,movie,star,comment
112,入殓师,4,觉得世界上最远的距离其实就是生与死啊。影片中的场景有不少很熟悉的，想起了以前的事情。最感动的是大悟终于看清楚了记忆中父亲的脸的时候。就影片本身的话觉得年轻演员们演技太外露，而且情节都在意料之中没什么惊喜。
113,入殓师,4,死可能是一道门。逝去并不是终结，而是超越，走向下一程。正如门一样。我作为看门人，在这里送走了很多人，说着：路上小心，总会再见的。
114,入殓师,5,说着再见，说着路上小心，总会再重逢的。死亡对我来说不是存在的缺失或存在的明证，而就是一次自我检视，以及与种种洗尽铅华的灵魂平等和谐尊重友爱地共存。外婆，我真想念您。
115,入殓师,5,"“死并非是生的对立面，而是作为生的一部分永存。”―― 村上春树 

PS.这个泪催的……"
116,入殓师,4,pps上看完整部，分两天才看完的，其中一个经典的场面：死者入殓，遗孀上前，亲吻他的脸颊告别，看到唇膏印在了死者脸上，她忍不住大笑起来，然后其他的女亲属陆续上前亲吻，留下错落凌乱的唇膏印，女人们抱成一团大笑，笑着笑着眼睛又湿润了。 
117,入殓师,4,纵使丑如广末凉子的日本媳妇，依然温暖。平和婉转的片子虽说不错，却达不到奥斯卡的级别。也许是题材新颖取胜吧
118,入殓师,5,在看到获最佳外语片奖的时候，就想一看，日本电影接触的还是比较少的，听闻的都是一些比较另类题材的，像《感观世界》《武士》之类的，很想看一看像这种节奏不急不缓，意义深刻的...入殓师果不让人失望，本木雅弘的演出细致入微，像是电影为其量身定做，广末凉子不耀眼不淹没的演出也让人叹服，其实，最让我深刻的却是佐佐木社长在入殓的时候，那么的专业和专注，啊~~~
119,入殓师,4,非常套路化的作品，就像高考作文般工整。从人设安排到故事结构，都如有答案的填空题似的对号入座。但是它却散发着一股特殊的力量，轻而易举的击溃你的心防。想起《再见，孩子们》里的一句台词：“这里只有我一个人思考死亡。”人们总是不愿思考死亡，因为它过于沉重。但是不论我们活的多好，请不要回避它；因为你再怎么逃避，它就在那里。只有理解死亡，你才能读懂生活；只有直面死亡，你才能更勇敢的生活。四星半。
120,入殓师,4,终于看完了这部存在电脑里很久的片子。故事发生、展开、高潮直至结束，都是在一种平缓安静，貌似波澜不惊的状态下慢慢进行的，没有声嘶力竭，没有惊天动地，主人公的个性很内敛，但这种埋藏很深的情感，实际却是暗流涌动。我想将来的某天，我也会不得不离开，希望有人真心难过，有人诚心为我祈福。
121,入殓师,5,好煽情的电影，虽然看到一点就知道后来的情节但也没法不感动。
122,入殓师,4,"久石让的配乐,广末凉子主演.       生老病死老生常谈.干一行且爱一行,实属不易     曾几何时.离别又何尝不是在我心头刻下狠狠的印记"
123,入殓师,5,我打算迎砣松的最大D折c，但u掉大提琴r，很不可思h，突然X得p松，X得一直以淼氖`解放了，自己以前孕挪灰傻粝耄可能根本不是粝搿 --奥斯卡最佳外语片还是有它动人之处。
124,入殓师,5,平抚死去的人，抚慰在世的人，对人生的一种思考，死亡的严肃性，神圣性。
125,入殓师,4,"The gift of the last memories.
可惜表演还是略欠火候，尤其是女主角。"
126,入殓师,5,广末凉子美得让人为难。
127,入殓师,4,我一直觉得日本电影常得奥斯卡的原因是张艺谋一直推崇的黑泽明给日本电影注入了变态之余的人性味。虽然我不喜欢黑泽明的电影，但是他给日本电影留下了话题变态但人性味越品越有味
128,入殓师,5,典型日本温情催泪电影的成功典范。大提琴配乐动人，细腻补捉入殓仪式的催泪点，符合奥斯卡的审片原则最为重要。
129,入殓师,5,"年轮的增长意味着死别渐多于生离。最后的送别既是对往者的尊重，亦是对生者的告慰。伴着低回深沉的音乐，大提琴家纤细的手指、静穆的表情、轻缓但利落的举手投足，展示了一个民族对待人性的本质，不禁被震撼、被感动、直至潸然、肃然起敬。The gift of the last memories.yes,it is."
130,入殓师,5,"哭死我了，要是我不小心比你们先走了，也想要这样啊。我争取活的比你们都长昂，你们到那边等着我。
好想要那样的妻子啊~~哈哈"
131,入殓师,4,完全好莱坞，导演技法非常成熟。导演说：“整部片子我都在偷懒”，“会偷懒”就是导演技术的精髓。
132,入殓师,4,久石让的音乐，山崎努帅得让人为难的演技～戏骨啊||我还是喜欢那个老的入殓师社长，大师级的
133,入殓师,4,丧葬这一题材题材虽说视角奇特但平淡乏味，对导演来说很难驾驭，而泷田将它拍得情感绵长，轻快且感人至深。影片围绕日本式的葬礼场面展开，织入了夫妻爱、生死观等一系列隽永的主题。影片的音乐（久石让监制）和独特浪漫场面让人印象深刻。
134,入殓师,5,"从开始整部影片就弥漫着一股淡淡的忧伤，缓缓的散播开去。眼泪一直在眼眶中打转，想哭却哭不出来。镜头一直都在缓慢而冷静的叙述。当最后一个镜头定格在握在手里的石头时，泪水终于滑落。
只有你，能看见我心底的温柔。
这部电影不是很适合午夜场，也许在夏日的午后，泡上一杯清茶，在树影斑驳的阳光里更能体味出那份挥之不去的哀愁。"
135,入殓师,4,离别是为了更好的相聚，失去之后更该好好地生活。男人在火化炉前大声喊着“妈妈”的时候，我知道这种撕心裂肺在人生中不会再有第二次了，维系生与死的是对各自的尊重。
136,入殓师,5,“生物都是吃着生物生存下去的，好吃的让人为难呀” 好看，除了面对死亡其实影片还表达了很多层东西，至于里面每个细微的暗示和铺垫都太日式了...广末凉子演的那个漂亮听话又贤惠的老婆是男人都爱，问题世上根本不存在这种生物！
137,入殓师,4,好吃得让人为难？...太日式的想法了.
138,入殓师,5,"《入殓师》能获得奥斯卡最佳外语片，绝不仅是因为美国人的猎奇，它和《卧虎藏龙》所标榜的中国神秘主义的不可理喻文化特质的卖点完全不同。日本文化发展到今天，已经强大到这种地步：不再需要靠异国情调去迎合外国人的猎奇心理了。他们已经能够用自己的头脑去思考普适价值并给出恰当的解答。 
"
139,入殓师,5,曾经深爱过的人啊，我是多么希望你们能够被这个世界温柔的对待，哪怕是在离去的时候，能够有一双手，温柔相握。
140,入殓师,5,电影最后，生与死的距离是那么近。当那颗小石头贴上肚子的时候，这一刻生死隔肚皮。连接他们的是永恒的爱。//20180113中国电影资料馆。胶片版。时隔八年再看大银幕，除了依旧被感动外，还能够看到剧作中很成熟也很套路的部分。能够分析出几场戏在剧作上的作用。能清晰感到自己观影角度的变化。感慨
141,入殓师,4,鬼子的镜头就是稳就是干净。布景也很有特色。这种片子的节奏把握似乎没难度，实则相反吧。
142,入殓师,4,生命的谢幕需要尊重
143,入殓师,5,本片以淡淡幽默的口吻叙述着一项特别行业：入殓师。貌似多数人会嫌弃或忌讳这个职业和做这个职业的人吧。但是这个工作总是要有人做的，而且对死者的温柔和尊重正是对生者的慰藉，难能可贵。
144,入殓师,5,"行业注定了电影里对白的稀少
对生命的诠释
虔诚的入殓生命，送入另一段路程
在整个剧中布满了各种死亡，那一滴生命就显得尤为重要了"
145,入殓师,5,"""日本文化发展到今天，已经强大到这种地步：不再需要靠异国情调去迎合外国人的猎奇心理了。他们已经能够用自己的头脑去思考普适价值并给出恰当的解答。"" 
"
146,入殓师,5,“让已经冰冷的人重新焕发生机，给她永恒的美丽。这要有冷静、准确，而且要怀着温柔的情感。 在分别的时刻，送别故人。静谧，所有的举动都如此美丽。” 所有的举动都如此美丽。
147,入殓师,4,7月才终于看完，很中规中矩。凉子演的老婆好假。很喜欢办公室背景神秘的秘书阿姨和开澡堂子的奶奶。
148,入殓师,5,『死亡，就是一扇门啊，它不意味着生命的结束，而是穿过它，进入另一阶段。其实就是门，我能作为守门人，送很多人穿过那扇门，对他们说声路上小心，我们后会有期，把他们送走。』不能不说大和民族骨子里真是充满温情的民族，影片中投射他们对人生对死亡对生命意义的思考真的是我们现在很难以企及的。
149,入殓师,5,沉重版冯小刚。男人的老婆不错，男人的中国版就是刘烨了……茶具不错……石头滚出来的时候，好吧，算你狠，~~o(>_<)o ~~泪奔
150,入殓师,4,死亡，突然离我那么近距离。我们都是孤单无助的小孩，带着对人生的误解前行，直到有那么一刻，发现了事实的真相，潸然泪下。尊重，已经被忽略到最低，因为有利益的驱使，一切都改变了。那么在意别人的看法，只能迷失了自己，你的职业是庄重不容侵犯的。
151,入殓师,5,不愧是获得奥斯卡最佳外语片的电影，虽然我并不能完全接受电影的慢节奏和日本人民那种时时刻刻都小心翼翼到有些神经质的社会礼仪，但是我还是被这种送去往生的仪式般动人的职业感动了。我想起《最终幻想X》里面的尤娜，当她跳起往生舞，无数的灵魂飞出来，很是美丽。入殓师是一份值得敬重的工作~
152,入殓师,5,温柔地扶去死亡的阴影，让死去的人再次焕发生机。最爱这种格调的电影，很舒服，有一种细细的感动
153,入殓师,4,"往往接触死亡的人才能看透人生本质吧，久石让的音乐依旧经典，广末凉子成熟了，还有，这个故

               事告诉我们：干一行爱一行..
"
154,入殓师,4,有笑有泪，很难的，但总觉得差那么点儿，有点半吊子高潮的意思，的确感人，但父子之间的和解太过简单化了，总觉得还应该有遗书之类的东西，广末凉子这个角色始终如一的甜腻温婉，也算尽职，本木雅弘算是得到了一个好角色，很出彩，前面笑得不行。是好片儿，难得一看，那小石头有四两拨千斤的效果。
155,入殓师,4,噢，冷血人流I了。。。流I了。。。I了。。。了。。。了。。。了。 。。。
156,入殓师,5,"石头信。石头能传递的情感 和一块手帕 一张照片比起来，更温厚。

“太好吃了 真罪孽阿”
河豚的鱼子。动物的尸体。

不知道要做男人还是做女人才好。
不知道要开澡堂还是卖掉才好。
不知道拉大提琴还是做死人生意才好。
不知道继续怨恨还是和解才好。"
157,入殓师,4,喜欢这位朋友的评论“对待死的敬意，犹如对待生的真诚”，不是矫情是人心！
158,入殓师,4,广末凉子漂亮 男主演的很中规中矩 倒是社长让人眼前一亮 说实话 这样的题材 美剧sfu已经拍过了 所以让我触动的点不是很多 当然电影的巧妙之处将很多情感杂糅在一起 却很通畅
159,入殓师,4,觉得他们很伟大，连逝者的家人也不能做到把自己的亲人真么美丽的送走，但他们做到了，给了逝者最后的尊重和爱护。
160,入殓师,5,"   让逝去的人留下美丽的背影，默默的温情流淌着。
  ps：大家欢笑着亲爷爷的脸颊，让人好感动。
  每一份职业都有他存在的意义，所以，我从心里面感谢拾荒者环卫工人为环保做出的努力。"
161,入殓师,5,很久很久没看到这么细腻文艺的日本片子 @羊男在海豚宾馆 这是个你会想看的片子
162,入殓师,4,还不错，有些地方极为做作，最佳外国语影片有点名不副实，好多后面情节都意料之中。中等以上
163,入殓师,4,故事并不强大，细微中流露出的情感却很真切；显然后半段的感觉更好些，前半段有些脱节，情感在不断的积累并递进着，最终，对于死亡的感触和亲情的包容二者情感的融合做的不错，因而剧情并无吸引却依然颇有泪点和内涵。
164,入殓师,5,A“人一辈子买的最后一样东西(棺材)是由他人决定的。”B“死可能是一道门，逝去并不是终结，而是超越，走向下一程。”
165,入殓师,4,最多值四星。很没有张力的一部电影，笑的时候让人小不起来，哭的时候也让人哭不出来。前面关于父亲的铺垫不够，以至于后面情绪并没有饱满到可以哭出来的地步。
166,入殓师,4,今天看特别有意义，希望小伯父走得平静而安宁...
167,入殓师,5,我最近有个感觉，就是中国的电影太快消了，以至于大家都在改短篇小说，要爽，要激情。但沉淀下来想想，中国的电影人是不是正在失去这种长篇叙事的能力。这也跟港片北上关系很大，但却不能赖人家。终究是路漫漫啊。真的是很好的故事，人们一生都在与自己和解，与世界撕逼。但别较真，最后都是要投降的。
168,入殓师,4,报纸一角关于奥斯卡最佳外语片得主的介绍。偶然看到“鎏镅蠖郎”和“广末凉子”两个名字，不禁想起了十年前的另一部电影。。。果然，又是结尾五分钟时的精彩。。。又是那份浓得化不开的亲情。。。很“鎏镅蠖郎”的一部片子。。。10年了，还是很喜欢鎏镅蠖郎的那种人文关怀。
169,入殓师,4,还不错吧 节奏有些太慢
170,入殓师,4,很感人，题材小众，感情刻画细微。虽说有些片段有点做作，但瑕不掩瑜。生老病死也是人生的艺术。广末凉子好美啊，但是觉得她的表演在里面显得有些不搭调。
171,入殓师,5,"1。广末的表演不是做作，你要是看日剧的话，就知道这个是日本标准好女性的一种表现。很日本，文化不同罢了。
2。很宁静的片子。宁静中的感动。
3。对死者的敬意。人，不论是生前还是过世，都要受到尊重。"
172,入殓师,5,真正的好电影是在最平凡的地方挖掘人性内心最宝贵的那点美好吧。其实感人的故事无处不在，只是看导演如何去发现，去表达出来。#入殓师#果然是一个好电影。。我居然看出来里面的女主角是广末凉子。。。。胖的厉害啊
173,入殓师,5,"Very good film, Every part shows me How beautiful & Real this film can be... And the Music is also very good"
174,入殓师,5,虽然意不在此，但影片的确完整描绘了日本殡葬行业的流程。与中国葬礼做文化对比，可以发现许多有趣的东西。
175,入殓师,5, dignity .  last journey
176,入殓师,4,这个电影不是讲死亡甚至什么追忆怀念云云而是讲一个人在逆境中如何面对世俗的目光生活 从在意别人的眼光 到最后在工作中找到自己的价值 高度认同它 与世界沟通 还有宽恕他人 从而达到自我的新生 从这个角度来讲 这部电影更像是一部励志片 而不是简单的感情片。ps：这电影的节奏好慢，安静 
177,入殓师,5,"哭了两次.我深爱过的人，我是多么希望你们能够被这个世界温柔的对待，哪怕是在你们离去的时候，能够有一双手，温柔相握。请给他们最后的尊严和爱护,因为我们是他们生前最珍惜依赖的家人,因为他们是我们一生中最爱戴尊重的亲人.
想起5.12日本的救援队"
178,入殓师,5,第一次看到这个电影的名字是在《为了报仇看电影》，可是我已经不记得那篇文章说了些什么，但是记住了这个名字，当然，原因是我喜欢奇特的职业；只是，我没想到，日本人惯有的认真，让这个工作如此的庄严肃穆，异样的仪式感。。。久石让的配乐
179,入殓师,5,"Death is just like a door, passing into another world.深厚的感情,只是音乐太过煽情悲凉,虽然这也是credit之一."
180,入殓师,5,爱如石子，捏在手里、很轻，放在心里、很重！爱与死亡，有时候那么无奈。
181,入殓师,4,真是一份令人敬重的职业，美化死去的人最后的面貌，对死者是一种敬重，也是寄托一种期望，希望他们此后也能美丽的存在，也能稍微抚慰死者家属的伤心，非常有意义的职业，无需介意别人的眼光。
182,入殓师,5,"往生的道路 赎罪的旅途 真正的入殓师 内心或许早已坚硬冷峻 但心灵最柔软之处――父子之情被触及 煽情还是很成功的
片中的miko是完美女性的典范啊~"
183,入殓师,4,陪床时又看~minisd的字幕比初看好多了~虽然最后落石还是觉得作过头了~但做容易被误解的须执念的工作自己理解坚定后爱人也认可的感受真好呐~自从知道本木雅弘当时43岁~就觉着帅爆了~这是个啥逻辑呐~ @翼人 河豚鱼白还是可以找机会试试的~~
184,入殓师,5,入殓是一场郑重的告别仪式，一首温柔的哀伤的歌。特别推崇埃及人所认为的那样，死亡不过是从尼罗河东岸渡到西岸，是另一段旅程的开始。未知死焉知生。催泪弹啊。2011.8.1
185,入殓师,5,现在的张艺谋之类的应该看看，到底什么电影才能得奖，还真以为老外只喜欢虚假的中国功夫啊？
186,入殓师,5,对死人的尊重也就是对活着的人的尊重。我想在日本，并不是很多入殓师像小林这样，所以他的妻子反对过他，他的儿时玩伴厌恶他。当他们看到小林把死者当成亲人般的梳整好，感动的不仅仅是他们自己；当小林的妻子接过小林递过来的手帕时，接受他的也不仅仅是他妻子一个人，还有看着电影的我们。
187,入殓师,5,电影之外，我们已经找不到能说服我们的势力。只好努力挣扎，以求体面，日益封闭沉默，在虚无中放纵，对现实世界低头。 最大的安慰，就只剩那个仅仅相依的人，却拥有一颗朝夕就可能变幻的自由的心。 但走完这一生，不过也就一死。我还是相信良知，相信你爱我的时候，的确是真的爱我。
188,入殓师,4,恩，是一部值得一看的片。我一直很敬佩那些在工作位上特eＷ⒌娜恕９ぷ鞑环仲Fv，PI在於你怎N去Υ自己的工作，只有全心全意地Υ自己工作的人，才能A得e人的尊重。在任何一位，都能做到完美o瑕，o可替代。@也是我一直想完成的事I心。那N眼神中流入出的Ｗ，不是S便就能有的。
189,入殓师,4,整部电影温情脉脉，却因为最后他父亲死时握着的小石子弄的煽情起来。个人觉得是电影一大败笔。
190,入殓师,5,几百年没看日本片子了。。。让老娘潸然了一把。。。对干这行的肃然起敬。。。广末凉子老了不少。。。
191,入殓师,4,“死可能是一道门，逝去并不是终结，而是超越，走向下一个旅程，正如门一样。”死亡果然是屡试不爽的戳中泪点。1，按钮下去，火焰升起，妈妈，对不起。2，去世的三十年不见的父亲，手中握着儿子给他的石碑。
192,入殓师,4,这部电影是唯一一部表哥点头称赞没有骂脏话的日本片，我却拖到现在才看。生命中经历了最亲最爱的人离去，才会真正体会到什么叫逝者如斯夫，亡者为尊。
193,入殓师,4,细腻动人，静水流深
194,入殓师,4,以小大的人生。乃劳龈Q生命的r值。
195,入殓师,5,直面死亡才能让人更加的珍惜生命。当死亡发生在我们身边，我们将会如何面对？一个严肃的问题，却人人都会因为难以面对而选择暂时的逃避，但终究事实还是会逼我们不得不去直视它的存在。日本电影一如既往的温馨感人，广末凉子很美！
196,入殓师,5,死亡不再可怕，反让人觉得温暖。爷爷过世，凌晨在休息室等待遗体火化，发现电视里竟然在放此片――不知是有心人对逝者亲人的宽慰还是商业化殡仪馆的又一赚钱的宣传
197,入殓师,5,生命中不得不面对的冰冷需要青春与爱来保温，死亡是道温柔的门，而每个人又必定会迈入。。。
198,入殓师,5,温柔的对待每一个人'火车上看的。最后哭的像傻逼一样。
199,入殓师,5,他是入殓师，它是艺术家，他微笑着把人们送上最后一程，像一把大提琴深邃而悠远而又亲切自然。
200,入殓师,3,剧情编排、台词及表演均过于刻意，看到某个伏笔马上就能知道后招（澡堂老板娘，石头，鸡，怀孕，父亲，各样的误解与释怀）几乎感动不到人...因为前段看过验尸官记录片的缘故，设定上也没能打动我。广末凉子很萌很贴心，让人觉得有这样的妻子太幸福了.西施乳真有那么好吃么？那个炸鸡看起来倒是不错
201,入殓师,3,很简单的故事但确实是感人。关于死亡的仪式。自己关于死亡的三个记忆：去年年底以及今年上半年各参加了一个葬礼；高中一个同学在高考前因癌症去逝了；初中一个同学则在殡仪馆就职。
202,入殓师,3,符号太多。。。其实没有必要。我想一个人没有好奇心是不会看电影的，于是入殓师的题材不可谓不成功。但还是不纯粹，非要把这样一个很有意味的职业变成男主角自我完成的过程，就有点落俗套了。而且中间穿插男主在旷野里拉琴的镜头，乱煽，简直跟某些台湾片一个境界了。。。
203,入殓师,3,日本版稍高级的“海角七”，平庸却又煽情得过火。“大提琴”和“入殓”之间衔接得十分矫情，尤其无法忍受主角边在富士山下拉琴边给人入葬的蒙太奇段落，拍MV呢！音乐不知节制见缝插针地铺得极满，可惜了久石让。但凡有点编剧细胞的人从开始都能猜到主角最后必然是要给自己父亲入葬才能父子重逢的，只是不料导演年纪不小了，却未能有更成熟深刻的观点，最后打在“父子情”上作为情感高潮终结，对于“生和死”的主题探讨只停留在家常温情这一层面，真是相当的遗憾。今年得奖的电影皆胜在温情路线，是经济危机造成的逃避主义么？竟一部比一部空洞。
204,入殓师,3,有一种职业能让人害怕，又能让人温暖，又能折射出人性！
205,入殓师,3,真的好普通，叙事特别平，结构就像命题作文一样卡得严丝合缝，人物设置都非常刻意，各种矛盾的处理都是一根筋式的，但不妨碍让人哭，认真的样子总是让人动容。入殓的过程有一段总是有剪切，不知道是演员无法做到无法拍摄还是那一段是行业秘密不能拍摄。总是手法是很精彩。总体再脱俗一些就更好了。
206,入殓师,3,对死者的尊重，对生者的尊敬！
207,入殓师,3,"早就看过了日剧死化妆师 所以对这个并不是很感冒 不过也架不住大家都说好看 

果然情节方面 和连续剧没有任何区别 不过配合着大提琴让悲伤的感觉传达的更好 只能说ok的电影"
208,入殓师,3,失望。除了公认出彩的音乐外，整部电影就像铺好的新干线，起点和终点早已明确，中间每站按部就班地停。广末别扭的演技就不多做评价了。我只是觉得这片拿奥斯卡太过分，而且日本电影要是不想办法摆脱这种模式化的拍摄和叙事方式（动不动就煽，对细节做过多描写反而给人做戏的感觉），那么也许这就是对日本电影的一次入殓...
209,入殓师,3,生，感情，尊严，死。影片感人，逻辑并不感人。人确实在飘，在受辱，烧掉之前被尊敬一下，算是补救。有些人20岁就死了，80岁才埋。
210,入殓师,3,"我想说，其实真的没得楞个好。这电影做作和精致是对半分的，再加上我亲爱的广末姐姐成为了含泪的花瓶……所以……

PS.不能原谅抛家弃子的父亲，懦弱"
211,入殓师,3,跨越生死的只有爱和尊重。。我一度以为他师傅就是他父亲，后来我又以为那女同事是他父亲的姘头。。。哎，我很恶俗，我承认。。。另外广末凉子，小鼻子小眼儿的透着那么小家子气，有什么好看的呀？
212,入殓师,3,日本片总是这样，太闷太慢了。一个镜头的定格时间长到让我怀疑碟是不是卡住了。看看开头如何入殓，普及下知识就可以了。
213,入殓师,3,山崎努一样的老不正经啊，广末MM是巨蟹座的难怪我会喜欢得紧
214,入殓师,3,最烦这种明明是山下怂炮还要一副参透了世间万物装腔作势说些看似哲理实则狗屁不通的话了。男主演技太差蠢得想揍扁他。这种片就适合糊弄糊弄学院那帮老古董。一星对死者尊重，一星给山崎，一星给背景乐，OVER！
