,movie,star,comment
375,入殓师,3,"}材不e，但热菘斩矗力不足。
V末鲎友菁加悬c做作，但e手投足之g
散l著系的庀，尤其是笑容（心）
我K於有ct解懂系的意思了～

久石老的音愤是那N催I。
最感拥狞c是按_P火化那。

生，事之以Y。死，葬之以Y。
慎K追h，民德w厚矣。

"
376,入殓师,3,9D-D9 完整花絮 一看题目就知道它要讲一个感人故事 所以我没有感动
377,入殓师,3,f就是部普通的片 致锊恍判 真的是普通的片
378,入殓师,3,反正我是看不下去了，节奏慢的我伤不起。
379,入殓师,3,其实我觉得封面上这段多余了，特别作。。。。。最喜欢的是女亲属往死者脸上印唇印那段。。。（外貌协会时间:凉子女神一如既往萌得戳心戳肺，大小眼最美了。。。。本木雅弘正面挺地味的，侧面倒是意外的耐看。。。）
380,入殓师,3,本来可以给4星的电影，减掉一颗送给广末
381,入殓师,3,唔，倒没有喜欢这部电影，但是感觉还是很不错，当时心不够静，可惜
382,入殓师,3,广末凉子的角色太捉了，有这样的老婆当入殓师有啥，想死的心都有。
383,入殓师,3,只顾煽了，可惜“浮世绘”般的一场场死亡没有铺展开，另外不是日本人演戏夸张，是某性感叔木有演技吧。
384,入殓师,3,白色色调中入殓的仪式感很动人。编剧技法太平庸，“大提琴”和“小石头”的意象好俗套，妻子怀孕和父亲葬礼不是解决而只是缓和冲突。励志和亲情的和谐主题使影片缺乏现实感，对生死的思考流于表面和形式化。
385,入殓师,3,"我实在不喜欢这种慢节奏的日本电影，老墨迹了。
你说你为什么会喜欢呢？哼~~
我知道片子很好，但你愿陪我，我也愿意去看~~嘻嘻~~
你是目前为止我最想一起看电影的人~~

"
386,入殓师,3,我终于知道我讨厌的女人声音的主人就是 广末凉子！ 日剧而已，奥斯卡是巴子没见过亚式入殓而已。
387,入殓师,3,"配乐不错。不过不喜欢最后父亲死的那段，难道父亲已经知道要死了吗

"
388,入殓师,3,可能男主角的表演影响了我的观感吧。死亡也很平常。死的释怀。
389,入殓师,3,这评分高的有点离谱了・・・・醒醒啊迷信们，看见奥斯卡是不是都不行了
390,入殓师,3,准备了一盒纸巾却完全用不上的失望。太多无用的支线、做作的抒情，再加上本木雅弘和广末凉子可怕的演技，两个小时的日剧实在太长了。
391,入殓师,3,就。。。粗糙的感觉。。。表演好浮夸。。。
392,入殓师,3,不日本、不美国、不商业、不艺术。
393,入殓师,3,主题选的不错 不过形式大于内容
394,入殓师,3,还挺正规的程序
395,入殓师,3,不是很喜欢的电影风格，闷，有点担心自己会没有耐心看下去，还好还好，失去的耐心又回来啦，取材还是不错的，
396,入殓师,3,死可能是一道门，逝去并不是终结，而是超越，走向下一程。-------希望是这样...
397,入殓师,3,如果这片子没有久石让，那么.........
398,入殓师,3,"也就是一部SP的水准吧……每一步都没有脱离日本行业剧的老套：不管做牛郎还是送葬的，一概要以拯救人生触摸人性为最高任务，发扬热血勤奋励志。不是说这样不好，但看多了实在有点腻，估计奥斯卡评委从来不看日剧，才会逮着这么部片子惊为天人吧。
不过说实在的，今年除了最佳女我没看，主奖中我觉得只有最佳男是名副其实非颁不可的。"
399,入殓师,3,日本的街道，家居、服饰风格，都如此整洁，日本人对仪式的重视是我们这个自视礼仪之邦的该好好学习，如今的国人有何仪式感，对什么似乎都没了敬畏感。影片过于煽情了吧。
400,入殓师,2,就是个2小时长的日剧嘛。拉大提琴的几场尤其造作尤其傻，这种半调子剧本、台词、烂表演、配这种业余水平的镜头和剪辑，近年来日本这种片子电影院里放完一部有一部，一部跟一部长得一个样儿。奥斯卡最佳外语片？黑泽明、小津那死掉的一拨儿，从坟墓里坐直了；还活着的山田洋次、是枝裕和、河濑直美虾米
401,入殓师,2,木卫二说的很对 人们总是喜欢《入殓师》这种大团圆般的幡然醒悟，而《步伐不停》这样给你生活的真相的电影，确实残酷而不招人喜欢。
402,入殓师,2,在清明节看完这个电影比较偶然，因为看上半部的时候发现没有下载下半部，所以才拖到今天看完。久石让永远值得期待。
403,入殓师,2,"
日本人对生灵的敬畏态度令人佩服。大提琴很赞。外国寻常人都会点乐器，在天朝，这些离市井太遥远了。"
404,入殓师,2,中途暂停一天。没有耐心。甚至结尾都不曾落泪。
405,入殓师,2,故事一流，”径流，演技三流，C合得分：尚恰
406,入殓师,2,太煽情了，看到后面昏昏欲睡。对于死亡的探讨沦为了刻奇的煽情，而对于入殓师这种职业的呈现只是从一种标签化变成了另一种标签化。
407,入殓师,2,最后跟父亲的那场戏彻底让我觉得只能给两分，抱歉，就算你死的时候再怎么怀念儿子又怎样？08年的电影，看似很宏伟的命题，拍的处处透露着平庸，给我感觉像是98年的料，无细节，老审美，叙事流水账，含义就那么点，台词里说完了。看导演的履历，运气好迎合了奥斯卡一贯的口味。
408,入殓师,2,好题材就这样浪费掉了，和《一代宗师》一样，都是假招子电影的代表。人物关系跑偏、情感矫情做作、多余的画外音把整个影片的节奏打乱，难怪泷田洋二郎导演就这一部比较有名的作品，之所以能得奥斯卡，东方殡葬仪式的呈现多少占了大比重。正巧刚看过小津的《父亲在世时》，各方面均是天差地远。
409,入殓师,2,大家都是农民，为什么对日本的这种充满仪式感的丧葬行为那么感动？不过是迎合欧美评委而已，我看不到所谓的生命的厚重感。
410,入殓师,2,多好的一}材竟被煽成@ 太可惜了 R^ 配 ∏ 一作到我逐u崩 另@ 谀┻^了那么多年是花瓶啊。。。
411,入殓师,2,家境贫寒的男孩Ali（Amir Farrokh Hashemian）帮妹妹Zahra（Bahare Seddiqi）取修补好的鞋子时，不慎将鞋子弄丢，为了不被父（Mohammad Amir Naji）、母（Fereshte Sarabandi...展开
412,入殓师,2,温吞水，也就能看看广末凉子了。想了半天连三星都不想给啊
413,入殓师,2,确实很日剧。且AV痕迹略重。除了广末凉子，其余皆很不好看。
414,入殓师,2,电影的好坏我懒得评论。在两个小时里我哭过一次（女人对男人说：你是不是会一直拉大提琴给宝宝听，直到宝宝出生。）我想起小狐狸，以后也会有女狐狸也会对你说：你会不会一直吹口琴，吹到宝宝出生……我不喜欢这样的小狐狸，我喜欢喜欢洛特雷阿蒙的小狐狸……
415,入殓师,2,广末凉子原来这么漂亮，现在开始当她粉丝不迟吧。
416,入殓师,2,前半段节奏很慢，对两位离异人士奇怪的思想（离婚了就不去看孩子）更不能理解。印象深：对逝者进行整理的手法，看起来很专业，很尊重。
417,入殓师,1,整矫情了..做殡葬业需要那么多感怀身世和心理建设吗...在我们中国，这是一个超级暴利而令人羡慕的行业.。
418,入殓师,2,女主角不错，其他一般般
419,入殓师,2,能了解下日本的入殓礼仪也不错，修身小西服很好看
420,入殓师,2,还好我是个从小到大都没有梦想的人
421,入殓师,1,我这唯一的一星是打给“入殓师”这个名头的
422,入殓师,2,我一看海报就知道叙事的架构了，陪妈妈看的。
423,入殓师,1,这片~~也太没有水准了一些
424,入殓师,2,故事一直在绕圈圈毫无递进啊，能撑两个多小时的原因是因为这是部边缘职业的科普片？
425,入殓师,1,只看到一个不负责任的丈夫，主演的人设真心不怎么样。喜欢NK的佐佐木社长，对生命看得很透彻，也喜欢澡堂的老奶奶，为了方便邻里努力的将澡堂开下去。喜欢电影所传达的对逝者的尊重。
426,入殓师,2,憋了一个钟头四十五分钟终于憋出来了的高潮。
427,入殓师,2,这有个锤子的意思啊！就音乐配的好，广末凉子打炮场景也没有。
428,入殓师,1,看了一半不敢看了。
429,入殓师,1,没觉得多好，闷的要死。太无聊，音乐也没觉得好
430,入殓师,1,可是还是要好好生活，好好吃。因为不想死，就只能活；因为要活下去，索性活得好些。 
431,入殓师,2,2.5，整w平庸但有亮c，2009/03/01@台南威秀
432,入殓师,2,完全不觉得感动 
433,入殓师,1,谁拍出这么难看的电影的？我算是小清新了，平时带点温情的电影都会入戏被感动，这个戏拖拖拉拉不说，男女主在戏里只有一个表情，前面110分钟极其tedious，最后开始煽情戏份，男女主故作伤心状，没有台词支撑，不能更糟糕。。。总之太terrible，这一部足够毁了我对所有日影的好印象
434,入殓师,1,我实在接受不了。。。。
435,入殓师,1,"给久石让的配乐一星.
了解了一份特殊的职业.
尊重生命"
436,入殓师,2,吗的，被前面的人妖恶心到胃了，管他什么奥斯卡，直接删了
437,入殓师,2,昨天看CCTV6看了，盛名己久，但没什么感觉，只觉得是一份职业罢了。抬得过高。也许人的长大是一份磨平狂势和极端的过程。
438,入殓师,2,真的不知道这片子究竟要讲什么，尊重死亡？算了吧；孝心？别引我发笑了。生硬的情节，凌乱的主线，剧情发展也很诡异。仅靠一两个小清新段子就能引得无数文艺青年产生丰富的联想并打高分，这电影运气也实在太好了。
439,入殓师,2,- -为嘛豆瓣给那么高分。。
440,入殓师,1,广末凉子的光芒还是难以掩盖本木雅弘的渣演技，这片子得奥斯卡就是个笑话。本木雅弘你还是老老实实去演一个神经质的军国主义者比较好
441,入殓师,2,还是看不进去 原著小说因为短且没有剧情我还能忍受 实现度来说还是kino和虫师更对口味 或许哀悼人拍成电影我会更喜欢
442,入殓师,2,"入殓师,很好的题材"
443,入殓师,2,"假惺惺
我哭了
过渡体会思考死亡不是什么有意思的事"
444,入殓师,2,怎么办呢，就是不喜欢这种日本电影的风格
445,入殓师,2,豆瓣有假。为什么那么多五颗星？这部片中的日本人举手投足之间都让我觉得恶心。另外，这个民族的死亡情节不是一般化。
446,入殓师,2,朋友看后说，看了这电影不再惧怕死亡。日本作为一个非常崇尚死亡的民族，很期待他们如何阐述死亡。看后有点失望，恐是期望太高了。情节完全在意料之中发展，因是央视翻译过的版本，美香的配音甜腻腻的，she is too sweet to be true.加上煽情的配乐，到最后好象是糖水片。
447,入殓师,2,假惺惺的仪式中点点温情
448,入殓师,2,节奏实在是太慢了，演技实在是太差了，没有一点能抓得住我的地方。
449,入殓师,2,最后的十分钟终于奔泪了。。
450,入殓师,2,我觉得有点矫情，一个三十多岁的大男人了，还如此惺惺作态..日本果真走治愈路线。大爱久石让配乐！
451,入殓师,2,夫妻关系 父子关系生硬 做作 男人肆意而为不负责任 女人无原则无条件扮演原谅角色。没看到与命运的抗争 只看到迫不得已 这次的片子的确够日本 所谓民族的就是世界的 奥斯卡实质名归 都这德兴还有中国人舔菊 服了你们！
452,入殓师,2,日本的电视和电影真是两个极端，电视能把拖沓的东西拍紧凑，电影却在把紧凑的东西拍拖沓。关于生活的精巧和智慧，我觉得天水围的日与夜胜过这部许多
453,入殓师,2,2.0+ 实在无法给三星
454,入殓师,1,给我个理由给我个理由！！omg！！
455,入殓师,2,其实我没能坚持把它看完 太不文艺了这娃
456,入殓师,2,睡着无数次 做作 白痴
457,入殓师,1,一部探讨生死哲学的巨著，改成了什么鬼。
458,入殓师,1,挺失望的，没啥看点。
459,入殓师,2,真看不下去这种治愈系剧情缓慢冗长的片子
460,入殓师,2,主题不明
461,入殓师,2,刻意的疗伤系。结构也挺糟糕，早猜到他会给他爸入殓。石头更是低级的煽情。
462,入殓师,1,哪来好了？
463,入殓师,2,太做作，滚吧。
464,入殓师,2,我就不知道好看在哪里了。除了景色和音乐。男主面瘫，女主跟马桶台打酱油的主持人太像了。那些打5星和看哭的真的很让人费解。。
465,入殓师,2,很好的思考人生，亲情，死亡的题材，而电影本身无论演员的表演，镜头剪辑，配乐的适度等都及其一般；2013-1-7；
466,入殓师,2,海鲜被做成了河鲜
467,入殓师,2,广末凉子老了好多了，现在那张脸笑起来就像文丑丑似的。另外我也不喜欢男主角，他身上就永远有股大都市精英气质，他应该去演东京红绿灯路口穿梭的白领。
468,入殓师,2,"没有被触动2012. 影片有时搞笑有时又非常严肃，然后严肃着说出搞笑的话让人有点哭笑不得。七年后又看一遍，没有一点印象得以为是第一次看，也仍然没有什么感触。
仪式感对活人来说其实挺重要。死亡是另一段旅程的开始。在每一次离别中感悟人生，体会如何去珍惜。血亲是永远割不断的然而真正的原谅也没有那么简单。工作不分贵贱，用心的人值得被尊敬。2019"
469,入殓师,1,"烂片啊


"
470,入殓师,2,深刻倒没觉得 挺刻意的 结尾有点煽情 但太拖沓【十分讨厌男主的耳朵和女主的笑.
471,入殓师,2,其实很空洞，弄个另类的题材装腔作势。
472,入殓师,2,这就是那种作的我无法忍的电影
473,入殓师,2,没有想象中好看，除了结尾有点感人，我还是想说，找一份正当点的工作吧
474,入殓师,2,为什么那么多人看哭了……完全么感觉啊……好吧这类型片不是我的那杯茶= =
475,入殓师,2,桥段+狗血
476,入殓师,2,我很喜欢广末凉子的内裤
477,入殓师,2,完全没觉得哪好看。
478,入殓师,2,谁说这感人了。无语。
479,入殓师,2,看不到一半就关了
480,入殓师,2,这部电影很夸张，很多剧情穿插的很无新意。
481,入殓师,2,太慢了，我等不下去
482,入殓师,1,并不是很差，只是我需要再看一遍
483,入殓师,2,入殓而已，弄得跟超度似的，活着干嘛去了。日本人抽完的烟蒂还用袋子收起来，文明社会的表现。五岁的时候捡的石头到了三十岁还记得什么样子，真是好记忆力啊，但却没记住自己爸爸的模样，真惊了！
484,入殓师,2,"可能是看过太多日本动漫的缘故，感觉情节老套。除了开头有些有趣，故事大框架设定有新意，其他便都是尿点，看得人昏昏入睡。
又是一部歌颂恋父或恋母情结的故事，总是在回忆那30年前少之又少的片段，仿佛这几年都没什么值得开心的事似的。
拍成电视剧还行，电影就太勉强了。"
485,入殓师,2,基本完全在我预料里么。
486,入殓师,2,矫情了..做殡葬业需要那么多感怀身世和心理建设吗...
487,入殓师,2,不喜欢日本片，阴沉沉的，还拿入殓来说事，说来说去就是说这个人怎么敬业，也没看出哪儿有感动人的地方，日本人就是小心眼，人都死了你就随便点儿呗，还那么郑重其事的，谁受得了，中国人是这样的吗？虽然也讲究，但是没那么放不开。
488,入殓师,2,男主角太做作太做作太做作了！
489,入殓师,1,日本的有些文化细致得让人佩服，但是我不认为入殓需要那么繁琐；另外，最后男主角父亲死后，他不该去。
490,入殓师,2,毫无说服力的剧本，还能更俗套一些么？这样的影片都能在奥斯卡拿奖，那我们春晚上的主旋律小品也可以到三大电影节上去混混了
491,入殓师,2,拖沓 
492,入殓师,2,受不了日本人的节奏
493,入殓师,1,真jb无聊
494,入殓师,2,有必要找时间再看一遍
495,入殓师,1,很多人跟我推荐这片有多感人多动人，在我看来就是一般的日剧风格啊 = = 石头梗什么的
496,入殓师,2,过度的煽情令人咋舌，偶尔的幽默也很出戏
497,入殓师,2,原来我是冷血么・・・・・・死活都不了解某人是怎么哭了好几次的・・・・・・・
498,入殓师,2,想看了3021天的电影……男主老爹离婚独居那么久到底是为啥啊？还一点没看明白，为什么没购买过入殓服务的人这么嫌弃入殓师这个职业?电影是想说因为男主做得特别好，所以才让人改观了？
499,入殓师,2,第一次在CCTV6看的，很感印ａ崦嬗滞暾看了一次，不怎N印…
500,入殓师,2,不舒服。非常不舒服。日本的各种观念，还真的相当于我不对口。亲自推最亲爱的人去火化炉这件事，就是想一想，就痛彻心扉啊
501,入殓师,1,浮夸的一比！
502,入殓师,1,这是爱情吗？这是对抛弃自己的父亲的感情吗？大提琴师梦想吗？这是什么样的价值观啊？
503,入殓师,2,我一点都不讨厌日本电影电视，但是这部实在太矫情了
504,入殓师,1,演尸体的群演工钱多少啊~！
505,入殓师,2,我还可以用我温柔的方式对待这个残暴的世界。。。
506,入殓师,2,广末凉子在这部电影里的演技做作矫情，真的接受不能；剧情的编排靠开头的倒叙撑起显得单一，而其中部分象征的运用在生硬的镜头切换下刻意以至于缺乏表现力。在演技和剧情的背后，一边是对死亡的诠释，是需要盛赞的；另一边则是归乡和孝相关的种种观念，却是迂腐的――主要表现在以主妻子及与男主共事的女配对男主父亲的态度和男主最后的转变。至于配乐，久石让从未让人失望，将主题与音乐结合的很好。整体而言，观毕发觉该影片竟得奥斯卡外语片奖，只能说：不配。
507,入殓师,2,"还是对日剧欣赏无能啊
"
508,入殓师,2,大烂片！大烂片！大烂片！大烂片！大烂片！大烂片！
509,入殓师,2,强忍着看完 虽然哭了两次 但是是因为想起姥爷了
510,入殓师,2,拍摄技法其实并不是特备高超，这片子几乎就是通过主题得奖的
511,入殓师,2,是我肤浅。是我没看下去。是我不想看了。
512,入殓师,2,实在受不了男主夸张的表情，你是成年人好不好。
513,入殓师,2,pia淡滴.......
514,入殓师,2,下的是译制片版本，节奏实在太慢，配音实在不忍吐槽，于是跳着把它看完了
515,入殓师,2,这部电影几乎没有配乐，剧情寡淡，我一点都没有被感动到。
516,入殓师,1,人物夸张的表演，做作的冲突设置无不反应出创作者对生活的恶意曲解
517,入殓师,2,日本的电影节奏慢的呦呦呦。。。。励志么 感觉没出来
518,入殓师,2,女主能别再假笑了么？
519,入殓师,2,"看完。  
为什么每天都在升。
为什么呢。 
CELLO 拉的很酷。

"
520,入殓师,2,我是实在不喜欢他老婆那个演员。。叫什么？广末凉子吗。。真做作
521,入殓师,2,"在我印象里较差,节奏太慢,之后什么都不记得了"
522,入殓师,2,很一般，无非是题材做噱头
523,入殓师,2,主打的温情的电影，所有的情节都猜得到，看了后有点小小的失望
524,入殓师,2,【资料馆】【胶片版】2.5星。刻意，太刻意了！这个水平也能拿奥斯卡最佳外语片？是枝裕和哪部不甩这片十条街？
525,入殓师,2,日本人就喜欢拍这种东西。
526,入殓师,2,首先要不是评分我也许这个电影我不会观看，评分太高，看完有点未尽人意。对于生与死的电影很少，都是阳光灿烂但是死亡就在那里。有一个感动的点就是最后那个人问他的妻子你的先生做什么的，她说入殓师。  最后她也认同了她先生的职业。
527,入殓师,2,还真是做作啊，你们这些人为了一个奥斯卡到底朦了多厚的猪油在心上才敢这么不要脸说这么昧心话。
528,入殓师,2,3.5   比同年的《步履不停》不知道差到哪里去了。
529,入殓师,2,无感。入殓师无非就是给死人擦开身体，反反复复这个情节。也许是因为我还没经历过生离死别，体会不到里面的感受。原本一星加一星给这个行业和题材。
530,入殓师,1,那么高分的电影，我怎么就看不入戏呢？
531,入殓师,2,原来是偶像剧来的
532,入殓师,2,娇柔做作。被同年的still walking 完爆
533,入殓师,2,我只想吃炸鸡
534,入殓师,2,一批奥斯卡片的镜头和音乐均考究而平庸，无趣。
535,入殓师,1,你帮这帮捧臭脚的 这片也就一般 你们捧你妹啊 
536,入殓师,2,业务越来越繁忙，一个比一个震撼，从陌生人到澡堂阿婆到生父，真“巧”啊……社长的表演还是到位的
537,入殓师,2,和同类型题材的东京奏鸣曲比差远了。做作的要命吧！
538,入殓师,2,"又臭又长又作,..
时间果然是相对的,..3个小时的七武士我倒不觉得长"
539,入殓师,2,"第一次清楚地了解这个职业, 很伟大
还是依然的依然 喜欢那大提琴曲  喜欢在空旷无人得大草坡中央 肆无忌惮的拉奏... 不受外界一切的打扰 其实乡间生活 更能活出自己 ！ 喜欢"
540,入殓师,2,我真的不知道这部电影好在哪里
541,入殓师,2,一般化 无功无过
542,入殓师,2,坦白的说，我几乎睡着了
543,入殓师,2,让死者最后漂亮一次又有何用，我始终坚信所有的愿望与遗憾需要活着的时候尽力实现与弥补，死者长已矣，做得再好也无用。再者，影片的过渡的也太烂，男主突然接受了做入殓师，女主突然就同意了，还有和男主父亲最后又有何用。还是，活在当下，珍惜在一起的点滴时光才是真。
544,入殓师,2,太负盛名的东西，看了反而会有失望之感吧。剧情的编排真的比较刻意。没有特别人感动人的地方。第一次完成后回家对妻子的依赖很真实。
545,入殓师,2,运用了文艺桥段的，温情的，通俗剧。
546,入殓师,1,开始：虽然有点矫情但是还行吧；看着看着，有点无聊；再然后，我要被恶心了；最后，我果然被恶心了！
547,入殓师,2,暑假数车的时候看了一个开头，就一直提不起兴趣看了。。今天终于拿出来继续看，依旧是拖沓的叙事，刻意的煽情。不知道为何评分那么高。一部电影就让你们思考生死了吗
548,入殓师,2,不知道为毛评价这么好！
549,入殓师,2,广末凉子太次
550,入殓师,2,因为是奥斯卡最佳外语片，所以一直挺好奇的，但是没有被感动到，看一半看不下去。感觉很造作。
551,入殓师,2,不是我喜欢的类型
552,入殓师,2,为什么都觉得好，而我觉得及其无聊呢
553,入殓师,2,好久没看到这么刻意的片子。
554,入殓师,1,Fuck Japan!!!
555,入殓师,2,记得没看完。看不下去。
556,入殓师,2,虽然导演想表达的东西很有内涵，但是剧情太慢，有点看不下去了
557,入殓师,2,没觉得感人
558,入殓师,2,看不下去 女主脸好熟悉呀
559,入殓师,2,3。清一色的友邻高分，没看过的请跳过，短评涉及剧透。题材较好，直面死亡前后的种种。最大的观感就是无法共情。男主突然对入殓这份工作的喜爱和对小提琴热爱的放弃同样难以理解。文本在这两次大的心境转变上完全没有过度，直接断层，人物立不起来，有种篇幅不够了，就这样吧的感觉。角色冲突营造的刻意，人物对入殓师职业的抗拒我不知道是真实的日本现状还是为了戏剧冲突。演员的表演很扣分，煽情全靠吼，吼不够再加催情音乐。最后最不能共情的地方是结局，这样的结局是属于原生家庭美满的人的。那种被抛弃，被嘲笑，自卑到躲在阴暗里的成长历程里蕴含的愤怒与憎恨不是因为血缘和生死就能原谅的。一个电话和同事的请求促成的回心转意随意到大跌眼镜。当然也许男主的童年很美好，那也能理解。可在这么一个当人面就可以侮辱人的小镇，我并不抱积极态度。
560,入殓师,1,可悲啊，事实上日本根本没人做这个行业，嫌太低贱，都是中国人去做。所以这鸡汤只配1星。。。
561,入殓师,2,广末凉子很好看。
562,入殓师,1,不喜欢，太深奥了
563,入殓师,2,我看不懂，昏昏入睡，不好意思
564,入殓师,2,只是很讨巧的煽情。
565,入殓师,1,烂片，没一点儿好的地方。
566,入殓师,1,看不懂，我不日本的文艺片，记录一个人成为一个入殓师的过程，我也知道主人公由看到死人吐到尊重死人，了解去世的人，让他们到另一个国度也可以美丽。可是电影整个都处于压抑的气氛。。。不是很喜欢
567,入殓师,2,拍的太烂了，俗套，演技渣，虽然不感动我，但是非说剧情感人，你们能不能只夸剧本别夸电影
568,入殓师,2,剧情不吸引人，通篇就是哭来哭去
