,movie,star,comment
215,入殓师,3,"
丢章鱼

面试
 
配上音乐的渲染 

父亲给石头 有电视剧之感"
216,入殓师,3,剧情走势大致可以预料到，所以就只剩下看细节了。本木雅弘有掩不住的喜剧气质，在看完《夜上海》之后格外会这么觉得。山崎努是老炮了，黑泽明的《红胡子》《影武者》里都有他。广末凉子还真是漂亮啊。――对于死亡这个主题，或许世界上没有比日本人能探讨得更好的了。
217,入殓师,3,因为奥斯卡最佳外语片的盛名很期待地欣赏，有些许失望，煽情太过度了。不知道是不是因为西方社会对东方文化的理解很难，所以才如此推崇。仪式感很强
218,入殓师,3,"死亡不是一个终点，而是另一段旅程的起点。
PS：美香这样的LP真是超级极品"
219,入殓师,3,大提琴选对了 片子说不清的别扭 几乎每个出场人物都担负着重要的职能 你可以说它布局严谨 我则以为虚伪至极
220,入殓师,3,3.5。就题材而言讲成这样实在不容易，从改变职业歧视的眼光、到死亡与孝道的解读，层层递进且不偏题。不过事理之间的关系还是有点跳跃性的，经常忘了用影像说话，一想催泪就拍泪。集日影惯有优缺于一身，观感舒服，但难说好。
221,入殓师,3,跟带你回家是异曲同工，没有说的那么夸张，但是也挺感人的，是那种最后时的释放与解脱，还会有第二部吗？
222,入殓师,3,幸运的是，看到了两个最搞笑的片段；不幸的是，依照这两个片段就去看片了，何况还打上了奥斯卡的名头。然后悲剧就开始了。小日本还是相当会煽情的，凉子被揉胸，她还越长越像馒头。
223,入殓师,3,"1.全片的基调 平静温和 想起了许鞍华的《桃姐》 同是死亡的主题但入殓师落下乘了，有些刻意死板。影片起承转合，规矩的好似八股文。
2.看过一篇关于我国殡葬职业的杂志文章。也是受歧视，男女婚姻尽量内部调和解决，每天回家都要首先把衣服洗一遍"
224,入殓师,3,旧瓶装新酒　另，我心目中完美的入殓师就像CSI MIAMI的法医ALEXX那样。 另二，成熟的广末凉子倒是相当有味道。
225,入殓师,3,感X情老套到我完全可以猜得到 久石的配纷情w更加狗血 感XU荷里活的 所以我想@部蜃詈玫牡胤骄褪亲プ×艘很能wF日本文化的c  借此狠狠地煽情了大家一把 煽的是大家永h都接受的那N感情 生死相e 生生不息T如此 
226,入殓师,3,日式刻意。这真不如真性情的阳光清洗来的好，而且有几个镜头跟阳光清洗太类似。拍摄期也是阳光清洗参加圣丹斯之后开始。
227,入殓师,3,一直对这部电影很避忌，直到今年大年初7外婆终于离开走向另一个世界。我才发现无论我们信仰什么，亦或我们只相信自己，终究难逃骨子眼里对死亡本能的恐惧。
228,入殓师,3,朋友推荐很久了，终于看完了。生死总是一个值得敬畏的话题，电影其实一般吧。。
229,入殓师,3,死，并不是终结，而是一段新的开始
230,入殓师,3,经济危机下的颓男。剧情俗了点，久石让的音乐加10分
231,入殓师,3,"很一般的电影……是一部浓缩了的日剧。本木雅弘的表演很像棒子，大减印象分，别告诉我没夹睫毛……整个故事很好猜，不明白怎么才收了第一具尸体还是腐烂的就升华了，不明白怎么妻子之前还觉得肮脏怀了孩子就升华了。久石让老师配乐说不上精彩，对他来说是中庸。
唯一的看点在了解文化。
广末都熟成这样了TAT 好生感叹。
开始下到的第一个字幕组简直神经病"
232,入殓师,3,电影完全可以剪掉一点装X的戏份减短时长，拉提琴的几段真做作……电影告诉我们有个好老婆多重要~
233,入殓师,3,音乐很棒。情感拉扯得太细太长了，很醒目，很难融入
234,入殓师,3,节奏。。。一如既往地慢吞吞 情感。。。一如既往地含蓄 广末 一如既往地清澈
235,入殓师,3,又被煽情哭，还是日本式的老套且漏点众多。最有感的反而是大提琴声中历经四季变换，加候鸟飞翔就反而画蛇添足了，跟这电影一样。
236,入殓师,3,oscar最佳外语片。。看了感觉一般也没多大感人。。只是对这特殊职业多了一点点深有体会吧。。
237,入殓师,3,在爬山的时候，拾起一块石头送给旁边的人，是光滑还是凹凸，代表不同的心情，(收下或扔掉)感受后扔的远远的，告诉大山，我知道了。
238,入殓师,3,2009-3-20 23:27:34 6/8.5(373) 其实比较受不了日本式的温吞水宋美
239,入殓师,3,人这一生死亡并不代消失，而且通往另一个世界必走的路
240,入殓师,3,3年前标记的想看。。。 前半段更好
241,入殓师,3,广末凉子的一举一动都像是她知道摄影机从哪个角度在拍她一样不自然
242,入殓师,3,题材关于生死让人动容，但整体上并不觉得太好，雕琢过度，煽情刻意。久石让的音乐这次没留下太深印象
243,入殓师,3,真心觉得很一般，完全看不出感动点在哪里。。。。。。好吧，我是粗人~
244,入殓师,3,"叙事过于平实，死与生的距离感就像归去的旅程，让生者慰死者安
个人没有太多感动，认为此片不足以问鼎最佳外语

久石让的音乐确实不错"
245,入殓师,3,不看都知道是煽情路线 没办法touch到就是没办法touch到
246,入殓师,3,"本木雅宏在我印象里还停留在浪漫日剧的年代中,虽然脸上表情庄重丰富了不少，但给我感觉依然是耍酷的大男孩.至于广沫凉子,那千篇一律的表情与伪纯真的笑脸真让我头皮发麻..."
247,入殓师,3,The gift of the last memories。
248,入殓师,3,为什么我又没被感动 为什么= =！
249,入殓师,3,还好还好，最后小林君父亲手里握着石头（能猜到）。它好在有情怀，向卑微职业行了一个深情真挚的注目礼。也没那么好吧。。。电影痕迹有点重，你能猜到谁会死，因为有误会要化解。
250,入殓师,3,独特视角，和风仪式，内里还是亲情人情和尊重。抛弃妻子宁可一人30年也不回家，自尊心有必要那么强吗？配乐前几个小节真的很像blue moon搞得我频频出戏。那年最佳外语片该由Waltz With Bashir拿啊！
251,入殓师,3,在我印象里，一般这种日本电影都属于慢热型...所以我使劲融入电影，等待这迟来的高潮....结果...莫有高潮或者没有想象中那么高...
252,入殓师,3,看了几部日系“经典” 哎 日系煽情完全就像汽水 一不小心就乱冒气泡 撒一手黏不兮兮的东西 我反正是受不了 
253,入殓师,3,看得想睡觉，最后却奇迹般的流泪了，卧槽我这是在想我死后的事情吗
254,入殓师,3,中规中矩，题材取胜。日式鸡汤，略显煽情。3星半。
255,入殓师,3,日本人的长项 煽情，没传说中的那么好。
256,入殓师,3,男主和父亲的这条线，感觉就是用来补充剧情，和为了使男主这个人物性格更加饱满和厚度吧，但是最后只是父亲手里的一个小石头就把一切都化解了就感觉有点，额，不知道该怎么说，着太多笔墨又感觉会抢戏，而一笔带过，又觉得有些随便。还有，总是隐隐觉得真实的入殓师化妆水平其实很差劲吧。。。
257,入殓师,3,火葬场把最后一道关的老爷爷 比入殓师更接近死亡
258,入殓师,3,盛名之下，其实难副，广末凉子在片中更接近于一个花瓶，大量的面部特写几乎让我以为这是一个MTV。
259,入殓师,3,跟《贫民窟的百万富翁》一样不懂为什么可以得奥斯卡最佳外语片奖………
260,入殓师,3,我所谓追求的梦想也许从来没有存在过。对于不信各种妖魔鬼怪的我来说，活得快乐，死得安逸，死后能留名最好，管你投胎还是转世。
261,入殓师,3,当年爆冷的奥斯卡最佳外语片，的确不如《与巴什尔共舞》
262,入殓师,3,觉得这片还可以的一大原因是因为题材……令一个原因是导演拍动作拍得蛮好的，很容易就表现出了仪式感和人的内心感情，相比之下，用别的手段表现感情和冲突就显得弱了点……本木雅弘身材不错；我现在终于想起广末凉子在这片里像谁了：像西索！！！！！
263,入殓师,3,"没感觉。在我们中国，这是一个超级暴利而令人羡慕的行业 
."
264,入殓师,3,"谀┟挥幸郧班橇耍除了声音。。。
久石让的音乐太生猛了。。。
小日本的电影为啥动不动就用贝9？？？"
265,入殓师,3,带有足够的日本风格与幽默，但是情节其实可以玩的更复杂一些。音乐很好
266,入殓师,3,典型的日本沉静电影，不知道为什么评分那么高，观看别人的死亡，沉浸淡淡的哀伤，也许是种不错的疗伤吧
267,入殓师,3,1.尼轰老婆真好！ 2.久石让就值2亿日圆票房
268,入殓师,3,这片子到底哪儿好看啊评分那么高？就连广末都老得好难看！
269,入殓师,3,剧情平平淡淡的，这么多年了，广末凉子的脸还是让人无法移开视线
270,入殓师,3,不是很喜欢这部电影，对题材总有点芥蒂。但里面有个情节很感染我，就是男主人公半夜睡不着，拉大提琴，女主人公梦醒后继续躺在被窝里聆听，会心的笑着，这就是幸福吧
271,入殓师,3,插科打诨太多，故意煽情太多，还是不够深沉，于是就没法再上个档次
272,入殓师,3,探讨的母题传统甚至陈旧，却始终没有特别独到的发言；意象保守且模式化，比如回溯的游鱼，在我看来有些刻意。表达上，柔软的山形小镇、百态的纳棺仪式――这种布置精巧的东方图景，同时也是缄默有力的画面语言，在学院奖看来想必颇为惊艳吧#挺矫情的一电影##男主很帅#
273,入殓师,3,这个片子之所以会得奖是因为评委们一般不看日剧 要是知道只是日剧的模式片 就不会这么激动的给最佳外语片了
274,入殓师,3,很日式地找}材再放大。大概大部份人看@部影rXe都有他/她吧? 「好吃得人殡y」@句住了。
275,入殓师,3,"明白楹文""影旬""第一了！"
276,入殓师,3,肚子痛的要死，芬必得根本没用
277,入殓师,3,喜欢那几个送程仪式场景，感受到生命与爱。音乐起了很大的催化作用。最后故事的发展，真是感觉有点怪。再就是表演有点做作了。
278,入殓师,3,老实说，看了近些年来的一些日本电影，感觉实在还有不少导演善于弄这些温情脉脉的东西……
279,入殓师,3,给个奥斯卡的理由
280,入殓师,3,商业片就是商业片，打不了四星。我知道广末凉子是很美，也不用一半的镜头来拍她，尤其是最后一场，剪接超烂，不断用她的镜头，她只是配角在故事上来说，而且她的演技也。。。
281,入殓师,3,没感觉感觉 刻意煽情很讨厌
282,入殓师,3,平淡，却又能让人忘却时间片子。然而男主角的脸总让我想起安徽卫视的搞笑艺人阿进，看他庄重地做着入殓工作，有些怪怪的感觉。机器也抽风的发出轰鸣声，再加上小猪的鼾声。都略微影响了观感，整体上感觉是三星半的样子。
283,入殓师,3,结尾有点俗了，亲情爱情一同得到释然。“为了死而努力着”，好伤感
284,入殓师,3,典型拍给西方世界淫看的日本片 不错 就只是还不错
285,入殓师,3,让已经冰冷的人重新焕发生机，给她永恒的美丽。这样要有冷静，准确，而且要怀着温柔的情感。在静谧的时刻，送别故人。
286,入殓师,3,很新颖的构思，很独特的视角，于是抱着必哭的信念看完了整部电影~~可惜除了冗长和平淡，并没有因为生与死的话题受到任何心灵上的触动！！难道不再容易感动了？？
287,入殓师,3,缓而优的温馨电影，各方面谈不上杰出或创新，但故事抓人。论及生死的态度，果然是日本文化中不可或缺的东西吧。
288,入殓师,3,电影一般，久石让的配乐果然是大师级
289,入殓师,3,路上小心，总会再见。
290,入殓师,3,"演戏都是那么做作，虽说在中国在我眼里，这是一个黑暗暴利的行业。然而，我感觉到了平淡而温暖的亲情，安安静静的爱。

"
291,入殓师,3,广末凉子太假了，与电影氛围格格不入，这等电影，强调是润物细无声，而不是装情绪
292,入殓师,3,从一个医生的角度去看待生死往往过于冷血 电影传达的是正能量 但是还是那句话 都用上这样的题材了 拍出这种水平的电影 差强人意 两星半的水平
293,入殓师,3,挺喜欢广末凉子的，可是我还是看不惯日本人的演技方式。还是日本动漫好看
294,入殓师,3,我只想给三星半。前半部非常不错，可惜后来落了俗套，虽然赚了我不少眼泪。妻子从反对到支持都显得没什么道理。太治愈系了，本可以弄的冷峻一点的。太煽了反而光顾着流泪去了。至于违者灯一绕我就知道要转场，夫妇二人间隔了个栏杆我就知道两人要吵架。是不是有点太程式化了？
295,入殓师,3,"我分析了一下我觉得没啥感觉的原因，广末凉子占20%，我一边看一边吃鸡爪和地瓜干占30%,和猪2一起边看边说笑话占30%，剩下就是影片本身的原因了――它一直太想煽了。"
296,入殓师,3,我比较喜欢看国外的一些关于葬礼、病房的故事，这个情节中的关于人性、关于人生，总是比中国的要透彻一些
297,入殓师,3,"看这个片子LP最后流了点眼泪，没有千里走单骑流的多，偶是不会哭的。搞不懂这么个简单的电影就能拿了大奖。可能是这么个特殊的题材。
有一些硬伤，例如如果为刚死不久的人做入殓仪式算文化的话，那么为死了两周的老太太请入殓师那真算日本式的BT了，以及大悟老爸是怎么回事都不知道就出结果了。
还有一些日本式的拍摄手法，真是经典啊
如大悟不想去看他老爸的时候，从小屋子里面跑出来，刚好碰到他老婆赶来，然后大悟继续跑，镜头前景是大悟的大头拍，镜头后面是她老婆从后面看他的模糊背影，真经典啊，一看就是日本的
还有在最后大悟给他老"
298,入殓师,3,没有特别打动我，除了给鹤乃汤的奶奶系围巾那段，可惜后来又被火葬场的用力过度打断了，为什么佛教徒要火葬？
299,入殓师,3,"LIFE  A  IS  JOURNEY ,  NOT  A  DESTINATION ."
300,入殓师,3,还蛮棒的哦虽然觉得有些片段也是有点假假的！广末凉子好棒啊真是说要搬回乡下立马就搬回去～真是个好老婆！可是我跟同学说好羡慕你们日本老公都在家被伺候的那么好老婆又炒鸡supportive～他缩～this is a movie~ reality is not the same！哈哈哈言语中有淡淡的忧桑！所以大家还是支持国产老婆吧么么哒
301,入殓师,3,极少看日本电影。没来由地排斥。这部终于在无意中被吸引，从头看到尾。满好的。但也不于于分数那么高啊，搞不懂。
302,入殓师,3,很好的诠释了仪式的美感。某些时候顿悟到“向死而生才是人生真谛”但实践中很难贯彻。让余生在悔恨中渡过的老爹也是个怯懦的人，宁愿抓着石头死去也不敢和儿子和解。日本人这种“无声胜有声”的交流方式就是误会生产机。跑到田间垄头拉大提琴真作啊。
303,入殓师,3,"似乎只有经历过死亡的人才能够真真切切地感受到这部影片的感动。温柔尊重.
3.9"
304,入殓师,3,日式的温情和励志，刻意的部分有点多，后面的剧情很容易看出来，部分龙套演员的演技实在是- -.......
305,入殓师,3,其实是3.5的电影，过于套路化，题材、摄影和音乐不错
306,入殓师,3,很多人都超级喜欢这部电影。但我只是觉得日本电影一贯如此。没啥特别。靠仪式取胜。
307,入殓师,3,广末凉子使这部片子有了AV的意味。音乐不错。
308,入殓师,3,"比东京奏鸣曲差  至少我的注意力全被广末凉子吸引去了 这算不算是这电影的失败？
"
309,入殓师,3,我觉得也就一般吧，虽然我看到老婆婆死去跟小石子掉下来的时候还是不争气的哭了
310,入殓师,3,泪点比较多。它确实可以说是拍得感人，但是只要对日本动漫、日剧看得多，就知道这些手法、桥段是多么常见。而表演，是这部电影里最差的部分。获得奥斯卡奖并不代表什么。
311,入殓师,3,"在公司年会上打发无聊时间看的，会场太吵，跟无声电影没什么区别了。由于一心二用，此时写不出什么深刻感触了
"
312,入殓师,3,期望越大失望越大・・・
313,入殓师,3,以前，人类还不懂得文字，据说人们寻找符合自己心意的石头送给对方，收到石头的人根据石头的触感和重量，了解对方的心意。比如，滑溜溜的石头代表心情平顺，凹凸不平的石头表示担心对方。3月份在cassis，我的块石头，代表什么？
314,入殓师,3,剧情设计刻意，但煽情之余进一步表现了入殓的正式与庄严
315,入殓师,3,看中的是封面的Cello大提琴，巧的。本身电影非常depressing，把我的五月搞得越来越灰暗，在厨房反反复复地听那段大提琴演奏，脑子里挥之不去的是吸血鬼也说看过，更挥之不去的是入殓师的深情，对死者的尊重，appriciate，温柔地对待尸体，那么温柔。桑心地要命了。
316,入殓师,3,导演曾经拍了一个大系列的电车痴汉奈 。。。
317,入殓师,3,温暖电影。虽然看到流泪了，但不是十分喜欢，不知道为什么。
318,入殓师,3,"压倒性的好评产生了太大的心理落差,等日本片子的痛苦-.-"
319,入殓师,3,这工作适合沉稳、淡定的人来做。大提琴配乐不错。
320,入殓师,3,有点煽，有点慢，有点长，日本惯有的死亡情节，后半个小时还行。
321,入殓师,3,终于tmd把这部在电脑里积灰的电影看完了
322,入殓师,3,一个男人提前遭遇中年危机时，学着与生活和解
323,入殓师,3,对日本片还真是很难感冒……是我没有美学意识吗？
324,入殓师,3,日本片+文艺，慢上加慢。各种全力煽情，还真不是我的类型。只是中间笑了一阵，都知道是哪段。虽然各方面都很细致，但这程度的话国产片也不是没可能。想想奥斯卡都喜欢啥？同性恋，摸死人。。但要能自圆其说。
325,入殓师,3,可能我感情还没那么丰富吧，小感动，不像某人从20分钟哭到最后
326,入殓师,3,虽然在一些细节上有了特别的布置和安排，但为什么我还是觉得这电影有点儿平庸呢？尤其是在演员的浮夸表演下。。。。ps：为何这片还得了奥斯卡？
327,入殓师,3,很多的5星评论才去看的，嗯，真的不过如此~~
328,入殓师,3,广末凉子这么多年好像一点都没变
329,入殓师,3,日本电影的庄谐相宜真是可贵  可后面是不是有点。。。。。。。
330,入殓师,3,至多四星，装B加一星，谁没事撑着抱个提琴跑田埂上拉去？角度独到，故事简单没啥更深层次探究（火化老头死亡是扇门已经算深了），范儿倒是做足做满。
331,入殓师,3,http://v.youku.com/v_show/id_XOTk4ODQ4NzI=.html
332,入殓师,3,广末凉子的人妻范儿好正
333,入殓师,3,结合文艺，温情，日本，对生命的感悟，所有这些我部喜欢的元素。。。
334,入殓师,3,“太好吃了！”“这就是罪孽啊…”音乐节奏过快了，不配那种悲伤的气氛。看完之后，对这个行业真是肃然起敬。
335,入殓师,3,还不错，我是说广末凉子啦。大提琴的音色和剧情还蛮搭的。
336,入殓师,3,太过缓慢的节奏，节奏点的反复提示也感觉让人感觉多余了。对死亡的避讳大概来自于恐惧和无知。
337,入殓师,3,凉子的微笑一如平日
338,入殓师,3,影片一再着墨于各类亲情，大悟和父亲，大悟和美雪，澡堂老板娘母子，甚至大悟和启蒙他的社长，其情谊也更类似于父子。融融一片亲情，哪怕遥远如生死，也无法断然隔断。
339,入殓师,3,"在日本电影里已经算好的了吧..只能这么说...
是只有我认为日本人演戏很假吗？日剧什么的假得让我受不了。"
340,入殓师,3,本来以为是部讨论生与死的电影 但看完感觉更多的是在刻画入殓师这个职业的高尚 同时又夹杂了点爱情、亲情和救赎 想讲的太多 两个小时不够用 有点散了
341,入殓师,3,"昨夜梦到富士山，今天就看了这个日本片子。
男主，像一山东籍同事；
男主老婆，身材长相酷似AV；
老板秘书，像赵涛；
烧火大妈化了妆像x丽媛；
笑场1：怀孕了，但没交待分开了多久，从剧情感觉好像好多年，至少半年，肯定不止一个月；
笑场2：烧人大叔说我最会烧东西了（他会烧啥，只是按个按钮），然"
342,入殓师,3,是我太肤浅吗？我怎么就觉得还好啊，是有感动，不过没有那么得感动。
343,入殓师,3,广末凉子的表演很突兀，完全没有代入感
344,入殓师,3,不温不火・带点励志・很符合日本电影・电视剧版的比较好看・本木很阔爱・
345,入殓师,3,难道是我感动点太高了么 不爱看日本电影的原因之一就是觉得剧情发展的很缓慢 而且中间男主因为这份工作面对朋友的冷嘲热讽还有老婆离他而去 我以为他会放弃这份工作 没想到就这么任由他老婆这么走了 这一点真是没法接受 本来当初就是因为为了养家糊口而接下的工作 现在反而成了自己的软肋
346,入殓师,3,日本的片子，看完了就是闹心，虽说是好片子吧，可看完了还是觉得没看就好了
347,入殓师,3,开篇相当有新意，过半陷入日片拖沓冗长覆辙= =
348,入殓师,3,日本人还真是把什么都能搞出精致的仪式来，影片告诉我们一个道理：行行出状元。另外广末凉子真漂亮啊！
349,入殓师,3,日本人要不要把给死人化妆这种事都拍得那么温情
350,入殓师,3,主题是不错，只是剧情很像日本的中二励志漫画。
351,入殓师,3,在看完姐姐的守o者@N重帖後看送行者，加上V末鲎尤耘f一派天真的幼樱以及T多日厍榈蚨危我X得不如外界盛。
352,入殓师,3,还行，我喜欢那个老男人，广末凉子的复出也挺surprise的，但是男主角演技不是太好，整个剧情推进的有点慢了。
353,入殓师,3,好吃得叫人为难
354,入殓师,3,其实就是一个仪式的奇观
355,入殓师,3,东方文化的内涵总是能征服西方评委的眼球.过分细腻的叙事方式造成情节拖沓，和期许的有差距，广末凉子表情好僵...雅弘大叔演技mama...OST不错...
356,入殓师,3,"也许这梦想看起来已不那么重要，甚至已不再有梦想的样子……
20100507"
357,入殓师,3,这个传说中得奖的电影 我却感觉不大
358,入殓师,3,好看个屎，期望值太高了
359,入殓师,3,生死叩问 传统而典型的日式审美 作了点
360,入殓师,3,"就这片子也旬报第一,剧本和去年的""不是我做的""没法比,画面比较精致,这种题材比较讨西方人喜欢吧"
361,入殓师,3,不配得奥斯卡最佳外语片。
362,入殓师,3,很简单的故事，只是，经历过这些的人只要见到相似的情景也会有共鸣吧
363,入殓师,3,这就是奥斯卡最佳外语片？原谅我太俗气，看不到感动，也看不到艺术，只看到了造作，导演造作，演员造作，整个电影从头到尾都带着恶心的造作。
364,入殓师,3,有一个肯陪你去乡下，不嫌弃你，还给你做饭，给你打炮，给你生娃，闹闹别扭，最后体谅你，理解你，是多么幸福的一件事啊。
365,入殓师,3,过誉了。广末凉子花瓶得莫名。奥斯卡式煽情桥段。虚浮欠深入。三星半吧。
366,入殓师,3,他有个好妻子跟好老板。
367,入殓师,3,"1.日本电影我只知道北野武，黑泽明和av，这导演av出身，自然要看一下
2.和入殓仪式一样，电影非常精致。太精致了，不是我喜欢的类型。
3.又看到广末凉子了。我最喜欢的日本女星。能从困难中走出来，恭喜她。"
368,入殓师,3,做入殓师绝对是需要强大的心里去面对这人世间的一切。拍的比较美，但事实不是这样的。今年经历了一场亲人的去世，晚上的时候一个人睡觉还会害怕，总是觉得有个人，他在找我，然后就去找妈妈睡觉去了。
369,入殓师,3,我没找到状态。
370,入殓师,3,一年前看过的电影，依旧对日本电影十分无爱。不知为什么。
371,入殓师,3,不错，但没有想象中好。感觉想给眼泪也给不出。激情部分也过火了
372,入殓师,3,- - 所有该对劲的地方都不咋对劲 除了他们虾饺
373,入殓师,3,这片子没我想象得好，因为说实话这类型电影，日本太多了。而且得了奥斯卡奖，不由得让人怀疑，可能评委们都没怎么看过日本电影吧
374,入殓师,3,情绪不好，没有仔细看。后面被一个当时认为重要的人的电话干扰，脑子里很空。
