,movie,star,comment
404,重庆森林,2,墨镜伟仔林青霞金城武王菲
405,重庆森林,1,看的真累。王家卫无聊的镜头语言怎么那么多，人物的废话也多，怎么那么矫情！恶心 王菲这造型真够丑  不知到拍出来到底是干嘛 受众人是哪些 …… 故作深沉王家卫 恶心的电影 看的我只想赶快结束
406,重庆森林,1,要不是课堂教学内容一辈子不想看王家卫的电影= =
407,重庆森林,2,我真的是看不懂这类电影啊~~
408,重庆森林,2,不明白为什么被捧得上了天，不明白这是一个什么故事。王菲的声音原来是那样的，尖锐又刺耳。整部电影中好像就没站直过。梁朝伟那个角色有点莫名其妙。金城武那个角色倒是有点意思。
409,重庆森林,1,什么鸡巴 浪费时间。
410,重庆森林,2,"2012年6月7日小文艺叙事有点装B，不过金城武真是正到死啊！绝对hot chick小嫩鸡
2017年3月7日哈哈哈好吧 看完之后最大的感觉居然还是文艺青年最推崇神经兮兮装逼范 放飞自我任性 觉得自己特别特别 嗯 没错 所以说5年过去了 我还是我"
411,重庆森林,2,真的好差，墨镜王的片子装了半天还是这样。故事没讲清楚，感情也飘来飘去，只有一些装逼的镜头和台词，作，太作的
412,重庆森林,2,那张盘我几次放进电脑，几次中断，不是盘的原因，实在是因为有事或者不想看下去了。中断太多次的电影总是不想再碰。
413,重庆森林,2,俩没关联的故事硬参在一起 看豆瓣短评也知道是一群说不出所以然不是摘抄就是鸡汤的文艺青年才捧的电影
414,重庆森林,2,梁朝伟脑子有病吧，一边期待女朋友回家，一边连女朋友留下的信也不看。金城武的故事和梁朝伟的故事有什么联系，谁能告诉我吗？整部电影没有一分钟不是无病呻吟了，都是吃饱了撑的。
415,重庆森林,2,小学的时候第一次看，不懂。后来再看，还有点意思。腻腻歪歪的片子
416,重庆森林,2,1，王菲潜入别人家狂打扫屋子那段毛骨悚然，这是什么级别的女潘扛沙隼吹氖露啊，2，要是诺兰拍最后估计有神展开，看的时候就发现自己总是想多，3，台词确实经典，早已耳熟能详，4，反复洗脑式放加州梦这首歌让人反感啊
417,重庆森林,2,当时是因为某个老乡人人上说自己太喜欢这部片才看的，那时候还不懂王家卫，还不知道他拍的电影略文艺，当然我现在依然不懂王家卫，看不懂他的文艺。我喜欢看故事连贯，跌宕起伏的东西，那样会让我很享受。
418,重庆森林,2,和前女友一起看的，并不是太喜欢这种电影，都在说一些奇怪的话，仿佛看透了人生，我不喜欢那种只留下了经典台词的电影。
419,重庆森林,2,我严重以为我看的片是不完整的，可是102分钟又的确是完整的。所以这部电影其实是两个故事。梁朝伟在片中对肥皂毛巾的自言自语实在是太有趣了。
420,重庆森林,2,王家卫的电影我就没看懂过
421,重庆森林,2,"自摸自爽不足以概括王家卫和他的电影,闷骚这个词也不合适,我只能说凶猛的逼格碎了一地"
422,重庆森林,2,2007年10月21日
423,重庆森林,2,又是看不懂的 唉
424,重庆森林,1,终于看到这片子了，我得说，这电影年代还对着，但是我不是20年前无病呻吟的把自己的孤独装饰的那么精致的惯犯。
425,重庆森林,2,我永远都不会懂王家卫，他却老找我喜欢的艺人拍戏。。。好吧，2颗星给这部戏里的所有大牌
426,重庆森林,1,有那么好看么。
427,重庆森林,2,看在金成武的颜上才看完
428,重庆森林,2,王家卫的电影看着都那么累，不是文青，真喜欢不了
429,重庆森林,1,真是年度最差电影。不知所云，没头没尾，我恨死了california dreamin这首烂歌。王家卫滚蛋。
430,重庆森林,1,就这？观影中途一度想退出，但这么高的评分感觉应该还是得有点东西的吧，期待有一个好的结尾，结果离预期还是有点远，影片镜头晃到头皮发麻，穿个白色内裤能在那走几分钟，一个镜头重复n多次，可能是电影档次太高，我还没到这级别，完全理解不了。
431,重庆森林,2,王家卫是要装疯迷窍多久。。
432,重庆森林,2,一个神经病和两个更神经病的故事。或许失恋和暗恋都会令人神经紊乱，但我毕竟是一个没有为爱情哭过的人。
433,重庆森林,2,王家卫我真心欣赏无力
434,重庆森林,2,我肤浅了，装不了13了，看不出这片有何稀奇之处
435,重庆森林,1,看了50分钟愣是不知道在看什么。恕我这个90后愚昧- -
436,重庆森林,2,（2020）今时今日看着警服我真的文艺不起来。许多年前被人说长得像金城武，回想起来好骄傲，又苦涩，离那张年轻的脸渐行渐远。金城武拿领带擦鞋的画面好on。悲伤失落的时候做一些出格/仪式感的事情，OK，但是为什么拍出了一种为赋新词强说愁的虚假感，如果人设的年龄小5~10岁可能才合理，中年警察这么生涩纯情太飘了。
437,重庆森林,2,天呀，一半的时候差不多就看不下去，感觉太装了，后来看评论才知道周星星都要从此片偷台词，可能男生的油嘴滑舌就是从这时候开始的吧，金城武的故事为什么只有那么一点点？是因为流量吗？哈哈哈，窦靖童完全是翻版的王菲了。这下我更害怕生女儿了，怕她太叛逆太酷我服不住～
438,重庆森林,2,也许真的太久没爱过了，我实在无法理解电影中的各种纠葛痛楚，只想起了最近很红的一句话――不作死就不会死……
439,重庆森林,2,梁朝伟好帅 王家卫烦死了
440,重庆森林,1,在我眼里：“烂片出金曲”。个人不喜欢而已，看了大部分影评，提前告诉骂我的人，我看懂了，你们那些拍摄背后的故事，我看个电影，为啥要看背后。本电影不客观评价，只表达主管看法
441,重庆森林,2,肤浅的我真心没看懂。。。。
442,重庆森林,1,电影很棒，看的人心情很差
443,重庆森林,2,王家卫的国产电影我就没有看懂的，不知道他究竟想表达什么！
444,重庆森林,2,王家卫电影的台词总是这么让人想吐
445,重庆森林,2,喜g不怼ＳX得Y面的人不是^分自倬褪巧窠病。
446,重庆森林,2,总有少年时的朋友喜欢这部片，总有朋友安利王家卫，然而我一块看的过程丝毫没有什么感觉，王家卫是彻底在我少年起就负分滚出了。
447,重庆森林,1,不喜欢装逼，即使王家卫非常的很能装
448,重庆森林,2,王家卫的电影不是我等凡夫俗子欣赏得了的
449,重庆森林,2,不知道这部电影为什么会有人在朋友圈推荐，也不知道这部电影为什么会在豆瓣有这么高的评分。我看到30分钟的时候一度以为自己找错了同名电影。跳到后半部分，看到传说中的王菲和梁朝伟才确信就是这部影片。除了金城武很帅、王菲很美、梁朝伟长得像我哥、林青霞的造型很适合现在范冰冰以外，无话可说。
450,重庆森林,2,我接受不了王家卫的电影风格，这个是确定了。
451,重庆森林,2,罐头会过期 爱情也可能过期 我只想说这部电影才真是过期= =整部无病呻吟的片子处处透着过期的味道 演员装束 电影画面 叙事方式 故事情节都很俗 经典也多了 所谓经典是无论过多久都不会过期的 这部电影我真的佩服我自己耐着性子熬了将近两小时 闷到快烦死= =王家卫还是他的蓝莓之夜更好
452,重庆森林,2,此片再一次证明我不文艺~我不文艺啊~
453,重庆森林,2,真是不明白为什么这部电影那么多人看过 那么好的口碑 或许是我没看懂吧 硬着头皮看完   觉得很没意思。这部影片要表达什么 真的有些搞不懂 充斥没落 颓废 无助 不安 饥渴 难耐 ...两对人 没什么交集 金城武 梁朝伟两个失恋的警官 一个与陌生的林青霞相度一夜 找到一丝慰藉。一个不经意间被默默付出的王
454,重庆森林,1,"不现实。感情线无铺垫，转折变化极快，让人无语。特别是后半段阿菲的行为没有一个很好地解释，或者连暗示都没有，就是一个少女寂寞了，YY的结果。看似很有“文化”的台词，现在看来就是狗血鸡汤。
众文青来喷我吧。"
455,重庆森林,1,矫情比滚粗 看到第几分钟你哭了？
456,重庆森林,2,2016年路过重庆大厦，忽然想到王家卫拍的重庆森林还没看过，时隔又近一年，2017年年初才看。一部电影淡得像无病呻吟，却时常让人回想起电影里面的片段、台词、音乐，也许这就是王家卫非常微妙的本事。
457,重庆森林,2,晃来晃去的镜头让人头晕，不明朗的故事线让人着恼，各种难听的配乐、、、诶
458,重庆森林,2,……和很多朋友在这点上是说不到一起去了
459,重庆森林,1,装逼经典呀
460,重庆森林,1,"很以前看的,我只想说....什么鸡巴玩意儿!"
461,重庆森林,1,好吧，你们都能看懂，就我不懂……
462,重庆森林,1,以我的年龄和观影量，加上本身又是偏艺术天份型，也就是分辨力比较高，我能百分百肯定这不是一部好电影，甚至不能算电影，只是导演拍给自己看的无病呻吟，不值得一看的烂片
463,重庆森林,2,这是很主观的评分。不知道为什么除了梁朝伟那部分，其他都很难忍受，这几个演员原本我都不讨厌的……
464,重庆森林,2,很失望，看不懂王家卫想表达的是什么。整个片子给我一种高度混乱的感觉，而且索然无味。耐着性子把它看完了，要不是最后一个镜头，我真的要给它打一颗星了。
465,重庆森林,2,墨镜王把用镜和甩道理的功夫放一点点在剧情上，也不会渣成这样子，不过，年轻的这群明星，面瘫起来也蛮可爱的，尤其王菲。
466,重庆森林,2,我就是不喜欢
467,重庆森林,2,当年没看懂，至今还是没看懂
468,重庆森林,2,其实我真的觉得这不片子很无聊  两段爱情故事是不是因为和我相处过远 完全没有共鸣感... 
469,重庆森林,1,MLGB什么玩意，10多年前看过一个开头，想小资文艺一把，但是还是忍不住想骂你王家卫怎么还在拍电影
470,重庆森林,1,"貌似很有名,但王家卫的电影不是我这种EQ所能明白的，一星的干活。"
471,重庆森林,2,刻意创造的共鸣会产生耳鸣-03/24/12
472,重庆森林,2,"空城里的加州梦，孤独深处是心疼。
凤梨罐头一杯酒，越是深爱越不休。"
473,重庆森林,2,王家卫。。。一万个无语。。。。
474,重庆森林,2,"1.反感王菲演的那种作女
2.王菲的京腔特烦人让我想到一个讨厌的女的
3.大概是我看的最后一部王家卫
4.金城武是可爱的"
475,重庆森林,1,看完之后才知道是王家卫，好像从来看不懂他拍的片子，不知所云。
476,重庆森林,2,看不懂 。1星给漂亮的林青霞和帅气的金城武，另1星是因为大话西游，虽然这部我欣赏不来，但我知道没有它就没有经典的大话西游！
477,重庆森林,1,一部让人没法看完的电影
478,重庆森林,2,总算耐着性子看完了，我发现有时候青春就是用这种方式认识就很好。太早或者太晚都不合适。果然过了年龄再尝当时的甜，已经不是想象里的那种甜了。罐头过了期，哪怕只过了一个小时它也是另外一样东西。
479,重庆森林,2,看评价很高才看到，磨磨唧唧的不知道说啥，反正谁要是没事闲的去我们家打扫屋子我准得报警，变态。什么爱情，还有那个神神秘秘的卖白粉的女的到底咋了...王菲和金城武长得是真好。
480,重庆森林,2,果然是王家卫条傻HI
481,重庆森林,2,有几句台词可圈可点。其余的，噱头太多。
482,重庆森林,2,欣赏不来
483,重庆森林,1,不好意思，没看懂
484,重庆森林,2,我二逼了，表示无力欣赏。。。
485,重庆森林,2,絮絮叨叨，默默唧唧，晃晃悠悠，故作深沉
486,重庆森林,2,欣赏不了，太装B
487,重庆森林,1,一个低俗的装潢工人，不懂什么叫唯美，但烂俗的故事再怎么包装都逃脱不了基因里的脂粉气，可能那个年代这样就叫酷吧！就像很多垃圾言情小说一样，不是王导的错，在这部电影里他只是能力有限而已。王导是一位很纯粹的技术派，复制粘贴及其容易，因为大多数人都把故弄玄虚跟高雅深刻等一系列词汇划等号。要欣赏这类电影，你首先要让自己无病呻吟，如果你端着一碗干拌面看这样的电影，对不起，这类电影不是为你拍的，可惜，无病呻吟的人世界上太多，王导的成功标志着浮夸空虚时代的到来。一星，给梁朝伟，天生的影帝，竟然隐隐看到周星驰的影子谢谢。
488,重庆森林,2,不得不无力的吐槽下，王大神的作品我从来就没看懂过
489,重庆森林,2,"get不到这种文艺片的精髓啊..
隔着屏幕感受到一种矫柔做作？？这大概就是我单身的原因之一吧。"
490,重庆森林,2,这么一部好评如潮的电影我缺没什么感觉。只感到金城武饰演的角色真的好孤单，第二个故事在我看来更超出现实不实际。
491,重庆森林,2,小时候看的电影，空姐的小飞机模型记忆深刻
492,重庆森林,2,嘛玩意儿
493,重庆森林,2,太文艺真不适合我。。。。。觉得那两个故事好无聊好无力啊。王的电影只喜欢春光乍泄啊。
494,重庆森林,2,问：王家卫和一坨翔有什么区别？答：翔没那么臭，4/10。
495,重庆森林,2,。。。。。。。。。为什么，真是浪费了一堆俊男美女
496,重庆森林,2,二分给我最爱的金城武。
497,重庆森林,2,我一直都不喜欢王菲真的很有可能她长得太像我小时候经常捉弄我的表姐，连声音都像。
498,重庆森林,2,是不是没谈过恋爱，没失恋过，也不是文艺青年，所以get不到这部据说很经典的电影想要表达的是什么？没什么感觉，好无聊，实在受不了王菲一直晃来晃去，天啊，好像就没有停下来的时候，看着太闹心，还有她听的那首歌也不喜欢（还总是放！）。总之，这部电影是看过了
499,重庆森林,2,明星大腕这么多，也难掩让人疲倦和无语，但愿你们能梦呓更久，自给自足里面有更多的开心，快乐，耽溺。
500,重庆森林,2,"装不动这个逼啊~本身就不喜欢看爱情题材电影，台词实在是矫情做作到我看了半截就想翻白眼，跑步流汗蒸发掉水分就不会流泪，可以跟花泽类再试试倒立啊，这样眼泪就不会流下来呢～而且还能锻炼身体。
不过内双的金城武看起来太纯净可口了，梁朝伟的眼神盯得我小鹿乱撞，王菲瞪着轱辘轱辘的大眼睛也灵的很。"
501,重庆森林,2,没认真看，只知道名气挺大。后来有那个2046，看开头，挺恶心的，印象不好 。
502,重庆森林,2,"当你还是王靖雯的时候，小鹿般闪烁的眼神,细l无邪的身材,疯狂的暗恋也不过是纯真执着的本能把我迷翻了。如果说失恋的人不要看重庆森林，但是没失恋过的人，怎么看得懂重庆森林。所有事情都有保质期限，尤其是爱情"
503,重庆森林,2,不知所云，磨磨唧唧叽叽歪歪，梁朝伟的眼睛真是会说话加一星。
504,重庆森林,1,看不懂
505,重庆森林,1,一星给梁朝伟，一屎给金城武
506,重庆森林,2,重点不集中，逼没装到《东邪西毒》那个点儿上，本片据说是刚拍摄完《东邪西毒》正在剪辑阶段，突发灵感利用2个月时间拍出来的，但可能是构思很短，没有《东邪西毒》那样把装逼的分寸掌握的那么恰到好处，重点也不集中，纯粹就是在秀文艺，并且金城武没割双眼皮之前的演技还很嫩，王菲永远都是吊儿郎当那副德行，也就靠着林青霞跟梁朝伟撑一撑门面吧。
507,重庆森林,1,中间来段忘记他很迷离，其他的看的人昏昏
508,重庆森林,1,电视台看了，当时年纪小，昏昏欲睡。反正没有再看一次的欲望
509,重庆森林,2,其不怎N影 @N多人x五星。。。。
510,重庆森林,2,文艺片可能不是我的菜……
511,重庆森林,2,难道是我没有看懂？为什么我觉得好无聊？
512,重庆森林,2,emmmmm不喜欢。我朋友说文艺电影不是看故事，而是看风格和感觉，这一点成功说服我改成两星，的确做到风格鲜明。就像我听rap不是在听歌词，是在听少年意气和反叛精神。王家卫的电影让我再观望好吗？给我点时间。
513,重庆森林,2,王菲的电影看过不多，想看看
514,重庆森林,2,太文艺了，更喜欢第二个故事。王菲真的灵，拍了一段大型居家指南。镜头语言不错，氛围渲染不错，不过王家卫的片我也只能接受这些了。
515,重庆森林,1,我给它打一分是因为前半部分三分后半部分负二，但是我明白这是因为我没有耐心看完后半部分，我受不了了感觉太无聊。既然它这么受好评，一定有它的道理，可能是我看不出来。过段时间我再来看吧，说不定会喜欢上。
516,重庆森林,2,王菲像个sb一样
517,重庆森林,2,我真的，可能我欣赏水平低，真的不是我喜欢的类型。讲了两个故事，年轻人失恋后的心情，失恋后又碰到新的人，如何有想要从新开始。但我真的没get到电影的点在哪里，可能这就是文艺片吧，剧情比较薄弱，不知道想讲啥，或许想很多人说的得多看几遍品品，也许吧
518,重庆森林,1,我打一星不代表电影不好，8.6的平均分已经证明了这部电影的价值。只是不符合我的口味，就跟洋酒一样，有人喝一口就吐出来，有人会慢慢的品。
519,重庆森林,1,浪费了人生中102分钟 恕我理解不了
520,重庆森林,1,烂文艺，竟然有那么多烂文艺青年喜欢
521,重庆森林,1,王家卫导演的戏看不来，就好像阅读理解，我喜欢的是应试的答案而他给出了作者的思想。两个不想干的故事在重庆大厦拍的就放到一部剧，说两个男人的失恋重点也太偏，觉得不好看。另外之前以为重庆森林是重庆拍的………
522,重庆森林,1,不适应这种拍摄手法啊……人物拍的确实一流的美，剧情看不懂
523,重庆森林,2,不行啊，我老了，再也受不了这些，太肉麻
524,重庆森林,2,傻逼操着文艺腔，真是可怕极了。
525,重庆森林,1,abstract
526,重庆森林,2,8.6开什么玩笑 通过重庆森另才明白伪文青上豆瓣这句话的含义了  粤语比较赞
527,重庆森林,1,金城武和王菲的演技比较粗糙，镜头晃的时候有点头晕，故事没有吸引力，223警察的日记式独白和生活方式，有点做作和装逼，让我想起当年读小四的书-悲伤逆流成河，影片主题较空洞，花式爱情较无聊。-
528,重庆森林,1,香港没有导演
529,重庆森林,1,莫名其妙啊 王家卫同学的片子总是在我达不到的高度和深度
530,重庆森林,2,金城武梁朝伟都好帅，这样的顶级皮囊这个角色身上都让我无法喜欢，part2跑到别人家里真的太恶心了，喜欢不是一个做变态的借口。好像又真的是很多人的生活，已经长大了，不喜欢的生活方式就嫌矫情
531,重庆森林,1,王家卫之耻
532,重庆森林,2,以前看过一遍没怎么懂，最近又看了一遍，发现真无聊，还是欣赏不来。各种装比，剧情只存在电影里
533,重庆森林,2,看的我发懵
534,重庆森林,2,对不起，我看不懂，我不装逼
535,重庆森林,2,。。。算了王家卫真的就这样了
536,重庆森林,2,不喜欢这人的电影
537,重庆森林,2,王导的独白倒是一如既往的文艺。只是两个故事完全联系不到一起啊。表示林青霞演的角色我一点也没看懂= = P.S.金城武好嫩，王菲的儿化音说得也太萌了吧~~梁朝伟跟肥皂毛巾的对白还是有劲的
538,重庆森林,2,没看懂，不是很喜欢
539,重庆森林,2,无聊，没兴趣。很讨厌一部电影讲多个毫无关联的剧情
540,重庆森林,2,"矫情……                           
2018.05.18@亚洲国际电影节 广州天环"
541,重庆森林,2,金城武与林青霞这条线交代得不够清楚，没头没尾。我觉得金城武的唯一作用就是搭出了王菲与梁朝伟这条线。至于都市的节奏感、镜头掉帧拍摄手法、旧时文艺青年的无病呻吟这些我都欣赏不了，觉得前半段去掉，把后半段再加点剧情单拍一部这样还好点。
542,重庆森林,1,文青们无病呻吟，不知所云，就是为了几句高深的人生哲理？卖卖情怀，装装洒脱，滚啊，我就给一个星，看不懂操作，影评大咖你们慢慢分析，我不玩了。
543,重庆森林,2,不明白评分为啥那么高，感觉一般般，文青有点装逼过头了，不过演员演技非常不错，音乐也很棒
544,重庆森林,1,我永远都学不会欣赏王家卫的电影，每次还是要挑战自己看，不知道为什么
545,重庆森林,2,除了莫名又不知所云的爱情，其他没看出什么
546,重庆森林,2,傻逼，不知所云，浪费我青春。
547,重庆森林,2,为啥子得分那么高 我是因为王菲才看的 这部电影不好看啊
548,重庆森林,2,没看懂，和堕落天使一样，不知在讲毛线。神经质的文青世界果然理解不了，不知在捧什么。独白一堆，金城武讲白话真的好好笑。拍摄还是很形式主义的。
549,重庆森林,2,只有豆大的香港才能产生豆大的自怨自怜
550,重庆森林,1,无感，怀疑给五星的都是迷妹，奔着梁朝伟去的，在B站看的就能体会到，每到梁朝伟的镜头，一帮人就狂刷弹幕说好帅啊！其中还有个恶心想吐的弹幕是“好喜欢他的白色内裤哦”(影片中有这个镜头)。卧槽，我只想说，妈的智障
551,重庆森林,1,就冲老是装逼的那句“爱你一万年”给1星
552,重庆森林,1,一如既往的烂
553,重庆森林,2,无感触。
554,重庆森林,2,"看过，现在没有感觉。所以，给差评。 太任性。

个人感觉虚高！"
555,重庆森林,1,"因为没看懂
"
556,重庆森林,2,看不懂.
557,重庆森林,2,我真的不感冒王家卫的电影，这部尤甚
558,重庆森林,2,因为题材和年代原因吧 不是很有爱
559,重庆森林,1,"装接着装 总结：镜头晃，人物画面模糊不清 受不了那种做作，极端委婉的叙事 后半段其实有点意思
"
560,重庆森林,2,没有在对的时间遇到对的人，，我也没有在对的时间遇到这个电影，看时我觉得这不是我的菜。
561,重庆森林,2,这么烂的剧本，白瞎演员了
562,重庆森林,2,情节没连上.
563,重庆森林,2,一向不喜欢王家卫的电影，简直文艺到了矫情的地步，经常看到说他的电影多好多好，也看了不少，没此都是快进看完的，这次跳的更多，不好看啊，除了金城武和梁朝伟帅没其他看点啊，我还没认出来哪个是林青霞哪个是刘嘉玲
564,重庆森林,2,看到一半就看不下去了。太无聊了。。
565,重庆森林,1,I will put the ash of your mum into the forest of concrete.
566,重庆森林,2,不知道在讲什么 喜欢上一个人那么简单的么？ 王菲喜欢633的原因是啥 就因为梁朝伟长的帅? 林青霞和梁朝伟那段又想讲什么? 用一些文艺桥段台词 什么乱七八糟爱情的期限和罐头的期限真的太无聊了
567,重庆森林,1,我也失恋过，但依旧看不懂这部电影。更加坚定了，在我心中，港片就是这么矫情做作的莫名其妙无中生有，王家卫永远一副自以为是的装X。唯一的亮点是，原来这么多经典的台词都是出自这里…
568,重庆森林,2,慕名而来失望而归，要不是有那些经典又文艺的台词撑着，真的看不下去，最惊恐的是竟然看出了跟摆渡人一样的调调05？？？
569,重庆森林,2,香港郭敬明 他的电影我都得用快进才看得完
570,重庆森林,2,行吧，我是看不太懂，可能情绪没到位不够感伤开开心心的就看了- -竟然只有0.9%打两星，是我境界不到位咳咳
571,重庆森林,2,比期待中差了很多。失望.
572,重庆森林,1,一群后现代的神经病
573,重庆森林,1,垃圾电影。实在难以理解为什么那么多人吹捧王家卫的“意识流”电影。根本没有组织剧情讲故事，乱七八糟的。
574,重庆森林,2,好作的爱情片，不喜欢。1994年…鱼诤刚刚开始事业吧，好奇那时候的女孩是如何过现代生活的，肉欲有些，可以感受到一点，想起他年轻时的照片。 王菲驼背好丑，林青霞墨镜好丑，风衣还是配轻巧的细高跟漂亮
575,重庆森林,2,配乐单调有损听力
576,重庆森林,2,"第一个故事不好，不完整没讲清楚。第二个稍好一点，王菲挺灵的
第一个那些个片段的闪来闪去晃死我了，负分差评"
