,movie,star,comment
127,重庆森林,5,"每天你都有机会和很多人擦身而过，而你或者对他们一无所知， 
　　不过也许有一天他会变成你的朋友或是知己， 
　　我是一个警察，我的名字叫何志武，编号223。 
　　每个人都有失恋的时候，而每一次我失恋呢，我就会去跑步， 
"
128,重庆森林,5,"看到一半是脑海里浮现起村上春树的一句话，“每个人都有属于自己的一片森林，也许我们从来不曾去过，但它一直在那里，总会在那里，迷失的人迷失了，相逢的人会再相逢。”我不知道除了“迷人”还可以用别的什么来形容王家卫的电影了。
"
129,重庆森林,4,“重庆森林”英文名是“chong king express”，看来和“重庆”和“森林”都没什么关系，而是都市快车中的酒色人生。两端衔接不怎么流畅，前一段有点戛然而止的感觉。后一段倒是像一个完整的故事难道是happy ending的缘故么。梁朝伟给王菲按摩那段好玩。
130,重庆森林,5,依然是目前重看次底疃嗟模最鄣碾影，每次看都很_心，可是不是所有人都意o你一登CC的
131,重庆森林,5,终于看掉，总算一偿夙愿。精灵一样的王菲，带金色假发的林青霞，还有帅到爆的金城武和梁朝伟，加上每一帧带有迷幻气质的画面，好一幕活色生香的港影黄金年华。王家卫是游离于城市的诗人，这城市里的每个人，都只不过是寂寞。
132,重庆森林,4,王家卫导演的作品总是显得文艺满满，灵活的摄影，暧昧的情景，让你隔着屏幕也能感受到影片里的情愫。重庆森林啊，王菲的风头盖过了林青霞啊，太个性了！
133,重庆森林,4,"没看太懂…肥皂自言自语那段有种感觉说不出来。。。
有人说经历过、失恋过才能看懂这部电影，不知道自己到时会怎么想呢？其实很多电影都是当时不太明白，事后一点点慢慢有自己的体悟的，就算与导演初衷不契合，但有自己的感悟就好，毕竟每个人的脑子又不是一个模子做的"
134,重庆森林,5,697M  .BDRip.x264.2AAC.miniSD-TLF(1).mkv 重庆森林 Chungking.Express.1994.720p.BluRay.x264.DTS.AC3.3Audio-HDWinG.mkv8g
135,重庆森林,5,"2017-07-11重看，才真正X得好看。
王菲太有魅力，看到心微笑，然後生活跟舳蓟煸谝黄鸱植磺宄了。
王家l第二部]有超越阿w，但是在小品中看到了他ι活，Τ鞘械莫特|角c非常品味。
王家l^κ窍愀鄣谝蛔髡o`，但@部剪接成叔平，也M有味道但人X得可能就是]k法超越阿w的原因"
136,重庆森林,4,"情调很美的爱情片。才知道，失恋那么痛苦，很难理解把30罐过期凤梨全吃掉是什么感觉，直到25岁生日的前一刻，他才确定要放下这段感情。暗恋又是什么，只是看到她在一厢情愿的付出、甚至都不想他知道。感情，是种...

"
137,重庆森林,4,两场爱情，一场似风匆匆吹过，一场似雨久润人心。暗恋是个矛盾体，让人不忍回忆，却又难以忘却。从来都把悲剧当喜剧看的痞子昆汀看完为什么会哭成泪人？看完你就知道。
138,重庆森林,4,无数遍了，每年都会重看.
139,重庆森林,5,90年代初期的王家卫一定是陷入了某种焦虑状态当中，这个像秒针一样困扰他的迷思或许仍然是摇摆不定身份。然而它最终的指向却并非是注定“过期”的过去而是必须“新鲜”的未来。但在未来迟迟不来的《重庆森林》里，他索性让男主角吃下全部距离保质期仅剩一天的凤梨罐头，貌似每多吃一罐时间就会多进一步。无论他是逃回过去还是飞往未来。
140,重庆森林,5,重看这部片子是一定要修改当年的评分的。20年了这片子的表达方式还是先锋，不断叫嚣着“电影的极致就是我这样的”。好多台词重看都很有感觉。
141,重庆森林,4,看王家卫的电影有时候就是看一种味道。 两个恋爱的故事，平实却又感到很浪漫， 浪漫却又不矫情。 直到现在才看， 却看出还是那时的青春好。
142,重庆森林,5,"试图还原当代都市男女的生活本质
主人公们一直在寻找他们握不住的东西。与他们的祖祖辈辈相比，他们生活于更支离破碎的年代，一些东西瓦解了，一些东西还没愈合，他们就处在这尴尬的裂缝中，漂泊于时间之河
都市人是“疏离”的，人与人之间感情的不确定性，现代都市人的困惑、不安、背叛与渴求，还有对人与人之间温暖的渴求，体现的淋漓尽致
在现实中，谁敢爱敢恨？
被生活冲淡的梁朝伟只剩下了麻木，随波逐流着
王家卫的电影里都是外表光鲜帅气，心灵是座废墟的男人们
王菲的单纯与执着打动了心死的梁，也打动了快要麻木的我
《重庆森林》最初并没有完整的剧本，只是王家卫脑海里有三个短故事，它想以此串成一部电影，后来因为第二个故事拍得太尽兴，他决定将第三个故事挪给下一部电影(即《堕落天使》)，前两个就是《重庆森林》的成片。"
143,重庆森林,4,很有味道的一部文艺片，画面、镜头配着音乐很有种迷幻的感觉。王家卫把爱情具象化了，于是金城武独自咀嚼着那罐过期的爱情，梁朝伟等待着他的下一班飞机，台词很有个性，算是王家卫的标签。
144,重庆森林,5,"""不知道从什么时候开始,在每个东西上面都有一个日子.秋刀鱼会过期,肉酱也会过期连保鲜纸都会过期.我开始怀疑,在这个世界上还有什么东西是不会过期的?"" 
""她走了之后,家里很多东西都很伤心.每天晚上我都要安慰他们才能睡觉."" 
最喜欢梁朝伟王菲在店前倚着的镜头"
145,重庆森林,5,2012-12-20 在荷里活道上做著加利福尼簟//王菲呀王菲。//想起A bout de soufflee的Jean Seberg.// 2016-09-08Z版，王菲p佻地耍著京腔嘴皮子完全把@一粲У搅硪环神游之境了。
146,重庆森林,5,"我至今还会唱里面的插曲: oh my life, is changing everyday, in every possible way。王菲在里面摇头晃脑的唱dreams的样子太可爱了，还有梁朝伟跟毛巾肥皂说话的桥段，太经典了"
147,重庆森林,5,"-你中意呢N畛音咩?-瞻,吵咪咯.唔使疃嘁鞍÷.
又要听这么吵的音乐,又要想很多东西.那就是我的不对了."
148,重庆森林,4,2007-10-18 1:10:13 8/8.0(10824) |2010-1-1 14:42:47 8/8.0(15393)
149,重庆森林,5,2019.5.18 不记得第几刷了，十几岁的时候看只觉得怪鸡但舒服；现在看，25年前的金城武说我已经活过四分之一个世纪了，演员的脸容、影片的胶片上也仿佛印有一个数字，在心底的感受即使不会过期，也会变质，变好或变坏，变浓或变淡，不一样就是不一样了。
150,重庆森林,5,最爱的墨镜王的电影，那时候还是王靖雯的王菲太太太灵了，阿武萌帅萌帅的，青霞女王攻，啊～梁朝伟的眼镜会说话，简直溺死在他眼神里了，这部电影百看不厌，少女心满满
151,重庆森林,5,治愈系的佳作，金城武的台词每一句都是经典，梁朝伟的动作每一个都那么诱惑，王靖雯的声音那时起就如此诱人，杜可风的摄影充斥着迷幻的味道，插曲经典《加州梦》、《梦中人》，最后加之王家卫的糅合，绝美、惊艳，可惜看的时候我没有失恋，总会少了一些感觉
152,重庆森林,4,001：王家卫是生活家，他给凤梨罐头、厨师沙拉、香皂毛巾、啤酒瓶、积水的房子都加注了人的情思。生活家才不问活着的意义，感情的本质，他们把自己浸泡在生活的末梢里，和生活保持平视的关系，而不是俯视。就像一只桃子，哲学家看中一颗核，生活家只需品果肉。我很欣赏后者。
153,重庆森林,4,"这大概是一部关于喜欢的感觉如何表达的片子。金城武在里面很可爱，吃着罐头凤梨然后想着""不知道从什么时候开始,在每个东西上面都有一个日子.秋刀鱼会过期,肉酱也会过期连保鲜纸都会过期.我开始怀疑,在这个世界上还有什么东西是不会过期的?"" ，梁朝伟在公寓里对于毛巾肥皂自言自语的片段很不错。"
154,重庆森林,4,边看边聊天，大概错过了不少。印象深刻的是223买罐头跑步，663对着毛巾对着肥皂对着衬衣对着啤酒瓶说话。
155,重庆森林,5,"一中想招就招吧，也是名校毕业生，谁来不都一样~不要让私念的屁股染污了客观公正的眼眸，随风摇曳的空乘制服才是孤独应有的姿态。。。
我爱你，加西亚~"
156,重庆森林,5,四星半。从小就听说金城武这个名字，今天终于看了一部他的作品，长得好帅！林青霞太有范了！更喜欢第一个故事，你遇见一个人，和她搭讪，听她讲一句生日快乐，就没有然后了，和你遇见的千千万万个人一样，不会有任何故事发生。遇见又别离，这才是生活常态，不是所有人都能像663和阿菲那样有运气。
157,重庆森林,5,重看。太好看太好看，@才是真的[渡人，如果重c森林是5星，那[渡人要扣一星。不按常理出牌，王家l致力做到一o二，他做到了。
158,重庆森林,4,原来重庆大厦还有这样一段故事，那时美爆的王靖雯，金城武，那些戏虐戏剧喜剧的爱情方式，8错，重庆生活过的时候一直没看，跟重庆也没任何关系，所以补top250的过程就是一次次战胜拖延症，真的不能再拖了 2013#24
159,重庆森林,5,重Chungking Express，那bartender和鬼佬好眼~最後演周嘉玲男友的是日本人咩？好n仔~梁朝パ劬好放啊~~如果@是94年拍的，大西[那句典_~完全是在“致敬”咯，有王菲和林青霞真的撞^面。
160,重庆森林,4,典型的文青话痨片。小吃店老板无论形象还是在片中的功能，都和达内兄弟电影里的Olivier Gourmet特别像。
161,重庆森林,5,喜欢california dreaming，喜欢戴墨镜的林青霞，喜欢偷偷去帮梁朝伟打扫房间的王菲，喜欢失恋就会去跑步的金城武，还喜欢金城武和林青霞相遇的那个酒吧，以及那首what a different a day made。
162,重庆森林,4,当时在王菲的影响下，完全没有去顾及美妙的配乐。到今天爱上加洲梦，才回头给这片加了点印象分。至少咱和导演同为老乡并且喜欢同样一首歌嘛。
163,重庆森林,5,很多时候爱并不是拥有，只是一种思念，但其实爱就要能够最后在一起，完成这个爱的过程，痴痴的等待，痴痴地妄想，那爱也许永远只能是单恋，最终会错失彼此。
164,重庆森林,5,少不看水浒，老不看三国，中年不看王家卫。
165,重庆森林,5,最喜欢的片子，初中时候找VCD很难找，听了电影原声，找了剧本来看，直到真正看到片子，已经2年后了。想成为里面任何一个角色，没有太多钱，生活很开心，工作简单没烦恼。
166,重庆森林,5,all the leaves are brown and the sky is gray...... 凤梨罐头，代号223，amei，电话亭，跑步出汗取代眼泪，保质期，空姐，雨衣，墨镜，假发，哭泣的毛巾……
167,重庆森林,4,凫端的蹉跎，凫端的等候，也只凫端的H遇。
168,重庆森林,5,因为两个帅逼我原谅了王家卫的一切。我果然是个善变的女人。不过这确实是最有趣的王家卫。
169,重庆森林,5,"王菲不是个专业的演员，但是在这部电影里面贡献了一段天然去雕饰，极为自然的表演，非常具有灵气。她那双粉红色的塑胶手套至今让我难以忘怀。
墨镜在这部电影里面主要想探讨的“过期-------感情的期限。感情有期限的吗？我想是吧。我喜欢细嚼慢咽的温吞生活，可现代人却习惯了快餐。
一个月神作，王导真是才华横溢。"
170,重庆森林,5,我这张旧机票，还能登上你的航班吗？｜｜20190523重看加分：在何志武又活过1/4个世纪后的五月重看。这个月去到香港，在重庆大厦看到了一群印度人，但没有看到金发的女人；在半山扶手电梯上，没有找到633家的窗口；经过几十次Circle K的门口，也没有进去买一罐凤梨罐头。如今才意识到，Circle K就是OK。I'm ok I guess. R U ok？
171,重庆森林,5,每一段感情都是有保质期的罐头，没有哪个罐头是永远不会过期的，但我希望永远都有罐头可享。
172,重庆森林,4,"我们也许没有在一个晚上吃过三十罐的凤梨，但我想我们的胃都曾经在某个夜晚抽搐过。我们也许没有对着毛巾或者肥皂自言自语过，但如果那个夜晚肥皂和毛巾也能明白我们的言语，我想我会和它促膝长谈的。“一个人哭了，你给纸巾他就行；但如果一间屋哭了，你就要做很多事情。”突然迷上了这些自言自语。
"
173,重庆森林,5,王家卫的电影。第一次看到，也许你会觉得无聊，闷。但你钻进去了，别有洞天。王菲那时年轻、火热。青霞、一代传奇。
174,重庆森林,5,感觉王家卫的电影不是讲故事，而是营造一种状态，一种氛围。重庆森林里的王菲是最出彩的，随意散漫的表象下内心疯狂的暗恋，配合California dream 就成了一部值得一看的电影。
175,重庆森林,5,“连保鲜膜也会过期”，说的我很是难受……追梦固然美好，但梦是否有止尽？？
176,重庆森林,4,剪辑好，很文青
177,重庆森林,5,"不知道从什么时候开始，在什么东西上面都有个日期，秋刀鱼会过期，肉罐头会过期，连保鲜纸都会过期，我开始怀疑，在这个世界上，还有什么东西是不会过期的？
"
178,重庆森林,4,新鲜新鲜，什么新鲜啊。就是你这种人啦，贪新忘旧的。喂！弄一罐凤梨罐头要花多少心血你知道吗？又要种，又要摘，又要切，你说不要就不要啊？你有没有想过罐头的感受？
179,重庆森林,4,不知道从什么时候开始每个东西上面都有一个日子，我开始怀疑在这个世界上还有什么东西不会过期。
180,重庆森林,5,不着边际的怪异叙事，摇摆甚至慌乱的写实镜头，富有趣味性的台词，这一切看起来都不像电影，但就是在这看似迷乱的画面里，情绪被塑造得从茫然演变成了笃定，并且印证着现实的生活。王家卫的个性在这部电影里像站在山峰上向世人展示一样，让那些喜欢的人朝拜，让不喜欢的人远离。
181,重庆森林,5,这部电影也太寂寞了吧！浮光乱影的城市边缘，男男女女真真假假的琐事和感情，失恋之后一个人跑步，在空荡荡的房间自言自语，也许每个人都幻想像阿菲一样神经兮兮不顾一切爱上一无所知的陌生人，义无反顾踏上说走就走的新人生，但最后都只是过着日复一日的平淡生活，角落有一封已经发黄过期的信
182,重庆森林,5,《蓝莓之夜》好像是对《重庆森林》的回答与扩充，蓝莓派变成了炸鱼薯条。不愿面对现实的人选择了离开再回来，不愿面对失恋的人选择了死在森林的夜里。秋刀鱼会过期，肉罐头会过期，连保鲜纸都会过期，我开始怀疑，在这个世界上，还有什么东西是不会过期的？ 
183,重庆森林,5,最精灵的王菲。
184,重庆森林,4,王家卫的片子总是让我第一次看完全云里雾里不太明白，尤其这部至今也不能清楚搞懂他要表达的意思，只是每每从中找到些许共鸣来勉强理解那么多人的拥戴。有人说失恋才能看懂重庆森林，孤独的人更能欣赏王家卫，我想我还是不要太懂的好。我喜欢里面的王菲，在我心里她就是那个样子~~~~
185,重庆森林,5,"印象尤深－california dreaming, 王菲哼吟，林青霞的黑超，梁朝伟的白色内裤，金城武的青涩。。。梦中遇见的梦中人－重庆森林"
186,重庆森林,4,一个人哭了，你给纸巾他就行。可是一间房子哭，你可要多做很多功夫。
187,重庆森林,5,硬是要如此寂寞，2点半硬是把这电影看完了，不过物超所值。这电影太适合失恋的人看了，如果一个人哭泣你只要给他纸巾就行，但如果一个房间哭了你就要做很多事。其实是特简单的故事，但一经过王家卫的手就变成舒服的午后电影很美，特别是伟仔羞涩的屁股。
188,重庆森林,4,为什么都是失恋的故事。。。这样一来，我总觉得要忘掉他不是一件难上一万年的事吧。。。尽管哈尼这样搂着我的时候。大熊还是跑出来了
189,重庆森林,4,关于失恋疗愈的故事。梁朝伟失恋后对着肥皂抹布自言自语自我安慰，金城武买前女友爱吃的凤梨罐头直到自己生日。林青霞和王菲的角色，试图告诉观众，生命中还是会偶遇未知又精彩的人，再痛的失恋总会被时间和经历抚平。
190,重庆森林,5,"#BJIFF#王家卫眼中的时间和空气都是光怪陆离的，上一秒你的呼吸可能就会让你第一次邂逅素未相识的可能伴侣，这份""可能""化作最奇妙的时光机，拜谒你上一分钟落寞但渴望的灵魂，探访你下一分钟新鲜但绝不过期的记忆。从不敢第一时间看你的短讯，但我希望上面或是生日快乐或是明天有空带你晒太阳"
191,重庆森林,5,8.1 剧本也就那样，但王家卫是像戈达尔一样地在玩。
192,重庆森林,5,第一次完整看完重庆森林，故事讲得真好
193,重庆森林,5,给菲姐无敌的演技来个五星吧，这电影可以当《梦中人》的MV了，然后就是菲姐喜欢听california dreaming哦。。。王家卫拍电影录像机都拿不稳的。。。女人的小腿最性感？。。菲姐制服诱惑的
194,重庆森林,5,如果什么都有保质期 凤梨罐头有 爱情有 凤梨罐头过期了会反胃 爱情久了会像换换新的 也许只有孤单没有保质期 你永远可以对着你的毛巾说叫他别哭 幸运的话也许记忆没有保质期 你总是可以想起那些值得记起的人 但愿未来也不过期 祈祷未来有个人给你一张一起去加州的机票
195,重庆森林,4,王家卫真是文艺到骨子里了，这调调太喜欢，是一位可以将那一刻的色彩、音乐和心情融为一体的导演。当然梁朝伟和王菲的颜值也撑起50%的戏。我后悔那么多可以用来追星梁朝伟但却拿来做数学题的时间。
196,重庆森林,5,"“不知道从什么时候开始，在每个东西上面都有一个日子。秋刀鱼会过期，肉酱也会过期，连保鲜纸都会过期。我开始怀疑，在这个世界上，还有什么东西是不会过期的？”重c森林里，最喜g的一段_~。^m王家lf片之旅。
"
197,重庆森林,5,不知道从什么时候开始，每件东西上面都有一个日子，秋刀鱼会过期，肉罐头会过期，连保鲜纸都会过期，我开始怀疑在这个世界上，还有什么东西是不能过期的。
198,重庆森林,5,天！我真是爱死这部电影了，爱死王家卫，爱死梁朝伟，还有王菲金城武林青霞！当年因为镜头太晃看不下去实在是年纪不到！十星！
199,重庆森林,5,这是一部关于失恋的电影，编号223的金城武还上了失恋综合症，无法忘记前一段五年的恋情，买了整整一个月的凤梨罐头，在最后一晚全部吃完，又打赌爱上第一个出现的女人；在223于阿菲插身而过的时候开始了第二段故事，编号633（梁朝伟）因为失恋而跟家里留下的东西聊天，那么喜剧却又那么伤感
200,重庆森林,3,挺想知道如果这电影不是王家卫+梁朝伟+王菲+林青霞+金城武，一样的表演、台词、镜头 ，会不会被人喷出来翔？
201,重庆森林,3,为了见证自己审美的变化，十几年看了几十次，发现还是无法喜欢，始终还是觉得王家卫的美流于形式，疏于意象，看片段很好看，看全片消化不良
202,重庆森林,3,没多牛逼，太一般了。主要是阿菲挺逗，喜欢看她。梁朝伟的演技再加一分，金城武的台词再加一分，一共三分。话说这个电影我看了30多遍了吧？还专门去了香港的重庆大厦和半山扶梯看。这个电影原本是林青霞的故事，王家卫删了好多才成了重庆森林，跟原版完全不同。
203,重庆森林,3,"“其实了解一个人并不代表什么，人是会变的。今天他喜欢凤梨，明天他可以喜欢别的。”
――《重庆森林》"
204,重庆森林,3,梁朝伟的忧郁，金城武的帅，都是华语影坛顶级的，导演更不用多说，如果能再聚首，我相信还能有更好的作品，
205,重庆森林,3,初看觉得还行，在看完花样年华，阿飞正传，蓝莓之夜等等之后就觉得腻歪了，王墨镜你还能换换啊，不带你这样忽悠大众的
206,重庆森林,3,一群好演员却没拍出好电影
207,重庆森林,3,墨镜王的代表作，几个角色都很精彩，尤其喜欢王菲对爱俏皮的执着，还有梁朝伟对那些小物件儿的碎碎念。只是金城武和林青霞那段镜头飘得太厉害，有些晕眩，和后半段的衔接也几乎没有，像硬生生的两个故事。这部电影看的是情怀，看到是性格。罐头到此，思方尽；机票成行，恋始开！
208,重庆森林,3,我实在不喜欢王家卫那种什么0.01秒的台词。。太倒我胃口了。。
209,重庆森林,3,我以为我终于get到王家卫的美学了，然而没有，我只喜欢春光乍泄和一代宗师而已
210,重庆森林,3,不文艺的我看文艺片~需要很大的耐心。。。。。。。。很喜欢王菲暗恋tony的部分。。那种感觉~那种付出就是一种幸福~一旦捅破便失去了韵味~那时的王菲~梁朝伟~金城武~都是那样美好的年代~纪念逝去的时间~
211,重庆森林,3,"当我觉得《重庆森林》里怎么每个人都那么装的时候，我就知道我已经俗了；当我在想打三星之前看到我关注的好友无一例外全打了五星，而我甚至有点害怕自己发出不一样的声音的时候，我知道我更俗了。
我俗，但我不敢承认，真是悲哀啊。
然后我又试图通过要不先看两篇高赞影评来用一下别人的眼发现这部电影的美，可是我看到别人说“失恋的人不要看重庆森林，但不是失恋的人又怎么能看得懂重庆森林”，唉，我知道片子里都是真性情的人，都是疯狂的、细碎的、敏感的人。
也许是我太害怕我还是那样的人吧。"
212,重庆森林,3,只不过S失恋，失恋好正常啧，本身唔S人O离弃你就S你离弃人O，舆罡丛印；鸪翟度チ耍唔会话时时都有个人凝望着你的背影；一个又一个电话拨出去，唔S话边个都詈眯那畹孟腥ビΤ昴恪尤S绝对丑人同埋红人，唔可以去怪人O嘎，因为幻象都S自己一手炮制。
213,重庆森林,3,故事的转折点是最后王菲穿上制服，而伟仔开了茶餐厅。片子暗喻着，尽管我们最终不会选择对方，但我们最终都潜移默化地因前任的伤，而将自己改变成对方期待的样子。跟前几部片子一样，主题仍然是我们是否需要稳定伴侣的拷问？在面临爱情必然过期和更替的自然预设下，我们是否会跟一个人开始一段爱情呢？
214,重庆森林,3,影视帝国版 粤语中字 上网本 甘韦肆 http://movie.douban.com/review/2905004/
215,重庆森林,3,哎呀。糟糕，又是文艺片，我又没看懂。以后如果想看文艺片一定要拉个脑袋灵光的跟我一块看让他给我讲讲这是怎么一回事=。=太辶耍看了半天竟然不知道在说什么，关了pps就毫无印象了，人物之间的关系都闹不明白，哎。
216,重庆森林,3,虚假和蹩脚。从来不喜欢太架空的设定和轻喜剧，特别是与我完全不感兴趣的爱情观混在一起的时候。好吧大家可以向我开炮了（。我已经完全做好了被打死了心理准备orz...
217,重庆森林,3,我不喜欢王家卫的镜头语言，总是感觉很飘。对于王家卫的意识、独白和被津津乐道的对白也不是很买账。哎，对演员和配乐倒是很欣赏很喜欢。感情的事情，说不清楚啦，Tony真的很骚包啊。
218,重庆森林,3,对王菲喜欢不起来，几年前总被推荐 看了很多遍都从王菲进入开始关闭，因为从来不觉得失恋需要这样作天作地的过日子啊。哎，你们喜欢就好。
219,重庆森林,3,是因为刚看了诺兰的片吧，这一对比就显得墨镜王没剧本的片实在是不严谨，过了期的爱情和看着就似乎没保质期的梁朝伟的一柜子罐头，前面的故事太飘渺后面的太矫揉。不过很喜欢那堆被教育的香皂毛巾什么的，还有只听过副歌的梦中人
220,重庆森林,3,现在来看这部很不对胃口，可能是因为片中那种梁朝伟恋旧物式的失恋和我自身经历不搭。不过在当年那乱晃的镜头和王氏台词还是很有味道的吧..
221,重庆森林,3,我很傻逼地说我没看懂。我想知道为什么片名叫重庆森林。片里的两个故事到底是要讲什么。看了几个评论，貌似是懂了。但是爱情故事对我这个没有恋爱经验的人来说，不是憧憬而是没有兴趣。
222,重庆森林,3,我看见你在那里摇头合，Californiadreaming……
