,movie,star,comment
223,重庆森林,3,那个啥，我本来就不想成为小资，也不怕小资们鄙视……我不太喜欢这个片子，其实很多闷片我都喜欢，但这也闷过头了吧
224,重庆森林,3,看不懂……我发现王家卫的东西我都看不太懂
225,重庆森林,3,也许在网上看断断续续影响了看的心情，只是对梦游、加州梦、摇滚人生、都会过期的一切，感触深刻。
226,重庆森林,3,10年前看的话可能会给五星，只可惜看得太晚，过了装逼的年龄了
227,重庆森林,3,4.1应景，王家卫从来不会讲故事，台词的碎碎念，情调片段的拼凑，摄影美术赞。
228,重庆森林,3,迟滞镜头用得太多，看得人想睡觉，为毛取了这么个片名？
229,重庆森林,3,这片儿看过几次，后来才知道它叫重庆森林……这名儿是怎么想出来的啊= =
230,重庆森林,3,学新东方的时候，和大法在熄了灯的宿舍拿笔记本看的。一直都不太消受王家卫的电影，就算经典也是一样。印象最深的是金城武每天买着明天过期的凤梨罐头大吃还有王菲每天偷偷跑去梁朝伟家打扫每个角落。爱，就是让人变成强迫症患者。
231,重庆森林,3,"导演的名字叫王家卫。呵呵。他是文艺片大师,可为啥大师讲故事就要这样讲呢?前1/3金城武和林青霞的故事,和后2/3梁朝伟与王菲的故事到底是个什么关系?我能想到最浪漫的事,就是他们都是讲了爱情,都是悲催的爱情换来了小浪花,金城武收到一条简讯,梁朝伟收到一张王菲手绘的""登机牌""。"
232,重庆森林,3,王菲的短发干净利索~在这里表现出她的随心所欲的真本性~
233,重庆森林,3,凤梨罐头和模糊的字条和已经偷偷打扫的房间。
234,重庆森林,3,无病呻吟，妈的智障。谁能想到王墨镜是个恋爱脑呢，还总是把男方放在弱势地位。王菲长的可爱，奈何角色中二神经病偷癖狂，她也没能力演的讨喜，声音也很奇怪。这种鬼怪精灵型田螺姑娘我真是怕了怕了，参见天使爱美丽。三颗小星星给镜头语言，想起苏州河。///天，阿菲这眼神，这小动作，这声音，这不是郑爽么？！
235,重庆森林,3,不明白前面一段 林青霞 金城武 是要表达什么 
236,重庆森林,3,"实话说，我不喜欢王家卫！
给自己标榜艺术的东西，我都不喜欢！
我不艺术！
"
237,重庆森林,3,我没有事业可以给兄弟，我没有爱人可以给予爱情。我唯一能做的，就是把孤独留给自己。在大多数人已经安然入眠的夜里，跟一个长相并不是那么漂亮的姑娘，说一句带着挑逗的话，以此打发寂寞的时光。
238,重庆森林,3,"这个片子看的太早了，心智还没发育成熟，看完以后我被催熟了。
回头再看，这片子实在……恐怕都是过度诠释吧！"
239,重庆森林,3,看的太久了，印象不深，不知还有机会重看不
240,重庆森林,3,"故事非常散　

小资啊
微观　而个性的　私人生活"
241,重庆森林,3,对着牙刷和毛巾自言自语.
242,重庆森林,3,没办法，观影体验来说真的没感觉那么好。只喜欢梁朝伟自言自语叨逼叨的时候，特逗~想吃凤梨罐头。
243,重庆森林,3,"不明白为啥那么多人喜欢这个片子，，王菲扮相很美，，很漂亮，，，其余什么本色演出我到没觉得，，你丫怎么知道王菲生活中什么样子，，装什么啊都！！！两个故事都淡淡的，，没感觉什么沁人心脾的高度啊拜托。。我就这个审美了。。爱咋咋地 
"
244,重庆森林,3,回头看王家卫早期的电影，能看到他早期的稚嫩。他不同的电影都在讲一个主题 男女的情爱问题，只是表现形式不同，电影技巧越发精妙。对于本片，个人不太喜欢。
245,重庆森林,3,越是搞不懂王家卫，越是要看，越看越不懂。不看王家卫就当不了好文青。
246,重庆森林,3,印象尤为深刻的是王菲扭着屁股整理床的那个镜头
247,重庆森林,3,台词经典，感情看不懂。观众很寂寞，演员更寂寞
248,重庆森林,3,王菲离婚那晚看的貌似，我反而想继续睇金城武同林青霞果part呢。
249,重庆森林,3,我不得不说不懂分数怎么这么高，金城武的故事没讲完啊，好吧是我没看懂==结局还算有点喜剧感==
250,重庆森林,3,王家卫的电影风格一贯如此，情节简单，表现手法复杂，文艺小青年都喜欢。
251,重庆森林,3,不要问我为什么只打三星。我想我的判断能力出了问题。
252,重庆森林,3,我只想说一句。警察果然是喜欢空姐的，连电影也这么演。
253,重庆森林,3,"“我和她接近的时候，我们之间的距离只有0.01公分， 
我对她一无所知，57个小时之后，我爱上了她，”喜欢第一个故事，第二个就算了吧…"
254,重庆森林,3,不知所云的电影。梁朝伟和家里的毛巾肥皂房子等说话挺有意思。加州梦那个背景音乐不错。就是冲着林青霞看的。
255,重庆森林,3,3星半，或许我应该给更高；可我不喜欢“营造”，或许王家卫并不是刻意。还会想，为什么叫重庆森林；前半截的金城武和后半截的王菲梁朝伟有什么关系？看来我还不够寂寞。喜欢对着肥皂毛巾加菲猫讲话的梁朝伟，喜欢《加州梦》，或许我们都只是在梦游。
256,重庆森林,3,意识流，随性，跳跃，没多大意思。   PS:来看看王菲。 
257,重庆森林,3,王家卫 风格独到 看一部就能区别出他和其他导演 却从没让我沉溺过 还有侯孝贤 是为什么呢 或者不沉溺也好 不会滥情的爱他们 会客观一些
258,重庆森林,3,"探T223自言自Z,不知氖颤Nr候_始,在每|西上面都有一日子…我_始岩,在@世界上,有什N|西是不^期的? @句r究竟道缍嗌傧愀廴说男穆? 殖民,本便]有^去,面快要^期的殖民生活,再加上一九八九年事件,@多少使得香港人ζ谙薜男延X得更槊舾,竟香港回w中是不可改的v史命\。"
259,重庆森林,3,话不投机还死缠烂打的就算是金城武也一律拖黑
260,重庆森林,3,装逼装得蛋疼，有些装逼文艺小清新我很喜欢，但王家卫明显不是我的菜，以及为什么要叫重庆森林？英文译名都比中文片名好……
261,重庆森林,3,入驻重庆大厦前看看有个心理准备 没想到时隔这么久还是电影中的样子 走在尖沙咀的有色人种的聚集地咖喱、香水和人体的各类气味充斥鼻息还是有些心慌 还有梁朝伟走过的半山扶梯 电影已不是电影了 给了我很多的符号
262,重庆森林,3,第一部不太喜欢的王家卫作品 有点神经质的絮絮叨叨
263,重庆森林,3,"life on mars...结尾少少扳回一城,"
264,重庆森林,3,我和她最接近的时候，只有零点五公分，57个小时以后，我爱上了这个女人。
265,重庆森林,3,我喜欢看文艺片。但是不带这样文艺的。
266,重庆森林,3,王菲的动作就是独白和台词。金城武每句话都很好听。可惜两个故事是王家卫的精神分裂。
267,重庆森林,3,跑步这么私人的事情，你有没有考虑过罐子的感受？她走了之后，他依然是一条感情丰富的毛巾。
268,重庆森林,3,"【闷骚电影】我和她接近的时候，我们之间的距离只有0.01公分， 
我对她一无所知，57个小时之后，我爱上了她，"
269,重庆森林,3,"终于看了。
真没看懂。。"
270,重庆森林,3,太小了 只记得菠萝罐头和加州之梦了
271,重庆森林,3,我不喜欢吃黄桃罐头。
272,重庆森林,3,说真的，真希望片长占比大的是林青霞和金城武的那一段。
273,重庆森林,3,"完全不知道

说的是什么，倒是满喜欢和那些东西对话的感觉的......."
274,重庆森林,3,王家卫王家卫王家卫。世界上总有一般人不理解另一半人。很明显我跟王家卫不在同一半。
275,重庆森林,3,王菲的那首《梦中人》，和电影真绝配~
276,重庆森林,3,痴情帅哥在现实中存在么？剧情严重不真实啊！
277,重庆森林,3,王家卫似的结构再次成功
278,重庆森林,3,小学时候在表姐新婚之家没看懂，后来大学时候看懂了，一直深藏心中的片子，生活，就像片中的金城武的生活那样，平淡
279,重庆森林,3,一个人在上海，独自呆在房间里看的。大都市里普通人的生活故事与情感，被王家卫拍得这么文艺，且有浓浓的香港味道，喧嚣、杂乱、简陋，却也不乏诗意。然而谁知道墨镜王来大陆后发生了什么，才会拍出摆渡人这样强拗造型空洞无聊的片子呢？但终究会有属于上海普通人的好电影。
280,重庆森林,3,金城武的凤梨罐头，林青霞的疾走。
281,重庆森林,3,结构失衡。哲学不是灵感游戏，电影也不是。“东邪西毒终极版”作为导演唯一的反思性修订作品却成了神作。“再思为佳”！
282,重庆森林,3,迷幻氤氲而不知所云。这大概就是文青的调调。然而我还是欣赏不来。但是不得不承认王大师对镜头的掌控实在太惊人了。
283,重庆森林,3,其实没太看懂是在说什么_(:з」∠)_就觉得大家都好寂寞啊_(:з」∠)_要是自己一个人的话是绝对不会看完的……王菲演的那个姑娘太神经了吧=   =+ 相比之下还是第一个故事更有意思一些。王家卫不装X会死么…………
284,重庆森林,3,实在不喜欢这种类型的片子
285,重庆森林,3,我真的不太适合看极文艺又很闷骚的电影 踏步像彭浩翔 可以调弄生活 他只是一种状态 这里的音乐 人物 身份 背景 都长着一张陌生而偏执的脸 仿佛天生就是为了某种控诉而活
286,重庆森林,3,看这电影的时候 正值高中 老实说并没有太大的感受 倒是对王家卫的拍摄手法和那首歌很感兴趣 年初去香港的时候 去了重庆大厦和半山扶梯 觉得还是蛮有代入感的 准备什么时候再看一次 
287,重庆森林,3,我不要再看王家卫了，故弄玄虚，烦死。
288,重庆森林,3,只得梁朝ピ诜鍪痔萆砘鼗亍、、、
289,重庆森林,3,欣赏水平有限，大师的作品实在是欣赏不了，主演演得都不错，其他的就不说了，没看明白……
290,重庆森林,3,本来以为看王家卫的这部片子会让我有烦闷无聊，不知所云之感。可一口气看下来，顺畅无比，如饮醴酪。如要认真分析和解构这部片子到底有何高明之处，我却不得而知。只知道本片吸引我的肯定是第二个故事――梁朝伟和王菲演的那部分。王菲干净爽朗的短发形象真是让人不喜欢都不行，她暗恋梁朝伟所表现出来
291,重庆森林,3,似乎没必要非要这么拍，还是真的习惯成自然？不过镜头似乎还好的有些过头。。。
292,重庆森林,3,Chungking Express翻译成重庆森林，Shanghai Express却翻译成东方快车。。。
293,重庆森林,3,看完《重庆森林》，不是我的菜。王家卫果然不适合我，每次点开花样年华，看十几分钟就看不下去了。至少有一点比较明显：我不是文青！！！王菲那叫一个青涩，哦，那时她还是王靖雯。金城武，你还让男人活不？？？永远都那么帅！我擦
294,重庆森林,3,真的是没有失恋过就会看不懂吗？难道好的电影不就是能够让没有经历的人感觉身临其中且内心颤动，让有过相识经历的人点头且哭泣（哪怕内心）。一直觉得自己还能够那么的一丁点看的进去文艺片的，似乎又打破了我的坚持。大大的人生乱象，今天是你也许明天就是他！期待未来某一天能稍微理解得了大家的认同
295,重庆森林,3,不是不来 失去了其他地方
296,重庆森林,3,有点看不懂呢 太文艺了
297,重庆森林,3,如果你不懂这个电影说明你不懂闷骚的意义！
298,重庆森林,3,感觉像第一次亲密接触，一些金句颇无厘头，几好玩。
299,重庆森林,3,那些小说和电影对数字的执念就是从这里的台词开始的么？难得我还记得一部自己当时根本没有怎么看懂的电影的好多瞬间，那个凤梨罐头，那个鱼，那个戴着墨镜的女人，金城武干干净净的国语和小小别扭的粤语~这些小小的瞬间一定有神奇的魔力~
300,重庆森林,3,大概是我没能领悟到吧，如果仅仅是到梁朝伟约王菲去加州酒馆，我都觉得这算一部比较可爱的恋爱/失恋男女的故事，但是王菲爽约一年后又回来这种情节安排，恕我理解不到啊。。。现实中遇到这种人我知道我只会想一鞭子抽死！这结局让我觉得墨镜真是巨矫情啊！我果然欣赏不了他
301,重庆森林,3,瞬间和瞬间都很不错，看着那些瞬间电影也看得下去，甚至觉得好看。但是就电影整体差了挺多。不过喜欢雨，雨中透过窗子低帧的人，玻璃窗中的倒影，颜色。
302,重庆森林,3,开始越来越喜欢梁朝伟了。。。
303,重庆森林,3,呃，就我喜欢第一个故事吗？
304,重庆森林,3,Californiadreaming在这里面显得尤其好听。
305,重庆森林,3,失恋我也试过啊，我失恋的时候我会去跑步，然后跑跑跑，跑到满身大汗，这样子呢我就没有泪可流了，真的，你要不要试试看跑步？
306,重庆森林,3,凤梨罐头。其实没有想象中那么喜欢这个片子
307,重庆森林,3,王家卫的片子对俺来说更像是悬疑片儿。阅历太单薄。王菲的京片子挺雷人的。
308,重庆森林,3,如果连保鲜膜都会过期，还有什么不会过期？
309,重庆森林,3,把鞋藏起 好可
310,重庆森林,3,可能是因为看电影之前看了太多关于这些经典的电影台词并没有什么感觉，倒是很叨逼
311,重庆森林,3,大学的时候，边宫王家卫专场通宵，木看太明白~~~
312,重庆森林,3,I am shoes
313,重庆森林,3,巨蟹座反反复复的碎碎念。。。王菲年轻时神似赵薇哦。
314,重庆森林,3,一直不喜欢王家卫，不只是因为他莫名其妙却不讨人喜欢的装逼范儿，那些显得刻意的长篇独白、那些晃动的乱糟糟的镜头、太过浓艳的色彩、和矫揉造作的台词，让人心生疲惫。虽则一次又一次失望，但还是在看他的片子，因为觉得，大家都喜欢的东西，我也应该喜欢不是？
315,重庆森林,3,我失恋了不吃菠萝罐头，也不对枕头说话。California Dreaming好听~
316,重庆森林,3,一部勉强不知道算不算看完的片子
317,重庆森林,3,迷幻的王家卫，这一切都的发生过吗
318,重庆森林,3,心理疾病 这得找医生啊！部分台词还不错 梁朝伟的自言自语还算是有意思
319,重庆森林,3,太多人来解析这片森林，我第一次看完全没有搞清楚状况，看的直困，等到年纪到了，却因为太多的解析，不想再看。
320,重庆森林,3,心理疾病 这得找医生啊！部分台词还不错 梁朝伟的自言自语还算是有意思
321,重庆森林,3,这种造型的王菲居然也让我迷上了。。。
322,重庆森林,3,冲着电影的名气去看的~NND 不知所云
323,重庆森林,3,情节跳跃 我知道了 只要一个人对你有兴趣 一定会主动找你搭话的
324,重庆森林,3,看不懂，台词很有爱
325,重庆森林,3,不有看懂想表达虾米。。
326,重庆森林,3,马马虎虎，可以看
327,重庆森林,3,喜欢电影里面的王菲
328,重庆森林,3,欣赏不了~~
329,重庆森林,3,。。。。。。。电影的前后= =有点灏　！！６且我喜欢那样的女生= =就想EMILY但是= =完全不知道point嘛。。。。看14年前的电影真的是徒增伤感><
330,重庆森林,3,那时候很年轻，真的很漂亮的王菲的侧脸，和斜侧脸 ，对于剧情只知道是他们错落的爱情，那年代很流行这样的叙述爱情方式，也与时代同步，但我还是不明白为何这么多人说它好的原因，我猜是因为整部电影唯美又完整的原因吧，http://v.youku.com/v_show/id_XMTQ5MDQzOTUy.html
331,重庆森林,3,两星半给那时的王菲，半星给金城武。前一个故事不知所云，后一个很有劲的~
332,重庆森林,3,还没看完 先给三星 再改
333,重庆森林,3,晃的我头疼的镜头，神经兮兮的情节，像梦游一样的众大咖青涩的表演，无聊的旁白，墨镜王编导，杜可风有份的摄影张叔平的造型，文艺元素全了。。。不过还是看不懂π_π果断是装逼文艺青年殿堂级别圣品！！！！
334,重庆森林,3,其实我没看懂，为什么要叫重庆森林？=。=好艰深的题目，然后，前面那段故事和后面那段又有什么关联呢？=。=我白痴了
335,重庆森林,3,学欧洲，王家卫
336,重庆森林,3,在压倒性的称赞声中，说我不喜欢这片子会不会冒天下之大不韪啊?呵呵，可能我比较土吧，更喜欢一些现实主义的片子，而且我对金成武没什么感觉。可能真得很经典吧，可是我不喜欢王家卫的自怨自艾，看着不耐烦，也引不起共鸣。
337,重庆森林,3,我也不知道怎N到F在才看@片子，但是@N小文的口味下真是hold不了了
338,重庆森林,3,我应该十年前看着片一定很喜欢但是现在不大喜欢这张莫名其妙的无病呻吟式的故事了。
339,重庆森林,3,如果王菲的演技可以好一点……
340,重庆森林,3,"真没觉得有啥看头！
"
341,重庆森林,3,稍微有点矫情的感觉，还是同年的东邪西毒好。金城武那段故事就那么完了阿，原来以为至少会回来收个尾巴的
342,重庆森林,3,不明白前后两个事有什么实质性的联系
343,重庆森林,3,一片钢筋混泥的森林中，孤独的人该何去何从。。。在我看透一切时再来回味吧。。。
344,重庆森林,3,不喜欢的节奏。感情，还是要学会move on啊。其实我倒是也梦想过溜进暗恋的人家里的~
345,重庆森林,3,我当时真没太看懂。。。
346,重庆森林,3,我只记得王菲那段用来学广东话来着。
347,重庆森林,3,菲姐真是傲娇 =。=
348,重庆森林,3,王家卫看多了腻味，一两部就行了
349,重庆森林,3,两年前的失恋，我哭湿了不知道多少个枕头。这次失恋后我开始跑步，真的一滴眼泪都没有流。
350,重庆森林,3,"7.5/10.
王家卫的镜头真的晃。很有那味。
林青霞不适合这造型，王菲这造型倒挺好，很有活力，演技也完全不输，她应该多拍点电影的。
梁朝伟现在还不太行，家里天天进陌生人都发现不了，后来进了警校，当了卧底就不一样了。"
351,重庆森林,3,虚无缥缈的不是爱情而是人心
352,重庆森林,3,喜欢那时候的梁朝伟和王菲，还有金城武那时候好年轻
353,重庆森林,3,看不懂看不懂看不懂
354,重庆森林,3,2012年10月28日观于宿舍。除了流泪的房子什么的就是不喜欢，镜头晃得我头疼
355,重庆森林,3,3.5 少的那半颗星就当是因为某天后好了2013.1.9
356,重庆森林,3,之前一直都是看的片段，这部被作为港片经典的电影，今天才把它完整地看了一遍。最喜欢的台词是“它还是一条感情丰富的毛巾”，最喜欢的是梁朝伟自言自语面对寂寞。青涩的金城武和梁朝伟真的太帅！王菲咋就这么好看呢，还瘦！林青霞自始至终没有摘掉过墨镜。还是不大习惯晃动过度的镜头画面。
357,重庆森林,3,王家卫最大的问题就是太装。
358,重庆森林,3,完全看不懂金城武有什么作用。。。苍天，王家卫啊。。。
359,重庆森林,3,好像看完了这个故事大家都记得金成武的凤梨罐头~
360,重庆森林,3,林青霞那段好濉Ｒ坏闶奔涿患，怎么你也瘦了。
361,重庆森林,3,我执着地喜欢喜剧。
362,重庆森林,3,Dreams怎么会被翻唱成这个样。。。。。。。。。。。
363,重庆森林,3,只喜欢王菲而已
364,重庆森林,3,overtated。。。。。or..i just don't get it...
365,重庆森林,3,哲学课 huangqihong 不太懂王家卫
366,重庆森林,3,有王菲，必须看。事实证明，她和老梁一点儿不配
367,重庆森林,3,小时候看了一遍一点感触没有，觉得很闷，然后经历过失恋才懂得
368,重庆森林,3,全片有种说不出的别扭气质，特别是王菲，别扭到家了……妈蛋，还没看过王家卫就过了看王家卫的年龄……每次听到梁朝伟的旁白就想到哥哥和黄耀明的crossover，这是为什么……
369,重庆森林,3,略有趣。ps：梁朝伟穿格子衬衫超级帅!
370,重庆森林,3,算是王家卫非常有代表性的作品了吧。看看那个时候年轻的那些脸，很感慨。
371,重庆森林,3,都市人的爱情观，失恋与再恋，不知道是什么样的感觉，应该怎样的去评价这部电影与我们的现状，一年后么。。。。
372,重庆森林,3,……我能说我看不懂吗
373,重庆森林,3,1.好抽象好抽象好抽象我看不懂看不懂看不懂！2.原来那个是林青霞！3.王菲很可爱！4.原来是两段故事……5.谁来给我写个电影领悟？？？
374,重庆森林,3,我好意食tinned波_
375,重庆森林,3,伤心人的无病呻吟和对爱的痴心妄想。
376,重庆森林,3,一曲梦中人，记忆最深的镜头居然是：屋子漏水后梁朝伟清理屋子，王菲来到，两个人一起在屋子里面睡着那一段，故事的发生不知是在现实还是在梦魇。多年后或许会无比怀恋的时刻，没有任何床上或是轻吻镜头，却感觉他们已经私定终身一样的。28岁，失恋的滋味，还是无法体会，依然看不懂王家卫。期待张嘉佳
377,重庆森林,3,色调昏暗 不知所云的feel 爱情木有保质期 很快就腐烂
378,重庆森林,3,重庆大厦 我再也不想踏进去一步...
379,重庆森林,3,#453|}中意林青霞。
380,重庆森林,1,《重庆森里》是一部制作非常精良的电影 无论剧本的情节还是演员的演技都非常棒 甚至我感觉这部电影没有所谓的配角 每个人都有出彩的地方 但是不得不说 即便这部电影再牛逼 看完了之后我感觉身体不适 脑袋疼 精致的背后我只感觉到矫情矫情还是他妈的矫情电影里的故事只会发生在电影里 一颗星
381,重庆森林,1,我想我已经厌倦了王家卫式的忧伤，说来说去，不过爱情，记不清什么时候，三个月前或者九个月？是，这个世界难以言说的愁那么多，不可斗量。可，那又有什么用呢。我更加坚信好的作品是应该能给人美的感受的，能让人勇敢的对话心灵的。那么多的伤心拥挤，谁会让你快乐一点呢。心情很美丽，悲伤勿扰。
382,重庆森林,1,王家卫牛逼。。。。94年拍出00后二逼节奏。。。笑点无数.....太喜感了...生平第一次看到如此装逼的电影。。。
383,重庆森林,2,两星全给王菲！林青霞一直没看到真面目，遗憾！那时候的梁朝伟，好年轻啊！整部片子，我只能说，太装逼了！如果没有这几个大牌明星，可以说，完完全全就是一部烂片！！！！！！
384,重庆森林,2,墨镜兄莫怪本天才品位低，不能理解你的作品，文艺片我看不懂啊，还有你的摄像师朋友的镜头感太飘逸了，我头晕！
385,重庆森林,2,鸡皮疙瘩一身差点看不下去 太毁了 王家卫装逼了 林青霞龙套了 王菲受不了 金城武太嫩了 但是梁朝伟依然帅爆了！
386,重庆森林,2,莫非是过了喜欢看王家卫的年龄，还是他的矫情已经过时了，大概王菲片中灵气的角色是电影出彩处吧，中间响起王菲翻唱卡百利（小红莓）的《梦中人》果断调到最大声，其实电影剪成四分钟给《Dreams》配MV就差不多了
387,重庆森林,2,王菲的加盟让我没勇气把这部片子看完。。。
388,重庆森林,1,讲道理并不是很懂这电影好看的点在哪里，对我而言就是长篇的碎碎念，可能是我不懂欣赏。不过还是要给金城武和王菲点赞。
389,重庆森林,2,就是因为晦涩难懂~它才是经典~
390,重庆森林,2,我对王家卫真心理解不了。。。对不起我是一个低俗的人。。。。。
391,重庆森林,2,我承认不是电影不好，是我实在欣赏不来这种艺术。。看不懂
392,重庆森林,1,不要再搞这样的桥段了，王家卫先生。。
393,重庆森林,1,不好意思，我压根没看懂- -，
394,重庆森林,2,王菲那段真是又臭又长...
395,重庆森林,2,大学电影课被讲了一大堆 为了中和高分打个二星 我真的不喜欢王家卫 真的不喜欢戛纳电影人的口味
396,重庆森林,2,依然不喜欢王家卫，边缘小资，每个人物都没有根浮在表面。
397,重庆森林,2,王菲长的像只猫 感觉电影里的人没一个正常的 除了Californiadreaming有印象 其他看的我想睡觉 一个有洁癖的女人在阴暗的角落对一个麻木的男人YY了很久・・・ 
398,重庆森林,2,不是较差，是我实在不怎么喜欢，基本上两颗星都是给台词
399,重庆森林,2,为什么一定要这么矫情呢。。。
400,重庆森林,2,不喜欢这种风格的电影啊，我不能装B
401,重庆森林,2,穷极无聊的都市男女们。百般挣扎才没有睡着…
402,重庆森林,2,看不明白的片子。。。一段段破碎的片段。。。
403,重庆森林,2,这是有重庆啊还是有森林啊…这镜头能再晃点啵…旁白能再多点啵…倒是片尾一曲梦中人让人看了快两个小时稍微好受点！
