,movie,star,comment
113,侧耳倾听,5,好吧，我给了5星。在看影片的同时，我妹妹在她BF来之前在门口摆了I 心形U 形状的蜡烛，在周围洒了玫瑰花瓣，然后这个身高185的大个哭得很娘们，然后影片结尾男生问你愿意嫁给我吗？然后尼玛不戳泪点不行啊。。
114,侧耳倾听,5,没有梦幻的童话。她走上那条窄窄的小巷，像千寻走过的那条小路一样，出口通往了全新的“世界”。这里没有忘记了名字的白龙让人为之涕涟，但却有一个开始倾听自己内心的美丽女孩。
115,侧耳倾听,5,http://www.qzvod.net/Content.asp?MovieID=7290
116,侧耳倾听,4,"齐耳短发.清纯初中.""为了让我的名字早点出现在借书卡上.我看了好多书.""只有少年的恋情才能有能力如此大量消耗时间.漫长的期待.做着所有愚蠢而没有结果的努力.为了对方不经意的一句话而改变自己整个人生.只有少男少女有资格说""一辈子"".因为..他们真的有一辈子可以消耗. 
"
117,侧耳倾听,5,"Country Road, Take me Home~"
118,侧耳倾听,5,太纯真太美好了。文艺少年的初恋，有你在，我也要加油！很羞耻的觉得现在整个人的状态和心态之于前路的迷茫，就跟这个小女生一样。。。
119,侧耳倾听,5,Tear drops in my eyes.
120,侧耳倾听,5,"County road,take me home~~~~~爱与梦想，理解还有初恋---“阿雯，我最喜欢你了”（总是在电影里才找到幸福感）"
121,侧耳倾听,5,宫崎骏的动漫电影都有各自的意义，第一遍看不出来有什么，他的电影需要慢慢品味，非常喜欢！
122,侧耳倾听,5,场景、场景中的路人都做的十分用心，像还原了儿时的点滴。故事里的大家，也是现实中的大家。人生道路上，一条条分支，大家都走散了，而故事，留给一个安慰。
123,侧耳倾听,4,亲爱的，嫁给我！看到最后的我居然哭了，美好的动画，美丽的懵懂，美丽的邂逅。如果有这样的男孩子爱我，我愿意一直等他
124,侧耳倾听,4,那曾是个柔软缓慢的年代  为了一张CD找遍全城  为了一本书询问路边所有的书店  为了查找一个资料需要在图书馆翻阅很多天  只能买到打孔的原版唱片  小众所以不被商家出售的书籍  手工填写的纸质借书卡  在日记本中摘抄的过时诗歌  手写邮寄的信笺  不冲印出来就不知道自己是否不小心闭眼的相片...
125,侧耳倾听,5,感动于为了让月岛~注意他而把名字留在很多借书卡上的天泽圣司，让我想起了《情书》里面的藤井树；感动于每十二小时才能匆匆相望一眼的时钟上的王子和公主；感动于因为战火而终身分隔两地的猫男爵和猫仕女；也感动于那只永远崇尚自由空气的肥猫moon。可惜了，近藤喜文。
126,侧耳倾听,5,80年代文艺男女的青春爱情物语。出乎意料写实，没有宫崎骏常有的海风与绿树、久石让婉转的舞曲，也没有常见的嘉年华般绚烂奇妙的大场面。只有一点小小的缘，书签，猫，座钟上矮人王子和精灵公主的童话，告白或被告白的烦恼，小提琴与写作……好些细节依旧是一下把人拽入这座发生着各种各样故事的城：跟着肥猫一路散步到隐藏的旧物店、半山坡住宅凭栏远眺、伴着Country Road沿公路骑车晚归，还有80-90年代那令人怀念的街道喧嚣、校园古朴、卧室拥挤、厨房烟火。果然与《听见涛声》对比看就会有更多感触。当然，在这里，宫崎骏式的积极与坚韧让故事饱和度更高。天泽圣司带着月岛~骑车的场景，很有些《罗马假日》的浪漫。埋着《猫的报恩》的小彩蛋，又有些调皮。
127,侧耳倾听,5,"""为了让我的名字早点出现在借书卡上，我看了好多书""。虽然结尾很破坏美感，但是这不也是水到渠成的么。Country Road原来也是一首情歌~"
128,侧耳倾听,5,也是那个年纪，也是一个做不了决定的女孩子，也是一个向往远方的男孩子，不同的只是，那个男孩子再也没有回来
129,侧耳倾听,4,"小野丽莎的《country road,take me home》，原是一首清雅的诗歌"
130,侧耳倾听,5,"★★★★☆ 很感人的校园恋爱励志动画，女生应该特爱这类动画片
"
131,侧耳倾听,5,我所做的一切，就是为了以最好的状态，和你在一起。回忆过去，这都是遥不可及又无法重来的青春啊。8.5
132,侧耳倾听,4,为了自己喜欢的人，不断努力，自己也开始慢慢了解真实的自己，还有比这个更令人开心的吗？
133,侧耳倾听,4,年少时候青涩的爱情。为了不变成你的包袱，我努力成为更好的人。只要有你在我就会努力。最后两个少年看着朝阳喷薄而出，许下诺言。很久以后我们会看清年少时的许诺大多无法实现，但是至少在那一刻，我们愿意去相信和坚守。这就够了。
134,侧耳倾听,4,穿插着country roads take me home
135,侧耳倾听,5,一开场的country road的音乐好好听！地铁、图书馆、学校天台、自行车、坡路、猫……一切我喜欢的元素都有！图书馆的故事不就是动画版情书吗？！！真好真好！（嘿嘿，NINO说过，这是他最喜欢的一部吉卜力）
136,侧耳倾听,5,漫步在云端的猫先生，和一天一次的亲吻，是我努力想跟上你步调的小小梦想。早就想好要带你这样翻山越林，就如同我早就想好在背后默默地支持你。
137,侧耳倾听,4,『u片 　缓苊饶请b肥和男爵~@是部钪酒吧 看完就很有跳到桌旁好好x的j望...
138,侧耳倾听,5,为了让我的名字早点出现在借书卡上，我看了好多书。
139,侧耳倾听,5,希望，总是悄悄的萌发，弱小，但很美。
140,侧耳倾听,5,晨曦的薄雾里，是对童年最美的回忆。我曾爱过一个男孩，一起看日出，一起梦未来。我们每个人都有一个宝石，那就是我们最真实的心，为了梦想而努力，各行各业，都不是那么简单的，要努力呀~！
141,侧耳倾听,5,第一次，2002年的时候，觉得青春如此甜蜜；第二次，2008年的时候，觉得梦想和爱是最美好的事物；这一次，看到那一句“没关系，我早就想这样带着你翻山越岭”的时候，那些关于梦想的努力、好感和欣赏等字眼喷涌而出。又是一个美好的夏天，又是一次追梦人。
142,侧耳倾听,5,一边看一边蹦出许多类似”工作・两地分居・小小年纪说什么结婚・以后肯定后悔“之类的想法・・看来我真是长大得很彻底- -
143,侧耳倾听,5,}司f，我想d著你，翻山越X。而月ut要做做支持}司的人，讨的少年r代的僬娴暮苊篮谩
144,侧耳倾听,4,青涩的恋爱 总让人想起自己的初恋，想起曾经怦然心动的他。
145,侧耳倾听,5,"重温一遍、、、竟然、他们还没上高中就求婚嘞/! 以前怎么不记得这个细节
"
146,侧耳倾听,4,很理想的恋爱模式了：因共同爱好被吸引，相知的同时更自知，然后为了彼此的未来努力变成更好的人。可惜的是看得太晚了，现在反而更容易被月岛笨拙的追逐写作梦想的片段给打动，被鼓励时的蠢蠢欲动，投入后连自己都无法纳得的受挫感，都很有实感
147,侧耳倾听,5,那种淡淡的纯纯的爱情十足的让人向往。中国和日本的国民素质差的不是一般的，人家的爱情电影是以共同努力来作为主题，中国则以找到富二代来作为
148,侧耳倾听,4,手艺人对手艺人总是分外同情，做琴的，打糖的，写字的，无一例外是体力活，还得需要技巧。月岛文章写不出来，哭着说原来光想写好是不够的啊，还要一笔一笔去写啊。日本泡沫经济时代，宫老爷子想警醒的，大抵是那些贪多图快的消费主义者吧。
149,侧耳倾听,5,很感动很感动，很喜欢很喜欢……可其实写的是初中生的故事……于是发现自己还真是没长大……20061218 http://blog.sina.com.cn/s/blog_58efee25010006ma.html
150,侧耳倾听,4,温暖清新，却又带着淡淡的忧伤，只因为一切美好终将逝去，一如童年最终会离我们而去，永远不再回来。我们只有在动画中重新回味那记忆最深处的童真。那年的夏天，那年的风，那年和你一起看过的风景，已经深深蚀刻在心底最柔软的部分，那是我一生看过的、经历过的最美好的事情，因为，身旁的你。
151,侧耳倾听,4,‘因为你，我愿意成为更好的人‘-----那时的爱情总是很美好的。
152,侧耳倾听,5,"Country roads,take me home,to the place,I belong "
153,侧耳倾听,5,"总是希望能够找到一个同样看书的男孩子，想要找到一个自己愿意追随的人，让自己更积极，更快乐的生活。
我早就想好了，我一定要载着你。
我早就想好了，我不要成为你的负担，我要在背后支持你。"
154,侧耳倾听,5,"Country road加一分, 圣司:我早就决定要这样载着你翻山越岭.阿雯:我不要变成你的包袱,我也早就想好了,要在背后支持你.对于感情空窗期的人,这个电影只能是遐想.因为我也想把名字留在借书卡上,可是现在都用条形码了."
155,侧耳倾听,4,“你以后可以做我的妻子吗？”“好的”……这么直率的感情，只发生在少年身上吧
156,侧耳倾听,4,看后发现我的《夏日图书馆物语》撞梗了。为了早点被你发现我的名字，所以我借了好多书。青春啊，就是可以这样不顾忌后果地跟你说我喜欢你，可以嫁给我么。男主把妹技能点满，女主灰色及膝水手服超可爱。最后跑到老爷爷店里快要哭出来地说“请您现在开始看好么”，被夸奖之后哭了出来也很动人。
157,侧耳倾听,5,1、能够遇见你，是我今生最美的意外；2、爱读书的孩子一定会遇到那个同样爱读书的TA；3、当你对我心动的时候，其实我也对你着迷了；4、所有的美丽邂逅其实都是刻意安排的一场舞曲，你知我知；5、要有自己的目标和梦想，并为之付出实践，前行的路上，有你做伴将是最幸福的旅途；6、故事都是你的影子。。
158,侧耳倾听,4,成长的女孩领悟到：对自己而言，故乡的风景正是自己生活的钢筋混凝土堆砌起来的城市，并决意立足于脚下的现实，鼓起勇气去积极地生活。
159,侧耳倾听,5,看着你我就会很努力，无你情况下也很努力o(￣ヘ￣o＃) 心地纯洁的小姑娘太萌人了~ “像我这样水准的到处都是”←嗯嗯，经过必要的试炼证明自己，然后才能肯定方向？必要的试炼总是和考试撞在一起啊（笑）
160,侧耳倾听,5,“因为你，我愿意成为一个更好的人，不想成为你的包袱，因此发奋努力，只是为了想要证明我足以与你相配”。少男少女都是诗啊，何必搞得两败俱伤，这样互留给念想貌似也不错。弹钢琴那段指法，活儿做得真细。
161,侧耳倾听,5,宫崎骏式的少女情怀~总有瑰丽的想象~喜欢两个人认识的过程~
162,侧耳倾听,4,有诗，有音乐，有借书卡，还有初恋～在最美好的年华里，我们都遇见了谁？
163,侧耳倾听,5,单车上，夕阳下，琴声伴我前行。更喜欢它的另一个名字：梦幻街少女。地下室伴奏的那段太有爱了，可爱的一群人；最感动的两句台词“为了让我的名字早点出现我看了好多书”，“我早就想好了这样载着你翻山越岭”
164,侧耳倾听,5,很困的看完了。关于懵懂的爱情、梦想，为了跟上他，她也拼命努力，完成了对自己的考验，也找到了前行的方向。
165,侧耳倾听,5,Country Road~Take me home~
166,侧耳倾听,5,最爱这调调。温柔收敛，干净纯洁。总也想有一个人，可以安静的注视我，拥有相近的兴趣，分担彼此曾经独有的感动，让我也那么想要努力向前去追逐他的脚步，不，那其实应该是一份想与之比肩相守的心情吧。溺毙在这样的期待中。（00:15;10/07/09）
167,侧耳倾听,5,让人感动的故事，初恋的美好跃然纸上，互相激励，实现自己的梦想。很喜欢月岛雯这个女孩子，纯粹自然不矫作。借书的桥段和《情书》很相似啊。还有猫男爵，恍惚有点儿《猫的报恩》感觉。
168,侧耳倾听,5,"好きなひとが、できました。
Country roads, take me home, to the place I belong. West Virginia, Mountain mama. Take me home, Country Roads... 
"
169,侧耳倾听,4,贯穿始终的那曲“Country Road”，在一个青涩又纯真的爱情与青春的故事间流淌，让人完全没有抵抗的理由
170,侧耳倾听,4,"宫崎骏，...................如果不是片尾的一句""你愿意嫁给我吗"" 我愿意打五星"
171,侧耳倾听,5,晨光雾气那段真是太浪漫。中学也有过一段写小说成绩下降的日子，在想象的空间和自己做着梦，较着劲。
172,侧耳倾听,5,all those  old  memories come back clearly to Me
173,侧耳倾听,5,喜欢一个人的心意 然后为他努力 为他变得优秀 希望有一天可以举案齐眉跟他看同样的风景 而他 亦愿在那里等她 等她长大 娶她 这样的感情 多好......
174,侧耳倾听,5,阳台上晾晒的白衣服随风飘动，骑着自行车缓缓地经过坡道，城市在夏天的阳光下白白地清新着。山顶有奇幻的所在，有梦想的开始，心的所往。这部动漫也许不是第一的，却带着深深的痕迹刻在了我的骨头里。走在日本的街头，寻找它，寻找这样的感觉。绿树下的影子、房间里父母姐姐的笑声。。原来我一直拥有着
175,侧耳倾听,5,滴滴坐在书桌前，小小的身影，单手托着腮好可爱。当她蹲下对着猫猫说“你也不可爱，跟我一样。”简直可爱到爆！音乐给我感觉很飘渺，又带点忧伤，带点期许，喜欢每当他们害羞时脸上会泛出的两抹红晕，喜欢滴滴和圣司在一起总是很窘的样子，喜欢滴滴乱乱的书桌，跟我的一样…
176,侧耳倾听,5,励志 但是镜头这么写实干脆做电影版啊
177,侧耳倾听,5,那么简单纯粹的少年心事，像是《情书》的平行空间，没有擦肩而过的一种可能。梦想有慈爱长辈支持，爱情有图书馆的静谧、借书卡上的狡黠，未来有繁茂中疾驰而过的单车。理想的清纯世界，全在动画中展现，让我们侧耳倾听，已被时光裹藏了的自己。
178,侧耳倾听,5,我不后悔这个时候才看到宫崎骏的这部作品。我很好，谢谢。
179,侧耳倾听,5,无话可说的美好，又并非只讲个青春故事那么简单。原声是双刃剑，有时是让人动情，有时却喧宾夺主了。
180,侧耳倾听,5,距离第一次看此片有将近6年时间了，重温依然感动 2015.9.29
181,侧耳倾听,5,这部电影告诉我们，想把妹就要成为一个有梦想的文艺青年，写代码的给我站墙角去 T-T
182,侧耳倾听,4,宫崎骏营造了这么多纯洁的梦，却没告诉我们现实有多残酷，社会有多残忍，所以我还是不喜欢他，因为再不会有这样的男孩和这样的女孩执着于这样的美丽梦境。
183,侧耳倾听,5,稀薄的晨雾里，冬日的冷空气里，坐在单车的后座，飞奔。裹着他的外套，却决心不要做他的负担。静静地一起等待日出，朝阳初升，彩霞满天。。。多熟悉而美的画面啊。。。如今我还是我。。。可是。。。
184,侧耳倾听,4,重看后觉得，这个世界还是值得活下去的。但没想到导演近藤喜文已经因为积劳成疾去世了。默默想拜托宫崎骏活一千+岁吧，想活在有他的世界里。侧耳倾听对我来说真的是相当特别。小时候看永远只记得猫男爵带飞下高高的楼梯看山坡下的风景。激动也一直是在那边。后来会激动于圣司的小提琴制作，激动于有矮人国国王和整点出现精灵的钟；再后来会激动于支持彼此梦想的爱情；再后来会激动于胖胖猫；现在激动于志同道合的琴友一起玩的聚会，距离似乎是更近了，又想起了因为有克里斯朵夫远道而来而激动得失眠然后大犯糊涂一整天都没接成人的老好人苏兹，和他的两个琴友……激动处于创作中的忘我与狂喜。我活了又活过来了
185,侧耳倾听,5,还是喜欢宫爷爷的风格啊~那首歌真的好好听~读书卡时候特有的浪漫就被科技化给剥夺了~
186,侧耳倾听,5,"thou salad days，宫老爷子担任的是脚本，分镜等制作。
算他吉卜力时期的作品吧"
187,侧耳倾听,4,:-]:-]:-]:-]:-]好早:-O
188,侧耳倾听,5,“只要有你在我就会努力”哇哦！ 日漫喜欢台版国语配音，看得轻松不失原味。
189,侧耳倾听,4,"如不是片尾的一句""你愿意嫁给我吗"" 我愿意打五星。或许还是太过年少，谈婚论嫁显得不合时宜。”因为你，我愿意成为一个更好的人，不想成为你的包袱，因此发奋努力，只是为了想要证明我足以与你相配。“喜欢男爵的爱情，喜欢钟表上永远不能相见的国王和王后。这种青涩的恋爱感觉真好，可惜我永不会有了"
190,侧耳倾听,5,"只看那一副副街景就很满足了，整个影片很轻松，
都是青葱年华的那些事"
191,侧耳倾听,5,宫崎骏早期作品 现在看稍显幼稚 不过还是很喜欢这种安静调子又不会觉得乏味的片子
192,侧耳倾听,5,曾经我还坐在你的旁边呢~我以前也设计过这样的偶遇~~
193,侧耳倾听,5,Country Road好听。喜欢男女主单纯的为了梦想而走到一起这种情节
194,侧耳倾听,5,实在是太美好太可爱太温暖了。不自察觉地微笑着看完，嘴里忍不住轻声哼唱着「Country Road」，一遍一遍，想停都停不下来。最是动人少年时，少女情怀总是诗。「因为你，我愿成为更好的人，不想成为你的包袱，所以更加努力，只是希望证明我足以与你相配。」初升的太阳一般满满正能量啊。
195,侧耳倾听,5,借书卡的幻想。直到后来进了大学，每次借书我都有看卡上之前借过的人名习惯~
196,侧耳倾听,5,十分十分喜欢这部动画，看几次都很感动。故事看似很平淡，但是很有启发性。人在不断努力的过程中遇到的困难挫折，还有爱和鼓励，友谊。我觉得这对少男少女会是幸福夫妻！
197,侧耳倾听,4,侧耳倾听、情书等告诉我们，借书卡在一段暗恋中是有多重要啊。而我们的时代又丧失了太多这样的浪漫。回头我要去CREMONA小提琴之乡去看看。
198,侧耳倾听,5,纯粹的爱恋，所以我常说18岁以前最好能找到相守一生的人。之后所遇之人不会如此纯粹了
199,侧耳倾听,5,好喜欢这里的人物设定，突然觉得跟这里的人物相比我是不是活的太刻意了，其实人生并不一定要走设定好的路才是最妥善的，美中略有不足的感觉结尾有点小幼稚
200,侧耳倾听,3,看得我有点闷.
201,侧耳倾听,3,最让我感触的一幕是下午姐姐数落小雯成绩落伍，姐妹俩争执起来。晚上临睡，姐姐说要搬出去住，让小雯加油。看到这突然有种失落感。
202,侧耳倾听,3,看这部电影的时候是我朋友下载了我跟她一起看的，然而她下载的是台湾腔的，太嗲身嗲气了看的时候看得我和朋友鸡皮疙瘩都起了，太玛丽苏了
203,侧耳倾听,3,初恋情怀，青春梦想。唯一不喜欢的是结尾。
204,侧耳倾听,3,曾经心血来潮去过学校图书馆，图书馆虽小却有智能化的电脑管理，所以我无法通过借书卡这样的媒介找寻到自己的“月岛雯”。随意挑选两本书坐下，我才发现视线所及之处都是三三两两的情侣。图书馆是静的，静的能够听到书被翻动的声音，而我的心仿佛也被翻动，侧耳倾听，整个图书馆弥漫着对单身狗的嘲笑。
205,侧耳倾听,3,7/10。飞翔魔法世界的书中梦幻部分很宫崎骏，细腻刻画青春期少女面对各种事物的心里摩擦则是高x勋的风格。平实和缓的叙事节奏有点无趣与沉闷，有意辍学去全心投入到写作而遭家人反对的成长经历，并非十分浪漫还偶尔斗嘴的初恋，在全片淡雅的气氛烘托下不禁对人生岁月的惋惜动容，可惜这不是我的人生。
206,侧耳倾听,3,如今的理想和承诺。十年之后又是什么样呢。片子若是拉长，应该就不会是个喜剧。最开始闪闪发光的东西，最后会褪色。
207,侧耳倾听,3,幼稚的年轻人啊，想要不学习而写书，无语无语。才初三啊，就决定结婚了么？为什么一点都没有说服力。= =前面有点长，看着有些累，是宫崎骏风格的传统。
208,侧耳倾听,3,近藤喜文不同于宫崎骏的天马行空，他更喜欢细细描摹平凡的生活。一部细腻的电影，以两个学生的青涩恋情为线索，却讲了一个关于对美的追求的故事。不知道《情书》和《猫的报恩》是不是受了这部电影的影响。嗯，我只想告诉你，这不仅仅是他们的故事，也是我们的。
209,侧耳倾听,3,吉卜力写实的青春题材，像《听见涛声》、《岁月的童话》，似乎都有些过于理想化，美好虽美好，却不是特别能击中我的G点，以我看来在这个年纪爱情的直接表达太多反而失真，不过图书馆、借书卡，以及为了喜欢的人而拼命努力什么的还是很有爱呀！
210,侧耳倾听,3,从来没喜欢过宫崎骏 对于这种冒失少女意外碰上旷世奇恋的偶像剧题材 除了脑袋疼之外想不出别的感觉
211,侧耳倾听,3,初恋的情怀自然是美的。只是这把年纪再看初恋的电影，能预知的情节七七八八不出左右，能吸引少妇的，是想象力。
212,侧耳倾听,3,宫崎骏的片子是一如既往的好听。听说这个小清新文艺动画，讲述的是少男情怀∑( ° △ °|||)我看完没有感触难道是因为这个？类似的电影，我看完也没什么感觉，估计是我对这种温情少女故事早就免疫了吧，不过影片中出现的五角恋让我为之一振
213,侧耳倾听,3,看着好闷啊(ˇ06ˇ)【话说回来 宫崎骏的东西给我一直是这个赶脚。。。。。
214,侧耳倾听,3,没感觉特别好，比真正的宫崎骏动画差得多。但还是很喜欢里面的场景，夏日的街角，学校的玻璃窗，一段公路。。。为什么所有的东西到了漫画里，即使再平凡普通，也都显得那么美好？
215,侧耳倾听,3,初中生的故事。雄心壮志，天高地厚。这个女主和几年前的我太像，但她的幸运让我又恨又呕。这毕竟只是一个童话。人如果上了二十岁还相信这些烂故事就没救了。
216,侧耳倾听,3,画面很喜欢。这种以寻找自己为主题的电影和书籍我看得不少，感悟不少，于是不是很有感触。那只胖猫好像我家来福哦~~~
217,侧耳倾听,3,时隔一年，才重新翻出来把它看完。终于发现，我是真的很喜欢猫咪~
218,侧耳倾听,3,音乐好听，画面唯美，只是有一个问题我一直没有想通：月岛雯给出差在图书馆的爸爸送便当，为何自己却要在外面吃啊？？？？我这是看得多认真，多认真啊！！！
219,侧耳倾听,3,开场，中学女生的家常，校园里你爱我我爱他的N角关系，这些只是寻常，图书馆借书卡联系起来的暗恋虽有怀旧和静谧，但剧本至此还未出挑。远赴意大利学做琴的少年，希望女儿努力考学但也不强求的父母――这些亮出来的生活观，对浸润科举制度至今的中国观众来说，应该还算新鲜的吧。厉害的是当少女意识到自己写作上限时的绝望，恋爱即自我成就加保守初心，故事留有余韵但观念已然完整。很多细节让人难忘，半山的小店，八卦的同学，我早就做好带你翻山越岭的准备，你却打定主意不做我的负累，宫崎骏的剧本也能写的这么甜，出乎意料。画的是一如既往的细腻，感觉画面分层极其多，主要集中在小店里那些物品上了
220,侧耳倾听,3,印象最深的是 《乡村路带我回家》浓郁的调调 记录了彼此名字的借书卡 还有猫伯爵的故事。天泽比藤井树聪明 或者说是幸运 遇到的女孩不算太后知后觉呢 所以有圆满。最近心绪不定 对吉卜力的暖调还真是不待见。不然应该多一颗星
221,侧耳倾听,3,很单纯的故事，不算出彩。日语演绎的《country road》主题曲倒是一级棒
222,侧耳倾听,3,很可爱的姑娘，看起来很舒服，不费劲儿。不过初中生就要“我爱你” “希望你能嫁给我”未免跟整个感觉不太协调。
223,侧耳倾听,3,美工实在无话可说，前段十分耐看，但中后段故事开始松散直白，近藤喜文唯一执导的作品，尚未成熟，但已有大师风范，英年早逝的确令人扼腕。
224,侧耳倾听,3,比不上宫崎骏其他作品。最让人悸动的就是那句 为了让我的名字早点出现在借书卡上，我看了好多书。
