,movie,star,comment
382,侧耳倾听,3,台湾配音相比原声跟粤语版最小清新。你才初三，等再年长些才能知道，生活可以把一切操的面目全非，所以啊，好故事有结束，不一定非要结局
383,侧耳倾听,3,3星半，故事虽然平淡，但是的确吸引了我。少男少女的忧愁和倔强让人很心酸，再次感慨，日本的男孩女孩要比中国的早熟好多，当然在这里展现的是积极的早熟。
384,侧耳倾听,3,这好像一篇初中生作文。。。失却了童话的想象力。。。嗯，是好学生作文，相当的主旋律。
385,侧耳倾听,3,如果早几年，或许会喜欢。不少女心很多年_(:з)∠)_
386,侧耳倾听,3,青春期的孩子真难整
387,侧耳倾听,3,年轻时候的故事6868
388,侧耳倾听,3,7/10。很纯情，情话说的很好听。叙事有点沉闷。看到少女的努力，更坚定的相信爱情只是一个引子，结果狠狠打脸。明明那一段可以安排在男主出国前，最后来个开放式结尾！
389,侧耳倾听,3,内男的图个啥？结尾太潦草。
390,侧耳倾听,3,也就一般，景美，男女主为梦想，爱情而迷茫和彼此追逐的设置蛮好，但对白和动画细节都充满了大众式的煽情与奇观，可能不算缺点，只是不对路吧。你愿意嫁给我吗“，虽然突兀，但符合那个年龄的设定。
391,侧耳倾听,3,想起伴着5月微热的朝阳单车上学的日子。花有重开日，人无再少年。
392,侧耳倾听,3,所以这讲的就是关于纯纯初恋的故事？
393,侧耳倾听,3,我一点儿也不怀念弱智的年少时光
394,侧耳倾听,3,原来很多爱情，就是这么简单啊~
395,侧耳倾听,3,"= =没认真的看。。。
而且，最后十分钟由于视频的关系，没有画面只有声音。OK~权当是练习日语听力了~
――2010.01"
396,侧耳倾听,3,可爱的故事，可我已经老了
397,侧耳倾听,3,《榷A》系一部平淡噶影，v述著年p人系成L道路上的彷徨和迷茫，ξ淼缆返奶角笈c追ぃ怀俚那和美好，鄣容和信任；粝氲牟恍缸非蠛π腋５讨努力。互相欣p又因命\走到一R的两人，因彼此而找到了粝氲姆较颍苦乐自己的不足而想O力s上Ψ降哪_步，榱顺槟蚺渖Ψ降娜硕努力^Y著...v甘多其ξ易约o太多共Q，可能系我仲未v^咧一切吧~
398,侧耳倾听,3,明明是个毫无新意的故事 分还这么高 不过95年的画面质量就这么好哦
399,侧耳倾听,3,就喜欢里面小提琴+伴唱那点儿，剩下的很无聊。
400,侧耳倾听,1,印象中我就没给电影打过这么低的评价，我一度怀疑这是宫崎骏编剧的嘛…只能说他身边一溜儿大下手的人都简直了各种了，不过别人的确实有看点。还是我老了，看腻了初中生的早恋了，话都没说两句呢，就要嫁了娶了。不排除初中高中生打那五星级的评价。
401,侧耳倾听,2,开头才发现是我以前看过的但是没有耐下性子看完的，看开头以为是奇幻爱情，后来才发现就是一般纯爱片，对于我来说就跟台湾脑残片没多大差别。剧情乱扯，多巧的事都凑一堆再见！
402,侧耳倾听,2,"挺失望的，并不觉诚意。
故弄玄虚下，充斥着一个男人想象出来的青春期少女春梦般的意淫，最后还有个“一不小心拖得太久，时间不够了，赶紧收尾吧”的结局。"
403,侧耳倾听,2,三俗的我鸡皮疙瘩一身，宫骑大爷编故事还不如多跟琼瑶阿姨学学，女猪还是一如既往的讨人厌啊
404,侧耳倾听,2,耳をすませば / 侧耳倾听 / 心之谷
405,侧耳倾听,2,都怪这片时间太长……弱弱的情节磨出2小时来……简直是折磨……
406,侧耳倾听,1,非常受不了这种淡淡的人生淡淡的感情，看的我蛋蛋的无趣。
407,侧耳倾听,2,是不是老了再看宫崎骏就没那么柔软的部分能被触动了。。。
408,侧耳倾听,2,"o聊啊o聊= =用mp4看是止不住的走神,我不看介是看不懂@部片子的....r(￣￣"")q "
409,侧耳倾听,2,看了前五十八分钟，很无聊
410,侧耳倾听,1,文艺爱情片...
411,侧耳倾听,2,其实最好的还是country road
412,侧耳倾听,1,这么纯洁唯美的爱情，我看了很妒忌也很气人。
413,侧耳倾听,2,老实讲，这个故事幸好是拍成动画了，如果是拍成电影，不过是一个老套的狗血纯情爱情片。实在是不喜欢这个故事，一个长相平庸，在人群里毫不起眼的小女孩怎么能得到帅气富二代的青睐呢？只能是场童话。
414,侧耳倾听,1,老了。。。欣赏不来了。。。本来还想为了那只萌肥猫以及台湾姑娘甜美的声线给四颗星的，结果被结局恶心到了。。。还我晚饭啊！！！
415,侧耳倾听,2,没有觉得这个故事很特别诶，反而觉得这样的情节发生在高中生和初中生之间太牵强附会了点
416,侧耳倾听,2,现在让我想起剧情是什么都很费劲。可以说，基调平缓却不够文艺，全片毫无情绪波澜或被打动之处，在我看过的宫崎骏片中排倒一。已经过了这种内心细腻的初恋时期，只能说白白浪费了我两个小时。
417,侧耳倾听,2,说实在的，不爱看这样的爱情片，节奏太慢了，感觉无聊，后半部分都跳着看的
418,侧耳倾听,3,"初三女生真是有闲到住，面也没见几回凭感觉就要娶要嫁啊？这种类型真的不能吸引我。并且台词好雷。。。
20200307再重新看又有不一样的感觉：走吧，别害怕，趁着下午气流乱的时候，我连星星都能摘得到。"
419,侧耳倾听,1,开头不错，从猫出现开始，急转直下一塌糊涂。
420,侧耳倾听,2,很少见的前四分三和后四分一不是一个画风的电影，看着大长段的平静而美好的年少时光，后半段的多数情节竟然显得格格不入，甚至把奠定的青葱岁月的味道全用大人话的语句一扫而空，太谢谢了。
421,侧耳倾听,2,不好意思。。。我不认真。。。真的没那么有情调
422,侧耳倾听,2,完全就是没什么营养的校园爱情故事啊，拍成真人电影评分都上不了5吧。太少女心了。
423,侧耳倾听,1,神经兮兮的少女？实在看不下去
424,侧耳倾听,2,如果这就是宫崎骏的水平，那么也许我就不可能看到后来的千与千寻了，我就不明白了，这个片是怎么得到的高分！整个电影一点都没有吸引人的情节，高潮在哪？简直是宫崎骏的败笔！
425,侧耳倾听,2,f在的不知道槭颤N@N高分，得r在勇台看片段的r候於@的世界，有吃越多成，然後在一大罐子里呆著的idea很@奇，但最後看了整片只我X得配泛芎瘢剩下的……很oM……可能是大了再回去看就]什N新r拧
426,侧耳倾听,1,年少的时候爱情都是纯真的，记得那个年纪谈恋爱的“小朋友”都会被大人或老师劝说，现在学业为重，你们长大了都会分开的，不会有结果的。
427,侧耳倾听,2,我觉得很无聊
428,侧耳倾听,2,我老了 再也看不起宫崎骏了。。。
429,侧耳倾听,1,卧槽。。。这。。。。这他妈演的是什么？！！！豆瓣这些高评分的都是些傻逼么？！好在哪儿？？！
430,侧耳倾听,2,女主统一脸。。。集集灰啊灰 决定不欣赏宫老师作品了
431,侧耳倾听,2,不喜欢
432,侧耳倾听,2,宫片名声在外，但我实在不知道这片到底让人感动什么~有种看不下去的无力感，看来这种调调实在不是我的菜！
433,侧耳倾听,2,我只是说出我的感觉和观影反馈的价值。对于一个94年的和23岁的大龄观影者的感觉的确太浅了。人不只是只有一条路可走，要找到自己的价值。不要成为别人的包袱。而是一起和自己爱的人一起奋斗！故事唯美，节奏缓慢，感情纯真。一般吧。节奏太慢了。最后10分钟才有那么一点感触。
434,侧耳倾听,2,宫崎骏，台湾腔配音，纯爱，三大死穴，一点扣一星
435,侧耳倾听,1,“有时一直想着能见到你，然而今天看到你却有点悲伤。”
436,侧耳倾听,1,艺术时空里美好的求而不得的想象。为什么还会在250里面停留这么久？为了追求艺术辍学，还有初恋
437,侧耳倾听,2,这电影看的完全不在状态…对这么缓慢的电影没有耐心…需要心静啊！
438,侧耳倾听,2,少女怀春的感情早已离我远去，没深意。
439,侧耳倾听,2,……故事无趣，节奏慢得矫情，台词矫情，日语版country road矫情，又不精致…
440,侧耳倾听,2,不说电影差 是我真不喜欢
441,侧耳倾听,2,与其说是一部电影 不如说是一部音乐剧 整部电影没有触到我的点 平淡不连贯 可能已经过了那么纯爱的年纪 可能灵魂上的契合才是两个人那么仓促决定的原因吧 “因为你 我想变得更好”最终目的是好的 但如果把一个人当作你努力的一切原因 未免太卑微了 活的像自己 纯粹又简单 才能够一直一起走下去
442,侧耳倾听,2,对于片中出现的“好朋友尴尬的三角恋”，“因为某人的名字出现在借书卡上而奋力看书”，“刚刚表明心意却面对离别”，“为了对方而努力改造自己”，“为了梦想写故事”，“一起看日出、求婚”这种二流桥段，眼泪已经没有作用了。我只对那只叫阿月的胖猫情有独钟，只有自由才是真正可贵的东西。
443,侧耳倾听,2,欣赏不来
444,侧耳倾听,1,什么破电影啊，烂烂烂烂烂，受不了啦。我TM居然看完了。这么高的豆瓣分，我还以为多好。看到100分钟还以为会有转折，从头到尾就是流水账，垃圾啊。
445,侧耳倾听,2,初中生恋爱的巅峰作之一，在我看来是《月色真美》，这电影哪里青涩啊……
446,侧耳倾听,2,彼之蜜糖，我之砒霜，没有共鸣，除了全程觉得过于理想化以外，也许也是对初中生恋爱故事的戏码不感冒吧
447,侧耳倾听,2,为什么要在最无法负责的年龄许最应该负责的承诺。
448,侧耳倾听,2,看得我有点闷，不过比起宫崎骏的其他作品强很多了，起码情节是浅显易懂的，不再故弄玄虚了。女主角月岛雯对于写作的事全都神经兮兮、紧张兮兮的，感觉很恶心。
449,侧耳倾听,2,剧情各种无法直视的少女梦啊，雷得我一脸狗血.......毕竟是95年的动画，当时觉得新鲜的情节，现在看来，只觉得老套。
450,侧耳倾听,2,也不知道为什么这部电影的评分会那么高，可能是因为顶着吉卜力工作室的光环吧。我是不怎么待见一对初中生没认识多久就要把自己许给别人这种行为的，轻诺比寡言，爱的浅一点，但爱的久一点吧！我从来不反对早恋，但是我强烈反对因为早恋荒废学业甚至放弃学业。初中生可能因为认知水平的问题，他们意识不到教育，读书对一个人的一辈子有多重要。
451,侧耳倾听,2,画的太美了！！！但是这故事能再无聊点么。。。
452,侧耳倾听,2,吉卜力的基本功真是，各N俯仰角度的走跑循h都得很。年坂垣伸只是赢呢……但故事有o聊（F在已完全不能被文W少女打恿耍，音芬彩」P，`和感很重。
453,侧耳倾听,2,怎么这部这么幼齿……老不宜……
454,侧耳倾听,2,流水账。这片子应该是拍给情窦初开的初中生看的。
455,侧耳倾听,1,哎真是要看睡着了。。用动画来演绎初中生青涩的爱情最后男主还求婚真是太尴尬了(￣￣)心目中的吉卜力不是应该充满着天马行空的想象，绚丽缤纷的色彩并瞬间把观众抽离现实的能力吗？要看早恋的故事我干嘛看动画啊-_-# 
456,侧耳倾听,2,不喜欢，可能我太浮躁了，看不了纯爱的和白痴的了，都看睡着了，拖沓，四五十分钟能完事的
457,侧耳倾听,2,过于超现实。
458,侧耳倾听,2,没趣味。的确是很纯的爱恋
459,侧耳倾听,2,人家的初中……不明显地插入爱情还是个不错的励志故事，女主反应有些过度，配音听着很舒服自然，音乐不错。
460,侧耳倾听,1,は？つまらねええええええええ！
461,侧耳倾听,2,叼毛都没长全，还想操逼
462,侧耳倾听,2,so boring
463,侧耳倾听,2,无聊
464,侧耳倾听,2,是花了多少钱买Country Road版权用得这么重复，让人讨厌
465,侧耳倾听,2,真心欣赏不来。。。。宫崎骏老爷子  不好意思了。。。。
466,侧耳倾听,1,太少女了，不适合我，而且故事太顺风顺水，太完美了，反而无趣了
467,侧耳倾听,1,没劲极了。。
468,侧耳倾听,2,很无聊
469,侧耳倾听,2,不喜欢，有点失望
470,侧耳倾听,2,= =太多了。
471,侧耳倾听,1,讲述青春期的荷尔蒙式爱情，过程中的事件比较普通，衔接有些狗血。女孩为了男孩而选择完成一部小说，这其中所表现的年少冲动，能够引起观众关于年少的回忆和共鸣，但是本片有烂片的影子。-
472,侧耳倾听,2,。。。。。。。。。。
473,侧耳倾听,1,别人的爱情故事  学校里每天都见很多 没啥意思 给这种片子评分完全看心情（结局，好好学习，一起骑车看日出 求婚）
474,侧耳倾听,2,少女怀春太做作
475,侧耳倾听,1,唉，有些电影就是要感动有些人。
476,侧耳倾听,2,按部就班的剧情发展没有任何转折，描写了一段少年励志恋歌，尽管是吉卜力最具有生活化的作品之一，对爱情的描述可谓平白惨淡，对爱情来的如此巧合及简单比某些狗血虐恋看上去还要狗血。若能讲男爵猫的小说换成主线故事以回忆插叙的形式重新出现的话，气势上要强出很多。
477,侧耳倾听,1,小女生才喜欢看的电影。
478,侧耳倾听,2,我看到了四十分钟，剧情有点拖。不太喜欢。
479,侧耳倾听,2,鬼知道这种青春期立志片为什么这么叫好……
480,侧耳倾听,2,么有看进去
481,侧耳倾听,2,风景美～
482,侧耳倾听,2,country road 歌曲的宣传片吗？高富帅的学霸励志要当小木匠，要成为意大利的顶尖高高手，妹子为了寻找未来不吃不喝也不睡搞出一部PG16版的琼瑶+玄幻小故事，老公公赠送绿柱石，获得法器宝物。不知凌晨几点少男少女利用心电感应彼此呼唤，跑到一坡顶相互许个愿。郎有情妾有意，连理夫妻结百年。WHAT  A   F*CK?
483,侧耳倾听,2,"2.5。
吉卜力出品。“初恋情怀总是诗”。但我觉得不好看，不是很喜欢。故事太单薄了，让我没有共鸣。画面很美，还意外发现了很多以前用过的空间壁纸哈哈哈哈哈。男女主的感情线也让我很迷。实在没感受到传闻中的初恋悸动（可能是因为我没初恋吧哇哇哇哇）。豆瓣8.9，不解。感觉是在青春意淫。如果是在初中，或许我会喜欢吧。That's all."
484,侧耳倾听,1,说好听是细腻，不好听就是矫情。一部普普通通的纯爱动画。
485,侧耳倾听,2,.......大家对待动漫也太宽容了
486,侧耳倾听,1,"30min：有句讲句，看了这我才明白“无奔跑不今敏”的可贵，这腿也太差劲了吧。
1h20min：这不就是玛丽苏嘛……"
487,侧耳倾听,2,多么纯美而乏味的初恋啊，宫崎老师太不严肃了！咳。。。
488,侧耳倾听,1,那么多垃圾时间，难道这就是所谓生活流？什么少女情怀，还不如金庸笔下的少女令人动容。
489,侧耳倾听,2,本来想打三星。看到豆瓣评这么高。感觉上当。评两分吧
490,侧耳倾听,2,我发现我和很多人的口味都不同，我喜欢的电影评分较低，评分高的电影我却不喜欢96我对《侧耳倾听》期望太高了，现在很失望，不喜欢06
491,侧耳倾听,2,漫长单调不出彩的故事情节，许多人物揉到2个半小时里太混乱，最多6.5分！浪得虚名
492,侧耳倾听,2,个人认为是宫崎骏比较垃圾的作品。
493,侧耳倾听,2,宫崎骏的作品就是这样，一段爱情里掺杂了猫、公爵、飞机等一系列东西之后，我就看不懂这部电影到底要表达什么了。
494,侧耳倾听,5,最爱的countryroad，为什么配上这首歌的电影我都很喜欢呢，其实呢喜欢一个人就想着为了他变更好吧
495,侧耳倾听,2,我可以说宫崎骏的电影我看不懂吗，高中的时候舍友说好看，可能因为当初高考，而她又有自己心中喜欢的人，心境一样，所以才会被打动。而我是大二结束看的，看着没什么感触，觉得挺没劲的，而且本人对动漫无感
496,侧耳倾听,2,真的是不喜欢这个故事 觉得有点莫名其妙 尤其是看到 最后 男生对女生说 可以嫁给我吗 这难道不是中学生的爱情吗 倒是觉得杉村向女生表白的部分挺有爱的
497,侧耳倾听,2,剧情其实就10分钟。p.s.我发现日本人很喜欢拿借书卡说事。
498,侧耳倾听,2,虽然基本开倍速完成观看，但还是感觉像一场漫长的凌迟。觉得是宫崎骏最差的剧本。大概我这种烂人就是无法理解爱情这种破事吧。
499,侧耳倾听,2,“我足以与你相配”的架空现实又假装真实的弱玛丽苏强少女情怀的爱情故事
500,侧耳倾听,2,这个爱情故事。是不是有点牵强。
501,侧耳倾听,2,业务大比武封闭学习期间，晚自习上到10点，结束了劳累的一天，回房和舍友漫无目的找节目时被推荐的。非常小清新，但是不喜欢这种纯治愈系动画。
502,侧耳倾听,2,好像看过的样子，猫头绅士有印象，没多大意思
503,侧耳倾听,2,真的get不到哪里好看。。
504,侧耳倾听,2,真的真的很不喜欢伯爵的出现和他的故事，这部影片的开头和结尾都太美好了，country road是首特别有情节的歌，适合远望过去的夏天，真的以为有多美好，也madamadadane
505,侧耳倾听,2,"我怎么觉得不怎么好看。没什么意思。小朋友之间的喜欢，但是没有什么重点。
2020.2.10 南沙 电视"
506,侧耳倾听,2,年纪大了果然看不进去 PS大学毕业时有人说女主和我很像。。。。所以才会去看
507,侧耳倾听,2,蠢死了，真的！
508,侧耳倾听,2,什么啦，好无聊的情节，中二病少女心为赋新词强说愁莫名其妙的哭泣和热血什么的，今年的观影让我对第三个导演由脑残粉转黑啊
509,侧耳倾听,2,通过借书卡注意到对方是不错的idea，可惜中间处理的既拖沓又失真，或许就是想通过失真来表现少女情怀？
510,侧耳倾听,2,快进着看的，报着欣赏佳片的心情。结果被结尾两个小孩互相表白到男孩要小女生（有十岁吗？）嫁给他的时候，恶心到了。能不能不要这么俗套！
511,侧耳倾听,2,拉倒吧，喜欢这种片子的男的肯定是长不大的孩子，跟他在一起就等着喝西北风吧
512,侧耳倾听,1,2个大红脸蛋子。。。
513,侧耳倾听,2,看了几部宫崎骏的动画越来越觉得高分作品不一定是自己的菜了。如果我没看错的话…这是一个初中生早恋的故事吧…虽说早恋已是见怪不怪了，但是还是有点不符合我这种老叔叔的爱情观…尽管通过借书卡表达情愫这种做法有些浪漫，但是毕竟主旨还是早恋…最后还问阿雯愿不愿意嫁给他？这究竟是浪漫还是莫名其妙？？
514,侧耳倾听,2,实在是忍不住想吐吐槽...男主角要去意大利学做小提琴，女猪脚就说自己也要好好加油，于是开始不眠不休的要写本小说，姐姐真心年纪大鸟实在是么有看出来这有个啥联系@-@ 男猪脚带着女猪脚去山顶看日出问女猪脚是否愿意嫁给他，尼玛~才初中生小日本也太早熟了吧，女猪脚说愿意片子居然就这么结束了我去..
515,侧耳倾听,2,强忍着睡意，几次都几乎睡着了过去。。。要么刺激，要么安慰，这部电影不知所云，节奏貌似走的安慰的路线，但是既不美，也不暖，有些造作。。。
516,侧耳倾听,2,充满想象力却又温暖而平和。但是女主这个人设真的一言难尽……咋咋呼呼的暴脾气真是喜欢不来
517,侧耳倾听,2,剧情平淡，那个挂钟的设计很不错。就是感觉很无聊，看不下去。看了50分钟。
518,侧耳倾听,2,不喜欢日本动画
519,侧耳倾听,2,没看懂，一会儿讲以前的，一会儿讲现在，可就是不知道男主女主在一起了没
520,侧耳倾听,2,无聊透顶
521,侧耳倾听,1,故事里是几角恋来着？忘了。
522,侧耳倾听,1,什么JB玩意。纯爱，少女情节真的受不了。
523,侧耳倾听,2,不好看，我没耐性了
524,侧耳倾听,2,不知不觉捏碎了三包干脆面……欺骗感情的肥猫太可怕了……小小年纪想什么早恋还谈婚论嫁了再见……感觉被豆瓣欺骗了……
525,侧耳倾听,2,两颗星，真的不能再多了…… 不管剧情如何如何、音效如何如何，脸盲这个问题实在太严重，太不能忍受！好几次，我真的都没认出人物和人物之间的差别…… 再加上网路版本是中文配音，真的配得好差，情绪和情节都没对上… … 不忍吐槽了… … 可能会想再给它一次机会再看一次，但真的是我看过宫崎骏最差的动画了… … 伤心92
526,侧耳倾听,1,拖沓无趣
527,侧耳倾听,2,这种纯爱真没必要这么高的分数
528,侧耳倾听,1,这个。。算是黑历史了吗 为什么有这么高的分 理解不能
529,侧耳倾听,2,也。。。太难看了吧，就是爱情电影嘛。女主简直莫名其妙，一开始对着男主大呼小叫的，后面写作写不出又哭的矫揉造作。只能说她爸妈真是好，好开明。完全不懂猫公爵是个啥设定，花里胡哨的加上魔幻背景。
530,侧耳倾听,2,又是第二次发起挑战的片子。这部动漫可能会成为某些人心底的一部分，很遗憾我没有这个荣幸。
531,侧耳倾听,2,看得我尴尬症都犯了，奇怪的女生说哭就哭说笑就笑，一会踌躇满志，一会颓废消极，真的是令我有点作呕，然后后面男女主的结尾，请问这是爱情吗。。。难道不是过家家吗。。。。。
532,侧耳倾听,2,@故事...太^r了吧 童只是童 最後十分的告白直是大」P
533,侧耳倾听,1,表示自己太笨了，怪不得那么多人看不起我，我答应自己要做一个有志气的人，不能总是吊儿郎当，要经常提醒自己实现心中的梦想。批评自己的时候语气也要较委婉，不要自己看不起自己，要以商量的态度劝自己走上正途。我最大的对手就是我自己了。希望往后能愉快地劳动。愿平安和健康永远伴随我的生命长流。
534,侧耳倾听,2,如果不是动画我就打一颗星。。
535,侧耳倾听,2,看了三遍，遍遍都觉得难看
536,侧耳倾听,2,没有青春的人啊，看不懂这些青涩的爱情，感觉很平淡，没有共鸣
537,侧耳倾听,2,一样的俗套，不过国语版翻译的挺好听的
538,侧耳倾听,1,没看电影，一眼都没看，但是我看了评论
539,侧耳倾听,2,无聊啊。。
540,侧耳倾听,2,说实话，个人觉得这部真的是宫崎骏动漫作品里不太出彩的了。本来一直讲到的男爵的女伴最终会被男女主角找回，爷爷也如愿见到当年的相约的女买家，可是，并！没！有！就在圣司求婚小萝莉后剧终鸟，养猴我顿悟了，这就是一个小纯爱电影啊~
541,侧耳倾听,2,呵呵 少男少女的纯爱片 不是我的菜
542,侧耳倾听,2,看了那么多部宫崎骏的动画，这一部是最不喜欢的。剧情太平淡了，也没有新意，男女主人公就好像天注定要在一起似的，不喜欢这样的设定。而且只是一个初中生和一个高中生而已，居然在结尾开始谈婚论嫁，好像真的会天长地久似的。。。总之不喜欢。
543,侧耳倾听,2,哎，十七八岁看这部已然太老，十二三岁的小朋友看看还差不多。
544,侧耳倾听,2,问题还没有答案，青春也尚未远去，似曾相识的诱惑总是相继出现在每一个深夜或者黄昏啊。情感线强行降格意义内涵，し少年时代是同一题材的佼佼者了。
545,侧耳倾听,1,不好看 浪费时间 
546,侧耳倾听,2,啥玩意就这么高的分数
547,侧耳倾听,2,日式少女纯情
548,侧耳倾听,2,没意思
549,侧耳倾听,2,剧情有点拖，中间有点乏力，为什么初中都可以这样，借书卡都能出爱情。要么现实要么魔幻，不伦不类
550,侧耳倾听,2,觉得月岛好婊啊，尤其是跟夕子相处的时候。整个剧情都太假了，假假假
551,侧耳倾听,2,这个主题曲一再响起，不停地提醒我们：恋爱很美好，生活很有意义。
552,侧耳倾听,2,除了猫姐姐老人奔跑下降的楼梯，对女主无感
553,侧耳倾听,2,看得我蛋疼~
554,侧耳倾听,2,只能说不是很适合我看。
555,侧耳倾听,2,合奏乐器那一段太棒。看完这部才知道，宫崎骏的片也有没那么好看的……
556,侧耳倾听,2,为了让我的名字早点出现在借书卡上，我读了好多书。
557,侧耳倾听,2,【张烤鸭楼上私人影院+老郭】2.5。好看吗？？请问好看在哪里呢？
558,侧耳倾听,2,这个不是很好。。。不如标准的宫崎骏好
559,侧耳倾听,2,还不如哈尔的移动城堡让人怦然心动……
560,侧耳倾听,2,太中二了，竟然能排在前250.
561,侧耳倾听,2,细致到一定程度就会变成嗦，很多没用的对白，没必要的情节。两星给画面。大概是只适合十几岁少女看的剧情吧。
