,movie,star,comment
0,侧耳倾听,4,"...................如果不是片尾的一句""你愿意嫁给我吗"" 我愿意打五星"
1,侧耳倾听,4,美则美矣 但是看着两个初中生这样子的深情 最后还说出你将来嫁给我这种话 还是觉得有点怪怪的 
2,侧耳倾听,5,原来图书卡寻人是这里来的呀。他们的城市是立体的，真漂亮，恋爱要翻山越岭才行。电影几乎集结了所有少女时代的美好回忆，完美、理想到失真，像一个斑斓的气泡，害怕一伸手就会破碎… 乱糟糟的书桌，伸手摸来摸去就是摸不到台灯开关，生活中的细节被它完整地还原，似曾相识，却不属于我…
3,侧耳倾听,5,喜g《艋媒稚倥》的男孩值得付K生。
4,侧耳倾听,4,我喜欢男爵的爱情，喜欢钟表上永远不能相见的国王和王后。
5,侧耳倾听,5,这是一个我早已错过的故事，我没有在十五岁看到它，我早已进入了不用借书卡的年代。现实中，只有我一个人与图书馆天荒地老。即便如此，我还是感谢它赐予我的全部勇气。|一五年夏去了多摩市。走在コンクリ`トロ`ド上，山雨欲来，穿过长长长长的A段，从来没有觉得他们如此真实过。
6,侧耳倾听,5,我爱死青涩的恋爱的感觉了~~~~~
7,侧耳倾听,4,最动人的一幕出现在爷爷拿着月岛刚完成的稚嫩的小说，对她说：太棒了，真是太棒了。在才华刚刚起步的日子里，有一个人能完全诚挚地赞美，比什么都好，它不会令人骄傲，相反会让人更看清自己。
8,侧耳倾听,5,近藤喜文的初啼与绝唱。像我这样的水准到处都是，这句台词当时是不是很流行呢。是否对《情书》有过影响呢。Country Road。
9,侧耳倾听,5,本人最喜欢的宫崎动画
10,侧耳倾听,5,情窦初开的感脚，学生情怀的感脚，都异常生动。月岛雯的性格许多地方就像小白一样，我太喜欢了。肥猫很酷。配乐很好。
11,侧耳倾听,4,我我...我，被两人青涩的爱情感动啦...在自己的生命里，会有那么一个激励自己想要走得快一点的人，为了能够赶上去，牵住他的手，不成为他的累赘，在背后支持着他，与他相爱，与她携手到老，实在是太美好了。
12,侧耳倾听,5,阿雯：我还是下来吧  圣司：我没问题...我早就决定...要这样载着你翻山越岭...   阿雯：我不要变成你的包袱...我也早就想好了，要在背后支持你...  圣司：知道了，拜托你了――哥觉得这就是伟大的爱情！
13,侧耳倾听,4, 细腻可爱的初恋故事如同少女写下的日记一般娓娓道来。侧耳倾听吧，那些呼唤着成长的微弱声音。
14,侧耳倾听,5,青涩的感觉，美好的青春
15,侧耳倾听,4,多么美好啊，他们那边也并不是特别注重学业，可以发展自己的空间和喜好，不像我们都被荼毒 了，结尾有点仓促
16,侧耳倾听,5,看的是英文配音版。如果年轻个10岁看到这片我一定爱得痛不欲生。勾起无数回忆的90年代，初恋情怀总是诗。
17,侧耳倾听,4,"我们终于来到以前憧憬的年纪，却发现已经有人订婚、有人结婚、有人出国、有人生活顺利、有人坚持梦想、有人碌碌无为..就像是一个分水岭，毕业时的那个蓝天早已消失不见，那个和你在操场边说着要一起走到未来的人，也早就不知道去了哪里。看着窗外的天，突然就黑了，感觉像我们的青春，突然就没了。

"
18,侧耳倾听,4,"侧耳倾听,怀念借书卡
"
19,侧耳倾听,5,太清新美好啦！所有只顾埋头苦读却不晓得勾三搭四的的中学时代实在是太傻缺了~~要是结尾那句“你愿意嫁给我嘛”换成《穿越时空的少女》那句“我在未来等你。。”就完美了。。。。
20,侧耳倾听,4,我早就决定，要这样载着你……翻山越岭。我不要变成你的包袱，我也早就想好了，要在背后支持你―――《侧耳倾听》 
21,侧耳倾听,5,当代文学青年，为了让喜欢的人看到自己，会标记很多很多的书影音条目。我们也要一起让自己成为更优秀的人呀。
22,侧耳倾听,4,如果初恋肤浅 怎么我会兴奋狂热  什么都想 什么都怯
23,侧耳倾听,5,与其说这部动画很大程度上反映了我的爱情观，不如说这部电影影响了我的爱情观
24,侧耳倾听,5,年代感超 超 故事平淡但 人物的小心思循序uMC具f服力 更重要的是在Φrg看到@部作品以至於φ人生a生了重要的影 m崎E再也不可能σ人@栏 出不了第二近藤喜文 也不有接班人 Sr拿出斫o少女心a血之作 重]一f遍也不嫌多
25,侧耳倾听,5,.暖暖的电影.很喜欢的.
26,侧耳倾听,4,安静的夏日，街角的铃声
27,侧耳倾听,4,"美丽的是梦想的破灭
侧耳倾听的OST也值得收藏
现在似乎有些被画面向给宠坏了
对了，陶瓷猫出现了――猫的恩返也有照应。"
28,侧耳倾听,5,我想给你写评论了，真想给你写评论呀。短短的附注栏说不出我对你的喜爱。这故事是我也是每一个人。真好。
29,侧耳倾听,4,看了很多遍的动画。也许是年纪大了，很喜欢那样的纯粹、青涩、美好。现实有一点跟女主一样，没有目标不知道未来要做什么。恩，要给自己定一个目标，然后努力完成它。
30,侧耳倾听,4,那只叫阿月的胖猫酷死了。
31,侧耳倾听,5,20170219二刷。很多吉卜力的梗，猫男爵和moon，美轮美奂的钟叫porco rosso，精准的技术细节（连揉弦都做出来了实在厉害，真人演员有时都做不到）配上这个唤起人最美好与忧伤回忆的故事，几乎想不出该用什么词汇来赞美。不由自主的倾慕，相互扶持鼓励的情感，太令人艳羡了。
32,侧耳倾听,4,为了能让你在借书卡上看到我的名字，我读了好多书。这部影片可以说是一个比较励志的故事，男主为了自己的梦想一直努力着，而女主被男主影响，也努力去尝试自己想做的，恋爱最好的结果大概就是让彼此都变得更优秀。
33,侧耳倾听,4,一段很成熟的初中生恋爱，美好的是日本的孩子那种可以自由选择进路并为之努力的状态。如果说这段青涩的爱情是建立在这样的基础上的话，那么最后求婚又何妨？远比现在某些大学生恋爱靠谱的多。
34,侧耳倾听,4,最美好的事情莫过于你喜欢的人，恰好也喜欢你。
35,侧耳倾听,5,今年看过最感动的爱情片。对不起，我归类为爱情片了。尽管主人公才初三，却已经对感情有着成熟的态度，又不失追求的勇气和执着。/我早就想好了，要这样带着你，翻山越岭。/我也早就想好了，绝不要成为你的负担。
36,侧耳倾听,4,"""I read all kinds of books so my name would be on the cards before yours."""
37,侧耳倾听,5,很温暖的一个青春爱情故事。早恋未必是坏事，好的爱情是会让自己变的越来越好的！
38,侧耳倾听,4,近藤喜文的绝唱，有人认为本故事绝不仅仅是讲述男女谈恋爱而已，它更加突出的是人物奋发向前的动力。可惜近藤早逝，不然他也许能够成为宫崎骏和高x勋的接班人。片中的部分画面来自于《依巴拉度》，主题曲翻唱自美国民谣《乡村路》。
39,侧耳倾听,5,无论多少遍也看不厌倦，真正经典。片中处处是让人会心的生活细节，真实又温暖；时代感的诗意，让人看到时光，在别人的故事里发现自己。尤其注意片尾出字幕时的场景，有彩蛋，更有升华的意境。
40,侧耳倾听,5,最喜欢的宫崎骏作品，不知道为什么，也许是故事发生在夏天，又有古董店和小提琴吧
41,侧耳倾听,4,好喜欢那个钟表上国王和王后的故事啊，带着一种淡淡的忧伤，猫咪男爵也很帅。整部电影里最喜欢的配乐是男女主唱歌那段。
42,侧耳倾听,4,近藤喜文唯一的监督作品……高中校园情节剧（好多桥段，借书卡真是直追[情书]……），典型的现实主义作品……写作和现实转换那段很精彩。
43,侧耳倾听,5,我槟憧捱^多少次，在漫o止境的青q月Y，自慕卡上邂逅暗倜字起。我散M十六q所有懵懂天真，那N用力追s你的背影，s在o岛夜被I水沾醒，原戆V到M^便是茶靡。那雨後天庭的t心跳伴著小提琴上克雷莫{的N留在Le，可你回首f我早已Q定，你翻山越X。Io每段，少年偾椤
44,侧耳倾听,5,太纯美了，《country road》轻快愉悦的旋律，听得耳朵都竖起来了，又见排在纯爱系妙招前列的借书卡一招，果然很灵，有志向的男孩，因其变得更加努力的女孩，奇幻的想象，老爷爷的经历和古董店，一切都炒鸡美好，日出一段太有爱，看完不禁觉得能遇到一个让自己变得更好又情投意合滴人是何其有幸啊！
45,侧耳倾听,4,那个……我想说：自行车后座载人是违反交通规则的！野崎君有话要说！文艺少女心甚好，不过就全片的结构来说，这其实是个模范家庭亲子剧。有好多可以消化当人生指南的地方，比如在喜欢的人面前自卑怎么办，如何平衡追求理想与现实……原来《猫的报恩》的原作是月岛啊~
46,侧耳倾听,5,男女主角之间那种单纯的爱情让人向往，虽然二人相处的时间并不长久，但是还是觉得超级甜。
47,侧耳倾听,4,"【人为什么会变呢？以前的我明明很乖，而且很温柔的。最近我老是心神不宁，也不像以前那么起劲，心里总有个声音老是在对我说“事情才没那么简单”变得一点都不可爱了。】直击内心 ps：虽然结尾减分了，可精致的画风以及男爵钟表里的国王王后总是处于[不屑](￣_,￣ )人类状态的肥猫怎么能不爱呢？"
48,侧耳倾听,4,自行车，图书馆，借书卡，教学楼屋顶，学后补习班，棒球，水手服，东京郊区的小陡坡，暖暖夕阳。日版的乡间民谣country road。和反复运用斑驳树影投射在男女主角羞红的脸颊上的纯爱。青春校园的怀旧元素几乎都齐备了。少女少男中学时代的青葱岁月哦。好美。
49,侧耳倾听,5,因为我太喜欢这部电影了，所以我都不知道怎么来短评一下，正合适我的年龄，总是迷茫，梦想与未来的选择，那种感同身受，淡淡爱情，清新唯美
50,侧耳倾听,5,宫崎骏的故事里都有好多精致的小物件啊，比如那个王子公主相遇的钟，猫的报恩里的男爵还提前出现了。东方特有的少男少女情怀真美好。
51,侧耳倾听,4,虽然最后大概不会结婚，但是故事停在这里，还是感受到了少年人的振奋。就好像中间浅尝辄止地谈到要循规蹈矩还是一步登天地追求梦想，即使很突兀，也会被想要好好教育年轻人的善意打动。不过，最感人的大概还是无数次站在高处凝望城市的景象吧……年少时对未来的憧憬，也都写在晨曦和星辉之中了。
52,侧耳倾听,5,年少的时候总会单纯地为某个人某件事成为更好的自己，初心未忘，我也希望不再年少却依旧童心的我在未来的日子里能成为最好的我。
53,侧耳倾听,5,十颗星。充满爱的世界，是如此动人啊
54,侧耳倾听,5,小时候看的忘记了重看一遍还是觉得好好看，哭竟然是在老爷爷们，圣司伴奏，霞唱country road最温馨的时候
55,侧耳倾听,4,少年的青春、梦想和奋斗，让人愿意把他们的承诺作永恒。侧耳倾听思绪流转，十年后的他们会怎样，十年前的我们曾如何…ps：又想重温一遍彼男彼女的故事了呢！！
56,侧耳倾听,4,这种能在对的时间遇到对的人再和他一起携手努力走向未来的感觉真是太美好了呀，初恋情怀总是诗~可是孩子们呀，人的一生那么长那么长，时间这磨人的利器会把人吞噬的连渣都不剩，但愿你们还能不忘初心，记得最初的诺言。
57,侧耳倾听,5,印象：少女的情愫。青春期的不安，微妙的少女情怀，对未来的期待与迷茫，贴近生活的朴素魅力，悄悄地动人心弦，从而引发观众的共鸣。
58,侧耳倾听,5,非常喜欢，我心目中爱情的样子
59,侧耳倾听,4,"近藤喜文唯一监督作品,宫崎骏脚本,温馨质朴的日式纯爱动画。1.最爱的[Country Road]及其变奏贯穿始终。2.乐器重奏,指法与口型吻合得丝毫不差。3.因借书卡而起的暗恋情缘,想及[情书]。4.""我才不要变成你的包袱,我只想在背后支持你""。5.细腻真实的细节还原,睡前无法摸到杂乱书桌上的台灯+1。（8.5/10）"
60,侧耳倾听,5,"看着画面里的日本夏日街景，怎么那么干净、舒服呢？而少男少女之间纯纯的爱又如此清新与纯美！特别怀念以前借书的日子，座位旁边某个认真读书的男生兼具帅气的外表......《Take me home,Country roads》的歌声又在耳边回响。片尾那一句""你愿意嫁给我吗""最动听！《猫的报恩》里的猫伯爵也出镜了。"
61,侧耳倾听,4,涩涩的青春，涩涩的爱恋，涩涩的回味
62,侧耳倾听,4,开头的乃Olivia Newton John版的Take me home country roads。经典呐，可惜的是近藤喜文挂了~
63,侧耳倾听,5,大步踏在乡间路上/不可猜的心情/反复质疑着自己是不是够努力/茫茫的人海/男孩你是否明白/喜欢你/是人生的第一次依赖/快乐纯粹得简直让人要拍起手来/渐次埋葬了青春的校园/明媚而忧伤的太阳/在下定决心要拒绝平庸之前/可不可以给我一点力量/可不可以不要那么快离开/可不可以让我相信你的诺言 会实现
64,侧耳倾听,4,淡淡却温馨的片子。感觉自己距离那种生活已经那么遥远或者说从未到达过。《情书》里也是图书馆的那些懵懂与爱恋。我看这片的时候精神不知道为什么不能集中。
65,侧耳倾听,4,萌点好多大胖猫狮子抱枕男爵的眼睛小店楼梯对出去的那片美景。还有我看的配音版阿雯的声音。还有像真的一样的紫色日出。就是结尾太他吗狗血了还是初中生哎！！！
66,侧耳倾听,4,在少年眼中，方圆三公里便宛如未知世界，而成年人就算几十公里也不会注意那些风景。不只有懵懂爱情，还有对未来的憧憬，自己的人生自己争取，不同于宫崎骏那样的真善美，这部更接近成人，都是些现实的话题。★★★★/8.5
67,侧耳倾听,4,宫崎骏编剧的作品，是吉卜力工作室很少有的非宫崎骏和高x勋监督的作品。担任监督的近藤喜文是宫崎骏的得意门生，让他出面显然有历练新人的意思。但是，对这部影片起决定性作用的仍然是宫崎骏，近藤喜文甚至连分镜头本都没有绘制。这一部动画和宫崎骏自己导演的那些奇幻风格的不同，朴实但感情细腻
68,侧耳倾听,5,完整看完《穿越时空的少女》哭完之后不是先想到那本小说《时光机》，而是想到《侧耳倾听》。这周老师动画史讲日本动画史，她说宫崎骏的爱情观是苦行僧似的，只是从《魔女宅即便》里面有转变。。侧耳聆听哪里苦行僧啊！就是满满的爱好不好啊！有爱当然要说出来啊！> < 搞得我好激动，好想再看一回。
69,侧耳倾听,5,宫崎骏的东西各个都是一幅画，只有心中有爱的人才能看懂。即使明明知道是理想化的，童话化的故事，仍就让人期待发展直到结局。我们也从来不会在他的电影中感到对美好和理想的纯洁的作腻。宫崎骏就是这样的创造着不朽的美，没有人会因为他的幼稚和浮想联翩而厌恶他的作品。因为那里是我们每个人的港湾。
70,侧耳倾听,4,重看一遍，作为吉卜力的剧场版正片，制作精度自然是非常高的，整个故事走向也就那种温馨小品的味道，这么一来很多设定则无法免俗，故事也就略显单薄与稚嫩了。当然什么弄到一定水准都是不能说差的，值得一看。
71,侧耳倾听,4,看完影片，最大的感慨是：中学生谈恋爱完全可以互相鼓励、共同进步嘛。如果18年前看的此片，当年害羞并且正确观强大的我是否会因此改写人生？――早恋，更好地成长。
72,侧耳倾听,5,说来很奇怪，在宫崎骏和吉卜力工作室所有享誉世界的动画之中，我最喜欢的反而是这部并不十分有名的作品。可能只因为这部动画里那个干净、唯美又有些奇幻的世界，让我在现实的尘嚣中沾染了一丝纯净。
73,侧耳倾听,5,"カントリ`99ロ`ド　この道ずっと行けば 
あの街にAいてる荬する　カントリ`99ロ`ド 
真是一部澄澈心灵，让人回忆起美好学生时代爱情的好动画。
近藤导演为什么你只导了这一部作品就走了呢。。。"
74,侧耳倾听,5,终于把nino最喜欢的宫崎骏的动画看完了，果然是“青春里美好的事物这里都有”的感觉。“我早就决定要这样载着你翻山越岭。”“我也早就决定要这样在背后一直支持着你。”曾经也有像月岛一样为了谁努力过，不过童话终究是童话，现实不会像童话一样完美的。
75,侧耳倾听,4,很美好的初 伴S著那首典的take me home country road  最喜g的一幕是男主角拉著小提琴 阿雯在唱 然後和他的酚岩黄鸺尤氚樽嗟鼍
76,侧耳倾听,5,为数不多的将爱情的片子。却也描绘的与众不同。不是单纯的情爱，而是两个年轻人，怀揣着梦想，彼此鼓励，奋进。不是谁牵绊了谁，而是彼此扶持。有梦想，有生活。结尾处，男生说要女生嫁给他，虽然那是很远以后的事，但是我想，那是他们应得的。
77,侧耳倾听,5,"COUNTRY ROAD,ON MY WAY,COUNTRY ROAD,,,,"
78,侧耳倾听,4,青春啊，年少时光。
79,侧耳倾听,4,这是我小学接触千与千寻来的第二部这种类型的动画，还是那种感觉，清新，明快，虽然一切都是日本的北京，声音和文化，但是总有一种久违的小时候的感觉。好喜欢那只胖胖的猫猫，大爱呢！还有英俊的男爵，还有经典的图书馆恋情，最温馨的画面是男主角凌晨独自站在女生楼下心里默念她的名字，然后女的真的
80,侧耳倾听,4,龙猫般散淡的情节，现实城市题材，懵懂倔强又勤奋善良的女主人公。无论画面还是情感，近藤喜文都是最得宫崎骏精要的一个，可惜英年早逝。角色们常常突然满脸羞红，细腻心思遮遮掩掩，实在可爱得不行。宫崎依旧对宝物和天空充满迷恋，复现country road有点俗，但煽情恰到好处。
81,侧耳倾听,4,从故事到画面都很唯美。结尾之前都能让我回忆起那段纯真的中学时代，率真粗犷，就像未经打磨的宝石。
82,侧耳倾听,4,动听的音乐，清新的画风，纯纯的爱恋。很简单很动人。让我怀念起大学的图书馆时光了…>< 喜欢那个时钟，真是太精致了~~ 缺憾是结尾过于仓促，求婚什么的感觉怪怪的。。。四星半。
83,侧耳倾听,5,宫老爷子大弟子近藤喜文的作品。可惜近藤英年早逝，不然宫老爷子的衣钵绝对是他继承。宫崎吾朗只能眼巴巴看着。
84,侧耳倾听,4,@就叫SOUL MATE啊
85,侧耳倾听,5,"耳边一直回荡的 都是【COUNTRY ROAD】
啊霞和长泽 都是有梦想的人 我也是
我一定要努力成为一个真正的设计师"
86,侧耳倾听,5,"　Kon-Chan， 
　　奔向那蓝色的大海， 
　　奔向那晴朗的天空， 
　　轻轻地融入光线，微风，树木，流水和大地， 
　　安息吧。 
　　我永远不会忘记你。 
"
87,侧耳倾听,4,"动画整体暖暖的....不过剧情的发展相当幽长诡异,结尾很劲爆感觉男主角瞬间被雷劈了....ps,猫的报恩莫非是这个动画的番外篇?!!?!?"
88,侧耳倾听,4,f吉卜力某段r期原磉真是不嗟卦谘u造情赢炮。初三的少年的艋寐贸蹋f在的其是更加有感X一c。
89,侧耳倾听,5,梦想离现实有多遥远？如果你真正去走过那一段路你就会知道，梦想如果只是设想那么它也永远只是梦想，但是将梦想和现实拉近距离的话，终有一天，梦想将会是你的现实。美好的未来未必遥远，只是要经过一番打磨才能看到如日出般的光芒……
90,侧耳倾听,4,街景画得真美啊，还有那只猫咪。
91,侧耳倾听,5,看这部片子的时候我脑子里就一直迸着这样一句话：看好的片子就如饮美酒。呵呵，就算我目前没有喝过算得上美酒的酒，但我也完全能体会发明这句形容的人的心情。因为那是一种满心陶醉的心情。他们拉琴唱歌那段感动的我想哭，当然电影中有太多让人怀念羡慕心动的地方了
92,侧耳倾听,5,“为了让我的名字早点出现在借书卡上，我看了好多书......”情窦初开的少男少女如此纯真美好。而对理想的执着，无非于胆大一试，失败后看清更需要的东西。
93,侧耳倾听,4,“我想好了要带你翻山越岭，我也想好了不成为你的包袱”。先看到这句评论的。结果在片尾看到的时候，泪如雨下。早已不是孩子的年龄。我的前途和梦想，实在虚度年华还是在实现中？
94,侧耳倾听,4,被改编成日文的country road歌词也写得很赞，完全现实的故事被宫崎骏拍出来感觉也充满童话色彩，很美好，很青春。
95,侧耳倾听,5,720P真好。credit里夕子那对都搞掂。核弹级闪光弹，真系闪到阿妈都五认得。
96,侧耳倾听,4,有没有这么一个人在寒冬的晨曦下 ，在太阳初醒的见证下，在美好的少女情怀中，对你许下未来的承诺：你能嫁给我吗？想到和莫文蔚一样，与初恋男友走进婚姻，他们或许也有过这样的承诺吧。
97,侧耳倾听,5,煮饭时候看的，看到目前为止最喜欢的一部～演奏的时候那种气氛真的会感染到观众啊，直接拿着菜刀燃了噗噗噗
98,侧耳倾听,4,初中简简单单的感情 又有什么都敢想都要做的冲动 把握得很好 好怀念那样的感觉
99,侧耳倾听,4,很纯洁的初恋故事，影片的色彩和构图无以伦比，处处又让我想画水彩的冲动。只是后半段略入俗套，有点意犹未尽。
100,侧耳倾听,4,看惯了宫崎骏的飞机大炮和庞大怪兽，这一部清新又青涩的爱情片看起来格外亲切。Country Road始终贯穿全局，青涩的情感瞬间带我到很久以前的心绪。那个时候我们还不知道未来在什么地方。我们慌忙的追寻，朦胧的方向。结尾有些仓促。青春兵荒马乱，他们最终不知会否潦草离散。
101,侧耳倾听,5,细腻的小提琴。情窦初开的感脚，学生情怀的感脚，都异常生动。月岛雯的性格许多地方就像小白一样，我太喜欢了。肥猫很酷。配乐很好。
102,侧耳倾听,5,我早就决定，为了你翻山越岭~我也早就想好了，在背后支持你~~PS：缅怀那些蓝天白云，听着乡村路的日子~~
103,侧耳倾听,5,好大决心才重温这部动画片，唯美的爱情。是那首country road，想象自己如果在春天的时候离开北京，奔赴长沙，在那样一个举目无亲，人生地不熟的地方，只有茵一个人才是最熟也是最亲的人。好好努力，不给任何人带来负担，做最好的自己，给她看，给家人看。
104,侧耳倾听,5,"夏天、山顶的木质建筑、大片的澄澈的绿色和蓝色、有树荫的综错小巷，神秘漂亮的商店、精致的陈设、山坡上狭长的水泥楼梯，大雨、电车、猫咪、穿水手服的女生、巷子转角处的单车・・・・・・
空旷的高处，云海里看见日出，听见圣司的未来时邀请。 
　　hey,亲爱，我答应你。 
"
105,侧耳倾听,5,“你将来愿意嫁给我吗”哎哟，姐姐听得新都酥了。。。 小女孩、小男孩，肥猫，男爵，老爷爷，算是宫老动画的老模式了，可还是很有爱啊有木有。。   看完真的好想单纯的爱一场！！！
106,侧耳倾听,5,PPS 1520 外公家 http://movie.douban.com/review/2947164/?post=ok#last
107,侧耳倾听,5,为了让我的名字早点出现在借书卡上，我看了好多书。看了10遍以上，前面十分钟的台词我会背
108,侧耳倾听,5,嘏年少...  稚拙甜蜜... 呢出甘少女甘opoint既蚓尤幌滴矣∠笞钌罴m崎E..得啦.. 就系甘架啦我..重country road.. take me home 添啊...
109,侧耳倾听,5,"无论今天,还是明天,和往常一样 
我想回去,却不能回去 
再见了故乡的路 
"
110,侧耳倾听,4,影片如题一般娓娓道来，那纯净的心与爱，梦想与等待在且听风别人吟中一点一滴敲击着内心那些不为人知的柔软与期待...
111,侧耳倾听,5,"为了让我的名字早点出现在借书卡上,我看了好多书... （200908）
原来09年的时候就看过了 阿月和猫男爵出现的时候才隐约想起来 这样的爱情才刚刚好 怪不得我总觉得人生的两件大事是认识自己和实现理想（201709）"
112,侧耳倾听,5,若我再，如初之r；我去郯桑就像初僖印Ｈ绱讼嘤觯只更加美好。等你，千千ff遍，勰悖全心全意，生生世世。
