,movie,star,comment
225,侧耳倾听,3,没有平时动漫中人物的夸张表情，捕捉了真实情况下的人物动作特点。配音还是依然很全面，注重细节背景音。故事的内容就是那么清纯美好。如果有电影版一定是萝莉和帅哥了。月岛滴滴的爸爸配音不知道是谁，感觉很有特色的声音，不错。
226,侧耳倾听,3,中间睡着了，结果醒来时已经是片尾，一句“你愿意嫁给我吗”让我睡意全无...
227,侧耳倾听,3,宫崎骏的动画最大的缺点就是太完美，完美到让人觉得不真实。。。。
228,侧耳倾听,3,甜蜜蜜～你笑得多甜蜜……
229,侧耳倾听,3,如果是十年前看的就好了
230,侧耳倾听,3,前面少年少女情愫的段落还不错，后半段总感觉有点奇怪，对前途的迷茫和自身能力的不自知还是很有代入感的。最后那句“愿意嫁给我吗”太破坏感觉了……
231,侧耳倾听,3,少男少女的小温暖已经打动不了我了TT
232,侧耳倾听,3,如果说我最喜欢的爱情类电影应该是《情书》《罗马假日》《廊桥遗梦》，但这部就莫名的小清新，比《情书》还要小清新，结局莫名甜蜜美好。名字好美好文艺啊!侧耳倾听:听见心里小鹿乱撞的声音，明明想见却装作不见，明明想问却不敢问……少女情怀总是诗。往往最青涩的爱情最单纯。
233,侧耳倾听,3,"天泽的表白挺动人 如今图书馆已不再用图书卡, 一时少了多少佳话的可能."
234,侧耳倾听,3,真不觉得好看 有些细节还是描述的很真实的 后面就很扯了
235,侧耳倾听,3,虽然借书卡的确是件浪漫的事，但你们才初中生啊，，，泪奔啊。。。。
236,侧耳倾听,3,"country road在这部电影中第一次听到。
关于奋斗的电影。"
237,侧耳倾听,3,为了那首歌 PS：猫的报恩里的男爵穿越了
238,侧耳倾听,3,"很唯美的校园爱情故事，很多画面处理显示出了宫崎骏精湛的技巧，但是我真的不喜欢把John Denver的《Take me home,country roads》翻唱成日语……"
239,侧耳倾听,3,1.是喜欢的风格，猜不到剧情结尾。2.画得很真实，比如吃面时流鼻涕、推车时披的外套滑落。
240,侧耳倾听,3,"Country Road, Take me home~"
241,侧耳倾听,3,缺少天马行空的创意，也没有特别感人的情节，更加质朴，接近生活。跟宫崎骏的其他作品相比，虽然秉承了一贯的画风，但没感觉的久石让的配乐，总的来说比较一般，片中翻唱的《Country Road》很有味道。
242,侧耳倾听,3,女主角的人设太奇怪了，做作，矫情，莫名其妙，真的喜欢不起来
243,侧耳倾听,3,我的青春里没这么为一件事情努力过，悲催！
244,侧耳倾听,3,只是和心情有关，我不知道又是一个关乎爱情的。
245,侧耳倾听,3,宫崎骏的卡通哦，有点失望...
246,侧耳倾听,3,节奏慢进度快剧设跳。死了。
247,侧耳倾听,3,说得好听点，叫做清新、恬淡、安静、纯爱、诗意……说得难听点就是闷且无聊了。说不上特别喜欢或者讨厌，但是中段大家合奏那首歌那里真是非常有感觉，歌曲很好听啊虽然据说是来自美国的。结局居然求婚了耶。于是觉得，在现在凡校园题材必暴力、卖肉、恶搞、早熟、批判等等的浪潮下，能重拾一份久违的简单之美也是很难得的。
248,侧耳倾听,3,除了主角是初中生之外 其实还是挺好的
249,侧耳倾听,3,这真的是宫崎骏？小情小爱已经无法消解我对于重口味剧情的渴求，还是自己过了那段体味校园恋情的年纪？不过借书卡白衬衫和喜闻乐见的多角恋倒是很有高中生的感觉。当然也只有高中生才能将执着但不靠谱的理想与爱情自圆其说。但不知不觉之中已被眼前葱茏的绿色所打动，夏天，友情，懵懂的爱情！
250,侧耳倾听,3,记得当时年纪小，你爱谈天我爱笑……年少时遇到他，就算最终分离，那也曾有过暧暧的芬芳。
251,侧耳倾听,3,前半段很好，后半段就落入俗套了。
252,侧耳倾听,3,很平凡但我每人都有ㄉ青回
253,侧耳倾听,3,画风很好。不过怎么觉得女主那么幼稚那么白痴...之所以只给了三星就是因为女主扣掉了一颗星
254,侧耳倾听,3,我想你留给我的只有停不下的思念和不敢想的未来吧。
255,侧耳倾听,3,我还就是不太喜欢这种清水爱情故事
256,侧耳倾听,3,依旧不喜欢宫崎骏，没觉出哪里很好来
257,侧耳倾听,3,好怀念以前用图书卡借书的日子。月岛的国语配音好熟悉。宫崎骏的静态场景太无敌了。
258,侧耳倾听,3,再看一遍 才想起自己原来已经在电视上看过，那个时候叫梦幻街少女。我不喜欢这样的女主角，尽管宫崎骏的书中从来都是这样的女主当道，很偏执着自己的梦想或者是一些什么坚持，我不喜欢，我也不知道为什么。PS，结局 圣司说嫁给我吧 我觉得是整部电影最大败笔，蠢爆了。
259,侧耳倾听,3,为了让我的名字早点出现在借书卡上，我看了好多书。好少女情怀的一部动漫。。。姑娘，你早恋了啊。
260,侧耳倾听,3,三星半吧。我喜欢他们骑自行车上坡的那段。
261,侧耳倾听,3,真的很少女，很励志很纯净的少女片，只是……本人真的不适合吃这类菜啊……
262,侧耳倾听,3,为了让我的名字早点出现在借书卡上，我看了好多书。。
263,侧耳倾听,3,我想!如果是年pr看的感狱c哦!F在看反而X得慌了!
264,侧耳倾听,3,可能是已经过了那个少女怀梦的年纪，看到这个的时候一点感觉也没有了。。但不可否认的是，这部电影是一部很好的电影。。想我初三的时候的那些悸动、那些对未来的憧憬和踟蹰。。往事如烟呐。。。
265,侧耳倾听,3,浓浓得主角光环，好看的女闺蜜喜欢的男生喜欢她，会做小提琴的有钱男生也喜欢她，就连不让人碰的流浪猫阿月都喜欢她，她真是何德何能啊？连个童话故事都写不好，还有脸闹着不读书。跟我发毒誓以后找不到工作就带着妈妈住天桥底的表妹有啥子区别啊？
266,侧耳倾听,3,3.5屋顶的剧情比寻找自我追赶对方的地方好看，反而浅显的表达比较容易接受吧
267,侧耳倾听,3,莫不是宫崎骏的初恋和早恋？
268,侧耳倾听,3,“为了让我的名字早点出现在借书卡上，我看了好多书。。。”95年，与情书童年啊，眼前总会出现图书馆窗帘后那个带点忧郁气质的男生……PS：日版Country Roads还挺好听的，水泥路很有意思。但这部整体上我还不是很喜欢，哈
269,侧耳倾听,3,其实我怀念那些一人一只耳机对着屏幕看电影或者是工作日的下午在环艺包场的日子。这片子有那么点儿狗血啊，看了上句就能猜下句的…
270,侧耳倾听,3,和宫崎骏其他片子的风格不太一样，不适应
271,侧耳倾听,3,不是很好看。三星半。里面有些道理还是很值得学习的。不过，真的不是很好看，期望太高了吧。
272,侧耳倾听,3,眼神的交流，不经意的脸红，图书馆之恋，猫君
273,侧耳倾听,3,日本人啊上个初中娘的老婆事业未来就全定好了。要不要这么早这么急啊！你们平均寿命又那么长，我真是看的一身冷汗啊
274,侧耳倾听,3,宫崎骏不是我的菜，我更喜欢今敏
275,侧耳倾听,3,看了一个多小时终于睡着了，小孩要不要那么早熟，看的台湾国语配音，一身鸡皮疙瘩，哎。
276,侧耳倾听,3,一般、、让我无感的爱情故事、女主的性格倒是挺让人玩味的。有个特别恶俗的桥段，女主跟男主说了那么多话、而且早就想知道他是不是那个谁 竟然不问他名字？？反而最后时通过别人的嘴知道的、。。
277,侧耳倾听,3,【TOP102】关于爱情最好的类型。怦然心动、奋不顾身、志趣相投，这些词在这部电影中都能找到。是你让我成为更好的人。因为有了你，我的梦想和爱情都得以实现。还有，那些我在学生时代也犯过的、笨拙可爱的错误。那些不在他面前闭上嘴，爱慕之心就会涌出的情绪。（另，故事四颗星，但过于冗长。）
278,侧耳倾听,3,哪有就这样问愿不愿意嫁给自己的哼 小伙子愣不老实。图书馆真美妙啊 想小石啾成长的地方有个图书馆 还有小街巷有点昏暗的小店和猫坨
279,侧耳倾听,3,很能代表JK少女情结的日本动画，青春期充满希望的志向和躁动，还有“纯爱”。很写实的动画，乐曲改编也挺好听，情节有点理想化。
280,侧耳倾听,3,评分竟然那么高？！宫老师，和其他作品相比，这部也太体现您少女风格了吧
281,侧耳倾听,3,年少时候那个悄悄喜欢的人，说出口会害羞的爱情。为了彼此更好一直在努力的自己，期待已久的我喜欢你。属于少年时候的美好，就像清晨破晓的第一道光，干净而美好。可惜我已长大，不会感动到稀里哗啦，也会理智的处理感情。但是为了曾经的美好与遗憾，还是4星吧。
282,侧耳倾听,3,早恋啊早恋。。。从小就看这么多书真是令我汗颜啊！
283,侧耳倾听,3,更适合小罗莉们看，我老了~
284,侧耳倾听,3,不X得有cC情么....
285,侧耳倾听,3,场景很棒，故事依旧有点廉价。
286,侧耳倾听,3,让我们侧耳倾听这些呼唤着青涩少女初恋般的细腻声音。
287,侧耳倾听,3,一个追着梦想的故事讲了这么复杂
288,侧耳倾听,3,主题曲听了很多遍，做好准备打5分的。结果故事和我猜想的不太一样。更喜欢片尾那一对。PS.姑娘你次次这么晚回家家里人都不担心吗
289,侧耳倾听,3,到底是哪里好看??!!告诉我!!
290,侧耳倾听,3,不好意思打了三分，故事节奏本来挺喜欢的，最后一个我要娶你我要嫁给你的，太俗气了，有失宫大师的水准啊。
291,侧耳倾听,3,已经过了能够这样爱着追求着什么的年纪了 = =
292,侧耳倾听,3,这样童话一样的初恋是每个少女的梦.....再次印证怀春少女就是傻......
293,侧耳倾听,3,county  road真好听~
294,侧耳倾听,3,country road 浪漫又意外的巧合 好友喜欢的男生喜欢自己 误打误撞的相识 小提琴 找梦想 写小说 迷途知返 等待 回归 日出 求婚 以及两坨男女一样的红晕… 有的事只有在动画片里才能有那么凑巧又美好的剧情，而动画片和爱情搭上边也就没那么有意思了。
295,侧耳倾听,3,从图书馆里借来的每一本书，发现借书卡上之前的日期里都有同一个人的名字是多么浪漫的一件事。有个趣话是说图书馆是个相亲的好地方，想找什么类型的恋人，就去什么类型分类那里找正在看书的就行了。如果有人能看过我所看过的每一部片子，那个人肯定是世界上最了解我的人了。浅浅的爱情，伸手可及。
296,侧耳倾听,3,一场平淡也优美的片..
297,侧耳倾听,3,宫崎骏还有琼瑶片？可以看到女文青喜欢的各种元素，小小矜持里的傲娇呀我能说我不喜欢吗！太正气的小初恋结尾把我肉麻到了，哎哟搭上糕富帅了女文青胜利了也！除了与猫对话的几段还有那只钟啊，还剩下小野丽莎的歌。
298,侧耳倾听,3,“我要努力成为很棒的人，为能追上你的脚步”~太健康向上了，简直是心理学教科书上爱的积极意义的经典案例。主线已经这么正面了，还要加上打磨原石的说教……太多健康因子向我铺面袭来，多少有点负荷不了~
299,侧耳倾听,3,一贯的水准，不过就是没什么感觉
300,侧耳倾听,3,我咋就不觉得这个好看。。。
301,侧耳倾听,3,看的比较早，印象不深刻了。姑且先给三颗吧。
302,侧耳倾听,3,"如果是在我17,8岁的时候去看这部动画会很感动,显然我现在的故事要比这个感动的多..."
303,侧耳倾听,3,一份小坚持，一份小纯洁。。画面感很好。。那首COUNTRY ROAD很棒。   男爵的眼睛~
304,侧耳倾听,3,果然是宫崎骏的风格，桥段在那个时候应该是很新吧，现在晚看这么多年，桥段也都熟悉了，没有特别感动，不过他们私定终生还真早。。。
305,侧耳倾听,3,作业布置少了吧，看把你们一个个闲的。数学17分，化学37分，英语不及格，就这，还排年级100多名？100多名？！还想考重点高中？还敢谈恋爱？妈呀，你们怎么不上天呢。以后不要骂桐华了，桐华写的《那些回不去的年少时光》都比这个强，因为女主考上了清华。
306,侧耳倾听,3,光线的处理真是让人叹为观止，转换细腻柔和，还有城市的街景也相当有实景感；原来动画可以做到如此细腻的地步。想表现的内容很多，也能引发一些共鸣，但故事还是有点小单薄。插叙。
307,侧耳倾听,3,真青春...= =
308,侧耳倾听,3,里面的猫还是很可爱的.
309,侧耳倾听,3,男女主角都没有得绝症什么的，很好，令人怀念的、羡慕的纯爱故事。
310,侧耳倾听,3,这样的早恋影片真是浅白如溪、平淡如水
311,侧耳倾听,3,不喜欢他的一切早期作品。。。
312,侧耳倾听,3,那个奇妙而美丽的钟表，我也好想有一个~
313,侧耳倾听,3,最萌小胖猫阿月，2016春重刷来看我桥
314,侧耳倾听,3,我喜欢安静的故事
315,侧耳倾听,3,很平和   很美好，country road  take me home
316,侧耳倾听,3,拜托，这都什么年代了。
317,侧耳倾听,3,大一看的。古老的情节总是有一种简单能让人感动。怎么能不喜欢图书馆借书卡这样的桥段。但是，爱情桥段无奇不有，真的还是过了年代了，略显老套。
318,侧耳倾听,3,"古早的借书卡总有动人故事，在你之前在借书卡上写我的名字……过于天真的甜美。想拎着猫君的尾巴抡个二十圈，再扔到狂吠的狗狗眼皮底下：P
"
319,侧耳倾听,3,动画讲到这个层次的也算可以了，对未来的思考，对生活多样性的思量。选择自己想要的人生道路，而不一定是按照社会的规则走，明白心中所想，这个主题倒让人觉得不错，尤其是作为一部动画展现出来就觉得莫名还是有些出彩的了。其他的关于年少的感情。我一直觉得宫崎骏里有爱情的孩子们都好小啊。。
320,侧耳倾听,3,两个场景不错，推着单车散步，陪着女主在图书馆看书。本来一个挺美好纯真的初恋的故事，非要加上魔幻和反战。2.5
321,侧耳倾听,3,“你将来愿意嫁给我吗？”“我愿意”年少时的承诺总是很美，初中生的青涩的罗曼蒂克往事，虽然很纯很美，也会勾起年少时的回忆与向往，但终究只是一个幻象！
322,侧耳倾听,3,较之宫崎骏其他的动画片，这个感觉比较一般般
323,侧耳倾听,3,为了让我的名字早点出现在借书卡上，我看了好多书――真的好像小时候。
324,侧耳倾听,3,配音版实在太让人想死了尤其那句又慢又港台腔的可是我喜欢的是你耶真的 太 娘 了
325,侧耳倾听,3,"减一颗星，完全是因为最后一句台词
"
326,侧耳倾听,3,我不喜欢这种类型的吧 那个猫咪男爵好精致 喜欢
327,侧耳倾听,3,看得太晚了
328,侧耳倾听,3,对现在的我来说，除了一天只能见一次的钟表cp和精致的猫男爵之外乏善可陈，我觉得这可能就是别人和宫崎骏的差距。ところで、那个年代初中生就有结婚的概念了嘛… PS.凹凸曼如我，才能发现这种陈年老梗。给圣司配音的竟然是高桥一生，当年作为声优出道，好配音的第一要义应该就是听不出本人了吧（笑）。
329,侧耳倾听,3,如果是九年前的自己 看完这部影片一定会痛哭流涕感动的给五星 长大后的代价就是 对于这种不切实际的纯真爱情 只能向往却不再相信 多少年后 阿雯会嫁为他人妇 而天泽君也会执起别人的手 只因为年轻的誓言就是为了背叛
330,侧耳倾听,3,我真的很不容易被动画感动诶。
331,侧耳倾听,3,文艺女青年养成记，本片较闷
332,侧耳倾听,3,"过了一定的年纪就看不下去这样纯真的电影了，也有可能是一直对动画电影不太感冒。
里面的月岛说，很羡慕圣司在这样的年纪就已经清楚的知道了自己想做什么，而自己没有任何规划和想法。
可是，他们才是初中生啊，多少大学生都不知道自己的未来在哪呢。
因为喜欢的人，开始让自己进步，让自己变得越来越好，这样的感觉应该很棒吧。"
333,侧耳倾听,3,得分这么高真是莫名其妙，少男少女好感产生得也莫名其妙，结尾那个让人吐槽的求婚更是莫名其妙= =
334,侧耳倾听,3,青春萌动而已
335,侧耳倾听,3,温暖的故事。很喜欢片中那段小提琴拉的county load。哈哈。
336,侧耳倾听,3,………………我对男主角耍帅以及初中生私定终生感到杯具。
337,侧耳倾听,3,因为你，我愿意成为一个更好的人，不想成为你的包袱，因此发奋努力，只是为了想要证明我足以与你相配。
338,侧耳倾听,3,X得@部很奇怪。可能我老了。
339,侧耳倾听,3,尽管才寥寥几面，但爱上圣司简直是情理之中的事。频繁出现在借书卡上的名字，捡到被遗落在长椅上的书本，笑着揶揄便当盒的分量，这些影影绰绰的时刻最可爱也最动人。上坡是曲径通幽处摆放着猫伯爵的小店，下坡是裙底生风踩着云朵的奇幻之旅，明明两个都是前路未明的少年人，却那么用力地追赶对方，笃定到一开口就是永远。太真实也太完整，以至于少了些欲言又止的浪漫，一般般喜欢吧，贯穿始终的那首老歌是真不错。
340,侧耳倾听,3,尽管才寥寥几面，但爱上圣司简直是情理之中的事。频繁出现在借书卡上的名字，捡到被遗落在长椅上的书本，笑着揶揄便当盒的分量，这些影影绰绰的时刻最可爱也最动人。上坡是曲径通幽处摆放着猫伯爵的小店，下坡是裙底生风踩着云朵的奇幻之旅，明明两个都是前路未明的少年人，却那么用力地追赶对方，笃定到一开口就是永远。太真实也太完整，以至于少了些欲言又止的浪漫，一般般喜欢吧，贯穿始终的那首老歌是真不错。
341,侧耳倾听,3,也许我已经可悲地老去了
342,侧耳倾听,3,对这样没太大感觉
343,侧耳倾听,3,这个说不上很好，青葱岁月里都会有的话，看的时候还是有些感觉的。故事就比较老套了。歌曲很好听。
344,侧耳倾听,3,三星半，青春励志片，各方面都很均衡的电影，Take Me Home Country Road真是好听，你会忍不住随着它的节奏而摇头晃脑。近藤喜文跟随宫崎骏近二十年，好不容易拍了一部大卖的处女作，没想三年后却与世长辞，惋惜之极。
345,侧耳倾听,3,大家强烈向我推荐 看了十五分钟就无任何征兆的入睡了
346,侧耳倾听,3,女孩写书的情节与之前的故事脱节，编剧失控了。
347,侧耳倾听,3,初中生早恋~~~个人发展~~宫崎骏的动画离不开早恋不伦恋人鱼恋~ 以及儿童，飞艇，老婆婆，猫，和加州情结
348,侧耳倾听,3,看的字幕翻译的不是很好，这不是宫崎骏的作品，但是是一伙的。故事记得有些模糊了。不是很喜欢的那种。
349,侧耳倾听,3,很难被这种完全清纯的小爱情感动了呀。。。《怦然心动》感觉很多人喜欢，我也是看了莫感觉啊。。。
350,侧耳倾听,3,- -字幕有问题，看着好吃力
351,侧耳倾听,3,拖了N天才拉完，几度昏睡过去，也许我真的已经记不清那些青葱岁月了，完全无感，所以看两个长相酷似小学生的小孩儿谈情说爱、为情所困还真是怪怪的，结局也太狗血了，其实我真的很想吐槽的，好在图书馆一起念书的温暖镜头还是戳到我了。不要早恋！
352,侧耳倾听,3,想起点中学的事情，懂了些少女心。看不惯的是标志性的洋气和早熟-12/23/15 at IFC Center
353,侧耳倾听,3,老阿姨看不下去太纯的爱情了，老阿姨喜欢看消失的爱人，婚姻故事和革命之路
354,侧耳倾听,3,除了画面保持了卜吉力一贯的水准外，其他方面都很难称得上经典。剧情结构松散，情感抒发也过于少年化，让大叔我看的昏昏欲睡～
355,侧耳倾听,3,实在是不喜欢如此慢节奏的。。。
356,侧耳倾听,3,吉卜力的动画还得宫老爷子导，其他人导的总觉得差了点什么
357,侧耳倾听,3,部分《情书》的桥段
358,侧耳倾听,3,很青涩，很纯情。
359,侧耳倾听,3,总觉得少点什么，可能太多人没有这种美好的记忆吧，美丽的纯爱但没打动我
360,侧耳倾听,3,漫长的异地恋从此拉开帷幕（喂
361,侧耳倾听,3,没觉得多美好 看的忒无聊 
362,侧耳倾听,3,所谓少女片就应该在少女心尚存的时候看吧…我错过了时候
363,侧耳倾听,3,有点闷~ 「猫的报恩」里面的男爵！
364,侧耳倾听,3,"那么单纯美好的爱情
书签上的名字早已引起注意，名字总是最初吸引少女的东西。让我想起岩井俊二的《情书》
天泽圣司的人物和外形设定很符合我曾幻想的少年模样，这种幻想是永远属于最少女的我。
爱情最好的模样就是上坡路那一段的体现，我愿意为你付出，愿意为你变得更好，想一点一点追上你的脚步，和你一起成长。求婚看似幼稚，但是那么难得，这样的友情爱情是让人年少时最向往的。
猫爵士玩偶的第一眼就让我想起《猫的报恩》 爷爷的异国之恋和始终没有实现的再次重逢也是种遗憾之美。
月岛雯是豆瓣文艺少女没错了，看书写作听音乐追猫开朗爱自由。我的生活，我喜欢的生活方式。活的像胖猫一样最好，自由洒脱享受当下自由自在。
看着宫崎骏动画里的景色，我想到也许只有是枝裕和能在三次元里拍出来吧。"
365,侧耳倾听,3,。。。。。除了结尾，一切都还算正常。。。
366,侧耳倾听,3,看这部片子就像是在回首过去的我们，青春少年，恋爱的青涩与美好，梦想的魅力与遥远。遇到一个对的人，是让彼此成为更好的自己。她/他就像自己自己的一盏灯，努力，让其永不熄灭。虽每个人就像一颗普通很不起眼的石头，但经过雕琢，都可成为闪闪发光的宝石。fighting，怀有梦想的少年少女。
367,侧耳倾听,3,这样的小温馨，小情小调我不喜欢。
368,侧耳倾听,3,真心没看懂要表达什么，梦想，感情，抑或是别的？很有当年看《情书》的感觉，人都感动得一塌糊涂，我却半点感觉都没有。
369,侧耳倾听,3,前面相当棒，不管是气氛营造还是BGM，但后面太拖，而且初中生就开始思考前途和婚嫁这是不是也太超现实了点
370,侧耳倾听,3,看之前不知道是宫的片子 看完也没有觉得会是他的片子 没什么感觉 只是那个挂钟太惊艳了 每个看过的人都会妄想拥有吧
371,侧耳倾听,3,比较沉闷，少年们浪漫纯真的爱。原来《猫的报恩》的猫伯爵最先是在这店里的师傅做的啊。
372,侧耳倾听,3,原来就是正能量版的早恋啊，哈哈。才初中哦，面对两情相悦就那么理性与积极，好励志哦。她们在还不懂爱情的时候，在情窦初开的时候，就许下嫁娶的志愿，好不可思议，希望正能量的早恋能走得长远哦~那真是幸福啊！
373,侧耳倾听,3,小清新，大格局。吉卜力工作室的电影大多是以少女为视角，不知有否萝莉情结？
374,侧耳倾听,3,宫崎骏的小情调之一 不要忘了最初的梦想
375,侧耳倾听,3,"大概是已经过了那个想到什么就要去做的年纪，看着女主追着一只猫跑的时候脑子里就只担心盒饭不会洒吗？
这个做什么都有冲动的年纪真好，但也不太怀念，毕竟多年之后想起是哭是笑也不一定。"
376,侧耳倾听,3,1、好单纯的爱情啊～可是为什么我没有感动，还在最后圣司问“你愿意嫁给我吗”的时候笑场了。。。 2、感觉宫崎骏爷爷不适合这种纯爱电影，更喜欢爷爷关于爱（不特指爱情）和勇气的故事 3、那只傲娇肥猫不错，噗哈哈～
377,侧耳倾听,3,【1】虽然电子借书确实比较方便，但我也还是更喜欢借书卡一些 这种相遇确确实实超级美丽 更有的是你知道有哪些人跟你读过i一样的书 或许会有一样的心情感觉是很美妙的事（这也是豆瓣的魅力所在）【2】电影本身来说 我觉得这种感情美好得太不真实了。。。。
378,侧耳倾听,3,日本初中小姑娘这么纯情啊
379,侧耳倾听,3,南宁市高温橙色预警的情况下看的这个片子，之后满身大汗。真是清纯又不羞涩的片子啊！
380,侧耳倾听,3,宫崎骏早期作品了吧、3.5分的样子、很喜欢那钟、
381,侧耳倾听,3,对于一个初恋遇到王八蛋的人来说，所有诸如此类的影像都看得人心生焦躁，初恋的节奏是如此缓慢的吗？是吗是吗？
