,movie,star,comment
0,超脱,4,少年时，我们都自私无知，夸张那些伤痛来当作放纵的借口。只知依赖不知自救，只知索取不知珍惜。打架，滥交，还自以为是看透了生命，绝望的很酷，其实肤浅的令人发指。孩子，什么时候你开始沉默的承受加诸你身上的重量，尊重它并与它和平相处，你才真的能称为一个大写的人。
1,超脱,4,这是一部不推荐看的好电影。没病的都要看出病的。好的作品分两种，一是发现世界的极美，二是挖掘人间的极苦。这部就是后者。
2,超脱,5,一次次泪倾，哭到胸口抽痛、难以呼吸。当我们感到需要暖意，首先要学会的，是彼此拥抱。穷尽一生，我们要学会的，不过是彼此拥抱。只因“一个人可以轻易地学会不在乎，但学会在乎，却要付出百倍的努力和勇气”，再不要独自一人穿过灰暗暝寂的暮色，在摇摇欲坠之前，在生命荒芜心脏冷却之前，彼此拥抱。
3,超脱,5,电影最后只留下冷漠与残酷，你根本无法从这一切中超脱，过去和现在，精神和肉体，理想和现实，教育和未来，与现实对抗相比选择冷漠并无视一切显然更简单。拿自暴自弃当成个性标榜，就像把自己搞得越叛逆越惨烈就比其他人更强大一样。这部电影的杀伤力太大了，没有给你一丝缓和情绪的机会！★★★★★
4,超脱,5,“我的灵魂与我之间的距离如此遥远，而我的存在却如此真实。”――加缪
5,超脱,5,我们不一样，我们都一样。
6,超脱,5,当电影全部播放完时，影院灯光亮起，那一刻我甚至觉得这个坐着千人的场子里的空气是凝结着的，每个人都很小心地呼吸着，被那绝望深深所震撼。
7,超脱,4,每个人的内心都是一座孤岛，人的心有多深，深到让别人无法试探的地步？教育和生活其实一样，教育者既可以超然物外，也可以放下防备与被教育者心灵交互。讽刺的却是，超脱既可以赢来尊敬，也一样能扼杀心灵。Adrien Brody终于跳出了烂片的泥潭，用忧郁气质和演技，再次将人性的考量重重甩在了观众脸上。
8,超脱,5,看过后很奔溃。这世界上最简单的事可能就是漠不关心地生活。因为一旦当你开始关心起别人，无论是多小的一个举动，都需要勇气。而detachment地生活，其实才不需要什么勇气和决心。我有段时间很自闭，觉得孤独地生活，一定是坚强的人才敢去做的事，而其实呢，这样的人才是最懦弱的吧。
9,超脱,5,1 Brody演的太好了，人生导师和脆弱闷叔转换一念间；2 如果你施舍温暖，无家可归的人就必会依赖，“超脱”如何可能；3 对青少年的刻画犀利，但也许缺乏同情，我们无法知道他们为什么如此绝望冷漠而满不在乎；4 老师带着支离破碎的人生站在讲台上寻求权威和存在感，说不清工作和自我是否已经恶性循环
10,超脱,4,托尼・凯耶这么多年了，拍片仍然是一副死不回头的独立范儿，各种伪记实、访谈与剧情相结合以拉近观众的距离。整部影片始终弥散着一股伤感、落魄的情绪。很多男人都想在大街上拯救一个雏妓吧。布罗迪的表演很加分。
11,超脱,5,每个人活着都必须面对内心的Chaos，如同透明人的存在，太多力不能及的无奈，不被认同的价值，被遗弃的苦楚，无法得到回应的感情。影片无数次提到，“每个人都会有自己的问题”。这也是我安慰人时最常说的话。凭靠它，我走过了很多路。可该怎么解决内心的Chaos，我仍然无解。
12,超脱,5,这部电影撩死了姐久违的厌世情绪（从值得褒奖的角度说的）。萝莉大叔之间的救赎之爱又很治愈，搞得姐要死不活（仍然是in good way）。个人风格非常强烈，影像形式非常自由，但信息传递得十分清晰。这很难得。姐真心觉得AB很帅的（好吧，我是马脸大叔爱好者），就是这长相注定演不了让人开心的电影
13,超脱,5,AB沉默多年，终于重新发威给出有超越《钢琴家》势头的影帝级表演。加上Tony Keye以擅长的纪录片手法给观众挖了一个美国教育灰色地带的大坑，题材不新但叙述角度和震撼力足够击穿经历过类似长短不一的时期的我们的心脏。
14,超脱,5,孤独感无力感痛彻心扉…… 真正触到心底的电影，很久没有这么毫不犹豫给一部片子5星了。电影试图将视角多元化，并且真正将每个角度都刻画得细致入微，引发共鸣和思考，些许压抑却不觉沉闷实在值得夸奖。
15,超脱,5,勿被片名误导。此片充满无处不在的郁抑及沉重。所有人对自己都毫无办法。指望他者解救自己的苦难永远只是一时，因他自顾尚且不暇。即使慈悲到收留你，也有天要离开。总之，就像那位代课教师一样，此片只是给了一个若即若离的拥抱，并未试图解决片中人物或观众的任何麻烦，但无助的人，会被无情击中。
16,超脱,4,1.流浪是归属的本质。2.以粉笔画串场，赞。3.加缪：我从未这般深刻感觉到，如此超脱于自身，却依存于世界。4.有些人睡着睡着就死掉了。5.信仰的倒塌与重建。6.失败的意义在于让每个人失望，包括我们自己。7.爱伦坡厄舍府一瞥。
17,超脱,5,相比之下，《放牛班的春天》乃至《死亡诗社》等皆成心灵鸡汤。学生、家长、同事、亲友，最后到教育者自己，在无奈、无助、无聊、无厘头中无处可逃也无法超脱。感谢一位从事三流大学特教事业的朋友以其日常的吐槽和坚持，使我不断意识到自己日常处境中理念与幻念的相克相生。
18,超脱,4,我们活着也许只是相互温暖，想尽一切办法只为逃避孤单。
19,超脱,5,穿插动画的模式似倒带人生；对话的密度和人物的弥散，以及幻实交错的画面似半梦半醒的人生；萝莉大叔配的形式似杀手里昂；唯有最后厄舍古厦的倒塌，谁都不似，是美国x档案那个托尼凯耶。在此类型里给这部片子五星主要因为两个人，其一致敬导演时隔十四年的坚持，其二期盼萨米・盖尔-未来巨星就此诞生
20,超脱,5,片名来自加缪存在主义的《抽离》之说，不该翻译成《超脱》。对现实绝望者，大多是过于理想主义者，他们想改变的东西有太多，却只感觉所有的努力不过是西西弗推着的石头。即便如此，石头还是会一直推下去――目标总是存在的，即便无路到达。不过，以加缪的虚无感开头，再以爱伦坡的诗意结尾，总感觉不搭
21,超脱,5,Adrien Brody之前主演的《钢琴师》，其忧郁深沉的气质，记忆犹新。他太适合饰演这样绝望悲伤的电影了。如果有一天拍爱伦坡传或者卡夫卡传，我觉得他是首选。DL:     http://www.yyets.com/resource/26539
22,超脱,4,将我带进了一种被情绪影响的精神困扰里，却直到影片最后都没有把我释放出来。得不到超脱。
23,超脱,5,我用光了所有表情，从人群中仓皇逃走；我们的心是城堡，我们宁愿躲在地洞，每颗心都那么疏离冷漠，每个人都承受着自己要越过的刀锋；如果我爱你，我会离开你；如果我原谅了你，我会拥抱死亡；我不会相信一切都好起来。
24,超脱,5,detachment，开头引用存在主义那句“我的灵魂与我之间的距离如此遥远，而我的存在却如此真实” 真是一语中的，永久的矛盾就是总在试图寻找某种与外界的关系，同时又企图把自己从外界隔离。我们笃信存在是存在本身，却又必须通过别人感到自己的存在。
25,超脱,4,以为治愈，结果致郁。
26,超脱,5,It's been long since last time I cried in the cinema. Great movie and so good to see Adrien Brody tonight! 
27,超脱,5,那些相当给力的段落，把这部片冲上五星。
28,超脱,5,"① We all have problems, we all have things dealing with.② We are all the same, we all feel pain, and we all have chaos in our lives.③ You may see me,but i'm hollow.  压抑+密集的泪点+OST+Adrien Brody，这片是要把人虐成傻逼吗！！！"
29,超脱,4,每个人都是孤独的。
30,超脱,5,一部直击人心又内涵深刻的伟大电影。琐碎多样的摄影和剪辑恰与存在主义主题相契合，台词句句珠玑，文学性极强却没有故作高深，布洛迪的演技炉火纯青，比获得影帝的《钢琴家》里的表演还精彩！影片涉及教育、女性社会地位、自杀等问题，展示了人生极苦的一面：荒谬、矛盾、孤独、虚无。（9.5/10）
31,超脱,5,开场就被震到。精到的镜头处理。压抑感从始至终。手持摄影机+变焦推拉像dv拍出来的效果，纪录片的效果，那种真实感平衡着观众的窥视心理。对社会现状的深入剖析，尤其是美国教育的弊病，同时也是全人类的问题。几个人物，处理得多秒。
32,超脱,4,长得像圣徒也蛮惨的，所有人都期待能从他那里得到救赎。我也好想被他拯救哦
33,超脱,4,虽然不错，但是缺乏代表性，少了预期的震撼感，很多道理也只不过是老生常谈，什么“不是你的错”，“明天会更好”的主题并未挖掘到新的层次。PS，为什么Adrien Brody总是演这样“伟大”的角色。
34,超脱,5,看完这部很久以前就下了但一直没看的电影，心里感叹：“这才是拍给人看的电影！”感觉本片男主人公就像耶稣复活，看到他给因被人强暴殴打而遍体鳞伤的雏妓身上的伤口搽药，瞬间泪崩。打动我的是他无尽的仁慈与悲悯……
35,超脱,5,这片子看似是拍青年人的教育问题，其实是拍这个世界的无助。在这个悲惨的世界里，即使只是保持自己的完整也变得如此困难。学校只是个舞台，青年人是我们塑造的这个世界的成果。最后的那段荒凉破败是个再明显不过的比喻，我们失去了所有的伟大和尊严，从今以后只有无尽的欲壑难填的荒漠。
36,超脱,5,我坚持认为，这才是我所需要的“励志片”。
37,超脱,5,糟糕，这蛋疼的共鸣是怎么回事？
38,超脱,5,既佩服如此多线索和视角几乎完美无缺的融合，叙事、独白、闪烁回忆、相片定格画面，各种色彩的交织，又反感这个明明是多角度却如同出自一个人的声音，它以表面的诗意回避了很多问题，比如see被简化的实质，比如童年。所以将我感动的，其实是这个教育的大背景，一种微弱的恻忍和理想，以及无力。
39,超脱,5,生命本是充满挫折与痛苦的，男主角清醒并诚实的探索且观察自己的灵魂，未被自我的痛苦腐蚀，用智慧超脱限制。Adrien Brody深邃忧郁的眼睛里有太多的戏，这个角色似乎是为他量身订制一般。深刻的台词，直敲心灵的真实感，电影里没有任何形式主义。
40,超脱,5,我也会是那个坐在公车上哭成傻逼的人。
41,超脱,4,压抑，erica的希望和绝望都感同身受
42,超脱,5,"精彩 有深意
"
43,超脱,5,超脱
44,超脱,5,致郁系。我们总想改变这个世界，到头来却发现什么也改变不了。我们总试图拯救自己爱的人，到最后才明白我们连自己都无法拯救。Adrien Brody在公交上泪流满面的样子强大到可以隔着屏幕带得我一起悲伤。他的眼神让我想起Guillaum。
45,超脱,5,致郁系
46,超脱,4,与《拉扎老师》很有异曲同工之妙，但此片涉及角度更广，视觉语言更具诗意。
47,超脱,5,你要如何原谅奋力过但无声？
48,超脱,5,Im out of faces and Im  gone
49,超脱,4,
50,超脱,4,原来是《美国X档案》导演的新作，真是超低产。美国青少年的青春真是太沉重太堕落太让人心疼了。。虽然无很强代入感，不明白为什么要痛苦到走极端的地步，但好歹结局很温暖。大鼻子哥哥演得挺不错，果然实力派，以前了解不够啊。。乳神Joan姐姐！穿再多也挡不住哟！
51,超脱,4,归根结底家庭问题导致问题儿童，问题儿童导致更多儿童出问题，所以为人父母前至少要确定你有这个资格…教书育人何等神圣，但老师真是个苦逼的职业，刘玉玲那段念白荡气回肠，编剧有才，布罗迪演的精彩
52,超脱,4,Henry不是鬼冢英吉，Henry+Erica也不是Leon和Mathilda，这里没有被拯救的学生，只有孤独，哀伤，破碎。刘玉玲演的很好，崩溃时的台词太棒了。“It is so easy to be callous. It takes courage and character to care.”
53,超脱,4,平静、平淡，值得思考。
54,超脱,5,过不完的高中
55,超脱,5,触碰到心的一部电影
56,超脱,5,够了：）从校内到校外的年轻姑娘走入歧途的心态感受都能自如体会简直是我的自传体电影
57,超脱,5,信仰
58,超脱,5,全篇充满了怜悯和关于死亡的思考。画面和声音都非常出色。
59,超脱,5,爱别离。
60,超脱,4,这张大长脸太会演戏了！
61,超脱,5,to get out of the sea of pain is what everyone should try to get out of
62,超脱,5,震撼心灵
63,超脱,4,寂寞，忧郁，疏离。
64,超脱,5,一边痛一边欢呼，咬着牙还是选择往下走，看这个电影和活着的意思是一样。
65,超脱,5,"不在乎真的很容易 困难的是在乎的勇气和决心~
"
66,超脱,5,。
67,超脱,5,The child’s intelligent heart can flatten the death of many dark places.
68,超脱,5,还有什么比现实更具绝望。
69,超脱,4,开始前更喜欢人间师格，看完后才明白“超脱”的含义，每个人心中的绝望，痛楚都需要去超脱。。。
70,超脱,5,人生来忧郁，心中的困顿，孤独，冷漠，谁人容易，“如何放下，才能得到”亘古不变，爱伦。坡的诗很写意，很悲伤～
71,超脱,4,relentless chaos uncanny ironic sinking  ...
72,超脱,5,非常非常好看，艾德里安 布洛迪简直就是眼神帝加表情帝
73,超脱,5,Mr. Bathes 有着与学生沟通的天赋，自己身上也背负着很多苦恼
74,超脱,4,nothing will be OK
75,超脱,4,满篇游离着矛盾与无力 感觉像是在宣泄不是在解答 Y剧本其实是说胖子没有好下场么~？（误）
76,超脱,4, doublethink
77,超脱,5,镜头，色调，插叙，节奏，配乐，选角，言之无物却又妙不可言
78,超脱,4,美国版《拉扎老师》，但感觉比之震撼许多。大量手提摄影镜头。纪录片的叙事手法。配角居然都个个出彩。刘玉玲看上去竟然已经那么老且肥了。
79,超脱,4, 在同}材中，他的表F手法是e致的，也更向於刃摹Ｉ踔了P乎了更V的用妗ｊP於人c人之g的叟cA，m然整影的情w是霾和悲^的，但是也不乏一些有鄣拈W光c在瞬g@F。
80,超脱,5,无言以对。
81,超脱,5,现象分析的蛮好
82,超脱,5,说不清道不明，却让你心灵一颤
83,超脱,4,压抑的一逼，不过好爱这大叔
84,超脱,4,其实真是不错的一部文艺片
85,超脱,5,"在f你,我,他"
86,超脱,5,"To defend ourselves, we must learn to read."
87,超脱,5,震撼到心底的电影，必须得重温一遍。
88,超脱,4,大部分的分数都给了男主！！哈哈哈哈！！没想到欧美也走这种风格了……
89,超脱,5,感觉类似于《特别响非常近》，只不过题材不同。Brody演得太赞了！！不过略感压抑~~“Never have I felt so deeply at one and the same time so detached from myself and so present in the world. ” ！
90,超脱,4,生活很苦逼
91,超脱,5,它的孤独 犹如弥漫在人群里的呼吸声 此起彼伏 我们从来没有试图摆脱 因为它挥之不去 又触不可及
92,超脱,4,孤独
93,超脱,4,结局引用爱伦坡的那个小故事真是再适合不过了。
94,超脱,5,用爱伦坡的诗用来点缀真是绝配...
95,超脱,4,装作不在乎什么的实在是太容易了谁都可以可是要知道在乎才是真正需要勇气的事情
96,超脱,5,阴沉文艺版的搏击会
97,超脱,5,从职业操守和道德的正义开始，到偶行善举后无法自拔的挣扎，从无奈的施助者升华到自我内心的超脱，从头至尾的压抑没有给观众一点喘息，贯穿全篇的爱和自我坚守的大义，甚至最后还晦涩不明，也许这就是黑暗中一丝光线的力量，即使当你我身处绝对的黑暗，也绝不妨碍对人本大义坚持和信仰！
98,超脱,5,看完之后，真的有绝望之感涌上心头！一个是美国教育，一个是人性关怀。最后的荒芜，看得我好难受！
99,超脱,4,每个人活着都必须面对内心的Chaos，如同透明人的存在，太多力不能及的无奈，不被认同的价值，被遗弃的苦楚，无法得到回应的感情。
100,超脱,5,真正的压抑都是说不出来的，面对明天的到来充满了恐惧，想逃避没有办法，害怕一切跟压抑产生根源有一丁点儿关联的东西，只能活生生硬着头皮去接受。这是一场崩溃边缘的自我救赎，导演用那些分镜头和色调把这种感觉拍出来了，很棒！
101,超脱,5,艾德里安的演技实在是太棒了，将主人公心里的那份挣扎，伪装的冷漠，和最后的释然演绎的淋漓尽致。超脱，也许就是对过去发生的不追究，过去的事情，即使再多疑团在纠结，也不足以成为阻碍你生命进程的障碍
102,超脱,5,"成长就是在各种不同缘由的经历中翻滚,是说不出的兴奋与迷茫;真正的""超脱""并不存在,只是命运让我们间歇性的喘息,至于之后又要陷入怎样的境地,则是另一个需要""超脱""的过程."
103,超脱,4,在个人的悲怆交织成社会的悲哀的背景下，我们都想自我超脱，但却发现自己的悲伤无法被救赎，我们又想拯救他人，结果却往往是把自己弄得伤痕累累。
104,超脱,5,这是一部很文艺文艺的电影！片中探讨了三个年龄层的内心。无论哪个阶段，都有着自己的痛苦！ 还是很值得一看的！
105,超脱,5,被男主彻底的悲伤和忧郁的眼神彻底感染
106,超脱,5,这电影太尼玛沉重了，很多的心理刻画都切中了大人数人的自身状况，我们在认知电影的同时，往往会更多的引起对自己的深思。
107,超脱,5,虚无冰寂中的星点阳光
108,超脱,5,不可多得的好电影
109,超脱,5,真的很好，能让自己的浮躁静下来
110,超脱,5,我喜欢的节奏
111,超脱,5,很好的电影。整个过程中你都可以感受到角色的内心，他们的思想，感受到这个社会上复杂的但是又存在的现实，非常残酷冰冷的现实。摇晃的镜头，穿插的动画，穿插的回忆，导演非常好的将其融合，一点都不会感觉到多余，只会你会感觉到这一切是那么的真实。最后一个拥抱的慢镜头，让我感受到了DETACHMENT的
112,超脱,5,虽然只有97Min，但自己内心仿佛经历了很多。反观自己已走过的人生，嗟叹之余更多的是无奈。每个人演绎不同的社会角色，注定有隐藏的另一面。面对自己，真的很难……
113,超脱,4,我果然还是不太喜欢这类片啊，一定要心情很淡定的时候才能开始看！有点小压抑，还好后面有相拥的阳光的暖意！
114,超脱,5,read   feel   detachment
115,超脱,5,为演员 为台词
116,超脱,5,一年前，我肯定给他两分儿
117,超脱,4,我的灵魂与我之间的距离如此遥远，而我的存在却如此真实……
118,超脱,5,用很多的自白，来谈论或者说提及一个说不清的事情，是教育吗？是责任吗？是自我吗？沉重和永恒的，我们的，混乱的世界
119,超脱,5,拥抱！
120,超脱,5,从头忧伤到尾
121,超脱,4,没有完全看懂，就是觉得很绝望很绝望
122,超脱,5,看过之后，觉得人生灰暗。暗黑的教育世界……
123,超脱,5,导演的镜头语言非常独到惊艳，电影无比动人。
124,超脱,4,这个电影看一遍是难以理解的，有时间再看吧
125,超脱,5,艾德里安布洛迪的演技啊，真叫人折服，难怪他当年他一出手，就拿了奥斯卡影帝。怎么说呢，这是一部叫人漫溢着阴郁之气的诗一般的成长电影。很喜欢其中引用的诗，其中的文字。总觉得有点像忧郁版的艾迪伍伦风。另外，特别，对其中的速写动画，公园里的木椅印象深刻
126,超脱,5,何以宽恕。
127,超脱,5,无与伦比！完美！正是我所喜欢的！
128,超脱,4,喜欢Henry对那个女孩的感觉  他真的是good and gentle    不过影片真的太沉重
129,超脱,4,very American 。。。
130,超脱,5,类似这样“好老师引导坏学生”的母题也不少，不过这片把视角更多对准了老师――他也生活在自己的精神危机中，detachment恐怕也是他自己成长中学会的自我保护机制，这也解释了他明明是“金牌代课老师”，广受好评，却不愿留下来长久任职，生活中似乎也没有稳定的居所与长久情感联系。他身上的温和坚定，其实有几分女性气质（至少大概不符合美国社会对“男性气概”的界定），不仅开头的黑人男孩说他“娘娘腔”，最能感应到他、且反过来推动他改变的，也是两个女孩。生活中的暴力总是会积累和相互感应，只有阅读能拯救――其实在中文网上又何尝不是如此。p.s.片名译作“超脱”，总觉有几分不妥，里面没人能这么潇洒，更多的倒不如说是从情感联系和人际关系中疏离，这既是解脱之道，又是问题之源。
131,超脱,5,看完《detachment》 好震撼，o奈不能x坡的英文原版《厄舍府的倒塌》
132,超脱,5,影如其名――超脱
133,超脱,4,"对不起,我们都需要一些东西
使我们暂时脱离错综复杂的现实

至少去想想他们从何而来 
去想想我们该如何找到出口
去摆脱那些我们都需要挣脱的无尽痛苦

我们有如此之大的责任去引导一个孩子
好让他们不要...支离破碎 半途坠落 消逝离去

我们在失败 不断失败
失败的意义就是让每个人都失望 "
134,超脱,4,好压抑
135,超脱,4,很压抑的片子。。。。。我们终于用冷漠推开了整个世界。。。
136,超脱,5,尊重 信任 换位思考 有效沟通 铸造厚实的幸福感 是这个社会进步和和静的基石 一部好的电影必然能促使观众有勇气去反思和思考 并从容的面对美丽或是丑陋的种种 感谢carl lund 这是一部完美的剧本 
137,超脱,4,很有回味思考深度的影片，压抑的基调刻画着人生的态度
138,超脱,5,深入的电影。
139,超脱,4,The words can touch the bottom of our hearts
140,超脱,4,有王家卫的范。。。
141,超脱,5,"In real life, Meredith is director's daughter~"
142,超脱,5,看完之后，一直默默的掉眼泪
143,超脱,5,富含营养的好电影。结尾感觉有点唐突。
144,超脱,5,很好看。
145,超脱,5,好看。
146,超脱,4,如果大家不要这么一致好评 也许会觉得这部片子更好看。
147,超脱,4,...... wordless..... 
148,超脱,5,善良的人无法独自生活
149,超脱,5,需要一个人静静地看...然后思考!
150,超脱,5,"By letting it go, it all gets done. The world is won by those who let it go. But when you try and try the world is beyond the winning."
151,超脱,5,有些看不懂，但很好看
152,超脱,5,"Take them home with us at night,take them to work in the morning~Things trap us all the time!"
153,超脱,5,比国产傻逼片儿《气喘吁吁》好多了。
154,超脱,5,"Everyone has his problems, and no one sees your struggles. ""Everything's gonna be alright."" Just pretend that everything is alright."
155,超脱,5,有点没看懂
156,超脱,5,让人心酸的感动
157,超脱,5,看完这个不仅没超脱而且心情更加压抑 AB的苦瓜脸是电影最好的诠释 每个人的问题都很多 压力巨大 都是困兽 说实话我们可以教育别人 却无法超脱自己
158,超脱,5,detachment.
159,超脱,4,长脸影帝继「钢琴师」之后终于有拿得出手的作品了，整部电影给我的感觉很压抑，生活中有很多的不如意，当你努力去改变它是时，有时残酷的现实真的很伤人
160,超脱,5,这片的叙事我很喜欢
161,超脱,5,让人绝望的成人世界。
162,超脱,4,节奏缓慢又平静的悲伤。
163,超脱,5,喜欢他
164,超脱,5,失败的意义，就是让所有人失望，如果有一个人，哪怕只有一个人，因你温暖或西希望，那就不是失败。
165,超脱,5,"基调压抑的要死, 普通的人各有各的不幸, It's so easy to be careless. It takes courage to take care."
166,超脱,5,教师该怎么做？可能很多人做不到，但应该醒悟：心理教育要远重于知识教育。
167,超脱,4,"亦或压抑 亦或舒缓
平齐的节奏让我们似走过了人的一生 而后恍悟 非极端悲痛非大起大落  依旧淡淡地点缀着生活  头脑   思绪
一种说不出道不明的感情......也许正如编剧所走过的一生"
168,超脱,5,压迫感
169,超脱,5,我从来没想过一部类似教育片的电影可以这么催泪，电影里的真实便是赤裸裸的残忍，也许曾经多多少少经历过这种真实，看这部电影真的泪崩了。超脱，便是要经历这种真实，承认它，试图去改变它，然后蜕变。
170,超脱,5,"9/10 44
我看过这部电影 2012-06-18 
29.3.2020"
