,movie,star,comment
171,超脱,5,好的电影就是这样，真实，而又教会你面对人生。学会自我超脱，这样才能更好的活下去。
172,超脱,4,看着很压抑...
173,超脱,5,老师也无奈。
174,超脱,5,需要再看几遍，深入灵魂的对白
175,超脱,5,Detachment（为什么阅读这个问题在里面回答了~
176,超脱,4,很少遇到忧伤、绝望得沉默而如此让人无力承担的片子。。
177,超脱,5,“一次次泪倾，哭到胸口抽痛、难以呼吸。当我们感到需要暖意，首先要学会的，是彼此拥抱。穷尽一生，我们要学会的，不过是彼此拥抱。只因“一个人可以轻易地学会不在乎，但学会在乎，却要付出百倍的努力和勇气”，再不要独自一人穿过灰暗暝寂的暮色，在生命荒芜心脏冷却之前，彼此拥抱”
178,超脱,4,"教育有时就是把一群孩子聚在一起，让他们在斗嘴之间对社会失去信心。
自信这东西有时很渺茫，不过是建一座心墙，将别人的嘲讽与不屑挡在外面，没有你就完了・・・"
179,超脱,4,人们彼此疏远内心却支离破碎。每天结束后，也许你是常人中偏执又疯狂的那一个。不论幸是不幸，你的挣扎，无人能见，无人能懂。
180,超脱,4,在这个物欲横流的时代，每个人都应该建一座精神城堡保护自己。
181,超脱,5,本来觉得这样的片子不会哭。。结果还是触到泪点了。。
182,超脱,4,"Fortunately, or unfortunately, no one will see your struggle.―好片，但是不推荐。相较于积极的情绪，人们更容易被消极的情绪感染。"
183,超脱,4,我们在拯救别人的同时也在拯救自己。
184,超脱,4,挖坑影评《教之殇》
185,超脱,4,美国电影不仅仅是好莱坞……这部电影需要找翻译较好的字幕来看。加缪那句话最好的翻译是：【我从未像现在这样深切的感受到，如此超脱于自身，却依存于世界。】 ……这片要是让看电影爱哭的窦文涛看，他得哭几回啊……
186,超脱,5,I love you henry
187,超脱,4,评论到侃到乱伦什么去了，真心视角独特！我只看到了一副躯壳在不断地用别人的灵魂填充自己，扮演着上帝的角色！
188,超脱,4,你要知道你做不了所有人的天使，但你给了他们唯一的希望又抛弃他们比恶魔还残忍。。你怎么没有看到自己不过是个用温情腐蚀别人伤口的恶魔呢？禁锢自己不是坚强，对于满眼残忍的悲伤无助吧？孤独吧？我们每个人都缺失了一块，请别用道貌岸然让我自以为的爱将我置于死地。。
189,超脱,4,布罗迪终于不瞎搞了...
190,超脱,4,我们都只不过想向这个世界要一个温柔的拥抱。
191,超脱,4,I like it    
192,超脱,5,很好很好
193,超脱,5,！
194,超脱,4,别具一格的教育故事，“每个人都有自己的问题”，AB很动情，故事谈不上多么惊艳，却因为新鲜而诡异的风格，让电影有了独特魅力。
195,超脱,5,“穷尽一生，我们要学会的，不过只是彼此拥抱。”
196,超脱,4,我讨厌这种阴郁的感觉，就像我们一直选择逃避真正的问题一样，这些来自外界而我们不能承受之重，并没有让我们坚强，而是装聪明掩饰恐惧和不安。
197,超脱,5,doublethink
198,超脱,5,放弃信仰和互助，从未有过的虚无感，丧失理智、道义、伦理和规则，充满堕落和罪恶。种种不幸，种种无奈，种种缺失，种种虚无。我们习惯于于此，源自于自我意识的失控、互助的缺失和颓废的滋生，在一个堕落的价值体系里，自然丧失的人性，这便是最大的悲哀。 8.7分
199,超脱,5,每个人都有问题；除了衰老疾病和死亡，其他都能改变；要有自己的时间；保持头脑清醒，保持心境澄明。
200,超脱,3,虚高
201,超脱,3,又名：一个把妹高手的内心挣扎。
202,超脱,3,灵魂困在空壳中，好似《厄舍府的倒塌》中的兄妹，挠抓棺盖渴望超脱。看起来像是时代的说教，但它却是最露骨的真实。既然教育的本质就是独立思考，那么该清楚为何思考。既然知晓其中的谬误，就不该再去相信谎言。
203,超脱,3,三星半。以悲悯的眼神垂怜着这个社会的悲哀，但布罗迪终究不是耶稣，无法背负这个世界的罪恶，面对崩塌，也只能束手无策。影片曾提到可以帮助人们躲避罪恶侵蚀的书籍，但这种力量被低估了，只是偶尔被提到。它只是一个悲恸的故事，缺乏力量。
204,超脱,3,在事隔十多年后，托尼・凯耶仍然在死磕那帮稚嫩生涩的问题少年，其间还不忘抹上一道他乐于讨论的法西斯主义。可是也不知是幸与不幸，本片最终环绕的始终是过于耀眼的小清新气质，而8.8的超高分再次证明了小清新才是豆瓣的主宰
205,超脱,3,这种风格，要是部5分钟的公益广告短片或者MV之类的，才能说得上好看吧。
206,超脱,3,从头到尾都很压抑就是了。。。
207,超脱,3,孤独症患者
208,超脱,3,再见独立，不知所云。学生被教室和高考折磨至死，而彼岸，教师在学生和生活下不堪重负。无法理解字幕
209,超脱,3,太沉重。。。
210,超脱,3,以为又是春风化雨，光明逆转的电影。结果竟然“苦逼+沉沦”的无可救药。每说一句，“NO CHILD LEFT BEHIND”就是一次反讽。这样的负面故事不看也罢。不推荐。
211,超脱,3,抱着看男主角帅帅的心态看，还行。
212,超脱,3,很郁闷的电影
213,超脱,3,对这种矫情的狗血剧真得无感，而且电影里的这些小孩都好讨人厌，要我说就不要管他们让他们自生自灭去…我天朝也能拍这种电影，而且更适合拍…
214,超脱,3,人的心绪是道很耐揣摩的线条。苦闷，烦乱，强烈的恶心，压抑感。充斥着睁眼之后的世界和闭眼之后的梦境。没有出口。什么时候起，悄悄藏好（遗忘）真实感官，麻木冷漠。对一切的磨难困境，需要面对的遭遇看透，平静对待。但又有谁会看到嘴角牵动眼梢而漾的细微皱动？“我们都一样，都能感觉到苦痛”
215,超脱,3,这是一部很符合豆瓣文青们标榜自己独到见解，发表装逼言论的电影
216,超脱,3,挺喜欢的。。但这对我来说太艺术了。。
217,超脱,3,"冲着高分去的,但看完没什么感觉.也许我这人天生冷血吧."
218,超脱,3,默默的看完，默默的评论
219,超脱,3,这片豆瓣评价居然还挺高，虽然大概明白这片子的主旨是教育和尊重女性，但还是在看的过程中觉得有点小平淡啊，果然不是我的菜。。。
220,超脱,3,情绪拍得很好，但探讨问题的力度不及《半个尼尔森》（另，美国教育问题真的如此糟糕吗？
221,超脱,3,这部电影的神奇之处在于，当你以为它是《放牛班的春天》时，它变成了《大象》；当你以为它是《我们天上见》时，它变成了《晚娘》；而当你觉得马上就要《这个杀手不太冷》的时候，它又变成了《雾都孤儿》！而在电影的最后我们才发现，原来它其实是《盗梦空间》！！ 
222,超脱,3,并不能感同身受，发现我的心理太健康了
223,超脱,3,混沌
224,超脱,3,太文艺了
225,超脱,3,闪回是一大特色。揭示美帝下层人民教育的各种矛盾，家庭里父母没有尽到自己的责任，在学校里老师苦口婆心学生仍旧兴风作浪。这种文艺类片子，青春期一忧伤就离自杀不远了。玉姐戴上眼镜让我老往教室调教系列想。
226,超脱,3,被告白比下去了吧
227,超脱,3,语文老师的教学方式非常合理。但对于精神痛苦的讨论我不同意。
228,超脱,3,教师果真是一门痛苦的职业啊（我果真是一个理解程度及其肤浅的人。。。）
229,超脱,3,过于悲恸，难抵超脱。从那个女学生自杀起到结尾，个人感觉比较败笔，有点刻意和违和感，不及前面杀伤力强。
230,超脱,3,看了一头雾水 ，有一种沉重的感觉，、
231,超脱,3,压抑
232,超脱,3,看完之后有一种特别虚无的感觉。
233,超脱,3,沉闷的片子，但总有一种力量拉着我往下看
234,超脱,3,伪记实加上伪访谈穿插其中真是让我觉得相当蛋疼。形式蛋疼也就罢了，故事方面吧，为何人活着就一定得这么苦？我一天倒是无聊，倒是觉得些许孤单，但剧中那种蛋疼、忧伤、没有自我存在感的感觉一点也没共鸣。蛋疼就俩字。也就豆瓣这种小清新聚集地能冲到8.8分。多加一星给可爱的96年小美女萨米盖尔。
235,超脱,3,花样真多，叙事，镜头，对白，音效都别出一格。只是我并不欣赏，装13的本事比大卫林奇，王家卫差太远了。不过电影不难看，不拖沓也不乏味，还行。 
236,超脱,3,就像在听Damien Rice的歌。萨米・盖尔，你的表演让那些女明星无地自容。
237,超脱,3,一行尸走肉般的人遇到另一行尸走肉，拇司湍芟嗷シ龀郑光生活了幔浚∥疵馓天真了。得不了正，只是已律系囊豢貌荩以樽プ×讼Ｍ，只不^^望前的一次玩笑。
238,超脱,3,与期待完全不符，根本没看到什么关于教育方式的探讨，只有莫名其妙弥漫全片的死亡气息，滞重却没有着力点，对不良少年人生困境的解释到最后落实的竟然只有一个“肥胖”？无病呻吟了点吧。
239,超脱,3,看完难受，一想到还没有开始复习更难受！
240,超脱,3,有些人是用行动演戏。有些人的脸天生长的就是一场戏。内小表情...
241,超脱,3,在灰暗的生活里寻找一丝温暖，抑或创造温暖。
242,超脱,3,并没有打动我
243,超脱,3,文艺到我无法负荷。
244,超脱,3,"三星半 没有悲天悯人的那样高度所以看不出太深刻的人文关怀。
帅气的主角演绎出不一样的老师很精彩。
胖学生的死更加说明男的就是视觉动物。"
245,超脱,3,布洛迪坚定地走在那条凋零路线上啊。。。
246,超脱,3,这种无病呻吟也只有在豆瓣上倍受追捧了。
247,超脱,3,又是把自己的小痛苦放的无限大，看在AdrienBrody 八字眉上给个及格
248,超脱,3,我看不懂
249,超脱,3,感觉像2001年那个Manic一样，都反映着少年的问题。看不出来这是现实的状况还是只是警示。
250,超脱,3,AB演技超好，情节让我觉得太极端。
251,超脱,3,我不知道该说些什么了。颓废厌世充满绝望气息，终我一生找到这样一个拥抱何其难。
252,超脱,3,Detachment & Universal，各种伪类型手法，少女救赎记。
253,超脱,3,压抑的片子，教师和学生、家长和孩子，以及教育制度都有看似无法改变的悲剧现实，又能怎样呢
254,超脱,3,无病呻吟了。
255,超脱,3,三星半。Adrien Brody的演技值5星，以及他和他外公的关系（评论里的那些YY都是胡咧咧）――摆脱不了与生俱来莫名其妙的亲密关系，令人厌恶却又要互相负责，才是挥之不去的人生写照）。学校的那群老师不错但仍刻画得太高尚，如果是被责任绑架更好。为了不绝望，还是+了爱，但这样反而打了棉花拳。
256,超脱,3,我不太理解看这片子哭好几次的人同学，其实这片子挺无聊的，看着看着我都快睡着了。像我们这样还没来得及叛逆就过了叛逆期的中国学生，不知道是该庆幸还是该遗憾。。。男主和街边堕落少女的模式让我想起了《杀手里昂》，夕阳下的拥抱美死了美死了~~
257,超脱,3,sad
258,超脱,3,表现手法太矫情了，片子本身就像西施皱眉抚胸口一样，有很本来应该挖掘的东西莫名演着演着就扔一边了，形式大于内容。米国的东西也就这样了。
259,超脱,3,这个遄至车钠质好像就从没阳光过~
260,超脱,3,"好是好 许多共鸣 文艺地未免太做作了 分高的莫名其妙 大鼻子的演技还是不错的
"
261,超脱,3,单单就是不喜欢用乱伦之类做前提的片子 有种讨巧的感觉 就好像用一种绝望的本能来叙述本能的绝望 绕来绕去就是个死胡同 叙述本身失去了意义
262,超脱,3,这。。。明显又是一部牵动文艺小青年们脆弱敏感的小心灵的电影-__-
263,超脱,3,nihilism，不如同题材的Shame
264,超脱,3,都有病都死了吧穆妮根胸怎么能是耷拉的呢
265,超脱,3,实在不喜欢通篇都是散文诗一般的片。电影就是戏剧动作推动情节。任何语言都是乏力的。
266,超脱,3,男主为什么每次上公交都只站着，而且镜头完全不交待公交车的内部，如果导演觉得没必要等待，他完全可以不留男主上车的镜头
267,超脱,3,压抑，混乱。感受不到那么多深意，倒觉得有点做作。许是我浅薄吧
268,超脱,3,美国社区教师也很苦逼
269,超脱,3,这电影其实不错，但我实在不喜欢这压抑的氛围，看完能让人郁闷很久。绝望包围着你，怎么都摆脱不了也逃不出去。人人看起来都是那么哀伤。愤怒绝望迷茫自弃的青少年…教师是什么？教师也是人。曾经你们以为的反叛与个性，现今看来是多么的可悲可怜与可笑。
270,超脱,3,看到老G和Will的老妈了 好开心喔！
271,超脱,3,为文艺而文艺。刘玉玲没把握好，钢琴师演得不错
272,超脱,3,不明白评价为什么那么好。全球的教师片不外乎两种：热血或情欲。这部不太一样，非常的抑郁和绝望。“失败的意义就是让每个人都失望，包括我们自己。”
273,超脱,3,一个破碎的我怎么拯救一个破碎的你
274,超脱,3,没看懂，感觉好沉重。
275,超脱,3,为什么我对公认的好电影一点想法都没有，没有人生、人性、成长的思考。原以为是像GTO一样的电影，结果整部电影很阴冷，不知道是不是不喜欢频繁切换的电影手法看得有点晕，
276,超脱,3,never have i felt so deeply at one and the same time so detached from myself and so present in the world...
277,超脱,3,预期有些高，因为豆瓣上的评分相当高。布罗迪天生一副寂寞敏感的模样，倒是很有魅力。只不过就如同女孩的父亲理解不了她的作品一样，我很不幸，没有其他豆友毫不犹豫五星的决绝，看来算是我的损失。
278,超脱,3,到最后也不知道这到底讲的是谁的故事。技术弄多了就显得夸张，夸张到像看这个片子都能“几乎从头哭到尾”的人。
279,超脱,3,"""一个人可以轻易地学会不在乎，但学会在乎，却要付出百倍的努力和勇气"""
280,超脱,3,一开始还以为是国外GTO...
281,超脱,3,演员很棒， 但是太压抑了。。。 
282,超脱,3,整片充满晦暗低迷的情感，我只能说，我看不懂……
283,超脱,3,《Detachment》太压抑了，剧中每个人都是病态虚弱的内心，期待别人的拯救很不靠谱，而老师的本职在剧中被赋予了太重的压力，愿你被这世界温柔对待，
284,超脱,3,Life is miserable。忧郁固然有魅力，但我们必须追求健全。
285,超脱,3,人生的一开始就走在错误的路上时间多么悲哀的事情
286,超脱,3,太过压抑，直面孤独，电影是好电影，但更欣赏正能量电影，SO，不推荐。
287,超脱,3,不知道如何评价，基调非常悲伤。
288,超脱,3,压抑或悲伤，痛苦或孤独，我们都希望能超脱于此。布罗迪表演加分！
289,超脱,3,太刻意，太煽情，音乐倒不错
290,超脱,3,超脱就没有压力了？
291,超脱,3,不理解为嘛会那么高分。有个评论说的好，这是一部神奇的电影，混杂了太多知名电影的元素和逻辑，结果一塌糊涂。如果不是AB演的，会有人去看吗？如果不是师生恋萝莉控题材，会有人去看吗？如果没有爱伦坡当渲染，会有人去看吗？
292,超脱,3,是挺悲的
293,超脱,3,"疼痛又压抑，跟放牛班的春天那种治愈系调调完全相反。选中人生最中二也最茫然的年龄段刻画，满眼寂寞绝望无奈的同时仍要卑微地坚持“引导”。大叔萝莉同居的桥段让人想起杀手里昂。推荐觉得人生无望的少年和有志教育事业的青年看。

"
294,超脱,3,主角怀疑外公是父亲，所以想通过回忆录确定真相。小萝莉得艾滋，胖妞暗恋表白失败自杀，一部相当压抑的电影，对白暗示很多，是可以多看几遍的类型，只是太用脑。
295,超脱,3,如何在这个脏乱差的社会保卫自我？如何分清我和被赋予的我？一个关于个体与群体的社会心理的故事。凸显了个体在这个设定好的社会的反抗与压抑。每个人都一样，无法超脱，甚至都不能保护自己。纪录片风格加上不断闪回的叙事手段，试图让人产生更真实的共鸣。演的不错，但很难给这个苦大仇深的故事高分。
296,超脱,3,今天看的电影都太变态了
297,超脱,3,没什么新意的电影，每个人都想在崩溃边缘寻求超脱，但真正超脱的只有自杀的胖女孩，片名还不如翻译成为一个好老师，不喜欢其中的闪回处理还有伪纪录片桥段，动画片段倒还可以
298,超脱,3,这部电影很忧郁，虽然很高评分，但我不太喜欢！
299,超脱,3,看完很压抑
300,超脱,3,感觉是部好片，但看不太懂....
301,超脱,3,不知道分数为什么这么高？不可能在中国上映，所以不应该是刷出来的。但。。。整体基调不明，意识流过多，拍摄花俏但流于形式
302,超脱,3,看的不是很明白，也不深究了，不过豆瓣评分出奇的高，看来我是文艺不起来了
303,超脱,3,太表面化了，跟那些大特写的镜头一样让人头疼
304,超脱,3,"这种""everything's gonna be ok""类的片子走这种抑郁路线真不够讨好。AB叔是我的型！不过长相注定只能演非主流片阿。桃桃说，男人大概都梦想要在街上拯救一个雏妓吧= ="
305,超脱,3,发现自己，认识自己，每个人都有一座自己该面对的炼狱
306,超脱,3,除了男主的演技外 全都不喜欢
307,超脱,3,刚开始以为是又一部放牛班，但几分钟之后就发现它其实是以教育为切入点来展示世界的残酷、人之冷漠以及无法交流自我封闭的困顿。当男主领着雏妓回家时，我在想该不会又要拯救他人与自我救赎吧，结果导演真的选择了这种最虚假最糟糕的叙事模式，这也是我只给三颗星的原因。
308,超脱,3,不说他不好，就是不平易近人了。作为一部电影，它不够好
309,超脱,3,期间很多说法和观念俺都接受。但这个拍法多少还是有点存疑。
310,超脱,3,苦逼马脸哥从头到尾愁眉苦脸演绎的一部压抑到死的苦逼电影，看的累死我的了，不是我的菜
311,超脱,3,人若不走出自己内心的阴暗，如何能为别人撑伞？
312,超脱,3,结尾的拥抱和在废弃教室中的场景很棒，不过可能是不懂美国教育制度吧，不知道这只闷骚是为了什么...
313,超脱,3,一夜看了两次？哭到胸口痛？我却什么都没感觉到，除了一幕关于他爷爷的。。
314,超脱,3,有所背负，是解脱，是沦陷。
315,超脱,3,评分高的离谱。文青们就有这么多的扭曲苦闷要去炫耀么。阳光少年我完全无法理解矫情的“在电影院里一遍遍哭泣”
316,超脱,3,美国的这种学校最不能去，恶性循环太毁人了，连老师都是如此，90后青少年看来成了世界性问题，小女孩演的蛮不错，那双含泪的眼睛，真是楚楚动人，BRODY先生有所改观，有点喜欢上他了，LUCY LIU真胡萝卜了，动作片直接跳这种路线！
317,超脱,3,忧伤，满地忧伤……
318,超脱,3,看完短评第一页，我一度以为我看的不是这部电影；果然一如预想中的差强人意，几段灵光一闪的对白撑起了整部赘余过多的剧情；关注Sami Gayle；3.5
319,超脱,3,有很多理由爱这部电影：教育、爱伦坡、影帝级表演；有一个理由不爱这部电影：整片的压抑与邪恶的暴露。美国教育也有灰色地带。We have such a responsibility to guide a young so that they don't end up falling apart. 一个边缘人教着一群边缘人。教师真不好当。
320,超脱,3,老生常谈
321,超脱,3,"太文艺了，
















评价不了，豆瓣上给高分的给跪了"
322,超脱,3,矫情，做作，装逼。看评价期望很大，看完觉得很渣。不是皱着眉头就一定是苦的。
323,超脱,3,太沉重了
324,超脱,3,没给高分是因为我猜到了结局以及这个译名实在是太难听了
325,超脱,3,面对一片荒芜，朗诵经典的心情，也只能既存在又抽离，因为人性如此。绝望之为虚妄，正与希望相同。
326,超脱,3,演员做戏很假，摄影幼稚很乱，编剧想法很烂。
327,超脱,3,影片确实不错，无限放大了生活中的压力，悲伤，黑暗面。身为天朝人民这些究竟算什么？出现如此高的分数，要么您感同身受，要么您现在才发现活着其实不容易……
328,超脱,3,看到这种阴暗厌世冷漠又粗口的片子居然毫无共鸣，我到底是一个多么阳光灿烂热爱生活的姑娘啊~
329,超脱,3,把所有的狗血剧情揉在一起，就能成就一部伟大的电影吗？NO！
330,超脱,3,实在是不想推荐，是因为题材太沉重。渐渐开始不能看这样的片子，因为真话总是最难听的。唔，生活是美好的。
331,超脱,3,影帝演得不错
332,超脱,3,剪辑有特点，但是文艺式的青春为什么总离不开死亡？最后的自杀是最大的败笔！！心水短发女孩，必有前途。
333,超脱,3,一点感觉都木有
334,超脱,3,"captain，oh, my captain! "
335,超脱,3,作者电影
336,超脱,3,跟简介写的一样吗？根本不，是不停的告诉你会好起来会好起来，但心里的想法是无可救药。前情除了母逝并无明白交代，结尾学校化为废墟只能理解为学生无可救药的自废老师们无计可施。超脱在哪里了？谈论形而上的情感本身是无尽头且无意义的。作为对抗过老师的坏学生反而是被刘玉玲发飙那场给moving
337,超脱,3,语文老师总是有点疯狂的，不是忧郁的就是疯癫的，真没有那么多时间去唧唧歪歪思考怎么挽救孩子。而最令我不信服的就是他上课时把一帮熊孩子扭转成乖囡囡的过程，这个过程是缺席的。我曾经的烂校校长应接不暇时还保持着偷一块小蛋糕吃的恶趣味。这是一部文艺电影，而现实中你没有哀伤的权利和时间
338,超脱,3,让人感到绝望
339,超脱,3,谁再说我文艺我真的要反驳！类似于《凯文怎么了》的拍摄手法，永远吃不消。
340,超脱,3,有点忘记剧情了，大约是一位大叔要拯救美少女，按着情色片的路子来就是Lolita，按着人性片的路子来就是种种高大全什么的
341,超脱,3,一个反映美国高中教师心理现状的片子，有必要这么文艺范儿吗？
342,超脱,3,好沉重
343,超脱,3,太晦涩的赶脚
344,超脱,3,只能说有点小意思吧
345,超脱,3,每个人都有难以启齿的经历不愿意建立长久关系或责任那是因为曾经的受伤。Brody依旧是带点悲情的笑对人生。亲力亲为拯救一个个年轻堕落自暴自弃的青年也让自己解脱。环境是如此重要不幸的家庭才会有不幸的下一代。
346,超脱,3,不如旧作《美国X档案》。
347,超脱,3,片子极度阴暗，不适合内心消极，压抑，阴郁的人观看，因为看完之后可能症状会加重。即便男主人公是Jesus一样的人，但在所有这一切阴暗的剧情下，也无法做任何改变。
348,超脱,3,可惜了，不应该在今天看这部片子的。改天重新看一遍好了
349,超脱,3,抱歉我没看完，因为男主角长的太难受了
350,超脱,3,Adrien Brody 这牛逼哄哄的演技啊！
351,超脱,3,辶晨吹奈页脱剧情了，看片途中一直想起“心灵烙码”那部电影。虽然跟超脱讲的故事不同，相似的表达方式心灵烙码更棒。
352,超脱,3,托尼・凯耶开窍了啊，类似《珍爱》的90年代独立电影拍法，不过调门忧郁的多，这片里也设置了一个不讨喜角色供消解（那个当众自杀给自己加戏的胖闺女），里面有导演的自信。超8家庭录像感回忆画面、粉笔画动画间插、类似库布里克的广角以及贯穿始终的喧闹世间宠辱不惊的态度，营造人人扭结的待救赎浮世
353,超脱,3,真清晰
354,超脱,3,内心赘述冗长。
355,超脱,3,一个破碎的我，如何拯救一个破碎的你？
356,超脱,3,除了Adrien Brody的身材外没觉得多好
357,超脱,3,抑郁的片子
358,超脱,3,超脱是每个人毕生都在追求的事吧
359,超脱,3,我，看不懂
360,超脱,3,看这样的电影感觉愤怒。千万不要在美国当老师。
361,超脱,3,"'There should be prerequisite curriculum from being a parent, before the people attempt.' 以及AB叔演得真好……"
362,超脱,3,虽然我不刷微薄，但我不认为花98分钟看一部装逼电影就比刷微薄高明了。
363,超脱,3,太过孤独的文艺片，太压抑了，都快扛不住了
364,超脱,3,"整部电影都浸泡在一种湿漉漉的悲剧气氛里感觉就像水缸里捞出来的电影。题材不得不让人想起""自由作家""，都是不听话的坏学生和善良的老师，但是这个片给人的感觉就太阴柔了一些"
