,movie,star,comment
365,超脱,3,这片我真心看不进去。男主永远都是这一副大衰脸么。。
366,超脱,3,"头痛的不行,不知不觉看完了,看完之后觉得头更疼,此片让人心情难受"
367,超脱,3,美国的小孩明显没有中国好教育
368,超脱,3,感觉说了很多但都没说好，尤其是你们怎么推断出乱伦的假设？？？这类独白的方式很容易陷入矫情，而如果要主动调用自己的人生经历去揣测人物情感，而非自然地被触动情感，个人极不喜欢。
369,超脱,3,怎么老在看这种阴暗的电影！
370,超脱,3,压抑
371,超脱,3,"如果轻声告诉你，我们每个人都一样，生活对于我们都一样糟，你会不会好过1点..failure,we're failing,we're letting everyone down,including ourselves."
372,超脱,3,影片要讲的东西很多，我挺喜欢那些主人公记忆碎片的闪回，但终究还是觉得少了点什么。台词是这部影片的灵魂，大部分很精彩，但不够贴近人心，有点空大虚般的说教，又感觉有点创作者的臆想在里面，当然这些成分很少，导演诚意十足，演员表演非常棒。
373,超脱,3,虽然评分很高，但我却看得不怎么带感，可能跟个人心情有关吧~觉得闷了点，其实都活得好好的，没病没残，偏就得一个劲忧郁，讲的人物太多，分不清来去缘由。
374,超脱,3,为啥米这片评价这么高，难道只有我觉得它有点装13么 
375,超脱,3,难以理解有这么高的分………开头就塌了……走在中间以为要牛铝耍结果还是怂了……对一个老师能否有这么大的教导意义表示怀疑
376,超脱,3,未免太成长教育了一点。和美国叉档案一样，站得这么端正。刘玉玲和好莱坞女士的角色比起主角更典型，布洛迪你还是直接去传教比较靠谱。
377,超脱,3,忽好忽坏的，Christina打酱油
378,超脱,3,也许
379,超脱,3,于是我们在这生活里，不断超脱不断超脱不断超脱不断超脱......
380,超脱,3,年纪大了，欣赏不了文绉绉的东西了=。=
381,超脱,3,好多地方穿帮了。。
382,超脱,3,"you can't solve all the problems. you just go with them, live with them in your own way."
383,超脱,3,在无比阴郁的一晚看了无比阴郁的一部，结果更加阴郁了。
384,超脱,3,用快速闪动的镜头揭示人物的心理，景别的衔接很有特点。
385,超脱,3,一个人可以轻易学会不在乎，但是要学会在乎却需要努力和勇气
386,超脱,3,心理辅导片
387,超脱,3,跟《暴龙》很像
388,超脱,3,气氛很好，“钢琴师”的气质加上不断穿插的旁白很有效。没有一种生活是简单的，人人都有自己的痛苦。
389,超脱,3,每个人目睹别人的苦难，到最后能看到的无非只是一片狼藉
390,超脱,3,这部片子均分高，是因为它勾起了很多人对生活绝望的感触。
391,超脱,3,这个adrien似乎总是哭丧着脸，这次虽然有装酷的时刻，但更多的时候还是被内心牵绊。能从事这样一份工作，对他更是双重折磨。很多情绪都有出现的原因，只是不是每个人都愿意去探究，更不是每个人都能解开自己的心结。
392,超脱,3,只有我不喜欢吗？只有我觉得闷吗？果然我好没品味。。。。。20171126，迷茫痛苦看出来了，我以前都是什么品味
393,超脱,3,我不是钞票，但是我就像货币一样，从一个人的手里转到另一个人的手里。那个包是没有感觉的，我也没有你能够伤害的感情。失败是我们让所有人失望，包括我们自己。自杀，可以永久性解决暂时性的问题。
394,超脱,3,看得我好压抑
395,超脱,3,传递无边绝望的孤独的电影
396,超脱,3,"这种把所有的不幸和人间惨剧堆在一起然后再说一句""一切都会好的""的电影。你们是多么的残忍，你们又是多么的无聊。"
397,超脱,3,【12.10.2】对这种心灵独白与救赎的电影不感兴趣，几乎看不下去。这么高的分，真是各有所好。Adrien Brody真是长着一副悲剧式的脸孔啊。Sami Gayle年轻美丽，她使她所饰演的这个角色笼罩着一种青涩纯洁的气息。
398,超脱,3,1、开始的那段真的对个人很有触动作用 2、整个片子太抑郁了 3、拍摄的整体感觉像是欧美pron...4、布洛迪最近几年的片子还真是（新铁血战士、人兽杂交）。。。真心觉得演完这些片子 丫该疯了
399,超脱,3,有些人迫切地需要C明自己，他需要得到一些人的刍蛘叩玫疥P眩不然他就像一尾o水的~，死在@薄鍪澜绲幕哪Y。中心意思表F的算突出，但是不知道什麽不X得感踊蛘哂|樱人以椴]有urf的那N好，可能是我^於愚木吧。
400,超脱,2,你们都理解错了电影主旨好么！大叔最终抱得瘦萝莉，胖妞只有服毒自杀。其实这是一部减肥励志片好么！
401,超脱,2,“一切都会好的”已经欺骗不liǎo我了  
402,超脱,1,各种装逼手法，构建大量二元对立――胶片与高清、生与死、耶稣与莫大拉的玛利亚、信念与堕落，等等，最大对立是在营造男主角的内心诗意与现实残酷。形式上的逼算是给他装上了，但是内容实在不堪，假大空。
403,超脱,2,加速抑郁
404,超脱,2,各种折腾跟假装掏心窝子，不喜欢。
405,超脱,2,"无新意,文艺腔,晒悲催,想克隆taxi driver?"
406,超脱,2,那种说教的口吻，矫情的台词，还是省省吧，起码先做到把主题讲清楚
407,超脱,2,他曾是两个姑娘的光，黑夜里孤寂的生物越悲伤越渴望。布洛迪那张禁欲脸配上大段大段枯萎的独白真是让人惆怅，镜头任意的闪回和推拉摇移看得人心慌。全片压抑沉闷，充满了个人的独特风格，让人看了却充满了睡意。那些潜藏着的欲望不得不被锁在笼中，影片中的角色如困兽，不如那些学生洒脱不羁流放青春。
408,超脱,2,很有情绪感染力的表现方式，丰富饱满的视觉美感，以及好听的配乐和出色的演员。但是叙事完全一塌糊涂，那么多抑郁悲伤绝望就成了华而不实的空壳，就像男主角大段大段的说教台词那样做作且肤浅。
409,超脱,2,乱七八糟，镜头乱切
410,超脱,1,第一次看了五分钟，中止；第二次看了半个小时，弃。实在看不进去
411,超脱,2,文艺范十足。从头到尾。
412,超脱,2,@言若浮萍 忧郁的调子加上老师天生遄至常没有weigh falling down都觉得沉重，特别是结尾特地用爱伦坡句子重压点缀，和前面加缪的那种迷茫随意生活调子，两个双管齐下增重50磅在肩上。
413,超脱,2,把教师的意义捧得太高了
414,超脱,2,everybody难受得满地打滚儿。。。
415,超脱,2,太苦逼了
416,超脱,2,纪录片(访谈、亢奋过度的镜头)加故事片(闪回，制造故事悬念，戏剧化的布局)，又有插入动画…我不知道整个故事要讲教育还是个人心理…总之，乱糟糟的一片。
417,超脱,2,导演想涵盖的情感太多，结果都没有把握到位，看来看去也不知道想突出表达的是什么，剧情片一旦搭上文艺的色彩就很危险了，因为文艺与2b只有一线之隔。
418,超脱,2,浪费时间
419,超脱,2,现代人价值观怎么了，这么闷的电影也能打高分。
420,超脱,2,"生者超度死者, 死者超脱生者."
421,超脱,2,"加缪,爱伦坡也救不了这部烂片."
422,超脱,2,只有布罗迪和那东欧雏妓的感情关系有点趣
423,超脱,2,"]k法,太阂至,拍@N]出口的|西是要干嘛"
424,超脱,2,很深奥，但太深奥，未必好
425,超脱,2,总感觉导演应该是个拍MV的，百度了下果不其然，差的让人不想评论，写这些个字儿为了发泄下被忽悠的消极情绪……
426,超脱,2,不知道是不是好片，心静不下来，所以真心没看完，看了一半果断关了，没有什么引起我注意的地方。豆瓣这片评分真给力!
427,超脱,2,各种蛋疼
428,超脱,2,"""Ultimately, Detachment invites us to feel precisely what it warns against detached."" by Rick Groen   中黑！"
429,超脱,2,这片就像它的片名一样做作的令人发指・・・
430,超脱,2,剧情简介写的比电影好看多了
431,超脱,2,what the fack.......
432,超脱,2,如果要用校园来表达这样深厚的主题就必须像61告白62般变态到极致才行。不然力度根本不够！显得有些故弄玄虚。驴脸的演技也没想像中好。剪辑和配乐倒是很赞，大大弥补了叙事的凌乱。也让人明白天朝中学生苦逼归苦逼，身心还是较为健康的。典型的中评片
433,超脱,2,3- 空、丧、作。Adrien Brody的设定几乎卡夫卡附身。首尾摘引加缪存在主义与爱伦坡心理分析不得其妙，呵呵只能给减法。可惜了不错的想法和对于独立电影来说有点豪华的卡司。  #虚无主义玩过火# #伤痛拍得不够真实导致很多剧情中二#
434,超脱,2,不知所云，不喜欢
435,超脱,2,完全不是我的taste。。。
436,超脱,2,"too long and hollow inside. personal misery distorted to fit all situations, that's the opposite of detachment. "
437,超脱,2,太无聊了
438,超脱,2,无聊，作，假。长Brody这么帅就该天天出去泡妞泡帅哥喝酒乱搞。搞这么苦逼被一群无脑teenage loser搞这么抑郁神经病啊。里面青少年讲脏话非常令人不舒服。
439,超脱,2,镜头好乱
440,超脱,1,太阴郁了 完全不觉得好看
441,超脱,2,好在何处？文艺装逼片！
442,超脱,2,装逼……
443,超脱,1,没劲
444,超脱,2,我和那些打五星的人的区别就是：他们是看《钢琴家》认识男主角的 我是看《人兽杂交》认识的。 
445,超脱,2,伪文艺
446,超脱,2,挺装的
447,超脱,2,只是交待了个阴暗的现实，比起一般类型电影多了些最后无法收尾的思考，但是我也不觉得是什么开放式的结局
448,超脱,2,情绪的不断压抑不断爆发从未停止。布罗迪对文艺小片的坚守和演技都值得称赞，当然不排除无大片可演。。结尾加分。
449,超脱,2,看见男主我就想起人兽杂交了 满眼的5分 顿时觉得自己好肤浅
450,超脱,2,既沉闷又虚伪的一部电影
451,超脱,2,看着好累
452,超脱,1,无聊。无力。
453,超脱,1,完全无法理解，没有得到任何观赏愉悦。各种哭丧脸，讨厌
454,超脱,1,waste of time
455,超脱,2,没有点。什么点都没有
456,超脱,2,理解不能~~这种片子果然不适合我~
457,超脱,1,我对这部电影有抵制情绪，对，烂片。
458,超脱,2,可能这种片子要看不止一遍
459,超脱,2,Adrien Brody的一脸苦逼真的是这部电影的全部了。剧情空洞、人物单薄、剪辑浮躁、各种突兀的变焦镜头更是让人心烦。
460,超脱,2,也没那么好吧，如果说表现校园暴力，那比bangbang差远了。我的感觉就是life is tough，每个人都很悲伤。男主选的很好，就是他这种一脸苦逼样的，我对她无感，羡慕他艳遇如此多
461,超脱,2,真不懂
462,超脱,2,2.5  我好w\
463,超脱,2,继凯文怎么了之后又一部拍的越好越讨厌的电影，因为无法认同
464,超脱,2,因为两撇八字眉，这位影帝总是出演悲情内涵忧郁男主角。要说还是那些励志型的师生影视作品合我胃口。“我们要通过阅读，阻止愚蠢想法的渗入，保有自己纯粹的精神世界。”这句话很不错。
465,超脱,2,“一切都会好起来的”这句话本身就很讨厌。
466,超脱,1,继《美国X档案》毁了爱德华诺顿以后，托尼凯耶这一次毁了布罗迪。。用了这么多摄影，还是一部空洞无物的影片，你看不到道德的交锋与人性，只看到镜头之下的无聊微表情。
467,超脱,2,想说的东西太多了又说不清楚，唬弄谁呀。男人面相让我想起一名悲惨的朋友。
468,超脱,2,剪辑弱，故事乱，镜头晃，主题思想极端...一个半小时的MV折磨得我太阳穴发疼……如果我是学生，男猪这样腻歪装逼矫情伪善弱质讲课没有实质性内容的老师绝对是属于我反感的那类。PS 我讨厌的大波妹Joan也演了此剧，果然是物以类聚，每个角色都不是我的type，一星给养老院里那个可怜外公。
469,超脱,2,你们那悲催的苦脸是有缘由的。
470,超脱,2,我个二逼青年认为这种忧伤旋律的片子都是模仿日系连续剧。
471,超脱,2,逼片。。集结B片所有元素。adrian根本不需要演技，长这样往那一站就是本色出演
472,超脱,2,呃。完全无感，除了压抑，太压抑，超脱个P！
473,超脱,2,操他妈的 看的烦死了  中间一段换戒指那还有点希望 后面 妈的 烦
474,超脱,2,什么是装b...
475,超脱,1,一个代课老师来到一所绝望的高中，这所学校聚集了许多具有暴力倾向、缺乏家教的学生。代课老师基本上什么都没做，什么也改变不了。情节沉闷乏味，气氛压抑，没有任何看点。
476,超脱,1,好另啊，I don‘t get it.
477,超脱,2,没看懂= =! 也没想去搞懂的打算……
478,超脱,2,大三毕业前、网吧、通宵、断断续续用了整个通宵中间还睡了两次、发现我真的不适合这种讨论人生的电影、看着别人普遍高分、我却没任何感觉、
479,超脱,2,对不起，我接受不了这样的电影。看到一半，弃。
480,超脱,2,过分压抑
481,超脱,2,有风格，但太说教。如果我揣测得没错，整部电影所想要呈现的恰恰是影像无力――起码也是难以――传达的那些东西。而且就我来看，这样的尝试实在算不上是成功。
482,超脱,2,为啥我要花时间看这么郁闷的电影。我以后再也不看这种了。
483,超脱,2,用一种虚妄的诗意堆砌出一个虚拟的道德楷模。除了导演本人，还有人比这个男主角更苦大仇深、更愿意担忧人类的未来吗？
484,超脱,2,我真的应该相信烂番茄的
485,超脱,2,有些片段还不错，可惜最终不知所云。看在豆瓣这么高分的“面子”上给个两星吧。
486,超脱,2,看的时候集中不了注意力，确实没有看懂。
487,超脱,2,欣赏不起来
488,超脱,2,没看懂。。。
489,超脱,2,看着这一水的五星，真的很有压力，难道你们活得都那么悲怆，那么空洞，那么不知前路吗？虽然我也对生活充满了无奈，但是这就是生活，这本身就不是什么风花雪月的事情，尝试去改变，不如先去了解
490,超脱,2,嗯，不适合这样的夜晚看，很不适合
491,超脱,2,太文艺了，不喜欢
492,超脱,2,我真看不懂。
493,超脱,1,太文艺就是装逼
494,超脱,2,o法w
495,超脱,2,很做作的片，看一半就垃圾桶了
496,超脱,2,假大空好吗，虽然实在是很喜欢艾德里安
497,超脱,2,只因为看完很压抑
498,超脱,2,假大空，电影改名字叫装逼的空洞好了，整个电影就叨逼叨逼的。 2018-08-13。又看了一遍，虽然看到了很多层意思但还是不喜欢，每个人看起来都那么不开心。男主角的演技很好，天生一副愁苦脸。教育 引导的重要性和童年影响
499,超脱,2,阴暗心理剧
500,超脱,1,"没看懂, 教育失败?教育体制问题?家庭教育问题?"
501,超脱,2,补签。我对这部片子做作的判断究竟是错觉还是真的有待重看。
502,超脱,2,迄今最令我产生困意的电影，绵绵不绝
503,超脱,1,完全不是我的菜
504,超脱,2,装逼必备
505,超脱,2,不想活死去
506,超脱,1,镜头好晃好晕，混乱
507,超脱,2,枯燥 故弄玄虚
508,超脱,2,不至于吧。
509,超脱,1,浪费时间。
510,超脱,2,受不了这种处处透着自怜的小众片。里面可爱的小雏妓和布洛迪的关系还勉强看得下去。影片叙事散乱无章，不时莫名插入各种伪访谈，追求记录感的打光摄影，导演的刻意和造作就好像满嘴大金牙，明晃晃的让人不忍直视
511,超脱,2,不喜欢……
512,超脱,2,总感觉这影片水土不服。有影帝？So what？？
513,超脱,1,估计又有一帮抨击中国教育的家伙要开始说风凉话了  反正也没什么好的意见 骂骂街还是会的
514,超脱,2,"not my type 
totally bullshit"
515,超脱,1,什么玩意儿，破镜头瞎晃个什么劲儿.....10分钟时，黑人男孩和迥心名其妙的冲突，生硬虚假老套――我就知道这片儿没什么看头了.......结果果然是我最讨厌的那种一层灰的伪文艺.....8.8分豆瓣瞎眼啦！谁说的这是减肥励志片，真对。
516,超脱,2,不知所谓
517,超脱,1,看蒙圈了。。消受不起
518,超脱,2,没看太明白…
519,超脱,2,豆瓣96名2012-10-28想看；2013-9-7看过，教育家长要重视对孩子的教育，但是太惨烈，这种片子用来教育社会大众效果并不好，另外，男主和其他老师心理已经都有问题了，应该加强对教师的心理辅导。js'
520,超脱,2,"好.要是被@""""o片""真的""感拥.那就擂瘟.
尚嵌际墙o剪接的."
521,超脱,2,我实在摆脱不了男主演人兽杂交的阴影。。。。。。
522,超脱,2,混乱
523,超脱,2,影片装逼极可能导致影评也跟着装逼。
524,超脱,2,此片唯一的煽情手段就是男主角的倒八字眉
525,超脱,2,我不适合看着片儿。。太深奥太压抑了
526,超脱,1,与特别响非常近气质一致，在我看来，属于装逼失败的典型。
527,超脱,2,"
根据郭敬明小说改编的吧"
528,超脱,1,坑跌的电影。。。。。不知掉为什么评分还这么高！
529,超脱,2,哪牛比了？电影看的是故事 不是别的 
530,超脱,2,这么做作的片子。。。。
531,超脱,2,故作高深，实际上假大空得很
532,超脱,2,我自身的肤浅，让我完全无法感同身受。
533,超脱,1,快速播放2.5倍看完的，不知道是我没看懂还是确实就没什么意思
534,超脱,2,首先这种伪纪实的手法就很不喜欢，这镜头前的脸忽大忽小忽明忽暗的，观感上就累！再有，上台威胁老师的老师说我就跟破书包似的没有感觉学生就放弃了，就是各种学生各种三言两语就可以轻松怼回去的！最后这男主是真牛，劝人家从良……影片如果是想表现当今社会每个人都有各种不同的生活烦恼需要根据不同情况不同对待要有积极向上的心态的话，仅这一点值得肯定。在剧情中，当学校所有老师都演绎各种烦恼时，只有男主那边展现出了幸福的情景，小丫头给他做着阳光早餐……基于各种原因，措辞很委婉……
535,超脱,2,我的确没有觉得这片子该有那么高的分数
536,超脱,1,看得我都快了。
537,超脱,2,有原因的悲伤不能叫悲伤，叫装逼
538,超脱,2,最怕а菡J樽约罕扔^明，把想f的都放在演T嘴ef教出怼- 很z憾大多涤^很受用@拥哪w\。- 除了小女孩，其他角色都]感情。
539,超脱,2,我能说除了这张悲伤的脸其他都是bullshit么。
540,超脱,1,大家的评分都很高，可我觉得就是一坨屎。
541,超脱,1,我恨大多数的文艺片，男猪脚在我心里仍是钢琴师的模样，探讨的问题显然不是我感兴趣的
542,超脱,2,十分压抑。诗类作品，注定要自我毁灭。而与妓女的剧情，很俗，妓女为什么就一定是堕落的符号，你拯救了妓女为什么就象征着你自我救赎。
543,超脱,2,整过过程看的我很压抑，更不用说看到世界的美好了...真不知道你们哪看来的。
544,超脱,2,拍摄得毫无新意，于是开始引文装逼。男猪的羸弱模样愣是从钢琴师带到超脱。全片都是cult电影的感觉，这种氛围特别像《梵高：画语人生》+《完美感觉》。这评分高得离谱，必须把它拉回应得的三星。“你们都理解错了电影主旨好么！大叔最终抱得瘦萝莉，胖妞只有服毒自杀。其实这是一部减肥励志”，哈哈。
545,超脱,2,oh   最受不了文艺片了
546,超脱,2,太闷啦~想说什么
547,超脱,1,压抑 悲伤 没疯的看完疯掉了
548,超脱,1,身心处于低估的我实在是不适合看这个片子，成长教育，永不变的话题，but not for now
549,超脱,1,傻鸡巴假大空装逼玩意还有那么多人喜欢也就是大叔萝莉值得一看你瞅瞅你们一个个加缪一个个存在主义的早怎么没看出你们这么有素质都他妈给我滚 
550,超脱,2,完全无法理解的突兀，什么也没有解决还害了一个人，被评分骗了
551,超脱,2,男主便秘脸，演戏每次都一样，还是钢琴师最好看
552,超脱,2,我实在超脱不了……看不懂
553,超脱,1,"形式远大于内容的电影. 没有超脱,只是失控."
554,超脱,2,没看懂 不喜欢
555,超脱,2,死的都是胖子…如果不是布洛迪够帅这片我实在看不下去…
556,超脱,1,做作
557,超脱,2,跳着看完的 里面的娃幸福感都很低 不忍直视
558,超脱,1,"""I feel trapped like the cat."""
559,超脱,2,没啥可说的  看着睡着了
560,超脱,1,"毛啊
"
561,超脱,2,没看懂。。。
562,超脱,2,#老韩看电影#一部米国教育文艺片，太纠结了。。。
563,超脱,1,美版告白
564,超脱,2,已经过了看到镜头前有人哭就会酸鼻子的年纪。
565,超脱,1,传播负能量的片子。。剪辑混乱，闪回过多，没有电影感，倒像电视节目。分数居然极高，就因为传播了负能量，文艺青年真是好哄啊。
566,超脱,1,果然豆瓣的傻逼多，这么个破电影被打那么高分
567,超脱,1,这么强大的卡司，弄的这什么？伪纪录片么
568,超脱,2,I HATE DESPERATE MOVIES!
569,超脱,2,如果我不相信“一切都会好的”
570,超脱,1,什么东西，能看得出来导演是想用心来诠释什么，但真心不是我的菜!!
571,超脱,2,"20200202。2.2分，为什么这么低，全剧最出彩的竟然是爱伦坡的诗你能信？很多地方都很生硬，仿佛那个女同学不死就没法结局似的。剧情和表现手法太差了，看的我是面无表情。有个朋友是老师，也被压力压垮要去看医生。说到底，不过是作茧自缚罢了，我们可以选择自己成为什么样的人和生活。大多数人都被社会关系局限了。可能因为我自认为六亲不认走出来后，心如磐石般坚毅吧。想起有次我去看医生，我说吃的多卵巢痛，我有暴食症。医生坐在桌子上晃着腿玩笑道""那你别吃那么多不就好了XD""那一刻我明白，自己才是悲惨生活的始作俑者。我可以选择快乐。剧情里的小雪花们和现实中的人一样，我经常遇到，哔哔赖赖不知道自己有什么错。拳头不打在自己身上感觉不到痛，一起打在他人身上，再痛也无法感同身受。灵魂只能独行。这也是我们最宝贵的东西。"
572,超脱,2,装逼电影尽管看得我so sad
573,超脱,1,充满了自恋的中二病电影 为Meredith点个赞
574,超脱,2,以极尽夸张的形式把悲伤摆在人眼前看、影片中最不喜欢的两种元素。没Bieber这片没法看了
575,超脱,2,领悟不了，整个影片充满了忧郁和悲凉
576,超脱,1,装的哪门子逼 没病的人都看出病来了！
577,超脱,2,真是情绪化，而且是极度负面灰暗的。导演也很会玩花样
578,超脱,2,看了两遍，我咋完全没有领悟与感动
579,超脱,2,2012.05.25 从没有像他们那样困惑过。
580,超脱,2,看不下去。。。
581,超脱,1,不够文艺看不懂这种艺术类电影，还是去看俗不可耐的特效比看这种要睡着的片子好。
582,超脱,2,不明白高分。从寓意和拍摄手段都不是上呈。最近电影没深度。
583,超脱,2,https://movie.douban.com/review/10486423/
584,超脱,2,这种调调接受不能
585,超脱,2,作为好学生的我表示不懂得另一个世界的人类
586,超脱,1,冷酷的世界不需要这样的电影。
587,超脱,2,电影传达出来的理念绝对是在天朝在自己的教育体系中所最缺少的，因而能够引发大多数人的共鸣。但是电影形式还是太跳脱，虽说这样的剧本简直留给了演员们太多的发挥空间。
588,超脱,2,好文艺，超过我的理解力
589,超脱,2,没有支点的想象，看不进去……
590,超脱,1,说实话，我没看懂，是我的错吗？
591,超脱,2,可能是我不喜欢这类电影吧。
592,超脱,2,"和我情感上完全产生共鸣，这不是别离那种看完想让我鼓掌的五星。一个半小时里我都不记得我坐在黑暗影院里哭了多少次，我第一次这么想它不要结束，想我的身体可以破碎成为所有被描述的情感的一部分，每个人都有问题，大多数的它们都无解。很多时候去死真的不是逃避只是我不乐意陪你们玩了而已。 
"
593,超脱,2,我对这片没感觉，不知道你们是怎么看哭的，我是真没察觉到好看，相反的，这太多的旁白让我好生厌恶，昏昏欲睡，没法，只能弱弱地给个两星…
594,超脱,1,看不懂
595,超脱,2,无聊
596,超脱,2,奏啊奏，在看不下去
597,超脱,2,看起来是讲教育，其实本质是满足创作者对男主角色和生活的一种幻想。
598,超脱,2,看了几个短评，大多都是被电影打动了N多闷骚苦闷空虚青年。
599,超脱,2,男主角那忧郁气质啊，简直绝了
