,movie,star,comment
242,萤火之森,3,“因为与你相遇在那个夏天，于是所有的季节于我只有夏天与不是夏天，所有的日子于我只有有你的日子与没有你的日子。”
243,萤火之森,3,只最后10min有意思
244,萤火之森,3,哭 我已经没有少女心了。典型的绿川幸风格，人啊妖啊半人半妖啊，我还是找夏目治愈去了。
245,萤火之森,3,略致郁。男主死的太突然了我不接受。
246,萤火之森,3,绿川幸的创作总是太清淡，缺了点什么，应该是很对少女的心思。男主消失的时候，我还是小小难过了一下，初恋般单纯简单的恋情真是很遥远很不真实，但美好的东西谁不爱呢。
247,萤火之森,3,有点意思，就是短了点。故事有点像中国的聊斋。
248,萤火之森,3,好短  才不到五十分钟啊  而且没有什么高潮 太平淡了吧 整部电影
249,萤火之森,3,这么美好的东西，我根本消受不起
250,萤火之森,3,没有感动到・・・
251,萤火之森,3,人妖之恋
252,萤火之森,3,一生一世一次的拥抱。
253,萤火之森,3,三星半，为了那做无聊的事也变得快乐起来的感情
254,萤火之森,3,温馨治愈，可惜不是我的菜！
255,萤火之森,3,3星半。
256,萤火之森,3,每个动画导演都是大叔脸少女心呦~让我这个伪萝莉情何以堪呐情何以堪！
257,萤火之森,3,画面很美， 桥段很老， 还有就是导演你究竟有多想拍出那隔着面具的一吻，吻即死啊，太刻意了吧
258,萤火之森,3,结局太坑爹了，前面铺叙了那么一大顿，最后竟是这么个结尾！
259,萤火之森,3,这么一个40多分钟的中篇动画版，无功无过不痛不痒，还不如剪成短片。。。
260,萤火之森,3," 豆瓣的9分,让我足足期待着是下一个《秒速5cm》给我的感动.可惜我老得已经看不懂这个故事了,又或者是这个故事太少女太纯爱了... 真心觉得渡边淳一的微小说用这个班底拍,各个都是精粹..."
261,萤火之森,3,忒纯 受不鸟
262,萤火之森,3,因为只有44分钟我才看的，要是片长再缩短一半就好了。
263,萤火之森,3,怎么到现在这种烂大街的宫崎骏新海诚式少女漫还有这么高的评分。
264,萤火之森,3,总感觉差了点儿意思...
265,萤火之森,3,发现好久不看日本动画了，但这个还不错，可能是因为短
266,萤火之森,3,作为治愈系，还是很合格的。小姑娘应该庆幸，他存在于自己最美的年龄。因为，也许，大概，可能，当她变成一个世俗而怯懦的大人的时候，他会选择自行了断。。
267,萤火之森,3,情感渲染什么的怪怪的，猪拱白菜的感觉太桑感了
268,萤火之森,3,事实证明，大叔就是大叔，少女漫画就是少女漫画，两者之间没有共鸣才是正常的
269,萤火之森,3,那小孩摔一下又不会怎样！
270,萤火之森,3,我们神仙怎么可以和凡人相恋，会触犯天条的。hhhhhhhh
271,萤火之森,3,3.5 像那些少女的梦，总会醒来，永去不回。
272,萤火之森,3,故事就 相互喜欢和不能触碰这条矛盾主线来说太单薄了，并且没有别的支线。豆瓣里面总会出现的几个高分没有故事的电影
273,萤火之森,3,这个内容其实可以长篇化的。
274,萤火之森,3,3.5.以后的以后，她对别人说起她和那个“妖怪”的故事，或许没人相信吧，不过那不重要，那种无法触碰的爱，只需铭记在心。甜美烂漫纯情的小故事，想起《秒速》，如若更长一点故事更丰富一些就更好，原声满分。
275,萤火之森,3,改天我也弄个面具去骗小萝莉！
276,萤火之森,3,日系纯爱动漫，少女情怀什么的最拿手了
277,萤火之森,3,前面一切都很好，终于小女孩长大，感情戏开始却戛然而止。。。
278,萤火之森,3,悲伤的心情传达得很粗糙呢.银白色头发的全是好少年！
279,萤火之森,3,寡淡。
280,萤火之森,3,三星半，少女心
281,萤火之森,3,好像在约会呢。――本来就是约会。在最美好的年华消失，我未老你依旧年少，或许是最好的结局。
282,萤火之森,3,比漫画平庸。
283,萤火之森,3,都是原著漫画党刷的分数。虚高的不行。四十四分钟，我印象最深的却只是配乐。。。
284,萤火之森,3,又纠结又拧巴。
285,萤火之森,3,不是我的菜
286,萤火之森,3,完全没能触动我。
287,萤火之森,3,竹川萤为什么不送阿金一副手套 酱紫不是可以拉手了么
288,萤火之森,3,瞬间我又少女心了
289,萤火之森,3,这种纯爱二次元实在不适合我，你有带面具，为毛不能戴手套不戴套啊！看过20世纪少年后，再看到这个面具神经质了好吗...
290,萤火之森,3,表碰我，我会屎。正中小清新下怀。
291,萤火之森,3,粉丝的悲哀
292,萤火之森,3,完全无法还原原著的神韵唉
293,萤火之森,3,44分把故事稀释过了头，前半尤单薄。干脆砍砍后加上四季里另三个短篇做成两小时得了。脚本后移当前时点，消融于原作半途的回忆性质被拉长到全片，于清晰结构有点用。利用影像说话的能力弱了，特别是原作情绪和光影的感觉没嫁接好。音乐格调走偏。人设还我五官艳丽的少年！总而太明朗，还是和原作不对盘
294,萤火之森,3,无趣装逼
295,萤火之森,3,实在无感……
296,萤火之森,3,这就完了？？那个摔跤的小孩真讨厌！
297,萤火之森,3,还真是小清新呢、、、清得太过了点吧
298,萤火之森,3,没有娘古三三~
299,萤火之森,3,有没搞错一批玻璃心伤不起吖！！这种故事都分这么高！！现在非得搞这么奇怪的人设来故意虐人么眼泪太多没处流么！！
300,萤火之森,3,45分钟都嫌长，哎~
301,萤火之森,3,小清新
302,萤火之森,3,像宫崎骏的。
303,萤火之森,3,最感动还是多年前的漫画，现在也许是心境变化了。以生命为代价，我终于可以触碰到你，然而我已经知道，爱你的人念你痴情，不爱你的只笑你愚蠢，仅此而已
304,萤火之森,3,对这种风格的日漫终于不再感冒了。。好像从来也没有感冒过。。
305,萤火之森,3,典型的绿川幸作品。透漏着《夏目友人帐》一样淡淡的关于成长的忧伤。不过受限于篇幅好像激情无处释放，味道欠那么一点。
306,萤火之森,3,一生一次的拥抱
307,萤火之森,3,终于，可以拥抱人类了呢
308,萤火之森,3,用了一个可爱的妖怪来写青春期爱情故事，最终流逝才是结局。不过对这种故事其实还挺无感的。。
309,萤火之森,3,画风不错，剧情很美，但内容不是我喜欢的调调
310,萤火之森,3,只能|碰一次的偃耸强梢载穿一生的邸Ｏg音贰Ｗ匿琴之森以後好久]^@N舒服的琴OST了。
311,萤火之森,3,夏目的画风，淡了一点。
312,萤火之森,3,我明明少女观感很正常的一普通人类这么多年偏偏对这个人妖（误）恋提不起心里的那口气。一生一次的拥抱什么的，真是不解啊不解。
313,萤火之森,3,爆好听的钢琴伴奏！！故事old了，有点夏目友人帐的感觉。
314,萤火之森,3,简单的故事。
315,萤火之森,3,(⊙o⊙)… 就完咯 诶 怎么回事 大家是怎么在这么短的时间内哭的稀里哗啦的 我情绪都还没酝酿 就完咯 
316,萤火之森,3,觉得还不如夏目友人帐呢。
317,萤火之森,3,果然我已经过了看这种片子的年纪么？
318,萤火之森,3,这个。。也算青梅竹马了吧。。。。日式小清新，很清新。。。
319,萤火之森,3,跟妹妹一起看的。挺温暖挺治愈的，一看就知道是《夏目友人帐》的制作方制作的啊风格啥的完全一致嘛~但是其实这种题材没有很吸引我的，三星半。
320,萤火之森,3,纯情少女类动漫。
321,萤火之森,3,"完全无感啊。。。我的少女心果然遗失在小学了嘛。。。完全没有当时看绿川漫画的感动。。。
"
322,萤火之森,3,~女孩的心思。。。
323,萤火之森,3,爱情萌发在夏天。
324,萤火之森,3,片尾的拥抱真美，如果风格从头到尾都是小清新就好了。
325,萤火之森,3,没有那个毁灭而心碎的拥抱，就会有后来她开始新的幸福生活的果敢刚决。5
326,萤火之森,3,就个纯爱故事，完全无法和虫师相比
327,萤火之森,3,不哀也不伤，只是个初恋消逝的故事
328,萤火之森,3,典型的日式暧昧，隐忍又温情。少女时代的那个似有似无的恋人啊，一触碰就会消失~~~这题材实在是太多了，可能应该先看下绿川幸原作吧
329,萤火之森,3,有点状况外，泪点来的时候没抓稳然后掉出去了然后就完了...
330,萤火之森,3,尼玛碰了就得死，是有多么的柏拉图啊
331,萤火之森,3,强烈怀疑导演偷懒直接从夏目那边偷画面，谁叫都是自家的。。。
332,萤火之森,3,无法触碰的爱人
333,萤火之森,3,并不能因为排行榜高而填充太多的期待，是吧。哈哈
334,萤火之森,3,不懂不懂 实在是不懂
335,萤火之森,3,飘渺的少女爱啊。。。我是真心误入了
336,萤火之森,3,我终于发现了！日本动画片男女主角最终都不会在一起的可恶！！
337,萤火之森,3,。。。。。。。
338,萤火之森,3,岛国治愈系动画，男默女泪的虐心路线，小清新画质加上激萌萝莉和完美男主角，俘获一众低泪点观众和文艺青年可谓不费吹灰之力，但故事薄弱和节奏催眠实在是有些让人无力吐槽。ps：渚薰你走错片场了吧
339,萤火之森,3,真短。。。但是多开心，你能陪我走过这一段
340,萤火之森,3,第一反应，夏目友人帐剧场版= =。。。就是单独把里头某个故事详细的拍了下而已，还不如拍成电影我会觉得更有爱=3=哎哎。。为啥分数能这么高？
341,萤火之森,3,没啥特别的意思么..很普通的动画
342,萤火之森,3,没有戳中我的泪点。。。
343,萤火之森,3,失望透了
344,萤火之森,3,真心没感觉！
345,萤火之森,3,好平淡。
346,萤火之森,3,好短………………………………………………那么高分是什么心态
347,萤火之森,3,没有太大感触，我悲剧的发现，我已经没有少女心了
348,萤火之森,3,太快了
349,萤火之森,3,我果然还是不适合这种纯情小女生的故事。
350,萤火之森,3,？8.8？吓到我了。感觉可能有些小心思的少女中学生会喜欢的类型。
351,萤火之森,3,想到夏目诶 不过真的对这种动画已然免疫了
352,萤火之森,3,"一段相爱不能相守的人妖恋。色调很舒服。
不过，那个狐狸精太丑了。。。"
353,萤火之森,3,不喜欢
354,萤火之森,3,少女的心思，不可触碰的爱，纯爱小故事，画风和音乐都应该很受女生欢迎吧@苏
355,萤火之森,3,神社像春日大社。
356,萤火之森,3,讨厌大森的做作，好好跟长滨博史学学怎么用长镜头吧
357,萤火之森,3,哎，没有感觉了。
358,萤火之森,3,虽然在豆瓣上排名125，虽然是豆瓣250里唯一的短片，不过，这片子确实让我想起了那个据说对精液过敏的女子。
359,萤火之森,3,还好吧。这样的故事对于我太简单了
360,萤火之森,3,对这种纯爱动画都无感了
361,萤火之森,3,好短
362,萤火之森,3,只是觉得妖怪死得太冤了。
363,萤火之森,3,看这种纯爱都能邪恶我真是没救了...还行，只是我不喜欢
364,萤火之森,3,画风挺美
365,萤火之森,3,剧情太单薄了一点。
366,萤火之森,3,平庸了点
367,萤火之森,3,看了一遍，不觉得怎么样。再看一遍，心里突然就有温情
368,萤火之森,3,"还是中段告白最动人 ""时间终会把我们分开吧＂"
369,萤火之森,3,干净、清冷
370,萤火之森,3,清新的故事制作却不精良..可惜了....加一星给消失那一幕
371,萤火之森,3,我是老了么，对这种带着过多幻想的片子有点爱不来，讲得实在略慢了点啊。
372,萤火之森,3,小清新看过来 重口味自动绕道而行
373,萤火之森,3,真有如此这样的淡淡的爱情咩？
374,萤火之森,3,再见我的少女心。
375,萤火之森,3,无感    结尾曲到挺好听的
376,萤火之森,3,夏目友人さ内s_
377,萤火之森,3,咦，果真是感受不来小清新了啊~只觉得消失的好冤啊
378,萤火之森,3,和漫画比差太多了-，-
379,萤火之森,3,或者是漫画的印象太深……觉得动画一般
380,萤火之森,3,带个手套就能拉小手了嘛。熊孩子杀伤力max。银发少年都没有好下场。每次看这种纯爱戏单身狗都感受到了伤害，手动再见。［豆瓣250真是。。。
381,萤火之森,3,有人讨论戴手套。。那么戴避孕套也可以吧#一句话毁了纯爱小清新#
382,萤火之森,3,神社的山路很美。夏日的记忆。妖怪文化吧不太理解。故事有些伤感。可是女主角很坚强的面对。不太喜欢。那么痛苦。为什么还要故作治愈。个人不太喜欢。不过舒婷的诗真好啊。悬崖千年的展览。何如爱人肩头哭一晚。触不到的恋人到底是否可以存在。
383,萤火之森,3,三星半 还好吧。。
384,萤火之森,3,这都能8.7分，豆瓣是潜规则过动画片儿吗？
385,萤火之森,3,少女心啊少女心，豆瓣9.0的高分就是这么来的。我的少女心哪去了喂(/n\) 
386,萤火之森,3,IN SUMMER.
387,萤火之森,3,日本学校不放寒假？
388,萤火之森,3,只有画风像虫师，内容和配乐都差得远
389,萤火之森,3,如果不拍的这么清新，仔细想想这故事吐槽点太多了。
390,萤火之森,3,结尾有点莫名啊。。。
391,萤火之森,3,谁说会看的涕流不止来的!?还要多夸张，抱的那一刻4有点心酸，但之后9为他有多荒唐而甚至感到气愤，柏拉图也要硬扯妖怪才可能，哎
392,萤火之森,3,审美疲劳了
393,萤火之森,3,太平淡，无感
394,萤火之森,3,对啊 为什么不用手套呢？
395,萤火之森,3,日本是个想象力与人性尚未泯灭的国家
396,萤火之森,3,是不是我真的太老了，这种治愈系动画真心喜爱无能啊~
397,萤火之森,3,大概画得不大让我满意吧
398,萤火之森,3,估计是年纪大勒，这种小清新打动不了我勒。。
399,萤火之森,3,日本人果然是很喜欢讲妖怪的故事啊～ 结局不太懂 @_@
400,萤火之森,1,无与伦比的做作，这片要是中国产，豆瓣评分可就是颠倒的了
401,萤火之森,2,每每看这种款，都能重逢自个儿的这副铁石心肠。
402,萤火之森,1,只有我一个人觉得矫情么？
403,萤火之森,2,二次元太可怕了！这什么东西！豆瓣250的耻辱！是时间太短的问题吗？跳过感情升温的阶段直接跳到了爱已永恒的阶段，爱情来的没有道理，女孩为什么会喜欢男孩？似乎除了颜控也没有更好的解释了……整体给人的感觉就是刻意、做作，强行赚人眼泪的设定，强行煽情的突兀结尾，让人反感至极，不过对于二次元粉丝来说，倒也符合卖萌和颜值即是正义的原则。在B站看的话，弹幕远比正片感人，优点就是没做成长片，只浪费我四十分钟。
404,萤火之森,2,约定の夏
405,萤火之森,2,平淡安静如一碗水，结局是把水倒了。我不讨厌平淡，但平淡不代表没味道。这带入不进感情的悲剧，乏味到尾，结局没有任何巧妙安排突然腰斩，让我想起个故事，某人画漫画到不想画，于是把主人公画死写个【完】。和这片儿太有异曲同工之处，碰了个小孩所以死了这算是什么结局方式安排，只是利用设定偷懒。
406,萤火之森,2,天真爱浪漫又纯洁又矫情的日本小姑娘 让哥哥来告诉你：没有身体接触的男女关系是不会长久的。PS：看到首页全五星评论 哥颤抖了！少女漫画什么的这辈子都理解无能。
407,萤火之森,2,这片都给这么高评价果然豆瓣不靠谱啊～
408,萤火之森,2,老套路的日本鬼神勇。好只有四十追昼。太了。
409,萤火之森,2,这也太平淡，太普通了吧，没有任何感觉；色调很糟糕，人物很单调，片尾曲更是一大败笔。
410,萤火之森,2,剧情太弱
411,萤火之森,2,姑娘的意淫 = -
412,萤火之森,2,又。。。浪费时间了
413,萤火之森,2,为何人们热衷于此类由一个生硬前提引导的、强扭感情发展的、对虚假的破事非要中二到底的只能被音乐感动的风景片？
414,萤火之森,2,没看懂为什么评价这么高？真没看懂。
415,萤火之森,2,原来是少女最爱的片子，真不适合我看。
416,萤火之森,2,日式纯爱小清新。这个套路的太多了。
417,萤火之森,2,豆瓣250里为什么会有这个……
418,萤火之森,1,这种陈芝麻烂谷子能评这么高也难怪动画没人看了
419,萤火之森,2,男孩吻了女孩
420,萤火之森,2,好。。。难看
421,萤火之森,2,拜托点也忒低了吧是拍给13岁小姑娘看的昂
422,萤火之森,2,如白开水般不温不火
423,萤火之森,2,太短了。
424,萤火之森,2,这。。。wtf，只能说认为这片子好的人跟我有代沟
425,萤火之森,2,一直以为是妖怪少年为了爱主动选择了亲吻女孩而消失，搞了半天原来是意外之死。克制的性冷淡气质还不到位，差评。
426,萤火之森,1,你妹啊，这不是坑爹时间么！！！！
427,萤火之森,1,四十四分钟倒完白开水，一滴进不得大脑中，一八P呆做画，萤幕想象力空又空。
428,萤火之森,2,一股暮光味儿
429,萤火之森,2,爱的人，摸不到触不着且永远失去了，这个还能称得上治愈系动画吗？
430,萤火之森,2,还是喜欢欧洲动画，日本的，看不惯
431,萤火之森,2,2.5。除了歌，有任何方面能不被宫崎骏碾压吗？任何方面？
432,萤火之森,2,1、两人为毛不戴手套？2、这个故事是用来告诉我们没有性的爱情是没指望的？
433,萤火之森,2,无新意
434,萤火之森,1,是因为年龄大了还是因为太受不了小清新了？这东西到底治愈什么了？妈的我一听见6岁女童那一副饥渴的不行的AV女优嗓音我都快尿了，日本人，能不能讲话的时候正常点？男人听上去都象装逼的性冷淡，女人哪怕只有五六岁听上去都象是小姐
435,萤火之森,2,大叔表示欣赏不能
436,萤火之森,2,想表达什么？
437,萤火之森,2,。。。。。。。满足了姑娘们的YY欲望
438,萤火之森,2,....就……不好看啊（还是说我已经对治愈系不感冒了？！不要啊！！人家可是励志做治愈系少年（大叔？）呢
439,萤火之森,2,说实话，漫画和动画的感觉真不一样。很失望
440,萤火之森,2,淫和淫，傻傻分不清楚。
441,萤火之森,2,一看画面一看名字我大概就知道是什么样了，或许这类的日本动画看得太多了，看评分这么高以为会有什么新意，结果还是让我失望了。
442,萤火之森,2,看睡着了
443,萤火之森,2,画风好看，故事还算有点意思。但是，自大的人类，为什么妖精们过节，要化身为人，妖精才不屑打扮成你们人类呢。
444,萤火之森,2,不好看。
445,萤火之森,2,没有那么特别啊。剧情为什么觉得似曾相识。有点做作了
446,萤火之森,2,还行吧。剧情挺狗血的，不过却有些感觉。不过就像某些人说的，为什么他们不能戴手套？？？这句话真心一句话毁掉之前所有感觉啊。
447,萤火之森,2,剧本太小白了。
448,萤火之森,1,垃圾中的战斗机。
449,萤火之森,2,太纯爱了  不适合我 
450,萤火之森,2,比《言叶之庭》差远了。
451,萤火之森,2,什么鬼东西= =
452,萤火之森,2,"短, 没什么看点. 故事一句话就能概括,"
453,萤火之森,2,好。。。。一。。。。般。。。。果然是太短没感觉！！还是我真的不爱动漫……
454,萤火之森,2,无感
455,萤火之森,2,整部片没找着看点在哪……
456,萤火之森,2,这片子 好在哪了？
457,萤火之森,1,真好真感人
458,萤火之森,1,我目测应该给一星。
459,萤火之森,1,女生会喜欢吧，男生对这种完全无爱
460,萤火之森,2,一女的 凵弦荒械 男的不是人 不能碰人 不能在一起 最後悲 的穿好L袖衣服 戴手套只要不漏肉不就行了 其xxoo也是可以的 整的@NM  _玩笑 工太一般 人物幼餮u作的也不到位 只有40分也不u作@一c
461,萤火之森,2,故事太单薄了。
462,萤火之森,2,完全无感。
463,萤火之森,2,没什么感觉的片子
464,萤火之森,2,我果然是一个已经不适合看纯爱动画片的妇女了。。。完全没有被感动啊。。。
465,萤火之森,2,好无聊・・・
466,萤火之森,1,日本怎么净爱拍些这样没营养的东西 给没看过A片的洗脑么
467,萤火之森,2,坑爹啊，白开水似的，哪感人了？！
468,萤火之森,2,不过是告别
469,萤火之森,2,再也不会期盼夏天的来临了吧（Ps 一直看不进去是神马状况
470,萤火之森,2,没感。。。觉得秒速五厘米更好。
471,萤火之森,2,青春期春梦一场 外加功德一件
472,萤火之森,1,冷烂欠连嘈都懒得吐了
473,萤火之森,2,好看在哪？感动在哪？豆瓣果然充斥着一群自认为小文艺的跟风者！
474,萤火之森,2,画面和音乐各给一星
475,萤火之森,2,名不副实的典型。
476,萤火之森,2,嫉妒坑爹 竟然是杯具！
477,萤火之森,2,期望值太高。情节太简单。
478,萤火之森,2,我也想说好尼玛短~~~结束的突然啊。
479,萤火之森,1,是我最讨厌的文艺动画片没有之一，感觉不到任何的泪点
480,萤火之森,2,一直期待看，但看完觉得也就那样啊，片子女性向的原因吗？感觉就是个简单的小故事
481,萤火之森,2,太平淡
482,萤火之森,1,为赋新词强说愁。
483,萤火之森,2,绿川幸，这是你目前为止最差的作品！！！！！！！！！！！！！！！！！！
484,萤火之森,2,太少女向，很无聊。
485,萤火之森,2,get。。不到泪点
486,萤火之森,2,人人都说不要靠回忆过活，其实谁不是抱着回忆在耳鬓斯磨，又有什么不可以。
487,萤火之森,1,真心没有粉红少女心无法理解……还好只有四十分钟没浪费更多时间
488,萤火之森,2,哪里好看了？？？？
489,萤火之森,2,隔着衣服戴上套应该可以的吧~~
490,萤火之森,1,小清新不代表大脑残，宣扬真善美不代表用脚后跟思考。
491,萤火之森,1,嘿，凡是小日本关于爱情啥的片子分都这么高。
492,萤火之森,2,少女心动画在我这里都是低分。
493,萤火之森,2,果真对纯爱电影不感冒
494,萤火之森,2,！！！！就这样结尾了好吗！！
495,萤火之森,2,= = 为内山昂x而看 这么傻诺木缜椤！OJZ
496,萤火之森,2,一戴著狐狸面具的人哥，因楸谎怪救助^而a生了脆弱的w|，被人碰|就消失，之後狐狸男c一位小女孩a生了偾椤，@}材在不太像是拍o小孩子看的，o成人看又欠缺f服力。
497,萤火之森,1,评分好高啊
498,萤火之森,2,也就这样 8.8分不至于吧  我是来拉低分数的
499,萤火之森,2,自己辛辛苦苦守了那么多年的骚年被一小男孩儿糟蹋了>:-<真忧桑……而且发现 在人人上看我这么想的绝对是奇葩 上了豆瓣才发现我不是一个人吼吼吼
500,萤火之森,2,日本纯爱片果然不是我的菜，少女情怀自然美好 但是...混蛋啊
501,萤火之森,1,奇傻无比。。。。。。
502,萤火之森,1,我不喜欢这类型
503,萤火之森,2,50/100，这到底有啥啊？这就8.8了？
504,萤火之森,2,冷漠地看着弹幕刷感动
505,萤火之森,2,片尾乐很好听。约好的夏天，我在等你拥抱我
506,萤火之森,2,"意境I造不到位，感拥哪芰恳脖∪酢
如果想要享受|感越的赢或音罚很明@的，也是]有。
所以…唯一值得嘉S的是，幸好]冗L的∏椤"
507,萤火之森,2,蛮好的题材，可就是节奏感不好。本来是想抱着痛哭的心态去看的，可是糟糕的拖沓以及重点煽情的忽略老是跳我泪点
508,萤火之森,2,从没看过只有40分钟的电影，敢情是把电影当电视剧集拍了？
509,萤火之森,2,跟漫画比差了好多~~~但那个拥抱还是很动人~~~故事太好了~~~T T~~
510,萤火之森,1,嗯 证明我真不是文艺咖，短短45分钟看得直打哈欠，小清新真不是我的菜
511,萤火之森,2,咱们不矫情
512,萤火之森,2,老实说，我真没什么感觉。。。
513,萤火之森,2,不过是夏目友人帐的加长版。
514,萤火之森,2,45min 无画面，无剧情，无配乐，这片看什么?
515,萤火之森,1,很无聊
516,萤火之森,2,什么烂片
517,萤火之森,2,确实是没有惊艳到我
518,萤火之森,2,故事一般 结尾太烂 不予置评
519,萤火之森,2,治愈个屁呀，这是故意做作矫情的虐心好嘛！！晚上看完还没什么，第二天凌晨突然醒过来，阵阵揪心啊
520,萤火之森,2,铺垫太少，草草结尾，泪点何在？夏目友人帐集集秒杀。
521,萤火之森,1,完全没有原著的感觉，那种喜悦无奈与忧伤，完全就是一流水账，真后悔看了动画，哎
522,萤火之森,2,少女心妹子才爱看这种吧。。男生就别在这种情节老套又短又没意思的片子上浪费时间了。。。某人说的好。妖怪有颜就是治愈。丑就是吓人，摊手。看着那么多妹子打5分我好想打1分啊
