,movie,star,comment
0,萤火之森,4,妖怪有颜就是治愈片 妖怪没有颜就是恐怖片
1,萤火之森,5,郁闷死了 守着一颗白白嫩嫩的大白菜多少年细心栽培没舍得吃，最后这颗大白菜被猪给拱了的感觉 (77n62)
2,萤火之森,5,我说………………既然树枝和毛巾可以，那么手套也不会有问题吧…………所以婚姻幸福就指望保险套了……………………………………………………………………
3,萤火之森,4,小孩子跑不好就不要跑好伐？！摔个什么摔！摔！
4,萤火之森,5,永远不会忘记的拥抱，是你让我曾有过怎样也不想结束夏天
5,萤火之森,5,时间停止在阿金消失的那个夏天，一生一次的拥抱放在回忆里不会变老。
6,萤火之森,5,有些故事，就算早已烂熟于心，再看时也还是忍不住要哭的
7,萤火之森,5,一点都没失望( >n<。) 真是发自内心的喜欢又痛恨这个故事！
8,萤火之森,4,“总有一天，时间会把你我拆散吧，可是，即便如此，在那个时间到来之前，我们一直在一起吧”
9,萤火之森,4,“你绝对不可以碰到我啊”，除了一生一世的最后一回。这些悲伤而又温柔的夏天――绿川幸总是能直戳人心最柔软的地方啊！
10,萤火之森,5,最爱 没有之一 少女心都在这了
11,萤火之森,4,我有多渴望触碰你，我就有多害怕失去你。
12,萤火之森,5,我这个泪点低的人又。。。TAT 又萌又忧伤。。我所剩不多的少女心啊~~
13,萤火之森,5,银发的狐面少年 夏日 花火 浴衣 隔着面具的那个吻 终于能够拥抱到你了阿金TAT 内山的声音好温柔 从开始就等着虐心的结局呜呜呜我又得内伤一天了 
14,萤火之森,5,TTTTvTTTT ←只有这个表情
15,萤火之森,5,在那个夏天那片森林 拥抱你 离开你 记住你 就知道是死虐
16,萤火之森,4,能够拥有，便是最美好的事，至少还有拥抱，至少那些快乐的日子不会被忘记。
17,萤火之森,4,是从哪一年开始，我们也不再对夏日怀有期待。那样的少女心事，你我也曾拥有。
18,萤火之森,4,从小女孩到大女孩，萤终于在银消失前拥抱了他。
19,萤火之森,4,“触不到的恋人”――以为他们会主动接触然后灭亡，就像那部短片《雪与沙的爱情故事》一样，可是不是，“银”无意间的一次对人类小孩的帮助，导致他在一瞬间必须做出决定：与爱人告白、再见直至死亡。完全意料之外的、突如其来的，一切幻灭。抱空爱人的感觉应该会很糟糕吧。
20,萤火之森,5,我靠，每一次摘下面具都特么美得要死要活好么！
21,萤火之森,5,期待已久的夏日 女孩不由地伸手想要握紧身旁的温柔 又倏忽停住将手收回 一生一次的拥抱 先是微笑着 最后却又流泪了
22,萤火之森,5,怎么都没进入那个状态。。是怎么回事！我的错吗QAQ为原著加一星w
23,萤火之森,4,突然想起了小时候的玩伴些，长大后是再也没联系过了。也许――我们就这样，各自奔天涯...情怀被挑起来了，故事倒是一般。
24,萤火之森,5,虽然很美好的故事，但是这个故事是个悲剧，日本动画片很多像这样的引人深思的动画片，明明是美好的情感，可惜身不由己。
25,萤火之森,5,都快三十岁的人了看这个还看哭了是要怎样( ⊙ o ⊙ )啊！我真是一颗少女玻璃心，真是受不了自己了( ⊙ o ⊙ )啊！“我想碰触你”
26,萤火之森,5,最后，银张开手臂，笑着说，来吧，我终于可以碰到你了，然后这个少年消失在了萤的双臂之中…这个拥抱唯美却伤感，看得哭得停不下来，看完之后一种说不清的情绪一直萦绕心头，就像被什么堵着一样，发泄不出，不敢看第二遍
27,萤火之森,4,1.害怕消失，不害怕死亡。2.怪物设定同[夏目友人帐]，借物牵手同[玩偶]与《做壹年》。3.狐面少年：拥吻只有一次，真爱亦如是。4.收尾不够好。
28,萤火之森,5,哭的稀里哗啦，很难走出结局的悲伤。多希望结局出现转机，山神被男女主的爱情感动，银没有消失。银摘下面具给萤戴上，吻上面具，我的少女心啊！
29,萤火之森,4,这部电影的爱情平淡而温馨，令人向往，结局悲伤得让我有点猝不及防。
30,萤火之森,4,我最爱的夏目人设。每个人都有一段别人无法复制的经历，是秘密，闭口不言，是惊喜，你不知道下一个相遇在哪里，带着遗憾，离开那个夏天。最后，用我的生命给你一个拥抱。
31,萤火之森,4,在我消失之前，请给我一个拥抱。
32,萤火之森,4,好美。。
33,萤火之森,4,画面很美  想要他们就这样一直下去  每年夏天 有个你等着的人  住在你心里的人  最后很想打那个熊孩子  果然童话里都说骗人的
34,萤火之森,4,为了能见你，不能触碰你；见到你，忍不住想触碰你。
35,萤火之森,4,最好的结局～
36,萤火之森,4,清清淡淡的也可以是深情。大森贵弘与绿川幸，强强联袂。
37,萤火之森,4,太短了。。
38,萤火之森,5,清新简短，小小的童话，何不再回忆下自己的童年？
39,萤火之森,5,少女心%>_<%
40,萤火之森,4,太美好了，我只是不能接受就这样结尾了。。。
41,萤火之森,5,阿金不要走，一晃从第一次看萤火之森的漫画过了将近十年
42,萤火之森,4,很短，很好看。喜欢这种只有用卡通来表现才最合适的卡通片
43,萤火之森,4,还ok吧~
44,萤火之森,4,好想哭啊~~
45,萤火之森,4,小清新，治愈系
46,萤火之森,4,妖怪们都很爱银吧，感谢萤，可是银的父母呢？・・・
47,萤火之森,4,"互相喜欢,简单的喜欢,执着的喜欢,沉默的喜欢,想要碰触对方的喜欢,,喜欢,喜欢,喜欢这样的感觉....只是男主这消失的真的是莫名其妙,总觉得他就算一定要消失,也应该用更好的方式...但如果没消失的话,故事会变成什么样?塔希里亚的<黄昏>那样吗?能够碰触,他们比银与萤幸福的多吧. "
48,萤火之森,5,清新动人
49,萤火之森,4,虽然结局已经猜到，但还是非常喜欢这样清新、温暖，又带有点疼痛感的爱情故事
50,萤火之森,4, 好有夏目的感觉啊！
51,萤火之森,4,结局不够惨！！！！！
52,萤火之森,5,更喜欢漫画，不过动画化了还是一样喜欢
53,萤火之森,4,很治愈~
54,萤火之森,5,少女心都在这儿了。
55,萤火之森,5,我喜欢你啊~~T^T【你妹啊！本来以为后面应该会有个转折的，，结果就这样木有了啊！！！(PД`q。)・。'b冰天雪地掩面泪奔…… 
56,萤火之森,5,虐心
57,萤火之森,4,很棒很棒，
58,萤火之森,4,又快到夏天了呀银~……看的我泪流满面，唉，羸弱的少女之心……看完想拥抱！！!~
59,萤火之森,4,让我能抱抱你，哪怕一次也好。
60,萤火之森,5,绿川幸就是我不死的少女心 QAQ
61,萤火之森,5,我终于可以拥抱你了，你也离开我了。
62,萤火之森,4,淡淡的感动
63,萤火之森,5,萤，现在你可以扑过来了喔.
64,萤火之森,5,无法触碰的爱~~~12.9.26 ――⒈果然比起TV版动画，还是更喜欢画面更为精致的电影版/剧场版动画一些；⒉难怪观看《夏日友人帐》的时候，会觉得气质跟《萤火之森》挺相似，因为他们拥有共同的监督「大森贵弘」；⒊可能是跟喜欢的人在一起时那种幸福感使得他们即使做无聊的事情也会感觉很有趣吧？-16.8.1
65,萤火之森,5,太美了，美到不忍心看第二遍。
66,萤火之森,4,每个少女心中的梦吧。
67,萤火之森,5,很温馨的爱情故事~
68,萤火之森,5,你会守护迟早要消失的爱情吗 “扑过来吧，这是我的愿望” 这样的柏拉图美好的让人不敢触碰 短暂的告别让人好辛酸 浴衣好美！！o(*////////*)q
69,萤火之森,5,无法触到的便是最美好的，触到了，梦也醒了
70,萤火之森,5,太治愈了!!!!!!!!!!!!!!!!!!!!!!!!!!!!!!!!!!!!!最后的ED。。。好煽情啊！！！！好想哭 ==好想在一个春末春雨的某天躲在家里看。。。。一个劲的哭。。。
71,萤火之森,4,少女心容易碎(>_<)啊
72,萤火之森,5,扑过来也没关系，我求之不得。隔着面具的亲吻~我所剩不多的少女心最爱，没有之一。小孩子跑不好就不要跑好伐？！摔个什么跤！！摔！！！永远不会忘记的拥抱，是我怎样也不想结束的夏天。泪目~
73,萤火之森,5,哭死我了T____T  内伤了。。
74,萤火之森,4,真正的触不到的恋人。。。虽然没有很悲伤，但刺痛了这个本就伤感的夜晚
75,萤火之森,4,男主最后死的有点怨。对白还是挺不错的，可以下个日语字幕看看。
76,萤火之森,4,不知道为何，比看漫画时感觉淡了些
77,萤火之森,4,美的矍橐谎廴f年
78,萤火之森,5,最后真的挺感人的
79,萤火之森,5,有些东西还是一直这样维持着好，一触碰就会消失不见。
80,萤火之森,4,其实我以前一直觉得漫画蛮治愈的结果现在才发现是我以前太迟钝，结局的时候眼泪一下子就掉了下来，这根本就是致郁片TAT
81,萤火之森,5,夏目と同じ暖かいの荨⒔Y果はもっと哀しいと思う
82,萤火之森,5,留在手中的温热，夏日的回忆，这些都和我同在。  如果知道一生只能有这么一次的拥抱，我们会选择用什么去交换，我们还会不会选择摘下面具彼此相爱。 面对无法触碰的宿命，也许从一开始就只是在你看不到的角落静静地守护着你，最好。
83,萤火之森,4,不要忘记我
84,萤火之森,4,不能触碰爱的人 是件很痛苦的事儿吧。
85,萤火之森,4,音乐可以更煽一点
86,萤火之森,5,不能触碰的爱恋。男主真的好喜欢。。。
87,萤火之森,4,"I want be your last,first hug.回忆恰好凝固于最美好的夏天，要我说这是一个HE。"
88,萤火之森,4,治愈的道路很长啊，从小时候到长大成人
89,萤火之森,5,好优雅的妖怪！少年的声音好好听！！
90,萤火之森,5,圆满了，怀念初中的新干线和新视点时代
91,萤火之森,5,绿川幸本命！很淡的故事情节但是最后还是哭到要死要活的~绿川幸的漫画人物表情什么的都是淡淡的，其中的哀伤也是淡淡的~
92,萤火之森,5,每年我都会回到那个夏天
93,萤火之森,5,回不去的夏天
94,萤火之森,4,真是小清新。
95,萤火之森,4,不知道是不是因为剧场版的关系，整个故事略显普通。片子风格清新，值得一看。
96,萤火之森,4,小女孩喜欢上被诅咒的少年，少年最终因诅咒而消失，小女孩还是小时候好看哇
97,萤火之森,4,以前看过漫画，被最后小感动了一下。动画版无功无过。这种简单的小故事讲清楚了效果也很好。PS：绿川幸的东西都是一个调调啊，银难道不是夏目的前世么。。。
98,萤火之森,5,这个赞。。。
99,萤火之森,4,很单纯，很美好。
100,萤火之森,4,很单纯，很美好。
101,萤火之森,4,伴君数载，终须一别。 我不要夏天离开……
102,萤火之森,5,QAQ哭死我了 看漫画就哭死了 看动画也哭死了 各种缓不过来 ED的歌词太煽情好戳泪点 妈蛋哭死我了啊QQQAQQQ
103,萤火之森,4,如果明知是一定没有结局.  你还会努力争取吗?
104,萤火之森,5,看到最后心都碎了。最好的时光，数十个夏日的记忆。
105,萤火之森,5,虽然没有漫画好 还是看得很感动！>皿<。
106,萤火之森,5,尼玛啊……我到底是多么抖M啊・……十年前的《新干线》还没有被虐够，十年后反复告诉自己小心泪点接着依然跑这边对着电脑哭成渣啊……【内山昂辉功力见长无误
107,萤火之森,4,少女心
108,萤火之森,5,“时间总有一天会分开我们，但是，就算会这样，在那之前，我们要一直在一起。请不要忘记我，不要忘记。”我想触碰你……我喜欢你，但是我却不能触碰你，一生一次的拥抱，刻骨铭心的记忆，这种不能触碰的设定就是虐心啊！总觉得比原作少了点儿什么，但是依旧很虐TTTTvTTTT 
109,萤火之森,5,治愈向为何如此悲伤……突然想恋爱了
110,萤火之森,4,T.T
111,萤火之森,5,感觉自己家养了多年的鲜嫩多汁大白菜还是被别的猪给拱了……
112,萤火之森,5,虽然人设和色彩比较弱~但是……最后还是哭了。
113,萤火之森,5,我的少女心啊……TUT被击中了啊混蛋！！！配乐很棒&里面的很多山中景色儿时都有体验过，很多生活场景也很细腻真实有代入感【疑惑的是我这个泪点很低的人为什么没有哦哭= =水喝少了么今天
114,萤火之森,4,淡淡的温馨~
115,萤火之森,5,哭M十分……
116,萤火之森,5,一愣神 会以为是在看夏目友人帐 人设音乐剧情 不过这个不长的剧场版确实细腻的表达出了初恋那份可以拥有不必长久的悸动
117,萤火之森,5,"总有一天,时间会将你我拆散吧.可是,即便如此,在那个时刻到来之前,让我们在一起吧."
118,萤火之森,5,虐死了 
119,萤火之森,4,那些青涩而深挚的情感，一如回不去的满是绿荫的夏天
120,萤火之森,5,第一次知道这个故事，是在几年前的某期《漫友》，黑漆漆的纸面里讲了一个平平淡淡但又隐约从心中透出伤感的爱情故事。动画的前面充满着夏天的阳光和森林的清凉，萤和金在林间穿行，我眼泪止不住了。
121,萤火之森,5,TVT
122,萤火之森,5,你故意的。。
123,萤火之森,4,就这么消失了，是不是有点冤？没办法~谁叫你爱上可怕的人类~
124,萤火之森,4,拥抱在美的刹那间，然后永久失去。
125,萤火之森,4,童年即夏天。
126,萤火之森,5,即使是短片（30-60分钟到底叫什么啊啊）也足够锁定一个个人年度十佳位置了。看过之后才明白绿川幸何以如此有人气，这份少年心气和恰到好处的虐正是某个年代的无敌配方。音轨对动画而言做得极为细腻，剧作也很不错。另赞片尾曲。
127,萤火之森,5,约定。
128,萤火之森,5,总有一天时间会把我们分来 但初恋的记忆会一直相伴
129,萤火之森,4,少女心什么的感觉好羞耻呢TVT
130,萤火之森,5,少 女 心
131,萤火之森,4,尽管猜得到结局，还是扛不住感动啊..
132,萤火之森,5,治愈系的~
133,萤火之森,4,还没来得及o(>_<)o，就结束了。
134,萤火之森,4,这剧场版……略短了点啊
135,萤火之森,5,绿川幸的动画是我的最爱，没有之一。少女之心啊，戳心戳肺。
136,萤火之森,5,每一个地球上的夏天永远用来遇见你，拥抱你，离开你，埋葬你。触不到的你。
137,萤火之森,4,一段注定无法触碰的爱情，生命最后时刻的拥抱将会永远封存于回忆。
138,萤火之森,4,"看动画怎么没有原来那种感觉了呢 
有点失望 的说TAT
"
139,萤火之森,4,色调场景情节都没有任何多余，连绿色都恰到好处
140,萤火之森,5,阿金TTTTTATTTTTT  阿金TTTTTATTTTTT 少女心哟 终于回来了
141,萤火之森,5,跟书一样的好看经典~
142,萤火之森,5,好y^啊
143,萤火之森,5,Ic大爆l
144,萤火之森,5,美  就是时间太短
145,萤火之森,5,难以抵抗的感动~
146,萤火之森,5,还不如不拥抱遥遥相望也是好的
147,萤火之森,5,我那所剩不多的少女心又被激活了……
148,萤火之森,4,柏拉图式人妖恋。
149,萤火之森,4,治愈啊
150,萤火之森,4,日本人真是太没生意头脑了，找个手套厂家，植入广告。既能提高居民收入，更能避免这场悲剧！莹和银在一起那么久，却没能触碰彼此，而小朋友出现几分钟，就触碰了。隔着的面具也有多层隐喻！但这就是爱情友情的实质。命里有时终须有，命里无时莫强求。而萤和银之间注定缺少缘分
151,萤火之森,5,阿金不是细长眼睛了可惜，还是看哭了……那句“就是在约会呢”好棒
152,萤火之森,5,我终于可以抱你了，那一抱，我的身上便是你的味道，即使消失，也忘不掉。
153,萤火之森,5,呜呜呜呜呜 大半夜看这个好催泪 不过这个应该是最好的结局了吧。。。
154,萤火之森,4,果然是夏目友人帐的特别版，治愈系丫~
155,萤火之森,5,每次看必定会再哭一次。。。可不可以不要让人类碰到他！！！！！！！！！
156,萤火之森,4,绿川幸的妖怪动画果然走的温暖系，朋友最早推荐我看的是漫画。我哭了却是因为走神想到了竹本，他骑着自行车回来对阿久说，我喜欢你。
157,萤火之森,5,喜欢一个人就是这么一件简单快乐的事情
158,萤火之森,5,萤要是来一发变成妖怪不就能happyending了。。。。。
159,萤火之森,5,在绿川老师面前我就是个抖M，并且十年如一日...
160,萤火之森,5,一个从头到尾都知道的故事还能看到眼睛发酸，就说明动画的完全成功！
161,萤火之森,4,还是感觉有点短，虽然故事的确很简单
162,萤火之森,4,触不到的妖怪桑 这个结尾... 正是我想要的
163,萤火之森,4,那些年的记忆反而成了最后陪伴自己的，但是已经足够了。
164,萤火之森,4,日本的动画是不是总是这个调调啊
165,萤火之森,4,多好的原声，结尾略仓促了。
166,萤火之森,5,六岁到十六岁，每个夏天的记忆，直戳死穴
167,萤火之森,4,喜欢妖怪什么的，最酷了。
168,萤火之森,4,比起电影来，更喜欢动漫的原因，包容与想象的空间更为之大，所有的塑造都在更为自我的世界里。
169,萤火之森,5,触不到的爱
170,萤火之森,4,第一次也是最后一次。
171,萤火之森,4,最后，最后，居然真的就，灰飞烟灭了！触不到的恋人呐~我也想去那片森林~但是觉得男女主还不够帅不够美啊= =
172,萤火之森,5,不能碰的恋人。。T-T
173,萤火之森,5,戳爆泪点
174,萤火之森,4,理想的人生小品
175,萤火之森,4,小清新，挺治愈的。
176,萤火之森,5,很想再看一遍，回味那种淡淡的感情，给浮躁的我一丝清新。
177,萤火之森,5,哪怕只能触碰你一下，我也就够了。
178,萤火之森,4,触不到的恋人
179,萤火之森,4,没什么感觉就没了
180,萤火之森,4,美好的夏日
181,萤火之森,4,我陷入了为什么不能戴手套的死循环- =。。
182,萤火之森,5,改成动画总感觉少了点什么，好在有音乐和声优，内山好棒我爱惨你！！！！唯一不能理解的是原作里小萤揭阿金面具的时候阿金的眼睛是细长细长的啊！惊艳得我可以一口气吃三碗麻婆！为什么不能还原这一幕呢/_\
183,萤火之森,4,不常看日本的动画片 觉得还不错  很清新
184,萤火之森,5,一贯的小清新 一贯的悲情故事
185,萤火之森,4,所谓少女漫画呀~“我终于可以触摸你了”直接泪崩了~真素的，开始就知道结果了，还是~~泪~
186,萤火之森,5,老娘已经看不了这么悲催的爱情片了好吗
187,萤火之森,5,偏爱之五星。一点也没有失望，看漫画时的感受完美还原。
188,萤火之森,5,就算知道幻觉总会碎裂现在就让我做个短暂的梦吧
189,萤火之森,5,结尾的钢琴曲很好听
190,萤火之森,4,简单的浪漫 还有难道不知道有手套这种东西么？
191,萤火之森,4,这意料之外的鼻酸是肿么了..= =
192,萤火之森,5,时时怀念 那时的金色 将无谓岁月的角落 都照亮
193,萤火之森,4,分裂了吗？分裂了吗？
194,萤火之森,5,特别简单的一个故事，但是充满了细腻绵长繁复飘渺的少女心
195,萤火之森,5,看一次哭一次
196,萤火之森,5,一生一次的，最温暖最不能忘怀的拥抱。
197,萤火之森,5,每个女孩心里都有一片萤火之森
198,萤火之森,4,是美丽，也是很清新。不过时不时也露点儿把持不住的矫情。
199,萤火之森,4,一人}莉，一半妖少年，@不是《犬夜叉》，而是一段年鸵荒o法|碰的柏拉D佟８木自G川幸短篇漫，挠颜x到矍槁慢NA，揭_面具那一刻的停息c羞怯，笑容之下是]定悲Y局的霾。每一期盼的sQ之夏，y身後的已亭亭玉立，剩下的不HH是y消失前敞_的驯А
200,萤火之森,3,动画表现平平，算是很平庸的还原了原作，而且……好你妈的短！！
201,萤火之森,3,本片又名熊孩子棒打鸳鸯，以及论手套的重要性。女性向动画，我被豆瓣齐刷刷的五星吓得不敢说话了，就这样吧
202,萤火之森,3,人生最美初相恋，少女情怀总是诗。
203,萤火之森,3,这故事看的我很不爽...太拧巴了
204,萤火之森,3,呃，男【突剂恕敢慌鋈祟就死掉」病的砘铮在山林居了十啄辏怎N可能有S便v扶陌生人的生活T？x世前的邂逅cx世後的t情有四星甚至五星的水剩就是@D捩c明@是槭录而事件了。
205,萤火之森,3,33869  喜欢你却不能碰你
206,萤火之森,3,前段时间刚重温漫画版 “过来，萤，我终于可以碰到你了。”剧场版话反倒没那么喜欢了
207,萤火之森,3,最近被训练得泪点高了，一点感觉都没有。。。
208,萤火之森,3,对少女类题材还有这画风，实在提不起兴趣
209,萤火之森,3,画面挺美的
210,萤火之森,3,好吧表示我已经过了少女年纪，看到了开头就猜到结尾的故事。。。不过想想那句“这样下去，我肯定会变得比金老”，感触还是蛮多的。
211,萤火之森,3,口味重了之后看这些东西只会觉得美好不再来好吗！是自己的心灵美不再来好吗哈哈！！！
212,萤火之森,3,今年奥斯卡最佳动画 结尾曲很好听 讲了一个山楂树之恋的故事
213,萤火之森,3,有一瞬间真的很动人。但平心而论，制作的比较粗糙，高潮前后也没有什么精心设计的地方。
214,萤火之森,3,感谢萌月字幕组的翻译宏、疯疯、蜡笔，校对宏、蜡笔、月染不透，时间轴月染不透，后期月染不透童鞋！
215,萤火之森,3,因为简单，所以感动。
216,萤火之森,3,每个人身边是不是都有一个很二很二的女生，无论过去或者现在，她或许就是我们错过的那段青春里的主角。
217,萤火之森,3,你丫有没有一点太省略了。。。如今我才发现我的内心再也经受不起这样的单纯了。
218,萤火之森,3,就这么结尾了吗!!!???
219,萤火之森,3,还好吧。。。。初中的时候或许会喜欢
220,萤火之森,3,一碰到动画片，我的少女情怀基本就消失了。。。感悟不了啊。。。
221,萤火之森,3,结尾很糟
222,萤火之森,3,果然老了啊，看这种纯爱小清新已经没丁点儿感觉了……还是滚去看暴力血浆惊悚凶杀之类提提神好了= =!
223,萤火之森,3,只为那一霎那间的相拥。我喜欢你。爱，瞬间即永恒。
224,萤火之森,3,就像是GAY的爱情，短暂而伤感，不可触碰
225,萤火之森,3,淡淡的感觉，还是被煽到了
226,萤火之森,3,没有女人那般爱心泛滥的感觉！剧情俗套，画风中规中矩，一般萌，作为2011年的作品，很一般。――哥跟阿金阿银一样帅，曾经照顾过比竹川莹更萌的小妹妹，屏幕前卡哇伊的你，来吧，哥的肩膀等着你，O(∩_∩)O哈哈~
227,萤火之森,3,24:44出现了纳兹麦
228,萤火之森,3,缺乏新意
229,萤火之森,3,只有40来分钟的样子，应该算是个动画短片，唯美，纯真，很投合女生，很简单的爱情故事，但画的很美。我们这种饱经沧桑的大叔看了感触比较浅，适合中学女生看。
230,萤火之森,3,日本人在描述这些情感上总有独到之处 但是没想象的好
231,萤火之森,3,相当一般，不知为何评分如此之高。
232,萤火之森,3,永远无法忘记的夏天，和一生只一次的拥抱
233,萤火之森,3,不信纯爱很多年
234,萤火之森,3,抄都不会抄......
235,萤火之森,3,之前没看过漫画，所以没有豆友们说的催泪场景到来。看到有人评论说女主应该送手套还喷了出来。不过那份感情的确美好。
236,萤火之森,3,注定是一场没有结果的爱情，却一点也不悲伤，更像是一首清新的散文，让人追忆那盛夏的美好华年，如同青春岁月，一去不再回头。画面清新，干净，美丽，小清新的味道十足。
237,萤火之森,3,与因为相互存在于两个次元而触不到的恋人相比，存在于同一次元却触不到的两人是否更加令人心痛~？很舒服的电影，但是确实没令我太感动。故事很简单，但表达出来的情感并不单薄。个人认为如果拍成十几分钟的短片，效果也许会更好。
238,萤火之森,3,和夏目一个套路…色调很亮但是不扎眼，看起来很舒服；音乐平缓流畅，能让人静下心来看又不打瞌睡；剧情旁枝末节没有很大波澜，不必要的角色多；主角内心活动很多，并且靠此补正剧情；世界观存在很多硬伤但故事不依附世界观；主基调比起治愈来更接近“令人放松”…我说大哥你去买副手套不就都解决了么…
239,萤火之森,3,最后化身泡沫就像得不到爱情的小美人鱼般美丽的消失。少女漫画治愈系。6岁时人类遇见妖怪一见钟情相濡以沫却又无法克服的隔阂。画风还能接受。小剧场。
240,萤火之森,3,夏日的治愈小品
241,萤火之森,3,连个拥抱都那么困难
