,movie,star,comment
373,完美的世界,3,很多在中国的不可能 这电影也完美了一点 对杀人犯的同情
374,完美的世界,3,越狱犯与一个绑架小男孩的故事。
375,完美的世界,3,亲子系，还有啥，完美世界？
376,完美的世界,3,虽然很温情，但是也改变不了剧本的败笔。相比之下《菊次郎的夏天》好太多
377,完美的世界,3,老师推荐的片子。还好。
378,完美的世界,3,其实并没有评价里那么好，也没有那么地感人，可能因为文化差异吧。
379,完美的世界,3,没觉得值得9.0这个分数啊...还以为是自己最近观影心态浮躁，看了评论终于放心了。分数7.0就可以，不要太高。连影评、图评也懒得看了。人生宝贵，既然确认不值得，就没必要在上面花费时间。下一部片子，继续。
380,完美的世界,3,无感。。。
381,完美的世界,3,"回想一下,现在觉得这个真的很一般"
382,完美的世界,3,还好吧。竟然是豆瓣那么前。很轻松的观影。爱音乐爱福特车的强盗。有点这个杀手不太冷的意思。都流行这种混搭吗
383,完美的世界,3,不觉着特好。。。
384,完美的世界,3,后段剧本微微不给力啊，太刻意了。觉得FBI那哥们儿一脸贱相，骚扰妹子是后面加的。前有Paper Moon，再有东木老师的荤段子冷幽默也无法给这片子多加分了。
385,完美的世界,3,全片毫无节奏感可言，磨磨唧唧，绑匪和女警都很矫情！小孩还行。
386,完美的世界,3,虽然很感动，只是为什么那么多枪对着自己，还要去掏口袋，走多几步上车后再交给孩子也OK吧~~=。=~~
387,完美的世界,3,东木的片子四平八稳，可感动人心，水准稳定。可，真的值9分吗？大概是因为拍的喜闻乐见吧！
388,完美的世界,3,铁汉柔情 世界完美
389,完美的世界,3,ur movie
390,完美的世界,3,一个绑匪，遇到童年的自己，开启一段时光旅程。多希望你们的旅行永远不要结束，一起去坐云霄飞车，吃粉色棉花糖，穿着可爱的小精灵服，不给糖果就捣蛋。
391,完美的世界,3,好奇这个孩子以后的人生是什么样的
392,完美的世界,3,布奇不是对菲利普有多爱，他是以某种方式保护他曾经悲伤痛苦的童年。如其所言，他不是好人，但他也不是最坏那种
393,完美的世界,3,我最近的哭点真的很低。
394,完美的世界,3,如果菲利普是女孩，那么布奇就该是美国版的这个不太冷的杀手了～美国人终是不比法国人浪漫啊
395,完美的世界,3,功能性脸谱化人物和硬桥太多了 伊士活叙事和表达能力还是比西部片大师们差一截
396,完美的世界,3,这是杀过人的人吗？看起来连鸡都没杀过。有点愚蠢。
397,完美的世界,3,为什么评分那么好。对了，他爸爸对他有什么期望啊！
398,完美的世界,3,看的时候字幕一直对不上，很痛苦。片是好片，节奏比较慢。
399,完美的世界,3,好像对这样的电影产生了一点点抵触，总觉得结尾不够动人，中间的转折和承接也并未像表现出来的那样毫无逻辑漏洞
400,完美的世界,2,土鳖故事；而且我真不明白为什么要搞双线叙事，东木头自己演的那条线有什么意义啊？
401,完美的世界,1,空洞的伪思考电影，女配角多余。
402,完美的世界,2,没有想象中的经典，好莱坞的陈词滥调。。。
403,完美的世界,2,节奏还可以吧，故事也算稳，但是呢，伊斯特伍德的电影有个很大的问题，他对宽银幕的理解非常奇怪，用色上强调色反差，画面调色比较重，又以冷色调为主，镜头普遍是不完整的中景近景，这就让画面看起来很闷，好像是赤裸裸在告诉别人：我没有才华，这是电影。神秘河是这个问题，本片也还是这个问题。
404,完美的世界,2,虚伪。最后半个小时真是脑残。故事真脑残。找死。克林特伊斯特伍德那么长的时间完全可以减掉，除此之外还有智商掉线，各种脑残行为。
405,完美的世界,2,被评分骗了。。。。大家能否冷静冷静。。。不过男主真心长得帅
406,完美的世界,2,我只杀过两个人，一个伤害了我妈妈，一个伤害了你，两个小孩的旅行
407,完美的世界,2,令我失望了，看过与狼共舞就很期待凯文斯科特纳了。。。
408,完美的世界,2,弱爆了，迄今为止看过的东木最差作。
409,完美的世界,2,一个有圣母心强迫症的越狱罪犯，在挟持8岁男孩逃亡过程中，坚持不懈地以正义的力量惩罚对小孩子不好的人，结果被男孩射了一枪，却毫不生气，在临死前还不忘感化男孩的母亲，最后被一群无脑警察打死的故事。这么假而虚伪的故事拍出来，求求你们救救自己的泪点吧啊啊啊
410,完美的世界,2,1、男主为男孩打造的完美世界；2、自己眼里的完美世界，在他人眼中可能完全不同，且我们看他人也是一样；3、为了爱的人而杀掉伤害他的人，你所爱的人也会受到伤害。立意很好，故事还是一样的人设偏激、戏剧点老套
411,完美的世界,1,前半段非常好，后面缺乏说服力。本来还有亮点想给两星，最后实在受不了这种傻逼作品，必须一星以泄愤。
412,完美的世界,2,当时看《与狼共舞》的感动还历历在目，现在抛下广袤原野，人狼情谊和苏族传奇，我开始怀疑伊斯特伍德一点儿也不会叙事。138分钟，完全没必要这么长，况且它如一条水平线那样波澜不惊，男配女配亦搞不清存在的必要。竟然在豆瓣上打出了9.0的高分，还让一堆人为之痛哭流涕，真是怪象。
413,完美的世界,2,越狱和警匪博弈，与人质关系微妙，剧情很传统，因为小时后产生的”共鸣“，浓浓的”父子“的那种不显露的爱刻画的还算不错，但结尾拖沓败笔。
414,完美的世界,1,《电影手册》经常傻逼么？
415,完美的世界,2,是不是看到老男人和小男孩外加劫匪人质外加童年创伤就要给8分以上？搞毛啊 这么松散的结构 目的性根本不明确的人物性格 能有7分就不错了
416,完美的世界,2,x2玉米地里打死恶棍同伙，斯德哥尔摩症，贬低女性偷车，后备箱尸体谁，买衣服和面具，梅毒末期母亲，耶和华见证人，擦肩而过调头，抢搭的顺风车，老板娘性暗示，讨厌黑人殴打，帮儿子翻跟斗，男童开枪打中主角左腹，熊孩子太讨厌了去死吧，误以为是掏枪，靠伤害善良人引起观众可怜
417,完美的世界,2,完美的世界里，希望不再有恶。
418,完美的世界,1,一星不代表电影渣，虽然真够渣的
419,完美的世界,2,先声明我非常崇拜和尊敬伊斯特伍德，不过这部电影我实在没get到感动的点。。故事不落俗套，但是结尾在我看来实数拖沓（可能在别人眼中是煽情），该片的问题不少：警长的这条线设置的效率不太高，即使在最后露脸也无碍主旨；小男孩倒不是说演技不好，然而不够灵性；男主也有点潘浚在本片中不够“上镜”，缺乏魅力。如果把男主换成阿尔帕西诺肯定不同。我一般不会指责演员，但是该片的选角似乎不够理想。此外，告诉我们犯罪者人性的一面，难道不已经是美国电影中老掉牙的主题了吗？总体而言我认为此片为伊斯特伍德作品中最差
420,完美的世界,2,分数虚高。视角太白，太西部牛仔，太美国。很多叙述没必要也没意思。
421,完美的世界,1,豆瓣9.0分大骗子！！！
422,完美的世界,2,从来对此类无感20140121
423,完美的世界,2,或许是片子有点老，看不下去。
424,完美的世界,2,这么冷的天还让人起一身疙瘩。
425,完美的世界,1,绑架儿童的逃狱犯也能洗白啊（叹为观止.jpg
426,完美的世界,2,普通故事，唠叨成魔，各种快进停不下来，可看性非常之低，没有丁点感动。当然结尾的处理还算不错。Buzz的演技一般。而且，Butch顶多算一个没有坏到根的坏人，怎么在圣母s眼里就成为好人了？！
427,完美的世界,2,在我人看恚引l小男孩_的事件有c，榱私Y局而生的。
428,完美的世界,2,爸爸我们去哪儿
429,完美的世界,2,kid not lovely. ho stupid
430,完美的世界,1,大概是看过的东木最差的一部了..除了开头结尾的处理给人眼前一亮，剩下都乏善可陈。女配角非常多余，准确地说，东木头整个警队的那条线都很多余啊。温情片还要用拖车情节讽刺官僚作风压榨主线的时间真的是ORZ故事十分老套，为了煽情而煽情，仿佛听到编剧的咆哮：“哭！都给我哭！”
431,完美的世界,2,后面30分钟爆弱
432,完美的世界,2,本属差强人意的公路片，最后一枪却让本片逼格降低两星水准。
433,完美的世界,2,莫名其妙的喜欢菲利普的布奇心理问题到底是有多严重才愿意把自己的命栽在他手上，宣扬的高智商到底体现在哪？
434,完美的世界,2,大人小孩都毫无魅力
435,完美的世界,1,这不是一部不好的电影，只能说他不符合我的口味吧。
436,完美的世界,2,豆瓣也骗人啊！很假的片子
437,完美的世界,2,同伙死得太早，导致后期剧情散乱；女配多余，警戏拖沓，一个半小时足矣
438,完美的世界,2,"好傻逼的鸡汤片，呼吁我们罪犯是充满了爱的，罪犯是站在宇宙中心呼唤爱的天使，即便这个天使不小心施了暴杀了人，那也是为了让真爱充满人间所必须付出的小代价，我不入地狱谁入地狱？就让我做这凡世间的罪人吧！这是怎样一种舍己为人的崇高精神啊各位，狙击手你个凡夫俗子是怎么下得去手的？直升机上向下看的时候，那个为了世界大同死去的人间上帝的身影是多么伟岸啊！啊！我真是太感动了！
导演请你自己把这坨屎吃下去谢谢。"
439,完美的世界,2,看完整部片子完全没什么感觉，只看到了浓浓的煽情气息。他真的给了男孩一个幸福的童年吗？一个人的童年假如是五年，他给的快乐顶多十天，有个屁用，就算妈妈答应了回家不还是照样清教徒。只浮于表面罢了。（不过局长和检查员那么激动干什么，还以为罪犯是你们的儿子和未婚夫呢）
440,完美的世界,2,不知大家怎么给这么高分，豆瓣开始让我失望。
441,完美的世界,2,我爸V州跟我爸一起看的 本以很燃Ic可是因槿^不合在出
442,完美的世界,2,树立一个完美主角的时候，你把其他人都弄成傻缺就很有问题。伊斯特伍德总爱这样搞。
443,完美的世界,2,不严肃的公路片，看不到什么东西。
444,完美的世界,2,节奏缓慢，三观纠结，狗血生硬，总体看来挺失败的。
445,完美的世界,2,我实在是受不了影片中，演员自以为是、自认为很酷的样子。说着自以为是的台词，到死都是装逼！
446,完美的世界,2,其实没那么好看。主角美化的太严重了，他是一个囚犯，一个越狱的囚犯，导演这样拍真的好么。
447,完美的世界,2,中规中矩，可能是豆瓣评分让我对此篇期望过大。大叔配正太，斯德哥尔摩，遗愿清单，创伤童年。亮点和惊喜在于警察和官员。贴一个评论：将公路片、伦理片、警匪片等诸多片种熔于一炉，适应了当代美国电影的新趋向―――类型交汇。于是，有了修正型公路片一说。
448,完美的世界,1,为什么坏人的好永远比普通人的好来的更加煽情？ 别人家庭有着宗教信仰 并不是刻意抑制孩子天性 然而男主却总以自己的标准来横判别人 别人好心让他搭车 让他住自己家里 他是怎么样对别人的？？别人的家庭教育纵然不对但也不需要他来这样干涉 况且你这样对别人家庭真的以后有用吗？告诫男孩不要偷东西要小男孩去讨 自己还拿把抢 还切掉别人电话线？我是反正不懂这部剧的感动何在
449,完美的世界,2,好像这位主演的好几部片都是评分莫名高到顶天
450,完美的世界,2,情节拖沓，漏洞很多，劳拉邓恩和克林特简直就是鸡肋，多少年前的观众可能会很感动，这片子今日来看，是什么啊
451,完美的世界,2,这个故事想讲什么呢？人性至高无上？不能随便给人贴上恶人的标签？要深度没表现出深度，想整成温情版的《杀手莱昂》却因为过于刻意追求温情而失败了？伊斯特伍德同志还要强行给自己加高大上的戏……总之，呆愣愣地看完，毫无感觉。（ps：不过如果侠盗飞车可以弄一个这样的任务我觉得会蛮有趣……）
452,完美的世界,1,这九分在逗我玩呢
453,完美的世界,2,程序化、脸谱化的作品
454,完美的世界,2,Butch行为上是一个活在童年阴影中的独裁者，形象却是一个爱世人的赠予者，那层亲情的外衣不伦不类，背道而驰。全程回忆+自白或许还能看。不喜欢本片中的伊斯特伍德，作为导演和演员
455,完美的世界,2,晕。这剧怎么寻思变编的。狂晕。。。
456,完美的世界,1,看完之后对世界产生了浓浓的厌恶感，讨厌除了布奇的每一个人。或许是我的视角有问题，但总之能让我产生这样负面情绪的电影对我而言是差劲的。
457,完美的世界,2,沉闷兀长，结局感觉也不是很合理。
458,完美的世界,2,过于拖沓的叙事看的有点烦，类型片还是有点审美无能
459,完美的世界,2,人生捉摸不透，人性善恶纠缠，对待黑人老伯过于凶残，接受不了这种背离传统意义的君子。对于主角孩子确实是足够好了，只是被他伤害的普通人呢？
460,完美的世界,2,好吧，我无法理解这个故事到底说了什么，或者这根本就不算是一个故事。
461,完美的世界,2,胆识与人性是有一点，但是越狱也太招摇了吧，一路下来，每一处都闹是非，唯恐警察不知道人在何处。这还是两个聪明人其中的一人，聪明在哪里？
462,完美的世界,1,"7.5，他或许是个好朋友，但他是犯人；小时候执着于童年阴影是人之常情，三四十的人还满脑子童年阴影就是懦夫
但是如果他有一个好的家庭呢？美国制度也是无尽讽刺"
463,完美的世界,2,没觉得温情，节奏太慢了，太平淡了
464,完美的世界,2,"（1）这么长的电影，无非就是想告诉大人要善待小孩
（2）剧情安排得太刻意了，除了男主角没一个家长疼自己小孩的
（3）结果有点讽刺，男主角对小孩不错，但是被小孩开枪干掉了"
465,完美的世界,2,就我不喜欢？矫情
466,完美的世界,2,"""I might be an old conservative man, but I have a good heart and I know what is right and wrong. And that's why I give everyone a chance. Oh..in fact,  I still want everything stays right in the same place.""  而且片子拍的又假又做作"
467,完美的世界,1,好吧，真没觉得有多好看啊，所以我是来拉低评分的。
468,完美的世界,2,不晓得这么高分哪来的
469,完美的世界,2,应该是因为斯德哥尔摩综合症搜到这片子，观影过程中用了很多次快进，那几句说教的台词，温情的画面是不错，可是拖沓的剧情过于的伤情真没留下一滴翔。
470,完美的世界,1,又是硬汉萌孩，嗯，好莱坞真有创意！！！！！！！！！！！！
471,完美的世界,2,平淡无奇，不合常理
472,完美的世界,2,实在看不下去
473,完美的世界,2,矫情无比
474,完美的世界,2,欣赏不了
475,完美的世界,2,妈呀，现在再看这种情节简直烂大街了好么？总体来看都是平庸、乏善可陈的电影，演员也缺乏说服力。9.0的分数简直不可思议
476,完美的世界,1,这部电影跟这个名字一样糟糕，    怎么能轻易相信小孩要小孩拿抢， 还要多管闲事，枪是很容易走火的，  硬撑看到小孩射了他就关闭了，  心理学上说，和绑匪相处久了会依恋绑匪，八岁的小孩不会这做的，我本就不想看这部，看木鱼解说说这部片会让所有人流泪，才看了，真他妈浪费我时间，  逃出来就来教训人的？世界上看不惯的事多的去了！逃出来干嘛？！  跟一个素不相识的小孩快速产生感情？   把合作搭档打死了
477,完美的世界,2,好多线都写废了啊！
478,完美的世界,1,从头土到尾的一部片子。2018年才第一次看这部片子的豆瓣er，你们真的觉得这部片子放在今天看依旧优秀吗？
479,完美的世界,2,分虚高啊。一部非常标准中庸的好莱坞作品。追求真诚美好和爱，抵抗虚伪做作和丑恶。坏人的好更能触动人
480,完美的世界,2,不是矫情，真没这么好。剧情的路数一看就到底了。也许的却是我们的观感被宠坏了。
481,完美的世界,2,磨磨唧唧
482,完美的世界,1,情节太过缓慢，让人看的昏昏欲睡，除了小男孩稍有看点以外，其他的真是一文不值，还拍了2个多小时，完全的浪费时间
483,完美的世界,2,分怎么能那么高...
484,完美的世界,2,还是不太能接受这种电影，完全没觉得哪里煽情，剧情也就那样，男主到最后居然给我一种神经病的感觉，看下来还是有点无聊的
485,完美的世界,2,好莱坞标准故事教程，适合十五岁以下观影群众
486,完美的世界,2,可能是期待值过高 9分真的是虚高了 小孩演技肉眼可见 好莱坞模式的老套 人物塑造后期破裂 男主最后对小孩的教育方式根本就是扯蛋 是我无感的公认好片
487,完美的世界,1,做作，平庸，垃圾。
488,完美的世界,2,煽情故事 也就男主角和小正太撑着整部电影
489,完美的世界,2,gotohell
490,完美的世界,1,这不是完美的世界，或许主角是带着幸福的微笑离开世界的，但我不认为主角应该得到这样的结局。本可以不用死，那两个有深意的警察存在的目的只是为了交代背景推动剧情吗？结局太滑稽，男主死掉就可以达到煽情的高潮对嘛，可惜感动的了观众却感动不了我，我没有一颗圣母心，男主释放了这么多的爱和善意给小男孩，小男孩有了父爱的力量，是很好。那么男主得到了什么，与自己缺失父爱的童年和解，小男孩的爱，对，还有吗？他完全值得一个更好的结局，处理的太令我无语，我实在不想给五星。
491,完美的世界,2,挺狗血的俗套啊，冗长且没有重点，很敷衍！之前看评价挺好，但是看了之后挺失望！
492,完美的世界,2,很斯德哥尔摩 很做作 
493,完美的世界,2,不给糖，就捣蛋
494,完美的世界,2,缺乏父爱再有个清教徒寡妇老妈造就的斯德哥尔摩症候群。又臭又长
495,完美的世界,2,九十年代公路电影，越狱逃犯带着个孩子产生了感情，没啥感觉。
496,完美的世界,2,我是对电影失去鉴赏能力了还是逼格降低了呢...看的好无聊
497,完美的世界,2,发誓这将是我最后一次被豆瓣250骗 令人发指的造作 没有一个人物是立得住的 不愧是把金棕榈发给《低俗小说》的傻逼导演
498,完美的世界,2,因很多情节经不起推敲而让人太出戏，比如警察个个傻逼得要死，女配演得奇臭如屎，劫匪要么奇蠢如猪比如被干掉的那位，要么牛逼得没有道理如凯文斯科特纳，至于被劫持的孩子一路美滋滋跟着劫匪跑更是胡JB扯淡。既非喜剧又非正剧更非儿童剧的十足垃圾片。伊斯特伍德演技精湛，可惜于本片而言毫无意义。
499,完美的世界,2,"人的多样性
但不喜欢，很刻意，很极端，无法感同身受"
500,完美的世界,2,我觉得小孩好讨厌啊，不管怎么说，开枪打人，真不能算好东西，害死了那个逃犯，挺恶心
501,完美的世界,2,我是真的抵触这种老少配的套路
502,完美的世界,2,公路/老少/犯罪/官僚主义/少年虐待/政治讽刺等等元素 女主角完全是象征 伊斯特伍德那条线根本没用对了 这片子还有一个很重要的元素：不好看
503,完美的世界,2,美式价值观：讲自己的价值观强加给别人。
504,完美的世界,2,看了一半就看不下去了，交叉叙事用的一点也不精彩，再加上主线剧情的刻画太过流于表面，给人的感觉更像是多刻画一条线来凑时间好渡过中间幕。小男孩这几场戏下来就三种表情，演技直引我尴尬症发作。实在想不明白这片子怎么会在豆瓣这么高评分。
505,完美的世界,1,看到小孩开枪就想关掉电影的冲动，不过还是看完了，完全没有想象中的经典。很失望，非常讨厌剧情中有因误解而错杀真心对待他的人的情结。
506,完美的世界,2,好莱坞式教学片，为公路而公路显得公路很廉价。
507,完美的世界,1,也许没人能理解你，但我们还需要坚定的完成自己的使命
508,完美的世界,1,为什么我给一星，因为明明是一个很感动的故事，为什么感觉有点“假”，一切都太巧了，逼得男主吃最后一颗枪子，这么刻意的安排下，我真的哭不出来。
509,完美的世界,2,很不好看，看了10分钟，不知所云，果断删除
510,完美的世界,2,没有看完，感觉一般，节奏慢，不知道为啥评分那么高，我我给不及格。
511,完美的世界,2,学好不容易学坏一出溜，典型豆瓣评分虚高的片子
512,完美的世界,2,这特么还是罪犯吗？很明显是打着犯罪的幌子在兜售布奇与菲利普之间的感情好吗？
513,完美的世界,2,又被豆瓣儿评分儿给骗了。
514,完美的世界,2,莫名其妙的双线叙事，莫名其妙地被所有路人喜欢和帮助，如果就是为了体现布奇的聪明的话编剧水平也太差了。布奇从坏人到好人的转变我看不出来，他从一开始就对菲利浦很好啊？！菲利浦的反应能像个孩子吗？？不知道为啥这么高分。
515,完美的世界,2,太一般
516,完美的世界,2,纯粹煽情片
517,完美的世界,2,不感冒煽情
518,完美的世界,2,公路警匪片。故事容易猜到结局，且有说教嫌疑，各种洗白罪犯做铺垫然后煽情，没什么惊喜，很拖沓。
519,完美的世界,2,不喜欢小孩的表演 拖沓 第二条线有用吗 好累啊真的，，，
520,完美的世界,2,唯一一部在豆瓣9分以上而我觉得特别特别特别特别特别难看的电影，可能是有仇吧
521,完美的世界,2,为什么豆瓣这么高分
522,完美的世界,1,一般啊！为什么那么多人看了要泪崩！
523,完美的世界,1,平庸之作，一分是为了修正过高的豆瓣评分
524,完美的世界,1,在怎么温馨，他也是一个罪犯逃犯啊
525,完美的世界,1,克里特・伊斯特伍德的片子都有点过于做作和假了，一开始看着还行，到后来太过了就觉得没意思了。尤其后半部分过于拖沓。
526,完美的世界,2,被评分误导，并没有这么好。结局太拖沓，主角完全是作死，完全不催泪。
527,完美的世界,2,Really？？这片子有9分？？
528,完美的世界,2,坏人的好总是让人能轻易原谅他的坏
529,完美的世界,2,辣鸡，什么垃圾？？？无聊透顶
530,完美的世界,2,渭胞生物
531,完美的世界,2,我们还期待一种父爱，他宠溺着我们，不像母亲管教那么严格，他允许我们吃垃圾食品，不做作业也可以去看电视；最好是带着我们去长途旅行，让我们坐在车顶吹风。
532,完美的世界,2,讨厌犯罪心理学家的声音哇
533,完美的世界,2,不能感同身受，就没法被打动。
534,完美的世界,1,什么烂片啊。。。 我这半小时真是浪费了
535,完美的世界,2,给骗了
536,完美的世界,2,我憎恨这个偷车贼，你他妈为什么拿枪去剥夺别人的财产，为什么撞坏警车。
537,完美的世界,2,主线剧情让不接地气，支线剧情特别多余…越看越迷离
538,完美的世界,1,是啊，警察是干什么吃的
539,完美的世界,1,老电影，看了3分钟，没兴趣，弃剧了
540,完美的世界,1,女主角演技太差
541,完美的世界,1,继《美丽人生》之后又一部不能坚持看下去的电影，完全不值这么高的分数
542,完美的世界,2,这次我又成了唱反调的 结局固然感人 但这不是男主赎罪的原因 在你最想杀死他的时候 他活了下来 在他最不能死的时候他却死了 真是讽刺
543,完美的世界,2,看不下去了，节奏太拖沓了
544,完美的世界,2,这就是不喜欢的公认好片
545,完美的世界,2,飞利浦最后丢下面具跑向布奇的一霎那我以为这是个好电影 以为最后他们俩一起幸福的生活在阿拉斯加！没想到导演和编剧和最后开枪的那个DSB一样的SB！影片意义何在！要说明啥！好人变成坏人又变回好人还是特么逃不过一枪的宿命呗！耍观众玩呢呗！电影名应该改成一张明信片引发的惨案！SB！
546,完美的世界,2,没感动到我
547,完美的世界,2,md这部电影看得我恶心，假如你是那个母亲，假如你是一家之主用了几年积蓄买了一辆新车全家出去郊游，好心让别人搭顺风车然后被抢，假如你是那个农民好心招待路人来家做客结果连累全家被绑险些丧命，你会觉得这个故事很温情？
