,movie,star,comment
228,完美的世界,3,故事的根基太浅，人物塑造也不到位，平淡如水的叙述和模式化的结局都难以支撑其成为一部优秀的作品
229,完美的世界,3,恩……不知道为什么，我总是特别纠结于编剧，很多地方让我质疑逻辑性。我不喜欢这样，电影是用来感受的嘛！我还是太麻木了……
230,完美的世界,3,节奏略沉闷，他们的感情有点深奥。。。感触最深的还是那群只顾破案率只顾表面功夫的混蛋。
231,完美的世界,3,如果删掉老伍德自己的那条线，电影会更饱满。另外，我得承认，有些男人的存在就是让女人犯贱用的，MD!
232,完美的世界,3,被高估还是我期望太高？双线叙事意义何在？ 小感人，但还没感人到让我眼角湿润。
233,完美的世界,3,耶和华见证会的人因为信仰而拒绝玩万圣节的trick or treat。有谁相信一个刚刚越狱成功的男人杀完同伴居然温情脉脉地带着劫持的人质小男孩开始一段公路旅行，并且慢悠悠地给他买衣服讲道理鼓励他做自己想做的事。两条主线相互交错，女犯罪专家一线基本瘫痪无用，而逃亡主线不够丰满，节奏不够紧凑。
234,完美的世界,3,看这个电影完全因为警长和导演是Clint Eastwood，结果看完了除了煽情没有记住什么。不太明白追踪那条线有什么用？然后精灵服装好丑，追踪的配角没有性格，一直在讲butch的成长背景，情节完全没有体现butch和女主聪明在哪。就最后比较感人。看完影评觉得好吧勉强算扣题
235,完美的世界,3,前边还行，结伟太烂，为什么非要在最后掏那张纸，不知道瓜田李下吗？不知道大家都很激动，都在瞄着你吗？还是一个职业杀手呢？！太不符合常理了
236,完美的世界,3,这个世界不完美，完美只在我们心中
237,完美的世界,3,不喜欢结尾凯文冲男孩老爸发飙的道德优越感
238,完美的世界,3,“逃脱于社会秩序之外的主人翁是如何在法律和道德的边缘建立起自己的“完美的世界”的。当然，这种乌托邦的世界自然是易碎的、易毁的。不过克林特・伊斯特伍德还是探讨了这种世界存在的必然性以及它对现实世界的意义。”
239,完美的世界,3,挺俗套的，手法很平实，好在煽的比较自然。ps:美国电影里总有那么一两个在政府机关工作的讨厌鬼，真不和谐。
240,完美的世界,3,"If have to choose, will you be a good guy but a bad father or a good father but a bad guy? My answer is the latter. Comments about Eastwood are always controversial, among them, I agree with the criticizers. ""空洞的伪思考电影，女配角多余。"""
241,完美的世界,3,导演不注意细节。女探员很有个性。
242,完美的世界,3,双线叙事/教科书范文/幼稚/伪深度
243,完美的世界,3,我类个去，在豆瓣分这么高。。。
244,完美的世界,3,真没发现这居然是伊斯特伍德的片儿，看来人上了年纪就有怀旧和矫情的毛病，这部电影的情感表达完全没有《不可饶恕》里那么内敛和干净利落，倒更像是肥皂剧，不过，还是挺感人的。
245,完美的世界,3,题材不错，但是故事走的支离破碎，大概是，剧情不够支线来凑，最终为了煽情而煽情
246,完美的世界,3,honey说很好很好推荐我看的，我可能不懂吧，毕竟是两个男人的友情电影（在我眼里都是基情）只是觉得把一个小孩子当成大人地去尊重才能赢得他的喜爱啊。PS，拒绝暴力~！！！！
247,完美的世界,3,主题挺不错，但是剧情比较拖沓冗长，有些完全没有必要的角色和双线叙事，再加上做作的演出，还是有些失望。
248,完美的世界,3,"1.故事本身张力太弱，东木头似乎想讲一些深刻的东西，但很明显根本失败；
2.双线叙事太过鸡肋，好好讲朴素的公路片故事会好许多；
3.东木头自己导演了许多佳片，除开进了250的廊桥遗梦，神秘河、不可饶恕，甚至于百万美元宝贝都比该片强太多，而这部片子竟是东木头在豆瓣里评分最高的，严重质疑豆瓣"
249,完美的世界,3,stupid child
250,完美的世界,3,我真的很难在坏人做了一点好事就因此感动，因为我实在不会忘记他作为坏人带给别人的伤害。最后过于煽情以及毫无重点的警察支线也不是很懂，唯一可以赞扬的是当公路片来看觉得够酷。
251,完美的世界,3,就说里面长官的咋那么脸熟，原来导演也是Eastwood....
252,完美的世界,3,6.0分，为什么评分这么高，没什么意思嘛。看了简介就知道全片了，小男孩演技还不咋滴。
253,完美的世界,3,坏人之所以坏肯定有原因，坏人骨子里其实都是好人。老套路的电影，但总是让人看得感动不已。
254,完美的世界,3,可能是我对凯文科斯蒂纳 有偏见
255,完美的世界,3,用力^猛Eastwood
256,完美的世界,3,没意料中的好，比较做作，可能我泪点太高。
257,完美的世界,3,又是一部把警察当傻逼的片子 双线巨傻逼 还有煽情嫌疑
258,完美的世界,3,经典还谈不上，因为用现在的眼光来看许多情节很无趣，有些人物挺多余...当男1第一次见到男2之后是不是就忘记了自己越狱的目的？还有些地方逻辑上有问题！此电影受众应是小盆友，但需大人陪着看！立意很好，但电影一般...
259,完美的世界,3,我只杀过两个人，一个伤害了我妈妈，一个伤害了你
260,完美的世界,3,前面的酷劲一直绷得都好，到黑人家后却泄了
261,完美的世界,3,只看了后面点，故事很好，但结尾痕迹太重
262,完美的世界,3,亲情片啊 坑爹啊
263,完美的世界,3,那个小孩现在已经长成印度人了，快来围观  @Susie
264,完美的世界,3,为何双线叙事？
265,完美的世界,3,一边是不给糖果也不能捣蛋，一边是又给糖果又能捣蛋，不管是大人还是孩子，选择都不会太难。可惜，世界总是偏向不给糖果也不能捣蛋的那边。所以打了两枪，谁让你给糖果！l让你捣蛋！
266,完美的世界,3,同样的一个故事因为主角的背景性格设定而变得非常复杂，但结尾第二枪过于戏剧化的结局又让这个故事最终流于商业片的逻辑。可能1993年还是一个不习惯开放式结局的年代，但1993年的凯文科斯特纳却永远让我想念。
267,完美的世界,3,所有想诱发人类流泪的东西都是肮脏的
268,完美的世界,3,到底好在哪里啊？全片韩剧情节+70年代画面。男主角死前告别时间长度约为1.5集海女了。不过，如果女侦探男警察那条线完全砍了的话，说不定会看起来不那么糟？
269,完美的世界,3,为什么评分那么高？苦情片在douban永远都受欢迎啊。eastwood的那条线删掉，完全没有什么影响啊。
270,完美的世界,3,还好吧，不是我的菜
271,完美的世界,3,每一段新闻之后都有一个值得探究的故事，勿要完全被“标签”所扰。
272,完美的世界,3,很有品位的老师让我们看的，片子太老，看着吃力啊
273,完美的世界,3,刻意打造出来的人物和为了人物而生造的剧情，好莱坞式的假，这种洗白不是所谓的人性爆发，价值观很有问题。伊斯特伍德和斯科塞斯差很大一截。
274,完美的世界,3,"克林・伊斯特伍有特功能，就是他能把稀平常的故事拍的深刻感人。
不^，以前一直]意R到@部影是他У模因在太普通了。"
275,完美的世界,3,没有愚蠢警察的烂俗剧情，才更能打动人心。
276,完美的世界,3,1993。再看94年的这个杀手不太冷，瞬间觉得果然受不了美利坚大温情牌。
277,完美的世界,3,中间睡了一觉，醒来发现剧情一点都没落下。但混球老爸抛弃妻子跑了这类的题材，在美国片中反反复复地出现，让我总是无法相信心中居然油然而生社会主义好来。咱为啥挺少见这种新闻呢。。。伊斯特伍德慢悠悠的风格的确还是挺酷的。
278,完美的世界,3,好看在哪里啊？套路地要命，警察追捕，还有那个犯罪学家完全是多余！把男主换成大猩猩，泪点雷同……
279,完美的世界,3,犯罪毕竟不是儿戏，会在雨天喂流浪猫的不良少年可以有反转，杀人犯却不能。底线坚守得不错。
280,完美的世界,3,我只杀过两个人，一个是伤害你的人和伤害我母亲的人
281,完美的世界,3,big man &little boy~
282,完美的世界,3,前面又走神。。但被后面煽湿了。心里呼喊着谁给那个杀千刀的揍一顿吧！然后东木爷很顺应人心地来了一拳~阿姨补刀~ 父爱缺失和童真救赎。三星半。
283,完美的世界,3,这部的评分应该是过高了
284,完美的世界,3,牢犯越狱后劫持了一小正太，逃犯和人质的关系渐渐升华为不寻常的父子之情。也许警察眼中的所谓逃亡在当事人心里是段美妙的旅程；正派者即使坐过牢房也还会有一身正气（哈！快使用双节棍哈！）；千万不能打孩子！
285,完美的世界,3,好莱坞和韩剧都有童年综合症，一个早早变态，一个早早恋爱。我不知道菲利普长大以后是否身心健康，我只知道，慈悲的罪犯仍是犯罪的。布奇最后的死只不过是为了维护所谓的正义，过审。笑而不语。
286,完美的世界,3,少一点煽情也许会更好
287,完美的世界,3,主角和小男孩是很好玩的，但是想想剧情太滑稽了。布奇花那么大的力气越狱为了神马？就为教一个小男孩大道理吗？
288,完美的世界,3,电影频道看的，还行
289,完美的世界,3,主角菲力浦是耶和华见证人教会的，不参与万圣节活动，主角家宣称，我们的信仰使我们更高尚。他们不过圣诞节，不过生日和一切派对。菲力浦甚至没去过游乐场，没吃过棉花糖，没坐过云霄飞车。奇怪的教会
290,完美的世界,3,有爱，但无悬念，又是一部美化犯罪分子们的电影，这个杀手不太冷，但是小男孩比当初娜塔莉波特曼可爱
291,完美的世界,3,很有思想的电影，但是结尾太过令人忧伤。他没有给我一种积极向上的力量，我很看重这个，所以这也是我给他减分的原因。
292,完美的世界,3,考虑到这部电影上映的时间是1993年，后来的二十多年里这种坏人也有好的一面的反差电影看得太多，比较无感，如果放在当年应该会很感动。
293,完美的世界,3,特别安静特别不刺激的犯罪片。爸爸去哪儿兼菊次郎越狱片。但是最后还是被催出眼泪。令人深思的是，我们该怎么看待犯人。
294,完美的世界,3,暴力是无法换回亲情和安全感的，美国佬儿就是没办法理解这点!
295,完美的世界,3,往前就是未来，往后就是过去，停下来就好好享受当下。
296,完美的世界,3,别对骗子撒谎
297,完美的世界,3,那金发妞儿是坨屎啊
298,完美的世界,3,不关于犯罪，而关乎男人与男孩间疑似父子的真情。如果不是结局那里凯文科斯特纳太嗦，我肯定会给8分的，哈哈哈
299,完美的世界,3,很久之前看 二观 剧情不复杂 杀人越狱 在于几个情节引人讨论深思 豆瓣居然9.1 这帮人很容易让这种敞开性话题的影片骗高分 从而忽略电影的多数情节几乎不会发生 连续发生更不会有的事实 邓恩双眸很美 难怪被人壁咚 为什么不继续强吻？ 牛仔警官想起老无所依 电影从头到尾基本是让逃犯扯温情 你说我是该感动还是愤怒？
300,完美的世界,3,没觉得那么好，10分满分的话6分左右。看完这个电影我想起来一段话，好人一心向善未必能成佛，坏人放下屠刀就是佛！最后开枪的FBI真的那么坏么？远远看去如何知道男主不是在掏枪，在打死个坏人和牺牲个好人中间来抉择，我觉得大部分人都不会选错，只是因为有上帝视角才站在道德的高度当圣母婊么？大部分人因为看了电影有上帝视角，知道男主因为保护小男孩和他妈妈才由于误会绑架了小男孩，FBI和警察知道么；男主因为另一个越狱犯打了小男孩所以杀了他，FBI和警察同样不知道；最后的枪手曾经想在车里跟女配搞，所以就定性为坏人？所以FBI只是枪毙了一个杀过人的绑架犯仅此而已！
301,完美的世界,3,好故事，讲的潦草了，配角也不给力啊
302,完美的世界,3,想起leon，这个杀手不太冷的leon罢了
303,完美的世界,3,这小孩儿都快被当亲儿子了，竟然直接就给肚子一枪，是走火了还是不懂事儿啊，坑啊。。你都把人坑死了还又哭又抱又牵手说一万遍对不起有啥用。那男的是好人啊，虽然干了点出格的事儿，但也是维护正义啊。见过那么多熊孩子，但这小孩儿算是比较萌的了。那破车竟然被称为惊人的警方装备“高科技拖车”。。
304,完美的世界,3,有点像刘德华的某些个人英雄片子，但是美国人拍了就给5?
305,完美的世界,3,要么有个极好的朋友，要么有个极好的儿子，人就可以被从一团糟的生活里解救出来。
306,完美的世界,3,节奏太缓慢了呀……
307,完美的世界,3,~i am philip.....e...buzz
308,完美的世界,3,剧情到后面开始鬼扯了，70-90年代片子的通病.......
309,完美的世界,3,州长作秀的慰问、竞选车是比较搞的那段；整部影片给我最大的印象是真实，真实的爱以各种方式呈现，真实的生活，无论从警察的视角，还是逃犯的世界；最后情节发展有些慢，如果紧凑一些效果会更好；孩子的演技可圈可点，但并不尽人意~
310,完美的世界,3,伪善良的越狱劫匪为人质编织的一个perfect world
311,完美的世界,3,老牛仔导演的片子总是一股子老牛缓缓拉车韵味，不是那种能刺激大脑皮层感觉很爽的类型，电影多年前看过，若干年后再看，依然说不出哪里好哪里不好，似乎很简单似乎又包含了若干人情道理，这也许就是他独特的魅力吧，有的时候感觉多点有时候少点。
312,完美的世界,3,感人有余，创新不足
313,完美的世界,3,最大的败笔就是男主缺少一个从纯粹的绑匪到变成孩子保镖的转变过程，而是从相遇那一刻起就开始扮演一个父亲的角色。缺少冲突与感情建立的过程。一丁点恶意没有完全一副梁山好汉样子的“坏人”去做好事是没有震撼力的。是部好片子，但绝对称不上经典。
314,完美的世界,3,看的版本声音太轻，根本听不见……
315,完美的世界,3,唯一喜欢的一点就是Kevin Costner。。。。帅得令人发指啊！！Mickey Rourke啊！熊孩子，他抱了你楼了你你还冲他开枪？！你要是不学石井尾莲一样把凶手剁了，对得起良心吗！！
316,完美的世界,3,3.5/5。有点太冗长了。结尾的大煽特煽也对我没有什么效果。
317,完美的世界,3,中间出彩多结局实在没什么看点
318,完美的世界,3,剧情俗啊，煽情煽得莫名其妙。
319,完美的世界,3,本来故事挺好的，但是每个桥段讲得太刻意了啊。。父亲、成长之类的。。为了父亲而父亲，为了成长而成长。。嗯，小家伙，第一眼看起来好萌好萌，看多了就觉得好呆好呆。。
320,完美的世界,3,原来缺爱的孩子不一定成长为变态，也可能父性满满，真男人。但影片有些过长了。
321,完美的世界,3,从现在眼光看，过时了，虽有感动点，但非常刻意，应该说在当时可能是部好电影，但不值得放到豆瓣148位，9分是高估了。
322,完美的世界,3,可能还是看的太晚了吧，现在我看来不无聊也不精彩，不到两个小时的时候也没坚持住睡着了！感觉是受到父亲影响缺少父爱的越狱犯，带着一样缺少父爱而且还受到宗教约束的小孩的一场公路之旅！
323,完美的世界,3,现在看来很一般
324,完美的世界,3,意义不错 剧情稍显刻意和平淡
325,完美的世界,3,节奏有些拖沓，作为反英雄鸡汤片，情绪渲染得也并不是很到位，伊斯特伍德这一线的情节有画蛇添足之嫌，总的来说比预期的差了很远
326,完美的世界,3,小男孩好萌！男主角是就这种演戏风格吗，念台词一点感情都没有！还是因为他演的就是那种没收过良好教育的小混混，所以故意这么说话呢？！瑞德真是个好人o(R∩Q)o 萨利衣服好漂亮。
327,完美的世界,3,我只杀过两个人，一个伤害了我妈妈，一个伤害了你 
328,完美的世界,3,岁月是把阉割刀！克林特伊斯特伍德在西部片里那么帅！
329,完美的世界,3,应该n年前看过，记得当初看的时候哭的难过，好久没有回过神，具体故事都忘记了，只有那感觉还在。今天温习了遍，觉得过程冗长，看到最后...鼻子还是酸酸的，也可能只是热伤风。我很喜欢男主，铁汉柔情。此外，最喜欢探长……
330,完美的世界,3,我可不可以说没一个罪犯都有一颗敏感的心和单纯的想法！
331,完美的世界,3,东木头自己演的线扣分
332,完美的世界,3,最可有可无的女主角，劳拉邓恩的这个角色真是多余。吐槽一下影评，难得看到的完全一面倒的评价，而且评论大多都是一致的什么泪流满面啊、不完美的完美世界啊、男猪脚当自己爹多好啊、小正太好可爱啊。。。我就不明白了，这TM到底是怎么回事。。。
333,完美的世界,3,"情节有问题，节奏也是。过程不曲折，甚至有些冗长。
小孩什么都不懂，但是懂得感受甚至懂得善恶。
里短评有句话说的还挺好：有以爱为名的禁锢，就有以绑架为名的解放。
但是，越狱犯真的是以拯救为名带走小孩的吗？
对于逃犯复杂人性的剖析，我看是有点过度了。可能，电影不过是完成了对于小孩童真的解读。
小孩的明净心灵，才是一个完美的世界，填补了成人的缺憾，消弭了冷肃的罪恶。
只是，这个世界里，到底是什么，在一点点一点点的破坏掉小孩子与生俱来的纯洁的心灵？

至于评分，过9属于虚高了。哭成狗的人的泪点，我不太懂。

请善待小朋友！让他吃棉花糖，让他过万圣节……"
334,完美的世界,3,与《中央车站》、《菊次郎的夏天》剧情如出一辙，但《完美世界》早于这两部篇。  虽然整个剧情感觉已经很捞了，但鉴于1993年的电影，从剧情的创新性来说还是值得鼓励的。so，三星~
335,完美的世界,3,我似乎已经过了看这种电影会感动的年纪了....
336,完美的世界,3,not that touching
337,完美的世界,3,小清新得太过平淡了。。
338,完美的世界,3,德州时光旅行。time machine
339,完美的世界,3,菲利浦对布奇的感恩怀恋，是因为布奇给予了孩子他内心真正渴望得到的鼓励与肯定，以及像父亲像朋友一样的情感。感动的思考~
340,完美的世界,3,……我觉得一般。警察追捕的线不够惊险反而让人觉得警察没什么卵用，FBI非常多余，沦为制作冲突的工具人（然而冲突也不够）说感人吧我也没有被怎么感动到……就，带不入剧。特别是黑人一家的我觉得很莫名其妙，最后被男孩射了一枪我也觉得莫名其妙，男警察和女协警本该是懂布齐的，但是也没有为他做什么，那前面说一堆都是为了在射杀他后感到难过？？我知道设定是男主要狗带，但是这个狗带得有丶牵强，就让我觉得，本不必如此。这部电影就像是越狱版菊次郎的夏天，但是既没有《越狱》的紧张与斗智斗勇（布齐和女警最聪明的两个人？？），也不够《菊次郎的夏天》的温情与感动，就，一般。
341,完美的世界,3,昨晚电影频道刚(or I should say 又）放了一遍呢
342,完美的世界,3,这不是多管闲事惹的麻烦么？
343,完美的世界,3,太多累赘的剧情了，布奇后来算是兽性大发以后又善心大发吗？男孩演的很不错，三星给男孩
344,完美的世界,3,高达9.0的东木头的美国公路片，看的我混混入睡，主要是看了开头就知道结尾了，让人提不起兴致。
345,完美的世界,3,老套不独到，孩子虽然你已经落伍了
346,完美的世界,3,我没那么喜欢小孩。
347,完美的世界,3,无力感动。很是费解为什么布奇要企图杀死善待他们的黑人一家。即使黑人老头喜欢打孙子也不至于那么偏激吧。无感。无感
348,完美的世界,3,没有想象中的经典 虽然叙事拍摄确实不错 但原谅温情片一直不是我喜欢的调调
349,完美的世界,3,已经看了几部公路片，剩下二十分钟都能猜到结局了，所以真没特别感动，反而觉得是陈词滥调……小男孩选角选的好增加了几分说服力，但那个女警官是什么鬼…一出场那个调调就是个套路觉得特别没意义也很恶心怎么的，这个分数真的是过誉了，比末路狂花都差太多意思，软趴趴的结尾，3.1分
350,完美的世界,3,我们都斯德哥尔摩了。已经完全是父子了
351,完美的世界,3,平原美景。
352,完美的世界,3,这绝不是一个值得称颂的人或某种值得称颂的感情
353,完美的世界,3,when a man loves a boy.公路片，拍得很流畅。但是不知要表达什么。
354,完美的世界,3,好生硬的结尾
355,完美的世界,3,3.4星，幸运的人一生都被童年治愈，不幸的人一生都在治愈童年，不光是童年，渴望而不得的执念，追寻着……
356,完美的世界,3,演员不错，但还是有点刻意煽情的感觉，剧情有点表面化
357,完美的世界,3,有点拖沓的煽情之作，不就一斯德哥尔摩综合症，温情脉脉的有些假惺惺，或许不该用20年后的眼光去看待它，相信电影还是可以轻易地动摇了观众的价值判断，成功地左右他们的情绪。ps：我还是挺喜欢科斯特纳的。
358,完美的世界,3,在看这片子的时候，我在努力的想着，这部片子为何能得那么高的评分，最后，也不得而知。只是赞叹男主在整个过程中都保护着男孩的纯真与美好。应该赚足很多人的眼泪了吧，可惜，没赚到我的
359,完美的世界,3,逃亡过程中略显枯燥，看到结尾处布奇像菲利普妈妈读清单的时候，有感动到留下几滴眼泪。总的来说，还行。如果过程中再增加一些感人因素就好了。
360,完美的世界,3,片子是个好片子，两个半小时完全感受不到时间的流逝。讽刺，幽默，潇洒，情感，浪漫等等演绎的也都很完美。可我完全不能入戏的就是怎么会有一个八岁小孩子被抽了一巴掌不会害怕不会哭，被猥琐怪蜀黍猥亵还能镇定自若，被一个绑匪（虽然绑匪很温柔）劫持也毫无恐惧，车自己动了能冷静地听话踩刹车踩油门..让我总是以为是两个大人间的革命友情..或是孤儿怨人设的冒险旅程..这个杀手不太冷里的玛蒂尔达也成熟，但她很有孩子的一面，让人信服，这个就不太会..又看了下，这个比leon早一年..还是厉害的，三星半
361,完美的世界,3,又一部大热的意淫片 男孩和三个女性在一起会变gay 妈妈禁止自己做一切快乐的事 就你厉害91 就算导演刻意不表现男主杀人过程 我也认同不起来 结尾还悲情了一把？？？大小主人公之间的感情塑造的不错 小主人公结尾像个小大人 大主人公结尾倒像个受伤的孩子 双方互相释放爱意和温暖 运用的摄影和构图很温馨 这条线最佳 但警匪追逐戏不慌不忙双方仿佛在观光旅游 bug颇多 叙事线多余导致拖沓是硬伤 于14#216和吴悦
362,完美的世界,3,豆瓣9.1的评分虚高，大小两位男主演技在线，不过影片故事今日看来太老套了。
363,完美的世界,3,小孩子太乖了，看得想恋童。忘不了里面冷不防的讽刺。
364,完美的世界,3,涉及的东西很多（原生家庭，宗教信仰，低效政府），然而都并不深刻，但这碗斯德哥尔摩毒鸡汤确实很毒，最后说不感动是假的
365,完美的世界,3,唔，中规中矩吧。搁现在看来，没什么亮点了其实，而且私自以为拖戏了，还可以更简单点的。。。
366,完美的世界,3,西部片版的《这个杀手不太冷》，东木的电影总想按快进键
367,完美的世界,3,Eastwood的公路片也透着他独有西部牛仔的情怀，与港式黑道片的兄弟情义、弗朗西斯黑手党的戒律守则、昆汀单纯的暴力快感有所不同，英雄实际上也是充满温情的人，无论好坏。从西部三部曲，到不可饶恕，牛仔符号下是一个个善良的普通人，这也许就是老牛仔影片的魅力之处吧。
368,完美的世界,3,都快忘记了
369,完美的世界,3,完美的世界只存在于人们的心中
370,完美的世界,3,人太好了，这样的好人怎么会犯罪呢？一旦人物太完美，高潮冲突就很难起来了。人物逻辑不够结实。
371,完美的世界,3,特编的故事 不喜欢这样的故事  然而潸然泪下了   孩子是致命武器
372,完美的世界,3,Bonnie and Clyde，Badlands，Paper Moon的无数种可能
