,movie,star,comment
98,完美的世界,4,一句话：现实当局的都是吃屎的。男主角和小孩的戏是出彩的，他因为童年的缺失所以对小男孩疼爱有加，他因为父爱的缺失所以让这个男人为他打开了一个多彩的世界――完美的世界，即使这一切从一开始就注定不完美。但整个戏都有点勉强，逻辑性不强，到戏尾变得跟韩剧似的拖拉。故事性强。
99,完美的世界,4,你要不要那么催泪，你要不要要不要要不要要不要！！！！
100,完美的世界,4,与你的冒险，童年一晃而过，我是否还会记得曾经的完美的世界。最后泪目了，%>_<%
101,完美的世界,5,硬汉电影，又被秒杀到了泪点，东木先生的经典，看一部少一部啊
102,完美的世界,4,"生在这种几近禁欲主义的家中真是悲哀；被围追的罪犯却给了孩子一段生动的人生旅行，这才是完美世界的意义吧；非常不满最后黑人家中的暴力桥段，完全是为了最终的悲剧结局设计的，也许这就是所谓的戏剧冲突
PS：海报值+星"
103,完美的世界,5,a perfect world has no ending
104,完美的世界,5,矮油，对于这种真爱必须死一个的片子我还是汤不牢……
105,完美的世界,5,呜呜呜呜呜呜呜呜呜呜呜呜呜呜呜呜呜呜呜呜呜呜呜呜呜呜呜呜呜呜呜呜呜呜呜呜呜呜呜呜呜呜呜呜呜呜呜呜呜呜呜呜呜呜呜呜呜呜呜呜呜呜呜呜呜呜呜呜呜呜呜呜呜呜呜呜呜呜呜呜呜呜呜呜呜呜呜呜呜呜呜呜呜呜呜呜呜呜呜呜呜呜呜呜呜呜呜呜呜呜呜呜呜呜呜呜呜呜呜呜呜呜呜呜呜呜呜呜呜呜呜呜呜呜呜呜呜呜呜呜
106,完美的世界,4,让人不喜欢，却真实的结局。生活就是这样的吧！所谓的完美世界，存在于何处呢！所谓的完美又该如何定义呢！
107,完美的世界,5,荣升为我最爱的电影了。。给我一个Butch吧！！！他是那么的美好。philip的一生都被他改变了。
108,完美的世界,5,"I am not a good man,I am not the worst neither.Just a breed apart."
109,完美的世界,5,"It calls A Perfect World, I say it is a perfect movie.It really felt good watching two brothers hanging around. Butch is like an angle for Buzz. and he got a chind's heart inside himself."
110,完美的世界,4,看了一段时间了，现在添加进来。只记得凯文科斯特纳是一个能引得少女思春的罪犯，最后死的很惨，挺赚人眼泪。
111,完美的世界,5,温和的暖风，奔驰的车辆，漫无目的的离去，旅行式的逃亡，男人总会死去，孩子总会长大，《这个杀手不太冷》的另一个版本。
112,完美的世界,5,==1==BDRip-NowYS  超可爱的小娃，完美伙伴版的科斯特纳。。。
113,完美的世界,5,"小时候cctv6看哭了,今天又看哭了.记忆上没有那时哭的激烈.可能已经知道了剧情?肯能是长大了些?是不是长大之后感受力真的就会变弱,就会慢慢变的冷酷无情.如果是那样,我选择是因为提前知道了剧情而显得云淡风轻.
对话“偷窃是不对的,ok？ 但如果你真的需要,又没有钱。你可以暂时借用一下。这叫做例外“"
114,完美的世界,4,"哪怕只是一丁点的善，也要用好大的恶才能扑灭。
你会变成什么样，取决于你遇见谁。
20130310"
115,完美的世界,5,最后哭的稀里哗啦的  原来那个真是Eastwood啊
116,完美的世界,5,结局煽得我肝肠寸断眼泪都快流光了。。。老牛仔导的戏。。。刚刚的
117,完美的世界,5,看了3遍，哭了3遍。不想去追究 剧本好不好，情节合不合理，演员认不认真，难道一定要一个镜头一个镜头地去分析，才能证明这是不是一部好电影？我是看电影，不是拆电影。大家是想要一部不完美但感人的，还是要一部完美的但无趣的电影？我有真的被感动到，就这样。
118,完美的世界,4,孩子被带跑偏了啊喂，但是两个人都好可爱。结局真他娘的心塞。
119,完美的世界,4,片头跟片尾交相呼应堪称完美。克林特脸小老了眉眼全挤一块去了。除了节奏不太好和人物刻画不够深刻之外克林特作为导演还蛮不错。小菲利普长大后果然残了，跟《小情人》的小男孩一样可惜啊。
120,完美的世界,5,road film/journey/western/crime/Hollywood. 类型片典范，Thelma and Louise的“父子”版。剧本就是写给小男孩的童话。完美世界，每个角色都代表一种类型的人物。感叹一下，讲故事真是需要天赋的。好莱坞和非主流的区别，就是Hancock和Wim Wenders的区别。
121,完美的世界,4,正太版《这个杀手不太冷》“镖客”伊斯特伍德自导自演的作品。小男孩实在是太萌。影片一开始感觉完全令人感觉是犯罪逃亡类型片，其实总体基调好似《雨人》一般温馨，治愈。与其说小男孩有斯德哥尔摩综合征，不如说这是一个逃犯在逃亡过程中良知的唤醒以及每个男人心底里潜藏着的父性的发作。
122,完美的世界,5,"Only killed two people in my whole life. One hurt my mama, one hurt you."
123,完美的世界,4,这个小男孩儿真是可爱到爆了！！！西部的味道，有我最爱的两个男人。不太懂老爷子的镜头，但是，喜欢老爷子的故事，中间那些细节，都是老爷子的味道
124,完美的世界,4,也没觉得就值5星了啊……BD 720P 12/12/18 重温 16/01/06
125,完美的世界,4,这个世界永远都不会完美。东木选了Kevin做主角也就说明了他的意图，好与坏，对与错的分界线从来都不那么清晰。煽的刚刚好，没有超出我的承受力。
126,完美的世界,4,匪童配组合让人想起《菊次郎的夏天》，kevin和clint都是演而优则导的多面手，此次对手戏不多但也算惺惺相惜。剧情因为几个人物间的化学作用显得履有新意，是一部另类且值得一看的警匪公路片。
127,完美的世界,4,渐渐觉得乌托邦之类的完美世界，只会在疯人院实现。阶级，以及一切可以物化的差距存在，才是人类最基本的幸福来源
128,完美的世界,5,"完美~killed two people: one hurt my mother, one hurt u~电影海报也如此唯美，估计不管过多久，所有被这影片打动过的人一见到就能回忆起影片的部分剧情和自己当初的感动。我给你5个yes"
129,完美的世界,5,4.5~~当看到伊斯特伍德爷爷出来的时候，就感觉这部电影是他导的了。果然，越看越像。让我想到《老爷车》，但是却远比它更为让人触动，演员的表演也更加出色。虽然大的情节有些老套，但考虑到是93年的片子，可以理解。何况小细节非常精彩，让人就算知道结局也会把感情都投入进去。
130,完美的世界,4,五星好电影一枚，因为结局给了4星，看的时候我一直在想到底是个什么结局到底是个什么结局，其实自己也没想出一个满意的结局，如果有时光机，布奇会怎样过自己的人生呢，从出生就注定了悲剧，感同身受吧，也许他也没去过游乐园没做过云霄飞车没吃过棉花糖，谁知道呢？
131,完美的世界,5,其实现在想想很老套，甚至有点刻意煽情的嫌疑。不过当时一个人仰着脑袋大半个晚上看宿舍电视哭得特别特别伤心。
132,完美的世界,4,同类作品有很多，《第八日的蝉》也是这种故事，但这部是我看过最有共鸣的男性视角和情感关怀，伊斯特伍德的片子经常探讨的问题是一个人，无论男女，可以被称为男人，需要具备哪些特质，经历哪些事情。
133,完美的世界,5,影视艺术概论课上印象深刻的电影。。。人和人相处久了都会产生环境情感。。。
134,完美的世界,5,揪心又浪漫。因为看过老无所依，我认定他会是个十恶不赦的人，男孩是他一生中唯一的光和暖，心里一直害怕他变脸跟着纠结了一路，直到他说我一生只杀过两个人，一个伤害了我妈妈，一个伤害了你，真是泪如雨下……男主无疑会是个好父亲，怎奈……如果男主还活着，菲利普能经常去看他，就是真的完美世界了
135,完美的世界,5,"汽车往前那是将来，车后的风景是过去，停下车就是现在。
因为生活环境变成罪犯的他，跟一个小孩子的故事。哪儿会有完美，从小就没有父爱的他，心疼这个没有父亲的小孩子啊。"
136,完美的世界,5,1995年像r代的最--粉t色的棉花糖
137,完美的世界,4,好罪犯坏警察（FBI？对导演的角色来说是好敌人坏同事）。放松、有张力、幽默、悲天悯人。看过最难且可信的儿童戏之一。
138,完美的世界,5,整个旅程，就是心灵的疗愈之旅。把当下的事件和角色的前史完美呼应起来，通过他的现在，讲述他的过去。甚至连一个八岁小孩，枪击了一个通缉犯，都重现在了当下。
139,完美的世界,5,"又是令人内牛满面的一部电影, 真希望这个road trip可以持续到永远."
140,完美的世界,5,伊斯特伍德从此进入我心。很有深度的电影。初三时候看的，哭的稀里哗啦啊啊啊啊。。
141,完美的世界,5,铁汉柔情什么的最讨厌了，又击中了我的泪点~我这个emotional的的魂淡~~
142,完美的世界,4,后来的《这个杀手不太冷》剧情跟这个有重叠嘛，这个也有爱啊~
143,完美的世界,5,o是菲利是巴，重要的是你知道自己想要的是什麽；介乎于友情和H情的@份感情，最微妙，也最H切~p.S.小正太真演虬
144,完美的世界,4,butch看着buzz，满眼都是当年自己的影子，两个没有父爱关怀的人，有的是无能的母亲。开头和结尾的辉映，掩盖了鲜血。作为父亲的角色，给Philip诠释了责任，尊重，男人，付出等。与之对比的是黑人的无知无良的家庭教育。贫困真的是会遗传。那些年，那么多因为家庭原因被抑制的理想。公路片，赞2013#163
145,完美的世界,5,"不是好人，不是坏人，我只是一个普通人。需要爱，需要性，需要关怀。what a hell fine trip！帅大叔和萌正太，一路前行，一路治愈，一路遗忘，一路展望。
男人的欲望和童心，孩子，去完成你的梦想，live a happy life!"
146,完美的世界,5,之前箫箫说，如何界定好片子，就是在看的时候我不会去考虑镜头运动、打光、道具等一切问题，完全被剧情吸引。此片子彻彻底底就是这样的一部好作品，几度笑出声来，又有很多细节实在动人，孩子三次上前去牵Butch，两次被躲开，到最后两人踉跄着手牵手向警车。爱Butch
147,完美的世界,4,前面都很轻松幽默  后面嘛.............
148,完美的世界,4,小男孩演的不咋的，结尾煽情过了，而且俗套，但仍旧是个好片。
149,完美的世界,5,damn it！为什么美国的罪犯都像天使一样！但不得不承认sometimes，you should believe there is a perfect world. 
150,完美的世界,5,哭成了泪人，电影结束后依然止不住的泪流满面
151,完美的世界,5,他不是个好人，但也不是最坏的人，他喜欢儿童，悲惨童年的他深知儿童所需要的关爱和理解，他只杀过两个人，一个企图伤害母亲，一个企图伤害他的人质孩子，父亲寄得一个明信片让他梦想去阿拉斯加，但现实让他死于警察的枪下，正如这个世界并不存在完美。
152,完美的世界,5,是1984年《绑票情缘》的翻拍
153,完美的世界,5,2013.10.20.643 在高中买的一本周黎明的好莱坞启示录的后面一排海报，当时唯一不认识的就是这部。这么多年之后终于看完了。什么是完美的世界?看完了发现kevin costner真帅。紧凑的剧情，还有让人深思的命题。很完美的电影
154,完美的世界,5,一模一样的画面，开头的时候观众面无表情，谢幕的时候却已泪流满面
155,完美的世界,4,没有绝对坏的坏人，没有完全好的好人。没有完美的世界。又是一催泪片。
156,完美的世界,5,东木爷爷导的作品，依然简约而且不落俗套。
157,完美的世界,5,很温情的一部电影。不是父子，胜似父子，还有点《这个杀手不太冷》的味道，强烈推荐级。
158,完美的世界,5,看过很多类似大人和孩子之间情感的电影，但是还是没有一部可以让我这么震惊。这是我近期看的电影让我流泪最多的了。不完美的结局，完美的电影。
159,完美的世界,5,巨型催泪弹。我也想被人带去坐一回时光机，我也保证不会扣下扳机，虽然早已过了8岁的年纪。
160,完美的世界,5,我只杀过另个人，一个伤害过我妈妈，一个伤害过你……结尾各种教科书触泪点……老爷子真的是。。给跪了
161,完美的世界,5,这部电影，让我再一次体会到父爱的重要和伟大！让布奇不顾一切的去寻找，阿拉斯加因为父亲在那里，布奇对菲利的爱可以说就是一种父爱【虽然他们不是父子】。最后扣动扳机的那一刻，我的心都碎了。眼泪再也控制不住了！一直哭到电影落幕！
162,完美的世界,5,开始与结束，是一个轮回，如同长大后与儿时的体会一样，菲利普是幸福的，有这么个人照料，布奇也是幸福的，有这么个小孩跟着他；本想4星的，看了一个评论，确实是轮回的寓意；风景很漂亮，音乐也很好，美国的历史，没太看出来
163,完美的世界,5,在图书馆本想休息一下，结果花了两个小时把它看完了。想起小时候我心里那个“带头大哥”式的人物，唉。继续report
164,完美的世界,5,今天看了后半段，很久以前看了前半段，公路片
165,完美的世界,5,伊斯特伍德这老混蛋每次都让我哭成一个傻逼。。。
166,完美的世界,4,世界那么美，我们一起去看看。两个可爱男孩的冒险与履愿之旅。俗是真的俗套，但真情实感总是有效。恐吓黑人那段拍过了，最后的草坪结尾又拍的太拖沓。这种一大一小搭伴同行的公路题材很有感染力，对后续一些作品也颇具影响。
167,完美的世界,5,那个夜晚它让我有一次流泪  名字是有点大 “完美”？！？！
168,完美的世界,4,好莱坞老牌影星确有让人相信世界是完美的魅力
169,完美的世界,4,为什么汤姆・哈迪现在那么受欢迎？因为人们在他脸上重新见到了90年代的凯文・科斯特纳
170,完美的世界,5,"「I only killed two people in my whole life.One hurt my mama,one hurt you.」人性里没有绝对的善或恶，前一分钟你还觉得他是杀人成性的恶魔，下一秒他却为筑造一个孩子眼中完美世界付诸生命。"
171,完美的世界,5,太美了，看到最后才知道开头是什么情况  虽然我是坏人，但我很善良 主角死时就好像是躺在草地上午睡，这也是对好人的补偿吧  不过开头和结尾连起来怎么觉得主角又活了～-_-||
172,完美的世界,4,好人似乎也没有多么的好，坏人似乎都没有那么恶贯满盈，戏剧性的经历使布奇和菲利普走到一起，相同的成长经历使得二者在情感上形成了共鸣，布奇对于父爱的探索和认识全部倾注在菲利普身上，而菲利普也在与布奇短暂的生活期间寻找到了与严慈的母爱截然不同的快乐。是一部用情至深耐人寻味的好作品。
173,完美的世界,4,"4.5; In spite of its formulaic sentimentality, A Perfect World is a poignant and heartbreaking film filled with moral ambiguity, through which American penal system is examined, and an escaped convict's redemption achieved."
174,完美的世界,5,男主在死前见到了自己的父亲，这是不是个完美的结局... 或许那个完美的世界，只存在于人们的心里...
175,完美的世界,5,剧情出新，伊斯特伍德的特点哈哈
176,完美的世界,5,喜欢最后结局的方式，很有意思。很巧合的发现上映日期于自己生日竟只差一天。
177,完美的世界,5,菲利普，这会是你所经历过的最好的时光。世界好小，只有他们两个人大手牵小手；世界又好大，装满了布奇和菲利普的童年与梦想，还有永远带不走他们的时光机器。
178,完美的世界,4,一个完美的世界怎么会发生如此不完美的悲剧！当小菲利普乘着属于他的“火箭”和躺在草地上的海恩越来越远时我已然泪下。他们两人都去到了他们的完美的世界，只是一个在将来，一个永远在梦里。
179,完美的世界,5,一个越狱的逃犯逃跑过程中劫持了一个基本上没有童年的小男孩，在他们逃亡的过程中，布什给予小男孩菲利普尽可能多的乐趣，在最后要求其母亲答应小孩列出的以前想要做却被静止的很多本该在童年时作的事情，人性的闪耀，结局也很好，这个世界是不容许善意的“恶人”的存在的。
180,完美的世界,4,“如果你觉得这世界快乐，它就是天堂；如果你觉得这世界痛苦，那就是地狱”，这篇影评写得到位，转。http://movie.douban.com/review/1040979/
181,完美的世界,5,有点公路电影的意思，音乐很好，这样的旅途上，无论什么样的双人组合总会产生一些羁绊吧。另外片子做了很多隐射，这个虚妄的世界令人心碎。
182,完美的世界,4,缺少爱和认同感的孩子们... 豆瓣er看到你们的影评一年的鸡皮疙瘩都掉光了...
183,完美的世界,4,"大强盗教小强盗强和盗,无奈调教成了理智的好强盗.布奇带着童年的自己,想给予菲利普童年所缺失的,其实也是去尝试做一个成功的父亲,给予孩子一个完美的世界.但自己太过偏激,杀掉所有该死的父类家长to make the world perfect?一个家庭就该没有太多约束快快乐乐的,才不至于有那么多悲剧,都是缺爱的孩子"
184,完美的世界,4,童年缺失父爱的布奇，临时当了巴兹的父亲。。布奇和巴兹在一起就像一个大孩子。。
185,完美的世界,5,不完美的世界，堪称完美的电影！
186,完美的世界,4,千辛万苦逃狱一场，只做了一件不大不小的坏事，拯救了一个灵魂。
187,完美的世界,4,。。。。。。。。吭哧吭哧下了半天才发现原来看过。。。。怎么也想不起来何时何地看的了。。。。。。。
188,完美的世界,5,4.5星。看完内牛满面。父爱的缺失啊。。。心有戚戚焉
189,完美的世界,5,我想说我还想再看一百次。。。。。2013年6月再看，觉得是凯文最好的电影。这次没哭，陪看的人哭了。
190,完美的世界,4,片^的Butch安地太像午後睡著一樱身上泛著WW的汗水，但始KX得能活著才是真的好。ps：Philipm起碚J真的小真可邸
191,完美的世界,4,"这一切是谁的错？如何才能有个完美的家庭，完美的世界？
这片子有点反犹太，但犹太的宗教习惯，由于历史原因确实很古怪。"
192,完美的世界,5,最好的斯德哥尔摩综合症！男孩萌，大叔帅，再加上这么一个悲情的结局，哭死我了%>_<%
193,完美的世界,5,煽的优点厉害，不过还是很喜欢。那种悲伤与绝望的感情呵。女犯罪分析就是花瓶！关于父亲，太过于明显的解读意象。小孩子演的真好，非常美国主旋律，非美国人明显比美国人买账。越来越喜欢这老头子。我想他的性格就是和片子中演的那种人一样。可以分析下构图和机位。
194,完美的世界,5,太感人了。怎么就这么感人！人家的片子怎么能拍成这样！
195,完美的世界,5,这一路的逃亡，你有怎样的成长。这不是有血缘的父爱，却胜过人间所有父爱。现在，你知道什么是完美的世界了吗。
196,完美的世界,5,哭了。再见，菲利普。再见，布奇。我这辈子只杀过两个人，一个是伤害我妈妈的，一个是伤害你的。
197,完美的世界,4,哇啦啦地大哭，一时却无法用语言概括它的意义所在。好电影就是这样。
198,完美的世界,4,"只对里面的暴力和对话有印象,男主比较可怜"
199,完美的世界,4,东木的特色很明显，不动声色的煽情
200,完美的世界,3,死长烂长，看到后面差点要崩溃了，对黑人那一家什么莫名其妙！保镖无语，老牛仔不帅，只有小男孩一人可爱、动真情，老头子就靠这一根稻草就压倒评价？只能说萌物无敌。
201,完美的世界,3,结尾还是有点被煽到，喜欢冬木和科斯特纳终于同画的那个镜头。FBI的角色设置太刻意了。
202,完美的世界,3,7/10。问题出在警察追铺这线没有给逃亡造成足够的惊险感，局长和女监察员对逃犯童年创伤出于理解，但他们除了给糖果没能为两男主做什么，几乎是局外人。高潮应该是在黑人农家爆发的，父爱的渴望成为布奇纠缠复杂的情感力量，对主人打骂孩子的行为过于敏感而采取可怕暴力，是他内心善恶两面的集中刻画。
203,完美的世界,3,活脱脱一场闹剧好么  开挂车追逃犯神马的，样子做给谁看呀！！！-- 小鬼正太应该被倒吊起来！== 为了烘托主题，结尾生硬拉长，还俗气地英雄主义了一把……汗，替男主的死感到万分不值 ==p（话说凯文・科斯特纳让我想到华仔，俩人都是戏霸  才一个月我就有意无意地看了四部他参演的影片……）
204,完美的世界,3,罪犯就是罪犯，别为杀人开脱，纵使他有错，你也没权力行刑。这部片的感人点就在于这个导演塑造的另类“好人”得到了悲惨的结局，可实际上get不到这个人的“好”也就get不到这个影片的动人。我没被打动。
205,完美的世界,3,就知道局长肯定会给那FBI混小子一拳，如同我们知道的一切。完美的世界，对缺失的短暂补全，虽然最后还是缺失，但有了经历。缺位的父爱和失去的“父爱”，这成长中的这一幕，当真并非灰色。
206,完美的世界,3,恶境出孽子，自恋毁全篇。东木先生的《完美世界》布满老式的叙事语言和复古的影调造型，以及他那种老派的“牛仔”情怀与“西部公路”情调。在明暗双线叙事的夹缝中虽然拥有一个反传统的核心，但无奈讽刺的意图全线沦为附属品，除了自艾自怨看不出其他存在的效果和意义。渐行渐远的过誉之作。
207,完美的世界,3,这部就有点强硬鸡汤了。所以豆瓣评分这么高。
208,完美的世界,3,Only killed two people in my whole life. One hurt my mama...one hurt you. 没想象中的好，情节有点俗套，豆瓣给分虚高，结尾还是蛮感人的，little boy很可爱。。Eastwood的电影一直热衷于表现男人的“铁骨柔情”，这倒是很对我的口味。
209,完美的世界,3,完美世界的不完美
210,完美的世界,3,这么好的故事，就让他一路到底吧。怎么最后就变成这样了。。。老克，我无法接受。
211,完美的世界,3,后面节奏一下子就变得莫名其妙了
212,完美的世界,3,这分数真够高的，真没这么好。就是一个温情的关于人性善恶的故事，有趣的是其中加入了喜剧的元素，算是一个另类的公路片模式，父亲的缺席是这部电影中反复出现的主题，也是凯文和小男孩之间感情的立足点。
213,完美的世界,3,分了几天看完，这种老片子的好处是能吸引你看下去，哪怕事后你觉得有些情节并没什么意义。不过遗憾的是，我没有被打动……
214,完美的世界,3,原来伊斯特伍德爷爷这么早就开始关注――警察局秀场，丢失的小孩，伤心的妈妈・・・・这两部片子都体现他的风格
215,完美的世界,3,伊斯特伍德的电影总感觉不给力    喜欢凯文科斯特纳
216,完美的世界,3,偶然看到这个片子，似乎是小时候曾经看过的，模糊有些印象。花了2个小时终于看完了，却发现不过了了。剧情牵强，情感空洞，只有小演员的表演成为了煽情利器，确实加了不少分。PS：不得不感叹一下，我小时候是多么喜欢看文艺片啊，好多大名鼎鼎的片子翻出来才发现：小时候看过啊！
217,完美的世界,3,结局恶心到我了，太假太生硬太峰回路转太莫名其妙了吧
218,完美的世界,3,煽情过度，男孩天分有限爆发力较弱，唯有整体编剧加分。
219,完美的世界,3,还不错，拖沓了点。对野外公路耀眼的绿的感觉甚于俩人的忘年情。某女人甚是多余
220,完美的世界,3,都是戏骨子。泪点那么低的我居然没被戳中，一切意料之中。所以大概是我变了心肠了吧。
221,完美的世界,3,“这个杀手不太冷，大叔萝莉变成了猛男正太”
222,完美的世界,3,类似的题材看了一些过。。所以就没那么感触了。。不过在当时还是算不错的3.5
223,完美的世界,3,一次说走就走的绑架。剧情挺一般的。
224,完美的世界,3,"138分钟的陈词滥调,挣扎着看完了.头痛欲裂!"
225,完美的世界,3,故事其实很简单，想表达的东西也很直接，但感觉全片没有高潮，有点平淡。小家伙演的不错
226,完美的世界,3,"看的过程中暂停了N次,奇怪了,这么好的电影为虾米我看起来毫无感觉?"
227,完美的世界,3,这是小时候看过的。直到最后那个镜头我才想起来。过于煽情了吧。没啥大感觉。还希望他俩个永远在一起呢
