,movie,star,comment
0,完美的世界,5,我只杀过两个人，一个伤害了我妈妈，一个伤害了你
1,完美的世界,4,标准的好莱坞煽情之作，坏人的好总是比好人的好来得更感人~~
2,完美的世界,5,他看见他，他带走他，就像带走童年的自己。他终于相信这个世界有鬼了，眼前这个开枪打伤他的小鬼就是童年自己的鬼魅。“再见，这是完美之旅。”再见，布奇。
3,完美的世界,5,有史以来哭的最伤心的一部电影~
4,完美的世界,5,遥远的记忆啊……每次看的时候都想如果Kevin要我做人质，一定张开双手欢迎，然后收紧两臂学足无尾熊的样子抱住他的大腿死都不放。有他当爹，再有Eastwood当爷爷，就是一个perfect world了。肚腩长在有些人身上莫名地就成了一块萌肉
5,完美的世界,5,他杀过人，却未动手打过一下菲利普，这段通往地狱的旅行过程中，当他看到妈妈因为怕孩子把新车弄脏而打骂孩子；爷爷嫌孙子动作慢而对孙子抬手耳刮子时，眼底的愤怒与不屑、憎恨与仇视，皆因他拥有一个对任何人都拳脚相加的父亲。这段近似父子的不寻常感情在影片结尾得到升华，我亦哭得稀里哗啦！
6,完美的世界,5,老牛仔真是个伟大的导演，总能把人性拍得如此美好而有力量。
7,完美的世界,5,将公路片、伦理片、警匪片等诸多片种熔于一炉，适应了当代美国电影的新趋向―――类型交汇。于是，有了修正型公路片一说。
8,完美的世界,5,史上最泪奔斯德哥尔摩综合征。我这辈子只杀过两个人，一个伤害了我妈妈一个伤害了你。情感创伤带来贴心信任，一对陌生人手拉手踏上没有希望看不到终点的迷途，Butch对Buzz的每一个小动作，摸摸头，拍拍屁股，看一眼心就化了~满满的父爱，已哭瞎。20171111小西天二刷依然哭到抽……
9,完美的世界,4,斯德哥尔摩综合症-Phillip 'Buzz' Perry 
10,完美的世界,5,哭了 小孩可爱，大叔也很会煽情，烂漫的骨子里还有一颗梦想的心
11,完美的世界,5,灵魂在天上 看着绿草如茵的地方……
12,完美的世界,5,"我童年时期最刻骨铭心的电影,今天终于找到了"
13,完美的世界,4,喜欢凯文.科思特勒
14,完美的世界,4,我这辈子只杀过两个人，一个是伤害我妈妈的人，一个是伤害你的人。这个“你”却是仅仅相识一天的男孩。。同样缺失父爱的两人以这种方式依赖对方。特别安静特别可爱的男孩，以后也要给我孩子穿这样的连体衣！太萌了！
15,完美的世界,4,“有一群孩子在一大块麦田里玩，几千几万的小孩子，附近没有一个大人，我是说，除了我，我就在那混帐的悬崖边，要是有哪个孩子往悬崖边来，我就把他捉住。我整天就干这样的事，我只想做个麦田里的守望者.”最后他死在了麦田里。
16,完美的世界,4,标准的有点像是教科书里的故事
17,完美的世界,4,一句话点评：这是成长道路上最美丽的逃亡，世上最有爱的逃犯和最单纯可爱的小孩演绎了一场美丽的邂逅！整部电影关乎边缘人物的内心世界，这就是完美的世界！
18,完美的世界,5,50 这可能是最俗但却最感人的一部电影。当母亲以爱的名义控制自由，当罪犯以绑架的名义对其解放，童年阴影的侵蚀令布奇内心阴暗的同时又有着不可触碰的柔软地方。最后一个镜头，布奇抱头躺在草地上，旁边是那个小精灵的面具，一脸安逸的他就像野营的下午睡在那里一样。
19,完美的世界,5,"永远不要有结束
"
20,完美的世界,5,潸然泪下~
21,完美的世界,4,好看……要哭了。Kevin Costner演坏人也这么好。。。不明白为什么要有警察一帮人打酱油，明明是公路片。
22,完美的世界,4,16.2.13 老牛仔作品中诉求最本真、浅显的一部，恶事多为却动机皆善，他为了一个象征自己所缺失的爱的目的地出逃，却意料之外而情理之中地填补了一个孩子缺失的，最终以另一种方式，到达了他想到达的地方。这个世界之所以不完美，或许并不是因为有坏人在，而是因为总有一些自以为好的人。
23,完美的世界,4,世界不是完美的，布奇也不是完美的，但不完美才正是完美。
24,完美的世界,5,感人，我的帅男啊
25,完美的世界,5,万花筒式的导演技能，家庭剧转越狱片转公路片转警匪片，最后结束在一片无名的草地上。每场戏都能看见导演的姿态，批评什么，怀疑什么，相信什么。Laura Dern那声尖叫和极度恐惧的神情，是面对真正暴力时的反应。狙击枪击中躯干中心，只有弹孔，没有鲜血，不容辩驳。九十年代的Clint Eastwood太辉煌了。不可饶恕，完美的世界，廊桥遗梦。Stéphane Delorme所说的作者的Gesture在他的电影里看得一清二楚。或许他的Gesture可以被总结为一个他做过千百次的动作――准备拔枪。往前一步是暴力深渊，往后一步是束手就擒。Gran Torino里他以这个Gesture死去，所有作品浓缩在此刻。
26,完美的世界,4,一边感动一边恨这部算计观众泪腺的电影
27,完美的世界,5,"完美的世界，完美的电影，不完美的现实。东木的节奏掌控力一流,擅长把反类型化的好故事在冷静节制的风格中娓娓道来，后劲十足。本片把强盗片,公路片和西部片类型融合并解构，情感真挚，在成长教育和善恶转化方面引人深思。| 这是20世纪的时光机，车前是未来，车后是过去，这里便是现在。（9.0/10）"
28,完美的世界,4,本片之前，凯文和东木刚刚分别获得奥斯卡最佳导演奖，而且所导的影片都是西部片，所以这样的组合可想而知在当时多么轰动。影片成熟得让人舒服，不动声色的张力和节奏。首尾呼应，凯文好像只是在野餐时睡着了，表情让人心酸：他原本就没打算逃走吧，根本就是瞎作一通，就跟小孩子明知道逃学会挨打但既然逃了就狠玩一通一样。他心底也明白那个爸爸不会等自己，自己也到不了那里。一本正经地给孩子讲那些狗屁不通的大道理，把这个角色塑造得更为完整立体且可爱。警察方面经常有些跟主线剧情也没太大关系的小梗，玩得很出彩，把官僚嘴脸表现得既没有太过夸张以至于立场居高临下，又讽刺辛辣。泪点戳得很好：我们见过吗？朋友。一结合前情就很好地把感情煽了起来。小时候看觉得不以为然的套路，现在发现都是很好的设计。20120207说：非常好呀。没什么
29,完美的世界,5,“我们说清楚，偷东西是不好的，……但是如果你特别想要一样东西，但又没钱买的话，你可以悄悄拿一个，这就是例外。”
30,完美的世界,5,【B+】估计自己一辈子都能被这种主流煽情电影感动，是很好的片子，但是其实可以更好，双线叙事很鸡肋，很多地方都“差那么点儿”，和东木后来的电影比有些欠火候。但感情真挚就够了，我前边装逼挑了这么多刺，结果还不是哭的一塌糊涂。小正太真心萌cry
31,完美的世界,4,3.5 骚年版《杀手里昂》，科斯特纳实在是帅，可惜太煽、匠气。
32,完美的世界,5,"我对这种大孩子小孩子的友谊完全没抵抗力...小孩子的感情太纯粹.坏人依然是坏人,无论什么改变不了成人的印象.片名很不错.又印证了我的死主角理论.Clint那条线完全多余的..."
33,完美的世界,4,对白、处境、张力、节奏掌控，只是最后各个人物的处理落了俗套。没有完美的世界，也没有完美的电影，但还是想说，拍好电影的人上天堂。
34,完美的世界,4,没有万圣节，没有圣诞节，没有吃过棉花糖。曾经自己失去的，就一定要倾尽所有给予对方更多，他的童年阴影却照亮了他的世界。你知道吗，你是我的一天英雄。
35,完美的世界,4,结尾拖沓狗血，当然也没什么思想性。但两个男孩的世界还蛮动人的。
36,完美的世界,5,看到最后主角将要死了，男孩却跑回他身边，最后还是死了，虐得我哭成了狗。电影的结局让我悲伤，但流眼泪这件事却让我为自己而高兴。当你还能为一本书或一部电影哭成狗的时候，你是一个多么坚不可摧的人啊
37,完美的世界,4,父爱的缺失，善良的本性，让这对大叔逃犯和萌娃人质的奇妙组合，产生了一段不是父子却胜似父子的情愫，公路上情感关系的递进很有说服力。在从来就不完美的世界里，小男孩收获的是一段近乎完美的旅程，有父爱、欢乐、信任、成长的阵痛及对未来的憧憬。双线叙事确实拖慢了节奏，东木和劳拉邓作用比较有限，更多是丰富男主人公的人物形象，这个遍体鳞伤的大男孩，依然能对这个世界心存善意
38,完美的世界,4,我这辈子只杀过两个人，一个伤害我妈妈，一个是伤害你。哭死人的公路片，仅仅认识了一天的大叔和小娃用缺失的父爱互相依赖这对方，牛仔爷爷的故事太煽情！kevin costner一出场就被帅瞎眼了，还混入了奇怪的萌肚腩。大坏人温情的一面总让人融化得好快。perfect除了东木的警察还有硬生女主的莫名其妙。
39,完美的世界,5,他们两个人的对话 很有意思
40,完美的世界,4,完美世界的入口，是布奇开往菲利普童年的那部时光机。两个陌生人在逃亡中驯养了彼此，是劫匪和人质，像父亲与儿子。菲利普实现布奇自我救赎的英雄梦，布奇用生命成全菲利普的童年成长，彼此完整了各自缺失的父子情。不论结局如何，在时光机锚定的那个当下，他们已经去过了完美世界。
41,完美的世界,5,布奇没得到过的，他让菲利普全得到了
42,完美的世界,5,"他塞给男孩的钱被直升飞机的气流一吹，从男孩撕破了的小精灵戏服里漏出来，散落在天空，飘到了草地，也轻轻划过他的脸。他使劲望，却已经望断了天涯的路。比《百万宝贝》完美一百倍的老电影。

"
43,完美的世界,4,4.5，多加半星给摄影。前半部分是非常精彩的警匪戏，后半部分变得很感性。男主角身上既有温情的一面、甚至带有一定的理想主义，也有人格不健全的一面，电影用这个罪犯的善良与其他人的冷漠为我们揭示出一个道理：完美的世界永远都不可能存在，面对罪恶我们与其试图禁止，不如选择善意与包容。
44,完美的世界,4,在这一场旅途中，Butch在Buzz身上看到了儿时相似的境遇，生长过程中父爱的缺失，早早丧失的童趣，Butch用自己的方式来弥补小男孩，助他成长，也算作给自己的一种慰藉。Butch绝对称不上好人，可他的坏也让人恨不起来。永远到不了的阿拉斯加，离世时释然的神情，Kevin Costner完美的演出。
45,完美的世界,4,坏人的好远比好人的好更打动人心。
46,完美的世界,5,"哥把肖申克放第一，legend和truman并列第二,Perfect World就在第三了。
唯一有点小小不喜欢的是，那个小游戏。结局非常棒――真正的现实主义！
比凯文演的与狼共舞、那个查走私酒的……不知要好百倍！小孩演得很棒！…………多年后又重温了一遍，还是感动到。重温于2012.3.18，再次重温于2018.1.21"
47,完美的世界,4,美好又悲伤的公路片，让人想到末路狂花。但是东木这次执导的发挥，尤其是让人多次出戏的剪辑，跟雷公比还是差了很多。最后煽情有点刻意，但还是让人泪崩。硬伤不少，依然动人。
48,完美的世界,4,小男孩后来的人生，那张带血心愿清单里的诸项就算能逐一实现，不断重复实现，也消除不了这一日持读强刺激造成的后遗症，尤其是枪击布奇的痛悔和惊恐。他极有可能被捧为英雄。而英雄荣耀的光华与内心深处阴影的对抗，不知这小男孩如何扛得动。影片最直接抨击的其实就两点：对孩子的暴力和行为中的鲁莽。
49,完美的世界,4,有人说这个是黑色幽默，自己不是很懂黑色幽默，只是，喜欢那个孩子，喜欢他们在一起的气氛，很和谐......ps怎么帮助他们的人后来都被吓到了，又抢车子，又打碎玻璃，哈哈
50,完美的世界,4,一眼望去，就知道这应该不是一部能够经典传世的电影，但可以是一部好看的电影。影片对成长、信仰、自由的阐述，都饱含着深深的人文关怀。尽管凯文・科斯特纳和克林特・伊斯特伍德都是老一副表情匮乏的脸，但他们还是成功地诠释了人物，这两个人的存在使得电影仿佛被聚光灯照耀着。
51,完美的世界,5,被一个有趣的怪蜀黍劫持了并非一件倒霉事。大叔三十好几了，心理仍然和小孩一致。见到有父母殴打子女，他就会惩罚那对父母。有一个人代替你的意志教训了你的父母，不知道小孩子看了心理会不会很开心。最后，大叔仍然被警察打死了，因为他正要交给小孩一个写满了心愿的小纸条。成人世界总是这么残酷。
52,完美的世界,4,独立双线，气脉不畅……没看过具体描述。不过个人以为东木移动警所这条线的确存在机构臃肿风格失调等问题。但败相之中不乏趣点：片中诸角，人人动枪。唯独史上最愿动枪的肮脏哈利手里总端着咖啡杯和大声公！这是个重要的讯息点（虽不足以提升品质）――冷战结束，刀枪未必入库。但超级义警，务必收手。……https://www.douban.com/people/hitchitsch/status/1981253274/
53,完美的世界,4,一部典型的新好莱坞式电影，赋予反面人物话语权和人性善面的描绘，把镜头聚焦在弱势群体中，原本正义的警察多少被增加了负面色彩，教科书般，同类电影太多且形成套路，没有太多感触。
54,完美的世界,5,大爱！！！克林特的电影总有一股强大的情感力量，又总能把我感动得热泪盈眶；凯文科斯特纳太帅了，演劫匪都这么男人，如此正派；父亲对孩子的影响是巨大的，可以是善的，也可是是恶的，但永远没有绝对的善恶之分；完美的世界，完美的故事！
55,完美的世界,4,相信很多电影都会在这片中找到很多灵感。一个逃犯给一个孩子过了一个真正的节日，结局是他帮孩子完成了很多凭他自己也许很多很多年都不可能实现的愿望，却天意弄人被小孩跟狙击手打死。原本追他的警察们最后给他致敬我想也没白来世上一趟。这故事很不错，我想美国警察要更加拽因为他们的逃犯可是带枪的
56,完美的世界,5,迄今为止我只杀过两个人，一个伤害了我母亲，一个伤害了你。看似定位成犯罪片，但全篇基调却偏风趣幽默，一个奔着亡命天涯去的逃犯机缘巧合下却和一个男孩玩起了“时空旅行”，几乎没有让他感受到犯罪的可怕，相反赢得了信任和支持，确实构造出了另类的完美世界。20171111@小西天
57,完美的世界,4,前半段闷得以致于怀疑影片分数是不是虚高，后面终于有所感悟。整个案件也许并非重点，它只是一个观测点，让你见证世人的虚无缥缈，从而使观者在悲伤叹息之后能够内省。Eastwood永远给人一副老当益壮的沧桑感。
58,完美的世界,4,也许世界本身并不完美，但人性却总能使它越来越接近完美。或许影片简单的故事难免可能使人过早地猜到了结局，但寓于贯穿全片的各种矛盾中的对人性的探讨，却仍能直逼心灵，具有相当大的震撼力。第一次见识到伊斯特伍德导演的作品，实属难得的好片。
59,完美的世界,5,监狱逃犯和一个八岁小孩之间亡命天涯的故事，在逃跑的旅途中，他们是完全信任彼此的，这种信任更像一对父子，因此逃犯内心其实并不坏，他向往美丽的地方，向往一个完美的世界，片尾处令人唏嘘，这个世界没有绝对的善与恶。这是克林克伊斯特伍德的经典力作，值得推荐。
60,完美的世界,4,老警长当初把布奇的父亲判了4年他以为这样对孩子好 可是他没有想到 虽然孩子有一个王八蛋父亲 可是在他的内心深处仍然有一颗渴望被父亲爱的心 
61,完美的世界,4,真的是相当可爱的电影    没有刻意煽情   却无比感人
62,完美的世界,5,一个生命映照了另一个生命，这个结构太高超了，且故事设定、人物设定服务于自己要的主题，这是创作上最完美的所得。父子之间比母女之间的问题要难以解说的更多，一个逃犯用自己失败的人生经验教育一个缺失父爱的孩子如何成为一个男人，勇气、爱情、性欲、责任，是我想要写的那种故事。
63,完美的世界,4,不要让自己受过的伤害在孩子身上重演。男孩与罪犯之间的情感羁绊，典型的斯德哥尔摩症候群。硬汉柔情，坏人心底的善意，很难不被这样的戏码打动，但总觉得少些铺陈。冲突双方的力量严重不对等，州警在追捕前期简直是废柴，减损了真实性。但结尾着实出人意料。觉得布奇心心念念的明信片其实是局长寄的。
64,完美的世界,5,"I need you  布奇。看的我难过的快要死掉。我只杀过两个人：one hurt mum ,one hurt you . "
65,完美的世界,5,为什么看凯文总有一种是费因斯主演的错觉？！好坏人和小正太的“父子情”。刚发现，为什么分类类型里有惊悚！？？！？！？！？！？？！？！？！？！
66,完美的世界,5,其实我这辈子只杀过两个人，一个伤害了我妈妈，另外一个伤害了你；其实非要中弹的话，我很高兴是你开的枪而不是其他人。虽说电影里有很多酱油和脑残，但毕竟感动过我，有一点眼泪产生的感觉，
67,完美的世界,4,伊斯特伍德的东西总是很沉重。也许被菲利普打死是瑞德最好的归宿。当结尾老警官被问到你已经尽力了，不是吗？的时候，他唯一能说出的就是，我什么都不知道。的确，他什么都不知道，他不敢知道。
68,完美的世界,4,有点拖沓，但到最后还是哭得一塌糊涂。。凯文很帅哎。。小男孩也很萌，演得竟然很好，天生当演员的料？
69,完美的世界,5,这个电影太棒了！很久没有遇到那么好的片子！我的豆友八面碰壁居士一定得要看看！
70,完美的世界,4,clint eastwood确实有一手，前面很平淡，高潮在最后。科斯特纳饰演的劫匪被小主角打中，被包围却要帮助这个被严格管束的小孩实现孩子心中完美世界的愿望。他本人演了追捕科斯特纳的警长，最后还要狠狠给擅自开枪的FBI一拳，老牛仔也太帅了。
71,完美的世界,4,有关父爱的吧，总之是。Costner很少演坏人，不过这里他并不很坏。结尾很感人，也很憋屈。字幕打出来，看到导演是老Eastwood，难怪憋屈了！
72,完美的世界,5,这个逃犯不太坏  这个名字更准确   带着一个孩子成就一段传奇  这就是天使啊  逃亡途中还不忘勾搭一个女招待 吻人家的屁股 说真的 有点小感动
73,完美的世界,4,世界最帅联邦探员，最诺谋ｏ冢单枪匹马的救世主，最懂女人风情的万人迷，拯救印第安人的战士，这次果不其然又成了最帅的越狱犯，保护小孩，拯救苍生无善不做。大男人科斯特纳，只要他愿意，全美的女人都是他的
74,完美的世界,4,这种糙大叔+萌正太组合的公路片完全就没办法抗拒嘛。始于亲情，终于亲情。“我这辈子只杀过两个人，一个是伤害了我妈妈的人，一个是伤害了你的人”。完美世界里的不完美，布奇许给了菲利浦一个终身难忘的旅程。
75,完美的世界,4,结尾部分处理得很好，也许是老片子的缘故，中间后半段觉得不算很好
76,完美的世界,5,这世界没有什么是完美的，完美本身就不完美，不完美中的完美尤其值得珍惜。亮闪闪的是父爱，不，更多的是对待菲利普像自己朋友或者兄弟一样的尊重和坦诚。。。。铁骨铮铮的男人柔情寸断的一面让人潸然泪下
77,完美的世界,4,“斯德哥尔摩综合症”。哭了。这个逃狱者出来的使命就是来引导这个孩子并不放肆的童年么，让它轻狂丰富完美起来？ 他们又好像是一个是二三十年后的自己，一个是年少的自己一样。 童年的经历无疑会影响一个人的一生，于是，在整个片子中，我都隐隐考虑这个孩子的未来会受多大影响，又会变成怎样的人呢
78,完美的世界,5,小时候居然看过，每个孩子都有一个这样的梦想吧，遇到一个很酷的爸爸。
79,完美的世界,5,他其实也是一个心理上没长大的孩子，从另一个孩子身上发现了人性的真善美，以黑色的方式掉落命运的深渊，得不到任何人的救赎。
80,完美的世界,5,"In a perfect world, things like this wouldn't happen."
81,完美的世界,5,公路版的这个杀手不太冷，男孩与绑匪的感情令人感动，故事成功在于绑匪布奇是一个善良的人，也是一个好父亲 ★★★★☆
82,完美的世界,4,不行了，大半夜的看这片子哭死我了。四颗星，都给男主的大手拉着小男孩的小手那个情节。大手拉小手，好想这样一起走一辈子，in a perfect world。这世界有的时候逼得人没法好好活，不疯魔不成活。这片子让我想起了太多，太多。大手拉小手。我已泪流满面。。。。
83,完美的世界,4,前一半节奏可以更好。虽然结尾有点刻意煽情但是还说得过去。大叔和男孩分别是他们人生中缺少的那一块，时不时地碰撞出来的火花真的很动人。
84,完美的世界,4,人所仅有的一点点良知被这个丑陋的社会所掩盖
85,完美的世界,4,其实是部相当经典的好电影~~只是感觉里面的桥段被之后的电影用烂了~~于是又好死不死全猜中了结局~~所以你妹的感动大打折扣呀！！！四星半~~
86,完美的世界,4,后半段明显不如前半段，不过有凯文康斯特纳就很想继续看下去。伍德老警长那边实在有点闷。。。也许是我期待过高了
87,完美的世界,5,好人与坏人有什么分别？法律所规定的难道就是永恒不变的真理？侬本多情。
88,完美的世界,4,算是Clint Eastwood在我这里的第一部电影，没啥感觉。Kevin Costner依旧打人性牌，这部电影中比较真实。我觉得影片名字之前是不是要加个Not
89,完美的世界,4,哭死我了！哭死我了！SBFBI SBFBI 总是在不适合的时候出现 总是在不适合的时候开枪 在凯文中枪的那一刻我哭得死去活来！ 东木大叔利用自己的权利给自己加戏令人发指 我原本以为东木大叔最有男人味了 但是在凯文面前黯然失色！！！我爱凯文科斯特纳！！！ 我爱布奇！！！
90,完美的世界,4,"型片。完美的世界不存在，但完美的影是有的^_^有小朋友f：""加入温情的公路片是我看过的最棒的公路片。""我X得不e。btw：r六七q的T.J.Lowther也太可哿恕２贿^F在好像也不再拍影了。是吧，有z憾。"
91,完美的世界,4,"]想到克林伊斯威特，@N早就展露а莸牟徘椤
@部有c斯德哥摩症侯群的感X，但а菸创蛩阌昧{@一c，反而在男主角在其刃纳钐的童趣及如何c小孩相上多有著墨。"
92,完美的世界,5,每个人都需要一个快乐的童年。影片的最后，菲利普缓缓地朝母亲走去，突然又转身回到布什身边，他真想和布什在一起，这一幕让人感动的落泪。
93,完美的世界,4,"【8.0】
1.串一下历史。不知道本片在多大程度上影响了第二年《肖申克的救赎》的奥斯卡之路，但包含元素的确平行且相似。劳拉邓恩这个角色其实发挥得很膈应，同年还出演了《侏罗纪公园》，再加《信笺故事》对比一下，又是一个性格化演员，演啥都是她本人。
2.老东木的一些恶趣味，40分钟没让小男孩穿上裤子、凯文・科斯特纳这种性冷淡的演员都能安排上情色戏份、拍劳拉邓恩竟然先拍屁股……太有意思了。
3.深刻寓意的俗浅表达。其实影片前半部分对于男主复杂的身份背景和小男孩与母亲的抵触关系作了很多铺垫，烘托到够扇传统家庭观念好几个耳光了，结果高潮竟然如此疲软，都知道那个墨镜傻子会开枪，也知道他开枪是因为误以为男主掏枪，但看到这一切真的按部就班发生的时候，竟然如此苍白无力。
4.临走再踩一下《肖申克》，嗯，就这样。"
94,完美的世界,4,typical American moving story
95,完美的世界,5,十几年后重看，这依然是我心目中Kevin Costner最好的一部，没有之一！！
96,完美的世界,4,生了孩子以后，不要打骂，免得让孩子留下心里阴影，将来报复社会。
97,完美的世界,4,伊斯特伍德特别喜欢搞一点带人性意味儿的东西出来，我觉得吧，坏人的好总是胜过好人的坏，所以两个多小时，看起来倒也不腻歪
