,movie,star,comment
0,血战钢锯岭,4,以我有限的观影经验，优秀的战争片不会美化战场，不会粉饰死亡，不会矮化敌人，不会无视常识，最重要的，不会宣扬战争。这个片子基本都做到了。
1,血战钢锯岭,5,正常国家的战争片告诉你，战争是一件肮脏残酷血腥恐怖的事情。你要有中奖般的运气才能活下来。军国主义国家战争片告诉你，战争很好玩，敌人很愚蠢，每天除了开枪打靶一样打敌人之外，就可以游手好闲，不用上班不用种田，关键还有各种风格的漂亮妹子陪伴
2,血战钢锯岭,5,截我影评里的一段话。有个印象很深的片段，首战第一晚他与战友两人坐在战壕里，战友开了一个罐头问他怎么不吃。满脸黑漆漆战灰的道斯笑着摆了摆手说：我不吃肉。我突然觉得多么可敬的人啊，他的信仰无法改变战争，而战争却拿他看似最普通的信仰也无可奈何。
3,血战钢锯岭,5,队伍配置中奶妈的重要性
4,血战钢锯岭,4,特别老派的热血直男片，甚至觉得叙事目的性强烈到有些直白。然而，就是好看。前半部分就是压制观众情绪，后面的战争就是帮主角和观者释放，去证明主角。战争场面太硬了，血腥可怕，看到紧张，如炼狱一般。我认同他的那些信仰？胡开尔啊！真正让人激动的，还是见证普通人创造的奇迹，因为这是真的。
5,血战钢锯岭,4,没有真人真事加持，你真会觉得，梅尔・吉布森是一枚假天主之名的神棍。当真实不可思议到某一个程度，你就会觉得，它怎么可以比电影还假啊。但这么老派的关乎个人信仰的电影，傻纯真的故事，看起来还是令人动容。电影是《全金属外壳》的两段式结构，大段的平静和抗争后，突然进入手撕鬼子的地狱模式。
6,血战钢锯岭,4,看完觉得吹牛啊，结果片尾出现正主时震惊了，再一查历史，真实道哥居然比电影里还开挂，真死人堆里爬出来的。当下好莱坞难得一见的右派电影，梅尔吉布森甩掉了神神叨叨，拿出宗教信仰和残酷战场，战争场景真实血腥，令人发指的牛逼 #这战争场景要是3D高清估计得看吐了#
7,血战钢锯岭,4,救人75命，胜造525级浮屠。
8,血战钢锯岭,5,枪林弹雨过，片叶不沾身。信仰没能改变战争，但也没让战争改变自己。梅尔・吉布森的宗教狂热病和个人英雄主义都让我想BB，但因为有本命在闭着眼睛也要给五星啊～（只有加菲才能这么一脸阳光的面对杀戮和暴力，五好青年的笑容太美！！！）
9,血战钢锯岭,5,“每个人的信仰都值得尊重，这就是最真实的我们” 我操，好久没看到如此热血经典范儿的电影了！复古老派，却看得老泪纵横。继上一部导演作品《启示》后，阔别十年的梅尔・吉布森依然出手不凡！恍惚在看2016的《地心引力》《勇敢的心》《拯救大兵瑞恩》《辛德勒的名单》…（短评也得老干部一点
10,血战钢锯岭,5,李安想告诉我们英雄是会软弱会迷茫的平凡人，梅尔吉布森告诉我们英雄都是神一样的人。但是这部片的好处是，同样是展现人的神化，它可比手撕鬼子的剧真实多了。大概是因为真正的神从来不觉得自己所做的一切常人难以企及，他只是谦卑地认为自己做的还不够。克制是最大的美德。
11,血战钢锯岭,4,这部片子最牛逼的，把钢锯岭拍成了寂静岭，把鬼子拍成了鬼。第一次被一部战争片的恐怖场面吓到，感同身受于士兵的恐惧。
12,血战钢锯岭,4,其实这片子挺牛逼的，后面一个小时里黄继光，董存瑞，王成，李云龙，白求恩相继出场.....
13,血战钢锯岭,4,3.5 前半小时和爱情戏俗得发指，从入伍开始才走上正轨，上战场就很好看了，虽然时不时出现的槽点还是会让人出戏，但最后成功被煽到。Bromance基友的存在感和感人程度抵十个女主告诉我不是一个人。对加菲的印象也大有改观。
14,血战钢锯岭,5,观众纷纷表示：前一个小时简直昏昏欲睡。你看，不管是屏幕内外，大家关心的、想看的都只是流血、战争与死亡，没有人关心你的选择和信仰
15,血战钢锯岭,5,打仗真不需要120帧
16,血战钢锯岭,5,无需多做评价，最好的评价就是开篇的字幕――a true story
17,血战钢锯岭,4,这部电影工整的格局，宏大的场面和充沛的感情都足以让人重拾久违的心潮澎湃，尤其是战争题材才能带来的那种感动。宝刀不老的梅尔.吉普森用这份“老派”的扎实再次诠释了“勇敢的心”：真正的勇敢并非骁勇善战，而是无论何时何地都不忘初心，坚守信仰，并秉持自己始终不会放弃的那份纯粹。
18,血战钢锯岭,4,8.1/点映，看起来在讲信仰，事实上确实是在讲信仰，很普世的主题，他在讲美国人需要信仰的时候也在讲日本人的信仰，战争场面很真实也很残酷！不知道用120帧/4K拍出来会不会有人跑出电影院，战争是一场噩梦，旁边的朋友被吓到哭又感动到哭！结尾真人眼神里的坚定和从容已经说明一切了！
19,血战钢锯岭,5,后半段足足1小时的战争场面，哇~热血沸腾！就算全世界都不理解你、抗拒你，依然秉持住自己的信仰绝不动摇。这种信念说的是男主角本身，也在讲梅尔・吉布森自己。
20,血战钢锯岭,4,青少年时期及父辈们的经历，永远是艺术家创作的源泉。看外国老一辈导演们的“老派”作品，当然有着强烈的共鸣与认同感，同时也为自己一代人由于时代的限制，在创作上的无语和失职而感伤。
21,血战钢锯岭,5,谁告诉我加菲猫的哥哥最后去哪了？
22,血战钢锯岭,4,疟了，Mel导，从打响第一枪开始全程WTF！据说内地版删减了30秒，真不容易。
23,血战钢锯岭,4,蜘蛛侠不吐丝改用绳子了
24,血战钢锯岭,4,当他终于从上面下来，双眼血丝与泪水模糊相融，胆颤地提防着周围的战友的时候，真是太让人心疼了。一个人在战场上硝烟与尸横遍野里寻找一个又一个生存的希望。Andrew的表演可圈可点，能有大导演提携希望能成大器。
25,血战钢锯岭,4,"""The real heroes were all over there."" 煽情也好，做作也罢，一个人若是知道自己想成为什么样的人时，天下无敌，这就是信仰。"
26,血战钢锯岭,4,我就想知道，被阉割的那一分钟是不是Hollywood正面全裸地做引体向上？[狡猾]
27,血战钢锯岭,5,非常好看。我是一个没有什么信仰的人，但是在多斯身上的事确实是一个奇迹。他的坚韧、阳光、善良铸就了这个奇迹。我知道是战争片，但是我莫名的也非常喜欢爱情线，法庭外两个人拥抱的一幕看哭了。最后，一个珍贵的教训――打团先打ADC没用，还是得先打奶妈。
28,血战钢锯岭,5,看的过程中唯一想法就希望这辈子都不要经历战争
29,血战钢锯岭,4,我是反对给战争动作题材打上“直男”标签的，就像反对给女性为主的电影打上“女权”标签。我周围的女性欣赏这部电影完全不少于男性，性别标签太狭隘了。更有趣的是，这个右派的电影里，男主以反暴力成就了伟大，恰恰打破了男子气=暴力的性别偏见。
30,血战钢锯岭,5,这个片子让我想到了一个国家的信仰根基。美国的宪法精神和基督教精神，始终是他们迷茫时可以回溯求解的坚实根基，支撑他们穿过黑夜。然而，有多少人还记得我们的根基，以工人阶级为领导的，工农联盟为基础的，人民民主专政的社会主义国家，当我们站在此刻，回溯这个根基时，我们会看到什么？
31,血战钢锯岭,5,完美的战争电影。你把信仰坚定到极致，周围人便会把你当做信仰。开始的时候我甚至愚蠢地质疑过他不拿枪上战场的动机，对Holy Bible条件反射般抵触，以及对“走后门”入伍翻个白眼。直到上战场后，我为自己的狭隘无比羞愧。精神的极致追求成就开挂的肉体，坚定的人生原则创造存在的意义。
32,血战钢锯岭,4,Old school二战片，战争场面够狠够长够猛，算近年难得的体验。Mel Gibson用了全白阵容，没黑没墨，估计在好莱坞被喷死，也真死硬……
33,血战钢锯岭,5,剧情紧张，场面震撼，根据真实事件改编，值得一看。
34,血战钢锯岭,4,信仰的坚持，个人英雄主义。今才发现我竟一部Mel Gibson的片子都没看过，还蛮喜欢这种不拖泥带水的导演风格，每场戏的设置都有目的，目的达到就进行下一场。加菲真人真的可爱到爆棚呀。
35,血战钢锯岭,4,低产的MG宝刀未老，大银幕战争场面震撼揪心，尽管手法略显老派，还是很难不被煽到。英雄主义，个人价值，恪守信仰，美国白人主旋律。加菲挺符合人设，奶气得不像军人，但又穿衣显瘦脱衣露肉，雨果维文演的父亲感人。前半段细水长流亲情友情，后半段专注战争，前后有些脱节，但可能反差大才更震撼吧
36,血战钢锯岭,5,每一场戏都如定海神针，重重的敲在心上。看梅尔吉布森的戏，如同目睹一个衣衫褴褛心若澄明之人，三步一叩首，缓慢而坚定地迈向圣殿。
37,血战钢锯岭,4,一种七八十年代热血战争片的通透和敞亮，通过以宗教为名拒绝摸枪的士兵，建立出固执己见的人物性格。接下来钢锯岭的恶劣环境，关照到战争的细节与情绪。我们才能逐渐理解主角的原则和救人，既反映出生杀与和平的二元对立，又令观者对信仰产生无比敬畏。
38,血战钢锯岭,4,横轴画卷般的慢镜头战斗场面调度复杂，尺度血腥，是最值得看的部分。关于战争和信仰的描绘其实都很浅很煽。猪大奔赫被耶稣感动的7分钟要删，对这片子明晃晃的基督复临派宣教反而高抬贵手，这暴露出了广电总局对宗教的浅陋理解。
39,血战钢锯岭,5,火之外的道具都是我朋友提供的。
40,血战钢锯岭,4,「我还是不能理解你的信仰，但我知道了你的信仰有多坚定。」特别复古老派，又硬又直，但很多时候“a true story ”比千万特效更能打动人心。★★★★
41,血战钢锯岭,5,你一定要相信，这个世界上真的有很好很好的人，戴斯蒙德・多斯从血肉横飞的钢锯岭上一个人救下了75个重伤员。这不仅仅是宗教的力量，是一个人内心信仰的力量。笑中有泪，最后热泪盈眶，战争的残酷和血腥从未如此震撼地在大屏幕上展示过。
42,血战钢锯岭,4,这辈子还没有看过这么可怕的战争片，打仗一开始第一个爆头就把我看傻了，一直到结束全程无法思考只能生理性地想流泪，看完电影后衣服仿佛都沾上了一股浓烈的血腥味。文戏非常中规中矩，不过加菲演的太好
43,血战钢锯岭,5,有个会走关系的老爸还是很重要的……我是不是歪楼了？
44,血战钢锯岭,4,时隔10年，梅尔・吉布森又坐在了导演岗位上，并再次带来了稳定又出色的发挥。关键是故事还是基于真实故事改编，生活真是比电影精彩，有那么多惊心动魄的往事被盖上历史的尘埃，一旦擦亮，会反射出一道道光芒。在这部里，便是一道人性的光芒，在加菲的表演下，传递出一种动人的力量。
45,血战钢锯岭,5,如果不是真人真事，那真的是可以媲美抗日神剧了。信仰拯救人生，结尾真人采访哭成狗，平静而充实的和最爱的人生活在一起才是最美好的事情吧。真的好讨厌战争，让战争都滚蛋！
46,血战钢锯岭,5,真实事件改编。看着他把一个个受伤的不管是战友还是敌人背下钢锯岭的时候，真的感动了，这就是信仰的力量，他做到了。他明明能力很强，却坚持不为了名利去利用，不因为时局而动摇，因为他坚持他的信仰，甚至可以失去生命。战争片，没有宣扬和平，却让人看到了信仰和平的力量。
47,血战钢锯岭,5,李安没给我们的，梅尔吉布森加倍还来了，满分电影！完美的电影！
48,血战钢锯岭,4,和平主义者在战争年代承受的巨大压力，今天的社会或许没有多少不同吧，人人都得上另一种战场，成就的战场，抢钱的战场。你讨厌厮杀，想偏安一隅静静生活，同样要承受人们的指责，指责你逃避应尽的责任。战争从来没有停止，无论上与不上，杀与不杀，都需要拿出勇气。
49,血战钢锯岭,4,我如果不坚持我的坚持，我就不知道怎么去爱你。一个不拿枪的医务兵靠着他的坚持，信仰在战场中救了一个，几十个战士的故事。我虽然打582但我不认可他连日本人都救的做法。
50,血战钢锯岭,5,"很另人震撼的故事
]有想^看@N片
居然被感
信仰的力量
是o限的"
51,血战钢锯岭,5,所有人的灵魂都是不死的，但正直者的灵魂将是永生不灭永垂不朽的――苏格拉底。
52,血战钢锯岭,4,3.5 倒是在个人英雄主义和上帝神谕找到了奇怪的平衡，如果他完全不信上帝，最后会显得像手撕鬼子的抗日神剧。而且并没有拿人性论来解释对战争的拒绝（男主不拿枪，但不管其他人拿不拿）。但总体来说，仍旧是好莱坞式传统的对战争的解读。战争场面残酷血暴到遮眼，加菲这部演得比沉默好很多
53,血战钢锯岭,5,认可把原型人物的故事“去传奇化”（原本这是一个夸张数倍的真事），与昭然若揭的煽动情绪相抵直到最后，我们已很难分清唤起的情感是否是强行给予还是本就置于观众的人心角落：不可避免地被圣徒一步步地狱朝圣所感动，不可避免地被战场段落震到万事皆空。这是个复杂的视觉心理，并不只停在昭然若揭上。
54,血战钢锯岭,4,战争不会让我们变好，它只会放大我们的善与恶
55,血战钢锯岭,4,电影真他妈是个好玩意。梅尔吉布森想当弥赛亚的这颗心用嘴说出来，就会被世人误解为砸场子不知天高地厚；嵌在电影拍出来，大多数人就看不出来，也就闭上嘴了。
56,血战钢锯岭,4,电影前对加菲长得太阳光，太可爱而无法融入战争片的担心随着战争戏开始的时候就立刻烟消云散了。前面文戏很一般，后面进入战争戏就开始跟着紧张激动起来了，第一次看撕鬼子这么投入…里面Desmond的兄弟是CW那小破剧爱上朋友妈的小哥演的，出境不多但帅cry:) 
57,血战钢锯岭,5,信仰有多大，力量就有多大。电影名字平平，又是战争题材，却十分好看，庆幸没错过老梅这部诚意之作。不拿枪，只救人，疯狂开挂，不可思议却是真人真事。救人那一段，再多救一个，各种燃。全片他两次拿枪都只是为了救人，一次救母亲，一次救战友。最喜欢结尾那句话：只要你有信仰，那绝不是一个玩笑。
58,血战钢锯岭,4,3.5。1.看完血糊糊的钢锯岭再吃夜宵，感觉就像饿鬼啃残尸，略反胃。2.又一部美式主旋律啊，让人想到抗日神剧，不过全程看得很爽，梅尔直布森依然勇敢得可爱。
59,血战钢锯岭,4,看过资料，冲绳战中日方不光杀死美方的医护和伤员，也在最后杀害了自己的伤员，并禁止随军人员投降。我还是觉得日本法西斯的非正义性是很具体的。无可奈何，这一代人已经凋零，对反法西斯战争的鲜活记忆就要丧失了。
60,血战钢锯岭,4,对我来说，这电影是从大兵们真正上了战场之后才开始的。真实的战争感让人血脉喷张，能让人忘了之前的絮叨和神叨。有宗教信仰并且内心虔诚的人可能在极端的环境下创造奇迹，但这并不能当成一种价值观去弘扬。如果不是精彩的战争戏，就有点儿天主教宣传片的意思了。
61,血战钢锯岭,5,梅尔.吉布森真他妈硬汉啊，又硬又直。
62,血战钢锯岭,5,为真人真事打五星。本尊事迹很难想象，一个医护兵，赤手空拳，单枪匹马，在冲绳岛钢锯岭这样的地狱救护出75人。英雄中的英雄。MoH授予他不能更恰当。Desmond炮火中肩负战友狂奔的形象。煽得几度泪。连长的反应，当时想要是TP里尤金的好连长碰到这样的部下又会怎样做。散兵坑坑友可惜啊。
63,血战钢锯岭,4,看到探讨宗教信仰就斥为神棍片，某些人的心理防御机制是不是启动得太轻易？一个人因为信仰有了铠甲，坚持自身主体性，在战争险峻恶劣的非常态环境下依然把持自主意志，不愿染指杀戮，即便他的坚信无法撼动你的坚决不信，难道就不是件可敬之事？战争给了他痛苦，却未令他仇恨。知行合一，世间几人做到？
64,血战钢锯岭,4,没有办法认同男主角不拿枪的理念，所以丝毫没有办法代入，故事也不觉得感人，整个故事就是一个特殊的奇迹，完全不具备复制性。男主角的不拿枪，是千千万万拿起枪的杀戮者为你守住的信仰，这个信仰其实并没有受到真正的伦理考验，念及于此，我会觉得狡猾。
65,血战钢锯岭,5,直接，真实，没有说教，紧凑。男主“one more”的执着时候我又快信上帝了。票房不会太好吧毕竟美国战争片，但会是有口碑的片子。（以及多次抹泪不是因为煽的，是某种沉浸感让眼泪不自觉流下来...）
66,血战钢锯岭,4,“让我再多救一个”梅尔吉布森宝刀不老，儿女情长家国大义宗教信仰共冶一炉，主旋律伟光正，手法老派煽情过分前后略断裂，但一点也不妨碍被感动到啊！带着血腥金属气味的真枪实弹在血肉横飞的火光地狱里嗖嗖而过，让人浑身战栗；选角棒，高潮掐得准，“攀登”的前后对应。
67,血战钢锯岭,4,枪炮是毒药，信仰是一剂吗啡。在逼近极限的人性抉择面前，效忠天皇的刺刀和求索上帝的圣经并无本质区别。信仰既能使一群人如蚂蟥奋不顾身，也能让一个人孤独扛起执念。地下堡垒包扎敌军士兵、战地救人安全无虞，难以置信仍深信不疑，因为我们在某一刻也相信了神迹。生活在迷雾中的人们，从未看清自己。
68,血战钢锯岭,4,战争场面太真实震撼了，足以弥补前一小时的乏味平庸。此片应给所有的好战分子观看。愿世界永无战争！
69,血战钢锯岭,4,热血+震撼+残酷。梅尔・吉布森用非常传统的手法拍摄了一段并不传统的战争电影，梅老板对气氛渲染的手段，将太平洋战场的血腥与惨烈渲染到极致，摄影和画面极佳，信仰之力MAX。前半段稍显冗长，后半段震撼，日本人冲锋那段跟僵尸一样，角色塑造一般，不熟悉几位演员的朋友需要提前辨认，否则后期脸盲
70,血战钢锯岭,4,人家的主旋律总能甩我们八条街。
71,血战钢锯岭,4,既《耶稣受难记》之后，梅尔・吉布森再次用信仰的力量震撼了观众。Rupert Gregson-Williams配乐生涯最佳作品
72,血战钢锯岭,5,你知道一个人要承受多大的意志力，才可以有所不为。
73,血战钢锯岭,4,吉布森到底是个好导演，战争题材拍的极其逼真+震撼，人物刻画和战争场面完美融合不脱节。在题材限制下很难更棒了--主旋律难以避免，部分情节出于剧情需要戏剧化也可以理解。不过主人公的事迹不应该影响对信仰的批判性解读。【P.S. 这种局部二战片真心只能是白人设定，挑刺儿的和挑事儿的都歇歇哈。
74,血战钢锯岭,4,梅尔吉布森二十年前告诉我们什么叫自由，二十年后他告诉我们什么叫信仰！
75,血战钢锯岭,5,牛逼，刚刚爬上去那段恐怖程度堪比恐怖片了。
76,血战钢锯岭,4,注定是迄今最过瘾最血腥最手撕鬼子的战争场面，有了这些部分，开头的《珍珠港》和《全金属外壳》翻版的再烂，也就都容忍了
77,血战钢锯岭,5,没有信教确实很难理解这样的信仰，只能说男主的三观坚定的令人敬佩，战争的刻画非常写实，写实到让人永远都不想再看到这样的场景。好片值得一看。
78,血战钢锯岭,4,我花钱上电影院是去看杀人的，没想到让我看主角不要命的救人。。。
79,血战钢锯岭,5,再说一次，美国的主旋律电影，高就高在旋律本身非常高。电影放完感觉全场观众都要鼓掌了，碍于是“美国佬”的片子，生生憋住。
80,血战钢锯岭,4,战争前是《珍珠港》，进军营后是《全金属外壳》，抢占钢锯岭是《拯救大兵瑞恩》，道斯想多救一人的执念则是《辛德勒名单》，上士的狙击战显然又是《兵临城下》，可见它其实处处都是套路，但偏偏一腔激情从头撑到了尾，鸡血满满最后全化为了汹涌澎湃的力量，堪称“荡气回肠”。
81,血战钢锯岭,4,感谢这些合格的战争片，在和平年代，没有任何娱乐性地最大化地告诉了我们战争的残忍和真实，哪怕只有小部分人被感染，也足够了，真心地谢谢它们。
82,血战钢锯岭,5,引人入胜的大片，讲述战争而不落俗套，给一个人以血肉，又不刻意煽情，实为难得。期待着我们所谓的抗战片可以拍成这样，而不是一味刷票房，讲空话。
83,血战钢锯岭,4,近一两年难得好看的战争题材商业片，战争场面拍摄的非常棒，冲突紧扣人心，除了战斗场面，故事意料之中地为主角设置了一个信仰困境，虽然不新却能令人信服。爱情戏多余，倒不如替代成战友情or甚至搅基也会更好。故事还涉及圣经以及宗教元素，略显突兀但不可或缺。货真价实抗日佳片。加菲很有戏点。
84,血战钢锯岭,4,惊人的写实再现战争的残酷，脱离了老套的反战片，而是用精神内核供人思考。战场下的温馨浪漫与战场上的血腥炼狱，军营里的世俗与信仰中的冲突，父与子的创伤和拯救，甚至最后日本人用投降与切腹所表达的毁灭和救赎，才是影片真正的主题――受难与信仰。非常热血，非常梅尔吉布森
85,血战钢锯岭,5,吉布森继续探讨信仰与个人英雄主义的母题。单纯从视听角度论“好看”还是比不上内容黑点满满的[勇敢的心]，但本片战争场面惨烈度甚至超过了[拯救大兵瑞恩]，烘托与煽情的段落也很有效果，但还是不及结尾真实人物采访来得有感染力。第二幕教官训话借鉴自[全金属外壳]。加菲尔德演得无可挑剔。（8.8/10）
86,血战钢锯岭,4,日军最后取刀的盒子仍然是干净无尘的，这是对双方信仰最直接的反讽
87,血战钢锯岭,4,【B-】梅尔吉布森好好拍战争场面吧，只要不谈情，不谈情都好说，一谈就作的我浑身慌。
88,血战钢锯岭,5,满分电影，完美电影，我的年度最佳和最爱。
89,血战钢锯岭,5,作为反战片看是满分，展现了战争最残酷的那一面，作为个人信念的实践看也很好，“再救一个，多救一个”，那真是信仰给人的力量。但我却始终不能忘记故事发生在_I椋想到战时毫无训练受迫参加战斗的_I人，日军的胁迫，战后的独立复归，以及替日本本土承担的美军基地。太复杂了。
90,血战钢锯岭,4,大银幕血腥之最。很好看，可我期待的结局是多斯被残酷战争逼得拿起枪杀敌或者干脆精神崩溃。传教姿态比战争场面更恐怖。
91,血战钢锯岭,4,场面十分震撼，特别让人感动的一部好电影。
92,血战钢锯岭,4,如果不是现实太过惊奇，就真以为导演这是在干嘛……
93,血战钢锯岭,4,后半段又煽又壮阔，特别是和基友那一段。故事讲得比较满，没有太多思考的空间。当然true story的力量就在于此，振聋发聩。太喜欢加菲了，明媚如春风，还是团队大奶，队友喊medic的时候俨然副本刷boss......加血啊！
94,血战钢锯岭,4,剧本非常一般，Mel Gibson靠一己之力把这个可能会被大多数制片人丢掉的剧本转化成了一部冲击力极强的电影。每秒钟我都能感觉到包括导演、演员在内的制作团队使出浑身技艺克服陈词滥调的努力。Hugo Weaving惊艳的演出让我扭转之前对他所有的平庸印象。
95,血战钢锯岭,5,英雄主义照耀钢锯岭，但就是有血有肉的好看啊！
96,血战钢锯岭,5,平凡人类的英雄主义最值得歌颂，而不在于是否关乎信仰。
97,血战钢锯岭,5,真实性击败我了我预先准备的吐槽，真实在于画面，在于事迹，也在于信仰。
98,血战钢锯岭,5,没有奢侈的特效、没有一线的演员、没有气势磅礴的大场面，但就是这么一部中低成本的战争电影让我观影结束10分钟内回不过神来。梅尔吉布森再次用朴实的电影叙事、娴熟的视听语言以及满腔热血创造了又一个电影史上的经典作品。这样的电影和《拯救大兵瑞恩》一样值得你去看第二遍，第三遍甚至二三十遍。
99,血战钢锯岭,4,每出现一个伤员，获得一个圣盾。荣耀将赐予我力量！圣光将赐予我胜利！
