,movie,star,comment
100,血战钢锯岭,4,我以为我会哭，但是我没有6868梅尔吉布森导演，蜘蛛侠主演，煽情有不到位，战争场面有，还特写了些血肉模糊的镜头，但是总觉得火候不够的感觉，不过挺有大片相，很像拯救大兵瑞恩，体现的是美国式人道主义精神，美国人打日本人，应该会过审吧哈哈哈哈
101,血战钢锯岭,5,梅尔吉布森是偏执狂，然而真的classy啊。他是非常老派典型清教徒的价值观，被诟病也是因为这种价值观显得不合时宜―但他并不是错的，人们会嘲笑这种偏执，但最终还是会尊敬这种偏执，因为这就是信仰的力量啊。把信仰活出来的人令人生畏。假冒为善看轻神的人多了，真的信仰证明在眼前反而不信了
102,血战钢锯岭,4,又见无语译名。结束时观众有掌声，一多半是给真实事件的当事人的。通过Desmond的童年和爱情故事令英雄有血肉更亲民。用他和上级同侪的对抗展现其信仰与意志。最后是神迹时刻。梅导一贯手段。战争戏拍得特别好，不设立场（日军也尽现其勇），没有保留（断手断脚穿肠破肚）。
103,血战钢锯岭,5,《血战钢锯岭》太好看了，年度Top前三，就是这个名字翻译的太像《狼牙山五壮士》这种红色国产剧了，非常失败的译名。
104,血战钢锯岭,5,在硬盘放了许久，最近按计划补片，终于看了，觉得真该早点看。这是部真正有灵魂的作品，吉布森的电影已不存在讨论质感和制作这种基本问题，而是不断被其中流露出的人性感动，为平等对待生命的行为震撼。在尸骨遍地、你死我活的战争中，尚能保留人性，足见信仰的力量。不得不说，美式主旋律依旧有穿透力
105,血战钢锯岭,4,战争的目的是为了和平。
106,血战钢锯岭,4,一个坚持信仰，用行动赢得尊重，拯救生命的故事，硬汉梅尔・吉普森另一种“勇敢的心”，文戏武戏一比一，平衡得好，前一小时爱情浪漫温柔，家庭揪心，新兵纠结，后一小时枪林弹雨耳朵炸聋，残肢断臂血腥恐怖，这样的真实奇迹，只能说主角“命大”。贵国拍不出来。战争太残酷，希望有生之年不要遭遇啊。
107,血战钢锯岭,5,反正我是哭成狗了，战争场面残忍又真实，大概是最棒的抗日片？虽然冷静下来想有些地方也有可以渲染的意思，但真得感动到我我就是要给满分！小细节很棒，演员都特别好，表演有说服力。信仰困境这个切入点也很特别
108,血战钢锯岭,5,今年第246部。这样的主旋律可以有。关于信仰，关于生命，关于选择。
109,血战钢锯岭,4,战争有多可怕和平就有多珍贵
110,血战钢锯岭,4,许你美帝可以开挂救人、不许我们手撕鬼子？――领导抽了一口荷花淡淡的说。
111,血战钢锯岭,4,很奇怪，有时候你觉得荒诞的事情事实上是真的，而你的第六感和你的信仰相比大概信仰是那种会带给你更多满足的存在吧。愿没有战争。
112,血战钢锯岭,4,不仅有宏大的战争场面，更有无法割舍的亲情、浪漫忠贞的爱情和坚忍笃定的信念。
113,血战钢锯岭,4,在寒冷的冬日，窝在被子里，喝杯热巧克力，看一部好片，真是绝美的享受～
114,血战钢锯岭,4,正宗主旋律，梅老牛逼。
115,血战钢锯岭,5,太好看了。我从来没有看一个电影看的脖子和背全僵住～
116,血战钢锯岭,4,后半段战争与血肉模糊是梅导一贯风格，无可挑剔。但仅就立意而言，这并非是个人信仰和军人职责的冲突，而是《圣经》代表的国教同现代国家机器的不兼容。章学诚说官师治教合一，预设就是治教分离。比如儒家十三经同古代政制的分离，共产党宣言同官吏执政现实的分离，只是中国人习惯了权变，缺乏虔信罢了
117,血战钢锯岭,4,即便知道是真实事件却觉得电影好假，就因为突然问神所以留在了战场那里！前面的信仰坚持铺垫到这里一下子没意义了。但战场太真实了，以至在心里默念无数次祈求世界和平。加菲有很棒的眼神，以及这是发生在冲绳…美军后来对这里也不是解放而是报复！其实那里的海很美的～
118,血战钢锯岭,4,当时在看的时候就觉得这部电影的主演因为自己童年的阴影而无法握枪，但是到了后半部分，就截然不同了，为了救受伤的战友而不惜冒着生命危险去抢救。。实在令人钦佩！
119,血战钢锯岭,5,这个世界有些人就是喜欢作死，作死还作得理直气壮的。比如在那个全世界都痛恨法西斯都希望痛扁小鬼子的时代，跟人家说我上战场不想杀人不想带武器，只想逛一圈回来的时候顺带拖(救)几(十)个人。成功变作死为牛逼。
120,血战钢锯岭,4,跟血战钢锯岭相比，李安的120帧更像个笑话。
121,血战钢锯岭,5,其实电影本身拍得只能算是合格，有太多类型片的套路，但是由于历史上真实发生的这个奇迹实在是太感人了，忍不住要打满星。其实这个片子主要的讲两个事，一个是信仰的力量，再就是个人信仰与他人之间的界限。顺便提一句，最后梅导也特意描绘了日军的切腹场景，这其实也是一种信仰的实践。
122,血战钢锯岭,4,超级主旋律 但是战争场面拍得很独特 很多出彩的镜头
123,血战钢锯岭,4,前面看睡着，一路睡到钢锯岭战役。之后，就想说：卧槽卧槽卧槽……到最后，拯救开始，眼泪刷刷直流。同为改编自真实事件的主旋律电影，这部比湄公河，段位高太多。信仰的力量，把我震到了！
124,血战钢锯岭,4,信仰之光佑我灯塔国，喜欢这部电影的老派与直男，建议由川普大帝授爆裂猛男华莱士“好莱坞直男荣誉勋章”。
125,血战钢锯岭,5,去电影院里看，哭个不停，哭得发抖。和Doss他比起来，我的信仰和灵命是多么软弱，在世俗的诱惑或要求与上帝的诫命之间，我向世俗妥协了多少次？面对困境的时候我逃避了多少次？当良心挣扎苦痛的时候，我回避了多少次？我一直自称基督徒，然而我为了这份信仰做了什么？坚持了什么？
126,血战钢锯岭,4,加菲演得太棒！一众卡司也演得棒！战火戏份拍出了一种悲壮的美感。只是可惜了导演，说了犹太人的坏话，从此被媒体唾弃，海报上连名字都没留。美国的政治正确还是很可怕的。拍电影搞艺术的人能拍出好作品就足够了。
127,血战钢锯岭,5,信仰真牛掰，可以杀人也可以救人。希望梅尔吉普森提名奥斯卡bp和bd。
128,血战钢锯岭,4,三星半吧。男主跟先前挤兑他的肌肉男在战壕交心时，好想说句赶紧开房吧，正打仗呢怎么还谈开恋爱了呢。整部电影就是这样，慢，拖，煽，除了非常厉害的战争场面。另，原型人物真的超级伟大。
129,血战钢锯岭,4,保留了梅尔・吉普森一贯的直白、真实与血腥。当他们从地上捡起《圣经》时，立即剪辑到正在切腹的日本军官，他们有着各自的信仰，但本质上却依然有一些相似之处。
130,血战钢锯岭,4,最后脚踢手雷，那真有点儿抗日神剧的味道，用暴力血腥来书写反战电影，结尾收的很好，没有政治渲染，梅尔吉布森越老功力越深厚。
131,血战钢锯岭,4,“求您，只让我再多救一个就好。再多救一个。”坚持信念的人有着别人看不见的一面，每个世人何尝不是如此？这让他有着救别人的勇气和力量。我已经失去了。随后，pre judge者都来道歉或者也正是出于这一前提。所以我只有judgement. 想到“我不管你信什么，只管去信”牧师对Mal说。他做到了，我不能。
132,血战钢锯岭,4,某些右翼总觉得玉碎作战感天动地，赢了道义分，但美国可没觉得自己道义上输了
133,血战钢锯岭,5,全程哭，无法相信这样的人和事真的存在和发生过，感谢导演拍下此片让后世知晓这样的故事和人物，并了解战争
134,血战钢锯岭,5,只要你有信仰，就不是一个玩笑，那就是真实的你。
135,血战钢锯岭,5,战争戏太凶残了，控制不住地生理性流泪。
136,血战钢锯岭,4,比较老派的战争片，很主旋律，但现在看来也很难得。要不是有true story加持，这样的战场白莲花故事还真挺难说服我的。后一半一进战场立刻开挂，暴烈至极，太梅尔吉布森了，有点找回了看《勇敢的心》的感觉。
137,血战钢锯岭,4,貌似是第一次在电影院看手撕鬼子。
138,血战钢锯岭,5,战争的场面调度方面还是无人能出拯救大兵瑞恩其右，  斯皮尔伯格还是那个唯一一个能够清楚地告诉你敌我双方的一场场大小战的过程是怎么打的那个神
139,血战钢锯岭,4,梅叔叔一直喜欢直白狂热的灌输他的意志，不讲中立，电影本身水准也就打个75分吧，战役部分情节人物设定都是样板式的，加菲开挂起来也是吴宇森式英雄主义。但即使是明知有艺术创作的成分，依然会觉得无比温暖感动，与宗教战争无关，就只是敬佩那种坚持信念的朴实和勇气。
140,血战钢锯岭,4,比利・林恩回到“安全”的战场。对于道斯来说，自己和自己博弈得出结论是他的安全领域。于是主题里反战和主旋律在这件真人真事上得以共存。导演用电影讽刺包装，想说的是奴役父权对成人的影响，以及信仰的可贵。即使在面对战败已成定论，它依然是稳固的：“和平年代，黑发人送白发人；战争年代相反”。
141,血战钢锯岭,4,前半部分三星，常规套路，后半部分五星，战争场面的震撼程度超过拯救大兵那段抢滩登陆战。
142,血战钢锯岭,4,让我想到一个问题：加菲尔德是不是美国王宝强？
143,血战钢锯岭,4,现实讲出来往往比故事更动人。
144,血战钢锯岭,5,因为这部片子引发的华人基督徒圈子口水仗，反映出我们所缺少的很多东西，恰恰是这部片子展现出来的东西：温柔而坚定地为自己的信仰抗辩；当别人坚持的信仰与我们不同时也尊重他们；不去论断人的品德与动机；承认自己曾经论断别人并致歉；还有最重要的，信仰不是说出来，而是活出来的。
145,血战钢锯岭,5,最好看的战争戏，残酷而感人。。。
146,血战钢锯岭,4,加菲是永远的少年
147,血战钢锯岭,4,华莱士拍片免不了用力过度带着一股抗日神片的味道
148,血战钢锯岭,4,最擅长血腥的吉布森拍战争不要太合适。jb都炸飞到天上去了。
149,血战钢锯岭,4,前半部拍的相当傻白甜，但机缘巧合之下反而有种黄金时代好莱坞的感觉；后半部吉布森瞬间变回那个干脆利落不掩饰的自己，残肢断臂，血肉纷飞，用最极致的残酷去衬托最坚定的信仰。
150,血战钢锯岭,5,有时候亲临其境不需要3D，只要找一个小银幕，坐在它两米之外看一部Hacksaw Ridge这样的电影。如临战场，感受信仰。毫无疑问，这是我在电影院看过的最好的电影。
151,血战钢锯岭,4,片是好片啊，“说教”能拍成这样也是厉害了。题外话：当年去电影院看《拯救大兵瑞恩》的时候，美空军正在昼夜轰炸南联盟。现在在电影院看着拒绝摸枪的有信仰的医疗兵，美政客则在提供枪给ISIS们...
152,血战钢锯岭,4,2014.2 看看，人家美国的主旋律怎么拍的这么好看！梅尔・吉布森的暴力风格还真是血淋淋的真实啊！
153,血战钢锯岭,4,最不喜欢看的电影题材之一，但是高潮部分还是高潮了。不喜欢加菲的表演，但是其他演员都演的有血有肉。全片荷尔蒙与血浆齐飞，看得我春心荡漾又心惊胆跳
154,血战钢锯岭,4,让我们看到战争的残酷，也让人懂得信仰的力量，更让观众看到人性的光辉！
155,血战钢锯岭,4,握草这个片最牛逼的一点是，电影最后多丝手握圣经和日本兵为了天皇刨腹的平行剪辑，对两种信仰的平等处理，绝不美化自己抹黑别人，绝不把对方拍成禽兽把自己拍成真正的人。
156,血战钢锯岭,4,Mel Gibson好战，喜欢宏大。幸好选择了Desmond Doss这个人物，又选择了Andrew Garfield这样的演员，调和了一部分战争的愚蠢残酷，消解了一部分信仰的偏执可怖。前半部分真无聊，澳洲演员真好用。推荐这篇最值得一读的影评《A Hero among Heroes》：https://movie.douban.com/review/8220037/
157,血战钢锯岭,5,美帝的可恶之处就是：他时刻告诉你，他尊重个体生命！
158,血战钢锯岭,4,前半段《恋恋笔记》后半段《血战冲绳》。梅尔吉布森的电影特色跟东木一样鲜明独特，不过其导演手法也算好坏参半：宣扬宗教倒也没什么，就是对角色的塑造还有些表面化，对主角的内心、变化表现都不够深入，战友们的态度转变也完全依赖主角神迹般的故事。这方面就没法跟《全金属外壳》之类媲美了。
159,血战钢锯岭,4,被战争戏惊得魂飞魄散。和平真好。
160,血战钢锯岭,5,父辈战争阴影与父子情谊，军事法庭坚持原则抗衡，战场画风一转，冲锋陷阵血肉横飞，炸碉堡与地道战，自杀式反扑与清道夫……然后再让前半部的浪漫主义逐渐渗透钢锯岭战役的残暴恐怖，很好
161,血战钢锯岭,4,很爽的战争片，值回票钱
162,血战钢锯岭,5,【A－】前半部分只有雨果・维文的演技让我眼前一亮；到了后半部分，长蛆的尸体，血淋淋的断肢断腿，以及魔鬼一般的日本士兵，着实把我恶心到了。美军攻陷钢锯岭的蒙太奇剪辑太棒，夺得奥斯卡当之无愧。 老梅的电影一直以来都在表达“信仰”这个恒命题，以最血腥残暴的方式。但必须承认，他做的实在是太好了。
163,血战钢锯岭,4,烽烟滚滚唱英雄，四面青山侧耳听，侧耳听。
164,血战钢锯岭,4,日本兵的刻画比较脸谱化，这方面与国师的差距大约是二十个陆川。
165,血战钢锯岭,4,都在拿它跟《拯救大兵瑞恩》比，在想如果镜头不是那么血腥重口味，是不是反而更好？画面太过刺激，是不是反而削弱了电影内在的力度？
166,血战钢锯岭,4,激励他的是圣经还是里面的照片？
167,血战钢锯岭,4,战争场面太写实，几个镜头犹如鬼片，突然被吓到。永远不要战争，太可怕。
168,血战钢锯岭,5,怎么讲，原型事迹的传奇性足以让人忽略影片一定程度的套路，好看即正义
169,血战钢锯岭,5,文戏编排新颖竟然还有幽默感，战争场面节奏稳健，感官刺激与心灵震撼双管齐下。通篇挑不出毛病，一百三十多分钟，竟然每一分钟都好看，没有用力煽情，眼泪却湿眼眶。
170,血战钢锯岭,4,从当年耶稣受难记的票房就能看出共和党的基本盘有多强大了。为出场设定就是无神论的同学理一下本片逻辑1.男主角信仰坚定2上帝护佑他3他创造奇迹。《圣经》就是按照这个套路写的。宗教还是很好的，再烂的也不会太差，无神论顶多能算正确，真正是所有可能中最坏的一种了。
171,血战钢锯岭,4,这么带劲的真人故事本可以拍得不这么中二的！前1小时的戏简直令人作呕。。“我这辈子从未对一个人有过这么深的误解” 嗯我也是
172,血战钢锯岭,4,真实的战争就是这么残酷，正常的人性都不会怂恿参战的。愿世界和平。8.3
173,血战钢锯岭,4,我看电影都是会先看看网上如何评论才决定看不看的，这部电影再中国上了2天后我和朋友去看的，很震撼很感动，好看
174,血战钢锯岭,4,无论是故事推进还是内核价值观都很老派很主旋律，但不妨碍好看，尤其是从进入战场部分开始真的震撼到屏息凝视，临场感极佳，直到片尾出现真人画面时脑子甚至还是无法思考的状态，走出电影院只想用力呼吸。信仰的力量令人敬畏，友情戏比爱情戏更具chemistry
175,血战钢锯岭,4,就像班上那个资质平凡但异常刻苦的优等生，真是感受到那股努力劲儿。梅尔吉布森又用了《耶稣受难记》的模式。战争场面血腥暴虐，拍得非常之精彩，大大弥补了前一小时的不足。但是，配乐那叫一个喧宾夺主呀。
176,血战钢锯岭,5,我不得不讲信号弹后的那一幕吓得整个电影院都叫了出来……我旁边的同事都快跳起来了。嗯，如果要深挖，就是一个阿甘般的美式英雄的故事，但是对于战争的刻画太写实了，真会让人触目惊心
177,血战钢锯岭,4,前段为了给后半程蓄力遂稍显沉闷，后半部分好看的炸裂！不过战场的血肉横飞实在是让人不忍直视，太残酷了，那就是人间炼狱啊！太多的痛苦让人无力承受……加菲饰演的角色简直阿甘附体，那股一根筋的劲儿活脱脱就是一个人，不过在这个角色上更凸显出信仰的力量，他们身上的坚韧和无畏都值得让人敬佩……
178,血战钢锯岭,4,浓厚的宗教情怀。
179,血战钢锯岭,4,1，打怪带个敬业的神牧多么重要，又能回血，又能加buff。2，二战美军装备真好，真好，真好。3，美国人也兴找老战友托关系。
180,血战钢锯岭,4,Mel Gibson强硬直白的表达出来的战争场面太震撼了，血肉横飞，真实的可怕，战场上没有设置过多的情感输出，就是让观众随着镜头感受战争的残酷和恐怖。男主前半段是个执着信仰的傻白甜，战斗开始后从他一次次单独救人的行动里，能感受到单薄身体里蕴藏的强大力量。而且这是个真事儿，太牛了。
181,血战钢锯岭,5,（提前场）“我听不到你的声音，我究竟应该怎么做？”当“救命，医务兵”这句话喊出来，des义无反顾冲进战场的时候，眼泪刷的就下来了。这是我第一次在影院看到大妈、中年人和同龄人同场抽泣……
182,血战钢锯岭,4,特别朴实的现实主义作品，老老实实的叙事结构，踏实细致做好每一个细节，把战争的残酷赤裸裸呈现在观众眼前，人物简单但朴实的情感，特别动人，信仰的力量，也深深地震撼到我，我几乎是屏住呼吸看完全片。这部片子的底色，其实是一部宗教片呀，黑白分明就是其特征，但居然是真事，令我乍舌。
183,血战钢锯岭,4,从多斯为战友祈祷那一段开始，后半段我是哭着看完的，单纯因为太残酷，因为我知道他们是要去送死。有些人看到宗教，有些人看到英雄主义，我看到反战更多。像列侬唱的，想看看没有国家的世界。或者像杨朱说的，想象一个所有人都不爱国的世界。日本人，美国人，ISIS，所有青年都不爱国了，多好。
184,血战钢锯岭,4,有信仰而且严格遵守要求自己的人真有魅力～ 加菲脖子真长。。。。
185,血战钢锯岭,5,最近这些年看的最好看的战争片了
186,血战钢锯岭,4,近期神棍流大片之一，然鹅人家是真事儿！如果不是这种铁血拍法，不是【乡村】少年感爆棚的加菲演男主，这片子99%得砸。你国大片导演学学梅尔吉布森――隔壁国全是丧尸直接砍，鬼片导演再学学罗泓轸――鬼都是隔壁国来的，你国影业复兴指日可待。家祭无忘告乃翁。
187,血战钢锯岭,4,美式主旋律，美式信仰加持，美式个人英雄主义式煽情，前半撩妹套路俗不可耐，后半战争场面目不转睛，尽管内核就是美式上甘岭。
188,血战钢锯岭,4,"好看到爆！！！
剧情俗套，但是细节充足。泪点也有几处，吐点也有几处。
战争真是狗娘养的才会发动啊！！！"
189,血战钢锯岭,4,老派的风格，熟悉的味道，喜欢的套路。一人一夜救伤员，简直像在看神话故事！还有徒手挡手雷，秒变抗日神剧既视感。
190,血战钢锯岭,4,喜欢他一个人留在岭上拼命救幸存者，对累瘫在地的自己说「再救一个」。喜欢他最后被日本追到岭边，获得战友的帮助。大家开始理解他对信仰的信念。战争镜头很带感。中间几个日本人突然出现的镜头可能会有点惊吓。
191,血战钢锯岭,4,没给五星原因是故事讲的确实一般，有些流水账，但观感依然非常棒。加菲从头到尾没打过一发子弹，不过不仅没搞砸演成圣母婊，相反是全场最酷炫的人，让观众真正感受到他坚定不移的信仰。战争场面更是点燃全场人的肾上腺素，不是我看过最血腥的，但完全不输今年的荒野猎人。
192,血战钢锯岭,5,战争场面血腥，救人情节揪心；靠着自己的双手完成救回75个人的不可思议的壮举，手握圣经，洗去身上的血污，宛如化身上帝，成为全队的精神支柱；我不知道你的信仰是什么，但我知道你的信仰如此坚定；真正的敌人是死亡，真正的勇气是忠于自己；在最坚定的信念面前，死亡也无能为力
193,血战钢锯岭,5,补课2016，其实冲绳岛日军输在没有一个妈宝男和振奋人心的Bgm，前期铺垫很赞，男主加菲符合美帝白左基督徒所有幻想，女主颜值过于逆天有点像斯图尔特必须赞！后面结局反而过于匆匆结尾，男主使出了星爷少林足球拯救了数名队友，完成了属于他真正的救赎！超凡被砍其实看起来让加菲戏路变宽了
194,血战钢锯岭,5,全程觉得主角光环开得太亮，最后五分钟被啪啪啪打脸。以及，这剧刷新了我对日本兵战斗力的认识。
195,血战钢锯岭,4,信仰无法改变战争，但战争也无法撼动他的信仰
196,血战钢锯岭,4,梅尔・吉布森，一个又粗又硬又直的男人。
197,血战钢锯岭,5,吉布森把战争原本令人绝望的样子展现给我们看，然后再告诉我们，奇迹仍旧会在绝望中出现。
198,血战钢锯岭,4,要是用上蜘蛛侠那招 估计那个桥段省力不少 
199,血战钢锯岭,4,看到他背起战友时我哭了
200,血战钢锯岭,3,"美国抗日神剧：乡巴佬,不杀人,信上帝,救队友。前一小时昏昏欲睡,而且新兵营抄袭<全金属外壳>.全片最好的就是40分钟的战争戏, 剪辑不错,混音很好,配乐能给老美煽哭。电脑特效五毛,化妆能让你吐出来。适合那些从没在电影院看过什么正经战争片的观众。槽点密集,比如日军冲到悬崖边却不扔手雷,人肉小吉普…"
201,血战钢锯岭,3,1.战争场面确实不错，子弹穿透头颅以及被炸毁的半个身子，但对国产片的审查估计还是不能给到这尺度。2.感情线的设定有一种豁出去的庸俗。3.不管信仰强不强大，让一个不拿枪的士兵上战场就是个笑话，不能因为奇迹般的特殊情况被这笑话转化为一种精神。3.说到底还是一个老兵走后门用特权帮儿子解围。
202,血战钢锯岭,3,真实故事非常值得尊敬，但是这种满屏飞肠子的宗教狂热/主旋律的抗日神片风格实在不能认同。槽点多到数不过来，加菲主角光环大到可以徒手接手榴弹，队友捡回来的圣经可以直接穿越成入党申请书，日军智商战斗力全程不在线，没烧悬崖边的绳索，也不知道往下扔炸药包，啊…还有那迷之展开的感情戏…
203,血战钢锯岭,3,3.5，救人那段确实挺燃的，但别的部分掐了手心一百多次才没睡去。美国抗日片里的日本人比中国抗日片里的还不像人啊。
204,血战钢锯岭,3,战场的残酷指数五星，战场之外的部分都是渣。
205,血战钢锯岭,3,雨果维文的演技碾压……看到好多老梗
206,血战钢锯岭,3,蛮好看的。只是看时有点烦躁：（1）你坚持你的信仰可以，可是你坚贞的固执把其他人都给卷了进来，为你操心，为你愤怒，带来诸多冲突，当然这个固执也是他之后救了那么多人的动力。（2）这种类型的片子女性永远都是扁平的配角，有点厌倦了。
207,血战钢锯岭,3,本质上和上甘岭没啥区别。女主颜值爆表。
208,血战钢锯岭,3,主旋律战争片里的音乐和爱情品味实在是糟糕；结合比利・林恩来看就有点讽刺了：男主的版权卖了多少钱？；如果最后没救那么多人，那么他的信仰是不是就没价值了？没有信仰的人总是会被信仰所打动。
209,血战钢锯岭,3,这片搁10年前还算能看，背熟[兄弟连]如我放眼望去没有一处不套路。追妹子那段俗不可耐，也就上了战场还能看（顺带说，横移用的真不错，值得一提）。意识形态保守得可笑又可怕（简直跟我国的革命历史题材似得），好在加菲还算讨喜。都这么多年了过去了，抗日竟然还是伊斯特伍德拍得最好。
210,血战钢锯岭,3,这部电影的唯一看点在于战争戏真的拍的十分出色。将暴力美学发挥到极致。镜头节奏都很流畅。剩下的就是上世纪主流大片的基础剧本。线索混乱人设无聊。可能我不信教吧觉得男主有点傻逼。其他人物刻画基本为零。
