,movie,star,comment
327,血战钢锯岭,3,战争几近真实！建议未成年在家长陪同下观看、小朋友不要看、女性观众也慎重考虑。。。
328,血战钢锯岭,3,战争戏好看，前半段人物刻画让我忍不住一次次骂男主傻逼，可能是因为我无信仰主义不能理解信教信到入魔的人吧……男主哥哥一直到最后也没出现 有点无语 所以哥哥的作用只是在儿时被拍了一板砖？
329,血战钢锯岭,3,2016144 就在你以为梅尔吉布森要展开战争和宗教的较量之时，却发现他还是被真实人物的英雄主义所束手束脚。但是战争戏着实拍得够精彩。
330,血战钢锯岭,3,被最后的手拍手榴弹，脚踢手榴弹拉低了一颗星
331,血战钢锯岭,3,3.5，后面节奏太拖，尤其讨厌最后一个镜头，不要随便升天0415。加菲还是自如模式，很舒服。这个信仰坚定到确实是已经魔幻主义了，放在祖国大概也是极少人可以理解。这个时间点的个人主义，不是为冲奥，那就难免带点情绪安抚的意味。@中影UL大沙发
332,血战钢锯岭,3,人y以置信，比阿甘神奇的事，只能用神硇稳...
333,血战钢锯岭,3,看着你们洋洋洒洒旁征博引深刻复杂。我只觉得1战争残酷，2男人可怜，3运气好也是种实力，4TMD还不是拿枪的人赢得战斗
334,血战钢锯岭,3,男主童年几欲杀兄弑父导致价值观原地爆炸，日本人漫山遍野视死如归宛如星际虫族，其他正常人非正常死绝，完。吉布森和东木的差距主要在于煽情不节制，急性尴尬症晚期患者。
335,血战钢锯岭,3,刚开完，没有想象中震撼。我更喜欢前半部，有更丰富的情感起伏，后半部宗教味重了些。我看到的是一个勇敢而坚毅的人践行了自己的信仰，不应简单地说因为信仰所以创造奇迹。
336,血战钢锯岭,3,喜欢梅尔吉布森大右派（虽然主人公其实是个伪左胶），喜欢赤裸裸的宗教题材政治不正确，喜欢它跟我的论文题目有关（没想到二战就已经有这种案例了）。但至于电影本身，我只喜欢他爸的餐桌演讲（吉登斯的制服）。
337,血战钢锯岭,3,题材倒是不错，只不过没有期待中的那么好，战争场面看着还像是黑帮械斗。因为故事原型在剧中露面所以也不好质疑什么，但是我真是怀疑冲绳上的日军是这么打仗的。一星题材，一星给前面的训练，一星给后面的老兵访谈。沃辛顿和原型还真是挺像的。
338,血战钢锯岭,3,毫无节操的煽情，三星打给true story（加菲是如何做到连鼻子都胖了…再这样下去真要变肥头大耳中年人
339,血战钢锯岭,3,之前一直和朋友解释中国的审查剪辑是因为没有分级制度，这部之后我实在不知道该怎么编了，就加个血战二字作为不适宜儿童观看的提醒吗？电影本身有些工整到俗套，但后一个小时还蛮过瘾。
340,血战钢锯岭,3,片头，看仔细了哦这故事是真的。片尾，再重申一遍，这是个真实的故事，亲爱的观众朋友们你们被感动到了吗
341,血战钢锯岭,3,是个工整的战争电影吧，但看过李安的比利琳恩，越来越对这些主义啊 信仰啊 民族大义啊  不感冒
342,血战钢锯岭,3,八一厂快来翻拍这个故事啦！可以讲一个佛教徒，坚持不杀生，吃素，不近女色，怀揣一本金刚经上战场，血战台儿庄，救人一命，胜造七级浮屠。。
343,血战钢锯岭,3,全片最青睐的是文戏部分且集中在刚入伍上军事法庭那会儿，后面的狂轰滥炸的战争场面看得我是血脉喷张可惜无亮点。★★★☆
344,血战钢锯岭,3,寓意非常恶心，这下连和平主义者和忠实的信徒都得派上战场了。
345,血战钢锯岭,3,炮火震得人屁股痛――一部]有3D效果的4D影
346,血战钢锯岭,3,影片想要鬟_的一切我都懂 但就真的 Not My Tea m然我知道中不可能有影片分制度@件事（起a五年炔豢赡埽┑是忍不住要吐槽   @N影片放在境外都是 16+ 保o的影片了吧 我@鲞有很多家L小孩砜 那些血腥的面 真是6868
347,血战钢锯岭,3,拖沓、主旋律
348,血战钢锯岭,3,很梅尔吉普森
349,血战钢锯岭,3,三星半，吉布森还是太套路了，没法跟老东木比
350,血战钢锯岭,3,战争戏的写实程度完全超过预期，看得人喘不过气来。战争以外的部分有点浅薄。
351,血战钢锯岭,3,对前半部比后半部观感还要好些――克服对自己军队的障碍难，克服日本人的障碍轻松，至于说到本来应该最有戏的自我的障碍，那就是无碍。所以略显无趣。
352,血战钢锯岭,3,战争场面太血腥了。
353,血战钢锯岭,3,2016/12/19(一)19:45三多影院
354,血战钢锯岭,3,神化了的医疗兵，高潮来得太晚。那个固执或者说是信仰，值得那枚勋章。
355,血战钢锯岭,3,直男热血主旋律电影。军事法庭那里挺感人的。然而前半段太长，后半段又太血腥了，并不是我的菜。
356,血战钢锯岭,3,真人真事改编不是编剧的免死金牌 美版抗日主旋律作品 战斗场面真实残忍一星 演员集体演技在线一星 女主好甜一星
357,血战钢锯岭,3,日本兵完全脸谱化就像丧尸
358,血战钢锯岭,3,也就战争场面很棒，其他的，太美式俗套
359,血战钢锯岭,3,前半截都是无聊的信仰宣传。战事部分特别写实，断手残肢血肉横飞，能过审特别好。
360,血战钢锯岭,3,生硬
361,血战钢锯岭,3,一般呢
362,血战钢锯岭,3,主角似乎头顶光环，在没有任何铺垫之下被神化了。人物细节处理方面更是槽点太多……完全靠信仰支撑起了整部电影，战争场面非常精彩，除此便无其他了
363,血战钢锯岭,3,相信W斯卡委T的品味具溆笆菲毡樾缘氖巧底樱相信W斯卡W院有o提名可以反影成就高下的t是蠢逼；但，如果想以此槔碛桑榕c本片同一年世s完全是下位互Q的R丁版《沉默》打不M季一事叫冤，那可就是又傻又蠢又滑稽了。
364,血战钢锯岭,3,头剧痛
365,血战钢锯岭,3,后半段的确很出色，但你要说完全真实地还原了战争现场，我不同意。整体性来说的话，本片最初的评价比较中肯吧，现在越来越神化了。
366,血战钢锯岭,3,有点血腥害怕…
367,血战钢锯岭,3,"2点5（加菲加一分）
被豆瓣的8点8吓到………
这部前半段在莫名其妙的乡村爱情偶像剧后半段歌颂个人主义信仰中间穿插了寻常的拼爹以及儿时阴影，最后还莫名其妙地升华了在战场上找圣经………
这个评分真的不坑？
"
368,血战钢锯岭,3,7/10。梅导故事里的男孩就爱跑山林、打架，带姑娘登高望远，父亲在家举枪射击等影响成长的创伤叙事都十足老套，美国战争片中主角都是自由和幸存的代表，其思想行动与军队的服从精神产生对抗，美军形象惶恐不安而敌人一定冷酷野蛮，最后转入塑造战争英雄的神话，胜在教科书级别的情绪渲染令人抵挡不住。
369,血战钢锯岭,3,怎么说，期望太高了。战争场面确实惊心动魄看的我小心脏都要蹦出来了，而且也不是无脑地贬低日本人抬高美国人，对日本人的武士道精神给予了尊重。但...总的来说就是一部个人英雄主义电影吧，而且直白的让人总跑神儿。如果真的比热血比直男，还是打开兄弟连好不好。
370,血战钢锯岭,3,爱国主义教育大片
371,血战钢锯岭,3,作为真人真事有太多wtf moments，不过对 Mel Gibson 的导演能力是刮目相看了起来。（好莱坞对男明星也真是苛刻，壮成这样还能被叫成玉米秆……
372,血战钢锯岭,3,老派直男战争。在缺少信仰的国家打信仰牌，然而信仰是没有贵贱的。日本人的也好、美国人的也好、非洲部落的也好。
373,血战钢锯岭,3,3.5星
374,血战钢锯岭,3,单纯不喜欢把好人好事归结于宗教信仰的做法
375,血战钢锯岭,3,文戏有点漫长，不过好在拉锯战场面实在动人心魄，满眼一堆堆烂肉，爆炸烟火效果也比之拯救大兵瑞恩开创的风格有了新的进步，尤其是横向的冲击波与碎片的真实感更逼真了，战场剪辑思路依旧如《勇敢的心》紧张密集却清晰不乱。至于为了烘托主题，很多场面设计的不合理还是比较遗憾，也因此还是主旋律类型
376,血战钢锯岭,3,没有想象中那么无懈可击，比起战争的主题更像是在讲信仰，可以一生坚持自己的信念不动摇，精神境界的确令观者动容。加菲撩妹简直浑然天成and一直以为会讲明白他哥怎么样了……
377,血战钢锯岭,3,"尽管根据真人真事改编且好评如潮不论豆瓣还是IMDb均获得高分,我观看影片时仍没有太大的惊喜与触动.影片整整用了前半部分所有的时间描述营造主人公性格的形成与入伍后的遭遇,无非凸显其内心坚定不移的信仰.其实在我看来称其为偏执更为恰当.当然凭一己之力拯救了多人依然值得敬仰.片名与内容严重不符."
378,血战钢锯岭,3,对不起，电影不错，雨果演技好棒，但我好讨厌这个男主，能把他换成大眼儿么，我给五星
379,血战钢锯岭,3,前半部分叙事很慢，爱情故事老套，对信仰无感的人也很容易出戏。但一下子跳到战争场面，残酷血腥可怕，收到多点惊吓…不管怎么样这个真实事件当事人非常让人敬畏。感谢生活的和平世界
380,血战钢锯岭,3,憋到最后一小时放大招 上次看到这样惊心动魄的战争画面还是拯救大兵 但远不如后者 即使画面更直接更残酷 其他配角的刻画以及俗气的前一个小时都令人失望（一个误场后第二天又去买票观众的真实OS）以及救人时致命的煽情 从配乐就感到一种误入抗战连续剧的尴尬 应该学习东木去年狙击手的冷静谦逊和克制
381,血战钢锯岭,3,前半段就是对珍珠港和全金属外壳的拙劣模仿，后半段对战争场面的处理倒颇有新意，浓烟滚滚下，凶残的日本兵如同丧尸。PS:就我一个人觉得安德鲁加菲尔德笑起来像阿甘吗？
382,血战钢锯岭,3,就……呃，正常吧，前面将近一个小时的铺垫说起来是挺长的，不过后面非常真实残酷的战场部分还是把气氛整个拉起来了，跟吉普森之前的片子相比，这部没怎么煽情，不过主旋律部分还是非常强烈，而且从另一个角度跟信仰再次产生了联系。总之，片子正常，还是很吉普森。
383,血战钢锯岭,3,呃......
384,血战钢锯岭,3,这部《你信天皇，我信基督，但中国或成最大赢家》的电影，总的来说还是太满了，不够克制。
385,血战钢锯岭,3,大多数中国人，都是没有信仰的。主要原因是，享乐主义下，没有比钱更重要的东西。就连情怀、信仰，都分分钟在全社会假恶丑的扭曲下，化身为圈钱的工具。人们趋利避害，自然没了信仰。
386,血战钢锯岭,3,没有惊喜，虽然是部大众期待的正能量大片。
387,血战钢锯岭,3,信仰是一个人对自我的要求，而不是别人。
388,血战钢锯岭,3,Gibson式的好莱坞大片，基本是《边境杀手》的正能量翻版，美国理想主义的救世情怀，个体信仰在世俗劫难下的升华和神化。前半程铺垫过多，倒也换来战争场面的惊心动魄，幼年经历可以保留，但感情戏删掉对影片毫无影响。
389,血战钢锯岭,3,炸药包和火焰喷射器，感觉回到童年。各种规定动作，不是我的菜。挺适合当国产战争主旋律榜样，但是把基督复临安息日会换成什么思想好呢……
390,血战钢锯岭,3,都挺没劲的，新兵营抄全金属，后面就是煽，槽点太多。唯一好玩儿的是跟宋老师看战争片儿跟看鬼片似的，乐死了
391,血战钢锯岭,3,主角戏份太多没太多讲冲绳战役结尾高潮一般一般.
392,血战钢锯岭,3,主旋律
393,血战钢锯岭,3,女主有c神似kristen stewart~那I夏敲佳郏 d著尸w的卡^新兵的那段好震撼 有加菲在地下洞穴褪日兵的那段TAT 拖著鹩殉吠r好o啊！雨果S文也演的可好~ 缺c是擂蔚母星颉！Ｒ约鞍讶哲拍的]有感
394,血战钢锯岭,3,"全程都在想男主能不能走开,我要看雨果维文!把男主身上优秀的品格的来源都往他的宗教信仰上靠,这本身就值得怀疑不是么?"
395,血战钢锯岭,3,女主是甜美版KS
396,血战钢锯岭,3,少儿不宜。
397,血战钢锯岭,3,挺好的一个电影，毁于最后几分钟那个手挡手榴弹。美版手撕鬼子么。
398,血战钢锯岭,3,观影体验很好，其余的为什么我感觉也很美国式主旋律？
399,血战钢锯岭,3,前半截昏昏欲睡，后半截仗打起来才好看。信仰的神力真伟大，就是不能直接化成如来神掌碾死日本鬼子。
400,血战钢锯岭,2,属于那种它想表达的所有点我都懂，但是基本是没有办法接受，更不要说engage的类型，战争血腥和宗教，只能说非常非常的直男以及非常非常的主旋律，以至于影片呈现出的价值观有那么些狭隘了，它将一个伟大的人物一段伟大的故事用某种自以为是的价值观表达了出来，我觉得这对于这些战争中的英雄是一种亵渎
401,血战钢锯岭,2,所以这是一个善良单纯但是某一方面又很自私的幸运的家伙成为英雄的故事，要问他怎么能在枪林弹雨中穿梭24小时以上？他相信是上帝在庇护他~如果这还不是鸡汤剧那也没谁了
402,血战钢锯岭,2,对梅尔吉普森拍出如此肤浅的宗教片感到惋惜，并且对其中错误到违背圣经原则的信仰教导感到愤怒，跟细细的红线相比，这片子真的跟哄孩子一样。梅尔吉普森再不解决自己信仰中的人文主义倾向的话就真的不要再以传教之名拍此等题材的片子了，真的是自绝后路并且有做“假师傅”的嫌疑了！
403,血战钢锯岭,1,"看了各大网站的影评，感觉自己和大家看的不是一部电影。
撇去真实事件改编以外，电影本身就是一个拿着本小小的圣经的军医用自己神奇的宗教信仰和信念拯救了75个人的故事吗？是吗？如果是，为什么评分这么高？？？？？"
404,血战钢锯岭,2,美国版徒手撕鬼子，为啥你国爱国主义教育这一套换成说英语的大家就能接受了呢？黑人问号……
405,血战钢锯岭,2,知道是鸡汤，没想到是卖拷贝的那种鸡汤
406,血战钢锯岭,2,这个真实故事其实就已经很套路了，尤其是在戴斯蒙德救完人之后人们都说看错你了你真棒就差没说你真是个英雄了，不是不能英雄主义，可执行得还是套路加尴尬，这点真心是不如勇敢的心。PS：加菲快笑成加菲猫惹！快减点肥。
407,血战钢锯岭,2,Desmond不通人性，只知天命。他从钢锯岭下来后被战友拍肩膀的反应，是典型的为人性而人性。前后不怎么统一。
408,血战钢锯岭,2,勉强两分。结构极简单，前半小时谈了场近似强奸的恋爱，继半小时是类似全金属外壳的军营戏，但领导们被主角身上信仰光环击垮，虽然他不服从拿枪的命令但也客气，最后一小时是炸逼战争戏，穿插了和战友冰释前嫌戏。男主很丑，瘪嘴加鱼尾纹，看上去太老，第二段里显得特别欠揍，军事部分也是鬼扯
409,血战钢锯岭,2,宗教脑残遇上滥俗煽情狂魔。唯一的长处就是一定程度上展现战争的真实，但就这部分也过冗长。极度的宣扬宗教以及美式英雄主义和人道主义的种种并且就如此简单粗暴的表现出来，真的很让人感到恶心。如果不是片头一句改编自真实事件，真的只会觉得导演是不是大麻抽太多。
410,血战钢锯岭,2,Boring as fuck...
411,血战钢锯岭,2,Does it count as profanity that I laughed out loud in cinema?
412,血战钢锯岭,1,先进典型事迹报告。
413,血战钢锯岭,2,整个故事就是一神经病反转为神的逆袭心灵鸡汤，童年创伤前置成为不可置疑的前因，现实层面的封神就成为后果，两者因其权威性无可置疑。但如果我们把创伤视为人之常态，那封神的过程某种意义上也是一个正常人发展成为神经病的过程，这一过程必然反智反人类，简单的说，就是不可以常理而度之、细思则恐极
414,血战钢锯岭,2,披着人文关怀的羊皮，举着英雄主义大旗，结尾还不忘给切腹的日本军官布一个完美的定点光，你到底是想表达天佑美利坚还是壮哉武士道呢？我想梅尔.冯.吉布森.小宁导演的内心一定是混乱的。场面之恢弘有如当年freedom，而内容之空洞则与李安之间隔着一万场中场战事。
415,血战钢锯岭,2,脑子被踢了拍出的东西。关于信仰的部分根本没讲对。其实一切都不对，唯有燃点卖点和主旋律是对了。
416,血战钢锯岭,1,"mel gibson's come back和donald trump's election, 哪个更容易点?"
417,血战钢锯岭,2,拒^安德・加菲德。
418,血战钢锯岭,2,影史第一伪君子 最当婊子还要立牌坊的男主角。不杀人 不持枪 就请不要参军 助人杀人也是杀。男主衣服完全暴露了头长脖长肩膀窄的乌龟身材。导演传道的唾沫星子都要喷到观众脸上 泛滥煽情五流配乐和慢镜头令人发指。战争场面节奏运镜布景一流 配上一个五流故事 梅尔吉布森的大起大落果然有道理
419,血战钢锯岭,2,看完此片，请允许我学习男主角坚守自己的底线，说一句真话。
420,血战钢锯岭,1,1.改编真事不一定是真实，有人买彩票中一千万，有人弹吉他治好癌症。整部片子如同二战老兵的不靠谱回忆，年轻时没活明白，老了脑子还退化那种。2.调教不好加菲，别用雨果维文，没有对比就没有伤害 3.求你们了别和李安比 4.镜头和剪辑粗暴到冒犯。上来就说我爱你，是简单直接，直接脱衣服叫耍流氓。
421,血战钢锯岭,2,为了煽情篡改事实用套路不要紧，问题在于本质上对“人”并无尊敬，人只是表现各式儿戏的杀戮大法的道具，只为呈现神的光环，神的力量...果然是神棍Mel Gibson...
422,血战钢锯岭,1,"两个小时一个小时在胡扯，另一个小时没有日本人，只有美国人？日美协议。
套路程式化"
423,血战钢锯岭,2,够残酷够二战吓死我了 信仰部分拍得太简单了甚至有了传教和说教意味我就不喜欢了 加菲怎么觉得长残了啊…
424,血战钢锯岭,1,这看上去就是一个近亲结婚生下来智商只有60的恋母癖被政治需要宣传美化过度的故事
425,血战钢锯岭,2,只能说原型很感人，手法非常好莱坞很会控制观众，但是美国人能拍出这种完全没有军事常识的片子真的让我震惊，细节瞎扯到一定程度就脱离“艺术加工”范围让人出戏了，半个世纪以前花点钱的美国战争片都不会拍得那么乱来，本来以为“抗日神剧”只是修辞，结果是真的……
426,血战钢锯岭,1,难看
427,血战钢锯岭,2,过度血腥。过度鸡汤。谁把这片子拍成纪录片就好了。
428,血战钢锯岭,1,不认同主人公的信仰和价值观
429,血战钢锯岭,2,从此相信了豆瓣水军的存在
430,血战钢锯岭,2,这是一个开倒车的时代
431,血战钢锯岭,2,不要带脑子，用心和灵魂去感受梅尔吉布森的宗教力
432,血战钢锯岭,2,"杰出的视觉效果和氛围塑造也掩盖不了导演陈旧教条的三观，“一切都是信仰的功劳""和“红星闪闪照我前行""有什么区别? 毫无主见的女性角色，理所应当的爱情故事。战争电影究竟应该带给我们什么? PS: 加菲的主角气场不够，最好表演还是在TSN"
433,血战钢锯岭,1,典型美国洗脑片。对战争没有丝毫反思。 你就英雄了？傻逼！
434,血战钢锯岭,1,服了。就这样一个脸谱化说教片能8.7，豆瓣真是和以前不一样了。
435,血战钢锯岭,2,你们疯了吗？给这么一个矫情片打8.8？？？
436,血战钢锯岭,2,影片的前70分钟，充斥着大段互相说教式对白，演技基本靠大喘气。战争戏份大都是近景中景，可能导演做不了场景调度。很多桥段来自大兵瑞恩、全金属壳之类的拼凑。把战争打造成个人英雄主义的政治正确。同时缺乏亮点，无论是摄影美术剧情演技，空有煽动的热血爱国主义。
437,血战钢锯岭,2,顽固的信仰理想主义者，很难让人相信这是真实的故事，却也因为它是真实的而动人。前面的铺垫生硬俗套，几乎是被导演放弃的一部分，达到铺垫的目的就好了。重点是后面的战场部分，甚至还露骨而残忍地展现那些死去军人的惨状，这些场景让我们不寒而栗，却没有改变道斯，于他而言，救人便是心中堡垒的材料
438,血战钢锯岭,2,什么时候人们习惯了平庸的审美，一部平实到没有任何优点的电影可以这样过誉大概就是现在没有好电影上映的明证
439,血战钢锯岭,1,五星场面制作叙事卡司演技，但是我要给一星，不怕被骂极端左派，我反宗教。支持宗教次位化，即宗教不应成为人们行为的中心指导。从这一点上，无论基督伊斯兰抑或曾经的儒佛道教，都印证一个道理：从善如登，从恶如崩。他所信的善，你怎知不会是恶的借口。
440,血战钢锯岭,2,也没血战啊，应该叫一个医疗兵在钢锯岭开挂的故事
441,血战钢锯岭,2,抗日神剧之野区之王。
442,血战钢锯岭,1,二战耶稣传+血浆丧尸片。主角用祈祷祝福子弹+敌军唯美慢镜切腹。一边宣扬非杀，一边用血腥镜头取悦观众，这一点都不伪善真的。
443,血战钢锯岭,2,真难看，就是滥俗
444,血战钢锯岭,2,打高分的智商为负
445,血战钢锯岭,1,nope
446,血战钢锯岭,2,"前面拍得太矫情 我都不想看了. 后面还不错. 战争很残酷, 没点信念真不适合打仗."
447,血战钢锯岭,1,这种鸡汤饭为啥还评分那么高，没看够吗。米国人民也真是喜欢被洗脑。ps，场面过于暴力，中国连个分级也没有，根本不能允许小朋友去看。
448,血战钢锯岭,1,同样是真人真事改编 跟萨利机长一比 水平高下立判
449,血战钢锯岭,1,吹上天啊，浪费我时间
450,血战钢锯岭,2,史上最被高估的电影，除了真实事件以外，改编和故事节奏把握完全就是shit。真实事件6星，其他方面全是负的
451,血战钢锯岭,1,mel gibson以为自己是messiah还是哪能啊
452,血战钢锯岭,1,太高级了，三段式叙事。
453,血战钢锯岭,2,都打两星了，还特么有啥好说的
454,血战钢锯岭,2,虽然是真人真事，但男主角塑造得就像小学生朗读自己第一篇议论文一样，空洞而抽离，介于自我陶醉和不得要领之间。在连打了一百个哈欠过后，电影终于结束了。结局像是梅尔吉布森泼向我的一脸盆圣水，让我立刻清醒了过来。但愿下一个这么平凡的电影，能和我擦肩而过。B-
455,血战钢锯岭,1,人设基本渣男，剧情基本流水账，逻辑基本靠bible。。
456,血战钢锯岭,2,"场面够爆。。。
却逃避一直作为核心的judge时刻，
不妨碍作为一类角色的善良，出色，值得表彰，却根本上是虚伪的，特例只好这样吧"
457,血战钢锯岭,2,这么好的题材就被梅叔拍成了这样?!麻烦您还是回去好好当您的男人电影俱乐部MC吧
458,血战钢锯岭,2,电影三星。宣教减一星。另外最后那个火烧鬼子的蒙太奇完全是清洗异教徒的意思啊，这片子rottentomatoes评分怎么回事？
459,血战钢锯岭,2,梅老板带枪的耶稣受难记，但是故事在变形金刚缺了救护车足不成守护神那集就讲过了，好无聊
460,血战钢锯岭,2,1整体叙事啊、镜头语言啊、表演啊、台词啊都很俗，尤其是前边那段。简直想睡过去。2戏剧性非常强，包括后边战争的场面。感觉不太真实，因为并不是有一些人突然中弹就叫真实，并不是有惨烈的血肉横飞就叫真实。3这种强戏剧性代表着强煽情，让人难受。吉普森境界不够，属普通商业电影范畴。4原型感人。
461,血战钢锯岭,1,虽然不会再幼稚到说「跟喜欢这种片的人无法做朋友」这种话但还是会怀疑能不能做上朋友....加油朋友（
462,血战钢锯岭,1,整部电影看得我如坐针毡，战场戏非常想快进，出场之后只想漫天大骂一些政治不正确的东西。只能说主角光环真是太绚烂了，无敌是多么的寂寞。
463,血战钢锯岭,2,稳。加菲看着瘦，但是一抗一个准。真实事件改编永远是番外最动人。
464,血战钢锯岭,1,"政治正确。但很垃圾。 主角太自私, 圣母婊一枚。"
465,血战钢锯岭,2,徒脚踢手雷，功夫还是差些。意外进电影院接受了美国爱国主义教育。
466,血战钢锯岭,2,加菲不能看了
467,血战钢锯岭,2,标注完敦刻尔克标注这部，就像敦刻尔克除了一个“好”字不可能用少于2000字说明其好，对我个人来讲，这一部除了一个“烂”字也很难尽述其烂。
