,movie,star,comment
211,血战钢锯岭,3,较常规的美式主旋律战争片，人物形象都很伟光正，前半段老派的不像这个时代的电影。两点致命伤，一是对主角个人信仰的执念没有进行深入刻画，使得人物后面的英雄行为很难真正有所触动；二是作为一部年代戏也缺乏背景与时代质感的营造，无法令人进入到那个世界。被吹得超神的战争场面其实也就那回事吧。
212,血战钢锯岭,3,3.5影片让我没有想到的是男主角真的直到最后都没有开枪，我以为战争会让所有人失去，至少是暂时地、选择性地忘掉信仰，而男主角坚持下来了，他某一时刻真的看见了上帝。我由衷佩服那些真正有信仰的人！
213,血战钢锯岭,3,故事不够丰满
214,血战钢锯岭,3,3 无法接受梅尔・吉普森的右派“尚武精神“：硝烟弥漫里从步枪弹匣里弹出的弹壳划出一道道美丽的弧线，子弹呼啸而过之后的是洒满银幕的血浆爆裂，战争场面拍得有多震撼多热血，就跟宗教信仰的切入点有多脱节，两者竟然被同时赞颂也算是”人间奇迹“。不过抛开故事，单为爽到爆的战争场面就值得进影院。
215,血战钢锯岭,3,差点儿就成了“信主就是好，枪子挨不了”，如果不是有现实原型，绝对以为编剧脑子进水了。才弄出这么刻意俗套，可见生活本身比小说电影都难以想象。
216,血战钢锯岭,3,Christian movie其实就算拍成《血战钢锯岭》这样的，也只是说教意味十足的Christian movie，对信仰的过度美化是会冒犯到后现代社会人们普遍携带的批判性思维...终于炸伤了腿要下火线了却说“慢，帮我把圣经拿回来”的corny情节，几乎不亚于在任何一个以土匪为主角的国产电视剧最后都一定会穿上八路军军
217,血战钢锯岭,3,打五星的朋友们，seriously？
218,血战钢锯岭,3,文戏好尴尬，武戏太小气。关键是一直在讲耶稣，私货太多，当真是二十世纪福音战士
219,血战钢锯岭,3,三星半。把这个人物交给“一根筋”导演拍是最好不过的，任何一丁点复杂的想法都有可能弄巧成拙。吉普森和史泰龙一样是暴力享乐主义者，这一回除了惯用的割喉和空坠，战争没来的时候，他让过马路都变得如此艰险。
220,血战钢锯岭,3,完成度很高的美国主旋律电影，如果除掉导演无节制的升格镜头，电影会上一个台阶。
221,血战钢锯岭,3,后半部分血肉横飞腻的有点麻木。我感觉更好的是前半段的感情戏，轻快顺畅尺度把握恰到好处，剧作、拍摄手段和情绪烘托搭配的舒服，撩动心弦又谨慎克制不过分张扬。这前一个小时是所有这些奥斯卡提名片里节奏感最佳。
222,血战钢锯岭,3,我也是相信信仰的人，但这么高大全的人物真的顶不顺。没有弱点和缺陷的人物一点都不可爱。我和黄海看得百脸懵逼，一致评价sb……感觉要被主流抛弃了。
223,血战钢锯岭,3,所以那个淋浴 踢球 还有上天的镜头到底怎么回事 笑场很严重啊
224,血战钢锯岭,3,很老派，信仰大过天，不是特别喜欢这样的主旋律
225,血战钢锯岭,3,真・抗日奇侠传。
226,血战钢锯岭,3,看到片尾，发现导演是Mel Gibson，就一下理解了贯穿全片的英雄情结+宗教虔诚。说实话，感觉此公有几分像托尔斯泰：作品有说教倾向，且自认那些说理（乃至福音）才是自己作品中最有价值的部分，但那却是受众们最厌烦的部分，他们感兴趣的倒是那些真实的细节叙事
227,血战钢锯岭,3,3.5 非战场部分拍的太土了，10年前都已经老掉牙的套路。战场部分血肉横飞，很残酷，但也很怪力乱神，抗日神剧不止是中国专属。总体观赏性很高。
228,血战钢锯岭,3,心脏不好还坐第二排数次觉得要死在影院里了。
229,血战钢锯岭,3,爱情、喜剧、战争，三方面都有惊喜，但组合起来总觉得某个地方好像少点儿什么或者多了什么，怪怪的。不断地强调信仰，但对信仰的铺垫其实是一种直给的方式。不碰枪和不杀人其实是两回事，权利和老爹却糅合在一起，仔细想想，怪怪的感觉会更强。
230,血战钢锯岭,3,从神学意义上讲，上帝为每一个人所准备的救赎都是不同的，比如在战争中拒绝拿枪，戴斯蒙德的救赎恰恰是基于其他人都拿枪这件事。对人类来说信仰必然是多元的，对集团来说救赎则意味着打包的赎罪券。在这部影片中，个人救赎和国家主义是一种既对立而又紧密的关系，这一点不可不分辨。
231,血战钢锯岭,3,前面感觉自己在看一部90年代拍的电影，后面……大部分都靠吃零食扛过去的。。。战争场面和文戏水平完全不一样……以及主角真的是bible……
232,血战钢锯岭,3,故事断裂节奏失调人设老套，男女主角演技捉急，战争戏乒楞乓啷看起来很热闹，其实并无特别之处，CG水平不够让战场光线不自然，表现战争残酷就用一惊一乍low到爆炸。故事讲得太愣，动作戏工艺平庸，故事虽感动人却引不起好感。
233,血战钢锯岭,3,Oh boy have we got you a Christian propaganda ：）战斗场面好评，配角演技杠杠的尤其是雨果叔，加菲恕我直言演得像弱智。深受感动，向战场上互相扶持的人们致敬，但是谢谢你啊我不吃这嘴圣经安利。另外惊悚居然玩三次、还TM摸进地道潜行点满，meh
234,血战钢锯岭,3,梅尔・吉布森一如既往的宗教狂热和血腥，在2016年也算稀有动物了。全片平铺直叙，前半段拖沓，不过训练营训话真是笑死。后半段的战争真是太恐怖了，如果片中的奇迹（救下75人并毫发无损）完全属实，真的也只有他心中的神能支撑他并保护他了。Roman Guerriero
235,血战钢锯岭,3,美版抗日神剧分数这么高？？为了尊敬原型人物加一星吧
236,血战钢锯岭,3,不顶不是镁国仁！
237,血战钢锯岭,3,"宗教与战争扯在一起的尴尬与讽刺啊，而大家只看到伟光正。。。万能的上帝还是无为的上帝,普世的上帝还是米国的上帝。"
238,血战钢锯岭,3,台湾上映版140分钟。熬过前一小时拖沓的傻逼中二矫情戏，接下来就是80分钟的极度残酷血腥的视觉震撼战争场面。爆头断肢，血肉横飞，肠脑满地。国内必会删减吧。日军残暴无脑，加菲主角光环大开，情绪渲染过度，一度觉得是夸张的好莱坞个人英雄主义抗日神剧。片尾历史真人出现，方才惊呼牛逼。三星半
239,血战钢锯岭,3,我是主角，我不会死
240,血战钢锯岭,3,梅尔・吉布森真是走火入魔了，什么戏都要搞成宗教题材。比「拯救大兵瑞恩」还差十个「硫磺岛的来信」。文戏全靠奇遇，武戏全靠开挂，什么战术战略都扔太平洋里了。还好反战的价值观没偏，不然就是妥妥的抗日神剧了。
241,血战钢锯岭,3,宗教反杀戮片，不是反战争，必然矛盾的是救护战友去杀戮一样服务于杀戮机器。各国的主旋律都是一样的好，但是我更加尊重反抗侵略保家卫国的杀戮。
242,血战钢锯岭,3,挺好看的，就是前半部有点长了。one more那段很阿甘；不仅没有黑人，似乎连亚裔、拉美裔都没有。
243,血战钢锯岭,3,拒绝武器的士兵本来就很神奇，手无寸铁的士兵在枪林弹雨中救下75条人命就更显得既讽刺又催泪。可是，我总觉得在战争里讨论正义或仁慈，是一个很难站得住脚的命题。要说表现战争的血腥和残酷，应该还比不上Kajaki。
244,血战钢锯岭,3,这是一本不过不失的教科书，主修美国主流价值观。胜在故事本身已经足够动人，吉普森聪明在知道不用太过渲染。
245,血战钢锯岭,3,这个视听呈现其实是把 true story 的力量打了折扣的，让人惊异的永远不是信仰或信念本身，而是它与承载它的人物之间令人惊异的化学结果。影片太强调那些简单层面的东西了。开场爱情戏份拍得年代感太足，也让人有点乏味/反胃呢。
246,血战钢锯岭,3,某同学说：“这音乐挺八股的。”哈哈~
247,血战钢锯岭,3,这评分怎么那么高…美国抗日神剧啊（这个故事也许不太适合改编电影，片尾的真实采访要更好看些）…另外加菲好像有点长残了
248,血战钢锯岭,3,"节奏差.不过我感受到的竟不是一边倒的主旋律陈腐价值观.宗教浸染/国家主义教化深入到让人不假思索判断,可两厢的结论却相悖,其各自宣称的正当性就很可疑了.而若它们一是一非,又为何要有抱守一边却仍成为糟糕之人的反例.道斯试图兼得的任性同于他追求姑娘的手段和时机.但你所信必定只由俗世回应.维文叔赞"
249,血战钢锯岭,3,3.5 男主的信仰、成长、洗礼，人物塑造还是偏嫩，太主旋律，中规中矩。不理解电影院内为什么一直笑声不绝。
250,血战钢锯岭,3,最后十五分钟有点儿手撕鬼子，但爬上钢锯岭的第一波攻击真是我在电影里见过的最接近地狱的场景
251,血战钢锯岭,3,每次都嘲笑好莱坞的套路和主旋律，也没什么效果。不得不正视，这种圣徒叙事，和革命英雄主义、或其他宗教、民族的集体策略有什么区别？意识形态都需要自我表达，哪一种可以创造真正的生活？这部过度煽情的电影的启示在于，非如此不可 ，不然别人怎么知道你的信仰是什么以及你信到什么程度。
252,血战钢锯岭,3,及格，但完全够不上预期啊。太平铺直叙了不是吗？群戏也做得不算成功，那么多配角，真正能让人记住的有几个？一两个顶多了吧？
253,血战钢锯岭,3,不把japs翻译成小日本，也算是一种进步吧。传教片。梅尔吉普森仍旧是那个狂热虔诚的基督教原教旨主义者。有个镜头很有意思:一场大战后幸存的加菲怀抱圣经，这时对剪日本士官剖腹自杀，还真是“所有信仰都值得尊重”。战争场面不错，够横店导演们喝两壶的，不过战争的荒谬远胜残酷，这与信仰无关。
254,血战钢锯岭,3,梅尔吉普森这次从95年过来的，自打演完上帝，心态就没放平，可能要学张铁林坐床了
255,血战钢锯岭,3,本来可以给四星，然而对于这种渲染奇迹的表现方式感到不舒服，扣一星
256,血战钢锯岭,3,好听点是扎实老派，不好听是太直太笨，前段铺垫过长中段军营老套结局战场炼狱倒过瘾，但也只停留在牛逼的视效上，角色太平庸，除了雨果维文的哽咽令人动容，加菲演技不怎么样，一干配角也都跟群演似的。配乐无感。老梅展现出战争的残酷，肉体的脆弱，信仰的奇迹，虽真人真事可反思战争不免有点宣教之嫌
257,血战钢锯岭,3,影片意欲呈现基督附体的人。前半段感人，后边变味。在我眼里，男主角坚持个人信仰纯洁，而他的妻子、父亲、战友却在为他背负十字架。人的回忆会放大英雄情结，而忽略真实的内心挣扎。他站在山下究竟在祈祷什么呢，横尸遍野，他又能祈祷什么呢。
258,血战钢锯岭,3,梅尔吉布森的电影，镜头总觉得愣头愣脑的。音乐也非常教条。
259,血战钢锯岭,3,和我国的战争片差不多风格  没有兄弟连和太平洋战争那么真实
260,血战钢锯岭,3,梅尔吉布森果然是皮开肉绽专业户，战争场面特别是初上钢锯岭的那一段在大荧幕的加持下确实很震撼，能感觉到自己在与死亡同行！甚至觉得自己闻到了硝烟的气味！...不过很倒霉后座有解说帝全程弹幕，所以其他部分能看进去就见鬼了...
261,血战钢锯岭,3,3.5星，不喜欢如此简单的价值观，虽然知道只有这样简单才能被大众喜爱。另外一个小时时才上战场的结构让人佩服，想到九层妖塔10分钟时男主角就上路了，这就是距离。
262,血战钢锯岭,3,它是用无数烂俗叙述装置堆砌起来的老派美国传记片，一个以坚持信仰能够创造奇迹为主题的白人主旋律故事，然而在围绕着主角的俗套爱情故事、家庭关系与事迹展现之外，梅尔吉布森以极为写实的方式呈现出了近几年来美国电影中最优秀最震撼人心的战争场面。
263,血战钢锯岭,3,这部关于“在现实下，如何诠释我的信仰，履行我的教义”的电影，我更好奇地是它上映的时机
264,血战钢锯岭,3,老美主旋律，但这背后的真人真事依旧让人肃然起敬。
265,血战钢锯岭,3,我本身对战争题材不感冒，不能深刻理解，而且我政治超级不正确一次，这片有true story加持吧，可这世界这么大历史这么久远，true story多了去了，还有人被雷劈好几回呢，还有人中好几回五百万呢，救这么多人确实奇迹，可你跟我说这就是神的力量就是信仰的力量，说服不了我
266,血战钢锯岭,3,中规中矩，不过战争场面还是拍得挺带感的。只是一直在想日本人为啥不在悬崖边缘设个据点，而且人都走到边缘来了也不把绳子割断
267,血战钢锯岭,3,从入军营到上战场之间那段文戏还不错，加菲太适合这种理想主义的文弱角色，就是岁月无情，已经有点显老了。。
268,血战钢锯岭,3,老白男电影，简单粗暴在本片既是贬义也是褒义。吉普森再次讨巧地把各种陈旧元素融合粘连，毫不节制地渲染让战争场面确实足够煽情抓人，技术整体过硬以及结尾对真实人物的强化赢得主流青睐非常容易。但要说本片最大亮点无疑是加菲尔德细腻传神，张弛有度的表演赋予这部个人英雄主义电影足够闪耀的灵魂。
269,血战钢锯岭,3,把战争的残酷，如同地狱般，拍的很真实。很好的反战片。不过，关于信念、关于信仰，因时因地而异吧
270,血战钢锯岭,3,开头絮叨絮叨小败笔，以及加菲某些角度有点像张云雷
271,血战钢锯岭,3,如果不是真实故事，就矫情了。拍得纹丝不乱、节奏控制特别好，这真难。大场面枪战怎么拍？一比起来前段时间热映华语片就落了下乘。日本军人非常凶残，比中国电影里的日本军人大约凶残一万倍。不把敌方当傻子，才是战争真残忍。
272,血战钢锯岭,3,同样是真人真事改编，好于去年的《坚不可摧》
273,血战钢锯岭,3,文戏难看到爆，战争部分很好
274,血战钢锯岭,3,战争场面直击人心，迫使每个不曾经历战争的人直面战场。但是，单就剧本而言，对人物的塑造确实比较单薄，虽然打着真人真事的幌子。。其实《勇敢的心》同样有这个毛病。PS：推荐小粉红们以及以宗教名义排他者看，男主告诉你们，什么叫做真正的信仰
275,血战钢锯岭,3,除了战争场面比较带劲，整个故事都怪怪的不知道哪里不对，就是没办法跟看林恩一样心里有触动，，，可能对我个人来说还是觉得个人英雄主义和宗教信仰当面渲染过度了，，（。加菲可爱！
276,血战钢锯岭,3,非常生气地接受了某福音派支派（有智障倾向）长达65分钟的传教...看在某人份上，就不打两星了~
277,血战钢锯岭,3,安德鲁・加菲尔德真是......小天使小可爱~！！（粉红色那种）
278,血战钢锯岭,3,集结了所有好莱坞大片的元素。它们重新结构了电影结尾的访谈――不是访谈让剧情更真实，而是剧情让我们重新反思访谈/回忆录这种文体本身介于纪录性和虚构性的特质。
279,血战钢锯岭,3,3.5。imdb的分难道就不会像豆瓣的一样，会出现虚高和被水军刷的情况？Metascore 71分是最中肯的。本片塑造了一个憨厚老实且固执得可爱的男主，可是从军事法庭一场开始整部电影都失去了可信性，甚至套路多到令人失望。我们看到了一个战场里的圣母，然而战争片最看重的永远是反思。
280,血战钢锯岭,3,老美的抗日神剧，果然不一般。我有上战场的义务，也有不拿枪的权利。对信仰的坚守和包容都值得尊重。
281,血战钢锯岭,3,请问跟国产抗日神片有何区别？人家信仰耶稣你军信仰毛泽东啊。为什么国产抗日神片不提名奥斯卡最佳外语片，是不是歧视？
282,血战钢锯岭,3,可能是之前期望值太高，所以略失望。吉布森如此直男，拍大段的文戏实在有些吃力（Desmond是靠他爹找关系免于惩罚又是几个意思），武戏不错，可是舰队的五块钱特效还有加菲脚踢手榴弹又是怎么一回事。最后真人现身说法倒是很升华，搞得都很想看纪录片了（如果有的话），以及加菲的口音学的棒棒的！
283,血战钢锯岭,3,确实是个吸引我的好题材，但是看了预告片之后我的期待过高，实际并没有兴趣看第二遍。卡司里演得最好的大概是雨果维文了。
284,血战钢锯岭,3,一开始我就知道最喜欢的那个小哥肯定会死 但是最喜欢的小哥后来真的死了 他妈的
285,血战钢锯岭,3,尊重轴线是战争戏的法宝
286,血战钢锯岭,3,主要是最後出F了真人，之前一直沈浸在主角光h太的|疑中，以及X得是鹘唐。
287,血战钢锯岭,3,非常美国主旋律的影片，比较突出的是战争场面表现的非常血腥真实，其实这也是梅尔・吉布森电影的一贯特色，不建议在饭前观看，其他方面其实很一般的片子，不如他以前的几部电影。
288,血战钢锯岭,3,虎^蛇尾，高唱好R]主旋律s走到一半就忘了中心；@怎N行呢～ Mel Gibson是那N教l主x、蠢、愚痴、瞎拍宗教元素，@熟悉感令人非常欣慰。特效雒婷黠@^假，如果能少一些CG渲染可能更震撼一些。教官出瞿嵌翁e可郏全片亮c。
289,血战钢锯岭,3,他打赢了两场“战争”，更重要的是个人的那一场。可能是期待拔的太高，没有想象的血腥，也没有预期的那么好。明白他对信仰的坚持，几次被打动，某几处画面甚至让我脑中的小人尖叫，但尴尬太多，上战场前铺垫过长，上战场后全程高能紧张氛围十足，可看到最后却又觉得，并没那么特别。7/10.
290,血战钢锯岭,3,电影前1小时真的太难看了。坐电影院2个小时又被“上帝祝福美国”洗了一遍脑。这TM已经2016年了啊！！！
291,血战钢锯岭,3,还是二十年前勇敢的心那个味道。。。倒是对如何判断一种信仰做了绝佳的注脚，胜者的信仰是高尚的，败者就是joke了。
292,血战钢锯岭,3,应该是个好故事，但语言实在是太陈旧了。其实这种南方人民题材更适合东木头老师吧？
293,血战钢锯岭,3,一位不愿拿枪的战士救出大量受困士兵。宗教意味有点太浓了
294,血战钢锯岭,3,可能是因为对阿甘式电影/战争片免疫，加上加菲实在有点显老啊，故事很感人是真的。
295,血战钢锯岭,3,感人是感人。但问题好多。而且毕竟有<兄弟连>珠玉在前...
296,血战钢锯岭,3,前一个小时阐述多斯不伤人不拿枪只救人的信仰，后一个半小时展现多斯手撕鬼子。梅尔吉布森是不是只关注宗教了？连续几部作品都和这个题材相关了～不要以为多点慢镜头就是展现战争中的人性了，先讲好一个不失重的故事吧。
297,血战钢锯岭,3,我有个战友，新兵训练违抗上级，连TM枪都不碰，按道理应该送军事法庭判刑。不过，他家有人，他爹找了个很硬的关系，不想摸枪就不摸呗，直接安排当医务兵了。后来听说这哥们当个医务兵都TM立了特等功，反而我们这些真刀真枪硬干的，到头来啥也没有。真是，天朝药丸
298,血战钢锯岭,3,前面一个半小时都好无聊，快睡着突然boom一声被炸醒了，开始了突突突血肉横飞的50分钟，很震撼，大概信阿门者得永生
299,血战钢锯岭,3,三星半。BGM你能不能克制点？
300,血战钢锯岭,3,一半《全合金弹头》和一半《拯救大兵瑞恩》的主旋律电影
301,血战钢锯岭,3,关于信仰关于歌颂生命的背后是经典老派的好莱坞战争片影子，有时还是套路颇多，对于拒绝持械的描写说服力一般。但梅尔吉布森的技艺足够的劲道，后半段瞬间亮出冲击力极强的地狱式战争戏，血腥程度非同一般，加菲的表演也非常讨人喜欢，结尾纪录片片段可留最后一个，别的略显多余。
302,血战钢锯岭,3,以故事本身的大和梅吉布森的水碚f，@片子流於煽情，反而是比^失望的。x式感如果用的太M，r值^又]有苟合，有N精神被人架的eX
303,血战钢锯岭,3,爸爸一战受创，儿子二战受创，孙子还有越战，曾孙还有伊拉克。上帝安排得不错。
304,血战钢锯岭,3,美好的爱情，超级美丽的女主。但是夸大的个人英雄主义，过于浓墨重彩的镜头，我不喜欢这种表达方式，也许平淡一些的表演会更好。腿被炸得像肉酱的镜头，真的把我吓哭了。和平不易，且行且珍惜。
305,血战钢锯岭,3,爱国主义cult片儿。。Gibson和塑造的男主形象，应该说就是billy Lynn里那个啦啦队大妞儿的男性执着版……也算符合这个上升的保守主义时代主旋律了
306,血战钢锯岭,3,真实故事很赞，但电影实在是太太太太主旋律，剧情和拍摄手法跟抗日神剧有任何区别吗，宗教对美国的主旋律意义就跟中国的洗脑信党没区别。。
307,血战钢锯岭,3,《最强医疗兵传说》；Mel厉害，但剧情老套，男主越来越像Anthony Perkins。
308,血战钢锯岭,3,讲战争与人性请看比利 讲信仰请看少年派 好电影应该只做呈现 而不是价值观的教化 破坏规则的极端好和坏都不值得歌颂  主角的真实事迹让人感动 可是行为我却不敢苟同 
309,血战钢锯岭,3,基督教战胜武士道精神的信仰传教电影
310,血战钢锯岭,3,正宗美国主旋律，老派传记片。借战争与信仰的结合将人物光辉事迹渲染放大，爱情与战斗都来得非常简单直接，带来不小的场面冲击力，但人物谱写还是过于光环化，不是战争突显人物，反像人物突显战争。
311,血战钢锯岭,3,一部被高估的影片。立意普通，打着悲悯宽恕旗帜，却没有对信仰和战争进行任何反思。表达方法也非常普通，男主不开枪救下七十五个人、手扔炸弹等桥段和抗日神剧如出一辙。
312,血战钢锯岭,3,被爆头的时候还以为在看行尸走肉
313,血战钢锯岭,3,战争场面拍的很不错，看的我胆战心惊的！
314,血战钢锯岭,3,3.5，第一次看到信仰在片e能支纹疬@N大的力量，K且是真人真事，被哭得眼影都花了！摸著珠子才能看完酷的雒妗Ｖ餍律，但喜g@「信仰」主}，轵\信仰注入一心：）
315,血战钢锯岭,3,为什么不割绳子？为什么不丢手雷？为什么不等他们爬上来扫射？
316,血战钢锯岭,3,事先看了剧情简介就觉得很无感，本来不打算看的，冲着Mel Gibson看了下
317,血战钢锯岭,3,“信主就是好，枪子儿挨不了。”包装过的宗教神话，伪战争片。同样是洗脑人家怎么洗的这么喜闻乐见？公宣部门反思反思吧。
318,血战钢锯岭,3,老美抗日神剧套路也不过如此
319,血战钢锯岭,3,就喜欢梅老师的简单粗暴
320,血战钢锯岭,3,本来打四星了，但是想想打四星对不起英雄连这种电影了，这种个人价值的营销塑造挺让人恶心的，他的队友的遭遇不会比他再好，而整篇光环都在他一个人身上，这营销理念就跟路边的华尔街英语和我爱我家一样
321,血战钢锯岭,3,……看到最后20分钟，忍不住笑了。和抗战神剧有什么区别。就差没有大喊一句共产党万岁了吧。手动维笑。
322,血战钢锯岭,3,种族主义者，宗教狂魔，烈狱奇观……梅尔・吉布森，本片中唯一可称道的只有导演技术了。
323,血战钢锯岭,3,主旋律个人英雄主义宗教至上 战争场面血腥而直观 主角光环太闪 加菲两米八 手捧圣经必有天神加持 导演很会调动观众情绪 当下会觉得真燃 但其实每个情节设置都老气横秋 太俗 这根本不是什么普通人也能创造奇迹的故事
324,血战钢锯岭,3,杀戮中的信仰，上刀山下火海就是不拿枪，拯救其实就是一种抵抗。战争场面触目惊心，子弹横飞，血肉模糊，到处都是被炸开的肢体，拿着战友的尸体作掩护的战场。动作戏震撼残酷，情感戏不可免俗。真实故事改编是有加分的。
325,血战钢锯岭,3,能再稍微冷静点，真就会成为个经得起一看再看的佳片，但咱吉普森是谁，那深谙刻奇观众操纵术多年，真人真事先把你讹上，高分贝口号加肉麻台词红上眼圈扯上嗓子叫唤管保让他们激情迸发涕泪横流，一整一个准，宛如黑产。
326,血战钢锯岭,3,剧情很抓人，信仰很强大，但我却告诉自己，要保持警惕，勿陷入其中。如果这部影片我是在十年前看的，我肯定会给四星以上。
