,movie,star,comment
204,岁月神偷,3,岁月被浪漫主义色彩粉刷了一遍，残酷的像是编导们刻意为之，而生活本身的积淀没剩下多少，倒是偶尔的几个类似戒指痕迹的小细节让人动容。本片很有观赏性和娱乐性，但这也是一部毛病显而易见的电影。★★★
205,岁月神偷,3,一家普通港人的悲欢离合，感情很真挚，很有港产文艺片的特点，有情怀又不矫情，不错。
206,岁月神偷,3,虽然我含泪了，但很失望。做作的地方还真是一点都不马虎地做作，煽得莫名，烂尾，初恋部分也极败笔。最感动的部分是“一步难，一步佳，难一步，佳一步，又一步难，又一步佳”
207,岁月神偷,3,1、恋兄片儿，私电影，编剧尚可，后半段点死为止，过分了。2、莫雨笙老师所言香港电影怀旧浪潮之一，罗导气度不如侯孝贤，《童年往事》仍然高山仰止。3、小朋友戏路同徐娇@《长江七号》，哥哥酷似王力宏，任达华简单粗暴，影帝无望，吴君如影后应无问题。
208,岁月神偷,3,虽温婉如玉但欠缺力度
209,岁月神偷,3,温情~理应感动~仅此而已~
210,岁月神偷,3,流水账似的电影难把握度，把握好了是影史经典，把握不好流于平庸，我觉得导演功力还不够。
211,岁月神偷,3,有点煽
212,岁月神偷,3,"人活着,就要信....什么乱七八糟的...有几个小细节处理还不错,我天生对催泪弹免疫....怎么办"
213,岁月神偷,3,三秒钟的记忆。
214,岁月神偷,3,有一些可爱的小细节，但我突然搞不懂这戏怎么拿的那么多奖项。它只是拍出了大家需要用来集体回忆的对象，甚至还显得矫情和煽情，而表演我觉得也只是中上未到佳。也许，吸引大家的只是比起同期电影的哗众取宠，这部电影有一份真诚和平淡，同时它又正正点出了岁月如梭，生活艰难。
215,岁月神偷,3,国语配音把感觉都弄没了。
216,岁月神偷,3,美术5星，演员4星，音乐3星，导演2星
217,岁月神偷,3,一部熟口熟面的q月，@神偷就是q月，q月起事就是老f和集w回的神偷；可是我@拥娜诉BDBS信用卡都]Y格有，何rDBSW校?@哥，文武兼洌有W校和富家女，@些都x我@低下雍眠bh，除了弟弟所接|所看到的一切事才我有一z共Q，@部影]有重要的弟弟根本不只一晒。
218,岁月神偷,3,张婉婷的片子给我的感觉就是淡淡的，一切都是淡淡的。回想起以前的内部玻璃之城，淡淡的凑成了舒淇黎明一对。许鞍华的客串让人想起她在河流里的客串，其实这种导演特别有意思，一点架子都没有似的。
219,岁月神偷,3,奶奶说只要把你最心爱的东西扔到苦海里，把苦海填满了，就能和亲人见面；细佬到处偷心爱的玩意，拍桌面吃剩食，头顶鱼缸，仿签明星照，收音机点歌，打弹弓；街头巷尾，理发和修鞋，街坊人到齐、同吃饭；鞋字半边难，鞋字半边佳，一步难，一步佳；大佬想自己的墓碑会写什么，离去较牵强；女朋友的角色弱
220,岁月神偷,3,苦逼片 可是什么意思呢？
221,岁月神偷,3,够煽情。。
222,岁月神偷,3,淡淡的情节，不是喜欢的风格，但还是看完了。哥哥死的时候很难受
223,岁月神偷,3,罗进二忒可爱啦！
224,岁月神偷,3,漫长的岁月里，时间原是最大的小偷。
225,岁月神偷,3,"挺感人的~但是刻意的痕迹比较重......
PS:音乐主旋律超赞！"
226,岁月神偷,3,我的心不在你这里，日夜相随又如何？
227,岁月神偷,3,当初很受瞩目的片子，我看了却觉得一般，说教意味太深，却少一种让人自发性的感动，也许老香港人看了会怀念，但非香港人看了也就只是看了，众人都在夸小演员演技好，我却觉得有时他只是很生硬地在背台词，当然他本来也是在背台词。也许是导演对这片子放入了过多的感情，而我看就太过于冷淡吧
228,岁月神偷,3,本来好好的，突然来什么白血病，你以为你在拍韩剧啊？好感度顿时降低...
229,岁月神偷,3,"蔷如有味道啊..分都o她了..
演T比片子出彩"
230,岁月神偷,3,很多处理用心，所谓悲剧煽情，催泪痕迹好重，并且成功了
231,岁月神偷,3,鱼的记性是最好的礼物……
232,岁月神偷,3,我咧个去！！可算TM演完了！！它的评分8.7怎回事？为神马我看的累死了？没泪点没感染，唯一的感觉就是想快进！没法理解主流的评分啊，那我回火星去了！！！
233,岁月神偷,3,很感人  连吴君如都没有都我笑～
234,岁月神偷,3,虚假的场景设定，人云亦云的豆瓣究竟怎么了
235,岁月神偷,3,弟弟想用古老的巫术让哥哥复活，结果他变成了哥哥！
236,岁月神偷,3,看了之后让人失望。。属于名气远远大于实质的片子。
237,岁月神偷,3,一般，很煽。
238,岁月神偷,3,岁月是小偷，只要钱不要包，到头来还能剩给你个装东西的地方。演技到底还得靠生活历练，任达华就是证明。电影音乐不错。
239,岁月神偷,3,突然有点不知道说什么
240,岁月神偷,3,@是一部由王力宏和山寨任男女配角的作品。已很久]^我姊看影哭。假S鞍A亮了。在故事的幽X程度上_夫D@次〗o了_方夫D，可惜^Y和\生都人略微失望了。最後，蔷如去北京之前穿著深t外套那一回^。
241,岁月神偷,3,滥情……
242,岁月神偷,3,上半年很多人都在念叨此片，不知道我是不是唯一一个觉得此片一般的人，总觉得同类型的港片都差一口气。多加一颗星给吴君如，再多加一颗星给《岁月轻狂》。
243,岁月神偷,3,喜欢二儿子的玻璃钢造型
244,岁月神偷,3,在幻变的生命里，岁月，原来是最大的小偷。。。。
245,岁月神偷,3,摄影很棒，音乐也不错，任达华和吴君如都称的上戏骨了，演起来得心应手。不过就是节奏跟剪辑有问题，整个故事我总觉得有问题，细节太多，煽情有余，总让人有快进的冲动，不是豆瓣的高分支持还真看不下去
246,岁月神偷,3,一开始看觉得貌似是很深奥的片子，到最后原来还是那么简单。
247,岁月神偷,3,没有香港情怀 表示不理解 皮埃斯：看了那个殖民情节的影评 上升到意识形态什么的太严重了吧
248,岁月神偷,3,鱼的记忆只有三秒。
249,岁月神偷,3,有岁月有旧情怀，除了苍白的爱情戏和俗套的白血病，本应有更多可看性，戏剧冲突可以比现在更真实更丰富，但影片没有做到。单说情怀，看《一碌蔗》，气氛掌控相当自然，情怀当前时，情节也能弱化。情节和情怀，本片两者都不能尽如人意。
250,岁月神偷,3,又是一部张婉婷式的伤情小资文艺片调调。
251,岁月神偷,3,煽过头　可我喜欢吴君如和任达华
252,岁月神偷,3,原声更能感动我。
253,岁月神偷,3,ZYXWVUTSRQPONMLKJIHGFEDCBA
254,岁月神偷,3,没那么好，也没那么差
255,岁月神偷,3,我的感动点太高太高
256,岁月神偷,3,用王刚的话说就是：有人为刻意作旧痕迹
257,岁月神偷,3,了解那个年代的香港平民生活，具有时代背景下的特质。平淡生活里的琐碎和真实亦是最令人难忘的，而感动正处于如此的真实。但或许之前听闻好评太多，所以看完对于感动程度有些许失望。
258,岁月神偷,3,虾片战争。
259,岁月神偷,3,"一个人,一家人,还是一个时代?　我不确定.
"
260,岁月神偷,3,任达华和吴君如演的很好， 配乐不错，年轻人感觉演技太嫩了。这种太煽情的电影不太适合我，但是大多数人会感到很温情的。
261,岁月神偷,3,100427，银河国际电影城，33。没我想象的好，配音也很奇怪。讲岁月的故事变成韩剧故事。罗进一完美的简直就是偶像剧嘛~还那么像王力宏！父母演的都蛮好，吴君如演妈妈外形很合适，不像惠英红那么明星相。
262,岁月神偷,3,我看电影这么爱哭的主 这次一滴眼泪也没掉 总有怪怪的感觉 
263,岁月神偷,3,我是真不喜欢他弟弟。的发型。
264,岁月神偷,3,勉强三星吧・・・看来我不适合这种温情片
265,岁月神偷,3,鸡肋
266,岁月神偷,3,有刻意煽情的感觉
267,岁月神偷,3,影院
268,岁月神偷,3,虐心啊，老老实实讲一家人的奋斗史不也挺好的么非得弄出人命才感人吗。音乐给五星。
269,岁月神偷,3,一味拿贫贱悲哀说事，不是正途
270,岁月神偷,3,一般。
271,岁月神偷,3,香港人的集w我不能懂
272,岁月神偷,3,刻意的煽情
273,岁月神偷,3,香港电影女演员后继无人。香港电影里的人都是人，大陆电影里的人都是符号，这大概是这部电影会吸引人的原因，有人就有感情，而且是这种亲情，但是这并不能掩盖导演的不成熟。ps：拔萃男书院，是《音乐人生》里的那个吧！
274,岁月神偷,3,是啊，做人总要信。
275,岁月神偷,3,除了罗进二让我喜欢，这片子真的没有打动我，情节，真不好说那一句话能说完的故事算什么情节。。。片名倒是带给我无限遐想，以至于期望过高？也许是因为确实不熟悉香港的那个年代
276,岁月神偷,3,有点不够真诚
277,岁月神偷,3,"人啊，不能太滥情~
"
278,岁月神偷,3,想往里面塞的内容太多了，反而乱
279,岁月神偷,3,小儿子太出彩了~
280,岁月神偷,3,手法很好，编剧太洒狗血了。市井味道可以拍的更好的
281,岁月神偷,3,不觉得有多感动啊！说那对年轻的感情干什么，还不如把篇幅多放些在亲情上感动因素可能还更饱满。现在变得不上不下，男女之间感情不够深刻，手足之情好像又欠缺了点。本来期待看到更多任达华和吴君如的戏份的。还是老演员的戏入眼啊。小的也演的不错。  -- 2010-6-20
282,岁月神偷,3,期待值过高。。。
283,岁月神偷,3,世事无常 还是未看透 未看透
284,岁月神偷,3,近几年港片的佳作...可惜我看着没啥感觉...
285,岁月神偷,3,过于煽情了
286,岁月神偷,3,穷困可杀人 哭完就去拼搏吧！
287,岁月神偷,3,和大爷一起。。。。。。
288,岁月神偷,3,我最讨厌有人要死的这种片子了。。。
289,岁月神偷,3,假大“胸”，又叫装假狗……
290,岁月神偷,3,不得不承认，这只是一个笼罩着怀旧气氛的滥情故事。而且主题与故事间有明显错位。然而，看后还是被感动了，可见眼泪多么不值钱。
291,岁月神偷,3,音乐给多一颗星
292,岁月神偷,3,港式温馨。一向不喜欢挣扎在底层的人民要死要活。喟叹现今流行男方在劫难逃，猝然横死。。。
293,岁月神偷,3,"只有上半部分的好戏,若干亮点,比如戒痕,比如骂孩子,比如鱼缸太空帽,比如老歌,比如街坊吃饭的那场戏.可惜后半部分被韩剧式绝症煽情摧毁殆尽.两个老演员真好,而那段青涩恋情的主角表演得真差."
294,岁月神偷,3,“在幻变的生命里，岁月，原是最大的小偷。”被岁月偷走的岂止是回忆，还有鲜活的人命。一个贫贱家庭的不幸，一段泛黄的怀旧岁月，只是刻意的编排，超过的煽情令影片缺少了深度，流于表面，好在亲情永远感动人心。三星半
295,岁月神偷,3,任达华和吴君如演得真好，但这片儿其实是罗进一的凄美罗曼史
296,岁月神偷,3,感觉像立顿红茶广告片的超长版
297,岁月神偷,3,剧情其实没什么特别的，经典的一些镜头，台词一步难一步佳 一步难一步佳。小孩子的形象很动人，吴君如的演技也很棒。
298,岁月神偷,3,我是不太能忍受：1、白血病。2、长得太像王力宏的的哥哥和长大后同样那么像王力宏的弟弟。3、博纳悠唐7号厅隔壁的装修声。4、博纳悠唐7号厅银幕上的一小片亮光。5、博纳悠唐冰窖一般的温度。
299,岁月神偷,3,free like a bird
300,岁月神偷,3,结尾真是败笔啊！
301,岁月神偷,3,三星半 煽情显得刻意  有点过了 虽然哭得很惨 但理性一点还是不太喜欢这个故事
302,岁月神偷,3,找角度、拖节奏，这便是文艺?
303,岁月神偷,3,如果最后小孩的哭声你不讨厌了，这片就成功了。
304,岁月神偷,3,打温馨牌，确实戳人泪点，但确实也有让人不买账之处
305,岁月神偷,3,其像我@N看影很哭的人 @一部在是要_走我不少眼I的 但是那N刻意的煽情和^於精密的算 在是相p了影的真\ 
306,岁月神偷,3,我没哭!太做作
307,岁月神偷,3,3.6 且不fR^@些事毫耍有意呈Fq月，我跟好朋友一起去看Z版。
308,岁月神偷,3,其实，有那么好吗？纵使演技到位、镜头优美、煽得如此这般，整个下来导演要表达什么并不清楚
309,岁月神偷,3,回忆的共同体
310,岁月神偷,3,我真没觉得这片儿哪里感动了我，可能我不是香港人吧......
311,岁月神偷,3,3.5 狗血故事，年轻演员演的一般，吴君如比任达华演的好
312,岁月神偷,3,淡
313,岁月神偷,3,岁月神偷。名字太好。
314,岁月神偷,3,还好吧
315,岁月神偷,3,进一实在很像蒲巴甲啊
316,岁月神偷,3,没共鸣
317,岁月神偷,3,里面有种看惯了的东西，所以对我没触动。
318,岁月神偷,3,一个时代的记忆  
319,岁月神偷,3,很好的主题，表达的没那么好
320,岁月神偷,3,王力宏李小龙合体有木有
321,岁月神偷,3,可能我期待度过高了
322,岁月神偷,3,没有多感人吧~~~我是不是没人味啊
323,岁月神偷,3,"2010.04.27 中关村美嘉
电影里的音乐好听~
边上那位的反应让我笑了，真是对不住啊......
罪过罪过~
“岁月，是最厉害的小偷”"
324,岁月神偷,3,轻柔情怀.
325,岁月神偷,3,好吧，承认泪点高了不少！ 一首原创歌曲真的需要一双欣赏的眼睛，不然毫无意义。
326,岁月神偷,3,其实也没那么好
327,岁月神偷,3,喜欢弟弟的演出，整个片确实比较煽情，感触却不如金鸡深
328,岁月神偷,3,看完出来大家都很尴尬 哭的 虽然故事很烂 但亲情牌总是有效
329,岁月神偷,3,"小男孩好可爱
"
330,岁月神偷,3,煽情有点刻意。。。好多镜头跑焦了
331,岁月神偷,3,哭了很多次，但真的不算好
332,岁月神偷,3,]X得多好看。。。
333,岁月神偷,3,这部电影好做作，故意煽情，看时鸡皮疙瘩一阵接着一阵狂起。要描绘小人物，比月满轩尼诗差。
334,岁月神偷,3,经历过真正痛彻心扉的生离死别后我对任何温情片都免疫了 呵呵 不过 看到维多利亚湾时我想念香港了
335,岁月神偷,3,结局也太惨了，吴君如和任达华的夫妻戏份实在太少了！！小弟演的很自然清新~国语配音一听就是麦兜~刚开始也很麦兜的feel，渐渐归于自己的风格，比较青涩的中尾部分
336,岁月神偷,3,看完之后感觉好压抑
337,岁月神偷,3,没有传说中那么好，在同类影片中不算太出彩吧
338,岁月神偷,3,剧情并不新，但演出很感人。
339,岁月神偷,3,"吴君如一颗星，任达华一颗星，小朋友半颗星。其实是两星半。
其他，不予评论。"
340,岁月神偷,3,严重被高估的电影，无论是表演还是亲情的表达，情节更是语无伦次，没有共鸣，我不是香港人。看在大家交口称赞的面子上给三星。
341,岁月神偷,3,近几年港片里不容易了
342,岁月神偷,3,最佳编剧？？！
343,岁月神偷,3,虽然我觉得这部片子很不错，可差推荐总是少了一点啥，可能我要求比较高，虽然我知道立意深刻，只是他不是我那杯茶，我觉得吴君如在里面的演技出乎我意外的好，题外话进一得扮演者长的真像王力宏额。邮寄的那个护士小姐的刻薄~当时医疗行业的黑心
344,岁月神偷,3,期望值太高？
345,岁月神偷,3,比《我们天上见》的情况要好点，但是仍然“勉为其难称其为电影”。任达华这样也能拿金像影帝，完全是香港人在自嗨。
346,岁月神偷,3,在幻变的生命里，岁月，原是最大的小偷。还剩下些什么。。。
347,岁月神偷,3,一步难 一步佳。看电影和做人一样 以后都不要太挑剔就好了么。忘掉软肋只顾情怀……
348,岁月神偷,3,岁月如飞刀 它刀刀催人老
349,岁月神偷,3,不喜欢港式温情的调调，有点为了温情而温情的意思~
350,岁月神偷,3,进二哭起来像猫叫
351,岁月神偷,3,岁月就是一个小偷，偷走我们的生命，而且悄无声息。
352,岁月神偷,3,有那么好看吗
353,岁月神偷,3,好...不^里面f城市Feel缀...
354,岁月神偷,3,不能因为悲情而影响对影片的客观评价
355,岁月神偷,3,俗獾墓适]人不喜g。xx你最後把所有|西都GM苦海。
356,岁月神偷,3,金像奖影帝应颁给“细佬”，任达华凭此片夺奖是过誉了。
357,岁月神偷,3,天呐，两个月，我居然开始喜欢听那种甜腻的声音。。。。。。
358,岁月神偷,3,原声带很好
359,岁月神偷,3,有温情的心，但是拍摄水准就跟普通的社会纪实新闻一样。对于一个真正的草根人民，这片子没有任何值得我掉泪的地方，它所投射的现实生活的影子太浅甚至太脸谱化。
360,岁月神偷,3,盛名之下，很是失望，拿奖没问题，问题在香港的电影没什么救了。三星。二星给小孩的，自然纯真。如果这片要出一个影帝的话，最佳男主角应该是这小孩了。一星是给刻板的煽情+刻意的符号化+单薄的剧情大杂烩所引起一众无谓的追捧。
361,岁月神偷,3,名不副实
362,岁月神偷,3,过于矫情了
363,岁月神偷,3,除了几个点感动了一下外 这个片不是我的菜...
364,岁月神偷,3,怎么多好评，让我说什么好
365,岁月神偷,3,"煽死我了,越往后越狗血.我等被韩剧虐大的人不流泪对不起导演。 两星半拉"
366,岁月神偷,3,简单细腻，几度看到眼眶湿润。
367,岁月神偷,3,只有在香港生活过的人才能有共鸣r(st)q 
368,岁月神偷,3,过于煽情了，手法太明显。应该是属于香港那一代人的集体记忆吧，所以自己没多大感触。里面的歌还挺好听。
369,岁月神偷,3,"感觉上没有四星那么好 不过夜不错了 罗进二非常可爱
"
370,岁月神偷,3,温馨平淡中又幸福美满。
371,岁月神偷,3,很一般啊
372,岁月神偷,3,个人觉得很一般
373,岁月神偷,3,1969太空漫游...哪儿跟哪儿啊~~勉强给了3星，实际上也就一个2星水准，要不是小演员的可爱，肯定直接降星（跟非常主播一个档次）。没看到一点感动，作为个MV的话还算勉强精美。韩剧三合板的生硬故事架构搭起的香港老背景，弱不经看。用给C说的是：即使是粤语的又能好到哪儿去呢？！
374,岁月神偷,3,吴君如提着香港60年代的双黄莲蓉月饼出现时，老公愤怒地大喊：“法克！90年代我们还吃红绿丝儿呢！”
375,岁月神偷,3,这和海角七号式的煽情有雷同，有着香港人特有的文化符号。可在和谐的天朝我怎么感觉此片进京看病有讨好大陆之嫌？此外哥哥的病与社会变迁联系不够紧密，反而与少女式幻想偶像剧有的一拼。此片全部的戏都在罗进二身上，自然、纯真、毫无造作。他是麦兜，也是一一。
376,岁月神偷,3,@星美。没有传说中那么好。港版的活着，不过感觉只拍了一半。导演拍得太刻意太用力了，不够自然。镜头语言交待得太生硬，很多暗示太过于露骨，好像生怕观众看不懂似的。到最后也没明白导演的意图。每个人物都有一笔，但都不深入。音乐还可以。任达华、吴君如和小演员的表演没话说。也许粤语版会更好些
377,岁月神偷,3,我不爱煽情 因为他们永远如此无力 还不如看励志来的过瘾 让勇者前行  能永远像小儿子那样 吗   为什么 为什么
378,岁月神偷,3,此男要红 以上- =
379,岁月神偷,3,就那样吧，没觉得多好，分三次才看完。怀旧地方志这种体裁最优是三丁目的夕阳。
380,岁月神偷,3,看这片基本没哭，可能是因为我觉得进一实在是做作的厉害，芳菲也是，长得也不好看。那种旧时代的建筑街道仿制的厉害就明显看出是临时搭建的。不过任达华演的真的很好，吴君如不演那种傻兮兮的片子也挺好的。小男孩很可爱，我觉得演的很不错。其实想要说明的就是岁月，岁月走了，偷去了心爱的一切。
381,岁月神偷,3,演员很好，配乐很好，其他很很很一般。
382,岁月神偷,3,细佬啊，呢个世界哩，S系永远有效噶……卖的是港人情怀，只是煽情与滥情往往只有一线之隔，人物与剧情设置仍略显做作。片尾曲《岁月轻狂》真好听……
383,岁月神偷,3,我受不了这种苦海无边的电影……怎么原谅别人和原谅自己就那么难呢？还有那配音我也受不了……
384,岁月神偷,3,没共鸣，快睡着了。
385,岁月神偷,3,所谓苦难，有点假。一些小细节：苦海弃珍，岁月神偷，半难半佳，总要有信。
386,岁月神偷,3,只能说故事不是很煽情.显得平淡了很多.
387,岁月神偷,3,我草，普通话配音听得我想哭，平翘舌学好再来搞事业好不
388,岁月神偷,3,基调是合胃口的平淡，怀旧情怀浓重，又不拖沓。。。任帮吴的演技真的不错，那位小朋友也真的很棒。。。
389,岁月神偷,3,温柔的.
390,岁月神偷,3,到影最後我只是在心]了哥哥]了爸爸但主人公上了和哥哥一所的W校，孤汗涯冈貅嶂WM跟生活
391,岁月神偷,3,除了小孩跟爹。。。别的人都蛮做作的
392,岁月神偷,3,"温情港片.
很就像老港正传一样.
也只有中国人才懂的温情片.

男主角很像王力宏."
393,岁月神偷,3,拍的好像台湾电影。其实是3.5星吧。瞄准哭点。不得不买账。其实几场嚎啕哭戏还没有老爹埋头做鞋来的触动。吴君如很好。那首“柔风吹过玫瑰”的歌大好。总体远不如天水围
394,岁月神偷,3,三星半吧
395,岁月神偷,3,蔡颖恩
396,岁月神偷,3,c解我未X得有名在外那般好。
397,岁月神偷,3,用力太猛，拿得起放不下，十分考验坚强度。剧本无需过度解读，大多数都是意在擦边球而已，对时代和政治的把握类似于<我们天上见>。在吴君如握住任达华缺少戒指的手时被煽中，差点落泪。两段爱情恰恰形成对比，经得起岁月挖角才能真正打动人。最直接的感受是，不像港片。
398,岁月神偷,3,人生苦海，结束了一段，另一段也会来临。
399,岁月神偷,3,对这个港式的怀旧，兴趣不大
400,岁月神偷,2,"我们的眼泪到底有多廉价？
"
401,岁月神偷,1,谁想到这么狗血。。。有种不停听人讲道理的感觉
402,岁月神偷,2,情也不能往死里煽啊
403,岁月神偷,2,勒紧的戒指印，同埋有血痕的老豆既手
404,岁月神偷,1,充斥的陈词滥调和各种技术失误就不提了，咱能不用慢动作来拍俩人的对话么？
405,岁月神偷,2,不见岁月只见偷…虽然拍出了老港味儿，但有些个煽情的地方显得刻意了，比如多次出现音乐、慢镜的眼神交流。这条国配很矫情，尤其是那个芳菲。小弟演得不错，脑袋上的玻璃缸就是他要当太空人的梦想吧，也是个鱼眼镜头看香港。
406,岁月神偷,1,恶俗、狗血、虚伪、矫情。
407,岁月神偷,2,"除了金鱼和鱼缸(鱼眼镜头=回忆视角表征)意象的运用及前半段对老香港的描摹,简直一无是处。你能猜到几乎每一步烂俗的情节,生硬不合理的除外(去北京看病和结尾扔米字旗)。滥用慢镜头和煽情音乐,摄影乱七八糟,刻意肤浅的说教性台词。拍绝症近年来较好的是[阳光姐妹淘][我和厄尔及将死的女孩]。（5.0/10）"
408,岁月神偷,2,这是韩剧的结尾，不喜欢
409,岁月神偷,2,"作为一个大陆人,没有香港的底子,看不出香港的味."
410,岁月神偷,2,难道是我怎么了？
411,岁月神偷,2,"期望太大了,这样的结局不是我喜欢的."
412,岁月神偷,1,一星给吴君如 半星给哭小弟
413,岁月神偷,2,神偷不q月
414,岁月神偷,2,不想打高分来表示我很懂香港。
415,岁月神偷,2,一个白血病人的悲情故事。为了笑而笑，为了哭而哭，浅薄的煽情，许鞍华大失水准
416,岁月神偷,2,感觉又一部被评分骗的电影。真的没看出那点感动的。剧情唐突，主题不鲜明。这名字是嘲讽还是寓意，真没分出来。《一一》给我印象太深刻，类型有点像，但功力不如其五分之一。任达华的表演倒是很棒，真没认出来。 
417,岁月神偷,2,一星给主题曲，一星给片名。实话我真的抱着会被感动的触觉，而一直没有敢看，有点失望了。纯粹就是一种煽情的教育片，岁月二字和出，偷字更是无从入手。
418,岁月神偷,2,北京闹文革呢，还去那看病？！严重不符现实，这片真是回归后的产物！
419,岁月神偷,2,任达华的演技不给力啊。
420,岁月神偷,2,原来这种韩剧情节真能拍成电影
421,岁月神偷,2,没有吴君如的话，这个片子就差不多是个风光片了吧。。。
422,岁月神偷,2,忆苦思甜啊，咋分那么高？所谓精英水平不过尔尔，有啥可无病呻吟的？
