,movie,star,comment
449,我是山姆,2,“在星巴克工作的山姆（西恩61潘 Sean Penn 饰），虽已成人，但智力水平只有7岁。一次偶然，他收留了一个流浪女。该女子帮山姆生下了一个女儿后消失得无影无踪。”虽然是感动片，但从理性角度来说，有缺陷的人确实需要立法禁止生育，不可能每个人都能运气那么好，调动那么多社会资源，等人大发慈悲……没有开始，就没有悲剧。
450,我是山姆,2,真心想说  好煎熬啊。。能快进着看完已经是不错了  看着演员扮着弱智吐着囫囵的口音  就是好纠结啊 侮辱情商啊
451,我是山姆,2,"说实话，由于男主的智力水平严重不足，情绪不稳定，根本没有能力独自将女儿抚养到七岁，还能让她那么心智健全。太多人打高分，声称爱比智商更重要，他们其实忽略了一个重要事实，就是爱的能力需要正常水平的智商做基础。他们羡慕山姆有这这样一个“早熟”的女儿，实际上是期待自己被救赎。一个自己不需要付出就能得到救赎的美梦。但这是不可能的。演员作为一个正常人只演出了智力缺陷人士的一半不正常，相比之下还是《怦然心动》中对女主父亲的低智兄弟刻画更加真实。
实在看不下去了。这个故事纵然感人，也是建立在一个动听的谎话之上。"
452,我是山姆,1,过分滥情了，且不符合逻辑
453,我是山姆,2,不好看，拍的一般，但如果是正常的智障鸡汤片我会给3星，可是智障哥居然没有选主动示爱的律师大人，相中了人家的老婆小女孩的寄养妈妈，这我就不能忍了。感觉全片最出彩就是律师大人了，另外小女孩台词太成熟了，没有儿童的那种天真可爱
454,我是山姆,2,All I need is love
455,我是山姆,2,不喜欢这样的套路，我也不想变成挑剔的刻薄的人，可是它真的不够真诚
456,我是山姆,2,"看不下去了，02年的达科塔范宁才几岁？小姑娘长的那么讨人喜欢却丝毫不见童真。我怎么就这么不待见这种装出来的早熟儿童涅？
ps.怎么看都觉得这片子是在致敬披头四"
457,我是山姆,2,nothing
458,我是山姆,1,为毛评分这么高。太尼玛智障了！
459,我是山姆,2,无感。怎么能拍成这样呢。小女孩未免太早熟
460,我是山姆,2,演员没毛病 但是戳不到我泪点 可能是因为演的低智商隔着语言文化的那一层 感受打了很大折扣
461,我是山姆,2,好的电影要让人忘记这是电影，小女孩过分的成熟是演技。看了21分钟看不下去了
462,我是山姆,2,老套，可西恩演的不赖
463,我是山姆,2,西恩潘的演技总给我一种浮夸的感觉，不如汤姆汉克斯真诚，虽然我能看出他很用力。编剧很松散且充满套路，为了煽情而煽情实在令我感到不舒服
464,我是山姆,1,太多自以为是 用他们的标准评判他人
465,我是山姆,2,一直在盘里存着，终于给看了，真没觉得有多好，很普通的剧情。分这么高，那我拉一下好了。2017-9-16 18:50:36
466,我是山姆,1,瞎编的，编得非常非常弱智，造假骗泪，就那套路。很烦人。
467,我是山姆,1,"父爱，冗长，剥削。
手持摄影？有必要96
几乎是最痛苦的一次观影体验，搞一堆残障人士做主角，导演是什么心态？以残障人士博取观众的同情心，剥削电影美学，还是最恶心无耻的那种，看到一堆残障人士聚在一起，我又想同情，又对电影本身感到恶心。
做作到了家...
"
468,我是山姆,2,这样的父亲养不出这样的女儿 他只是个7岁的孩子
469,我是山姆,2,因为得奖了才看的~对不起了只有两颗星星~
470,我是山姆,2,为了披头士的几首歌而看，大失所望。中规中矩，叙事无趣，套路的温情牌这年头再看真是不新鲜，不懂大家泪点在哪。为西恩潘出神入化的演技加一星
471,我是山姆,2,问题很多 影片的立足点和逻辑要先搞清楚了再呈现给观众
472,我是山姆,1,"It's a difficult issue, one that is not well served by a hollow confection like I Am Sam."
473,我是山姆,2,"The score is a bit too high.
The whole film didn't seem to be touched at all.
I just want to know how seven-year-old IQ actually makes a woman pregnant."
474,我是山姆,2,不喜欢看傻子
475,我是山姆,1,有这个女孩的电影都极难看
476,我是山姆,2,这位导演。您真是差到家了。
477,我是山姆,2,巨讨厌里面的小姑娘，怎么会有这么让人措气的萝莉。。
478,我是山姆,1,Sam说我有时比你们聪明，是的，他看起来很奇怪，Lucy看起来只是小孩子，可是他们真的很聪明，他们知道什么是真的爱。Sam的朋友都看起来很奇怪，每一个都有自己的原则，这么坚持自己所坚持的这不是很好吗？以世俗定义看起来很成功的lawyer，其实很压抑，很不幸福。人永远不满意，不管自己拥有多少。所以啊，幸不幸福，it's all up to yourself.Sam其实比谁都聪明。
479,我是山姆,1,看到后面，感觉很冗长
480,我是山姆,2,全程尴尬病发…看来我对某影帝的偏见真是深入骨髓了
481,我是山姆,2,我竟然不喜欢。。因为。里面有小孩。。大人也像小孩。。。。
482,我是山姆,2,剧情拖沓  主线混乱  男主欠打
483,我是山姆,1,受不了演的那个讨打的傻B!
484,我是山姆,2,可能是比较冷血吧，对那些表现the mentally challenged自强不息/爱的伟大的影片，一向无感（阿甘除外。
485,我是山姆,1,煽情煽得我恶心。
486,我是山姆,2,童星演的太假
487,我是山姆,2,还不如韩国 七号房的礼物
488,我是山姆,1,很抱歉，get不到剧本的点子
489,我是山姆,1,家庭片分总是虚高，脸谱化严重，剧情不通，人设不通，音乐不错。
490,我是山姆,2,浪费我两个小时看了个迷之没有重点情感走向微微令人觉得有些不自在甚至恶心的电影。。请问大家的泪点在哪
491,我是山姆,2,泪点为零。
492,我是山姆,2,浪费演员瓦 
493,我是山姆,2,一位智力障碍的父亲如何可以很好的抚养一个女孩，用爱就能发电吗，他甚至不会点餐、不会付钱、做不好咖啡、只会读一本书。生日会同学说女孩自己说是被这位智力障碍的父亲捡来的，说明在平时的生活中已经产生了诸多智力差距带来的不适。为什么周围的人连专业的律师都跟着瞎起哄，简直为了煽情而煽情。
494,我是山姆,1,法官问到山姆某个问题后补了一句why，山姆的表现如同我口语考试时考官如是问到一样哈哈哈。她不爱你，有时候问题就是这么简单，嗯。
495,我是山姆,2,一个7岁的孩子能有如此的老练 本身就是一种悲哀 感情归感情 但不是全部 看着一个孩子的眼神如此之犀利 我觉得恐怖 
496,我是山姆,2,西恩潘再强大的光芒也掩盖不住那商业目的极强的矫揉造作，太过刻意。女律师与养母的关键感情戏一滴泪都没，全片假哭太多
497,我是山姆,2,一部弱智片。毫无感动，只有智障，愚蠢。再也不说韩剧墨迹了。韩剧一点都不墨迹！
498,我是山姆,2,总感觉主人公的傻被表演地有些刻意与做作。
499,我是山姆,2,冲着little Fanning来看的。会同情但没感动
500,我是山姆,2,我怕是泪点太高 被很多人强推才看 可能期望越大失望越大吧
501,我是山姆,2,我怎么没感觉有那么好呢，一个智障把一个流浪女弄怀孕了，然后政府要收养这个孩子，智障还不同意。。
502,我是山姆,2,剧本还行，导演和剪辑不太好。全篇节奏没有呼吸感，基本都是手持摇晃镜头，又没有给休息的气口，看的十分难受，2个小时的电影，我暂停快进看了3个小时，台词有些牵强，主角表演也太过用力，观众始终无法有代入感，根本没有感受到主角对女儿坚决的不舍。2星给剧情。
503,我是山姆,2,女孩挺懂事的，全篇讲要孩子，踢完足球就结束啦？意思就是和抚养方达成协议啦040404，你养，我随时看。我期待了半天律师和山姆在一起，并没有04
504,我是山姆,2,男主演技好，套路剧情，看套路知结尾。我弱我有理呗，女律师也是很可怜。一切用爱来美化，可是爱真的最无用，什么问题的答案都能用爱来回答，可同时爱无法解决大部分问题
505,我是山姆,2,小时候的达科塔范宁好可爱
506,我是山姆,2,太过了。。。。
507,我是山姆,1,以为是上世纪80年代的片子。。。看了35分钟，忍不了了
508,我是山姆,1,在不想看似的×
509,我是山姆,2,觉得不够真诚
510,我是山姆,2,好烦
511,我是山姆,2,有啥好看的.. - -# 豆瓣前250 徒有虚名呀..
512,我是山姆,2,男主和女律师感情线略尬。小女孩一句“All I need is love.”瞬间泪目。众所周知，智力水平和爱一个人的能力没有任何关联。全片都是鸡汤电影普通桥段。
513,我是山姆,1,终于知道叫什么了，大学时期老师课堂上看到的最乏味的电影，难怪热带惊雷有恶搞。
514,我是山姆,2,镜头太晃了很烦，本了看低能儿说的话就累，简单的剧情弄太长了就更无聊了，看了一个小时很不舒服了，直接X了没意思。
515,我是山姆,2,没意思
516,我是山姆,2,一开始被那女孩感动到，特别是她对她爸爸说“it is okay..”那段。感觉片子后半段一直想故意弄的很煽情，但不知道为什么根本就没有被感动到。有点做作。
517,我是山姆,2,毫无泪点，莫名其妙
518,我是山姆,2,呵呵，政治正确，love 能当饭吃么，控方律师问的问题都很实际
519,我是山姆,2,我看到院前种了许多花，所以收起了手里多余的那一束。
520,我是山姆,2,我老觉得很久之前看过一次。非常讨厌这样的故事，没有就是没有，爱根本就不是万能的。
521,我是山姆,1,太拖拉了 我没看完 sorry
522,我是山姆,2,大闷片，真的看不下去
523,我是山姆,2,不管多感人，畸形就是畸形。
524,我是山姆,1,实在看不下去了
525,我是山姆,2,表演确实可以，但故事平庸，镜头太晃，而且儿保协会是对的。
526,我是山姆,2,John Lennon在英美地位这么高？
527,我是山姆,2,量身打造追逐影帝之作。
528,我是山姆,2,看到一半...放弃...
529,我是山姆,2,西恩潘演的傻子没啥说服力 剧情拖沓到让人不耐
530,我是山姆,2,没看完 看着有点吃不下饭 不知道为什么
531,我是山姆,2,应该叫山姆律师，打官司的部分有点多了！情节拖沓了，故事性行进缓慢，容易疲劳！
532,我是山姆,2,看不下去
533,我是山姆,2,电影冗长拖沓，杂乱无章！导演掌控这种轻喜剧，偏温情的电影火候还未到！
534,我是山姆,1,不好意思，只坚持了6分28秒。看了看低分评论，可以心安地看下一部片子了90
535,我是山姆,1,镜头非要晃得这种所谓的即时感，可是剧情却假的让人出戏
536,我是山姆,2,情节拖沓，只有煽情没有理性，唯一的亮点是小范宁。
537,我是山姆,2,"expected more.
配角演技堪忧。。
2.5"
538,我是山姆,2,对不起 没感觉  开头摇的我头晕
539,我是山姆,2,再一次证明爱在任何人身上都适用~
540,我是山姆,1,傻子怎么生出的孩子。啪啪啪无师自通吗。太扯了。
541,我是山姆,1,小女孩很可爱，男主声音不好听，不需要智商的执着
542,我是山姆,2,      叙事节奏乱，剧情推进不够合理，逻辑不结实。人设不够好，几个人物形象都脱跳尤其小女主，豆瓣的评分这么高，难道我看得是删减版？
543,我是山姆,2,哭点在哪里，而且女孩好过于早睡啊……
544,我是山姆,2,这部片子被过高赞誉了
545,我是山姆,1,剧本平凡愚笨，情节拖沓冗长。
546,我是山姆,1,“不管他是谁，他是我爸爸”的父爱如山，还用你来编个这么离谱的故事来说？？其他的都扯了些啥？？不要给我塞“糖里有毒”的童话故事了，谢谢。
547,我是山姆,2,感觉没意思，难道是因为我之前看了七号房的礼物？
548,我是山姆,1,西恩潘在演戏
549,我是山姆,1,坏人永远是有色人种，我去你码的。
550,我是山姆,2,装二的二片
551,我是山姆,2,为何豆瓣评分这么高，我觉得还行
552,我是山姆,2,西恩潘的演技让人头皮发麻，小闺女已成精。
553,我是山姆,1,"看了一半,,很慢"
554,我是山姆,2,有点傻。
555,我是山姆,2,无语。爱并不能解决一切
556,我是山姆,2,分高了 电影很喜欢
557,我是山姆,1,歪果仁都好闲啊，一堆人陪一个傻子玩...没觉得多感人，觉得男主从头到尾都在给人添乱……
558,我是山姆,2,滥情，假
559,我是山姆,2,太拖沓了，我看到15min的时候就在纳闷之后还能拍什么？
560,我是山姆,1,"看着真是毫无感觉
但小萝莉是真的好看"
561,我是山姆,2,没有找到泪点，甚至有时候看得有点捉急
562,我是山姆,2,太做作。男主的“表演”痕迹太重。
563,我是山姆,2,无感。。。
564,我是山姆,2,"现实是一位年轻有能力的美女律师是绝对不会喜欢上个""大龄儿童"""
565,我是山姆,2,剧情很一般
566,我是山姆,2,居然没被cue到98
567,我是山姆,2,类型不合口味
568,我是山姆,3,结构也太散乱了吧...多一颗星给西恩潘的演技
569,我是山姆,2,温情感人的故事，喜欢范宁的表演，天真无邪的笑容太甜了。
570,我是山姆,1,我爹妈连傻子都不如吗？
571,我是山姆,1,我是来拉低分数的，不应该这么高分
572,我是山姆,2,"对比起《七号房的礼物》泪点不是那么多
对比起《天才少女》小演员的演技又差了那么一点"
573,我是山姆,2,没被打动到诶…但是演技很好
574,我是山姆,2,“爱的能力并不取决智商的高低。”
575,我是山姆,2,我说我最讨厌演成这样的“煽情”电影你们信么。。。
576,我是山姆,2,几次想要放弃，真的有点看不下去，不感人，太主观。有可能我预期太高，看完雨人再看这个，这个差好多啊，
577,我是山姆,2,这样的撩不到我
578,我是山姆,2,看了40分钟，觉得真没必要拍成一部两个多小时的影片，剧情拖沓严重。而且我个人不喜欢在同一画面的长短镜头转换。而且看西恩潘的山姆总让我想起汤姆汉克斯的阿甘，觉得西恩潘表演的一般，其他角色也很做作。赶紧看会伍迪艾伦休闲一下。
579,我是山姆,2,看的很难受 
580,我是山姆,1,拉下250。
581,我是山姆,1,弱智片子
582,我是山姆,2,逻辑混乱，人物感情没有进阶，不怎么样
583,我是山姆,2,已阅无感
584,我是山姆,1,哭个吊哦
585,我是山姆,1,一般，没什么感觉
586,我是山姆,2,范宁小时候就这么会演戏了，前途无量啊……--
587,我是山姆,2,并不好看，太不适合西恩潘了
588,我是山姆,2,讨厌这种类型的片
589,我是山姆,2,好假，人老了不相信这种鸡汤故事了
590,我是山姆,2,律师是不是和sam发生什么了。。。
591,我是山姆,2,一颗给Sean的演技，一颗给有趣的七岁的思辨题材。
592,我是山姆,1,"原可以被这个世界温柔以待




“爱是一种能力，有些人有，有些人没有，有这种能力的人是幸福的，可以感受爱并给予爱。”"
593,我是山姆,2,小女孩好可爱，题材也不错，但总觉得这个电影哪里出了问题，或许是导演？现在我还不懂，等我以后好好认识一下电影可能就明白了。
594,我是山姆,1,D
595,我是山姆,2,西恩潘模仿霍夫曼真的不大行诶。
596,我是山姆,2,完全不共情
597,我是山姆,2,是我看不懂吗？？？？？？
598,我是山姆,2,刻意的感动并不感人
599,我是山姆,2,Sean Penn最帅的是在情迷佛罗伦萨中。
