,movie,star,comment
284,我是山姆,3,没有哭，不过达科塔・范宁 真心灵气
285,我是山姆,3,片子不错  但这分是不是太高了  IMDB7.6
286,我是山姆,3,一个只有七岁智商的爸爸如何争取抚养女儿的权利，如何努力成为好爸爸的故事。但是不是有点虚了？
287,我是山姆,3,弱智父亲争取抚养权的故事，挺平静挺简单的片子。不过我想说点不一样的，抚养子女确实不需要智商，除了需要爱，更需要品格。这些年，遇到很多人渣败类，我就想他们的父母是不是人品拙劣，内心恶毒的人呢？在看到身边很多品行不过关的人，他们生下的熊孩子，缺乏家教，没礼貌没素质，到了别人家跟土匪似的打砸抢，似乎印证了我的观点。
288,我是山姆,3,剧情拖沓了点，但是不失为一部好电影~达奎塔范宁小时候真是个萌物呀
289,我是山姆,3,The Beatles and nothing.
290,我是山姆,3,自然而然地想起雨人和阿甘。演员演得都太用力了。人物形象很单薄情节设置经不起推敲。
291,我是山姆,3,我觉得...我没有被感动啊，而且有时候看着山姆讲话做事挺烦的。大概是对于智障我不怎么能理解他吧。小女孩很可爱，声音也很萌。
292,我是山姆,3,还行吧，泪点真的没觉得，只是全程都觉得这孩子的教育问题确实值得商榷，特纳辩护的角度没有问题，为了孩子健康成长，被一个健全的家庭收养确实比较合理吧。再说女律师和Sam的感情火花有点猎奇。这片子的演员都不错，男演员演技太棒了，真的不像演的，太真实了。Lucy这个小演员也很绝，太有灵气了。女律师气质超群啊，很喜欢。
293,我是山姆,3,看到剧终导演名字出现时才意识到问题所在。近期碰巧连续看了几部女性导演的电影，她们的共同特点是，在努力构筑其感性的世界观的过程中，不知不觉间把事儿说露骨了。
294,我是山姆,3,导演敢不敢把故事讲明白
295,我是山姆,3,故事不错，也是属于直接催泪型的。不过结局还是中国式的。喜欢看律师心理变化的戏，达科塔范宁那时候还好萌！有点向《克莱默夫妇》和甲壳虫致敬的感觉，里面的台词设计不错。
296,我是山姆,3,Sean Penn 的演技没话说。但整部戏没给我太深刻的感觉。
297,我是山姆,3,"治愈系里最没感觉的一部了，拖沓了点，该表现的地方没有表现好，总觉得这样的责任让孩子去承担有些沉重
"
298,我是山姆,3,范宁真的太灵了。竟然发现Michelle在干哭。Sean的表演一向让我无甚感觉
299,我是山姆,3,Love的年龄限制，智商限制，时间限制``她退下来，摸不清自己在做什么。
300,我是山姆,3,果然说的没错，豆瓣是爱与艺术的世界，换句话便是文艺矫情地盘。250也名存实亡，长时间的不更新，近乎偏颇的排名。虐心，真正让我不懂的是，为何在孩子的问题上，孩子却没有丝毫的话语权。
301,我是山姆,3,sean有点做作了（纯属个人的BT看法）
302,我是山姆,3,小姑娘超可爱的，故事也一般么
303,我是山姆,3,abbey road的致敬画面出现时被感动到， 中间泪点不少。这类题材“智障伦理片”的故事真是挖掘不尽啊，这次又带上甲壳虫一块上。
304,我是山姆,3,挺好的一个题材给拍成这样了，情节时而拖沓，时而用力过猛，让人看着很不舒服，角色的塑造也不算成功，倒是Sam的那帮朋友挺有意思。
305,我是山姆,3," Sean Penn很牛/Dakota Fanning 很灵/ Michelle Pfeiffer很气质,but仅此而已了..."
306,我是山姆,3,把一部童话拍的很像一部童话的片子
307,我是山姆,3,其实没有想象的好看=。=因为……我看得不是很明白・・・但似乎还算感人吧・・・
308,我是山姆,3,"达科特范宁也长成大姑娘了啊...
笑起来真好看"
309,我是山姆,3,"范宁小时候真是天使啊 父女情很感动 不同于母亲的爱 况且还是个“不一样的爸爸"" 爱是不会少的"
310,我是山姆,3,不喜欢西恩潘但看的还是很感动  导演真是披头士+星巴克骨灰粉
311,我是山姆,3,西恩潘的演技很一般啊……范宁有型到爆！
312,我是山姆,3,这种类型题材的电影看多了，会造成审美疲劳，基本上，反复无常的法庭戏和那些若隐若现的爱，没有惊喜，也无所谓精彩。
313,我是山姆,3,看得眼泪花花的，文艺范啊
314,我是山姆,3,我知道故事是挺感人的，西恩潘和小童星的演技也实在出色，题材也选择得非常不错，可是可是，就是太过煽情了！其实是小女主成就了山姆的。
315,我是山姆,3,潘的演技明显抄袭达斯汀霍夫曼。剧情造作了，但是范宁很惊艳。
316,我是山姆,3,我tm又冷血了..
317,我是山姆,3,我确信这是一部感人的电影，我确信sean penn的表演是有功力的。但为什么我觉得看起来觉得很难受，很讨厌看到他在里面扮retard的样子。weird!
318,我是山姆,3,萌萌哒达科塔・范宁 - 好故事好演员但是差些什么。镜头晃呀晃。情感处理不够。相比《雨人》和《房间》。
319,我是山姆,3,没看下去。。。
320,我是山姆,3,萌萌哒达科塔・范宁 - 好故事好演员但是差些什么。镜头晃呀晃。情感处理不够。相比《雨人》和《房间》。
321,我是山姆,3,豆瓣打脸进行时，《我是山姆》MTC28，《迫在眉睫》MTC30，《大卫戈尔的一生》MTC31，《心灵点滴》25
322,我是山姆,3,不是催人泪下就一定是好片・・・・・・
323,我是山姆,3,煽情的一逼 就是不给丫五星 气死你
324,我是山姆,3,喜欢前半段，尤其小婴儿长成小姑娘的那段，满满的感动和温情，再往后剧情拖沓，虽然是有催泪点的，但是不知道为啥没被打动。
325,我是山姆,3,fanning美的不行，但显得很太成熟了。这片子遇到“反对驳回有效”的法庭后就无药可救了。
326,我是山姆,3,压抑。喜欢达寇塔范宁和米歇尔菲弗。
327,我是山姆,3,少了点什么。演员很棒。
328,我是山姆,3,sean penn很害
329,我是山姆,3,范宁真是太可爱了~不过如果不是老师在班上放的话，这种片子一个人应该看不下去吧~
330,我是山姆,3,小女孩非常漂亮，男主演技很好，但把一个残酷的现实题材拍得这么温情，真的好吗？犹如法庭上辩论的双方，全片都是好人，尽管做法不同，但目标都是为了女孩能更好的成长。这本是一场没有结果的讨论，但片中取向明显，以爱为名，就像画面一闪女孩就6岁一样，太多的困难都被一笔带过，真的只剩下感动了。
331,我是山姆,3,不是特别中意，因为巨烦Dakota Fanning，太烦她了！！！sean和Michelle倒是可以的，剧情也不很喜欢，灵性不够。
332,我是山姆,3,挺感人的――小女孩好好。
333,我是山姆,3,为什么要致敬beatles这么多次
334,我是山姆,3,催泪弹。get to me so bad.也许有些是我所不能理解的。太催泪了。。我不会推荐给别人看的。
335,我是山姆,3,因为一直以来的高分系数很期待，却失望了，小女孩真真可爱，可是影片重点跑偏了父女情，集中在了残障人士权利上
336,我是山姆,3,小时候的fanning这么可爱。。。
337,我是山姆,3,Dakota Fanning太可爱了。
338,我是山姆,3,小女孩前途光明。
339,我是山姆,3,"很喜欢dakota fanning~~~~
这才叫童星！"
340,我是山姆,3,有点受不了这种精心包装的传输主流价值观片子，太讨好观众太甜，人物脸谱化符号化，虽然范宁演的很好，导演是有多喜欢披头士
341,我是山姆,3,大概是最近看的好电影太多了，，，，一点也没被感动到
342,我是山姆,3,sean还是适合演老混混，傻瓜要清纯，他不够
343,我是山姆,3,2小时多。略假。略主旋律。免费律师包赢百案。养母抱回小女孩说，我实现不了对法官讲的我会给她需要的全部爱。打官司抢扶养权想起小爸爸。哄。爱是耐心。是陪伴。
344,我是山姆,3,小女孩的表演真棒
345,我是山姆,3,导演和摄像这种镜头的运用是要把我们都变成sam吗！
346,我是山姆,3,爸爸。最简单温暖的词汇。
347,我是山姆,3,为什么觉着西恩潘演的没hoffman或hanks的好。菲佛的小身板啊，太性感了
348,我是山姆,3,色彩太纷乱了，Sean有些过于卖傻，不合我口味。可……重要的是小loli的存在啊……！
349,我是山姆,3,达科塔范宁太萌了，想想现在长残的她，杀猪刀啊。。。
350,我是山姆,3,我现在泪点怎么这么高，完全没被感动到。倒是他们拿着气球过人行道的时候有那么一点小激动，三秒过后，又平静了。
351,我是山姆,3,好感人。。。。。
352,我是山姆,3,看过第八日的乔治，山姆就显得过于做作。剧情老套，失望。
353,我是山姆,3,“爱，要有忍耐和仁慈，永远没有妒忌，爱，就永远不要自负，不要无理和自私，不要侵犯和愤怒，爱，使你不会因别人的过失而不快，但会因为真相而喜悦，要永远准备着去原谅、去信任、去希望、还有，去忍耐，无论世事变迁”
354,我是山姆,3,开始总是感觉Sean Penn表演过度，可能没见过他这样子。此片轻巧的感情触动点挺多的。
355,我是山姆,3,现实冷漠的office lady米歇尔出来的时候拯救了片子开始的虚假美好，但随着她对山姆感情的沦陷直至最终的开放结局，都使这部片子只能沦为妈妈再爱我一次的傻哭型电影。
356,我是山姆,3,导演可以在Lucy成长过程中和把拔的互动上多着笔墨。这小女孩真是太太太萌了吧！！
357,我是山姆,3,她的眼睛会说话
358,我是山姆,3,用我五岁的听力看智商七岁的sam带心理年龄二十岁的闺女
359,我是山姆,3,"摄像机晃啊晃的也没给故事增加一点真实感，全靠演员煽情，靠beatles撑场么
"
360,我是山姆,3,太扯了剧情，难道美国的人道主义就是活生生拆散一对父女。
361,我是山姆,3,哭啊哭啊。。想到自己的父母 我或许还没有片里的那个小女孩那么好吧、父母给了我那么好的条件 而我的种种所作所为。。想到这儿 我便觉得。。我还要成长
362,我是山姆,3,没有想象中的那么的感人
363,我是山姆,3,6/10。法庭没有关注孩子的基本需求是主要冲突，山姆带给女律师的救赎关系则印证了他具有教育儿童人格健全的能力。片中有许多趣味性的符号，如披头士的歌曲象征不能拆散的爱，气球和千纸鹤则暗示爱的表达，当山姆的朋友们筹钱给露西买一双鞋后一起牵着橙色气球过马路，而社工要带走露西，露西逃跑时手中的气球飘飞，气球的象征含义鲜明地呈现。成串挂起的千纸鹤把公寓内部装饰得漂亮、温馨给露西庆生，山姆在证人席上被问到能不能给女儿更多的需要，他拍着桌子不停哭闹，桌上的千纸鹤见证了父爱的无奈，被剥夺抚养权的山姆藏进千纸鹤堆成的堡垒逃避现实。剧作中最有意思的是露西在智力上照顾山姆，他说服山姆坐公交逃去公园隐姓埋名地生活，半夜逃出寄养家庭徒步寻找山姆，比父亲行动能力更强。山姆困难地陪着露西学会念字体现了亲子关系中沟通的重要性。
364,我是山姆,3,其实题材是个好题材，也挺感人的，但是情节处理地有点儿粗糙，有点儿层次不清。看完之后，很想要个女儿。
365,我是山姆,3,演员都很棒，拍的一般般
366,我是山姆,3,Dakota Fanning小盆友真萌啊~~Sean penn大叔智障得真不稳定啊~~
367,我是山姆,3,完全无亮点　！３了beatles。。作为商业片也没有什么煽情的力度
368,我是山姆,3,哭点制造的还挺多  那也掩盖不了这片不咋地的事实
369,我是山姆,3,"一厢情愿了,回归题材说,在中国露西根本没机会改变,而此片却煽情有余理由不足"
370,我是山姆,3,扯淡的电影。另外，讨厌镜头晃来晃去。
371,我是山姆,3,难道是雨人先入为主了 所以只给了四星。但确实是一部很感人的电影。sean和小女孩演技真是不得不赞叹。
372,我是山姆,3,Lucy in the sky with diamonds
373,我是山姆,3,可爱的小范宁哦~~
374,我是山姆,3,很意外的，我没多大感觉（其实我的泪点大多都是在亲情片上），虽然还是有感动的元素存在，但观片的过程总觉得差点什么，也许是女儿和爸爸互动的戏分少了些吧
375,我是山姆,3,萌萝莉和神演技的西恩潘。
376,我是山姆,3,"太假太煽，从处于社会主义初级阶段的我们来看。他们在反思国家社会对破碎家庭小孩成长教育的干预太家长式而不够人性化，而我们的处境是压根没干预，甩锅躲得远远的。
单亲父亲智商只有七岁，在这儿他自己都早死掉了，不说政府社会扶助不够、周围人冷漠，单骗子就让他死几轮了。
智商，那冷暴力、贫穷"
377,我是山姆,3,太理想化了，不现实。
378,我是山姆,3,一些情节多少会让人感觉不舒服…范宁天生超龄旁观范，菲佛塞个棉花糖也好看，西恩・潘也不错只是有些太过用力。
379,我是山姆,3,太煽情~~我不觉得电影看多了会让人麻木，看纳德和西敏，看东京物语，总是久不能平静，甚至小武还引发泪点；而这部电影，只是不耐烦。前者是真正用心用情的电影。大概我不喜欢这样的小孩也是原因
380,我是山姆,3,用力过猛。还不错。3星半。
381,我是山姆,3,忘了是不是25小时里面的台词：“汤姆汉克斯、达斯汀霍夫曼、西恩潘都演过白痴，但惟独后者没拿到小金人，知道为什么吗？因为阿甘会长跑雨人懂数学，只有西恩是个totally fucking idiot。”
382,我是山姆,3,小姑娘很可爱，但我对这种伪大人的小孩无感。小孩子还是笨笨的更自然一些吧。
383,我是山姆,3,这么出名的一部片子看起来居然没有太大的感觉，小女孩算是没有长残，小时候太懂事了，怎么反而让我心里有点慎得慌的呢
384,我是山姆,3,西恩潘一贯浮夸的演技配合煽情的剧情，真是用力过度的典范。看在米歇尔菲佛和范宁两位美女的份上，勉强给个2.7星吧
385,我是山姆,3,看的我挺伤心。感人但是程式。
386,我是山姆,3,不能算推荐。还行。
387,我是山姆,3,across the universe在这里面格外的好听
388,我是山姆,3,sam的表达比我都好
389,我是山姆,3,P不敢想象这个就是9年前的Dakota Fanning，实属美人胚子，好嗲。Sam的故事很让人感动，当然也为这样的一个7岁智商父亲而感到骄傲，他给予了一半父母所不能给予的宽容理解。Michelle Pfeiffer又是出演一个成功女性，可是，她却在成功的路上丢失了家庭和孩子的爱。
390,我是山姆,3,西恩潘演技无可厚非，不过整部电影太矫情做作。
391,我是山姆,3,一老一小是演得真好，这特殊的“爱”确实浓又感人，不过我还是觉得这个“爱”是有点说服力不足，法院上的慷慨陈词也有点强词夺理。
392,我是山姆,3,小姑娘很萌。太煽情了有点不喜欢。
393,我是山姆,3,很感人的片子。不过不会再想看了。similar to 雨人
394,我是山姆,3,总感觉更喜欢7号房的礼物
395,我是山姆,3,理想化 生活不会如此顺利 剧情拖沓 比较失望
396,我是山姆,3,不知为毛这个小女孩我就是喜欢不起来；因为西恩・潘的表演所以给三星。
397,我是山姆,3,前半段真的非常非常好，后面过于拖沓和predictable。Dakota真是了得，Sean Penn演低智商有模有样，不过和Tom Hanks的阿甘相比，就逊色多了。
398,我是山姆,3,没有想象中的温情好看，不过金发露西真心好看，让我想起皮特家的希洛
399,我是山姆,3,被戳泪点了 电影里面的人都很善良 连地方教育官的出发点也都是好的 演员的演技也都怒赞 尤其是西恩潘 要放现实生活里他这个样子 我还真以为他是傻子呢 范宁也嫩的滴水 小姑娘那种不符合年龄的成熟劲儿总让我想到娜塔莉 但总觉得这种温情片不适合我 是好电影but not my type
400,我是山姆,2,又是呆子的故事，而且是西恩潘演的，我服了。说良心话，把小孩儿扔给一个智障养，绝对是不负责任的事情。小女孩的表演，太惊艳了。
401,我是山姆,2,导演技法相当糟糕，故事情节冗长难耐，女律师决定pro bono的直接原因竟然是来自同事的眼神刺激，而她在Sam面前大诉苦衷甚至接受“反安慰”的那场戏让人非常不舒服，再不济也是开保时捷的正常人，何德何能让一个retard同情你。影片的一大目的就是让西恩潘冲奥，西恩潘演得非常投入，足以以假乱真，导演也最大化地给予了配合，表演时刻一个接一个，但显然有些缺乏节制了，反倒过犹未及。摄影是灾难级的，运镜乱而无章令人惊愕，一些快速摇镜更是莫名其妙，通篇冷色调也无必要。达科塔范宁聪明伶俐引人瞩目
402,我是山姆,2,演技很好，不过太慢了，结尾处理得不好。“是不是记忆都藏在日光里呢？”20110102
403,我是山姆,2,lucy演得好安妮演得好Sam的朋友们演得好律师的儿子演得好法官演得好男女主角演的差女主角很像Kate Moss
404,我是山姆,2,meng~
405,我是山姆,2,争孩子那段想起刮痧来了。我真的是超级讨厌这种电影的。范宁美是美，但是不可爱；潘天真归天真，但是也不可爱。
406,我是山姆,2,"弱智教育正常人的故事。
小姑娘太象个天使。"
407,我是山姆,2,that's a wonderful choice
408,我是山姆,1,我觉得西恩潘在这部电影里的表现不算是演技，而是无聊的装疯卖傻
409,我是山姆,1,我真的是捏着鼻子看完的，虽然很喜欢西恩潘，但还是受不了臭温情。
410,我是山姆,2,"Jessie Nelson and Kristine Johnson, who co-wrote the screenplay,
researched the issues facing adults with intellectual disabilities by visiting
the non-profit organization L.A. GOAL (Greater Opportunities for the
Advanced Living). They subsequently cast two actors with disabilities,
Brad Silverman and Joe Rosenberg, in key roles."
411,我是山姆,1,片子很无聊，内容不丰富，内涵还可以就是没打动我。sean演技不错，但听他说话听的我着急
412,我是山姆,1,小女孩给人留下的印象还真的很深啊！
413,我是山姆,2,对这种流于表面过于追求效果的催泪法，完全提不起兴趣。
414,我是山姆,2,当一个电影里有一个你不喜欢的演员，你也许还可以接受，两个，那就不行了。
415,我是山姆,2,没有很感动，还是觉得如果没有能力就交给别人去养孩子比较好，只是片子里主角和女律师的暧昧有点受不了
416,我是山姆,1,受不了西恩潘演了个智障。
417,我是山姆,2,不喜欢，剧情拖沓，问题探讨不够深入，都是轻轻点水！
418,我是山姆,2,"也许本来是一部好电影，但日子过去很多。90年代的那批励志左派电影，现在看来，更多感到滥情而不是感人。不过减分的原因并不是对题材的不适应。
--
视觉方面就一招。推拉推拉，长焦怼到脸上，再拉回来再推过去。伪纪实吗？
也许是想表现和模仿主角注意力难以集中和混乱的视觉体验，但是就这一招，贯穿全剧想吃遍鲜，不太好接受。
--
有钱用的起甲壳虫的歌。好多音乐段落，一段段的全是情绪和荷尔蒙。不喜欢这种讲故事的方式。
--
想起老白的儿子。小演员和特殊演员的演技也是非常的好。"
419,我是山姆,2,不好，一点也不好
420,我是山姆,2,暴躁无常更年期律师，痴呆父亲山姆，不值得赢下官司。愿天下孩子都被温柔以待。
421,我是山姆,1,1.“阿甘”爸爸每月那点微薄收入怎么让孩子上的起那么好的学校的？2.“阿甘”爸爸是怎么学会把女儿打扮得这么漂亮的？3.晃动的镜头在这部片里真的是个减分项。4.明显有模仿《阿甘正传》的卖惨之嫌（PS：光有爱是远远不够资格扶养一个孩子的，不良的家庭教育一定会毁了孩子）
422,我是山姆,2,这是一个老故事了
423,我是山姆,1,您正目睹“无能”一词的全部涵义。论二位编导是如何把一个绝妙点子毁得体无完肤。确实有几个瞬间被打动，尽管我知道这电影是彻底虚伪的。我永远也不能忍受的一类电影。
424,我是山姆,1,煞笔片 别看 
425,我是山姆,1,美国亲情片，我讨厌这部影片，不是Sam不值得关爱，也不是父女情深不感人，而是影片传递的价值观――只要有爱可以就可以做超出自己能力范畴的事，甚至是任何事。让流浪女怀孕生子，深夜打扰邻居，朋友没有一个正常，闯别人办公室，喋喋不休的叨扰……偏执，易怒，易失控，这样的人真的可以当监护人？
426,我是山姆,2,let it be去哪了
427,我是山姆,2,装煞笔的真傻逼。
428,我是山姆,2,不能说电影不好，但是看不下去，一个可以从头猜到尾的故事，而且太多装傻和哭哭啼啼。
429,我是山姆,2,找不到感动点。
430,我是山姆,2,最近看片越来越没有耐心了，去除同情心，这种片子一无是处。
431,我是山姆,2,"反正我七岁的时候肯定不会换尿布和喂奶……The customer always right,我真特么想冲进屏幕里去揍他……最后还特么的收获了两个漂亮女律师？！（另外那个是婚姻故事里的牛逼女律师93）这片子应该去伦理大课堂讨论下。"
432,我是山姆,1,"有个电影叫《热带惊雷》。
嗯，我觉得看完那个就明白我想说什么了。"
433,我是山姆,1,讨厌这类影片    小女孩超赞
434,我是山姆,2,看得我都要喷出来了。太纠结
435,我是山姆,1,太假，还一大堆好评，真是豆瓣全是虚伪的深闺小资，没有几个真的照顾过弱智人群的，真的和弱智人群生活过再看这个电影就会知道这有多么假，典型的好莱坞假情假意报喜不报忧，连感情线都搞出来了，无语
436,我是山姆,1,只有我一个人觉得美国的寄养制度有点略奇葩吗？孩子都7岁了换家庭心理上很难接受啊。以及女律师的人物动机莫名其妙的。
437,我是山姆,2,不理解 不感动 没感觉
438,我是山姆,2,散漫无重点。毫无情节可言。我也是真不懂这片为什么能有8.8分。
439,我是山姆,2,在披头士里面我最喜欢的也是乔治哈里森
440,我是山姆,2,是有点羡慕看这个能哭出来的，说实话看到一半看不下去，7岁小孩也没有这么傻的，有个场景是在一个房间，屏幕上显示孩子被审问，然后孩子消失，山姆就贴在屏幕上说为什么没了，山姆在家也看电视，他怎么会把电视上的事认定是真的呢，假装的太明显了好不好
441,我是山姆,2,山姆的角色塑造不好 想贴近自闭但仅仅只是retarded而已 女律师间歇性的狂躁太过分出戏 整个电影没有一点节奏起伏 看得很累 fanning表现不错
442,我是山姆,2,故事方面，主角的作用不强，导致结尾无力，不知道从哪就被主角感动了，那些事件太弱了。价值观方面，这片明显是拍给中产阶级看的，而且是在消费无产阶级，里面的配角（律师，寄养母亲身份是中产阶级），通过主角（无产阶级）的事情，认识到了自己缺少爱这个事实，但是真实世界里，无产阶级比中产阶级还缺爱。这个影片，第一，满足了中产阶级内心缺爱的心理，因为片中有很多爱，智障群体+女孩全都是爱到比天堂里的天使还会爱。第二，满足了中产阶级的愧疚感，让他们以为无产阶级虽然在经济上过的不如他们，其实比中产阶级有更多的爱，他们过的一样幸福。整部影片超级甜，但是这个糖衣原子弹是带核辐射的，我吃不下。
443,我是山姆,1,低能却神性的父亲，低龄却老成的女儿，为了工作却又无理由死磕的男律师，成名已久却容易心软的女律师……一个由虚假的符号人物堆叠而成的表象世界却以极端的方式戳中亲情的泪点，又表现了些许对抗的渺小，最后归笔大团圆连法庭都省略了。
444,我是山姆,1,小女孩不喜欢感觉早熟
445,我是山姆,2,"找了6年的片子，只记得大致剧情，一直无法和片名对上号，今天终于看到了。
回忆起爸爸给我爱，无私，温情脉脉地伴随我的成长....
看了却有点失望，可能真的是期望太强烈了，结果看了半小时居然完全没有兴趣了，没有看完，人物情感过渡不足，那个小孩，演得非常成人化，觉得有点假、、、"
446,我是山姆,2,Not to my taste
447,我是山姆,2,浪费了一打好演员
448,我是山姆,2,就是loli可爱你们才觉得好看
