,movie,star,comment
147,我是山姆,4,没哭出来，不过拍得确实不错，不做作，不迎合，剧情发展合理，SeanPenn和小家伙儿都演得格外出彩儿。
148,我是山姆,4,哭啊哭啊，一直哭啊！煽情，感人到爆。不过总觉得剧情有缺陷不流畅，但是流的眼泪足矣掩盖剧情的各种不足了。3.6
149,我是山姆,5,You don't have to be smart to be a good father
150,我是山姆,5,You're my dady. I'm your daughter. And I love you.
151,我是山姆,5,影片加入了许多由当代红歌星翻唱的披头士歌曲，音画配合非常和谐。
152,我是山姆,5,感动，看完哭的稀里哗啦
153,我是山姆,5,太好看了!!..达科塔61范宁怎么会这么萌这么萌这么萌.....全程无拖拉进度...啊....真是大爱温情片..
154,我是山姆,5,只记得我哭的稀里哗啦，碰到跟父爱有关的我的泪点就特别低，这部电影真的从头哭到尾，一把鼻涕一把泪。
155,我是山姆,5,"“Paul在写Michelle这首歌的时候，他写了一部分，剩下的一部分由John完成，John写下了‘I love you, I love you, I love you'，这就是为什么1970年4月10日Beatles解散的时候，全世界有那么多人在哭泣。”迷影和浓重的Beatles情节。什么样的人才算合格的父母？美国对于监护和抚养孩子的制度有利有弊。"
156,我是山姆,5,男主角还是很性感啊诶。Doug Hutchison好喜欢:-D
157,我是山姆,5,看到一半的时候，我一度觉得，这部电影的叙事有点拖沓。直到我耐着性子一直看完。我的抱着坚硬外壳的内心被一层一层刨开。直到全身放松下来。
158,我是山姆,4,再一次觉得，爱根本不需要任何物质衡量，它不是一道精妙的数学题，不需要有多么高深的智慧去剖析，哪怕只是一个智力有障碍的人，同样可以给予那么深厚的不放弃的爱。西恩潘比达斯汀霍夫曼更打动我，而范宁真是可爱善良眼睛会说话。还有，Beatles是打开心房的钥匙。
159,我是山姆,4,高中时老和好友一路唱lucy in the sky with diamonds
160,我是山姆,5,"I love you I love you I love you 这也是为什么世界都开始哭泣 
"
161,我是山姆,5,有很多披^士情。@N影就像天真的矍槠，我都在楹⒆雍茫可是孩子好不好K不是你X得孩子好不好。如果我的父母，算了。
162,我是山姆,5,这电影告诉我们 永远不要怀疑 永远不要放弃爱 所有人在爱的面前都是平等的 每个人拥有的能力不一样 但每个人与生俱来的能力就爱 只要你能保持爱 相信爱 一切都会因你改变 blackbird响起的时候 就好像一切都释怀了
163,我是山姆,5,第一次看西恩.潘的电影，真的很棒，很棒的表演，很棒的剧情，很棒的亲情！！！
164,我是山姆,4,Dakota Fanning和Sean Penn彪演技的同时，观众在飙泪。真是无与伦比的温情片。
165,我是山姆,5,哭掉整整半桶纸。从剧本到演员到摄影都牛叉坏了。
166,我是山姆,5,"Lucy:i'm lucky.. SAM:yeah! we are lucky,how are we lucky...."
167,我是山姆,5,"Daddy,why does the snow flake?
What is mustard made of?
Why are men bald?
Why does the moon follow me home?
Daddy,do i look more like you or mummy……

"
168,我是山姆,5,和GG一起看，从sam说对不起的时候开始哭，一直苦到结尾。我不会也不愿意去想那些低俗的问题，比如一个弱智怎么知道如果ml，我看到的只是世界上最最单纯的爱。就算sam可能因此失去他的孩子，他还是很伤心的叫她不要撒谎，不要撒谎。天，我现在写起来都还想哭。
169,我是山姆,4,范宁是个精灵，当我看到山姆的朋友帮他凑齐钱给范宁买到鞋子然后一堆人扯着气球在街上走的那个镜头，彻底被感动
170,我是山姆,4,Sean pan演的忒牛，故事跟同性恋父母一样，既然父亲爱女儿，我不懂为什么政府不能给父亲一些帮助，一定要夺走女儿呢
171,我是山姆,4,lucy in the sky with diamonds……
172,我是山姆,4,Sean的眼神真惹人怜爱，小钻石太招人了~此片对克莱默夫妇和披头士做了很好的宣传~激起莫大兴趣
173,我是山姆,5,Lucy in the sky with diamonds.
174,我是山姆,4,镜头语言比较独特 可是我觉得一些手持伪纪实效果并不怎样 而且有些快速切换镜头的戏剧性实在是很鸡肋 虽然偶有亮点但还是挺奇怪的。 实力派西恩潘这部的表现和达斯汀霍夫曼《雨人》中有的一比 后段略显松弛 不过这也是相当高的评价！小姑娘萌爆了哇~ 
175,我是山姆,5,弱智者的世界其实比我们幸福。当一切都是透彻、简单的喜欢、不喜欢、爱、不爱，“别人的爸爸不能随时和我去公园”――lucy说。如果能只看到这世上的好，so nice~P.S.小姑娘非常可爱！
176,我是山姆,5,男主角的演技真是绝了可以把一个智商低的成年人演绎的如此真实，这是一个关于亲情的感人电影，至少在细节上打动了我。
177,我是山姆,5,"1 所有的演员都是实力派的。2 加上拍摄和编剧，这个故事无懈可击。但是因为过于美好反而有点不现实的感觉吧。
3 自己的苦难在于他们相比之后，实在是微不足道了。"
178,我是山姆,4,至少有教会提供免费教师，并且有很多人性化的无偿服务，= =虽然故事很好，可是小孩子最重要的东西是未来，可是在小时候孩子可能会不需要爱以外的未来
179,我是山姆,5,daketa fanning太灵了sean penn好强大，虽然这种题材的片是我的软肋，但是冷静下来…还是好想给五星啊！！！＞＜
180,我是山姆,5,"Sam: OK, remember when Paul McCartney wrote the song ""Michelle"" and then he only wrote the first part, Annie said. And then he gave that part to John Lennon, and he wrote the part that said, ""I love you, I love you, I love you."" And Annie said that it wouldn't have been the same "
181,我是山姆,4,情节有些拖沓，为SeanPenn的演技加一星。ps. 七岁孩子的早熟意外的感人。影片一开始就戳中泪点。
182,我是山姆,5,得父如山姆，子女复何求？（这片子给我留下了一个无法修复的后遗症：看到西恩潘那张残脸就觉得是弱智啊>< 达寇塔还是小时候好看~）
183,我是山姆,4,从来没有喜欢过西恩潘，但这部片子确实演得入木三分，有时候看着sam说话都会觉得特别难过。而范宁真的是太牛逼了，天生的吧。michelle真的是美丽的无以复加。
184,我是山姆,5,跟达斯汀霍夫曼太像了。手持摄像机拍的让人感觉很亲和自然，里面的吉他真好听不知道是不是披头士的，配乐很喜欢，达科塔范宁小的时候真太可爱了没法说了。感人又演得好，演员还漂亮，还有啥比这更让人幸福
185,我是山姆,4,主旋律真善美催泪片。范宁的天然灵让使出浑身解数的西恩潘也失色。当然他也挺委屈的，Oscar毕竟不可能再将影帝颁给第二个阿甘。
186,我是山姆,5,它没有抽丝剥茧一步步让你往痛哭流涕的境地走，它只是很柔情地在为你将这样的一个故事。西恩潘真的把sam诠释得很好，而范宁小时候就那么美丽。尽管这不像七号房的礼物时已开始就让人哭瞎的节奏，然而却仍然打动人，因为不只是他对她的爱，还有更多她所表达出来的无法割舍，不能感动得更多。
187,我是山姆,4,开始很温暖，后面发生却在意料之中，为了庆祝父亲节看的，愿天下所有的父亲，节日快乐！
188,我是山姆,5,"-You're not like other daddy. -I'm sorry. -It's ok,daddy, don't be sorry, I'm lucky."
189,我是山姆,5,"We are all idiots, in our own kind of way. And...I guess we all need to know that everyone also has one's peculiar way to say, I love you."
190,我是山姆,5,人人都有爱，不论是智障的SAM，还是幼稚的孩童。爱不分年龄，不分种族，不分智力高低，不分贫富。爱是人间最公平的给予。让我们跟着SAM学习为人父母，学习爱的伟大与无私。
191,我是山姆,5,坚强的蠢爸爸和勇敢的聪明女儿 感动了所有人  除了她无情的妈妈~
192,我是山姆,4,他可以很丑，他可以很穷，他可以很笨，但是无论如何我都要在他身边，因为只有他能给我谁也无法替代的爱。我想你了，爸爸。
193,我是山姆,5,@部影e，不是演出患有p微智障的父H一角的西恩潘，或是早熟心wN的_科塔61芬妮都是演砭采啊，而做榕主角的蜜雪悍品鹪谶@部影e，只能f好而已，演聿凰愠霰。
194,我是山姆,5,感动得一塌糊涂。小女孩太美了，眼睛水灵灵的，而且又很懂事。
195,我是山姆,4,what is life what is love？how to love and be loved？？
196,我是山姆,5,终于看完了。演员都棒极了。前半截比后半截好看
197,我是山姆,5,被小范宁演哭了已经不是第一次了，这小女孩天生就是演戏的料，太喜欢小时候的她了！
198,我是山姆,5,谢谢你看到我所有缺点也还愿意在我身边
199,我是山姆,4,同情心泛滥的人看这种电影真是 虐心，结尾要是不那么平淡绝对五星。
200,我是山姆,3,真正的戏眼是达科塔・范宁。她才是催泪的原动力
201,我是山姆,3,情节有些拖沓 主题很好 演员也不错 但是导演不好 
202,我是山姆,3,雨人版的克莱默夫妇，编剧对山姆的角色塑造并不成功，山姆成了一个行为上有缺陷的正常人，他的处事和思维看起来其实挺正常。西恩.潘对角色的演绎是完美的，范宁的表现也非常成熟。部分剪辑和镜头感有点晕。但是还是打动了我
203,我是山姆,3,受到克莱默的影响，这个父亲不止失业而且智障。个人觉得他的发挥不是很稳定。小妞演的很成熟。毫不讳言对六七十年代的回望和致敬。美国片大都很和谐。。。这个也不例外，律师一角可说很夺目又亲切，尤其当我们身边到处都是这种被社会压得戴着紧绷面具在网里游走具有暴食强迫症和暴力倾向的人时。LITttl
204,我是山姆,3,人人都有爱的权利。虽然感动，但故事节奏不够明快。其实它可以讲得更精彩。
205,我是山姆,3,我不会怀疑他们父女间是有爱，但只由一个弱智的爸爸来照顾一个小孩，这不是只有爱就可以吧，养育一个孩子那是多大的工程啊，更何况美国青少年的环境那么乱，以后吸毒，青春期啊什么问题一大堆要怎么办啊，片中的小女孩还太少，很多以后会遇到的问题她根本就没有考试到。
206,我是山姆,3,看过这部电影之后的一年，我看了《热带惊雷》，充满了对电影工业的调侃，其中有这样一段：即使是演傻子也要有一技之长，汤姆汉克斯演了阿甘，会和中国人打乒乓；达斯汀霍夫曼的雨人能一次记住六套牌；他们都获得奥斯卡。置于什么都不会的也有一个，西恩潘的我是山姆，啥奖也没拿。
207,我是山姆,3,还好，没有预想中的那么催泪感人，原来儿童福利机构可以随便闯入别人的家庭，并且还大言不惭的去抢夺别人的孩子。不过没想到SEAN还能演的这么生动，有点出彩的角色，还有那时的Dakota很天使！
208,我是山姆,3,去星巴克面试之前 静洁媳妇儿推荐我看的电影。她说她看了两遍哭了两遍 我说 那你去看芦田爱菜的《Mother》吧 你会哭得刹不住车的。好故事好演员好结尾 好电影的骨架统统都齐备了 可惜少了个好导演。电影的温情戏码毋庸置疑 但是温情和温吞是两码事好吗? 导演的拖沓真的让电影的杀伤力降了一个档次。
209,我是山姆,3,One's intellectual capacity has no bearing on their ability to love...小女孩很cute，但结局处理得草率，所以三星...
210,我是山姆,3,煽情煽得太过了喂 让达科塔范宁那小眼神儿看得一身冷汗！
211,我是山姆,3,小范宁实在是太可爱了。感觉sam和律师，和寄养家庭母亲的关系处理很奇怪。除此之外，电影发展在意料之中，不过足够感人就够了。三星半。再赞一下萝莉。
212,我是山姆,3,影片故事并不新颖，除了两位主演，其他演员也均有较为出色的表现，尤其出演露西的小演员达科塔・范宁的表演更是令杰茜・尼尔森十分惊喜万分
213,我是山姆,3,George is always my favourite Beatle
214,我是山姆,3,"够温情的片子。西恩潘的演技没的说，只是整个片子的调调太家庭了，太好莱坞了。。有点“主旋律”的意思。。
Luck in the sky with Dimaonds."
215,我是山姆,3,西恩潘，以及诺顿、凯文史佩西。。。都很喜欢演这种智障青年么。。奥斯卡影帝不乏残障人士角色问鼎者。。这是通向小金人的一条捷径。。小女孩演技很赞。温情片，用来吸引主妇们和妈妈们以及青年少女观众群。家庭题材本身就是很保险的方向，智障人士很能赚去足够同情跟票房。。
216,我是山姆,3,19135#我这人真是太冷漠了，我连半秒想哭的感觉都没有。我相信父亲对女儿的爱是相当纯粹的，只用爱来计算的话可能很多家庭都比不上，只是同时也需要身边的人给予很多帮助来弥补，当然也没有人可以脱离别人帮忙来成长就是了（好像这样讲也不是问题……算了）。后半拍得有点拖拉，另外真的不喜欢加入爱情部分，没啥必要。SeanPenn演技相当好，DakotaFanning真的是可爱哭了
217,我是山姆,3,这部电影应该是引用披头士最多的一部。但印象最深刻的是《棉花俱乐部》里一段很疯狂很暴力的一段，引用的居然是《Please Mister Postman》。。。。yeahyeah
218,我是山姆,3,一部电影现在总要分成好几段才能看完，再也不能一个人躲在房间里不出来假装睡觉，实际上是在看电影了，这么想，我突然觉得对不起爸妈，他们那么想在休息时间和我聊天，现在我却忍着最大的耐心陪着他的妈妈聊天，人只会伤害最爱自己的人。
219,我是山姆,3,很催泪，但是并不是触动的感动，就是觉得太惨了。问题在哪里我也不知道，可能小细节依旧不够真实吧，太美国了
220,我是山姆,3,不喜欢这种煽情片，很假，正常人演的啥子很假，小女孩执着的爱很假，律师跟傻子搞上很假。要是国产片，估计没几个人爱看。
221,我是山姆,3,为什么这部电影评分这么高，其实就是雨人和克莱默夫妇的情节拼凑，表演也很一般
222,我是山姆,3,unfortunately this film speaks retarded language too
223,我是山姆,3,主线之外，居然还可以和Michelle Pfeiffer暧昧一下，山姆这小子和阿甘一样幸运啊!
224,我是山姆,3,a bit scripted ..
225,我是山姆,3,要是不这么长，我说不定更喜欢这电影.......不过看完之后必须要看一眼神秘河顺顺味儿，顺顺味儿....
226,我是山姆,3,我只想说范宁实在是太萌了，太萌了太萌了太萌了太萌了............
227,我是山姆,3,小范宁真漂亮。纯粹的人笨一点也没什么关系，所谓聪明往往是世故和低劣。
228,我是山姆,3,导演捏造了一个不可能实现的事实。于我，我无法认同他的抚养权。好吧，我缺乏耐心。Done，2013年4月8日。
229,我是山姆,3,跳脱的剪辑和配乐，以及无意义的虚晃镜头和造作快节奏剧情，彻底消耗了西恩潘近乎五星的演技。
230,我是山姆,3,故作无助与折腾的痕迹明显，但还是会动容，毕竟谁都需要爱。啧啧..如小S言，这样小大人的孩子让人讨厌又害怕，不过范宁小时候实在太可爱盖住了讨厌与害怕..   总4觉得西恩潘长的有点奇怪..
231,我是山姆,3,小孩子真会演，又是一个在天朝不太会发生的故事
232,我是山姆,3,虽然肖恩潘的演技很好 小女孩也够伶俐可爱 但全篇总有点力不足 草草结束
233,我是山姆,3,幼稚的人还是比较受欢迎的。这部电影的感人不一定能让你流泪，但会让你的心软下来，暖洋洋。山姆是快乐的，他热爱自己的工作，有着一帮同样低能却可爱的好友，而露西的出现则让他找到了生活的中心，她漂亮、聪明、懂事，谁人不爱？小范宁灵气十足的表演让人惊艳，老潘依旧是戏精！
234,我是山姆,3,我愿用我现实中的坏爸爸换取电影中的傻爸爸。PS：被片中的披头士元素感到很亲切，尤其是一群傻子和一个天使般的女孩儿一起举着气球穿过人行道，明显是模仿了披头士的某张著名的专辑封面：）
235,我是山姆,3,西恩潘&范宁的演技都超棒，故事也算温馨感人的。。只是......太压抑了，简直是强忍着无聊看完的。。。是我的问题还是电影的问题？ 
236,我是山姆,3,看着很无奈，有种冲进去打人的冲动。。但是，片子多少有点沉闷的说。
237,我是山姆,3,西恩潘演弱智很卖力，故事围绕弱智是否能养育孩子的问题，讨论很发人深思，很多地方小女孩那个无奈但又充满对父亲爱的举动很让人动容。就故事本身而言，探讨的地方多了些，渲染的地方少了些
238,我是山姆,3,这姑娘真的很会演戏...总觉得收尾有点仓促。那种不断的努力又不断的落空的心情，真的不是所有人能够体会。但现在明白。不是所有的努力都会带来好的结果，但一定会对最坏的状况造成改变。
239,我是山姆,3,All I need is love.
240,我是山姆,3,他确实无能力抚养孩子，担心的是养父母会不会虐待她
241,我是山姆,3,山姆的朋友凑钱给露西买鞋那段真有爱~~小露西演得成熟又可爱，她说我需要的是爱。这爱不仅仅是以为的对她好，还有陪伴。律师那个角色很夺目。西恩潘，个人觉得在这部戏里发挥不太稳定。有点拖沓。三星半。
242,我是山姆,3,  没觉得西恩。潘在这片里有多好的表现，我觉得这样的角色不适合他。达科塔。范宁倒是很让给我着迷。
243,我是山姆,3,他不是阿甘，不是雨人，他是山姆，一个完全的弱智，所以他拿不了奥斯卡
244,我是山姆,3,"相对两个小时的电影而言故事情节太单薄，反映父女关系的内容及冲击度都不够，以及很大程度上展现的是女儿对父亲而非父亲对女儿。父亲和律师若隐若现的感情是败笔，放在里面不伦不类。西恩潘的眼神太睿智成熟，不像智障者，表演还是不到位啊。
作为一个被爸爸宠大的女儿，没有被这部电影感动到。"
245,我是山姆,3,西恩潘的确演技超群，范宁从小就这么灵，也的确看着好早熟，记得在《夏洛的网》里她还是纯真的样子啊...但是的确没有特别感动和催泪，一可能是因为看的时候好卡...二是因为思考了一下如果现实中真的做选择，什么是对孩子最好的...
246,我是山姆,3,都说恋爱中人的人是傻子。这句话一点不假。
247,我是山姆,3,跟看前的想象相差有点大，不是不好，是理智、琐碎的风格偏离看前情意绵绵、温情满满的设定太多。西恩・潘、小范宁、菲姨都很棒，一句台词概括片子中心思想：爱人的能力跟心智(智商)无关。
248,我是山姆,3,西恩潘演这个多少令人生厌，范宁还是比较可爱的
249,我是山姆,3,Sean Penn乖死了萌死了，超爱他、爱死他了！又是披头士歌曲大合集，最重要的是有Golden Slumbers！
250,我是山姆,3,最怕这种片了 很多时间都被过慢的语速占据了 而且杯具的情节千篇一律 
251,我是山姆,3,感觉拍这样的电影的太多了……剧情有点拖沓，看着看着就想快进，最后也没有真正的高潮，结果也没有很美好的好莱坞式收场，不是特别喜欢。但是真的好喜欢那个小女孩，这个小女孩演的太好了啊！！！
252,我是山姆,3,塑料，美国人怎么尽搞这种虚情假意的东西。西恩潘这张无比精明的脸，跟我说这是弱智？达科塔范宁小时候也太好看了，可是她演7岁小姑娘，像27岁职场女性。（不过道理也说得通，唯一的家人是弱智，她必须保持清醒。），故事还是好的，作为注意力不集中（弱智）患者很同感了。最后：米歇尔费佛真是太好看了(1711ω1117)1779
253,我是山姆,3,女孩对爸爸所带来的自卑没有演出导演也轻描淡写，太正面了
254,我是山姆,3,一个好的故事+两个好的演员却抵不过拍摄的粗糙6868
255,我是山姆,3,"继秀兰・邓波后，我最喜欢的小童星。
那个牵着气球过马路的场景很像Beatles的一张海报，从某个角度来说，这部电影也是对Beatles的一场纪念。"
256,我是山姆,3,为了米歇尔 非佛看的这片，真是美极了，又多了一女神！
257,我是山姆,3,应该让人感动的题材没能让我泪奔，说明是真的没那么感动。不过小女孩LUCY真的太漂亮了，没有人会不喜欢这般梦幻的萝莉！
258,我是山姆,3,withしゅうちゃん。真是中了邪，看什么都会想念ws，分别相思之苦大概都是相通的吧。每个人都有自己这样或那样的缺陷，可无论是亲情还是爱情，最重要的是一颗真心，和因为真心而愿意去弥补缺陷付出努力。另外关于披头士的detail好评。
259,我是山姆,3,也许这就是锤炼影帝的必经之路吧，比如 雨人 里的Dustin Hoffman，比如 我是山姆 里的Sean Penn，范宁简直就是个小戏骨 以至于都没了点童真的味道。这种happily ever after的美国梦看多了是会作呕的！！ps.向披头士致敬那段还是很赞的。
260,我是山姆,3,我不知道除了范宁之外还有什么可看的。
261,我是山姆,3,父女俩演得真好，情感还是要在平淡的生活中呈现，国内的片子大多又哭又闹折腾得不行。
262,我是山姆,3,每个人都在做他们认为正确的事情，检方也好，律师也好，山姆也好，露西也好，大家都在做自己认为正确的事情，没有对错
263,我是山姆,3,“爸爸”和“女儿”的表演都堪称一流，从演女律师的演员的profile中还找出了与波士顿法律的关联，但可惜我这种冷血女就是对片中的idea不买账。
264,我是山姆,3,傻人有傻福气，配乐翻唱beatles
265,我是山姆,3,虽然哭了，但是，拍摄手法一点不朴实，充满炫耀感的镜头比比皆是，菲佛也有点歇斯底里，不过西恩潘倒是很出色
266,我是山姆,3,7/7.5 西恩潘如达斯汀霍夫曼 米歇尔菲弗如黛安基顿；爱与身份无关
267,我是山姆,3,顺便去看看热带惊雷 会有惊喜
268,我是山姆,3,剧情拖沓，剧情着力点都是之前看过数遍的拼接。除了Sean和年仅七岁的Dakota Fanning的表演外，对这部电影真的没有什么兴趣。
269,我是山姆,3,"换我年龄还没2打头的时候 我是那个稀里哗啦啊
现在，还是喜欢sean penn的神经质和Fanning的熟女街拍了"
270,我是山姆,3,啊！什么！？你们为什么会看哭！！！？？
271,我是山姆,3,可能女律师爱上男主角的那一幕，是他穿上了西装之后，她发现他是西恩潘。
272,我是山姆,3,豆瓣TOP250补标。影片太商业，西恩潘和范宁在我眼中也是过于商业的存在――比起对德尼罗的偏见，这算不错了。摄像灾难级。
273,我是山姆,3,范宁小时候演技真的很棒
274,我是山姆,3,从头到尾我都没感动过。我总觉得，一个智力成问题的父亲，怎么可能把女儿教育好？靠品德？靠判断是非？这些都是建立在知识累积上的，你认识越多，才能越能知道什么是好什么是坏。就是这样，整部影片我都在想这些，居然没想去查查这小姑娘叫什么名字，直到到泸定看了皖兄的专辑才知道她叫Dakota Fanning
275,我是山姆,3,本片获第74届奥斯卡最佳男主角提名。中国有一句古话：犬不择家贫，子不嫌母丑。在对待“什么才是对孩子好”的问题上，中西方的观念还真不一样。山姆用他那只有七岁的智商告诉我们这些健全人，远比物质，孩子更需要的是你的爱和陪伴。可惜，影片被那刻意晃动的镜头给毁了，严重怀疑摄影师患有帕金森症。
276,我是山姆,3,毫无感觉，冲着小萝莉给个三星吧
277,我是山姆,3,"快来我们村啊,很多人不懂小九九,不认几个汉字,还骂孩子打孩子,快把他们的孩子带走啊!这样的社会关怀也太荒谬了吧?法庭闲着没事你关心一下那些真正缺爱的孩子好吧?但是,有这样的爸爸也真会使人难堪的,分不清时局缓重.露西可爱,演技不可爱;但110分钟处山姆后面那个朦胧女孩也挺可爱啊!给我分开玉米绿豆?"
278,我是山姆,3,喜欢披头士、约翰列侬和萌妹纸的人一定不能错过
279,我是山姆,3,芬宁打西恩责怪他怎么不来看她那段，还有芬宁天天夜里爬楼出去找西恩那段，都很感人，芬宁很可爱
280,我是山姆,3,"not buying the story, still, the daughter is adorable "
281,我是山姆,3,"Dakota Fanning真系卡哇伊耐~前途8可限量哇 迷倒迷倒
8过IQ只有7岁滴大叔居然也懂得sex 暴汗了一把 中奖率还这摸高"
282,我是山姆,3,演傻子除了霍夫曼和汉克斯就是你了
283,我是山姆,3,肖恩潘和达斯汀霍夫曼都有一张适合演痴呆的脸啊
