,movie,star,comment
208,三块广告牌,3,科恩嫂麦克多蒙德表演精湛，让人觉得这个人物的长相都是她演出来的...
209,三块广告牌,3,一大半的时间里，除了土埋半截到忍无可忍自尽的威洛比，全部主角和一半以上配角都像中学上不到一半就不念了的混混儿一样使劲挑事儿，不作好像浑身难受似的。一个议题的价值就是这么用来消耗的吗？
210,三块广告牌,3,69/100 麦克唐纳应尝试同他人合写剧本，以弥补故事上的不足。Frances的Mildred被一眼识破的强势，过早的扼杀了人物的成长。Woody的角色除了带着矫情的黑色幽默外，对剧情几乎起了毁灭性打击，第二幕专心塑造女主被误解都比让Sam180度大转弯强。最终我不禁要问：还记得当初为什么竖那些billboards吗？
211,三块广告牌,3,三星半。此片最大启示是女主对警官说的，每个男性应该在出生时就被验DNA，这样就没有破不了的强奸案了。
212,三块广告牌,3,电影质感非常差劲的[三块广告牌]证明麦克唐纳还是专注于写剧比较好。咸腥口的暴力与充满了pathos的正剧嫁接得十分奇怪，这是源于影片粗枝大叶的节奏感。这位作者的优点在于反转剧情前的悬念铺垫，结果在这里显得手忙脚乱没有目标。影片的质量于是低于它的题材，最终开放而沉重的结局没有得到足够支持。
213,三块广告牌,3,像南方系的小说，矛盾隐藏得相当高明
214,三块广告牌,3,三块广告牌是招牌，三封遗信才是干货，于是也就透出了一种虽然极富技巧性却也极具投机性的机灵。
215,三块广告牌,3,一个混乱撕裂的美国当下的孤胆英雄，出彩的人物、故事和新奇的剧本结构都有了，然而我不是很确定电影大量的黑色幽默究竟是令它出彩的点睛之笔，或只是自作聪明的抖机灵。
216,三块广告牌,3,打赌奥斯卡没跑了，简直量身定做，那种看上去很酷但本质很怂的片子
217,三块广告牌,3,有你们说的那么好吗？！
218,三块广告牌,3,2.5 / 将观众一切可能固定的情感支点都悉数拆除这一点很好，问题在于拆除后冗长的拖延以及寻找的出口之单薄，几无更深思熟虑的层面，甚至连社会结构性的描绘都触及甚少就已经满足。人物的粗暴与细腻都像提线木偶，只有编剧的戏剧意志而没有独立性。电影化程度也被戏剧性削弱。#与九苍老师意见相同#
219,三块广告牌,3,WTF？分级13+ 我在电影院里看的感觉心脏病要发作…… 看影评人花式夸用“温柔”来形容 我的预期真的不是这样的… 很暴力 非常暴力#一定要做好心理准备# 即使有些温情也让人觉得不过是人之将死其言也善 愤怒太久代价太大和世界妥协了而已
220,三块广告牌,3,应叫《三块牌案惊奇》……本片其实有很重的“说教”。洛克威尔那种劣斑遍布的性格，如弧归到舍己为人对不起，不下重手无以服众。导演如何避免重说教造成的违和感？喜剧弱化与惊悚转移。前者发生在医院，施害受害齐聚一堂；后者就是读信时遭遇纵火。麦克多蒙德的导归难度略低，思路集中在喜剧：前夫19岁女友，目击证人是侏儒。……麦克多蒙德本希望自己演的是祖母，被导演拒绝，因为剧本改动将太多。后来还是其夫科恩说服她接演。此角的部分灵感来自于约翰韦恩，而洛克威尔的角色灵感则部分来自韦恩在双虎屠龙中的死对头李马文。凸显他与女主的截然相反。可死对头最后竟然……所以此片是敬，是黑，或者兼而有之？
221,三块广告牌,3,剧本的推动力在警长死前是不可调和的矛盾，冷峻中才见悲悯。等他一死剧情已然无力推进，所有人沐浴在他的圣光里，黏腻无比。密苏里乡村派出所老支书虽然人死了，但他活在每个人的心中。
222,三块广告牌,3,"3.5?Pushes all the right buttons, a tour de force of script writing,但不管蹭多少美国社会热点，还是改变不了骨子里讲的就是那个19岁动物园妹口中那句anger begets anger的鸡汤。。。"
223,三块广告牌,3,黑色幽默太过的后果是人物心理刻画往往谈不上细腻。
224,三块广告牌,3,挺一般的电影，几个主角性格转变过快
225,三块广告牌,3,演员真出色啊。反而剧本实在是太过雕琢，有破而无立，看看里面那些不显著又不必要的黑人角色就知道了。好莱坞怎么开始流行拐弯抹角地爱国了。这种欲扬先抑的写法很难，打着恶的幌子唱善的赞歌，很容易互相掣肘。也有几幕交汇得自然，比如夫妻俩掀桌子和结尾车里对话的部分。
226,三块广告牌,3,觉得小个子先生和女主掰了之后，走前回头那个有点委屈有点难受的表情演得最好了。其他虽然有不错的地方，但感觉这片子特割裂，一会儿想现实一会儿搞荒诞一会儿让你笑笑，还有巨多巨明显的设置，导演就差凑你跟前指着画面说：朋友看这里，拜托你理解理解哦。那什么，不好这样用力划重点吧……
227,三块广告牌,3,感觉美国普通人民跟天朝人民也一样，都充满戾气怼天怼地。各种打破套路，不过人物转变看起来有点怪怪的，最喜欢结尾。
228,三块广告牌,3,年度最失望。并不难看，但麦克唐纳丢掉了他身上最可贵的独立精神，转而把视角向主流靠拢和妥协，仅仅留下的那一点点还属于他的技巧，也处处写满了居心叵测。
229,三块广告牌,3,贴合米国社会热点，“不落俗套”式的俗套，精剧本但总感觉不是发自内心深处的呐喊～题外话：这部如果是日本电影，应该锁定映画艺术年度十差前三
230,三块广告牌,3,72，开头几场戏非常精彩，干净利落。后面乡村音乐吉他弹起来，就觉得乱了，节奏和整体性很怪，断裂感是很明显的。电影和电视剧的差别，前者大单元内完成情绪的迅速燃烧释放，后者用多个小单元叠加延宕。这影片让人感觉就是电视剧。特别不喜欢音乐。
231,三块广告牌,3,后半部真是太刻意了，各种揭露所谓恶人美好的一面。当然对话写得很牛逼。
232,三块广告牌,3,3.5。所有人都是愤怒的，把情绪和性格写得极棒。不得不说剧本强，提名1get；摄影赞，提名2get；女主男配强，提名4get；配乐到位，虽然觉得有点煽，提名5get；故事的起因，讲得东西，外加一些附加内容，影片提名稳了。喜欢开头和结尾，喜欢里面时不时抖得梗。但中间一度看得乏和累。
233,三块广告牌,3,反套路何尝不是一种套路。从剧本落实到影像的过程中，韵味起码减弱了一半。的确是那种眼睁睁看着沙子从掌心中流走又深感无奈的奥斯卡定制“佳作”。
234,三块广告牌,3,最好：矛盾冲突的中心人物，无论受害者或强权者，都没有绝对的善也无完全的恶。是三块广告牌，而不是二或四，标题已经在解构。善恶关系的模糊，也就更加要求观众的判断力。最失望：s警察从恶到善的改变，不过因为一封遗书，还原到虚无的超越性符号里，回避问题的真正所在。
235,三块广告牌,3,妇女节陪着又看了一次，问题也逐渐清晰：某人退场后整个故事就散掉了。马丁喜欢怒怼主流价值观这点我不讨厌，但他的立场确实限制了他在那个严肃问题上的想象力，其结果是某人的退场几无价值，最终让心灵软化的是那些个近似于机械降神的拙劣手段。
236,三块广告牌,3,较真一点的话，这种和《逃出绝命镇》同期精准踩点的剧本，看起来很牛逼，但冷静一点想其实是比较小聪明的。说来说去，讲故事不能“太精” 啊，还是要诚恳，别忽悠人。
237,三块广告牌,3,1.从三观角度评价电影都是初级、低级的行为，虽然此片在三观上有创新；2.剧本一般，道具太多，极端戏剧性太多；3.牙医（暴力升级、尽职）、儿子部分不错，其他普通，三封信和电视新闻部分整段垮掉；4.导演生怕观众看不懂，自我解释太多，结尾是典型。
238,三块广告牌,3,高分是因为反类型和里面的毒舌经典吗？我只喜欢里面反政治正确的那一部分。导演想说一个仇恨只能带来仇恨，只有原谅才能解脱的故事。但问题在于男女主角都做了不可被原谅的事，而且是导演强行让他们做的。做完了之后导演又强行让他们被原谅。这故事开头的张力感可以，结尾的自我和解太过草率，莫名其
239,三块广告牌,3, 非关侦破，关乎怨憎会与爱别离。有些事情的发生就是没有理由，随手抓个人来怪罪最是方便。可是，面对种种不义，不去憎恨实在太难。
240,三块广告牌,3,第一次觉得人物丰满比扁平更假。三星全部给洛克威尔和麦克多蒙德的演技，他们完成了剧本设置的人物，但超强的完成质量并不妨碍剧本本身做作谄媚到极点。伍迪哈里森就更奇怪了（（（（（
241,三块广告牌,3,美国内陆小镇社会比较可怕。女主老公基本缺席，男二父亲早逝，唯一正常点的男主警长早早自杀，全是一堆破碎的家庭。还有穿插其中的酒精泛滥、警察滥权、种族问题。感觉里头的人物不练点散打都不好生活下去。
242,三块广告牌,3,三星半。前半部分不错，后半部分越来越离谱，越来越像导演以前的电影，人物活在导演臆造的世界里，也便消解了前半部分费力搭起的看似对美国各种社会问题的批判（枪支、性、警察暴力，种族歧视，侵略战争，宗教，恐同，等等），变得跟现实关系不大。可取之处在于保持了导演一贯的风格化，叙事表演台词等
243,三块广告牌,3,很能与mildred产生共情，理解她后来的行为，除她之外，其他人物的塑造超出了我所能接受的“荒诞”范围，willoughby喋喋不休的遗书朗诵自杀嫁接没有任何铺垫，dixon的转变突兀莫名，火烧警署、病房的仇敌相见都让我回到了《撞车》时期――那种故意把冲突和救赎放置在一个缩小语境中的不舒适感、造作感。
244,三块广告牌,3,遭受暴力却无从反击，心有仇恨却无处宣泄，生活有的时候压抑的让人想反击！不顾一切！
245,三块广告牌,3,挺带感的一部犯罪伦理片，用广告牌的形势告知警局与大众，随着故事发展，各种多面人性展现出来，让人沉思
246,三块广告牌,3,请给我一个五颗星的原因… 
247,三块广告牌,3,一气呵成，硬核到底。一个悬案贡献出异常精彩的剧本，敢爱敢恨上可发飙下可卖萌的角色最可爱。
248,三块广告牌,3,在完全不知道剧情也没有看过评论的状态下看的，看完觉得有点刻意。
249,三块广告牌,3,确定马丁・麦克唐纳不是我的菜。有编排故事的才能，但偷懒。
250,三块广告牌,3,本来是关于美国中西部删帖事件，后来转成个性社区生活片了，口无禁忌，生无所惧的各类characters 
251,三块广告牌,3,3.5 证明好故事跟好电影是两码事 环环相扣又针砭时弊的剧本 营造出的却是一个无法令人共情的道德困境 导演一贯的黑色幽默和科恩嫂的表演加分
252,三块广告牌,3,还行，但太处心积虑了。
253,三块广告牌,3,Go fucking the American dream!
254,三块广告牌,3,太剧作，后半尤甚…不妨视为我不是潘金莲在米国的远亲…
255,三块广告牌,3,3.5 单从剧本角度看，的确是密不透风环环相扣，沉默力十足的结尾更是画龙点睛；但作为一部电影，即使能感受到人物在正确与不正确中间的苦痛挣扎，却无法建立同理心，即同时存在着创作者的强力干涉和表演上的过于被动，于此成品只是着眼精美的空壳，容不下任何情感放置；换句话说就是，好故事≠好电影。
256,三块广告牌,3,这个剧本路数从哈里森举枪自尽开始就有点捉摸不透 导演既想让故事和人物都渲染出一种更为天真的科恩式的黑色幽默 但又在竭尽全力地摆出一副达内式的披露社会现实的写实风格 结果两者都略显不足 又或者十分胶着
257,三块广告牌,3,看了一半坚持不下去，觉得做作。
258,三块广告牌,3,"很多看电影费电的二逼说这部片子是少有的政治不正确，更多的傻逼还点赞，电影结尾台词已经明明白白地问了""你知道安利吗？”于是公民抗争的神话瞬间被自我安利消解――这是一部吊的不像鸡汤的鸡汤片！"
259,三块广告牌,3,再次被高分困惑。导演故事讲得OK，可远不如《海边的曼彻斯特》。首先，主演们演过类似角色已无数次，无突破可言；其次，垃圾白人警察的转变太快了；再次，哪怕女主角再“死猪不怕开水烫”，她的动机还没强到会让她的行动升级到轰警局，三块广告牌无声激起千层浪，这让她铤而走险以身试法显得更愚蠢。
260,三块广告牌,3,我咋觉得挺一般的
261,三块广告牌,3,处处用力过猛，非常刻意。音乐棒。有意思的是，身边那位ABC带着他的trophy女友全程在笑，生怕别人不知道他们听懂了片中所有的美式笑话。
262,三块广告牌,3,说教
263,三块广告牌,3,并没有打动我，电影在黑色现实和理想鸡汤之间做了个很讨巧的折衷，几处细节：警长的遗书、Dixon的转变、病房相遇、广告牌前的麋鹿，生硬而造作。Missouri身上的刺，凌厉而果决，刺痛敌人的同时也刺痛爱人，我敬佩之，但这样的人，我不敢爱。
264,三块广告牌,3,开始和尾声部分都很好，唯一遗憾的是剧情推进转折部分的设计，戏剧感太强。另，不要看鲸鱼字幕组的翻译。
265,三块广告牌,3,？？？看得好烦躁
266,三块广告牌,3,可能是带着Fargo那样的期待来看的吧，所以看完之后有点失望。这个剧本过于斧凿了，蛮适合得好莱坞的最佳剧本的。
267,三块广告牌,3,很不错呀，亮点不少，就是放在一起有点过头了，音乐也是...
268,三块广告牌,3,搞不清是我看到高分期待过高还是片子本身不够好，我觉得这电影的质感像是电视剧，文学性略低。感觉作者再硬往下编似的，很滞涩，观感比片长长很多…
269,三块广告牌,3,带着“找真凶”的目的看完了整部电影才发现原来这个片子的意义不在于此，从某种角度来说有点像《杀人回忆》的结局。这个镇上的大多数人都挺偏激却又善良。那个疑似犯人的人身份是在影射美国驻伊或者阿富汗大兵吗？
270,三块广告牌,3,拆了两天看完，女主完全靠着愤怒而活，何必呢？
271,三块广告牌,3,{一c子U出的”荆人物身上M是典型嘶`。　建立在嘲笑e人的笑c不合胃口，|疑人素阏x的∏ξ碚f太\，X上更偏好再更多控制力的面；音泛寐，最好的是表演。　S多台~後的空白瞬g常擂危只想：呃，然後呢？／如果f@就是未受法W的人J榈捻尖故事，我真的不X得法W有可能被所有人理解。
272,三块广告牌,3,是的，它有几处破折。正义迟来，或者干脆不来，我们该作何打算？人的无奈或者干脆无赖，剧本当然有聪明精细的雕琢。在正义的持续的延宕中，去事物的核心周边打圈，这当然是高级的出发。高级的理念造就好电影，但也可能并不能如愿。它的破折在或左或右的飘忽，这过山车的表现是控制的结果，但我喜欢意外
273,三块广告牌,3,配不上它的名气。
274,三块广告牌,3,烧警察局这么大的罪过居然靠一个人的不在场证明就能逃过去真是呵呵哒了
275,三块广告牌,3,是谁给这部电影打上了“犯罪”的Tag……搞得我一直以为他们要破案，看了将近一个小时才看明白故事想说什么。主题不错，但埋的这条“伪主线”有种故意捉弄观众的嫌疑。
276,三块广告牌,3,没有想象中精彩。仇恨和愤怒导致恶果，爱可以救赎。而事实上，即使没有仇恨没有愤怒，只有爱，也会导致巨大的伤害。对爱人如此，对普通人也是一样。更何况现实里像电影里那种丝毫不计较自身伤痛而以德报怨的人屈指可数。要爱，不要恨。要冷静、不要愤怒。我懂，也能做到，然后呢？
277,三块广告牌,3,"rough, tough, and good midwesterners…但这戏就像科恩兄弟的一样，不是我喜欢的调调，看着有些不耐烦"
278,三块广告牌,3,黑色疗伤，剧本工整，群戏炸裂
279,三块广告牌,3,廉价的救赎和原谅，如果没有勇气对抗恶，至少不要粉饰之。
280,三块广告牌,3,弗兰西斯・麦克多蒙德太彪悍了……
281,三块广告牌,3,差一口气
282,三块广告牌,3,本以为很有劲，结果是杯温开水，人物还是美式死板，总要写傻子和英雄，性腥是调和剂。但高明之处是表面歪风邪气的小镇里能微缩了一个正义模糊的世界，早在和神父示威的对话里就扣下了议题，结尾虽然设计依然刻意，但答案高明，-About killing this guy？-I guess we can decide along the way.
283,三块广告牌,3,我要是mildrid 会直接拿酒瓶把烧广告牌的ex的头爆了，哪怕当时餐厅音乐是k 279。
284,三块广告牌,3,有c太情
285,三块广告牌,3,这电影不应该叫《三块广告牌》，而应该叫《三封亲笔信》
286,三块广告牌,3,"3.5。I mean, it's definitely not what you expected, which is a good thing?? 有很多转折，有很多科恩兄弟式、“无法无天西部片”式的暴力，有很多有点超现实的巧合和桥段（比如前夫女友的那种教科书式的傻）。我觉得最好把此片理解为寓言。否则很多地方都觉得是臆想出来的密苏里农村。"
287,三块广告牌,3,其实觉得故事发展有点莫名其妙...
288,三块广告牌,3,整个剧情可以划分为几个章节，每一章的冲突都来得非常猛烈，要说黑色也并没有那么黑，要说温柔倒是有点过头，暴力版“爱的教育”。Mildred这个角色和之前的Olive Kitteridge相比不得不说层次感和复杂度都减了不少。
289,三块广告牌,3,很多安排都过于讨巧了，显得非常算计。
290,三块广告牌,3,刻意：父H跟19q女孩(c女和g)同居、一片哀戚戴耳C、x完信迅速改性、侏儒跑出缟眢w的火、嫌疑犯去砸店的目的不明、接任警L黑人、毛拖鞋和鹿也S褚怀尸F就好.....
291,三块广告牌,3,最喜欢狄克森黑暗中跟女主通话落泪那一幕，美。政治片不好讲太透的。
292,三块广告牌,3,这要是个小说就太好了。Francis一出场那种紧绷也是让人一头雾水，就算要和后面反转出的脆弱性对比，也不用这样演吧，Olive Kitterige的时候都更subtle，大概也是这个剧本的文学性在电影中不太成立的一种解释……
293,三块广告牌,3,我就不太明白，这怎么就得了金秋奖了呢？诽谤警长、火烧警察局、要去杀一个意淫出来的凶手、踢儿子同学下身，怎么就成了英雄妈妈了呢？#20180109
294,三块广告牌,3,平静只是暴力在勒紧缰绳，局长用枪自杀，花钱赞助广告牌，鼓励大家发出暴力之声。没有暴力，无法抵达善意。
295,三块广告牌,3,整部片子都陷入一种巨大的愤怒之中，除了不停的情绪宣泄，看不到其他的什么。
296,三块广告牌,3,不是很喜欢这种为了情节精彩而把众多极端性格的人聚一屋子的剧本，一切都太刻意了。
297,三块广告牌,3,认同表演，拍的算工整吧。价值观不认同，所以完全没有共鸣。一个愚蠢而非常不称职的母亲，为了为自己就害死女儿的行为找心理开脱，用非常不理性的行为害人害己。
298,三块广告牌,3,剧作确实精巧，故事曲线和人物弧都做得好，节奏舒服，足够好看。但另一方面，多处情节转折点的设计都让人觉得有刻意讨巧之嫌，甚至一度会有被道德绑架的微妙之感，是把双刃剑，有好有坏，中和下来给三星。
299,三块广告牌,3,这是一部关于“找到希望”的电影。导演麦克唐纳动用新西部片和真人真事改编电影的制式完成这部虚构片，于是很自然便获得两类型题材的组合优势：一种既缓和惬意又剑拔弩张的叙事张力。剧本则相对显得缺乏新意和趣味，几乎都是由缺乏说服性的冲突堆砌而成，转折不自然，表演也过于自觉。★★★
300,三块广告牌,3,我就是觉得莫名，一切都毫无理由与章法的极端又讨巧。。
301,三块广告牌,3,太痛苦了 ，找虐
302,三块广告牌,3,不欣赏这样的价值观，也看不出影片想讲述什么
303,三块广告牌,3,整体风格的确感到让人眼前一亮，很久没有看到如此新意的电影。但剧作不喜，几处逻辑难以接受，一些人物的转折有些生硬，感觉很太过刻意，一点也不真诚。编剧对人性的拿捏很奇怪，黑色幽默也没觉得多高明，到底在牛逼在哪儿了？看了特别不舒服。
304,三块广告牌,3,三块广告牌 。
305,三块广告牌,3,好看但不喜欢。台词写得比起电影更像电视剧，有些地方甚至像话剧，三封信写得和念得都格外尴尬……人物行事不合逻辑的部分实在太多了，一两次还可以接受，整个镇子都狂躁发作搞得像雏见泽症候群一样实在让人受不了。
306,三块广告牌,3,出乎意料地戏剧化啊，但不知道为何，看完就是特别无感...Frances McDormand和Sam Rockwell太赞！！一对比觉得警长老婆和小女友演得十分敷衍
307,三块广告牌,3,看似是个逼格很高的片，设计巧妙，主角演得好。但男主转变突兀，女主叫人讨厌。
308,三块广告牌,3,剧情不是很合理。美国治安这么差吗？犯罪了不追究？女主伤害牙医不追究？警察把人打伤不追究？放火不追究。如果真是这样，生活在这个国家一点安全感也没有
309,三块广告牌,3,I can't even. Seeing any abusive people corner  / choke / hit another person caused me physically uncomfortable.  Fuck.
310,三块广告牌,3,无心插柳柳成荫
311,三块广告牌,3,还是更喜欢醉乡民谣
312,三块广告牌,3,前后这个转折…………喜欢前半部分，其实拍的特别政治正确，只能说导演很聪明。
313,三块广告牌,3,3.9 人物太多，应该去拍电视剧
314,三块广告牌,3,这是一个we voted NO and we solve problems with emotions instead of rationality that's exactly why it's best for Oscar的故事.
315,三块广告牌,3,警局混混的人设最好。人其实有被拯救的机会，人不一定能发现自己的优点，人不一定会遇到发现自己仅有优点的人，人很难遇到在合适的机会救赎自己人，并用一件事来彻底改变自己。
316,三块广告牌,3,原地转了个圈
317,三块广告牌,3,竟然是一个温情的故事。黑色幽默，反转的剧情，亦正亦邪的人物，开放式的结局。
318,三块广告牌,3,广而告之，不安生；和而不同，好困难。p.s.:这电影态度有问题，是谴责犯罪还是鼓励犯罪？你不能把问题抛给观众就算完事了。
319,三块广告牌,3,非常刻意地在装随意
320,三块广告牌,3,看似有些冒犯，实则是观众喜闻乐见的那种电影。又野又没文化的南方人，其实都有颗善良的心。用黑色幽默消解强情节带来的失实感，也许形成了一种统一，但仍然让我不太想去消化。所谓人物的生动，更接近于话剧式的生动。文本呼之欲出，而影像方面并没有留下什么记忆点。三星半。
321,三块广告牌,3,整部片就看到编剧和演员那种“我会拍吧！”的功利心
322,三块广告牌,3,环环相扣，世间的善恶没有绝对，残酷里有温柔。就是看得我有点昏昏欲睡…
323,三块广告牌,3,一个愤怒与宽恕的故事。三星半…故事中规中矩，有些点还不错，只是没什么feel…
324,三块广告牌,3,还可以吧。不值得专门跑去看。
325,三块广告牌,3,只有我觉得不行吗。感觉是coastal elites对中西部人民的意淫。人物怎么能蠢成这样。女主也很扁平，从头到底的女牛仔形象。一星给科恩嫂
326,三块广告牌,3,有点丧又有点温情。虽然有几处都很想哭，还是不太喜欢这种风格的电影。P.S.我果然还是欣赏不了奥斯卡。
327,三块广告牌,3,镜头设计、场景调度、故事结构、配乐......这些统统都没问题，但是当所有角色都表现出他们复杂的一面时，整部影片给我的感觉就是“轴”。
328,三块广告牌,3,2018年观影003。群戏对助推最佳影片可是大有助力，“强”jiang麦麦厉害，滑伍迪也没输，耿山姆很拼，小卢卡斯是招谁惹谁了，出了海边死爹组，进了三块死姐家。只有艾比有点拉低表演水准。
329,三块广告牌,3,我并不喜欢。不能说因为愤怒和绝望就可以为自己的犯罪找到借口。牙医何其无辜？广告公司的小哥哥小姐姐又有何过错？就算是警察小哥，一场火灾又岂不是无妄之灾
330,三块广告牌,3,政治正确
331,三块广告牌,3,看什么都觉得刻意，感觉我要完蛋了
