,movie,star,comment
0,三块广告牌,5,你完全站在逝心痛的母H@r，你才lF她也可以是一加害者；你以榫L就是如V告牌f的懦弱o用，你才lF他也正在自己的生命旅程面λ劳觯划你以榉N族歧的白V警察已]救了，又lF他竟因橐环庑哦完全改。]有l是^φx，]有l是^π海奉壑名，可以善也可能是骸
1,三块广告牌,4,本届奥斯卡主题――美国妈妈牛逼死了。《伯德小姐》《我花样女王》《大病》《三块广告牌》拜托把这几个妈妈凑在一起吧，光聊天吵架就行，比超级英雄联盟好看一万倍。
2,三块广告牌,5,这部竟然拍得非常温柔，有点落寞和伤感，看完会被人的善良所打动。虽然确实有些天真，但还是好爱这样的电影，会让你很享受这个故事。当然，导演之前擅长的喜剧部分仍然很到位。几个演员都非常出色，女主和两个男配，写得好，演得更好。挺奥斯卡的片，应该能有斩获吧。
3,三块广告牌,4,一直觉得马丁・麦克唐纳是继昆汀・塔伦蒂诺之后最有才华的编剧，他的剧本每次都是超高的难度，既有一流的编剧技巧又有严肃的文学性。他总是以黑色和荒诞的东西先爽到你，最后再慢慢的用正能量感动你，让你在残酷的生活里看到一丝人性的暖色。这次的人物塑造很厉害，最佳群像表演也是这个剧本的功劳。
4,三块广告牌,4,胖牙医十分可疑
5,三块广告牌,4,今年两大最政治不正确电影之一（另一部是《凭空而来》）。愤怒是活下去的动力，怼天怼地才能内心平静，麦克唐纳用冲天戾气和负能量熬出一碗悲喜交加的心灵鸡汤。科恩嫂的表演太炸裂了，枯瘦的身躯下隐藏着滚烫的力量，全片仅有的一次笑容锁定奥提...
6,三块广告牌,5,三块火一样烧红的广告牌，三个人，三封信。角色的面目都是逐渐清晰起来的，就像警局里前一秒两人还针锋相对，局长意外吐血，米尔德脱口而出一句“baby”，全片就充满那样意外又令人心软的转折。
7,三块广告牌,5,老套的寻凶复仇故事讲述得如此生动，编剧值一颗星；情节似层层剥笋，露出的是七八个清晰、独特、复杂的人物，两个星给予出色的女主演及男配角；将视觉场面、音乐服化等手段与叙事有节奏的、完整地掌控融合起来，应是导演获得的一颗星；结尾高明的情节逆转和开放式，为这部电影赢得了最后一颗星。满分！
8,三块广告牌,5,我的情绪和观点在这100分钟里面不停地翻转和颠覆
9,三块广告牌,5,一晚上居然写了三封信！厉害了Woody叔。环环相扣，宿命轮回，错与对的双刃剑，比《杀手没有假期》更以小见大，提前预定今年奥斯卡最佳影片。女主、双男配演技巅峰，群戏也个个出色，剧本无可挑剔，开放式结局令人唏嘘…“-你确定我们还要这么做吗？-我不确定。-我们可以路上慢慢决定”
10,三块广告牌,5,#Venice2017# 影后已出。真是教科书一般的好剧本，破了不少套路，人物塑造十分生动。再加上导演控制力很强，不乏幽默感，也有不错的社会观察。对仇恨与愤怒的探讨颇有与当下社会状况的契合点。
11,三块广告牌,5,太精彩了，实在想不到今年还有什么影片可以挑战。剧情音乐节奏摄影都接近满分，更可贵的是除了女主弗兰西斯的超水准表演之外，剩下所有演员的演出都精彩到可以颁最佳群戏。由于不妥协与不谅解所引发一系列悲剧，但是悲剧中更有合理的人性，戾气重的浪漫诗。从第一幕路过告示牌咬指甲就最佳女主内定了。
12,三块广告牌,4,蹦出一条小鹿这个必须减分了…而且还那么像CG做的…
13,三块广告牌,5,或许是今年的高分之一吧。有种去年看海曼的感觉。这个镇子上的人都感觉脑子缺根弦。又名《局长的三封信》
14,三块广告牌,4,我对生活从无迷信，为何对女儿的诅咒却一语成谶？我以为世间应有上帝，奈何却被邪佞玩弄股掌。没人告诉女人在丈夫自尽后的一天该做什么，也没人知道母亲在女儿奸杀后的半生能做什么。在血色晚霞里涂上殷红的广告牌，它早晚会在烈火里被遗弃。幸好在斑驳之前，每个经过它的人都看过上面狰狞的字，正义。
15,三块广告牌,4,3.5 电影咋看很酷，美国乡村天注定，被人欺负了24小时内一定要报仇。剧作也确实比较大胆，很大的梗就这样撂下了也不觉得哪不对。演员也都很好，还很好笑。但警长一封信道出了内核的问题：你们这样主要是因为缺乏善良友爱。这不对吧，如果这些红脖缺的真的是爱，一年前他们怎么会去投川普呢
16,三块广告牌,4,无关对错，他们只是执意的做自己，可我竟然被这两个近乎疯狂小人物深深打动，他们永远都像濒临爆发的火山，在一种不顾旁人的偏执中狂奔。出色的剧本与惊人的表演相得益彰，让电影里的每一角落都充满感染力。
17,三块广告牌,4,想到江歌之母。这一生我们会扮演很多角色，父亲，母亲，丈夫，妻子，儿子，女儿，兄弟，姐妹……但最执着而有力量的，却只会是一个失去孩子的母亲。
18,三块广告牌,5,米尔德里德被愤怒冲昏了头脑，丧失了判断，和女儿争吵间接引发惨剧；迪克逊被仇恨蒙蔽了双眼，降低了智慧，伤害了莱德。后来，米尔德里德放下偏执，与前夫达成和解；迪克逊收起愤怒，和莱德握手言和。这一切源自愤怒和仇恨，又以大爱和善意结束。因为“仇恨从来就无法解决问题，但是爱可以解决问题”。
19,三块广告牌,5,这其实就是我不是潘金莲真正想要达到的高度。
20,三块广告牌,5,其实伍迪哈里森演的是一个天使
21,三块广告牌,5,牛逼，牛好看，广告牌边的曼彻斯特。
22,三块广告牌,5,我们已经习惯于接受电影里的人和事都不是真实的，但是这部不是，不但不是，而且把真实玩出花来了
23,三块广告牌,5,其实底色还是童话。但啥叫好剧本啊：每一步都在意料之外，又在情理之中；情节的翻转不硬拗，再小的一个角色，再少量的戏份，都有可信的行为、合理的动机。马丁.麦克唐纳一向擅长塑造群像小人物，演员们也集体交出了完美的演技，台词精炼毫无一个废字儿，情节秒秒钟牵动情绪，喜感又悲情，让你大笑着哭出眼泪。个人年度最佳。
24,三块广告牌,4,回过头看，洛克威尔第一次经过案发的小路，发现了广告牌上的字，为什么是在夜里，他去那干嘛呢？他要么是自发的，要么是执行伍迪・哈里森指派的巡逻任务。如果你能在意这些非叙事功效的情节，就能摆脱电影其它强设定的问题。四星半。
25,三块广告牌,5,死亡只是一个开始，三块广告牌是对人类良知的发问。你会看到懦弱的人强装蛮横，心碎的人假装坚强，相爱的人只能互相怪罪，愧疚的心灵被愤怒埋葬。而死亡也是一个结束，良知告诉你去接受人类的复杂，相信那些未泯灭的精神，带着爱重新上路。
26,三块广告牌,5,4.5 非常喜欢女主这个fierce woman的角色，为了找到凶手，她不妥协不心软，为达目的誓不罢休。但和儿子和前夫的几场戏里又流露出了一个母亲心里的柔软。剑指司法系统的腐化与失灵，但并没有一味诉苦卖同情，将煽情减到最低。
27,三块广告牌,5,片名不如叫“三封信”，马丁・麦克唐纳的电影太迷人了，跟《杀手没有假期》的氛围太像了。抱歉有些词穷，说不上来电影具体风格类型，但静谧气氛下的难以言状黑色元素，荒诞、阴郁而又始终保持着让人感到孤独的忧伤，却又透露着些许的温暖，一部电影占全了五种情绪，太难得了
28,三块广告牌,5,他们开车的时候，心里一直想，就停在这里吧，这里结尾多好，然后就黑幕了，骂了句脏话：我靠，神作！
29,三块广告牌,4,文本是精心算计的高级货，比较欣赏的是在黑色荒诞的分裂之下，底子维持暖色调的统一性，怒诉了分裂、残酷、暴戾的社会现状，却能够在微妙的社会感情上弥合现实状况的分裂，最高明的是这两者还完全没有违和感，这便是美国呀。
30,三块广告牌,5,还是那个味道的马丁-麦克唐纳，舞台剧大师，充满戏剧张力。开头一首《夏日的最后玫瑰》奠定整片基调，虽然发生在美国，但仍是爱尔兰的情怀。私人大爱。第一个评，五星力顶。
31,三块广告牌,5,真正的美国电影。没有一个坏角色，火从头烧到尾。
32,三块广告牌,5,"You thought you knew where the story was heading, then you found out you were wrong, then you were glad that you were wrong."
33,三块广告牌,4,剧本和表演是强项。在点出“三块广告牌”的开局后，并没有去经营案件进展，而是深入角色心理和人物关系，陷入人性对立。故事不断插入偶然性和随机事件，令看似意料之中的发展，带来惊喜不断。在悲喜剧之间恰到平衡，演员藉由角色的人性描述再去发挥出更多火花，表演值得激赏。
34,三块广告牌,5,中西部压力锅版Olive Kitteridge，最后也确实突变成了Olive Kitteridge，连Frances McDormand勉力挤出的微笑都一模一样――这世界确实没什么好值得她高兴的。
35,三块广告牌,5,2018第一部就五星。相比故事，更爱台词。1.―貌似我刚刚被解雇了（稍顿）解雇还是停职我不太清楚是哪个。―解雇吧。2.―很抱歉让你重燃希望。―没事，我至少拥有了一整天的希望，总比没有好。3.―威洛比先生，你的鸡巴可真棒。―这哪个剧本里的？我好像在莎士比亚剧本里见过。―傻瓜，是奥斯卡・王尔德
36,三块广告牌,5,十星。奥斯卡影后预定，最佳影片大热，最佳男配提名。全片大小人物演技集体在线。
37,三块广告牌,4,都对了，编、导、演、音乐，一切感觉都对了。和Martin McDonagh活在同一个时代是我们的幸运。故事线神奇、意外而合理。天才的黑色幽默故事。他是怎么做到的？爱尔兰真是优秀作家的摇篮。全戏骨阵容。看Frances McDormand表演真是至尊享受。
38,三块广告牌,4,看之前到很多人形容榧みM、怒、荒Q，但我s只看到厝岷桶痛。
39,三块广告牌,5,三块广告牌好就好在，它并没有企图阐述一种是非观，它平视人性，像我最爱的电影《撞车》一样，让你重新思考和审视你相信的观念。长大之后很难恨一个人，因为天地不仁万物刍狗啊。但那杯橙汁，那杯递过去的橙汁，是光，是好看的部分，我在那里开始哭。心中无限难过又无限温柔。
40,三块广告牌,5,五年前的七个神经病是我年度第一，当时还为豆瓣评分才七点几感到不平。刚刚看完广告牌，要疯了，不在乎了，真的，一切都不在乎了，随便了，战狼好看就好看吧，妖猫转要美就美去吧请美到天边去哈
41,三块广告牌,4,为了报仇发广告，冲冠一怒烧警局。如此政治不正确，已经难见又难得。
42,三块广告牌,5,当代美国小镇居然还能做出西部片乃至武侠片的神采来，不容易。一开头以为是个美国秋菊打官司，后面人物性格和故事走向都出乎意料，却又没有美剧的烂俗包袱感。都是靠人物性格驱动的故事，让人想起《赴汤蹈火》。只有女主和前夫的和解让人有点莫名其妙。
43,三块广告牌,4,4.0。1.仿佛每个人都身处火宅，无可遁逃。2.帮甲虫翻身，与麋鹿对话，是全片最柔软的两场戏；科恩嫂的演技恰恰好在不拘泥方法派。3.整体不如预期震撼，但着实蓄力打破了好莱坞叙事常规，是个新范本；但并不看好登顶奥斯卡。
44,三块广告牌,4,看的时候一直在想会怎么收尾，最后的出镇便是离开这个舞台――这个过度理想化的舞台，不管什么人干了什么事都不会被抓的小镇――如果是美剧的话，他们肯定会由于某种理由在下一集（季）中途被赶回镇里。
45,三块广告牌,5,剧作层面牛逼到金光闪闪，包括所有配角在内的人物都写的太丰满了，小细节也十分到位，一些乍看无法理解的人物动机细想一番实则又极其合理；正面是奸杀悬案背后小镇人民的“以暴制暴”，背面是警民同心前赴后继共铲奸人的“欣欣向荣”，高潮一个接着一个最后又能以和风细雨般的笔调轻松收尾。妙不可言。
46,三块广告牌,4,每个对话都写得结结实实的，所有人物都有几层立体的面相（除了俩年轻貌美的妻子们）。
47,三块广告牌,5,太出乎意料了，完全不按常理出牌，是很少见的毫无套路的电影
48,三块广告牌,5,剧情很有张力，所有情节看似意料之外，实在情理之中，值得慢慢品味。
49,三块广告牌,5,平和的，轻快的
50,三块广告牌,5,本次入围影片中最有分量、最扎实也最触动人心的一部！更接近麦克唐纳的戏剧，而不是其前两部黑色幽默电影，故事表面平淡但于无声处听惊雷，矛盾冲突及角色刻画之深入和丰富超过其他！在我看来，本片反映的正是今日美国非常重大及深刻的主题：冲突与和解！某些情节斧凿痕迹略重。最后一幕神来之笔。
51,三块广告牌,4,从《在布鲁日》就喜欢马克唐纳的黑色幽默，这次《三块牌》一波三折的故事走向和笑料与泪点的穿插带来了特别的观赏体验，这剧本实在太聪明！科恩嫂表演炸裂，广告牌灭火那一吼，我眼泪就出来了。而悲情的山姆叔，又演了一个让人无限怜悯的角色。PS: 《灾难艺术家》里的Tommy也自己出钱挂过广告牌！
52,三块广告牌,4,你知道当你得知一件遗憾事有了补救的方法，你内疚，绝望，恐惧，甚至萌生疯狂愚蠢的想法，就因为一切突然得到宣泄的出口。但这无补于事，也不是以身试法弥补来不及的来得及。你知道生活最差最烂最恶心最无助最被人看不起的就是：当你觉得够糟不想再继续活下去的时候，你却已经习惯了。这最后无法点燃的湿稻草。
53,三块广告牌,4,“为什么台风都取女人的名字？” “因为她们来的时候都又湿又猛，走的时候卷走车和房子~” ――《毒品网络》
54,三块广告牌,4,3.5；世上所有小镇都涌动着平静而汹涌的「恶」，大众不允许个体撕下道德面具，戳穿真相就是跌破底线，科恩嫂以悍然铁血姿态与之背道而驰；大家都是藉由自身的愤怒与不甘，向外界或他人传递暴力的链接，熹微闪烁的爱之零星最终悄然改变格局；剧本多重转折，有匠气痕迹，涵盖内容过多，结尾收得好。
55,三块广告牌,4,看的有点压抑，泪点低很受触动，演员也很棒，恭喜电影拿下最佳影片，也祝贺女主荣获奥斯卡最佳女演员，山姆最佳男配，实至名归，女主灭火那段演得震撼人心939393
56,三块广告牌,5,当“直面戏剧”与电影媒介携手，灵魂无处躲藏。有时生活甩手给个耳光，错愕之余，我们循着蛛丝马迹，发现片中种种与现实的相互映照。对罪恶的抽象界定，对毁灭的宗教仪式感，杀戮之后，温柔无人能挡。
57,三块广告牌,5,看过最黑色幽默的主旋律电影，反之亦然。全片最暖的人和最蠢的人说了最鸡汤的两句话，要爱啊，戾气催生戾气。马丁不遗余力地往剧本里加料，文学性和流行性兼顾， 不断超出观众预期是技巧，给予每个角色爱则是善意。比起科恩嫂，觉得伍迪哈里森和山姆洛克威尔的男配更值得。
58,三块广告牌,4,妥善协调社会各方利益，正确处理人民内部矛盾，促进社会公平正义，构建资本主义和谐社会。
59,三块广告牌,4,世上本无善恶分，只怪爱恨没解药。虽然本质上还是《杀手没有假期》那一套，但能在这么刻意的反套路和强戏剧里不被各种意志拖累，反而籍此找到如此真实的人和生活，一年下来真的也仅此一部了。另外，这是我近四年来看过最能正确演绎“政治正确”这四个字的电影，从这个维度看，非常有站最佳影片的冲动。→2018.7三刷。
60,三块广告牌,5,特别好。好到不知道怎么写评论。羡慕能写出这样的人物，这样的故事，这样的剧本。
61,三块广告牌,4,剧本太棒，赌十块奥斯卡也是它了从敌人到朋友，从愤恨到友爱，温柔的悲伤中渗透着善良的温度，你我从不是敌人。
62,三块广告牌,5,老戏骨联手群戏相当精彩，当演员、摄影、配乐高度融合时，叫人看到一部极具情感冲击的力作。这部电影没获今年奥斯卡最佳影片真是太遗憾了。
63,三块广告牌,5,演员，导演，音乐，电影剧情，都很好，很棒的了
64,三块广告牌,4,与麦克唐纳之前的作品一样智慧幽默，高潮层层叠起却又有着对报仇意义的深刻反思。我并不觉得这片再“爱尔兰化”，那或许只是大家熟知的独属麦克唐纳的元素，相反它是彻头彻尾的美国故事。扣一分是觉得不给交代的开放式结尾，并不符合本片气质，毕竟导演自始至终没去营造《老无所依》那样的神秘感。
65,三块广告牌,5,大银幕二刷后改五星，发现了好多一刷时没有注意到的感人细节与小幽默，几度泪目。正如映后谈中所说，这是一个很多编剧看完之后应该难眠自省的故事，全片毫无赘笔，从故事结构到剧情立意再到几位主要人物的性格呈现，都能做到均衡且深刻，推荐看过资源的友邻可以去影院二刷一下，相信会有很多新的收获。
66,三块广告牌,5,我心目中的2017年最佳。米尔德雷德，你见到那个人在杀了他之前，别忘了要回你的7美元啊。
67,三块广告牌,4,得劲
68,三块广告牌,5,4.5 细节异常精准，疯狂偏执里藏不住的温柔感伤。
69,三块广告牌,5,“仇恨是活下去的动力，报复是伤心人的良药。” 质感无限接近我想要看到的那种丧家犬式的警探故事，虽然背景是美国。最喜欢的是倒橘子汁和对前夫说“你要对她好”的片段，苦海里的一丝甜，长夜中的一点光。
70,三块广告牌,4,"无法理解为什么没有能到最佳影片。
无论是剧情还是演员演技，都是无可挑剔。"
71,三块广告牌,5,"一个案子牵扯出的小镇生活，人物各个都立住了，环环相扣，冤冤相报，一开始很冷，最后竟然被暖到了。弗兰西斯・麦克多蒙德一出场，就把人吸引住了。这种酷酷的大妈，魅力指数爆表。

很喜欢电影的调子，没有什么正派、反派，全都是人性的弱点，同时又有光。"
72,三块广告牌,5,每场戏都写得太好了，虽然我其实希望导演不要为了那种感觉而且特意说那不是凶手……
73,三块广告牌,4,就像片中出现的民谣配乐，电影歪歪扭扭、不经打磨却又饱经痛怆。“人为别人竟会把事情做到如此地步”一直是麦克唐纳最让观众惊愕的地方，里面带出的侠义气息是他最擅长的。本片充满了决绝的人，将事件从一个不可能引向另一个不可能，让电影从一出“对喷闹剧”慢慢滑向对命运的徒呼奈何。
74,三块广告牌,4,每个身在矛盾中的人一旦放下立场，都变得惺惺相惜起来（是不是有点秋菊打官司的味道，哈）。奇笔别出，相当惊喜，更难得的是不断的大笑一声瞬间又笑不起来的那种新鲜观影体验。
75,三块广告牌,4,lucas这个角色就像刚从卡西家出来。祝福Sam与狗爹奥斯卡双飞
76,三块广告牌,4,4.5 麦克唐纳每部电影的人物书写始终带着一股精致取巧式的“假草率”，他们都诞生于黑色幽默的趣味与俗世的泥潭之中，却从未想着洗清自己，而一切就像熊熊燃烧的火焰和迟来的灭火器。相比之前，这部最脱胎换骨的地方在于其精明的政治嗅觉，所有元素的组合用尽全力死踩点，达到了巅峰造极的怒斥与温情。
77,三块广告牌,5,天地不仁的粗砺与残酷，也行这才是真正的真探。
78,三块广告牌,5,母亲真的各种压力都顶住了，威胁恐吓甚至是儿子的不理解。看到那三块广告牌被放火烧毁，她扛着灭火器一路灭火时，真的是，为求真相，寻真凶，命都可以豁出去了。这是一个痛苦，执着，伟大的母亲。最后尽管没有明确的结局，但是还是人性赢了，很庆幸，没有什么彻头彻尾的大反派。
79,三块广告牌,5,充满戾气而又温柔。
80,三块广告牌,4,"眼泪里的盐分会使你的伤口恶化。
我还以为盐分会对伤口有好处呢。
引爆泪区。"
81,三块广告牌,4,马丁・麦克唐纳太会写剧本了吧，献上膝盖。他的笔下每个人都有各种问题，每一个人物都立体。[B+]
82,三块广告牌,4,临终遗言也要教导人充满爱的传统好警长（旧式价值观）病入膏肓，他的死无疑“感化”了Mildred和Dixon，但却不一定改变什么。内核其实是如此丧的片竟然被拍得如此温柔。剧本太精彩，没有一场废戏，有些场虽然刻意以及巧合了些，但在黑色幽默的一丝魔幻下完全可以被接受。几乎所有角色都是那么立体。
83,三块广告牌,5,结尾两人车上对话处，大家一齐拍手“这才应该是最佳剧本”。每个人物都立起来了，还都有合情顺理的发展曲线。这个世上大多数的人都既不算圣也不大坏，却总有冲突，大家都活得很愤怒，有起由有揭示有解决……吧。我特别喜欢这种把小人物小事情小琐碎拍到妥帖的。
84,三块广告牌,4,唯一的问题可能就是女主角的气质太好了，很多时候的表现都不像是个南方的糙老娘们儿
85,三块广告牌,5,百感交集，五味杂陈……希望人间少点悲痛和别离，善良的人都能被温柔对待，作恶多端的能得到应有的惩裁！不过，将爱的人从身体中割舍出去后，真的能否做到淡定如初？离开的终究是离开了！不管冲动与否，广告牌会诉说出不公，能不能讨回公道再说，但至少是父亲心中的一份爱的表达和对恶势力的对抗。
86,三块广告牌,5,科恩嫂主演了一部不是科恩导的科恩感十足的电影。
87,三块广告牌,4,1.剧本极有功力，许多不无荒诞的偶然性事件与善恶兼具复杂暧昧的角色让影片浸染上存在主义之味。2.幽默、暴力与温情的精妙调配使观影者不断在多种情绪、感受和动作中轮转，与人物同呼吸共命运，仿若深陷燃火老宅之中，主观时间因而被大大拉伸。3.贯穿全片的反讽手法，如暴力时刻的温柔民谣。（8.5/10）
88,三块广告牌,5,神奇的剧本，片中出现的所有暴力行为动机都是真善美
89,三块广告牌,5,没有一个人不耐看。就连坏心眼的南方奶奶，吹牛的嫌疑人，伤心侏儒，刷牌工人，都耐看。因他们是蓬勃的真人。主角更是女武神，女鲁迅。
90,三块广告牌,5,在所有的疯狂和痛苦之后 依然给予所有人原谅与温柔的拥抱 坚强的外表 隐藏不住内心的绝望 跪倒在硕大的广告牌前 是内心深深的无力 几个小镇小人物的人生 这年头好好讲故事的电影已经不多了
91,三块广告牌,5,大爱，我的观影感受就是静静呼吸又提心吊胆。最后两人远去以为要结束而不希望结束，近景两人又对话庆幸还好没结束却又结束了。。。好爱这种感觉。
92,三块广告牌,4,人达到愤怒的极限，就会失去理智。互相发泄愤怒不是好方法，冷静下来再行事更好。（话谁都会说，但是真正能够做到的人少之又少。）
93,三块广告牌,5,最喜欢的是完美家暴那一段，还有医院基友重逢。手起刀落，一言不合扔下楼。
94,三块广告牌,4,实在是没想到，到最后成了治愈系的心灵鸡汤了，赤裸裸的不看到最后猜不到结果，难得的是里面所有的人物角色都立起来了，一切虽然意料之外，也在情理之中，挺厉害的。
95,三块广告牌,4,确实如高晓松所说，能量密度足够大。不能比啊，一比就感觉前任，战狼这些电影是拍给幼儿园的孩子看的。
96,三块广告牌,5,看片中不停地想起江哥妈妈。剧本打破几乎所有俗套，纯粹，有力。世界上哪有那么多好人坏人，这片真实复杂的剧本就像人性。灭火那里看哭了。
97,三块广告牌,5,剧本无敌......剧作家是真心厉害......
98,三块广告牌,5,的确是今年目前最佳，好的让人牙痒痒，堪比文学性很强的小说了，把情感多层次地展现出来，痛苦和笑都同时带出来。Dixon这个角色不输妈妈啊，打台球那里就差点亲上去了，真是今年最好的同性恋角色。妈妈自然不必说了，该给奥斯卡。
99,三块广告牌,5,在生活面前，没有人是强者。
100,三块广告牌,5,满分剧本。
