,movie,star,comment
101,三块广告牌,4,看得挺爽，演员太强大，每个人都有自己的存在感，伍迪・哈里死了之后，一浪一接一浪的火爆，以为要互相大开杀戒了，其实是……故事走向不好预测，没想到结尾这么暖。
102,三块广告牌,4,威尼斯最佳剧本，多伦多People's Choice Award，实至名归啊。编剧太可怕了，“残忍”地用几件事情让事件关键人连环地紧扣在一起，但最后又能看见他对人性善良的坚信。观影过程中整个影院都在不停鼓掌，真的第一次遇见这样的情形。
103,三块广告牌,5,确实是绝技之作。剧本好到无以复加，整体虽仍就是麦克唐纳的老路数，但也更加精致。与以往风流气不同，此回每场单独的戏都是起承转合上乘之作，数场戏联合起来简直运斤成风，稳稳的最佳剧本，此外他设计的每一个意外都是理所当然的真正意外，这是对人生最慈悲的观察。麦克多蒙德的表演精湛，生动而坚毅
104,三块广告牌,5,英国人写出了近年最好的美国群戏，荒谬与真实伴生，敏感中自有力量，台词精准牛逼，剧本炸裂够劲，全程烈性酒余味竟是回甘的。一点就着一碰就炸的偏执狂们，不喝二斤不能为之痛哭流涕。
105,三块广告牌,5,最喜欢踢3个小孩裆那里。
106,三块广告牌,4,结尾停得恰到好处
107,三块广告牌,4,180215纽约到北京；很美国的故事，生活中的各种没来由的沮丧、矛盾、焦躁、失败，和费尽心机找到的不知道正确与否的出口。无关道德或对错。
108,三块广告牌,5,人物太有力量了，全程挪不开眼，情节转折看似戏剧色彩浓厚，内里不过都是人性。感觉小说会更精彩。喜欢！
109,三块广告牌,4,在怒火中，加入少量爱，可以平静地燃烧。「与其凋零，不如从容燃烧。」via Neil Young
110,三块广告牌,4,这不就是奥丽芙基特里奇带着那张肃杀的面瘫脸从缅因州穿越到了密苏里州了么？如果上帝死了，我们能否惩罚魔鬼？如果必须释放出心中的魔鬼，我们能否惩罚魔鬼？如果我们就是魔鬼，却一直浑然不知呢？
111,三块广告牌,5,我的天，太厉害了，堪称完美的电影。
112,三块广告牌,4,没看之前觉得是鸟小姐，看完之后预定今年最佳女主科恩嫂，以及全片演员最佳群戏。
113,三块广告牌,4,【B】为了给情感找到出口，人们总是不得不确信某些想法，继而变成执念，甚至成为生活下去的决心。通常我们会认为这份期望应当是喜悦的，《广告牌》则说，其实它也可以是沉痛的，而且和喜悦一样，也常指向虚无。剧本对场景与人物的多重有效利用，戏剧式的紧密，很值得学习。但不觉得主题阐述十分成功。
114,三块广告牌,4,很赞的故事片！南方的幽默和暴力都有，美国的问题都有，对白很棒，几个警察的角色都很立体，但我真想说：弗朗西斯的表演和扮相都和奥丽芙一模一样，一样演技爆棚，但其实没有改变……我是吹毛求疵我承认97
115,三块广告牌,5,【愤怒begets更大的愤怒，内心平静是比仇恨更有力的武器。】导演在传达这个主旨的同时，用了黑色幽默的形式来阐述这个本应苦大仇深的故事，把种族歧视等社会问题一网打尽，还充满着叙事张力！Dixon才是全片最核心的主角~
116,三块广告牌,4,冤冤相报何时了，悲凉的是只能借助循环的愤怒和暴力对抗绝望狗屎的现实、释放内心的伤痛，配乐和冷幽默带来些许调解和慰藉，干脆利落的了结尊严赴死，一句令人动容的Thank you后两个被伤和伤人最深的人结伴上路，反思阴暗的社会境况，演技集体在线，FM延续了奥丽芙的形象，WH的人设太好，SR演得精彩。
117,三块广告牌,4,配乐很棒
118,三块广告牌,4,真压抑啊，男女主角都不是坏人，可愤怒却让他们成为施暴者，不过这也是一个教人以德报怨的故事；最终男女主角的愤怒被宽容和爱稀释了......最喜欢电影开头前2分钟营造的氛围，背景音乐是一首伤感的爱尔兰民歌《last rose of summer》
119,三块广告牌,4,好片，人性有弱点，人无完人暴露出了种种人性，最终还是真善美，值得一看。
120,三块广告牌,5,好看，有剧情，能引人入胜，看了两遍了都。
121,三块广告牌,5,全镇都是狠人。
122,三块广告牌,5,奉献了毁灭性的画面，燃烧着人们重生的希望，悲悯而怜惜。
123,三块广告牌,5,一个受人爱戴却大限将至的长官，一个想证明自己老大不小还母亲住一起的片警，一个日常和女儿对爆粗口却要为她伸张正义的红脖子母亲，三个人，三张广告牌，连接他们的是一个没头没尾的奸杀案。大家僵硬巴巴地活着，生活向前流淌地艰难，派分给每个人不同的，他们并不想要的答案。
124,三块广告牌,5,California Theatres Berkeley 2017.12.4.3:40pm 开头极为沉稳，事后想起很drama的情节却在层层推进里自然地抵达观众。影片展示了一种今天尤为难得的相互理解，已经深度撕裂的美国及世界太需要这种叙事（在都进行了暴力宣泄后，左右同车前往指认的敌人，然而敌人不能被明确，只能结束在悬而未决中）。
125,三块广告牌,5,太精彩了。没有谁对谁错，大家都只是在做自己觉得正确的事。
126,三块广告牌,4,千人千种解读，我觉得这个结局其实挺好！我记得我昨天去看的电影，因为刚听说科恩嫂刚得了奥斯卡影后，又看了评价，所以去看的，实话实说就是我全场哭了三次，第一次是警长自杀的时候，第二次是女主在卧室里用左脚和右脚说话的时候。第三次是在火烧广告牌，她在第二块广告牌上灭火器用完的时候。很棒！
127,三块广告牌,4,仿佛已经看到了这片子下下个月血洗奥斯卡的画面……
128,三块广告牌,4,相信很少有一部凶案片的最终目的并不是揭露真相，整部的重点全部放在人格的多面性和人性的转变，这似乎比找到凶手更重要，女主气场强悍，演技了得
129,三块广告牌,4,看到时候不时笑，看完却又憋得很。小镇上的人个个鲜明，性格皆让人爱恨两难。
130,三块广告牌,5,啊啊啊啊啊，超级无敌赞，看一遍根本不够。
131,三块广告牌,5,太棒了太棒了太棒了太棒了！希望国内可以引进！想起彭高峰寻子。
132,三块广告牌,4,就烧伤了被递橘子水那段我是哭着笑的。整体感觉主题被太多枝节岔开了，有点可惜。音乐很赞。
133,三块广告牌,5,完美
134,三块广告牌,5,原来这不是一个破案片。关于人性，善与恶从来都不是绝对。
135,三块广告牌,5,三刷 真探
136,三块广告牌,5,感恩这种负能量电影，才显得善意珍贵。看到拖鞋对话忍不住的流泪，恍惚从帅到爆炸的妈妈身上看到了江歌母亲的些许影子。
137,三块广告牌,4,结局惊艳不过想说警长形象也太完美了吧，这个垃圾小镇简直配不上他，两封信摆平一切，难怪能娶到如花似玉外国文学妞。心疼被扔下楼的哥们，心地这么好竟然是复线。
138,三块广告牌,5,Martin McDonagh式的荒诞，情节充满了不确定性，角色也充满了不确定性，其实是一个特别忧郁的黑色喜剧，所有的笑点来自于让人捉摸不透的人性，比起用巧合制造笑料的更为高级，而佩妮洛普、女前台这样戏份极少的配角又加强了一些恶趣味的成分，这样一部电影我居然哈哈大笑了好几次。
139,三块广告牌,4,何以解决仇恨，是正直、勇敢与爱。
140,三块广告牌,5,整个故事的走向都是一个个合理的没想到串起来的，不按套路出牌，还有些黑色幽默，精彩，几个主要人物刻画得比较厚实，表演也非常到位，愤怒只会招致更大的愤怒，怨恨只会招来更多的怨恨，亘古不变的解决方式是―爱，开放式结局带出不少思考，值得细品。
141,三块广告牌,5,如果看过麦克唐纳德话剧的人想必对这种黑色幽默的风格十分熟悉，尤其是《丽南山的选美皇后》，与这部电影有十分近似的气质。全程笑声不断，但内心却是彷徨凄苦。每一个转折都让人难以捉摸，生活从不能如愿，人生的每一步选择都可能导致后续的大变动，三块广告牌是一种隐喻也是一个注解。
142,三块广告牌,5,愤怒不得宣泄只能酝酿出更深的愤怒。令人愤怒的案件牵动周遭人带着他们的情绪疯狂着纠结着拧巴着心疼着爱着。而导演却把故事讲得如此温柔善良，硬硬地干，心却是软软的。彻底的矛盾，却节奏克制环环相扣，每当转折发生便会有抚平伤口的歌声响起另旁观者默默流泪。别说戛然结尾是套路，换作谁会有答案？
143,三块广告牌,5,一点不矫情 是真丧 丧到砸在当代小确丧脸上能砸出一个窟窿 
144,三块广告牌,4,好看的一逼！编剧架子搭的就很好，开头引人入胜，笔触干脆利落，每个人物都是多面体，所有反转卡点都卡得很准，难得的是结局也没有流俗。我最喜欢的是，它明明是一部爆裂冷酷的丧逼片，但从电影一开头被翻身的虫子开始，裹藏了很多温柔的细节。科恩嫂太适合这个角色了，铁血老妈，永不低头。
145,三块广告牌,5,一万零五颗星。从技巧到叙事无可挑剔。最难得的是结束在最应该结束的地方。太扎实了，简直每一分钟都是完美的。
146,三块广告牌,5,短时间内把复杂线索和关键冲突讲清楚的能力太强了，每个转折发生的时机又都选择得太妙了，以至于既不落俗套，又举重若轻地挖掘得甚为深入，好几个场景都让人不由自主反复琢磨。原来一个人的痛苦，乃至一个地区的痛苦可以通过这种方式来表达，我觉得这是马丁・麦克唐纳的创新，他不是第一次这样聪明了。
147,三块广告牌,4,这种暴躁暴力的冷硬氛围，我（这样的女人）活不过三分钟吧（大约只能存在于开头的歌里了）。
148,三块广告牌,4,下午看完红海行动晚上看这个，待会儿回去需要看点轻松的东西缓一缓……大概是期待过高，感觉没有想象得好……美国人办案是不是太随意了点？我以为女主纵火至少要喝个茶啊，怎么就问了两句话听了伪证就作罢了？……PS那个烧伤的警察我一直在想为什么这么眼熟，原来是银河系总统啊
149,三块广告牌,5,偏见、狭隘和暴戾，这里恶的所有来源.。剧本太棒。8.6
150,三块广告牌,4,丧比金句 ―― “我至少拥有过一整天的希望，总比没有好。”
151,三块广告牌,5,”咎e秀! 怒、仇恨造成的Bi反，hh相扣。折射下的美社於小中。有McDonagh招牌的黑色幽默穿，蚝眯蚣怃J。人物塑造精彩，群蛞涣鳌Frances McDormand演的母H太了，有翁羧世界的F馄恰５又樗心痛不已。Sam Rockwell角色是大@喜，D折的很好
152,三块广告牌,4,还不错。但不喜欢强行升华、强行和解的后半段。不是不相信真善美，只是不相信真善美会在愤怒和怨怼积累到最大值时突然降临。来得那么激烈的偏执，恐怕不会这么简单就放下。
153,三块广告牌,4,南部换了光景，在最坏的时代他们都成了最“好”的人物。看完电影做的第一件事是买OST，第二件事是买原著剧本。其实私心希望Woody Harrelson可以拿最佳男配。
154,三块广告牌,5,以电影的“上帝视角”来看，都有苦衷，也都有伤害；然而，转换到现实的媒体视角，你我的感受都将去“站队”，一部挺有思辨色彩的感伤电影，黑色但是不幽默。
155,三块广告牌,5,人物描绘得太精妙了，在这个绝望的故事里，每个人都是施暴者，每个人又都是受害者，而恰到好处的音乐又给深陷仇恨的人披上一行温柔的注脚。如果说《海边的曼彻斯特》给2017开了个“丧”字头，那么这部夹杂着更多讽刺意味的广告牌恐怕也能给18年加上一个“tough”的标签。
156,三块广告牌,4,1.以牙还牙以眼还眼的处世哲学；2.暴倚祸伏，多行善事，阿弥陀佛；3.不时被影片逗乐，不时被影片渲染的暴力气氛慑住，剧本真心给力，人物塑造得神采奕奕，配乐好听。
157,三块广告牌,4,人性很复杂，没有绝对好和坏的人，只要心存善意，社会会更美好，万事不要太过激，要心存信念，你对他人好一点，他人这对你好一点。我们总是对身边最亲最爱的人说一些狠话，为什么不能对亲人温柔以待呢，都是出于爱，但是如果更温柔以待，或许人生就不会有那么多的自责与遗憾了，每个人要学会珍惜美好。
158,三块广告牌,5,"哈哈哈，这句台词对话太经典了:                                
男:树三个广告牌不能让女儿起死回生。              
女:搞19岁的女孩同样也不行！                                 
陈独秀同志，请你坐下"
159,三块广告牌,5,并不觉得有什么反套路不套路的，主要是人物和人物关系反映社会矛盾和困境，结尾给力，有后劲儿。（是有刻意的地方，但人家要表达的东西就是那么有力，在那里）
160,三块广告牌,5,是本年v最多的影片，反常故事Y，黑色幽默，又暖又省０凑粘Ｒ故事Y，警L就精竭]^一番D苦的推理找出真矗然而」室馔媾^的意志，很多被J槭O端的情都l生在了@部影中反倒@得真。e面的人不上大奸大海都有自己的苦衷。
161,三块广告牌,4,Sam Rockwell 实力诠释什么才是一个小人物的成长，躁郁狂暴的个性，天生敏感自卑、情感细腻，拳拳见血，暴力的展现丝毫不手软，历经变故和挫折、迟到的正义和使命感让他的善良本心更令人动容。这样一个让人恨让人怜的角色，实在演绎得太深刻太出彩了。
162,三块广告牌,5,故事精彩，台词好评，卡司阵容有惊喜，且个个贡献出上佳表现，尤其是卢卡斯・赫奇斯，《海边的曼彻斯特》《伯德小姐》《三块广告牌》接连参演三部佳作，已成功引起我的注意（哇，作品表还有《布达佩斯大饭店》《月升王国》）！――不想让家人看他被病痛折磨的惨样，所以他选择留下快乐回忆、先行一步。
163,三块广告牌,4,暴戾尽头的温柔，非常有节奏的一个故事。表面上一个爆发接着一个爆发， 但是实质表现的是一种克制、忍耐和秩序内化的过程：我们必须承担一切，我们必须承受一切。喜欢这个题材的观众可以听一下NPR的podcast s-town 让人知道o'connor和faulkner的故事真的不是凭空而来。
164,三块广告牌,4,怪不得那么熟悉的调调，一看导演还导过《杀手没有假期》和《七个神经病》，明白了。
165,三块广告牌,5,1.女主在不作为的国家机器和以暴制暴之间徘徊，最终和国家机器和解2.金基德式故事：人物在遭受毁灭性打击后精神失常，做出反常举动，比如滥用暴力，并且这些行动推动剧情发展3.这是一部西部片
166,三块广告牌,5,爱恨如此强烈，却拍得平静利落，有巧合反转，也欲言又止。小人物反抗警局，如东木附体，警长的信又进了一步，爱是更强大的精神力量，一杯橙汁改变Dixon，drama但很动人。正义也不是老爷车和萨利机长里那么直接分明。广告小哥动物园小妹小恶魔都是很出彩的配角。
167,三块广告牌,5,非常有得奖相的片子，剧本、导演、表演各方面都很优秀。人性的复杂和面对命运的无力感在快速推进的节奏中表现的淋漓尽致，每个角色都很生动。女主有力竞争者，Woody和Rockwell可能性也很大。
168,三块广告牌,4,剧本水平高于导演能力，有些地方拍的有点电视剧感。但演的很好，人物也都有种善意的天真，除了演伍迪哈里森老婆的那个女演员，跟大家在一起简直场场都在自取其辱…// 太爱柯恩嫂了，好莱坞最酷，酷到炸裂！一星给嫂子
169,三块广告牌,4,马丁・麦克唐纳扎实的剧本所造就的大师之作。独辟蹊径般用幽默展现生活的无常与无解。结局则是在悲伤与虚无间做出了自己的选择。
170,三块广告牌,5,这部正能量的片子告诉我们，努力很多时候都是能奏效的，特别是以暴制暴。
171,三块广告牌,4,结尾猝不及防，又觉得好像这样最好。愤怒、仇恨，还有偶尔的善意感动，最佳群像当之无愧。
172,三块广告牌,5,故事的容量极大，涉及诸多社会问题，但每一条副线都完整，每一个角色都立得住，矛盾中生出矛盾，冲突里隐藏着冲突。结局看似仓促收尾，但细想来却是让故事免俗的神来之笔，最佳编剧实至名归。剧本唯一的瑕疵可能就是巧合过多。
173,三块广告牌,4,硬是把一个女儿被强奸谋杀的悲情故事拍成了口味独特的喜剧片。有仇必报，戾气很重，但又是这么的可爱。
174,三块广告牌,4,剧本真硬啊。很多地方在套路和诡异幽默之间的拿捏非常到位。
175,三块广告牌,4,又名《一个失去女儿母亲的“暴”款10W＋》《震惊！女儿转世了，不是三毛，竟是一头鹿！》《我不是潘金莲之我是血性武二郎》《警察局长自杀前的三封信》《无声告白之我要爆粗来》……
176,三块广告牌,4,#金马54#一起罪恶无果又牵扯出更多的罪恶，又用喜剧形式带动起角色的愤怒和人性的黑暗，绝望和希望都穿透而来。人物塑造极其出色，每个角色都有鲜明的性格，除了女主以外狄克森尤其出挑。悬而未决的强暴欺凌谋杀已不必追究，所有这些亮眼的角色都把这个故事撑得非常饱满，力度恰到好处的大气之作。
177,三块广告牌,5,真的精彩！背景，剧情，演员都给力！复仇的外表下也不缺乏阳光温暖。
178,三块广告牌,5,喜欢的主要原因是这部片子每个人物都很丰满，每个人的优点缺点、强悍脆弱都很好的呈现出来，加上情节推进，整部片子张弛有度。影片中的母亲太帅了，强硬而温柔的人!
179,三块广告牌,5,社会诉求与个人诉求的冲突，人们都在同一框架下挣扎。
180,三块广告牌,4,好看是好看的，但有些过于机巧，层层转折虽然在意料之外，却有明显的经营痕迹。每个人都有自己的困局，每个人都陷于自身的泥沼中不可自拔，惟其如此，那些些的温情、释然与原谅才更加动人。
181,三块广告牌,4,剧本蛮破格，最好的是结尾
182,三块广告牌,4,立牌回应了纵横小镇的各种危机，再次立牌确认了这些危机的表面性终结，而本质上，他们的回归初心是以荒诞开始和告终的
183,三块广告牌,4,当以为只身一人against the world时，也会偶然发现人性中一些本质上的善吧……虽然开放结局却也仍是足够令人绝望
184,三块广告牌,4,感觉到生活的残酷，人性的一丝温暖，编剧真的很棒，情节安排有张有弛。
185,三块广告牌,5,剧本太强大了，矛盾连接着矛盾，矛盾套着矛盾，矛盾催生着矛盾。在极大的戏剧张力下，塑造了非常可爱的几乎所有角色。而全片最重要的一句话居然出自女主前夫的小女友之口，吝气催生吝气。科恩嫂太硬了，这角色非她莫属。
186,三块广告牌,5,发泄，隔阂，谅解。充满无理取闹的激烈冲突，又无比理智地一一化解。虽然主题沉重而无奈，却用明快的色彩和诙谐的表达给人温暖。
187,三块广告牌,4,"一念天堂，一念地狱
所有的喜怒哀乐都如此自然，叙事节奏和表演都是一等一
续集是叫Bonnie & Clyde吧98"
188,三块广告牌,4,好在细节丰富，故事不套路，表演也很棒。这种偏执狂的故事确实是比较讨巧，但多牛逼也谈不上，女主角的戏差不多被那几个暖男配角抢光了。看来今年的奥斯卡又是矬子里拔大个的一年。
189,三块广告牌,5,质量十分上乘的电影  可惜的是我们这边排片真的是太少了
190,三块广告牌,5,暴戾下的柔情配乐，悲痛下的玩笑话，废柴的坚守，适时的结尾，和高潮时的两把大火
191,三块广告牌,5,Comèdie tragèdie. La vie est injuste surtout pour les petits. 边哭边笑，强颜欢笑，每个人都活得特别痛，Mildred勇敢地去撕破惨淡的现实，最后和【】驱车上路恍惚让我看到了Furiosa和Max，差点让人信了是个HE。这片操纵能力太强，悲喜错落有致，喷血那瞬间我就决定给五星。女主男配！
192,三块广告牌,4,强势的母亲，强势的母爱，女主表演太好了，影后级。挺能反映美国社会方方面面的问题的，三块广告牌，立在那里就是美国的立国根本，虽然也会有各种想毁掉它的东西存在，但它一直在那里。
193,三块广告牌,5,1、当你与世界为敌，理解你的可能反而是你曾经的“敌人” 2、堪称反套路教科书 3、当威洛比写完三封信，他就是上帝了 4、放下仇恨是每个人都要修的课题 5、奥斯卡奖，Good Luck！ 
194,三块广告牌,4,科嫂有望再拿女主与冰血暴相反的角色但都如此黑色。看似无头尾的故事其实就是大火烧掉的过程，伸冤对抗整个世界的同时也在摧毁和建立了新的东西，一个个丰满的人物意外转折无非是唤起正义的普世价值，尽管他们像小恶魔不起眼营私利满是缺点愤怒甚至狂暴。为马丁台词鼓掌各方面都很好的奥斯卡热门，金马
195,三块广告牌,5,预定一个今年最佳，从剧本，演员到导演无可挑剔！笑点泪点一样密集，看得真是舒心。只是不敢相信这片竟然跟星战8这个垃圾同分，内心mmp
196,三块广告牌,4,看了三分钟突然想起来马上要公映，刹不住车了。。看完必须影院再刷，哪怕只为了看字幕保留多少狗娘养的婊子和逼
197,三块广告牌,4,一部歇斯底里的躁郁症电影。剧本与其说工巧不如说投机。用最政治不正确的手段拍出政治正确的初衷。美国社会的现实可能比这片要更加撕裂吧。
198,三块广告牌,5,答案在路上，往前走就对了，管他左脚穿的是愤怒，还是右脚穿着的宽恕。
199,三块广告牌,5,就好像一块长年在阴暗角落里长满霉菌的龌龊石头，有天突然把它翻过来，发现背面画了一只无比萌蠢的小兔子。去你妈的吹毛求疵的影评人，去你妈的套路，这是我近几年看过的最令人愉快的电影，看完只想像小李一样快乐的大街上头摇以巴晃。
200,三块广告牌,3,这题材太适合奥斯卡最佳影片了，完全贴合美国社会热点。人物和结尾写得不错，洛克威尔是目前为止我心目中的年度最佳男配。Burwell的配乐动人。但是麦克唐纳再次证明他是一个精于算计的戏剧编剧而不是一个优秀的电影导演。以及大家称赞群像表演时请把艾比・考尼什排除在外谢谢。
201,三块广告牌,3,麦克唐纳在黑色幽默和社会正剧之间摇摆不定，结果两边都没搞好。一部很好的颁奖季电影，不是一部好电影。
202,三块广告牌,3,设下这么巧的一个局，最后落点如此轻飘飘？到头来居然有点被喂鸡汤的感觉......
203,三块广告牌,3,可能我心里还是戾气太重，这种最后落脚点是弥合、和解、宽恕、理解的电影，总觉得太温和了，尤其是当那种冲突和对抗，可能无关于那位警长（当权者）人格的优劣，而是一种结构性的不可调解的时候，这碗鸡汤我是不喝的。黑人、同性恋、被侵害的女性，这些深度撕裂本身也无法用一句理解来弥合的。
204,三块广告牌,3,开始每个人的戾气都那么重 就被几封信鸡汤了
205,三块广告牌,3,有点失望。开头情绪很足，人物的性格和动作收得很紧，很克制，越往后越散，从炸警察局开始，后半段彻底沦为口水片。愤怒和暴力是最简单的解决办法，省略了探讨和关怀，唬住观众的视觉，最后弄个公路式结尾，充满”写不好了，算了“的感觉。可以想象，绝对是一堆聪明人在办公室头脑风暴出来的剧本。
206,三块广告牌,3,生活和命运，都是巨大的矛盾体。仅以那场大火的起因、过程和收场为例，就暴露了整部电影的盘盘设计，街头运动般的冷静作案与歇斯底里的发泄并无不同。以牙还牙的母亲，与那个怼死女儿的母亲，惨遭家暴的失魂妻子，依然是同一个人。三封遗书与三个家庭，更像扑灭不了的血与火。
207,三块广告牌,3,3.5一个密西西比乡村的群像人性大戏，被拍成了想当然的黑色喜剧，宽恕与爱如此烂大街的主题，在嘲笑的同时又不可避免地去拥抱他们，每个人物都背负着秘密，害怕被揭开，却又在寻找替罪羊来解脱，但刻意设置的情节还是让人物愈加不真实，剧情转折地过于牵强，削弱了情感的力量，也就剩下表演救场了
