,movie,star,comment
332,三块广告牌,3,一部优秀的电影，然而精彩都只停留在开头。好莱坞式的剧作痕迹在之后的情节中接二连三地浮现，很多的情节点都能在意料之中。一部专注于冲奥的竞赛片，缺乏惊喜。
333,三块广告牌,3,全片就是洗白各种人，结局加分
334,三块广告牌,3,结尾看不懂……硬要升华什么东西还是想咋滴……3.5星
335,三块广告牌,3,太美国了
336,三块广告牌,3,演员表演都很棒，就是对其处处刻意强行设计用以带节奏推情节的人物事件不敢恭维。前十五分钟十分精彩，然后就一路平庸地文艺到底，纵然极力渲染角色性格情感，但终归是术的小聪明。不知道金球还是不是那个金球，不过显然我不是吃这套的文艺青年了。
337,三块广告牌,3,3.5 真的没有到神级，编剧也就讨巧而已，开篇让广告小哥拿那本《好人难寻》已然剧透了这部电影的走向，可能是之前的好评让我有了高期待。喜欢洛克威尔的戏，但真的真的不要再胖了好咩，已然认不出那个演月球的小哥了。
338,三块广告牌,3,好吧我是靠着主角们的表演撑下来的，女主真的是赞，世界如此冷漠有时就是要学习她这样怨愤戾气十足对抗所有人。sam怎么胖成这样啦><但是演技和魅力还是依然在滴~他的角色和广告小哥red有点微妙。扮演sam妈妈的居然是费城深柜Mac的妈妈哈哈哈哈，完全没有区别
339,三块广告牌,3,好故事，但没结局，看的不痛快。穷乡僻壤，大家都没有好下场。但好像也不无聊。密苏里的乡村爱情故事。
340,三块广告牌,3,名气很大，看过也就还行。
341,三块广告牌,3,真不敢给四星02♀15
342,三块广告牌,3,（@台北真善美剧院）
343,三块广告牌,3,镜头语言还好，中规中矩，胜在创意
344,三块广告牌,3,应该叫做三封信，看得我昏昏欲睡！
345,三块广告牌,3,跟年拆部一右拥摹
346,三块广告牌,3,爱与恨的边缘，致郁分泌治愈。又一波创伤后遗症套餐。整体说来命题太多，戏剧冲突块状化，粘合度差。人设太投机，除了常规命题外，还塞入体制与个体，以暴制暴的合理性与诡辩。分流之后对应的2017佳作应该是：底特律、风河谷、勇往直前。整个剧组都像在酒缸里泡了三天，半数以上人物动机生硬失真。
347,三块广告牌,3,觉得也还好吧，剧本确实不错，比水形物语好多了，但总觉得那个警察的转变太突然，我也不赞成片尾的做法…
348,三块广告牌,3,美国好警察的故事，局长忍辱负重，唯一有缺点的年轻警察最后也浴火重生，而“上访者”跟疯子一样，不可理喻，不过最后也对自己行为有所反省，所有人最后都和解了，和谐社会，只有人性问题，没有社会冲突。感觉这片在中国放也能起维稳作用，在现在大多数人已经不知道两国有何区别的情况下。。。
349,三块广告牌,3,电影名字应该是三封信，编剧下足了心机，把未破案件和相关人物的生活交织一起，还给了观众一个充满希望的结局
350,三块广告牌,3,受不了，从人物、事件、表演无不都在大写两个字“反转”，伍迪哈里森往科恩嫂脸上啐了口血后两人表情的迅速变化堪称全片最尴，精准且套路好比两台会演戏的机器人，其余尴尬桥段无数，刻意追求的戏剧冲突和所谓人物复杂度就像导演在耳边对着观众们说：瞧，这个段落剧本该画重点分析啦。
351,三块广告牌,3,太沉重 看不动
352,三块广告牌,3,风评太好，反倒有点失望
353,三块广告牌,3,Sadly 好的地方和烂俗的地方一样多。（为什么最近看的这些大热片都有种没剪好的感觉...）
354,三块广告牌,3,三星半。警局局长孔明：我身后留下仨锦囊，尔等依计反转。
355,三块广告牌,3,一般的冲奥片，转折有点生硬，不知道为什么会这么高分
356,三块广告牌,3,_3min氛O好 到後砘本看不下去了 冤冤相 想念我密K里哥伦比亚
357,三块广告牌,3,吹的有点神
358,三块广告牌,3,不喜欢那么极端的解决处理问题的方式 不是至恶才能至善的
359,三块广告牌,3,三块广告牌，警长的三封信。。。这部电影其实和水形物语一样都是童话，只不过这片用了现实主义的方式在拍，它比水形好的地方可能也就是结尾吧。洛克威尔这样的警察是会因为一封信就轻易转变的吗，小镇上的人其实都是很善良的虽然他们可能立场不同却依然都是好人，就这点来说和现实的差距就是天上地下。
360,三块广告牌,3,额 说实话我没有觉得有友邻们评价的那么好……
361,三块广告牌,3,”揪巧，演T表演好，但不合我胃口。
362,三块广告牌,3,无感，Dixon的洗白很牵强，不喜欢放火后Mildred正好看见案卷和偶然听到强奸犯对话的刻意桥段。嫌疑犯不是凶手及开放式结局也有点俗气。当然女主男配演得都很好。
363,三块广告牌,3,看一遍就够了的故事片，规规矩矩的强制戏剧节奏电影，观众没有自由，还好文本写得不错。
364,三块广告牌,3,每个人物都没按照观众的期望出牌。案件没有解决，每个人物却都发生了转变
365,三块广告牌,3,三星不能再多了，两颗给镜头语言，一颗给所谓的“男配”，一个各种装的剧本，一位故作聪明的编剧，拧巴的情节反转，真的太做作了，现在真是明白为什么没得最佳了。看得我憋屈，和我弟从东二环游荡到北四环，终于盼到晚上来到北三环，最后一肚子气回家睡觉，并且为了等电影花了60抓二十分钟娃娃
366,三块广告牌,3,好奇葩的真治愈系
367,三块广告牌,3,说真的，没觉得有多么赞。
368,三块广告牌,3,"生在这样的自由国家，你们有责任针砭时弊，有责任去告诉，从你们的角度人性是什么样的
"
369,三块广告牌,3,人物角色异常丰满，演员角色集体在线，人间百态的刻画折射出真实美国的世间百态，一切的一切都提升了我对剧情的期待。结果大跌眼镜：凶手不是那个混蛋？那你安排他出场干啥？凶手是谁也不管了？互相有仇的几个人就这样和解了？还要跑到爱达荷去杀跟自己无关的强奸/杀人犯？哥们你这剧本有点过了啊。
370,三块广告牌,3,元素过多，剧情靠偶然和刻意来搭建，不流畅，表意不明。看出来是朝着得奖去的，剧情讨巧手法娴熟关键是演员太牛逼了，但真的不是值五星的牛逼片子。
371,三块广告牌,3,警察局街道门口没有监控吗……为什么这片子里每个人都在打架摔瓶子破坏财务混社会 却没有一个人被抓起来？？？女主这么轻易就逃脱了？？疑似罪犯的人如果不是罪犯为什么要去挑衅女主？？？
372,三块广告牌,3,人物关系体现出真正的黑色幽默：女主与女儿与前夫与侏儒与解雇警员，解雇警员与母亲与广告牌管理员……伤害，那都不是个事，我本善良，哈哈哈…… 自杀的警长是个高大的“魂”，后继者本该有故事却形同虚设；一封遗书的作用可以伟大，却将活着时候的言传身教全盘否定，何况是对一个死心塌地的追随者？
373,三块广告牌,3,比较boring
374,三块广告牌,3,讲真我觉得警长和迪克森的转变都有点莫名其妙。
375,三块广告牌,3,都各自尽力了，犯浑的迪克森其实是个好人。
376,三块广告牌,3,几乎难以共情。
377,三块广告牌,3,？没有传说中那么好啊，结局是啥啊
378,三块广告牌,3,整部电影充斥歇斯底里的气息，人物行为焦虑狂躁，感觉混乱而缺乏整理
379,三块广告牌,3,不如预期，当然预期过高也很可能是原因之一。真正的问题似乎在于结构过于松散，几个主要人物一字排开，表演固然都极为精彩，但人物的转变都嫌说服力不够。个别配角登场突兀，个别则几无存在的必要。整体相比以往的《杀手没有假期》或《七个神经病》，锐气又明显处于下风。
380,三块广告牌,3,怼天怼地怼警察。科恩嫂太酷了。后半段不喜欢。结局也是让人有点失望。
381,三块广告牌,3,女主呀，按照的故事，你加入了坏妈妈帮，你就是有罪的。为什么总是在指责别人呢？警察局长领悟了，坏警察领悟了，可你，仍然在漠视自己的坏。
382,三块广告牌,3,我就看看女配们- -
383,三块广告牌,3,风格鲜明，也很好玩，但故事在局长死后就失去了方向，就剩几个人物，不知道做啥好了。
384,三块广告牌,3,有一点天真噢。
385,三块广告牌,3,3.5。噗，这不阿莲吗？剧本设计很精巧，但麦克唐纳时隐时现的黑色幽默风格放在这种比较沉重的事件上就有点怪了，后半段关键角色的转变也显得说服力不足。配乐什么鬼？麦克多蒙德演得非常好，支持封后的。好久不见Hawkes! 至于男配，只想说一句Dafoe加油惹。
386,三块广告牌,3,戾气太重
387,三块广告牌,3,她定能夺回那7块。Frances顶摄人一处在一双毛拖鞋。Caleb my little alien！！！每次窗内望出去的小广告商都太可爱了5555555555555！！Lucas真实的「阿仔M^卜卜米」w
388,三块广告牌,3,挺没劲的.....全片亮点是扶梯子的某人太可爱了
389,三块广告牌,3,非常不经看 再刷觉得剧本和表演的毛病都挺多 @SanSebastianIFF
390,三块广告牌,3,金球奖最佳影片。威洛比局长在给杰森的遗书里写道：「我认为你有成为一名好警察的潜质，因为在你内心深处 你是一个正直的人。我觉得你太暴躁了，如果你不放下执着 就永远不能成为一名真正的警探。你知道你缺少了什么吗？是爱呀。因为在爱中才能变得沉着，沉着才能思考。思考才能获得答案，而恨不能。」
391,三块广告牌,3,@ mk2 bibliothèque
392,三块广告牌,3,"The Midwest America remains legendary, a myth that you can never tell what and why. I guess this is a different approach to avoiding vulnerability that I can't relate to, but maybe one day I will."
393,三块广告牌,3,所有的惨剧皆由于愤怒。
394,三块广告牌,3,好表演，但剧本过于公正套路以及煽情，完成度很高的命题作文。
395,三块广告牌,3,去年上映时好评如潮的电影，今天看了感觉……像有位网友说的，人物前后的转变生硬牵强。局长就算自杀了，他生前还打算通过不断找女主麻烦的手段来打击报复广告牌的事情，不仅不作为而且利用职权侵害公民权益的可耻行为，真是无法洗白。还有烧伤那小子，我不相信生活的灾难可以让一个人由善到恶，这小子因为丧父之痛就变成那副嘴脸，真是理解无能。电影画面不错，但情节，不恭维了。
396,三块广告牌,3,有点像换子疑云，是个挺好的电影，调调、小幽默和故事设置都挺精致。但是也没有换子疑云经典。3.5星……
397,三块广告牌,3,愤怒只能引来更大的愤怒，做决定先停顿几秒再看。女主的演技炸裂，故事本身不重在事实，而是给观众的带入的思考。
398,三块广告牌,3,这样的家庭太不正常，灾难总会来临……角色在电影里有很多的思考时间，这点很好。It's been heaven knowing you.
399,三块广告牌,3,非常精致成熟的作品，从剧本到表演到主题。只是越往后人物行为动机和情节推动力越模糊孱弱，有种费了半天劲结果就喝了口甜鸡汤的错愕：知道作品想说什么，但是既无源于逻辑和事实的说服力，也无源于信念和情感的感染力。于是精巧这个长处也觉得是造作了。总之不喜欢。PS 这片在天朝的票房应该不会好。
400,三块广告牌,1,所有的人物都如此面目可憎，让人厌恶。都是处心积虑的虚假复杂性的悲催虚构产物。毫无真诚度可言。
401,三块广告牌,2,年度失望，不懂为何好评如潮。其实我挺喜欢麦姨这决绝到不合人之常情的alone against the world的人设，但迪克森的圣人附体和酒吧偶遇嫌疑人简直莫明其妙到了极点，而且警长这条线想想其实还挺突兀。
402,三块广告牌,2,从伍迪哈森林自杀后独白念信开始一路崩坏，最后发现又看了一遍杀人回忆，胡B煽情版的   2.5
403,三块广告牌,2,所有人物背景和关键剧情全都是强设定，真实人性的牌坊要立，黑色幽默的偶性又要加以利用，说到底就是一个为了反套路而不停抓耳挠腮设计反转，从创作动机到文本都虚情假意的大土鳖。
404,三块广告牌,2,又一个最擅长“黑色幽默”的导演一不留神走火入魔的病例。当你讽刺到原本已足够荒诞而且压根儿不好笑的现实头上时，曾经好用的Absurdity就不再能轻易帮你解决一切问题了。玩弄观众的心理认同一点都不高明，最终勉强找对了方向，但密苏里到爱达荷实在太远了。
405,三块广告牌,1,一只因木牌掉就怒拿油炸警局（是g敢铀叫痰暮诰郑┑哪赣H，何以在女罕⑨嵴整七月毫o屿o？如此PI而撕裂的人物C的空白，不可能也不靠一句「怒只招致更大的怒」就打l，晚状味家樱缓r我根本想不出，有哪一N怒能比人母得知女K死下的那一N更巨大、更O限。
406,三块广告牌,2,非常一般，也不觉得剧本好，被安排的戏剧冲突过于刻意。整个事件的发生以及后续延展的推动力的逻辑支撑十分怪异，人物不真实，包括警察自杀、包括后面的Dixon的转变
407,三块广告牌,1,十分钟弃，毫无味道的寡淡剧情，对老美的“政治正确”已经产生生理性厌恶了，看到黑人挑衅警官的时候有点反胃，老美影视圈很多人真是越来越让人讨厌了，然而这片子还是被人捧臭脚，就像那部无聊到令人发指的海边曼彻斯特，全民尬捧出的皇帝新衣，看个电影也要人云亦云多累啊，能不能跟随自己的本心？
408,三块广告牌,1,都尼玛装蛋，事实就是很难看，戏剧张力在某些场景细节有，通篇下来就是冗长拖沓的自我感动式故事。
409,三块广告牌,2,电影主题太散，转折生硬没有铺垫，观影全程一脸懵逼07，不知道自己看了个啥，特意看了影评不明白为啥这么受肯定07。
410,三块广告牌,1,一部怀着关怀社会的心写着鸡汤文学价值观的电影，一部极度欠缺对当地人生活观察的电影，一部仿着约翰福特霍克斯虚构的西部英雄人物，写出的伪现实主义电影，一部把所有人写得拧巴到不可信的极致，却没有抛出实质内容的电影，一部甩下一堆正确的废话实际上极致谄媚的电影，一部不敢直面社会现实的电影。
411,三块广告牌,2,抖机灵，不喜欢
412,三块广告牌,2,整个电影看完后就看明白女主最后释然了，然后全程一脸懵逼。特意把影评看下，看不懂，这剧全程压抑，无主题，不知所云，不明白评分为什么这么高。
413,三块广告牌,2,可怕，又一个“正义联盟”。
414,三块广告牌,2,悲喜怒情绪转场写的那么“尬”，一众演员还能演下去真是“演技惊人”，反转比本格推理小说还多真是难为导演兼编剧了，那您好歹解释下红脖子警长是咋娶到澳洲老婆的？把simple mind people写成一根筋的嘴贱傻子，唯一认理的两个警长一个死一个是黑人，真省事儿，就全当是在讽刺川普吧
415,三块广告牌,2,跟朋友一起去看的，网上评价很高。这电影全程压抑，没什么真正的好人，整个影片都是各种锁链式伤害，全程一脸懵逼，故事没有结局，不知道凶手是谁？没看懂07我到底看了个啥?
416,三块广告牌,2,天啊完全没看出来Abbie Cornish…没想到是如此陈旧的一个主题，人物也全都见过无数次了，情节走向莫名，从警长死之后我基本全程黑人问号脸…总之完全没看出来是个好故事，若只是要谈冤冤相报中的意外与领悟，实在太单调。
417,三块广告牌,2,从放火烧警察局开始，这部戏就失效了。面对暴力，导演选择的是逃避。而科恩兄弟早期电影中，戏剧根植于对暴力的极度恐惧。
418,三块广告牌,1,不带情绪客观评价，剧本简直不是缺乏打磨，完全就是个半成品，演员排练不到位，还带着对南方肤浅的偏见，白左完全没问题，不能忍傻逼当白左
419,三块广告牌,1,对不起我真的欣赏不来…
420,三块广告牌,2,现在真是完全不能忍好莱坞那种假模假式的电影，纯粹为了遵守社会公德才没当场吐出来。深入人心？不存在啦！黑暗故事？我一定看了个假电影。。。。3星不能再多，冲着豆瓣虚高的评价减一星做个平衡吧
421,三块广告牌,2,刻板做作，为电影而电影，人物或故事无新意，也无诚意。
422,三块广告牌,1,我的天哪，我们看的是同一部电影吗？你们说的跌宕起伏，完美剧本呢？我一直等着前面温吞水一样的剧情最后迎来高潮，结果，就这么完了，完了？这片子到底讲了什么？一个母亲为女儿伸冤竖了三块广告牌？就这？毫无起伏，毫无波澜，温吞水一样讲了两个小时，是我对电影的欣赏能力出问题了吗？？
423,三块广告牌,1,为了刷90届奥斯卡强迫自己看完了，别说那么多深刻内涵，多么精致的拍摄手法，我看着实在是不舒服抱歉无法领会。从没有一部电影让我如此厌恶里面的每个角色。   追加:翻了一下我之前的广播发现好像这几年的每一部奥斯卡最佳影片我都不怎么喜欢。这部应该是最佳影片没跑了
424,三块广告牌,2,2.5 本来举得就低，放下的时候又太突然。所以当几乎所有人都尽力把事情做绝，而剧作又想顺接到略俗气的“逼上梁山”，同时附上温情标签，这种不匹配感让人很莫名其妙。而这也并没有带来多少实质性的提升作用。还是有些工整了，但又似乎不完全是剧本的问题，整部电影都在机巧和做作中摆荡。
425,三块广告牌,2,电影里好多熟脸；伍迪・哈里森在我脑海里快被《真探》里那个警察定型了，总感觉电影里的人都在拼命的想演一件他们自己都不相信的事情。
426,三块广告牌,1,为什么这么多人打五星？？对不起我觉得没头没尾，怒打一星。
427,三块广告牌,2,Y局救了影一把，但如期f具_放性，不如f不得不@邮瘴膊趴尚校W”镜钠渲幸淮蠓t「意料之外，情理之中」，∏槌龈(又何出格可言？)，每一步都r似要O出喜出望外，因而人物C就可以想怎泳驮樱靠吹r候感到精神分裂，困_，@是「幼-影像」以及⑹卵eP於「真」的}
428,三块广告牌,2,黑色又不够黑色，诙谐不够诙谐，文艺不够文艺，写实不够写实，讽刺不够讽刺，连丧都不够丧，片尾还来个装逼式的戛然而止。本片除了音乐和表演还算出彩之外，看起来真是又长又臭，如坐针毡。3星不推荐，鉴于无脑跟风吹捧的人太多减去1星。
429,三块广告牌,2,不明白好在哪。
430,三块广告牌,2,"老夫少妻 红脖粗俗的用语 无聊绝望的密苏里 这也算电影“Nowadays everybody wanna talk like they got something to say,
But nothing comes out when they move their lips"""
431,三块广告牌,2,too oscar for me
432,三块广告牌,2,令人赞叹的是它出色的剧作架构和对文字表意能力的颂扬。问题在于这个剧本过度工巧匠气，且有把观众注意力从专注于破案本身移开以完成表述救赎这一主题的意图，使得观众几乎难以与之共情。小鹿的出现、在失火的广告牌前痛哭还有那杯带着吸管的饮料，都不约而同的煽情过度以至于用力过猛了。
433,三块广告牌,2,很不喜欢，单独拉出每个人都很有趣，放在一起就极度令人不快，疯狂的故事，里面能有一个正常人吗？出了电影院我只想骂人？？
434,三块广告牌,1,满眼都是自以为是的编剧意志。毫无意义的为了反套路而反套路
435,三块广告牌,2,自己别扭不够，还要折磨别人，虽然可怜，但也可恨。三个黑人清一色的都是好人，Dennis的作用是被白人警察抓起来，Jerome的作用是充当救世主，Abercrombie的作用是以离奇的方式伸张所谓的正义（目睹白人警察暴打平民后，不实施抓捕，而是充满戏剧性地将其开除，真是大快人心）。是部越想越烂的电影。
436,三块广告牌,2,认真地重看了一遍。多么造作的一部电影啊！在骂脏话和洒狗血之间反复切换直至精分。所有人物都捏着一个强调讲话，都是这么欠揍。女主演得很好，完美地达到了导演预期的强硬又心碎的精分形象。
437,三块广告牌,2,新鲜的只是这个故事，其实本质还是那种套路化的救赎片拍法，冲突不断的情节实在太激烈了，这些冲突还全是在模式之内的流水作业，虽说引向的还是化解之路，但实在很不聪明，看着膈应。
438,三块广告牌,1,灵魂大师
439,三块广告牌,2,Oak Brook - Thanksgiving night (如今真是啥人都能来拍电影……)
440,三块广告牌,2,得奖定制电影，hardcore女性角色+弱势群体(still?)议题+故意刁钻切入点+小清新音乐+慢到要死的剪辑，假到生理厌恶，再也不想看见Lucas Hedges了。
441,三块广告牌,2,作橐徊啃℃影，小炔慷Z激起的i漪常弱，好像只有H演出淼蚨尾庞行Ч，此除了@孜唬ㄐ蜗罂贪宓模┙巧外，彷]e人（有c像龅牟感？），不懂@”灸难e好68一群投o川普的人，可是影告V我他不是娜耍只是笨跟y搞，最後端出碗u。收尾H道德崦痢
442,三块广告牌,2,如果不是发现马丁・麦克唐纳自己写了这个矫枉过正的剧本我会觉得或许是剧本找错了导演或者导演挑错了剧本，但现在只能说这又是一个英式幽默在美国一不小心就成了七嘴八舌传教（甚至超越了说教）的案例。|20180303 1.5 还是不能理解这里面快速多次的立场转变，大概马丁・麦克唐纳真的没有抓住美国精髓吧
443,三块广告牌,2,去年最奇怪的一部电影，引起了我的生理不适。它的黑色幽默有时竟有点像<南方公园>。剧作在追赶社会议题的时髦，却又摆出一副旁观者清的姿态，而成了某种自以为是的、缺乏生活体验的空中楼阁，一如戏剧(而非电影)课堂上避不开的知识分子投机取巧的产物。导演层面没什么建树，对配乐的使用简单粗暴
444,三块广告牌,2,"Which century do we live in? I’d rather watch Funny Games, :)."
445,三块广告牌,2,其实是个鸡汤温情唐僧念经一样的心灵祈福片。用爱发电吧，暴动狂躁的痞子们！
446,三块广告牌,2,哪有这么好看？！没有
447,三块广告牌,1,看完后一想，越想是越好笑......以致于这个烂片意外变得可爱起来：）
448,三块广告牌,2,"Set in an imaginary ""american heartland"" that exists in a vacuum. Creates conflict for the sake of conflict. Manipulative and at times cringy, not even funny. Frances being Frances. Woody being Woody. One-note cliche characters with undeserving redemption arc. fuck this trash."
449,三块广告牌,2,"人总是爱为自己的行为找借口逃避,片中的母亲就这样,广告牌是对女儿忏悔.自己痛苦就可以成为伤害别人的借口?片子中设置了很多巧合情节让封闭小镇有矛盾的人进行快速和解,现实可不这么简单.何况这母亲不管做什么都不承认罪行,三观不正,这种人不值得怜悯.自我救赎固然重要,不过最重要是对自己的行为负责"
450,三块广告牌,2,自上而下透露着一股平庸，即使它的文本精湛至此，但就电影来说这种政治思想倾向显得太刻意了
451,三块广告牌,1,"原思不俗,但l展出的∏橛o聊,可惜了一秃醚T"
452,三块广告牌,2,"麦克唐纳没能把对现实的嘲讽与现实的荒唐联系起来，只为黑而黑，为反体制反体制，毫无思辨精神，观前便知后，无悬念，无细腻情感铺垫，彻底propaganda；有理就可以动用私刑伤害无辜？关牙医什么事，把人家手给整的，就这一个行为我就无法接受；抱着""我过不好，你们也别想好过""这样狭隘的心态去复仇的形象居然也可以被加上主角光环？"
453,三块广告牌,1,Fuck This Garbage. 05
454,三块广告牌,2,美国泼妇
455,三块广告牌,2,不好看
456,三块广告牌,2,不是很感冒唉
457,三块广告牌,2,这他妈警察可以随便把人丢出窗外 女主钻牙医烧警察局还有理 最后两个人还可以快快活活地杀个非本案相关的人去了？虽说电影可以折射现实 但也不是这样宣扬反秩序吧
458,三块广告牌,2,剧作表意不但盖过了一切成为不断反转的设计文本，甚至剔除了导演的大部分功能，在故事不复杂的情况下拆解的若干面南方脸谱加时政扭曲元素拼凑整合也真是无脑，和学院的奥斯卡级别“女议员”比格罗相比，英国佬麦克唐纳写这本子之前，估计看了不少川普上台之后的美国新闻。
