,movie,star,comment
63,记忆碎片,5,诺兰2000年的这部《记忆碎片》的牛逼之处在于将整个故事砍成了26个碎片，并且正序倒序互相穿插着放。本片不同于《穆赫兰道》从一开始就给你下套，也不同于《禁闭岛》用精神病人的臆想做线索推进，更不同于《盗梦空间》留下开放式结局，它的难在于你如何将26张碎片无缝链接，并且不顾此失彼。
64,记忆碎片,5,我们凭借什么来相信和确定自己与世界的真实性？由终点看到起点、用一种倒序的手法让我们慢慢接近真相、故事真的很简单很明了、但一个人的内心世界真的可以让我们疯狂、一个短期失忆的人欺骗自己设下的圈套、让我们足足迷惑了2个小时、没有记忆如同尸体一般、他却用另一种方式去证明自己卑微的存在..
65,记忆碎片,5,结构倒还不是这部片最好的地方 其实结构也不很复杂 一条倒序 一条顺序 两条线汇合就是影片的完结 有意思的还是提出了失去自我认知的人 抗拒和厌恶自我的人如何寻找生存下去的目标
66,记忆碎片,4,嗯，就是觉得，前面弄的真挺玄乎的，也好像是很麻烦，之后就越来越豁然开朗，但是，结尾没有特别升华。这是一部内容很不错很不错的片子，结构也复杂，趣味性强，但是这部片子的主旨，或者说灵魂，不够强，看完，对人的触动不大。据说盗梦更商业，也许单从感观上，盗梦也许更有意思吧。
67,记忆碎片,5,倒叙的方式很常见，但诺兰这样，一小节一小节倒叙拼凑出整个故事，看得真是费脑子，电影逻辑果然可以很复杂。看到最后你也不知道记忆是否可信，那些为了帮助记忆的影响图片是不是真的记录了事实，还是有意的篡改。究竟什么才是真实的，谁又知道。
68,记忆碎片,5,"「""保留他存在于这个世界的意义"" 只是teddy一个人的结论，是teddy灌输给你的观点。 整个电影非常让人迷惑，惟独teddy的那一大段对话说的十分明白，所以观众很容易在一片迷茫中错误地感觉到拨云见日的错觉，认同这个撒谎者的结论。 」"
69,记忆碎片,4,"在不断看到热捧的情况下看完此片只能说我并不很感冒。尽管细节再严丝合缝也不能抹去这不过是一个十分钟情节的电影。大量的回放和补遗只是为了满足我们可笑的偷窥欲。

即使我们最后恍然大悟原来Teddy死的冤或者Lenny才是真正的杀妻者又如何呢。这片子无关感情和道德，这只是十分钟的回放而"
70,记忆碎片,5,人们需要靠记忆去确认自己和认识这个世界，但记忆可靠吗？你看到的世界和事情是你自己认为的那样吗？还是别人想让你认为的。最可怕的是不但别人会误导你，甚至，你自己也会误导自己。从长远和广大点看，一个国家的记忆，就是历史，还会是我们认为的那样吗？
71,记忆碎片,5,真的太经典了！这样的电影应该是再也拍不出来吧!
72,记忆碎片,4,"A great suspense film. The narrative goes backward, yet our sympathy travels forward to the shock of the openining: what will he do?"
73,记忆碎片,5,@不能u造的男子 su造了自己的跬邪睢 其我都一 不需要你@些人慷慨的z 只要活在自己的空地上 一切影像都是可以建的。 我什麽都不需要。
74,记忆碎片,5,其实记忆真的只是一种想象，它并不是事实，但我们只需要记忆来证明自己存在的意义，知道这个世界不是我们想象出来的。这种因果联系式的电影，倒推的手法，到最后才知道原因，而且前后联系，一段段的记忆互相促成。到底什么是真？什么是假？看到最后，无法分辨了。
75,记忆碎片,4,虽然很推崇Nolan，但我不得不说，这并不是他最好的电影，这么火估计也是很多人看不懂，他把情节支离了的原因，但几条线，包括模拟自己的Sammy等，都还是很好的点
76,记忆碎片,4,我就知道这种片至少要看两遍以上才能理清头绪。。。拍摄手法倒是新颖，就是感觉有些混乱，必须要看第二遍啊~~~有多少心理疾病是由不愿面对现实引起的。。。
77,记忆碎片,5,卡梅隆负责革新电影技术，诺兰负责革新电影结构... 
78,记忆碎片,4,非常花哨的一部片子。把一个完整的胶片分成两段。每一段再分成许多小段，然后把两部分互相交叉，以色彩作为分界线。泰迪，你是真的爱兰尼啊~~
79,记忆碎片,4,有那么费脑子么？感觉比禁闭岛差点，其实答案应该是明了的了，所有一切不过是莱纳自己患病的幻想所致。但是诺兰导演凭着高超的技巧，不断倒叙不断闪回，将短忆病人的症状表现得淋漓尽致，将整个故事倒着串联起来，这样精湛的拍摄技法才是最值得称道的。还有那些别有用心的人，不得善终也是罪有应得。
80,记忆碎片,5,看这部片子必须要集中全部精力看，很费脑细胞．最后也没有把事情弄的完全明白，但这重要吗？
81,记忆碎片,4,This is a puzzle you can never solve. 一环套一环倒序，外加神剪辑，还得看一遍，总觉得 Lenny 被利用了，但同时他又再也走不出这个圈子了，杀死了一个 John G 之后还会再去寻找一个 John G 复仇。
82,记忆碎片,5,诺兰最好，之后他的所有片子都没小成本时的精巧了
83,记忆碎片,5,从剪辑技巧上来说无懈可击，可以说没有剪辑就没有这部电影。一个生活在自己幻想的世界中的失忆症患者，以为自己妻子报仇为由不断的杀人。主人公在错误的基础上做出错误的判断，并以这次错误的判断作为下一次错误判断的基础，于是整个事件越来越偏离真相。看懂电影需要很强的逻辑思维能力
84,记忆碎片,4,不把你看晕了，不叫电影。
85,记忆碎片,4,就像海报一样，诺兰用了一种片段式倒序的方式完成了这部作品，虽然很前面就猜到导演要怎么让这故事有起伏，还是没有料到主角嘴里一直挂着的jammy是在讲自己的事情，尝试性的手法带给人惊喜，也给人多看几遍的欲望，唯一的缺陷是为了讲好一个故事，似乎人物性格塑造方面几乎毫无建树。
86,记忆碎片,4,其实剧情并不难懂，只要用心去看，就可以捋清思路，那结局最终让人深思。他的活着，是为一个目标，为了这个目标，他可以做很多事，包括……
87,记忆碎片,4,"旅^前_的bird先生lenof,你G是知道自己要做什麽,s忘自己做^了什麽.  但於失去的人碚h,最可怕的不是忘自己做^了什麽,而是不知道接下碓做些什麽了.  其,不是有短盒允的,是正常的人,都怕自己做的事情都不再具淙魏我饬x,@右簿筒辉儆谢钕氯サ睦碛闪."
88,记忆碎片,5,阶段性地倒叙模式，一步步解开谜团，也许一切都没有答案，也许不知道答案才是幸福的
89,记忆碎片,4,很棒，这部片子能展示电影与书的不同。书，你可以翻来翻去的看，前一页没看到的那三个字，你可以再翻过去读一次，然后你会豁然开朗，原来故事是这样的。而电影不可以，错过了就永远错过了，错过的后果是你成了一个傻子，然后要为你的不专注付出代价。用这部片子其中的那几秒，测试你是不是个傻子吧。
90,记忆碎片,4,80/100，诺兰标志性的非线性叙事的开始，看晕了。这么炫技好吗？不一定吧。
91,记忆碎片,4,一段零碎的记忆，慢慢勾勒出了一个骇人的结局。我们需要一种记忆，来记住自己的身份和过去，未来。其实忘记也未尝不好，当绝望占据了生活全部，捏造出来一个主人公比自己更像自己，然后慢慢忘记，何尝不是一种解脱？我们的很多行为，原来都是徒劳，只不过给了自己一个活下去的借口。
92,记忆碎片,5,看统鹗亲钅茯使人前M的恿Γ既或是根本B仇人是l都不能得，仇恨的火焰仍然能在胸中狂的燃。我在想Mulholland Dr.是不是Memento有所借b
93,记忆碎片,5,开始觉得很压抑 看的断断续续（看了两个星期…）到后来才逐渐看明白到底是怎么一回事。看完以后再看影评今天再详细看细节发现这个电影是有多高大上我的智商是有多战五渣。假如你还没看过那就千万别看影评…快去吧真的很好看
94,记忆碎片,5,这要有多强大的脑子才能布置这样的局。如果人可以忘记不快该是多么欢乐的事情。反而觉得莱纳活得有些快乐得痛苦。不记得还好，如果记得，杀错了人，信错了人，该是多么可悲。
95,记忆碎片,5,沉重的话题，沉重的演绎，深爱的倒叙。依然还是诺兰。
96,记忆碎片,4,最牛逼的是剪辑，毕竟这样的故事要顺着拍也就没意思了，完全倒叙也需要技巧，而诺兰很聪明的将所有镜头都打乱，最后一幕仅仅是整个故事进展中间部分的过度，回味起来很过瘾！看多了类似电影的人很快也都能猜到最终结果，故事本身或许对后来的《恐怖游轮》《禁闭岛》等电影都有影响。
97,记忆碎片,5,看过Nolan的几部片子，蝙蝠侠诞生、致命魔术，其实都觉得仅仅是还不错，这部memento才真能叫牛，不过这种手法也仅此一部了，大片是不能这么拍的。2001年的时候我和好朋友一起看了半小时memento没坚持下去，现在能津津有味地看完说明自己的耐心有很大进步。
98,记忆碎片,5,太混乱了，医院里那个镜头很藕拧Ｖ档寐虻收藏。一遍下来就基本看懂了，佩服自己哈哈
99,记忆碎片,5,就是一个倒叙一个正叙，《记忆碎片》的剧情如果捋直了来说，在好莱坞是一文不值。偏偏克里斯多弗・诺兰的字典里就没有“俗”字，一个简单的复仇故事被他切割后重新组合成一部Cult经典。虽然看的时候没有《致命魔术》那般畅快，看完还不得不再看几遍，但这部电影要深刻的多，也更加经典。
100,记忆碎片,5,这部电影很奇特，但是我觉得要比《21克》要容易懂一些。灰色部分是正常叙述顺序；彩色部分是一种“迂回”的顺序――就像是蚯蚓在地上爬行时一样，向前爬一段，再往后缩一段。整部电影就是一段接一段的倒叙组成。而当电影结束的时候，实在应该重新看一遍电影的开始，就会发现，电影的开始紧连结尾。
101,记忆碎片,5,"把车牌号等事实纹在身上，是为接下来让自己对付Teddy，（有没有让自己停止追寻的意图,因为另一方面，给自己留下杀Teddy的线索就是为了让自己找到下一个目标），Sammy是主角记忆嫁接诈骗者，但在主角杀死Jimmy时，Jimmy临死为什么说了Sammy的名字。男主杀死妻子的线索之一他能自如的用针纹身。"
102,记忆碎片,5,一部只看10分钟但让我感觉看了一个小时的神奇电影，太费脑了！！！记忆不断的重组回放再重新捕捉，很多细节可以回味。。。就是看完后累的不行TAT
103,记忆碎片,5,1影片结构倒叙，2主人公脑子错乱，3看电影的哥们我脑子不好使，所以。。。只好发句号了，但是有一点，一个男人应该努力变得睿智、严谨、深邃
104,记忆碎片,5, better than think ...  顺叙+倒叙 最后结合到一点 牛比啊 导演 牛比啊 编剧
105,记忆碎片,4,先看印度翻拍版的我把所有悬念都先知了。诺兰用色彩变幻的手法展现现实与记忆，结尾所展现的轮回令人为之一惊。剪辑手法很有一套，多线叙事什么最能弄昏人了。整体来看，不失为悬疑的经典！
106,记忆碎片,5,“To make things right.” 自欺欺人，这才是他想要的世界。我们真正记住的东西有限模糊又多义，当我们回忆故事片段的时候，其实是我们用自己脑中的逻辑，把这些片段的信息补全的。记忆碎片的整合与理解之于人就像是一场拼图游戏。你想要的世界是你所想要相信的世界。叙事手法为主题服务，非常高明。
107,记忆碎片,5,其实坚持从头看到尾不要漏掉细节就可以看明白整个故事了。至于结局，我觉得是开放式的，所以并不存在一个最优解释，所以电影才好看嘛。
108,记忆碎片,4,碎片化的记忆让故事显得有点光怪陆离，最可怜的不是那些死去的人，而是一直活着寻找下一个杀妻仇人的Lenny。只是节奏叙述的有点拖沓，本来就记忆点模糊的故事越是拖沓越是会把人看懵。。。
109,记忆碎片,5,说起来，很多人说NOLAN的故事有漏洞，但我认为他最优秀之处就是故事完整且严密。所谓的漏洞，要么是真没看懂，要么是真的眼力很高
110,记忆碎片,5,"两条线索丝丝入扣最后贯穿全片, 虽则观影过程中已经想到这样的结构但在结尾处仍遇到惊喜. 从为爱复仇到冷血复仇男神的转变需要我来适应. 剧本很好. 手法很骇俗以致看到争论颇多竟用上shit等字样, 罪过罪过. 还是好电影呐~"
111,记忆碎片,5,为了心理学的extra credit跑到图书馆看完，很喜欢wwww
112,记忆碎片,4,等看完本片，我发现我完全傻B了，从来没有想过一部点影还可以这样子来剪辑。几十个碎片拼出的真相，几十段闪回的记忆，当你有一天也遭到主角一样的境况时，你到底能选择相信什么？本片真的很个人化，也是相当费脑子的，一遍基本是无法完全理解了。如果导演在穿插多一点点商业因素，应该会很完美吧！
113,记忆碎片,5,电影剪辑是最大看点。正常的故事被剪成45段，不是按1、2...45播放，而是45、1、44、2、43...22、23这么放的。其中倒序的45、44...23是彩色的，1、2、3...22是黑白的。22到23通过一张相片色彩渐变从黑白过渡到彩色。正常的电影被剪切的支离破碎，据说是给人记忆碎片的感觉。为了看明白这个电影，我来来回回的看，看了一周。
114,记忆碎片,4,果然是诺兰作品，这对兄弟是继斯皮尔伯格之后又一对编导具佳的封神导演？
115,记忆碎片,5,"如果我们交往前，我就预知不会有结果。我还会选择和你在一起么？
我不会拿甜蜜的时光去换任何东西。那是我们最美的经历，除此之外，人生中一些最棒的事就是由错误引起的。

预见未来会毁了我们。如果让人们预见未来，那么他们就没有未来，去除了未知性就等于拿走了希望。
"
116,记忆碎片,5,"又名: 记忆碎片 / 纪念品 / 失忆 / 记忆迷局 / 凶心人

导演: Christopher Nolan克里斯托弗・诺兰
主演: 乔・潘托里亚诺 Joe Pantoliano / 盖・皮尔斯 Guy Pearce / 凯瑞-安妮・莫斯 Carrie-Anne Moss

上映年度: 2000
官方网站: http://www.otnemem.com/
语言: 英语 法语
imdb链接: tt0209144
制片国家/地区: 美国

"
117,记忆碎片,4,这部看得有点跳脱，间接闪现Eternal Sunshine of the Spotless Mind；Mulholland Dr.；Pulp Fiction的影子。。。超级强大的倒叙法。。就是个结局混乱了我，看了影评后才觉得有点开窍――至少让一切有了个解释。。。
118,记忆碎片,5,"all because his love for his wife, falling down n down n down......."
119,记忆碎片,5,真是越来越着迷于这种有关心理的影片，而这部电影更是这一类型片中的经典之作，超赞的剪辑，超强的剧情，很考验观众的IQ~~
120,记忆碎片,4,★★★★ 两线叙事，正叙和倒叙，手法很奇。好看，但气氛没出来。发现诺兰的风格稍嫌平淡，没有两个大卫来得浓烈，更喜欢两个大卫的悬疑片。
121,记忆碎片,5,这个真是无敌了。什么变态编剧啊啊啊啊啊啊啊啊啊~~~
122,记忆碎片,5,看过已经有好多年了.到现在我也没有勇气再看一遍.神一样的剪辑是要杀死多少脑细胞!!!
123,记忆碎片,4,本是最简单不过的复仇剧情通过精彩的剪辑和倒叙手法变得扣人心弦，现实与回忆交错，追本溯源，逻辑紧密，抽丝剥茧，又悬又疑又妙。真有第二个凶手的存在么？teddy真是最终的结果？
124,记忆碎片,5,这绝对要看第二遍，虽然第一遍看懂了（尼玛，这种剪辑手法真的只能在借助暂停和快退的方式下看懂），但还是要重新再看一遍。个人觉得影片后面的勾心斗角的剧情违背了一上来的复仇主线。
125,记忆碎片,4,简单的故事胜在神剪辑和编排。倒叙的手法更容易让人身临其境，BUG的存在也只是更让人觉得人生轨迹的不可预知，很多时候，一瞬间的决定就会扭转整个人生。什么都是会骗人的，包括记忆。我们因为记忆而完整，也有一天，会被记忆杀死。
126,记忆碎片,5,一个简单的故事复杂化。虽说我并没有完全看懂，也不想继续深究，但它确实是一部好电影。如果你对自己的理解能力有信心，就挑战一下这部电影，看你能了解多少的真实。
127,记忆碎片,5,“如果自欺才能使我快乐，我选择如此的活着。”我们要生存下去必须给自己一个理由，否则就会精神分裂。但那些我们坚持的东西可能只是自己假象中的虚幻。
128,记忆碎片,5,"不是完全明白，半个小时能说明白的故事被导演剪成了110分钟并且十分有迷惑性，故事本身很好，看得人目不转睛。。ps:最喜欢的台词：I don't remember to forget you.
pps:我还在yy这片假如让皮特演~~~~~~~~"
129,记忆碎片,4,诺兰在访谈中谈到，“此片的关键是一个由乔・潘托里亚诺扮演的角色可能才是真相权威。而他以往角色却又让观众感觉此人不可信。我发现由乔所带给影片的不确定和险恶感才真正可怕。”……利用观众刻板印象施展叙事操纵。好！可问题也随之产生：由于影片采用倒叙手法，乔的角色出场即已显恶，同样出于观众心理，他们会揣测对此公的初始印象是否最终被反转？于师傅，结构隐隐出卖了角色。
130,记忆碎片,5,纯倒叙，编剧、剪辑太强了。看的晕头转向。
131,记忆碎片,4,每天都要记下很多东西，甚至要刻在身上，才能知道也许身边发生了什么，过去发生了什么，否则一转眼，刚刚见过的人和事就完全从记忆中消失，这种人生真得很可悲，完全没有安全感，不知道能不能信任别人。也许这个世界也真的太黑暗了。
132,记忆碎片,4,本片用一个倒叙的故事告诉我们，记忆是在无数个“现在”被再造的，那些如此清晰温存甚至刻骨铭心的瞬间，真的是我们脑海中的画面吗？还是我们想要记得的样子？Nolan的片子一向费脑子，片中的巧妙细节穿插总让我在后半点睛时一拍大腿。有拖沓的地方，本想给五星。2010.5.23
133,记忆碎片,5,诺兰风格既定之作，让人惊愕的多线结构，仿佛齿轮般精密，每个画面带给人们的信息都是崭新的。
134,记忆碎片,4,果然集悬疑于大成，5分钟一个碎片，此段正叙，2分钟回忆，黑白画面，5分钟与5分钟之间又是倒叙的。怎么让人看着不混乱
135,记忆碎片,5,诺兰确实厉害~ 弄出这么复杂和费脑的片子，看的过程很累，但坚持看完一遍之后却对里面的细节回味无穷。如果看电影是为了寻求消遣的话，这种片子只会让人更加头疼，但喜欢悬疑、思考类电影的人，将对此片欲罢不能。从某些方面来看这片子和《致命ID》有些异曲同工之妙，其实Lenny就是Sammy。
136,记忆碎片,4,最精彩的地方还是在于电影的叙事方法吧，导演很棒，用倒叙也能清清楚楚交待清楚这个故事，虽然故事不复杂
137,记忆碎片,4,这片并没什么难懂，只是让人烦躁而已，看的我快失心疯了。
138,记忆碎片,5,这才是诺烂兄弟的正真代表作，INCEPTION神马的只是浮云
139,记忆碎片,4,其不是很y懂：故事的_^是接着结尾的，主角R{妻子被，他要统穑主角R{只有短暂的，因此，他只能凭借相片、纹身和纸条生存并统稹Ｄ人莉娅和泰迪都不是好|西，他利用R{的失u毒品，借刀⑷耍ò奄u毒品的吉米⒘耍，把资f弄到手，不料R{s把自己的身份换成被杀的吉米。
140,记忆碎片,4,终于看了这个片儿。然后感觉就是：Shit我再也不相信PSY了。不带这么玩儿自己和玩儿观众的。人脑这玩意儿是看不穿研究不透的好么。整个被搅和混乱了的逻辑和常识而导致的所有猜想让整个人好压抑。所以主观减颗星吧。最后，所以《未知死亡》其实就是模仿失败了的简约版Memento是么。
141,记忆碎片,4,“I have a condition. It's not amnesia.” I watched it last night and played the movie backwards in my mind on my way to school this morning. Guy Pierce looks awesome only with the scars on his face and the blond hair up in the air.
142,记忆碎片,5,黑白和彩色两条讲述路线以及一帧一帧的倒叙剪辑非常锻炼逻辑，相当精彩。这么说的话，主角是在碎片似的记忆中失去了世界。
143,记忆碎片,4,采用独特的倒叙手法讲了一个模糊不清的故事，创作者试图通过电影告诉观众一些关于记忆的东西，至于这是什么，其实创作者也没有表达清楚。这部作品体现了诺兰的编剧才华，但却有为了悬疑而悬疑的意思，手法上值得称赞，深度上欠缺火候。
144,记忆碎片,4,整部电影的主题是真相，失忆的主人公凭借各种手段试图寻找妻子死亡的真相，然而真相却越发扑朔迷离。看完影片，不禁开始思考，到底什么是真实的存在？我们存在于真实的世界还是存在于我们自己的意识中？真实的世界到底由什么构成？有时候我开始相信我们存在的世界仅仅，由我们自己的意识构成，仅此而已
145,记忆碎片,5,到底是谁杀了Lenny的妻子，影片在1小时30分处，以疗养院里Summy有半秒中变成了TLenny，导演其实在暗示，Lenny可能才是杀死自己妻子的凶手，但在一点点的错误下，所有证据都指向了Teddy，这如片中所说“光凭照片和纸条就能知道凶手吗”
146,记忆碎片,5,一个是自欺欺人逃避现实自我解脱，一个是利用他人最后反而被对方利用了。故事叙述方式和剪辑让本片很耐看（记得当年我就看了2遍，现在重新看还是觉得挺好玩的），还有导演在影片中隐藏一帧关键画面的手法也让本片更具趣味性。喜欢拼图或者喜欢悬疑解密等等的必定也会将本片收藏吧。
147,记忆碎片,5,这么复杂的一部电影我好死不死的竟然只有法语版...... 字幕也不给力，mac不能解rar也不给力。真是悲剧. We just lie to ourselves to make us happy. 
148,记忆碎片,4,剪辑用到极致的片子。好想知道拍的时候是按什么顺序来拍的，如果再剪个正常时间线的版本对照看会如何？男猪脚就是像一台出了问题的电脑，硬盘只能读取以前的记忆，无法再写入新的长期记忆。而内存又变地很小，只能记住几分钟之类的事。
149,记忆碎片,4,非常靠谱的悬疑片。彩色影像和黑白影像交插叙事，而彩色为倒叙，黑白为正叙。这种编剧的技巧明显超越了剧情本身。不过我对萨米的故事是真是假尚有疑问。而且似乎并没有唯一的答案。
150,记忆碎片,5,显然的嘛，咱Nolan……
151,记忆碎片,5,本以为他是最可怜的，其实他是最凶残的；本以为他是被愚弄的，其实他操控一切。还好我短期记忆没问题，不然这电影铁定都看不懂……经典诺兰
152,记忆碎片,5,"居然从 Guy Pearce 脸上看到了""Boys Don't Cry""里的 Hilary Swank！轮廓、神情都像。"
153,记忆碎片,5,诺兰十年前玩的游戏...太强了...我还算是找到了那个半秒钟的画面...
154,记忆碎片,5,失忆是忘记了过去更恐怖，亦或是遗失将来来的更加痛苦~如果要给朋友推荐电影，我会想起它~
155,记忆碎片,5,欺骗自己，只为有活下去的动力
156,记忆碎片,5,太牛了！！碎片拼起的记忆，只要有一点点的缺失，一点点的情绪影响，故事的路线完全改变！
157,记忆碎片,5,"看完影评后的问题1：teddy是不是John G？2：把teddy设为John G，主观上是为了结束游戏，还是为了开始下一段游戏？3：黑白片段的时候Lenny那些电话是打给谁的？4： "" I've Done It "" 抱著老婆的画面如何解释？5：Sammy就是以前的Lenny还是另有其人？6：妻子的注射致死与发生过强奸的时间逻辑关系？"
158,记忆碎片,5,看到这样的片，还能说什么？俩字：牛逼！诺神的作品，就绝不会有失败的，不用看就知道必是佳作。循环往复的结构，逻辑悬疑类电影的翘楚。看完之后整个人都惊呆了，怎么会有如此棒的电影，Unbelievable!个人心目中悬疑Top 10！
159,记忆碎片,5,其实如果导演反应的是人性恶就更好了，可惜最后原来是反应人的善良 - - 看懂这电影可真够类的，记住别看正续版的，原版的感触良多。
