,movie,star,comment
0,记忆碎片,4,"最靠谱的评论 来自2008-02-24 04:45:21 MILKY_MOMO　我比较倾向“否”的答案，也就是lenny只想杀掉间接导致他妻子死亡的仇人，并且摆脱一直在利用他的teddy。虽然这个答案降低了电影的内涵，破坏了电影的结构美。但这答案符合逻辑。 　　 　　 　　 　　首先，要确定确实存在第２个没有伏法的匪徒（这一点是没有疑问，如果网友有疑问，请自己在电影中寻找答案，篇幅问题，不赘述了），lenny的心理失忆是对他的仇恨引起的（不然“否”这答案的可能性就不存在了）。 　　 　　 　　 　　其次，lenny在杀掉第２个匪徒，大仇得报以后为什么还继续玩侦探游戏，假如lenny只想杀掉那有且仅有的一个仇人的话，为什么还有现在看的这部电影，那人不是早被lenny杀掉了吗？ 　　问题在于lenny虽然想要结束“复仇”，但是因为记忆问题一直在被teddy愚弄。 　　 　　 　　 　　这点导演有伏笔，影片中lenny打电话时突然看到自己手臂上纹着“绝不要接听电话”的字样。这情节很突兀，唯一的解释就是lenny曾意识到有人利用电话来愚弄他，lenny早就对因为记忆问题会被利用有了警惕，而利用lenny的那人就是teddy。Lenny拒接电话后才逼迫teddy从利用电话背后操纵lenny浮出了水面，从而被lenny在一次利用自己的记忆缺陷伪装不认识teddy，试探出teddy愚弄他的事实将他锁定并且干掉。Lenny的记忆本是一种缺陷，但他利用自己的缺陷试探出敌人，多么聪明呵。 　　 　　 　　 　　Lenny只想杀掉有且仅有的第2个匪徒的心理，在电影很多地方曾被暗示过。只不过被许多网友选择无视。比如lenny和natalie的一段对话 　　 　　 　　 　　Natalie：不过即使你报了仇，你也不会记得。 　　 　　 　　 　　Lenny：妻子的仇不可不报，记不记得无所谓，即使记不得，依然值得做。即使闭上眼睛，世界并没有消失（这句是关键，lenny相信的是事实，是事情的真相。换句话说，lenny不在乎自己的记忆，而在乎妻子的仇得报的事实！）。我可以拍张照片来提醒自己，或者再纹个备忘录在身上（这句可以断定lenny打算报仇后就停止侦探生活。与之对应的是，他报仇后的照片在teddy身上，也就说明了teddy愚弄了他，teddy私藏了lenny报仇后的证据，也就是为什么lenny还在继续“报仇”的原因） 　　 　　 　　 　　让大家疑惑的是电影的最后一段，貌似lenny打算销毁真相，打算继续愚弄自己。其实大家完全被lenny这个有记忆缺陷的人骗了，他销毁照片只是为了杀死teddy。 　　 　　 　　 　　分析一下电影最后一段lenny的心理独白就可以看出来： 　　 　　 　　 　　“我不是杀手，我只是想补救错误（错误是被teddy利用成杀人工具，错误是误杀了jimmy）。” 　　 　　 　　 　　“你以为我想再去解另一个谜（话后语当然是你猜错了）？再去找另一个John61G？你也是John61G，你可以做我的John61G。我要自欺欺人才快乐（显然不是）？teddy，对于你，我会（只对你，会，因为你愚弄了我）。 　　 　　 　　 　　Lenny的最后一段心理独白这断话表面上像是lenny打算继续当侦探报仇的宣言，其实恰好相反，这段独白最为复杂，是电影迷题的核心： 　　 　　 　　 　　 　　“我要相信世界不是我想象出来的，我要相信我所做的事情仍然有意义，即使我不记得做了什么，我要相信，即使闭上眼睛，世界仍然存在（貌似打算继续自欺欺人，其实这是知道自己已经报仇成功后的lenny在告诉自己DD即使今天以后我不记得我已经报过仇了，我做的事情依然有意义，因为，即使我不记得，世界仍然存在，事实仍然存在DD即使我不记得，我也已经报过仇了）。 　　 　　 　　 　　“我相不相信世界仍然存在？（注意，这句话后有一个非常关键的画面，这是lenny幻想出的场景，lenny和妻子在床上，lenny胸口有“I have done it”的纹身。这是lenny在知道自己其实已经报仇后的一副心理画面的描写，可以看做是lenny了结了心事后的一个奢侈的幻想，一个对他来说完美的幻想DD妻子没有死，温柔地躺在他身边，而同时他又报了强*妻子的仇，I have done it。妻子没有死当然只是幻想了，剔除了这点，只剩下了另一个让他满意的信息剩下，I have done it！我已经做完了！因为这是lenny梦想中完美的世界，我们可以就I have done it这一句断定，lenny渴望的是已经做完了，而不是要继续欺骗自己去报‘假仇’，换句话说，lenny渴望终结，而不是没完没了。另外，扯离话题，这个幻想的镜头真是一副让人痛彻心扉的画面DD妻子抚摩着他纹着身的胸口DD这画面用弗洛伊德梦的解析方法来分析，包含着非常复杂，信息量巨大的感情DD这里面lenny对妻子蕴涵的爱就不说了，lenny的孤独，复仇后希望把消息传达给死去的妻子而不能的伤心，以及lenny以残疾之身得抱大仇背后的艰辛，特别是这种艰辛渴望得到已经不可能得到的的妻子安慰背后的痛心。无奈，巨大的无奈！这画面让我无泪。） 　　 　　 　　 　　世界仍然存在？我们需要记忆确定自己的身份，我并不另外（这句话lenny说的很得意。是lenny想出杀掉teddy的办法并且能终结自己复仇生涯后的得意DD至于lenny想出了什么办法终结自己复仇生涯后面再讨论DDlenny很得意，一种认同自己的得意DD所以他说，我并不另外。）” 　　 　　 　　 　　好了，不磨叨了，用一个情节就能完全确定lenny的不打算继续自欺欺人DD那就是他纹在身上的“事实６”， teddy的车牌！ 　　 　　 　　 　　当lenny杀死teddy后，这一切都结束了。Lenny的所有复仇的线索（文身）都指向teddy，当Lenny杀死teddy后，所有线索都终结了，lenny会很容易调查出他的仇人的车牌是个死人的车牌，他也没有任何线索再继续下去了（再继续？你先让lenny把纹了一身的文身清除掉吧，否则每次他都是找一个死人报仇了）。这就是lenny想出的既杀了愚弄操纵他的人，又让自己停止继续报假仇的办法。 　　 　　 　　 　　整个电影可以简单地看做一个记忆残疾人杀死利用他的残疾来愚弄操纵他的人的故事。 　　 　　 　　 　　另外，最让观众疑惑的是teddy说lenny自己撕掉了警察档案的１２叶纸来自己欺骗自己。你真相信teddy的话吗？teddy的话虚虚实实，有些是真，有些是假，这一段就是假的，事实上，那档案应该是teddy撕的。试想，teddy要是不故意迷惑lenny，又怎么能利用他，欺骗他来杀掉jimmy呢？teddy私藏了那些照片。电影中lenny不接teddy 　　电话时，teddy把lenny的报仇后的照片塞进主角房间，逼lenny接他电话。为什么lenny报仇后的照片在teddy手上？因为teddy要误导利用lenny去帮他杀人，所以teddy不能让lenny有已经报完仇的证据，所以teddy私藏了那些照片。与之同理的，teddy既然能用把lenny报仇后的照片私藏的办法误导利用lenny，那么teddy也能（而且必须）用相同的手法撕掉那１２页的警察档案来误导lenny（不然，无法利用他）。至于影片最后lenny又烧了照片，这还是涉及电影的“ＢＵＧ”问题，和为什么不立刻杀死teddy是一个问题。 　　 　　请你再注意电影开始的第一个镜头，是lenny拍下了teddy死亡的照片。假如lenny打算继续玩杀人游戏，那他就不会拍下这张照片了。他拍下照片，就是要结束所有一切。假如lenny决定继续玩杀人游戏，他何必拍下照片。如果按照你的解释，lenny会再把照片烧掉，这样解释不是脱了裤子放Ｐ，多此一举？　　　　 　　 　　lenny杀死jimmy时，他也是立刻拍下了照片，要保留证据。结果jimmy临死时说出了“Sammy”这个词，lenny立刻明白自己杀错人了，非常痛苦，责备自己说“我做了些什么啊”。这时候teddy来了，lenny非常机智地假装不认识teddy，利用自己的缺陷明白了原来这一切都是teddy导演的，然后才对teddy起了防备之心（或者杀机）。 　　 　　你思考一下这个问题：lenny只有十分钟的记忆，是否可以证明lenny的个性是永恒不变，处理问题的方式永远不变DD因为人的性格不会在十分钟内发生巨大变化。假如lenny烧照片的话，那么说明他的性格和处理问题的方式在１０分钟内（其实更短）发生了巨大变化。 　　 　　说的更深一点，假如你的解释正确，lenny是喜欢玩“侦探杀人游戏”的人，那么他就是个草菅人命的垃圾，为了满足己私，不顾其他无辜人的性命，就lenny的“个性是永恒不变，处理问题的方式永远不变”的生理弱点来推测，假如lenny是这种人的话，那么lenny在杀死jimmy后，为什么会为自己杀错了人而后悔？我们把剧情截断，如果lenny在杀死jimmy后，teddy没有出现，你觉得此时为杀错人痛苦万分的主角会决定继续玩杀人游戏吗？ 　　 　　这样就在一个恒定性格的人身上产生了一个人性悖论DDDDDD杀错人后悔DDDDDDDD想要杀无辜者来满足自己私欲。想要杀无辜者来满足自己私欲必然会杀错人，杀错人会后悔就不会想要杀无辜者来满足自己私欲。你怎么解释这种人性矛盾？别和我说lenny是多重性格的人，那么我就汗了。 　　""保留他存在于这个世界的意义""是很一厢情愿的看法. 　　 　　整个电影没有支持这种观点的任何事实上的线索，之所以有很多人支持这种观点，无非是teddy那一大段的“１２页纸”那段话，这是teddy误导Lenny的话，大家也都被teddy误导了。 　　 　　""保留他存在于这个世界的意义""只是teddy一个人的结论，是teddy灌输给你的观点。 　　 　　整个电影非常让人迷惑，惟独teddy的那一大段对话说的十分明白，所以观众很容易在一片迷茫中错误地感觉到拨云见日的错觉，认同这个撒谎者的结论。 　　 　　teddy一直在误导Lenny，这样的人说的话，你也信？ 　　 　　奉劝大家，如同Lenny告诉自己的：别相信teddy。相信他的话，你就被耍了。"
1,记忆碎片,4,虽然知道多看几遍有可能会看懂，但我觉得应该把这个时间献给更多的电影。
2,记忆碎片,5,你可以连看5部烂片 然后忘掉他们 或者用同样的时间 把《记忆碎片》看上5遍 然后爱上它
3,记忆碎片,5,导演用一种前无古人的倒序方式营造出“支离破碎”氛围，让观众深刻体验到Lenny破碎的生活及内在，我们如Lenny般扮成侦探，在电影里寻找着所谓的真实。而那织在复杂结构中的情感更让人没有办法不被感动。“如果自欺才能使我快乐，我选择如此的活着。”我们要生存下去必须给自己一个理由，否则就会精神分裂。但那些我们坚持的东西可能只是自己假象中的虚幻。一觉醒来时看着天花板问问自己：我是谁，我为什么在这里。然后你开始回忆，当那些记忆的碎片一点一点拼凑起来，一个完整的可能也并不客观的现实呈现在眼前，你，是否惶恐？
4,记忆碎片,5,那个不到半秒的画面。。。另外请问一下楼上那个“短”评是怎么做到的！！？
5,记忆碎片,4,"不错,一开始我还以为家里的DVD坏了,怎么倒着放的"
6,记忆碎片,5,神奇的剪辑让故事内容呈现出了光怪陆离的多种路径，在记忆的初期，只需要烧掉两张照片，多加一个注脚，命运就会像一俩失去了刹车的悍马一样在历史的胡同里横冲直撞，莱纳在片刻清醒时的自问自答讨论存在感，需要多看几遍才理解
7,记忆碎片,5,如果还没看过，那么现在最该做的是千万别看任何有关的评论，立刻飞奔到影碟店，买张带导演评论的D版，然后开始失忆之旅。
8,记忆碎片,5,"用记忆来确定自己的身份，让自己相信世界仍然存在。
剪辑手法太诡异了，看的我也失忆了。浑身发抖"
9,记忆碎片,4,二十六个碎片，将后十三个碎片倒叙，以彩色片形式拍摄，前十三个正叙，分别加在十三个彩色情节中，并变为黑白片，以突出纪录片的风格。后十三个碎片每个碎片再被分成两半，并颠倒顺序，黑白片时而在两半之前，时而之中，时而之后。
10,记忆碎片,4,这片看起来太累了。。。
11,记忆碎片,5,在六月五日的前一天特意看这部电影的，想了解一个没有记忆的组织，是如何确认自我的，在开头的时候还真以为没有记忆也是能确认自我的，然随着电影延伸，最终仍旧证明一个没有记忆的组织是没有自我的。一个没有自我的组织，在这世界做什么呢？复仇，杀人？
12,记忆碎片,4,真烧脑子
13,记忆碎片,4,抖机灵这事吧，真没那么玄乎
14,记忆碎片,4,约翰G只是失去记忆的杀手活下去的理由而已。一场无穷无尽的反复与补完，教导电影学院派诸君“管中窥豹”也会随时间轴递进转变为叙事一法。虽然没什么大牌演员，但各位的表演却也都很到位，甚至海报都与主题的嵌套法配合得恰到好处了。lenny变sammy的一处镜头是脱出困境的钥匙。
15,记忆碎片,4,一个针管引发的血案。
16,记忆碎片,5,1、看毕更加相信不可知论，以及，增加对本体论的兴趣。2、没有什么是确定无疑的。3、用镜头能如此完美表达短期失忆症，神剪辑，神代入感。
17,记忆碎片,4,其实也就是倒叙和重新剪辑，好玩的地方只在于最后那段话。
18,记忆碎片,5,诺兰大神的作品，改编自他弟弟的短篇小说，这一家子都是大神。
19,记忆碎片,5,打断能指和所指的连接的一种有趣尝试，在记忆和证据这组关系上做了极为有趣的文章。脑科学电影的代表作。另外结尾翻盘翻得真好，一方面男主被双重地利用，另一方面他其实是他在自己骗自己……
20,记忆碎片,4,第一个想出这种拍摄手法的人简直就是天才。
21,记忆碎片,5,不服不行
22,记忆碎片,5,克里斯托弗・诺兰最形式主义的作品。片如其名，当时看完脑子完全呈碎片状了。影片高度风格化的剪辑和叙事结构既是最大优点，也是不足之处。
23,记忆碎片,5,Just because there are things I don’t remember doesn’t make my actions meaningless.
24,记忆碎片,5,【A+】重看，评分上升。一个突破了电影故事的章法，又完全无法被复制的完美特例。悬疑性的构造已经让人叹为观止，要命的是还能在结尾跳出情节剧来一把哲学性升华，诺兰太牛逼。
25,记忆碎片,5,这片子有基本逻辑失误，细节上的小BUG也不少。1.为妻子报了仇的事实会忘记，要复仇的这个念头却固执到全然不会忘记？2.原则上似乎受伤后所有的事情都会忘记，却不会忘记自己的健忘和失忆，到处跟人提醒：我有个病……，且每天醒来仍旧能依次的、逐步的写下字条拍下照片，并且不会忘记出门给自己带上宝
26,记忆碎片,5,看似散碎无章，其实影片一直恪守着最严格的线性叙事结构；这个黑暗的，阴郁的复仇故事在诺兰的重组下魅力十足。
27,记忆碎片,4,评分：B 如果按照哲学气质分，诺兰就是导演中的笛卡尔。他的电影几乎就是对《第一哲学沉思录》的视听化翻版。相比于《盗梦》，《记忆》还是孩子般的稚嫩期。想吸引更多人思考哲学问题并不难，开门电影哲学就可以了。欧美这方面已经比较成熟。在这个意义上，感谢诺兰。
28,记忆碎片,5,不止是一个悬疑片，还触到了生命中无可避免的痛苦：找一个活下去的理由，哪怕这个无比强大的理由其实并不真实。虚无感比死更可怕。
29,记忆碎片,5,精巧的记忆拼图～！
30,记忆碎片,5,我已经说不清我第一次看到它时的震撼，我只能说怎么会有人想到这样拍电影
31,记忆碎片,4,2018年1月第三次重温；剪辑炫技自不必多言，与男主破碎的心灵和记忆也呈对称；倒叙的结构加上黑白段落的闪回，逐渐拼凑出真相；每个场景构成一个相对独立的段落，交叉叙述，对观众很大考验（特别是细节部分），安插顺序有讲究，结构形式至上的巅峰；记忆迷宫的轮回。
32,记忆碎片,5,神级的镜头剪切和组合，从错综复杂的剪切片段去组建整个故事架构，而到最后一直都令人不得不去思索镜头逻辑。不仅如此，深度的人性思考也体现出来了。全世界最出彩的剪切故事。而据说成本只有500W美金！诺兰真神人也。8.9
33,记忆碎片,5,用倒叙手法将简单的故事复杂化，依次递退，层层还原，顺看逆看值得重温几遍。看得辛苦但是很益智。吉米给妻子注射致死那段的暗示处理得极好，交代了主人公妻子的真正死因，聪明的导演不刻意交代，既是保持独立性，又是尊重观众的智商。
34,记忆碎片,4,整个故事分成二十六个碎片，将后十三个碎片倒叙，以彩色片形式拍摄，前十三个正叙，分别加在十三个彩色情节中，并变为黑白片，以突出纪录片的风格。后十三个碎片每个碎片再被分成两半，并颠倒顺序，黑白片时而在两半之前，时而之中，时而之后。
35,记忆碎片,5,（无非是一个有病之人自导自演的一场没完没了的假戏真做，直到最后再让观众恍然大悟并为主角连声叹气。）
36,记忆碎片,4,看的时候一直在想有没有谁会做个自己剪辑的正序版本……
37,记忆碎片,4,本片最大的成就在於裼昧艘环Nl逆向rg交叉剪的⑹率址ǎ橛^造了一N全新的角w，正如我都很擅L根已知l件\算求解，s很y在得知Y的时候逆推反^l件和成因。生活@道C明}o解的r候，我或多或少地都像男主角一樱要N自欺欺人，要Nx裥允。
38,记忆碎片,5,原来解构主义就是将一件简单的事情一直重复到让你搞不懂，再给你恍然大悟的感觉。。。考验的是后期编辑的功力。
39,记忆碎片,4,智商已被烧光……看完碎片都拼不起来了……
40,记忆碎片,5,"【A】那些说诺兰电影烧脑的孩子不是哗众取宠就是真的没带脑子去看。这部电影值得赞赏的点根本不是什么所谓的“烧脑”，而是在观影过程中对于信息的一层层堆积与解析，最后一瞬间通晓答案时的那份满足感。就这点来说，诺兰无出其右。
（哦，还有一个疑问，那句“不要接听电话”到底是谁指使兰尼纹上去的?）"
41,记忆碎片,5,"有点类似《盗梦空间》和《禁闭岛》：当无法确定唯一的真实世界时，那就被迫生活在多重可能的世界中苦苦追寻自我。片尾那句“I have to believe in a world outside my own mind……”是关键，实际上，对这些主角来说，向来是“your world is not real""，无法信任外在于my own mind之外的这个世界"
42,记忆碎片,5,虽然知道精神题材的某些套路，但结局还是挺震撼的：未来的我被过去的我误导了！短暂性失忆让人忘记时间的存在，选择性失忆让你心安理得。不妨思考一下，如果你是主角，你会怎么做呢？
43,记忆碎片,4,处女作《追随》因为缺少突出主题可能还不明显，可看看之后的作品：《记忆碎片》里的记忆是硬盘和内存，盗梦里的梦更像虚拟世界，《致命魔术》里屈服于结局的复仇，不像蝙蝠侠的蝙蝠侠，不像小丑的小丑……诺兰缺少看穿事物本质的能力，而那并不是努力拍电影就可以获得的。
44,记忆碎片,4,当记忆已经支离破碎，要怎样才能找到真相？电影用倒叙的手法一步步抽丝剥茧让我们接近真相，这个电影确实很能抓住人，让人迫切想知道结果到底是什么，悬疑做的很不错，很烧脑的电影
45,记忆碎片,4,确实有点过分地卖弄技巧，而使一个故事支离破碎，抛开结构，单纯说这个剧本本身还是值得肯定的。
46,记忆碎片,5,好喜欢这种烧脑剧情 表白诺兰我男神 一遍遍重叠复述 刚开始看不太懂 后来越来越清晰 要用脑子看
47,记忆碎片,4,看一遍没看懂，在网上找剧情解析，明白了大概。诺兰很擅长此类烧脑电影，叙事手法新颖，剪辑到位。之后的作品《致命魔术》、《盗梦空间》更精彩，更经典。看过这部电影，我想到了《心迷宫》，想必导演很崇拜诺兰吧。
48,记忆碎片,4,重温。说用剪辑和拍摄手法把一个一般的故事化腐朽为神奇并不太恰当。Nolan通过正反叙并开，黑白色转换将故事粉碎为无数碎片，让观众仿佛Guy Pearce一般患上了失忆症，并在剧情进展中让观众重新找回专属的上帝视角，从而对处于失忆状态的主角发生共情。但电影本身为了展现这一手法显得有些束手束脚了。
49,记忆碎片,5,将叙事拆分成较小的段落、逆时间顺序放映、并在每个段落里插入某次通话的部分和一些回忆幻想。这种故布疑阵的情节组织方式，使得平淡剧情悬疑起来。也证明人必须通过完整记忆才能是一个“连续统一体”，否则只能是片段化的、会被他人和自己误导利用，“拍立得”提供的点（瞬时照片）无法连缀复杂生活。
50,记忆碎片,5,十分佩服诺兰这脑子
51,记忆碎片,4,没有记忆或许会很快乐，但是只有片段的记忆就确定会很可怕！
52,记忆碎片,5,牛逼的片子诶~
53,记忆碎片,5,如果你的记忆碎掉了，你会怎么办？――简单的故事，通过不简单的结构，所呈现出来的效果，确实有点烧脑。双线叙事、一正一倒，最终融合，悬疑揭晓，这个过程在这次重温中最直接感受就是“漫长”。――诺兰真是个很会用结构讲故事的导演，让你跟随他的设计，体验莱纳没有短期记忆能力的生活。2013资料馆
54,记忆碎片,5,不愿意相信记得的事情被篡改记忆之后，虚假也成了唯一相信的真实。//二刷之后深深感到剪辑和无限可循环叙事的牛逼。记忆是一个圆，此刻的我站在圆周上任意一点。向前回溯，接近真相；越过真相，回到起点。我反复涂改着我的记忆，因为失去一切意义的生活啊，它需要继续下去的动力。（20160821）
55,记忆碎片,5,#电影调色#黑白与彩色。黑白代表过去时空，彩色代表正在发生的时空。倒叙部分为彩色，顺叙部分为黑白，两条线索分别发展，到最后黑白部分的时空逐渐变为彩色，完成了两个时空的交汇。#谜题#俗称烧脑电影的谜题电影吸引男性观众为主的观众，这种智力测试经常围绕时间旅行、科幻或濒临疯狂的心理扭曲故事展开。有些更像是围绕现实和艺术本质所作的广泛哲学讨论。
56,记忆碎片,4,"Do people really need excuses to live on? What would undo, if I get the ability to lie to urself?
Does the truth really matter?"
57,记忆碎片,4,这部电影看下来比较费脑子。见过倒叙拍片的，但是把片段剁这么碎一截截往回倒的还第一次看。太考验人的短时记忆力了。我简直想指责这个导演故弄玄虚。不是一部剧情片电影，而是一个智力游戏。其实整部电影的要点在于要相信teddy说的话都是真的，然后所有的套团就全解开了。
58,记忆碎片,5,【169】明明标注过，不知为啥豆瓣又抽了。这是一个一般故事的高级讲法。
59,记忆碎片,4,虽然设定有硬伤，但能把一个简单的故事通过倒叙，插叙，剪辑等种种手法讲成这样，还是挺有能耐的。和盗梦空间有类似之处，种下一颗种子结出一个果。只是先让你看到结果，最后看到种子时就有醍醐灌顶之感。主旨么。。。就是最后主角独白那段，不过让主角背书一样把中心思想这样背出来真的大丈夫么=。=
60,记忆碎片,4,首先我得说如果所有的电影都是这种叙事手法，我们早晚都得疯了，而对于这部电影来说，这样的方式只不过是让我们更容易与主角感同身受罢了，当然，导演对于故事把握的还是很细致的，不至于自己乱了分寸，至于莱尔以外人物的探讨也就免了吧，这个世界不过只是属于莱尔的。
61,记忆碎片,4,真的让人看得头晕，非常的烧脑，得多看几遍。
62,记忆碎片,4,克里斯托弗.诺兰用这部影片让观众深刻感受电影带来逻辑和思维的愉悦。主人公有短暂失忆症，记忆每过段时间就会被清空，观众也必须洗清头脑去迎接下一段记忆，而更要命的是已经采用了如此复杂叙事方式后还用了倒叙的手法。这真的是一部仅凭结构就可以成为经典的电影了。
