,movie,star,comment
275,记忆碎片,3,"倒着记叙 一个短时失亿的人 ，所以会不可思议的结果。所以感觉就没有那么牛逼了
这种电影有创新性，完全到这来的片段 ，如果你什么也不记得，别人都可能利用你，害你，是不会有一种恐惧感。  凭着感觉去做吧"
276,记忆碎片,3,黑白画面的顺叙，彩色画面的倒叙，碎片化记忆穿插在其中。诺兰用这样的方式为我们展现了一个自欺欺人的故事。
277,记忆碎片,3,诺兰在影片结构的创作上让人惊奇到发指，就像一个语不惊人死不休的作家，在文采上倾注了太多心血。令人尊敬的匠心和过度配合结构的剧情设计，在大量的留白里为自己留下了回转评论的自由空间
278,记忆碎片,3,每人都需要e人泶_定自己的身份，@很好。但拖沓是真的，男主也不是短菏，是真的心理有}，而Nolan是真的讨地好著@口槔掀哦B的主}。
279,记忆碎片,3,人们往往只想记住对自己有利记忆，得到自己想要的结果，事实真相到底如何根本就不重要。PS.初看这片智商完全跟不上啊......
280,记忆碎片,3,这样倒叙的手法看到最后我真心跟不上，支离破碎的片段，Nolan用心良苦也。
281,记忆碎片,3,我又睡戳了。天，是我太困还是电影太恼火？为什么那么多人打五☆？电影是让人娱乐还是让人费脑壳？confused。。。
282,记忆碎片,3,看得我累死了。一点点往前倒叙搞死人了= = 完了以后也没啥推理成分嘛。你说深刻确实深刻可是我不是文艺范儿我深刻不起来……所以传说中的高分悬疑片都不适合我么……
283,记忆碎片,3,一条线段中分，两部分再分别剁碎，一部分按着时间顺序排列碎片，另一部分再按着时间倒序排列，再将这两部分交叉排列。其实玩的就是个结构！
284,记忆碎片,3,干嘛非得弄成这样啦 太埃塞了 但是导演想法真的很棒 看了很久 才回过神来
285,记忆碎片,3,该死的倒叙，我只想要一部能开心120分钟简单的电影。
286,记忆碎片,3,无聊透顶，那么高的分数我认为大家都是跟风打得
287,记忆碎片,3,看了三遍都没看完 提不起兴趣啊 可是都说好看都不知道到底要不要继续
288,记忆碎片,3,虽然能吸引你一直看到尾，但是结尾解释实在是觉得太简单了，一个简单的逻辑让导演忽悠你，就像出了一个很难的谜语，谜底越很烂
289,记忆碎片,3,这个电影导演用了倒叙，还有很多线索也可以是说男主的纹身还有黑白片里叙述来铺开整个影片，没看过这样的片子，大部分是看懂了，但是不怎么喜欢这种类型，看得太累了~~
290,记忆碎片,3,三星半 诺兰对时间线的把握真的厉害 两条叙事并行还是一条倒叙一条正叙 剪辑也很神摆 隐约嗅到了故弄玄虚的味道 有点炫技的意思
291,记忆碎片,3,imdb居然排31 不能理解 没觉得多好
292,记忆碎片,3,对这种智力型片子，我实在不是太感冒。不过怕的是挺好的，那种错乱的叙事，呓语似的台词，把人物的状态刻画的很好。
293,记忆碎片,3,记忆这玩意，男猪脚牛逼极了，选择性剔除对我不利的，自己创造自己的历史，看谁不爽就将谁刻上John G，然后自己凭身上的纹身证据来找出来然后杀了他。导演逻辑性如此之强，如果混IT界肯定大有前途。
294,记忆碎片,3,嘛，我就是不喜欢。。。
295,记忆碎片,3,有cy，是捋清楚了。W到要律一c，@|西就不失了
296,记忆碎片,3,传说会烧糊脑袋的高智商电影之一，看了皮皮上令人纠结的影评，有点忐忑，有点惶恐，顶着看8遍才搞明白是个什么回事的大帽子，心怀不安，满眼疑云的观看了这部影片，期间不时走神以及无数哈欠干扰，但是绝不影响我们理解和认识，看完之后，心中无限感触，“艹，什么高智商影片？侮辱我们智商来着！”
297,记忆碎片,3,说实话我没怎么看明白，也不知道这部电影好在哪里，如果有机会，我愿意再看一遍。
298,记忆碎片,3,故事本身还不错，开放式剧情颇让人玩味。哇哦，剪辑！我明白看似没有逻辑的剪辑方式似乎更能表达“碎片”二字，但我讨厌这种花哨的手法，技巧玩过了成炫技，显然是一个怕观众不知道自己牛B的导演在脸上写了硕大的“牛B”二字，于是路过的人都看到了牛B。“你只记得你想记得的”，不过如此。三星半。
299,记忆碎片,3,大家真觉得这样片子很有意思吗？
300,记忆碎片,3,凭着点点记忆杀人无数 都是自找的
301,记忆碎片,3,LG说我看过 完全木有印象啊
302,记忆碎片,3,其实这样是为什么？？？卖弄手段？故弄玄虚？？？有意思吗？
303,记忆碎片,3,just soso..差不多看懂了，只觉得影片剪接手法诡谲，看的过程并不觉得享受，看完也没啥回味。就酱。
304,记忆碎片,3,差点把我整疯了，应该倒着看
305,记忆碎片,3,没看懂。2012年年末在JH和亲爱的一起看。短期失忆，心理，压力。倒叙。逻辑思维能力，得多看。
306,记忆碎片,3,3.8，花招在于段落间的时间序列问题，主体部分随时间回溯，展开剧情的逆转。中间插入若干时间不明确的段落。这样在时间上依然模糊，再把表示客观事件发生的镜头与主人公记忆的镜头穿插在一起。
307,记忆碎片,3,2009.7.7 DVD home
308,记忆碎片,3,我真的是看腻歪这种其实主角自己就是个神经病的套路了r(st)q悬疑或者惊悚片难道一直都要走这个路子吗
309,记忆碎片,3,新颖，但始终给我一种形式大于内容的感觉
310,记忆碎片,3,过誉了吧。不过看了评论后打算找个时间再看看。
311,记忆碎片,3,三年前第一遍看了10分钟就关了 昨天加今天第二遍才从头到尾看完 导演确实很值得敬仰 不过 电影么 可以不这么累么
312,记忆碎片,3,这部片子让我头疼了好久，不停想不停想
313,记忆碎片,3,稍微有点乱。看的很累。
314,记忆碎片,3,"看完后有些失落
并没有期待中的好看是看有人说它比《蝴蝶效应》好看才看的但是个人还是更喜欢《蝴蝶》多一些。
看前面会一直不停的重复
好吧
又是倒叙
需要耐心
不可以快进
不过结尾男主角的一段话总算没让人觉得这部片很无趣
总结就是这片
不适合打发时间
看这片会让人觉得累需要思考"
315,记忆碎片,3,Top250#24。说实话，没怎么看懂。不过这种拍法挺有个性的。
316,记忆碎片,3,正着的故事倒着讲就是好片？那政治课本就是名著了
317,记忆碎片,3,据说是一个10分钟的剧情两小时才倒叙讲完的，我在飞机上闪了一遍，没看懂。。要说花五遍的话，我觉得不值。。
318,记忆碎片,3,很混乱...........不觉得这种拍摄方式有多高明.........而且觉得逻辑性也不是那么合理..........
319,记忆碎片,3,故弄玄虚，要多看几遍啊。
320,记忆碎片,3,骗子，费劲心思看完，感觉到被导演耍了，跟“丁点真相”里说的那些破事差不多。无非是种了西瓜长出来确实土豆，请它十几个专家来研究，什么基因变种，外星人・・・・拍个几集，最后说是他哥拿错了种子，天哪！
321,记忆碎片,3,导演很磨叽，故弄玄虚，没什么可看性，难以忍受
322,记忆碎片,3,这……有点过了吧……一直不太接受诺兰的电影，大部分都觉得是依靠拍摄剪辑手法故弄玄虚而已。更让我接受无能的是这片在豆瓣上竟然比我心中的神作《穆赫兰道》分高
323,记忆碎片,3,原谅我实在没怎么看懂 后来还是经朋友提醒才明白怎么回事...看来太深奥的片子不适合我(￣.￣)
324,记忆碎片,3,诺兰的片就这样 前面虚晃一大片 让你以为很牛 到结尾告诉你其实只是bull shit
325,记忆碎片,3,我们要生存下去必须给自己一个理由，否则就可能会精神分裂，但那些我们坚持的东西可能只是假象.
326,记忆碎片,3,oh no! 倒⒑直看得我[抽筋!
327,记忆碎片,3,"可能我们每走一步只有小小的误差，但是当我们走了很多步以后,却发现自己已经远远偏离了自己的原来目标||倒叙叙事很新奇"
328,记忆碎片,3,相当费脑细胞的一个故事――一个可以用一句话讲完的故事的倒叙。
329,记忆碎片,3,好吧，这个电影真考验智力，但是，作为一个电影，实在太累了
330,记忆碎片,3,擦，还是看求不懂啊，第二遍了。
331,记忆碎片,3,。。。。。编剧很牛。。但是这电影拍的很不人性化。。。。。
332,记忆碎片,3,如果我说它故弄玄虚一定会被众粉丝骂死..
333,记忆碎片,3,我觉得这部电影很无聊 故弄玄虚 把一个很没含义的故事倒叙 正序 穿插讲述 最后交点 有些人真是的喜欢这类电影 有些人肯定会拿这部电影来显示自己的品味 可惜 我对这部电影没有任何感觉 看完没有震撼 没有感动 跟做了一道题一样 很无趣
334,记忆碎片,3,"对45,1,44,2,43,3……这种剪辑方式挺新颖，剧情就很一般了"
335,记忆碎片,3,文艺腔文艺腔文艺腔文艺腔文艺腔文艺腔
336,记忆碎片,3,一般人一遍看不懂，看懂了觉得太一般
337,记忆碎片,3,电影很一般，就是被吹的神化了
338,记忆碎片,3,将一个故事分成几个部分，打乱次序，再按一定的排列组合起来。这样就把一部剧情片排成了悬疑片了。其实真的有点乱，没有逻辑推理能力的人根本会看不懂，剪接手法有点欠缺。不过悬念做得还好，到最后才能真相大白。后面显得是应付式的，前面分解地很碎，到后面就是一大段事件交代。
339,记忆碎片,3,闭上眼睛，世界依然存在。那么在梦里还是现实，又有什么区别。自以为离真相越来越近，却是一步步走向毁灭。
340,记忆碎片,3,"反正我是没看懂，也暂时不想再看一遍
"
341,记忆碎片,3,体现了好莱坞文化的空洞，运用低劣手法搞小把戏的片子，不觉得算是佳作，这片子出了美国也得不了什么奖
342,记忆碎片,3,不好意思看着看着睡着了。。本来想瞻仰本片来着的。。没想到那么沉闷，不过影片的拍摄风格和构思设计都十分巧妙
343,记忆碎片,3,我已经忘记这部电影的具体剧情了
344,记忆碎片,3,从头到尾的倒叙 最后也就是所谓的一开始 那男的就分裂了还是真么了啊 我没看懂。。。
345,记忆碎片,3,《低俗小说》害苦了你，如果说它只是小试了表现手法，那你就是滥用！！
346,记忆碎片,3,诺兰的片子也看了很多，没想到IMDB前30里有3部都是他的，真牛逼。
347,记忆碎片,3,主角自欺欺人、警察最后玩脱
348,记忆碎片,3,看完以后很愤怒 有一种被导演耍的感觉。。诺兰貌似很喜欢拍这种题材的电影 真是个不喜欢这么烧脑子的电影
349,记忆碎片,3,正叙与倒叙分布对应彩色与黑白胶片。诺兰这家伙从来不肯老老实实讲一次故事，玩好了牛逼，玩砸了就是装逼了。
350,记忆碎片,3,混乱的记忆，刚开始看时心情阴晦看完心情更阴晦，所以呢心情不好时还是别看这类了
351,记忆碎片,3,"连个高潮都没有,就算把男主纹成活尸小子那样的也没用"
352,记忆碎片,3,很久前下载过这部电影。可是看了一点，没有兴趣看完。今天终于看完了。理解的不是太透彻。有时间再看看。
353,记忆碎片,3,最开始我以为是一部单纯的把事情倒过来说的电影，直到最后才明白是TRIANGLE.这男人真蛋疼啊。又似乎不是
354,记忆碎片,3,开头泰迪就让莱纳杀了的镜头，应该很多人不会太留心，故事其实很狭小，观影乐趣就是找顺序了吧。另外男人穿大一号的西装真是难看
355,记忆碎片,3,剧情安排的不错，但是我竟然犯困了
356,记忆碎片,3,承认导演付出的辛劳，可是我的脑细胞死了不少。
357,记忆碎片,3,没有传说中的那么神，胜在倒序与碎剪辑交替，复仇只是一个自欺欺人的故事，为了给自己一个活下去的理由，这样活着实在可怜，还不如死了幡洇
358,记忆碎片,3,不推荐，但，是高级的剪刀手~天才诺兰的随意作。。
359,记忆碎片,3,失忆真是人生最悲剧之一
360,记忆碎片,3,Pathetic man. Not impressed. Matrix girl is kinda hot though.
361,记忆碎片,3,故事挺简单的。但是被导演拍的很难看懂
362,记忆碎片,3,真的有那么那么好吗？我觉得这结尾挺一般的啊。。。或者我应该像多数人一样再重看上五遍，十遍的。
363,记忆碎片,3,完全没看懂~我是俗人。装逼必备啊。我了个擦。
364,记忆碎片,3,第三次尝试观看，中途放弃，看得我头疼。
365,记忆碎片,3,小警察一时起贪念 失忆男错报无妄怨
366,记忆碎片,3,倒序，上溯，自语，一定要一口气看完
367,记忆碎片,3,第一次看不喜欢，希望以后会喜欢
368,记忆碎片,3,丫的，不断的重复。。结尾不错。结尾的歌不错。
369,记忆碎片,3,终于找到机会看了 在失忆起点和终点之间开始重构记忆，一个向后（黑白）一个向前（彩色）直到99：50左右打死几米拍照交汇成完整记忆。诺兰留白了刚刚失忆的段落，但是叙述依旧是建立于记忆碎片的收尾相续，所以对线性叙述没有多少绝对性突破，商业痕迹大于实验
370,记忆碎片,3,天，又是一颠来倒去故弄玄虚的片子！故事很一般，技巧很出色。建议从尾看到头。
371,记忆碎片,3,电影顺着来拍就属平平无奇，男主角本身就带猥琐样，衣服一次都不换是为了把观众们搞晕的效果
372,记忆碎片,3,没有记忆的人好可怜阿，每时每刻只能生活在不真实的世界里
373,记忆碎片,3,其实导演不过是把一部普通的电影一段一段倒叙着来放，制造出抽丝剥茧的效果，看多了此类片就感觉没什么特大的看点。男主角原来只不过是失去短时记忆的功能，可能后来受老婆自杀的刺激，就自己给自己编织了一个世界，创造的生活的意义，即使他知道这一切，装着装着就成真的了。
374,记忆碎片,3,我看过的。可是我不记得了。
375,记忆碎片,3,有点小失望 ，和先前看的未知死亡雷同。。。。。
376,记忆碎片,3,故事倒是不太复杂，只是后期的剪辑有点故弄玄虚的意思。
377,记忆碎片,3,如果能看懂应该给四星，看不懂的话只能给三星了，真是记忆碎片，我的技术不行拼了半天也没拼上，导演整的太碎了，看了影评才大概理清了脉络，没看过这么碎的拼接记忆片，挺佩服导演。一位老兄说多看几遍有可能会看懂，但现在是急功近利的时代，所以我选择有时间看点别的片子，又不考电影学院，就不细研
378,记忆碎片,3,看得太累了。。。。。我果然非常不适合所谓的高智商电影。。。
379,记忆碎片,3,绕绕绕！这片儿要是正着拍，就没神马看头了吧。
380,记忆碎片,3,果真还是最爱致命魔术。。。诺兰你要加油继续突破！。。！
381,记忆碎片,3,那些不可能的惊心动魄
382,记忆碎片,3,诺兰成名作，但系真系睇到我晕，剧情比较破碎
383,记忆碎片,3,还确实是要看5遍才能看懂
384,记忆碎片,3,为嘛大家都广泛接受美国风格的玩结构而不太喜欢欧洲风格的玩隐喻呢……我真诚地觉得这片子不咋地啊……
385,记忆碎片,3,生活在其中的男人是忙碌的也是幸福的 因为他找到了追求的目标 也许这个目标是错误的
386,记忆碎片,3,鉴于这部是在inception和the prestige之前我就原谅导演了。。。跟那两部比这部弱爆了。。。
387,记忆碎片,3,美国电影深刻一点，就开始玩兜圈子，兜来兜去都是自己搞出来的祸端～看到一半，我就知道肯定是他自己为自己设下的局，这种手法许多电影都延用过，以前看《精神病患者》里那个精神病人，就用了那种“只缘身在此山中”的手法。
388,记忆碎片,3,四个字，故弄玄虚。那些说半秒闪现牛的，你们都没看过搏击俱乐部吗……像这种只看最后10分钟就能知道全部剧情的电影我真不明白为什么会被捧得这么高。
389,记忆碎片,3,期望太高，所以失望也很大。觉得还不如seven和fight club。
390,记忆碎片,3,。。。。看的要失忆了 其实很有意思 
391,记忆碎片,3,这个调调我负荷不起~~~~
392,记忆碎片,3,闷，无论结构如何花活，这个故事不是我的那杯茶。多看几遍肯定会看得更清楚，但我却提不起那兴致。
393,记忆碎片,3,"到底想说个什么，禁闭岛模仿的这部电影？
全部看完之后，把顺序颠倒一下。。"
394,记忆碎片,3,。。。看的我的记忆都快成碎片了。。。
395,记忆碎片,3,额啊啊啊啊啊剧情无爱啊，不过演员都给有亮点，
396,记忆碎片,3,还行吧 倒叙的拍摄手法虽然带来些新鲜感 但感觉看的很累 看完了也没什么兴奋感 看电影是该给人带来轻松 愉悦的 刻意的追求新鲜 特别 反而给观众带来吃力的感觉 
397,记忆碎片,3,先给出一个发生了的事实，然后在这个时间点上不停往前推，一小片一小片地推……直到最后，才会发现，原来前提是有问题的，并不是我们一开始所认为的那样。很玩结构的一部电影，或者说诺兰就好这口？只是，哪里都没有像好莱坞这样这么喜欢出产这种类型的电影。
398,记忆碎片,3,我真的记得里面的片段 感觉看过 可是又不记得情节 好像没看过。。我的记忆成碎片了。。
399,记忆碎片,3,"形式新颖, 其实用一般的叙事方法的话实在是很平常的剧情..."
400,记忆碎片,2,10分钟可以搞定的电影默默迹迹搞了2小时。故弄玄虚，文艺青年必看装13电影。
401,记忆碎片,1,说句不客气的话，这里的诺兰和盗梦空间中的诺兰对剧情的掌控差了无数条街。
402,记忆碎片,1,把观众当傻瓜啊。
403,记忆碎片,1,我讨厌只是因为拍摄手法而取胜的电影。
404,记忆碎片,2,"剧情扣人心悬,但是莫名奇妙,没有任何值得收藏的价值"
405,记忆碎片,2,故弄玄虚
406,记忆碎片,2,抱歉，也许是我智商的原因实在欣赏不了这部电影的价值，一直觉得电影最重要的是给人带来愉悦、感动或者启发，但是这部电影给我带来的是confusion and lost
407,记忆碎片,2,个人觉得其实剧情很普通，导演来了个大逆序，从头到尾的逆序，搞得一些人觉得很神奇，我觉得很困惑。看到一半的时候对倒叙的愤怒终于大过了好奇，于是找来剧透一看……不过如此~就像某经常说真话却挨人骂的兄台说的，随便找部电影，这么剪辑一下都会是同样的效果。
408,记忆碎片,1,难看的要死……哲学逻辑实验电影什么的最难看了……有意思吗！？有意思吗！？有意思吗！？有意思吗！？有意思吗！？有意思吗！？有意思吗！？有意思吗！？有意思吗！？有意思吗！？有意思吗！？有意思吗！？有意思吗！？有意思吗！？有意思吗！？有意思吗！？有意思吗！？有意思吗！？有意思吗！？
409,记忆碎片,2,剪辑很新颖。关于失忆，故事很一般了。片长过长，墨迹了点。http://movie.douban.com/review/1096945/
410,记忆碎片,2,诺兰的手法确实一流，但是确实不是我的TEPY。还是喜欢INCEPTION
411,记忆碎片,1,什么破玩意儿！！！！能简单明白点不，正序放不行么！！！这个装逼犯导演就会故弄玄虚！！！
412,记忆碎片,2,前边有点难以理解 终于 哦。。。是哈么回事啊
413,记忆碎片,2,我只是想做一个我，为什么有那么的多。
414,记忆碎片,1,确实是一坨碎片，只是我无法把它们拼起来。
415,记忆碎片,1,同一个机灵反复抖2个小时，再机灵也看得反胃。更何况故事本身也没什么吸引人的地方，过于简单
416,记忆碎片,1,电影无非消遣，我从来就不喜欢什么“高智商电影”这种说法，只是导演玩的手法而已。这片子我看了两回，第一回看了半小时， 第二回又接着看了二十分钟，还是一点兴趣提不起来。所以神马高智商，玩儿蛋去吧，我智商低。
417,记忆碎片,1,纯倒叙。好SB的一部电影。浪费时间。
418,记忆碎片,2,"强迫性神经病。
没有看懂。"
419,记忆碎片,2,在早上的大巴上看这样的电影，确实很催眠。。。
420,记忆碎片,2,《战舰波将金号》是古典三乐章交响曲，《记忆碎片》则是现代多声部卡农。欣赏前作有如听贝多芬，欣赏后作则犹如听利盖蒂、施托克豪森...
421,记忆碎片,2,毫无才气的作品，无非是打乱了重新组装，我不明白，如果一个人这样跟你七零八落地讲一个故事，你一定想大嘴巴抽丫的，为啥这样七零八落地拍电影的手法，就是牛逼了呢。还有，男猪脚太丑了，看见他时常半张的嘴我蛋疼。
422,记忆碎片,2,悬疑是悬疑的。手法是特别的。但是没劲。
423,记忆碎片,1,我就是不喜欢！看不进去！！！！
424,记忆碎片,2,2012年12月26。大雪。从学校半路回来接姜思如回家，俩人在我家看了此片。均表示没看懂。没看懂的片子就不是好片子。拒不承认跟本人智商有关系。
425,记忆碎片,2,不正常人的行为，但对于失忆的描述太多漏洞！刻意的叙事结构，只能让人看的心烦！很多人真没必要曲意附和！不喜欢就是不喜欢。好电影不需要这么拍！
426,记忆碎片,2,天啊，这什么片子啊，看得我都快精神分裂了。
427,记忆碎片,2,"之前imdb上评分很高才下来看，看后很失望，刚看了10分钟就对所谓的精巧的情节安排能够预料了，表演很没劲儿，没有任何地冲击，看过就删的电影。
如果有兴趣，还不如看《罗拉快跑》，甚至周星驰的《大话西游》也有文化意蕴，《记忆碎片》只是一部通俗片而已。"
428,记忆碎片,1,真心不喜欢这种矫情费劲的电影。看的人累的。
429,记忆碎片,2,装B到不要脸的片子
430,记忆碎片,2,这个片起初让我看的很暴躁，因为导演一直跟娘们似的磨磨唧唧的讲一个自认为很牛逼的故事，其实无非就是把故事分成几段倒着放而已。后来当我确定这个导演是个傻逼之后我就没那么暴躁了，耐着性子把这部片子看完，一个导演连最基本的故事都讲不明白真是可悲又可笑。改良版的未知死亡比这个要好太多了！！
431,记忆碎片,2,看了一半，实在不习惯倒叙的手法。
432,记忆碎片,2,根本什么都没看懂。
433,记忆碎片,2,太混乱了，看得好纠结，死了好多脑细胞，虽然我知道多看几遍，仔细去理清线索是能看懂的，但是有这时间我不如去看多几部电影。
434,记忆碎片,2,这个。。。普通人看不懂，me too
435,记忆碎片,1,破碎不堪的叙述。把悲剧拍成了喜剧
436,记忆碎片,1,他妈的哪里好了~花哨的跟狗屁一样
437,记忆碎片,2,看的要睡着，一直在纳闷男主角2到为什么不记日记，原来是自己在给自己制造谜团。这电影简直是在考验逻辑思维能力有限的我！！！
438,记忆碎片,2,so annoying. what's the point anyway. if you like these meaningless mind games then suit yourself but I got better things to do with my time.
439,记忆碎片,1,太垃圾了！！！！！！！！！
440,记忆碎片,2,故事太琐碎嘈杂了，比较乱。我只有一个问题：如果我只能记得十几分钟前的事情，我首先是去治病，如果我强行去找什么线索报仇，警方首先也是强制给我治疗或者监控。而不是任由我去收集什么狗P线索。搜集对了也就罢了，搜集错了杀错人，没有愧疚吗？别人的这个仇找谁报？
441,记忆碎片,2,没看懂，确实没看懂
442,记忆碎片,2,看了半个小时 实在受不了隔两分钟就重复一次的剧情 然后直接拖到最后半小时 发现完全没有错过重要的事...真心不待见男主 屎一样的头发 和怎么看都不顺眼的嘴巴。诺兰你这次真的是把自己玩脱了！！
443,记忆碎片,2,复杂不是态度不明确，愚弄观众前提是自己清楚
444,记忆碎片,1,芹菜推荐的。但因为男猪脚实在长得像素低，我看不下去呀。。。
445,记忆碎片,2,不是我的调调儿、、、
446,记忆碎片,1,剧情略显冗长，但这样的叙事结构还真是让人佩服的，相信无人敢模仿。
447,记忆碎片,2,这叙事不是很清楚明白么。。。。。每个人都觉得自己可以利用Lenny结果他非常合作的构造他自己的世界 ；整一个剪辑教材，太注重剪辑重点人物塑造的不到位，花样太多反而震撼少了。神秘的双眼就成功很多。
448,记忆碎片,2,完全靠空想构架的一场“记忆缺席”的故事，作品毫无指涉，叙事走向了偏执和故弄玄虚。人物单薄，动机乏善可陈，诺兰最差的一部。
