,movie,star,comment
160,记忆碎片,5,其实如果导演反应的是人性恶就更好了，可惜最后原来是反应人的善良 - - 看懂这电影可真够类的，记住别看正续版的，原版的感触良多。
161,记忆碎片,5,电影本身已无需多言，经典自然是经典。记忆这东西就是迷幻，我之所以为我就是因为那些记忆，我的记忆，那我到底是什么呢，突然跳脱到哲学问题上去了，打住。生活可以很简单，也可以很复杂，也许根本没有复杂的事实，只有复杂的记忆和复杂的人。
162,记忆碎片,5,"《记忆碎片》观后感。1、这是个考验逻辑性和记忆力的片子。2、好的片子都需要有极赞的剪切和戛然而止的结局。3、故事情节可以通俗也可以开放。你可以相信导演给你的结局，也可以自己思索研究蛛丝马迹找出自己的答案。百花齐放从而创造经典。4、诺兰是个妙人。以后的片子必然都看。
"
163,记忆碎片,5,"这手法跟俄罗斯方舟有的一拼~~很新颖独特~~
记忆不好~或者电影方面造诣不深厚的朋友~~看的时候建议做一下笔记~以免造成思路混乱~我其实也相当于看了2遍~每一次他回忆的时候或者我搞不清楚的时候我都倒回去重温一遍~~你会发现黑白是正叙，彩色片段是倒叙~~很搞脑子的~呵呵~~"
164,记忆碎片,5,这是一部费脑才能看懂的影片，情节却十分巧妙，神剪辑！“失忆的人是不会记得自己失忆！”记忆是不可靠的，即使你把重要信息纹在身上，或者用拍立得拍下了照片，也有很多的偏差，心理失忆让所有逻辑和分析变得没有了正解。好可怕的疾病。
165,记忆碎片,5,一部本来以为看懂了结果想想觉得没看懂最后又觉得我的理解没有错的电影= = 从一个小故事发展成如此庞大的逻辑性严密的电影诺兰的确十分强大，特意在盗梦空间之前看这一部不知道inception会怎样
166,记忆碎片,5,大致线索理清，但看了两遍之后，感觉lenny就是sammy，因为没有一个生命垂危的人会在最后喊出一个毫不相干的名字，还有那晃过一帧的画面，越发理不清思路了。。。
167,记忆碎片,4,胜在剪辑.，lenny和sammy神情转换的一处很巧。但将太多的精力和重心落于叙述的重新解构上显得有些炫技，接踵而至和繁杂的细节使得观影的感受显得绷紧而情节冗长，相形之下更着迷于追随中恰到好处的张弛有道，但是影片的价值不容怀疑
168,记忆碎片,5,四星半，结局的两种解释都有道理，事情总是不能完美啊。某评论说，听说诺兰的记忆碎片很好看，看完发现超烂，再一看，原来是吴宇森的记忆裂痕。。。。。。。。
169,记忆碎片,4,感觉就是一部悬疑片截成N段，电脑乱序后稍微加点过度拍出来的。整体感觉不错，节奏紧张，能牢牢的抓住观众的兴趣点。有些人说看不懂，我只能说你没好哈看，电影逻辑清晰，只不过有点乱序，不可能看不懂。电影的结局也挺好的，是我喜欢的那种。
170,记忆碎片,4,看得懂，也很简单的故事，就是倒着讲事儿比较新鲜。在穆荷兰道下都是浮云。
171,记忆碎片,5,记住sammy jerkins
172,记忆碎片,5,故事原本就不错，这样倒叙加插叙的叙事方式更赞，而且两者原本就相互依存。男主表演不错，一双惊恐的大眼充满了张力。
173,记忆碎片,5,非常相当十分神乎其神地讲述故事的另类方法 完全被迷住！本片绝对可以称作CULT片的“王中王”。
174,记忆碎片,4,支离破碎的记忆造成支离破碎的人生，支离破碎的执着导致支离破碎的绝望。
175,记忆碎片,5,很经典
176,记忆碎片,4,这个电影看着太难懂了，特别是对于快进党来说。故事倒序，而且电影片段化，每段之间又结合的很好。看完才知道大概的情节。虽然评分很高，完全是一种导演风格的体现而已。票房不喜欢，估计影评员也不怎的喜欢把！并不是看不懂的电影就是好电影！！！！
177,记忆碎片,5,"第一次看的时候还太小什么都理解不了。今日重看，才领会其天才之处。就算先不说那非常人所能想出的叙事结构，诺兰质问了personal identity这个哲学问题，挑战了john Lock的理论。结尾的“we all need mirrors to remind ourselves who we are""和”do i lie to myself to be happy""太令人深思！天才！"
178,记忆碎片,4,2000年的记忆碎片确实比2002年的不可撤销更早的使用了倒叙手法 看到最后有点毛骨悚然 不是因为Leonard烧掉照片、把记忆改变成他所希望的样子 而是记忆确实太不可靠了 Teddy说的他妻子有糖尿病 他就想象出打胰岛素的画面…好记性不如烂笔头 前提是笔下内容是真实的。
179,记忆碎片,5,“我要相信世界不是我想象出来的，我要相信我所做的事情仍然有意义，即使我不记得做了什么，我要相信，即使闭上眼睛，世界仍然存在。“
180,记忆碎片,5," 生活需要有一个目的，一个明确的目的，这很重要。 
　　
"
181,记忆碎片,5,好赞的电影，诺兰果然是一个革新电影内容的大师，这部电影的构思好巧妙，剪辑和串联也非常给力，让人看得欲罢不能，诺兰的电影果然都是能够将观众一次次吸引进电影院去的，这故事里还有好多让人迷惑的小细节，恨不能再看一遍。原来男主为了让自己活得不无聊而到处寻找一个又一个凶手，没有记忆真可悲~
182,记忆碎片,4,当我们丢失某件东西的时候，总希望时光能倒流，如果不凑巧丢失的是自己，我们又会想尽各种方式证明自我的存在，其实能证明你真正存在过的，只有你自己的记忆和别人关于你的记忆~ps：第一次看的时候只看了十几分钟觉得好累弃了，片子放在电脑里快一年..今天心情不好反而看进去了~
183,记忆碎片,4,“细节放在一起，你就更怀念那人”真相被像洋葱般层层剥落，过去和未来的融合，他只需要一个驱使他生活下去的推动力，否则他只会像一个五脏俱全的机械一样，停滞不前。对吼，每个人都是短期记忆者，要靠外部工具的帮助下才能将历史延续，所以历史的真相就如这场凶杀一样扑朔。
184,记忆碎片,4,记忆的Droste effect，结构又被篡改了……
185,记忆碎片,5,这是一部看完片子想给五星，看完影评想给十星的电影！回顾1：29那半秒的镜头，真的是一种很奇妙与惊艳的过程。诺兰无敌。
186,记忆碎片,5,导演把整个故事分成了大概二十六个碎片，再将后十三个碎片倒叙，以彩色片形式拍摄，前十三个正叙，分别加在十三个彩色情节中，并变为黑白片，以突出纪录片的风格，这样还不够，后十三个碎片每个碎片再被分成两半，并颠倒顺序，黑白片时而在两半之前，时而之中，时而之后。
187,记忆碎片,5,我要相信世界不是我想象出来的，我要相信我所做的事仍然有意义。我们需要记忆去确认自己的身份，我们需要爱去度过此生。
188,记忆碎片,5,还真是牛叉闪闪。lenny的故事即sammy的版本，老婆是lenny不知情下致死，lenny给自己的解释是第二凶手J.G杀害了她，警察Teddy可能是帮助了他杀了J.G，但是他不记得。Teddy想一举两得，把私下交易的毒贩干了灭口，却被Lenny琢磨出来了，teddy想支开他，不料Lenny联系上了Natalea，后者利用Lenny杀了Teddy
189,记忆碎片,5,因为经典，所以特意买来精装的D9，还应该再看。
190,记忆碎片,5,幻境和现实哪个才能更真实一些呢？人活下去总归是要一个理由的吧，也许复仇正是莱纳的生存目标之所在。我相信萨米是他幻想出来的人物，不，也许萨米是另一个莱纳。真真假假谁又能分的清呢。又及：墨菲斯讲的很好，我爱死导演评论了。最后用笛卡尔的哲学理论作为结语深得我意啊：我思故我在。
191,记忆碎片,5,"I have to believe in a world outside my own mind. I have to believe that my actions still have meaning, even if I can't remember them. I have to believe that when my eyes are closed, the world's still here. Do I believe the world's still here? Is it still"
192,记忆碎片,5,观众跟着主角一起片断性失忆，手法不俗，再也不可能会有这样的电影了，因为都会是跟风作。
193,记忆碎片,5,这这是一种，技术上的成功，至少不止我一个人，认定他是值得比较的内容
194,记忆碎片,4,Don't believe your fuckin lies
195,记忆碎片,5,一直想看没看的片子庆幸没被提前剧透。极具跳跃性的剪辑一度让剧情朝着无限种可能性发展，你永远不可能猜出下一秒会发生什么，在失忆症患者的世界里一切皆合理。
196,记忆碎片,4,倒着拍的电影，最难得的是：这种新颖的罕见健忘症（顺行性遗忘病症，无法形成新记忆）现实中的确存在。更难得的是叙事，非线性但是逻辑，信息性很强大有力，故事本身并没有叙事精彩。反结构：一道没有正确答案的完形填空题
197,记忆碎片,5,绝对是一部好电影。而且让你每时每刻都集中着精神来看。另外、意想不到的结局！
198,记忆碎片,5,凌晨，让妓女把厕所门用力关上，吵醒自己，去荒地里燃烧妻子的伪遗物。人如没有记忆，便能天荒地老地坚持。
199,记忆碎片,4,昏! 这部片从片名到海报 我头一次见就总认为是看过了 直到今天看了才知道明明没看过 啊? 真的明明么| POLAROID 690 | 手法5星 整体4.7星 | 第一时间认出了triniti 从她墨镜后的眉毛 这类的事 原来以为我是不行的 | 他这么自信地把记忆和本能归为两回事?
200,记忆碎片,3,有些故弄玄虚，其实我原本应该很喜欢这种结构，但不知为何这部让我不太感冒
201,记忆碎片,3,感觉太过用力的在制造悬疑，而不是故事本事迷雾层层
202,记忆碎片,3,"剪辑！
黑白正叙，彩色倒叙。电影开头和结尾都是主角在甩动照片，注意照片颜色变化这个细节"
203,记忆碎片,3,如果是顺行性遗忘症，那么男主角能够回忆的事情只可能发生在脑病之前。既然导演又暗示了男主角把自己过去的经历投射到了三米身上，那就说明脑病发生在妻子因胰岛素过量致死之后，剩下的故事就是他要不停地杀人以度余生。以上推论若不成立除非顺行性遗忘症患者可以通过内隐记忆来构建记忆。
204,记忆碎片,3,还是不爱看这种拐着弯的片，至少前个把小时的缓慢进程让我睡意朦胧，直到最后半小时才显山露水。说到底，莱纳就是在寻找生存的意义，并不断制造下去。
205,记忆碎片,3, 一段零碎的记忆，慢慢勾勒出了一个骇人的结局。“刚刚写到几了，我的文身呢，怎么不见了，这到底是第几部了！我怎么什么也记不得了！”
206,记忆碎片,3,D+ / 只能说太不凑巧前几天刚好看了《薄荷糖》，感觉两者完全不在一个量级。李沧东用文学的思路拍出了诗一般恢弘而又细腻的电影，而诺兰只是写了个概念蛮好玩的剧本然后让演员念出来，真正的人物情动几乎完全缺位。当然，剪辑确实很厉害。似乎是目前最无感的诺兰作品。
207,记忆碎片,3,基本没看懂，因此无法评价。总体感觉叙事混乱，本来一个很简单的故事，导演为了表现自己的所谓才能故意以错乱的叙事手法迷惑观众，自己沾沾自喜的以达到满足虚荣心的心理。另外，不是因为我没看懂故事就不喜欢这电影，而是厌恶导演的这种装B的叙事方式和拍摄手法。
208,记忆碎片,3,也就是纯倒叙罢了。
209,记忆碎片,3,看N次试图看下去，结果也没看完。真的不太喜欢啊。
210,记忆碎片,3,Nolan影好像都是在考智商]有I艉每础＠@圈圈倒法熟悉套路一眼R破。和失病人混越混越y解M人。不生理或心理障K不接受或逃避F只活在o止境的痛苦中o法自拔。演T一般。
211,记忆碎片,3,大失所望。除了那个萨米变身主人公的一秒钟镜头之后带出的反转剧情还稍弥补了一点。一遍就能看明白，逻辑线索这么直白的片子，那些声称看几遍才能看懂的，我怀疑你们是不是也有短期失忆症，看了后面的忘了前面的，要么真的就是智商低装文艺？
212,记忆碎片,3,诺兰是天才，这部电影依旧能看出他在编剧和导演上的功力。不得不说他一直在给观众设套，全片看上去是如此伤脑筋，你从开始到最后最好不要离开影片画面，因为这种连环套似的剧情设置只有诺兰这个天才儿童才能想出来。还是那句话，不服不行。以上。
213,记忆碎片,3,不知道为什么就是早就隐隐的觉得是这样，结局不意外，而且不喜欢这样的剧情= =男主结局很恶，简直是既预谋犯罪又要让自己理所应当的没有罪恶感，太无耻了，好吧，他的朋友也是咎由自取，谎言的代价= =
214,记忆碎片,3,当sammy这个人物出现的时候，我说：哦，我知道结局了。于是后面的观影过程也变得愈发疲倦。不知道此片是不是同类影片的开山鼻祖，如果是，可以给四星。悬念气氛渲染太足和过于炫耀其实让人产生难受感觉的蒙太奇都是我不能接受的。PS：guy pearce很型本片里。
215,记忆碎片,3,重新看了一遍，从复杂的故事编排和段落剪辑 确实很花哨显得很牛逼 但是最后还是证实诺兰只是一等一的装13高手 从他后来的片子特别能体现出来 当然装13装到一个境界也是本事 可惜内涵和诚意还是太差了
216,记忆碎片,3,最难的在于倒叙，通篇倒叙。结局倒是不很surprise。另外，开场杀掉Teddy也不够强，不能把悬念push很久。刺青可以交代更多，Lenny的背影应该从中深化，照片子结果来看，导演讲多点Lenny观众也不会猜出点什么来，但更好看。
217,记忆碎片,3,真的是看到我睡着
218,记忆碎片,3,倒叙让人好混乱 必须要很专心的看电影才行哎 但其实我本身并不爱看这样的电影~
219,记忆碎片,3,"“我们需要记忆确定自己的身份”
最近“病态”电影甚是畅销，广受好评，《禁闭岛》亦是如此。也许是“正常”人的现实过于空虚，只有在病态中寻找活着的意义。格局颇大，但同样的病症更喜欢《未知死亡》的宝莱坞演绎，虽然后者有抄袭之嫌。"
220,记忆碎片,3,不喜欢这种编排手法，看的太累，比看《大话西游》还累，那个还能逗你笑。
221,记忆碎片,3,"很想重头再看一次，但是还是宁愿把时间留给下一部电影。""I have to believe in a world outside my own mind. I have to believe that all my actions still have meaning even if I can’t remember them. I have to believe when my eyes are closed,the world’s still here. """
222,记忆碎片,3,★★★☆ “我要相信世界不是我想象出来的，我要相信我所做的事情仍然有意义，即使我不记得做了什么，我要相信，即使闭上眼睛，世界仍然存在。”
223,记忆碎片,3,天呐，前一个小时能让人睡过去几次哇！完全提不起兴趣。倒带N次却迟迟不肯交代什么，几个人又很嗦，一直不懂主角拿着电话是跟谁打电话？？妻子被人奸杀然后想报仇但是自己记忆又出现问题，这种人留在世上还有何用？真的不如未知死亡这样的来的震撼。烧人脑子啊我看大家猜的都不太一样
224,记忆碎片,3,"有人说过：金鱼的记忆只记得10秒时间内发生的事情。
看这部电影，很容易就误以为我也是条金鱼。
不仅仅是倒叙，应该说整体上用的是倒叙的手法，是一种夹杂着乱序的倒叙手法。我靠~搞得我好乱啊！
最后，这典型是一场玩脱了的闹剧。。。
故事剧情我不喜欢，叙述手法很好，尤其在10年前。
★★★☆"
225,记忆碎片,3,我看的有点儿乱。可以肯定的是那个娜塔莉亚是知道了莱纳被人控制杀死了他男朋友，所以设置了圈套让他去杀死泰迪。娜塔莉亚的男朋友死之前见过莱纳，那么泰迪在装成警察前应该带莱纳去见过吉米。泰迪或许真的是带着莱纳杀死过凶手，也可能都是胡说的，但是杀死泰迪也是莱纳的愿望......
226,记忆碎片,3,????????????????????????????????????????????????????????????????????????????????????????????????????????????????????????????????????????????
227,记忆碎片,3,其实哪有那么玄乎  就是一傻比一直在自以为是  NOLAN的剪辑真的很厉害
228,记忆碎片,3,不管他是怎么个倒叙啦，感觉要是中间看漏了就不知道在干嘛了，结局还真是看到最后才知道，应该说是到了最后才知道起因，才知道原来娜塔莉亚的男友是他自己杀的，才知道为什么娜塔莉亚要设计让他杀泰迪。主角除了有什么顺行性失忆症？应该还是一神经病吧
229,记忆碎片,3,一般吧，看一遍，故事没什么难懂的。就是觉得那时候的导演有点装。如果他不这样拍的话，故事还是俗套。只是喜欢主角最好那的做法，留个目标给自己，虽然自欺欺人。
230,记忆碎片,3,我只能说，这部电影超出了我能力范围，表示这种错综复杂最后结局还扑朔迷离的电影会杀死我本就为数不多的脑细胞....
231,记忆碎片,3,剪辑所带来的可能性果然超乎想象，碎片式的剪辑，倒叙与插叙片段重复，在刚开始看的时候真是一片茫然，越往后看就越回想前面的剧情，高智商电影果然看起来够累。
232,记忆碎片,3,看到那么多的五星，我以为我才是一脑子浆糊的那个，原来装13的人远比浆糊的人来得多。这是个什么编剧、这又是个什么导演
233,记忆碎片,3,整片看得挺压抑，也太烧脑，不易懂。
234,记忆碎片,3,没错，在我坚持了近1个小时还是没能发现这种倒叙破碎拍摄手法如此故弄玄虚的电影好在哪里，也就再也不愿意花剩下的1个小时时间去完成所谓的高智商电影。看这种片子唯一的收获就是：做一个快乐直白的白痴其实是很幸福的事。
235,记忆碎片,3,哎，会想起好多片子哦，比如穆荷兰大道、蝴蝶效应、致命魔术、低俗小说、搏击俱乐部、初恋50次等等等，导演达人果然是逻辑达人，看了费脑筋啊
236,记忆碎片,3,跟21克一样，走乱剪一气故弄玄虚路线
237,记忆碎片,3,"""I always thought the pleasure of a book was wanting to know what comes next."" No, it is in what happens before."
238,记忆碎片,3,为什么这个电影分会那么高，难道拍出一些让人看不懂的故弄玄虚的片子就要给分高么，难道这些打高分的就都看懂了吗？片子的这种剪辑是很牛B，但是观众在欣赏的过程中是否会有好的感受，我看未必，一切都是倒叙，而且是一段一段的倒叙
239,记忆碎片,3,看多了诺兰的片子，回头来看这一部的时候，就有点不耐烦了…能被人口口相传的好片子不是靠一点剪辑的把戏来实现的。而作为娱乐大众的目的的话，还是盗梦空间更加有观赏性一点儿。ps.这货难道没有点儿穆贺兰道的味道？！
240,记忆碎片,3,是要仔细认真看才会觉得好看的影片，但我完全不受这套啊！！
241,记忆碎片,3,诺兰就喜欢复杂的故事6868但是呢，不够动人和深刻。
242,记忆碎片,3,谜底揭示了虽然能看懂了，但是要理清逻辑太费劲了，导演拍它出来相当不容易。
243,记忆碎片,3,【独独不喜欢这个，连往下想的兴趣都提不起来...】
244,记忆碎片,3,迷失在记忆的碎片里，其实只是自己不愿意相信罢了。PS：看到后面真的没有耐心了・・・・我这种看了后段忘了前段的家伙不适合看这种片子啊・・・
245,记忆碎片,3,剪接师 你绝对是个疯子。。。你大爷的那半秒。。。
246,记忆碎片,3,和禁闭岛的题材跟部分情节有相似之处，可是相比差了很多（但是禁闭岛是后拍的哎）。很多人都特激动的给个满分评分，这都是无法抑制的“我居然看懂了哎我！！”的喜悦。我肯定不会再看第二遍，不值得再看一次总之。
247,记忆碎片,3,说到底就是一个很常规的thriller用非主流手法剪辑了一遍，然后就被众人吹为神作。。。和侦探小说里的变格派有点像，讲得俗点就是忒没内涵>< 所以说诺兰是有创造力与可看性的导演，但离伟大还差得太远太远。。。
248,记忆碎片,3,在看第二遍时候发现了一个bug，于是就看不下去了，求解释。
249,记忆碎片,3,离开的那天，你推荐我说一定要看，只因为这电影跟拍立得有关。可是让我这种看《盗梦空间》都看不懂的人看，两遍都没懂…你说，啊，那你这智商可不行啊。
250,记忆碎片,3,牛逼是牛逼啊，不过我咋就不那么感冒呢？如果不是出色的结局，我就要给丫两星了。不过诺兰的牛逼潜质已经显露无疑了
251,记忆碎片,3,看来导演很是喜欢拍了撕然后拼起来，再拍再撕拼起来，重复了120分钟有意思么，当观众也都短期失忆呢？
252,记忆碎片,3,并没有禁闭岛好看哟！嘶嘶嘶嘶嘶~因为紧闭岛的“剧情直转急下”转得更加急哦~但是这个片子就是看的过程中需要多一点的记忆力和注意细节~哈哈哈~但是大家一起讨论电影感觉好嗨皮！
253,记忆碎片,3,据说诺兰的脑残粉为了把TDK捧上IMDB第一名，疯狂地给GODFATHER打一星，结果就是让SHAWSHANK REDEMPTION超越教父成为第一名…PS建议豆瓣开始分十分，而不是五星标准
254,记忆碎片,3,可能是之前的希望值太高。我没觉得有那么精彩。
255,记忆碎片,3,进入别人的记忆和保留自己的记忆都不是易事。记忆不是记录，而演绎。
256,记忆碎片,3,一个记忆系统混乱的人被一堆人利用的故事……OTZ
257,记忆碎片,3,"看完过的最费解的片子，从未见过这种叙事顺序...需要吗？
里面有一些揭示人性和人生的东西，但一定要用如此花哨的手法表现吗？
当第一次从电影院走出来的时候，就不信谁会enjoy"
258,记忆碎片,3,反正没让我搞得清清楚楚，再好也只有三星。
259,记忆碎片,3,没别人说的好，倒叙的叙事手法比较出彩，但是看破了之后会发现故事其实很简单的，内涵不足
260,记忆碎片,3,对这种绕来绕去的片子不感冒，尤其是男主又不帅哥。。所以快进了。。看到大家分析得热火朝天不禁感叹自己的蛋定。。也许会好好看一次之后再来修改评分。。借用一位网友的评价：10分钟可以搞定的电影默默迹迹搞了2小时。故弄玄虚，文艺青年必看装13电影。 
261,记忆碎片,3,其实这样拆来拆去拼来拼去是有什么意思？
262,记忆碎片,3,略有点无语。。。。。。又是一个自己想象出的世界，偏偏又被别人玩弄。。。。
263,记忆碎片,3,故事向前走，时间往后退。记忆没有碎片，只有杀戮自欺。
264,记忆碎片,3,"好吧, 我承认我上百度搜了详细剧情解说才真正明白. 看得太晕了...Lenny真悲剧啊!"
265,记忆碎片,3,看不懂啊看不懂。。好像是经常失意的样子
266,记忆碎片,3,困。。。墨迹。。。看在是2000年的上映时间上，三颗星。
267,记忆碎片,3,我讨厌这种其实根本没什么 自己靠点手法然后愚弄人 的电影！还10大最难懂的电影 。。
268,记忆碎片,3,"形式与内容之间失衡的电影要么是能力欠缺,要么是炫耀心理. 这部的结构玩得太过火, 难免有故弄玄虚之感."
269,记忆碎片,3,一般！完全是靠剪辑的电影 其他的地方没任何嚼头！
270,记忆碎片,3,不知道是因为题材而产生这种结构，还是因结构而选这个题材，两者唱和的很像一回事，能自圆其说。这种打碎、拼图、抽丝剥茧的方式让人看得很累，如果说它具有震撼的效果，那也是来自它的结构性，而不是电影本身所具有的情感。感觉诺兰的电影都是以一个巧妙的设定来取胜，真正触及心灵的东西太弱了。
271,记忆碎片,3,看不懂，即使看了百科里的解释，从影片最后倒叙过来解释。
272,记忆碎片,3,算是让我头疼无比的电影之一了，翻来覆去，顺序倒叙NND看了三遍才稍微淡定下来……第一边看下来简直想撞墙……
273,记忆碎片,3,彻底晕菜！和《盗梦空间》相比，可见诺兰同学10年来进步不小，起码他现在学会了怎么用一个流畅而富有吸引力的故事来表达自己的思想，而不是把电影剪得比我们的记忆还一塌糊涂。
274,记忆碎片,3,传说中比盗梦空间更考验逻辑的片子，但看过以后没觉得多好，感觉跟《恐怖游轮》有点像，第一个让你感觉循环，第二复杂在他把正常的叙述顺序拆开打乱了放，仅此两手很多人就晕了，至于到底主角是不是亲手害死他老婆或者到底有没有第二个凶手，我觉得根本没有标准答案，这片子就是给你搞脑子的，想了入套
