,movie,star,comment
131,熔炉,5,从头哭到尾，这是唯二看的韩国的影视了，小女孩躲在厕所，校长在找的时候，校长突然从上面伸出头，真的好可怕，被吓着了。
132,熔炉,5,2016-9-17 我们努力奋斗，不是为了改变世界，而是为了不让世界改变我们。
133,熔炉,5,"我们一路奋战  不是为了改变世界 是为了不被这世界改变   
这算是最成功的口出狂言？
只是此刻的我看了社会热搜，做出的下意识反应电影。所以你们的电影能改变国家，而我们的热搜只能换来几天热闹"
134,熔炉,5,为什么原本应受法律与正义保护的无辜孩子要遭到这个世界不公的对待，为什么有钱有权者可以如此肆意妄为地蹂躏他人的童年后逍遥法外，为什么有气血有责任感的年轻人们的奋力呐喊没有人能听得到…但世界有时候就是这样残酷的。奋起反抗不是为了改变这个世界，而是为了不让这个世界改变我们。
135,熔炉,5,我一直在想，倘若事件发生在中国，结局是不是就会朝着光明面发展。最后连我自己都觉得这种想法原来很傻逼。因为在哪里我们都并不具备说真话的资格。电影还是有艺术加工，从杜撰而来的城市开始就暗含了浓雾一样的现状。表演有力，安排太假。不过维系了电影初衷要制造的效果。“是为了不让世界改变我们”
136,熔炉,4,好人vs恶人 (PS感觉评分有些过头，8.1还差不多）
137,熔炉,5,比《釜山行》更可怕的是人间炼狱。浓得化不开的难受。人间还有什么，值得去歌颂？125分钟的《熔炉》如同严寒冷酷的地窖，只有2分钟的夕阳落日下的海滩，沉缓、安宁、静谧、温柔。孩童的笑脸，以及迷人的孔侑。
138,熔炉,5,最让你心寒的是“这是根据真实的故事改编的”这几个字.........................
139,熔炉,5,中国真正热映中
140,熔炉,5,“我们一路前行，不是为了改变世界，而是不让世界改变我们。”
141,熔炉,4,很感人的一部剧    小孩子们太可怜了
142,熔炉,5,看得压抑又难过
143,熔炉,4,【B+】同样的儿童性侵电影，甩出那个肥皂剧一样的许愿130条街好吗。制作上和导演能力上都强多了，也更有力度和思考。虽然说还是有后半段叙事断层，某些地方用力过猛等缺点，但瑕不掩瑜。最为难得的是此片上映后引发了警方对事件的重新调查，真正的“电影改变现实”
144,熔炉,5,看来韩国人脑子远没我天朝活络啊，你说他们怎么想不到定个“嫖宿幼女罪”呢？
145,熔炉,4,看得惊心动魄，公平和正义从来只存于乌托邦，心存善念理想，力行奋力抗争，人类得以保全一丝光明、尚不至于全军覆灭。
146,熔炉,5,“我们一路奋战不是为了改变世界，而是为了不让世界改变我们” 。韩国没有审查制度，所以出了这么多同类型的好片子，同样是体制臃肿、腐烂的中国绝对拍不出这样的好电影。对现实的无力，就像松子的生而为人，对不起。同美国田园下的罪恶，东西方在同一题材上发挥很迥异。
147,熔炉,5,看了两遍，唉，心理阴影啊，据说现实里这件事的结果并不让人满意，加上昨天红黄蓝的新闻，心痛，满满的无力感
148,熔炉,5,始终不敢看完 校长扒在厕所门上往下看那个画面真的太惊悚了 第一次发现人可以比鬼还可怕 去搜了一下真实事件 发现比电影还要惨 诶突然觉得身边的人都好幸运
149,熔炉,5,全程鸡皮疙瘩都起来了，不管信不信教，败类就是败类！
150,熔炉,5,韩国人比你国人民有血性
151,熔炉,5, 什么是绝望 绝望是明知道他们犯的罪却不能让罪人绳之以法 熔炉一部让人看了压抑 无奈的电影 
152,熔炉,4,太值得中国人一看。我们为什么抗争？不是要改变社会，是不要被这个社会改变。
153,熔炉,5,至少还有这样一部电影来改变了些什么
154,熔炉,4,影片在气氛渲染，情节的推动，情感的调动，故事的结构等方面都做得十分讲究。前后情节铺垫，细节描写都恰到好处。
155,熔炉,4,他们有改变国家的电影，而我们只有改变电影的国家。
156,熔炉,5,我没有勇气写这样的剧本。电影真的可以改变世界，哪怕只是一点点。让我们把每个一点点汇聚起来。
157,熔炉,5,打分已经不足以评价这部电影的意义
158,熔炉,4,前半段很赞，后面法庭戏稍微弱了点；这种电影的价值已经超越了电影本身~
159,熔炉,4,正义不止于法律之内。
160,熔炉,4,“校长开房找你老婆，放过小学生。”原事件是一个惊心动魄并且残酷得多的故事，两个维权人士经历长达数年的诉讼最终分别死于疾病和高压水枪，恶魔依旧逍遥法外。这个事件催生了《熔炉法》，我们对弱势群体的关注和保障做得远远不够。PS校长长得好像莫言。
161,熔炉,5,电影人的良知！
162,熔炉,4,虐心；请剪掉他们的小JJ！请剪掉他们的小JJ！请剪掉他们的小JJ！请剪掉他们的小JJ！请剪掉他们的小JJ！请剪掉他们的小JJ！请剪掉他们的小JJ！请剪掉他们的小JJ！
163,熔炉,4,"世上很多顽固的罪恶，源头只不过是来自稀松平常的""关系""""人脉""、熟人伦理、老于世故、""和为贵""、对潜规则的""隐忍""、难以指责的沉默装睡，和永远理直气壮的那一句 ""我只是为了生存""。"
164,熔炉,5,社运电影注入变革强心剂，虽难完满，终需迎上。
165,熔炉,5,看到想杀人 也想死  当年看完素媛 觉得无论如何是不敢看熔炉了 现在真实发生的事情比这恐怖一百倍 终于发着抖开始看
166,熔炉,4,阿廖沙
167,熔炉,4,我们如此努力不是为了让外界因素改变我们，而是为了改变这个世界
168,熔炉,5,看完后整个人都不好了，一直在反思世界上怎么还会有那么多恶人
169,熔炉,5,只为能把这样的真实事件拍成电影并上映，就值五星。在什邡事件的当下，看这样一部电影真让人唏嘘。人的一生，能有几次机会，站在善恶交接的门口，挣扎着作出不让自己后悔的决定？
170,熔炉,5, 震撼，看着非常的揪心，压抑，殊不知是孔侑在服役期间看到小说原版之后，力求拍电影，把真实事件公之于众，其中涉及了多项发条当时被隐藏着，韩国电影还是敢拍。
171,熔炉,5,真得是很棒的一句话，我们之所以要努力，或许不用怀抱能改变世界的梦想，但是，却必须能维持自己的信念，不要让这扭曲的世界，轻易地改变我们!
172,熔炉,5,这个一定要打五星，当初看完以后再自己上隔间的厕所都会下意识抬头看一下，很可怕。这个社会还有许多这种案例，作为电影能把它改编呈现给大众，虽然是血淋淋的很残酷，但公众有知道真相的权利
173,熔炉,5,一根火柴，怎么也无法驱散迷雾；但火柴悉数亮起，会有越来越多的人看到迷雾。一部压抑至极的电影，满满的无力感，驱使我们从久跪的膝盖上重新站起。为每一个个体奋斗，为的是公理、正义、天赋人权。
174,熔炉,5,雾失楼台，月迷津渡，鸟倦归林，人归何处。东亚国家的民主化转型看来都要经历类似的曲折，韩国比天朝早一步启动，先驱者跌撞得头破血流，终究也有了如今的成就。日拱一卒，功不唐捐，如果我们不曾被世界改变，就已经在改变世界了。
175,熔炉,4,卑鄙是卑鄙者的通行证，高尚是高尚者的墓志铭。
176,熔炉,5,不知道该说什么，他们最后，还是失败了，也许这就是这个世界的残忍
177,熔炉,5,"希望会有的，活下去
因为北电这个事件，真的，产生了对我的国家从未有过的失望，还好，有一直在抗争的人"
178,熔炉,4,真实得有点可怕，孔刘演技很好
179,熔炉,4,人性之恶就像病毒一样，越是封闭的环境越容易滋生和扩散，当体制已经不能保护生而为人的基本权利时，舆论的力量就开始凸显。电影还是给人希望的，相信正义之火可以燎原。（以后我闺女的老师不管是什么原因要是敢动我闺女一指头我都跟他拼了）
180,熔炉,5,每一幕都触目惊心，但在韩国，至少因为这部电影改变了法律，再看看我们？红黄蓝最新的报道，是在搞笑吗？！真是对这个糟糕的国家失望透顶…
181,熔炉,5,难遇的让人禁不住站立鼓掌的影片。
182,熔炉,5,"""他们至少有电影力量在支撑与帮助弱势群体,而我们呢?""其实人性最难的地方便是 ""正义与现实的较量."" 仅仅是弱弱呼唤.请国家至少不要屡屡让国民失望.至少做一次对的事.可好?"
183,熔炉,5,他们斗争的理由，不是为了改变世界，而是为了不让世界改变他们。正是因为有这个“各人自扫门前雪，休管他人瓦上霜”的世界，才导致人人都对悲剧闭目塞听――这大概就是影片起名叫“熔炉”的原因吧。这部电影与其说是讲韩国的某件事，看过之后觉得更像是会在天朝发生的事。总之，这个片子非常虐。
184,熔炉,5,总是感觉是个国家都比中国强……
185,熔炉,5,电影的力量足以改变社会
186,熔炉,5,做了很久的心理准备看的这部剧看完还是很伤心
187,熔炉,4,看完有一种深深的无力，说不出道不明的绝望，看这部电影因为朋友的推荐，所以先了解了其中的背景，了解到真实故事改编。所以看完之后那种竟然真的有如此恐怖的事的感觉，让我有些厌世，也有些感到愧疚。很震撼人心的事件
188,熔炉,5,真实的世界，真实的人性，也有真实的不放弃。
189,熔炉,5,"赞同那句评论：有的电影让你憎恨社会，有的电影让你反思自己。压抑的不是电影里的故事，而是你知道，现实比电影更残酷.
      
 
我只觉得 韩国电影人及其观众很幸福"
190,熔炉,4,其实电影拍的也就韩国的一般水平，但故事和现实的意义却异常深远，我们不是为了改变世界，而不是让世界改变我们。另外孔侑的表演真不错，让我好奇的是片中的小演员们是怎么拍的啊，不会给小演员带来阴影吗？？
191,熔炉,4,支撑着我看完这部充满着罪恶欲望的电影的是仁浩老师一直没有放弃帮助孩子们，我不想想象 万一，万一老师也认输了，孩子们会怎样。。
192,熔炉,5,你听不见看不见，不是因为你聋或者瞎，只是因为你没有心。视而不见充耳不闻。比起聋哑的儿童，更可怕的残疾是装聋作哑。最不可原谅的是那些亲人，如果说陌生人只是出于正义感，亲人的和解书无异于背叛，一定还有别的选择，只是你太轻易出卖。凭什么我的悲剧却求她原谅？
193,熔炉,5,终于看完了
194,熔炉,4,因为【熔炉】的上映，一部关于【性暴力犯罪处罚特别法部分修订法律案】目前已通过韩国国会正式颁布，当时的嫌疑人也已被警方逮捕，【熔炉】让我们看到一部现实题材影片所蕴含的巨大能量。什么时候我们国家也能拍这样的片子。
195,熔炉,4,真事比电影还惨，生活比戏剧解构多了。不要总在后面加个高大上的陈词了吧，什么法制建设进程上的。。。垫脚石。。。谁爱当垫脚石谁当啊，你全家都当垫脚石啊。。。周云蓬说的对啊。。。不要当XX人的孩子。。。啊。。。娃们下辈子投个好胎吧。。。
196,熔炉,4,题材尖锐，风格凝重。可怕可感的故事。
197,熔炉,5,这种事件真的应该被重视，教育很重要。生活中应该多一些像男主角一样的英雄而不是一直做网友
198,熔炉,5,"""我们一路奋战，不是为了改变世界，而是为了不让世界改变我们""。看到北电的事情又过来看了一遍这个电影，男主的微博已经被封，现实拍成了电影，而电影里的情景正在现实中上演。"
199,熔炉,5,年轻的时候多希望能够仗剑走天涯。仗剑是为了能够路见不平拔刀相助，能够有怨抱怨有仇报仇，而不用去求助那些所谓的公平公正和自由。
200,熔炉,3,笨拙的展示触目惊心的腐败和罪恶，毫无想象力的剧情推进，影片时刻在提醒你铁一般的事实，以及最后结局的无奈。这个故事让人没话说，但电影却没什么亮点，不像是故事再创作，更像是普及真相。打动我的是这个故事，这些孩子，而不是这部电影。★★★
201,熔炉,3,总算是有时间静下来看了今年的第一部电影。挺一般的片子，在韩国的影响大主要是因为这是一件令人难以置信的真事吧。题材很尖锐，又抢占了道德制高点，但致命的缺陷在于用煽情代替了反思，将黑幕片拍成了苦情片。韩国宽松的创作环境令人羡慕。
202,熔炉,3,你恨贪官，想当公务员。你讥讽不正之风，办事托关系。你仇富，却梦想一夜暴富。你憎恶小三，却也盼望美女投怀送抱。人生多无奈，自叹世不公。不言水湍急，只盼船顺风。一方人民养一方官僚。
203,熔炉,3,其实很一般的片子，牛逼就牛逼在这句话，“我们一路奋战，不是为了改变这个世界，而是为了不让世界改变我们。”
204,熔炉,3,豆瓣评分8.9。片子本身只抵三颗星，但它巨大的现实意义及震撼力，让每个看过的人都实在很难扣下那两颗星。
205,熔炉,3,生而为人，死不瞑目。
206,熔炉,3,全片最触动到我的部分，是民秀哭着的一段话，“谁原谅他们了，他们并没有向我和弟弟道歉，我都没有原谅他们，谁也不能替我原谅他们。” 没有力量谈何正义，你不去改变世界，世界就会 改变你
207,熔炉,3,能够煽动观众情绪就已完成任务了。
208,熔炉,3,韩片拿手绝活是，情绪总比人先到。
209,熔炉,3,话题性比电影性更强
210,熔炉,3,3.5。1.祝凤鸣：雾好大，像一堵墙。2.戳心一幕：孔侑手捧民秀遗照哭嚎于水枪中。
211,熔炉,3,谁给标的励志tag，这哪里来的励志？故事很震撼，但是大于电影本身。感情色彩太浓重了，十分压抑。关于聋哑儿童的性侵犯的故事。电影调度自然，摄影也不错，表演有点一贯的韩国电影的夸张，但是不影响观众情绪代入。如果按照英文翻译，Silenced有“被动沉默”的意思，应该是故事最到位的名字了。
212,熔炉,3,电影改变法律，明星制如何在威权转型社会完成自我营销，达到舆论名利双赢。
213,熔炉,3,在卸下“尺度”这个伪加分项之后，就不难看出以题材为龙头的大部分韩影显然都被高度神化了。意义大于本身没问题，鞭挞多于反思才可惜。
214,熔炉,3,听李淫河的，抓紧3岁儿童的性教育、普及换妻同性恋就可以防止侵犯儿童了。
215,熔炉,3,呃，这个题材再也不想看了……
216,熔炉,3,怎么会有人拿此片与《杀人回忆》相比较，即便只从形式上也比不了
217,熔炉,3,本来就残酷凌虐的故事情节，因为当事人是聋哑人更显得凄凉无助
218,熔炉,3,《熔炉》最大的意义在于影片立场和社会效应，一部电影真的可以对未成定论的现实发生推动和改变的作用，尽管雾津依然阴霾寒湿，《熔炉》却用无语凝噎的姿态，炙烤着这个世界的良知。
219,熔炉,3,http://tv.sohu.com/20120807/n350080414.shtml
220,熔炉,3,片子拍的充满战斗性，情感太奔放，当然是弱点，不过能起到现实中的作用，也就成了优点了。
221,熔炉,3,8580  监狱  精神病院  学校
222,熔炉,3,不觉得孔侑长得很像谷智鑫吗~本人依然觉得这些类似题材的是被高估的一类电影，不懂哪里戳到豆瓣er的G点了
223,熔炉,3,双胞胎的设定好妙。演员选的不错。不考虑对错，只考虑利弊的成人世界。老师的妈妈冲老师嚷，“你以为别人是不知道你说的话对错才闭口不提的吗？”民秀知道奶奶私了了以后的那段表演真是令人心碎。“漫天的是非，做自己的真理。”“我们一路奋战，不是为了改变世界，而是为了不让世界改变我们。”
224,熔炉,3,这点事被讲的里吧嗦，流水账式的叙事方式硬生生把电影拖那么长，完全削弱了这个真实事件本身应给人带来的震撼力。演员不错，导演能力绝对有限。一直觉得棒子很喜欢拍这类以小见大揭露人性的犯罪题材，通过秀下限来唤醒人类的良知，好高骛远，但也不乏优秀作品，可惜这部真的太一般了。失望。
225,熔炉,3,那个长得像雷政富一样的校长在厕所探出的恶心脑袋真的比灵异片里的恶鬼狰狞恐怖多了……
226,熔炉,3,浪费了一个非常好的题材，拍的太韩剧化。孔侑真可以算作特型演员了，他好像只会演睁着大眼睛忽闪忽闪做什么都慢半拍的无辜正太向大叔。。。。
227,熔炉,3,整体的摄影非常好，故事太沉重演员没啥演技
228,熔炉,3,二逼吧 评分这么高
229,熔炉,3,无亮点
230,熔炉,3,“韩国七岁女孩被性侵”，看到新闻就跑来看掉它。韩国的大叔们啊，孔侑这样的有没？记得以前写毕业论文的时候还查到过本地的儿童福利院丑闻。
231,熔炉,3,故事是好故事 小演员也是好演员 就是导演我不喜欢
232,熔炉,3,同类型片子里这部对我来说节奏太慢了，虽然用了2个小时时长，但我还是觉得导演并没有把这故事讲好。
233,熔炉,3,分这么高！得看看，大爱韩国纪实案件类的剧情片！
234,熔炉,3,这货是催泪片
235,熔炉,3,讨厌这个结局！除了主题、孩子、正义之士之外，电影本身没什么出彩和打动人的地方。
236,熔炉,3,“我们一路奋战，不是为了改变世界，而是为了不让世界改变我们。”
237,熔炉,3,真实事件改编，只想骂句畜牲！
238,熔炉,3,可以拍的更好的~
239,熔炉,3,拨开雾津的大雾，砸出遮挡的车窗，看到道德的沉沦，法律的偏颇，家庭的无奈，小孩的恐惧，这让人愤怒，但是最担忧的恰恰是除了愤怒什么都没有，欣慰的是有美术老师这样的人一直在奋斗。现场暴力，社会伤害，搭上配乐，看起来很煽情，论艺术性其实不如《嘉年华》，但是，前者的社会影响力让人钦佩。
240,熔炉,3,又一部改编自真人真事的关于司法腐败的憋屈韩片，喜欢的台词是“我们一路奋战，不是为了改变世界，而是为了不让世界改变我们”。这部片子真是难为也辛苦那几个孩子。
241,熔炉,3,很无力 送给孩子们一首hot当年很红的孩子呀~希望你们可以都有个幸福的童年~
242,熔炉,3,我们一路奋战，不是为了改变世界，而是为了不让世界改变我们，这过程如此艰难，他死了，他失败了，她还在继续前行。就连月亮也有不为人知的暗面，来自无声世界的呐喊，匆匆路过的你是否愿意驻足聆听。未成人的孩子们也不可避免地卷入社会这个大熔炉，面对纷涌而至的各种伤害，是否已做好准备永不妥协？
243,熔炉,3,速度加快就更好。 最後抗h一幕可以不要 催I煽情路好低n 直接在法庭完Y才乾Q俐落嘛。 事件本身就很有震撼力 被美化了一下子 指演T。 片子上映後案件重@就蛄恕 
244,熔炉,3,跟《即使这样也不是我做的》一样沉闷的片
245,熔炉,3,棒子还是可以的，棒子电影还是可敬的。真正敢于面对现实，敢拍、敢过审、敢上映，咱远远比不上，咱永远歌舞升平形势大好一片祥和，其实骨子里老早烂成shi了，有产阶级最担心并且会积极维护社会稳定，这样才能保证他的有产，咱这的有产阶级很可怕的还有权，所以，忍着吧你
246,熔炉,3,"没有出彩,尤其是有10几年前的#杀人回忆#等珠玉在前.剪辑不够有想法,不防再大胆点"
247,熔炉,3,唉，到坎上就怂了的韩国人。这种事情不能复仇和争取胜利，当事人还有脸活着啊~
248,熔炉,3,此片尽能在韩国允许播出。民主之国强大的自我修复力，令人倾佩！
249,熔炉,3,男主演技又娘又弱没法恭维，还不如女主中性小清新打扮给力。孩子们表演火候正好，尤其想到真实事件中小姑娘在法庭上的智慧果敢就更动容。猥亵情节有些刻意，想用虐心走捷径打造经典结果力所不逮。煽情太多，诗意太浓，两个情绪高潮都没有感动反而觉得喜感。不知道真实事件中的孩子们看到是什么感觉。
250,熔炉,3,仅题材就可以让人给五星的电影。就电影本身而言一般。中和四星。DD我们一直都在被这片土地轮奸。我们都是会说话听得见的聋哑人。
251,熔炉,3,一座迷雾笼罩的城市，雾隐下潜藏着人性的黑暗。
252,熔炉,3,电影的社会价值很高，至于电影本身，就是一本流水账。
253,熔炉,3,把一个如此简单的故事讲得曲折是件不简单的事，摄影配乐都很棒。那段听音乐的戏节奏非常好，歌曲出来她缓缓的举起手来，真是要感动的落泪啊。
254,熔炉,3,人性的丑恶
255,熔炉,3,故事本身比电影要震撼深刻得多，令我瞠目结舌的更多的是这个事件，所以可以说电影没有什么特别精彩的演绎，倒是这种片子能上映的电影文化环境很是让人感慨。
256,熔炉,3,好故事 电影倒乏善可陈
257,熔炉,3,精致干净的影像效果与令人发指的罪恶形成了鲜明的对比，这也是这部电影从电影艺术与技术角度讲唯一让人称道的地方。因为改编自真实事件，让这部电影现实意义远远大于其内在本身。从电影选材角度来说，韩国人让我们这些身处景德镇的影迷泛滥起各种羡慕嫉妒恨，这就是我们与民主体制的最大差距。三星半。
258,熔炉,3,浪费了这么好的题材，主要是导演的问题。太多没有用的伏笔，想装的很有深度反而显得乱七八糟。为了效果加了没必要的剧情，比如被害者的那个小姑娘明明是听力障碍者却非要坚持说那天她听到赵成模的音乐…对孔侑并不失望，但可能是很少演这类的角色所以显得有点仓促。尽管如此可还是算成功吧，起码引起了
259,熔炉,3,审判下来，一帮猥亵儿童犯量刑很轻，这帮畜生的老婆、情人竟然欢呼着胜利，我操你们祖宗十八代！！！你们才都TM是弱智！！！！
260,熔炉,3,http://www.xiaopian.com/html/gndy/dyzz/20120623/38330.html
261,熔炉,3,没有华丽的技巧，也没有过分的煽情，只是平实的叙述但依旧很震撼，看完后心灵的压抑感不次于盲山盲井。
262,熔炉,3,描写了一起性暴力引发的悲剧以及学校的教授和人权运动者力图揭开背后黑幕的故事
263,熔炉,3,事件电影≠导演电影
264,熔炉,3,我干嘛在这种晚上 看了如此虐心的电影 一 一
265,熔炉,3,还行
266,熔炉,3,又是一抗暴片
267,熔炉,3,电影拍得一般。想到日本那部《黑暗中的孩子》，同样也是揭露令人发指的娈童恶行，《熔炉》给人的感觉是，拍摄者似乎还有靠它赚一笔票房的意思。他们的初衷也许只是想把电影拍地更有戏剧张力，但这么黑暗的题材，不该更严肃、纪实些吗？
268,熔炉,3,影片根据真实事件为基础的小说改编，也就是经过了两层加工，但整体剧情并没有可取之处，片子既想展示揭露罪恶的艰难又想以孩子的角度表达对这个社会的绝望，结果两头都做的不怎么样。值得称赞的是 配角们的出色演出“我们一路奋战，不是为了改变世界，而是为了不让世界改变我们。”
269,熔炉,3,mb 好人就是苦
270,熔炉,3,电影技术很一般，导演能力也有限，只是在这样的事件面前，观众的感情到位了，自然会产生强烈的认可。3星给小演员。
271,熔炉,3,"""奋起反抗不是为了改变这个世界，而是为了不让这个世界改变我们。"""
272,熔炉,3,不喜欢看这种虐心的电影!
273,熔炉,3,发现华数竟然上了这一部，于我来说这一直是一部传说中的电影，各种听人说被安利，但是从未看过，看了之后觉得远远没有他们说得精彩。
274,熔炉,3,几个主题间有些顾此失彼，处理得也显得急躁，例如最后的台词“我们的战斗并不是要改变世界，而是不让世界改变我们”。不过这句口号一样的话确实能打动人。
275,熔炉,3,很一般啊！
276,熔炉,3,没看完，这种虐片不是很喜欢
277,熔炉,3,电影本身没什么。讲得这个真相倒是让我觉得世界上每个国家都是一样的。有人说他们有改变国家的电影，我们有改变电影的国家。其实这也只不过是N线城市的低级故事而已，触及不到管的着这事儿的人的利益。谁也没好到哪儿去。移民没有用，成为呼风唤雨的人才有用
278,熔炉,3,真实事件确实叫人难过愤怒也有感动 但我怎么都觉得电影本身实在是很平庸
279,熔炉,3,为勇气加一星
