,movie,star,comment
468,熔炉,2,结尾那句话的确不错，虽然我们不能改变世界，但也不能让世界改变我们――但整部电影结构混乱，角色脸谱，人物单板，表演面瘫，不觉得像电影，倒更像是法庭实战纪录片。
469,熔炉,2,人家能上映，能发挥作用。但电影本身不好看。
470,熔炉,1,看得很恶心不舒服，只是觉得看完了一部恐怖片。最近看完 Spolight 我才明白为什么。熔炉不是在严肃地讨论案件，而是在搞噱头、讲“故事”，弄成韩国恐怖片一贯的清新阴郁风，拙劣地让人心里膈应
471,熔炉,2,去你妈的
472,熔炉,2,校长，有本事找我
473,熔炉,2,虽然说棒子电影和电视剧是一个天上一个地下的水平 但是这种人性的邪恶和呼唤根本就没有他们说的那么玄吧 9分也充其量是为了个勇气 作为电影没有什么出彩的地方 不如改拍纪录片 不合胃口 可惜了那么高的期望
474,熔炉,1,这种结局给不了那么高分儿
475,熔炉,2,看不下去
476,熔炉,2,"有这么高的题材Buff,竟还拍的这么拖沓烂俗"
477,熔炉,2,"很多韩片的毛病就是题材先行+情绪先行，极尽煽情之能事。用特写拍性侵时小女孩的表情，用慢镜头拍主角团大雨里挨打，你若是个人，还能不哭么?你哭了，导演的目的就达到了。情绪淹没了理性思考，哭完之后还剩下什么?
全部的人物都是极度脸谱化的，对于惨剧形成的制度社会本质没有丝毫涉及，导演似乎认为出这种事是因为坏人太坏了，所以抓起来就好了。
改变了法律倒是真的，但是这和电影有什么关系呢――或者说，法律能被电影煽动改变到底是不是好事呢?


"
478,熔炉,2,并没有觉出哪里很出色== 既然是讲故事可以讲的更精彩吧。。
479,熔炉,2,校长那两兄弟真的有点可怕，特别是他那个样子。
480,熔炉,2,韩国车都不装警报的吗？
481,熔炉,1,这个既然是个真实的故事那么那些人也就真实存在，嫌犯依然活着他们的变态依然存在任然会有被害人。这个电影毫无意义!!!
482,熔炉,2,除了恋童癖的噱头什么都没有了
483,熔炉,2,电影本身不怎么样，但是韩国的宽松环境太令人羡慕了。
484,熔炉,1,上次没看下去 老看人推荐 下次再看看吧-20150620
485,熔炉,2,本片的社会意义已远大于艺术价值。
486,熔炉,1,9999@Noway
487,熔炉,2,越情绪满溢，越可试着小声讲，几乎听不见的声音，往往最动人。
488,熔炉,2,一眼看到底的电影真的很无聊 白开水一样的展开 人物单调的非黑即白 整部电影还停留在 “你看 他们很坏 我们要伸张正义”的这种水平上 然后9.3 无奈
489,熔炉,2,平铺直叙 枯燥乏味 像是新闻连续报道 连现在的法治综艺节目都赶不上 两星也就能给卖同情和朴实两点上吧
490,熔炉,2,男主角是个面瘫
491,熔炉,2,叙事烂
492,熔炉,2,。。。。 无语！
493,熔炉,2,真是对不住，与其说多么揭露社会人性黑暗和真实改篇，不过只是噱头，身边的数据多到可以自行了解就不必为电影掉眼泪PS霓虹可是在这方面的老专家呢
494,熔炉,1,内容太黑暗 ，怎么还有♂♂呢 
495,熔炉,1,只有愤懑，因为最后正义没有被保护，请问你想传达什么？
496,熔炉,2,题材本身已经足够令人震撼，这时候就应该尽量拍的冷静克制。最后手持遗像顶高压水枪一幕实在多余。导演只想把故事讲好，观众自然会被打动，导演在讲故事时还总是不停强调“这里很感人哦，这里很震撼哦”则只会让人莫名其妙。三星扣技术，二星给题材。另外，不是所有方面一味黑到底就能越显真实的。
497,熔炉,1,韩国片就是想玩艺术，拍的磨磨唧唧，能一口气1说完非要憋成一肚子，所以就出现了片子里娘里娘气的暖男，看了就作呕。相反倒是几个小孩子大飙演技，演绎的无助聋哑人栩栩如生。
498,熔炉,2,1.5
499,熔炉,2,有些过分渲染惨烈悲痛的情绪，把血淋淋的伤疤揭开了看总会有点不舒服
500,熔炉,2,从电影文本的角度来看，《熔炉》是一部各方面都很糟糕的电影。只不过，他赶上了一个更糟糕的时代而已。
501,熔炉,2,评分虚高
502,熔炉,2,2星都给这个题材，其余就算了吧...明明可以拍的更好。现在整部电影节奏拖沓，形容涣散，除了片中小孩的处境牵引着人看下去之外，其余确实乏善可陈
503,熔炉,2,不卖惨没什么好看的
504,熔炉,2,太气愤了 看的过程中真想把里面的人揪出来暴打 但是真的受不了韩国电影拖沓的节奏
505,熔炉,2,情感处理直白，所有铺垫都是为了后半部分的律政剧。国内观众很买韩国的账，大家都喜欢律政剧，这种简单直白的情感操控。豆瓣这剧的评分高的要上天了，真心觉得不值这分数，电视剧水平。个人心情复杂，只能说评分高的观众是又傻又可爱吧。
506,熔炉,1,又是一部被吹出来的神片，打高分的你们到底能不能分清楚，现实故事本身优秀和电影拍摄平庸可以共存？
507,熔炉,1,小国电影
508,熔炉,1,跟狩猎完全相反的电影，不明白为什么都怎么高分。
509,熔炉,1,令人绝望的不是电影，而是生活本身。
510,熔炉,1,看到热评在踩自己国家 让我放弃这部片子
511,熔炉,2,或许故事本身能带来些共鸣和思考。但从拍摄角度 客观的说 人物脸谱化严重 细节不讲究 整个风格太简单直白了 导演能力有限 拿手技能只有点传统韩式煽情。
512,熔炉,2,主旨和演绎有过而不及的感受，越来越多的棒子现实题材走向苦情主义，跟韩流爱情死戏、悲情戏其实是一路的
513,熔炉,1,单从电影的角度讲，节奏感很糟糕，情节展开过早不到一半就已经乏力，还是处在伦理片的小框架里，很不成熟的电影，和辩护人并不在同一个水准上
514,熔炉,2,11.13
515,熔炉,2,死了…
516,熔炉,2,现实远比电影剧本来的惊悚。ps抱歉 电影本身拍的实在是一般。
517,熔炉,1,无聊烂片
518,熔炉,2,很揪心又很恶心 揭露体制背后的漏洞黑暗 
519,熔炉,2,太套路化了。你时时刻刻都清楚导演想表达什么 以及叙事会如何发展。以老套的方式拍我们已经很熟悉的东西 没什么意义
520,熔炉,2,"节奏慢。人物刻画虎头蛇尾。故事情节东窜西跳。
我只知道打五星的爱喝心灵鸡汤喜欢45°尿流成河喜欢在看完好声音挑战赛后一边扣脚一边哭的涕泪四溅高潮迭起。"
521,熔炉,2,比多淀n抗暴片有耐心，且相信^承受得了，又懂得拿捏生命出路的分寸（然，《南h山城》更上一牵，特e是收尾那段尤说男偶热荨？H一介陪伴者，行佑邢蓿o力改世界，只能努力不被改（竟付了高~的W校l展基金），有美是嵫ㄎㄧㄤ妹（是不是大W忙抗h]考上律啊XD），末段入W校取得τ捌FC，孰料己方z察官跟中立方法官皆被收I，W生c狼玉石俱焚，再接到孔⒛弥W生z照，遭力水柱x，_十分^望。收尾的F津市旅[V告，框之鹊闹e言，^T影y幕框之於我^。_觥讣俚摹蛊叫屑艚樱嚎㈤_撞死鹿vs逃xW生被卡撞死。恐怖片手法引入：光演p胞胎超f（特e是所偷Q那幕），G色，水母，@然^^，但o法不承Jζ樟_大奏效。法庭上的辨R歌段落。基督教萘Α
522,熔炉,2,这种几十万人评出的所谓9分“神作”，相当客观地向我们呈现了国人的整体欣赏水平是有多高，换句话说，如果这“新闻联播”能上9分，那像《狩猎》这样的同类型好片该上几分？90分吗？还是900分，9000分？抱歉我也是按豆瓣10分制算的。
523,熔炉,2,是个好记者，但并不是一个好导演。
524,熔炉,2,棒子这样下去不行啊。民族精神呢？别老学好莱坞那一套，没意思。
525,熔炉,1,从辩护人到这部，真的很失望，完全配不上9.1分，不够震撼，不够热血，不够深刻，不够爽，难道韩国电影我是真的欣赏不来？
526,熔炉,1,恶心，去看看聚焦怎么拍的。
527,熔炉,2,《熔炉》不是佳作，但是煽情效果倒是很到位，从豆瓣9.2分的虚高分数就可以看出来，我们国家的国民对棒子国的电影捧爱，于是刷高分，就当自娱自乐吧。几个小孩毫无演技，是这部电影的诟病。
528,熔炉,2,一般
529,熔炉,2,"我们一路奋战，不是为了改变世界，而是为了不让世界改变我们。
这样的题材还要煽情，韩国导演们摆脱不了的定式吗？
极度讨厌韩式的残忍与灰色恐怖！"
530,熔炉,2,除了真实事件改编之外没有震撼力，如果只因为此的话，恐怕没有新闻来得震撼。
531,熔炉,2,只能说，我不感冒
532,熔炉,2,打动我的是这个故事，这些孩子，而不是这部电影。
533,熔炉,2,为了两个小姑娘的颜一人给一颗星。世界就是这样，就在我打这段话的时候世界上有好几个人被强奸，其中不乏小孩，你们有时间为了一部电影感伤这么久，不如做点实在的，去救救你看见的可怜人吧。如果真的有人在你面前被强奸，你猜猜看好了，你有勇气去救她吗？
534,熔炉,2,一开始吓到我 略无聊 
535,熔炉,2,我是跳着把郑有美的镜头看完的
536,熔炉,2,就算讽刺现实的不公，在次元世界也要留下些美好呀。
537,熔炉,1,令人作呕。
538,熔炉,1,棒子的”仨零分
539,熔炉,2,真庆幸中国拍不出这么矫揉造作的电影。
540,熔炉,2,"真事件是值得同情cx助，但在不需要就移情到影o高分吧？
影就影角度碓ur。"
541,熔炉,1,拙劣
542,熔炉,2,虐
543,熔炉,2,720
544,熔炉,1,这样的电影不该存在的，好可怜的孩子们，看了这个电影，心情不好，想骂人
545,熔炉,1,很一般
546,熔炉,2,题材不错，太过煽情了，还是更喜欢辩护人。
547,熔炉,2,作为振聋发聩的社会题材，了不起，能推动法案也是十分可以的；作为电影来说，考量不克制又单一粗暴，苍白无力感更多的是真实事件本身给的，而非电影本身功力.
548,熔炉,2,题材揪心，但作为一部电影太过沉闷压抑，可看性太差，更像是被公众关注的社会新闻事件跟踪报道，豆瓣评分虚高。相较同类型韩国律政电影，与前些天看到《辩护人》相比实在逊色。不推荐看，找篇影评读读故事就好。
549,熔炉,2,片子不错。但真实社会事件改编上映对事件原型家属来说，是二次伤害。
550,熔炉,3,奴隶的枷锁是由其他人打破的，而这些人之所以有能力打破枷锁，是因为他们的枷锁更松更轻――普利莫・莱维【20200414】
551,熔炉,2,没有想象中好看，也许是因为太过于真实了
552,熔炉,2,纯粹沦为了发泄的方式，没有注重电影本身
553,熔炉,1,不知道泪点在哪，总是和素媛放一起说真是白瞎了素媛那么好的片子了。
554,熔炉,2,有点接受不了，天道如此衰亡
555,熔炉,1,真不怎么样
556,熔炉,1,傻逼韩国人拍的傻逼电影！
557,熔炉,2,没原来容易感动了。。。。
558,熔炉,2,剧情很真实，真实的没有电影的那种戏剧化效果
559,熔炉,2,勇于自揭伤疤的民族 不过一切还是服务于煽情了
560,熔炉,2,勇于自揭伤疤的民族 不过一切还是服务于煽情了
561,熔炉,2,没看懂，不想看了
562,熔炉,2,我并不喜欢这种跟纪录片似的反映社会黑暗的，其实中国要是能拍这种黑暗片，审核松一点 能上映，每一部都让你们泪流满面。比如最近的药神
563,熔炉,1,对我个人来说 ，这是劣质煽情片，玩味的是很多人说好看，可能是我对大众的心理还有不了解的地方
564,熔炉,2,只是阐明了真相，电影本身没什么可圈可点之处。
565,熔炉,2,看过一般 Get不到点
566,熔炉,1,以前只看到厕所那一幕，就关了，一辈子不会再看第二遍
567,熔炉,2,生气。故事简单
568,熔炉,1,感觉很平淡一般
569,熔炉,2,电影没什么意思 但事件很令人难过
570,熔炉,2,在网上看到推荐才看的，推荐说是恐怖电影，结果却是人性与犯罪类的片子……
571,熔炉,1,大量的恐怖片桥段和煽情让我没有了一点好感！而且男主演技是真的不太好啊！三星半吧，一星平衡下。
572,熔炉,1,辣鸡，棒子辣鸡。
573,熔炉,1,不喜欢此类题材的电影
574,熔炉,2,无
575,熔炉,2,主题正义吧、对事件本身很痛惜，电影造成的社会影响也很值得赞扬，但电影本身
576,熔炉,1,为了一群逗比 怒打一星
577,熔炉,1,"我们一路奋战，不是为了改变世界，而是不让世界改变我们
开什么玩笑
我们一路奋战，不仅要改变我们，还要改变世界
真是自己已经很完美了吗，tm还不改变，世界很美好了吗
既然不是，还不改变，落得这么个下场，活该"
578,熔炉,2,为了保护未成年儿童，至于拍得这么真实吗，尤其是性侵小女孩的那段，看得很不舒服
579,熔炉,2,老奶奶的选择我觉得是最好的。既然伤害已成事实，给加害者以惩罚OR获得最大程度赔偿，哪一种对受害人最好？？这两颗星给故事本身 只有小男孩出彩了
580,熔炉,2,虚高的评分
581,熔炉,2,社会意义>>>>>>>>>>>>>>>>>>>>>>>>>>>>>影片水准，看到前面我就能猜到后面，情节的推动过于生硬
582,熔炉,2,毫无亮点！！！
583,熔炉,2,韩国有太多这样的把好题材给拍烂的犯罪类片子。这片子评分这么高，全靠反体制争人权的题材
584,熔炉,1,真是给豆瓣傻逼韩粉跪了，这jb片子也能9.1分，真是笑尿，一辈子没看过电影吧
585,熔炉,2,5/10。电影审查制度释放的红利使得韩国电影人有着更广阔的选材空间，《辩护人》便是其中代表。但这部电影从技法层面完全是电影学院学生习作的水准，浪费了这么好的题材。豆瓣居然打出了9.2分，看来文艺青年审美水平也有待提高啊。
586,熔炉,1,很感动989898
587,熔炉,1,如果我说不好看 会被喷吗
588,熔炉,2,期待过高，失望而归，9分太虚高了，同类片中也就及格线，剧情老套，所有的起程转换都在预料之中，一星给制作，一星给良知，
589,熔炉,2,然后就没有然后了？
590,熔炉,2,分数这么高大概真的是因为对把真实事件改编成了一部电影的pc国民权斗争的鼓励？单就电影本身艺术魅力来说真的是没有多少现力 太多地方未免太刻意 ，导演想的表现形式让人有种有口难言的窘迫感
591,熔炉,2,面n此N}材的影，我能f的在很少，F今影是所^文化樊aI的一h，但不一定要反蟊，渭的坊c低俗化，泯绲舻牟HH是影精神本身，而是整民族的精神。我c越碓蕉嗟娜私涣鞯r候，我越碓侥芨杏X到，人的改，就如同影中所v的，人是被世界改的游铩
592,熔炉,2,男主的木讷拖沓让人想扣分
593,熔炉,1,撒狗血式表演
594,熔炉,1,用别人的痛苦换来的赞誉永远一文不值！
595,熔炉,2,故事因为是真实事件改编比较震撼，但也仅此而已。感觉作为电影还是差点什么。
596,熔炉,2,电影不如事件题材本身吸引人，如果硬要与另一个素媛比，可能后者要拍的更好
597,熔炉,2,泡菜电影的神奇之处在于，编剧不用废寝忘食的去构造一个完美的故事，他只需要把真实事件搬上荧幕即可。这应该算是一部纪录片。
598,熔炉,2,好剧本拍出了烂电影啊。好差。不明白豆瓣评分怎么这么高。因为真人真事改编然后还通过了熔炉法吗？导演和演员不深刻，细节的处理不到位，剧情交代不清楚让人莫名其妙情节太拖沓。虽然悲剧会让人深刻，但是这部拍尽了社会的阴暗面却感觉虚伪而浅薄。对小孩的考虑太少。最近看的高分电影都让人失望。
599,熔炉,2,这么高的分拍得也是令人失望 这个国家的人有点跳不出自己的小情小节小格局 立意倒是诚恳感人
