,movie,star,comment
280,熔炉,3,可惜导演的太过戏剧性和煽情减弱了整个故事真实性带来的冲击和反思。加一颗星是因为该片最终让此案从新提审，并促进了法律上的修订。小盆友们和孔侑都演的很好
281,熔炉,3,电影拍的很好，但我真心不想推荐。太虐了！！！！！！
282,熔炉,3,整个电影语言就是叙事中夹杂着明显的刻意！但是这个事实真的太让人毛骨悚然了。ps小盆友演的很到位！
283,熔炉,3,看得好心凉啊。。。据说此片上映才重新翻案调查，那群背后不屈不饶的人才是最可贵的。
284,熔炉,3,卖惨的故事吗？？不喜欢，不如素媛处理的好
285,熔炉,3,叶十元和艾晓明会为此一脱吗？
286,熔炉,3,捉M俯拍的R^，正是罪赫囟酥r，上帝默S著人g的罪重，人幻迷著自我的邪孽，相εc施暴者，作榇蟊的鹾险於罪旱某聊或者v容o疑更加的可怕，我不是要改世界，只是不要世界改我，但是，F就是一坨屎，早晚糊在你的上。
287,熔炉,3,没有评价的那么好，但是话题很不错，很沉重。男主角又面又废柴，我不喜欢。。。比较发人深思。。。脆弱的正义感在物质诱惑下能扛得住吗。。当看到男主角抱着照片喊：“这个孩子叫民秀，是个听不见，也不会说话的孩子”的时候，还是微微流泪了。。。欺负弱势群体，哎，太无耻了
288,熔炉,3,"完美}材2星影,男孩死後的抗h狂煽情最大」P!!小演T倒是都很棒!
片子拍成@雍直把M分的故事Я!!不^是要xxа,至少它促成了案件重跟法律的完善,不得不@影大的效"
289,熔炉,3,勇气的国家越拍社会黑暗面，悲哀的城邦才喧嚣和谐社会
290,熔炉,3,许愿
291,熔炉,3,韩片总存在过煽的嫌疑，片子节奏略拖沓剧情推进太直白倘若不是这样敏感的题材实在算不得一部好片子。。但是，相比之下，试问中国电影人何时才能着眼于现实，拍一些像《熔炉》这样有担当有社会反思性的电影呢？
292,熔炉,3,最大的问题在于叙事角度的不明。从电影来看是上帝视角，但故事来源于真实事件，片尾也指出了还未结束，也就是说，本来是上帝视角的导演却站在受害者一方，丧失了故事的客观性。录像存疑，导演的偏袒之心可见一斑。
293,熔炉,3,无论是叙事上，还是深度上，都较《嘉年华》要差一些，韩国电影惯常的煽情，很少能看到克制和冷静，是最大的毛病，这片绝不是烂片，只能说好题材，不是好电影而已。
294,熔炉,3,完全是站在偏见的自以为正义的角度拍的一个真实的故事，这种类型的事件不适宜拍成电影
295,熔炉,3,单纯从电影拍摄的角度讲，拍得太一般了，过分强调戏剧冲突和煽情。不能纯粹靠一个真实的故事来震慑观众，正因为要对得住受害者，更应该好好拍吧？从这点上来说，拍得不如《素媛》，也不如《美国田园下的罪恶》。同类影片的佼佼者应该是《晨曦》。
296,熔炉,3,"我们一路奋战不是为了改变世界，而是为了不让世界改变我们为师不尊,为官不正,为医不德,为富不仁,为慈不善,这些都应该是另一个五宗罪@世界的^望在於，眼地看著那N多的不公不平每天都在身l生，自己再怎N努力s依fo可奈何；而@世界的希望也在於，明知是蚍蜉撼大洌s是有那N一群人"
297,熔炉,3,现实总是很具有冲击力的，中国这样的事难道会少吗？拍得倒是一般，三星半吧
298,熔炉,3,把善恶过于区分放大，电影就没啥意思了
299,熔炉,3,这真是一个无力的主角 但他不正是我们大多数人吗
300,熔炉,3,震撼来源于真实。感觉棒子片普遍节奏偏慢，另外男主角是面瘫吗整出戏都没什么表情。结局很郁闷，拍得不错但给不了愉悦感的电影。
301,熔炉,3,"内容比电影本身更震撼,或许换个男主会更好."
302,熔炉,3,“我们一路奋战，不是为了改变这个世界，而是为了不让世界改变我们。”社会就是一个大熔炉，人性就在此交融、瓦解，从一种变成另一种。但是保护弱势人群同样的人性，是任何标榜人权的法律制度应该具有的价值追求。
303,熔炉,3,吹过了吧，感觉分高绝对是因为最后十几分钟
304,熔炉,3,剧情本身不复杂，比起剧中令人发指的恶势力和黑暗司法机关，更让人悲哀和震撼的是该剧是由真人真事改编！庆幸7年后因为电影引起的社会回响使得案件重审重判禽兽12年牢狱，悲哀时至今日同类事件在天朝任然层出不穷！就在不久前海南就爆出小学校长带学生开房的丑陋暴行！
305,熔炉,3,每个国家都是有黑暗的哇，不过小孩子们真可怜
306,熔炉,3,太压抑了
307,熔炉,3,作为电影来说并不出色，现实意义大于艺术。
308,熔炉,3,对于这种题材拍出来肯定会有很多人捧，但就电影论电影，品质着实非常一般。
309,熔炉,3,每个人在这个世界上都应该是平等的，但是现实并不如此， 我们一路奋战，不是为了改变世界，而是为了不让世界改变我们…每个人都应该保有一份善良，对自己善良，对别人善良，处于的不是怜悯和同情，而是真正的关爱…
310,熔炉,3,很刻意的片子，但真实世界里，坏人还是没有得到真正的惩罚
311,熔炉,3,题材本身太硬。技法一般。
312,熔炉,3,双胞胎莫言~~
313,熔炉,3,电影确实一般，只是这个真实事件实在太震撼了！！！
314,熔炉,3,还是冗长，过火，不加节制地表现恶势力和黑暗，为恶人、好人、伪善和受害者贴标签式的表演。法庭戏拐点很弱。只有题材是优势。这几年韩国社会题材商业片中除了过度渲染犯罪和官场丑恶外，剧情和叙事还有股挡不住的山寨好莱坞气场... 可能要再历练几年才能学到好莱坞式的风格多样。
315,熔炉,3,我们一起奋力反抗，不是为了改变这个世界，而是为了不让这个世界改变我们。
316,熔炉,3,我们在一起抗争 不是为了真的想要改变什么 而是为了不被这个世界所改变
317,熔炉,3,这种片子就像是带你去森林里见识某濒危物种，一边向你讲解它们有多可贵可怜，一边剥皮撕肉烹饪给你吃。并觉得是对你盛情款待。题材哭天抢地手法道貌岸然，但另一方面又体现了棒子导演训练有素的类型化能力。
318,熔炉,3,号称真实的故事，这就是不完美之处。电影的上帝视角能是客观全面的吗
319,熔炉,3,这类片子以为以恶胜善负的结局就能为片子披上揭露现实的皮囊进而赢得深度，只不过是投机取巧。何况悲情泛滥，拖泥带水不利落。真没法和杀人回忆相比。
320,熔炉,3,我就想知道要不是真实事件改编，你们还给不给这么高分？这年头没人好好讲故事了要多矫情他妈就有多矫情。
321,熔炉,3,RTfh：“他们有改变国家的电影，我们有改变电影的国家。”
322,熔炉,3,无声呐喊的漩涡，总是太沉重
323,熔炉,3,我们一路奋战，其实并不是为了改变世界，而是为了不让世界改变我们。
324,熔炉,3,男主角一副半死不活的样子急死湃
325,熔炉,3,虽然有些细节问题，但是切入角度很好，也有不少闪光的镜头设置。这片应该也折射出不少韩国司法体系的漏洞，一些在西方发达国家绝对不会出现的致命问题。比如：触犯刑法竟然可以庭外调解？没有监护权的家长可以行使法律责任？最扯的是，被告因为贡献重大而在不认罪的情况下减刑？
326,熔炉,3,很严厉的问题 但是电影本身并没有很严厉 结局很不满意 需要的不是温情 应该是惩罚
327,熔炉,3,主旨先行，观影过程过于痛苦。
328,熔炉,3,略显造作。没有办法保护一下小演员么。
329,熔炉,3,m然}材很好，但@老B娘都不如啊看得牙B
330,熔炉,3,5/10
331,熔炉,3,当我在马斯楚安尼死后旋即再看这部电影时，我想费里尼和马赛罗曾经有过共同一刻的发现，并将之拍成了不朽。这里未必有甜蜜的生活。但是有必要让你自己去寻找。
332,熔炉,3,奋起反抗不是为了改变这个世界，而是为了不让这个世界改变我们
333,熔炉,3,原来韩国也有校长~这校长也太雷政富了吧
334,熔炉,3,作为类型化的犯罪韩片，电影实在太一般了，甚至连结尾也早在意料之中。是不够好，因为可以阐述的空间还有很大。出彩的是真实事件而非电影本身。
335,熔炉,3,韩此类型片巅峰，各种黑政府，各种黑法律，比素媛更暗更郁闷，但是同样很用力，用力到刻意。
336,熔炉,3,也就是说现在坏人还在逍遥法外，哎。
337,熔炉,3,电影很韩式，意义比电影本身大得多，做人还是做畜生，钱权面前多得是人选择当畜生，以及恋童癖是世界上最肮脏的东西，没有之一
338,熔炉,3,"我是造就@世界的础
Ps:影本身平平，尤萑说氖穷}材，小孩演的好！"
339,熔炉,3,补标，儿童演员表现突出，戏剧冲突强烈，感染力强，事实证明，电影可以改变国家，所以某些国家，对电影进行严格的控制。
340,熔炉,3,残酷世界的缩影，这个世界还有真善美吗？★★★☆
341,熔炉,3,看完了胸口好闷！
342,熔炉,3,三星半。“我们一路奋战到底，不是为了改变这个世界，而是为了不让这个世界改变我们。”
343,熔炉,3,好}材但是故事好s，情感抒l^多，故事背景内容D著位不足。
344,熔炉,3,高压水枪一场是一个宣泄的出口；韩国电影的创作环境真的太让人羡慕了。
345,熔炉,3,拍的实在一般，也就故事本身撑起来了。
346,熔炉,3,男主跟演段誉的韩国人是兄弟么。。。长的一样一样啊。。
347,熔炉,3,这片儿的高分应该给的是故事本身，导演也只是把故事平实讲完了。。。
348,熔炉,3,一直以为男猪数段无表情的特写是为了后面的爆发，后来发现--他真的只是耍帅的无表情！！！电影贵在真人真事改编，在上层建筑的规则前，起码还可以听到真实的声音。而在天朝，“房间里的大象”太普遍甚至说已成所有人默认的规则了
349,熔炉,3,直到电影最后的字幕出现的时候，我才知道原来这部电影是一种争取大众关注和支持，积极维权的方式。【但，其实整体看下来真的很一般，不知道是什么把这部电影神话了，整个故事焦点很多，最后却什么也没有解决，也模糊了重点，叙事上如同男主一般充满了无奈和矛盾。】
350,熔炉,3,韩国的法律也真弱智，恋童癖都去死吧！无耻的从法庭那里开始，韩国的耶稣的人都发癫了
351,熔炉,3,连看三部残疾人电影  被虐到快残疾了 这部最煽情
352,熔炉,3,“而是为了不让世界改变我们”真是一个粗糙的表述。
353,熔炉,3,题材很残酷 可是真不觉得拍得好
354,熔炉,3,这个世界变态太多，那个变态还TM信仰耶稣。。。。
355,熔炉,3,变态的一直在想，施暴者是不是也因为有过受害的悲惨童年。所以重要的是，事后该怎么处理？也曾犹豫，提供丰厚的物质补偿是不是更利于孩子们今后康复和成长，但，执着地追寻和证明正义、良善的价值就在于，不要让受害者变成施暴者！
356,熔炉,3,不得不让人感叹韩国电影工业真成熟啊。真正具有震撼人心的力量的是这个事件本身，这部电影非常工整又不失煽情地展现了这个案例。
357,熔炉,3,电影太过平铺直诉没有加强反而削弱了故事本身的残酷和拷问人心
358,熔炉,3,"欢迎来到雾津, 白色的浓雾之都, 黑色的罪恶之所. 事件震撼, 演技欠火候."
359,熔炉,3,题材过于沉重，导演手法则稍嫌稚嫩。
360,熔炉,3,这类题材也难免导演渲染情绪过度，但有心拍出来就是最好的，电影本身三星，立意四星，棒子和天朝真有异曲同工之妙。
361,熔炉,3,是睾镁 但是只是酒琶土 K不能人沉醉。n人w是大 挑衅政府的}材也敢拍 K且拍得如此入木三分。@才是影有的立觥＞拖瘛敢患恐惧」的片^台~：想找公平就到妓院 想被人干才到法庭。深雾中到是颤栗的呻吟。我一路奋鸩皇榱烁淖世界 而是榱瞬蝗檬澜绺淖我。
362,熔炉,3,这种题材怎么拍都能引起大众的共鸣 庭审和母亲角色的设置很粗糙
363,熔炉,3,不好的地方：过度煽情（尤其是结局）甚至是矫揉造作。好的地方：一是题材，二是韩国片貌似很少出现庭审部分，而这片把差不多三分之一的重心放在庭审。想哭的可以看一看。希望大家都能去看看那些需要照顾的人
364,熔炉,3,扣一星在于，既然民秀不是这样死去的。那我就不接受这样的剧情处理方式。这种艺术加工起到的是反作用。让故事之前的现实主义冲击力大打折扣。从一审宣判以后剧情急转直下，每一个镜头都是不合时宜的煽情。两星扣给后十几分钟。
365,熔炉,3,特意翻来看，没有许愿好。也许以前看我会给五星。
366,熔炉,3,影片中的整个事件最后以悲观收场，但贴近现实，揭露了很多不可改变的现状，最后又给我们一个乐观的心态，正如那句话一样：我们一路奋斗，不是为了改变世界，而是为了不让世界改变我们，之所以有人去抗争就说明他们还没有被改变
367,熔炉,3,结局让人郁闷
368,熔炉,3,片名太赞了！剧情不够丰满
369,熔炉,3,尹慈爱 吴正直
370,熔炉,3,刚看到的一个段子，其实不止适用于年轻人；如果将来不打算参与政治的话，私认为适用于每一个人：社会制度不好，你的选择只有三个：忍受、改造、离开。第三个最明智。这就是自由。自由只能是这样。太绝望的电影，不仅仅是性侵聋哑儿童这种事件，社会体系腐朽成这样基本也就没救了。还是抱着希望活着吧。
371,熔炉,3,小演员太专业了
372,熔炉,3,。。。。。。。。九分。。。很莫名
373,熔炉,3,我只是给电影打三星
374,熔炉,3,三星半，太平铺直叙了~
375,熔炉,3,影片提醒我们不要忘记社会有阴暗肮脏的一面。拍摄的侧重点没有把握好，以至于心中压抑的激愤之情得不到发泄，还多添了几份对于卑劣事件的恶心。在金钱、强权面前，向来不存在公平与正义。但是抗争，从未停止。
376,熔炉,3,这片背后的价值比它本身要重要的多。
377,熔炉,3,爬厕所那张脸太吓人了你妹
378,熔炉,3,拍得还是差一口气。为什么娈童的都是贵教人士？
379,熔炉,3,故事讲得很一般，讽刺手法太刻意。加1星给这个名字
380,熔炉,3,题材脱胎于《一级恐惧》。表现更黑暗
381,熔炉,3,充斥着负能量与无力感，韩国电影越来越多的走向极端的影像政治。
382,熔炉,3,拍的有点软绵，还是有点棒子偶像剧的多余对白跟情节，关于警察的态度转变，官员的态度转变交代不清
383,熔炉,3,三星半，很真实的故事，但全程太惊悚、压抑了。
384,熔炉,3,韩国把中国的片子拍了
385,熔炉,3,"]有任何後淞α康恼x根本毫o用。@句，用在@e好。

"
386,熔炉,3,我日妈除了题材讨巧还有啥子？电视剧演技节奏莫名奇妙前送后紧悬念制造不流畅画面就他妈惊悚片而已有何创新？？称得上艺术？？看球不惯那些好不容易看懂部片拿到就吼成神作的。更可恨的是那个小女娃娃听音乐到底是咋个回事？？！！日吗搞耍？？！！
387,熔炉,3,孩子太纯真，世界太残酷。
388,熔炉,3,这部根据真实事件改编的影片中，作恶者行径令人震惊，对艺术创作者来说是难得的题材，能够讲述出来已然值得尊重，但处理得还是有些简单。无论好人图画老师还是坏人校长、宿管主任，都相当脸谱化，缺乏行为背后的缘由。只对那三位残障少年留下了较深印象，却并非剧本功劳。
389,熔炉,3,浓雾下的真相，遇难的小鹿凝固的血液。作为一部社会题材商业大片，堆砌了足够多咬牙切齿的丑恶，节奏多有小高潮，但实际有点紊乱和矫作。精神可嘉，民主韩国有戏！
390,熔炉,3,习惯了港式的快意恩仇，对于这种继承了东亚内敛性格与悲剧美学的韩国电影一时间还真是难以接受啊。整体都挺好的，但是没什么亮点。也许这因为韩国电影标杆太高了吧。开头的蒙太奇很不错，几处暗喻过于隐晦。表演上也乏善可陈。透过情节来看的话，凑合。
391,熔炉,3,片子里的坏人太坏，好人太好，实际上这个邪恶肮脏的世界终归还是属于坏人的
392,熔炉,3,这是一个我所不理解的社会。那么多人抱怨生不逢时，说乱世出英雄。还不够乱吗
393,熔炉,3,是一个震撼的事件。如果做成纪录片会不会更好。
394,熔炉,3,作为一部电影，并没有拍得很好。作为理念的传达，还OK。拍成纪录片更好吧。有些父母、祖辈，根本不配有孩子，“息事宁人”是多么恶的心态。
395,熔炉,3,如果编剧再强悍一点再考究一点就好了，题材太沉重了，如果不是孔哥哥，真不会看下去。。
396,熔炉,3,电影的社会意义
397,熔炉,3,受不了好阂值慕Y局，看一半直接跳Y局了。
398,熔炉,3,影片的社会意义已远远超过本身的艺术水准，虽然存在人物脸谱化、电影语言单调等问题，但它直面迷雾拷问人心的勇气已然值得钦佩。几位孩子的表演令人印象深刻。
399,熔炉,3,光州金某涉嫌于2000年至2004年先后对6名7-20岁的聋哑学生长期进行性侵犯。孔泳枝
400,熔炉,1,崩坏的国度 以及不愿醒来的春秋大梦
401,熔炉,2,能把好好一题材拍成这样我也是挺佩服的
402,熔炉,2,就电影来说煽情痕迹过重。但，性侵儿童的人就该去死去死去死！！！
403,熔炉,2,就这还和《嘉年华》比？
404,熔炉,1,艺术水平，差。幼稚而滥情。
405,熔炉,2,有的电影，虽然好，但我不会给高分，也不会再看第二次，甚至不想去点看过，因为我难受。
406,熔炉,2,凡是豆瓣打分超高的都很可疑，这片也果不其然。一个好故事拍成这样，也真够过家家的。
407,熔炉,2,导演一点也不会讲故事 看得难受  这是期望和实际差得最远的一部电影   《素媛》没有一个直接的性侵镜头照样能让人愤怒  让人动容 而 这部电影仅仅是老老实实地讲了一件事  甚至不是事件！
408,熔炉,2,这电影可能只能算是对真实事件加以琼瑶渲染的还原。里面的所有人物都没有真实的个性，不是一味的善良懦弱就是彻底的萎缩邪恶，太没意思了。
409,熔炉,2,正义竟然得不到伸张。。
410,熔炉,1,想五分 但是没敢看完 好可怕
411,熔炉,2,很失望，只能说事件本身在现实中对韩国司法公正有意义，但电影拍摄的水平相当低下，平庸之作，不喜欢。编导的肤浅和无能折损了一个好题材。
412,熔炉,2,一般
413,熔炉,2,故事是有 但我怎么都不觉得这部电影有这么高分
414,熔炉,2,硬要当作电影来看的话够烂的。
415,熔炉,2,意图也太明显了吧这位导演！
416,熔炉,1,嗯 就是讲述了这么一个真实的故事 电影拍不好 还是改写小说吧
417,熔炉,2,被剧透了，所以一点感觉也没有
418,熔炉,2,虽然是真实事件改编，但作为电影，沉闷得让人不想看下去。一星给师父，一半，弃。。
419,熔炉,2,电影层面最多两星。社会层面意义重大。
420,熔炉,2,为什么韩国的优秀电影总是他妈的要涉及到国家的法律和政治，这是故意煽情观众吧。你要是对韩国的政治法律不太满意就他妈的移民到被朝鲜去，这样韩国就统一了。这时候再拍电影。
421,熔炉,2,两星半不能再高了...虽然韩国片看得少之又少 就这几部而言 总觉得拍摄手法以及色调都是一样的 同种题材的人物情感表达也是一样一样的 韩国就是这种烂水准嘛 9.0 呵呵
422,熔炉,2,看了一小半，么看下去，题材不是我的菜~
423,熔炉,2,太失望了，作为电影，实在太单薄了。除了敏感题材和现实批判，一无是处。
424,熔炉,1,抵制棒子
425,熔炉,2,"社会意义大于影片,但还是值得推荐~"
426,熔炉,2,一般般。
427,熔炉,2,仅针对电影来说，并没觉得很吸引我，剧情一般，叙述一般，没什么出彩的，感觉中等偏下。但是所引起的社会效果值得肯定，我喜欢这种引人思考的电影，希望有越来越多这种直击社会问题的电影。
428,熔炉,2,表现的好拙 白瞎了这个题材了
429,熔炉,2,评分虚高了吧？就电影来说导演过度渲染气氛，感觉施暴者太假，心里刻画不到位，就感觉在看法制频道情景在现，故事真实性不毋庸置疑，但就感觉有点做作。
430,熔炉,1,人渣没死，只给一星
431,熔炉,2,很表态，我根本不能看完
432,熔炉,2,他们听不见！他们说不出！太压抑的片子了。
433,熔炉,2,转：题材很尖锐，又抢占了道德制高点，但致命的缺陷在于用煽情代替了反思，将黑幕片拍成了苦情片。写的好。
434,熔炉,2,并不好啊。男女主演简直是面瘫。几个小朋友倒还不错。但是叙事不好，整体比其他名气等身的韩国电影差多了。
435,熔炉,1,好题材被糟蹋了，几个演员死鱼表情真够了
436,熔炉,2,这种爱憎分明的片子会令我很快忘记
437,熔炉,2,花了九十分钟打官司 高潮的太快了
438,熔炉,2,SOSO
439,熔炉,1,实在无法投入，什么的感觉都不对。题材严肃，但我哭不出，也无法认同剧情的设定，把人写的都太淡泊无情了。即便是现实也不至于这样，太做作了这片子.....
440,熔炉,2,看得不舒服得想吐。
441,熔炉,2,如果你也是不那么富有同情的话
442,熔炉,1,不停的用伤害小孩子的方式煽动群众的愤怒从以达到电影的目的，直观的表现手法完全的脱离艺术的本质，电影的目的达到了从而在电影的层面上奠定了他的失败。
443,熔炉,2,分高不高，就看你拍的够不够惨
444,熔炉,1,变态，恐怖，f心，吃不下了
445,熔炉,1,案子这样判，太侮辱观众智商，日韩剧这种一味渲染悲伤凄凉的艺术表达效果不顾叙事逻辑的做法过分了。为正义只给一星。
446,熔炉,2,原来大部分人都认为影片只要意义重大就可以了，那演员导演们不如都去当编剧写些政治类的剧本吧。
447,熔炉,2,好题材，拍得很一般
448,熔炉,2,没什么新意。
449,熔炉,2,一部完成了自己任务的片子。同事说我长得像里面那个小女孩
450,熔炉,2,权利和金钱的熔炉融化所有与它不同的声音和思想，但总有一些人在坚持，怎么也不肯乖乖被融化。
451,熔炉,2,是五星的现实，是4星的电影。但我实在无法认同大量的不必要的性爱镜头，那些只有几岁的小演员，需要经历这一切吗？
452,熔炉,2,小清新还是不要碰现实题材的好……
453,熔炉,2,总是没有办法理解韩国电影的牛逼之处，每每看到清一色好评都打心底怀疑我是不是下错了源确定看的是同一部电影吗？这个也好杀人回忆也好到底好看在哪里啦
454,熔炉,2,不算是电影2.5
455,熔炉,2,不是题材深沉 电影就深沉
456,熔炉,2,特别不喜欢这个题材 硬着头皮看他是高分才看的
457,熔炉,2,没明白为什么豆瓣上白夜行才6.5分这部片子竟然有9.0。有点冯小刚式的“定泪点”。太直白了。
458,熔炉,2,好故事，拍烂了
459,熔炉,2,变态太恶心，不喜欢
460,熔炉,2,这类叙事烂大街人物苍白的道德捆绑片儿得这么高的分儿，总有那么一股酸酸的小人得志感啊…………
461,熔炉,1,最伤心的地方在最后一个孩子的家人因为钱而接受和解。如果是我最后也会这么决绝吧。一命换命
462,熔炉,2,"太沉重,太拖沓,小孔你就别煽情了"
463,熔炉,2,我期待的是教师和律师精彩的庭辩和充满智慧的调查，像永不妥协那样的，而不是大坨大坨的眼泪，韩国人拍戏怎么总是水汽这么重
464,熔炉,2,两星给电影本身
465,熔炉,1,我接受不了结局。。。
466,熔炉,2,未看全 只是太沉重
467,熔炉,2,我气是老师从头到尾优柔寡断，软弱之极，除了有点人性之外，很多事情都没办好，作为男人一点太过软弱，最可气的是非常没脑子，竟然把证据就随随便便给了检察官，成年人做事好歹想一想。而且都知道校长等人兽行了，还跑去送花，不要拿家庭生计拿女儿生病做借口 。一开始就是这个父亲没做好老师也没做好，到最后希望压在他身上的男孩该是有多么绝望才会跟犯人同归于尽。老师在火车驶来时的哭喊更让人非常来气。这个男人不配做男人！！这样的结局的电影，最后也好意思让女主背景音和最后的文字来洗地男主和那些不作为的人！！！看得要气炸了。明明是悲剧，这样的苍白无力结尾非常让人反感，不能最大的表现悲剧性，如何才能让人反思！！！
