,movie,star,comment
0,熔炉,5,媒体越干净，社会越肮脏
1,熔炉,4,人口大国什么时候能拍出这样的片子，这样在嘲笑棒子的时候才有点底气。
2,熔炉,5,想起一级恐惧的片头台词来：想找公平就到妓院，想被人干才到法庭。深雾中到处是颤栗的呻吟。
3,熔炉,5,@世界的^望在於，眼地看著那N多的不公不平每天都在身l生，自己再怎N努力s依fo可奈何；而@世界的希望也在於，明知是蚍蜉撼大洌s是有那N一群人讨地x窳诉@一lDy而捉不可能的路。
4,熔炉,4,我们愤怒的不仅是禽兽的行径，更是禽兽逍遥法外，正义无处伸张，无能为力才是最痛苦和绝望的。一个非常容易感动观众的题材，尤其还是真实事件改编。其实电影还有很多提升空间，包括对犯罪场面的描述太刻意未也太多了。但仍喜欢这样的电影，这才是电影应有的立场。这就是我们和韩影的差距。3星半
5,熔炉,5,。。。套用 被嫌弃的松子的一生 里面的一句话：生而为人，对不起。
6,熔炉,5,我们无法改变世界，但我们可以选择不被世界改变...
7,熔炉,5,当邪恶的力量已经渗透至社会的每个角落尤其是当权者手中，我们还他妈向谁去央求公平和自由
8,熔炉,5,这片子居然没有被棒子国的Z.F有关部门给封了啊？？？
9,熔炉,5,大概只有套用《让子弹飞》里的一句经典台词才能略为表达我看完本片时的心情――震撼！震撼！！还是TMD震撼！！！我可以理解部分人站在纯粹艺术的角度对这部电影技法上的乏善可陈评头论足，但是我无法相信有人面对它由始至终散发出的那股震撼人心的力量时居然能做到完全无动于衷。
10,熔炉,5,不说别的，光电影那股正义的力量，就足以让人沸腾。
11,熔炉,4,《内咸》--鲁迅
12,熔炉,5,令人绝望的不是电影，而是生活本身。
13,熔炉,4,“奋起反抗不是为了改变这个世界，而是为了不让这个世界改变我们。”电影以真实故事改编，又一部极其精彩反映社会阴暗的题材。每个人物都刻画的立体丰满，情感同样控制得当，无力感充斥全身。电影完结，愤怒、无奈、唏嘘、悲伤各种情感如同“雾津”的浓雾一般，久久未能飘散，始终萦绕心头。★★★★
14,熔炉,5,一个文科生，每天背着政治生活，背四项基本原则我国的国体公民的权利。亲眼看着热搜被撤下，视频被删除，三种颜色消失不见。豫章书院还存在，赵V再也没有人提及，国乒事件最后化为一题选择题。熔炉的故事真实发生在我所在的国度。“我们一路奋战，不是为了改变世界，而是为了不让世界改变我们。”
15,熔炉,5,熔炉二字意思直到影片最后真正理解相信大多更是层层叠叠的无力感，这世界少部分人保留着人性多数猪狗不如，你不善可以但不要作恶。羡慕他们的制作环境至少能拍能过审，而中国的影片皆大欢喜的结局男女主角百分百的鸡巴爱情套路数的精良制作连说真话的机会都没有，我们怎么还有脸指责韩国，真羞耻。
16,熔炉,4,我在想演戏的小孩子会不会有心理阴影
17,熔炉,4,好感人啊''''看得我都想杀了那些坏人''''
18,熔炉,5,不能用电影的标准来评判它，因为这事件本身已经震撼得出一身冷汗，能拍出来就是已经了不起的事。
19,熔炉,5,孔侑在里面对自己的母亲说：我在她被性暴行的时候来不及去阻止，现在这些孩子需要我的时候，我怎么能袖手旁观呢？如果这样都做不到，我又怎么能当一名合格称职的父亲~    
20,熔炉,4,意料之外是看到最后才发现这是一部战斗中的电影，而不是想象中闭合的圆满故事。这个世界的确有太多事情值得我们去奋斗，虽然“大多数人在电影院哭成泪人，却对电影院门口的乞丐视而不见”。
21,熔炉,5,韩国电影总是有本事让我能痛痛快快哭一下。影片最后的信里，问孩子们这件事发生后对他们而言最大的变化是什么？孩子们说，知道了自己也是有人关心的。我一下子就泪崩了。
22,熔炉,5,我有一个长长的望远镜，一直能伸到你的家里，你说什么做什么我都能看得到。
23,熔炉,5,故事本身就能给到五星。那股站出来的正义让人沸腾，而无声的背影和哀嚎撕碎人心。特权阶级的民主践踏过良知，瓦解成兰花盆里的碎石，倾倒在地。战斗过的勇士会知道，还没赢不是绝望，只是，还没赢。
24,熔炉,5,教师性侵聋哑儿童题材，真实故事改编。这片子让我对韩国多了一分尊敬，对基督教更无好感，更加相信死刑不能废除。再也不能直视莫言。。。。
25,熔炉,4,言语苍白，人间地狱。这样的题材恐怕只有放进韩国电影的容器才会这么锐利和直戳心脏，一些艺术上的缺陷反而不重要了。鲁迅的“救救孩子！”言犹在耳，这样的世界真让人想投身熔炉，付之一炬。
26,熔炉,5,强权对弱势的强暴，放诸四海都存在着。我们不能痴人说梦强势群体都有良心、都讲道德，只能寄希望于自己强大起来，足以维持个人最基本的权益。女性，特别是小女孩被性侵犯这种事儿，会对她们的身心造成多大的伤害！记住，即使禽兽们害的我们生不如死，我们也要努力好好活着，别为贱人浪费自己。
27,熔炉,4,我觉得近期的嫖宿幼女事件也可以拍一部片子。
28,熔炉,4,韩国未成年人保护法之弱令人震惊。情节的几处穿插匠心独运，对雾津的几次俯瞰/大图像描绘意味深长。高潮撼人心肺。
29,熔炉,5,真的哭惨了。可是真的觉得，别的国家，愿意因为一部电影就做出改变，是件值得尊重的事。
30,熔炉,5,从未有一部电影看得那么愤怒而绝望，面对人性中的恶，有时候真的觉得自己太弱小，无法帮助那些苦难中的人。英雄二字，好写难做。
31,熔炉,5,法律再严苛又如何？无法启动，没有力量。
32,熔炉,5,又一部没有大场面的五星级韩国大片，值得鼓掌叫好。 电影里说“我们一路奋战不是为了改变世界，而是为了不让世界改变我们”，网友说“他们有改变国家的电影，我们有改变电影的国家。 ”
33,熔炉,5,如果不是因为红黄蓝，也许我都不愿意回忆起自己曾看过这部电影。这是唯一一部看完希望自己能够忘记的电影，因为太痛苦。
34,熔炉,5,最最让人绝望的，不是厮杀、不是性侵、不是凌弱时的若无其事、不是不平等的话语权、不是被害者的伤痕、不是面对不公的无助、也不是喊不出声哭不出来。而是这所有的一切都会化为平常，并慢慢的被世人遗忘，像是从未发生其一样，作恶者终会忘记受害者的脸，而受害者却不得不将其铭记一生。
35,熔炉,4,那位说“什么时候我们才能拍出这样的电影”的朋友，我想说：我们拍出来了――《嘉年华》，而且拍得不比《熔炉》差。
36,熔炉,5,真的哭到不能行，从判决宣告开始哭到片尾曲。我们的编剧敢不敢写这样的本子？我们的投资人敢不敢投这么一部片子？我们的导演敢不敢拍这么一部片子？我们的总局敢不敢让这样一部片子上映？没有司法公正，弱势群体如何对抗他们受到的侵害？我们战斗，不是为了改变世界，而是为了不被这个污秽的世界改变。
37,熔炉,5,我们这样奋斗着，不是为了改变世界，而是不让世界改变我们。
38,熔炉,5,改变国家的电影，毁灭电影的国家，我们一路前行，能否真的用脚投票？
39,熔炉,5,好片！我们不是要改变这个世界，而是不被这个世界改变。影片从场景设置、纵深取景、配乐，再到人物表演，全部到位。题旨，更是利用大量的低调光，剖析开这个社会的“脏”。人脉似雾，是一种无形的枷锁。现代社会之文明人，建构其中，必受困顿。心明之人，何以逆流？以何栖身？
40,熔炉,5,看完后心情变得沉重，最终正义没能战胜邪恶。在现实生活中，又有多少熔炉不为人所知呢？
41,熔炉,5,曾经以为熔炉很远 可它却很近
42,熔炉,5,这一年来，我已经不害怕看恐怖片。却害怕看如此般的【真人真事改编】。我不怕鬼，我怕【真人真事】。
43,熔炉,4,弱势群体所遭受或正在遭受的远远比影视更残忍。哎
44,熔炉,4,现实如水母，看似美好无害实质总是致命伤人。有真实事件在前这部电影从根本上就不会差到哪去，但还是能拍得更好。小演员表现都不错
45,熔炉,5,三色幼儿园事件之后看的，这样的事情发生了，政府如何处理，舆论如何走向，相比之下，我很失望。
46,熔炉,5,刚刚我简直想钻进屏幕里暴打那些禽兽不如的家伙们！！！心情好压抑！！！愿世上每个人都能被温柔对待(176107610617) 
47,熔炉,4,看完一遍真的不忍心在看第二遍，心在颤啊。某些人的心真的比鬼还可怕。
48,熔炉,5,今天的红黄蓝猥亵事件 我想影迷们都会想起这部电影的伟大 有些电影可能不够精彩 不够有趣 但它们承载的意义超过了电影本身 电影的功能从来就不只是娱乐 有时它们也能改变人们的生活～ 不过天朝子民就算了… 
49,熔炉,4,这个社会就是一个熔炉，熔的不仅仅是身体还有心。哎。
50,熔炉,5,真实事件改编。残酷而真实，面对物质和现实，抉择真的很难。震撼。
51,熔炉,5,之前就看过，三se事件后又来重温了，韩国这种片子真的是拍的很好，看过以后心情特别压抑，我们努力奋斗不是为了改变世界，而是为了我们不被世界改变。虽然，现实也许远比电影更令人绝望。
52,熔炉,5,在2017年感恩节的今天，伴随着红黄蓝幼儿园虐童事件，我屏住呼吸地看了这个电影，当孩子们用手势说着案件的全部的时候，说实话，我还不能够完全相信这般禽兽的存在。更为了无法控制事态而严重影响了孩子的心智的经历表示沉痛的哀悼
53,熔炉,5,改编自真实事件，坏人大获全胜，大部分加害者如今已经官复原职。影片并没有局限于案件本身，而是将其延伸到了更残酷的法庭大战，受害者的妥协与无知，造成了加害者最终逃脱制裁，现实中一个坏人事后还说“这说明正义必胜”。该事件同时也反映善与恶都是没有国界的，很多人可以从片中看到我国的社会负面
54,熔炉,5,我们之所以战斗，不是为了改变世界，而是为了不让世界改变我们。电影最后孩子们还是没有得到想要的结果，真是揪心，真是一个不公平的世界
55,熔炉,5,目前的亚洲只有韩国人敢拍这么多【社会问题电影】（黑色电影），韩国电影人用自己的行动切实做到了【勇敢做个韩国人】
56,熔炉,5,"这帮狗操的畜牲，吃屎长大的变态，喜欢猥亵未成年人是因为JJ小的无法定位吧？我要是那老师法庭上解决不了我就抄个油桶上去炸了他们的狗窝同归于尽。PS：这片在韩国公映，如果在天朝剧本都过不了审吧，有什么资格整天嘲笑他们？
"
57,熔炉,4,我们一路奋战，不是为了改变世界，而是不让世界改变我们。。。
58,熔炉,4,相似题材中还有阪本顺治的《黑暗中的孩子们》可以一较高下，电影表现力和揭露社会黑暗面《熔炉》更好，道德批判和自我审批上《黑》更胜一筹，不知道为什么一直没人注意到《黑》。不过细想《熔炉》这个名字还真是绝了，不正点出在熔炉般的世界如何不让改变的主题吗。
59,熔炉,4,"一年前一次夜聊，朋友之一个讲有个20几岁的大姑娘，总觉喉咙疼胀有异物感想呕吐，且性情乖戾，可看了好多耳鼻喉科专家，都查不出有什么毛病，走投无路找到心理医生，催眠后她讲出一个惊人的信息，在她年幼的5,6岁时，曾经被一中年男人强迫口交，当时其母知道后不但没有做任何心理干预，反而让她不要瞎"
60,熔炉,5,震撼，残忍，真实，人性。当我们无病乱呻吟的时候有多少无辜的人们在黑暗中苦苦挣扎01
61,熔炉,5,在和性侵害}上，中也非常乐兀但是更加的沉默。
62,熔炉,5,发人深省，反应了韩国社会的黑暗面，希望我国也能多些这样的片子。
63,熔炉,4,终于在一个雪夜把这部电影看完了，让我真正觉得震撼的不是故事本身，而是一部电影竟然真的改写了现实中的结局。身处在一个恨不得让你失聪失语的国家里，我们也许已经消极到忘却批判与反抗，不闻政治，不信法制，世界在下沉，我们在狂欢，所有个体的思考都陷入静寂无声，那才是真正的绝望的来临。
64,熔炉,5,一点点安静下去，连哭声都不剩。
65,熔炉,4,总算知道为什么这片子到处被封了
66,熔炉,5,地狱空荡荡，恶魔在人间。
67,熔炉,5,因为红黄蓝事件重新看了这部电影，真的太可怕了。
68,熔炉,5,即使再绝望 也不要放弃可以重新开始的可能 即使再无助 也不要放弃揭露真相的机会
69,熔炉,5,有法可依，依法治国
70,熔炉,5,看完了好沈重 怎N人性可以黑暗成@ 完全不敢再看一遍 太虐心了
71,熔炉,5,勿谓言之不预也
72,熔炉,4,原谅是上帝的事，而我们要做的，是送他们去见上帝。
73,熔炉,5,我们这 苦难事件拍成电影是个梦
74,熔炉,5,中国什么时候才能拍出这样的电影呢，今天真的第一次为这个国家感到羞耻
75,熔炉,5,结合最近频频被爆出的虐童新闻，丑恶从来都没有停止在阴暗的角落上演。“我有一个长长的望远镜，一直能伸看到你的家里，你做什么说什么我都能知道”像极了那副在厕所隔间伸出的丑恶嘴脸…令人绝望的不是电影，而是生活本身。
76,熔炉,5,不敢相信这是真是的故事，甚至事实的更加惨烈，黑暗的政府，冷漠的社会，仅有的正义也被压榨。这种导演让我们看到了一个让人绝望的故事。
77,熔炉,5,从林奕含自杀，到最近的北电性侵事件，这个社会让人感到寒冷和绝望。举报人微博十几万转发和评论被封，有很多人是真的怕了。拔出萝卜带出泥，背后的利益关系可想而知，再往上都有可能。世上从来就没有公平公正，我们一路奋战，不是为了改变世界，而是为了不让自己被世界改变。
78,熔炉,5,它用优秀的技术，精湛的表演，秉持着自己面对绝望的态度。
79,熔炉,4,依旧是韩国特色，直击人性的黑暗最深处，小女孩法庭辩论智取的片段很精彩，根据真人事件改变更有穿透力，而台词，“我们所做的不是为了改变世界，而是为了不让世界所改变”有回音不绝之味道。【校长兄弟俩真的是莫言上身，哇哈哈】
80,熔炉,5,看的时候就哭了，心疼那些孩子，心疼里面的人，心里愤愤不平，这个世界确实很残酷，看完心里很压抑，很难受，久久不能平静，但是确实是好片
81,熔炉,5,对于导演是否太骟情要扣分这点不提，佩服将这事写成小说的作者和在案情轻判的情况下还拍成电影的导演。电影看完觉得很绝望，绝望在于我国每年都会发生不少类似的事，但我国却没有一部揭发这些事的小说或电影。只会在网上骂日韩的人，先审视一下自己吧
82,熔炉,4,这就是现实…
83,熔炉,5,只敢看一次的电影！应该支持，但是太虐了，过程结局都承受不来！
84,熔炉,5,1.“我们一路奋战不是为了改变世界，而是为了不让世界改变我们”；2.心被撕成一块一块；3.真相一直都在，只是我们看不见，哭泣声很响，只是我们听不进，很多人都以为我们是正义的捍卫者，可以为了正义付出很多很多，只是在有些时候你容易动摇，而更多的时候，是你无能为力。
85,熔炉,5,曾经以为熔炉很远 可它却很近
86,熔炉,5,这是根据真实事件改编拍摄的，剧情看得我愤怒的哭！特别是最后律师也同流合污，恶人仍然没有得到惩罚的时候真的不能忍受。
87,熔炉,5,不愧是大家口口相传的好片子，真的拍的太好，一个影片可以促进社会的改善法律的完善真是太有价值了。压抑直白得不忍回顾，心疼得要命，那都是些干净弱小而美好的小生命啊！那些衣冠禽兽都该死！男主很不错，釜山行里的表现也很棒。给五星。
88,熔炉,5,看得很压抑，厕所院长往下看那个镜头至今想想都后怕，韩国的社会题材电影一直都拍得很好，希望我们可以多拍一些这种真实题材改编的电影，曝光那些不被人发现的黑暗面。
89,熔炉,5,孔侑真的是一位伟大的演员。
90,熔炉,5,这个世界有光明就有黑暗，正义总能战胜邪恶这种屁话我从来都不信
91,熔炉,5,竟然哭不出来，巨大的恐惧和绝望，一直揪着心，原来，剧中并没有光明的结尾，而且，在很多地方，其实还在发生。韩国有《熔炉》以及因此而出现的《熔炉法》，我们，什么都没有。
92,熔炉,4,听着兔子讲完了整部电影，真的没有勇气去看，但一部电影改变了一个国家的司法，就社会意义来说，也已经值得四星推荐。
93,熔炉,5,“我们一路奋斗，不是为了改变世界，而是为了不让世界改变我们”，电影远比我知道的内容震撼，电影里小孩被打的场景想到10岁那年和小伙伴一起犯错后的景象，我们在黑板上写老师的坏话，老师花了一整节课把我和小伙伴揪了出来，然后小伙伴被老师一脚踢肚子而倒地，我则上课时跪在最后一排三天。
94,熔炉,4,题材很尖锐，看的很戳心，剧情看得也是愤怒的哭！愤怒的骂！特别是最后律师也同流合污，也反应了基本的社会存在问题，恶人为非作歹还没有得到惩罚。
95,熔炉,5,因为过于沉重的题材，一直没有看这部电影，直到昨天才看，在现实中，我们无法改变世界，但我们我们真的希望，可以不被世界改变
96,熔炉,5,更令人揪心的是，这部电影改编自真实事件。
97,熔炉,4,惊天的高分，声名赫赫的片子，艺术改变了法律。故事极佳，遗憾的是浓重的韩剧煽情成分，稀释了冷静和客观，但相对已经做的不错。和佳作《一次别离》比起来差一些。从仁浩听到女厕所凄厉的哭喊的时候，就感觉仿佛一直有绳子勒住脖子，几欲窒息。惟愿我们能不被浑浊的现实侵袭，永葆善良正直。
98,熔炉,5,人家的电影改变了国家，而我们的国家改变了电影。电影四星，被冲击被震撼被刺痛多加一星。
99,熔炉,5,我知道，罪恶还在上演。可是，世界怎么可以这样…………………
100,熔炉,4,洒水车戏真是一声长叹。“我们一路奋战，不是为了改变这个世界，而是为了不让世界改变我们。”
101,熔炉,5,让人绝望的不是他们生活过的那个世界，而是你们仍旧生活在的这个国家。Tschuess
102,熔炉,5,触目惊心的犯罪事实，却总是被想方设法地掩饰，民众已然麻木。人性的光辉，是在于不被这个世界所改变。极具力量的影片，推荐！！！题外话，数年前我在邛崃特殊学校做手语志愿者的时候，孩子们冬天都只能在户外洗澡，经成都商报报道之后得到了改善，不知道这群长大的孩子现在还好吗？
103,熔炉,5,现在看到这部电影被重新刷出热度 还能记得当年看的时候的压抑与愤怒
104,熔炉,5,韩国好片还是挺多的，你们就是不肯承认
105,熔炉,5,无比地尊敬，这样的电影，这样的民族令我羞愧，令我感到深深的耻辱。
106,熔炉,5,如果这样的电影不打5星，怎么对的起那些被欺负的孩子们呢？
107,熔炉,5,"想必中国的每一次上访也有背后的故事,但却永远不可能变成电影上映吧.再一次为南韩电影人致敬."
108,熔炉,5,在发生三色幼儿园事件之后终于有勇气看了。整个过程口干舌燥，说不出一句话，心脏始终紧绷，脑子一片窒息感。
109,熔炉,5,今晚注定要做噩梦。我死了。特别恐惧。在纸上写了不知道多少遍「唐.维托.柯里昂」也不管用。失眠。校长那张脸怎么也赶不走。连孔侑大叔都不管用了，教父救救我，我，我本人，承认我对你的友谊和忠诚。不要再让我看到那张脸。
110,熔炉,5,孔侑的表现力真的是120分了，韩国人能够把这样的事情拍成电影并且上映了，这本身就够了不起的了。
111,熔炉,5,不想再看第二遍了。再综合最近的事。我亲爱的祖国，你说话的自由不给我们就算了，你连八卦的机会都不给我们。
112,熔炉,5,昨天看北电性侵事件，想到了熔炉，正好一直想看。看到一半凌晨了心里很沉重地睡去，竟梦到电影里大一点的孩子在欺负那个小点的孩子。清晨梦回，恨起自己来。可能我的潜意识里面是个懦夫。
113,熔炉,5,小韩民国
114,熔炉,4,很久之前看过熔炉科普，感觉电影最后还是太温情，太美化。最后法庭部分和素媛一样无力，但是总觉得情感渲染还可以更好。最后男主拿着民秀遗照在法院前绝望控诉的时候哭惨了，正义迟迟缺席，邪恶逍遥法外，无法想象现实中的他们有多绝望……
115,熔炉,4,幼童被侵犯的真实故事，太血淋淋不忍看，几年前看阪本顺治的《黑暗中的孩子们》（2008）就有这种感觉，比起后者电影还不够饱满，但是看到一直以来韩国电影的血气和愤怒，还是被这种气节感染。最后一句台词说得好“我们一路奋战，不是为了改变世界，而是为了不让世界改变我们。”
116,熔炉,5,由纠结到心碎，再到热泪盈眶，最后忍不住开始抽泣。日本电影擅长刻画人心的黑暗，韩国电影则擅长直面社会的残酷。聋哑学校的校长老师性侵了学生，却没得到法律的严惩。这是真实发生的故事。电影让人纠结，社会更让人心碎。我们一路奋战，不是为了改变世界，而是为了不被世界改变//20161114台北乐声影城
117,熔炉,5,这是一部真实故事改编，反映社会阴暗的题材。真的难以置信，很震撼，看完心情久久无法平复，愤怒、唏嘘、悲伤始终萦绕心头。
118,熔炉,5,看完好难过 韩国真敢拍 
119,熔炉,5,摄影和剪辑都不错，小演员的表演太真实了，简直有种看纪录片的感觉。缺点是煽情有点过火，这也是韩国不少苦情戏的通病。单论电影，大概是7.5~8分的感觉，但考虑到影片史无前例的社会效应(促使一系列法律修订，原案件重新追究，对残障人士社会保障加强等等)，必须打更高分数。（9.0/10）
120,熔炉,4,这片要拍的是国内的话是不可能过审的。因为侮辱抹黑了人民警察、人民教师、人民医生、人民法院、人民检察院以及人民政府。还有，媒体自说自话进行报道和民众擅自集会抗议那更是违反了社-会-主-义-核-心-价-值-观。
121,熔炉,5,特别愤慨和心酸，不得不说韩国的电影是敢说话的
122,熔炉,4,"单亲或是孤儿的聋哑/智障儿童，受害者的身份不能更极端了，施救者自身处境尴尬，侵害者的形象已经变成影史经典。是一个足够复杂和极端的故事，但是看过现实中的案例会觉得电影情绪上还是没敢再深一层，有些节奏过于拖沓，痛心也不只是儿童站在雨中大哭,「拍出来」的意义远大于艺术意义本身。"
123,熔炉,5,终于鼓起勇气看了。希望有一天，我们也能有这样的电影。
124,熔炉,4,先给了铁一样的前提之后开始叙述一个注定委屈的故事，进而大量煽情，这样显得太苦情了一点，题材很好，但调动观众情绪过剩，留给人思考的东西过少，遗憾。
125,熔炉,5,在天朝，这个结局不会过审。哦不，这种片，根本就不会被拍出来。
126,熔炉,4,4.5。「我们一路奋战，不是为了改变世界，而是为了不让世界改变我们。」民秀的结局太凄惨了。那几个畜生为什么还能苟活于世？！看得很愤怒也很心痛，一如观影《素媛》。更可怕的是这部电影根据真实事件改编的。
127,熔炉,5,无边的压抑与黑暗，人性的丑陋与无声世界的纯真相比较令人感觉到好恶心、
128,熔炉,4,拍的很不错，看的我非常气氛，紧张揪心，有些人真是非常好变态。
129,熔炉,4,虽然很反感用苦肉计加分，但导演还是不失聪明严谨，至少没有对题材的过分利用。但人物处境设置的过分苦情和坏人的极端暴行还是会让人忍不住察觉到投机。双胞胎校长的设置很不错。结尾相当动人：“我们如此这般奋力抗争，最终不是为了改变世界，而是为了不要让世界改变我们。”
130,熔炉,5,连法律都无法保证正义和公平的话，那只有通过非法制裁了。每每看到这样的电影，总感觉这边巨恶心巨无力巨艹蛋。9.2
