,movie,star,comment
383,模仿游戏,3,3*半。没觉得那么好看，穿插着纪录片资料，反倒觉得有些场景和情感有点假。
384,模仿游戏,3,并没有超出预期吧~
385,模仿游戏,3,卷福好像一种动物
386,模仿游戏,3,真是一部奥斯卡机器流水线产品，把一个隐忍又残忍、痛苦的真实故事讲成了浮夸的日间剧。感人时刻莫过于推动矛盾爆发的desplat配乐，腻是腻歪了，依旧催泪。
387,模仿游戏,3,文明的表征之一是对万种异类的包容。图灵的天才、个性与性取向皆为他的异类属性，那个社会却想要在消灭他的性取向与个性的同时利用他的天才。→_→ 那个时代真是野蛮的双标狗。
388,模仿游戏,3,还能更主旋律一点么
389,模仿游戏,3,我怀着很忐忑的心情过来打三星  结果看到大部分友邻还是很理性的我就放心了  整个故事实在是太中规中矩 这些廉价的同情最多让更多人了解到这样一位天才而已  其他毫无意义
390,模仿游戏,3,关于破译Enigma的过程描述太多，对Turing后半生描述太少，让人忘记电影的意图和重点，忘记整部片如此忧郁和压抑的原因，来自于Turing的丰功伟绩和他后期绝望没落的生活的对比。BC演技突破卷福
391,模仿游戏,3,最佳改编剧本？别逗了。。。原来奥斯卡也喜欢狗血剧本啊。一直没觉得BC的演技有多好，顶多算是中规中矩，跟好莱坞那帮影帝完全不在一个档次，腐国牛人也比比皆是，到底怎么圈的粉啊？
392,模仿游戏,3,拍得比较无聊。
393,模仿游戏,3,主旋律要不要重复这么多遍啊 当观众是白痴吗
394,模仿游戏,3,天才人物传记的正常发挥。
395,模仿游戏,3,三星半，中规中矩的传记电影，少年图灵的扮演者很出彩
396,模仿游戏,3,总体来说， 片子的厚重感来源于这是真实的历史， 其实最真实的历史，才是最能打动人心的。图灵的悲剧是人性的悲剧，英雄得不到应有的待遇，伟大的一声充满潦草。电影总感觉欠缺点什么一样，真的是非常好的电影，但是除了卷福飚戏，真的无法触动我的神经了。
397,模仿游戏,3,女主角在里面没有任何的作用。。。
398,模仿游戏,3,智商跟不上，看的我云里雾里的。
399,模仿游戏,3,这是“电影中想象的”图灵而非“现实生活中的”图灵，角色设定和情节冲突都像是架空的预想和英国琼瑶剧。天才图灵的一生浓缩到一个Enigma里难免捉襟见肘，太显廉价。电影本身的情节、摄影、配乐、欧洲演员的设置倒像是刻意讨好奥斯卡奖 #一个gay拍得如此直男真是莫名其妙#
400,模仿游戏,2,一部未来的人显然不会想起，刚出影院的观众也讲不清楚的电影。
401,模仿游戏,2,在一部高度浓缩的传记片里，我只能看到一个浑身贴满标签的孤僻，偏执，交流障碍的同性恋天才，看到他的经历和思想奇迹般的被剧情串联在一起，看到防空洞里的全民填字游戏，以及在战争和解密的夹缝中拼命挤出的一丝性向与性别平等的声音。如果只能以这种电影纪念的话，多年后他大概还会长出一张长脸吧…
402,模仿游戏,2,配乐，演员，摄影和故事核心的掩饰下毫无出彩点的庸作。
403,模仿游戏,1,导演不造怎么继续就开始音乐抒情，剧本超烂，铺垫非常刻意，少年线完全没用好，卷福的演技真的称不上一流，不够投入也就不够迷人。但是，图灵本身的故事还是让人深为一叹的。
404,模仿游戏,2,非凡的人被拍成了无聊的电影。
405,模仿游戏,1,每年颁奖季必备的跪舔申奥片，去年是为奴今年是这部，招招算计好了对准评奖口味，能力欠缺原创力匮乏先放一边，这种功利主义态度着实让人恶心，浑身上下一股子绿茶婊气味儿。有点阅片量号称影迷的人要还能容忍甚至鼓励这种投机电影的存在，那之前那些电影也真是白看了，以后也别再浪费时间接着看了。
406,模仿游戏,2,看看Derek Jarman拍的Wittgenstein吧。这部戏隐秘的三幕结构是，他是天才还是傻瓜？哦他是天才！他跟我们也差不多。观众遂去，乐而忘忧。
407,模仿游戏,2,整部影片全程cliche，洋溢着各种喂给大众的sterotype，而发现破译关键的那段情节则已近乎弱智，科学家传记片什么时候才能拍的不要这么low。
408,模仿游戏,2,又糟蹋一个好题材
409,模仿游戏,2,作为图灵传记也真是刻板、平庸又拙劣，过于简化、模糊乃至扭曲掉了很多史实，不是我的菜
410,模仿游戏,2,这种全片叫嚣着“跪下！给同性恋天才磕头！你这个不孝子！”的政治正确好莱坞大片，除了马修古迪的小坎肩哪儿还有看点。
411,模仿游戏,2,一般，优点是拍的很克制。细节粗糙，都是熟脸又没有神一般的演技和化妆，所以前一个多小时一直在出戏。后面慢慢有了温度和感动，及格的结尾并不能掩盖整部电影的平庸，我的记忆还没有差到看了后半段，忘了前半段的程度。赶了个早场，电影票很便宜。
412,模仿游戏,2,比万物理论好一点，除此我还能说什么呢。
413,模仿游戏,2,乔布斯的最爱。
414,模仿游戏,1,真的 这种烂片 8.6？同性恋连电影得分也要补偿？
415,模仿游戏,2,各种煽情，够不着老衲的尿点，只好为了电脑多打一星。
416,模仿游戏,2,节奏不好
417,模仿游戏,2,是我脑子当掉了么，竟然会是这样一部剧情人物设定都如此平板毫无创意的片子，感觉是50年前拍出此片也不算有新意啊！所有主演脸上都写着我是天才我应该得到更多照顾，可惜老天爷不这样想，每个人不过是平凡众生该为自己行为负责，走过曾经有过才是端正的态度！为我两个小时默哀还得扣掉一星！
418,模仿游戏,2,不喜欢康伯巴奇的表演
419,模仿游戏,2,"好比下棋，已知道κ忠走的每一步，s依然不勇色的G兵卒，然後等待mr刻提前一e完佟
整i蛉狈力，^看起碚媸撬魅o味，更要命的是主}Sr在D，有蠼饷堋⒂型情x，又有`魂伴H的表白……，雅矣趾yY一番後，最K居然搞成包容同性俚男片。"
420,模仿游戏,2,Alan Mathison Turing
421,模仿游戏,2,图灵传奇的一生
422,模仿游戏,2,讨巧的冲奥主旋律
423,模仿游戏,2,矫揉造作，小清新豆瓣er最爱。
424,模仿游戏,2,pale and boring。。。看混沌理论纪录片里面的小段图灵生平都比看这部电影感动几倍。。。多处太假。。。2.5偏向于2
425,模仿游戏,2,看到最后真是哭死我了...向图灵献上最诚挚的敬意！！！此外真的是一个好感人的爱情故事...他看着那台机器，哭着说别从身边带走QAQ（另外从以基为罪到现在大名鼎鼎的腐国= =好可叹啊）但是，以一个具有人文关怀的真实故事拍摄电影，其能感染到观众并不难。如何更近一层？在我看来这部电影似乎没做到。
426,模仿游戏,1,这种胡编乱造的剧本都能拿奥斯卡 可想现在奖项多污糟. 金句几分钟就重复 场面拖沓 群众感兴趣的私生活近乎没有 唯一有的又是乱写. 传记和真人真事改编的影片这样不尊重的只有1分伺候
427,模仿游戏,2,嗯........重点没有抓好，比例没有分配好，是想抓住图灵同性恋身份但又不能太过分？二战中牺牲一小部分成全大局的人性两难抉择？无情商天才真挚换来的友情？最后什么也没写好，个人觉得综合实力不能进top250
428,模仿游戏,2,要BC演天才太勉强了 太勉强了
429,模仿游戏,2,图灵传记搭配了一个较俗套的好莱坞模式。解谜部分、童年部分、同性恋部分，任何一部分都没有惊喜
430,模仿游戏,2,太假了，制造了太多太假的戏剧冲突，艺术加工过了，还分成三个时间段乱七八糟穿插，根据史实改编的电影不是这么故作聪明的玩的。
431,模仿游戏,1,导演对同性恋的偏向，彻底破坏了本该充当主角的图灵机设计及理论，以及其对计算机学界的深刻影响。又一政治正确的主题先行。这和黑命贵，《至暗时刻》等符号化的主题，政治正确没有区别。借电影，宣扬同性恋，把同性恋副主题凌驾于图灵理论之上，主次颠倒了。这不是图灵传，这是gay的宣传片和洗地广告
432,模仿游戏,2,不够震撼
433,模仿游戏,2,上次看Idelmotion的”揭秘―布莱切利公园密码破译中心“就很不喜欢Alan Turing，而这个cast简直全是我讨厌的装逼男和全身瘫女，except James Northcote!
434,模仿游戏,2,强行煽情，史实错误，情节刻意。
435,模仿游戏,2,非常一般，分数高是不是因为有真实历史事件？
436,模仿游戏,2,我觉得英国人在拍一个英国科学家传记系列。下一个会是谁？
437,模仿游戏,2,想说解码还是同性恋？
438,模仿游戏,2,抄袭74届状元的命题作文妄图取得高分不惜歪曲一切，可耻。就这样还拿了最佳编剧，说明好莱坞还真tm爱吃这套。
439,模仿游戏,2,剧情没看头。马脸演的不是Turing，而是所谓的BBC福尔摩斯，而且演得非常刻意，要不是直说他的角色是同性恋还真的一点都看不出来，现在奥斯卡提名也真是随便。Matthew和Charles Dance的演技比男主自然多了。
