,movie,star,comment
227,模仿游戏,3,三星半，故事非常流畅，角色也很鲜明，这方面有点像《国王的演讲》，都属于趣味性十足，节奏非常好，传主比较吸引人的传记电影，但在角色的开掘和故事的内涵上，比《国王的演讲》还弱一些，跟《美丽心灵》之类就差距更大了。看完少了点意犹未尽的感觉。规整圆滑不是错，但始终不够登堂入室。
228,模仿游戏,3,中规中矩，并无惊喜与亮点。多年前我曾看过一本讲Enigma密码机的书，十分详尽，让我对图灵敬佩不已。但电影连Enigma的原理和使用方法都没讲清楚，更不用说破解它的图灵之伟大了。电影把破解密码机拍得如同过家家般。这是对当年大批科学家的不敬。就图灵本身，也未能拍出其伟大。遗憾本尼的演技
229,模仿游戏,3,表演满分不服莫辩。脚本的优点是平铺直叙改成三线同时推进，把 Christopher 这个包袱抖得很准，重要的 scene 写得都没得挑，缺点是三线之间的切换很多处都略不自然，人物关系方面的有些情节过于 cliche，刻意痕迹比较明显
230,模仿游戏,3,片名是有双关性的，既是图灵测试，也是一场生活游戏，图灵没能像他人那样遵守游戏规则（借用96版的台词“该遵守游戏规则的”）。本片和德里克.雅格比的《破译密码》可以相互补充，这部聚焦于布莱切利园密码破译，私生活写的较浅，后续事件也只在结尾以字幕形式交代（前面氰化的伏笔埋得不够深）。
231,模仿游戏,3,改编不是问题，就是太工整了点，各方面都很专业，拍的固然好看，最终破译成功振奋人心。有一刻真被计算机的先驱的光芒感动了，小男生初恋也拍的挺好。天才的傲慢是常见的，因为周围的人都愚不可及。但这并不代表天才情商一定为零，比如真实的图灵。这种文艺界对科技天才的刻板改造可以收一收了。
232,模仿游戏,3,「Sometimes it's the people who no one imagines anything of who do the things that no one can imagine.」三线叙事十分巧妙，配乐煽情十足。不过演员表演、电影演绎只是做到中规中矩，传奇人物的一生本可讲得更多。★★★☆
233,模仿游戏,3,战时不搞笑版《生活大爆炸》？一直不喜欢卷福，演技浮夸表情僵硬。结尾从传记片突然变成同志维权范儿。。。
234,模仿游戏,3,飞机上看的。工整的腐国电影。『机器的思考方式与人类不同，但并不能就此说，机器不思考。』
235,模仿游戏,3,整体老套而平庸，人物也太简单了些，演员不错。
236,模仿游戏,3,三星半；中规中矩；感觉现在Benedict Cumberbatch出演的角色都是这些偏执而孤独的天才，戏路受限，且原地踏步；倒是凯拉・奈特莉有些意外感动，“因为你，这些城市这些人都还存在着”；马修・古迪太帅了！结尾很仓促，浮皮潦草。
237,模仿游戏,3,1.他是如此的孤独，仿佛只有那台冰冷的机器才是维系他活下去的一丝温度；2.他一哭，我才晃过神来，他是艾伦图灵，而不是夏洛克福尔摩斯。
238,模仿游戏,3,三条线索交织在一起，还原图灵“克里斯托弗”情节。没有惊艳处，也谈不上失望，四平八稳的颁奖季电影。
239,模仿游戏,3,三线并行交叉剪辑的想法还是很有野心的，一句主题句通过角色传递串起三段故事，可惜有些段落实在是幼稚敷衍的让人想翻白眼，总体上不管在历史里看个人，还是同志权益问题，以及图灵个人的悲剧都通通毫无力度，导演的掌控作用消失殆尽，配乐，表演，笑料拼起了部奥斯卡大作。唯一的感动也只是为图灵本人
240,模仿游戏,3,原来我们用的电脑的祖师爷“克里斯托弗”是个GAY
241,模仿游戏,3,对图灵感情有多深，对这片子就有多失望……
242,模仿游戏,3,同志拯救世界，腐国迫害天才。
243,模仿游戏,3,没有任何东西能戳中我 平胸的口音可能算一个  如此非凡的人生被拍得那么……平凡
244,模仿游戏,3,就那样吧，对图灵的刻画其实还不够，卷福也没演得多出彩啊。给人的感觉是既想说这是一个孤独的天才又想说这是一个可怜的得不到尊重和爱的同性恋，但其实两方面都没做好，这个人物并没有给我什么共鸣。最让人唏嘘的是图灵最后的归属。一个给人类带来如此贡献的人却不得不被其他人类逼到自杀，太可悲了
245,模仿游戏,3,典型学院片，即使本尼贡献了精湛的演出也救不了这样一部影片。全片下来有佳句无佳章，出彩的结尾就这样被干瘪的前戏毁掉了。
246,模仿游戏,3,图灵很伟大，电影很一般。
247,模仿游戏,3,戏剧冲突在哪里？两年不见，小司机怎么胖成那样了？美（马）颜（脸）缺居然和神颜马修没些什么？编剧你是不是腐国人啊。。
248,模仿游戏,3,Overrated
249,模仿游戏,3,品质不错，出色有余。
250,模仿游戏,3,剧情还是不错的，音乐也棒
251,模仿游戏,3,剧本太流于表面，卷福和KK的表演也很一般，可挖掘的点太多，却只用了最学院派的拍法。略失望。
252,模仿游戏,3,人是神人，表扬也尚可，但是剧本怎么能得奖的实在想不通，很多地方的转折太突兀，手法上也毫无亮点。
253,模仿游戏,3,然而感觉一般般
254,模仿游戏,3,"meh, one star down for Benedict."
255,模仿游戏,3,爆裂鼓手讲了天才的无情冷血，轮到模仿游戏来讲天才的七情六欲。这便是异性恋天才和同性恋天才的区别。还有一部万物理论，将两者中和，造就了最完美的天才配置。
256,模仿游戏,3,尽管一路冷静地看完整部电影，但看到最后出现的字幕还是不免有所触动。不过我认为一个好的电影不应该沉浸在只是把一个好故事说明白了，这个故事里有天才有自闭有同性恋有改变历史，唯独没有情绪。
257,模仿游戏,3,That's the only German you need to know to break ENIGMA
258,模仿游戏,3,优点和缺点都很明显 三条主线 少年时和战后这两条明显被削弱 显得多余又炮灰 但还好影片情节环环相扣 剪辑也是行云流水 配乐渲染到位 马脸对图灵这个怪胎天才诠释恰到好处 最后和KK的对手戏令人感动 Turing和Joan大概是世界上唯一一对能和平共处的gay夫和同妻
259,模仿游戏,3,题材好，电影中等偏上，导演在类型方向上摇摆太多，被人物光环绑架了。
260,模仿游戏,3,英国人手艺活的精细程度令人叹为观止，以疏离又密切的姿态对平权、婚姻甚至身份认同进行巧妙探讨。本尼总演高智商，但图灵俨然非翻版夏洛克。反倒是是有血有肉，令人感同身受的天才。可惜对图灵描摹过于倾向其悲剧性，使本片杜绝更多可能，仅成为赞颂与平反的作品。它有力量，但仅此而已。
261,模仿游戏,3,很遗憾，我没看懂。（其实是没好好看）
262,模仿游戏,3,其实吧，我觉得要想讲图灵的故事不能这么干巴巴地讲，得弄成魔幻电影带有寓言性的那种，煽情什么的都不需要，有那么宏大的关于人类未来的主题可以深入思考呢。另外，请英国影视圈封杀奈特莉，没有一个角色她演完了我能切身感受到角色的性格特征的。
263,模仿游戏,3,没什么惊喜…但是被凯拉奈特利slap Turing前那一段话感动了
264,模仿游戏,3,剧本太不丰满了，可能是看过有关bletchley park的话剧（That is all you need to know），对故事非常熟悉，更没有什么惊喜了。很难想象80年能让图灵机发展成现在的样子，我期待未来80年世界会变成什么样子，我们需要下一个图灵。BC的声音太性感听了会怀孕，喜欢他但更想看他演演正常人
265,模仿游戏,3,"20150722@万裕。中庸的“好”电影，把天才故事做出了流水线感也是蛮诺摹 “Sometimes it’s the people no one imagines anything of who do the things that no one can imagine."" （颜值高到意外的小哥请看的，所以还算愉快233= ="
266,模仿游戏,3,导演就是《猎头游戏》那位，调子定的稳，用料也足，讲二战密码破译就加了些户外大景、历史影像和战场一瞥，诚意比同背景的《至暗时刻》之流可是足。三线交叉推进：幼年线回顾挚爱；二战线揉破解密码的悬疑在传记片里；结局线暮年凄凉为同性恋发声（想想清朝的娈童风气我们在这方面还是领先欧洲的），三条线的调度全无紊乱，图灵至死受着和恋人同名的计算机雏形，台词中多次出现的人工智能构想莫不是对真爱的招魂？这个角度看，倒也有些科幻片的气质了
267,模仿游戏,3,本来是很不愿意让Benedict Cumberbatch演的，夏洛克也是天才，很怕把天才都演成一个样。前半部人物和故事割裂的看的，但图灵实在太惨，铺垫那么久最后还是可以真正沉入这悲伤的。“2013年，女王伊丽莎白二世特赦图灵，以表彰其空前的成就“。”20170101
268,模仿游戏,3,最虐的是初恋还没看到告白就去世了QAQ
269,模仿游戏,3,原以为是谍战片，看到一半发现是传记片，最后才猛地发觉是撑同片……
270,模仿游戏,3,成为一个出人意料的人，要付出多大的代价。减了一星，因为马修・古迪根本在片子里就是个花瓶配啊，因为真的只有我一个人不喜欢大长脸的卷福吗，还有英伦玫瑰的牙齿不好看我怎么才发现。跟杀死汝爱里萌爆了的戴涵涵、美丽心灵里的小女孩都差了好多记忆点。比较震撼的是破译了密码却不能公开的无奈纠结。
271,模仿游戏,3,《模仿游戏》卷福演的不错，可是片子真心一般，作为一部描写天才的电影，应该用一个天才导演来拍，才能拍出内心的冲动与外界格格不入，被压抑的挣扎抗争状态，以及到最后用自己的能力来取得成功的骄傲癫狂，这个导演太平庸了，浪费一个好题材。
272,模仿游戏,3,未达期望，表现平平，颁奖季标配。想不通如此的一个天才传记片，却要大段的刻画和埋伏他的同性故事，再掺一些琼瑶戏般的矛盾片段，不得不说，真的浪费缺爷的脸，神探夏洛克随便挑一集都比它好看。
273,模仿游戏,3,8.6……现在是8.5了……又8.6了……
274,模仿游戏,3,前半段各种福尔摩斯出戏，后面才慢慢进入角色，故事是好故事，但还是缺内涵，只是表面的叙事。
275,模仿游戏,3,马马虎虎了，卷福的戏路有多窄就有多窄。
276,模仿游戏,3,立意好，剧本瞎，牺牲图灵的人格深度去附会一个过于通俗的故事。
277,模仿游戏,3,根本没有看点嘛
278,模仿游戏,3,这是一个爱情故事，是他与初恋的故事。MG一如既往掩盖了所有人.........3.5
279,模仿游戏,3,就是个为迎合奖项存在的类型片，固定模板下的量产片。虽讨巧但绝不讨好。大量篇幅展示天才图灵的非凡智商，显得冗长乏味，让角色可以丰满的性格特点，懵懂的初恋，亦敌亦友的同事之情沦为炮灰，一笔带过。人物描绘的干瘪晦涩。让我只看到他的自命不凡，妥协懦弱和结尾文字数据所呈现出的所谓伟大…
280,模仿游戏,3,不过五十年，判他同性恋罪的国家，却变成了闻名的腐国，多么可笑。
281,模仿游戏,3,影像工整，配乐匠气，标准答案似的作品。
282,模仿游戏,3,65/100，工工整整的人物传记，可以用精彩来形容，但是整体还是略平庸，缺少亮点，不过胜在还算感人，标准奥系作品。
283,模仿游戏,3,毕竟一张脸占了半个电影屏幕的观影体验是很难得的
284,模仿游戏,3,同性、战争、人物样样想要，结果什么也没抓到，导致把图灵这么有戏的人物拍得比国王的演讲还无聊
285,模仿游戏,3,演技都不错，就是故事非常无聊。开头的画外音太故弄玄虚，还以为有多大的悬念。
286,模仿游戏,3,尼玛，这电影要不是有卷福还有图灵这个原型放着，谁看啊？拍的跟屎一样，剧本也烂的要命好么！！！
287,模仿游戏,3,英国帮助同盟国 默默无名的英雄 对歧视同性恋的反思 然而破解密码的过程却过于戏剧化简单化
288,模仿游戏,3,太过工整，显得无趣
289,模仿游戏,3,就这样吧
290,模仿游戏,3,隐匿的历史往往更为真实动人。台词整体偏简单化。
291,模仿游戏,3,作为人物传记片，故事比较流畅，仅此而已，卷福演科学家也算圆了影迷的梦想了。
292,模仿游戏,3,中规中矩冲（奥斯卡）奖片。Joan向Alan提议的同栖生活听着很棒，可惜没成。
293,模仿游戏,3,诚意的匠气，还是挺感人的，不过马修・古迪的嗓音比低音炮好听好吗……一度怀着等楼上扔剩下的一只鞋好去睡觉的心情等着凯拉・奈特莉的出现……然后，画面就都毁了……
294,模仿游戏,3,还是没有跳出这些年来的天才传记片的套路，依然以心灵创伤的主题搞戏剧化煽情，强把当今的多元意识形态灌入历史，这种换了一套外衣的“科学怪人”模式仍然是在迎合文艺人对科学家的想象。
295,模仿游戏,3,太好莱坞，太主旋律，太寡淡，配角比主角精彩。KK戏份偏多，情节设置不理想，容易让人产生错觉。地球人都知道图灵是给好不好，需要这么遮遮掩掩的么？小图灵剑桥求学的桥段倒是很讨人喜欢。
296,模仿游戏,3,本来期待就不大，看了也没失望。拍了一个表面单调脸谱化的图灵，故事也不太接近史实。就这样吧，让更多人知道了他而已。
297,模仿游戏,3,Christopher turn Turing to a Turing's Christopher
298,模仿游戏,3,豆瓣影迷对基佬片情有独钟
299,模仿游戏,3,电影还成，好在图灵的遭遇够戏剧。
300,模仿游戏,3,多的两颗星给BK，乱改原著就算了，故事实在乏善可陈，人物刻画缺乏张力，对白还行，但不够。
301,模仿游戏,3,电影低估观众智商。精确搜索条件居然是图灵机解密的突破点，呃，好吧。
302,模仿游戏,3,宏观上看人类史发展的巨大波动从来都不是由整体、制度、环境推动的，这种荣耀属于绝对的个体，上一个时代波动是牛顿带出力学，这个时代依然处在图灵引导的坡度中，可惜电影格局太小，连伟大者的悲情都是水过地皮，让人失望。
303,模仿游戏,3,来看卷福的，这台词声音真不错
304,模仿游戏,3,字谜游戏爱好者。
305,模仿游戏,3,阵势甚是可怕
306,模仿游戏,3,最后差点哭了
307,模仿游戏,3,没意思
308,模仿游戏,3,图灵机开始工作的瞬间确实有点小激动！我为什么觉得群戏的本还蛮弱的，大家都没什么发挥，除了马强的头发（喂。
309,模仿游戏,3,还真是中规中矩
310,模仿游戏,3,俩人脸型真互补
311,模仿游戏,3,模仿史实图灵爱，中规中矩传记片。煽情配乐英伦腔，长脸基佬太有爱。
312,模仿游戏,3,内容演技，其实都只值得2星，不过加一星给图灵而已
313,模仿游戏,3,个人感觉很淡，图灵这一生很有悲剧英雄色彩，片子把每个点都顾及到了，可整体下来平稳中庸，连惯有的煽情点都太少，只有最后马脸福飙的那一下确实精彩。唐家屯里的小司机这胖的都无边无际了，那屁股……
314,模仿游戏,3,BC演得不错啊。然鹅，这剧，戏感太足了，使劲儿煽，跟艺术人生似的。KK这尼玛什么烂演技，浮夸得不行了。她还是专业海盗女吧好吗，出来一次毁一出剧。
315,模仿游戏,3,"""Sometimes it is the people no one imagines anything of that do the things no one can imagine."""
316,模仿游戏,3,之前看了关于图灵的苹果的事迹就在想这个传记片该如何拍，又是#美丽心灵#式老套的关于天才的脸谱化传记片，各种励志毫无新意，没能挖掘出更深远的意义，也没有那个苹果，去年的“赦免”有什么好提的，为此感恩戴德？感情线也拍得平庸，Matthew Goode简直就是英国黄晓明，过多熟面孔的群戏也很生硬造作
317,模仿游戏,3,没有毒苹果的镜头，可惜。我觉得电影中规中矩，中心思想表达还算清晰，但是没什么令人惊艳的地方。
318,模仿游戏,3,每个用计算机的人都应该记住他，图灵
319,模仿游戏,3,给演员的三星～剧名和情节～唉
320,模仿游戏,3,多的两颗星给BK，乱改原著就算了，故事实在乏善可陈，人物刻画缺乏张力，对白还行，但不够。
321,模仿游戏,3,电影低估观众智商。精确搜索条件居然是图灵机解密的突破点，呃，好吧。
322,模仿游戏,3,宏观上看人类史发展的巨大波动从来都不是由整体、制度、环境推动的，这种荣耀属于绝对的个体，上一个时代波动是牛顿带出力学，这个时代依然处在图灵引导的坡度中，可惜电影格局太小，连伟大者的悲情都是水过地皮，让人失望。
323,模仿游戏,3,来看卷福的，这台词声音真不错
324,模仿游戏,3,字谜游戏爱好者。
325,模仿游戏,3,阵势甚是可怕
326,模仿游戏,3,最后差点哭了
327,模仿游戏,3,没意思
328,模仿游戏,3,图灵机开始工作的瞬间确实有点小激动！我为什么觉得群戏的本还蛮弱的，大家都没什么发挥，除了马强的头发（喂。
329,模仿游戏,3,还真是中规中矩
330,模仿游戏,3,俩人脸型真互补
331,模仿游戏,3,模仿史实图灵爱，中规中矩传记片。煽情配乐英伦腔，长脸基佬太有爱。
332,模仿游戏,3,内容演技，其实都只值得2星，不过加一星给图灵而已
333,模仿游戏,3,个人感觉很淡，图灵这一生很有悲剧英雄色彩，片子把每个点都顾及到了，可整体下来平稳中庸，连惯有的煽情点都太少，只有最后马脸福飙的那一下确实精彩。唐家屯里的小司机这胖的都无边无际了，那屁股……
334,模仿游戏,3,BC演得不错啊。然鹅，这剧，戏感太足了，使劲儿煽，跟艺术人生似的。KK这尼玛什么烂演技，浮夸得不行了。她还是专业海盗女吧好吗，出来一次毁一出剧。
335,模仿游戏,3,"""Sometimes it is the people no one imagines anything of that do the things no one can imagine."""
336,模仿游戏,3,之前看了关于图灵的苹果的事迹就在想这个传记片该如何拍，又是#美丽心灵#式老套的关于天才的脸谱化传记片，各种励志毫无新意，没能挖掘出更深远的意义，也没有那个苹果，去年的“赦免”有什么好提的，为此感恩戴德？感情线也拍得平庸，Matthew Goode简直就是英国黄晓明，过多熟面孔的群戏也很生硬造作
337,模仿游戏,3,没有毒苹果的镜头，可惜。我觉得电影中规中矩，中心思想表达还算清晰，但是没什么令人惊艳的地方。
338,模仿游戏,3,每个用计算机的人都应该记住他，图灵
339,模仿游戏,3,给演员的三星～剧名和情节～唉
340,模仿游戏,3,平庸的出奇，尽管BC无可挑剔。
341,模仿游戏,3,剧情虽与史实有一定偏差，但这么写确实能够带来跌宕起伏振奋人心的效果之余，又对观众的泪点实现精准打击，不会让人反感。我就在想，这部电影最大的意义难道不是，相当于对那些不被理解的天才们说，何必费力去解密庸人之语，反其道而行之吧，让他们拼命去听懂你的。
342,模仿游戏,3,感觉是腐国版的暗算，影片的故事结构感觉很一般，你分不出重场戏有哪些，没有惊心动魄，还没听风者有意思，起承转合非常模糊，影片过半后乏味又拖沓，而且多线性叙事感觉也很累赘，虽然为半自传电影，但真希望是柳云龙来导，所谓的卷福和苦逼脸奈特莉虽有演技，但均是我最讨厌的演员！
343,模仿游戏,3,历史一定比故事 故事一定比剧本更难以情状更羞以启齿更叫后人扼腕愧疚得多
344,模仿游戏,3,没看过图灵传，但总觉得把一个天才讲成情商底下的，是真的吗？
345,模仿游戏,3,确实不够荡气回肠
346,模仿游戏,3,看过大概的人物原型描述后减1星。
347,模仿游戏,3,十八大以后才被平反啊！人生已经足够精彩，却还得添加这么多为冲奥而设置的传统编剧技巧，保障故事安全好看却也就毫无惊喜。
348,模仿游戏,3,不了解这段历史不过感觉刻画天才有点不够力度，又有点故意夸大效果之嫌。目的可能是拍个令人震撼的天才拯救世界的感觉，但就效果来说有点差强人意！
349,模仿游戏,3,英式做派浓郁 太过工整 反而失去灵动
350,模仿游戏,3,卷福突破的很彻底。天才本就有意想不到的能力。
351,模仿游戏,3,太太太陈词滥调的拍法
352,模仿游戏,3,可能是开会开的太累了，反正睡着好几次
353,模仿游戏,3,计算机
354,模仿游戏,3,家国存亡和个人际遇的交织是极好的题材，康伯巴奇和奈特莉的表演也是游刃有余。不能忍受的是轻飘飘甜咪咪的爱情文艺范贯穿全片，完全没有此题材应有的厚重和严肃。品质还不如类似风格的《万物理论》。
355,模仿游戏,3,不喜欢把传记类电影重心放在同性上
356,模仿游戏,3,同性主题算是多余了，把机器当成自己的爱人
357,模仿游戏,3,美丽心灵至少还有主人公和主人公老婆两个丰满的角色 而本片只有图灵 插叙预叙炫技 KK花瓶潜质永远改不掉 全片只有卷福和Alexandre Desplat在状态 啊 后者是本片的配乐师
358,模仿游戏,3,相信看过《心之全蚀》的人，不会有耐心看完这部又闷又慢的同性恋片，导演太柏拉图了，拿“克里斯托弗”这初恋做起小文章，是否略矫情？即使被化学阉割也要保住自己的初恋，真的太扯了，这不符合逻辑和人性吧？传记片拍成这样，让历史如何告诉我们真相呢？
359,模仿游戏,3,3.5「Sometimes it's the people who no one imagines anything of who do the things that no one can imagine.」向人工智能祖师爷致敬~~~
360,模仿游戏,3,没什么太大意思，但卷福错失男主好可惜，后半段看得我揪心，好想抱抱图灵，生错时代的天才。
361,模仿游戏,3,再好再真实的传记片也是电影，只要是电影，就是造梦的机器，主人公不管多窝囊，多潘浚都得有一定能让观众代入的梦幻或英雄气质：主人公到了影片一半时间，还在失败，还在结巴，还在不让观众了解他到底干了些什么，那就是剧本有问题了。
362,模仿游戏,3,致敬！
363,模仿游戏,3,这么值得拍的传记人物怎么不拍得好一点呢？
364,模仿游戏,3,Sometimes it’s the very people who no one imagines anything of who do the things that no one can imagine.
365,模仿游戏,3,Thank you. Alan Turing.
366,模仿游戏,3,太中庸普通了，编的时候就没想出什么彩，既不很深，也不很奇。拍的时候也出不了什么太多东西，包括演技，都在一个很高的水准上，但一点也没意思。
367,模仿游戏,3,比预期差得有点远。战争时期的倒叙和少年回忆的穿插与现在时形成了三个层面的叙事时间线还挺有意思的。可惜故事太工整和主旋律，传记电影之难是没有剧情的悬念怎么把故事讲好。少年时代和结尾很美。其他配角全部浪费啊。
368,模仿游戏,3,前半段真的非常精彩，后面就有点作了。。感觉导演是想阻止大家去当伟人。。
369,模仿游戏,3,不知道为啥评分这么高 情节一般 演技不错 卡斯不错 但是看完就是平铺直叙的感觉啊
370,模仿游戏,3,说真，平庸的传记片啊，平庸的调色，trying too hard的马脸
371,模仿游戏,3,三个时间点的穿插叙事交代了图灵的一生 高潮又是在片尾的字幕。。感觉可以拍的更加震撼些的
372,模仿游戏,3,两个小时的片子看了三次才看完不过大家觉得好就是真的好系列
373,模仿游戏,3,7/10，中规中矩电影。
374,模仿游戏,3,煽到我的是AD的配乐，凯拉奈特利的设置简直太做作了，一方面想为同性恋群体抱不平，另一方面又急于用这样的角色设置向以异性恋为主的主流观众靠拢，一副冲奥标配，无甚高论
375,模仿游戏,3,拍出来的效果一般般
376,模仿游戏,3,感觉评价虚高，本身对传记片也没有多大兴趣。
377,模仿游戏,3,维恩斯坦为业界毒瘤正名。
378,模仿游戏,3,当工作和生活如此激情有意义，婚姻和性生活变的可有可无。所以可以明白女主订婚时候没有问题的原因吧。伟大的人，我想要知道他多一些，而不是只有BC呈现出来的这部分。
379,模仿游戏,3,3.7  不够紧张，不够煽情
380,模仿游戏,3,居然忘记标记看过了，马脸演的图灵，形象太丑，电影没什么新意，演技勉强及格，三星，比美丽心灵差100个万物理论
381,模仿游戏,3,好看吗？不好看；精彩吗？很不精彩！
382,模仿游戏,3,之前就看^了才lF]o到，整w碚f算一般改，片中於D`的同性傩砸虼耸芸嗫橹兀不^∏槌尸F如此也是D`一公道。
