,movie,star,comment
0,模仿游戏,5,他给机器起名“克里斯托弗”，因为这是他初恋的名字；他同意接受化学阉割，因为这样政府才不会把它带走：这大概是今年大银幕上最含蓄和悲伤的一段同性恋情了。全世界的恐同者都该知道，他们用来敲出每个仇恨字眼的电脑在很多年前曾有一个名字――“克里斯托弗”。
1,模仿游戏,5,借用一个木心的句式：别再提图灵了吧，他的死，使我们感到大家都是对不起他的。天才总天真、坦荡、毫不设防地迎向这个庸人占领的世界，一腔热诚付与世界。世界待他们，往往却是一盆脏水兜头浇下。有人说：人类社会进步得还是太慢了。嗯，或许吧。人类社会大约是进步了，但人性从未进步过。
2,模仿游戏,4,看完之后才理解为什么学校的数学楼叫alan turing building，为什么工程学院的咖啡馆叫enigma cafe
3,模仿游戏,5,太惨了，做人怎么能这么惨，惨得我和女士看完电影坐在椅子上一边擦眼泪一边思考了五分钟人生，上一次哭成狗的lgbt电影还是断背山。现在终于感觉，一个很厉害的人过得很惨，比一个很惨的正常人丧多了。
4,模仿游戏,5,“无人所念之人，方能成就无人感想之事” 工整却依然好看。“我们用自己的方式爱着对方，我们能一起过我们想要的生活，你成不了完美丈夫，我也不想做什么完美的妻子，我不会整天给你做羊排，等你从办公室下班回家…我们享受互相的陪伴，我们享受互相的思想，因为我在乎你。我们彼此相知，胜过任何人”
5,模仿游戏,5,我现在看我家电脑眼神满含深情，别问我为啥
6,模仿游戏,4,1最佳soul mate是去掉性吸引力 你仍是完美伴侣  2唯一爱你的方式，是建造一部解决人类所有问题的机器，冠以你名。 卷福又上升了一个新高度，演绎淋漓尽致  结巴天才四星半
7,模仿游戏,5,重度虐伤。我承受不了图灵所承受的这种委屈，@世界亏欠他太多太多。
8,模仿游戏,5,真的很好看…最后简单冷静的几行叙述文字本来我有一种欣慰的感动但准备会心一笑又觉得一种莫名的委屈，然后“噗哧”一声我就哭了出来…真的是五味陈杂啊T~T and thank you for bringing Turing back
9,模仿游戏,5,这个世界由阳光、空气、偏见组成。我们歧视不同种族的人，我们歧视不同信仰的人，我们歧视不同性向的人，我们歧视任何观念与我们不合的人，我们甚歧视仅仅是出生地不同的人。如果技术进步可以忽略不计，这个世界千万年来没任何改变。偏见是人类心灵的巨大鸿沟，原因再简单不过，仅仅是我们都渺小的相似
10,模仿游戏,4,最后她去看望他，拥抱他。他孤独地站在那一排为之奉献一生并恩泽全人类的庞大机器面前说，I’m not alone，never have been。然后伸手抚摸那些柔软的冰冷。它是他的恋人。而谁记得，孤独的孩子，你是造物的恩宠。
11,模仿游戏,5,你看缺爷，你继霍金梵高福尔摩斯之后，又接了个高智商神经病，集齐七个就可以召唤神龙让自己变得不那么二缺（或是更二缺）了~听说这片打算冲击奥斯卡，那就坐等缺爷封帝，淡泊明志当然不是问题但是封帝也是件很美好的事啊，就可以叫你缺帝了不是。乳房发育，卧槽那画面太美我不敢看。
12,模仿游戏,5,电影院看的时候哭成狗，图灵一边颤抖一边哽咽着说“我不能进监狱，他们会把我的christopher抢走，他们会再一次抢走他！”，看到这里我已经哭的泪流满面，一个英雄，他拯救了整个世界，但是看看这个世界给他的回报是什么！！
13,模仿游戏,4,天才之觞。Alan Turing的这台baby computer如今安静地站在曼城的科学工业博物馆一角，看电影之前我刚去看了它。机器不能思考，但天才倾注于它的所有心血和情感，也许是他孤独短暂的一生唯一可宝贵的珍藏。
14,模仿游戏,5,一定要打五星表示支持，丰满而感人。剧情编排很聪明，时间线打乱留足了悬念且增强了感情冲突，图灵的一生被完美诠释，这是对所有同志或仅是不同的人的献礼，伟大的人多是与众不同的。小男主隐忍的特写表演很好，BC也终于感动到我了，有奥卡相！唯独如今的电影都超宽屏要装下BC的长脸还真不容易！
15,模仿游戏,4,再被图灵的守护感动前竟然先被KK感动了，“那又如何？我们和一般人不一样，我们用自己的方式爱着对方”
16,模仿游戏,4,自古大神多是gay
17,模仿游戏,5,BC是为这个角色而生的，聪明，孤独，神经质的天才。导演对于情节的安排和取舍很克制，没有为了夺人眼球而刻意强调Turing的同性恋，同性恋情节只是轻轻点过。错落有致地讲到了Turing生命中的所有其他维度：希尔伯特猜想，图灵机，Enigma，人工智能，对长跑的热爱。人物很丰满。
18,模仿游戏,4,看完图灵隐形眼镜都哭掉了，倒不是benny演的有多好，说实话还是没有突破自己固有的银幕形象，能入围的话就已经很不错了。但图灵的一生真的很有泪点，影片结束能听到后排抽泣的声音， 因为真实存在过，所以让人心更为他疼。 
19,模仿游戏,5,编剧的奥斯卡获奖感言：图灵从没有站在这样的舞台上接受褒奖的机会，而我却得到了。这是最不公平的事。我想和那些同样觉得自己是个怪胎、觉得自己不同，与周遭格格不入的人一起分享，是的，你是怪异是不同是格格不入，但请你保持怪异，请你与从不同，当下一次你站在聚光灯下，也请你把同样信息继续传递
20,模仿游戏,4,电脑之父是基这件事，相信会让很多IT男的三观坍塌。
21,模仿游戏,4,抱着又一部《万物理论》的低期待走进影院，结果当然是比预想的要好，毕竟要比《万物理论》还差还能提名奥斯卡也不太可能了吧。马脸前半段一直在演夏洛克，后半段才入戏，就这样也足够完爆雀斑。AD配乐煽啊煽。撑同志反歧视的主题被放在哪么中心的位置还挺惊喜。
22,模仿游戏,4,又一部四平八稳安全着陆的冲奥电影。天才就这么被一群自以为是的庸才耽搁了...同样是传记类，《万物理论》就像可笑的过家家偶像剧....但说句真心话，卷福和kk的表现是意料之中的好，整体没什么太大的惊喜，相比之下，配乐真的是太抢耳了...
23,模仿游戏,5,人类会扼杀他们所不能理解的天才。正是那些人们认为的无用之人，成就了没有人能成就的事。
24,模仿游戏,5,Fuck normal！！！
25,模仿游戏,5,不一样并不代表是错的，电影真是好看……棒到什么程度？看完后我想把之前打五星的电影都改成四星就留这一个满分的程度。
26,模仿游戏,4,"遗憾天才的陨落，也遗憾与小金人失之交臂。
可能，命运注定要两部史诗级人物传记相遇。
当图灵碰撞霍金。
他们都是为推动人类进步做出不可磨灭功绩的智者。你无法把他们摆在一个天秤上较量孰轻孰重。
许是粉丝滤镜吧，让我终究因为卷福更偏爱图灵。偏爱这个战火纷飞的年代里，压抑的，激情的故事。"
27,模仿游戏,5,他大脑那么迅速地运转，他的双手却那么愚钝地触摸世界。他用聪明保护世界，却被事件的愚钝所迫害。愿所有的伟大都得到应许的赞誉。在图灵做出“考文垂事件”的选择时，我在想如果政府在破解时就得知他的同性恋身份，还会用牺牲战争胜利来做出对他的审判吗？
28,模仿游戏,4,"每年年底标准的颁奖季命题作文 典型的笑点泪点刚刚好based on a true story主角无限飚戏空间观众（和奥斯卡评委）要什么就给什么的韦斯坦恩式好莱坞商业片 it's not bad, but it just hasn't got any surprises"
29,模仿游戏,5,真实的故事常常让人流下无可辩驳的泪水
30,模仿游戏,4,故事本身便动人、跌宕起伏，看得难过。看到木心谈图灵的一句话，已经贴切地说出我所想的，“别再提图灵了吧，他的死，使我们感到大家都是对不起他的。天才总天真、坦荡、毫不设防地迎向这个庸人占领的世界，一腔热诚付与世界，世界待他们，往往却是一盆脏水兜头浇下。”
31,模仿游戏,4,本质是爱情片  图灵这么拼都是为了初恋
32,模仿游戏,5,马修・古迪无论怎么看都太迷人了
33,模仿游戏,5,拍摄，故事都没的说。。如果Allen (John)的角色换成抖森来演。。就舔屏了。。
34,模仿游戏,5,"因橐幻天才同性W家, D`, 二鹬辽倏s短了赡, 挽救了至少一千四百f人的生命. 於此同r, 在1885-1967年g, 有大s~49000名同性僬甙凑沼法律被判有罪."
35,模仿游戏,4,多重道德困境包裹的图灵，人物命运令人唏嘘，是上帝还是怪胎？谍战类型嵌入传记核，紧扣巧妙，解决了三段并行的冗慢。说到底，奥斯卡种子是靠价值观押宝，职业操守与身份秘密，国家集体和私人欲望。明处交锋，暗夜见芒，熊熊大火，幕幕戳心。
36,模仿游戏,5,卷福的演技加分。故事开篇让我想到听风者，整张下来尽是温情。以为是悬疑片结果人性和温情才是故事的基调。题材赞！
37,模仿游戏,5,这原来真的是一部LGBT电影。他妈的古蒂子一出来感觉全世界都排卵了。小司机已经胖成一坨大气球了。但是太惨了真是他妈太惨了，看哭了，是真的字面意思的哭了。他妈的然后clarke的形婚宣言怎么能那么牛又要哭了。最后，我们爱尔兰人就是那么牛呵呵。
38,模仿游戏,5,【B+】同样的学院派规整路子，比万物理论真是好多了。剪辑和剧本相当出彩，闪前和闪回的搭配，一波一波的情节冲突，剧力极强。马脸演的不错，但是怎么演都太直了。
39,模仿游戏,4,一个传奇式的天才英雄故事。虽是一位悲剧人物，但是影片着力表现图灵对战争所做的贡献以及自身的纠结点。三线叙事让情节变的丰满，也让图灵这个人物变的更立体。卷福的表演大赞，奈特莉也是可圈可点~
40,模仿游戏,5,无人所念之人，方能成就无人感想之事
41,模仿游戏,5,可以把它看作传记片剧情片爱情片... 科学、爱情、友情、LGBT、战争、人性...... 可解读的方面很多，而且各方面表现都令人满意。一直都认为对用心佳作吹毛求疵蛋里挑骨的人一定不是宽容温厚的人。
42,模仿游戏,5,一部电影，两条主线，讲了很多层面的东西。关于正常与反常，理性和道德，历史的转折点往往是由于一两个人的存在而出现的。
43,模仿游戏,4,其实觉得三星半最适合。政治正确、节奏准确、分镜合格、叙述圆满，可还是少了一点什么我们称之为点睛之笔或泪点或精髓的地方，情绪一直悬在那里，未能宣泄。是不是如此憋屈而隐忍，是腐国所崇尚的高贵？
44,模仿游戏,4,Forever Christopher 
45,模仿游戏,5,“无人所念之人，方能成就无人敢想之事”。向图灵致敬。
46,模仿游戏,5,看完电影感慨很多，但最希望的是我的同性恋朋友都能被这世界温柔对待。过了几十年，同性恋“罪”终于得到平反……因为这“罪”牺牲了多少有才的individuals啊...图灵是当中杰出的一个。无法想象他生平遭遇了多大的痛苦和委屈，感觉他的成就、后世人对他的平反都弥补不了他所承受的痛苦
47,模仿游戏,4,光是这卡司阵容就看的舒心。和想象中不一样，没有过度去追求大气的效果，倒是细节上人与人之间的细腻情感很感人，影片结局的处理也是淡淡的。整体节奏和氛围包括配乐都可圈可点。原以为很多情节会更为激烈，燃点却都来自日常，来自内心欲望的张力。卷福演gay还是不太像，理性天才的劲倒是很到位。
48,模仿游戏,4,一个天才式的人却过着无比悲催的生活。数学狗在电影院里竟然听明白了真是激动到飙泪，而快到结尾突然出现的政治斗争才发现智商快不够用了，最厉害的其实是政客啊
49,模仿游戏,4,工整的传记片，不乏看点，流畅有序，表演很出色，但是整体缺少升华的价值，剧本显得过于保守，最后把电影的落脚点放在同性恋问题上是一大败笔，结尾戏也显得托大做作。很像《国王的演讲》，但没有前者干净利落。和《美丽心灵》还差的很多。
50,模仿游戏,4,我觉得BC跑起来肯定没有图灵怪，但是BC哭时的那张脸肯定比图灵怪很多……
51,模仿游戏,4,本尼太适合
52,模仿游戏,5,求婚前一抬头的小眼神瞬间萌化了。。对又高冷又呆萌的技术理科男简直没有免疫力好嘛！！！！
53,模仿游戏,4,工整的剧本，观众一定会喜欢的一部好电影。
54,模仿游戏,5,看完电影走回家。差点哭出来。非常好的一部电影。趁着还没下映。去看看吧。天才总是被伤害，因为他们不是普通人，也无法被普通人接纳，可是，正是因为他们这个世界才会变得更好。人是多么自私愚蠢的动物，固执的认为他们本身的智慧和经验理解不了的，都是怪物。
55,模仿游戏,4,TuringK於出F了，抖吧人!
56,模仿游戏,5,故事情节，演员演技，画面音效，每一个都很棒！
57,模仿游戏,5,乌云压顶，呼吸困难，世间所有的天才终将被体制毁灭。
58,模仿游戏,4,怎料到是部矍殡影呢，去到Y尾他摸著那款叫著他一生中最鄣娜嗣字的C器，f著自己的孤r，才知运那N深沉的叟c思念；Keira Knightley最後在他痛不欲生r和他f：「不起眼的人往往能做出超乎想像的事。」，@句就是他最鄣娜烁嬖V^他的。一下子眼I没止住
59,模仿游戏,4,虽然知道计算机之父图灵，但还真不了解他的生平！通过影片了解后，真替男主感到悲哀，再伟大的发明以及对社会的贡献，也抵不过人心的冷漠！引人深思的一个故事！
60,模仿游戏,5,五星打得一点都不心虚，就算有感情分也不是因为BC而是因为图灵，对于电影来说图灵是个非常好的角色，够复杂够特别也够让人喜爱怜悯，而这部电影出色的发挥了这些优势，把看似无趣传记电影拍得让人真心的笑痛快的哭，我很遗憾我们没有更多的机会去了解图灵，但我们至少有这部电影去认识一个伟大的灵魂
61,模仿游戏,5,真的是很工整的作品，能结结实实让你看出冲奥的野心，可是我无法不打高分。感觉这个世界欠图灵的，这个世界亏欠，枉负了太多天才。当缺对着“Christopher”吐露真情飙演技时我真的要哭了，可当我看着他那么长一张脸扭成那个样子时，我居然他妈笑出来了
62,模仿游戏,5,"三个时空揉杂剪辑，却毫不含糊，层层递进，看到文明之光从那个戴着镣铐的钢铁时代里一点点渗出光来。不管是图灵在科技上的贡献，还是他同性恋的身份背后的故事，都是满满的inspiration.感谢这个从始至终都未被世界善待的""weirdo""."
63,模仿游戏,5,改变世界的还有第三颗苹果，在牛顿之后乔布斯之前。如果没有他，也许现在意义的电子计算机就不会产生了，也许现在信息技术和人类文明要改写。1954年6月7日，艾伦・麦席森・图灵因食用浸染过氰化物溶液的苹果死亡。据说乔布斯的苹果logo概念源自于此。8.5
64,模仿游戏,4,影院二刷，从中午12点赴一场电影到晚上22点，十个小时。剧作可能是这两年最工整最近乎完美的一部了节奏张力极佳，配乐也极灵，虽然命题作文痕迹明显，紧扣模仿和游戏把图灵的悲剧表现得很透，尤其是最后，克里斯托弗堪比「玫瑰花蕾」，后半段大量的泪点虽有堆砌之嫌，但第二遍依然哭成狗，也是真挚。
65,模仿游戏,4,这是一部太过讨巧奥斯卡的影片，却很好看，最后一群人烧资料的场面令我印象深刻
66,模仿游戏,5,1，天才+偏执狂推动世界文明。2，总是生前迫害，死后若干年再用各种方式纪念。3，六十年前，在英国同性恋是犯罪，现在成了腐国了。
67,模仿游戏,5,1.天才都是孤独的，但是不正常人常有的非人壮举。2.天才很多，只有情商高的才能有高成就。3.一切个人的成就在政治大局面前都是渺小的，珍惜生命，远离政治。4.彼得是个非常常见的俄国人名，往往当人专注于大事时，却忘了一些显而易见的小细节，这也是政治中所谓的最危险的地方最安全。5.运气都是留给勤
68,模仿游戏,4,如果把马脸的角色替换成Sheldon来演会是什么样？
69,模仿游戏,4,和我一起看这部电影的人，是我同事的前男友，也是我前男友的好朋友，也是我高中同学【贵圈怕
70,模仿游戏,5,我们用不同的方式生活，用自己的方式爱着对方，你不会是完美丈夫，我也从未想过做一个好的妻子。 无论是历史还是现在，我们被看似正确的道德枷锁囚禁了太久，排斥那些自己无法理解的人和事，而让整个世界的进步延缓了许多年。
71,模仿游戏,5,世上的秘密错综复杂，若从开始就一无所知，一切都容易得多；但我们依然选择保留这些秘密，也许只是为了不要过于孤单。
72,模仿游戏,4,由真实事件改编。天才，艾伦・图灵破译的英格玛密码，据统计使二战缩短至少两年，拯救超过一千四百万人的生命。他研制的图灵机就是我们现在所说的电脑。却因为是同性恋，被自己人摧残导致自杀，死于41岁，在2013年由伊丽莎白女王赦免，一段被尘封50年的往事才被政府公开。
73,模仿游戏,4,史诗。传记。谍战。四星半。
74,模仿游戏,4,在大银幕上看感觉摄影有些死板。
75,模仿游戏,5,《Him》么？Alan守候那个叫Christopher的机器，倾注了如此覆水难收的爱。孤独者的短暂人生，路过的稀缺天使往往留下难愈的伤。这一生如此辉煌仁义而憋屈耻辱，英国晚来的赦免意义重大得欲哭无泪。好多场景隐忍而震撼，Joan与Alan一众颇出彩，好几处眼神实太动人。但不合群的天才塑造真是常规么？
76,模仿游戏,4,凯拉宽，卷福长。凯拉坐在卷福上，卷福偏偏不让凯拉坐在卷福上.......凯拉偏偏就要坐在卷福上......................当里个当
77,模仿游戏,4,这片我是第一次看。影片结束时深受震动，除了图灵传奇又虐心的人生令人动容外，我真的真的没想到能在公映院线中看到一部对同志形象如此正面塑造的电影（个人感觉一刀未剪）！图灵说Christopher越来越聪明了那一段顿时泪崩~~(>_<)~~
78,模仿游戏,4,拍得很具可看性，有很多好玩的桥段，不过也就止于此了。
79,模仿游戏,5,天才的动人之处。
80,模仿游戏,4,明年奥斯卡种子出现。三个时间线交替进行，素材取舍得当，优美的音乐和运镜下故事娓娓道来，最后将对机器和对爱人的深切感情融为一体，直击人心。二战的时代背景营造得不够可信，人物刻画出色，BC的表演质朴动人
81,模仿游戏,5,"喜欢英国电影的画面，构图和拍摄角度都很满意；基于真实的故事，矛盾和冲突引发无限思索；只能试着去揣摩那种心血被被迫掩盖和关掉电源的那一刻。很感动，社会的发展是由小部分伟大的人排除万难而向前推进的。轰炸的场面太玄幻，减一星，和削皮器一起看的，超大爆米花和shared的可乐，加一星
"
82,模仿游戏,4,五味杂陈吧
83,模仿游戏,4,一部让人印象深刻的人物传奇。天才的世界可能我们难以理解 但全身心投入工作时的魅力那种从头顶散发的光芒我们却能够欣赏 图灵就是这样如上帝般的救世主。然而觉得图灵最伟大的不仅是创造了电脑及缩短了二战 而是宁愿化学阉割也要留住Christopher 就像在告诉世人 要维持自己性取向中那份珍贵的尊严。
84,模仿游戏,4,我是计算机相关专业，所以学院的大楼里一直都有图灵的画像，看了这电影又翻了些资料才了解了一些他的坎坷……本尼真的很适合这种聪明的有些偏执的天才
85,模仿游戏,5,法律有时候是另一种暴力。
86,模仿游戏,5,图灵伟大、丰富却又短暂的一生，电影并未仔细描述图灵丰富的感情生活，他的高傲演出的并未那么傲，也并未提及他对人类计算机事业的诸多贡献，可依旧，五星，献给伟大的图灵！
87,模仿游戏,4,未能达到预期值，但依旧是合格的主流片。BC的表演无可挑剔，AD的配乐天衣无缝。Being normal vs. being different的辩论，图灵对Christopher至死不渝的爱，以及恐同者用图灵的遗产来传播憎恨的讽刺都值得一个大大的拥抱。
88,模仿游戏,4,三星半。庄Sir分析得很好~Benedict还有一股sherlock的影子。拍得好正统，解密部分（剧情上的解密和关系的解密）还挺好看，结尾拖沓。
89,模仿游戏,4,20150115最后一点很感人。整体来说・人类才是操纵历史的么？为了让一切都符合逻辑学~让谎言来麻痹对方来得到胜利。
90,模仿游戏,4,3.5★…结构工整，三段交叉，错落有致…论整体，好过万物理论一截 +★…论个体，二缺大致还是神夏的路数，当真压不住万物理论中拼命的小雀斑…骚年那几段倒有意思，kk的告白差点把老夫看湿，唔，真是超越性爱的伴侣关系啊…马修正常发挥，呃，泰温公爵总让人脚着进错了片场…
91,模仿游戏,4,中规中矩，没有惊喜，习惯了英国电影的配乐，隐约觉得太过于多余。胜在卡司强，但女主角不抢眼，也许是没有太多发挥空间的愿意你。
92,模仿游戏,4,标准规矩的传记片，略平淡，向人工智能先贤致敬！
93,模仿游戏,5,已跪舔
94,模仿游戏,4,相比原型人物的生命轨迹电影显得避重就轻，不确定是刻意为之还是力不从心，各方面都中规中矩，但依旧是部好看的电影。意外的是战争探讨部分有打到我，可惜篇幅有限，讲得也不深。演员方面那谁演这种geek已经熟门熟路了，反倒马修戏份不轻啊第一次演playboy开心吧哈哈
95,模仿游戏,4,值得看也值得思考的传记片，卷福真心演的好。
96,模仿游戏,4,★★★★为赋巧合强作媒，天才搞基不耽误。天才谢耳朵卷福的坎坷破译路，靠出色的剧本功力和演技把这部创意一般的剧演绎的熠熠生辉，挺好的，值得一个奥斯卡。
97,模仿游戏,4,所谓真实的人生比电影更传奇，决定翻出人物传记书来瞅瞅
98,模仿游戏,4,图灵对于技术的执着和对爱的执着，形成了巧妙的互文关系。悲伤，含蓄。
99,模仿游戏,5,悲伤的故事，布莱切利，英格玛，古迪、小司机、MS、跳舞叔、首相大大。。。。。。为了马脸，把KK都忍了
100,模仿游戏,4,图灵对于技术的执着和对爱的执着，形成了巧妙的互文关系。悲伤，含蓄。
101,模仿游戏,5,片子没什么新的，但是turing实在太传奇太可爱了。看到最后我都心疼死了。#圣母心发作
102,模仿游戏,4,个人传记电影剧本写得不错，戏剧叙事中提出了非常犀利的观点。
103,模仿游戏,4,二战题材总是能常拍常新。影片包含的信息太多，尽管有些未能全部展开，但也让人唏嘘不已。图灵生于那个年代，是他的幸运更是他的不幸，透过本质又回到那个天才不融于所生存的环境这个永恒的话题。
104,模仿游戏,5,BC演技大赞。在主题之外，影片中对爱情的描写，是我近期看过最棒的。
105,模仿游戏,4,分虚高。一板一眼的英式申奥片。导演心头太大，想在一部电影里讲科学家孜孜不倦的研究，双面间谍的悬疑和同性恋被迫害的悲惨处境，却没有组织好素材，只能让狗血的矛盾冲突串联故事本身。同样是学院派的作品，《国王的演讲》完成得更加优秀和典雅。
106,模仿游戏,4,本渣对数学仅存的那一点“执着”让把目光全放在了密码机原理和破译工作上，知识储备太少，简直拿茫然来形容。片尾图灵的情感爆发来势之凶猛丝毫没有受到影片着墨其事业为主的影响，这真的归功BC了，比霍金倒带人生夏洛克都还要真挚动人！最后一部电影并不能对图灵尝鼎一脔，但苹果的logo真与他无关
107,模仿游戏,4,最后看得泪目啊…
108,模仿游戏,5,心塞。
109,模仿游戏,4,其实按照最近两年的电影总体水平横向比较来看，足可以给五星了，但是可惜，和与之相类似的题材《美丽心灵》比较，还是有一些差距的……我相信夏洛克、泰温等几位老戏骨已经尽力了，但题材这么好，理应拍得更好一些……
110,模仿游戏,4,一声叹息
