,movie,star,comment
111,模仿游戏,4,"""Sometimes it is the people no one imagines anything of who do the things that no one can imagine."" 我真希望凯拉说的这句台词图灵真的听到了。Christopher 的取名真相出来的时候泪目……"
112,模仿游戏,4,四星半，连对马脸的嫌弃都少了那么一丢丢
113,模仿游戏,5,传记片能拍成这样相当不易了，情节够曲折。基佬们以后会骄傲地告诉我们，你们现在用来下毛片的机器原型是基佬做出来的……
114,模仿游戏,4,最后一直在想有什么意义。女王赦免，档案解封，在死后给予无上的荣誉，这些事的意义在哪里？图灵已死，死得悲惨又灰暗。那些荣誉是为了安慰观众的，让观众开心一点。观众不过是委屈了几十分钟就deserve了一个大大的安慰。他们观看的对象却要疼痛几十年，这才是人世间最大的不公平
115,模仿游戏,4,影院版好像没怎么删减耶。
116,模仿游戏,4,"终于看了，的确如很多人吐槽的那样戏说太多，高智商低情商的一贯演绎；尤其是对Christopher的着墨比较""狗血""，当然我个人很爱这狗血的改编。很工整也没什么大的毛病，但缺了点""灵气""，结尾部分全靠卷福的演技脑补了。不过还是四颗星。英国欠图灵。还有多少人被无声无息地亏欠？这才是最难受的。"
117,模仿游戏,4,看英国传记片的好处是基本不会失望，结构完整，表演在线，情绪到位。但坏处是，熟脸太多容易串戏，本片分分钟穿越到夏洛克+唐家屯+权力的游戏。
118,模仿游戏,4,英国电影拍大制作时候的“正统”感我一直不太喜欢，和万物理论、国王的演讲一样，讲故事和拍摄的方法都有些太cliche...新人编剧还是差了口气。后段BC虽然是方法派但是是能打动人的方法派表演加半颗星、凯拉的角色设定加半颗星～BC和凯拉有几场戏很动人，小BC也不错～PS.Goode是话痨，Leech是呆萌～
119,模仿游戏,4,我们用自己的方式爱着对方，我们能一起过我们想要的生活，你成不了完美的丈夫，好吧，跟你说，我也不想做什么完美的妻子。我不会整天给你做羊排，等你从办公室下班回家。我也上班，你也上班，我们会享受互相的陪伴，我们会享受互相的思想。这听起来不比一般人的婚姻要好吗？因为我在乎你，而你也在乎我
120,模仿游戏,4,不是任何情商低的人都有能力以洞悉世事来弥补的。
121,模仿游戏,4,三线并进，把故事说得珠圆玉润、滴水不漏。比预想的还要好看。
122,模仿游戏,5,很赞！
123,模仿游戏,4,传记片套用了碟战类型片的外壳，整体挺有想法。仔细想来，如今已常见的人工智能电脑的思维方式，便是图灵式直来直去思维的翻版。这个当年不被理解的人，靠着发明电脑，终于让所有人都开始用他的方式思考。此外，如此敏感的同志题材电影能在大陆公映，也是历史一大创举。
124,模仿游戏,4,"【B+】不得不承认英国人拍这样优雅的历史电影是真的有一套:美术、服装、布景和人物都透着一股属于那个时代的古朴气质，摄影、剪辑和配乐更有着浓厚的英伦绅士风，而影片的三线交叉叙事的节奏把控与完成度更是精妙无比。也许本片因为太过工整而失去了很多影像特性，但对一部电影来说，把“工整”做到一种极致也是自身实力的最好体现。
另外，女主对于婚姻的那段诠释真是深得我心，也许这才是婚姻最舒适的模样。"
125,模仿游戏,4,最恨精英主义的天才了，因为这总是对的，并且总让我想起自己这个人文主义者，总感觉他们都在技术的圈子里打转，偶尔扭曲了一下思想的笼子，动不动以为改变了世界就能够改变人类，可人性永远没变，这也是对的，并且还是真理。btw.不赞同同性恋就是不赞同人性，为什么永远有人那么瞎。
126,模仿游戏,5,故事本身力量太强了，虽然拍得老套，但也足够震撼人心了。
127,模仿游戏,5,图灵 看完才想起每次计算机课上第一章节一定会讲的原来是他  本尼迪康伯巴奇每次看他演戏都觉得他是戏痴 演技超级棒 最后一幕太惨了01
128,模仿游戏,5,卷福的演技可以打10颗星，可是导演完全OOC了图灵这个角色……他不是这样的啊人家明明是个超级磐耆不在乎周围人眼光到处跟人出轨的死基佬！不是这种“大众眼光下压抑的同性恋者”形象！对图灵最重要的几个科学贡献也都没好好说，人家的贡献不仅仅只有破译了Enigma而已！
129,模仿游戏,5,四星半吧  印象最深的一是I don't know how to judge you 再一个是  We love each other in our own way....正好赶上高中几个班的老师组织学生集体去电影院看这个。。。被小鲜肉们围绕起来看电影的感觉真奇妙。。。卷福在这里真心大秀演技 不愧凭此片拿男主奖
130,模仿游戏,5,凯拉宽，卷福长，凯拉想绑在卷福上，卷福不让凯拉绑在卷福上。
131,模仿游戏,4,好吧我原本是冲着KK去的，不过结果却是被马脸后半段的表演感动了。完成度非常高的一部传记片，不过叙事和人物塑造有点太稳了，在众多二战题材片中可能得列入比较平庸的那一类。影片结尾烧纸的一幕很棒：六个在解码游戏中拯救了世界的年轻人，在火光中对过去的一场祭奠。
132,模仿游戏,4,图灵在二战中破译密码的故事，情节注定不会枯燥，但也很难展现他对人类真正的贡献――或许这本就不是电影可以做到的。对天才的敬仰与对孩子的心疼在心中交错。一切赞美都来得太迟。
133,模仿游戏,5,本尼的演技无可指摘，电影末尾他哭了，我也哭了。
134,模仿游戏,4,really moved...
135,模仿游戏,4,人类社会大约是进度了，但人性从未进步过
136,模仿游戏,5,致敬图灵
137,模仿游戏,4,很学院派的片子，和今年的万物理论格调有点像，但是要好上很多。图灵自然是伟大的先驱，而他被迫害的经历更让他蒙上了一层受难英雄的光环。本片比较有亮点的是图灵和他的C，被叙事强化，处理成了一段很委婉的同性恋情，让人唏嘘不已。
138,模仿游戏,5,理解是对和普通不同的人最大的慰籍。是真的理解。
139,模仿游戏,4,被马修古迪帅出一脸血 68(68 686168ω686168 68)68
140,模仿游戏,4,8.8。终场掌声响起，图灵得到了承认，卷福的表演也得到了认可。Quinn的表演很一般，还是跟Alicia好好玩吧。三女婿也是默默存在中。前面很多好笑的台词，表演一很用力。但是总感觉卷福演的有点过，要么就是剪辑师为了缩短片长故意只把发力的部分存着。总之很奇怪。
141,模仿游戏,4,原来这个世界早就是码农和基佬的了……sigh
142,模仿游戏,4,虽然也是中规中矩，但是一是不花哨，二是分三线，有散有并，还是不错的，三是整体情感表达和人物都是到位的。比《万物理论》好多了。
143,模仿游戏,4,这个世界，总在以我们不可知的形式默默运转。马脸叔演技大爆发！承认自己害怕孤独那点太挠心，小图灵的眼神也真挚的可怕。最后，我想说，其实我也想找一段图灵与琼之间的relationship，这世界心灵相通真的太难。
144,模仿游戏,5,编剧的技巧太高超了，非常流畅地将叙事和象征通过三条时间线索完美结合，同时不露痕迹地将同性恋政治，图灵测试以及图灵机这几个关键词串起来。这样的改编能力令人叹服不已。
145,模仿游戏,5,为了那些被庸人世界戕害的天才们，打五分。
146,模仿游戏,5,没有敢看结尾。怕太难过了。
147,模仿游戏,5,一段历史，秘密封存着伟大而又单纯的英雄；一个天才，默默奉献着奇特而又创造性的天赋。历史成功的背后，展现着一个天才的崛起；知之甚少的年代，击垮了一代英才的陨落。当再次回味，慨叹的只是图灵对这个世界卓越的贡献以及命运的对他的不公。如今真相重见天日，那么就是世人对他最好的纪念。
148,模仿游戏,5,历史的背后总是藏匿着太多秘密，最后尘归尘土归土，但有一些人该被铭记。这片子带着一股淡淡的腐国文艺气质，缺卷塑造的Alan Turing很像一朵沉静郁艳的玫瑰，他是否因为爱而拯救不得而知，但那份守护让人备受感动。很难得喜欢上一部传记片。真心希望缺卷拿个影帝啊~
149,模仿游戏,5,又一部有趣的传记片，剧情也算够曲直了，卷福一直专注于演这种超高智商超低情商的天才。电脑原来是同性爱情的结晶，五星。
150,模仿游戏,4,腐国版《听风者》，主角从盲人换成人格缺陷者。身在暗处的英雄，却因为一代的知名老gay的身份反被国家遗忘和羞辱。电影无限放到了这点，并给图灵配置了一个美好初恋1.0，文艺味够了，技术能量减弱不少。看在配乐、KK、卷福份上给个四星。
151,模仿游戏,4,电影只是标准的冲奥传记片，四平八稳，真正让人动容的是图灵伟大的贡献和悲哀的结局。对于本尼的表现，我觉得卷福不会再是他唯一的标签了
152,模仿游戏,5,"In the end, it is a love story. 一开始在三个时间段的跳跃让进入状态有点慢，但渐渐被BC磁性的深情嗓音攥住。KK最棒的一次演出，要感谢精致的剧本。叙事层面感觉不是最完美，但BC&KK，甚至是小司机的演绎都很加分，OST太棒。男神帅得冒烟。关于“秘密”“机器与人”“不平常”的台词值得回味…"
153,模仿游戏,4,电影三星，图灵四星。
154,模仿游戏,5,在认知领域如果领先大众一步叫先知，领先好几公里必定成为先烈。
155,模仿游戏,4,谢谢图灵让我等小辈用上电脑看片。
156,模仿游戏,5,五星给卷福的表演
157,模仿游戏,5,最近喜欢卷福，先马住
158,模仿游戏,4,"‘Keith and Charles, you are fired’. 
然后自强不息的两人终于创立了Charles & Keith"
159,模仿游戏,5,一种制度摧毁了一个伟大科学家的一生。
160,模仿游戏,5,1.三条线却毫不杂乱，反而更显人物形象的立体化；2.太爱朋友了，所以才会给机器叫克里斯蒂夫；3.图灵到底是什么？到现在还是没人知道。
161,模仿游戏,5,借着反法西斯战争胜利70周年大陆公映的同性电影，政治正确万岁！！
162,模仿游戏,5,不知道说什么了，“愿世界上一切伟大的人都能得到应有的认同和赞誉”。
163,模仿游戏,5,需要靠点联想触发泪点，不过总体而言确实是很好的片子，卷福很适合这种天才类角色
164,模仿游戏,4,战争中你流尽鲜血，和平中你寸步难行
165,模仿游戏,5,当世俗用一颗龌龊的心去看、去对待 一个坦荡、直接、有才华的人的时候，他并没有憎恨，因为他或者包容或者不在意，他只是把自己的精力和爱继续放在它们应该在的地方。可悲的是，最终这样的人不会不圆滑与妥协，经常让他们被埋没。太多人，太多事，只能归为运气，以此解心结。
166,模仿游戏,4,形式上，它的确是一部标准的冲奥片，传奇科学家传记片这个题材本身就是标准的冲奥题材，影片拍得也比较稳妥，没想颠覆或打破什么。但是，但是，由于图灵的伟大，以及他人生经历所构成的悲剧性传奇，使得这部传记片，即便不用什么技巧与探索，仍然是震撼的。全文：http://t.cn/RZ0bRdy
167,模仿游戏,5,北京市大兴区欣宁大街15号荟聚购物中心3层金逸影城。李亚欣
168,模仿游戏,5,我想起蒙克写维特根斯坦的那本书的名字――天才之为责任
169,模仿游戏,4,正是人们不抱期望之人，做成了人们不抱期望之事。
170,模仿游戏,4,三线剧情交叉进行，有点乱。
171,模仿游戏,5,Sometimes it’s the very people who no one imagines anything of who do the things no one can imagine. P ZQAE TQR.
172,模仿游戏,4,真好看。好的传记片会让人停止评论，只关注片中事，而无关人物的大事件。影片的长度当然不尽然交代完整，但足够了解。正如影片接近末尾处，图灵问警察“我是一个人还是一台机器？”警察不能做出判断。三条线是现在，过去和过去从前。他决心在那一刻忘记他，然后建造它。在某个空间，他就是他，也是它。
173,模仿游戏,5,国王的演讲2 给祖师爷跪了
174,模仿游戏,5,I have no idea why it hits me so hard. We've been taken things for granted for so long without being aware of the people behind. This world is such a forgetful child.
175,模仿游戏,4,世界上有3%的人与众不同，却推动了社会97%的进步。当我们用苹果电脑播放着这部电影时，是否想过，电脑背面那个缺了一口的苹果，就是在纪念那个被社会主流道德和强权阉割的天才。
176,模仿游戏,4, 一个改变了全世界的人 最终却因为性取向被世界抛弃 落得如此下场 最后卷福握不住笔的样子真的直戳泪点
177,模仿游戏,4,一直下了在电脑里没看，因为觉得题材沉重，结果等到国内上映，于是去电影院看完了，本尼的演技就值回票价。
178,模仿游戏,5,浪漫有余，冷峻不足。电影中的图灵有点虚弱，讲述国家秘密的成分居多，而历史上的图灵，无论性格还是成就，远不止此，所以不能算是一部合格的人物传记，不过这些都不妨碍为图灵致敬而打五星。
179,模仿游戏,4,真的觉得这样的才是好演员。不是靠的夸张的表情和肢体语言，而是――他就是图灵。真挚、毫不做作的演技，才能动人呢。当他说“只有这样，我才会不会和克里斯托弗分开”的时候，反正我是被打动了。
180,模仿游戏,4,尽管已经看过 还是庆幸去了影院 三条时间线交叉叙事 节奏紧凑且推进自然 奥斯卡最佳改编剧本实至名归 本尼奉献了自己最震撼人心的演出 天才图灵其实没想做伟人 只是想做自己想做的事罢了 他遭受迫害的罪名需要女王特赦吗？没人有资格宽恕他 唯一不满意的是计算机命名 太言情小说太肤浅 
181,模仿游戏,4,痛哭。“我从来不是一个人，Christopher 越来越聪明了”戳爆泪点。近一百分钟的压抑，结尾全力爆发揉碎人心。已逝爱人的温柔和世俗的恶毒是多么讽刺的对比，Chris曾经的话如图灵一生的一语成谶：他们打你是因为你与众不同。有时正是那些不容于世的灵魂成就了无人能及之事。
182,模仿游戏,4,"Benedict Cumberbatch的演出非常精采,图灵更是一生髌,可惜”舅坪醪蚝穸,а菀诧@得平庸,整w碚f只能算是J真乐之作...(]想到竟然是影最後的字幕我哭了一把)"
183,模仿游戏,5,现在看到电脑都有异常的亲切感，他们有共同的名字“图灵机”，嗯，以后我的笔记本就叫“克里斯托弗”了。
184,模仿游戏,5,硬是要捏合同性恋和破解enigma两条线，比较吃力，但完全不妨碍我对如今码农们程序猿们的爆炸般的崇拜。果然什么片子只要一沾上二战我就会跪舔加一星。比《鸟人》更符合爸妈的口味。
185,模仿游戏,5,向我们展示了一个推动了人类历史重大进步的数学家，心灵能有多坚强
186,模仿游戏,5,本尼演得非常好。
187,模仿游戏,5,最出彩的就是编剧对电影主线的安排，很抓人。也正是由于剧情连贯性的需要，许多史实就有修改，就当阿兰图灵“传奇”而非“传记”去看吧。另外图灵有孤独症，应该避免和强势的人有眼神交流才对，这是我从这部好片里挑出的唯一一根刺。
188,模仿游戏,4,Who will fall in love with ordinary？
189,模仿游戏,4,天才总天真、坦荡、毫不设防地迎向这个庸人占领的世界，一腔热诚付与世界，世界待他们，往往却是一盆脏水兜头浇下。
190,模仿游戏,5,Joan进了仓库，灿烂的阳光从她背后溢出，斑驳摇晃。她稍微愣了愣，让门就这样开着，走向了他和他的Christopher。
191,模仿游戏,4,我来告诉你们为什么人类进步的这么慢 而且前途渺茫 因为我们当中唯一几个有智慧的 都被大多数没智慧的傻逼害死了
192,模仿游戏,5,姐不是去看图灵也不是去看缺爷，是去看christopher的。以「找密钥」为故事线，以大到国家小到私隐的「秘密」展开情节，每段都有「关键字提醒」，山埃、苹果、圣经。从Christopher到Turing到Joan再回到Turing，「不可理喻之人能成不可思议之事」成为人生密钥。架构美。有些台词别那么白就更好了。
193,模仿游戏,4,20150412，夏布洛尔
194,模仿游戏,4,很为图灵先生伤心。与众不同的人，做出与众不同的事，这是他唯一的安慰吧。
195,模仿游戏,4,到破解机器密码前剧情 节奏都非常好 后面有点泄气的感觉
196,模仿游戏,5,培养一个绅士，需要三代文明者；可是毁掉一个天才，有时只需要庸人一句话。可惜可叹历史走过了漫长的几千年，人类是进化了，可人性从未进化过。
197,模仿游戏,5,棒的不得了的电影，不论对人类重大贡献的战争英雄最终因为同性恋身份得到悲惨结局，还是图灵对未能表达心意的初恋的恋恋不忘，还是坐在审讯室中问警官“我是机器还是人？”都戳中了我柔软的心窝窝啊啊啊啊啊！强推！
198,模仿游戏,4,故事本身就是悲怆啊，光听到这样的事，就已经动容了。好看度也是强，各方面都做的可以。
199,模仿游戏,5,模仿并非只是游戏，智能的整体表现往往取决于智能的实现粒度。对新观念的包容与学习正是人类智能的最好诠释，日心说如此，同性恋亦然。机器要实现人类的思维智能路还很远，但这并不一定意味着要走很久。
200,模仿游戏,3,在图灵这样一个传奇、天才的身上，只能说我想看到的比这部电影说得要多得多：它说的是一个智商超高的人的故事和悲剧，却把观众的智力水平放到了最低的位置… 许多如同琼瑶剧一般的矛盾制造把我是看呆了。当然各方面都太讨好奥斯卡了，英国演员、欧洲导演，配乐，摄影。领奖标配。
201,模仿游戏,3,什么片子配上Alexandre Desplat这种学院派的煽情配乐都能让你感动，更别提这片子还有讨人喜欢的腐国文艺片气质，还有男女主角优秀的表演和一群熟脸配戏，背后还隐藏着一个伟大的男同爱情故事。不过将图灵的一生编排进这样的颁奖季类型片，时代背景，无名英雄，天才与自闭，没什么惊喜。★★★
202,模仿游戏,3,拍的太平庸了。本片的主题：德国人被任性害死了。我们英国人真厉害。我们破解了密码。我们击败了敌人。我们发现了间谍。我们真伟大。【英国人你们还记得剑桥五杰怎么拼嘛？马脸充满着“我就是一个天才”的气质，演技是很好，但剧本的刻画太单薄。即便如此，征战美帝没问题。美国人不是喜欢英国的文化嘛
203,模仿游戏,3,现在这种精致的人物传记都大同小异。尤其是天才式的人物，他们大多呈现出同样的性格特质。不过过程中设置的层层障碍，让解谜成功的激动还是很振奋人心的。而影片最终还是把重心落在了同性这个话题上，一个伟大的天才，终究才是要毁在那个时代对同性的迫害上，确实非常可惜。BC表演确实不错，不过影帝难
204,模仿游戏,3,没特别期待也没大失望。人物脸谱化。故事简单化。好莱坞。高大全。然而若不是这电影我也不会了解那故事的细节和其他人物。卡司非常好。我觉得最喜欢的表演反倒是Matthew Goode和Mark Strong. Matthew Beard在那角色里都发挥不出来，可惜。
205,模仿游戏,3,顶多三星，韦恩斯坦想模仿国王的演讲，砸了
206,模仿游戏,3,又名：我要奥斯卡
207,模仿游戏,3,真的只是还行吧
208,模仿游戏,3,砸在牛顿头上的苹果，被图灵咬了一口，掉进乔布斯的手里。
209,模仿游戏,3,剧本工整太过，所有桥段和戏剧效果几乎都按照写作101来的，无任何意外，脱离现实明显。好看自然还是好看，尤其对结尾那个巨大的不公正处理优雅，悲情效果良好。若从传记角度出发，电影则十分肤浅娱乐化。
210,模仿游戏,3,毫无亮点的片子。剧本幼稚。想想类似这种传记片一抓一大堆
211,模仿游戏,3,以学院奖的标准配置，工整、流畅、单调，冲奥气质浓郁。二战、天才、同志题材本就是万金油，加上大把优秀演员、AD煽情的配乐、精细的摄影和美工，本应该会非常好看才对。最后把图灵拍成这样，还是太小看人家。3.5。
212,模仿游戏,3,一切都太过显而易见了……包括里面那种悲伤都如此的显而易见……不好看。
213,模仿游戏,3,可能是这两年影视剧里这种类型的天才出现得多了，看起来并没有觉得是会让人有所触动的故事。BC还是不要演什么同性恋了，真的，直男气都要喷出屏幕了……
214,模仿游戏,3,电影的匠气太重了，什么时候插入同性恋话题，什么时候追忆，捋顺了逻辑后，插入一个挫折，再安置酒吧的转折戏……过于工整，每一个情节碎片的意图太明显，完全能猜到下一张牌是什么，无甚惊喜。……但为什么还得了奥斯卡最佳改编剧本奖……
215,模仿游戏,3,在结尾打上一行又一行陈述史实的字，这已经成了冲奥传记片的标配，让你混淆历史和片子本身，双双敬畏起来。其实这是春风化雨的绑架。传颂历史的电影跟创造历史的人关系很大？我给图灵牛逼的贡献真真诚诚地打五星，给距离《美丽心灵》十万条街的本片打三星。
216,模仿游戏,3,尽管对本尼的表演以及图灵的传记都很肝心，但关于图灵有三个要讲的内容：二战的密码工作；同性恋者身份；计算机的诞生以及关于图灵假设；内容组合呆板以至有些拙劣。（弹幕里一句话得记下来：恐同的最好就不要用计算机了！
217,模仿游戏,3,夸张的标签化的电影只是为了告诉观者有过图灵？谢谢额。
218,模仿游戏,3,每一个学术gay都有一个叫科研的男盆友。电影有些用力过火，工整到刻意，二缺时而谢耳朵时而本喵喵傻傻分不清楚，演太多天才迷失自我了，小图灵是一大萌点，结果如此凄惨，后妈编剧虐心指数五颗星
219,模仿游戏,3,3.5。1.图灵人机恋，果断是本片最大的点睛之笔。2.卷福演得不错，有颓迷有痴狂，尤其最后化学阉割后的那场戏。3.往往是那些最意想不到的人，会完成最意想不到的事。4.可惜导演造梦能力一般，整体中规中矩，历史的痛感未能真正感同身受。
220,模仿游戏,3,发明密码、破解密码、又发明新型密码、又破解新型密码……这群人真是天才。
221,模仿游戏,3,毕竟熟悉图灵生平 也毕竟是传记片 两个小时下来 没有任何激烈戏剧冲突 取得项目主导权、改善同事关系、谁是间谍、同性恋疑案、破解enigma时间过长等等 均是旋即破解 或者分阶解决 进一步削弱冲突感 主体插叙框架外的破案悬疑 不足以支撑全片 少少几个战争或战残场面 割裂于主体之外 次要角色刻画也欠佳
222,模仿游戏,3,英国无名英雄赞歌，类似《国王的演讲》，但主题表现更像《逃离德黑兰》，作为人物传记片看剧本切入点相当圆滑，很讨巧。可惜莫滕泰杜姆导演太平庸，直逼《万物理论》BBC电视电影拍法，只有所谓严谨的平铺直述，也因此情感冲击大打折扣。KK角色理想化到不可信，提名凭的是角色而非表演本身。
223,模仿游戏,3,再超凡的人物和故事也能被平庸的电影工业那自以为是的“好看”原则，处理地俗气、矫情而又浮于表面。尤其是奈特莉戏码设置，衬托图灵好直男，这种为了迎合主流观众而妥协的地方，影片里比比皆是。但BC和那个小演员演得真好，让人动容。撑同志效果也算达成。
224,模仿游戏,3,中规中矩。在解开Enigma的同时team里的小弟发现自己哥哥就在即将被攻击的船上这种刻意接受不能。你们卷福演这种偏执的天才太易如反掌，他应该演些别的角色了。
225,模仿游戏,3,三星半。卷福的表现无可挑剔，偏执，冷静，腼腆，拘谨，不善言辞，却又十分聪明。形象刻画十分到位，电影看上去更像是一个二战里的密码谍战剧，反而对图灵的性取向没有做多大的描写。
226,模仿游戏,3,莫滕・泰杜姆在挪威拍的片子那么生猛，来拍英语片也是软塌塌的；从剧作到技巧都是中规中矩，工整但没有惊喜，为了把同性恋和英格玛两条根本不相干的线揉到一块的倒叙看着也是费劲。
