,movie,star,comment
238,恐怖游轮,3,这是一部神话片。只可迷信于神明幻想，不能纠结于故事框架与细节。
239,恐怖游轮,3,噩梦的不断重复是因为我们不愿醒来
240,恐怖游轮,3,我猜到了这开头，也猜到了这结局
241,恐怖游轮,3,这部片子的技巧是可以的，拍循环时空的概念。但如果是一部纯粹的科幻片，又有太多无法合理解释的情节联系，所以和灵魂联系在一起，很多bug就顺理成章了。还是更喜欢纯粹的科幻或者纯粹的灵异。用灵异来填补科幻情节不严谨的漏洞，就有点投机了。
242,恐怖游轮,3,编剧这货以前一定是程序猿，对死循环深恶痛绝。这个bug最多只是自圆其说。
243,恐怖游轮,3,这种悬疑的电影真的会看的脑袋晕了去的，所以也会导致很多种不同的见解。
244,恐怖游轮,3,三星半
245,恐怖游轮,3,在家看的，因为没等人，还挨说了饿~~~
246,恐怖游轮,3,哲学片…………
247,恐怖游轮,3,"突然发现我居然看过这个~~~
好给力
不是不喜欢，而是无力感，这部电影，让人有了强烈的无力感，对于这点，我深表厌倦"
248,恐怖游轮,3,翻了评论，再表示明白了一点，所以感冒状态下，智商果然是零
249,恐怖游轮,3,放不下，即受轮回之苦。
250,恐怖游轮,3,【B-】原来没有标记？其实我觉得也就那样吧
251,恐怖游轮,3,觉得这片儿好看的人，应该看看心慌方2
252,恐怖游轮,3,刚看的时候有点迷惑，但你仔细从头到尾缕缕情节，你会发现这部影片最大价值就在于每个人可以不断提出自己的见解，并在自圆其说的过程中享受到思考的乐趣。
253,恐怖游轮,3,总感觉缺点什么。。。不能称为悬疑
254,恐怖游轮,3,过半之后就毫无惊喜了，后面那个鸽子尸体堆根本就是等着它出来的。三星半，但还是推荐一看。
255,恐怖游轮,3,一开始胃口被吊的挺高，后来就没了。。。  最开始是怎么开始的？ 难道就是一个循环？
256,恐怖游轮,3,死脑筋导致的无限死循环。是不是外国人都这么木- -
257,恐怖游轮,3,结束了？
258,恐怖游轮,3,女猪脚那合不住的嘴，一脸木相r(st)q
259,恐怖游轮,3,没传说的那么神乎其神。
260,恐怖游轮,3,看得有点头晕。。。来来回回都是她
261,恐怖游轮,3,被过誉的影片，硬伤过多
262,恐怖游轮,3,创意不错，执行太差。导演控制细节的能力很成问题
263,恐怖游轮,3,关于时间的一个迷宫题
264,恐怖游轮,3,很多解释不通的硬伤，以及没有前因后果地套用西西弗斯的典故
265,恐怖游轮,3,只能说是比较早的一部轮回设定吧 现在看是很一般的悬疑片
266,恐怖游轮,3,经不起反向推敲~~
267,恐怖游轮,3,美国版西西佛斯式的抗争。同性质的故事就连日本《世界奇妙物语》系列都讲过好几个。不过最搞笑的是有些观众喜欢钻牛角尖，探究死循环的源头究竟何在，这样的人我觉得好无趣，就跟打破沙锅问到底一定要知道先有鸡还是先有蛋般无聊。反正这种惊悚奇妙系的电影不能剧透，连预告片都不能看哦！
268,恐怖游轮,3,剧情真tmd绕啊。。。
269,恐怖游轮,3,希绪弗斯
270,恐怖游轮,3,循环电影，剧情是不错，但是重复的容易烦……
271,恐怖游轮,3,坐霸王车不付钱不遵守诺言是要付出迷乱而徒劳的代价的。游轮上的Room237，镜子上的字、唱片、ballroom、老照片、走廊的花纹，完全是向闪灵致敬（homage to “the Shining”）。好奇这部电影的成本。
272,恐怖游轮,3,只要大概搞懂这个轮回是咋回事就行了，一个套里面有N个套。
273,恐怖游轮,3,呃・・・・・・・・・很快就猜到结局了，没劲~
274,恐怖游轮,3,一百个读者就有一百个哈姆雷特~~~
275,恐怖游轮,3,死循环！！！！
276,恐怖游轮,3,先看《时空罪恶》，轮回~~~
277,恐怖游轮,3,纠结的电影 
278,恐怖游轮,3,在pps上看到的：这个就是由于没有付车钱给司机而被画圈圈诅咒的一个悲剧惨事，还有人说女主角的玩了cs   3个回合，然后当起刺客信条里的自杀一回，最后玩起了极品飞车可是不幸的是・・・・撞了・・・
279,恐怖游轮,3,无从解释无中生有
280,恐怖游轮,3,
281,恐怖游轮,3,其实就是月光宝盒的故事  可惜到了后小半截情节都在意料之中 完全没有什么新的看点了
282,恐怖游轮,3,好凌乱，要仔细去想。
283,恐怖游轮,3,看不懂
284,恐怖游轮,3,"我只想知道,如果一切都发生过了,那她上船为什么还这么无知呢?我觉得睡觉不够有说服力呀"
285,恐怖游轮,3,中规中矩的宿命论
286,恐怖游轮,3,3.5
287,恐怖游轮,3,漏洞其实还不小，但是比照这个故事本身，也不必过于苛求。西西弗斯的轮回，其实主线也很清晰，就是不断挖掘主角心理的复杂层次，一次次的自我否定和自我纵容，这才是和西西弗斯的行为从本质上的契合点。
288,恐怖游轮,3,不符合逻辑但依其逻辑可顺推的循环。周而复始的让我看得没有任何情绪，boring。
289,恐怖游轮,3,我妈很费解这种电影有啥好看的，呵呵
290,恐怖游轮,3,其实导演处处埋伏笔，看出来心意很足的商业片，剧情紧凑逻辑也顺理成章，可能是我对希腊神话过于崇敬，导致我觉得导演有点不内涵了！哈哈！ 
291,恐怖游轮,3,轮回，只不过是重启罢了。
292,恐怖游轮,3,喜欢《蝴蝶效应》，《死亡幻觉》这种七拐八拐最后能从逻辑上拐圆满的同学不妨一看。早知道是这种绕圈圈的片子就不看了~引俺娘的话：导演，演员，观众，总有一个疯的！
293,恐怖游轮,3,穆赫m道+源代a+蝴蝶效。前半段故弄玄和昏昏欲睡 缀跏W美乙善的特c和共有的通病。一_始以槭亲 原硎鬼弄的]合循h啊。故事接的精巧 但是精巧也不能吃啊！不就是把半段片子剪砑羧サ募舫梢徊苛幔。
294,恐怖游轮,3,姐智商太低。。。。
295,恐怖游轮,3,从前有座山，山上有座庙，庙里有个老和尚在给小和尚讲故事：从前有座山，山上有座庙。。。。
296,恐怖游轮,3,胜在结构精巧，剧情其实没看之前期待的多么精彩。相比于同样类型的片子，林中小屋绝对更好，可以没什么名气听说过的人不多
297,恐怖游轮,3,这片子让我想起了玩刺客信条执行某个任务的时候总是不能在规定时间内找到另一个目标，结果找到的那个目标就一遍一遍被我杀死，在街上堆成了尸体山
298,恐怖游轮,3,这个故事告诉我们。。。。。。最重要的一点是开车要专心
299,恐怖游轮,3,好大一个圈。。。不过诡异的没个原因，不爽啊
300,恐怖游轮,3,所以这个片子的点在……
301,恐怖游轮,3,原来由形式支撑起来的电影也可以很精彩。
302,恐怖游轮,3,其实很烂
303,恐怖游轮,3,最后还是编不圆嘛
304,恐怖游轮,3,谈不上有逻辑。有人拿出什么宿命论、平行时空理论……来解释，狗屎般无法自圆其说。这故事缺少的其实就是一个开头，并不少结尾。
305,恐怖游轮,3,来来回回，晕头转向。不要企图在重复中寻找已经失去的爱。
306,恐怖游轮,3,她怎么莫名其妙的就躺在沙滩了呢？！片尾特意要与片头归位，，，但这个地方没『轮回』、这个圈断了
307,恐怖游轮,3,N久之前看的
308,恐怖游轮,3,怎么说呢= = 究其实挺一般的
309,恐怖游轮,3,如此循环，世界早晚会被尸体装满
310,恐怖游轮,3,不难看，但也没多大意思。
311,恐怖游轮,3,"故事看点低,倒是结尾和结构还不错."
312,恐怖游轮,3,我支持没给打的费那个说法；只是把time travel逃不出的作茧自缚一环单独表现出来 不做别的过多解释 不给一丝可以打破的机会的绝望造就了神棍地位 而且还不怎么能经得起推敲 和我属于【命运论吃屎】的那一派 我很天真
313,恐怖游轮,3,知道自己会犯错误，还是一而再再而三地执迷不悟，遗忘自己不愿回忆起的事情，放任自己，自然是无法逃出轮回，只能在痛苦和回忆中一直徘徊。
314,恐怖游轮,3,逻辑……我在和自己打架……
315,恐怖游轮,3,这片子应该叫“被诅咒的轮回”或“迷失轮回”才对。其实本来只是一个希腊神话的现实呈现版，被拍得玄乎迷乱有点纠结挣扎而已，当一部纯虚幻心理悬疑片来看还是可以的，压抑感很强烈，看多了可能会让人抓狂，但是很多人夸得分析得那么费力，就太可笑了。如果非较真现实的话，这不过是个编的扯淡故事罢了
316,恐怖游轮,3,好o聊的循h……不^因是在成都看的～有o念意x^_^
317,恐怖游轮,3,其实想打3星半
318,恐怖游轮,3,只能说这部电影肯定是一部好的科幻悬疑小说 但是拍成电影 就有点差强人意了 不仅不断重复的剧情 场景 人物给人疲惫感 各种重复的镜头更增加了观众的心理压力 看完这部电影不会让观众感到恐怖反倒会很疲惫 有点事倍功半的效果
319,恐怖游轮,3,一个变态女人的施暴轮回
320,恐怖游轮,3,无感。。。
321,恐怖游轮,3,"Goodbye,please not return."
322,恐怖游轮,3,这是一部低成本的、技巧大于内容的、女主角身材挺hot的一部电影。中间看得我颇为索然无味。豆瓣评分也太高了。
323,恐怖游轮,3,穆赫兰道之后还比较凑合的角色错位穿越剧
324,恐怖游轮,3,理不出逻辑
325,恐怖游轮,3,如果没有那个结局我估计就评两颗星了
326,恐怖游轮,3,创意很新颖，这个片子就一句话就能形容内容，就是左转左转再左转好像是个圈哦~
327,恐怖游轮,3,过于诡异的片子，其实此题系导演扯淡，无解。大幕落下时，导演一下惊醒，where was i？空留诸位看官瞎猜去吧
328,恐怖游轮,3,不知道为什么，这个片看一半就不悬疑了。。。
329,恐怖游轮,3,很耐人寻味的剧情 但女主。。长相 丑 声音 难听 性格 2B 这是一场灾难啊。。
330,恐怖游轮,3,"还是一个平行空间论的问题，不过这个电影在连接上略微有点问题。
比不过法国人拍的《时空罪恶》那么连贯。精神可嘉~预祝平行空间论越发突长。让荒诞变为真实，让真实沦为荒诞。"
331,恐怖游轮,3,本来以为是多重平行空间的故事。看了豆瓣结果有灵魂一说，好吧其实也说的通。
332,恐怖游轮,3,无语啊无语，绝望的片
333,恐怖游轮,3,这个大条船 就你们几个人玩
334,恐怖游轮,3,乱糟糟的，吸引观众继续看下去的那个谜团没有那么大能力去平衡影片开始半小时内很乱的剧情。   至于让主人公生死停留的那个原因，没有感受到是多么的强有力的让一个普通人去一遍遍的很片中的死神做交易
335,恐怖游轮,3,轮回与循环
336,恐怖游轮,3,类似的电影现在太多了。。。
337,恐怖游轮,3,想表达什么啊？
338,恐怖游轮,3,"""He cheated death. No, he made a PROMISE to death that he didn't keep."""
339,恐怖游轮,3,不是我的菜
340,恐怖游轮,3,不喜欢
341,恐怖游轮,3,有事月光宝盒的剧情~~~重复再重复
342,恐怖游轮,3,这片逻辑之神奇不亚于盗梦空间啊！怎么会没火呢？
343,恐怖游轮,3,首尾连接导致整个故事没有起点，没有起点就不知道女主无限循环是为了什么，拯救自己的孩子？死神出租车司机？复仇的海鸥？电影本身不好看，我完全是为了证明自己的智商才坚持看完了。
344,恐怖游轮,3,提前被剧透，导致看的无聊透顶= =
345,恐怖游轮,3,为啥我感觉一般……甚至还看得有点累……
346,恐怖游轮,3,这一型的电影，往往把人物当成道具。Momento还是有人物塑造的，这个就没有了。
347,恐怖游轮,3,不要随便拿来比穆赫兰道
348,恐怖游轮,3,没有逻辑
349,恐怖游轮,3,穿越题材，绕来绕去逻辑就有点乱了。再加点恐怖的为了自私灭绝人性。
350,恐怖游轮,3,又是一部呼声很高的电影，简单重复的剧情，杀戮，开始，没有结束，大圈套小圈，无尽的循环。影片结尾的剧情，违背了某些常理，刻意的呼应开头，显得尤为生硬。
351,恐怖游轮,3,这个无限循环不符合逻辑，当循环次数足够多的时候，死者甚至可以漫出整个游船，甚至影响之前的循环，除了这个逻辑悖论，其他看起来还是挺绝望的
352,恐怖游轮,3,母爱真他妈狠
353,恐怖游轮,3,恐怖佳作 其实过程中看出许多对现实社会的隐喻 比如一轮一轮不变的人，和一处许多的死尸 但到最后明白了――现实版的西西弗斯。
354,恐怖游轮,3,还是不够恐怖啊哈哈。。。
355,恐怖游轮,3,死神改开出租了。。。
356,恐怖游轮,3,一个新颖的创意非得用狗血而做作的巧合来圆润，如果第一次看这种电影我会给五星，看得多了就觉得审美疲劳了，从女主角把那哥们推到带钉子的墙上时，我就知道为了剧情需要制造巧合的时刻到来了！
357,恐怖游轮,3,还好吧，就是很容易猜透，有点老套。本片又一重述了美国的宿命观。这妈妈太轴了，明知道命运不可改变着无聊的死循环，还是为了看一眼儿子，没玩没了的重复着悲剧
358,恐怖游轮,3,本片作为我提上日程的悬疑电影系列第一部，看着还是挺费力，所以终极篇《穆赫兰道》的到来之日遥遥无期呀~
359,恐怖游轮,3,虽然时间悖论这类题材还挺喜欢的，但是这部和《超时空犯罪》都令人异常苦闷，再就没有像《关于时间旅行的热门问题》那种style的了么
360,恐怖游轮,3,逻辑上似乎有点混乱  不过还说的通 就是剧情上有点简单
361,恐怖游轮,3,还不懂的就看影评.....然后就会觉得这个片子至少三个星，不过一个电影要靠影评才能理清...也就只能有三颗星了
362,恐怖游轮,3,先三颗星吧 嗯・・・ 我在理一理
363,恐怖游轮,3,逻辑和伦理的漏洞都太大了...
364,恐怖游轮,3,眼晕。。。
365,恐怖游轮,3,前面还有部《时空罪恶》。
366,恐怖游轮,3,老掉牙的莫比乌斯环设定，非常无聊的时间悖论题材
367,恐怖游轮,3,这个电影被列为最近最好看的恐怖片。。话说，是一个不停重复的故事。
368,恐怖游轮,3,其实只要跳进海里就可以被冲上岸了吧……逻辑混乱
369,恐怖游轮,3,Loop
370,恐怖游轮,3,哎，可惜了，总是感觉差点什么，导演玩的很high，我可能没跟上，也没太愿意跟...
371,恐怖游轮,3,好像是个圈哦~~这种题材不新鲜并且它不如《时空罪恶》更经典
372,恐怖游轮,3,3.5星吧 非常不喜欢女主角
373,恐怖游轮,3,恐怖游轮 这名字翻译的不好。。
374,恐怖游轮,3,轮回，时间并置，西西弗的传说，Triangle，
375,恐怖游轮,3,不要没事骂孩子
376,恐怖游轮,3,没看明白 看分析后晕了
377,恐怖游轮,3,以为是推理片，结果发现是科幻惊悚 - 人家要的就是你心惊肉跳的效果，而不是一个合理的解释。不过看到最后预感到这是一个走不出去的怪圈时，内心还是颇为绝望的。
378,恐怖游轮,3,disgusting永劫轮回，杀戮游戏
379,恐怖游轮,3,一个无聊的死循环。
380,恐怖游轮,3,明明于事无补 何苦陷入万劫的轮回深渊
381,恐怖游轮,3,无限轮回的剧情设计很完整，但是主角的惯性思维让人很无语啊，从头到尾的连环杀人魔就是她自己啊，处理突发事件的能力怎么就这么点呀。如果主人公是个健康快乐的人这片完全可以成喜剧片撒。
382,恐怖游轮,3,what's the point....
383,恐怖游轮,3,形式过分机巧。
384,恐怖游轮,3,逻辑花活儿
385,恐怖游轮,3,西西弗斯触犯了众神，诸神为了惩罚西西弗斯，便要求他把一块巨石推上山顶，而由于那巨石太重了，每每未上山顶就又滚下山去，前功尽弃，于是他就不断重复、永无止境地做这件事――诸神认为再也没有比进行这种无效无望的劳动更为严厉的惩罚了。西西弗斯的生命就在这样一件无效又无望的劳作当中慢慢消耗殆
386,恐怖游轮,3,"一般
"
387,恐怖游轮,3,循环，无限循环。
388,恐怖游轮,3,豆瓣评分有点虚高・・・・・・・・・・・
389,恐怖游轮,3,虽然看过剧透之后，明白了怎么回事，但是就是无法喜欢上这种电影！
390,恐怖游轮,3,当中有牵强之处 始终瑕不掩瑜
391,恐怖游轮,3,循环套路什么的我看得要吐了
392,恐怖游轮,3,好吧，我原谅你，时空问题没有能自圆其说的
393,恐怖游轮,3,喜欢女主演。。。。这是一部异次元死循环片
394,恐怖游轮,3,看过解析后我有点害怕TAT
395,恐怖游轮,3,为神马会这么高得分？我只觉得三星半…… 
396,恐怖游轮,3,看的时候做别的事情去了嘿嘿嘿嘿 还要重新看一遍的。
397,恐怖游轮,3,没有出口的电影不是好电影
398,恐怖游轮,3,喜欢这种暗含神话/诅咒 的 轮回套路
399,恐怖游轮,3,06年的《断头气》被本片导演拍得一团糟，今咸鱼翻身拍出佳作。虽说故事没有新意，但是在叙事手法上玩起了环形结构和平行时空错位，从《土拨鼠日》和《暴雨将至》偷师成功！前半部和高潮部闭合鸿沟的动作时角色视角对换是一个令人惊喜的设计，但美中不足是结尾拖沓，应见好就收，出租车处就可出字幕。
400,恐怖游轮,2,还好吧，逻辑没有传说中的那么强。而且我最讨厌主角那种一副似懂非懂的茫然表情了，这个叫套路，眼睛无神的瞪着前方，嘴半张，欲说还羞的……好老套啊……
401,恐怖游轮,1,真是天才的烂编剧，为了套层什么逻辑都不要了，别的什么都不说，核心推论是杀光了才来下一波，可是您杀光了么？留了一个分身还冒出来第二个分身，到了结局强行接开局，完全无视最基本的人物性格，为了循环而循环，本质上是极端自恋
402,恐怖游轮,2,如此无聊！！
403,恐怖游轮,2,不探究的话会以为这是一个很妙的西西弗斯式死循环，但是导演却试图用无数个死循环来证明第一道循环的正确性，这就让后面的情节无处不BUG
404,恐怖游轮,1,自作孽不可活，珍爱生命。
405,恐怖游轮,2,点子不错，情节太硕
406,恐怖游轮,2,挺Interessting的...
407,恐怖游轮,1,我当初为什么会打了一星的？
408,恐怖游轮,2,还行吧，远比想象中差。看了评分和评语，觉得太过誉了。真实的世界尚没想清楚，像这种幻想中的复杂逻辑，没漏洞是不可能的，漏洞少就不错了。一些地方能看出来是在弥补，还有些地方是没弥补好的。
409,恐怖游轮,2,头号高智商电影！年度创意奖，一道让人欲罢不能的谜题，有连续看十遍的价值恐怖惊悚片！
410,恐怖游轮,2,你不喜欢所以我也不喜欢
411,恐怖游轮,2,a:想玩历险惊悚没这么空洞的，想升华主题没这么敷衍的，想抖包袱没这么不带爆点的b.戏剧冲突纯属为了吓你而吓你，结局纯属编不下去
412,恐怖游轮,2,能不看还是别看了好~
413,恐怖游轮,2,导演就想告诉我们一个死结嘛？
414,恐怖游轮,1,睡着了
415,恐怖游轮,2,极度不适、、、、营造的心理上的恐惧氛围。。。
416,恐怖游轮,2,看的过程中一直纠结她怎么不站出来直接面对自己不就得了。
417,恐怖游轮,2,"这年头，不看影评看不懂电影了~
"
418,恐怖游轮,2,是很有创意  不过主角没有爱  来回重复的片段是很有连贯性也不失为节省胶卷的好办法 但是太拖沓  看得很累
419,恐怖游轮,2,没有西班牙的时空罪恶好看
420,恐怖游轮,2,弱智
421,恐怖游轮,1,女主角的嘴比死神还可怕。
422,恐怖游轮,1,女主丑的那么一逼，还拿这种计算机公式糊弄人？没脑子的人硬要觉得这片烧脑子
423,恐怖游轮,2,都说逻辑不是很严密，老重复那几个镜头真省钱
424,恐怖游轮,2,同样是“时间门”的电影，还是更喜欢93年的《土拨鼠日》，血腥地，不喜欢。
425,恐怖游轮,2,bug太多
426,恐怖游轮,1,感觉澳大利亚的片子没那么恐怖，悬疑也没那么悬疑，就是轮回么，一开始估计就猜到了那个杀手是女的了，最后结局倒也意料之中了，主题还可以，不过也没有特别的。
427,恐怖游轮,2,"前半段吓死，后半段搞死。
看豆瓣影评就可以了"
428,恐怖游轮,2,"一点都不恐怖  
无限循环  到后面都有点无聊了
不过最后的回到最初 让人惊喜了一把"
429,恐怖游轮,2,IQ值不高的人，最讨厌这种看影评才能看懂的片子了～
430,恐怖游轮,2,出来混迟早要还的
431,恐怖游轮,2,没劲爆了！！！导演真懒！！！
432,恐怖游轮,2,无聊 跟盗梦空间比 差远了 说神作的都没看过《LOST》吧
433,恐怖游轮,2,无聊 SB
434,恐怖游轮,1,操你大爷的！你丫要循环多少次？？？从没有因为看一部电影让我如此出离愤怒！浪费了我生命中的90分钟！！！
435,恐怖游轮,2,为毛现在恐怖片都不恐怖啊啊啊啊啊啊 ！！！！！！！！！！
436,恐怖游轮,2,看的是一感觉 我打分经常随大流 但是对于这种影评比电影本身好看的、分析n层结构的、主角名字后面下标一号二号之类的电影 看了那么多 也算是受够了
437,恐怖游轮,2,反正我是没看懂什么意义。
438,恐怖游轮,1,BUG太多，类似蝴蝶效应，但情节不够严密，衔接十分的不自然
439,恐怖游轮,2,玩时空的。不断的循环没完没了的，神马玩意
440,恐怖游轮,2,穿越穿越穿越
441,恐怖游轮,2,原谅我实在是没觉得哪里悬疑 哪里惊悚 哪里特别
442,恐怖游轮,1,每一次轮回都不过是悲剧命运的挣扎，宿命会被蝴蝶影响，终将行灭。
443,恐怖游轮,2,艹，剧情简直是个冷笑话。。。拍的不错一颗星+声音和音乐不错再一颗星
444,恐怖游轮,2,搞精分很好耍吗 ? 拍循环你看fear itself都比你好看
445,恐怖游轮,2,"这么烂的片子居然有8.1分！成功骗到了某人，一定要看！当初看到这么""直白""故意""赤裸""的片名我就没兴趣，看到1/4就猜到在玩什么把戏，想睡觉某人不让。到了后面某终于受不了，承认选片杯具了！"
446,恐怖游轮,2,是没问题，但片子真的很一般，
447,恐怖游轮,2,智商不行啊没看懂……
448,恐怖游轮,2,没逻辑不可怕，可怕的是强行让观众接受你的没逻辑
449,恐怖游轮,2,前面吓死爹了……还是一点也不能看恐怖片啊
450,恐怖游轮,2,很无聊。
451,恐怖游轮,2,这种逻辑的电影以后再也不看。
452,恐怖游轮,2,Shining+Stay+Groundhog Day
453,恐怖游轮,2,看笑场了=。=导演太差劲了，好好一故事给拍的。。。
454,恐怖游轮,2,挺有新意的故事
455,恐怖游轮,2,泥马星星姐给剧透的内容都比正片好！
456,恐怖游轮,2,有种山寨致命id的感觉。为什么分这么高？我的问题？
457,恐怖游轮,1,"她上船的目的这么明确，就不会有上船后的三部曲和心态了，整个一矛盾。。。看得我那叫一纠结，看过不少这类的片子，这个真的是最扯淡的
"
458,恐怖游轮,1,文青修炼必备良药。
459,恐怖游轮,1,什么乱七八糟的
460,恐怖游轮,2,特么无限重生你告诉我这叫循坏？
461,恐怖游轮,2,挺烂的 看的牙痒 
462,恐怖游轮,1,剧情经不起推敲
463,恐怖游轮,2,无限循环==！
464,恐怖游轮,2,不要以为打着母爱和时空循环的旗号就能唬弄老子了 剧情漏洞百出 女主角永远一副痴呆的样子 脑子也不灵光
465,恐怖游轮,1,女主到了港口一看 跳着表等她的出租车停满了停车场
466,恐怖游轮,2,一道简单的虫洞理论问题。。看的我都快睡着了。。女主角腿很漂亮。。
467,恐怖游轮,2,胡编乱造的恐怖片
468,恐怖游轮,2,女主人公困在对现世与爱的依恋中，而观众则困在自己的小聪明与盲从里。
469,恐怖游轮,2,说实话这片子真不合口味。本来活着就累，看个电影还得绞尽脑汁，浪费生命啊……话说全片就那个死在海里的女人最养眼……女猪脚看起来就该死……香肠嘴……看得我真纠结。。。
470,恐怖游轮,2,寝室白富美在看，我也顺便看了大半――这讲的啥跟啥啊？女主不变的表情和那来来去去的轮回真是相映成趣。评分这么高是怎么回事？一定是我看的方式不对……
471,恐怖游轮,2,"@N破影@N多人吹捧，砘丶糨不算，一切都是按照式的工I模式完成的作品，@悚常用的落危C位DQ，分批收拾，毫o新意,e他o我扯什麽西西弗斯，六道回，片就是片"
472,恐怖游轮,2,女主为什么不自杀。。
473,恐怖游轮,1,一恐怖片拍成这样..
474,恐怖游轮,1,无限次循环。
475,恐怖游轮,1,这片硬抄《时空罪恶》，抄得还不怎么样
476,恐怖游轮,2,跳海前的打斗巨bug
477,恐怖游轮,1,烂片
478,恐怖游轮,2,你说随便跳出来一个人就出来了呀~前面都蛮有轮回的样子，不过也很无趣，太冗长~后面撞车后她突然就出现在现场~那她当时的记忆状态实在哪里啊？根本就不行啊。。。
