,movie,star,comment
479,恐怖游轮,1,对我来说，一个电影是要讲一个好的故事，我看了这个故事可以思考一些东西知道一些东西，或者了解某个时代某个人的生活，最不济也是收获一些酣畅，享受一些特效，感觉到快感。而不是在一部电影里面死扣一些细节，得到一个经过故弄玄虚的手法掩盖的普通故事。解数学题可能有人喜欢，但绝对不是我
480,恐怖游轮,2,豆瓣居然给了8.1分，尊重我妈的意思只给1.8分。智商高的观众不好糊弄呀r(s_t)q
481,恐怖游轮,2,2016.02.14.
482,恐怖游轮,2,死循环，睇到我个脑打晒结。
483,恐怖游轮,2,炒冷饭
484,恐怖游轮,1,不喜欢。虽然导演/编剧很费心。
485,恐怖游轮,1,极SB的电影，极SB导演，极SB的叫好观众
486,恐怖游轮,2,一遍就懂的电影真心不明白所有人在纠结什么 还有这种无尽循环只是让人想睡觉 
487,恐怖游轮,2,不怎么样，一点也不恐怖。
488,恐怖游轮,2,看的快睡着了，轮回这东西，一开始就点破索然无味，情节重复的累赘，一堆鬼扯。
489,恐怖游轮,2,豆瓣的品位
490,恐怖游轮,2,逻辑性没的说，但是这对我来说不是一个完整的故事，女主到底是如何穿越时空的？也许就像环形蛇，没有答案才是魅力所在？
491,恐怖游轮,2,杰西你究竟怎么得罪死神了
492,恐怖游轮,2,bug太多，忽悠小孩好了
493,恐怖游轮,2,到底要循环多少遍啊！！！卧槽！！！
494,恐怖游轮,2,几乎每一步都想到了，颇有些无聊啊~
495,恐怖游轮,2,成本太小了。。小的我有点儿小心眼儿了。。
496,恐怖游轮,2,这个电影告诉我们――世界就是个循环。让我想起了一篇科幻小说叫《一日囚》。这女的就被囚禁在了一天。当然这种时空交错有很多地方是讲不通的――比如她应该在第一次循环就洞悉了一切。除非有超常的力量将她一次次的拉回并迫使她重复。否则如果她仍有自我意识就无法完成循环。这女主角我实在很看不顺眼
497,恐怖游轮,2,为女主不厌其烦的折腾加一星，完全是困兽之斗啊亲
498,恐怖游轮,2,模仿痕迹太重，又比人家拍得烂..受不了这类型的片子了，以为自己很有深度，其实看着难受死了，这片几乎没有一个优点
499,恐怖游轮,2,这片子给装逼犯装逼最好使了，傻逼电影。。。
500,恐怖游轮,2,反正我没看懂。逻辑漏洞百出
501,恐怖游轮,2,不待见这种累心需要说明书的唯心主义神秘惊悚片
502,恐怖游轮,2,为轮回而轮回  毫无逻辑性 豆瓣友怎么特喜欢把一个牵强附会的故事解构得无比高深以显示自己牛B呢？
503,恐怖游轮,2,好无聊，看了不到1/3就知道剧情套路了，就没点儿能让人猜不到结局的悬疑片么
504,恐怖游轮,2,所谓循环重复，人类拍悬疑的智慧难道就永远停留在这种小猫腻上？就跟看大笑江湖，又是掏来掏去的广告式幽默，看来宁财神也江朗才尽，混饭吃了。
505,恐怖游轮,2,明显有bug好吗？这么高分也是醉
506,恐怖游轮,2,被一姑娘“这是我最喜欢的一部片子以及一点儿也不吓人！”的评价忽悠去看了，结果一点也不觉得好看，并且被吓了个半死。。为什么人类要拍一些神神叨叨故弄玄虚又没有半点寓意的空洞无聊又吓人的片子啊摔！
507,恐怖游轮,2,就莫名其妙讲了个轮回的故事。所以这几个人这辈子就一直年轻一直过那天发生那一件事情咯。。呵呵
508,恐怖游轮,2,时间切入点等一系列细节问题都没处理好，而且给人想要蒙混过关的感觉
509,恐怖游轮,2,永无止境的神经病
510,恐怖游轮,1,垃圾
511,恐怖游轮,2,一部IMDB6.8分的烂片，这里竟然是8分，豆瓣的分数真奇怪
512,恐怖游轮,2,1只有结构可取2please return3多个尸体如同沙僧的108骷髅头4应该大气、走出来
513,恐怖游轮,2,"整部电影就是个大BUG：女主在船上有两种模式的命运,假设A和B,A模式与主角相同,结局轮回。B模式即在船上被砍死。AB模式必须交替上船轮回才成立,而能再轮回的人只有A模式。即便假设B模式被砍死丢入海中能继续轮回,那么完成整个过程仍需要3个存在互不干扰的女主才能完成(AB和在被人发现死在车祸的那个)。"
514,恐怖游轮,2,"是恐怖片(w章_J). 女主角的蠢笨程度令人指, 我看的全身汗毛倒Q."
515,恐怖游轮,2,毫无逻辑性，比《时间杀人》差多了！
516,恐怖游轮,1,演技差 剧情拼凑 
517,恐怖游轮,1,打的不能不给钱
518,恐怖游轮,1,"妈的,看得老子压抑,,差"
519,恐怖游轮,1,无能的女人
520,恐怖游轮,2,额。。。。。。。。。
521,恐怖游轮,1,女主阴森森地回头一看，我就吓尿了....
522,恐怖游轮,2,我不得不说它的逻辑性很强，但是它是我不想去推理的逻辑电影，这类的惊悚是没有缘由的，凭空推理对于我来说难度太大，只能说不适合我吧。还有这女主的表情一开始我就很讨厌。
523,恐怖游轮,1,去年评分才6.2，一年过去硬生生被刷成了8.0，片子来来回回重播其实挺扯蛋的，给五星的人你们看着不烦不想快进吗？
524,恐怖游轮,1,"你要是不追根纠底的问最先一个进入一切的第一位女主,并且看看网上的解释就会觉得这是好片,但是你要是结合自己的实际情况我只能说女主脑残,第一我看见跟自己一模一样的人不会躲,我就不懂她躲毛啊,要是我至少会觉得很有趣,渴念了男主和一众好友,招谁惹谁了,无辜垫背被女主杀了又杀,悲催啊......"
525,恐怖游轮,2,很好懂，故事是很好的，虽然同样的梗越来越多电影再用，但导演把握的不够好，本来可以很吸引人的但我看的时候却不停的吐槽它低成本…（和周某第一次一起看的电影在他家）
526,恐怖游轮,1,最讨厌无脑又大胆又心急的女人了！！！！！！
527,恐怖游轮,2,看完之后让我吐槽，太不够严谨了
528,恐怖游轮,2,表面看似逻辑十分完整，实际上是踏入了一个在一维空间内发生的机械式的循环穿越的怪圈，而在追求工整度的同时基本上对平行空间所造成的蝴蝶效应进行了完全否定，而从演技来看也没有什么特别出彩的地方，值得一提的是画风还不错。
529,恐怖游轮,1,"If the directer's goal is to let the audience scream WTF, then he succeeded..."
530,恐怖游轮,2,看开头就像是一部无聊的恐怖片，反正我是看不下去
531,恐怖游轮,2,有点为了惊悚而惊悚 为了悬疑而悬疑 逻辑也存在严重偏差、
532,恐怖游轮,2,这有什么好看的..??
533,恐怖游轮,2,也就那么回事吧，还是没有华山一条道的地步。自杀试试。莎莉尸山是不错，可其他几位的尸体又不见了。这次的自己又遇上了不知哪次的自己。我也不喜欢拿母子情当斩杀令的简单设置（就跟诺兰总是死老婆一样。）杀死暴躁的自己一处还以为有新意，循环反而削弱了惊奇
534,恐怖游轮,2,逻辑啊逻辑~经不起推敲的逻辑~
535,恐怖游轮,2,不喜欢这扯淡的剧情
536,恐怖游轮,2,有人说是拍到后来没经费了，所以再放一边
537,恐怖游轮,1,又一部豆瓣高评垃圾片，毫无逻辑章法的宿命论，维持该片的继续点就是成百上千打的女主角，杀不完死不完，二分裂么，日！女主角你弱智得可以吧，重复自己做过的事说自己说过的话你很HIGH？！不是我干的不是我干的，娘娘~~~妈的棒子剧一般的臭！游轮哪里恐怖了，女主角持续1个多小时的二缺傻愣表情才恐怖
538,恐怖游轮,1,导演你是有多无聊？
539,恐怖游轮,2,乱
540,恐怖游轮,2,大家省省吧，别闹了。这片子经不得推敲。导演有个无限循环的好想法，却没有吧细节处理好，即使看来解析之后仍然看不出什么，很明显的bug被说成我们看不懂，比如用刀杀死那对夫妇的女主是哪来的。反正，这绝对不是什么神片
541,恐怖游轮,2,哪有意想不到的结局。明明一下就猜到了。浪费时间真是。小呆家。
542,恐怖游轮,2,"没有逻辑的一部片，运用了很多重复镜头。
有没有想过每一个她自己都是这个循环链里的一个环节
断了就没办法再继续了！
她既然已经把将来的那个自己给杀了
那怎么再继续在同一个时空里出现两个自己的个体？！
没逻辑就别拍这种逻辑性看似很强的电影"
543,恐怖游轮,2,这女人干嘛不自杀了停止循环
544,恐怖游轮,2,20100911 @ home : fucking loop
545,恐怖游轮,1,破`很大好么
546,恐怖游轮,1,过誉
547,恐怖游轮,2,无言的圈，我都要昏了
548,恐怖游轮,1,烂片！~~~~不可理喻！~~~~
549,恐怖游轮,2,成本低啊，反复剪辑就行了
550,恐怖游轮,2,时间轴扭曲，逻辑混乱，价值观幼稚，心智不成熟。不敢面对现实，不敢面对自己的脆弱与错误，反而试图像玩儿游戏一样一旦有问题就save and  load.于是，换来的就只有反反复复的后悔。
551,恐怖游轮,2,故事发生的一切只能建立在女主角是大2B其他人也是2B的基础上。女主那恍惚的演技让我也恍惚了。活该死一百遍。
552,恐怖游轮,2,澳大利亚拍的，难怪这么大反应，就这片要是在美国拍的，肯定沉下去了。循环什么最无聊了，比幽灵船差好多。
553,恐怖游轮,2,这是陀屎吧 一部短片来回播！
554,恐怖游轮,2,神作？呵呵
555,恐怖游轮,2,神马里个东东 这部东西的制作成本应该很低吧 来来回回 在美好的圣诞之夜 浪费了这么点时间 坑爹映画啊……
556,恐怖游轮,2,很纠结
557,恐怖游轮,2,好吧，我没看懂
558,恐怖游轮,2,无限次的循环，主人公分明已经知道了剧情和结果，可她还是leave it alone，还是让循环继续。她完全有办法阻止登船。而且最后完全可以不去航海。。。结果，她还是去了。。。虽然被很多人把它跟盗梦空间相比，但是我看盗梦空间的时候从没有过这样揪心过。说实话，我不喜欢这电影
559,恐怖游轮,1,必须打一个星是吧・・・算你狠・・・
560,恐怖游轮,2,挺无聊的
561,恐怖游轮,2,有点太荒谬了吧。。非要这种死循环
562,恐怖游轮,2,2
563,恐怖游轮,2,"真好,拍四五十分钟的镜头可以放成九十多分钟."
564,恐怖游轮,2,反主角啊~
565,恐怖游轮,1,我看多了么？都猜到了
566,恐怖游轮,2,40/100。编剧很用心，可这片子实在不对我胃口。不知道这样一部电影拍出来到底有什么意义。女主角的演技太差了。还穆赫兰道蝴蝶效应呢，洗洗睡吧。
567,恐怖游轮,2,故弄玄虚 海报夸大的影片的惊悚程度 其实也就悬疑的档次
568,恐怖游轮,2,无能为力地噩梦
569,恐怖游轮,2,不仅海报很烂，故事也烂的够呛！
570,恐怖游轮,2,恐怖油轮就是一个NC自私女为了无限升级不断的重复卡Bug刷副本，但还是悲剧的被GM干了
571,恐怖游轮,2,从此以后，杰西123都生活在一起好了。。循环的头疼。似曾相识这类电影。。抄来抄去。
572,恐怖游轮,2,看得我快崩溃了！
573,恐怖游轮,2,又是死循环，无聊透了 看的我昏昏欲睡，剧本就够软肋 逻辑漏洞太多 实在无法自圆其说 再配上傻X一样的女主 故弄玄虚的阵势 真让人崩溃，最后让我们震惊到底的是真相还是绝望？！和同题材比起来真的一无是处 ，过誉了。
574,恐怖游轮,1,就知道这种片子在豆瓣 一定是高分的 真难看
575,恐怖游轮,2,这个故事告诉我们不能拖欠出租车司机的钱
576,恐怖游轮,1,我日，女主角大傻逼……如果最後企w在船上堆M了呢？
577,恐怖游轮,2,无趣
578,恐怖游轮,2,没觉得特别出色，主题也不新颖
579,恐怖游轮,1,《死了7次的男人》的仿作麽。。。好垃圾，很差。。。
580,恐怖游轮,2,和《寂静岭》有点雷同
581,恐怖游轮,2,烂片
582,恐怖游轮,1,故弄玄虚，生搬硬套。
583,恐怖游轮,2,女主角我就说眼熟的很原来演过lie to me......本来没看懂一直轮回的原因机制，所以觉得神叨叨不好看，后来看了影评，哦，原来是被死神耍弄了一番。。。然后还是想说“我去....无聊....神马爱啊、轮回、执着啊都完全无感，对啊，我就是肤浅白不懂深刻黑。。。”
584,恐怖游轮,2,完全让人想不明白~~ 挺白痴的
585,恐怖游轮,2,看得头直疼
586,恐怖游轮,2,想法巧妙，情节老套
587,恐怖游轮,1,厌烦这种恐怖，到最后还是不能给个答案。永远陷入无休止的循环之中，不得解脱。成本或许能小很多，翻来覆去就好。
588,恐怖游轮,2,结果既不是悬疑也不是恐怖片。。。看结尾觉着和stay有些相似。其实吧，那女主在第一次轮回结束，明白到底咋回事后就该在下一批想登船时就跳出来阻止，即便她迟钝些，第二次轮回后她总掌握规律了吧，导演怎么总让她做些重复动作，原来是想附和西西弗斯这个主题，不是我说，也太牵强附会了，漏洞多多
589,恐怖游轮,1,KAO 完全不能理解这个伪母爱暴力脑残女做事的方式 
590,恐怖游轮,2,个人不喜欢恐怖类的 但这部不错
591,恐怖游轮,2,抄，要骂娘了，弄了半天倒是给个解释啊！Bug还这么多。
592,恐怖游轮,2,整部片的理论基础紊乱又可笑。时间交错空间重叠理论不符，把剧情意义由大化小却又失去了味道。
593,恐怖游轮,2,神经叨叨的女主角看得人心烦
594,恐怖游轮,2,每一种解释看起来都说得通.但每一种解释最终都推向一种神话色彩的过程和结局.那就是说每一种解释都说不通.一旦故事出现了神鬼的虚幻色彩.那就有无限种可能.也是就是说根本没可能.
595,恐怖游轮,1,呃。。。难道是我看的越来越恐怖了还是怎么回事，这种表现手法真的觉得有点不适合用在惊悚上。。人类永远也不能组织死神。。
596,恐怖游轮,2,就是不停的循环再循环，我实在不知道好看在哪里
597,恐怖游轮,2,麻烦放过自己好吗！别人的命也是命！自欺欺人很好玩吗？实在不行一枪崩了自己ok？看得我无限烦躁的一部片92
598,恐怖游轮,2,"看到三分之一困得睡着了的电影.导演还真是有够无聊,来回来去就这一段儿故事,你是思维枯竭,还是钱烧的?"
599,恐怖游轮,2,时空轮回的时候有一段剧情出现了很大的漏洞。。。。。。。不知道编剧怎么想的。。。
