,movie,star,comment
202,罗生门,3,凑合，跟芥川龙之介的原著没法比
203,罗生门,3,“我对人类又充满了信心” 这个信心恢复的有点快…
204,罗生门,3,要我说真正跨时代的是原著开辟了多角色多线叙事先河，而黑泽明在二战后不久便将其影像化只能说占了天时地利人和吧。
205,罗生门,3,一则寓言故事，一场话剧演出。76三人争相认罪，但都不忘维护自己的形象――强盗：征服女人且决斗战胜男人，女人：被男人目光逼迫而无意识地将其杀死，男人：原谅强盗的罪过之后自裁，保有残存的荣誉；77通过明台词揭示老生常谈的道理，毫无骇人听闻、振聋发聩的力度；78乞丐、樵夫、和尚像是强盗、女人、男人的二重身/转世。
206,罗生门,3,人性本善，所以弱
207,罗生门,3,那时候的演员真的是当之无愧的艺术家，那么热的天，那么无所谓地贴地滚爬，较之现在把卖肉当做牺牲，你们才是为艺术而奉献。
208,罗生门,3,好看是真的，黑泽明用极其简单的故事，人物，场景扯到全人类的善与恶，电影确实拍得扣人心弦，视角也取得好，但是有些台词我实在接受无能，不是很喜欢过于直白和说教。
209,罗生门,3,这部电影在电影史上的地位没人会否认，什么第一次使用长镜头，第一次bulabulabula的，这些我都不懂，毕竟我不是专业的，对于我，看电影的意义只是自己看的开心，说实话这部片子看的犯困。能从头到尾津津有味看下来的绝对是真爱！！！
210,罗生门,3,"那个年代，多线索是经典。。。“人只是以为自己诚实。”“有软弱的地方就有谎言。”“真相是,这个世界上只有事实，没有真实。叙述者越多，我们离真实越远。欲望造就了每个人内心的软弱，并且构筑了每个人利用谎言企图展现的幻像。” 
."
211,罗生门,3,Rashomon.1950.CC.REMASTERED.EDiTiON.WiTH.EXTRAS.iNTERNAL.DVDRiP.X264-KiSS revisited 2018.12.23@CFA
212,罗生门,3,扑朔迷离 当年Kim对老婆的眉毛化妆非常接受不能哈哈哈
213,罗生门,3,"人的动机是复杂的,你永远也弄不明白是否出于真诚还是出于遮蔽,有些伪装的很好让人不得不信以为真,有些暴露的透彻一目了然,然后内里的缘由究竟为何?真的很难说,我们谁也不能说自己百分百诚实,只是让自己以为诚实而已,进入内心的均为美化后的谎言.人是否能够原宥自己的软弱呢?还是大胆承认自己的不诚实?"
214,罗生门,3,跟芥川原著<竹林中>无得比。多襄丸相貌好 很中意那个女人多如乌云的头发
215,罗生门,3,期望高了，很一般嘛 不过也没办法，新电影早把老电影那点东西玩了好几轮了。   
216,罗生门,3,自己杀了人不是他们的表达想造成的效果，最多只能说他们追求的效果中谁杀了人不太重要。所谓效果，就是自己想说什么，同时想掩饰什么。因为不知道最后真相是什么，这些人各自的说法中想掩饰的内容我们只能说“可能”。就比如你看强盗他要表达的意思是自己是很了不起的，他可能主要是掩饰自己的平凡（通过樵夫的描述，强盗杀死武士几乎是个意外）；女人她要表达的是自己是很贞洁的，她可能主要是掩饰自己的不洁（通过樵夫的描述，她被歹徒强暴后并不确定跟谁走）；武士他要表达的是自己的宽容，他可能主要是掩饰自己的懦弱。这些人应该都不在意我杀了
217,罗生门,3,film history class。说不上什么感觉。想说不好看，怕别人说我不会欣赏。。。还是明天听老师讲吧
218,罗生门,3,作为“罗生门”类型片的鼻祖，地位固然重要，但有些地方拍得多少有那么点多余。争论中带出的深度台词，感觉是为了说而说，不会引起思考以及的心理效果。演员基本从《七武士》搬过来，但表现确实有差距。
219,罗生门,3,活在天朝本就是场罗生门式的故事，这远非电影所能比拟
220,罗生门,3,我不管你主题多么鲜明，立意多么崇高，作为一部电影，没什么太多能从技巧上值得太多称赞的地方，更别提吸引观众的眼球了，这样的电影也只能在鉴赏课上放了
221,罗生门,3,故事不怎么样 但是最后的话真让人悲痛啊
222,罗生门,3,印象不深刻，还不如《阳光灿烂的日子》里“可是说真话的愿望有多么强烈，受到的各种干扰就有多么大。我悲哀的发现根本就无法还原真实。记忆总是被我的情感改头换面，并随之捉弄我、背叛我。”给人的思考性强。不过年代不同，这样的关公战秦琼，没太多可比性。也许在当时算是开创性的吧。
223,罗生门,3,仅仅是一阵微风。如果没有那阵微风，也许那个男人就不会死。
224,罗生门,3,虽然是经典之作。但是我还是觉得，本来可以30分钟讲完的故事，硬是讲了90分钟。
225,罗生门,3,虽然朋友强推，还是觉得三星就够。人们美化自己行为的倾向，这并不是什么多深刻的东西。表演什么的也欣赏不来。拍摄手法加上音乐倒着实值得上三颗星。
226,罗生门,3,所以从很早前我就明白人类的情感是多么强大而寂寞。沉闷的片子。
227,罗生门,3,好像一部小品。可是没有看懂啊。。大家说谎了？为什么会说那种谎呢？
228,罗生门,3,故事的创意是可以的，就是可能是老片的关系，演员演得夸张到搞笑，过场长的可以，影片中至少有一半时间是里面的人在跑来跑去
229,罗生门,3,"2011.1.22

久仰。但是总觉得演技很刻意。灯光也打得很不自然。结尾莫名其妙的温情。突兀。生硬。"
230,罗生门,3,真相有那么重要吗？就算每个人承认自己脆弱说谎有罪，又能如何，难道就能获得拯救？戳破那层窗户纸还让人怎么愉快的玩耍。
231,罗生门,3,抛去原著来说 几个角度的连接凑的很勉强生硬 最后的一丝光明有点做作 要和芥川的比 能把竹林中和罗生门变成这样还算不错 基本抓住要点 但是远比不上 不过演员基本都很赞
232,罗生门,3,芥川龙之介《竹林中》到了黑泽明这竟成了《罗生门》，大师的脑袋是如何实现标题概念偷换的呢？再创造使小说原本没有给出真相的悬案变成了电影中的“真相只有一个”，弱化了“恶”，给予了“光”。芥是真残酷，黑是退一步。“文学作品的魅力之一，也许就是可以被误读。”莫言胖老头儿这句说的不错。
233,罗生门,3,"道理讲的不错，可是我很想假设，如果是国内的小人物拍出这么一部片，下场会是怎样？呵呵。的确，我们永远不知道真相，如同大话西游的隔夜红一样。

另外我还在想，男人究竟能凭借什么让女人喜欢？也许这是个永远没有答案或者处处是答案的问题。sigh"
234,罗生门,3,因为黑泽明、川岛龙之介，忘了是大学时还是高中时看的，反正当时没看懂还打瞌睡，后来也没再看了。不好评价
235,罗生门,3,四个版本的故事互有交叉、各有疑点，这世上是否存在未经改造的事实？
236,罗生门,3,剧情确实经典，但是黑白电影还是不习惯。。。
237,罗生门,3,这是一部不适合拍成电影的作品，它注定只能以小说的形态存在。节奏拖沓，气氛渲染过头变成搞笑片，在那个年代被奉为经典我无话可说，可放在现在，它真的不能说是一部好片子。
238,罗生门,3,一个樵夫走啊走啊走啊走。天仙女 神马的。作为 刑诉法 科教片儿给我们看了。
239,罗生门,3,丫的，好好一个短篇故事拖拖拉拉的演了一个半小时，原著的意味也少了一些，我真服了，竟真有人拍大腿的说好。要我说，还是原著好一些，起码不会把你大把时间浪费在那所谓人性上，不就那么点狗屁东西吗？
240,罗生门,3,舞台剧一般张牙舞爪，完美的构图和走位。还魂一幕好吓人。
241,罗生门,3,我觉得剧情和各种拍摄手法是现在司空见惯的。但在电影史上有重要地位
242,罗生门,3,三个当事人都隐瞒和篡改了对自己不利或者丢脸的部分，樵夫对调查者隐瞒了目睹这事儿，就这样
243,罗生门,3,看完简介，当做悬疑片来看，结果很失望。。。。
244,罗生门,3,初中时看了芥川龙之介的《竹林深处》，大一念社会心理学老师推荐这部电影，当时觉得拍得不好，比起小说差很远。
245,罗生门,3,每天都有人在感慨人性，每天有更多人做着没人性的事。
246,罗生门,3,六十多年后的现在看来不觉得很牛逼
247,罗生门,3,不错的尤其想想这是60年前的片子，正值战后的日本~确实是大师的作品~感觉上东方人确实相比西方人更加虚荣一些，不愿意坦然面对自己的软弱，骗了别人，甚至连自己也信了自己的谎言了~这片子肯定影响了一代又一代的导演，只不过现在这个年代回头看确实有点审美障碍了。。。
248,罗生门,3,我出戏了。音乐一起我就会想到《波莱罗》，然后是一部关于新干线的纪录片里用《波莱罗》衬托列车登场，然后会重复默念《波莱罗》的节奏，然后想起爹地早年间的盗版CD，就从那儿听的《波莱罗》。后来，一直没进戏。
249,罗生门,3,看不下去阿~~为什么大家都说好呢？小日本都死光了吗？就不能找几个看得过去的演员？
250,罗生门,3,不得不说 对牛弹琴了……光影剪辑什么的分析不来啊 只知道故事讲得还成
251,罗生门,3,经典作品，但似乎当年的节奏以现在看来，慢了点。。。
252,罗生门,3,"090204@home,演员演得真好，但是实在是无法忍受这种风格..."
253,罗生门,3,旗帜一般的电影。。。其实我很难看下去
254,罗生门,3,"1、60年前居然能拍出这样的电影，真是让人由衷钦佩。但是作为现代的观众，此片的创意已经显得不那么新鲜了。
2、三船敏郎不错的。
3、那时候日本女人的扮相真恐怖，那俩块儿眉毛，拍恐怖片不用化妆。

"
255,罗生门,3,人的言论都会以自己的主观角度来解释看到的世界．如果事件有自己作为参与者，当然能尽可能的美化自己是最好的．人性本来就不完美，那谎言也就有善意与恶意之分了！　有些冗长和无聊，但总体还是发人深省的！
256,罗生门,3,住在罗生门这儿的鬼因为害怕人类的凶残而逃走了。
257,罗生门,3,大不g我的菜 或死或都g一N交代。
258,罗生门,3,还行，比七武士还是差远了，总觉得太过于躁，而且最后我总觉得结尾那个樵夫会把孩子卖掉，如果结尾是这样，我觉得会更震撼人心。
259,罗生门,3,"Z z z z z z z z z z z....... 嗷 我好佩服自己的毅力啊  嗷 我就是肤浅怎么着~
PS:女猪确实蛮美的，演技不赖~"
260,罗生门,3,对黑泽明的观感不是五体投地这大概还是第一次，是不是因为把人心看得太通透，此类寓言纠结的那些东西对他而言反而显得Petty了？
261,罗生门,3,台词堪称经典。看到最后强迫症的我居然觉得没必要再知道真相究竟是怎样的了，正如那句：撒谎是人之本性，在大多数的时间里我们甚至不能面对自己的诚实。最后我都无法想象农夫会对小孩做出怎样的事情，是善是恶？和尚的叙述就一定是全部真实的么？所谓人性啊~（加上这一句是不是我就化身社会学家了？）
262,罗生门,3,两分给芥川龙之介 一分给黑泽明做面子分吧。。实在是无法恭维小日本的演技和性格。。。。。只觉得可笑。 S   B  .............
263,罗生门,3,摇摇欲坠的罗生门，却有着与现状不相称的恢弘结构。正如被编造谎言和相互攻讦所伤害的事实本身，动摇了信仰人心向善的根基，直击人性深处的懦弱与虚伪。但最后黑泽明导演还是留下一个光明的尾巴。镜头语言充满美感。
264,罗生门,3,为什么我觉得好几个地方都有点濉！
265,罗生门,3,日本近现代文学和影像文化的课上看的。黑泽明对芥川龙之介作品的解读确实是非常好，也很巧妙地把『_生T』和『の中』结合在了一起。但是大概还是年代久远和自身太肤浅的原因，那时候电影的演绎方式我还是欣赏不了
266,罗生门,3,日本人的审美是不是有问题。真的……没什么感觉啊……((((*17_17)_（不过男主倒是真的很拼呢）
267,罗生门,3,看完我就开始回想每个人的说法。但最后我们也不知道事情的真相是神马。开头有些故弄玄虚了而且节奏有点拖沓，但确实是那个时代的惊世之作了20120716@gz我要上研我要评中级
268,罗生门,4,受不了这莫名其妙的神经兮兮，但剧情确实有深度。
269,罗生门,3,开山之作，介川的原作啊，呵呵
270,罗生门,3,Top250#62。片子太古老了，没看懂
271,罗生门,3,我觉得是樵夫杀的。。
272,罗生门,3,有软弱的地方就有谎言。
273,罗生门,3,盛名之下其y副。跟七武士相比差h了。【赡旰蟮2016年9月，我K于明白了_生T什麽是影史的作品了，五星！】
274,罗生门,3,欣赏无能啊。。。强盗是悟空转世么，一直跳来跳去，抓耳挠腮。。。
275,罗生门,3,听过太多不同叙述后，判断力被迷惑，即使最终听到真相也不会相信。像当下被媒体真假交织信息搞晕的民众，无数次被证实遭到愚弄，很多人已经学“聪明”了，一律不信。摸不准结尾是重塑人性光辉还是更深的讽刺。叙事方式当时很新鲜，现在看也不觉得多好，日式的夸张挺招人烦的，无法欣赏。
276,罗生门,3,本以为会是探讨叙事主观性的一大杰作，但涉及人性后主题不可避免地向自私、谎言之类倾斜，两者也说不上孰优孰劣，只是没有想象中那么喜欢。
277,罗生门,3,无论原著还是电影，看起来都难以接受
278,罗生门,3,太混乱了 不仔细看 结局 是很么 根本不了
279,罗生门,3,一千个人的眼中有一千个哈姆雷特，不管哪种结局，强盗都强暴了妻子，妻子都很浪荡，丈夫都很无能。
280,罗生门,3,恕我浅薄 实在觉得比较一般
281,罗生门,3,12/50。自私的人，才最快乐；世间无真相，谎言恒流传。用欺骗掩饰人性软弱，多视角无真相诠释故事。片子太老，虽然经典却无法弥补它的老态龙钟和节奏缓慢。黑泽明是高中订阅南方周末时，接触到的大师，但我以为经典，应永不褪色，应永憾人心，而非这部电影给我的感觉。
282,罗生门,3,每个人都为自己着想 每个人都在隐瞒真实的情况 每个人都有不同的故事
283,罗生门,3,看来“信任”是人类永恒的主题之一 但是谁说的是真的呢 不过是为自己的利益添油加醋吧
284,罗生门,3,又是一部难看的黑白电影，还什么开山鼻祖。具备丑陋人性特质的人才看得懂。
285,罗生门,3,每个人都隐藏了自己不道德的一部分，把真实改编为利于自己的故事。强盗隐藏自己软弱的一部分，妻子隐藏了自己愿意变节从于强盗的一部分，武士隐藏了自己嫌弃妻子的一部分。看完《罗生门》倒不能说自己心情特别好吧，也没那么沮丧。比看《巴别塔》之后稍好一点。还是烦，诶
286,罗生门,3,我知道很经典…但我真的佩服每一个看得下去的人…
287,罗生门,3,黑泽明的怪力乱神真没觉得有多大意思
288,罗生门,3,真的是我头脑简单吗 怎么都给这么高的分数 我真的很无语 不喜欢黑泽明这样表达他的深刻 觉得无趣。。。
289,罗生门,3,太磨叽，很多地方磨叽得没必要。这部电影真是鼻祖，越到后面越有趣，可还是太磨叽。
290,罗生门,3,"Woman is horrible, but it's more horrible to be a woman. "
291,罗生门,3,寓意还是很有哲理的。结尾看那表情，我还以为孩子是和尚的呢…但是，尼玛日本人和法国人拍的片子，我是永远欣赏不了的。
292,罗生门,3,说实话我可没耐心看完- -
293,罗生门,3,那女的长得跟裘千尺似的，怎么这么能惹事儿啊。这种据说很经典很深刻的片儿我以后还是少看为好，太艺术了，欣赏不来。
294,罗生门,3,那女人的尖叫太可怕了！
295,罗生门,3,imdbtop250和豆瓣top250里的日本名片，看完感觉一般般了，讲的就是人性自私说谎的一面，跟另外一部名片生之欲感觉一样，娱乐性一般般啦。
296,罗生门,3,芥川的小说不错，可是剧情实在是太拖沓了。。。
297,罗生门,3,很久以前我叫了一批同学一起看这部名片，大家兴致勃勃地来了，最后电脑前就尴尬地剩我一人。
298,罗生门,3,老片重看。真奇怪，当年我是如此热爱此片，惊叹于黑泽明的天才。可是如今却一点也说不出这片的好来。
299,罗生门,3,疯了。。我看不懂= =
300,罗生门,3,恕我浅薄 实在觉得比较一般
301,罗生门,3,12/50。自私的人，才最快乐；世间无真相，谎言恒流传。用欺骗掩饰人性软弱，多视角无真相诠释故事。片子太老，虽然经典却无法弥补它的老态龙钟和节奏缓慢。黑泽明是高中订阅南方周末时，接触到的大师，但我以为经典，应永不褪色，应永憾人心，而非这部电影给我的感觉。
302,罗生门,3,每个人都为自己着想 每个人都在隐瞒真实的情况 每个人都有不同的故事
303,罗生门,3,看来“信任”是人类永恒的主题之一 但是谁说的是真的呢 不过是为自己的利益添油加醋吧
304,罗生门,3,每个人都隐藏了自己不道德的一部分，把真实改编为利于自己的故事。强盗隐藏自己软弱的一部分，妻子隐藏了自己愿意变节从于强盗的一部分，武士隐藏了自己嫌弃妻子的一部分。看完《罗生门》倒不能说自己心情特别好吧，也没那么沮丧。比看《巴别塔》之后稍好一点。还是烦，诶
305,罗生门,3,又是一部难看的黑白电影，还什么开山鼻祖。具备丑陋人性特质的人才看得懂。
306,罗生门,3,我知道很经典…但我真的佩服每一个看得下去的人…
307,罗生门,3,黑泽明的怪力乱神真没觉得有多大意思
308,罗生门,3,真的是我头脑简单吗 怎么都给这么高的分数 我真的很无语 不喜欢黑泽明这样表达他的深刻 觉得无趣。。。
309,罗生门,3,太磨叽，很多地方磨叽得没必要。这部电影真是鼻祖，越到后面越有趣，可还是太磨叽。
310,罗生门,3,寓意还是很有哲理的。结尾看那表情，我还以为孩子是和尚的呢…但是，尼玛日本人和法国人拍的片子，我是永远欣赏不了的。
311,罗生门,3,"Woman is horrible, but it's more horrible to be a woman. "
312,罗生门,3,说实话我可没耐心看完- -
313,罗生门,3,那女的长得跟裘千尺似的，怎么这么能惹事儿啊。这种据说很经典很深刻的片儿我以后还是少看为好，太艺术了，欣赏不来。
314,罗生门,3,那女人的尖叫太可怕了！
315,罗生门,3,imdbtop250和豆瓣top250里的日本名片，看完感觉一般般了，讲的就是人性自私说谎的一面，跟另外一部名片生之欲感觉一样，娱乐性一般般啦。
316,罗生门,3,芥川的小说不错，可是剧情实在是太拖沓了。。。
317,罗生门,3,很久以前我叫了一批同学一起看这部名片，大家兴致勃勃地来了，最后电脑前就尴尬地剩我一人。
318,罗生门,3,老片重看。真奇怪，当年我是如此热爱此片，惊叹于黑泽明的天才。可是如今却一点也说不出这片的好来。
319,罗生门,3,疯了。。我看不懂= =
320,罗生门,3,期望值太高，难免失望。三星半
321,罗生门,3,世界真想不可言说  （足已）
322,罗生门,3,欣赏不来。。。但是叙述角度很新颖！每个人说的话怎么可能都是真的呢？这很正常啊，而且最后，砍柴人说谎其实很符合人性啊，剪了匕首换钱或者自用都很合理，没必要因为这点就看不起任何人！这就是人，就是人性！最后他收养了弃婴，其实说明本性是善良的，而且他吐露他其实是旁观者也说明他内心自己的抗争！只不过剧里女主角才是真正的挑起事件人。还有在日本也有鬼魂上身的引人啊，原来这些东西都是互通的。这能不能从侧面反映其实鬼魂是存在的呢？不然为什么那么多国家，都有相似的一套迷信？
323,罗生门,3,文n老放的，日本女人的眉毛一直我出颉
324,罗生门,3,前段时间看了一个理论，说是人类的记忆也是和事实会有偏差的。这就是为什么很多人斩钉截铁地描述一件事有可能不是真的，甚至是他们在“无意识地说谎”。这个世界上几乎没有人认为自己是个坏人，这也是为什么我觉得最出彩的是那个乞丐。他居然可以直视自己的恶，让人惊诧。
325,罗生门,3,.....黑泽明自己加的那个故事很有趣....但是人物性格不太合理
326,罗生门,3,终于知道一种电影结构，终于知道鼻祖之作的意义所在。
327,罗生门,3,技g上光的\用的_超前，但是@拥墓适滤坪K]有特e的新意？
328,罗生门,3,好吧。。是不是我对这种需要发掘的人性本恶说已经不是太感冒了。。。各种内涵审美疲劳么。。。这个片子可能当时的确牛逼 但是现在看貌似还是有点一般了。。。
329,罗生门,3,女主角太丑了。。。每个人都有逃避自己丑陋一面的天赋。。。
330,罗生门,3,我承认它的影响，承认观看的重要性，认为主题具有普世价值，我也做了他的论文，不过电影本身就90分钟却让人感觉3个小时，我也不喜欢演员的表演风格。
331,罗生门,3,现在看起来很普通= =
332,罗生门,3,表情造作，动作夸张，台词卖弄。但一部片开了一个门派。
333,罗生门,3,"可能是我太粗俗了

我不过是不明白有没有必要这么一惊一乍"
334,罗生门,3,叫声、呼吸声、风声、雨声……
335,罗生门,3,大屏幕修桶婀塾啊充满前瞻性的叙事手法和人性价值观，在黑泽大岛还没有真正走进大师级行列之前的个性荒诞尝试，经典性毋庸多说，后人无数次在他阴影下乘凉
336,罗生门,3,可能在五十年代看会很震撼，但是现在看来，实在是太冗长了，困死了
337,罗生门,3,【电影课】注意力全部集中到奇怪的地方
338,罗生门,3,这次看了才知道这已经是姐看得第二遍了 姐年轻时候原来就能沉得下心看大师的片子啦
339,罗生门,3,是不是从那时候起，电影就开始揭露人性的丑陋呢？我很久以前就听说了这部电影，刚刚看完，觉得没什么感觉，不就是说人们为了自己的利益而撒谎吗。看电影里的和尚和樵夫都那么困惑和痛苦，我觉得太夸张了。可能是我现在无法理解那个年代的背景吧。反正到没觉得深刻或是怎样。
340,罗生门,3,是不是从那时候起，电影就开始揭露人性的丑陋呢？我很久以前就听说了这部电影，刚刚看完，觉得没什么感觉，不就是说人们为了自己的利益而撒谎吗。看电影里的和尚和樵夫都那么困惑和痛苦，我觉得太夸张了。可能是我现在无法理解那个年代的背景吧。反正到没觉得深刻或是怎样。
341,罗生门,3,挺有深度 但是太慢 故弄玄虚 不喜欢
342,罗生门,3,感觉一团乱 几条线 叙事有创意 单从观赏角度 不好看
343,罗生门,3,"黑泽明的成名作
日本电影的成名作
高一的时候语文老师放给看的
总觉得他是个喜欢装作自己很厉害的人
于是这片子也看不大懂..."
344,罗生门,3,每个人都在掩饰。武士和强盗掩饰自己的懦弱，“炫耀”臆想中的准则与气概；女人掩饰自己的不贞洁，强调丈夫的遗弃；志村乔自我欺骗，不敢面对自己与前者本质相同；偷走和服之人看似看穿一切，也不过是通过指责他人的罪恶逃避自身的罪恶。结局是希望。
345,罗生门,3,日本女人太丑，跟鬼一样
346,罗生门,3,这世界 小人活得最好
347,罗生门,3,时隔半个多世纪去评价一部电影，无法做到公允……BTW，过去日本女人的画眉毛方法好诡异
348,罗生门,3,"但那是因为人们太脆弱了所以才撒谎
甚至是对自己撒谎"
349,罗生门,3,每个人都有自己的故事版本，这个现在已经在电影里用了很多了。最后樵夫版本感觉依稀看到了一点女权主义萌芽意味，男人在其中甚至更加软弱。可能是年代差异问题，现在看最后的结尾还是说教意味太浓了，不然就打四星哈哈哈
350,罗生门,3,看因低素质而丑陋的人，请来中国        看无论高低素质依然丑恶的人，请去日本             丑陋的人总觉得自己会变美，丑恶的人总认为自己是善良
351,罗生门,3,人性是值得探讨，但是影片实在太老啦！
352,罗生门,3,因为是黑白的，所以我有点没有耐心◎
353,罗生门,3,小说更让我惊讶   那时候的电影似乎会把人与人之间的眼神 对视 和沉默作为一种表现人物心理的手段   不是我喜欢的那种夸张演技 可惜
