,movie,star,comment
354,罗生门,3,一般，人本来就是自私的。不过很多东西很朴实，是看多了科幻片这种片子不和我口味罢了。女人的眉毛太在意了，以至于不能好好的看片子，丈夫对于侮辱妻子的恶人居然能够原谅，这个观点太奇葩了。汗兹兹的脸，破烂的衣服，斑驳的树荫，感觉挺真的比现在大多数战火纷飞却很干净的游击队好多了三星半
355,罗生门,3,虽说片糙理不糙，但是看得有点闷啊
356,罗生门,3,最聪明的出世术是，既对世俗投以白眼，又与其同流合污。
357,罗生门,3,那天见到了来宁波的第一场雪。也是隔了12年之后的第一场大雪。
358,罗生门,3,好像又看了一遍张艺谋的《英雄》
359,罗生门,3,大师作品，揭示丑恶人性
360,罗生门,3,陈述者难免都要带主观情绪，偏偏守教者想要信任每一个，所以只好被善念搅扰到动荡不堪。哪有那么多拿捏得出的棱角，真相在被揭示时始终会变圆润。（但是选角太差了，那些丑女人让我完全没勇气全屏，所以三星。）
361,罗生门,3,"真有这么好？把黑泽明仨字去了，再评评看？特别不喜欢里面和尚最后一句话：多亏了你，让我保存了对人类的信心。能不能再做作点？Don't tell me, show me. 多年之后，或许只能记得里面的笑声。"
362,罗生门,3,对于非电影专业的普通观众，以今天的眼光看真的很一般，因为我们已经看过太多比这牛逼太多的关于人性丑恶的故事。这部电影于今天的全部意义也就是罗生门式的叙事手法了。
363,罗生门,3,罗生门一词出自日语，现在通常指：事件当事人各执一词，分别按照对自己有利的方式进行表述证明或编织谎言，最终使得事实真相扑朔迷离，难以水落石出。
364,罗生门,3,刚从白雪公主过来才发现前者真的是致敬黑泽老师啊。台词不多纯靠演技推动剧情发展，不过可以想象此类型的片子在1950年可算是史无前例独创一格。比鬼更为可怕的是人心，在这个案件里谁又是绝对无辜的呢？这样的结尾也许也是对观众的一种救赎吧……（不行多襄丸和武士的打斗戏虽然好真但是太好笑了……
365,罗生门,3,20101003 呃 我懂你的意思 但是没觉得电影好
366,罗生门,3,one scene that a dog came from a  cave  bited the man
367,罗生门,3,电影最后，在晴天之下，人们似乎才看清了一半残破一半却仍伫立的罗生门的全貌。So textbook.
368,罗生门,3,看来黑泽明不是我的菜。
369,罗生门,3,毕竟是1950年的电影，的确已不是个新奇的故事了。倒是唯一的女子在真实故事中表现出来的烈性是故事里的亮点，在1950年的日本，实属不易。
370,罗生门,3,好片就是它能够跨越一个时代的思考，很能理解为什么被称为经典的理由，但以现在的眼光看实在很讨厌这种浮夸中二的表演
371,罗生门,3,黑泽明将人性的黑暗展现给人们看，幸好最后还看到一点希望
372,罗生门,3,这是一部探讨人性、欲望、生存、真实的电影。不会编织谎言的人，经常受困于真相，无法成为生活的艺术家。当遇到自己不想面对的真相，人们除了用谎言掩盖，还会说难得糊涂。纯粹抑或迷糊，哪一项才是生活的本质？砍柴人选择了承认真实的自己，回归纯粹，你呢？
373,罗生门,3,伟大的一部电影 思想永垂不朽 但放在今天 弱爆了了一些镜头还是无可避免的暴露着科技不发达时电影技术的局限性
374,罗生门,3,没有提供更多的营养，这种手法已经老套了，
375,罗生门,3,以现代的眼光来看..主题思想和叙事结构给3星...以1950年的眼光...我不知如何评价……节奏真够慢
376,罗生门,3,这个世界没有真相，只有立场
377,罗生门,3,所谓的经典电影得趁早看
378,罗生门,3,真相竟有一丝女性主义的升华 这我没有想到
379,罗生门,3,其实我觉得还不如看小说，电影好嗦。难怪我每次看小说《罗生门》都觉得跟我理解的「罗生门」不一样，原来根本就不是一回事，电影改编自《竹林中》，那导演对罗生门这个词是有多大的执念啊98。《竹林中》这篇我也看过，但是电影跟我的记忆也是不一样，我记得是强盗看上女人，绑了男人，强奸了女人，强盗要带走女人，女人说要跟活着那个走，接着打斗后一死一伤，女人干掉伤的那个就跑了98。我的记性也是够够的…
380,罗生门,3,都说是一部改变电影史的影片 可能的确有他独有的意义在 分段式的4段叙事、高速的拍摄镜头、连贯的剪辑、以及故事本身所要揭示人性的一面 就是这种片子看的会有些累 如不真爱电影就算了吧
381,罗生门,3,将女人 塑造得 如同 妖孽！ 台词 恶意 中伤 女性！ 3星 是 给 快速跟拍 和 蒙太奇 的！
382,罗生门,3,这也许是一部牛逼的电影，但并不怎么好看。。。大家不吝赞美的把五星给大师，说他如何深刻地在电影里讨探人性并开创了一种奇特的叙事手段，其实这样类型的佳片层出不穷，只能说，电影赢在时间上吧。。。
383,罗生门,3,说理性太强，主题是好的，但是故事本身没有吸引我的地方
384,罗生门,3,又是一部探讨人性的电影，对黑泽明不感冒。不知道为何评价如此之高，也许是1950年的关系吧
385,罗生门,3,如果有真相的话，在对一个真相的不管是否带有私利的撒谎的解释中，事实变得越来越模糊了。在这方面，我们只能借王小波转罗素的那句话来聊以自慰，即：参差多态乃是幸福之本源。这时候，真相不重要了，重要的是人们为什么要那样去解释。不知是悲是喜，小孩在罗生门中诞生，又要在谎言的包围中体验世界。
386,罗生门,3,空有说教，形式乏味的电影不是好电影
387,罗生门,3,又一部被过度夸大的电影，我不知道那个时候的日本电影总体来说水平如何，但从现在的角度来看，这部片子实在谈不上经典，剧情简单枯燥，演员表现用力过猛，疯疯癫癫，简直就像是舞台剧，唯一出彩的地方就是配乐，别的地方都实在平庸单调。
388,罗生门,3,真相从来就是拼图游戏。
389,罗生门,3,很简单的一个故事，怎么理解，看个人。引用介绍：真相只得一个，但是各人提供证词的目的却各有不同。为了美化自己的道德，减轻自己的罪恶，掩饰自己的过失，人人都开始叙述一个美化自己的故事版本。
390,罗生门,3,残酷的真相！有软弱的地方就有欺骗，你，能接受真相吗？
391,罗生门,3,开头技巧惊人，但整体粗糙的一部电影。前面精心构筑的罗生门故事其实蛮中二的，完全是“做戏”的感觉，和尚的人设形象假到不行。真懂所谓“罗生门”道理的人，看到一半会笑，搞半天，你给我看这个？导演做戏，做得再严肃较真，观众也只是看戏，聊起人性来，总像在谈外星人或者历史人物。最精彩的是开头和结尾的几分钟时间。结尾老农夫金句，“养六个和养七个一样辛苦。”人性深度方得彰显。没有最后五分钟，这部电影会很废，但终究还是有的～
392,罗生门,3,原来日本武士和强盗搏斗这么菜哦~
393,罗生门,3,充满戏剧张力的划时代之作，虽然处在冲锋枪的时代观赏大砍刀让人觉得不够震撼，但是可以想象的到这把刀是那个冷兵器时代的巨人。
394,罗生门,3,立意很好 具有时代意义 但是这耸人听闻的铺垫 这缓慢的剧情推进 这嗦的叙事 这浮夸的演技 强盗的笑声和女人的哭声 听得脑壳疼 
395,罗生门,3,“软弱的人作恶最深”看完黑白画面的影片不由自主想到这句话。每个人都在为自己的行为找借口，而好像每个人都是有自己的理由。黑泽明的电影我看得不多但是盛名在外，与我之前看的一部共同之处都是用音乐和环境来制造氛围，而这氛围，多半是诡异和悬念交叠，会感到剪辑的奇妙和配乐的精妙所在。
396,罗生门,3,我只关心性爱-4/18/18 at MoMA
397,罗生门,3,罗生门成了一个典故，也成了一种行为的代名词
398,罗生门,3,总觉得黑泽明太直白
399,罗生门,3,People's lives are similar to young girls
400,罗生门,2,照二十一世纪的眼光来看，这部片子挺大惊小怪 
401,罗生门,2,30分时看了一下进度条，56分右手强烈想点关闭的冲动，但想到很多经典电影也这样，前面大段缓缓的平铺直叙，精华啊彩蛋啊往往喜欢埋在片尾，我挺到了最后一秒。结果，看了一出浮夸的黑白舞台剧嘛这不是，8分钟的故事生生拖成88，还硬要强加各种哲学解读，是我境界不够？太俗没文化欣赏不了大师的艺术？
402,罗生门,1,不爱看老片的根本原因就是大多演员的表演都异常浮夸，此片尤甚。破老头都亲眼目睹了还得劲地苦思冥想？不想惹事上身干嘛还引这个话题？莫名其妙！！甚至居然连鬼魂都出来了？有完没完！！
403,罗生门,2,商业片是垃圾，那么这种非商业片呢？？也同样是垃圾。看完除了一句【穷山恶水出刁民】之外，你只能觉得被浪费了1小时人生。不能给观众带来享受的电影就跟不甜的糖一样，除了垃圾之外你找不到其他的词来定义这种东西。
404,罗生门,2,一只南美洲亚马逊河流域热带雨林中的蝴蝶扇动几下翅膀，引起了日本的一桩命案。
405,罗生门,1,悲剧，实在不喜欢这片子。众人不断回忆凶杀案现场情景让人受不了
406,罗生门,1,看了这部电影后，失望之极，远没有当初看芥川龙之芥作品的那种震撼。记得大学一个老师说过，小说最失败的地方就是在书中用过白的语言把宗旨点明，电影中就不时的点明，而且叙述环节并没有书中那种环环相扣，时实时虚，但是又分不清哪是实哪是虚的感觉，反正感觉电影很失败，想必非常喜欢的人是因为没有
407,罗生门,2,这尼玛.....女主角这么丑还引谁犯罪啊
408,罗生门,1,人物表演用力过度，台词夸张得让人厌恶，剧情庸俗无奇。本年度第一部看完之后影响情绪的烂片。
409,罗生门,2,在同时代比较都只能说很有特点，不能说好
410,罗生门,2,挺没意思的。导演希望人类是怎样的呢？不然挑十件导演自己的糗事，甚至是不能说的事，自己来叙述看看，你能完全客观？对于人类来说，在牵扯到自身利益的情况下，要100%完全客观的去陈述事实，基本是Mission Impossible。这么要求别人，有意思么。
411,罗生门,2,"看不太懂……
看来年代太久远了……
或者我理解力比较差……"
412,罗生门,1,薛定谔的猫是生是死，在第二天看到之后就没有意义了。同一个事件给出几个人的不同描述，同时每个人都认为自己是对的。那么就没有意义了，因为事实是必然有人说谎，同时演技比较好。
413,罗生门,2,果然是不喜欢“经典”“名著”“名家”，可能是因为太肤浅。
414,罗生门,2,1950年拍出这种电影，可以对黑老师点一个赞。但影片可观性较差，只是为了说明人是自私的，互不信任的。电影最后那个樵夫的一笑，真是诡异的很。
415,罗生门,1,就这狗屁玩意？屁大点事
416,罗生门,2,那女的喊了好久的亚麻跌
417,罗生门,2,通过几个神经病来揭示人性的丑陋 无语~~~
418,罗生门,1,恕我直言，现在看来真的过时了。情节极其幼稚。
419,罗生门,1,我真觉得这电影就是个流水账
420,罗生门,2,难道看过的人真的都认为这个片那么牛么？是不只要说不牛就显的自己境界很低？口不应心的真是跟剧情挺暗合啊！
421,罗生门,2,历史太久远了，实在看不下去
422,罗生门,2,https://www.bilibili.com/video/BV1sE411A71K晚上看的，非常无聊，不吸引我，看得我都快睡着了。要不是因为分高，我才不看呢。很多噪点。女主长得不好看，很凶悍的样子，眉毛很奇怪。打斗不精彩，闹着玩一样，没有观赏性。撒谎是人之本性。女人爱利用她们的眼泪来愚弄众人，甚至愚弄自己。女人爱的是充满激情的男人。在这个世界上小人活得更好。张艺谋、斯皮尔伯格、卢卡斯都是他的铁粉，他是“大师中的大师”，导演黑泽明的电影世界https://www.bilibili.com/video/av35483258
423,罗生门,2,很普通的故事，到底好在哪呢
424,罗生门,2,文学概论课。不喜欢
425,罗生门,2,大师是给专家研究的。不是给大众口水的。
426,罗生门,2,出其不意！说大失所望不如说瞠目结舌，被每个人做作而怪异的表演方式弄得丈二摸不着头脑，哎不说了，不知道会不会有人跟我一样看他们表演像吃苍蝇一样。其实表达的东西还是很有力道的，关于人性的解读，不论是在四十年代的日本，还是当今整个社会，都一样鲜活见骨。更别提开辟的“罗生门”指代之说了。
427,罗生门,2,无聊。这不过就是给了时间地点人物事件，然后编故事罢了。真高明的人，会把每个人的不同陈述，相互暗示，揭露大体的真相，那样才算高标。
428,罗生门,2,"切列啊～撒度啊～受不了啊～有毛病啊～
践踏女性尊严啊～"
429,罗生门,1,我觉得不是我看不懂  也没什么看不懂的  一部电影拍出来就为让观众关注看不懂所以就能成为好片了吗  肯定不是  所以以现在的眼光看里面的电影语言或者剧情 这部电影还真是跟伟大没半毛钱关系  日本人的行为动作总是让人觉得恶心 烦到不能再烦 变态
430,罗生门,1,奏慢又沉，大失所望。希望心C婊被支解_膛拿去酰”斫o尚牵榱诵C婊再p一w星...... Y尾救回一w星~尚墙Y案。
431,罗生门,2,果然看不了老片
432,罗生门,1,唉！！！完全傻了，这电影到底想要表达什么呢？
433,罗生门,2,人性的灰色地带。。。电影现在看表演太过了
434,罗生门,1,我都要看睡着了 急得死 不晓得经典在什么地方
435,罗生门,2,拍摄手法还不错，场景少得可怜。人物太丑。情节拖沓。日本电影太恶心了。
436,罗生门,2,欣赏不来。。对于这种经典老片，不知道是不是因为代沟的缘故，现在看来也没有那么传奇……
437,罗生门,2,故事讲是讲完了 可是坑似乎忘记埋了 前面三人为什么要在损害自己利益的状况下撒谎？受不了的长镜头 果然看不来这种电影
438,罗生门,2,我的内心毫无波动，甚至还想笑。不过核心议题在经历了一些事以后觉得还是挺有趣的，只要存在零和游戏就避免不了。
439,罗生门,2,这么简单一事儿真能挖掘，真能升华。。。
440,罗生门,2,说我思想觉悟不够高也好，就是喜欢不起来这部片子。
441,罗生门,1,这是一部伟大的电影，却很难让我喜欢！“一个人若不自私，怎么可以在世界生存”“人人都在说假话，人人都在伪装”，现实生活已经如此艰险，我还是更期待看到温暖人心的作品。若大家都互不信任，这世界会变成冰窟。
442,罗生门,2,说实话 实在有点失望 任何一部企图完成一种智力游戏 逻辑游戏 道德审判、道德辩论 或者其他社会心理学实验的电影 都不能称其为一部优秀的 具有现代性 电影性的艺术作品，社会批判不能取代生命批判 唯一的亮点反而是在日本大男子主义下女性角色令人震惊的奴性
443,罗生门,1,二逼电影，一般来说我讨厌所以号称探索了人性的装逼电影
444,罗生门,1,你要是第二遍看，你也会打一星，哪怕你第一次给五星，这又是部被豆瓣欺骗的电影！电影主题空乏做作，细节漏洞百出，人物表演用力过火，导演跟成名后的大多数人一样，故作高深，又执迷不悟一意孤行。
445,罗生门,2,女主角太丑。。。神婆更丑。。。没有眉毛的女人 太吓人了 留下心理阴影了。。。
446,罗生门,2,四个故事里人物关系与行为逻辑都趋向于崩塌，无力交织出一个真正充满谎言直指人心的迷宫，显非成熟的剧本。
447,罗生门,2,实在看不懂
448,罗生门,2,还好是50年度的。。。前半部我在研究那女人的眉毛，后半部我还在研究那女人的眉毛。
449,罗生门,1,可以和地道战媲美的无聊之作》。。
450,罗生门,2,没啥意思，哲学问题看书好了，排成电影还是拍好看的故事。
451,罗生门,1,装逼遭雷劈
452,罗生门,2,真是受不了黑白电影..
453,罗生门,2,难看死了，我欣赏不来黑泽明的美学。今天在放映厅看到睡着，就听见片子里面传来女人的嚎叫= =|||不但不相信里面任何一个人，连电影导演我也不信……
454,罗生门,2,"好老好老的片。看过最老的日本电影。第一遍弃，第二遍坚持看完了。女主挺丑，男主还把她视为女神……犯人我最开始的猜想是，排除掉了强盗，觉得凶手是女人。结果……一开始凶手就自己招供了，有点不走寻常路的悬疑片。

ps.神婆那段，虽然说是艺术手法，但还是感觉到有点扯。

需要耐心，还无聊的电影。"
455,罗生门,2,不喜欢，一切都太做作、太直白、太形式化。台词直白得看得尴尬，真正好的电影是通过故事让观众感受到道理，而不是通过简单的台词说出来。再者，这种题材本身也挺老生常谈，说人性阴暗也并没有挖得很透，只是表面略过罢了。
456,罗生门,2,没觉得多特别。对我来说，黑泽明和王家卫是一列，蛤蟆的油
457,罗生门,1,"五星电影么?- -||| 
原谅我吧，1星已经算高了。。耐着性子看一群疯子张牙舞爪了俩小时...莫名其妙的一故事。。。"
458,罗生门,2,为了写作业 被迫看的 three      这是啥嘛  里面的人物咋像神经病尼
459,罗生门,1,好吧。。。what a happy ending
460,罗生门,2,也许在那个时代算是不错吧。但是我不是在那个时代。我只好给我的分数。
461,罗生门,1,黑泽明又怎么样
462,罗生门,1,纯粹在为日本的侵略史开脱，各位看不明白吗？
463,罗生门,2,可能因为看的是黑白片 又因年代久远的关系 画面处理不够细腻 所要表达的情感也不够丰富  但终究是一个年代的记忆
464,罗生门,1,有啥好的 都f黑擅ゴ 看不出砟
465,罗生门,1,一句话可以概括的故事，磨磨唧唧演了一个多小时……急得好想快进。不过就是谎言、谎言、谎言，和目击者的谎言的故事。人性确实有，但悬疑故事完全可以更复杂，结果只是在纠结武士怎么死的――由此显得开头避雨三人尤其夸张，迷之吊胃口，结果就给我看这个？不过1950年能有个这么深刻写人性的，也不错。
466,罗生门,2,不好看 不论什么大师崇拜至极 多少豆瓣粉为此片高潮  不喜欢就是不喜欢  故事无聊 演的太假  叙事方式也不喜欢
467,罗生门,1,太深奥 智商达不到
468,罗生门,1,what the fuck！
469,罗生门,2,故事的深度不错.但拍摄太枯燥..不太喜欢.年代不同
470,罗生门,2,我是真心受不了这种风格的电影，看下来我都要被配乐和画面逼疯了= =以及，只有我一个人还认为最终杀了武士的人是那个女人嘛……？
471,罗生门,1,神的作品！！你以为我会给五星？？不，我给的是一星，因为我就是这样神秘令人难以捉摸
472,罗生门,1,我并不会因为它是大众以为的高分就给高分，也不觉有多讽刺人性，现如今不知有多少片子可以超过这部的讽刺意味。什么？要考虑当时的年代和电影划时代的意义，对不起，任何一部伟大的作品都是超越时代和时空，给人以震撼的
473,罗生门,2,简单的剧情，揭露出一个人人皆知的道理，人是动物，当然会趋利避害，谎言，对于现在的社会，恐怕习以为常了吧。
474,罗生门,2,欣赏无能。。演技略浮夸。。
475,罗生门,2,先看了小说《竹林中》，剧情完全知道了，再看电影，好拖沓好拖沓，沉闷了，还是喜欢《七武士》。
476,罗生门,2,说实话，今天看来不怎么样了，宗教迷信成分，和尚的愚氓假慈悲。
477,罗生门,2,黑泽明的又一著名作品 可惜不太喜欢 或许理解力还太浅
478,罗生门,1,一般吧挺无聊的。就一堆人撒谎而已
479,罗生门,2,"2014-05-08 想看
2018/3/12 看过 对于电影本身不喜欢，也欣赏不了黑泽明。
现实中用罗生门去评价一件事的人，都是事不关己的人，不想扯进是非也无可厚非，但是其实真相只有一个，美化不美化都没有用。人性复杂但有底线，法律是底线，道德是另一层底线，穿越了底线就是无耻。"
480,罗生门,1,实在看不出好在哪里？实在感受不到为什么这么多人给高分。是因为知名度高吗？
481,罗生门,2,是我欣赏层次不够。
482,罗生门,1,让人看不懂的电影不是好电影。
483,罗生门,2,"太冗长了。。

或许是年代的问题吧"
484,罗生门,2,好片，但是真的不喜欢……可能是不喜欢日本人物的大喊大叫表演吧，真的听的简直要作呕，在女子的那一段中达到顶峰，简直灾难的观影体验……还是要承认，剧本和氛围营造确实出色，但是我觉得很多地方处理的不见得比英雄高明，结尾倒是尽显大师气质……个人觉得英雄更好，虽然感觉其实也没太大可比性
485,罗生门,1,特别}人的电影，尤其是那个女人和强盗。不喜欢。
486,罗生门,2,对不起 不喜欢
487,罗生门,2,黑泽明的性别观真的太有问题。写不出好的女性角色的人也不可能创造出好的男性角色，我对这一点深信不疑。
488,罗生门,1,别说教成么！！
489,罗生门,1,立意我懂，题材也看明白了，手法也值得称道，喵的岛国人拍这种我就一点都get不到这是几个意思，参考恶人的影评请
490,罗生门,2,看过了，一般~~老片子，但是给人留下的印象不是很深
491,罗生门,2,遇到如此神片只能跪舔!!Σ黄6868我]有欣p美的眼睛6868
492,罗生门,2,真的不懂 它的看点在哪里 慢节奏 没有眉毛的女人 矫揉造作
493,罗生门,2,欣赏不动，闷死了好吧……
494,罗生门,2,一直以来这部电影都被很多人视为划时代的作品，但说实话自己在看的时候感觉到的是一种总想快进的想法。可能是同时期的电影看的太少没有比较，所以不知道这部电影究竟为何而伟大，不过在看了不少人的影评之后也能略微的感受到导演想要表达的思想，其实放到现在也不为过时，人总在用欺骗掩饰自己的阴暗面
495,罗生门,1,以现在的标准看，真不觉得故事内容有什么大惊小怪，电影本身那么慢的节奏和夸张的表演也同样考验人的耐心，还不如《七武士》。同时代的《魂断蓝桥》现在依然打动人心，这个就最好还是退出历史舞台吧。PS：看到唐朝传过去的蛾眉妆，挺有意思。
496,罗生门,2,呃。。我不想说谎。。看得我都要睡着了。。
497,罗生门,2,"88min并不算长，一口气看完后又翻了两篇影评。影片映射了很多东西，这点不置可否。但单是对于我来说，讲一个社会性大道理的故事还是太单调了。最失望的是结尾，完全没有feel. So board.
我对人物夸张式的表演和女主的颜表示尤为反感，真是抱歉"
498,罗生门,2,太太太太太难懂了。
499,罗生门,2,"可能是年代问题？看的时候都要睡了...要不是这是作业 可能看不下去五分钟吧...都睡了含义肯定没看出来 观后感也泡汤了...
看了影评 果然厉害 其实就是那种每个镜头都不能删减了 然而太无聊了...真的困..."
500,罗生门,2,价值观太落后了，当女人是什么？这他妈强奸文化宣传片吧？
501,罗生门,1,这不很正常吗? 评尼玛那么多5星脑子进水了?
502,罗生门,2,好无聊的电影。。。想知道‘罗生门’是什么意思，才去看这部电影。罗生门就是公说公有理婆说婆有理，只说对自己有利的东西。每个人以为的真相，只是自己看到的真相罢了。就像我们看同一部电影，却会有那么多不同的评论。
503,罗生门,2,觉得经典是有时效的。
504,罗生门,2,不知所云- -
505,罗生门,2,...以现代人的角度来说 真的可以说是负分滚粗了 但是想到1950年 还是要加一星的。 如果是学哲学电影学的值得一看 纯粹娱乐的还是省省吧....
506,罗生门,1,我看了这么多电影。没见过比这部更无聊的了。
507,罗生门,2,这样一部芥川龙之介的短篇小说大杂烩拼出来的电影也能拿8.7分？
508,罗生门,1,就那样了，不懂
509,罗生门,2,睡觉睡觉
510,罗生门,2,虽然很有意义，拍得却很拖沓无聊。
511,罗生门,2,我靠，可能因为片子太老了，我怎么觉得不能忍！
