,movie,star,comment
95,罗生门,4,黑泽明50年的黑白片，有点生硬，但内容非常反映现实：一个强盗，一个武士丈夫，一个妻子，强盗说得自己像强盗及男人，武士说得自己像武士及男人，妻子说得自己像妻子，事实是，乱七八糟。当然，说谎也是事实的一种。
96,罗生门,5,最好的日本电影
97,罗生门,4,赤裸裸的揭露人类的丑恶的一面，有时候只是单纯的说出事实那么简单
98,罗生门,5,人就算死了也不会放弃虚饰，可见人的罪孽如何之深。这是一幅描绘人与生俱来的罪孽和人难以更改的本性、展示人的利己心的奇妙画卷。
99,罗生门,5,let's leave the truth in the grove
100,罗生门,4,真相只有一个，但是看到最后，好像真相是什么都已经不重要了，那空远的婴儿的哭泣声和抱着他走向夕阳的忏悔着的樵夫，已经可以衍生一切了
101,罗生门,5,人总是喜欢编造有利于自己的故事。让历史与真实看上去像历史与真实。至少最后大师让我们看到了一丝丝希望。
102,罗生门,4,"我觉得这个道理其实我早懂了,而且活到这份上的中国人也都该懂.所以最后和尚的重拾信心也只是自欺欺人,结局到底如何也无所谓了"
103,罗生门,5,本以为是大闷片，放在电脑里迟迟没有看，看过之后却是觉得出奇的精彩。随着剧情的进行，一直想到小时候的一个游戏：是谁在说谎，游戏是在每个人的证词中找到共同点在推断出说谎之人。每一个谎言都把自己美化，真相却是如此不堪，“每个人都为了自己，你不是也一样吗。”在任何时代这个故事都在发生。
104,罗生门,5,影片结尾那句多亏你我才有能相信的人有丝丝的讽刺，武士、女人、强盗虽然的各执一词也让我更加认清了身边的人讲出的话都是站在自己利益角度的。因此这个电影主题相当的发人深省！！！看过一则影评：黑泽明意在突出当年社会女性权利的未解放以及武士道精神的名存实亡！这部电影确实信息很多
105,罗生门,5,黑泽明作为公认的电影大师实至名归。很多人钟情这部电影的情节和架构，而最让我难忘的是看这部电影让我有了电影-观众这样的简单回归的感觉。
106,罗生门,4,片中的每个人都是阴暗的利己主义，气氛令人绝望，好在结果还能让人勉强产生一丝希望。配乐不错，镜头运用特别是人物特写给人很强的冲击。
107,罗生门,4,事件原点即是“客观事实”，随着时间的推移，“客观事实”消失，参与事件的当事者和目击者都成了“客观事实”的客体，转述成为经验制造器，从原点出发随着时间的推移会经历数层转述（甚至电影本身亦是转述），直到“现在的经验”。如果原点是真理的隐喻，那么人类引以为傲的认知将会把人类不停带离真理
108,罗生门,4,世上的每一个人，哪一个不是自私而又爱撒谎的？
109,罗生门,5,黑白电影会让人想到白噪音，而反映到《罗生门》里，白噪音这种通感大概可以当作是一种隐喻存在。真相有千白种真相，但都对各自做了修饰。
110,罗生门,5,想到曾经有个人这么对我说，我不说谎话，但真话我可以只说一半。我非常讨厌这样推卸责任却沾沾自喜的言论。片中的男人尽情地掩盖自己的软弱和自私，女人竭力以软弱回避真疯狂。人总是这样，一张嘴就是谎言和欺骗。日本这个民族的特别在于他们彻底的黑暗，却也彻底的愿意把黑暗与扭曲的人性摆在阳光下。
111,罗生门,5,多视角，多情景，悬念丛生的剪辑，精妙内涵的对白，影史经典绝不是吹的。
112,罗生门,4,"Itsumono nice costume, love the simple and direct settings, clean cuts, well-designed screenshots, and of course, the well-arranged storytelling, how the story is set out and played out step by step"
113,罗生门,5,一开始是《罗生门》，后来是《密林中》，后又回到《罗生门》，却结局在《橘》。读过原著的当天来看这部电影，只觉刀锋割面，黑泽明对《密林中》的改编实在是太棒，不过他最终还是没有像芥川龙之介那样放弃这“费解的、低等的、无聊的人生”。
114,罗生门,5,这是1950年的片子，放到现在看依然很震撼，当今的社会人性亦是如此，有人的地方就会有谎言，贫贱是一种罪恶，富贵又何尝不是，影片的最后，农夫因为之前说谎而要带走婴儿，这是人性中赎罪的意识，归根到底，人还是应该善良一点，不要以为那个自私自利的旁观者就是哲学家，仿佛看透了人性，这是很阴暗的
115,罗生门,5,改编自芥川龙之介的莽林丛中，最后剥衣一段来自于罗生门，模糊化叙事的经典，改编也做到了尽显原作神韵，no land for goodman的绝望在最后还是留下了一点希望，这是在战火中生存下来的导演给时代的寄语
116,罗生门,5,罪恶与谎言，道德与人性，即使过去了六十年，仍不失为一部很有思想性的电影。
117,罗生门,5,这个世界上只有事实，没有真实，叙述者越多，我们离真实就会越远
118,罗生门,4,比鬼神更可怕的是人心，比人心更可怕的，没有比人心更可怕的东西了。日本版的启示录，人其实是自然界里最脆弱的一个环节
119,罗生门,4,日本1950年就拍出这样的片子啊！镜头感很好的，强盗的笑声太怪，女人的眉毛倒也是另一种风味，黑白片怎么拍都是大师的感觉
120,罗生门,4,兜兜转转一圈，日本作家里，最后我还是更喜欢芥川龙之介。这部电影杂糅《罗生门》和《竹林中》，结合得极妙。电影与小说的气质毕竟不同，而我也许不太喜欢电影的这个结尾。我很喜欢《竹林中》对“历史强加给女性的错误”的这层表达，也极佩服芥川书写得这么到位，黑泽明的镜头语言这么深刻。
121,罗生门,5,人撒谎，因为他的软弱。虽然是黑白片，1950年的作品，但意义深刻。当年看的小说是没有樵夫在电影最后叙述的他看到的近乎于事实的那段的，基本无法看懂。电影中加入了这一段，较为明显的体现了每个人撒谎的原由和他们想要掩盖的软弱和自私。
122,罗生门,4,真是一部深刻的电影 若砍柴人描述的可信 那还真是讽刺 事实太讽刺了 btw 一直花痴三船敏郎0404
123,罗生门,4,谎言与迷局。【女主长得好像Toshiko 真是标准日本女性长相=v=
124,罗生门,5,straight to the point. I'd prefer a gloomy ending with the baby being.. I guess the ending is a test for the viewers in a way
125,罗生门,5,最爱之一，对我青春期人生观世界观影响巨大的电影之一 -_-!
126,罗生门,4,难以想象是1950年的片子，比当下很多所谓大导演的片子都好看。虽然是黑白画面，却让人感觉到另一种人性的敲击。可以再重温的片子。
127,罗生门,5,黑泽明的伟大作品，从不同角度体现了同一个事件，但相互矛盾，从而表现了人性的缺憾。看报道说，黑泽明是第一个在电影中直接呈现刺眼太阳的导演。
128,罗生门,5,“我不理解自己的灵魂，我才是那个应该感到羞耻的人。” “别那么说。多亏了你，我想我可以继续保持对人类的信心了。”
129,罗生门,4,"又名: Rash00mon / Rashomon

导演: 黑泽明
主演: 三船敏郎 / 千秋实 / 京町子

制片国家/地区: 日本
上映年度: 1950
语言: 日语
imdb链接: tt0042876

"
130,罗生门,5,"在互相怀疑，自私自利的地狱之中我们仍就能看到希望.
说实在的没大看懂.那四个版本的杀人案,到底是什么意思.不会仅仅是人类内心的自我欺骗吧"
131,罗生门,5,你写日记都不会把真相全部写出来，人就是如此，即便临死前都虚伪如故。首先，它开创了此类叙事风格的先河，当然也要拜芥川龙之介所赐；其次，本片在摄影技巧上达到的高度也是同时代的人难以企及的；最后，膜拜黑泽明大师！
132,罗生门,4,MiniSD-TLF：http://www.verycd.com/topics/2803261/ 
133,罗生门,4,每个人都是又自私又不诚实，爱遍借口，每个人，社会已然如此。那些对你不自私够诚实，直接说明理由的人就是你的家人，朋友，爱人。
134,罗生门,5,"-Lies, it's all lies. -It's human. Most of the times we can't even be honest with ourselves."
135,罗生门,5,老黑拍的东方人性，十分具有批判性和艺术性。虽然他拍的人性绝对赶不上拉斯冯提尔透彻。但他的影片不至于令人绝望。
136,罗生门,5,芥川龙之介《竹林中》与《罗生门》的混合，看不懂看小说《竹》，无论如何也该看小说。
137,罗生门,5,2000年，第一次接触日本黑白片，很用心的看完，我想也是那时候开始试着去精力去看完一整部电影。开始觉得电影并不只是用来取悦自己的。
138,罗生门,4,每一个人都有善恶双面，所以一个人的好坏只能靠看他是“善大于恶”还是“恶大于善”！PS：原来《英雄》的叙事技巧并非原创，而是有本片做先行者！
139,罗生门,5,什么是客观事实？屁，根本就没有客观事实。任何人的记载，转述都多少掺和了其本身的主观意图。视频音频，也逃不离摄录人的摆布。
140,罗生门,5,芥川龙之介的剧本帮了非常大的忙，运用镜分析主要是在于平仄空间的多角度展示上，也就是说黑泽明牛逼的地方在于树林 衙门 罗生门三处场景用了丰富的镜头语言充斥于88分钟中。
141,罗生门,5,发觉自己越来越能看得进老片了。黑泽明的片子倒是一点都不闷，即使是黑白片，视觉观感、音效都很不错(洒满阳光的树林给拍的多美，鬼魂附身女巫那段音乐多邪恶)，四个角度的描述也很有趣，大约每个人都会为了自利的缘故掩饰和扭曲真相吧
142,罗生门,5,这片子在当时社会引起的反响肯定比现在要强烈，现在的社会更接近于片中所说的‘地狱’了吧。另，可以吐槽点实在太多了：日本简易版《十二怒汉》，多囊丸长的太像马骏了！还有真心觉得女主比现在的锥子脸骨瘦如柴的女人们漂亮得体的多的多的多，一脸福相啊~
143,罗生门,5,81/26（风格：运动长镜头，使用镜子布光；故事：众说纷纭。三角关系。TSPDT.2016.020.4.8）
144,罗生门,4,外面下着暴雨，留我一个窝在屋里看这老电影感慨人性。与剧中人何其相似乃尔啊！
145,罗生门,5,无结尾式的阐述、推理，把人性谎言赤裸裸的呈现在观众眼前。类似十二怒汉，一个是无尾的真理，一个是无尾的谎言，这是两部可以撑起一片天的影片，挚爱
146,罗生门,5,"这构图...
感觉芥川和黑泽明有很多相通之处 都认为人性本恶 只是芥川是对人世彻底的绝望 黑虽然在罗生门中留有余地 到了晚年的乱却也不可避免的和芥川走上了同一条路"
147,罗生门,5,强盗用勇猛掩饰自己的无谋，女人用软弱掩饰自己的欲望，武士用道义来掩饰自己的屈辱，农夫用无辜来掩饰自己的自私和懦弱。看到最后在想农夫是好是坏时，大家都输了
148,罗生门,5,“在这个世界上小人活得更好，如果你不自私的话，就没办法活下去。”“每个人都是又自私又不诚实，爱编借口。”好深刻的人性剖析！喜欢镜头拍摄天空的角度。
149,罗生门,5,真相果真是不存在的吗？未必如此。纵然我看到恶意，虚伪，懦弱，自私，但在这条道路上不过是有人走得更远。只有理解自己的灵魂，才会等来晴天。我很喜欢电影最后的善意，但我还没有足够了解这个世界到能做出评判。
150,罗生门,5,罗生门，这部电影存在于世，其他的电影谁好意思说自己挖掘的深刻，这不放屁吗
151,罗生门,5,用一部电影讲述生活中人性的本质，每个人都会为了自己的利益而编造自己的谎言，谁是谁非从来都没有定数。
152,罗生门,4,大雨滂沱中开始的讲述，竹林里阳光微风下的罪恶，三个人案情回顾里的自己是凭借自身刚猛征服女子和战胜武士的强盗，忠贞却遭冷眼的可怜妇人和忍辱负重不堪“最毒妇人心”自尽的丈夫，但真相却是如此不堪和局促，每个人内心自私那一面被放到最大。三船敏郎张狂的样子真帅啊。
153,罗生门,4,对于1950的作品要向经典致敬，现在看来其实未必有那么传奇伟大了，但在那个年代，罗生门里的所有电影元素都是值得称道并且在世界电影中的贡献是极大的。不太喜欢日本电影不喜欢日语发音不喜欢日本人，所以说对这部电影感觉也最多是平淡中还好。
154,罗生门,5,以现代的眼光看，这当然不值一提。但是作为50年代电影，简单直接，而且与其说悬疑犯罪的鼻祖，倒更是人类原罪的揭露。这本来就是一个罪恶的世界。
155,罗生门,5,《罗生门》有如导演性格，张狂外放，热烈又沉重，寓言式的故事风格能简洁纯粹地指明其态度。到底是原著好，还是导演功力强？对善恶强弱的思考，人性自私的诘问，黑泽明做到了。我们或许像那个无赖无耻地拿走弃婴的衣裳，但大多数人是樵夫不是僧人，婴儿长大又是个樵夫，软弱是民族的宿命。
156,罗生门,5,事实只有一个，答案却又很多，用黑白影像演绎：这个世界无处不在的谎言和人性之中缔结的私欲贪....  看完你会知道什么叫他妈的“审丑艺术的杰作”的
157,罗生门,5,和ozu完全唱反调的相当娴熟自信的运动镜头 各种恰到好处的背景音乐 绝佳的大鸣大放的表演 一句话没的说的剧本
158,罗生门,4,结局太和谐鸟，如果用上原著短篇《罗生门》的故事应该会更震撼吧
159,罗生门,4,虚伪与谎言，所有人都逃不开的人性。但仍旧会存在着我们可以相信的人。
160,罗生门,5,确实伟大和优秀根本就是两回事，可惜那些伟大的事物总是让人战栗啊，未免太惨烈了些~~于是大多数人自动选择盲视，选择屏蔽了这个选项。大路朝天啊，为啥非要去走窄门，很大代价的好不好。一日饱食三餐，夜晚安然无梦，懒惰和逃避简直就是人的天性嘛~~
161,罗生门,5,50年代的佳作，跟欲望号街车一比，高低立判，第一次看黑泽的片子，很震撼，三船的演技在当时来说相当不错，可以爆了白兰度。
162,罗生门,5,黑泽明导演正是让这部片子成为了一种不可超越的范本，终身成就奖不是人人都能收入囊中的，我十分敬重这位日本人。他的谦逊多才和对艺术高度的不断追求是我一生需要学习的。
163,罗生门,5,把三个人说的故事拼起来去除涉及到他们自身利益的那部分，就接近最后由客观者叙述的事实了，每个人都是自私的，都企图掩藏自己那自认为或外人认为丑陋的一面
164,罗生门,4,谎言充斥着人间.无论出于何种借口都是在为自私辩护.黑白片+镜头感.一个简单的小故事就反映一个时代.听黑泽明娓娓道来~
165,罗生门,5,“住在罗生门这儿的鬼因为害怕人类的凶残而逃走了。”60年前的镜头下折射出当下社会的虚伪与丑恶。力荐！
166,罗生门,4,带有鲜明时代印记和民族风格的艺术形式，滑稽而夸张的表情和动作戏，悬疑故事的揭露却没有什么惊险，镜头倒是简约而典型，已经和希区柯克一样成为一种电影语言。住在罗生门这儿的鬼，因为害怕人类的凶残而逃走。是针对人性的吧，诚实和自私。这里就是地狱。每个人都需要反省。孩子，代表了新生！
167,罗生门,5,黑泽明不愧是大师。对人性的自私，软弱，贪婪与谎言刻画得入木三分啊。谢谢你，让我对人类的灵魂还存有信心。留在最后的总是希望。
168,罗生门,4,三人三种说法，都在尽力维护自己的利益和自我形象，各说各话，使真相更加的扑朔迷离，谎言成为了人性的遮羞布也是护身符。因为年代的久远也许已经很难取悦现在的观众，但罗生门已经成为一尊图腾在电影史上有着无法撼动的地位；演员演技浮夸，但足以令人印象深刻，尤其鬼上身那段。
169,罗生门,4,说实话真正看完后我觉得不怎么样。。 估计是片太老了罢 看得觉得boring 不过因为是大师的作品 还是至少要给个四星的
170,罗生门,5,伟大的电影，远远超乎预期
171,罗生门,4,一个女人引发的血案……让我想到《第七封印》啊……话说回来，人不为己，天诛地灭。最后那个婴孩说明什么？他只是人宽恕自己的手段罢了。人，到底应该信呢还是不信呢？
172,罗生门,5,根据芥川龙之介的另外一部小说《竹林中》改编，其内容与《罗生门》小说无关，只是借用名字而已。现在罗生门的主要用法是指每个人为了自己的利益而编造自己的谎言，令事实真相不为人所知。超级喜欢京町子，每次看到她出现就像遇到伽椰子一样后背冰冷。其他要义我可讲不出来，看电影的时候自己琢磨吧。
173,罗生门,5,黑泽明改编自芥川龙之介的短片小说《薮中》的电影，和芥川龙之介的《罗生门》原文没什么联系，将人性自私论体现的淋漓尽致。
174,罗生门,5,People from diverse background hold different interpretations on a controversial issue.
175,罗生门,4,我得说黑泽明确实是在探讨很深的东西。人们总是从利已的角度阐述所谓的真相。谎言是种常态，每个人都无法避开。
176,罗生门,5,开始有点蒙，不过讲到第四个故事的时候就懂了，原来罗生门就是这么回事――也算是早期的悬疑片吧，看到最后发觉烧焦得还剩一半的寺院、大雨及雨停、婴儿及啼哭的寓意都很好，这应该是黑泽明电影的优点吧，借物点到为止但足够说明。为了自己的利益粉饰真相，社会都如此，但结尾一转，还是有好人啊！
177,罗生门,4,人都是自私自利的 都在伪装自己 凡是人 都不得不怀疑他(她) 强盗想要表现自己即使杀人也要有的磊落气概，女人企图掩饰自己并不贞烈的事实和挑唆两个男人决斗致使自己丈夫死于非命的真相，武士即使是借巫婆的口也意图掩盖自己的懦弱和无能，而樵夫迟迟不愿说出真相，只是想隐瞒自己偷偷拿走了短刀。
178,罗生门,5,证据学的基本原理――证据越多，越接近事实真相。但是，这部电影颠覆了这个原理――由于人类趋利避害等主观因素的影响，造成了证据的扭曲，在这种情况下，证据越多，事实真相却愈加模糊不清。一部伟大的影片，来自一部伟大的小说――芥川龙之介《竹林中》。另，奇怪黑泽明为什么用芥川的另一部小说为名
179,罗生门,5,四个人，四种立场，四段截然不同的故事，四次刺痛观众的神经，改变观众的判断，直到最后亦不知所谓真相，作品对人性如开膛破肚般深刻的洞察与剖析，各自丑陋，却各有自己不同丑陋的地方，道出人本虚伪爱随口说谎的本性。黑泽明多重叙事的张力把握无需多说。演员们的演出简直完美，这样不断改变观众立场的作品，最有直接说服力的部门就是表演了，这四段故事里三次颠覆性格的三位主人公以及最后云淡风轻地抱着孩子离开的樵夫都给人留下极为深刻的印象。
180,罗生门,5,一个简简单单的故事，就揭露了人性的复杂。为什么导演能对人性阐述的如此之好？像一把快刃剥开人类的表皮，把人看得如此之透彻！人性的软弱、谎言、丑陋展现的如此淋漓尽致！不愧为经典。黑泽明的影片很像十二怒汉，但意识形态更适合中国人
181,罗生门,5,原著芥川龙之介的《密林中》其实只是个短篇小说，但大导演黑泽明给与了它血和肉，情节丰满了许多。不同的人在不同的立场上看问题是会不一样，但如果没有以道德为基础，只能像片中这些人物一样。我虽说对人性也不抱以太大希望，但自己还是要走的正坐的端，至于别人，管不了也不想管
182,罗生门,4,"时间是一条永远无法逆流的长河,所有的真相都如浪花般转瞬即逝,再无法看清,永远沉淀在历史的河流中。该片之所以在世界电影史上占有重要一席,绝不是因为电影技术,而是因为在那个年代能用电影的形式进行的人性拷问几无旁者,芥川龙之介和黑泽明的伟大就在于此。并且因为这部电影,罗生门这个词被创造出来。"
183,罗生门,4,"很幸运的买到了黑泽明大师的罗生门
是的,人嘛始终都是寻找着自己利益的边缘,找寻着对自己有利的事实,回避着那些可有可无的东西.
真实是什么?什么是真实?看到的?听到的?想到的?没有什么是真实
 "
184,罗生门,4,2008-10-23 熄灯 8/8.5(28958) #70 半夜看得毛骨悚然
185,罗生门,5,每个人心中都有一个罗生门，同一个故事在不同人口中都会变得不一样，听故事的人的判断力将变得非常重要，这就是现实生活中要面临的。
186,罗生门,5,其实我真心觉得演员们演得不怎么样。和原著的区别虽然很大但是有些直指人心的东西还是共同的还有就是片子拍的好美，真的好美，林中的光影若非黑白也就无此韵味了吧。
187,罗生门,5,几个人控词对不上 成了某禅意了 虽然背后很可能是很凶险的一段真实 我真没觉得 这是什么人性的片 倒是某种迷糊失格的美 我不想形容的那么阴谋
188,罗生门,5,我擦，薛定谔之猫，1950我看的最早的电影好像是吧，居然是日本人的！，好厉害，还有你的眉毛去哪了?
189,罗生门,4,了不起的剧本啊。黑泽明几十年前拍出的电影仍是现今社会的写照，能把丑恶小人的自私拍的那么极致，看的让人火大。小人讲话总是大声且气直，不做小人怎么活的下去？好人没有力量，只能忍气。不过结局也还是给了那么一点光明，小善长存人间。一个扑倒技术一流的女人，两个窝囊废，那场打斗真是够搞笑的
190,罗生门,4,【B+】“如果人们不互相信任，这个世界跟地狱又有什么分别呢？”这个世界已经是个地狱了，不，比地狱还要复杂。黑泽明的镜头语言和剪辑手法实在精妙无比，用“罗生门”的手段为我们讲述了一场关于人性的“罗生门”。最后的结局看似光明，但谁也无法确定那是不是更可怕的黑暗。
191,罗生门,5,宣传噱头常用词汇 。想看是因为听到多人云淡风轻的说起一个我不懂的词汇，看的时候总以为自己找错了电影，看到中段才渐渐醒悟。
192,罗生门,4,多线闪回在现在已经并不少见了，但在1950年，这样的叙事手法会让人无比震惊
193,罗生门,4,本来想说是日本的十二怒汉，一查年代，十二怒汉摄于57年，晚了黑泽明七年。电影里的人们衣衫褴褛，行为大同小异（只为自己）。大到电影小到各类末世卡通，人好像对社会现状的忧虑和思考从没停止过，而这就是黑暗世界残存的一点光明力量在人心目中的映射，或者说隔靴搔痒了。
194,罗生门,4,赤裸裸的谎言和人性黑暗面！t9d85df089 字幕：http://shooter.cn/xml/sub/109/109563.xml
195,罗生门,4,审讯时演员面向观众，几乎完全将摄影机放置不动而有极强的代入感，处理不同人叙述状态时多借用主观视角（感知）及属于角色当时心理状态的音乐（樵夫状态下选择无背景音乐），将人物心态刻画到极致，武士亡魂的一段堪称惊艳，对于人性的呈现没有过多的限定而是让观者自行决断，似乎是对于战后时局的哀叹
196,罗生门,5,"大师之作,就是能把故事讲好.而且是故事原型,就是说,在地域限制下,但每个不可国家不同思维的人都能理解."
197,罗生门,5,原以为此片在西方大亮除开技术原因更多在于芥川的小说主题迎合了当时西方的怀疑主义论与存在主义思潮。后来发觉，影片最让人动容之处却在一个“仁“字。这也正是黑泽大帝将《罗生门》部分的哥特转为电影结尾的新生、希望与爱的出发点。承认残酷却依然有所信，这正是黑泽大帝比芥川君高妙之处。
198,罗生门,5,人性之丑尽皆爆发！
199,罗生门,5,cc extra 花絮：1. 罗伯特.奥尔特曼谈罗生门 2. 《宫川一夫的摄影世界》3. Testimony as an Image: Rashomon (2012) 4. 志村乔采访。 1.2.3. 看过了，4没看
200,罗生门,3,看不下去啊看不下去啊女主角太丑...
201,罗生门,3,在那个时代它肯定是一部开创性的好电影，但显然无法取悦现在的观众。所有关于人性的讨论都是以对白给出，并且竟然出自乞丐和樵夫。以三船敏郎为首的几个演员，演技跟《七武士》时期几乎一样表面、浮夸，以及慢半拍。人性部分，相信芥川龙之介的原著剖析得会更深刻。
