,movie,star,comment
0,海洋,5,看完之后深深希望2012快点来，大家抱团死，剩下的生物就可以好好活了。
1,海洋,5,太震撼的画面了，目瞪口呆看完全片。砍鱼翅那一段的惨烈堪比《海豚湾》，配乐相当不错。全片就像是由千万生命谱写演奏的谢幕曲，如此绝美绝望，而镜头前的一切都在不断消失，请2012来得猛烈点吧。
2,海洋,4,摄影加一星。影片本身缺乏凝聚力，几乎为单纯的影像展览。
3,海洋,5,从此更加讨厌人类了，世界末日果然是有用的...
4,海洋,5,人类是大自然最纠结的发明。但凡在大自然的和谐静美中出现人类的身影，非凶即恶、非恶即丑，一定是地球上最丢脸的存在、最恶心的物种，优胜劣汰、适者生存这样的说法可用来解释自然，但被用作强奸自然的由头、自我炫耀的工具，一切就变成屎了。如果人是不自大狂傲而只是充满好奇心和谦虚的态度，多好。
5,海洋,5,大自然孕育生命也播散死亡。你见过它壮阔的美景，也会见识它怒吼的巨浪。但它从来都给你希望，讲给你听生命的礼赞。就像有日落，就会有日出。那唯一逃过捕食的小海龟，代表着生的喜悦，它仍会勇敢前行。那被割掉鱼鳍绝望而死的鲨鱼，代表着人类的残忍，这超越生命与自然的限度。看看吧趁一切还来得及。
6,海洋,5,有些中国观众的素质和耐心，真是不配看这部杰作，我都想给他们倒贴电影票钱，让他们滚蛋。
7,海洋,5,大自然很美好。而择其美好，为其配乐，加以剪辑，使之美好得如梦似幻曼妙呆萌壮丽秀雅，就是智慧了。 
8,海洋,4,这个剪的确实有点歌剧感觉了
9,海洋,5,觉得阿凡达很壮丽？你得看看这个。
10,海洋,5,如果可以给更多的星星，我全部送给这部如诗一般的电影。一个法国老头和他的团队，花了５年时间，耗资５０００万欧元，１２个摄制组，采用蹲点拍摄的“笨”办法，只为你我能够感受到梦一样、诗一般的海洋。７年后，这部电影来到中国，还亏损９００万，我想我们能做点什么，比如一份尊敬。
11,海洋,4,心旷神怡，蔚为壮观，只是可惜缺少情感共鸣，更像是影像展览。“将来我们所能看到的生物，只存在于动物园的栅栏里，还有水族馆的水槽中吧。到那时该怎么办? 丰富的自然成了过去一个久远的梦。” 当大白鲨也变得温顺可掬6868
12,海洋,4,82/100。美不胜收。火箭升天和虾蟹大战两段很有爱；这片子拍摄难度应该比去年上映的Earth大多了吧lol
13,海洋,4,不需要导演编剧演员，大自然能帮你搞定一切。画面那个美，中途睡着。
14,海洋,4,整体不够惊艳，屠杀海豚和环境污染那两段堪称亮点。
15,海洋,5,想必一生都会记住被割掉翅的鲨鱼被人类抛入海底的样子。如果这个世界没有人类该多好。
16,海洋,5,美得我直掉眼泪。它们孤独吗？或许它们的行为原本只是出于本能，可我已经看不得两条相爱的鱼。我只能跳过那些残忍的画面，气得直哆嗦。人类活该灭顶，让2012早点来吧！
17,海洋,4,补添。不若里芬斯塔尔的《水下印象》有感。换句话说，《水下印象》是一曲盛开的乐章，而《海洋》是一篇漫游的散文。可惜是漫游，若肯神游就绝了。
18,海洋,4,法式浪漫和胶片美感。只是情感元素注入太多，不像自然纪录片，更像剧情片。
19,海洋,5,好后悔没去影院看，这真是最像梦境的电影。
20,海洋,5,《Océans》：自然的颂歌，生命的礼赞！
21,海洋,5,在生命的源头也是尽头，人类显得那么渺小和无知，企图用残暴来摧毁一切，片中鲨鱼被割掉鱼鳍沉入海底生不如死一幕让我哭到泪崩，也许影片不如微观世界和迁徙的鸟那样完整，但这些伟大的镜头已足以名留史册，姜文的旁白有些尴尬，海洋本身就是一场交响乐，百年以后，从哪里来，回哪里去。
22,海洋,4,让我印象深刻的是螃蟹功夫对打，和擎天柱、甄子丹一样遭到了断臂的下场；再就是两军大战场面，用的是战争片惯用的音乐，气势恢宏。导演在纪录片中安插剧情片思路，让人耳目一新！最后环保的观点直指人心，悲剧就是把美好的东西撕碎给人看，撕碎美好的就是人类自己！
23,海洋,5,耗时耗力的良心纪录片，幸好我基本算个素食主义者9595
24,海洋,4,人类中，只有傻逼才吃鱼翅
25,海洋,4,很有意义的电影
26,海洋,5,那些难以忘怀的镜头：刺入海面的飞鸟，爬向海水的龟群，腾空而起的海豚，深蓝海水中的水母群……美得让人窒息。一个半小时的时间总感觉过了很久很久，久到我都不想让它结束，如果能一直放下去，该多好，如果人类能意识到自身的渺小与无知该过好。
27,海洋,5,绝美的纪录片，看过后一直都挺抵触鱼翅这种食物的
28,海洋,4,也是国家地理看多了，感觉严重下降中……
29,海洋,5,人类实在是太可怕了
30,海洋,4,在影院里看了一场海洋生物记录片和教育片。不过挺震撼的.
31,海洋,4,“看完之后深深希望2012快点来，大家抱团死，剩下的生物就可以好好活了。”海豹那一幕真有爱~
32,海洋,4,豪华加长版《动物世界》兼环保宣传片。姜文大叔客串了一把配音旁白帝，可惜旁白在这部片子中有如鸡肋。
33,海洋,5,迪斯尼出品，自然偏重更美好的一面，影片恢宏壮丽，细致有趣，十分感人。
34,海洋,4,"就是旁白比较少 然后没有一个主题故事的动物世界嘛。 看的是日语版的  听的我快睡着了。
只有什么龙虾啊 什么鱼的出现的时候会流着口水心里想 这只味道应该不错。"
35,海洋,4,即便很久之前在网上down过高清，也还是无法和影院效果所媲美。这种半记录片半科普片的影片也没让人感觉沉闷犯困，太美妙的海洋风光始终深深吸引着观众，甚是壮观，让人心旷神怡；配乐加上剪辑到让人觉得像是在看一场歌剧听一场交响音乐会。★★★★
36,海洋,4,很美的纪录片，但是在对观众的诱导上木有帝企鹅日记之类的做得好。
37,海洋,5,很用心的生态纪录。
38,海洋,5,太赞了！！！巨棒的片子！超喜欢~
39,海洋,5,牛逼
40,海洋,5,震撼人心，纪录片的力量是真实。去金逸看时还惊喜得到了HP7的海报
41,海洋,5,很美，我看的是美国版
42,海洋,5,没有买卖就没有杀害…雅克贝汉是现代最有才华的纪录片导演
43,海洋,4,音乐和画面无可挑剔。虽然还不太习惯看这类纪录片，还是在影院里被深深的震撼。
44,海洋,5,画面很震撼，解说的声音好听
45,海洋,5,一定要看的片子，绝美的海上芭蕾！
46,海洋,5,灰常华丽的海洋
47,海洋,5,926@三里屯美嘉vs花  哭死了我
48,海洋,5,不在影院看会折损大半美感。
49,海洋,5,“上映日期: 2009-10-17(法国) / 2011-08-12(中国大陆)”愿意花钱再看一遍致以最高的敬意。谢谢。
50,海洋,5,纪录片永远是王道，花15元的票价，看了如此一场视觉盛宴实在让人好像在路上捡到钱一样高兴。里面的动物太多了，要是能在出场的时候稍微说明一下就好了，好多不认识的。
51,海洋,5,#海洋#是一部无与伦比的电影，每一帧都美到令人窒息，画面中流淌的情怀有种纯粹的圣洁光芒。强烈的震慑，我已臣服。将来，如果蓝色最终变成红色，那么，他们灭绝，人类终结。保护海洋，守卫生命。超五星推荐，你需要看一看！
52,海洋,5,你们不要这么调皮！
53,海洋,5,美得让人以为是科幻片...
54,海洋,4,大美！影片最后40分钟当人类开始出现并残忍地破坏这种美好时才让人更加痛心疾首。
55,海洋,4,没有鸟迁徙好看
56,海洋,5,应该有3D imax版本。。
57,海洋,5,JUST LIKE A DREAM
58,海洋,5,陆上有牛B电影，海中有鲸B电影。推荐。
59,海洋,4,海洋之美，纯澈的蓝色，和其中的一个个生命…可爱的或是凶残的，那是只属于海洋生物的世界…让我不由得想去潜水亲历这种生命之美。电影的中心依然是想指出人类在地球的生存中，如何与自然、与海洋相处的环保主题。片子有点散，一段一段的感觉…配乐很赞。
60,海洋,5,诚意十足、美不胜收、触目动心~~~
61,海洋,4,45627
62,海洋,4,没有奇观，没有科教，没有故事，什么都没有。
63,海洋,5,很多画面其实在动物世界里已经看过，但在影院的确更加震憾一些，今天特意到新开张不久的太平洋影城看的
64,海洋,4,一小时的时候居然话锋一转变成了极端环保主义科教片，让前面一个小时的美丽镜头瞬间失去了好多平静动人的力量，简直有些功利了。我真是不喜欢后半小时这种didactic的语气……（我是完全赞同documentarian要有社会责任感的说法，但是作为一个观众更希望的总是“电影好”不是么）
65,海洋,4,相当富有诗意的唯美画面 雅克贝汉确实厉害 而我依旧是行星地球控
66,海洋,5,美！每个镜头都很美，作曲很棒，音乐的配合使得海洋生物的一举一动像舞蹈一样美丽
67,海洋,5,虽然不如迁徙的鸟那样震撼，但是还是够五星的。。。头一次在电影院看纪录片，一天只有一场，一大早。。。
68,海洋,5,其实还是有很生硬的地方；看的时候偷偷抹了三次眼泪，坐旁边的两个人也哭了；之前在水族馆海洋馆看到觉得很丑的动物在里面都好美；真的值得去电影院一看；会去买张DVD收藏；the ocean will be forever home
69,海洋,4,狗日的小日本！！
70,海洋,5,这种纪录片特别容易触碰我的G点~
71,海洋,5,什么叫叹为观止，看了这部片子 算是知道了！太神奇太伟大了！
72,海洋,5,这个孕育着地球最具灵性生命的海洋终将是我的归属。
73,海洋,4,海豹和海獭真是萌的我心都要融化了-///-
74,海洋,4,说教之于电影，就像捕鲸之于大海~
75,海洋,4,观后感：人类啊不要祸害子孙了，或者干脆别要子孙了。
76,海洋,4,这次看的时候太容易跳脱，有种思而不学的错觉…有激动人心亦有静谧深邃，有爱也绝对有恨
77,海洋,5,生命
78,海洋,4,美
79,海洋,5,极品！！
80,海洋,5,大开眼界
81,海洋,5,解说有些凌乱，可只凭画面就可深深打动人心，为了完整连贯欣赏这部电影，我硬憋回去一泼拉肚子的稀粑粑，可最后还是晚节不保，被佼佼的一条利用星座骂她自己脑残的短信打断了。。。。
82,海洋,4,很像看discovery呀～～有的镜头梦幻得怀疑自己嗑了药～
83,海洋,4,没啥主线的纪录片，不过很好看。技术上算是水下摄影的巅峰
84,海洋,5,Thanks mother nature!
85,海洋,5,这是我看过拍摄的最棒的一部生态纪录片，秒杀BBC海洋系列
86,海洋,5,人生苦短，请尽情享受美好的生活，并爱护着我们的家园。
87,海洋,5,前半段大治愈！
88,海洋,5,很美很壮观 但愿我们的后代们永远能够看到这样的景象。
89,海洋,4,难得上映一定要在电影院看！真正的惊涛拍岸卷起千堆雪！不知跟海滨城市有没有关系，大连院线场次还蛮多的，只是旁边会不时乱入海蛎子味儿点评：这不就四（是）圣亚、极地馆、刺锅子、虾爬子……最后挨个特写算是演职员表嘛，附上学名就更好了，当然最美最逍遥的还是海龟！
90,海洋,4,保护从了解开始
91,海洋,5,画面音效音乐各种震撼
92,海洋,4,雅克 贝汉用镜头捕捉海底形形色色的生物，给我们带入了一个最自然的大海的世界，并且呼吁我们对大海的保护
93,海洋,4,法语版的剪辑太冗长。
94,海洋,5,纪录片果然是要两个人一起看的
95,海洋,5,生命不是电影，如果非要成为一部电影，也是包含各种爱情、恐怖、动作等风格的纪实，小右派也想吃日本人的胳膊了，怎么办？因为我爱你啊，你知道的，因为我爱你，jinn荐，洗
96,海洋,4,在电影的部分有些做作和教条，但是镜头是各种美和弥足珍贵~
97,海洋,4,生切鱼翅那块真是MLGB啊！！！你们怎么下得去手！！！！
98,海洋,4,画面很美音乐很赞，但是一个人看有点无聊－ －，我倒底还是脱离不了情节控的观影标签啊！
99,海洋,4,原声大赞，某些情节配合得天衣无缝。美得让人心碎，也会让人会心一笑。诸如螃蟹和龙虾的刀光剑影，虽没太着力描写，但也反射出弱肉强食的残酷。人类应当反省和惭愧，地球不仅仅是他们的。
100,海洋,4,自然的魔力是人类永远无法想象的，对于大海的敬畏只是一个缩影，每次看到关于自然的纪录片，都会放下心里的疲惫，享受自然的治愈力量
101,海洋,4,有木有人一起看啊！！！！！
102,海洋,5,走过四分之三地球，送你一部《海洋》。 
103,海洋,5,如果是3D版应该可以专门盖间电影院了哇！
104,海洋,5,"海洋并不存在美,只是人类将它定义为美."
105,海洋,5,F在o片都在X。
106,海洋,4,蓝色家园
107,海洋,4,缺乏核心，缺乏将影像聚集的重点，只是单纯的影像展览，连开头结尾的承接都显得突兀又刻意。
108,海洋,4,有些动物花了几百万年进化到现在，而人类只用了几十年就将它们灭绝了，有些物种刚刚发现就绝种，濒临绝种了；没有买卖，就没有杀害，看到那条鲨鱼被砍下鱼鳍后的垂死挣扎很难受；当然人类也在竭力改变与挽回，从自己做起，我也要随着大自然自我修复；今日的遇见会是缘分吗？保佑我吧
109,海洋,4,还是很了不起的，剪的时候估计很痛苦
110,海洋,4,自然就是最伟大的导演，生物就是最杰出的演员，人类所做的只是记录而已。视觉系影片，可惜没有3D没有IMAX，海洋世界俨然又一潘多拉星，有震撼人心的美。配乐很赞，尤其捕食一段；音效怀疑是后期合成，很精妙。缺憾是结构比较松散，姜文的声音有时和画面格格不入。
111,海洋,5,环保科教片。壮观啊！不过不太适合密集的人看。
112,海洋,4,也许因为我憋着尿吧，并没有耐心看下去
113,海洋,5,什么样的机器和摄制人员能拍出这样的镜头。 对于本市影院只排一场而且还在深夜表示抗议 
114,海洋,4,摄影加一星，文本扣两星。其他见影评。
115,海洋,5,万物性灵
116,海洋,4,"大自然的鬼斧神工堪比任何电脑特技，随便一个镜头就足以震撼人心……
纪录片自然少不了说教，其实从某些角度讲我觉得人类早就没救了，"
117,海洋,5,怪奇！可爱！美！让人不知所措地好看！不在电影院看这片会遗憾的！还好还好～法国人拍自然与动物片真是一绝！
118,海洋,4,可能是因为从小就爱看动物世界一类的和动物相关的节目，所以没有太多惊艳的感觉。始终觉得人类是自然界最奇怪的动物，最近越来越怀疑进化论了。另外说实话，感觉哪怕是从现在醒悟也早晚了，人类早已经在自我毁灭的道路上走太远太远了。。。2012早晚都会来的，还是不要再自欺欺人了。（主题曲很美）
119,海洋,5,拍成音乐会了。
120,海洋,4,在情怀上不如鸟的迁移，其他几乎完美。
121,海洋,5,美得我心神摇荡......观影中联想到老庄的哲学观，不得不感叹二位是真正的智者，洞察这宇宙的奥秘啊！
122,海洋,4,画面和配乐是不可争议的绝佳。但也请原谅我确实在电影院小憩了十分钟，因为作为电影缺乏情节牵引，作为纪录片缺乏写实处理。推荐热爱探索海洋动物的人看。类似主题的，还是更喜欢《海豚湾》。
123,海洋,5,了保持物N的多有裕只好做掉人@物N了。
124,海洋,5,所谓的西方文明普世价值观充满了侵略性！回头看看中国传统中的“天人合一”是多么有前瞻性啊！
125,海洋,4,画面很美，有些地方剪辑莫名，主题嘛，没太大意思，生命本就冷酷的美，不因人类滥杀而更悲怆。
126,海洋,5,虐杀海洋动物那段看得很揪心。只能说保护环境，从我做起吧。
127,海洋,5,太空般广袤深邃忧郁的蓝调，使所有的语言都显得庸俗不堪，而人类则是这一曲蓝调之上的猩红。
128,海洋,5,with mistyee. 画面美而震撼。配乐极棒。
129,海洋,5,太棒了
130,海洋,5,太美啦！什么叫大片，这个就是，精良的制作，紧凑的剪辑，精致逼人的画面，极具震撼的美感。这种片子才值得去电影院看，才能值回票价。才能让坐在第一排的我一点不觉得累一点不想睡完全忘记电影外的东西放弃挑剔与抗拒，而且由于坐在第一排所以有种排山倒海的感觉~非常推荐，即便不是最好，其环保意义
131,海洋,5,不觉得眼眶都湿了。我愿做一尾海豚。
132,海洋,5,真美！！！想看104分钟版本。。
133,海洋,5,“人类的智慧污染了海洋。” 
134,海洋,5,失眠
135,海洋,5,大自然才是真正的艺术家，相比我们太丑恶了。
136,海洋,5,绝美。
137,海洋,5,看了那么多海豚啊鲸鱼啊跳出海面才觉得这个世界还是有希望的。海洋是大自然赋予人类的财富，请保护海洋，保护大自然。
138,海洋,5,看看吧！
139,海洋,5,海洋深处真是太让人震惊的美了，海洋生物太萌了~~尽自己所能好好保护海洋吧
140,海洋,5,"OST是诗，独白是诗，画面更是诗。喜欢雅克贝汉温情脉脉的纪录片。虽然很多物种和习性都在BBC纪录片里看到过，重温一下仍然有新鲜感。谈到自然避不开污染，这真是个悲哀的话题。Down here, it's like nature has given everything a try."
141,海洋,5,今晚看了《海洋》，天才导演献给海洋生命的一曲赞歌。广袤的汪洋让人炫目的美丽物种，也会由衷感叹造物主的神奇。纯美的海洋世界让我们这些高智商人类隐隐刺痛。看片的时候不由得感叹导演的用心，每一个镜头都力求完美，这注定是一部伟大的电影。海洋的协奏曲，生命的交响乐，爱护环境，敬畏生命。
142,海洋,5,"不如天地人三部曲，但是很好的环保片，蔚为奇观。  
在雅克・贝汉手里，海洋生物都成了身边的朋友，连船都是有生命的。尤其喜欢惊涛骇浪中小船奋力前进那段，还有所有鲸鱼的段落，鲸鱼真是神奇而美丽的动物。由此多了个愿望，希望有天能亲见鲸鱼在大海上的舞蹈。"
143,海洋,5,有那么一会，几乎坐满的巨大imax厅内一点声音都没有。都为眼前这浩瀚的美丽屏住了呼吸。那片深蓝美得我想哭。。。。
144,海洋,5,好棒~！也没出现海洋恐惧症。很好。vip座椅很舒服。@中影。
145,海洋,5,好吧，看到鲨鱼被割掉鳍和尾巴的那个场景我哭了。。放心我以后不可能再吃鱼翅了
146,海洋,4,最爱纪录片了!
147,海洋,4,没有科教没有情节只是单纯的记录海洋与生命
148,海洋,5,和Hugo。低调的每天只在上午放一场的电影，一直在研究镜头的位置，和长镜头的主体关系，每一个画面都可以独立存活，美到不行。海底生物其实很萌。
149,海洋,5,1.海洋太美了，雅克贝汉让海洋呈现无比的魅力；2.人类太残忍，对其他物种，对整个地球；3.姜文大叔的声音很独特很气场，却没办法与这部片子融合，是唯一败笔。
150,海洋,4,"在大自然面前人都很渺小 , 我不嗳テ , 全因我很o知~!"
151,海洋,4,画面的确很美，但是因为叙事的杂乱而缺乏情感共鸣，
152,海洋,5,人连自相残杀都干，哪会疟鸬奈镏
153,海洋,5,美
154,海洋,4,正太好美丽！→鱼→好多鱼...→饿了..好想吃鱼→长得难看的鱼应该会很好吃吧→正太好美丽！
155,海洋,5,六星
156,海洋,5,对制作团队的那个敬意啊！！！太厉害了，野性的歌剧。“大银幕的画面和声音”“精心设计的内容”“那些电视纪录片承载不了的我想要的诗意”……
157,海洋,5,太震撼的画面了，目瞪口呆看完全片。砍鱼翅那一段的惨烈堪比《海豚湾》，配乐相当不错。全片就像是由千万生命谱写演奏的谢幕曲，如此绝美绝望，而镜头前的一切都在不断消失，请2012来得猛烈点吧。
158,海洋,5,心生柔软。如此美丽。无可比拟、无以复加。 整部电影最揪心莫过于被人类斩了鳍的鲨鱼直坠深海那一幕。仅一秒的画面，汗毛林立、揪心无比。
159,海洋,4,这个摄影真的棒呆！
160,海洋,5,被割掉鱼鳍的鲨鱼那段让人心碎。。吃鱼翅的傻逼们 草死你们
161,海洋,4,朴素环保的纪录片就应该让大家都去看看！幸好姐家境贫寒从来没吃过鱼翅！
162,海洋,5,看着你的脸，心里真是无比难受，这个电影看得真是一波三折啊
163,海洋,5,人类自作孽不可活啊
164,海洋,4,大海啊  不全是水
165,海洋,5,看过BBC太多纪录片，于是觉得本片的剪辑不够完美，配乐有点问题，鉴于摄影师劳苦功高给五星！影片开头，是海底小怪兽，它在等它的凹凸曼么？ 
166,海洋,5,“如果在你面前杀死一个人你会怎么反应？杀死一只狗呢？我疑问的是如此相反的感受，其两事件的本质又有何不同？不都是杀戮让一活生命断送吗？”“如果人类因为恐惧而先下手为强，那么在明了那些不会损坏我们的生物何故还能忍心谋害？人性本恶？还能轻易原谅？”
167,海洋,5,m然Z言缀]有 但就算有Π 也是一Nn白！
168,海洋,5,右边的情侣讨论的很热闹 话比姜文还多 左边的基友睡的很香
169,海洋,5,画面真美
170,海洋,5,天地人都拍了之后，雅克贝汉对准了深邃的深蓝世界，这部纪录片一如他以往的作品，绝佳的拍摄角度和唯美的取景，充满艺术气息的思辨和空灵优雅的配乐，雅克贝汉总是能把纪录片拍成文艺片，并且让人深深喜爱上他镜头下的万物生灵。
171,海洋,5,它的美无法用语言去形容
172,海洋,4,视觉冲击 太美咯
173,海洋,5,大海不仅仅是水。终究我对深不可测的汪洋大海有天然的敬畏，我宁愿去火星都不去海底。另，鱼翅太残忍的，虽然我没吃过，还是安慰自己幸好没吃吧。
174,海洋,5,忍不住惊叹真美，生命太奇妙了。who exactly are we? 没有故事，没有说教，只是完美的展现海洋的交响乐！PS:我想做一只海濑躺在海面晒太阳PPS:我更理解路飞要做海贼王男人的愿望了
175,海洋,5,在贪婪面前无所畏惧。人类真的很伟大啊！！
176,海洋,5,终于在大屏幕上看了一遍，惊涛骇浪迎面而来，生命的壮阔，不可言喻的影像，姜文解说着，因为人类地球上演化了千万年的动物在短短几十年大批的灭绝了，隔壁的哥们抽泣起来。我们真的爱地球上的万物嘛？还是仅仅暂时悲悯？
177,海洋,5,原谅我哭点怪，但这部片子真的太感人了！
178,海洋,4,"比HOME和EARTH都差远了，更不用说微观世界或迁徙的鸟。单纯的靠镜头，失败；衔接太乱，失败；再配上姜文的鸭公嗓，失败中的失败。----------------------------- despite them all, still 4 stars"
179,海洋,5,美 
180,海洋,5,自然是值得去敬畏的~杀戮、灭绝、污染、破坏，这些行为被冠上“人类”这个集体名词之后，仿佛立马就和任何一个个体不直接相关了~但事实上，就像《武侠》里说的“每个人都是同谋者”。PS音乐太棒了，唱诗班的声音一出来就让人心旷神怡
181,海洋,5,太美，比梦还像梦
182,海洋,5,如此恐怖……
183,海洋,5,比《海豚湾》更令人震撼
184,海洋,4,像在海底旅游了一次，不过还是有充数的痕迹。――看过生命的人飘过
185,海洋,4,很美，很残忍
186,海洋,5,从这部电影发现了我喜欢蓝色的溯源。法国人一直以来做纪录片的情怀是简单、可爱、浪漫、质朴并发人深思的，Ocean也不例外。个人并不觉得带领6岁以下的孩子观影是件明智的事情，明白道理需要心智的积累。
187,海洋,4,莅蹴缬厍槊}}，ゴ蟮碾影。
188,海洋,4,不可能完成得拍摄任务啊!!!!!
189,海洋,4,流动的画卷。。。
190,海洋,4,海鲜大作战，看得津津有味。
191,海洋,4,太美・・・・这种片让你有背上背包就出发的心动
192,海洋,4,能拍出这样的视频的人，格局有多高呢？
193,海洋,5,很少有电影是我想坐在电影院第一排目不转睛仰视看完的，真是艺术品
194,海洋,4,画面很震撼，同时也很细腻，但是很多地方没有衔接起来，配乐是极大的亮点。
195,海洋,4,全片无尿点
196,海洋,5,"仅仅一个割鲨鱼鳍的镜头,就能让人流泪"
197,海洋,4,鱼翅，我无法下咽了。
198,海洋,4,"一大早上 又去是包场子 电影院工作人员会很不高兴的 
缺乏主线的感觉 让我和同学居然想到了背后的阴谋论 
总之 喜欢大自然的朋友 应该去电影院看看"
199,海洋,4,真好看！精致、震撼、有趣味、有思想。
