,movie,star,comment
200,海洋,3,"拍得非常好, 但不要来假装电影"
201,海洋,3,画面什么的没的说，但是好像没什么主题，只是硬要往环保上扯而已。
202,海洋,3,没有奇观，没有科教，没有故事，什么都没有。
203,海洋,3,海洋很美……不过好容易困
204,海洋,3,前半截是动物世界，后半截是没有买卖就没有杀害。因为没有主线，前后两截切换也生硬，相信很难像《鸟的迁徙》那样打动人。即使是那么少的旁白，译得也不理想，姜文也显得突兀。难得引进，特地去影院捧场，算是为之前雅克贝汉给过我们的那么多，致敬。
205,海洋,3,法国导演雅克・贝汉与雅克・克鲁佐德合作的以环保为主题的纪录片，但也许观影前期待太多，没有震惊的感觉，且后边太刻意的说教不是很喜欢。
206,海洋,3,问题在于，我害怕逼真的动物。。。我觉得应该在大银幕看。特别震撼。
207,海洋,3,冲着3D看的。很美很美。
208,海洋,3,海洋生物好美丽！
209,海洋,3,切面比较零碎的地球之美
210,海洋,3,dvd的好处是可以玩，我在美日中文法文版之间来回切换，听姜文布鲁斯南雅克贝汉宫泽理惠，最喜欢女的。代入感差，分数出奇高还就是因为公映，这种片子能上映还有票房本身就是奇迹，三星都给运作的人，《海洋》最严重的问题是感受不到创作者对拍摄对象的爱，听说美版和日版公映都有文字说明。2012年214
211,海洋,3,谁能给我说说这片子和动物世界有嘛区别
212,海洋,3,各种奇景异象，大开眼界。
213,海洋,3,年度最佳视觉
214,海洋,3,一部有些无聊的纪录片而已，不知道分为啥这么高。海洋里的生物真心多，画面不错。我就是有点奇怪到底是怎么拍出来的。
215,海洋,3,单纯的美景堆砌
216,海洋,3,不比迁徙的鸟，这次是比较单纯的环保纪录片，观影过程中姜文的旁白听着着实难受，且一惊一乍~P.S去电影院看绝对是明智的选择，极个别镜头还是挺美的..就是姜文的配音把我吓着了..
217,海洋,3,画面确实非常漂亮，可是然后呢……
218,海洋,3,不管怎么说，画面很不错，就是每帧都可以拿来做桌面那种
219,海洋,3,又看了遍。。
220,海洋,3,调色调得海象哈利波特得海似得……还有一半的画面是CGI？！
221,海洋,3,越看越困……
222,海洋,3,想f勰悴蝗菀 游锸澜缫比@拍的好多了 h保}材也是炒冷 只是我]想到掠Z~翅要B尾巴一起切掉 那真的是重重的戳到了Ic 也_在一天里唯一一晚晚的龃涡⌒〉挠d里到了鼾
223,海洋,3,为啥我觉得很一般
224,海洋,3,纪录片，大海真的很美，不过，纪录片，对我来说，好像还是没有剧情片来的让我感冒。
225,海洋,3,摄影一级好，影片本身并不怎么样。
226,海洋,3,拍得太散，整体缺乏连贯性，尤其自然纪录与环保宣传两段间脱节感明显，解说也是老生常谈。自然题材纪录片还是BBC王道，2001年的《蓝色星球》至今仍是海洋类影片之王，看过那部以及《深蓝》的就没必要来看本片了。（7.0/10）
227,海洋,3,毫无疑问，身为剧本控的我完全对这种大自然风光片待见不起来，这不就是动物世界的精华版+没有买卖就没有杀害吗？而且配音也让我觉得前言不搭后语，可贵的是音乐很美，画面也很细致。
228,海洋,3,高分理由是真琢磨不出很多镜头是怎么拍的6868 低分理由是看的时候彻底睡着了6868 平均一下就是三分了。
229,海洋,3,又看了一遍日语解说版，很想问问他们对杀海豚那一段作何感想？
230,海洋,3,2011.8.27，mbox，张师傅。我：＂张师傅，鱼真可怜，我们以后还是吃猪吧。＂傅：＂姜文旱幕赫嫱p的。＂
231,海洋,3,去电影院看这个有点枯燥无聊，陪我去看电影的人直接坐那儿睡着了。看完电影，我们去吃了火锅鱼，哈哈哈，最喜欢吃鱼。
232,海洋,3,画面很好看，但是未见得怎么好，制作精良的动物世界而已。对于“环保“这个概念很容易过度阐释，把人类当成万物的保护神很可笑，把自己看作自然界的救世主还是独裁者有什么区别？其实都是践踏了其他生命的尊严，其实一样荒唐，做好自己的角色，不自私冷漠，也别越俎代庖，万物自有存亡的规律。
233,海洋,3,单纯的影像好看。。。结构还是陈词滥调的原始-破坏-毁灭。。。
234,海洋,3,前后像看了两部电影 应该拍成默片么!
235,海洋,3,其实音画效果都不错。少了解说就闷了点，只得一个看字，很多时候都看过就忘了，多了解说的话就加多一星，但偏偏这不是部标准的纪录片，前面的美景完全是批评人类污染海洋的伏笔，真的有点文不对题的感觉。
236,海洋,3,人类是地球最大的敌人
237,海洋,3,对于一个密集恐惧症、深海恐惧症兼幽闭空间恐惧症患者来说，这次观影经历确实很特殊啊……
238,海洋,3,虽然很美，但是还是有点闷。也不太有回味。
239,海洋,3,三星半。不给四星是因为这分虚高得太严重了，《海洋》和《HOME》都是类似的情况。大部分帧的画面都可以截图用来当桌面，但是却谈不上是一部好的纪录片。不说纪录片的两大方向，这部电影的旁白格外不明所以与矫情，摄影的确好到不行，但是那生硬且无整体性的音乐、无逻辑的材料组织，还是当动物世界看了
240,海洋,3,可能期待过高，没有想象中精彩。
241,海洋,3,自然音跟交返慕M合我不舒服。
242,海洋,3,摄影非常令人震撼，但是这片分裂得太过厉害，两段式结构，先是震撼的动物世界后就变为催人泪下的环保公益；影片没有凝聚力，只是单纯的视觉奇观。另外，密集恐惧症就真的不要看。观影期间血压心跳格外异常。
243,海洋,3,感觉像看幻灯片，没啥逻辑
244,海洋,3,欢迎收看动物世界之海洋生物。美轮美奂，但是几乎没有什么说服力。一开场就表现出动物世界的残酷和弱肉强食，却又告诫人类。配乐绝对满分。
245,海洋,3,"没有太多的特写，不震撼
"
246,海洋,3,传说！被妖魔化的纪录片，沉闷琐碎！看得我都快睡着了！姜文配音非常奇怪！法语原版又不是不能看！整个大上海竟然没有一家电影院放原版！整部纪录片简直就是在回忆我疯狂迷恋百科全书的幼儿园时期！Sigh！还法国凯撒奖最佳纪录片呢！老头儿和小孩子的处理简直就是多余！@港汇恒隆广场 永华电影院 2号厅
247,海洋,3,比迁徙的鸟要好些，但我真不觉得这能叫电影
248,海洋,3,个人感觉不如《微观世界》和《鸟的迁徙》，尤其是穿插的博物馆、水族馆的梗，只是加重了脑容量而不是直达人心。海洋很美人类很可怕（鲨鱼被切成肉棍扔下去，对不起剧透了）很有趣（海牛吃草），能够听到自然的声音。蜘蛛蟹殴斗太恶心了。姜文的旁白是大败笔，用力过度，搞得纪录片变成了故事片！
249,海洋,3,看的快睡着了，要是3D的就好了。
250,海洋,3,一些场面确实壮观！分三次看完，睡了两次~
251,海洋,3,不如向往。
252,海洋,3,了不起的纪录片，可是我看到海洋生物真心害怕。。。基本是当恐怖片看下去的。。。
253,海洋,3,我是来听姜文配音的
254,海洋,3,解说与画面脱节，只是一个又一个的美丽画面连接起来的风光片。
255,海洋,3,的确一般
256,海洋,3,法国人不着调的……
257,海洋,3,表现大自然的纪录片经过精致的后期处理固然很美，却无法真正触及人的灵魂。宰杀鲨鱼获得鱼翅的情节更有点像隔靴搔痒。我开始明白为何《天地玄黄》中要加入现代化养鸡场那种并不讨喜的桥段，并且全篇真正的无一对白，那才是致力于讲述人类进化和环境保护的纪录片。雅克贝汉很好，但目前还无法称为伟大。
258,海洋,3,电影院看的，还好吧，拍的是挺不容易的
259,海洋,3,其实我在三分之一的时候睡着了，旁边的人也不知道……
260,海洋,3,影像非常之美，这是一次对令人敬畏的神秘世界的屏气凝神的窥探。镜头所及之处，无不摄人心魄。但是此片信息量奇少，单纯展示，未有解惑，旁白所同虚设。剪得也凌乱，不系统。最后我对一影院小孩和妈妈们表示愤慨，简直是噩梦！
261,海洋,3,画面不好看……色彩也不好……本来对海洋很期待的说，还是家园好，华丽丽的色彩
262,海洋,3,有点动物世界的意思
263,海洋,3,真实、唯美、壮丽、惨烈、震撼……要是在影院看IMAX 3D版就太好了。跟BBC和Discovery的纪录片差不多，只是更细致更壮阔更具有电影艺术美感，配乐也相当棒。环保的主题要一直做下去，不断地提醒才能让人们实时记住环保的重要性。“台风来的时候，人们同心协力共度难关，为什么就不能共同保护大海呢？”
264,海洋,3,画面不及《家园》，震撼不及《海豚湾》。
265,海洋,3,画面脏兮兮的，旁白太少，第一次在电影院里睡着了，还差点错过了猎鲨唯一那段高潮，姜文不如赵忠祥，要是拍成3D能稍好，对，海豚、鲸鱼、不知道是什么的鸟捕鱼那段也还行。。。本来看到说5年拍了这一部电影想给加一分，后来又想5年一个故事都没讲明白也说不过去了
266,海洋,3,每一个画面都美得可以做桌面的一部电影..但不能称为电影是真的
267,海洋,3,珍爱生命，远离人类。自然很难拍，但最难拍的还是人性。
268,海洋,3,前半部《动物世界》 后半部《探索与发现》的说教版 说实话这种主题的纪录片我都已经看麻木了 也没感觉这电影有什么新意 画面和色彩应该请张艺谋团队 配音应该请张忠祥 友情演出的小正太改为林妙可 渔船为日本渔船 污染环境的城市景用中国随便一沿海城市 拍出来比这牛逼多了
269,海洋,3,不是不喜海洋，只是不喜这种风光幻灯片式的奇观纪录片，就如同我不喜欢[鸟的迁徙]，若不是在大银幕看得真切，定然会昏昏然睡去。而本片CCAV式的旁白和最后部分的刻意环保化，让整部电影彻底廉价掉。还是更钟意[微观世界]和[喜马拉雅]，一个够微观，一个够圣洁。
270,海洋,3,即使波涛汹涌的大海，看来都有种让人沉静的力量，看的我也好想在海里遨游哦……所以这样的平和美好被破坏才会更令人痛惜吧。好长的动物世界海底篇欣赏……
271,海洋,3,电脑看这个味同嚼蜡。。。
272,海洋,3,大家是都没看过动物世界还是人与自然还是探索频道？音乐不错，海浪冲撞灯塔和船只的镜头也不错
273,海洋,3,可惜，没有故事线。捕食杀戮的配乐好赞。<9.14>
274,海洋,3,无言，不评，不差。
275,海洋,3,感觉与Earth系列有一定差距
276,海洋,3,never sick at sea的么
277,海洋,3,这片应该标注：密集恐惧症患者谨慎观看！！！
278,海洋,3,对于一个每天守着动物世界看的童鞋来说，木有什么太多惊喜，也木有科普解说词，也木有故事，严格意义来说，就是部上大荧幕的精美版动物世界。严重同意倡议词！吃鱼翅的人，都中毒去吧！！！
279,海洋,3,镜头没的说，几乎做到极致了！但前面有《海豚湾》比着，总觉得少点升华、少点深刻~
280,海洋,3,拜托，哪值得这么夸张的分数啊。除了摄影外，整个都很乱啊，结尾还要跳出来说教一通，前面根本没铺垫好好么！类比而言，就是一条采访做得很NB，但稿子结构叙事什么的一堆问题总之就是写得很差到结尾还莫名其妙要拔高度的片！当然，画面是真漂亮。
281,海洋,3,第十三届上海国际电影节 大上海1厅 13：30 40元 with姚&花 http://movie.douban.com/review/3367476/?post=ok#last
282,海洋,3,在看这个的都是老爷爷老奶奶
283,海洋,3,不如作者的前两部作品，也不及莱妮的《水下印象》。另外，解说完全没有必要，画蛇添足，多此一举。
284,海洋,3,有点失望了……姜文的生意有点突兀……电影的节奏很诡异。
285,海洋,3,再好的画面和配乐，如果只是堆砌在一起，又有神马意思呢？
286,海洋,3,还是很害怕
287,海洋,3,只是美而已，平静得缺少情感，不适宜独赏。
288,海洋,3,海洋动物影像纵览，但缺乏海底奇观，基本上是常见的动物，最美镜头是片头加拉帕戈斯群岛的海蜥蜴仰望夜幕中升起的火箭。配乐先行，主题肤浅，画面优美，结构松散，比BBC纪录片差了一个级别，唯一优点是音乐和画面结合得很好，舒缓。
289,海洋,3,没有传说中那么好，什么都讲了一点，又仿佛什么都没讲。林林总总的，蜻蜓点水的，又掺合了很多说教。节奏感应该再强一点，主线再突出一点。
290,海洋,3,视听哈赞，奇妙可爱的海洋生物们。
291,海洋,3,这。。。给五星的你们都是看正大综艺人与自然长大的吧
292,海洋,3,没这么好吧
293,海洋,3,艺术家的海洋
294,海洋,3,要是还有小时候看动物世界的心，肯定给满分，可惜这是一部电影
295,海洋,3,人类对海洋的了解是如此匮乏，却已把它破坏的满身伤痕。前半部分有些像动物世界，但由于篇幅关系无法展开太多，所以很局促的感觉；中间部分开始探讨人类对自然地破坏，依然没有展开。收尾表示现在改变还来得及。整体像篇标准的作文，拍摄很漂亮，但觉得篇幅限制导致每一部分都太碎。
296,海洋,3,"画面超美，多给一星。就是不喜欢这种太过慢、乏味的。。。
纪录片没凸显出记录片的性质。更喜欢《海豚湾》型的。。
但还是提醒着我们，人自己作啊"
297,海洋,3,N和K的电影周~
298,海洋,3,不如预期。
299,海洋,3,画面够美，但是和同年上映的另一部自然纪录片《家园》相比，真的很没创意。解说是这类片子极其重要的一部分，但是这部片子的解说极其差劲。
300,海洋,3,还行是给摄影打的。导演明显做的力不从心，姜文的断句和语气不敢恭维。不知道姜文的个人魅力居然可以迷惑这么多人。老子就是不喜欢。
301,海洋,3,觉得很一般，没必要给那么高分吧，我还是比较喜欢BBC的纪录片。
302,海洋,3,impressive and educational indeed，but I dont see anything else。
303,海洋,3,不知道导演想说明什么，故事性巨烂。但是有一些镜头很美。
304,海洋,3,"国家地理海洋集合版~没海豚湾感人好看~有些画面还算不错~整体还是小失望,难道是对它期望太高了~~"
305,海洋,3,无视电影院里那些吵闹的小孩，还是很适合和喜欢的人一起去看。世界那么大，好好珍惜吧。
306,海洋,3,看睡了都 没特点
307,海洋,3,挺害怕的 壮了壮胆才敢看 受不了海水 受不了...
308,海洋,3,说实话吧 纪录片也是应该有主线的 挺好的题材和大银幕优势沦落为超长版的动物世界海洋篇很浪费 姜文声音不比赵忠祥差 但是拍得没有主线而且没有价值观导向 虽然海豚湾那种邪恶的价值观战让我反感 但缺少创造力的纯记录真心不如动物世界
309,海洋,3,视觉有冲击力
310,海洋,3,豆瓣电影里的纪录片果然分数都很高，呵呵，它真的值9.0分吗
311,海洋,3,评分虚高，不过有些场景还是很震撼。
312,海洋,3,大海挺美的，不过也没有让人类很喜欢，我觉得有句话说的对，人类想保护环境不过是为了保护自己，如果人类灭绝的，所谓的污染或者什么，对于地球什么根本不算个事情，火星什么不就那样子么，其实就是要保护自己而已。海洋挺美的，我表示有些镜头没看到，难道是删节版本，好吧
313,海洋,3,很好听的片尾曲 很美的画面 特别是座头鲸集体冒出海面那一段 可是有点看的昏昏欲睡。。。还是更像纪录片些
314,海洋,3,陈词滥调，不如选择看美国国家地理的纪录片系列。
315,海洋,3,不好意思打两星，真的不咋好看，旁白配的很多余很多余，不过海底动物还是很有看头的，总觉得自己再看动物世界，还不如看蓝精灵去呢。。。拍摄这些镜头不容易吧+好感
316,海洋,3,让我在第三遍才坚持看完的电影真的不多，悲催的是直到看完了也不明白它为什么有这么高的分数。就当看了半个风光片吧。
317,海洋,3,画面挺好看，但是没什么实质性的内容
318,海洋,3,我一直在想，这个片子如果叫赵忠祥旁白，会是什么效果呢。
319,海洋,3, 雅克・贝汉的玩意总是缺少主线，这样的纪录片+教育片算出来的环保片，力度是不会够的。
320,海洋,3,论美感，雅克・贝汉又不是吕克・贝松；论主题，《海洋》也不是《海豚湾》。期待太高了，失望得很。
321,海洋,3,纪录片，还是看bbc吧
322,海洋,3,人类叔叔真是讨厌。非要破坏这样的美景和奇特的生物。
323,海洋,3,光宣传是没用的 
324,海洋,3,没有传说以及想象中好看，素材不错，但是感觉剪辑凌乱，内在逻辑性弱
325,海洋,3,真心不觉得有多好，感觉就像动物世界的海洋合辑。
326,海洋,3,我敬佩这部“电影”，从制作到内涵，但是真的不是几个好镜头好画面就能称自己是电影的。
327,海洋,3,其实我觉得..就那么回事吧。鱼翅我没吃过，所以我鄙视吃鱼翅的，占领道德至高点的赶脚好好。
328,海洋,3,只有单纯的画面，看着看着就困了，感觉适合在海洋馆或者博物馆的放映厅里播，要是配上赵忠祥老师的解说就完美了
329,海洋,3,没有情节，没有故事，只是在用一幅幅画面诉说着海洋的美丽，而人类却在一点点扼杀这自然的恩惠。
330,海洋,3,只是画面很美，剪辑点很惊喜罢了……
331,海洋,3,我只能说~确实很容易睡着~~~
332,海洋,3,没有想像中的好
333,海洋,3,平庸到无话可说
334,海洋,3,一般般。算不上很喜欢。
335,海洋,3,画面很好，可惜没有感情。小动物们都很萌，人类很猥琐。坑爹的电影院，中文配音真是让人汗颜==
336,海洋,3,昏昏欲睡。猎奇展示性质浓重，环保内容生搬硬套，说教也陈词滥调，姜文的国配也救不了翻译的低劣。3星全给牛掰摄影与优秀配乐。这片该改名为海洋交响曲，还是印象派的 @MOMA当代百老汇
337,海洋,3,如果]有最後叨叨絮絮的f教就更好了。
338,海洋,3,法国电影展最有人气的一部作品，不过我个人觉得与《深海传奇》差不多，没有本质上的优势
339,海洋,3,问题在于前半段是风景片，姜文版动物世界，各种赏心悦目美丽画面，后半段突兀地变成环保片，倒也不是说让人跟不上，只觉得没有杂交的必要。一星给配乐。
340,海洋,3,法国人拍的就是散
341,海洋,3,我不喜欢什么电影最后都有个政治主题
342,海洋,3,人类的聪明才智弄脏了海洋
343,海洋,3,绚烂美丽的海洋世界
344,海洋,3,很美，但是可能纪录片不是我的菜吧。
345,海洋,3,"加长版动物(海底)世界,真没听出来是姜文...."
346,海洋,3,画面很漂亮，最后让我觉得硬生生地扯上环保…螃蟹群殴很有意思~
347,海洋,3,华而不实~
348,海洋,3,远远不及《蓝色星球》，失望。
349,海洋,3,很美，但太散了，我即使从其中任何一处看起，任何一处结束，都觉得会是完全一样的效果。
350,海洋,3,太简括了~
351,海洋,3,密集事物恐惧症症状严重，不是欣赏是折磨了。
352,海洋,3,尿点太多。你问有多少？全片都是。
353,海洋,3,睡了两觉
354,海洋,3,屏保
355,海洋,3,海洋生物恐惧症
356,海洋,3,我自比自己是鱼，说明你要找的还有更多
357,海洋,3,老头和小孩纯属败笔，最后说教意味过于浓烈，实在遗憾。
358,海洋,3,雅克h的水平不只是@印
359,海洋,3,"主题散漫 音乐不错
"
360,海洋,3,动物世界剧场版
361,海洋,3,这真的不是电影，就是好看的画面的集合。
362,海洋,3,看得我都流口水了
363,海洋,3,人类残暴的行径令人发指：鲨鱼被割掉侧鳍、背鳍以及整个尾部之后再被扔回海里，光秃秃的鲨鱼只能一边淌血一边扭曲挣扎；影片配乐和画面搭配，大气磅礴；国语解说是姜文，对大导演赞一个。但故事性较差，情节平淡缺乏高潮，有点像动物世界。
364,海洋,3,为什么那么多人觉得好看？！打高分人多了就不好意思不装逼么？！
365,海洋,3,3.5。超长公益宣传片。甲壳类动物太逗了，一群螃蟹那是集体相亲么。g点你要使劲戳啊导演！！！要不你还不如完全不要戳！！！
366,海洋,3,有点过分诗化了
367,海洋,3,面画不给力，说教味太浓
368,海洋,3,我能说这片挺乏味的么？
369,海洋,3,剪辑得很琐碎，相较迁徙的鸟而言没有主线和逻辑，后面直白的说教感觉不好……第一次在电影院看这种科教片，大屏幕表现下的海洋相当震撼。抹香鲸最美了最美了>_<
370,海洋,3,根本不像个法国人拍的纪录片，还是喜欢《阳光宝贝》那种纯粹热爱、干净淡泊的路子，如果说纪录片也要讲故事的话，《海洋》明显的起承转合张弛节奏都太好莱坞范儿，什么时候卖萌什么时候紧张，什么时候说教什么时候煽情，一步步倒是稳妥又恰到好处。
371,海洋,3,希尔很可爱
372,海洋,3,还不如直接去海底世界比较好看。。。。还是动物世界比较好看。。。
373,海洋,3,节奏有点儿乱
374,海洋,3,除了壮阔的美丽，大海的可怕一面，雅克・贝汉没有说。
375,海洋,3,画面很美，但........我睡着了
376,海洋,3,雅克・贝汉是个一直坚持用镜头讲故事的导演 但是这部影片丢掉了《迁徙的鸟》里的那种情感内核…
377,海洋,3,顶着内心对记录片的抗拒，看了海洋。装一把纯文艺青年吧，结果发现自己真是没到那个境界，看着实在无聊，心里起急！看得出来这片子花了很大的心思拍，画面上、动物的选择上、搭配的音乐上都比动物世界强太多了。让我记忆最深刻的就是，数不清的海鸟从天而降捕捉海面的鱼的情景，粉帅！
378,海洋,3,摄影和声音牛逼，题材讨巧，姜文的配音大便一样。
379,海洋,3,可惜不见深海，纯视觉流了…
380,海洋,3,放在电影院里看的动物世界
381,海洋,3,画面很美，非常美，内容倒没那么丰富，另外，那个孩子实在是很像一个外星人。
382,海洋,3,我就不明白，是个纪录片就能在豆瓣睡混个高分，不就是中国二十年也拍不出这样的纪录片吗。打五星的是不是因为治好了各位的失眠啊？ 
383,海洋,3,画面很好，纪录片的画质，解说和镜头感感觉不强。
384,海洋,3,给三星一定会被鄙视…但我真的对这种动物类的纪录片无感…我发誓这真的与密级恐惧没有半毛钱关系！
385,海洋,3,作橘Y深discovery^ @部影在热萆Ыo我的新意不多 narrator的也不是我喜g的型 (喔! 如果是BC砼湟!.. 我是e幻想了) 三星近三星半
386,海洋,3,每一个镜头都很细心 还有呢？
387,海洋,3,9.1高的分，不至于。这电影对不住五千万欧元，比《微观世界》差远了。影片缺少科普性的解说，比如看到蟹斗、游弋在大鱼身边的小鱼，观众都会困惑这是什么自然原因？人类污染海洋处却说了一些不必说的话，镜头的表现就足够了。另外，对如此多的镜头缺少设计，显得杂乱看不出章法。
388,海洋,3,结构混乱旁白无力自不待言。第一次看到如此呆萌的海洋生物：跟着海龟喘气，跟着龙虾耍爪子，跟着海鳗扭动，好快乐的观赏体验；看到海蟹叠罗汉时彻底惊了！环保部分移情作用失调，“我们有义务保护他们”，一副糟糕的救世主嘴脸，渣。P.S. 推荐BBC的《Human Planet》。
389,海洋,3,和其他几部没得比，主题太大，中心就散。/ 下辈子做条鱼~活得久点，想去哪儿去哪儿……
390,海洋,3,我个人认为本片的导演和编剧雅克・贝汉先生严重浪费了野生摄影团队的心血。他非常不明智的尝试以文载道，但所有的论据论证都显得仓促随意，就这个问题Cove比它做的好。有了那么好的素材，不如直接展现美，让它为自己证明。
391,海洋,3,这片太困了。。。
392,海洋,3,更多惊喜 就在探索频道~
393,海洋,3,不小心选了很差的座位，严重影响观影，扣一星...
394,海洋,3,与BBC相比，这片差太多了
395,海洋,3,感触不大，如果有物种介绍该多好啊，动物世界或者探索就更好。海底确实是另一个世界，海底平原真漂亮。
396,海洋,3,还好。但解说真跟中国的赵忠祥老湿似的。。声音不够吸引。如若能来个《第十放映室》什么的那家伙的声音就挺好
397,海洋,3,无感觉 但还是喜欢水
398,海洋,3,美是美 可是能看得我在电影院都睡着
399,海洋,3,海洋萌物+谴责人类。
