,movie,star,comment
400,海洋,2,我很难理解为什么这个片子能得到9.1分。豆瓣的小清新口味是这样的？全片镜头乱切。没有主题和主线。想说什么也不明白。欲言又止的谈了下捕杀，污染和灭绝。但就是欲言又止的感觉，很太监。我一直在思考本片和一部加长版动物世界的联系――缺少赵老师。其实我倒更期待有找老师来介绍下我不认识的动物。
401,海洋,2,动物世界加长版，另外我不喜欢这种一本正经的说教。SIFF
402,海洋,2,鲸鱼那一段实在让人大失所望!
403,海洋,2,摄影还是不错的...不过...
404,海洋,2,自大狂
405,海洋,2,一如鸟的迁徙，这样的片子让BBC去拍就可以了嘛。整个片子竟挑些漂亮的画面，所依靠的却是十分浅显的环境学和生物学知识。无趣得很！
406,海洋,2,盛名之下，其实一般。假如你们非要把它捧上天，我只能说，亲，去多看两集动物世界吧，这片子表现主题的方式幼稚，而且基本没有故事性可讲。我敢保证动物世界一半以上的片子都比这个好看。
407,海洋,2,解说词太少，条理不清，贩卖环保理念，比起61地球脉动62之类差太多了。
408,海洋,2,是去看风景的orz
409,海洋,2,姜文的配音毁了一切
410,海洋,2,左派环保主义者阴谋大片
411,海洋,2,去看discovery不就好了~
412,海洋,2,海洋好美，动物们好美好自由，有些向往那种纯净的自由自在的生活。但作为电影，影片实在太乏味了。
413,海洋,2,这样的纪录片拍得很好。但就是，对我来说没有任何意义
414,海洋,2,片头我就看不下去！！！对这种自然界的生物天生没有好感啊！！！！！！！！1
415,海洋,2,浪费时间
416,海洋,2,很难完全认同这种价值观，至少没有完全展示海洋。人类是很残酷，但是海洋本身就像画面一样唯美么？这就是为什么看的时候，孤舟在风浪中航行的画面比被砍了鳍的鲨鱼坠入海底更揪心。
417,海洋,2,去电影院看的，就为了海豚。。以后知道了，这种科普片就等着discovery来播就好。。
418,海洋,2,睡死过去了
419,海洋,2,结构上杂乱无章，旁白无力，脉络不清
420,海洋,1,真不懂分数怎么这么高  
421,海洋,2,很一般
422,海洋,2,你真的知道你在拍什么吗？
423,海洋,2,画面很好给一星、拍摄难度再给一星。没别的星星了。因为根本没有任何剧情，单纯一部“请您欣赏”。
424,海洋,2,我不是有意拉平均分的。。。确实是看着就睡着了
425,海洋,2,保护海洋生物的说教，我只能说我本来对水产就没兴趣。同样作为一个没有闲钱玩象牙制品的人，对地铁里保护大象的广告感到意义不明。尼玛玩象牙的谁天天坐地铁啊
426,海洋,1,导演想把海洋的魅力、人类的入侵都展现出来，但想要表达的东西太多，没有一样是说清楚的。旁白很莫名其妙，音乐不出彩，画面太杂乱，老人太刻意，小孩太呆板，虽然它的主题毋庸置疑。
427,海洋,2,逻辑混乱 叙述混乱 旁白牵强 人物牵强。仅仅是美丽画面的堆积。
428,海洋,1,本来想给2星，看到这么多5星，我觉得我还是离他们远一点好；有四分之三的画面重复；我怀念赵忠祥的动物世界；直接破坏了我的约会，因为她一直哈欠连天
429,海洋,1,搞到最后还是成了环保片。质疑配上煽情音乐的所有片子
430,海洋,2,连故事都不会讲，拍什么纪录片！
431,海洋,2,耗资5000万欧元，动用12个摄制组、70艘船，来告诉我们什么叫环保~
432,海洋,2,过于平淡了
433,海洋,1,睡觉电影
434,海洋,2,小王八们太倒霉了...
435,海洋,1,Life source.|矫情。|缺少动物灭绝对人类的影响。
436,海洋,2,不是因为它公益就一定要打高分~
437,海洋,2,我真的缺少发现美的眼睛
438,海洋,2,原谅我看着看着睡着了。。。 加长版的动物世界。。。
439,海洋,2,拍的还没纪实频道的纪录片好。。。姜文的声音挺好听的，但是作为旁白配的是在太逊了，好生硬。。。今年到目前为止除了 《巴黎宝贝》 以外 我最后悔进影院的一部了
440,海洋,2,中央九台
441,海洋,2,睡着两次，很催眠
442,海洋,1,看了十几分钟我就后悔想退场了…之后我唯一的念头就是怎么还不演完啊…要不是旁边的小孩时而大笑，时而狂哭，估计我又要看睡着…豆瓣上的评分怎么这么高…
443,海洋,2,催眠大片，伪文艺
444,海洋,2,弱
445,海洋,1,一部将赵忠祥的动物世界转给姜文的故事
446,海洋,1,当时的我好困
447,海洋,2,我觉得这只能是部及格的记录片
448,海洋,2,比纪录片还纪录片
449,海洋,1,看了一半，在看不下去了，好啊，看得我昏昏欲睡~
450,海洋,2,我在电影院。。。我看睡戳了
451,海洋,2,动物世界，坑爹
452,海洋,2,拍的画面挺美的，但不是我喜欢的电影类型。
453,海洋,2,睡着了
454,海洋,1,"照比BBC的《planet earth》 以及《human planet》差的不是一两个档次，和《HOME》比也差好多，甚至不如【国家地理HD】,【探索频道HD】的节目，除了鱼翅那段无其他亮点，一星足以"
455,海洋,2,睡着了......
456,海洋,2,坐到影院满怀期待，却发现1年前就看过了！
457,海洋,2,100分钟的动物世界里用20分钟来呼吁这部电影真的大丈夫？
458,海洋,1,至少在电影院真的...会睡着，以及密集物体恐惧
459,海洋,2,不好意思我是个俗人 这我真不如大众 看得没那么开心雀跃
460,海洋,2,睡着了
461,海洋,1,像是一本没有目录，也几乎没有文字的摄影杂志，全是图。一星给摄影师。
462,海洋,1,花了30块钱看了一个半小时的鱼游来游去的屏保。。。。。。。
463,海洋,1,没看懂~~~
464,海洋,1,把说教去掉，人类也是自然的一部分，就如摄像机也是自然的产物一样。
465,海洋,2,谁TM说好看的，看过纪录片没有，这玩让我都快睡死在电影院了
466,海洋,2,啊全是水
467,海洋,2,失败，对于纪录片爱好者而言简直是灾难。浪费我的期待和时间和银子。
468,海洋,2,对于拍摄而言是个突破，但情节等一点也不抓人，感觉花钱去电影院看动物世界。不必那么趋之若鹜，没宣传的那么好吧，就算姜文配音又能如何。。。
469,海洋,2,大海啊，不全是水。
470,海洋,2,影版的【人c自然】，不^……人c自然的v解部份都比你多啊！你多就算【您欣p】吧！
471,海洋,2,对不起，我不小资，我也不文青，我是真的要看睡着了。特别是对于密集恐惧症的人来说
472,海洋,2,我真的在电影院里睡着了！前排的小孩子们也睡得很香。。。
473,海洋,2,不敢说是片子不好，是我有海洋恐惧症，对我来说，这是十足的惊悚片。
474,海洋,2,没有赵忠祥配音的加长版人与自然。我欣赏不来。。。。。。
475,海洋,1,无聊死了！！！
476,海洋,2,"就跟纪实频道的片子差不多
看点有些乏味 就没有看完"
477,海洋,2,电影院。浪费钱
478,海洋,1,头回在电影院想睡觉！朋友在旁边酝酿了几分钟直接去和周公party了…整一个巨幕版动物世界，唯一的区别就是该赵忠祥解说改姜文了…这种片子在discovery频道播播得了，坑爹的！
479,海洋,2,豆瓣九分以上的电影以后我还是不凑热闹了。
480,海洋,2,不要拿动物世界冒充电影
481,海洋,2,"当然，不说题材、内容，（海洋纪录片肯定是大手笔，肯定会付出很多，并且纪录下来的也绝对是稀奇的，观众喜闻乐见的），单纯说本身的拍摄质量来讲：
这拍的是啥玩意啊。。小学科学课科普ppt？
不过还是有些极好的镜头的（夕阳海豚最佳），虽然基本只是昙花一现，但出现的时候确实被惊艳到。以及至少还融入了一些思想的，也算是终于没有被完全做成ppt。
（单纯发泄：砍鱼翅一段实在是心痛到无法呼吸，吃鱼翅的你全家bs。）"
482,海洋,2,看完之后好想吃三文鱼刺身
483,海洋,1,这真的是我看过的最没内容最没亮点最没激情的纪录片 就是个风景摄影
484,海洋,2,与《迁徙的鸟》差太远。
485,海洋,1,低俗的人儿是觉得难看的。
486,海洋,2,前一个小时很沉闷，看多了蓝色让人昏昏欲睡，而且很多都是科普节目里面看过的片段。和爸妈在青年宫看的。票很贵，有点坑爹。
487,海洋,2,觉得无非是个电影版的动物世界，过分科教的味道让我各种不适应不舒服，而且有点越看越瞌睡的感觉。或许海洋是个神奇的世界，但是，没有故事和趣味的电影，在中国市场，不免沦为给小孩子看的超长版的动物世界。对于成人，对于在中国生活的人，弱肉强食我们已经看得太多，无论是办公楼，还是大街。
488,海洋,2,给差评哟~亲！怪我真的不懂欣赏，途中很想睡觉N次。
489,海洋,2,这是长达100分钟的海洋环境保护公益广告。画面美不胜收但看得昏昏欲睡。找纪录片看都比看这强。如果小时候喜欢动物纪录片那就更不推荐了――你能说出绝大多数出场的动物，你也很明白导演想说啥，这将会是让你无比煎熬和无聊的100分钟。
490,海洋,2,以后再也不啃自然纪录片了，对我来说很无聊。后半段突然旁白说教感觉很教条，我不喜欢。
491,海洋,1,一星是给卖力参演的动物的。。。
492,海洋,1,看不下去
493,海洋,2,《动物世界》精选版么？
494,海洋,2,我承认我低俗，我看不了这么高级的纪录片，都要睡着了……
495,海洋,2,"本来就困,差点没睡死过去,麻痹万达不排普通厅,还是VIP厅才有放,是今年最贵的电影和演出了吧"
496,海洋,2,没看完。。。
497,海洋,2,看见环保就恶心
498,海洋,2,大自然让人昏昏欲睡，好多海鲜……
499,海洋,1,不行我要开始吐槽了 这什么科普片啊CCTV天天都播吧 想不通为什么口碑会那么好 如果想看这类题材的还不如去重温下海豚湾 海豚湾那才叫真正的震撼啊
500,海洋,2,看得快睡着了，感觉跟动物世界没差
501,海洋,2,姜文配音版的动物世界？
502,海洋,2,作为纪录片，拍的不够好，没有任何主线，只是画面的堆积
503,海洋,2,会动的明信片集合。看到第十二分钟。可以关掉了。
504,海洋,2,看睡了。
505,海洋,2,好多场景都是第一次看到呢，可惜看电影的人都懂这些道理；而真正应该受教育的人却从不看电影。
506,海洋,2,看得睡着了
507,海洋,1,节奏超慢，不知所云，说教十分老土，忍了10分钟崩溃了。生物题材的东东，还是去看DISCOVERY或者BBC吧……
508,海洋,2,和动物世界比差远的，不负责任的纪录片
509,海洋,1,这是我这辈子在电影院看过的最烂的电影，说好看的应该都是站在10岁以下儿童的角度说的，电视里放的动物世界都比这好看
510,海洋,2,WTF豆瓣评价怎么那么高，上它老当，我反正欣赏不能！
511,海洋,2,知道要保护海洋和海洋里的生物，但是这个片子不够吸引。
512,海洋,2,马马虎虎看完了，没感觉~
513,海洋,2,浮光掠影，被高估的 OCN1101。
514,海洋,1,如果是纪录片，给四星，如果是电影，给一星。画面确实很震撼，但影片没有主线，就如同人没有脊柱，站都站不起来。比如海豚跃出海面，第一次看确实很美，过20分钟又放一遍是闹哪样？
515,海洋,2,素材堆砌，不会讲故事的人。
516,海洋,1,在电影院看着看着就睡着了
517,海洋,1,这种类型我接受无能
518,海洋,1,跟80年代似的。
519,海洋,2,比较差，不如bbc拍的，而且英文原声带有很浓厚的法国味道，不推荐。
520,海洋,2,以为是电影，原来是海底世界啊
521,海洋,2,不是我的菜，没有地球脉动好看，另外，姜文在哪里？
522,海洋,2,也就是动物世界的感觉啦
523,海洋,2,我以为讲的是海洋的形成和气候影响（一颗赛艇），但讲的只是海洋中的生物。我对“生物”这个概念毫无兴趣甚至厌恶，就像我厌恶“人类”这个概念一样。就拍摄难度这部纪录片可得满分，就内容和科普型而言，鹅，，，我难以给一个不存在的东西打分。
524,海洋,2,不是我的菜。感觉就是动物世界。完全不知道情节在哪。。
525,海洋,2,拍摄的素材和同类大型纪录片相比并无太多不同 只是稍加感性 不想走传统科普式纪录片的道路 导演希望不科普直接抒发感情 最后成品成了个四不像 不科普也看不出导演对大海的敬畏和深沉的爱 后半部的环保题材(参考：鲨鱼海洋 海豚湾…… )更是和整部电影格格不入 探索道路以失败告终
526,海洋,1,只有傻逼文艺青年才觉得这片拍的好。谁TMD在电影院坚持100分钟不瞌睡，站出来！我请你看三遍！！！！！
527,海洋,2,我只能说我不是看纪录片的料
528,海洋,2,感受到了海洋的美，但是感染力不足
529,海洋,2,一般
530,海洋,1,哎，这部电影应该改名叫《我拍到的一些海底好风景》，这样就比较紧扣主题了。
531,海洋,2,"没主线, 跟看剪辑版的动物世界一样, 无聊"
532,海洋,1,"拍得非常好, 但不要来假装电影"
533,海洋,2,动物世界。
534,海洋,2,对这种片子实在无感
535,海洋,2,好好拍纪录片，不要环保说教。拜托
536,海洋,2,这个片给5星的没有看过动物世界吗？人也是食物链的一环，如果低级食物链被消灭太多，那么就会导致人类大面积死亡，接着就是低级食物链再繁荣，人类再繁荣，这才叫自然。人养猪养牛也是保护生物多样性的手段，很多环保作品只是情怀片而已。
537,海洋,1,纪录片 无聊至极
538,海洋,1,害死人啊
539,海洋,2,有一组镜头蛮有诗意的，但这种东西跟展览的区别也不大，实在太散了
540,海洋,1,一般
541,海洋,2,魂淡啊这样能拿9.1分！扯淡啊！人生第一部看到想提前离场的电影啊魂淡！
542,海洋,2,看的不是电影，是动物世界。不如BBC的
543,海洋,2,用了所有努力让自己别睡着。。旁白自顾自的文艺 看的我云里雾里。。很生硬呀 每段镜头和主题的切换
544,海洋,1,以人为本，动物只能牺牲
545,海洋,2,这纪录片。。。不适合我看。。。相较之下更喜欢看Discovery里的海洋世界
546,海洋,1,画面很美，很真
547,海洋,2,电影院看的，感觉没理由看第二次，除非未来要陪小朋友。小时候类似的vcd和书看过很多。
548,海洋,2,居然没有拍出我钟爱的深海恐惧症既视感。
549,海洋,2,在电影院睡着了
550,海洋,2,一部没有解说的纪录片…
551,海洋,2,"怎么觉得以前看过的,忘记什么时候下载看过的了."
552,海洋,2,没有剧情，看得云里雾里。硬撑着看了二十几分钟，实在不知道在表达什么。就算不给旁白，不解释发生了些什么，给个字幕也行啊，标注一下那些生物都是什么也行啊。拍得很好很美，但感受不到它的思想。
553,海洋,2,太散了
554,海洋,2,很好的片子，我也非常喜欢动物，曾写了几十期博物学短文。但评故事，这里没有一点儿故事，所以低分。
555,海洋,2,上完厕所回来正赶上结尾，看到一小孩和一大人背影，俩人眺望大海展望未来～镜头拉远到太空，宇宙卫星鸟瞰地球，之后出字幕，散场。本来想看看动物陶冶下情操的，前面一般，结尾太烂，环保主张拍的也够无聊，失望。
556,海洋,2,画面很好看的影版动物世界。
557,海洋,2,果不其然，雅克贝汉的作品，前几天刚看完迁徙的鸟，现在再看这个感觉似曾相识的手法，sorry，他的作品我欣赏不来，不谈
558,海洋,2,海洋世界配乐版
559,海洋,1,08
560,海洋,1,为毛这片9.2分啊。。 我层次太低理解不了啊 ！！
561,海洋,2,海洋世界画面动人 但实在很无聊
562,海洋,2,给二星是因为，纯粹觉得是去看了一场画展。片子逻辑没跟上，该解说处却多是留白，几个回合下来，姜文说的话没超过两百字吧？
563,海洋,1,到电影院看的第一部电影……
564,海洋,2,盛名之下其y！旁白被面甩出100l街。亮c碜阅切┥舷玛P接的瞬g面。
565,海洋,1,"这部看一半去午睡，被mini异常的声响吵醒，送医院抢救无效，历历在目，过程不表，事隔8年，再也不看海洋。未曾忘，不愿忘，也不忍忘。
"
566,海洋,2,没有看出哪里好看 想看这个电影的时候 还遇上电影院断电改时间 呵呵
567,海洋,2,感觉不就是动物世界吗……
568,海洋,2,平庸，主线不清晰，转折生硬，试图从宏观层面把握海洋，联系历史与人类，却只显得空泛，大而无当
569,海洋,2,看@N]有思想和情感的游锏降啄难e有趣啊除了拍得很漂亮
570,海洋,2,刚开始被某些场面镇住，然后到后来……睡着了，好吧
571,海洋,2,像真人秀一样。 我个人比较喜欢严肃派的纪录片，能客观真实记录地球上的一切。片里的主持感叹词也太多了，对很多动物有太主观的评价。减去一些惊呼和毫无疑义的感叹，增加一些科学可靠的解说会更好一些。蓝色星球是个非常好的榜样，毕竟是纪录片。
572,海洋,2,主体思想不明确，和动物世界差不多，不值得一看
573,海洋,1,我不明白着也可以这么高分，怎么不直接上海洋世界了？完全没意思。
574,海洋,2,我看的是假的吗？
575,海洋,2,几个月前看的一部冗长的无聊片子
576,海洋,2,下了高清版，还是没耐心看完
577,海洋,1,和动物世界有啥区别
578,海洋,2,有点失望，感觉像本来期待一大锅羊蝎子结果只上来两三块肉。。做动物世界目录还差不多
579,海洋,1,难道我看的删减版？
580,海洋,2,画面感觉挺好的，就是硬要往环保上扯
581,海洋,1,真的没内容，法国人大概脑子进海水的，这个也能叫纪录片，大家看鱼乐无穷就好了啊！菜场也比这个有内容！我是不是太刻薄乐啊哈哈哈
582,海洋,2,剧情无逻辑。。演说很枯燥。。。
583,海洋,2,感觉较之以前的《迁徙的鸟》相去甚远总感觉这次的电影还没行星地球拍的好
584,海洋,2,虽然场面美，到这称不上电影吧，还不如中央电视台的动物世界纪录片带讲解的有趣好看
585,海洋,2,#感官愉悦#马戏团#滤镜中毒
586,海洋,2,个人感觉不如之前看过的几个记录片，帝企鹅日记、北极熊和海豚湾，而且差距不小，后面猎杀和污染海洋的场景还算可以，影院不少人都提前离场了，还不如动物世界呢
587,海洋,1,第一次看到睡着的片子，只能打一星，不能再多了
588,海洋,2,剪辑一塌糊涂，白瞎了这么多好素材
589,海洋,2,ppt
590,海洋,2,环保是必要的 但没有＜海洋＞我一样拒绝食用鱼翅 一样憎恶日本借科学实验的名义捕鲸的行径 一样认识那些色彩斑斓的小鱼 不懂那些说好的人被震撼在那里？
591,海洋,2,爪机的原因吗！一个小时之后完全看不进去！每五分钟想休息一会儿的冲动！看不出画面优美气势磅礴！算了不打算看完了。
592,海洋,2,影片缺乏凝聚力
593,海洋,2,不如鸟的迁徙，帝企鹅日记这些同类型片，给两星是为了平衡下豆瓣的评分，居然9分，骗谁呢
594,海洋,2,弃了 看不下没什么解说的纪录片 看着想睡觉 明明不是电影强行加电源标签
595,海洋,2,装逼的评分，加上以前的经历，从此再不信豆瓣！！！
596,海洋,2,大海啊，不全是水。
597,海洋,1,唯一一部在电影院看睡的电影。。。
598,海洋,2,看不来纪录片
599,海洋,2,最烦环保电影了，都是屁。
