,movie,star,comment
134,新龙门客栈,5,太爱邱莫言和周淮安打招呼的小把式，太爱金镶玉的顾盼神飞，终于get到了梁家辉的帅点，感觉林青霞在这里面有点老了，岁月真是不饶人
135,新龙门客栈,4,张曼玉真是风华绝代啊，林青霞有几个镜头总有东方不败的感觉，梁家辉和甄子丹的风头早就被这两位影后抢光了。经典武侠之作。
136,新龙门客栈,4,现在想来，1992年的《新龙门客栈》之所以成功，是因为里面的每个人都有血有肉，剧本好、人物好、演员好，什么东西都对，所以一部好片子就这么诞生了。”
137,新龙门客栈,5,无删减，完全老版重映，国语配音尚可接受。最后的乱拳打死老师傅很cult！各种怀旧，各种风情，五星力荐！
138,新龙门客栈,5,甄子丹演活了一个曹少钦，张曼玉演活了一个金镶玉，林青霞演活了一个邱莫言。即使是在大陆上的普通话版本也很精彩。本来以为是两人包场，想不到这一场有30多个观众，还以年轻人居多，真的好感动。只是观影途中不时有看过的观众进行剧透，有点小郁闷。要看就看经典版，神马飞假飞饼都弱爆了。
139,新龙门客栈,4,"老版是徐枫的啊
张曼玉那时候还是年轻的风情，是个惊喜。
林青霞好像总是把主角演得像配角，还有《滚滚红尘》和天龙八部的那个电影"
140,新龙门客栈,4,如此风骚绝伦的金镶玉，如此隐忍而又俊美的莫言，以后再难有了。张叔平美术亮眼。动作方面，能让我这么一个非武侠迷看得眼花缭乱而不觉得重复、厌倦，如今的动作片实难做到。
141,新龙门客栈,4,最出彩的地方在于人物的塑造，首屈一指为张曼玉扮演的金镶玉，出场便让人感到这名角色已经无法再被超越；故事依然很武侠，由于人物错综，爱恨情仇，导致故事被人物所弱化了，气氛烘托的恰到好处，几处镜头极妙。
142,新龙门客栈,4,还可以。。。。。。甄子丹真心丑。。。。十年前就这样。。。。。张曼玉~林青霞~哎。。。。这样的女星现在已经绝种了。。。
143,新龙门客栈,5,多了金玉，故事瞬g就多了好多人情味。武打雒嬉策hx了老胡的日式Ψǎ回w鹘y中武b。甄子丹的造型真是雷死人，看了半天才J出是他。曼玉演的金玉真是^了，太^了，可惜《Tw甲》里s不了老娘。
144,新龙门客栈,4,小时候觉得很猛 现在看比龙门客栈差远了 稀松平常外加徐克的血腥卖弄 最棒的只有最后沙漠中昏黄的决战 以及那个鞑子
145,新龙门客栈,4,除了张曼玉的配音，其他我真心觉得蛋疼。尤其是林青霞，那么帅气的一个角色结果硬生生配成了苦情女主角。经典就是经典，经得住随便看。但是林青霞在这里的女装扮相确实没有张曼玉娇俏，张曼玉简直登峰造极了。够劲！最后还上演一出烈女缠郎，性情女子。
146,新龙门客栈,4,"又名: New Dragon Gate Inn / New Dragon Inn

导演: 徐克
主演: 张曼玉 / 梁家辉 / 林青霞

上映年度: 1992
制片国家/地区: 中国香港
语言: 粤语
imdb链接: tt0105859
"
147,新龙门客栈,5,原来这部#新龙门客栈#电影上了豆瓣top250，原来导演不是徐老怪，他当时只是六个编剧之一....
148,新龙门客栈,5,当年的港产武侠是多么优秀多么神奇。英雄情儿女情江湖情，一样样都是淋漓尽致叫人赞叹的。所以，电影有时候真的是个会倒退的东西。
149,新龙门客栈,4,今后每次想起《新龙门客栈》，势必会联想到《龙门飞甲》，真让人难过。
150,新龙门客栈,4,张曼玉的风骚老板娘很是成功，金镶玉露着大腿在屋顶唱歌，她与梁家辉的互相挑逗，处处透出一种野野的诱惑，但并不让人讨厌，这个角色相对于其他人的沉闷也是相当讨喜啊！
151,新龙门客栈,4,对武侠精神一直没什么见地。甄子丹扮相太搞笑，好多镜头非常cult。大漠的感觉倒是营造得非常到位。
152,新龙门客栈,5,重新看了一遍好好看啊。老片子虽然技术粗糙，而且背景是黄沙乱舞的沙漠，但是画面感仍然很好，动作戏也漂亮，剧情节奏都把握的一流，气氛渲染的超赞，两个女人的戏演得真是后无来者。哎……
153,新龙门客栈,5,林青霞一出场，我浑身就起鸡皮疙瘩。相比之下，重制的配音和剪掉的飙血镜头带来的违和感可忽略不计。
154,新龙门客栈,5,龙门客栈巴掌大地方里的爱恨情仇，多年以后我才认出那是甄子丹，也才理解那个‘没名没姓的年代’
155,新龙门客栈,4,曼玉这角色演的太经典了！！话说我是看完龙门飞甲又想着回来看遍这个，结果果然是毫无关系。。尼玛整的背景都一样。。
156,新龙门客栈,5,修复版出现在大银幕上，港片迷如我，心情之激动言语难表。片头就令人想鼓掌。色调修复得我很满意，细腻精美，但人物配音让人稍觉不适。人说乱世莫诉儿女情，其实乱世儿女情更深。周淮安，邱莫言，金镶玉，你们都太美好了！梁家辉，林青霞，张曼玉，你们都太美好了！那个时代的港片太美好了！
157,新龙门客栈,5,【2012/2/24 修复版】大漠孤烟，英雄儿女。刀光剑影，江湖旧梦。一直被模仿，从未被超越。
158,新龙门客栈,5,很经典
159,新龙门客栈,5,重刷。2006年4月13日标注。大漠风沙狂，龙门情义重。过客无归时，客栈终成土。
160,新龙门客栈,5,"特意下载英文配音一起看 结果童年的记忆真是有偏差啊 怎么张曼玉那么黄暴啊:""knockin' on ur mom's cunt"" 看得他全场吐槽笑得打滚 明明那么精彩 特别后面宰肉的把反派削成白骨 多么有冲击力的场景! 却给老子笑场! 还有大漠黄沙里打斗的4个影子 美不胜收! 给老子张大眼睛看清楚啦! 莫非是culture gap?!"
161,新龙门客栈,4,重制了画面、配音和音乐之后，给人焕然一新的感觉，说是在看一部新片也不为过。张曼玉的演出依然无比出彩，顾盼生姿眼波流转之间勾魂夺魄。回过头来觉得当年的动作设计还真是粗糙，反倒是《龙门飞甲》打得比较好看。无比怀念西厂厂花雨化田中……
162,新龙门客栈,5,为看《龙门飞甲》，在考四级的前一天完整看了一遍《新龙门客栈》。赞叹不已。虽挂名导演李惠民，但徐克武侠风格浓厚。金镶玉的国语配音绝赞！“我草你爹”不绝于耳。风情万种，各种疯各种骚。连东厂太监演的也是入木三分//修复版看完，画面修复完美。新国语配音太让人失望！操你爹变成去你的，弱爆了。
163,新龙门客栈,4,点灯啊吹灯拔蜡啊，金镶玉可真是个难缠却意志坚定的人，看到林青霞男人打扮，想到了赵薇，觉得赵薇将会走她的路线吧，这片子最厉害的就是那个削肉的小二，连少钦都抵不过那快肉刀
164,新龙门客栈,4,记得十几年前，看的《新龙门客栈》是露天电影，一群人老少爷们看的津津有味，经过录像厅、VCD、DVD、CCTV6十几年的洗礼后，重回大荧幕，依然看的津津有味，甚至还有一些莫名的感动。
165,新龙门客栈,5,这是这么多年之后，我们很少再见的武侠电影佳作。
166,新龙门客栈,5,此片可谓武侠电影史的一座丰碑。有人的地方，就有江湖。有江湖的地方，就有侠客。江山笑，烟雨遥，涛浪淘尽红尘俗事几多娇。张曼玉真是风骚到骨子里了，最牛逼的人物其实是那个鞑子，他那娴熟的刀法，让我想起双旗镇刀客里的孩哥。
167,新龙门客栈,4,重新修复后发现丹叔的腮红愈发地娇俏了，实景颜色都白亮了一圈，没旧版黄黄的有感觉，声轨也有点小问题，但是这样的老片，连配音听来都是如此悦耳，再加上爽气的打打杀杀说说笑笑，20年后看来仍是一条好汉呐，什么时候金铨的版本要能上映就更好了
168,新龙门客栈,4,从看电影不记名字起就记得这部电影最后太监被杀是白森森的腿骨 打斗非常犀利 画面色调非常到位 然后 嘿。。。毕竟是在我家拍的电影 啦啦啦~~
169,新龙门客栈,4,1992年的电影拍得却比多少201N年的电影更有电影该有的样子，看着这些经典毕业的导演们你们真心不惭愧么？曾经拍出过这样电影的导演们，看看你们现在拍的片子，你们真心不惭愧么？
170,新龙门客栈,4,"大漠无情，张曼玉美得一塌糊涂。
他说，我再也没有勇气面对这个沙漠。"
171,新龙门客栈,4,小时候就记得剔骨那段了，是恐怖片，长大了看得是武打，是武侠片，现在看的是爱情，是感情片
172,新龙门客栈,5,各种cult各种吊诡。。。。。金镶玉可劲造地风情，周淮安和邱莫言可杯具地闷骚。。。/ 20120225，电影院重温，那叫一个内伤无数荡气回肠！
173,新龙门客栈,5,中国西部片。无敌屠宰匠牛逼爆了，遁地术无影刀十步一杀，甄子丹惨被剔骨的镜头把我吓尿了，惊呆了，直到再看时，才发现只有这一幕还在我的潜意识里。温柔可爱的女神青霞，冷酷高贵的女王不败。
174,新龙门客栈,5,我们爱的是那个风情万种的张曼玉，我们爱的是那个侠骨柔肠的林青霞，我们爱的是英气十足的梁家辉，我们爱的是个邪气冲天的甄子丹。我们更爱的是那个从小就伴我成长的江湖，一个给我带来无限向往和神秘的武侠世界！
175,新龙门客栈,4,"果然粤语看着才够味,修复版就只有国语...徐克将西方动作片短快的连续分镜引入中国武侠片造就了90年代后明快的武侠风...英气十足的林青霞,风骚的张曼玉,帅气的梁家辉,这种时刻一触即发的剧情,看过新龙门之后总觉得新龙门的风格比起胡金铨过多长镜头的旧龙门来显得更加适合"
176,新龙门客栈,4,看到最后我才发现原来这个结尾我是看过的，龙门飞甲看起来是新龙门客栈的续集~比起那一场场精彩的客栈戏，龙门飞甲里的龙卷风大战简直弱爆了~
177,新龙门客栈,5,其实我超喜欢这部片的，想那最后从沙子里钻出来把人脚砍成五根骨头的场景，我就能猫躯一震……
178,新龙门客栈,5,徐老怪把武侠片拍成这样巅峰可说是活色生香精彩十足。小时候印象最深的是青霞阿姨扮男装帅到爆。而今看来却是更钟爱张曼玉演的黑店老板娘，泼辣蛮横满嘴脏话：“里面真他妈乱，贼还要被贼偷，我操”。沙漠里的打斗既美丽又惨烈。我第一次知道骆驼在沙漠里可以奔驰，我以为他们只可以慢吞吞的步行，奔的真的好有性格。甄子丹扮总太监好可怖，青霞阿姨的某些瞬间很像菲姐。
179,新龙门客栈,4,金镶玉的确绝无仅有，但是飞甲的故事层次丰富很多啊（虽然也有硬伤和bugs)...这片故事情节简单的有点取巧了，当然突出了演员
180,新龙门客栈,4,"霍金说女人是世间最大的谜题，对我来说，金镶玉才是那个时代最大的谜题。

"
181,新龙门客栈,5,"看了3D的《龙门飞甲》，好想念《新龙门客栈》里的金镶玉。
那可是少不经事时的福利，当时在太山庙上初中，学校组织去东风厂里的俱乐部看的，当然还有之后的《泰坦尼克号》。原来那时我已爱上你了，电影。"
182,新龙门客栈,5,@N好，f屁。【算了，作湓]再多f删浒桑”疽p插、角色SM特e是曼玉都知道不U了、R^那LL得那快尤其是最後沙漠四人狠斗】但，好cult（磨碾、刀削的死我了！那夥是叩厣N？）
183,新龙门客栈,4,后面有点渣了。前面的节奏都很符合这种快意恩仇的武侠情怀。哎总之看完更加不屑龙门飞甲了，还我150块钱啊
184,新龙门客栈,5,这是李惠民和徐克的神来之笔，再也拍不出来了，就像当年何平拍《双旗镇刀客》一样，后来怎么努力也找不着感觉了。这是香港武侠电影黄金时代的回光返照之作，惊艳的一闪。林青霞，张曼玉还有那个飘逸的程小东。所以不得不承认，徐克在20年前用光了所有的才华。
185,新龙门客栈,5,20120128再看!我心中最爱三部之一!赶上开头必须看下去的电影 一遍一遍。。心以致远 行云流水~~(“我去你爹的!”)必须力荐!!。。20120225再看--所谓经典修复版-影院上映的!强烈呼吁内地启用电影分级制度啊!太干净的所谓经典版--大失所望啊!!好多从新配的音也不行):。。
186,新龙门客栈,4,甄子丹那仿若被泼了面粉还PS了两朵红云的脸出现在大屏幕上时 我瞬间笑喷了 差点忽略了帅哥吴启华!店小二才是武林高手啊 !张曼玉真的真的无法被超越 如此风骚敢爱的老板娘哪里去找?美人如玉是林青霞!看着梁家辉 好几次穿越到东成西就 打戏很赞!配乐很赞!香港老电影的配乐始终是我觉得无法超越的
187,新龙门客栈,5,新武侠电影的鼻祖……它开创的不只是新武侠，它更继承了老武侠的风骨。
188,新龙门客栈,5,实在好看，我觉得张曼玉在里面是最大的亮点，妖治泼辣又魅惑，最后的结局应该是电影！史上最喷饭的，鞑靼人最后的鬼斧神工吓着我了，果真徐老怪的顽童精神万岁！
189,新龙门客栈,4,千辛f苦的找了清晰的版本砜矗了岩幌露十年前，便和Tw甲Ρ认拢只是突然X得後者似乎更好看？濉曼玉那L}味寒然是o人能比，梁家x可能比李B猓甄子丹的腮t汉苓m合他可惜也巢贿^坤的眼骸
190,新龙门客栈,4,大漠孤烟，长河落日，这个翻拍推陈出新，侠气纵横。最大的享受的是美感，不仅曼玉、青霞是美的，就连风景、武打也是美的，剪辑和摄影是新武侠片的典范。
191,新龙门客栈,4,有味道的武侠片 令人难忘的人设 结尾强烈的感情设计 让整个影片都升华了 所有角色都过目难忘 经典就是经典
192,新龙门客栈,4,my favourite movie of knight-errant!最喜欢的武侠电影~
193,新龙门客栈,4,再看一遍。原来各大导演对于美女都有SM情节O(∩_∩)O哈哈~徐锦江真是sexy咯，特别是对金镶玉的那一抱
194,新龙门客栈,4,黄沙漫天，马蹄声至。儿女情长，刀光剑影，畅快淋漓，漂泊天涯。
195,新龙门客栈,4,甄子丹的脸在大屏幕上比那些骇人的“高科技”武器更吓人，还好他戏份不多并不影响观感。恍然间还发现青霞的脸比曼玉的大【喂】但是二位都很美。梁家辉原来还有如此帅气的一面，啧啧啧~吴启华萌，宰人鞑靼小子更萌~即便有些镜头看上去会蹩脚，但还要感叹经典不愧是经典。
196,新龙门客栈,4,甄子丹好帅啊，金镶玉的人设真的太讨喜啦，整个片子气氛营造的非常棒，紧迫感一直追随。还不忘有情有义一番，妙哉~~
197,新龙门客栈,4,张曼玉那个小眼神把我的魂儿都勾走了~和甄子丹的红脸蛋比，坤哥那个小眼线都是浮云啊浮云
198,新龙门客栈,5,大漠孤烟直，长河落日圆，中国的西部片《卡萨布兰卡》。“我草你爹！”张曼玉饰演的风骚入骨的金镶玉成了银幕经典形象（配音师功不可没，好过粤语）。就是每当梁家辉深情呼唤林青霞“莫言”时我总让我想到了一位获得诺贝尔文学奖的作家，濉
199,新龙门客栈,4,打戏节奏很好。最招人的张曼玉啊，骚而不贱简直是境界。片子里有很多可以用的空镜头，马一下。最后，吴启华也有那么年轻的时候呀。
200,新龙门客栈,3,张曼玉最后的必杀干嘛不早点用
201,新龙门客栈,3,我一直以为重映应该是个逐渐能起来的市场，但貌似比较悲剧。当年的经典现在来看，各方面都平庸无比，但此版并没有很好地还原经典场景系色调，似乎更谈不上修复，和去年年初对倩女幽魂的失望如出一辙。
202,新龙门客栈,3,不似正邪之，而是o情（宦官）和有情人的α，且是精神生理阈校褐芮裰g的男女之邸⑶窠鹬g的女女崦痢⒔鹬苤g的性吸引力、以至孤人小二矢告⒌茴似H情投射的情x，再再都是]具便不配有的PS。相^於⊥獗汝I多s的洋片典故，@安排倒是非常的「中特色」，一o二啊。
203,新龙门客栈,3,大boss甄子丹最后出场，架势无比牛A，却仅活了四分钟，秒杀他的是开了金手指的屠夫……这设定太逆天了吧（很早之前在电视上看过，补了一趟修复版吃饭的时候看）
204,新龙门客栈,3,江湖20190605二刷，徐克最大的功劳是加入了金镶玉和邱莫言两个妹子，反而是从女性视角展开这个故事，写这种乱世中她们的爱恨情仇和那些说出来和没说出来的秘密――自始至终的强项，拍女人才拍的好。除此之外，俗不可耐，乏善可陈，徐克的男人真是很少有能让人看上眼的。中间实在被完全不搭的西北民歌搞得头昏，又去听了韩英杰那只完全不在调上的曲子，一晃眼看见李丽华，突然想起古龙写王云梦，说染香的眼已经很媚了，跟她一比就是死鱼，嗯，28岁的张曼玉在49岁的李丽华面前，就是一个活泼的小鬼，完全无招架之力。PS就这样当年香港人还那么买账？审美水平下降看来不光是大陆自己的问题。
205,新龙门客栈,3,"典型徐克影,,,有背景,有丫,,奏s只快不慢,,人物情感粗枝大~..最後Q鸨驹是×θfx,,但@得dd,,莫名其妙..本片不是一部好影,,但有著很大的改空g,,然後硪恍茏,,如|邪西毒和月光盒也可以找到不少本作的影子"
206,新龙门客栈,3,★★★ 凑合看看，小学时录像厅第一次看此片，到现在都不知看多少次了，从来没喜欢过此片。电影吵闹过头，节奏也不好。
207,新龙门客栈,3,很小的时候，在舅舅家的录像店里看过，当时觉得这部远没有“东方不败”好看！
208,新龙门客栈,3,大风沙过后……他们的半个身子被埋住了。这一段真有搞笑片的潜力。丹叔一下子被削肉扒皮成标本，那个配角真是好惊悚。张曼玉丢出去几枚飞镖就把丹叔以外的人都杀光了，真是威力无比啊。
209,新龙门客栈,3,"还可以
还可以
还可以"
210,新龙门客栈,3,徐克进军美国之前的作品，却拍出了美国西部片的风格，打斗很精彩，故事很简单，人物很多，尤其是张曼玉的角色很出彩
211,新龙门客栈,3,2008-1-27 1:12:26 7/7.1(974) 一群牛逼哄哄的人，应该能做得更好
212,新龙门客栈,3,"这故事现在来看实在太一般。。救人救的太没技术含量了，就那么4,5个草寇。。还混着奸细。。怎么打得过大军嘛。。邱莫言死的太悲催了。。周淮安受了那么重的伤居然还能活着。。曹少钦最后居然被杀猪的以片肉的方式打倒了。。那么多士兵居然就那么散了。。太坑爹了。。。"
213,新龙门客栈,3,故事本身挺一般，只是那风骚的老板娘啊......没想到梁家辉年轻的时候还挺好看的.......林青霞确实是英气十足，娱乐圈唯一一个让我觉得是雌雄莫辩的人
214,新龙门客栈,3,前些天看的。――这个绝对看过很多遍啊，也不知道为什么，小时候就能对一些片子一看好几遍，也不会生厌。。回想起来，大约是物质匮乏或者资源太少了吧，也什么都不懂。
215,新龙门客栈,3,风情万种的老板娘 依稀记得林青霞在沙漠中慢慢沉下去那段我哭残了
216,新龙门客栈,3,看到一广告，一馋老呸对着另一在啃薯片的男人说给我一片。那小气鬼说如果我给你一片，就要给这里的每个人一片。说完他抬手指了一下茫茫无垠的北极，适时刮过一阵风。很契合龙门客栈里边关的氛围，大漠孤烟，清角吹寒。尽管都是大腕，随便一名字打出来都尖叫一片的，情节方面还是弱了点。张曼玉这个没胸
217,新龙门客栈,3,...还行，从此客栈多以龙门命名了！
218,新龙门客栈,3,小时候看的，剧情都忘记了，只记得林青霞和张曼玉
219,新龙门客栈,3,还行，那时候的技术也只能拍出这种那时候的经典电影了。
220,新龙门客栈,3,在那个年代还是很经典的，到今天看来还是一点不闷，特别是金镶玉这个形象实在是前无古人的，这是这部电影里最善良的地方。当然还有几路人马一起过来，剑拔弩张的气氛云绕和关键时候的一些设计都很不错
221,新龙门客栈,3,在下不会欣赏血腥镜头过多的电影。。。
222,新龙门客栈,3,曼玉青霞，风情万种。再没人能演出那样经典的老板娘了。人之所以无情义只是因为未见对的人。没想到最后是剔肉工解决问题...
223,新龙门客栈,3,很多大牌演员，情节只记得大概，印象不是很好，不太喜欢~
224,新龙门客栈,3,很早时候看，那时候看英雄看美女看打斗，唯独少了对故事的解读
225,新龙门客栈,3,不喜欢结局，虽然金很洒脱，可最后的举动显得好唐突
226,新龙门客栈,3,看了龙门飞甲于是兴趣上来来看，怎么觉得差不了多少。故事太简单，人物上除了张曼玉的老板娘比较出彩，赵怀安竟然显得猥琐愚蠢和无能，邱莫言总体上几乎感觉不到侠女风范，性格也很是模糊。至于所谓的武侠气质，嬉笑怒骂，只觉得很是聒噪。比较失望。。。
227,新龙门客栈,3,服装布景高端大气上档次，打斗特技酷炫狂拽耪ㄌ欤各位明星妩媚清新各一套，太监大人冷艳厉害求收编？槽点虽多，不要在意这些细节 。。我是九零后，当然比六七版好看啊！
228,新龙门客栈,3,小r候每看到那段剔肉削骨就毛骨悚然，F在只得金玉了＝ ＝|||
229,新龙门客栈,3,比起《龙门飞甲》，这片子更欢乐腻！金镶玉的风骚可是完全盖过邱莫言的侠气嘞！周淮安嘛…呃…真的好欠抽呀！最后结尾会不会太仓促，有人死了，有人走了，啥都没了~这就是江湖撒？
230,新龙门客栈,3,很小很小的时候看的 当时只觉得人肉包子很恐怖……
231,新龙门客栈,3,不行。。那个音乐吵得我脑袋有点疼……。。。
232,新龙门客栈,3,果然还是这个版本的惊艳比较多。。。厂公居然是甄子丹
233,新龙门客栈,3,1992年的片在2012年看难免很多不足，张曼玉的演技在目前中国的女演员中无人能出其左右！
234,新龙门客栈,3,现在重温这部港片已经全然找不到当年的感觉了，观影过程甚至觉得有点无聊！不过放在老港片里这部还算不错的了，张曼玉依旧霸气侧漏，梁家辉的角色现在看起来反倒有点恶心的感觉！打个情怀分，及格吧！
235,新龙门客栈,3,看完龙门飞甲再看新龙门客栈觉得两部都还好吧。记得好像应该是小时候就看过，因为甄子丹最后被剃得只剩骨头那幕记忆犹新，而且小时候就分不清两个女主到现在还是有点分不清。。。(/n\)倒是丹哥，刚出场给我惊艳得，比陈坤还有韵味~
236,新龙门客栈,3,很小的时候在电视上看过N遍的电影
237,新龙门客栈,3,五系话真系甘好睇 只不过睇得太多次 想永久删除都唔得啦 就好似A冠嘎艳照甘 等往日的记忆一次过暴晒出黎！
238,新龙门客栈,3,额额额额额.....甄子丹.....你这是肿么了....
239,新龙门客栈,3,模模糊糊记得小时候看着就很吓人，现在看起来仍然觉得好诡异
240,新龙门客栈,3,"梁家辉，林青霞，张曼玉都很好很好，但剧情偏我不喜欢。
“天大地大我最大……我的脚……”"
241,新龙门客栈,3,红颜未老恩先断，大漠孤烟牵马还
242,新龙门客栈,3,过去的记忆再拿出来就是一段新的回忆而不是一个历史的重复所以有些是走不出一个桎梏的怪圈的念头是必将完结的不可阻碍新的一切存在的可能不过这纯粹是在浪费生命包括这一段废话
243,新龙门客栈,3,片子太早，感觉风沙吹起来的时候剧组人员都不好受吧。非剧情类的电影确实很不容易打动我。对于大漠，我只能想到三毛以及荷西，无情无义倒真的是不知道。
244,新龙门客栈,3,自从东成西就后，梁家辉在我心中的古典扮相似乎就永远停留在那个烈焰红唇大黄牙寻找真心人的艳妇阶段了。。。所以本该感动的地方我都会出戏。。。两个女人的身材真不错。。。
245,新龙门客栈,3,新龙门客栈的旗帜，永远飘扬在贺兰山下龙门关前，大漠朔风之中。 没有去过大漠的人，不会明白。
246,新龙门客栈,3,垃圾，谁说好看谁傻逼
247,新龙门客栈,3,人肉包子，看了之后好久没吃过包子
248,新龙门客栈,3,周淮安像个娘们！此片最厉害的就是厨房仔！刀工无敌，还有钻地专属技能！牛逼！
249,新龙门客栈,3,一直记得的是那个刮骨剔肉小店员，两把刀，舞得飞快。
250,新龙门客栈,3,maggie is amazing
251,新龙门客栈,3,如果我冠名 就是“馆子动作片”......
