,movie,star,comment
252,新龙门客栈,3,甄子丹原来这么会演戏啊。以后去参加喜欢的人的婚礼时 要模仿青霞姐姐 ，假装洒脱仰头喝下一口酒然后让泪无意划过眼角。
253,新龙门客栈,3,说实话不太喜欢这种一直沙尘暴的场景哦……= 0 =大家为了鳗鱼和青虾谁更出彩争得不可开交呢……难道没有人觉得最出彩的其实是甄子丹么！那粉白！那腮红！那眼影！矮油！
254,新龙门客栈,3,CCTV6看的，当年还觉得蛮好看的
255,新龙门客栈,3,小学时候某个周末暖洋洋的下午，爸爸坐在沙发上，我在地毯上倚着。
256,新龙门客栈,3,「张曼玉的曼、林青霞的青。」我在自我介绍的时候总会忍不住这样说，因为总感觉这样会让我的名字美一点儿。
257,新龙门客栈,3,我爸爸参与拍摄了・・・诶・・
258,新龙门客栈,3,短平快，也就那么回事
259,新龙门客栈,3,看来我真不喜欢武侠。
260,新龙门客栈,3,为什么古代的太监功夫都这么好
261,新龙门客栈,3,历史片的感觉，无论画面还是人物设计，都比较中规中矩，像是一群历史人物真实的故事。
262,新龙门客栈,3,我看不懂这样的武侠片……
263,新龙门客栈,3,任金镶玉再怎么有情有义，周淮安的眼里也还是只有邱莫言啊。PS：每次周淮安喊莫言的时候我的脑海里就浮现出某位胖子大文豪，谜之跳戏。
264,新龙门客栈,3,杀几个人这么费劲？尼玛！！！两三下用火烧直接KO
265,新龙门客栈,3,徐克 黄沙漫天 风狂鼓
266,新龙门客栈,3,跟原片比大为失望，可是能在大银幕上看到那么好的林青霞张曼玉梁家辉甚至是徐锦江，好吧，还有背后的徐老怪，心里也很高兴
267,新龙门客栈,3,张曼玉很灵的，其它没了。。。反正我也没什么港片情怀。。。
268,新龙门客栈,3,很小的时候看的～
269,新龙门客栈,3,大漠的风情，ps两个截然不同的女性角色都很出彩呀~
270,新龙门客栈,3,什么几把意思，演员的动作、表情、语言都太生硬，剧情狗血。小的时候看过，记得那个切羊肉、能遁地、干掉boss的鞑子。20160826打了一星，后续更改。
271,新龙门客栈,3,看过片断算不算，管中窥豹
272,新龙门客栈,3,潇洒的武侠世界，干净利落。女扮男装的林青霞真的很帅气
273,新龙门客栈,3,小时候看感觉挺好的
274,新龙门客栈,3,央6播出，Get到了林青霞的美貌和气质！！！
275,新龙门客栈,3,徐克风格，大牌云集，经典作品
276,新龙门客栈,3,侠客们的一次大集合
277,新龙门客栈,3,那个时候的记忆。不知道为什么，那个时代的电影和那个时代tvb的片子一样让人百看不厌，明明漏洞百出，荒诞可笑却让人欲罢不能。
278,新龙门客栈,3,看完Tw甲才砜吹模我X得Tw甲比^ξ业奈丁
279,新龙门客栈,3,先看的《龙门飞甲》，跟此片真的一个模子，但是错过了那个时代，现在来看，真是对此片不来电啊。不得不承认张曼玉的形象确实是一个经典。
280,新龙门客栈,3,就叙事而言还是新版的比较完整~金香玉那个风骚劲啊！真是绝了~
281,新龙门客栈,3,剧情很荒诞，角色很出彩。PS：小学时看过，印象只剩风骚入骨的张曼玉和最后被削得血肉横飞的甄子丹。这次重新看过，还是对这俩印象最深。
282,新龙门客栈,3,早几年看可能会更喜欢吧。徐克的片子真的常常就是有句无篇，有惊鸿一瞥的人物和场景，但是故事讲的乱七八糟。相比较胡金铨，徐克既飞且糙。小时候喜欢徐克的怪诞、奇诡、张扬，近来倒是更喜欢胡金铨的扎实、生动、烟火气，非常有生活质地，也直承了很多中国民间文化的传统。看这片儿就当是为下周看京剧版新龙门客栈做功课了。
283,新龙门客栈,3,对于没看过老版的我来说可能体会不到那种感觉吧
284,新龙门客栈,3,甄子丹居然演太监...没地位啊没地位
285,新龙门客栈,3,http://movie.douban.com/pics/sth.gif
286,新龙门客栈,3,"看了豆瓣我才知道原来我真的看过这部片，哈哈，算啦，特价么。
不过记忆中已经被龙门飞甲的剧情给覆盖了。。。"
287,新龙门客栈,3,唉呀我果然是新时代的人了我觉得这个都没龙门飞甲好看
288,新龙门客栈,3,那刀子够快  一会儿就把人的大腿给削成骨头了
289,新龙门客栈,3,"修复版配音真不怎么样。。。
剧情太过写意，不够严谨，港片通病。。。"
290,新龙门客栈,3,看了龙门飞甲后找出来又看了一遍……不看逻辑还是很好的……
291,新龙门客栈,3,梁家辉和张曼玉真年轻啊
292,新龙门客栈,3,张曼玉比林青霞出彩。
293,新龙门客栈,3,当年傻傻的自己淘来这部碟 人生中起码看了3遍 武侠片我只能说是武侠片
294,新龙门客栈,3,岁月不饶人，演员是，导演也是。有些东西真是入脑就很难改，看到梁家辉想笑，看到张曼玉脑内旗袍，看到林青霞眼里还是东方不败。不过作为甄叔的死忠饭，有甄叔看就够了。
295,新龙门客栈,3,姐只能说炯炯有神，东厂太监们死得也太不合逻辑了吧，难道武侠就可以不讲逻辑天外飞仙么？以及梁家辉是怎么回事？文成还是武将？八十万军的军教头，您让姐说您酸还真是不为过！唯一的亮点就是金香玉的风骚入骨、林青霞的英气逼人以及小厨师刀工的出神入化，看得姐心里直发毛！
296,新龙门客栈,3,只记得林青霞和张曼玉这两大女神
297,新龙门客栈,3,【B－】在当年极度疯狂的香港电影市场下，镜头是狂妄的，剪切是粗糙的，人物是夸张的，打斗是模糊的，暴力是噱头化的，故事则是极速推进的。总而言之，整部电影都像那个香港一样是不择手段的“快”，一招一式都快到癫狂，如此眼花缭乱、酣畅淋漓，却从不经得起回味，在如此夺目的皮囊之下，其潜藏的却是香港电影快餐模式下的审美疲劳。
298,新龙门客栈,3,对港片，特别是老港片，还是敬而远之吧。。。有代沟。。。
299,新龙门客栈,3,江湖不远朝廷
300,新龙门客栈,3,被吹上天的二流作品，f什N@是最好的武b片的，拜先看看胡金吧。
301,新龙门客栈,3,江湖不远朝廷
302,新龙门客栈,3,其实我是看热闹型的，不懂
303,新龙门客栈,3,为神马小时候看一般，现在看还是一般？
304,新龙门客栈,3,记得风骚的老板娘和可爱的快刀手……
305,新龙门客栈,3,大仰角 大俯角 书上说的 我要努力愤青新龙门客栈 龙门客栈 龙门飞甲之间的区别思密达
306,新龙门客栈,3,当时看 貌似还不错。。。。。
307,新龙门客栈,3,林青霞真帅气
308,新龙门客栈,3,两伙人一开始就互相知道身份，可一方想瓮中捉鳖，一方想暗渡陈仓，因此两伙人暗地里试探周旋，表面上却和和气气，从中可以窥见中国文化的含蓄在武侠中的体现。可是片中有些细节还是经不起推敲，为什么明明时间紧急还主动要求拜堂成亲？为什么被东厂击溃的莫言一行人比东厂先行回到客栈？另外当年的特效也是挺糊弄的，穿透胸膛的剑明显是从胳肢窝里伸出来的，穿透大腿的剑明显只是刺穿了裤子。金镶玉也未见得有多爱周淮安，洞房夜还在和东厂的人谈生意，见到自己的人被杀才发怒杀掉东厂的人，最后却说去找周淮安，然而相濡以沫不如相忘于江湖，这样的结局平添了几分落寞，少了几许潇然。
309,新龙门客栈,3,终于知道笛子的来历了。。不过周迅演的是张曼玉的角色？？？太夸张了吧。。。
310,新龙门客栈,3,说实话 要是胡金铨的话 新龙门客栈绝对不能拍成漫画电影 徐克说你什么好呢 刚愎自用啊
311,新龙门客栈,3,张曼玉是唯一亮点
312,新龙门客栈,3,很一般啊。。剧情硬伤好多啊，果然是因为年代久远所以审美也不同了吗。。我还是觉得龙门飞甲好看多啊。。= =
313,新龙门客栈,3,张曼玉的妩媚和林青霞的秀颜撑起这无聊的剧情
314,新龙门客栈,3,我有一个片段的印象，然后没了...算看过么？
315,新龙门客栈,3,"发现林青霞演的美人没一有好下场的。。
张曼玉的粗口骂的不够销魂，有待提高！"
316,新龙门客栈,3,给我感觉一般吧。没有那么传奇。
317,新龙门客栈,3,没有这个情结
318,新龙门客栈,3,80年代能有这样的作品，算是神作了
319,新龙门客栈,3,周淮安为什么不从了金镶玉周淮安为什么不从了金镶玉周淮安为什么不从了金镶玉周淮安为什么不从了金镶玉周淮安为什么不从了金镶玉？
320,新龙门客栈,3,恐怖的甄子丹
321,新龙门客栈,3,开创新武侠！！
322,新龙门客栈,3,看得太不认真了。。。
323,新龙门客栈,3,那时候的张曼玉皮肤简直了，满满的胶原蛋白啊！还蛮希望最后金镶玉在关外找到了周淮安，然后带着两个孩子，再自己生几个孩子，还带着那店小二过逍遥自在的关外日子。哈哈哈，我也太无聊了吧
324,新龙门客栈,3,以前看的，补档；郎才女貌，豺狼配虎豹；演曹少钦那个演员刘洵很赞啊；2012-10-21；
325,新龙门客栈,3,到最后还是店小二最= =削爪子功力了不得哇。
326,新龙门客栈,3,故事情节很好，林青霞太帅，梁家辉也难得的摆脱了小喇叭的感觉……
327,新龙门客栈,3,喜欢这个片片里的张曼玉~~~
328,新龙门客栈,3,偶稀饭张曼玉的金湘玉
329,新龙门客栈,3,我感觉我和这个电影不是一个时代的人了……我还年轻着。
330,新龙门客栈,3,真的只能打3星
331,新龙门客栈,3,挥之不去的童年阴影
332,新龙门客栈,3,恐怖片啊，。削小腿，最后只有骨头了是不。是这部咩？
333,新龙门客栈,3,THE ACTING IS GREAT
334,新龙门客栈,3,哎呦喂，甄子丹那个媚啊。。。
335,新龙门客栈,3,这么你妹血腥啊。。。。。。。。。
336,新龙门客栈,3,最近看了数码修复版，武打场面只看到一群穿着戏服的武行在打，那个年代的特效确实简陋，很多直接靠镜头的剪切，而就故事层面而言，其实我觉得人物还能再写得深刻一点，情节再丰富一点，因为故事本身的戏剧张力是足够的，两队人马在龙门客栈里剑拔弩张、互相算计。在人物设计上最突出的就是张曼玉了。
337,新龙门客栈,3,那个小矮子的刮骨刀让我至今印象深刻。
338,新龙门客栈,5,又一次在被窝里看《新龙门客栈》，那对白像刀光剑影一样，轻重有力，一来一回，好过瘾。画面不需要太精致，因为人物已经脉络分明，特效不用太高级，就光听浮夸的音效就很刺激。好经典。“住几天？”“怕我不给房钱啊”“怕你不告而别”。每一句台词都好喜欢
339,新龙门客栈,3,"2012.4.7
@ Bridge Street, Aberystwyth"
340,新龙门客栈,3,那时候看的时候还小，最后结局觉得很恐怖的说。
341,新龙门客栈,3,看看吧，我到了看这电影的地步了。
342,新龙门客栈,3,只记得张曼玉很风骚
343,新龙门客栈,3,徐克电影，不知看了多少遍啊
344,新龙门客栈,3,据说也武打经典，而我呢，真是欣赏不到这个美
345,新龙门客栈,3,"因为看的比较早,记不清了"
346,新龙门客栈,3,"  看了龙门客栈再看新龙门客栈就知道区别了,新龙门客栈最让我记忆深刻的是最后在沙漠的一战,那个伙房的伙计竟然把那个太监腿上的肉给刮光了,熟能生巧啊......."
347,新龙门客栈,3,想不到那么快 20年过去了！是为了让大家对比《龙门飞架》有多少异同么？但是很奇怪 无聊从画面还是剧本上 老版都不比新版 只是为什么大家对老板的评价远高于新版呢 我想 或许是因为人们的要求都变高了！
348,新龙门客栈,3,103分修复版。。。。逻辑比较差各种装逼武侠片。。甄子丹熊欣欣鞑靼人印象深刻
349,新龙门客栈,3,以前的电影，这么多明星！！
350,新龙门客栈,3,大致情节记不清了，就是结尾菜刀削得大概只剩骨头好吓人。和续集龙门飞甲比起来，还是没加太多特效的老式港式武侠看着更让人热血沸腾。
351,新龙门客栈,3,一开始看着林青霞的女装是风流倜傥，最后看着张曼玉火烧客栈才觉得她是真的潇洒，这里面的人物，小到客栈的帮工都是很有特典
352,新龙门客栈,3,张曼玉在里面的表演非常出色，多么风骚啊
353,新龙门客栈,3,比龙门飞甲好==但是甄子丹无法和坤姐媲美！~
354,新龙门客栈,3,很喜欢林青霞死的镜头
355,新龙门客栈,3,演技好剧本烂
356,新龙门客栈,3,贼人！看贱。
357,新龙门客栈,3,我一直想不通小时候竟然没看过这部电影。我一直不咋喜欢徐克的风格，剧情挺简单，风景挺美 。本片最出色的人物就是八面玲珑，风情万种的金镶玉。7分
358,新龙门客栈,3,最是无情却有情
359,新龙门客栈,3,意境是不e的，孜坏难菁家睬〉胶锰（甄子丹不man的r候居然是演虻摹！＃，S沙啊S沙真艋谩８凼接哪穿。
360,新龙门客栈,3,补标啊   2017.5.27    白露放的   我还记得当时看完一脸懵逼    不止带它在讲撒  还有很多逻辑也不通  似乎在白露面前发表了自己的看法？记不得呢已经       明朝的事  记得当时的那个东厂还把我给吓到了    其实根本就没有这样啦   崇祯也不是  慢点  有崇祯吗？
361,新龙门客栈,3,金镶玉只是要一夜情，周淮安还非要成亲，接下去也没有连贯的手段，白白害死了莫言，典型得把简单事情复杂化――直接要了不就完了嘛。
362,新龙门客栈,3,LOOKER林青霞
363,新龙门客栈,3,那个小屠夫  好灵活啊~~
364,新龙门客栈,3,首先当初的他们都好清纯啊 哈哈 吴启华就是个小白脸 张曼玉挺美的 最后那个杀猪的好强悍啊 血粼粼的骨头都出来了
365,新龙门客栈,3,92年的电影，不知道大陆干嘛现在才能上映，美国版片长比大陆版多十多分钟。广靛总菊太无耻了
366,新龙门客栈,3,250里看过但没添加的
367,新龙门客栈,3,张曼玉的表演很丰满..........
368,新龙门客栈,3,看^好多遍，也]看出T道
369,新龙门客栈,3,好粗糙的特技 那个贾公公笑得我腿毛都直了 草
370,新龙门客栈,3,很小的时候看的了。。。看的超级没趣味的~
371,新龙门客栈,3,2012.01.01
372,新龙门客栈,3,甄子丹好稚嫩，张曼玉好风骚
373,新龙门客栈,3,居然看出了笑点，是怎样啊
374,新龙门客栈,3,话说找不到高清版的，看起来味道不对。
375,新龙门客栈,3,刁Dp。
376,新龙门客栈,3,为什么我感觉很一般..
377,新龙门客栈,3,没看过这个好像没看过电影似的 不是我的风格 结尾的沙漠部分 摄影挺过瘾
378,新龙门客栈,3,"1.甄子丹竟然演太监。。。太劲爆了；
2.红颜薄命，英雄气短，多情总被无情恼；
3.龙门客栈，无情无义，多少情义由此生；
4.原来高手深藏不露，做人肉包子练就一身绝顶神功，苦恋老板娘多年不得手，只能苦逼似的伴她去追男人，好人卡一张，鉴定完毕。"
379,新龙门客栈,3,风情万种的张曼玉!
380,新龙门客栈,3,很久以前香港的武侠给我的印象总是昏暗。不晓得这些日子来怎么的又迷上老电影。粗糙但是写意。
381,新龙门客栈,3,反正多多少少有点想起来东邪西毒。张曼玉和张国荣都是无情又勾人的人。电影就一般。
382,新龙门客栈,3,张曼玉在里面一个劲的飙脏话，感觉很爽的样子
383,新龙门客栈,3,张曼玉的个人秀，前二十分钟像这部片的假肢，最后的cult有点意思。整体编排感和程式化太重，情节漏洞也密集，客栈封闭戏才正式到徐克的节奏上。
384,新龙门客栈,3,最后的印象不是风骚的老板娘，而是那把锋利的剔骨刀，这个电影是我童年的阴影，太吓人了
385,新龙门客栈,3,此片对我来说最大的失败就是，我喜爱的全都死光光。这是我的脑的问题。但是，曹公公萌得我哟。最近偏爱阉驴怎么破。
386,新龙门客栈,3,吓人的很当时觉得。
387,新龙门客栈,3,导演明明是李惠民，为啥提到这电影总说徐克呢~
388,新龙门客栈,3,甄子丹当年是谐星么，天大地大我最大= = /  看了店小二后才知道，高手在民间啊
389,新龙门客栈,3,编剧 何冀平 来我们这儿放的，后来我看困了就睡着了。貌似没什么意思。。。。。。
390,新龙门客栈,3,把对港片的缅怀抛去，不值这么高的评价。被人吹捧的龙门客栈里的勾心斗角尔虞我诈，跟真正优质电影如新世界、特工相比简直像小孩子过家家。最后的大漠打戏确实可圈可点，但我就不明白，怎么得几千东厂大军包围了龙门客栈，为什么就老大一人儿上前线追了出去？当然，最大的问题是，好人就是侠胆豪情，坏人就是奸诈阴险的脸谱，实在让人诟病。只有亦正亦邪的金镶玉，贡献了全片最大亮点，无论是人设还是演技。
391,新龙门客栈,3,骚到骨子里的老板娘  
392,新龙门客栈,3,名过其实的片子，太经不起推敲了，一会晚上一会白天，子弹气势汹汹带一大帮人马杀过来，最后就一个人单挑被干掉了，然后所谓黑旗军们就都全部下线了。两星的片子一星给拍摄。
393,新龙门客栈,3,是这部电影让我真正记住了林青霞。 初见邱莫言，何等潇洒。但是周淮安一出现，她就有了铠甲，也有了软肋。
394,新龙门客栈,3,好片是好片，张曼玉演的真心好，可惜字幕太差了，音都对不上
395,新龙门客栈,3,真不见得比飞甲好，这情节搁舞台剧我都嫌夸张，有时代局限性。另外张曼玉演得出彩。
396,新龙门客栈,3,感觉梁家辉是演得最差的一个了。。恩怨情仇讲的有点不清不楚，最后明明应该全要死了，怎么活过来的。。
397,新龙门客栈,3,现在这么看，只是觉得一般……没有武侠FEEL啊。只有荒漠漂泊FEEL。就这点来看比龙门飞甲差远了……
398,新龙门客栈,3,现在看这种老片有好多瑕疵
399,新龙门客栈,3,其实这才是很黄很暴力||
400,新龙门客栈,2,在看的过程中我就很纳闷为什么这部的评价这么高，是因为是普通话版本影响还是我真的没那欣赏能力。
401,新龙门客栈,2,不知何时起，我对武侠片形成了这么强的免疫力。。这个新搞出来的经典版实在是找不出经典在何处。。整部影片下来，我能做的就只是直勾勾地盯着青霞360度无死角的脸蛋儿，好美啊！
402,新龙门客栈,2,观众品味太差，这种片小时看看还行，大时还奉为经典，就可笑了。
403,新龙门客栈,1,盛名之下，其实难副。唯一的亮点是甄子弹活着看自己的手脚被庖厨。话说原来那鞑子男才是扫地僧般的存在啊。
404,新龙门客栈,2,艺术真实感不够，故事逻辑立不住，故事局限在小的空间，在空间视觉上缺少了节奏变化，但没能像12怒汉那样在狭小的空间做到情节的极其有层次的推进和不断上升的矛盾冲突以及强有力的中心悬念，来弥补无法实现空间的自由转换而造成的视觉枯燥，人物为实现戏剧需求而作出的行动和巨大牺牲就像编剧开玩笑
405,新龙门客栈,1,别扯你们那点廉价的童年回忆了行不行，nobody cares！请承认徐克连故事都不会讲，他的片子都是不入流的彻头彻尾大烂片！徐克这几个片子都拍得真tm恶心，香港电影之耻！
406,新龙门客栈,1,这片上映的时候，现在的主要电影观众80后基本都没有进影院去看。现在拿来重新上映，本人表示强烈的鄙视。上次的东邪西毒也就算了，怎么能一直龌龊下去？
407,新龙门客栈,2,没什么意思莫名其妙的电影，妖艳贱货赢得了男主，可怜的林青霞屁也没得到，梁家辉也太他妈幸福了吧，凭什么。还有，我果然非常非常讨厌一个电影基本只讲述一个故事，而没什么时间跨度。腻歪这种模式，看不到人生
408,新龙门客栈,2,小时候对那只沙子里渐渐沉下去的手非常有阴影
409,新龙门客栈,1,看完6套的神级修复后准备改分，画面清晰的重要性啊，跟数字电影一样的画质下锦衣卫和龙门飞甲的善恶分的更平庸了，对刀剑2策划的影响太大，四川话，苗刀，还有那与断刀客一阴一明通透的江湖气息
410,新龙门客栈,1,虽然不是他拍的，但画面很有徐克风范，之暴力，之出其不意，之重口味。
411,新龙门客栈,2,我的_哇～ 我的手呀～
412,新龙门客栈,1,口型完全跟台词对不上 不是国语也不是粤语 难道配音改台词了…
413,新龙门客栈,2,。。。。。。。。。。。一眼都不想多看甄子丹。。他还是去演硬汉吧。。。。。
414,新龙门客栈,2,武打动作假大空，最后甄子丹手脚被削成白骨也太玄幻了吧，还珠楼主都不敢这么写
415,新龙门客栈,1,香港电影拉低了中国一代人的审美观，被淘汰是历史的必然。
416,新龙门客栈,2,去掉情怀的光环，这电影还能剩几星。全是BUG，捂着脸看。
417,新龙门客栈,2,那么大的风沙还要拍戏，够呛~
418,新龙门客栈,2,不敢相信是1992年的片子，以为是1912年的，谁能告诉我好看在哪里
419,新龙门客栈,1,这片实在太得儿了 林青霞侧脸真美
420,新龙门客栈,2,这种人物动机为了剧情可以想变就变丝毫不care的b级片擦边球居然可以成为豆瓣top250，港式滤镜实在太厚了
421,新龙门客栈,2,10年之后再看徐克的片子是在是没新意 没看头 
422,新龙门客栈,2,当电影只剩下特效，不需要剧情时，产生了这部佳作
423,新龙门客栈,2,南艺戏文
424,新龙门客栈,1,"甄子丹等于一星。
"
425,新龙门客栈,2,记不清以前看时的感觉了，现在真是看不下去，动作场面是马术表演
426,新龙门客栈,2,烂透了，据说这还是武侠代表作，唉，看国产片要谨慎啊
427,新龙门客栈,2,20年前的电影，大概也许就是这样了，还能有什么要求，唯一的亮点就只有张曼玉了。
428,新龙门客栈,2,两个美女一人一星！
429,新龙门客栈,2,有些镜头我觉得在模仿胡金铨的，虽然没看过之前的版本。有情有义、黑白分明、正邪对立的江湖是不是有点浅薄。
430,新龙门客栈,2,徐克为何要摆自己一刀？
431,新龙门客栈,2,印象最深的人物：金镶玉。 印象最深的台词：我操你爹！ 印象最深的情节：1.邱莫言看见周淮安与金镶玉洞房，不断灌酒。2.曹少钦从周淮安背后刺过来，金镶玉喊了句“小心”，但周淮安仍挡不过那一剑。
432,新龙门客栈,2,曼玉使我着迷。就是……好血腥啊98不过那时候的港片里的动作戏就是看着太爽太舒服了！
433,新龙门客栈,2,"what the hell was that?????太不讲究了。镜头乱用不精简；讲台词嘴都不动；着墨毫无意义的姐弟关系；滥用配乐尤其打斗和西北唱曲，后者最多在鞑靼人高光一处出现就够了。人设与其他武侠片相差无几，除了张曼玉有谁在角色里吗请问？全片充满了男性凝视：大美女交手；知己委屈求全为我而死，风流红颜带着备胎为我放弃自己的生活，而我甩甩头还是迷死人大英雄。谁是主角啊到底？小女孩被漠视（上马希望不是我多想）看得我火冒三丈，这需要出现吗，还不是恶心人？或许港片我只能get王家卫了，希望不要奶死。
张曼玉真是天才，我是为她看的，除此之外也没有惊喜了，星星是给她的。"
434,新龙门客栈,2,腥风血雨的江湖的亦有儿女情长、侠骨柔情，而亦正亦邪的人物给俗套的武侠故事增加辛辣的刺激。
435,新龙门客栈,2,故事其实有一些硬伤，让人看到最后如鲠在喉。一朵花的凋零，是为了成就另一朵花吗？为什么钟情的莫言必须死，而风骚的老板娘却得到了周淮安？另，如果把客栈放到现代，《无人区》黑店那味儿就出来了；再另，回头一想，两部《绣春刀》好像都有《新龙门客栈》的影子。或许这也是它高分的原因？
436,新龙门客栈,2,"这种片都能进250？张曼玉和林青霞哪里好看了。更别说渣得一笔的演技。。张曼玉之前的电影没说演技有多好，但也不是像这部那么差吧。。最好的就甄子丹了。。。
一直夸这两人美。我。。。。。粤语字幕没对上，国语配音听得难受！还有点蜡烛是个啥？！"
437,新龙门客栈,1,脏话连篇，教坏小孩
438,新龙门客栈,1,用着胡金铨龙门客栈的故事和设定，片头是胡金铨题的字，然而胡金铨的名字自始至终都没出现过，踩在在原作的肩膀上自己独揽功劳？越了解胡金铨，便越不能原谅徐克。
439,新龙门客栈,2,经典之作，隐藏boss太犀利了= =
