,movie,star,comment
0,青蛇,4,当时很不能接受的是，许仙竟然和小青有暧昧。不过长大之后再回想，男人，可不就是这样的么。
1,青蛇,5,如果有六颗心我就打六星，如果有十颗星我就打十星，别问我为什么！
2,青蛇,5,每个女人，也希望她生命中有两个男人：许仙和法海。是的，法海是用尽千方百计博他偶一欢心的金漆神像，生世位候他稍假词色，仰之弥高；许仙是依依挽手，细细画眉的美少年，给你讲最好听的话语来熨帖心灵。
3,青蛇,4,作为一个性格被阉割的男人，青蛇那一剑捅得好！
4,青蛇,5,人生如此，浮生如斯。小时候看到的是群妖乱舞，大点看到的是情欲纠葛，昨天再看的时候是悲悲戚戚。谁人言，花彼岸，此生情长意短。谁都是不懂爱的罢了。
5,青蛇,5,"姐姐，你为了一个许仙放弃千年道行，值得吗。
"
6,青蛇,5,真正觉得不辜负原著的一个电影
7,青蛇,5,"也是非常喜欢的,第一是两个女人太美丽了.第二是,音乐太棒了"
8,青蛇,4,张国荣当年若愿意出演许仙的话此片会更美，但曼玉和祖贤姐姐已足够妖冶天仙，赵文卓的法海也更是傲世独立，吴兴国的许仙――猥琐男一个。全片的音乐美不胜收，飘飘欲仙，欲仙欲死，配乐和画面都极为出色。
9,青蛇,4,徐老怪拍的最美的一部片子，连法海都是赵文卓，有这样的白蛇传么..
10,青蛇,5,李碧华的爱情模式，得而失才让情更刻骨，碎彻底才让痛更铭心。青蛇与法海交欢的戏藏得够深，很有佛理。
11,青蛇,5,情欲流转，媚尽浮生，带着点纸醉金迷的末世气息。只是李碧华原著中法海是想把许仙占为己有的，估计因为太惊世骇俗所以被徐老怪无情的喀嚓了...不管怎样，是好片！
12,青蛇,4,赵文卓太帅了太帅了！！！！！
13,青蛇,4,两人的“扭啊扭”到现在我都还记得。
14,青蛇,4,徐克最好的片子。
15,青蛇,4,特技算什么，再的特技也不能阻止一部牛片旱恼Q生……
16,青蛇,5,九三年的徐克真先锋
17,青蛇,5,2011.5.29 第无数次看这部电影，这次是跟ann一起看的。幼时只记得青蛇白蛇的美与艳，长大了才知道，这世间纵是你有百般法术，终究是有一关你过不去。
18,青蛇,4,你们说人间有情，但情为何物？
19,青蛇,5,妖道，人道傻傻分不清楚。金山寺的和尚长的妖气过重，反倒是两个妖女活得人气十足。
20,青蛇,4,徐克 如今再拍不出 这么细腻的片了
21,青蛇,4,"最难忘青蛇一回眸,眼含热泪,把人心都生生捏碎..."
22,青蛇,5,青蛇的柔媚入骨，白蛇的魅惑大气，张曼玉，王祖贤不愧为香港首屈一指的大美女。快二十年过去了，在看这部片依然那么吸引人，配乐，布景，爱嘛！太好了！还有赵文卓年轻那种冷心冷面冷郎君的感觉太帅啦！
23,青蛇,4,天生媚骨的蛇精，冲破了我心中那版端庄优雅的固有印象，但这才是集天地灵气而成的精怪该有的样子，野性妩媚，随心所欲，做出了人类想做却不敢做的样子。
24,青蛇,4,虽然现在看特效成了渣，但却是徐克在意识形态上最有深层次颠覆性的片。另外这密不透风高速行进永不停歇甚至互相之间几乎不连贯的叙事节奏只有香港的商业电影才有。
25,青蛇,5,中国的哥特电影~
26,青蛇,5,"1.私以为与[倩女幽魂][新龙门客栈]同属徐克最完美的作品序列。2.风华绝代的张王配，祖贤美艳妖媚无与伦比，曼玉演技入骨谁与争锋。3.配乐,造型,服装皆极尽浪漫考究。4.轻纱作墙依稀掩映的紫竹林,冷冽蓝幕下的青白斗法及彩虹色的布光美得令人痴醉。5.法海与青蛇的云雨藏得够深。6.扭啊扭~ （9.5/10）"
27,青蛇,4,反转的剧情，帅法海是gay，小青和小白是les，丑许仙是窝囊废。
28,青蛇,5,小青 白素贞 男人心里的朱砂痣和白月光 
29,青蛇,5,我们也是亿年修来的人，只为一个人，值得吗？
30,青蛇,5,端午节再看第十遍也是应景吧
31,青蛇,5,非常经典好看的港片，张曼玉的青蛇演绎的非常到位，整个片子意境优美。法海也很帅。
32,青蛇,4,膜拜法海的人O：男孩的眼神，少年的面孔，成年男子的健焉碥|，混搭一起已迷倒生；偏偏要身榉秸桑法力高，像Thor一硬倏v雷霆；他修佛禁淫，又暝在欲海心魔，像男孩。@拥哪腥耍你f他是迦如恚我都深信不疑。
33,青蛇,5,印象最深的是白蛇泼酒做法降雨那个镜头，配的是黄的《流水浮灯》，美极了
34,青蛇,5,或许是徐克最好的一部作品 将一出经典解读出了离经叛道和情欲流转 异色的摄影 缠绵的配乐 充满挑逗性的暗示 青蛇还在学做人 而人是多么虚伪和懦弱 倒是妖爱得更坦荡更真诚
35,青蛇,4,仙作！必须承认没看过这样的电影，压根找不到参照系！观前只因慕名实无意兴，何曾料越看越意外，最后惊喜得无以复加。乍看不仅迷恋红尘，还俗眼看佛、大有不敬，妄图为享乐主义正名，其实满纸荒唐言一把辛酸泪，大巧不工，形拙神准，色下皆是情。及境界之高，绝对港片异种，道真理之尽，可谓风月巅峰。
36,青蛇,5,看完发现许仙完全是酱油，而且不懂为什么姐妹两个都能钟情于这个脓包……
37,青蛇,4,我在电影频道看的应该是删减版，发现知乎上面说了很多，大概就是唐僧动情了对于青蛇
38,青蛇,4,两位美人平分秋色，气韵风情太迷人了，音乐很有异域感，贴合剧情画面。
39,青蛇,4,这部片子颠覆了我心中新白娘子传奇的传统印象，青蛇和白蛇更接近妖的形态。小青和大海之间居然意味深长，真是给人意想不到的感觉。
40,青蛇,4,王祖贤和张曼玉犹如两枝绽放的莲花，一雍容，一妖媚，联手献上一场绝世芳华。
41,青蛇,5,白素贞在水漫金山寺的时候说：“我不知道我们会不会赢，我只知道如何去明白人情世故，依足所有做人的规矩，如果这样都是错的，我的千年修行都不知道为了什么。”最后，无情的法海也有情了，不谙世俗的小青也落泪了，但是人间依旧是个有情无爱的人间。
42,青蛇,4,高颜值   演技好   喜欢张曼玉
43,青蛇,5,演员表演和造型与场景设计都十分经典且富有意境，黄沾的音乐很有感染力。
44,青蛇,4,两大美女美的各有特色，关键是还演的超棒，眼神，形态堪称完美。男主的存在感太低。
45,青蛇,5,徐克以自已的江湖情怀将《青蛇》这个古老的传说，妖娆又不失诗意的呈于光影，古韵悠然的配乐契合张曼玉与王祖贤两人一青一白两妖的演绎，在情与欲的风华绝代里媚尽浮生，而妖与人的善恶对错，在电影中以小青视野的一展，因为爱情谁又能定夺孰是孰非？！
46,青蛇,5,这部比我年龄大的电影，来来回回看过许多次了，每次看都依然惊艳万分，是现在的电影给不了我的那种感觉，芸芸众生皆渴望自由与浪漫，虽然最后往往事与愿违。
47,青蛇,5,很有内涵的一部电影，张曼玉和王祖贤的颜值和表演到达巅峰。
48,青蛇,4,画面很美，影片很标新立异用青蛇的角度解读白蛇传这一传说，倒是有趣的很
49,青蛇,4,我想像小青一样活得没心没肺的通透，她不是人没有太多弯弯绕绕，可最终还是得活成白素贞。女人想征服的应该是像法海这样的男人吧，一直都觉得许仙不值得爱。
50,青蛇,5,非常喜欢，王祖贤和张曼玉都绝了，赵文卓的法海也是很经典。
51,青蛇,4,徐老怪为了百合渣了许仙
52,青蛇,4,每个男人，都希望他生命中有两个女人，青蛇和白蛇。同期的，相间的，点缀他荒芜的命运。只是，当他得到白蛇，她渐渐成了朱门旁惨白的余灰；那青蛇，却是树顶青翠欲滴的嫩叶子。到他得了青蛇，他反是百子柜中闷绿的山草药，而白蛇，抬尽了头方见天际皑皑飘飞柔情万缕新雪花。
53,青蛇,5,曼玉真的把蛇妖演的活色生香，那妖孽的幼樱我@女人看了都忍不住小心肝漾了一下，有王祖t真的是不折不扣的大美人啊，只可惜F在@拥拿琅真的y了，有w文卓的法海，也是萌死人啊~~~典果然是典，即使∏椴乐，也依然是每一面都充M了颉
54,青蛇,4,很经典的故事，演员也是当时特别红的，真的挺美，妆和服饰也妖气十足，印象最深的就是青蛇白蛇到人间以后，学人类走路的样子，扭屁股，挺好玩的。
55,青蛇,4,与有情人做快乐事。
56,青蛇,5,很好，特别是音乐
57,青蛇,4,你们说人间有情，但情为何物。等你们弄清楚了，也许我会回来。
58,青蛇,4,王祖贤美，张曼玉也美。
59,青蛇,5,最近才了解到青蛇拍摄地址是在香港，棚内拍摄，非常惊讶
60,青蛇,4,重看，小时候毕竟是小时候，中央六看再多遍也看不懂；这妖媚的视觉和狂妄的节奏真是绝配，把这个略显语焉不详的故事掘出了颠覆性的深意；还有这选角，实乃丝丝入揉，妙不可言――增之一分则太长，减之一分则太短。
61,青蛇,5,烟雨西湖配上流水浮灯美得让人久久无法忘怀
62,青蛇,5,不是我只喜欢帅哥哥 不喜欢美女 而是如今的美女都是奇奇怪怪 哪有美女的样子。
63,青蛇,5,王祖贤和张曼玉真的很美，而且电影里的欲望描写的很现实。
64,青蛇,4,青蛇与法海在水中的缠斗戏特别精彩。
65,青蛇,4,其实白素贞和小青才是一对。
66,青蛇,5,人生如此，浮生如斯。这部电影的画面和配乐都美到了极致。
67,青蛇,5,两位姐姐的美貌与智慧很羡慕 
68,青蛇,4,港台佳作046.90年代初的徐克创作力与对文本的重新结构能力达到了巅峰状态，不管是中国传统武侠，还是民间故事，都能赋予它们全新的生命。这部《青蛇》虽然来源于李碧华奇妙的改编故事，但进行影像化后完全变成了徐老怪自己的东西。尤其是演员的选择，再次印证了好的演员会对电影起到怎样的推进作用。
69,青蛇,4,紫霞把那滴泪留在了至尊宝的心里，而青蛇最后流下一滴泪是留在了人间，这个多情又无情美好却残酷的人间。那一瞬间她美得触目惊心，因为终于懂得并放弃了感情而美艳。张曼玉把青蛇的天真、情欲、妖媚、洒脱表现得淋漓尽致，相形之下，王祖贤美则美矣，却差了精气。
70,青蛇,5,事隔多年再看 ，还是那么完美。 王祖贤， 配乐无敌
71,青蛇,4,P於情愫的m葛，李碧A是非常有自己一套的。她能在一套本就情的百年文本上，重新打造自己的情，而不失文本∏榈闹戮础０咨咔嗌叩匿h芒F，已是太@，以至於我反而同情起桥d在片中的S仙了（年抢真年p阿！），其S仙@幼笥u[的弱浪子，是用不著蛲舛己的d硌莸摹
72,青蛇,5,徐克导演的经典爱情魔幻电影，打破常规，以青蛇视角探讨，新意十足，青蛇的妖媚入骨，白蛇美到极致，年轻俊朗版的法海，完美的配乐，造就经典中的经典！
73,青蛇,4,我不喜欢王祖贤，从来不喜欢，但我被这里面的张曼玉迷住了
74,青蛇,4,从倩女系列到青蛇看徐式奇幻武侠剧中主要角色所代表阶级的走势。倩1，儒（宁采臣）正、侠（燕赤霞）强、救苦女（小倩）于恶妖（劳老）；倩2，儒侠皆走弱，一个被伪偶，一个拿钱才办事，女不再是鬼，而是父亲蒙冤的姐妹，敌人来自内部。3、儒已去（92年胡金铨阴阳法王，书生亦可转恶），换佛入，佛道合力除妖。4、青蛇，儒（许仙）因容情而叛逆传统，本性善良却行事软弱，道已沦为显恶（马精武）、佛退格到正邪难测（法海施法）或迂腐保守（金山囚许），总之男角普遍走衰，跌势较猛。而女则升腾为绝对核心，且分青白双姝，更以传统上仅以从属出现的那位冠片名，剧情也由此倾向于巧褒青而暗贬白――因白素贞执着于向主流靠拢。
75,青蛇,4,王祖贤张曼玉的经典爱情魔幻电影，徐克作品总能打破常规，新意十足。赵文卓的法海也最顺眼。
76,青蛇,4,好喜欢，张曼玉和王祖贤都是又美又会演！
77,青蛇,4,8/10。情欲与幻想交织的空间存在佛性斗争人欲的主题，开场面目怪状、杀鸡斗狗的世间弥漫血粉与法海使用的红袈裟一样，红色象征吞噬人性的强权势力；灵芝救许仙/青蛇征服法海的空间并联交代了爱情的善意和诱惑；儒家书生渴望爱两个女人，道家捉妖不分善恶，妖魔可以被真情转化，佛教压抑人欲涂炭生灵。
78,青蛇,4,"他人末日是洪水，
徐克末日杏花天，
洒酒化作西湖雨，
雄黄熏得红叶天。
碧螺青髻细细圈，
你侬我侬恰恰吟。
情为何物碍修炼，
一剑斩杀许官人。
诱僧搂定法海身，
水漫金山第一窟"
79,青蛇,5,"七刷。一个无知少女的成长故事，一部道破红尘的伟大电影。流光飞舞的影像，从青蛇的视角重新诠释了这个古老的传说。相比白素贞对人情世故的通晓，小青更像一个懵懂的旁观者，她努力想要学习和超过姐姐，却始终无法进入这个红尘世界。
小青-法海和白蛇-许仙两段缠绵的平行蒙太奇虚实呼应，一个写意一个写实。徐克沿用了许多《倩女幽魂》的套路来拍此片，不过张国荣没演许仙是对的，这个角色需要更猥琐一些，因为这不是纯爱片。
高潮段落小青的那两行泪实在美极，精彩的人物弧光。但最让人挥之不去的还是结尾的那句诘问：你们说人间有情，但情为何物？
其实人妖并无分别，影片开头第一个字“人”，第二个字“妖”，最后两个字“小青”，这是法海说过最重要的四个字，也是影片的主题。
最后把镜头给到法海也是意味深长，一切始于紫竹林，终于紫竹林。"
80,青蛇,4,重看@百美汇；眼波曼转柳腰轻摇，眉眼横波柔情似水，你侬我侬佳期如梦；一场无法消解的千年孽缘，一滴终于落下的眼泪；《流光飞舞》响起，双姝诀别美哭；我就不信法海未曾动心。
81,青蛇,4,"7.8 炫彩灯光、大量雾气、画面有种廉价的美轮美奂。节奏从未停下来过，几乎每一秒都很刺激，感觉还是少了番韵味。而粤语配音实在太垃圾，徐克的武侠片奇情片每次都人不张口就说话，真是让人难受。
这样cult味十足的猎奇向鬼怪片，竟然成了大众经典，除了演员的风情万种外（《倩女幽魂》《东方不败》《新龙门客栈》等片亦有这样的角色），恐怕就是因为徐克贩卖的这种以他所搭建的反乌托邦丑恶世界为基础的“人间不值得”情感观念让人思绪万千、回肠九转了，比如《倩女幽魂》中什么“做人惨过做鬼”，《东方不败》里“人就是江湖”又“天下皆是负心人”等，到了《青蛇》就是“妖有情而人无情”了，好像把人性说得很清楚，把世事看得很通透，但细品还是太虚无缥缈了。这样一想恐怕《喋血双雄》里“我们太念旧了”可能不是吴宇森的而是徐克的。"
82,青蛇,4,【B】制作真是糙的超乎想象……好多配音台词甚至人物嘴都不动。在当年香港快餐式制片的体制下，叙事节奏快的令人惊叹，却反倒给电影增加了些混乱的妖气。最有意思的是对传统神话里妖形象的再创作，外在形象至邪至淫，打光夸张，姿态做作，但青蛇和白蛇的内心却是干净至极，连偶尔的“坏”都是一种毫无恶意的坏。剥离而矛盾的妖，反衬出人混沌的迷惑。
83,青蛇,5,如果有六颗心我就打六星，如果有十颗星我就打十星，别问我为什么！
84,青蛇,4,经典人物演绎，隐秘的情欲和伦理。人生一遭，轰轰烈烈过，大哭过大笑过，最后的悟与不悟，生与死，戒与破戒，都没有那么重要了。
85,青蛇,4,婀娜多姿的妖艳~~~二刷：在缺乏电脑特效的1993年，主创们想方设法利用斑斓色彩的灯光、千奇百怪的道具和场景、形色各异的镜头语言和剪辑手法……去展现奇幻瑰丽的妖法佛术，真是看得叹为观止（有些设计有点特摄片或定格动画的感觉，感觉挺棒，那个略矬的“飞龙在天”反倒比较不满意）~~~编导演值得嘉奖，国语配音也值得表扬~~~人生如此，浮生如斯，缘生缘死，谁知 谁知？情终情始，情真情痴，何许？何处？情之至！~~~撒谎也是修行，做人真不容易。~~~你老说人间有情，难道妖就无情吗？我们姐妹相处了五百年也是情，你当我是人那样想过我吗？~~~我到人世来，被世人所误，都说人间有情，但是情为何物？-2019.11.22
86,青蛇,5,虽然是很早很早前的电影了。但是不得不说经典就是经典。两大美女真的很养眼。
87,青蛇,5,徐克在其巅峰时刻拍摄的一部顶级佳作，故事李碧华音乐黄造型张叔平，演员全明星阵容。王祖贤和张曼玉的表演在此片中简直达到了两人演艺生涯的巅峰，单就媚这一点来说淋漓尽致，小青和法海缠绵那段堪称经典的晦涩。除了香艳以外，电影在画面设计和光影效果上颇具匠心，剧情更是引人入胜，充满爱恨别离
88,青蛇,5,难以置信这是这是一部比我年龄还大的电影，画面美爆，选角完美，剧情精彩，意义深刻。狂甩如今古装电影100条街！！！
89,青蛇,4,这俩妞永远都是我心中最妩媚的人~
90,青蛇,5,小时候没看懂，长大后看哭了，想到“扭呀扭”又笑了。
91,青蛇,5,真的是一部妖气十足的优质港片
92,青蛇,4,原来看了这部电影才想说，小青和法海有关系，一直驻扎在自己脑袋里
93,青蛇,4,完全世俗化的解读偶然间颠覆原本民俗体质的神话传说，获得使其在糟糕的叙事环境里脱颖而出的某种美学层义的表达。因此在围绕错误剪辑和肤浅影像风格形成的别扭影像氛围里，电影似乎更能够收放自如地展露其高度自觉的自嘲本领。这也恰是香港商业片迄今为止的最佳状态，嬉笑怒骂皆能写成文章。★★★★
94,青蛇,4,脑海里一直是青蛇和白蛇扭啊扭的走着路
95,青蛇,4,扭啊扭 扭啊扭
96,青蛇,4,老版的白蛇传，青蛇本是雄性，见了白蛇欲娶之，无奈白蛇不同意且斗不过她，只得变作姐妹相伴，青蛇对白蛇的情，才是长久之情。
97,青蛇,5,活到最后，发现到人间是为了修行，男（女）人（感情）是干啥用的呢？陪着修行的。修行的结果是啥呢？偏要我执。认清人生的真相，还要爱下去。万事皆空，不动凡情，那该多无趣。李碧华的爱情都是给女人看的，小说中许仙鸡贼至极，但电影中徐克对男性角色柔情多了
98,青蛇,4,很颠覆
99,青蛇,5,虽然在剧本、特效和拍摄手法上受时代局限显得有些土气。但我还是要予以此片高评价。并非因徐克X王祖贤X张曼玉阵容的经典，而在于电影在妖人善恶方面的思考值得赞许。在经典的白蛇传故事中表达了新的观点。对情义的描写细腻真挚，非常有编剧李碧华的风格。不同人不同年龄不同心态看电影都会有不同的感慨
100,青蛇,4,过于英俊的法海与一场突如其来的identity crisis。
101,青蛇,4,情与欲，爱与欲望，在本片中展现的淋漓尽致，景美人美剧情更美，剧中四位主演演技担当，张曼玉与王祖贤更是欲与美到不可方物，强推电影原声带，无论何时听都是春意满满。
102,青蛇,4,美术极尽风格化，迷离而狂野，人物造型美到登峰造极，音乐风格飘飘欲仙。徐老怪营造了人鬼混杂的世界，且把他倩女幽魂中的人鬼辩证更进一步，人鬼身份发生了颠倒，人的世界充斥着杀戮与狰狞，鬼妖世界保留了未被污染的真情。李碧华擅长写情，法海、白蛇、青蛇各自象征了理性、爱情与欲念这三个人性的维度。
103,青蛇,4,重看。今年《四大天王》上映的时候还常提这部片，恰好也是25周年，不禁想了想，如今还能去哪儿找到第二个张曼玉和王祖贤，演这么一部《青蛇》呢，甚至第二个赵文卓和吴兴国都寻不到了（才发现演这部片的时候吴兴国竟然都40了！）
104,青蛇,4,“我到人世来，被世人所误。你们说人间有情，但是情为何物。”印象最深的一个镜头是白素贞产子后和小青在水中相偎相依之时，白催促小青去救许仙时小青的眼神，这个表情真是演得绝了。小青对姐姐的爱才是最真挚的吧。
105,青蛇,4,美若无骨，媚态尽显。故事情节我已经记不情了，但两位美人的倩影，确实令人久久难忘 。
106,青蛇,5,想象力丰富的经典解构，每个人物都有隐线而且写的很复杂。
107,青蛇,5,经典，配乐与画面超棒的。
108,青蛇,5,长大再重温是如此刺痛人心，从后半部分开始狂哭，王祖贤演得特别好
109,青蛇,5,这个片子，不懂佛教的看了觉得很好看；对佛教文化有了解的，看了会觉得更好看！！！真的很牛很牛~~~中国拍的那些佛教故事片，不是观音传就是布袋和尚传奇，真的很少见到把佛教文化这么不露声色融入到一个片子中、又融入的这么妥帖、这么好的！！！~~~・・
110,青蛇,4,人生如此，浮生如斯。人都是不懂爱的。徐克的经典。
111,青蛇,5,张曼玉的青蛇和王祖贤的白蛇都超级好看啊  颜值在线  演技在线。
112,青蛇,5,王祖贤和张曼玉那股子风韵，20多年了都未褪色
113,青蛇,5,特效虽雷情谊真，风华绝代颜艺高。“大蛇大蛇超越吧”，法海是天龙之女，滤镜和灯光不要太骚，好想重回当时作观众。
114,青蛇,5,这片子，在我心中排第二名，不知道为什么，每次看又有重新的领悟，和有情人做快乐事。。。。。这也许是徐克最好的片子，片中的女人们，太美，太美。。。。
115,青蛇,5,非常细腻，各个方面都很出色。徐克真是懂得何谓风月情浓，很喜欢电影对于情节上的改动，法海更有人情味，许仙明知妻子是蛇但不到最后关头不想点破这个“知道”，让两人关系图穷匕见，也是对于夫妻关系有着深切体察才能拍出来。白蛇青蛇这种女人间微妙复杂深沉的情谊展现，徐克作为一个直男，极是难得。
116,青蛇,5,配乐和画面都极为出色。
117,青蛇,4,香港佳作：对于女性的美，这里总有“性”的隐藏欲望，对于白蛇传更为大胆的解构，张王两个女神的表演，妩媚多，很有趣的经典观感。
118,青蛇,4,2019亚洲影展第三场。不愧是徐老怪的作品，《白蛇传》只是个模子，法海为心魔所困，白素贞为情所困，许仙为欲望所困，在这一切里，青蛇是最大的旁观者，她见证了七情六欲，理解了情为何物，甚至于有了人的情感，同样她也见证了无情无欲之人，她看清了为人为妖或者是为佛的所有规则，在观影过程中，我们的视角已经不知不觉拉到了青蛇身上了。为情放弃一切亦或是断绝一切情欲其实都是有代价的，对错其实也说不清，回归电影本身，老怪构建的几个光怪陆离的世界和独特的美学，已经掩盖了特效的粗糙了。而张曼玉和王祖贤这两个演员我只能说美到天际了。（8.5/10）
119,青蛇,4,小时候觉得好经典，特别是刚刚幻化成人形的时候那个扭啊扭的。看了这片子才知道端午要喝雄黄酒驱邪的。@Fei's Home
120,青蛇,5,妖气那个冲天啊 充满古典又性感的女性之美 配乐也是如此完美 莫呼洛迦 流光飞舞 流水浮灯 黄和雷颂德 还不够牛逼吗 徐克还是挺有能耐的 总能特别夸张地展现这种志怪感 包括赵文卓的形象 也是极尽的夸张 快要龙珠了 现在是拍不出这种感觉了 全是硅胶一样的特效动画 再也没有恰到好处的道骨仙风了
121,青蛇,5,想给10颗星！~春天必看！~
122,青蛇,5,当重看一遍粤语版的之后，发现了从前并未发现的一切。一切有为法，如梦幻泡影，如露亦如电，应作如是观。
123,青蛇,5,那首歌都用sizishizhi的音是为了模仿嘶嘶声吧。
124,青蛇,4,“我来到人间，却为人情所困”。以我三生烟火，燃你一世寂寞；求不得啊求不得。这样的电影在当时必定是轰动的，可惜了是在今天才看……形象很颠覆却又很典型，徐克拍得很前卫，但总的来说还是李碧华写得好。电影结局有些太仓促，但还是被感动得哭了呀…………比起书，电影不是青蛇，而是二蛇。
125,青蛇,4,我是看天涯八卦有人兽才来看这片的。徐老怪啊。中式的皮里很西式的内核，这叫香蕉皮？
