,movie,star,comment
240,青蛇,3,"2008年4月，在家。
在电影里许仙还是可爱的，发现了娘子和小青是蛇精后还帮她们逃走。
这样的话素珍S得还比较值得。否则换我了就转身就跑。爱虽然要奋不顾身，但也不应该为不值得的人去S。
影片是90年代末拍的，带着那个时期香港电影的气息：浮躁、不安。还有颜色，那时期的古装鬼怪片都喜欢用滤镜染红或染绿天空。夜景则无一例外地打上绿光。连徐克也不免俗套。
不喜欢也得忍受了。"
241,青蛇,3,年代久远，记不清了。
242,青蛇,3,没准不是妖修炼成人而是人修炼成妖，没准不是资本主义修炼成社会主义而是社会主义修炼成资本主义
243,青蛇,3,颠覆了白娘子传奇，很不错。
244,青蛇,3,动作精彩，意义不大。白蛇不如青蛇真诚，率性。
245,青蛇,3,99分钟太短，故事太匆忙//配乐真好
246,青蛇,3,在所有港星都还是美女的时候。。。
247,青蛇,3,法海严重侵犯人权，联合国人权委员会应该制裁他
248,青蛇,3,法海很又型哈，没跟小青成真可惜，史上最恶之许仙
249,青蛇,3,中学时学校发票没去看，二十年后终于看了。我非常不同意对这部电影流行的百合看法。影评的主题不是情和义，而是人和佛（和妖）。佛是要灭绝一切人性的，而妖一心想的是怎么获得人性。这三者中不可调和的矛盾才是影评的主题。另外也不觉得这部电影的色调美。感觉像在后面挂了一个红光灯一个蓝光灯拍的。
250,青蛇,3,张曼玉里面怎么这个打扮 受不了有些夸张哦
251,青蛇,3,很小的时候在CCTV6看的~
252,青蛇,3,我到人世来，被世人所误，你们说人间有情，但是情为何物？真是可笑，连你们人都不知道，当你们弄清楚了，也许我会再来。
253,青蛇,3,一直不觉得王祖贤和张曼玉两个人好看。
254,青蛇,3,痴男怨女，情丝缠绵。在电影始终存在着妖和人的分别，故事慢慢的发展，人和妖的分界线愈渐模糊，可那些慈悲之士又哪有与妖、人的分界线呢？佛教说，万法唯心造，法海在片中也说，世间色相，皆属虚妄。当人、佛、妖看不透这一点时，结局就是水漫金山，悲惨戚戚…… 
255,青蛇,3,王祖贤姐姐很美耶 不过总觉得演白蛇是个错误 若是青蛇可能更漂亮
256,青蛇,3,现在看来有很多粗糙之处，但古典新诠的颠覆性确实极强，美术也极慑人。香港电影黄金时代才能产生的作品。
257,青蛇,3,两个和尚和两个蛇精的情事。一直不怎么待见徐克的片子，虽然王祖贤的确风华绝代，但那屁股扭得话娇媚得让人无法忍受了……张曼玉更是一张大脸还装清纯装洒脱……
258,青蛇,3,我是觉得一般..因为赵阿姨版的根深蒂固了.也许是自己没看懂吧
259,青蛇,3,小青摸了摸法海的下体说，你输给我了。
260,青蛇,3,蛋疼的法海和许仙
261,青蛇,3,小r候在影院看料N次
262,青蛇,3,其实我挺心疼徐克的，因为这部电影的张曼玉，王祖贤和赵文卓我认为演的都是接近职业生涯顶峰的演技，镜头运用和艺术性也都不错，但是苦于当时技术实在是太拙劣了，布景和特效惨不忍睹，可能我看的版本不够清晰，我甚至觉得胶片都有点问题，看90年代的好莱坞电影就没有这种感觉，真是难为了徐老怪。
263,青蛇,3,这尼玛有点过了。。。色情狂徐克。。。
264,青蛇,3,妖娆的歌，妖娆的女子，凛然英俊的法海，可以忽视的许仙
265,青蛇,3,主角不清，每个角色的戏份都太均等了，这片子叫白蛇叫许仙叫法海都可以，这绝对是一大失策。王祖贤真美啊~
266,青蛇,3,呃……好混乱。和我从小看到大的新白娘子传奇大相径庭。要不是看在两大美女和服装份上三星都不给。
267,青蛇,3,小时候看的。。。估计没懂
268,青蛇,3,王祖贤的白蛇风情万种、妖媚诱人；张曼玉的青蛇灵动天真、美艳脱俗。抛开其他不说，单是这两个女人，就已经成就了这部电影。但究竟电影把书的精华演绎出了几成，只有读过之后才知道。最后两句话：年轻时的赵文卓好青涩。粤语的配音让人难以接受。
269,青蛇,3,依然与小说相差甚远！不过张曼玉的青蛇还是很美很媚很妖娆的
270,青蛇,3,李碧华 徐克 黄
271,青蛇,3,很小看过的。。印象不深刻了
272,青蛇,3,"剧情早已熟知，无创新，唯有演员，让人惊艳。
徐克要告诉我们什么，妖可以很正派，很淫荡，又很痴情？"
273,青蛇,3,算是徐克的劣作吧。忍了。
274,青蛇,3,比较喜欢这里面的法海~~
275,青蛇,3,发现我从小就看不懂徐客
276,青蛇,3,看不太懂，是徐克故意要颠覆传统吗？
277,青蛇,3,张曼玉活吃小老鼠很妖...整个片给我的感觉就是湿漉漉的...
278,青蛇,3,你千年的修行，为了一个许仙，值得吗？
279,青蛇,3,那配乐太尼玛迷幻了。那逍遥小屁股扭的我至今难忘。翻拍的很成功。
280,青蛇,3,2个蛇精都很销魂，万千不记得许仙是哪个演的
281,青蛇,3,"不认识张曼玉了，演的不错。
去过金山寺后又看一遍。束缚人的，是情吗？佛法就是用来束缚别人的一道名正言顺的枷锁吗？也许佛祖经历了若干重天找到了他理想的那一重，于是想渡众生也去那里，可是众生并不觉得自己所在的一重就不好，所以法海也苦，许仙也苦，白蛇也苦。原来有一种苦是因佛的执。"
282,青蛇,3,完美的商业电影，差一步就是完美的电影了。从特效到摄影，再到两位美神，拿到今天完全超越那些号称大片的糟粕。可惜与《诱僧》一样，被李碧华的文字所局限。我最恨满口戒律的假和尚，封山堵水，抵不住五音五色，人不能和人性做斗争，否则最后大罗金仙也会如那被洪水从内部爆开的金沙寺一样，自绝于自然
283,青蛇,3,编剧是李碧华？？特效做的不咋地。。。
284,青蛇,3,喜欢张曼玉。超喜欢。
285,青蛇,3,那个，白娘子和小青是不是百合了
286,青蛇,3,姐姐，你千年修行，为了一个许仙值得吗？
287,青蛇,3,小时候学校组织看的，都忘啦，有机会再看看
288,青蛇,3,徐客其实我不喜欢你
289,青蛇,3,左右为难，自欺欺人。
290,青蛇,3,94216
291,青蛇,3,情是个什么东西...
292,青蛇,3,最近看到网上说青蛇乱法海修行的那段很有内涵的，不知是真是假
293,青蛇,3,张曼玉跟王祖贤谁大啊，张美人演小青，还这么骚，一点都没有花样年华的闷骚感。王祖贤这么骚这么妩媚倒是正常，人间尤物啊
294,青蛇,3,为什么名字叫青蛇呢？
295,青蛇,3,场景很享受，拍人差了点，讲故事就不太好了，逻辑不大通，以致结尾一直出戏，虽然那戏不错。忍心给三星。
296,青蛇,3,当时很不能接受的是，许仙竟然和小青有暧昧。不过长大之后再回想，男人，可不就是这样的么。。。。。。
297,青蛇,3,大家是因为王祖贤和张曼玉的暧暧昧昧给了这么高的分么？而且我隐约在片里看到了宝莱坞印度歌舞。。我穿越了？
298,青蛇,3,当时还是小孩子的时候，竟然觉得这个片子有点色情~
299,青蛇,3,技术性与故事性是不是真的无法融合？
300,青蛇,3,BC香港武侠影展。可能是因为今天放的版本有阉割，看到了解构，却读不出太多的东西。那么，看看徐克对色彩的运用，还有张曼玉与王祖贤的争奇斗艳，也还不错。
301,青蛇,3,后来才知道，原来里面多东西都没看明白，现在懂了点
302,青蛇,3,Maggie的骨子里有种抹不去的妖媚
303,青蛇,3,为什么法海老是那么不讲道理....这个许仙看起来好废物。名字为什么要叫青蛇？..万恶的雄黄酒，为什么老坏好事。果真谈起恋爱，连千年蛇妖都要变成白痴。
304,青蛇,3,这电影比我出生得还早= =昨天半夜无聊重新看了一次，现在感觉好猎奇，毕竟是那个年代的特效，赵文卓的龙纹身和不能更假的蛇尾巴太好笑了。我好像没怎么看过张曼玉年轻时拍的戏，简直是惊叹她那时的外貌加上演技，以至于冲着王祖贤来，两姐妹一起出镜时眼睛却移不开张曼玉。还记得小时候看青蛇时，是和
305,青蛇,3,没有看出来的情与欲
306,青蛇,3,一部女同三级片。
307,青蛇,3,我最喜欢的中国导演是徐克！！
308,青蛇,3,妈妈带我在奶奶家楼下的电影院看的，当时当成恐怖片来看，印象不深了……但是妈妈带我看电影的场景总是很深刻，也让我深深地喜欢上了电影院，喜欢上了电影。
309,青蛇,3,神啊，多n些痴情的妖精吧！
310,青蛇,3,叫人印象深刻的是那个时代的香港电影，原声大碟的制作
311,青蛇,3,祖贤……我要~，文卓……我靠~
312,青蛇,3,每个女人，也希望她生命中有两个男人：许仙和法海。是的，法海是用尽千方百计博他偶一欢心的金漆神像，生世位候他稍假词色，仰之弥高；许仙是依依挽手，细细画眉的美少年，给你讲最好听的话语来熨帖心灵
313,青蛇,3,人生如戏，浮生如此，缘散缘聚
314,青蛇,3,不见武侠与美感的影子，在是满脑子的徐克和李碧华。
315,青蛇,3,张曼玉和王祖贤都好漂亮呀
316,青蛇,3,我扭 我扭 我扭我扭我扭~~~~
317,青蛇,3,场景拍得不错。港片的翘楚了
318,青蛇,3,1、成人片与非成人片界限在哪？那层布？2、小白叫白素贞，小青叫什么？青花瓷？3、王祖贤张曼玉所有角色中，本片应为最媚。4、本片是中国文化之集大成，许仙为儒，法海为佛，那位降妖伏魔的草根高手为道家。
319,青蛇,3,徐克通过青蛇新解白蛇传
320,青蛇,3,徐克通过青蛇新解白蛇传
321,青蛇,3,白娘子和小青都太妖娆了，因为电视剧版大气贤惠的白蛇印象太深，对这种都有点接受不了了……
322,青蛇,3,也是很早时候看的了，当时感觉王祖贤和张曼玉都演得好妖精啊（不过本来就是妖精= =），整部片子还是很雄浑壮丽的感觉，观众的代入感很强
323,青蛇,3,白蛇和青蛇在里面很性感
324,青蛇,3,2008年的我无法欣赏鼎盛时期的香港电影
325,青蛇,3,讲述两个女人蕾丝的故事
326,青蛇,3,最喜欢小青和白娘子在西湖边的那个片段
327,青蛇,3,小时候看，不喜欢；后来因为新红楼梦，才明白当时的铜钱头用的多么恰当~
328,青蛇,3,对这种风格不太感冒
329,青蛇,3,谁说青蛇不懂情
330,青蛇,3,这个故事太熟悉了。。。其实电视剧比较好看
331,青蛇,3,除了两蛇的演技别的都不想说、= =
332,青蛇,3,感情这东西太特么累人了，好好的做妖怪岂不更好？
333,青蛇,3,另类白蛇传
334,青蛇,3,许仙很猥琐，白蛇很霸气，法海很混乱，众人很迂腐……此片很糜烂啊。许仙对白蛇不是爱情，是肉欲。还是最喜欢青蛇的坦率天真。
335,青蛇,3,旖旎好风光
336,青蛇,3,音乐太美好，故事比较颠覆，本也没什么不好，但是结局太狗血了
337,青蛇,3,故事讲得太满了，面面俱到反而没有了个性的发展
338,青蛇,3,故事简介和剧照比电影成片吸引人系列。最期待的是张曼玉最后的那滴泪，结果tm毫无预备的跳切出来了……
339,青蛇,3,这也太歪曲佛法了。。两条蛇演绝了！
340,青蛇,3,全因法海生事，到头来谁也没有搞清何谓对错
341,青蛇,3,唯一一次和爷爷去电影院看的电影。。。
342,青蛇,3,主题歌还不错
343,青蛇,3,"经过港派的演绎,故事就别有味道了."
344,青蛇,3,“贫僧来自金山寺，法号法海...”
345,青蛇,3,很老很老的电影，白蛇传的电影版
346,青蛇,3,可能是我不太喜欢的风格。
347,青蛇,3,青蛇的凄美
348,青蛇,3,张曼玉，王祖贤。不看美女看电影作什么？
349,青蛇,3,一直很讨厌法海
350,青蛇,3,演员们的演技不错。那个时代的特效我也就不讲究了。感觉不好的地方是草草的结局，颠覆传说的结局。尤其是青蛇毫无预兆地杀了许仙的一幕。另外法海这个形象塑造地太过刻板了。
351,青蛇,3,剧情不行，画面很行。
352,青蛇,3,小时候看觉得妖气十足，现在看觉得千娇百媚。
353,青蛇,3,500年的小青
354,青蛇,3,我扭我扭~~~
355,青蛇,3,"小时候看，觉得法海就是大魔头，并一直奇怪为什么这么个大魔头为什么没人来制他呢？
现在再看，原来是，作为高僧的法海，空有一身法力，在思想上却实在落后。"
356,青蛇,3,我是多么喜欢白娘子这个故事。只是喜欢故事而已。
357,青蛇,3,"白素f：“小青，我白硎郎弦惶耍一事o成。半生`我是V情，你永h不要重蹈覆H。切！” 
　　 小青f：“幸好我把他⒘耍他]C遇上另一新g。” 
　　 ――《青蛇》李碧A"
358,青蛇,3,酱……我错在跟我妈一起看了这一部片子啊，整个电影中我都脸红心跳啊啊啊啊，我妈在小青调戏法海的时候问我“你看不看得懂他们在干吗啊”的时候我真想一巴掌抽死我自己啊。话说回来，我还是不适合看这种古老的香港武侠片，因为他们的核心都被一群乱七八糟美的七荤八素的镜头搅乱了。看着堵得慌
359,青蛇,3,真的非常妖娆啊，不过我总是觉得白蛇与青蛇的演员转一下比较好，张曼玉看起来比较像白蛇呢。
360,青蛇,3,不知道 觉得蛮好看的啊 青蛇真的好美 青蛇真是风尘入骨啊 谁说这样的女子不吸引？
361,青蛇,3,立意不错，就是剪辑有点烂
362,青蛇,3,诡异的非常态的青蛇传。
363,青蛇,3,ms是7岁时候看的
364,青蛇,3,配乐完美，化妆布景还凑合，人物（除了小青）一塌糊涂，情节不可救药。最搞笑的是刚看以为是3p，最后才明白是女同。。。。
365,青蛇,3,白素贞的宿命是小青，结果被许仙搅黄了。
366,青蛇,3,最大亮点就是两女主，但是也没觉得那么经典，3星到3星半。本版的许仙也没有和青蛇有过分的暧昧，根本没对不起白蛇，每次都是青蛇主动诱惑然后他推开，怎么这么多人唾弃，甚至觉得结局大快人心？青蛇一再不听白蛇的话，甚至多次诱惑许仙，虽然批判一个有意学人入人世的妖怪未免矫情，但是大家不觉得她有一点问题，却全部怪许仙，难道不觉得有失偏颇？本片确实有提及人和人世的疑问，但也只是浅尝即止，也没到什么高度，感觉有些过誉了。如果要更深入，青蛇和许仙法海间还要更多的互动纠缠。当然，还是开头的话，只看两女主就值回票价了。
367,青蛇,3,人间有情，但情为何物？
368,青蛇,3,j望不是女人，不是蛇，是水。@是凫缎炜擞腥さ脑。最K是李碧Ac美g巫≌部片品。李碧A的文字作品，_迟I不I得到呢？
369,青蛇,3,吴兴国那双眼睛长得真好。BD 720P 重温 16/11/06
370,青蛇,3,后来水漫金山寺那段尤其不错，那一剑捅的好。
371,青蛇,3,2007年1月14日
372,青蛇,3,有的部分好诡异啊像色情片。。不过其实只是想突破那个故事，最后又回到那个故事，算不算小青只喜欢白素贞呢。。
373,青蛇,3,??08 ???? ???
374,青蛇,3,该电影的原声是香港电影原声中少有的佳作之一。
375,青蛇,3,看惯大开大阖的徐克居然拍出如此诡异的电影…………
376,青蛇,3,原来是2女1男的故事。
377,青蛇,3,徐老怪我还是欣赏不能啊～
378,青蛇,3,重新看了一遍 那特效我就不说了 故事呢 按现在标准 剪的还是参差了点 但主角们真心美啊 而且两条蛇姐妹情深演的蛮好 王祖贤先救仔也蛮感人 还是靠演技啊 丢到现在 谁哭的梨花带雨 我估计都是个铁心。。。
379,青蛇,3,记得93年。。那天，阴天 雨天 和奶奶一起
380,青蛇,3,呃，电影频道的回忆……
381,青蛇,3,为什么题名是《青蛇》？
382,青蛇,3,不是很喜欢这种风格的电影.
383,青蛇,3,u色u相，竟李碧A是情酃适碌模要求也不能太高。
384,青蛇,3,如梦如幻，但原著更惊心动魄，电影还是把原书的精神给篡改了，只为谋得一个“和谐”的结局
385,青蛇,3,"老怪就是老怪,走起路来很徐克.张曼玉很辣呀~~"
386,青蛇,3,在那个特效尚落后的年代，徐老怪能把片子拍的奇幻色彩十足真是不得不佩服。
387,青蛇,3,节奏很赶，而且意识流手法用得不是很娴熟自然
388,青蛇,3,白蛇传头号电灯泡儿～张曼玉吃老鼠了～
389,青蛇,3,配乐太不节制。江南拍的好浑浊。说实话跟港片挺不来电的。
390,青蛇,3,评分高点在何方
391,青蛇,3,卷，我和你都是俗人。
392,青蛇,3,那时候的她们真是顾盼生姿。
393,青蛇,3,张曼玉抢了王祖贤的风头，青蛇比白蛇出彩，不知道调换一下会是什么效果
394,青蛇,3,我没那么喜欢看……
395,青蛇,3,看过小倩，不太喜欢这里的王祖贤...
396,青蛇,3,我讨厌张曼玉 也讨厌王祖贤
397,青蛇,3,三星半。应该是最好版本的白娘子故事，妖气十足，何必为人。小青爱姐姐，姐姐想做人，做人有何好，法海许仙一般蠢。
398,青蛇,3,小青才是极品啊！！！
399,青蛇,3,与有情人做快乐事，未问是劫是缘。
400,青蛇,1,我一直觉得只有我一个人完全get不到这剧，真是想哭，看这剧还是因为有个文章夸了这影片，看其他人反响也十分不错，结果从网上搜来看时，一度以为自己看错了剧，可能是年代久远，又或者我实在领悟不了影片的含义，只有最后结尾时水漫金山让我感动了一把，结局为点金之笔，若是没有这个结局，想给负分
401,青蛇,2,意识到一个话题。这个徐克吧，他就是很三流。或者三流都算不进。又或者这个武侠吧，它本来就很难进选三流以上。武侠吧，差不多就是狗血剧情（+故弄玄虚/义正词严）+视听感官刺激+荷尔蒙挑逗。古龙是小学时抵挡语文课看的爽文，金庸是高中逃避复习期末考试= = 看的时候爽吗？爽。看完有精神提升吗？还不如回去看语文课本，起码还带点古诗词= = anyway，跟青蛇是没什么关系，只是突然想到徐克这个名字，差不多就是神雷剧情，加飞来飞去，加巨大声响。加妆容凌厉的美女。看了十秒钟2018年狄仁杰片花，还是那点花头。虽然我少年时期贡献给武侠的时间和感情不多，不至于说意识到这个话题时为自己的懵懂时光大感不值，但它至少还是占据了我的一部分记忆。如此想来，小时候看的所谓经典香港电影，莫不外乎上述配方。感慨的同时，突然想到卧虎藏龙，一声叹息。
402,青蛇,2,小时候看过一遍，不记得什么东西。这次看是抱着好电影的期待看的，结果。。首先呗白蛇和许仙的爱情互动打败了。。完全看不到爱情。。后来许仙被吓晕之后可能有一段感情发展？我不知道因为我睡着了。。剧情还是单薄，跟李锐的《人间》比差太远。。外加对王祖贤的智商演技很无语，她除了媚根本不会别的吗
403,青蛇,2,剧情梗概：1、青蛇和白蛇有一腿；2、青蛇和许仙有一腿；3、青蛇和法海有一腿。
404,青蛇,2,怪力乱神恶趣味软色情厌女症。充满反抗精神的爱情故事只余下情欲与极度被色情化的女性。和尚对产妇动邪念这种情节得多猥琐的人能想出来。
405,青蛇,2,就像不喜欢倩女幽魂一样的不喜欢.......
406,青蛇,2,文学是有其价值的，但改编电影实在是劣质粗糙看不下去啊。真心厌恶这种类型的港产片。BTW整个氛围好像鬼片。
407,青蛇,2,两条蛇有点骚啊，但是张曼玉很勾人，两蛇是不是有点les情节，特别是青蛇对白蛇。赵文卓没想到那么帅。。。
408,青蛇,2,徐克张曼玉王祖贤，真让人失望。干枯的戏，没有感情
409,青蛇,2,张和王得造型很好看 其他就没什么看头
410,青蛇,2,很久前看的，不喜欢，没什么感觉！
411,青蛇,2,个个都把你们奉为经典，我却不大喜欢您们的媚气。
412,青蛇,2,陆陆续续看了很多次，不觉得咋地。
413,青蛇,1,管它经典不经典，管它是谁演的，不喜欢照样一星。
414,青蛇,2,"请问你们扭来扭去到底在干吗？
还有！对女人来说，长得men真的是一个很悲惨的形容词，王祖贤小姐
好么！好么？"
415,青蛇,2,小时候和俺娘花了钱走进电影院看，以为是新白娘子传奇风格的……结果看到张曼玉姐姐人形蛇魂实在是只能吓的中途离场――所以徐克先生的风格就是要吓到小孩子的呀。
416,青蛇,2,法海大师，不是你太执着，也不是你的错，是他们太二
417,青蛇,2,2011.12.02：悲剧；是我不懂得爱情？还是不明白电影？总之，不喜欢的感觉。
418,青蛇,1,神马乱七八糟的
419,青蛇,2,小时候看的，没怎么理解剧情，也许本来就没什么剧情，只记得两个女人扭动的姿态
420,青蛇,2,现在看真的很烂……各种五毛特效……虽然能理解当时的条件限制，但是……王祖贤和张曼玉在里边真的很假啊……
421,青蛇,2,思前想后终于还是随波逐流打了两颗星，想打一颗的！可能是我的审美低于平均水平，这部片子我有几处都差点看不下去。可能是很冗长的故事非要在138分钟内说完显得剧情有点欠缺不合理节奏有些跳跃。音乐一星两个女神一星。
422,青蛇,2,小学六年级的寒假和同学一起去影院刷的。
423,青蛇,2,1就像看了一个半小时的mv2主题不明智3伪玄幻
424,青蛇,1,"我看改名青楼更好,两个女主角的表演好似妓女.拜托,并不是一脸饥渴像就叫妩媚"
425,青蛇,2,"很失望 
浪费了大好时光 
特技效果太差了~惨不忍睹"
426,青蛇,1,一坨屎啊，，断续无脑的剧情，，加上 昆曲的 发音
427,青蛇,2,#第二部徐克# 这部片的世界观设定可以说是非常幼稚了，想讲的大道理太多，金句连篇，但是实在塞不进这个让人看不到丝毫诚意的故事。
428,青蛇,2,逵猩瘛！！Ｄ训牢也还挥哪。。。
429,青蛇,2,要是百合那该多好啊，这个法海有点帅哦。我愿意贪恋女色！最后一刀刺的好。
430,青蛇,2,【50】烦死这个剧情。好好的改成这样。
431,青蛇,2,可惜了小说，拍成了一B级片……
432,青蛇,2,女主角造型很美。
433,青蛇,1,看不出来小青喜欢许仙，还有她为什么说许仙背叛了她们？根本看不出来许仙是一个负心汉吧！要说小青喜欢姐姐还有点可能。逻辑很混乱也。搞这一圈就可以批判爱情了么？或许根本就没有爱情，只有性和习惯～（卖肉太多了，特效乱，剧情乱～）（端午节驱蛇～今天是端午节）到最后青蛇也没懂感情，是好是坏？
434,青蛇,2,法海的纹身亮了  整体不科学
435,青蛇,2,李老师真的是非常的厉害 在这样一个框架里 重新勾勒了所有人物 完美的让各自的性格充分的展现 可惜徐大师只是在场面上完成了 如果霸王别姬不是在某些个机缘巧合中拍成这样 也很可能被泯然 演员倒是用的相当相当出色 无可挑剔 美术上单从视觉上不讨论服务度和契合度也能给满分 还有就是惊喜的雷颂德了
436,青蛇,2,除了服装能看外就没什么了...
437,青蛇,2,很讨厌这片子。
438,青蛇,2,也许做时光机回到那个年代看会觉得比较有趣。反正我花了两天才看完的
439,青蛇,2,王祖贤是美妖媚不是每一个人都能玩的，张曼玉好看吗？一星给主题曲，一星给祖贤姐姐，叫阿姨了吧应该。。。
440,青蛇,2,很美学，但是故事不喜欢，修行五百和千年的妖怎么就为了许仙吃醋放弃修行，就因为他老实吗？那这世界上老实的人又不知有多少。妖看人应该是朝生暮死的虫豸。聊斋的女鬼都是大人的意淫罢了
441,青蛇,2,小说被改编成那样实在是好神奇好神经 不觉得好看啊喂！虽然王祖贤张曼玉很美啊！！！
442,青蛇,2,于是 白素贞的儿子拜了法海为师 成为了一个捉妖的小和尚。。。。。
443,青蛇,2,醉了，，王祖贤好丑啊。。。而且看的时候尴尬恐惧症要die了。。
444,青蛇,1,什么东西嘛
445,青蛇,2,原著党表示并不喜欢，原著里的妖魅迷离气氛完全沦为了情欲美色的泛滥，对剧情的一些改编也烂俗。李碧华的故事，不是谁都能拍的。
446,青蛇,2,我现在都记得那个ticket box有多小，有多stand的感觉！真的是一个很小很矮的BOX，里面只能放一把椅子坐一个人！
447,青蛇,1,............
448,青蛇,2,看碣慌幽魂上半部喜∠掳氩看螋Y的O置是徐克的主意
449,青蛇,1,有时候豆瓣 top就是水 很多人说这片子放到现在也不过时 我觉得这片子放到现在也就是个二星烂片 除了三位演员 还有什么 色调 ？配音？悲情吗？讲了个啥？人妖殊途？
450,青蛇,2,with熊 好猎奇的特效&配音・・・・
451,青蛇,2,被看的。。。挺无聊的。。。
452,青蛇,2,三级片+神怪片+徐克特效
453,青蛇,2,徐克是最早的烂片王。
