,movie,star,comment
126,青蛇,5,高兴也哭，悲伤也哭。虽然人类总是惯性用眼泪来表达情绪，但是当你懂得了一滴眼泪的重量，就再也回不到从前了。报恩的妖怪，捉妖的和尚，好色的书生和贪玩的小青，爱恨情灭惊惧悔，最后全部湮灭在一个初生婴儿的嚎哭中。
127,青蛇,5,情者小青，法者水去。道法似电每悔，情缘如水尽去。
128,青蛇,4,"年轻时，更爱这部电影，因为每个人（妖）都有情，虽然都不自知；人到中年，更爱原著小说，因为人是凉薄的，相比爱情，更爱自己，一心做人的妖反而学不会人的薄情。
所以，电影没有问题，只是是太暖了，我们都知道人世有多冷。"
129,青蛇,5,我到人世来，却被世人所误。看无数遍也不腻的经典，越成熟，看着越痛。画面、配月、色调、妆化、故事、内核、表演形式全都是一流，将情欲与成长讲得那么透彻。
130,青蛇,5,没想到这样好看
131,青蛇,5,徐克最出色的作品之一，深谙文化但并不囿于传统。并没有颠覆传说故事，只是从另一个纬度去解读。光怪陆离又至真至性，美术更是登峰造极了。“人生如此，浮生如斯。缘生缘死，谁知，谁知？”所谓成长就是认识“混沌”的过程，人与妖的界限，有情与无义的界限，值得与不值的界限，局外人很难评判或分辨。
132,青蛇,5,所谓人妖殊途，李白笔下的男人怯懦无能，而人不如蛇，男人低于女人。痴男怨女，爱恨情仇
133,青蛇,5,"这一滴泪，这一眼神，这一微笑，使得青蛇与张曼玉成为影史永恒。牲畜拥有了感情，与人还有何区别吗？这一点比拥有七情六欲的人不断消磨殆尽自己的善与爱强得多吧。
法海脑海浮现的裸妇产子、青蛇与印度舞女贴身缠绵跳舞、青蛇与法海的水中斗法… 无一不是直面生而为人的本性。
“姐姐你总说人间有情，难道妖就无情？我们相处五百年，难道不是情？”
“总说人间有情，你们世人都不知道情为何物。”
妖，也只是人类的欲念罢了
而妖有了欲念情感，该何去何从？
将欲望层层剖开，扔给观众而无解答。
"
134,青蛇,4,王祖贤还是适合性冷淡风和似水柔情，终究还是骚不过林青霞
135,青蛇,5,小时候当武侠片看到的都是群妖乱舞，长大了才明白这其实是一部情欲电影。影片里白蛇和许仙，青蛇与法海，白蛇与青蛇之前可解读的内容太多了，只可惜本次香港电影展不仅不是粤语版，而且把全片最精华的两段情欲戏全部删除，实属遗憾。
136,青蛇,4,哎哟，徐克+李碧华真是绝配啊。一切仙佛在人本主义之下荡然无存。张曼玉真是淋漓尽致的表演。还有黄作词的那首莫呼洛迦，妖~   8.1分
137,青蛇,4,一分献给《流光飞舞》，有些片子不愿重看，感觉压抑，不知道是片子压抑还是某次看这电影的时候压抑，阴影了
138,青蛇,5,这两天又重看了这部片子，而且把一直没看下去的小说也看了，感觉是难得的电影改编比原著小说好的。电影里许仙的渣行更合理，法海的人物设定也更丰满，也看懂一些小时候没看懂的东西。觉得好东西就是这样，每次看都会有新的发现和认识，虽然因为年代久远一些技术上的东西差强人意，但依旧经典
139,青蛇,5,徐克最佳兼又一部（为什么说又）因为超前而注定会被误解冷落的杰作。讲的是爱情，又不止是爱情，动作场面都在为小青的阵痛成长做铺垫，千年修行换来了“做人不如做蛇”的感悟，其实我们长大成人不也是如此吗
140,青蛇,4,蛇能变成人吗？我们于《青蛇》最终诞下的那颗修行了五百年晶莹剔透充满水分的眼泪里看到了雄辩的答案。而徐老怪也从这个惊天地泣鬼神的千年传说中洞见了体制教条扭曲与碾压个体的事实，所以他拍出了这部经久不衰的批判力作。在93年那个技术生产力尚且匮乏的语境下，创作者们的美学思想反而走在了先锋。
141,青蛇,4,"一个好导演+半个好演员+一个花瓶+一个垃圾+一个极品垃圾=★★★★   
徐克是好导演。张曼玉开始摆脱花瓶。王祖贤还是花瓶。赵文卓是谁？演许仙的是谁？"
142,青蛇,5,"李碧华的小说，李碧华的剧本，徐克导演……
张曼玉、王祖贤主演……
这个阵容不算豪华，但是真的很到位"
143,青蛇,5,青蛇说：我们来到人世，只是为了学情。可是你们人类自己都不懂，等你们懂得的哪天，我会再回来。
144,青蛇,4,徐克这部拍的真不错。。很有中国味那个颜色拍的嗲。。王祖贤太妖了张曼玉是搔呵呵。。蛮灵蛮灵。。
145,青蛇,4,记得最牢的就是青蛇和白蛇一扭一扭走路的样子~~小时候电视上看到过无数遍的电影~~
146,青蛇,4,CCTV6删减版 徐克妖魔武侠登峰造极之作 可惜现在再也不可能拍出这样的作品了 即便是他本人！
147,青蛇,4,1993年的徐克真先锋，张曼玉和王祖贤的妖娆气质给荧屏留下了经典的青白蛇妖形象，幸好当时的巩俐和梅艳芳没档期...那扭啊扭，扭啊扭...的风情直到现在还在我的脑中印记。也许为了许仙这样的男子不值得，但千古的爱情都是如此，现代女人什么都解放了，有些反而不如那两条蛇了。
148,青蛇,4,"又名: Ching Se

导演: 徐克 (Hark Tsui)
主演: 王祖t / 曼玉

上映年度: 1993
制片国家/地区: 香港
语言: Z
imdb链接: tt0106559


"
149,青蛇,4,大半夜的又看一遍...人生如此，浮生如斯，缘生缘死，谁知谁知
150,青蛇,5,"我也不知道我看过什么⊙66⊙？版本了据说CCTV是82分钟版本，豆瓣显示是99分钟版本，我网盘下载了一个不到95分钟版本，看来究极版本也是看电影的纷恿耍可能VCD或者DVD港版就是有不同吧，且看且珍惜吧，如果有更完整的我再看，目前是1:34:51（等于95分钟左右）所谓修复版
*【2018 - 08 -20 网盘下载[完整版][DVDRip-MKV/2.68G][国粤双语/中英双字][480P]U盘投屏再看片长：98:46（约99分钟左右）】"
151,青蛇,5,拍的真美。场景，造型，服装，音乐。有古老的神话奇幻美，有传统的戏曲和风俗美。又有小桥流水，荷花盛开，青青竹林。还有白衣书生和美丽蛇妖。音乐更是有佛国印度的歌舞和缠绵的情思和气势恢宏的斗法。融合了诸多的古典美，同时在设计和主题上又创意先锋。“值不值得容不得我想，千年修行不知所谓”
152,青蛇,4,"重藏 2007-07-18 .每个女人，也希望她生命中有两个男人：许仙和法海。是的，法海是用尽千方百计博他偶一欢心的金漆神像，生世位候他稍假词色，仰之弥高；许仙是依依挽手，细细画眉的美少年，给你讲最好听的话语来熨帖心灵。 
."
153,青蛇,5,徐克永远的经典。张曼玉和王祖贤的白蛇青蛇实在是太太太美艳了!
154,青蛇,5,初中学校组织去电影院看的第一次，看完后同学们都讨论为什么法海在笑。N年后我又从网上下载来看了回完整的粤语版，才发现当时被电影院给骗了。开篇的裸身舞和后来色诱法海的经典片段都被和谐了~张曼玉把青蛇的妖媚蛊惑发挥地淋漓尽致。我总是替小青不值，小白是属于小青的，那废材男插什么足！~
155,青蛇,5,小青一句：你们说人间有情，可是情为何物？真是可笑，连你们人都不知道。终于点破了这点红尘。。。
156,青蛇,4,青蛇 .Green.Snake.1993.DVDRip.x264.2Audio.AC3.INT-NowOur 2g
157,青蛇,5,最爱徐老怪的就是这部《青蛇》，包括《倩女幽魂》在内曾一度让我认为他就是东方的蒂姆伯顿！片中放花灯那段不禁让我想到了《仙剑奇侠传四》哦。而王祖贤和张曼玉更是将女人的妖艳，娇媚，性感，容情似水等等表现的淋漓尽致，所谓女神就是说她们二人啦！
158,青蛇,5,"人们忽略它可能因为形式吧。其实它的内核包含了人性。
里面有很多经典的台词，“我来到世上，被世人所误。你们说人间有情，但情为何物？真好笑，你们世人都不知道，让你们弄清楚，也许我会再回来。” 
"
159,青蛇,5,小时候看的是妖魔鬼怪，大些时候看的是情窦初开，再大的时候看的是你情我欲，再大的时候看到的悲悲戚戚 。芸芸众生，形形色色的人，光怪离奇的怪，艳丽的风景，凄美的音乐，无情的宗教，被精神阉割的男人，火热的千年女妖，对人性深处的拷问，谁人谁妖？
160,青蛇,4,2006.7.26. 第N遍。2007.6.15.第N+1遍。2008年11月15？16？第N+N遍。
161,青蛇,4,先赞一下徐克，再赞一下他先锋性的配乐、色调、画面，非常格格不入但又毫无违和感，大胆、新鲜、刺激，不知道为什么会用这些词，就是直观感受。但也不是没缺点，情节的推进就是个问题，跳帧一样时快时慢，总体节奏还是稍快。小青的角色很有深度，细想想会有如梦初醒的感觉。
162,青蛇,4,那个极具爆发力的高潮拯救了整部电影，否则这就是个《倩女幽魂》升级版，无论是技术还是剧作。徐克自身的定位决定了这部电影在情感上的探讨只能到此为止，虽然它完全具备成为另一个《霸王别姬》的可能。张曼玉在PK中完爆王祖贤，一个又能风骚又能神情的演员一定会比一个只会演女鬼的花瓶出色。
163,青蛇,4,"她和张曼玉的组合 一切是如此完美
裙摆只消轻轻摆动  即有蛊惑人的美丽
小青的率性  妖娆  几分的邪气  张曼玉都刻画得入木三分
忆起了  白素贞水中的凝望 嘴角的一抹浅笑
以及西子湖畔  滴着水珠的衣衫  油纸伞下  她那双妩媚流转的眼睛  "
164,青蛇,4,做人真难，自由真难，到底情为何物，人不知道，妖也不知道。法海斗法斗不过小青，他终究还是人不是佛。法海露出了纹身，就算纹了一条龙，也还是人的体现。
165,青蛇,4,奇趣的灯光美术，舞台化的梦幻景象，恰合人妖两界的情始情终。
166,青蛇,4,"今天看到新闻惨见祖贤现照  觉得很难过  美人最是敌不过岁月  就重温了这部青蛇 回忆女神最美好的样子
张曼玉和王祖贤都妖娆美好的很  配乐 画面 氛围都很赞  好片子 
还有徐克这老怪物  是有多喜欢拉拉情节啊  刀马旦 青蛇 东方不败都是这样"
167,青蛇,4,当时不明白为什么这部电影叫青蛇，明明白蛇才是主角啊。现在才知道电影不是为了讲述许仙与白蛇的故事，而是要探讨成长，人性，爱，欲，恨，纠缠。
168,青蛇,5,小青：我到人世来，为世人所不容，你们说人间有情，但是情为何物，真是可笑，连你们人都不知道，当你们弄清楚了，也许我会再来。法海：小青。小青：哼！
169,青蛇,5,白蛇传新解，感情也纠结，其实觉得曼玉、祖贤在许仙之前也是一直相爱的。
170,青蛇,5,难以想象以前的王祖贤，张曼玉的妖娆曼妙在如今还有哪个没垫过鼻子的女星能比。也难想象当年的鬼才如今却难突破自己。
171,青蛇,5,我想养条美女蛇了 帅哥蛇勉强也接受吧 恐怖宠物店里的D伯爵什么时候送我一条？
172,青蛇,5,"也是特小的时候看的
那时候只知道傻笑
只知道扭啊扭和三角争
这些情这些爱 唯有相忘可抵消"
173,青蛇,4,张曼玉与王祖贤，很是妖媚风情。徐老怪的片子就是有点邪气。其实心目中的白娘子和小青还是赵雅芝和陈美琪那种端庄典雅派。
174,青蛇,5,初次看时，只觉得乱七八糟，不符合心里的常规价值观，有点厌恶抵触。后友人喜之有甚，无聊间隙复又开篇，尚略懂。。。青蛇是此刻唯一的动物，她道行浅薄，人情世故不能领略，保持了畜牲（蛇）的习性，喜欢就争取，不悦就离开，惹祸生非也洒脱自如。白蛇已完全幻化为人，甚至比人还有人情味儿，她知书达礼、温柔贤淑，是人中典范了，不知是初为人的自卑使然，还是心中的善良无穷无尽，极少看到她发火生气……许仙是这凡间的普通男人，有普通男人的审美也有普通男人的欲望，虽然我不希望看到这些……法海最后还是没有过了这情关，是青蛇过媚？还是情根难除？只怕他在神秘中也是一个普通人吧！呃，普通男人……
175,青蛇,5,第一次，年方二七，看了一脑子妖魔鬼怪，十分压抑。第二次，看尽了情，欲，爱，恨，忠贞与懦弱，却更为压抑了。
176,青蛇,5,结局比小说决绝却少了点苍凉，赵文卓作为花瓶鼎盛之作。。。配乐真正到位
177,青蛇,4,卧虎藏龙？ 英雄？ 唯美的开山是谁？青蛇做到的绝对是那个时候的极致 你看人家也是京剧头吧 怎么就那么好看呢？！
178,青蛇,5,这是徐克作品中我最喜欢的一个 尤其是黄沾的音乐 犹如画龙点睛！！大赞！
179,青蛇,5,哎呀哎呀~~小时候心中的两个美女姐姐同时出现的时候我那个激动的啊
180,青蛇,4,童年经典真的别随便复习，看完原著后回头看电影，觉得这压根就跟原著没啥关系。徐克毕竟是男人，把许仙几乎改了个彻头彻尾，连法海戏份都加到如此重，大刀阔斧的改编直接导致剧情漏洞百出，例如原著最后杀许仙有众多铺垫，电影则莫名其妙。看在音乐服装和演员份上，三星半吧
181,青蛇,5,很小时候看的了，奇妙的是我还记得  2015.10.23重温
182,青蛇,5,另一种美艳绝伦~仙境也不过如此吧~有温柔纯情的白素贞~还有俏皮惹火的小青~白玫瑰和红玫瑰兼得~每个男人大概都羡慕许仙了~这不是故事一场~而是现代的艺术品~
183,青蛇,5,奇幻古b片包b的女性影。U意思想夂瘢美g音芬训剿手上，武打雒嬉袁F今砜椿蛟S有追值募伲但已是做到非常用心。本片的功诔了徐克秀的а莨αν猓莫^於王祖tc曼玉在片中的妖W美形象，是典不是]有理由的。
184,青蛇,4,第一次⑶嗌咦橹鹘牵以青蛇的角描述白蛇cS仙的矍椋以青蛇之口f出^的心。
185,青蛇,5,"春光无限的片啊，两个似水娇娘，这小腰扭出花儿了，大爱。我至今仍觉得小青和那法海应该好好的谱写一段恋曲~~~留人间多少爱　应浮生千重变 
　　跟有情人做快乐事　别问是劫是缘 
"
186,青蛇,5,妖媚的精灵，你常说人间有情，难道我和你修行了500年，就没有感情了吗？觉得徐克大导其实是个大哲学家，人为什么是高于一切的灵长之王？
187,青蛇,4,情是什么你是什么，我不要再想了，我已经倦了，我不想再看了，我已经哭了
188,青蛇,5,无法忘怀的角度。从此 李碧华////2014.7.7 重看粤语版 更是经典
189,青蛇,5,小青说，“我们两个加起来一千五百年，就陪他一个人玩。”她们两个自己玩就可以很开心，为什么要来这人间呢，要找这个许仙，所谓的老实人，遇见法海，纠纠缠缠，理不清，最后受这样的结果。
190,青蛇,4,电影要比小说美得多，极美。尤其是赵文卓的法海，玉树临风，他最有感觉的角色，没有之一。法海与青蛇的对手戏在我心里早已打败了白蛇与许仙。
191,青蛇,5,青c白的u曳身姿，S仙的懦弱，成就了怎拥那殂骸．小青以媚B勾引S仙，小青心生Ψê５崦粒可是她心中，最鄣模仍是那千年白蛇。
192,青蛇,4,"绚丽仿佛一幅画，悠然如同一首词。

许仙，你倒是心动了没有？"
193,青蛇,4,重看。做像许仙一样的人有什么好，规矩又多，难拒诱惑，关键时候又软弱；做像法海一样的神佛有什么好，道貌岸然，自以为义，以正义之名行奴役之实；白素贞痴情重义撼天动地，小青肆意妄为但也洒脱自由，不如做妖怪的好。
194,青蛇,5,卧去竟然没马过这个？？？喜欢死了啊！！！！！！！！！！力荐力荐力荐啊！！！！！！！！！！祖贤姐姐你跑到哪里去了55555T^T
195,青蛇,4,与有情人做快乐事别问是劫是缘，看破来到人间的一场修行，妖魔鬼怪人神共愤的情为何物？功过自在心，相抵泪眼湿。徐老怪的超级cult，诡异癫狂氛围串联的不连贯，搭景特效的粗糙与大胆都是不可复制。大量的雨水情欲诱惑，纠结于无情有义的凡世因果宿命。法国文化完整版胶片。
196,青蛇,4,我修炼几百年，只为了在你的生命中绽放，即使一瞬。
197,青蛇,5,重温。选错片了。后果吓死人。活了一千年的蛇精怎会不聪明？ 遇到的一切事人是成人的路而已。白蛇成人。青蛇退隐。法海悔悟。凡人身死。就是结局。
198,青蛇,5,是缘是孽，谁也说不清楚。这部电影真是看了无数遍，可是我依旧执着的认为，她爱的不是那一无是处的许仙，而是爱情本身。而她，只是爱着相依为命的她，仅此而已。
199,青蛇,4,“说什么四大皆空，为何还紧闭双眼”
200,青蛇,3,我们以为白蛇迷恋的是许仙，青蛇勾引的是法海，实际上真正的爱情只发生在青蛇和白蛇身上。
201,青蛇,3,扭啊扭……扭啊扭……
202,青蛇,3,红玫瑰与白玫瑰――青蛇与白蛇――许仙与法海。诱惑的两面。
203,青蛇,3,虽然是耳熟能详的老套故事，但王祖贤和张曼玉恐怕是无法超越的白蛇和青蛇了。
204,青蛇,3,1.音乐古韵悠然，镜头乏味可陈；2.情节巧思，青蛇色诱法海、青白斗法、法海恼羞成怒等等等；3.人都搞不懂情是个什么东西，妖反而懂了...
205,青蛇,3,非要把那么多大道理灌进这个奇谭当中，总觉得不伦不类，尤其是这奇谭还非得添加点情色和喜剧的成份
206,青蛇,3,一般。给王祖贤配音假得跟粤剧唱白似的，情节也显得散漫。法海好贱好二逼好教条。相反原作中“男人没一个是好东西”的主题被削弱了，我还感觉许仙挺好的呢。所以最后小青杀许仙的部分也显得牵强了。几年前我一直觉得自己像素贞，现在却越发像小青了，所以人退退近近的过程大概是无可避免的。
207,青蛇,3,我擦，小青去调戏许仙，就被小白妒忌，然后小青只能去调戏法海，法海生气了去把许仙抓来剃光头，这样小白就不愿意啦，然后小白就去金山寺救老公，打架打了一半动了胎气生了娃，然后，法海就去救小白，没救到只旧了娃，小白就被雷峰塔砸死了，于是小青把许仙咔嚓了给姐姐陪葬，并和法海在一起了，在一起
208,青蛇,3,以前看受不了许仙和小青，但不得不说，张和王真美。
209,青蛇,3,w雅芝之後 世上再o白素。但是我得你弁踝尜t 笑起砜梢钥匆小巧的兔牙像哪泻⒁话憧邸０姿刎f「我淼饺耸篱g s被世人所`。」小i「姐姐 你了一S仙放前年道行 值得?」你有^人的w 有^心跳 ^花香 看得出天空的色 你流^眼I 世上有人勰 情槟闳ニ?
210,青蛇,3,十分地体现人生的意义:nonsense  ///妖啊人啊的有什么关系///特效真的好///请像白蛇一样看开
211,青蛇,3,"小青说：你们说人间有情 但情为何物？
李莫愁说：只叫人生死相许。

显然 93年的作品已经很粗糙的布景对白和人物 也许是客观条件 但是实在不理解的是 音乐。。真的 啊 那个啊啊？
前半段有一些很感觉很弱智 还有些感觉很“过” 唉 sign。"
212,青蛇,3,"你比白蛇更妖娆。
小时候看的是妖魔鬼怪，大些时候看的是情窦初开，再大的时候看的是你情我欲，再大的时候看到的悲悲戚戚，刚刚又看了一遍，我却什么都没看到。"
213,青蛇,3,爱情来得太快就像一阵抽风，禁不住诱惑所以要开后宫。本想看更多双蛇戏水，无奈只剩下法海多嘴。
214,青蛇,3,没想到竟然是一部癫狂邪魅的Cult片，无论是从配乐灯光人设，还是从剧情特效，都Cult颠覆了我对青蛇和白蛇印象，特别是青蛇和法海的那段交欢戏，应该是我看过脑洞最大的了，实在太前卫太颠覆，一时间难以接受，还有法海那纹身和青蛇会飞的翅膀…问世间情为何物，眼泪落下的那一刻你可能才会懂。
215,青蛇,3,"情节对于传统故事太颠覆了，大有无厘头之风。

不过从演员（除了许仙）到扮相还有布景都算是真的唯美！"
216,青蛇,3,我知道这是为张曼玉量身打造的，所以叫青蛇而不是白蛇嘛，可是小时候的我就是觉得王祖贤甩张曼玉100条街，其实现在也是。扭啊扭，扭啊扭，小时候cctv6反复的播出，脑海里印象最深的也只有这段了。另外，话说这是徐克最好的电影，应该是了，不过不是我的菜。
217,青蛇,3,"　z影、美指一流中的一流
可是剪接和а萃暾地破碾影一切的R^，九流中的九流"
218,青蛇,3,徐克大哥做电影的气氛还是不错的
219,青蛇,3,音乐，画面，舞蹈都传神地演绎出白蛇青蛇的妖魅奇诡之美。赵文卓的法海也很有突破，但不明白为何要矮化许仙（表现的太刻意了），人妖恋在蒲松龄《聊斋》的路线上也有一些创新，但整个思想格局还是老套的。
220,青蛇,3,"曼玉+王祖t..2l蛇太妖了,,典型中神故事!!"
221,青蛇,3,“我来到世上，被世人所误；你们说人间有情，但情为何物？” 徐克总是比李碧华心软，他的许仙没有她的那么懦弱绝情。人生如此，浮生如斯。王祖贤和张曼玉都好美。
222,青蛇,3,这个就是恐怖片吧，而且这两条蛇实在未免太骚了。剪辑好怪，现在看起来好不舒服啊。
223,青蛇,3,电视里来来回回看过很多遍，有种很诡异的意境，蛇妖走路的姿势以及小青和法海的情愫，李碧华，记住了这个名字。
224,青蛇,3,许多电影多年以后再品评就会完全不同，只有真正的经典会久看不厌。就像现在看此片已无感觉，但却还会想起多年以前坐在一个烧烤店吃着串喝着啤酒看东成西就。
225,青蛇,3,小时候看过，前段时间又温习了一下，觉得…还是有点矫情
226,青蛇,3,一念成佛。赵文卓饰演的法海看到女人阴部的那一幕，成为我长久以来抱有一种态度“僧人也应该有欲，信仰佛陀自然可以得到救赎”
227,青蛇,3,原创音乐是加分项；对情欲和人性的讨论是加分项；张曼玉和王祖贤在我眼里不好看是减分项。看完还是有点儿被触动到的感觉。
228,青蛇,3,艺术风格、原声音乐与经典重释（相对于那个时代）的意义大于电影故事本身，讨论作品的艺术特点的意义要大于创作，从这个角度上看，本片存在某种「过誉」和「低估」的双重悖论。
229,青蛇,3,小时候不知道在电视上看过多少遍，但无论如何都对王祖贤一点不感冒。至于具体的，以后再说吧，先备着。最近比较迷徐老怪，正在下，算是为龙门飞甲准备吧
230,青蛇,3,“与有情人做快乐事，别问是劫是缘。”这歌可真不错。这俩女的实在太媚了，用我爸的话说，太浪了，可能是道学家看见淫的过，我这颗玻璃心觉得电影应该属于黄片，那恶心的大尾巴看得我超想吐- -！剧情好弱，完全不敢相信是李碧华的本子啊！
231,青蛇,3,只记得电影中的端午节飘在河面的莲花灯了，很漂亮
232,青蛇,3,真愁人。第一次完整的看完。。无语了。。这片拍的。。老也不能这样阿。真濉Ｔ偎狄裁豢刺出来以青蛇的视角阿。总之很无语。
233,青蛇,3,典型的港产古装老片的审美。王祖贤和张曼玉太美。
234,青蛇,3,十分受不了张王二人唱戏般的念白和史上最猥琐的许仙
235,青蛇,3,徐老大的视听语言无可挑剔，但剧作始终是短板，要不缺逻辑（神都龙王），要不就是人物刻画虚假，改编重要的一点是忠实于原著，本片和原著相差极大，许仙电影台词句句都是老实人，但霸占白素贞又想和小青发生关系这一形象完全破坏了原著许仙一个文弱书生的形象，最不可忍受是小青竟然也与法海有了一腿。
236,青蛇,3,无疑这是部经典，那时的演员虽然年轻但是演技都很赞，不过此片想讲的东西实在太多，而篇幅又太短容不下这么多的剧情，所以看起来稍显混乱了些……
237,青蛇,3,人人皆道玉姐年老了风韵依然，可看她蓬蓬头发的装扮，实在是心无同感，而那些如此评论者又有谁不是因为念旧容颜/看了评论后重看，原来才发现一直没懂，太高深
238,青蛇,3,小时候看的。需要再看一遍
239,青蛇,3,徐克是仙侠，肆意纵情不拘小节，飘逸空灵又不着调，不过主题总是很深沉。话说大概是我们看的这个版本不太好的缘故....
