,movie,star,comment
454,青蛇,2,从来不觉得他俩有多美，可能还太小，到是记得舅舅带我和妹妹在日晖电影院看扭啊扭的好笑
455,青蛇,2,1.从小就对白娘子不感冒。2.“柔情绰态，媚于语言”――音乐勾人，画面宜人，仪态媚人。总体很细腻。3.以后下个超清版再重看一遍。
456,青蛇,2,邪典，搞不明白拍成三级有什么必要，依然无法接受徐克的各种“地狱审美”的造型，估计是《地狱无门》给我留下阴影了，以后不再敢看老怪高分神作了……
457,青蛇,2,喜欢王祖贤
458,青蛇,2,两颗星星给女主，和原著差太多了啦。老港片都很cult耶。
459,青蛇,1,很喜欢他的原声，喜欢里面的缠绵
460,青蛇,2,张美人真妖，走路腰快脱臼了
461,青蛇,1,如果青蛇是男人，还会觉得他单纯好不做作么？
462,青蛇,2,我觉得打扮有点乙醚，所以一直不喜欢
463,青蛇,2,13年看93年的电影表示理解无能啊!!
464,青蛇,2,能不能好好讲一个人性贪欲的故事啊，前后逻辑不清，许仙真是冤死了。
465,青蛇,2,流光飞舞
466,青蛇,2,"呈现方式过于猎奇 搞得我观影过程无情无欲 看来比法海道行高了几十年...
法海的人型“小蝌蚪” 小青的水中戏“蛇” 和尚的木鱼“高潮” 现在看来多少有点蠢...
叙事问题不小 最后强行升华显得干巴巴的 实在不喜欢这部..."
467,青蛇,2,既然两位都这么骚许仙也没有定力也只是个见色忘情很怂的普通凡人而已，为什么不3p？？没看出到底有多么神作多么惊艳。。结尾很暗黑，一通乱搞，最后许仙被对人间有真情人间有真爱是否存在困惑的小青用剑插死了，还有各种五毛特效和吊威亚都看的见。。看过一遍足够了，徐克妖气的风格真不是一天炼成的。
468,青蛇,2,"一分给王祖贤小姐姐 漂亮的无可挑剔 一分给许仙的台词: 我迷恋红尘 我自甘堕落 那都是我的事情. 另外,真的很讨厌法海一类的以自己的想法去判定别人 去指责别人 去干涉别人生活的人 就像现在的美国一样"
469,青蛇,2,但这是徐克里我比较不喜欢的一部
470,青蛇,2,小时候和小姨在电影院看得，当时完全不懂。
471,青蛇,2,小时候看过，觉得演得太骚了，还是媚俗的那种骚。现在看……好吧电影拍的这么简陋真的大丈夫？
472,青蛇,2,不喜欢・・・・・・・・・・・・・・・・・・・但我总是演扭啊扭那段・・・・・・・・・・・・・
473,青蛇,2,我多么喜欢曼玉跟祖贤，可惜，这个片儿始终不对我的胃口
474,青蛇,2,还是赵姐姐好。
475,青蛇,2,差评，什么破玩意！据说剧本也是李碧华自己改编的，那配音里白素贞的山东口音怎么回事！一出场就把两姐妹搞得鬼魅淫荡，许仙如何出卖二人也并未交代清楚，最后小青何以恨许仙至要杀人，许仙儿子长大后的结果全没讲，我也并不觉得两个女主角好看，反而不伦不类，总之看过小说的无法再欣赏电影！
476,青蛇,1,小时候看觉得蛮好看的，但是关于法海和小青那段，真的很像藏传佛教在修双身法。这让我想起徐克的另一部电影《倩女幽魂》张学友那个角色念的是六字大明咒“哄玛尼玛尼哄”。藏传佛教是喇嘛教，喇嘛教修双身法，根本不是佛教。这种暗地包含，藏传佛教双身法思想的电影真的恶心。
477,青蛇,2,因为书太棒的缘故。
478,青蛇,2,我真的欣赏不来。。。毫无演技啊。。。
479,青蛇,2,一颗为小青，一颗为配乐。
480,青蛇,2,不是很喜欢太神话的东西
481,青蛇,2,拍的好乱哦~意境很撩人~不算经典！
482,青蛇,2,2星到3星间
483,青蛇,2,现在看来就是两毛钱特效，又吵又闹的神经病香港电影。我果然无论如何都不喜欢香港电影
484,青蛇,1,乱七八糟 道具太假
485,青蛇,2,这部电影要是放到小时候让我看的话，我肯定说是好，不过，现在再看，感觉一般，没有什么感觉了
486,青蛇,2,那个年代的港片经典拿到现在也就喜剧和武侠有的看。曼玉流下泪那段太慑人心魄。主演们实在太美。
487,青蛇,2,"王祖贤是真漂亮。

论性压抑导致的性变态?"
488,青蛇,2,场景美，剧情么，呵呵呵呵呵呵
489,青蛇,2,多年前在电视上看过国语版一些零散的镜头，终于完整看完，只觉得是一般般能看的故事片，豆瓣评分这么高，我却理解不到什么太深入的东西
490,青蛇,2,乱七八糟
491,青蛇,2,坑死爹了，不是为了写论文我绝对不会浪费这时间的。
492,青蛇,1,哪里好看了
493,青蛇,1,拍太太烂了 伤心 实在对不起这么好的故事这么好的演员
494,青蛇,2,我真应该再看一遍去理解发生了什么 但是我不想再看一遍
495,青蛇,2,电影都不讲逻辑关系的么
496,青蛇,2,我真纳闷豆瓣为什么评分很高 是因为徐克张曼玉王祖贤所以大家太宽容吗 两个蛇精妖是妖的 可故事实在不好看啊。。
497,青蛇,2,好多年前看的。
498,青蛇,2,真不喜欢呀 看着恶心
499,青蛇,2,小时候看的 就觉着这叫什么电影啊
500,青蛇,1,前几天CCTV-6在播，正好看到。怎么说呢，剧情实在是很怪诞，像小时候看的妖魔小人书。青蛇爬着吃苍蝇一点不美感，两人水中嬉戏百合味十足，再加上白蛇那口奇怪的黄梅戏配音，还以为是90年代被黑社会逼着拍出来的电影。来豆瓣一看，竟然8分多，这是真的先锋还是情怀作祟呢。
501,青蛇,1,法海在这部电影里一开始就看到青白二蛇为村妇遮雨，了解到青白二蛇的好心，所以放走青白二蛇；后来又与青白二蛇看到暴雨成灾，一起排涝治水；白蛇盗取灵芝，法海拦下仙鹤，说日后会给灵芝主人仙翁一个说法；看到后来你又会发现法海又莫名其妙把许仙绑到金山寺。刚生下孩子的白蛇被雷峰塔压死，按理说总得给孩子留个爹吧？更何况这个爹还为了法海能饶过青白二蛇答应出家为僧，是个负责人的好爹。可是青蛇一下子就把许仙给刺死了，哦不，是两把剑同时所以是两下子！还有青蛇你抱着一个蛇身子在水里面摇什么？有帖子说是在和法海make love。可能导演拍情色片有瘾但却没这个胆吧！过誉了。一直以为香港在传承中华文化方面做得比大陆好，但是毁经典我觉得是一点不含糊。西游记之月光宝盒大圣娶亲之类的也是两个例子。抱歉，应该是我没看懂吧！
502,青蛇,2,豆瓣对这电影的评分把我吓到了。我看了电影看了影评，然后满脑子都是“故弄玄虚”四个字。。。对不起。
503,青蛇,2,说真的 以现在的眼光看全期的徐克 不要谈内涵了 光是故事和逻辑就看不下去。花哨了就叫爱情 破戒了就是前卫
504,青蛇,2,还是更喜欢传统的白蛇传 不想被颠覆
505,青蛇,1,乱七八糟的剧情完全没逻辑啊。王祖贤也跌落我神坛了。为什么排名那么高还是top250，我看不懂港片是因为地域偏见吗
506,青蛇,2,盛名之下其实难副！影片充满直白，缺少意境。采用唱腔肤浅而刻意，毫无审美意义或文化共鸣。表演者心理刻画平平，但影片情感的传达浓烈细腻都没有，用来探讨人性情爱的主题显然撑不住。2星可能有点低，毕竟20年前的电影场景在现在看来简陋了（也有画质效果的问题不赖影片本身吧），剧情也ok，最多3星。
507,青蛇,2,看了张曼玉我就想笑
508,青蛇,2,徐老怪太会拍女人了，光这一点就赢太多知名男性大导。曼玉祖贤太会演女人了。
509,青蛇,1,什么烂七八糟
510,青蛇,2,对两位女主都没有什么感觉，文卓演法海又太不脸谱化了。
511,青蛇,2,幼稚的港片，好好商业吧
512,青蛇,2,也许以前看这电影会给高分，现在真的完全get不到点了，一星给黄的音乐，一星给王祖贤的颜
513,青蛇,1,我真的体会不了这部片子的高深哇  你们道行都好深啊
514,青蛇,2,我不想装作我懂得欣赏这部片。纯妖孽
515,青蛇,2,评分怎么这么高  一颗星给王祖贤一颗星给张曼玉 ^^
516,青蛇,2,很小的时候看觉得整个片子充斥着一股YD的气息，也不知道要表达什么；如今央六又看了一遍，依然还是不懂。
517,青蛇,2,我靠，这片都豆瓣250了？豆瓣真是越来越柴了
518,青蛇,1,只想说这TM什么鬼片.还是因为电影频道看的被剪少了17分钟的缘故.
519,青蛇,2,作为小学生，当年真不该看这个
520,青蛇,2,不得不说，有我的女神王祖贤，还是演得可以的，
521,青蛇,2,絮絮叨叨、磨磨唧唧还有些脑残的苦情电影，感觉好烂，王祖贤的造型还算帅，别的就没了。
522,青蛇,2,大概是年代审美代沟。。
523,青蛇,2,受不了这剧情
524,青蛇,2,一星给演员美，一星给拍的美。
525,青蛇,1,真心不知道逻辑在哪里。。
526,青蛇,2,优点是片子很性感，但剧情看得挺别扭
527,青蛇,2,两星给的是配乐和美女
528,青蛇,1,我看的为什么只有80多分钟。。搞的我根本看不懂人物动机 乱七八糟！以后再改～
529,青蛇,2,其实电影要表现的东西还是不错的，但是这个表现手法真的让我接受不了，90年代的港片夸张的过分了。
530,青蛇,2,开头很香艳
531,青蛇,2,豆瓣top250里，唯一的一部让我觉得不怎么样，众人都觉得好的好电影。4.7
532,青蛇,2,劣质的效果，连王祖贤，张曼玉都不能抵消抓狂的观影体验
533,青蛇,1,徐克的风格到底应该用雷人来形容还是杀马特呢
534,青蛇,2,"这个高分…是纯粹的敬老分吗？
莫名其妙的剧情，惨不忍睹的特效。
许仙的长相好像各种香港三级片的男主角，年青的祖贤和曼玉都是浓妆艳抹，唯有赵文卓鲜得一比～"
535,青蛇,1,谁说蛇妖就生不出文曲星？法海算是幡然悔悟？白素贞是被雷峰塔砸死的？搞不懂电影为什么要瞎改原著。
536,青蛇,2,两个女人为什么时时都在发骚啊，有时候还互相缠绵跟女同似的。特效也很差，不过也许90年代的香港电影特效就是这样吧。
537,青蛇,1,白蛇传的演绎完全不是一个正常的套路。。
538,青蛇,2,不知道为什么这么一部狗屎电影居然评分这么高！这帮人真的是跟风狗！电影全程尴戏，看得我无聊到极致！从未看过如此无聊的电影！场景什么的都假得一B且故弄玄虚。早年间香港好多电影其实都水得要命 ！
539,青蛇,1,完全不知道在讲些什么。。都快看睡着了。。这片子女性观众更喜欢一些，作为大老爷们完全看不下去。。
540,青蛇,2,满屏幕的情欲，即使有一堆电影分析和很高的评价，我还是觉得不好看。
541,青蛇,2,我真的不特么明白怎么这么多人打这么高的分啊我去
542,青蛇,2,刚开头修行20年的法海就收了一只修行200年的平和温顺的蜘蛛精（可能暗示法海是神明大蟒蛇神（八部天龙之一）转世），但是蜘蛛精产生的佛珠使他动摇。在紫竹林碰到青白蛇，原本要收妖，但看到俩蛇为孕妇遮雨，放她们一马并把佛珠给了她们让她们修炼
543,青蛇,2,K不好看啊，y兮兮[哄哄的，有奏不。囊w回北京的路上看完，令人回想起住在清Ar的假期，父母上班去後，悄悄打_P凰l影台r的情景。清A小朋友的共同回啊！某o聊的夏天看了好多@N[v的片子。演T不e，王祖t、曼玉、w文卓都是一流的，可惜被急功近利的拍zoЯ恕
544,青蛇,2,话说我真接受不了这种的
545,青蛇,2,徐克和王家卫应该拍点适合大众的影片 而不是这样的
546,青蛇,2,眼花缭乱而已！就如书生试期将近还在齐声背诵“春眠不觉晓 处处闻啼鸟”，可笑浅陋得很！
547,青蛇,2,不喜欢电影给我的感觉．
548,青蛇,2,改的乱七八糟的，不过张曼玉和王祖贤真美。
549,青蛇,2,张曼玉是演技派，电影一般
550,青蛇,2,这特么到底什么鬼阿。。这股风骚劲实在受不了。。而且这是讲情么？还是讲性冲动啊。。
551,青蛇,1,不觉得，没有，不是，还是小说好看
552,青蛇,2,真的不懂点在哪里
553,青蛇,2,不知道是不是我看的国语版的问题。。。对白让我觉得好尴尬。片里女神的扮相也很不怎么样。反正看不出哪里好看，评分好高啊。
554,青蛇,2,张曼玉最出彩。徐老爷怎么不放飞自我干脆拍部百合算了？
555,青蛇,2,完全不喜欢不知道为啥
556,青蛇,1,拉低。
557,青蛇,2,原著小说写得更好，人性剖析得更深
558,青蛇,2,小时候看完新白娘子传奇很难接受这个，现在也留阴影了，觉得这个片子特别恶心。
559,青蛇,2,不知道小时候为什么喜欢
560,青蛇,2,你们看的跟我简直不是同一部啊
561,青蛇,2,受不了…青蛇逐渐成型看到随便一个男人的背影就要上去跃跃欲试，没看到她跟许仙的爱是怎么来的…都是看脸看皮囊吧，而且许仙跟小青也有暧昧？？？
562,青蛇,2,小时候电影频道播了八百次都没认真看过 长大想看都没有（摊手 带着情怀重看都觉得一般 看来是真的一般 （法海有点以公谋私啊）
563,青蛇,2,制作粗糙，剧情胡编乱造！
564,青蛇,2,也只有颜值得看了，配音听得我尤其难受。
565,青蛇,2,一星王祖贤，一星张曼玉，其他都是垃圾，
566,青蛇,1,实在忒粗糙凌乱了
567,青蛇,2,抱歉不在我能看懂的范畴里，觉得实在是被过度解读了
568,青蛇,2,看不太懂，有些地方很意识流，然后演员演出来的感觉特别奇怪。 也不是很懂姐妹为何突然撕逼。
569,青蛇,1,这种垃圾电影评分这么高？天理何在？
570,青蛇,2,看了两遍愣是没看完。竟然还是top二百五。
571,青蛇,2,莫非我看的是盗版……剪辑太跳跃，细节好凌乱。两大美女的装束我欣赏不了。
572,青蛇,2,我觉得是没意义的片
573,青蛇,1,画面是美，但是，我真的看不进去，尤其是剧情推进方面，看得挺累的。
574,青蛇,2,欣赏不来…张曼玉和王祖贤的美貌一人值一颗星吧。
575,青蛇,2,我无法喜欢这种调调
576,青蛇,2,除了王祖贤美腻外，全剧可谓是糅合了港片魔幻剧中我所有很讨厌的元素！
577,青蛇,2,给她两星只是为了王祖先
578,青蛇,2,“白蛇传”的前传
579,青蛇,1,93年的电影啊，又隐晦又露骨的，真真消受不起
580,青蛇,2,评分这么高 我是否该重看一遍 当年觉得电影太妖。。。
581,青蛇,2,不知道拍的是什么，其实我觉得导演可能想说的是人妖没有一定的善恶之分之类的，但是我觉得被说了个稀巴烂……然后许仙渣男实锤……不管怎么样，看得我快睡着了，不知道豆瓣这么多好评哪里来的。对了，感觉拍摄剪辑方法和《东邪西毒》像极了
582,青蛇,1,前
583,青蛇,2,乱糟糟的，不好看。
584,青蛇,2,在电影院看过这个，暴露年龄。
585,青蛇,2,赵文卓真是嫩出水来了。两蛇精扭啊扭啊扭是什么意思。
586,青蛇,2,从来没有仙子下凡和普通女子一生一世的
587,青蛇,2,垃圾～～～
588,青蛇,2,典型的香港片，人个个都急吼吼欲望强烈的感觉，就是看看美艳的曼玉和帅气的赵文卓吧
589,青蛇,2,不喜欢，真的不喜欢。
590,青蛇,2,中途多次出戏以为看了个三级片，结尾的改编还是不错但无力回天
591,青蛇,2,骚浪贱 毁神作
592,青蛇,1,2019亚洲影展在影院看的，一星给美术音乐和曼玉祖贤，这个剪辑风格，太难熬了
593,青蛇,2,多年以前读过李碧华的原著，此片与其相差甚远
594,青蛇,2,不知道为什么，我一直挺反感这电影。
595,青蛇,1,无语。。。。我只觉得辣眼睛。
596,青蛇,2,2.5 小姨子是姐夫的心头肉啊。
597,青蛇,2,小时候当A片看，喜欢王祖贤
598,青蛇,1,。。。。。。
599,青蛇,1,这是我最不喜欢的一部徐克电影
