,movie,star,comment
119,谍影重重,4,粗中有细，柔中带刚。波澜不惊，又危机四伏。在美国中情局的眼里，法国警察就是2b.在伯恩的眼里，什么都不堪一击。谍影重重就是比谍中碟惨，为国家干坏事，至少比干国家的坏事有归属感。钱，身份，女人，居家旅行，幸福生活必备。
120,谍影重重,4,这种节奏快，又牵涉到很多人物关系的片子就怕没看懂，看懂了也没什么好挑剔的。就很爽的过了2小时。柏林风景超棒
121,谍影重重,5,好想有个这么玩得转地铁，太会认路的男友，以后背包游走南闯北啥也不怕，现在只能交给丁丁。
122,谍影重重,5,听说4换了主演和主线情节路线，找了前3部来重温，才发现豆瓣上居然没标记为已看。我觉得动作片里，这种套路的电影给5星不算赖吧？
123,谍影重重,4,我也想有个一筹莫展找不到钥匙的时候能一下把门撞开的男人
124,谍影重重,4,看演员就发现如果不补看谍影1、2、3可能对这个周末去看特工先生不卡墙（。）没有任何影响――但新租的房子还不能办网，嗯晚上就都补看吧。。情节可紧张虽然熬过大使馆那一段就好多了Orz。。但再紧张也没问题，一看到Matt叔的脸想到动物园里他和斯小姐一起就各种喜感（喂！）但也因为这样不喜欢女主QAQ
125,谍影重重,4,这个大叔不怎么对我胃口，那女主，都是我先看了美国恐怖故事，我一看见她就想起ann frank
126,谍影重重,4,商业片里面算精彩的了，马特戴蒙，这部里面挺帅的
127,谍影重重,4,"不是典型的典型的特工片啊，挺喜欢的，不用高科技，用脑
发现导演这样的开始是要冒一定风险的，开始这么的无奇，要不是推广以及评论做得好，很可能就败下阵来。欣慰的是他的票房很好，电影本身也很好"
128,谍影重重,5,窝觉得谍影重重比碟中谍好看！！！是我一个人吗！！！不快闭嘴你对得起JR吗！！！不要紧JR要演4的！！！。。。节操呢。。。。
129,谍影重重,5,不说啥了，咱都懂，永远无法超越的电影了，就像唐诗一样
130,谍影重重,5,突然想重看谍影重重。无比怀念那个时候的Matt Damon，小伙真灵啊。现在完全是大叔了。
131,谍影重重,4,你带我看了第一部，然后我自己去淘碟看了第2部，又或者是你带我看了第2部，我自己淘碟看了第一部
132,谍影重重,4,除了最后从楼梯上跳下去有点不科学和前期女主的一些行为有点刻意以外其他都好棒啊！！马特达蒙好萌啊！
133,谍影重重,5,系列电影中最好看的永远是第一部~马达叔和欧文叔最后在荒草地中的对决真伤感呀，欧文叔存在感完爆三部所有炮灰。话说我以前做梦最怕别人“追”，无论我怎么想尽办法的飞天跳楼左拐右拐，总是逃啊逃的就到路尽头了；自从有了波恩这个好榜样，我再也不怕做这些梦了，嗯！（确定片名不是《波恩快走》吗）
134,谍影重重,4,"""喜欢Bourne的冷静。当Matt Damon打开银行的保险柜时，我突然发觉，世界之大，持有三样东西便可畅通无阻：金钱，身份（也可理解为地位），枪（强权）。要求自己象特工一样生活显然是很辛苦且不切实际的，然而，有些时候，特别是面对危机，试着用特工的思维方式去看待问题也许会很有效，特别是男生"""
135,谍影重重,4,特工什么的，早已不是新鲜剧情了，但此片却能很好地抓人眼球~紧张的气氛营造地很好~~这就是一个“剧情其实没有那么好，但是电影拍得很好”的实例~~
136,谍影重重,5,波恩在寻找自己身份的路上开始了各种冒险，没有后面两部的晃动镜头，但是故事的情节安排更出彩。
137,谍影重重,4,完全摒弃了传统谍战片里惯用的视觉特效与夸张表演，取得代之的是紧凑的节奏与利落的战斗。大使馆脱出，圆珠笔戳人，巴黎追逐，小屋狙击，都已经成为了标志性的经典。音乐很强。算是为看小说之前做热身了吧。
138,谍影重重,5,蓝光高清版真是看得人欲罢不能啊~
139,谍影重重,4,马特达蒙帅到了 巴黎场景也十分一流 各种打戏 飙车 枪战也看得挺过瘾 那一大麻袋的各种货币（人民币和澳币十分亲切啊） 不拖沓很顺畅的节奏 不错的商业片 
140,谍影重重,4,爱死Matt Damon了~~~~~非常沉稳严谨，丝丝入扣的一部片子。
141,谍影重重,4,叙事有力、干净利落，绝无拖泥带水的特工片代表。
142,谍影重重,4,完全不萌女主 以为短发会惊艳些结果更丑了... 只会panic又没有美貌请问你为什么是女主啊...不过十年前Matt Damon的少年样真的挺美好 之所以是4星是因为我觉得难得有比较现实的特工感 逃亡格斗枪击等等虽然不眩目但基本都是有逻辑而且也可能发生的
143,谍影重重,5,其实我更喜欢原片的直译――《伯恩的身份》，伯恩是谁？伯恩来自哪里？伯恩将要去向哪里去？随着对这些问题抽丝剥茧的深入，逐一揭开事实真相。智谋、胆识、身手、意志，将这些优质特性齐聚一身的男人真是太有魅力了。。。
144,谍影重重,4,TLF压的BDminisd有问题，原版配音那一轨的配乐声音巨小，追逐打斗时只有音效没有配乐，导致看起来紧张气氛整个就被削弱掉，超冷静的，就像在看《一次别离》。。。。
145,谍影重重,4,看到巴拉克给女猪剪头发那一瞬我脑海里满是奔跑的罗拉，事实证明我的记忆力还是不错的...这算是给期末复习背诵不能的自己一点小小的鼓励么
146,谍影重重,4,I DON`T LIKE NO REASON
147,谍影重重,4,打Y很棒，∏楹芫o，音芬渤，果然很值得一看
148,谍影重重,4,因为全片围绕着“失忆”这一点上，悬疑成分重的厉害，好在结尾部分用几笔就勾勒出了答案，让观众也不至于不明不白了。相比其他好莱坞的间谍电影，大场面少了些没有那么劲爆，不过也算是个优点了，至少不会因为过重的爆米花气息堕入俗套。总之本片算是干净利索的，加上欧洲风景，也能扯上个清新凛冽。
149,谍影重重,4,3集都差不多，都看完后甚至情节都混在一起了。
150,谍影重重,4,★★★★☆极简、又特别浪漫，一个伟大系列的开端。
151,谍影重重,4,最后的音乐跟大话西游似的……
152,谍影重重,4,在两次看到快结尾睡着的经历之后，我终于找来了结尾：王子和公主幸福地生活在了一起。除了结尾的动作画面值得加一星，尤其是夸张的雪中十指爬墙。P.S.MattDamon绝对不是第一眼帅哥，绝对啊绝对。
153,谍影重重,4,作为系列第一部没有先介绍故事背景人物，直接从主角的失忆开始，让人有点云里雾里的感觉，稍不留神就跟不住剧情，不过这样也使喜欢推理的观众更加投入，跟着伯恩一起寻找丢失的记忆。相比于《碟中谍》系列偏爆米花的动作戏显得冷峻许多，更体现特工的个人能力。
154,谍影重重,4,谍影重重和碟中谍的区别就是追车戏中碟中谍用的是宝马，谍影用的是小破烂车。
155,谍影重重,5,三部里最好的一部。杰森在浴室里给玛丽剪过头发以后两人接吻的镜头真是呼吸暧昧动人心魄，是我看过氛围营造最好的镜头之一。
156,谍影重重,4,差一个星不是电影的问题，是因为我看的太晚了，还是有技术代沟。不过，真正的特工应该是这样的吧，没那么多花俏的枪和车或者电话，而是实打实的肉搏和已经混入血液的经验甚至一丝丝的天赋。
157,谍影重重,4,在任何组织、团体、国家机器下，在各种利益冲突和争夺的人群中，生命只是路边一块可以随时一脚踢开的小石子。
158,谍影重重,5,一个完全有资格和007分庭抗礼的间谍系列。
159,谍影重重,5,快速而充满节奏感，不时想起越狱。没有一点多余的拖延与煽情，一切都恰当好处。111208再看，实在抑制不住对小马的想念，小马绝对是动作片里的文艺片，excellent。另mary长的好像老徐哦。。
160,谍影重重,4,粉嫩的马特达蒙真是各种萌啊，让我忘了那个传染病大叔吧
161,谍影重重,4,本来觉得4还不错，不过比较之下，还是1的风格比较协调。
162,谍影重重,4,朴实无华的美版失忆007，节奏很好，剧情其实非常简单，但是并不拖沓。另外一点，背景上的东西大多虚化了，摆上台面的都是实打实的卖点
163,谍影重重,4,阴谋论剧情，因为它本来就是以娱乐为目的的动作片，阴谋论的吸引力一目了然：世界复杂到令人想尖叫，而阴谋论提供的答案简洁明了。它把世界从一道问答题简化成了一道判断题，从一个智识问题简化成了一个道义问题。一个国家卷入一场战争，必然有CIA就是个杀手机器因素推动。
164,谍影重重,5,难得边看边HC的电影..........很多片段以前断断续续在电视上看过，今天终于完整地看了一遍！太喜欢了~~~...咳...现在对这个系列的感情真复杂啊> <另外听Moby的片尾曲出字幕感觉真的很棒~
165,谍影重重,4,和想象中的不太一样，以为是碟中谍那个类型的，原来相去甚远。虽然场面不那么华丽，但景色和情绪是亮点。马特达蒙太适合这个角色了，惹人怜。其实还是有些沉闷和赘述的，算是好看，有些亮点，但应该谈不上经典。
166,谍影重重,4,看完碟中谍1看的这个，这个系列显然高出一截子。马特达蒙也更讨喜点，自打看了心理捕手，每次看见他，都觉得他长的好聪明好聪明好聪明的。
167,谍影重重,4,还算满成功的间谍片  不过看多了不觉着出彩了 
168,谍影重重,4,补童年，剪辑明快，逻辑缜密，动作设计也很精巧，尤其是楼梯坠落桥段，毋庸置疑的经典。影响了很多间谍特工电影，对狙戏被大量抄袭。补充一句，因为谍影4让我一直对这系列提不起兴趣，4就是一坨屎
169,谍影重重,5,我至今看过的感觉最男人的特工，那种酷是真实的，不是摆出来的。故事情节紧凑，扣人心弦，镜头切换与音乐搭配极佳。此为第一部：The Bourne Identity / 伯恩的身份。向这部小说和电影的编剧致敬。
170,谍影重重,4,不喜欢马克达蒙。。而且玛丽那角色十足的让我觉得讨厌。镜头一转到她我就不舒服。。
171,谍影重重,5,最喜欢的特工系列电影，3部绝对经典
172,谍影重重,4,经典经典啊，从心灵捕手爱上他，看谍影重重无法自拔啊……
173,谍影重重,5,2012Oct3，九亭，东方电影频道。（PPS）
174,谍影重重,5,故事讲的太慢了，以至于有些拖沓，但情节还是很吸引人的
175,谍影重重,4,有点夸张个人觉得赶不上不可能的任务
176,谍影重重,5,中规中矩的好片，干净利落。简洁有力。惊喜并没有太多。节奏的控制，配乐，镜头剪辑，剧本等所有都非常专业。
177,谍影重重,4,还没搞明白到底发生了什么就结束了。就是很牛逼，牛逼到不需要解释。
178,谍影重重,4,不死小强大战神秘组织找回自我历险记之一~
179,谍影重重,4,New age
180,谍影重重,4,本片取材于著名的作家罗伯特-勒德姆的畅销小说《伯恩的身份》，公映后获得了如潮好评，应该说通过这部片子马特・达蒙才真正成为了世界级的巨星。不得不提这部影片的演员阵容，除了小马哥，还有克里斯・库珀，他演过《美国丽人》，以及克里夫・欧文。导演道格・里曼后来还拍过《史密斯夫妇》。
181,谍影重重,4,虽然这部里的爱情来得莫名其妙，故事也有点讲不清楚，但是节奏很好，也依然不妨碍第一部比第四部的水平高一大截，看起来就是换了一个演员嘛，我为什么要先看第四部。。。
182,谍影重重,4,纯属是因为看过书才来看电影。但是电影果然比不上书。伯恩在我心中比这个演的神气多了
183,谍影重重,5,三部曲环环相扣，jason是个行动派，该打该跑该杀果断冷静，从没屁话，帅呆了，比装B，玩女人的某七靠谱多了
184,谍影重重,5,只属于Bourne创作团队传奇的开始
185,谍影重重,4,不公平不公平，为什么跟马特达蒙配戏的女主角都这么丑！！白瞎这鲜衣骏马的少年了！！！
186,谍影重重,4,不是个人耍帅秀，节奏感不错。连姆尼森总演同类型男配，很喜欢他。欧洲雪景真好看。
187,谍影重重,4,第一部时的Bourne那无辜少年般的清纯小眼神哟!不过整体真的没有第三部那么利落酣畅...
188,谍影重重,4,★★★★，内敛深沉，气氛压抑，节奏迅速。打斗，飙车，逃脱处处塑造人物，凸显着人类的本能与睿智。低调而兴奋的味道，会让你欲罢不能。不同于以往谍战的耍帅斗狠，冷战政治背景下的阴郁气氛，与男主角的性格交相辉映，当哀伤碰撞硬汉气质，马特呆萌便从头发丝性感到脚趾头。
189,谍影重重,4,让人惊艳的剧情和叙事手法，众人眼前一亮！
190,谍影重重,4,最大的感觉就是为女主捉急！
191,谍影重重,4,2002年能拍到这样的水平，相当不错了
192,谍影重重,4,看这部电影的时候，除了感慨这个bourn先生的超高个人技能以外，就是沃我也想体验这样的生活一次。
193,谍影重重,5,系列都十分不错 独特的镜头切割形式从此开始
194,谍影重重,4,没有比伯恩更厉害的特工了，3000万值了。看过立马感觉身边全是特工
195,谍影重重,5,看完4后，又重新看了1。这的确是我人生中第一次主动看第二遍的电影，幸福啊！10年前看完后不能正常呼吸和生活的记忆又回来了！原子笔肉搏和小马哥给女主洗头剪发的片段看得我撕咬小手帕，侵占了我十年的记忆啊！还有，都不记得有clive owen啊，天枰座果然是生出优质男最频繁的一个星座。情结啊情结。
196,谍影重重,4,一切从这开始，伯恩―沉得住的冷静特工
197,谍影重重,4,死亡，不停地死亡。除非战无不胜，否则下一个就是自己。
198,谍影重重,5,三部都喜欢，这个系列算是我最喜欢的电影之一了、看这片能学不少东西。
199,谍影重重,4,其实能让我一开头就能进入状态并看懂的电影并不多
200,谍影重重,3,个人感觉外界评价过誉了~~
201,谍影重重,3,没有想像中精彩，国外版本的“我是谁”……
202,谍影重重,3,一小般，故事讲得糊里糊涂。
203,谍影重重,3,追车打斗中的巴黎街景拍得风情万种，如同第二集中的柏林的肃杀，外景选择和拍摄一流。
204,谍影重重,3,为什么不只拍一部就罢手呢
205,谍影重重,3,不够紧张....
206,谍影重重,3,巴拉克所言间谍三部曲之一――什么？马特达蒙？我不认识.这一部看的时间真的太早，内容几乎又忘光了依稀记得打开的皮箱里有人民币的对吧.这个巴拉克除了这部片子之外还演了一部开着mini去抢银行的极度失败的盗匪片，另外还有巴拉克版十一多个罗汉什么的额.其实真的是小说要好看得多呢
207,谍影重重,3,有些看不下去，动作戏太小儿科/【B】20160421重看，我他妈当年居然说这个动作戏太小儿科了（应该是嫌弃场面不够大），第一集时风格尚未完全形成，一些场面还带有着老实动作电影的痕迹
208,谍影重重,3,从人类的终极疑问开篇，我是谁、我从哪里来？在浩瀚的洋流中开启了一个谍战系列的首章，与杰森一起循着问题追踪答案。靠着本能与杀手博弈，凭着直觉黑暗中行进，仍会温柔且浪漫地对她说出无心的情话：我怎么会忘了你，你是我唯一认识的人。间不容发的快节奏叙事，便当发得毫不迟疑，踩石之后荆棘丛生。
209,谍影重重,3,以为clive owen 和Julia stiles 至少有点点有意义的戏份…同理不喜欢巴黎追车一段、又不是只有几个警察…
210,谍影重重,3,是不是每一个叫JB的人都身手不凡，永远不死？从Jason Bourne到James Bond，再到Jack Bauer。@啊皓
211,谍影重重,3,这才是特工嘛~~007和李润成那样的只是耍帅，虽然不是很喜欢粗狂型的马特达蒙，但这位特工我喜欢。故事一般@Home
212,谍影重重,3,看第四部之前重温，故事有点散，毕竟不是《魔戒》，分三段来回忆实在拖沓，频繁地牵扯出一个又一个和某计划有关的幕后人物，不过现实生活中若有些啥丑闻败露后，相关人员倒真是一抓一大把……
213,谍影重重,3, Franka Potente出现时还是标志性的一头红发，感觉劳拉又穿越时空般的来到了这个故事中。很多客串角色都是大腕啊~Clive Owen、Chris Cooper给的镜头都太少了，不甚过瘾呢~~
214,谍影重重,3,我真心觉得这部片子实在是太无聊了，暂停了一天才把它耗完，中间很乱不晓得它在讲什么，各种莫名其妙的人。这种“快节奏”的片子不适合我。还有这个演员天然呆！
215,谍影重重,3,先看4再来看的1 没传说中的那么神。剧情不紧凑场面不紧张男主不沧桑 就追车那以及男主部分高难度动作加了点分 不过拿十年前的跟现在比似乎也太过分了点。我大概是变了谍4男主的脑残粉吧。。
216,谍影重重,3,是时代不同了么？为啥没觉得很精彩。。倒是moby的片尾曲还是那样让我不愿离座。。
217,谍影重重,3,算是比较利落的开篇。事实证明，逃命或追击，还是小巧实用款的车比较好。
218,谍影重重,3,听说谍4要上了赶紧补档，原来是十年前看来这时间滑到现如今动作片也还真没什么长进。明明知道自己是谁却还以一种不认同的方式活着，比活着不知道自己是谁更可怕。
219,谍影重重,3,巴黎、马特・达蒙、失忆、“罗拉快跑”里的红头发吉普赛女郎，小细节出彩。元素一旦建立好，故事大方向也不会太偏离，整体比较中规中矩，没有太失望，也没有被惊艳。
220,谍影重重,3,神马剧情紧凑扣人心弦么，我觉得漏洞重重，而且有些地方显然没交代清楚啊。据说是三部曲后面有交代，那看完再考虑加个星
221,谍影重重,3,三星半，无高潮，无特技，不惊险，有的只是马特达蒙和我心中的罗拉，还有人民币。情节很迷糊，打斗很平淡，刺客死的很古怪，特别是那坠楼的。。。
222,谍影重重,3,Matt Damon同学写过《Goog Will Hunting》的剧本，算是才子吧，不过还真是不喜欢看他演戏。
223,谍影重重,3,虽然评价高于碟中谍。。。但我觉得中译名都叫谍影重重~你的身份还称得上是迷么？。。。。。。。。。。。。
224,谍影重重,3,放在硬盘里的，看了四五次才看完，没什么特别的。尤其是看完这个马上看了速5，这片更是寡淡。
225,谍影重重,3,居然敢用失忆这么找打的题材。。逻辑上不通，没下手的原因也恶俗的可以。。不过这不影响可以看的很high，罗拉还是很漂亮
226,谍影重重,3,一边看一边玩和风物语的结果是我连CIA要暗杀的那个黑人文波西的身份都没搞清楚…只能感叹小年轻马呆萌真呆萌！
227,谍影重重,3,分3个晚上来看。。。每次看的时候就走神，状态极不佳。像我这么任性的人~老走神就怪在电影不对胃口上吧。
228,谍影重重,3,临危不乱胆大心细，还有一身好武力，带上一兜子美钞，干净利落就能走遍天下，但我私认为此片为欧洲各大城市风光片。
229,谍影重重,3,CIA总是让人为他们的智商捉急，不过DAMON智商还比较高，让人也比较容易CIA了。当然，普通的POLICE我们就不提了。//女主角的长相让人捉急啊，这是谍战片的标配吗？//然后我发现一个很赞的不让坏蛋看起来太弱的方法：就是不要让一个显得很强的人一直去阻击主角，派多个人轮番上阵效果会比较好。
230,谍影重重,3,只有8年，科技发展成果通过本片可以强烈对比，那会中情局的特工都还用BP机联系呢...编剧主观...他怎么就这么容易找到每一个地方呢？这种片跟着剧情走就对了。
231,谍影重重,3,邂逅的姑娘系好安全带决定和肖恩一同出逃镜头些许感人。
232,谍影重重,3,开始看这部系列作品，第一部并没有什么特别出彩的地方呀，为什么豆瓣上评分能有那么高？
233,谍影重重,3,演十分高智商的人的戏我总是很感兴趣，但是这个看过一段时间之后，虽然当时好像看得还挺带劲的，但是现在几乎一点情节也记不起来了！我更肯定Matt Damon在心灵捕手里面的表现。感觉外界真的对该片过誉了。
234,谍影重重,3,james bond jason bourne jack bauer.... 20/02/2013 Re  减一星
235,谍影重重,3,不就是又一个俄狄浦斯么…ps 为啥我在matt脸上看到了某个不招人DJ的小学同桌…但是伊居然还是gd will hunting的编剧！！登时脚得升华了，但因为是吐爷狂推的于是还是低分
236,谍影重重,3,据说在希望到绝望的久别之后，送给她最好的礼物就是浅浅的微笑和再也不想放手的拥抱，嗯，等有机会了可以自己尝试一下，如果不好使就删自己的嘴巴。
237,谍影重重,3,1.Matt Damon is an eye-candy 2.女主角系典型的德妹，高子乳+性格男人 3.中中矩的幼髌，∏榭翱斑^P，冷o不花哨的打蚝芫彩…Matt Damon神演技+100分
238,谍影重重,3,看过好几遍，但一直记不住结局的电影
239,谍影重重,3,失忆的主题到不新鲜，节奏挺紧凑，果然是本能和习惯，即便是不知道自己的身份，伯恩在面临各种危险的时候依然不失冷静，这才是存活要素啊
240,谍影重重,3,大三暑假看的，看过好多间谍类的，突然听谁说的谍影重重，想了半天，好像还真没看过，就看看吧
241,谍影重重,3,意义要大于影片本身的质量，紧凑凌厉但不算太精彩，不过看得出来对后世同类型作品的影响很深（不只是系列的几部续集）全片最出彩的是设定“他什么都记得，就是忘了自己的身份” 女主还是长发好看
242,谍影重重,3,一个失忆的特工，哪里好看了啊？？欧文同学打个酱油都那么闪闪发光！！！
243,谍影重重,3,为什么看完4回头看1还是觉得莫名其妙不知道要讲什么。。多重身份。。。总是想到那个男人。。。他对于我也是神秘的人，却不控制的被吸引。结尾的重逢很开心~只是，谍影重重系列，永恒的男主角，流水的女主角。所以说，这样的男人，注定不会在一个人身边停留吗？
244,谍影重重,3,情节铺垫的一部。10年前的马特达蒙好帅！！现在就只能we bought a zoo了。。
245,谍影重重,3,这个系列的开端可以说给整个系列立下永久的印象：遭抛弃杀手失忆虐杀阴谋白宫。剪辑和摄影甚至配乐都给后来作留下了楷模，但比较而言剧情的“曲折”只是糊弄观众加上狂玩剪辑造成的。只想到，记忆的碎片不是我们能关注的物件，主人公的孤独才是永恒的主旨，即使有段狗血的恋情也不可折返这段悲歌。
246,谍影重重,3,其实是无功无过的片儿吧可是女猪脚太不美了白瞎了这位神似小李的天秤座，啊~是一种别样的帅啊星星眼@.@要关注一下啊三部曲要看完
247,谍影重重,3,身中两枪，箱箱里发现印着自己照片的各国护照，各种现金，枪支弹药，观察入微，身手敏捷，愣是猜不到自己是干嘛的。
248,谍影重重,3,它是在反类型吗，不然为啥都不make sense呢。莫名其妙中…
249,谍影重重,3,不像传言里说的多么多么牛逼，多么多么好~就一普通片儿……
250,谍影重重,3,如果我02年看这个片子可能认为是个好片，十年后看这片就少了激动。matt的fight时的动作还是蛮帅气。女主角不讨喜。
251,谍影重重,3,解谜成分加入的不错，不过故事讲的并不好。
252,谍影重重,3,又是被期待给晃点了的作品
253,谍影重重,3,现在才去看马达的老片儿。主要是才不久看了4，发现没怎么看懂，于是惊觉该补课啦。唯一不满的演员就是那个吉普赛女主角，表现平平啊，没有哪点让人印象深刻。
254,谍影重重,3,没有想像中精彩，好莱坞版《我是谁》。
255,谍影重重,3,恨自己没看之前怎么会把它跟007相比？唉... 不过至少电影里面有好些欧洲不同地方的味道，那倒是开了点眼界！ -- 2008-11-16
256,谍影重重,3,感觉很一般呀，怎么就这么高分了，前面有种似曾相识的感觉。
257,谍影重重,3,2002年的马特呆萌是真・呆萌，那皮肤嫩的能掐出水来。写实派剧情赞，随手拿东西就开打，反最终什么的很带感，然而仍然无法拯救女主角的莫名其妙。女主角不好看就算了，莫名其妙就决定跟真・一无所知的男主角逃亡，莫名其妙啪了起来，莫名其妙跟家人隐匿成功，从头到尾都好莫名其妙！还好第二部就挂了:-
