,movie,star,comment
436,谍影重重,2,动作出彩，节奏紧凑，可惜情节弱智
437,谍影重重,2,到底好看在哪儿？
438,谍影重重,1,我真觉得这片子挺无聊的6868
439,谍影重重,2,路人甲越级奉命杀死自己的老板是剧情走投无路时的救命稻草
440,谍影重重,2,理应紧凑却很散漫的片子。在最后只想尖叫为什么。
441,谍影重重,2,"10年前的片子果然不能看这种..
"
442,谍影重重,2,我以为我早看过了，其实今天第一次看
443,谍影重重,2,真心不知道这电影好在哪里。好吧，我不待见男猪，不待见女主，不待见脚本，不待见动作。
444,谍影重重,2,我又有一种剧情一厢情愿的感觉  （忽然就像改成2星罗）
445,谍影重重,2,看了第一部就完全不想看下去了，没任何感觉，豆瓣上的评价过誉了。一成不变的主角光环，虽然没犯什么错误，但同是特工，水平的差距太大太假。还有男女还没了解呢就瞎搞，见面就打嘣儿，厌倦。
446,谍影重重,2,特工+失忆，这类把戏没少见吧？明明非常普通的一片子咋就让你们集体高潮了呢？
447,谍影重重,2,不停逃，不停逃，一觉醒过来还在逃。。。
448,谍影重重,2,看完以后剧情没明白，等研究明白了觉得这点事还值得拍个电影吗？ 
449,谍影重重,1,我知道很多人觉得这是经典，特别是美国人，这个电影对我来说是纪录，我尝试看了三次，睡着了4次
450,谍影重重,2,不好看，而且女主角没必要找个那么丑的吧，毕竟不是在拍喜剧啊。
451,谍影重重,2,这部影片里失忆不过是点胡椒末儿，枪战场面乏善可陈。
452,谍影重重,2,剧情拖沓的令人发指（快进看完依然看懂剧情）・・・剧情老套的令人发指（中情局、英雄、少量政治元素的恩怨情仇）・・・剧情无聊的令人发指（然而我下载了全系列）・・・这高分怎么来的？
453,谍影重重,2,典型过誉。
454,谍影重重,2,看过书就觉得电影拍得太敷衍了。男女主角都和我想象的太不一样了。剧情省略太多了。
455,谍影重重,1,女主角就是恶心的一逼，也没多好看。看到女主角就想按下X，
456,谍影重重,2,走特工路线的马特达蒙，觉得，不够帅，不如汤姆克鲁斯的碟中谍。
457,谍影重重,2,女主角还能再丑点吗
458,谍影重重,1,被严重高估的电影，剧情不禁推敲，也无法理解你们对马特达蒙的舔点在哪
459,谍影重重,2,老片子 最近才看的 马达蒙特当年好嫩啊 然而这样的片子放在现在没有什么亮点。
460,谍影重重,1,为什么总是拿失忆大做文章呢。看着他总觉得他是那个数学天才失足少年。的确是高速剪辑啊。
461,谍影重重,2,平民版007，不是我的菜。
462,谍影重重,2,特工对行动有高度的敏锐对女人就是zero么，不是编剧给男主一个美好结局的话用推的就知道那女人还是会一团糟啊。一点都不好看
463,谍影重重,1,难看。闷得要死
464,谍影重重,2,为什么我看到的全是一大堆莫名其妙的剧情漏洞和逻辑硬伤。#最烦那些为了出续集不好好讲故事的片子了#
465,谍影重重,2,可能是期望太高了，可能是心情不对，为么我感觉好闷，男主女主都不太好看
466,谍影重重,2,只为马特达蒙而看的片子，事实上也只有他一直在维持着这部戏的高度
467,谍影重重,2,差点没看睡着过去。。。
468,谍影重重,1,They chose to fight and lose
469,谍影重重,2,忒没劲了
470,谍影重重,2,这个系列一，我反而记不得了
471,谍影重重,2,表达什么
472,谍影重重,2,这剧情是有剧情？别看到外国片就给五星好吗？
473,谍影重重,2,我去，我觉得自己智商实在太低了，完全不知道这部东西在讲什么，，，除了呆萌一直在失忆之外我什么都没看懂。。。
474,谍影重重,2,不知道有什么好的，最后也没明白他到底是干什么的，是卧底还是杀手
475,谍影重重,2,特工片太无趣了，弃看
476,谍影重重,1,一个不想做杀手的杀手杀了很多人，最后找到真爱的故事。很烂！
477,谍影重重,2,女主轻度脑残且废话较多 片子一紧张她还捣乱我最烦这样的；妮基那个演员丑死了还能配上dex，怨念……这俩女的让我把片子从三星拉到了两星。
478,谍影重重,2,对这种间谍片一直就喜欢不起来 看着太无聊了 [ 2016.07.19 home]
479,谍影重重,1,垃圾谍战动作片。
480,谍影重重,2,拖沓而糟糕。
481,谍影重重,2,不知道为什么真的无感这部电影，剧情拖得太长，完全不如碟中谍
482,谍影重重,1,吃不下去，不知是暂时性的胃口不好，还是味觉已经再次因革命而悄然变化。――今年初在冰滴日晒耶佳雪菲的轰炸下，一滴甜味饮料――糖水都无法下咽。一如既往？
483,谍影重重,1,有点犯困
484,谍影重重,2,这尿崩的剧情是怎么打上8分的
485,谍影重重,1,浪费时间，完全不知所云，真是不明白为什么会给高分。。
486,谍影重重,1,本来想给两星，看到豆瓣评分居然高达8.3毅然改一星。商业片没帅哥没美女，情节老套又牵强又装腔作势。间谍片拍到这么无聊也够不容易了。
487,谍影重重,1,"我重新点开这部电影3次,3次在20分钟以内就关掉"
488,谍影重重,2,我就 老X得 男主角忒丑。
489,谍影重重,2,按理说应该给三颗星，但就是为了它把原著里还算聪明的女猪改成一个尽拖后腿的蠢女人，我要扣掉一颗星！你全家女人才都是白痴！你全家女人才都是拖后腿的！当年看觉得不怎么样，现在看了书再来看觉得这片子就是渣！
490,谍影重重,1,好看在哪儿？？？？？？？能被夸成这样？？？？？？完全逼自己看完的2345678910都不会再看了。怎么它就成硬汉派的代表了呢？？？？硬汉派没这么无聊啊，迈克尔康奈利一秒把剧本秒成渣好嘛。
491,谍影重重,2,神翻译的片名让一部普通的爆米花电影获得了和《谍中谍》同样的知名度
492,谍影重重,2,看到一半不小心睡着，再看一次还是一样，不知道为啥。
493,谍影重重,2,为什么我觉得不好看 
494,谍影重重,2,主角很帅，但我看不懂，整个片子剧情都乱糟糟。
495,谍影重重,1,题材是好的 从一开始的失忆可以让观众和主角的心理产生共鸣 但是这剧情也太几把无聊了 就为保守秘密一环接一环 咳。开始节奏气氛都还好 后面的氛围就太神经兮兮 剧情非常散落 左一套右一套 而且一走感情线就开始婆婆妈妈 看着烦
496,谍影重重,2,……原来评价这么高，但不喜欢就是不喜欢啊……
497,谍影重重,1,尼玛还没见过比这更没悬念更没吸引力的好莱坞商业片呢 唯一亮点是偶尔出现的德语 看来想打瑞士银行的主意懂点德语也是有好处的 
498,谍影重重,2,失望！
499,谍影重重,2,我不觉得有多精彩啊
500,谍影重重,2,暑假实在无聊没网的时候在电视上看的~其实也很无聊。。。
501,谍影重重,2,boring...
502,谍影重重,1,拖沓的要命，该背景音乐烘托紧张气氛的时候又出不来，男女主角又蠢又迟钝，打发时间也会嫌无聊的啊！
503,谍影重重,2,本来觉得一般，但是和期望值相差太大，决定只给两星
504,谍影重重,2,"剧情无聊透顶、莫名其妙。
美国特工的组织性、应变能力就这么一塌糊涂?
007、碟中谍两个系列随便拎出一部来就完爆本片。
据说这还是系列最佳，我都没有看续集的勇气了。"
505,谍影重重,2,不知所云，，，睡得一塌糊涂= =
506,谍影重重,2,我怎么一点都不觉得好
507,谍影重重,2,全靠呆萌苦苦撑起全局，尼玛，心疼～！大半部都在吊着我是谁我在哪且都干了什么的胃口却仅凭几句话回忆如初，除了只能看出导演叙事的单薄外还能有点啥～杰森伯恩最后的微笑简直是本萌了～
508,谍影重重,2,又一部“Who am I?”，因为是先看的《不明身份》，后看的这部影片。感觉在整个剧情的处理和情节上面，《不明身份》更加扣人心弦，情节更跌宕起伏，更好看一点。虽然从时间来说，《不明身份》虽然有点老调重弹的嫌疑，但是青出于蓝而胜于蓝。
509,谍影重重,2,锅 我都快哭了好吗
510,谍影重重,2,差强人意
511,谍影重重,2,相当平凡的一部动作片.. 不明白火在哪里 ？
512,谍影重重,2,动作场面一般，剧情逻辑漏洞，顶级杀人武器特工居然会因为看到目标的孩子不忍下手导致任务失败，特工任务失败后组织居然派所有剩余特工出动杀死他，N对1的抓捕行动还被挟带着主角光环的男主角轻松破解。莫名其妙的女主角，没有铺垫的感情戏，这种节奏的片子，我还是喜欢这个杀手不太冷。
513,谍影重重,2,盛名之下、其实难副，美国版“我是谁”，记得在山大时，晚上看完珍珠港，和华哥一起去水房，我说本阿弗莱克还演过谍影重重，这时旁边一哥们儿说，不对，是汤姆克鲁斯演的谍影重重，我纳闷儿道，阿汤哥不是演碟中谍的吗？这时华哥已笑翻
514,谍影重重,2,非常凌乱，很多情节根本解释不通，男主刺杀行动的失败，女主的爱情线莫名其妙；二人一起被追杀来回逃，并不好看啊，不知道为什么这部片子会有8.5分。
515,谍影重重,1,老套的剧情，呆板的表演，丑陋的打斗，这部烂片到底哪里好啦？
516,谍影重重,2,就以幼髌而言... 不及格
517,谍影重重,2,吃不了马特的颜....总觉得他长得像一个生活在美国北部地区的地主家的傻儿子…………
518,谍影重重,2,2颗半 略显沉闷，剧情有点点云里雾里，看到后面都有点不耐烦了，男主那时真年轻。优点是比较务实，没有过多特效特技，剧情进展比较理性。
519,谍影重重,2,没有碟中谍好看
520,谍影重重,2,不好也不坏。惊险刺激度不够，一切都是那么中规中矩。
521,谍影重重,2,原来我之前看过，这次在保利科技馆看才慢慢回忆起来.可能放在02年算是经典之作，现在再看就感觉挺一般了.马特达蒙给我种草黑风衣了
522,谍影重重,2,⊙66⊙！过誉
523,谍影重重,2,确实比不上后两部的节奏感，但一些小细节，比如对格斗的真实性和实用性的追求，已经可以体现这一系列的精神。
524,谍影重重,2,我X得我x了V大人民群的美6868看了一半多真的尾蛔×6868
525,谍影重重,1,打一星完全是因为当年去电影院看宿舍四个人全部睡着了，并且其实根本不记得看的是12还是3，等有空一定全重看一遍，恢复一下此片名誉。
526,谍影重重,2,一般，挺没劲的，属于看过就忘的那种
527,谍影重重,1,配不上蓝光碟。
528,谍影重重,1,美国电影中的经典，就等于我的“无聊”
529,谍影重重,2,没什么传说中那么有看头。
530,谍影重重,2,搞不懂为什么豆瓣评分这么高，情节太简单了，完全没悬念，结尾也奇怪
531,谍影重重,1,无聊得要死，人物一点性格也没有，编剧根本不知道他的人物在想什么，人物互动完全倒置，一个幻想得到美好生活的女人突然卷入杀生之祸，还他妈有心情主动挑逗罪魁祸首做爱？主角一直没有一个盟友，且没有丝毫让我们提心吊胆，他好像牛逼上天，复仇的节奏又像蜗牛，大决战简直他妈的糊弄，送你句:我走了
532,谍影重重,2,除了男主比较好看，这个电影到底在说什么。。
533,谍影重重,2,商业大片
534,谍影重重,1,不知道讲的是监控风云，还是飙车风云，或者说追逐风云。真心不好看，越来越讨厌美国佬那一套英雄主义的拍摄模式
535,谍影重重,2,到底是太久远的片子了，无感。
536,谍影重重,1,片子其实还不错~评得低是因为她居然公然说喜欢matt damon~.
537,谍影重重,2,所以最后到底谁是好的谁是坏的...难得一部特工片我会既讨厌男主又讨厌女主。女主的任务就是在旁边打岔，怀疑男主，不信任这世上的坏人，就是傻逼角色。
538,谍影重重,2,好气啊，光环把我闪瞎了。
539,谍影重重,1,"不太喜欢，没看完。和所有的谍战片一样，一惊一乍的。Bourne为什么会知道自己会失忆？为什么对从水中救起自己的人没有回报？
发现谍战片和《灌篮高手》一样，画面给的信息特别少，导演随时可以让另一个人（或是情节）插入镜头。"
540,谍影重重,2,没人给两星我也要给 说好的比碟中谍系列好看呢 我看得都快睡着了= =
541,谍影重重,2,我如马特・达蒙般一脸懵逼。
542,谍影重重,1,没什么出彩的  
543,谍影重重,2,150529 从开头我就期待着马特戴蒙恢复记忆继续任务精彩绝伦，一直等到片尾曲...好吧我承认我没看懂，所以234是讲他恢复记忆完成任务了吗
544,谍影重重,2,说真的，也不是太差；但较《心灵捕手》真的逊色很多，马特戴蒙。加油
545,谍影重重,2,电影节在巨幕厅看的，剧情还可以，就是拍摄各种偷懒，全靠镜头瞎晃制造剧情紧张，至少一半的时间只能听电影而不是看电影，观影体验太差，导演不尊重观众，这不是一部合格的电影
546,谍影重重,2,什么烂玩意儿 是不是配乐该是within
547,谍影重重,2,真是啥JB
548,谍影重重,1,在这里我给它一个烂片的界定，120分钟内，剧情很简单很好懂，基本上到后来是可以才出结果的，在艺术的层面特技和镜头画面剪辑很紧凑，给观众一种剧情紧张的错觉，有种莫名其妙上当受骗的感觉。
549,谍影重重,2,和l小s好了 下周去看4，於是 找了1 2 3眍A，真]X得有多好看，看了1不想看2...
550,谍影重重,2,看得要睡着了zzZ
551,谍影重重,1,好没劲，比碟中谍差远了！马特达蒙好丑、、、女主也好丑、、、、、、伤眼
552,谍影重重,2,"就这？等我看完前3部再下定论。

看完前三部，379152，这个系列很奇怪一部比一部好。"
553,谍影重重,2,一般
554,谍影重重,2,这么硬的打斗只有中间那10几分钟时间有点可惜
555,谍影重重,2,这个弱智剧情是怎么拿到8.5？？？
556,谍影重重,2,160824 中午 160825 下午 iqiyi 在线 观看
557,谍影重重,2,剧情略拖沓加上SB矫情女 完全无感啊
558,谍影重重,2,大失所望，各种不在线
559,谍影重重,2,What the fuck?简直莫名其妙好吗？马特达蒙苏到我了。
560,谍影重重,2,我可以说什么乱七八糟吗？飙车戏动作戏枪战戏都没有亮眼的地方
561,谍影重重,2,没啥好看的
562,谍影重重,2,为什么除了扯我觉得我啥也没看见？
563,谍影重重,1,"韩国电影《柏林》借鉴过？
《罗拉快跑》的女主
有点《黑客帝国》的影子"
564,谍影重重,2,啥啊这是...是因为年份早吗？也许在那个时候很先锋，现在看就是平庸至极。
565,谍影重重,2,现在看起来很一般了嘛，找身份这个梗还行。但是情节不拖沓，没什么多余的水分这点倒是很不错。
566,谍影重重,2,完全没传说中那么神啊，我已经好久没遇到能让我端着早饭端着中饭端着晚饭搁电脑前面蹲了两天才看完的片了…………一个动作片、谍战片能让人暂停那么多次蛮不容易的……
567,谍影重重,2,原来谍影重重跟碟中谍不是一个系列啊......简直就是糟烂类型片的典范，所有缺陷它全占了，无聊到爆。侯孝贤想致敬这个系列是什么鬼，坑人不倦啊！
568,谍影重重,1,"剧情可以给4颗星；演技3颗星；
女主丑减1星，笨减2星，破事儿一堆还总是自以为是减3星。
因此，总的就是一颗星"
569,谍影重重,2,看得想睡。
570,谍影重重,2,说实话 是冲谍影的大名来的 看过才发现漏洞太多 而且剧情也超级无聊 整个过程就是伯恩找自己身份 最关键最后也没弄出个多大的阴谋来 就如有些朋友所回复的 为啥要杀伯恩? 一直没交代清楚。。而且伯恩失忆前的任务到底是什么？杀黑人？后来那个BOSS又说不是让他去杀黑人  真是搞笑 还8.5 呵呵！
571,谍影重重,2,这只是一部普通的商业片而已 追逐、真相、谎言、性爱、狙击
572,谍影重重,2,so so
573,谍影重重,3,15年第一次看给2星，这次给3星
574,谍影重重,2,周Sir暂时没有评论什么。
575,谍影重重,2,喜欢看欧洲国家的风景，算不错的休闲片。
576,谍影重重,2,恕我直言美国教科书式套路片。（看厌了美国大片。全都一个套路。一部爆米花电影。
577,谍影重重,2,对间谍片无感额・・・・有什么可悬疑的
578,谍影重重,2,我真的不懂 为什么分那么高…?尴尬 19/10/30update 好了我懂了 真的9690 get 到了马特达蒙的帅气，可女主还是不喜欢，坐等继续被自己打脸
579,谍影重重,1,湮没在历史的长河中吧！于我而言实在欣赏不来！
580,谍影重重,2,不怎么的啊！真的真的！
581,谍影重重,1,这片子8.5？呵呵了……影片整个逻辑很奇怪，一个失败的特工把组织干翻了，然后女主还莫名其妙爱上他？打斗也没啥看点，对比，和碟中谍1差太多……
582,谍影重重,2,你妈！看三遍没忍住看完！
583,谍影重重,2,除了与女主的爱情戏 其他一无是处
584,谍影重重,2,看到最后，说了两字，我去。一直以为神作，简直难以下咽，下了整整四部，看了一部半，怒删
585,谍影重重,2,一般，精心打造的杀手，执行任务时因为顾及孩子在场不忍心杀人？
586,谍影重重,2,不知道为什么评价这么高 感觉略无聊啊 剧情发展得突兀又缓慢
587,谍影重重,2,作为成熟的商业片，确实可以从中借鉴很多
588,谍影重重,2,我还真以为是悬疑片呢，结果一点不悬疑，都想说，什么鬼？片名可以叫：我是谁
589,谍影重重,2,只有原声带能听。
590,谍影重重,2,一点都不好看。可以说全程莫名其妙。
591,谍影重重,2,到底哪里好看...真的不懂
592,谍影重重,2,我又一次的被评分和评论给骗了，超没意思，女主角还巨丑。
593,谍影重重,2,真的没觉得有多好看，外界美誉过头，女主也不美，不是我的菜，早被碟中谍和007先入为主。看完也不知道最终目的到底是什么，明显是为后面铺垫
594,谍影重重,1,女主是不是傻？？？
595,谍影重重,2,是我下的字幕翻译得太烂了吗，为什么老觉得台词很欠火候，
596,谍影重重,2,同类片教材片，唯一遗憾是女一丑。
597,谍影重重,2,看之前已经被剧透，所以总有种等待高潮的心态，可惜一直到看完也没等到。
598,谍影重重,1,为什么我完全欣赏不来这部电影，拖沓的情节，莫名其妙的情欲戏，智商为零的女猪脚，还没做就开始吐。很少有一部电影讨厌的这么明确的！
599,谍影重重,2,唯一一部看了第一部就不想再看下去的电影  也可以说没看懂？智障女主脑残警察整部电影不知所云主线模糊  故事情节经不起推敲 没有逻辑 最后煽情也是煽的没有味道 纵观全片也不是没有亮点 Matt帅帅哒 细节也做的比较到位 中间有一部分场面剪辑还算不错 但整体来讲精彩的部分少得可怜 
