,movie,star,comment
258,谍影重重,3,如果只看1，很难想象能出到4.。。。飙车还可以，就是场面小。各种场面小。跟碟中谍没法比的场面小。。。
259,谍影重重,3,要不是男主，这片还有看头吗…20100712。20160821又看了一遍，完全没印象啊。。感觉好生涩，土里土气的。。with Js 豆瓣250
260,谍影重重,3,女主角与达蒙太有夫妻相了！尤其是短发造型
261,谍影重重,3,看完正在上映的“谍影重重4”，再来回头恶补之前的系列，没有想像中精彩，国外版本的“我是谁”…… 
262,谍影重重,3,我不喜g X得]什N新意 可能@音出淼r候比^新r吧 也就是三星
263,谍影重重,3,可能是本片被太多后者模仿，现在看起来觉得没啥感觉。
264,谍影重重,3,稳扎稳打，挺正常的片子，连故事结构都那么简单，也许是我在10年后才看的这片子的原因，觉得实在一般。一个镜头比较漂亮，马特从楼梯上踹下一人，把这人垫在身下，悬空射击的段落。动作有伯恩特有的风格，这点一直值得赞。
265,谍影重重,3,节奏紧凑，纪录片式的手法，让观众感受到一个无比真实的世界。
266,谍影重重,3,事实证明可能这种神马特工谍战片确实不是我喜欢的类型电影吧，不过马特达蒙在里面真的满帅的（是不是很多人是因为这个系列而喜欢上呆萌的？）★★★☆
267,谍影重重,3,剧情拖沓无力 没有代入感和悬疑感 嚼嚼爆米花完了
268,谍影重重,3,真没觉得有评价说得那么好
269,谍影重重,3,错过的片子一定要补上了，现在看起来好像没什么值得大说特说的，唯一值得说的就是马特达蒙那清瘦的样子。
270,谍影重重,3,动作和追车场面很棒，男主很帅 失忆特工自我认知的故事，踩石计划有点不知所云
271,谍影重重,3,看不进去，男猪脚用我们老孙的话来说就是一直想抽他，女主是我最烦的那种，什么都不会还还意思跳来跳去装大尾(yi)巴狼
272,谍影重重,3,稳扎稳打型的电影，平实铺垫直叙而入，这种电影难有让人打了鸡血的兴奋感，多的却是拳拳到肉的真实感。总体来说全片没什么可挑剔的地方，但也没什么太大的优点，就电影本身而言属于中上水平，但以我个人评判并不是很喜欢，三星。
273,谍影重重,3,周末三集连着看掉了，总体还是不错滴
274,谍影重重,3,"1.飞车，搏斗，枪战，坠落，VS美女；2.恐高症慎入；3.逆袭的真狠，一点不留情面，看不下去了；4.不要小看文职，他们不只会作报告和订会议室；5.日内瓦到巴黎到西班牙，古董车、砖石街道、路灯、黑伞、尖顶房子。。。ps,没有人的死是正确的"
275,谍影重重,3,电影情节过于平淡，叙述倒也紧凑、干净利索。类似的题材，这一部中规中矩，只能保持个中间水平。特工的派头有了，搏斗也有硬度、质感，观众内心兴许能泛起点涟漪。不足之处在于内核，将矛盾的核心归于一次特工的演练着实让人大跌眼镜。主题过于平庸，那么电影本身存在的意义在哪里，票房还是票房？
276,谍影重重,3,马特・达蒙撑起了整部电影啊。。。话说那个罗拉快跑的确不是属于这种谍战片的美型女主演啊。。。。
277,谍影重重,3,"结尾应该是Jason来到女猪面朝大海，春暖花开的小店，两人相视一笑，此时从里屋走出一个只穿了条内裤的壮汉捏了捏女猪的屁股问道，“hey pumpkin, who's this?”"
278,谍影重重,3,"I watched in Design Minor while in GHP.
There are things you try to tell yourself to forget. And then, you will."
279,谍影重重,3,@是一部爽片，但故事e]有英雄。三部曲要B在一起看，才有倒吃甘蔗的w。全文：http://hou26.org/zeta/bourne.htm
280,谍影重重,3,d 谍影重重  道格・里曼 2002 The.Bourne.Identity. 双语字幕.HR-HDTV.AC3.1024x576.x264
281,谍影重重,3,"  我觉得各种BUG重重啊...    后面2部,不知道会怎么样.,明天看"
282,谍影重重,3,",我发现当初不仅是人认错了,就连豆瓣也加错了,重新加一遍,还算精彩，就是感觉整场战斗打得好乌龙"
283,谍影重重,3,Matt Damon的脸怎么看怎么不顺眼
284,谍影重重,3,不理解杀手会因为一个小孩而失手，导致整部影片都是在被总部追杀中……
285,谍影重重,3,第一部除了迷还是迷……基本上是打一个杀手和一个boss之后还有更大的boss等待出下一集
286,谍影重重,3,感觉没啥意思啊。。。对这种男女主角莫名其妙爱上的电影从来都觉得很无奈。。。
287,谍影重重,3,我说这女主角越来越眼熟，原来是《罗拉快跑》里的。
288,谍影重重,3,可怜的克里夫欧文，才一句台词就死了
289,谍影重重,3,不觉得有很好的片，但却很红，很多继集的片，其实那剧情很旧套啊，有什么好看的。
290,谍影重重,3,悬念感不强，作为一个特工您也长得太不美型了一点吧。。。
291,谍影重重,3,啊，好多年前看的，少数完全不记得讲了些什么的电影，但记得好像还不差看
292,谍影重重,3,完整的故事，凌厉的打斗，纯爷们的荷尔蒙。可惜不是我的菜。
293,谍影重重,3,剧情不够精妙，如果不是马特达蒙我也不会看下去吧，随便看看打斗场面就好。再说马特达蒙的打斗用了神奇多的镜头转接，辛苦剪辑师和特效师了。爱情什么的，我总觉得是那女人在达蒙顶着当年瘦鞋拔子脸傻兮兮的时候乘虚而入。
294,谍影重重,3,有钱你就能让美女给你开车。。。虎头蛇尾的电影
295,谍影重重,3,20071001 7/7.6(82085)
296,谍影重重,3,11.4 男主挺萌，俩人挺配。没了。
297,谍影重重,3,是不是我间谍的电影看多了？怎么觉得剧情老套，结局仓促，一点都不好看呢？
298,谍影重重,3,"预算：6000万
北美票房：1亿2166万
全球票房：2亿1403万
上映日期：02.06.14
上映周数：23周
分级：PG-13
最高院线数：2663
北美最高排名：2"
299,谍影重重,3,应该说一切都很好，但不是我的菜。可能是罗汉系列印象太深，马特达蒙给我的印象永远是地铁站的小扒手...
300,谍影重重,3,克里夫欧文咋也来打酱油了喃......
301,谍影重重,3,以前一直不明白为什么 MattDamon 可以是最性感男性，现在懂了
302,谍影重重,3,原来1我N年前在电影院看过…只是那个时候我还不认识马特戴蒙…
303,谍影重重,3,说实话 没啥亮点 可能是看的太晚了的缘故吧~没有碟中谍好看~
304,谍影重重,3,一贯的风格，简洁有力，再加青春无敌，Matt Damon是也。
305,谍影重重,3,好吧~  我看不出经典。身手完全的好~  追车戏很棒~  比一般的
306,谍影重重,3,电影比书好…书我看了半年也没看完…主要是马特达蒙这个演员选的好…至于女主角…劳拉快跑里很酷…在这里么…我猜是为了跟达蒙同学夫妻相…
307,谍影重重,3,"第一次在电影院看，很讨厌。几年之后再看，却是极端喜欢。
16.8.3在看，三星半"
308,谍影重重,3,2012/11/1重看，还是3星。
309,谍影重重,3,故事一般，节奏太太太太太慢，让人昏昏欲睡，特别是女主角难道不能找个年轻漂亮点的么？每次看见她就想快进。。这类失忆特工的题材已经拍不出什么新意了，没有碟中谍的大场面，文戏也弱爆了，唯一的看点是动作戏很连贯舒服。又是一部过誉的电影。
310,谍影重重,3,最近不喜欢这种类型的电影了
311,谍影重重,3,雏菊最后那场枪战是模仿的这场戏啊，不先看经典的结果就是会喧宾夺主啊。
312,谍影重重,3,情节紧凑，故事一般，张力不大，表演出色。
313,谍影重重,3,困惑又冷静的各项全能优秀特工，最后的白衬衫造型真是娇嫩可口！酷但是没有记忆中的第三部酷。是的，重头开始看伯恩系列。我还是对呆梦挺好感的~ 三星半。
314,谍影重重,3,第一集不能说是精彩，印象中也就一场飙车戏和两场格斗戏还不错，剧情也马马虎虎，并无亮点。
315,谍影重重,3,"看完之后感觉只是还行啊,看完不怎么很兴奋.只能三星了"
316,谍影重重,3,我喜欢马特达蒙的一脸憨相，配上利落简洁的身手瞬间形象鲜明起来；在他慢慢发掘自己身份的过程中表演还挺细腻。作为谍战片情节还是简单点，且女主角丑得惨绝人寰，故将3.5分降为3分。2012.6.9
317,谍影重重,3,说是动作片其实不算很炫，说是悬疑片又完全不费脑子。为嘛找劳拉当女主？长得那么抱歉叫人怎么看下去……
318,谍影重重,3,看完了4硌a前3部。搞了半天@了一大圈是了除掉IВù箪F）啊……MINI的植入性V告太成功，不起眼的小破？居然超禁折v！特工混口吃也不容易啊，大家都是“上^的”棋子而已。（不^我也想有好妆静煌籍的有效o照@N事我f
319,谍影重重,3,好吧！我承认我没有太全神贯注！
320,谍影重重,3,马特达蒙跟女的怎么可能会有化学反应！对象还是罗拉！飙车，枪战戏还是可以的，顺便学习技能
321,谍影重重,3,第一部其实也就是中规中矩吧，期待后面2部。
322,谍影重重,3,很久很久之前和老爸一起看的。自己不太喜欢
323,谍影重重,3,mark个到此一游，然后忘掉
324,谍影重重,3,节奏慢，不知道为什么会吸引人投资拍续集，但事实证明第三部吊！
325,谍影重重,3,看似平淡的商业片却是拥有完美巧妙的剧本 一个点开始 扩大至面的过程也同是讲述剧情 有一定的剧情之外加杂的表达 优秀的视听预言 出彩的马特达蒙 典范商业片
326,谍影重重,3,911是spy movie的一个分界线 从escapism到realism 邦德片最明显 
327,谍影重重,3,弗兰卡・波坦特 剪了短发有点像苏菲玛索呢
328,谍影重重,3,我是谁，连接破碎的记忆，找寻自己的“原点”。
329,谍影重重,3,发现个帅哥，Gabriel Mann演那个反派小跟班。很想知道他做了什么让那一排车的防盗报警器都一起响了起来
330,谍影重重,3,1，当年的马特达蒙真心帅。发福不管多好看都会完败。2，特工技能的全面剖析才是影片的最大亮点。完全可以当做优质生活指南。3，干净利落的特工电影。4，失忆完全没处理好，最后一泻千里。观影憋着的一股劲自动消化没有爆发。
331,谍影重重,3,3.5星这编剧挺费脑的吧20121104
332,谍影重重,3,现在这种调调已经拍烂了；结尾的Matt Damon令我顿悟：我喜欢的还是Good Will Hunting里那个阳光傻小子；Oh I am f***ing Matt Damon
333,谍影重重,3,以现在的标准看，情节着实弱了一些。
334,谍影重重,3,【给你们拖下坑……好吧好吧不傲娇挣扎了虚弱在坑底躺平仰望星空的为梗补番】我觉得在啥都不知道就开看的情况下我的年代感判断还挺值得昂已下单……其实所有出戏感都是因为这种刚好卡在10年差距的时代感略微妙……从服装化妆到房间装饰神马的都……嗯我就不吐槽电脑了…………
335,谍影重重,3,伯恩系列迟迟难以下咽的重要原因是：伯恩特别神似俺大表哥，忒易出戏。
336,谍影重重,3,02年的片子现在看 技术都跟不上了 破车也不咋好看 看的就是个朴实无华
337,谍影重重,3,啊啊啊，主要是为了看可爱的马特达蒙！PS：在一大堆钞票里看到人民币时感觉太亲切了！
338,谍影重重,3,为啥那么多男人都喜欢看这系列呢～我接着看看后面的吧～
339,谍影重重,3,好吧，没有想象中精彩。。。
340,谍影重重,3,大概是我看的太多过了看这种片子的年龄了？怎么看也看不出怎么值得豆瓣250的
341,谍影重重,3,当我看到片头，德语英语法语互换的时候，我都能明白他们的谈话时，我明白我会有多高兴了~~主要剧情是编剧带着大家逛巴黎的景色，开车在街头一路狂冲确实印象很深，寻找自我的过程好像是之后很多悬疑片的模版～～　
342,谍影重重,3,"2008.12.14在寝室看的,肌肉很有型..."
343,谍影重重,3,为毛我看了无感，好困啊。
344,谍影重重,3,如果没有男女啵啵的戏就不叫电影了好么？(我在吐槽，嗯，认真吐槽。)
345,谍影重重,3,视效、剪辑、剧情、节奏、张力，也许是十年前看会觉得很棒，但现在，套路不断被套路，看多了就觉得很一般很无感，而且跟现在的同类型影片比显得很过气。虽然内心有个声音告诉自己，毕竟是十年前的东西，但还是难接受。得承认商业片，真的很容易过时。
346,谍影重重,3,没想象中的那么好。我怎么觉得没看懂呢？
347,谍影重重,3,不好看，比碟中谍差远了。不知所云，小排量车都能飚车。赤焰战场的老俄国特工出现了，策划专家么，一个项目接一个项目……
348,谍影重重,3,大汗，我居然看过的，怪不得当时看3的时候感觉眼熟。。
349,谍影重重,3,可谓是临危不乱，方可一战啊。
350,谍影重重,3,Ready Steady Go -Paul Oakenfold 
351,谍影重重,3,一般. 没有get到男主的帅点..而且带着一个既不好背又很容易被认出的包晃荡了好久.....
352,谍影重重,3,作为伯恩系列的开篇，头开的还不错。
353,谍影重重,3,不是人，怎么训练得出这么厉害的特工，蓝伯的时代已经过去了
354,谍影重重,3,不明白此片为啥评分这么高。不过6868Matt Damon在这里还真能打啊。跟买了个动物园那片的熊样差好多啊！
355,谍影重重,3,唯一亮点就是克里夫欧文，我还没认出来
356,谍影重重,3,可能年代有点老，感觉节奏太慢了。
357,谍影重重,3,唔并没有觉得很出色啊，不过第四部里有不少套路都跟这部类似呢。克里夫欧文很有型呢，可是死得好快（←第四部那个看似最强BOSS也是如此-_-|||）还是更喜欢女主红头发的样子
358,谍影重重,3,节奏太慢的特工片，看的我都快要睡着了。一是对马特・达蒙无感，罗汉系列还以为他是个大酱油的；二是对单打独斗而且拼命逃亡的主题无感，不就是失忆找回自己而已嘛，为什么我觉得这个情节似曾相识。真不知道为什么评价那么高，影评也没说清咋回事儿。
359,谍影重重,3,HBO正在播。最近可以把这个系列看一遍。
360,谍影重重,3,就动作悬疑片而言节奏有点慢。但是六本护照苍苍亮很帅啊有木有！！！
361,谍影重重,3,第一部确实不是很让人眼前一亮~
362,谍影重重,3,有些特工一直在追，有些特工一直在逃。作为一部主打动作戏的商业大片，还算不错。
363,谍影重重,3,烂女主 boooooohhhh。 
364,谍影重重,3,完全活在碟中谍的阴影下了，中规中矩。
365,谍影重重,3,美国版《我是谁》。甩掉包袱才能来去自如。
366,谍影重重,3,有个外景是在H00tel Regina Louvre大堂拍的。道理我都懂，但我就是看着觉得没劲。
367,谍影重重,3,打开保险箱的瞬间出现的是杜蕾斯（杰士邦）和隐形眼镜盒 U盘欧米茄和一大堆护照 毛爷爷 没有热成像瞄准镜真是费事儿  作为特工片硬伤还是蛮多的
368,谍影重重,3,再次印证了：womean dont like questions
369,谍影重重,3,剧情好长。看着紧凑，但又有拖沓的感觉。
370,谍影重重,3,智商太低，没有理解真谛，不是很明白~
371,谍影重重,3,怪不得如此眼熟。你还是留红头发好了
372,谍影重重,3,先前一直以为这个和碟中谍是一部＝＝
373,谍影重重,3,被感情线生生给拖垮了！！！！！！有没有！！！！！
374,谍影重重,3,"Get serious, guys. This is on the top 250 movies of douban? Whatever man... The thing with this sort of movie is that everyone is doing their job properly. No loose ends, everything's clean, keeps you hooked from the first minute till the very last. You've got kick-ass Mat Damon, a chick to care for & to bring some vulnerability, the bad-bad guys to hit on the face and the bad-good guys to lay to death softly. The care chase was nice, the close-contact action fine, the gunfights delivered too... No really, they thought about everything so that nobody points out fingers or complains. Except that this does not have any soul or personality. You forget about immediately the minute it ends."
375,谍影重重,3,没什么感觉啊，就觉得达蒙太帅了，最后不是应该男女主角深情一吻么，怎么抱的那么开心，好姐妹么？！
376,谍影重重,3,前半部分挺好看..后面就一般般了
377,谍影重重,3,minicooper王道！各种灵活转向，各种漂移，各种路况都能适应。法国警察根本无增援。。我根本在看马特达蒙玩极品飞车9，而且是一星电脑！
378,谍影重重,3,女主一点点像苏菲，男主一点点像孙扬。呐，跟007差不多嘛，凭啥分儿这么高。
379,谍影重重,3,"这是谍战类还是动作类?剧本的细节刻画得很细腻,但整部戏并没什么悬念和看点,失忆被追杀,在找自己是谁的同时保护同伴并对抗追杀,就这么简单的故事."
380,谍影重重,3,你都厉害成这样了不知道自己是个特工？瑞士，法国。摸不着头脑的是为什么就相信遇到的第一个人啊，为什么就跟女主角擦出爱的小火花了啊？我不听我不听。第一部的目的是要接着看下去，渐入佳境，解开大阴谋（恰似越狱）这部的马达怎么看怎么像年轻的Jack
381,谍影重重,3,"又名: 谍影重重 / 神鬼认证 / 叛谍追击 / 伯恩的身份

导演: 道格 利曼 (Doug Liman)
主演: Matt Damon

上映年度: 2002
官方网站: www.thebourneidentity.com
imdb链接: tt0258463
制片国家/地区: 德国 /　美国

"
382,谍影重重,3,其实我是拿这部当爱情片看来着，失忆王子与平凡少女的物语，《东之伊甸》有木有~
383,谍影重重,3,最好看的打斗戏真的太少了，马特达蒙拍打戏真的太帅了91女主德国人演美国人口音重。
384,谍影重重,3,不知道为什么，我没找到G点，顺滑的看完，觉得少了些什么，但又说不出来。可能是之前评价太好，无形中我提高了挑刺的标杆吧。
385,谍影重重,3,真的感觉没那么神，有些地方还看得云里雾里的！应该是特工版的《我是谁》，失忆特工揭开自己身份的冰山一角，感觉编剧是挖了一个大坑，结尾看似结束实则隐患无穷！轻微交代了之后的“垫脚石”行动和药物控制这两大线索。两场戏很经典：1.Mini飙车戏 2.旋梯枪战戏。疾走罗拉很美，matt长得好幼齿
386,谍影重重,3,《不明身份》绝对是受了它的影响，这种光靠身体记忆的英雄个人主义太！霸！道！
387,谍影重重,3,这部片子好在哪里？好在哪里？？好在哪里？？？？？
388,谍影重重,3,WHO AM I ?
389,谍影重重,3,我在犹豫要不要把第二第三部看下去
390,谍影重重,3,演的人感觉很爽，看的人没什么感觉。
391,谍影重重,3,仍然对达蒙接受无能。。好吧他是演技派。。不知道为什么评分这么高。。
392,谍影重重,3,先声茶社2012-10-31
393,谍影重重,3,节奏肿么有点慢呢。。。大晚上的看了一点不兴奋。。。
394,谍影重重,3,组织为什么杀伯恩啊？因为刺杀失败？
395,谍影重重,3,备忘Mark。
396,谍影重重,3,6.9/10 虽然说细节决定一切，但是这种全靠细节推动，情节过于简单的电影，我真的觉得还好。
397,谍影重重,3,The.Bourne.Identity.2002.DVDRip.XviD.DTS-CiPA
398,谍影重重,3,真的一般 8过马特达蒙还是很帅滴
399,谍影重重,3,"大y幕, 不如第二.第三集......"
400,谍影重重,2,我实在是不明白为什么外界评论这么高。。。真的太普通，太俗气了，一个超级特工和组织对着干，再加一个稀里糊涂但是身手不错的美女，标准的好莱坞大片模式，我都厌倦了。
401,谍影重重,2,看了4后倒去看1，有些失望。一个不称职的特工制订了周详暗杀计划，突然因为自己想立地成佛搞砸了整个计划。之后虽然因为失忆情有可愿，但主动招惹是非给整个项目组带去危险，别人打算灭口也是很自然。最后还连累上司被枪杀。看4时和主角劲往一处使，看1时就想丫这惹事精怎么还没被灭啊
402,谍影重重,2,作为女人，发誓再不看这种塑造superman的电影了。
403,谍影重重,2,男女主是大硬啊啊啊啊啊... 破`百出，比如f，一v胎有}的mini居然能w；比如之前不擦指y，s在f你妹的都追了ol街mess up了全巴黎了居然全身而退居然那r候s又想起要擦指y了；比如男主扇战女主精通g之道；比如男主身殚g居然下不了手橙... 我勒去，]搞e吧！
404,谍影重重,2,我是异类么 我觉得这是很无聊没意思节奏和情节都很无趣的电影
405,谍影重重,2,你在问人话的时候会掐着他的脖子问么？而且人还能冷静的跟你用英语回答。shit
406,谍影重重,2,CCAV的配音毁了这部电影，配不来就放原声嘛，老是搞些画蛇添足的事
407,谍影重重,1,碟中谍+个人英雄主义！
408,谍影重重,2,虽然时隔六年。。。也未免。。。太难看了
409,谍影重重,2,跟第二部比起来，天上地下
410,谍影重重,2,尼玛基本就是你追我打，唯一的人物关系还处理得非常草率；无法理解为什么要花那么大篇幅在中情局的线索上，观众总比波恩先一步知道答案，然后看他把答案再查一遍，累不累啊……
411,谍影重重,2,0309-10 节奏慢 不吸引人 女主和男主居然能情愫双生 很奇葩啊  豆瓣大神们打分都出奇的高 如果是国产片会被骂死吧
412,谍影重重,1,看到一半后再也坚持不住，跳着看的。什么破烂，没劲的要死
413,谍影重重,2,是《}拉快跑》的Lola
414,谍影重重,2,剧情太弱了. 躲来躲去就把2个小时混完了.
415,谍影重重,2,为什么非要加上一个破坏节奏和紧张感的丑女人
416,谍影重重,1,这部摄影像狗屎一样沉闷无聊的作品是怎么火的。。。。。。
417,谍影重重,2,Do you have a ID？Not really.
418,谍影重重,2,我想这部片 没有后两部真的能这么有名么 我想很多只看了第一部的人都还不懂为什么吧..哈哈哈哈哈只不过还有一两个clive的镜头哦~~
419,谍影重重,2,说实话，糟透了
420,谍影重重,2,剧情挺老套的，也许当年算经典，也许因为我不喜欢马特达蒙。
421,谍影重重,2,和妈妈一起看的。线索乱，交代不够清楚。
422,谍影重重,2,没劲，情节太没张力，涣散的很
423,谍影重重,2,作樯I影也太y看了c。如果遇上的是小夥子呢，H不H？奏在一般。ps女主明明好看啊。Clive Owen的眼R造型。。。
424,谍影重重,1,没剧情，没场面。
425,谍影重重,1,说实话这个电影让大家吹嘘的有点过了，看了20分钟了还不知道讲了什么，大家所谓的真实也不过就那样，剧情实在是老套简单的不能再简单，看的人昏昏欲睡，还有女主张的实在是...不打算再看234了，无聊至极
426,谍影重重,2,我就不懂了  到底好看在哪里  而且对于“就算全世界只剩下我和你  我也不会因此爱上你”的我来说  实在没办法理解这两人的感情是怎么来的  btw曼恩真是帅得掉渣嫩得掐的出水啊。。。啧啧 
427,谍影重重,2,女的安插得太拙劣了- -总之我一点都不enjoy
428,谍影重重,2,"牡谝患看，不明白什么@部片子被捧得@N高。
三部曲系列的影有很多，但是如果渭o法好好f一故事的，就已掉1/3印象分了。"
429,谍影重重,2,难看的要死
430,谍影重重,2,实在不了解这部电影为什么评价那么高，无论伯恩找不找回自我，他的身份决定了他就是个罪人啊。也实在欣赏不了女主角的魅力，感觉她在电影里就是伯恩的累赘，除了在酒店拿出名单，好像就没有什么所谓安抚男主人公的作用了。感觉要看了原著的人才看得懂电影。
431,谍影重重,2,我看到了人名币。果然先看了第三部之后在看第一部产生了很大的落差，并没有那么的精彩，无论是剧情还是对手戏。影片以马特达蒙寻找自己的记忆为主线，在个个地方都有一点小打小闹，打斗的场面都很平常，没有什么特点，而且很短暂。完完全全是普通的特工片，都没有第四部好看。唯一的亮点就是反拿手枪。
432,谍影重重,2,越来越喜欢美国动作片，直到我的膝盖中了一箭.......首先是缺乏重头戏，例如在草原上和另一个绊脚石的对决，应该更精彩一些。然后他们找了一个不太漂亮的女主角，一开始我想，这很好，符合剧情设定，后来我明白了，这是一部好莱坞大片，制片人没有按规矩准备美女，而我居然给他找理由，真是傻透了
433,谍影重重,1,说比 （碟中谍）好看的人 请问好看在哪里！看的过程都要睡过去了
434,谍影重重,2,失望。不明白为什么很多人将此系列奉为经典。平淡到哈欠连连，也或者是品味不够？最关键的，木有SG挖。。。
435,谍影重重,2,好多bug，故事说的既不悬疑也不清晰，非常普通的片子啊。也许是没看后面几部吧。
