,movie,star,comment
113,猜火车,4,一个时代和一个地区的人才能有共鸣的，单纯的去体会让后去感想，虽然对，但是总难免有点假。坦率的说，剧情有点拖沓，连接不够。
114,猜火车,4,选择生活，选择工作，选择事业，选择家庭，选他妈的大电视机
115,猜火车,5,低角度摄影、写实主义、问题电影，世界在变，音乐在变，毒品也在变，你不能在海洛因中逃避的太久。
116,猜火车,4,一部先听了N遍OST再去看的电影，从头到尾没有停下过的音乐，独具风格的另类独白，构思精妙的叙事技巧，这些都成就了《猜火车》的桀骜气质和个性品牌。
117,猜火车,4,猜火车让吸毒者的各种感觉都用影像表现出来，对青春的迷茫也是如此。
118,猜火车,5,Trainspotting加Braveheart就是真实的苏格兰。 奥运会配合片 reprise
119,猜火车,4,开篇各种惊艳，中间略显冗长，结尾非常精彩。大婶和屎霸抢被洗那段笑抽
120,猜火车,5,不是选不选择 不是吸不吸毒 不是背不背叛 不是离不离经叛道 而是人的内心永远都是一个无底洞 充斥着无数的欲望 填不满也掏不空
121,猜火车,4,"Just a perfect day.Problems' all left alone.Weekenders' on our own.It's such fun.It's just a perfect day.You made me forget myself.I thought I was someone else, someone good.Oh, it's such a perfect day."
122,猜火车,5,NND爱尔兰人够狂野；他妈的我的青春怎么跟死水一样；知识很重要但更重要的是应变（电影里说什么都在变世界在变音乐在变毒品也在变时想到的）；跟他们比我真他妈的太好孩子了，当然东方跟西方两种不同的文化很难这样比较!;真他妈的想跟他们那样狂野一下；吸毒他妈的老子连烟都不吸，因为我周围的人都说
123,猜火车,5,这片子本身就是毒品 无论是创意还是演技都直接牛逼到高潮完全没有低调的过程
124,猜火车,4,"too far from my life       
the last lines are touching"
125,猜火车,5,“选择生命，选择工作，选择职业，选择家庭，选择可恶的大彩电，选择洗衣机、汽车、雷射碟机，选择健康、低胆固醇和牙医保险，选择楼宇按揭，选择你的朋友，选择套装、便服和行李，选择分期付款和三件套西装，选择收看无聊的游戏节目，边看边吃零食......选择你的未来，选择生命……太多选择，你选择什
126,猜火车,5,"堕落、迷茫、放纵、糜烂……我们也只能从电影中体会这样的青春了。
这是一部很混蛋的电影，混蛋到让人想去吸毒，堕落到卧在铁轨上决定人的一生，又让人向往无政府状态下的放荡自由。年轻时候的伊万简直帅的迷人和《大鱼》中的判若两人……"
127,猜火车,4,作为电影，它应该得5个星；但对于青少年的影响，我给减少一个星。
128,猜火车,4,很好的片，可惜不是我喜欢那一型的青春，太多的自我，太多的放纵，缺少一种抑郁忧伤的美
129,猜火车,4,Ewan名垂青史的角色，紧身牛仔裤帆布鞋的装扮现在看起来都是潮到不行。
130,猜火车,4,本片堪称电影奇葩，没有苦口婆心的家长式人物在里面，没有道德的矛盾冲突，没有世纪末的大审判，而是零观点的方式记述，在一个阴暗的公寓里一群这样的青年，你清楚的看到毒品是怎样溶解，加热，吸嗜，他们ML，脱衣，全裸，高潮。另类颓废经典
131,猜火车,4,选择你的未来，你的生活。但我干嘛要做？我选择不要生活，我选择其他。
132,猜火车,5,Lou Reed的歌声伴随着无处倾泻的荷尔蒙，无所追随与无所适从的心
133,猜火车,4,实话是从画面的处理，故事节奏，音乐的似有还无、融为一体的诸多角度上来说，灰常不错！再者，叙事者的思维完全纯粹，纯粹完全体现在follow heart上面。啊~~是哒，想做神马就做神马，想吸毒就吸，想过上平常人的正常生活就过这样的生活。阿门
134,猜火车,4,选择生命，选择工作，选择职业，选择家庭，选择可恶的大彩电，选择洗衣机、汽车，选择健康、低胆固醇和牙医保险，选择楼宇按揭，选择朋友，选择套装、便服和行李，选择分期付款和三件套西装，选择收看无聊的游戏节目，边看边吃零食，选择你的未来，选择生命，太多选择，你选择什么，我选择不选择
135,猜火车,5,我曾v^的q月……
136,猜火车,4,昨天去小屁股家玩，麦克larance steven eugene，虽然e早走了，但整个过程终于形成了一直听说的hang out。5个小时没做什么具体的事，就听听歌聊聊天跳跳舞，当中去了个麦当劳。觉得找到了那种free spirit的感觉。于是今天终于觉得准备好看这部了。看这部真是要头脑进到另一种状态才能看才能理解的。
137,猜火车,5,世界太乱人太坏・・・我们怎么办・・・这是荒唐么？这是堕落么？
138,猜火车,5,你不会越来越年轻，世界在变，连毒品也在变，你不能整天宅这儿，梦想毒品和伊吉波普，关键是你得找到新东西。后青春期的怀念，经典至极！满星不为过黑色励志片，不看不知道，一看吓一跳，想了解，还是得自己看看的。期待几位男主20年后非凡的重聚以及经典的献映！
139,猜火车,4,人都受不了一条线的生活，当你把一种生活玩烂了，就会自然而然地奢求改变。不过事实上，并不是所有人都跟主人公一样最后有个好的结局，当你想摆脱你认为不堪的过去时，才发现过去在你的生活中深深扎根。难的不是决心，而是坚持。只有强烈的决心以及狠心才有可能改变过去，创造新的生活。
140,猜火车,4,"I'm going to change.I'm cleaning up and I'm moving on, going straight and choosing life.Looking ahead, the day you die. （还是这个时候的Ewan McGregor最帅。）"
141,猜火车,5,怎拥那啻涸拥娘L，在那片K格m的土地上默默成L的狂c苦。流失的不H是rg，有ι命的讨。Cult是痞獾模但又是前l的，在o厘^中摸打L爬，就是@印
142,猜火车,5,"Trainspotting 边缘文化 另类新生代的最爱。
"
143,猜火车,4,奇怪这些怎么都没标记，大一就看得，这是很特别的一个。
144,猜火车,5,"I don't want to be left in the world, so I choose to persue whatever I  like or not like."
145,猜火车,5,也许我不过是像迷恋lolita片头语一样纪念这部电影的片头语罢了
146,猜火车,5,相对于这个，实际上我更喜欢发条橙子跟飞越疯人院。但是从纯粹的人性自由选择上来说猜火车确实是一部不带主观色彩的电影。好坏全看个人看法。光这点，给5星，不为过。
147,猜火车,4,高中时看不下去，现在再看感觉还OK。与毒品有关的日子是糜烂到底的，好在最终其实是一个积极的主题。
148,猜火车,5,"cult
被电影名字吸引，又是一部类似于SHORTBUS的文艺片吧。
很英国的一部片子，苏格兰的“方言”。一直很压抑的看这部片子，带回曾经在英国时那些不美好的记忆。发旧的房屋，脏的发黑的红地毯，潮湿的壁纸，一定有那些潮虫，那些或在最底层的英伦青年，街上厕所随处可见的黄色针管筒，还有那一直阴云低沉的天空。音乐不错。
另一种生活方式。客观的平视它，上演。"
149,猜火车,5,"The job, the family, the fucking big television. The washing machine, the car, the compact disc and electric tin opener, good health, low cholesterol, dental insurance, family Christmas, indexed pension, tax exemption, clearing gutters, getting by, looking ahead, the day you die."
150,猜火车,5,掉进马桶里游泳，无意识地倒进棺材，我崇拜这两个富有象征主义的情景。
151,猜火车,5,敬我们终将逝去的青春！音乐和镜头非常赞！以及裘月逭γ辉一角，这样他们三个好基友就聚齐了！
152,猜火车,4,"1.生活有太多的选择,他说他选择不选择,但海洛因也是一种选择,最终还不是回归要选择的世界,所以说远离毒品,不是谁都经得起那样堕落的青春.
2.那马桶恶心到我了."
153,猜火车,4,"所谓的青春题材:sex,drug and friends?! 印象比较深的地方:同样一间屋子，曾经穿着T恤的他们和后来穿着西装的他们……年少的狂妄到最后还是选择人生，按照大家都会经历的人生走下去…… p.s.我只希望那个叫黛安的女孩也能幸福……"
154,猜火车,4,我很想不通为什么当年我在标记想看这部电影的时候加了cult的标签，目前看来这种口味已经算小清新的了。由此可见我的口味升级是有多猛！大爱开场和Mc被锁在房间里戒毒那段儿~
155,猜火车,4,丹尼・博伊尔是我最喜欢的导演，他从来没让我失望过。这也是他的代表作之一，经典！
156,猜火车,5,喜gY尾，其是钪酒不是么！毒a后的鼍罢娌诲e。p.s.Ewan McGregor真是和毒品很相r的美人喊。我缀醵纪了他演^大~了……
157,猜火车,4,没办法打五星，在我看来这样的片子太另类，只适合偶尔看看，虽然我们能找到自己的影子，但青春不是借口
158,猜火车,5,EWAN受性之美 被社会遗弃的垃圾，呼吸再多新鲜空气有个屁用
159,猜火车,5,"看过很多遍。始终不厌烦。Maybe we're victims of fate,Remember when we'd celebrate.We'd drink and get high until late,And now we're all alone。"
160,猜火车,5,"Looking ahead, to the day you die. 
"
161,猜火车,4,喜欢里面的冷幽默，伊万念台词的功力真棒，当年也是帅的一比。谁说泯然于众人的人生不是一种幸福。
162,猜火车,5,【2004.09.03-DVD】中二时期以为是中二片，后来发现它其实是励志片。
163,猜火车,4,仰望很久的片子，K於看了，f，]想像的好。冒U，迷失，追ぃ有甩不掉的p友，@就是青春的注_。有人f它引人落，s忽了它钪镜囊幻妗Ｒ樗看不到，看似av的R桶下，s是V袤的海洋。巨喜gR桶那段。
164,猜火车,4,分了四次看，热情耗没了有点。马桶那段很经典啊，封面很像谢耳朵，收藏了这影人。推荐++ps白发小青年天蝎署仔水瓶男主和暴力男都是白羊，恩
165,猜火车,4,首先真的好喜欢影片的拍摄风格 有趣 还不忘致敬 雷邓简直是现代人的代表 自私可是有那么努力的活着 影片用黑色幽默的方法传递了一种孤独和恐惧 看到中间都有些心疼
166,猜火车,5,选择生活，选择工作，选择职业，选择家庭。选择他妈的一个大电视。选择洗衣机，汽车，雷射唱机，电动开罐机。选择健康，低卡里路，低糖。选择固定利率房贷。选择起点，选择朋友，选择运动服和皮箱。选择一套他妈的三件套西装。……选择腐朽，由你精子造出取代你的自私小鬼，可以说是最无耻的事了。
167,猜火车,4,原声音乐很赞，就用这悲情却热烈、迷幻又纯洁的电子配乐来祭奠腐朽的青春，现实让人妥协，如同坟墓。每个人都奔向它。 
168,猜火车,5,Looking ahead tile the day you die.
169,猜火车,5,"Choose a job, choose graduation, choose a fucking nice cellphone, choose nodding, choose talking nonsense on weibo, choose a cheap house near subway, choose fake British fashion, choose women, choose self-deception, choose being filled with jealousy and fury, choose escaping."
170,猜火车,5,超现实的镜头+英伦摇滚+铅笔裤+帆布鞋+毒品+性+尖叫
171,猜火车,5,猜火车.Trainspotting.1996.BDRip.MiniSD-TLF.mkv 599
172,猜火车,5,有没有人可以同时拥有mates又同时拥有一份工作you know，it must be pretty cool。Mark 还是斩断了过去过逐渐走向死亡的正常人类的生活，可是谁说过什么来着 什么过去背叛现在忘记等于什么来着的okdokey  you know what  i say
173,猜火车,5,真TMD的励志片！每个真理让人安宁，不是吗？如同坟墓。每个人都奔向它。它的原声音乐就是将迷幻药缓缓送入你血液里的针管。
174,猜火车,5,事实上，你是内向敏感的人。如果我愿意，会发现你的内在，风趣、爱冒险、热情、忠实，有点疯、又有点坏，女孩子不都爱这种男人？
175,猜火车,5,最后偷钱的时候真是让我紧张坏了，不觉得马克和谢尔顿很像么？其实不用觉得其他人有多无聊，因为往往最不知趣的就是我们自己，所以，趁着还无所事事，那就赶紧该干什么干什么，别遗憾，别犹豫，别后悔。
176,猜火车,4,前三十分钟像是纪录片的呈现吸毒状况看着没什么劲，越到后来越有意思。苏格兰厕所一段略恶心。同样也是在铁路旁四个人对苏格兰身份以及所谓殖民产生了不认同和迷惘。被锁卧室戒毒一段的剪辑很精彩。选择或是不选择都是被选择。爱情与友谊都说不定，背叛背叛，忠坚忠坚。道别，开始。
177,猜火车,5,"我干嘛要做选择？我选择不要生活，我选择其他。理由呢？没有理由。只要有海洛因，还要什么理由？ 
"
178,猜火车,5,不良少年的罗曼蒂克消亡史。
179,猜火车,5,一群2B青年的2B生活，男主角长得太帅了。我看的版本翻译人名很赞啊，“卑鄙”“屎霸”，好贴切啊。这部影片真的不关乎好坏，男主结尾盗走巨款的时候，让我小小欢畅了一下，还有好人“屎霸”也得到一点回报
180,猜火车,4,“我要把自己收拾干净，我要往前走，一直走下去，去选择我的生活。对此我是充满期待的。我终将会变得和你一样。工作，家庭，他妈的大电视，洗衣机，汽车，CD唱机，电动开罐器，健康，低胆固醇，牙医保险，分期房贷，第一套房产，休闲装，行李箱，三件套西装，DIY，电视节目，垃圾食品，孩子...
181,猜火车,5,嗑药犹如猜火车，徒劳无益~~喜欢这种旁白式，果然丹尼鲍尔的风格比较合我口味~~PS:貌似片中有多处意识流手法，慢慢总结吧
182,猜火车,4,选择生命，选择工作，选择职业，选择家庭，选择可恶的大彩电，选择洗衣机、汽车、雷射碟机，选择健康、低胆固醇和牙医保险，选择楼宇按揭，选择你的朋友，选择分期付款和三件套西装，选择收看无聊的游戏节目，边看边吃零食......选择你的未来，选择生命……太多选择，你选择什么，我选择不选择
183,猜火车,4,有些垃圾青年值得我去喝Z，@e的，算了吧，落的落，死的就死，]人稀罕。
184,猜火车,4,并不是熟悉的青春，但也真实得很。音乐很出色。我们不能永远年轻，不能永远热泪盈眶，可我们却始终对一个更美好的世界怀有乡愁
185,猜火车,5,"残酷，过瘾。想想《slmdog milllionaire》,丹尼鲍尔好像对于主角钻粪坑钻马桶这一桥段情有独钟，对于竞猜节目厌恶又有瘾。"
186,猜火车,4,从一开始厌倦生活琐事到最后蜕变为对琐事的向往，说明生活虽然不能像毒品一样给人带来瞬间的刺激，但是踏踏实实的东西才会让人有充实感和满足感。
187,猜火车,5,令人作呕的马桶、天花板上恐怖婴儿、好压抑的火车墙纸。针管、毒品、注射。运用极具叛逆的拍摄手法叙述极具叛逆的青春，毒瘾发作的样子真的是超逼真。“只要有海洛因，还要什么理由。”
188,猜火车,5,"迷途青年一代的精神塌陷，音乐？海洛因？SEX？还是什么别的，一切以叛逆为先，还记得Mark有句台词：We would have injected vitamin C if only they had made it illegal!→如果吸维生素C违法,我们就去吸！"
189,猜火车,5,"无论你如何抗拒选择，你始终都要选择你的未来，选择生活..
Choose Your Future,Choose Life."
190,猜火车,5,Ewan掉马桶的场景给我留下了难以抹去的心理阴影
191,猜火车,5,一个把现实拍得超现实的导演。。。。大概是我看过的最“恶心”的电影，但是又这么畅快淋漓。。
192,猜火车,4,讲的是曾经的叛逆少年们最感兴趣的事:毒品、性、摇滚，以及大家都喜欢的足球和电影。男主角本来很鄙视被社会同化的成年人，但最终却想要成为那样的人，多么讽刺。其实绝大多数情况下，人生本就不会是我们想象的那般精彩纷呈，所以有人要今朝有酒今朝醉也没什么。视听效果很炫，但剧情还可以更好。
193,猜火车,4,主人公reyton看似是在做一次次的选择，实则是在一次次的迷失自我。本片从社会底层的视角出发，以人物的沉沦来展示对这个社会黑暗面的痛诉，在拍摄手法方面也有超现实的一面，此外在对于维度及幻觉空间的描写非常出色，不亚于盗梦空间。但本片的价值观更加偏向于非主流，容易产生误导。
194,猜火车,4,很diao的苏格兰口音；最后当Spud拿出Mark给他留的钱的时候，感受到了mark最后说的话的意义：I can choose my life...
195,猜火车,5,这是个很颠覆的故事 叛逆 浑噩的几个年轻人 在自己人生道路上 有多少荒唐可以经历 人生可以重新洗牌吗 这是个疑问
196,猜火车,5,让人从头爽到脚的英伦绅士腔。迷幻，百感交集，思绪漫天飞舞。的确得再来一瓶英伦的威士忌。
197,猜火车,4,好像人们都在津津乐道这部电影多么经典。其实看完之后就觉得英国佬比美国人重口味多了，加上最近在看皮囊，对英国人有了颠覆性的看法。如果这是一部关于“吸毒有害”的电影，那么我觉得比梦之安魂曲差的不是一点半点，所以说这部电影能在IMDB拿8.2分根本是因为触动到叛逆少年的某根心弦了吧。
198,猜火车,4,"20170609 再看就惊了：没一个不是腕儿啊....可惜当初都不认得...然后被摄影给闪到了
20070117 很畅快地干坏事"
199,猜火车,5,每次看完这类cult movie都觉得堕落其实是一种天分和魄力。肾上腺素那么浓烈的“猜火车”楞被四娘整成了逆流成河的忧伤文艺范儿，想想就很气。其实我还是更爱Ewan McGregor的《Velvet Goldmine》一些。
200,猜火车,3,就一点想法，而且与电影无关：外国连个吸毒的流氓都知道和未成年发生性关系是违法的，即使是人家自愿的，但在天朝。。。。。我就不说了。。。
201,猜火车,3,"开头：Choose your future, choose life, I chose not to choose life.
结尾：Getting by, looking ahead to the day you die."
202,猜火车,3,"被神传的一部青春电影,不过并不出彩."
203,猜火车,3,作为一个烂人走出堕落青春的故事，《猜火车》里的毒品和《皮囊》里的性一样，拥抱虚无又渴望存在，英国孩子们的这一类青春文化就是从带着叛逆与不屑的粪坑里爬出来，走向他们曾经鄙视的平庸，与狐朋友狗一起阳光灿烂的日子只能是粪坑中的臭味相投，而脱离了粪坑以后自然无感于那些曾经一起蠕动的蛆虫。
204,猜火车,3,没想的那么牛逼。
205,猜火车,3,该面对现实了！！！你不可能一直都在逃避…有些老外的身体就是好，怎么祸祸都没事；有些狐朋狗友就该快刀斩乱麻，要不这辈子都被耽误了…
206,猜火车,3,你带走巨款，却带不走内心的烦恼和迷惘；你跌进马桶，从此在空虚的海洋泅渡一生。误当毒品是救世灵丹，在婴儿夭折后借一根针管救出溺毙的自己；错把友谊作万能妙药，睁大双眼看见背叛喉咙却发不出声响。那是一代人无所事事的侧写，挣扎在毒品与性爱的边缘，任由欲望怕打、时代摇摆，抛给看不见的明天。
207,猜火车,3,从15年前这个电影就不断滴在我的眼前晃，无数文艺青年向我推荐这个电影。今天终于下了决心看了。总觉得有过誉的感觉。放在今天看就是典型的独立电影，但既不是最激进的也不是最飘逸的。可能确实迎合了许多人对边缘性的想象吧。其实这个片最好的地方在于有许多英式的玩世不恭在里面。
208,猜火车,3,直男的世界文艺男青年你别猜，你猜来猜去也是不明白。虽然伊万很有魅力。
209,猜火车,3,迷茫迷失的清纯！
210,猜火车,3,"User Rating: 8.1/10 (106,266 votes)
Top 250: #175
"
211,猜火车,3,不做作，y能可F，各段落也算g贰ＬK格m vs. 英正y（如007）。x瘛ｋm然整片子做的是A段c^程（即使最後也走在蛏希，而非一整w，但收尾的「逃x」是可以得更好一c…
212,猜火车,3,从马桶钻进去，又从马桶中走出来，还能这样拍，没觉得很好看，不喜欢从头到尾的主人公自述。
213,猜火车,3,很多人说他和发条橙子类似，但如果我说他只能类比昨天是不是说明我没看懂？所谓的cult片代表，其实反映的未必都是消极。如果你了解trainspotting只是一场猜下一趟火车目的地的游戏，那其实这才是探索。
214,猜火车,3,"电影一开始就特装逼，前半段很逼。。不过导演的表述手法不错。音乐也不错。我们的未来都是好用青春一次次的借口在自欺欺人。ACTUALLY, WE KNOW EXACTLY WHO WE ARE."
215,猜火车,3,没看懂。难道导演只是在讲述那些大不列颠岛上年轻人怎么度过叛逆的青春？难道导演只是在告诉我们终将学会选择？虽然也是关于毒品的片子，但是远没有梦之安魂曲那么震撼人。虽然同为英伦片子，但是没有两杆大烟枪结构让人叫绝。
216,猜火车,3,然后，一天你发现，就算你拒绝，你放弃，世界还是没心没肺的存在，而你却被抛弃，不会因为你不承认改变你的失败。伊万那时候好帅啊，圆寸控~
217,猜火车,3,除了电影技巧很好。总觉得主题不凝练。很多人不知道怎么把小说改成电影，很多人不知道有些小说不适合成为电影。
218,猜火车,3,有点意识流的感觉。电影重复出现“这是最后一次”，然而每一次都是最后一次。大道理人人都懂，但就是懒得去做，但人生却会突然因为某句话或歌词而点亮。往往心意已决很久，只是少个行动的理由。
219,猜火车,3,3.6 很狂野的年轻啊..跟小凤一起看的~ ：）
220,猜火车,3,好可怕。死孩子毒品酒迷幻跳舞混乱烟钱男人女人街道学校....555妈妈....
221,猜火车,3,Camera always rolls with Fun. I wish I knew English so as to get rid of fucking subtitle. A similar plotline as The Deer Hunter. 
222,猜火车,3,厕所真恶心
223,猜火车,3,太堕落了，不推荐。风格独特的cult吗？仅此而已吧，太小众了，喜欢猜火车就个性了？
224,猜火车,3,五年前，当@danyboy 第一次决定给大家看一次电影的时候，班里的女孩儿喊出了这个名字。而我当时完全不知道这是个什么。他说这个电影没什么好看的，这也是我拖了很长时间一直没有看这部电影的原因。我很奇怪rent最后怎么走上了好日子。不管怎样，这部电影除了时装以外，实在没太多叫我感冒的地方。
225,猜火车,3,20121005：颓废青年励志……交友得谨慎。
226,猜火车,3,这就是Danny Boyle赞誉最高的片儿？在我看来不尽然。表现手法的确出众，细剖下来，不过是毒瘾记录片儿。可喜：功绩依然显眼，催生了包括skins在内的英伦状态片（剧）儿；可悲：一直被拿来作为装逼利器，高估得失去了话语权。
227,猜火车,3,看到有人说什么这就是青春迷幻和自由放纵，原来你们的青春是这样的，真牛逼//我真不喜欢这个故事//汤米就被麦克这一盘磁带毁了，之前温馨整洁的家之后成了什么样//也搞不懂Diane，女生喜欢这种“酷酷的坏坏的”男生?呕//弗朗西斯贝比拍的johnnie walker广告简直经典//番仔留着泪摇头意味着什么
228,猜火车,3,苏格兰的“莉莉周”，叛逆青少年～一开始的那段台词很经典：选择生活，选择工作，选择前途，选择家庭。选择他妈的大电视机，选择洗衣机。。。我不喜欢灰暗的片子
229,猜火车,3,为什么叫《猜火车》？不应该是《我做人渣的日子》么？啊，感谢上帝，我的青春多明媚温馨！开篇的话痨，差点让我没看下去，好在电影渐入佳境。再说一次：配乐是国产电影的硬伤。
230,猜火车,3,rock&roll的精神在于向逆境挑战，代表着永不服输的人生态度，反正我是没有从一堆嗑药的废材中看出什么摇滚的内核。
231,猜火车,3,太晦涩，没怎么看懂，可能也和文化差异有关系。但这部片子是真晦涩~
232,猜火车,3,原来我把他和发条橙弄混了
233,猜火车,3,Looking ahead the day you die！
234,猜火车,3,一两年前看的时候，只看到那个家伙头钻进一个脏兮兮的马桶里就看不下去了。再翻出来看，终于能看下去还看完了。在无数文学作品里屡次被提到的电影，真是没看出什么感觉来。
235,猜火车,3,#常看常新#年轻、放荡、自由、颓废、混乱……生命中不断地选择，依然走向未知的生命。再看依旧对厕所那段感到生理不适，却突然发现演Tommy的是GA里的Owen~
