,movie,star,comment
407,猜火车,1,堕落的源泉来自空虚，堕落的孩子上辈子上厕所都不带纸。“屎霸”这个名字是谁翻译的？这么有节操。是谁说这个比《贫民窟的百万富翁》好看的？拉出去斩了！根本就不是一个风格的，再说水平也差很多。诶?原来伊万・麦克格雷迪和特雷西・麦克格雷迪长得一点也不像啊。
408,猜火车,2,唯一一部让我喜欢的男主却不愿意再看的电影。可能爱之深责之切吧= =
409,猜火车,2,“选择生活，选择工作，选择职业，选择家庭。选择他妈的一个大电视。选择洗衣机，汽车，雷射唱机，电动开罐机。选择健康，低卡里路，低糖。选择固定利率房贷。选择起点，选择朋友，选择运动服和皮箱。”。还是要选择适合你的。清清楚楚的记得，这是我第三次认真严肃的，打算把这片看了，买了薯片啤酒，还是没看完，This film makes me uncomfortable. 一曲perfect day是唯一get到的。18年的《高潮》我看得也有点蒙，就酱吧。三刷2019.4.29 3/10
410,猜火车,2,有很多人心仪这部片子，将其视为颓废青春的经典之作，然而它却始终提不起我的兴致。就好像我曾经努力去听nirvana的垃圾摇滚，曾经试图去理解无数人膜拜的Kurt Cobain，却始终找不到很多共鸣。也许是我没有真正叛逆过，这些东西对我来说就是太嘈杂太混乱。
411,猜火车,2,"I Dont Get It..
No Good 4 ME.."
412,猜火车,2,老婆，真的看不懂为什么那么多人评价那么高，呼呼，可能是老公从小是“好孩子”吧，没有乱七八糟的乱青春，嗯，老婆，你喜欢我这样吗？老婆，圣诞节快乐！
413,猜火车,1,不喜欢青春残酷系列的所有电影
414,猜火车,1,抱负盛名的大烂片，除了一首perfect day还比较好听。
415,猜火车,2,吸毒酗酒为非作歹还自认为很酷，从头疯到尾，无聊的烂片，却被捧得天那么高
416,猜火车,1,"关于青春最深处的堕落被无限放大，丢弃在潮湿的角落，和他们的茫然无措一起发酵成这个炎炎夏日最刻骨铭心的痛。他同他们一样混乱，却比任何一个人都看的清楚。一边不能自已地沉沦，一边冷清地看着旁人...
"
417,猜火车,1,"电影透出的气息是无聊，庸俗，浅薄，盲目自大的。  正所谓不想滥交的毒瘾青年不是好朋克。一切的理由和宣言不过都是在为自己的放纵无能找借口。去你妈的Cult, 去你妈的朋克。作为人，谁都不比谁傻。你放纵过，就可以拍这种垃圾故事装逼了？可怜可笑可悲。"
418,猜火车,2,重口电影 但不觉得情节有多牛B啊
419,猜火车,1,没啥意思，很失望。一群颓废的苏格兰吸毒青年，似乎想表达出某种青春的迷惘与叛逆，其实又只是有那么点影子而已，没啥实质性的动人内容。这个真是典型的cult film。就给个也号称cult的《旺角监狱》一样的分儿吧。
420,猜火车,2,男主吸毒犯事多次纠正终于戒掉了，做房屋销售上正道，老sb“弟兄”们滋事又一起合资搞了比买卖，最后男主把钱一偷闪人...多一星给的是和男主做爱的短发学生妹...
421,猜火车,2,很多人喜欢，但我不是很喜欢
422,猜火车,1,装B片 颓废就是行为艺术？
423,猜火车,2,很多英国片都不适应，有点难受，有点恶心
424,猜火车,2,这就是著名的猜火车啊，原来著名仅仅限于前后两段独白，中间那些乱七八糟的是什么啊？！！！
425,猜火车,1,确实是两极分化的观感，十分无聊，对我来说，看的发困，好像在看火星人的生活
426,猜火车,2,大学室友的最爱，说他找到共鸣，我怎么在这闷骚的片子里毫无这种感觉。。。
427,猜火车,2,"怎么没太看明白呢？
"
428,猜火车,1,"我还真是个大俗人，这么有内涵的片子一边看一边恶心。不好意思，真心挺烂的，而且三观也不正，没有get到任何能让我给他打一星的点，青春，呵呵，你们家青春要吸食毒品抢劫盗窃死亡来缅怀啊。我觉得猜火车可以直接叫“young generation of white trash""。"
429,猜火车,2,不喜欢这个类似发条橙的调调
430,猜火车,2,一直很期待，终于没看完。太压抑。
431,猜火车,1,bitches drugs violances bults drunks raps stoles ! ass movie!
432,猜火车,1,莫名其妙的颓废青年脸谱。犯罪边缘人群的小众生活旁记。
433,猜火车,2,前三分之二基本没有剧情，我就纳了闷了一堆人说好看，说的好像你的青春也吸过毒一样。
434,猜火车,1,用了个超大屏幕，买了巨多零食，选中来晚上看的一部电影！！！差点没吓死我，口味如此之重……就算是256MB的脑容量也忘不了……T.T
435,猜火车,2,披着伪文艺外衣的病态装逼片。
436,猜火车,1,颓废，影响极坏，难听的苏格兰英语。
437,猜火车,1,没有剧情又恶心的垃圾片，导演拍这种片子真需要鼓起不少勇气阿
438,猜火车,2,有品位绝佳的配乐和精彩的剪辑，我还是对这部片子爱不起来。我真的很不喜欢看吸毒的场面，也很讨厌随波逐流完全失控的生活状态。片头片尾那一长串看似特有哲理的内心独白，不过是精神空虚却精力旺盛的小年轻的无病呻吟。被一些影迷推崇备至的“愤怒感”，根本只是吸毒人员难以自控的狂躁的精神状态而已
439,猜火车,1,我真的很不喜欢这个电影，看完就感觉到恶心。。。
440,猜火车,2,我只能负责任且不装逼地说，也许梦之安魂曲是唯一一部我能兴致昂扬看完的同类电影
441,猜火车,2,overrated
442,猜火车,2,不再年轻，不再叛逆，不做非主流。
443,猜火车,2,不喜欢Ewan
444,猜火车,2,"Actually i can't understand and can't bear~
我说过我不够文艺。等哪天文艺了再来看一遍，说不定就给五星了~"
445,猜火车,2,讲一群英国低端人群的吸毒犯罪的颓废渣滓般人生。男主最后背叛一群渣朋友偷了渣渣朋友贩毒的钱去追求自己的健康正常凡人的生活去了。其中婴儿被饿死的情节看得扎心虐心。人性的愚蠢导致的邪恶太恐怖了。人生反面教材。
446,猜火车,1,价值观无法接受
447,猜火车,2,这片其实我有打一星的冲动
448,猜火车,3,"看个大概四次才看完
一打开就想关掉的电影
一开始很不喜欢
今次看完觉得还可以
从自己的时代走出来
活在当下，认真生活
需要很大勇气"
449,猜火车,2,瘾君子混日子
450,猜火车,1,格利特! 斯高剃须 埃克森特. The film makes me sick.I don't think I appreciate it.
451,猜火车,2,有神马好拽的， 还不是一群小杂碎。
452,猜火车,1,电影可能不错，但我不喜欢~
453,猜火车,2,"连这部电影我都能和父母一起看！
我妈看到几个镜头就说这是三级片、垃圾片，让我关掉。
我爸说它很非主流。
我觉得他们二老说得挺中肯的。
"
454,猜火车,2,极度厌恶这部！
455,猜火车,2,我a生了一要不要猿挚赐赀@部髡f中的影的r候我果嗟仃P了播放器，我已不需要青春的宣了。
456,猜火车,2,不知道槭颤N 就是不喜g
457,猜火车,1,只喜欢美好的东西，生活本已经够黑暗
458,猜火车,2,我低俗 我看不懂 嗯 就这样 至少我不装逼
459,猜火车,2,快进看完，挺无聊，别以为堕落吸毒就NB
460,猜火车,1,真他娘奇了怪了，这片到底哪吸引人了？
461,猜火车,1,就是要给1颗星！！！！
462,猜火车,1,对于吸毒者心理和形态的刻画十分精准！
463,猜火车,2,妈了个X呀，看完之后真想找个人砍死我，完全不对我的口味。但我总算知道它为什么那么受追捧了。我本来想给三星的，但我现在心情实在太差了。我问我同桌有没有看完后很励志，很想学雅思的电影，他说《猜火车》!励你妈去吧!!我还是看《还珠格格》比较靠谱。
464,猜火车,1,看不懂，更不懂评分为毛这么高……看得好累好恶心反胃，画面很脏，内容太颓废了，也没什么故事性，就是一群脏兮兮的颓废的瘾君子的生活。竟然这么高分…这逼我装不来。
465,猜火车,2,“你虽然吃素，却是个邪恶枪手。”
466,猜火车,2,"讨厌男主角惨白的脸，讨厌其他所有苍白的脸无神的眼，
真是一部让我作呕的电影，为吸毒找借口， 
明明就是隐君子还非要上升到精神层面装文艺，恶心的电影
sick sick sick"
467,猜火车,1,fuck！快颠覆我的人生观了。像类似的偷拐抢骗，两杆大烟枪都很喜欢，却实在无法接受这部电影。
468,猜火车,2,Q说：平淡和琐碎是生活的本质。我们即使不甘不愿也不得不承认我们需要它向往它。
469,猜火车,2,或许已经过了那段混沌又叛逆的时期，所以很难接受那种自甘堕落又渴望自我救赎的艰难。最让我震撼的镜头就是那个小孩在摇篮死去的时候，那青灰的脸太吓人了。而它的妈妈在自己孩子死去的时候只是嚎啕着要继续注射，这让我觉得可怕。
470,猜火车,2,不堪回首的马桶
471,猜火车,2,我始终不懂为什么会有那么多人喜欢它~开头厕所的镜头恶心至极~
472,猜火车,2,看到我想吐的一部电影，特别是那个死婴的部分。我没这么高尚，理解不了这部电影
473,猜火车,2,很有名的片子，但看不出什么意思？弱弱的打个二星吧……
474,猜火车,2,Mo聊的。
475,猜火车,1,这个世界应该有两种人 喜欢这部电影的人 和 不喜欢这部电影的人 放他妈的狗屁艺术 我就是觉得恶心 从心底的恶心
476,猜火车,2,虽然被豆瓣的文青奉为神作，但我确实不喜欢。一群疯子、瘾君子过着操蛋的生活，整部影片都看得人很压抑，音乐更压抑。分三次才看完，因为实在看不下去。有人说这最励志，我想说励个TM的志啊！奔着高分去的，却无比失望。
477,猜火车,1,男主角倒是好帅！我真觉得这部片好无聊啊都不知道说的什么
478,猜火车,1,这个和发条橙差不多难看，年轻的我也喜欢过欧美“青春做作颓废自以为酷炫”片，但是只有水果硬糖97
479,猜火车,2,音轨不同步，看得甚为不爽
480,猜火车,2,感觉特无聊，很不喜欢很不喜欢
481,猜火车,2,"难道我已经过了《猜火车》的那种愤青、疯狂、叫嚣、颠痴、随意扭曲的年纪了？Why I just thinking isn't a joke,maybe..."
482,猜火车,2,说实话，远没有盛传之中的经典，杂乱无章。难道是电影中的摇滚乐，只是我不懂欣赏？不过……我对自己的鉴定能力还是比较自信的哈。
483,猜火车,2,糊里糊涂的
484,猜火车,2,黑色电影，贩毒，吸毒，看不明白，高中生妞不错
485,猜火车,2,丹尼的存在率o有1%
486,猜火车,1,这逼装的，无法直视……不过麦克唐纳身材倒还不错嘛，哪像海滨帝国里面一副大妈相
487,猜火车,2,欣赏不来，content is a bit disturbing to me，完全与我的世界观背道而驰~
488,猜火车,2,"很黄很暴力，典型的British black homour, i don't get it"
489,猜火车,2,经典中的经典，不过我还真没看出来好在哪儿了……
490,猜火车,2,这部烂片怎么这么火。
491,猜火车,2,一些镜头还不错，但情节以及叙事远没有期待中的直击心灵
492,猜火车,1,谁说大烟枪像它的！！我怎么一点也没看出来。片中各种毒品，我对于这种颓废青年醒悟实在没有共鸣。但是那句话我喜欢，I CHOOSE NOT TO CHOOSE
493,猜火车,2,一道友戒毒後最後成功甩掉i朋狗友。]想像中恐怖(一直不敢看)然後看完是有那N有一下想要哈哈...不^]X得很好看
494,猜火车,1,"the only credit i'm gonna give to this movie is for its pretentiousness. and don't get me wrong, i am not so mean quite often"
495,猜火车,2,无政府主义的朋克风，问题少年的自我救赎。为什么要叫猜火车呢？抱歉，不喜欢，也没看懂。只记得那恶心至极的马桶。
496,猜火车,2,无法故作深刻地说是多么经典 受不了这样灰暗的电影 配乐倒是很出色
497,猜火车,2,朋友推荐说看完后久久难忘找来看的，但个人觉得较压抑还是喜欢色彩明快的片子~
498,猜火车,2,他是个疯子，但没办法，谁叫他是朋友呢。
499,猜火车,2,不知道是不是和年代更或者认知有关 不明白想表达的东西
500,猜火车,2,传说中的装逼神作。欣赏不来，够恶心的。
501,猜火车,2,到现在我看了2、3次了吧，还记不住情节。是我老年痴呆了吗？
502,猜火车,2,不要拿青春叛逆来说事儿！这么扯淡的电影不是我的菜！
503,猜火车,1,什么狗屁电影，反正我没看完，那个马桶太恶心了。
504,猜火车,2,"一般般。

怎么感觉有点发条橙的叙事影子。

个人不喜欢这种电影。

镜头的叙事还是挺天马行空的，印象最深刻就是主角吸毒后，掉进毯子里，直到被护士打针救醒。

年度最恶心镜头：开头那个马桶……"
505,猜火车,2,搞不明白一部反映人渣生活的片子会有如此多的高评分，是猎奇吗？反正我不喜欢，我还是喜欢温情正常的电影。
506,猜火车,1,这个片儿看的时候实在是不适。并没什么深重的感觉~
507,猜火车,2,这片子好看？好看？好看？好看？？重要的问题问四遍，竟然是前百，失望。致幻的嗨药是弱者逃避现实的选择，你觉得现实很丑陋，那只是你选择了丑陋面。整部片子不知道想说什么，这四个哥们统统可以去死了，人渣
508,猜火车,1,全中国的白粉仔都给这部电影5分吗？垃圾电影！！不要把毒品暴力淫乱与青春联系起来，不要把自己的失败就等同于青春，不要污蔑了青春这个词！
509,猜火车,1,多么神奇的电影。一会儿想让人打5星，一会儿想让人打1星。可是的可是我怎能忘记那些关于大粪的特写呢！亏得老子我没边吃零食边看，我操。
510,猜火车,1,经典他妈了个逼
511,猜火车,2,不喜欢这部片子，太恶心了。这样的青春我可不敢苟同。这样的片子也豆瓣250我真想不通，就是迷失回归正途吗？
512,猜火车,2,英国也有如此的灰暗以及脏乱差 看着确实混混沌沌  嘻嘻哈哈 [ 2016.12.27 2102]
513,猜火车,1,片子和我价值观冲突太大，谁的青春都迷茫，可迷茫就意味着可以肆意颓废（嗑药、抢劫、滥交、贩毒）吗？！没有人可以左右你内心的选择以及之后的重新选择，可历史往往真切地告诉我们：一失足成千古恨，再回头是百年身……
514,猜火车,2,这种颓废黑暗装那什么的青春剧已经完全不适合我了。。。
515,猜火车,2,欣赏不能 T_T
516,猜火车,2,没经历过，无法感同身受
517,猜火车,2,其实没看懂~其实还想看
518,猜火车,2,没有中心思想的一部文艺片，不好看，内容跟标题完全对不上。
519,猜火车,1,根本看不下去，离我生活太遥远了。
520,猜火车,2,"so crazy,dirty~..it's too much..!这片只是表现了某种现象，但不具备好的意义. 
"
521,猜火车,2,瘾君子的日常――那个嬉皮士年代。花了两周才看完这90分钟的电影，时代不一样了，看不出精彩，就像看历史教书的年代尺的感觉。
522,猜火车,2,看不懂
523,猜火车,2,不明白这个片子经典在哪？！
524,猜火车,2,看来我不大适合畸形的…… 2007.03.17
525,猜火车,2,。。。欣赏不能。传说中的cult果然还是不知所云的同义词。
526,猜火车,2,这种片子对我没意义
527,猜火车,2,"this movie seriously made me want to try heroin... and that's dangerous. The rest is all ""cool-factor""."
528,猜火车,2,σ徊勘口好u的影打低分我K]什N愧疚感；我就是X得不好看你咬我N～
529,猜火车,1,单纯从电影制作的角度来讲还是不错的。非常抓人。但这恐怕是我看过最令人难受的电影了。能不看还是别看了。就跟吸毒一样，看上就停不下来。看完就难受的一塌糊涂。
530,猜火车,2,en 2005
531,猜火车,1,请问剧情跟这主题有什么联系吗，一堆恶心跟扯淡。
532,猜火车,2,很多人喜欢   可我就是喜欢不起来
533,猜火车,2,别人国家的青春电影……看之前以为是讲案件的悬疑片，看之后就蒙圈了…最近猜火车2上映，又掀起这股浪潮，隔了这么久才上映第二部，两部电影都是8分以上，还以为是多好看的电影，其实看完了也没啥大的觉悟和感触，电影总体风格都比较血腥暴力，2据说是讲他们的中年危机，暂时没啥兴趣看
534,猜火车,1,"看不懂 就是看不懂  
不喜欢就是不喜欢"
535,猜火车,2,好乱啊，那个男孩跨进坐便器时，彻底傻眼。前30分钟，一片迷惑。
536,猜火车,2,除了又恨又爱的兄弟们..其他没什么共鸣..
537,猜火车,2,"这与我的青春无关   我一直致力于把自己打造成最会做选择题的高分学生\那些犹豫的都是可以放弃的
"
538,猜火车,2,这种电影我真心无爱啊……
539,猜火车,2,"没啥意思
"
540,猜火车,1,电影太脏，看到一半忍不住关了。可能是我的档次太低了，体会不出这部片的牛逼。
541,猜火车,2,好吧   我承认我无法理解这种传说中的经典。。。
542,猜火车,1,毁三观的传说中的神作成僵尸的婴儿真的让我无语，看见太多自媒体推评论一句不适合推不适合小年轻看，特么一群装b犯把我喷得，还搬一坨奖出来，2星改1星，越来越恶心这部，呸
543,猜火车,2,因为你看过，所以我看，当然，也许是我太肤浅没品，觉得也不咋的
544,猜火车,2,这部电影很懒，什么都不想讲。
545,猜火车,2,不是我的口味，看完后只觉得另类，没法体会导演想呼吁的东东，suma
546,猜火车,2,这么多屎的镜头真是恶心。死掉的那个朋友是GA里的OWEN，就说这男的长的不像美国人，但在GA里说的是美语。伊万寸头耳环紧身汗衫真精神。
547,猜火车,2,"今年上映的第二部，看完才补的第一部，看完 猜火车1才明白 猜火车这个游戏游戏比喻的是当年苏格兰的青年沉浸在毒品中躲避着现实，对未来的迷茫。 
2部时间跨度达20年，比《爱在》系列的18年还要长，4个人还都能再次聚到一块，拍出第二部，已经能满足20年前看过第一部的人影迷们了。"
548,猜火车,1,不欣p，∏榭床欢。
549,猜火车,2,无数国外专业影评杂志将此片列为必看NO.1，无限吹捧肆意抬高的结果就是，观影期间无数次想骂WTF……往深里挖，也就是讲了“选择”二字，人在得意失意时的不同选择。论颓废青春题材，#皮囊# 甩它几条街了；邪典不足，部分场景令人恶心不适
550,猜火车,2,这是什么？
551,猜火车,2,对美国的这个世界不感兴趣，或者本能的害怕和规避。而电影也让人费解，要不是看过三分之一的书，我想我是看不懂的了。。。
552,猜火车,2,同情这么多傻逼给高分，可怜他们肤浅的思绪和贫瘠的心理。文艺逼和装逼是异曲同工的质量守恒，就喜欢看豆瓣儿上这么多文艺逼无病呻吟大逼装起，孙子们继续，不装逼你们都感觉没吃饱。。。话说回来爸爸觉得这电影还成，但没这么多孙子文艺逼们评价的那么矫情。。你们不如去多吃点屎来的痛快~
553,猜火车,2,我欣赏不了。。。
554,猜火车,2,"不是我喜欢的类型，开头确实有一种引人吸毒的诱惑，最后Begbie在宾馆的暴怒很赞很解气
----------------------------------------------
意义在于告诉你，生活中的那些操蛋苦难不会因为你吸毒而减少半分，反而只会加剧生活的瓦解（这句影评我喜欢）"
555,猜火车,2,2012.2看过，不咋样
556,猜火车,2,特别无聊，一群“很用力”作死的人
557,猜火车,2,无意义
558,猜火车,1,好垃圾的一部电影，又被骗了，最近被骗了很多次，最讨厌看吸毒了
559,猜火车,2,"5.6没心情看，过于低沉了，莫名其妙
看着周围空荡荡，太可怕了。不喜欢这题材"
560,猜火车,1,原来英国片可以更颓的，超堕落超讨人厌的片
561,猜火车,2,要经历过那个时代的人，看这个电影才有味道，就像是文革电影，对于没有经历过的人看起来只能当是剧情片了。电影的过渡一般般，有点仓促了。
562,猜火车,2,"的确。
我没有爱这不剧爱的要死。
而是郁闷的咬牙。
"
563,猜火车,2,我还是应该诚实，我非常讨厌这部电影。
564,猜火车,2,经典电影 但不合我口味。。
565,猜火车,2,拿猜火车装13的人可真不少
566,猜火车,2,拒绝消沉片。
567,猜火车,2,"我也算看吸毒的看的多了，就没像今天这么反感过，恶心腐臭，引起强烈不适，个人觉得在新时代成长的青年这种电影还是不看的好，尽管它立意有点高，但年代、背景、文化、不是同日而语，同地而语了
真是反胃"
568,猜火车,2,这是“垮掉的一代”吗，还是“后现代”，还是XXX？这不会是欧美小朋友成长的主流吧？跟这种青春完全木有共鸣啊，迷茫是啊，可哪有这么放纵的？英国人的口味有时候真是吃不消啊。还有，它为什么叫《猜火车》？
569,猜火车,2,不可以交友不慎，不然你会像汤米一样死的那么惨。被男主偷性爱录像带→女友分手→被男主引诱吸毒→被感染艾滋→自己死在废屋里。
570,猜火车,2,欣赏不来
571,猜火车,1,开始的场景很难让我投入 没看完就放弃
572,猜火车,2,里面有苏格兰最恶心最肮脏的厕所。
573,猜火车,1,是因为喝酒后世界已不是我的世界的原因吗，这个备受好评的片子我可能是没看懂。
574,猜火车,1,一点都没觉好在哪
575,猜火车,2,非常不喜欢这里面混乱的生活
576,猜火车,2,每个人都会有自己的青春，我的青春，不会活在毒品中！
577,猜火车,2,二星 不够堕落、不够励志、不够感人、朋友之间的羁绊也肤浅。欣赏不了这种小清新装比的发恼骚。唯一可以的是吸毒进入马桶的幻境和戒毒时的高超旋转一镜到底拍摄手法。
578,猜火车,2,十几岁的时候觉得好酷，现在看不下去
579,猜火车,2,"TMD, 我得承认我看不上这些混混，也没怎么看懂"
580,猜火车,2,堕落吸毒少年重获第二春，为马桶下的海洋加一分。
581,猜火车,2,我不明白之前听到的评论是从哪来的根据。
582,猜火车,2,太恶心了，太颓废了，看不下去，不明深意
583,猜火车,2,英国的叛逆青春电影真是走在前头的。只是我这个乖孩子理解不了为了作而作的青春。不过不矫情。
584,猜火车,2,对荒诞一代的电影总是欣赏无能，可能缺乏对时代背景的理解力。
585,猜火车,2,"买的盗版DVD,没看懂"
586,猜火车,1,"选择生活，选择工作，选择职业，选择家庭。选择他妈的一个大电视。 

选择洗衣机，汽车，雷射唱机，电动开罐机。选择健康，低卡里路，低糖。选择固定利率房贷。 

选择起点，选择朋友，选择运动服和皮箱。选择一套他妈的三件套西装。…… 

选择DIY，在一个星期天早上，他妈的搞不清自己是谁。 

选择在沙发上看无聊透顶的节目，往口里塞垃圾食物。 

选择腐朽，由你精子造出取代你的自私小鬼，可以说是最无耻的事了。 

选择你的未来，你的生活。但我干嘛要做？我选择不要生活，我选择其他。理由呢？"
587,猜火车,2,也许是因为情人节独自在家看的缘故我真的不懂他哪里好
588,猜火车,2,反胃 反思
589,猜火车,2,不是很喜欢这种脏兮兮的片子~~
590,猜火车,2,被传颂得惊天地泣鬼神的它，我就是没感觉，可以确定的是，有些人就硬是要说他很叼，至于原因，就不说了。。。
591,猜火车,2,看了一半，实在看不下去了。毒品与青年，自由与犯罪，没有兴趣看完。。。
592,猜火车,2,没看懂……很颓废。
593,猜火车,2,看不下去，太恶心。
594,猜火车,2,"I've tried many times to accept the plot, but never succeed. It makes me sick."
595,猜火车,1,无聊，，，
596,猜火车,2,不喜欢 也许以后重温感觉会不同
597,猜火车,2,我不能理解那个年代那些人物，完全没有代入感。所以我给2星。是我的个人主观感觉，但不能说是片子不好
598,猜火车,2,不知那帮人在干吗==
599,猜火车,1,大二冲着片子的名气去看，但是听英伦摇滚的人真心接受不了这部英国cult片，至于那么颓废吗？离中国青年生活比较远。不过片头的台词还是很经典的。通过这部片子认识了伊万麦格雷戈。
