,movie,star,comment
236,猜火车,3,说实话不是很理解人生的意义需要靠毒品快感来填充这样的感受，从所爱的到所恨的，能激发意义的理由太多了…… 一次次闯入吸毒少年世界的现实感：苏格兰、家庭、法庭、结尾的警察……似乎构成了某种压抑，但强度又不是很够。仅凭开头的一通诡辩不足以说服人吸毒是不是……
237,猜火车,3,有种看成年版skins的感觉，看完以后觉得很闹心，向前看是早晚要做的事情，除非不想在这个世界继续活下去。
238,猜火车,3,从形式到内容都挺别具一格的，一个颓废青年走出堕落青春的故事。观后并无多大感触，若是要论反吸毒教材典范，还是更倾向于《梦之安魂曲》那样的。
239,猜火车,3,青春是地下流动的欲望，地上是主流生活。最后我们都穿上西装打上领带成了中产阶级！
240,猜火车,3,不是我喜欢的类型 毒品之类的电影最无感了  马桶这段真神奇 还有床单大便
241,猜火车,3,说实话，虽然我承认它是部意义深刻的片子，但颓废和边缘的影片还是让我无法很喜欢
242,猜火车,3,是不是加上旁白就会给人一种很文艺的赶脚？不过戒毒那一段拍的真心不错
243,猜火车,3,"这个片子告诉我，一定不要吸毒。 
里面死去孩子的母亲撕心裂肺的哭喊，对任何人都是警醒～"
244,猜火车,3,终于把它给看了，未剪切版挺有意思==我在看的时候脑子里冒出来“后现代”几个字==然后还在想盖里奇的烟枪是不是抄了这个开头==噗
245,猜火车,3,・・・・・・・・想象了很久的一部电影  始终在找一个伟大的时间看  但是最后也没看出哪里好
246,猜火车,3,我很喜欢苏格兰口音，不过不是从这部片子喜欢的
247,猜火车,3,我就知道马桶里肯定隐藏着什么更奇妙的世界。。。
248,猜火车,3,颓废青年 靠福利养起来个懒汉 这是西方社会的一个问题 
249,猜火车,3,厕所捡毒丸那段我直接吐了，床单飞屎那段又差点吐~~~~片中的迪厅让我回想起初中蹦迪的音乐和氛围了。
250,猜火车,3,在《猜火车》中，他们选择了――彻底叛逆！
251,猜火车,3,"我觉得挺恶心的，但有些情节很喜欢。比如，卖电视机那一段。还有，除掉男主外，我很喜欢那个银色头发的人~~~刚百度，发现他就是神奇律师 哇哈哈
"
252,猜火车,3,看过《梦之安魂曲》，再看这个就觉得档次低。
253,猜火车,3,看懂的人不多吧。打这么高分数的原因？
254,猜火车,3,如果你没有喜欢上它，那你就会忘掉它。
255,猜火车,3,还以为是颓废片呢，挺积极向上的呀。开头那段厕所戏实在是……后悔刚吃了东西……
256,猜火车,3,名气很大，但我不太看得懂啊，不知道要表现什么？虽然看电影不一定要求人家表现什么，但也不能仅仅表现一种特异的生活。不知道题目和内容有什么关系？
257,猜火车,3,英音和苏音差别好大哦。伊万年轻时尽演痞子形象啊。那个马桶确实惊艳了。没觉的有多好。丹尼鲍尔作品。
258,猜火车,3,豆瓣标签有“经典”，而且8.6的高分，真没觉得多好，还是不喜欢这种欧式文艺片。
259,猜火车,3,可能有点能体会他当时的迷茫了……
260,猜火车,3,十五年前就能拍得这么不容分说的彪悍
261,猜火车,3,被神化的片子。苏格兰一群吸毒青年垃圾式的生活现状，其冷静的喻讽口吻，贯穿始终的黑色幽默及充满现代感的声画处理。使所以成为另类影片中的经典，也只是其那种英式文艺范儿
262,猜火车,3,我知道它很有名很经典 但是我完全无法和这部片子产生任何共鸣 当做任务一样看完 啥都忘了
263,猜火车,3,由坠落走向希望，但是我是来看绝望的呀
264,猜火车,3,不得不说完全体现了OST里面那些英伦迷幻摇滚的精髓. 一点都不Cult，简直是部纪录片.
265,猜火车,3,原来戒毒那么容易？这电影。。幸亏我是在美好的tc平平安安长大的= =
266,猜火车,3,"此片没有谁对不起谁，背叛了朋友，只要自己想得通就不会背上包袱开始新生活。
但是观众没有，责怪的意思，因为有些背叛是可以原谅的。"
267,猜火车,3,"拍摄风格不错，情节比较散漫，算不上励志片吧。有趣的是导演会通过这片子宣扬自己的喜恶：讨厌获奖烂片，喜欢邦德女郎，讨厌英国统治～ 然后我记得最后那句“looking ahead,the day you die”"
268,猜火车,3,其实设计和背景音乐运用的还是很巧妙的
269,猜火车,3,感觉像是久闻大名的样子，看了，觉得没有想象中的那么惊艳，也许是期望太高，所以觉得失望，也许它的本质是很好的也说不定呢～～～
270,猜火车,3,一部英国黑色幽默的青春文艺片
271,猜火车,3,虽然很多人都说好看　不过我确实觉得没有非看的必要
272,猜火车,3,You can’t stay in here all day dreaming about heroin and Ziggy Pop/Renton:It's Iggy Pop[lust for life.谁说这是励志片我杀谁
273,猜火车,3,2008.4.2 青年的叛逆
274,猜火车,3,结局有点唐突 发音有点奇怪 部分镜头有点限制级  但是以上种种都不影响这部片子的出色        还有 男主角的眼睛很漂亮
275,猜火车,3,"看到最后竟然有点伤感，很多这些年少时的朋友，结局都注定就是outgrow each other吧。“Some childhood playmates turn out to be friends for life. For others, there comes a time when they simply outgrow each other.”"
276,猜火车,3,7.4分。没觉得多冲击，多牛叉，多愤世嫉俗，多酣畅淋漓啊！别迷信所谓经典，丹尼・鲍尔后面的影片精彩更多。相信他还能超越自己！
277,猜火车,3,我擦 我一直在找火车啊 哪尼玛有啊
278,猜火车,3,2014.04.12 有些厌恶。青春可以挥霍放纵但不可以堕落，而这里的青春已经堕落到善恶不分了，会混淆年少观众的视听。所有的元素都是负面的，包括靠背信弃义起家，估计以后也不会好好混。所有要表达的道理都已经台词说出来了，不需要自己去想。看不到醒悟，是留着给观众吗？
279,猜火车,3,自己水平有限 再高的星级看不懂也是白搭
280,猜火车,3,看的有点恶心 ，不是很喜欢。但是喜欢开头和结尾的那段台词。““选择生命，选择工作，选择职业，选择家庭，选择可恶的大彩电，选择洗衣机、汽车、雷射碟机，选择健康、低胆固醇和牙医保险，选择楼宇按揭，选择你的朋友，选择套装、便服和行李，选择分期付款和三件套西装，选择收看无聊的游戏节目，边
281,猜火车,3,"滚你妈蛋的，生活得不好都是自己作的。
到死之前一直向前看怎么了，我不伤害家人，我不背叛朋友，我不让那些爱我的人天天为我担心。
别说什么平淡是福全扯淡，看着自己孩子饿死的惨状就幸福了"
282,猜火车,3,我是真讨厌有垃圾一样生活样式的人，他们先被人丢弃，再被自己丢掉，没有救世主存在在他们的世界的
283,猜火车,3,为什么我不是很喜欢这部片呢?
284,猜火车,3,写实的表现了一群吸毒青年的生活现状，不同的选择导致了他们不同的人生和结果。很独特的拍摄手法，虽然没有预想中的震撼，可能是因为已经过了那叛逆和萌动的年纪？
285,猜火车,3,影片描绘了吸毒青年人颓废精神状态，没怎么看懂
286,猜火车,3,很出名的一部片子，但看前面，不过是几个不良少年的糜烂生活。定位为cult片吧，有几个镜头还是蛮有意思的。影片我觉得有点名副其实了，内容可以也饱受争议。点睛之笔是开头和结尾的两段独白吧；我选择不选择，和我选择生活。可以看做青春的妥协吗？想到的却是那些不顾一切的小混混似乎更能泡到妞……
287,猜火车,3,不太了解他们的心情。。。
288,猜火车,3,没有那么牛啦。开阔度完全败给发条橙
289,猜火车,3,那个马桶里的世界.....蛮有创意的 不过恶心了......
290,猜火车,3,这部片子的精华之处，在开场第一句内心独白中已表露无疑
291,猜火车,3,"Choose life. Choose a job. Choose a starter home. Choose dental insurance, leisure wear and matching luggage. Choose your future. But why would anyone want to do a thing like that?"
292,猜火车,3,太过于被推崇的电影，看完我只记得那全世界最脏的厕所。
293,猜火车,3,这个电影将吸毒之后那种抽象的感觉用视觉实体化了，很震撼
294,猜火车,3,基本上是快进看完的，有些闷。或许以后会复习，难说：）
295,猜火车,3,说实话，看不太懂。很阴暗的电影啊！
296,猜火车,3,非常不喜欢。不过表现方式不错，比如爬在天花板上的头旋转360度的婴儿。
297,猜火车,3,最可笑的是豆瓣上一群被中国高考挤压的毫无青春的乖学生们都去装逼兮兮地缅怀猜火车里的青春，拼命地找共鸣，还有比这更扯的事情吗。三星献给男神Ewan
298,猜火车,3,没有传说中的精彩，还可以再表现的极致些。
299,猜火车,3, 所有名词之前都有一个fucking听起来真的很过瘾，开始被片头的独白吸引：“我选择不选择”，可最后Mark还是选择了。遨游在马桶海洋里还是走向未来，回答不能确定，每个人的答案都不同，生命不可复制，选择自己这一秒想选的就可以了。
300,猜火车,3,毕业一年时怀着虔诚的心去看这部被神传的电影，但是我已经不记得了情节了。只记得是一群混混过着醉生梦死的生活，然后某一个人因为吸毒死了，给主角带来触动，主角从此大彻大悟，过上正常人的生活。是讽刺青春期终会过去，叛逆的时光很短暂，最后仍不能免俗吧。人生，就是如此。
301,猜火车,3,看的有点坚持不下去。分了三次才看完，没觉得有那么的好，他们的思维方式我还是理解不来把
302,猜火车,3,可能我不嗑药理解不了吧。。。
303,猜火车,3,"姐姐最喜欢的一部电影。
但我似乎没看懂"
304,猜火车,3,其实还可以，我以前sb了 妄加评论。我觉得与青春无关
305,猜火车,3,好吧不懂那个背景还是别看算了……
306,猜火车,3,不喜欢这类电影 很恐怖 很黑暗 看到海报任然心悸
307,猜火车,3,Looking ahead the day you die台词有感，没有惊艳的感觉，不对我胃口，不知道是不是那厕所太恶心了，鉴定完毕o(s□t)o
308,猜火车,3,迷茫滴~寂寞滴~堕落滴~青春呐！曲折后有所选择，回归朝九晚五的正常人生。
309,猜火车,3,所以想要开始一段健康全新的人生，是一定要摒弃以前的狐朋狗友啊。没有新环境，没有新生活；没有新朋友，没有新生活。只是我们往往是长大了之后，才知道谁是好朋友谁是坏朋友。
310,猜火车,3,我去买碟的时候被它的封面X到了
311,猜火车,3,为我是一个中国孩子感到庆幸，真没那么多叛逆的经历，所以对这个片子没大感觉，才疏学浅 才疏学浅……
312,猜火车,3,片中的生活就跟被嫌弃的松子的一生一样，毫无共鸣
313,猜火车,3,2012.3.4：黑色，超级写实；有个性的年轻人，要么被生活遗弃，要么归于平庸的生活；外界评价很高，但我看来一般。
314,猜火车,3,f，]大看出∏楹迷谀模只是很喜g片子放的R^L格
315,猜火车,3,面对选择总这样的无奈。当初的选择未必就是现在想要的选择。随着成长，选择在不停改变。
316,猜火车,3,仅仅觉得里面的brit pop不错
317,猜火车,3,我觉得还好吧，或许是我没有什么文艺的灵魂，整个片子实在让人看的有点难受，马桶，死婴，等等…
318,猜火车,3,英国的文艺青年们，在萎靡腐烂的抗拒中庸拒绝平凡后开始向往正常普通的朝九晚五的生活。一类人的颓废青春方式吧，不过我很不能接受，所以不明白为什么这部电影会有8.6的高分。此外，这部电影还是一本吸毒的百科全书，直截了当丝毫不掩饰的教会你各种吸毒方式，不过这部神一样的电影还是让我有点失望
319,猜火车,3,先看的昆汀的东西，先入为主了
320,猜火车,3,很绚丽的电影，可惜不是我的茶
321,猜火车,3,说实话。。。没想象中那么精彩，比较失望
322,猜火车,3,房子，车子，孩子，这些一开始被鄙视的东西，却成了马克背叛所谓的兄弟们的原因。瘾君子时候对一切不屑一顾的马克是真的错了吗？戒毒后为了所谓正常生活出人头地去背叛兄弟的马克又真的对吗？世上哪有什么对错…不过影片只展现了另一种生活的极端。每个人的志向不同，做自己想做的事情就好了。马桶漫游和戒毒幻想也是挺奇幻，恶心惊悚肾上腺飙升。腾讯视频没有躺铁轨那段，真的很讨厌。
323,猜火车,3,只有两个场景印象深刻，没那么好。
324,猜火车,3,这片子，我真不懂为何评价这么高，大概是我还没有堕落、糜烂到那个程度，无法了解？
325,猜火车,3,"断断续续铐，前面好多都好无感。不过最尾噶叛变行为，自己睇完都觉得好有快感。
好多时候的确都系会盍兀系心底入面否认自己系坏人，但总系做完一件坏事之后先同自己讲自己开始要做好人了。"
326,猜火车,3,...不适合我这类没品味的人看，看了也使浪费时间。
327,猜火车,3,得奖的片子，我大概都是看不懂的，没有什么艺术细胞！
328,猜火车,3,看得时候挺过瘾的...马桶那一幕very fascinating...但真的受不了那暴力男....
329,猜火车,3,多年以前会多给一颗星
330,猜火车,3,感觉好多英国电影尤其是苏格兰腔英语的，都讲吸毒、混乱生活、老损友阔别重逢。不知大家为何都喜欢本片，一定和结尾主角的抉择，以及这与开头的呼应，还有这呼应背后的荒诞有关。我对这一切却没有什么共鸣。
331,猜火车,3,"整个片子能看到《同屋三分惊》的影子，跟Danny Boyle最近几年的励志风格很不一样。这部电影再加上Skins，英国青少年真尼玛过的迷幻。
"
332,猜火车,3,看不太懂说实话・・・・・・・・还有Mark居然是伊万麦克格雷格演的  我真是脸盲啊  但这电影真心欣赏不了啊 也许是没用共鸣的原因？
333,猜火车,3,我果然是个适应社会的成年人了。
334,猜火车,3,大致解释了为什么我们会在爱丁堡被翻包而白花花的400磅没有被偷――人蠢。如果说青春的开始就懂得要圆润与妥协，拿刀子的会说你没有青春，不好意思，我笑了。
335,猜火车,3,毒也，害也
336,猜火车,3,还是选择那段狠
337,猜火车,3,少年太空虚太腐朽，选择在街头颓废，烂醉加迷离。紊乱的生活变成意识流，朝九晚五是天方夜谭，他们颠三倒四。麻药酒精还是natural high，谁来做个主？没弄懂情节，却领会了“零余者”和“世纪末情调”。否定自我，虚掷青春，去他妈的真理。反正文艺青年都是落魄。让人看得心烦的电影。
338,猜火车,3,好吧我还是喜欢两杆大烟枪。。。等等也没可比性
339,猜火车,3,真是过誉，哪有梦之安魂曲好
340,猜火车,3,对于这种现象级的影片我一般不太感冒，无非是表现了一直被忽略的群体和他们荒诞的生活。并不能因为题材的开拓就值得鼓掌，就像中国文学并不是写了底层就该获奖。男主被父母接回家抱上床说明妈宝是废柴。然后猪队友毁一生。暴躁、懦弱、滥交、吸毒，如果导演就是要告诉观众这些是恶心的，好吧，你赢了。
341,猜火车,3,结局救了这电影，其余不想多说话。
342,猜火车,3,当我们在叫嚣个性挥霍年华的时候，问问自己is that what you really want?空虚是堕落的根源。伊万戒毒在床上挣扎那一段演得太好了。神奇的厕所，任何爬行的活物都很吓人。最好的时光都是用来辜负的。被辜负的价值就是让我们熟谙那些曾唾弃的大道理，痛彻心扉，真的成长。
343,猜火车,3,看到很多影评在讨论影片的名字“猜火车”。记得小时候夏日的傍晚，父母还有爷爷都会牵着我的手走到铁路边散步，火车飞驰带来凉爽的风，他们会让我数火车有几节车厢，猜下一辆火车车厢是双数或者单数。
344,猜火车,3,大叔也有这么正的时候，装逼这事儿先放一放
345,猜火车,3,没有想象的那么好，也许我早已过了叛逆的年龄。不过，片中的音乐都超喜欢。
346,猜火车,3,年轻时，谁没放纵过，关键是能不能及时收回来，想我高中那会天天通宵的日子。。。
347,猜火车,3,颓废挥霍的青春，最震惊的那个孩子死的方式状态，这TMD什么价值观。
348,猜火车,3,嗑药、毒品难道就是嬉皮士文化的核心了？好糜烂的青春！
349,猜火车,3,真心不喜欢这电影的调调，有点点无聊
350,猜火车,3,是一部很**的电影 好吧我也不知道怎么形容
351,猜火车,3,看完后的感觉被吹捧的过了些，颓废式的垃圾生活完完全全就是瘾君子的生活，没有太多共鸣的东西，毕竟我连烟都不碰的人..伊万的表演相当棒，马桶那段异常惊艳。
352,猜火车,3,也许是我看不懂。。。
353,猜火车,3,我也年轻过，但是好像完全忘了曾经的叛逆，现在在看这些。。我完全懂不起来。。
354,猜火车,3,真是磕high了，好迷幻颓废生无可恋。和filth一个作者但不太能get这部，看简介我好像对第二部更感兴趣。伊万和米勒青葱水嫩prprpr以及马桶畅游那里大开眼界。
355,猜火车,3,能理解那N多人喜gEwan McGregor的原因了！
356,猜火车,3,但年看过乌七八糟的版本，没感觉，不知道重看会不会好些。
357,猜火车,3,所以典型北爱口音是这样的，那女孩第二天穿着校服做鬼脸实在太有灵气嘞... 从小就是乖小孩的我看得很憋屈，一定要这样子过人生吗？    还好男主有醒悟
358,猜火车,3,"好吧。。我又看的删节版。。。你妹的姐们成年了好吗。。
你必须改变。"
359,猜火车,3,人活在世上有被需要的欲望，就是贡献奉献之类的，偶目前无所事事。下面是影片开头的大段词，同时对于吸毒持反对意见。（“选择生活，选择工作，选择职业，选择家庭。选择他妈的一个大电视。选择洗衣机，汽车，雷射唱机，电动开罐机。选择健康，低卡里路，低糖。选择固定利率房贷。选择起点，选择朋友，选择运动服和皮箱。选择一套他妈的三件套西装。……选择DIY，在一个星期天早上，他妈的搞不清自己是谁。选择在沙发上看无聊透顶的节目，往口里塞垃圾食物。选择腐朽，由你精子造出取代你的自私小鬼，可以说是最无耻的事了。选择你的未来，你的生
360,猜火车,3,垮掉的经典，我是没共鸣
361,猜火车,3,很青春很实验很看不懂
362,猜火车,3,我在中午吃饭的时候看了这个电影。。。
363,猜火车,3,略无聊我看不进去，大概闲的无聊还会找来再试看看
364,猜火车,3,"Maybe we're victims of fate,Remember when we'd celebrate.We'd drink and get high until late,And now we're all alone"
365,猜火车,3,这部片子告诉我们，所谓的朋友，所谓的爱情，所谓的社会，都是不可靠的 可靠的只有你自己，对了，还有钱，海洛因
366,猜火车,3,马桶一段挺特别。瘾君子的电影，没什么多少感触。开头一段不错。
367,猜火车,3,都说很经典。。。还是道行不够。。。没看出什么来。。。对开篇马桶寻药那段记忆深刻~
368,猜火车,3,Cult的涵义
369,猜火车,3,不适合我的口味，苏格兰英语也听不懂，没认真看。但是Ewan真是穿得太性感了！
370,猜火车,3,请写影评的孩子们，不要那么多P话，你们还没有资格评论！
371,猜火车,3,小文艺小装逼~Ewan还是很可爱的~
372,猜火车,3,★★★☆ (2005-03-04) 很多超现实主义表现手法很强悍，但我实在不喜欢这种残酷青春的。
373,猜火车,3,我不该看这部电影
374,猜火车,3,"the whole thing's not that impressive to me, except for the transpotting scene, really hit, and that SHITE did impress me. good movie"
375,猜火车,3,"被传得如何如何好的一部片子,感觉挺一般,渣子青年们的颓废人生和浪子回头,不过回头付出了一些代价.与毒品相关的片子印象深刻的是梦之安魂曲,或许以吸毒者回头为结尾的影片不如毒瘾者彻底毁灭更震撼吧?"
376,猜火车,3,谁都年轻过，谁都将老去。
377,猜火车,3,三星半啦。让我看到一种从未经历过的生活。 
378,猜火车,3,就喜欢里面的那个英国女生
379,猜火车,3,看了一半看不下去了。
380,猜火车,3,糜烂的像垮掉的一代。。。有段音乐不错
381,猜火车,3,"Mark以花样游泳般的入水方式义无反顾钻进全苏格兰最脏的厕所里最恶心的自己刚刚大便完的马桶里面，就像游进了广袤纯净的大海一般，拼命游啊游，最终拿回了两粒闪闪发光的之前被塞进自己直肠的胶囊毒品，那么惬意，那么有成就感。
远离毒品远离狐朋狗友爱祖国爱生活。"
382,猜火车,3,"有人说这是任何一个年轻人的成长轨迹，从最初的怀疑一切推翻一切的严肃“左派”，进化为接受一切认可一切的终结的温和“右派”，这就是生活的选择。
     "
383,猜火车,3,"没有共鸣 Spud最后是怎么找到Mark留下的钱的？
从出生起就获得了稳定的生活 电视 保险 洗衣机 西装三件套 等等，于是满足于此，也挺好的。选择与不选择 还是选择"
384,猜火车,3,戒毒教育片，大量打针嗑药的镜头让人头皮发麻。
385,猜火车,3,同一件事物上能发现“自由、叛逆、欲望、泛滥的爱”和“社会、阴郁、自私、节制的爱”，双方辩证统一。无论怎么选，人都不是纯粹的。橙黄绿的渐入佳境，红色的毒品警告色，蓝色的现实警告色。低角度的各种用法
386,猜火车,3,我们都得来一次这么放浪肆意迷幻空虚的青春。
387,猜火车,3,另一面青春电影，我只能用意象这词来形容我对此片的感受。
388,猜火车,3,被神化的一部电影，并不是我喜欢的
389,猜火车,3,关于嗑药的片子，都不会引起我的好感，固然扣一分。
390,猜火车,3,觉得对我这种21世纪的中国听话少女没什么触动。我要黑色，但没有幽默。
391,猜火车,3,没看懂呢 豆瓣上装B的影评也懒得看
392,猜火车,3,话说这类文学色彩特别浓的我总是看起来没激情，虽然影片里现在社会上的激情比比皆是。影片有那些幽默风趣在里面使其在观赏中不至于特别的无聊。按说，在现在看来，尤其是北京朝阳警方，是年轻小伙儿洗白的最佳诠释了！都说背景音乐不错，马克了两首。属于早年2U团队风格的，我很喜欢！
393,猜火车,3,我没吸毒，不颓废，也无法理解
394,猜火车,3,青春的意义就是一种虚掷，一种否定;而圆熟的过程是一种务实，一种修正。
395,猜火车,3,不失为一个不错的选择模式，适合的人才堪承受。
396,猜火车,3,英伦迷幻剂。。。。那么抱着信念去生活就可以了！
397,猜火车,3,"猜火车

导演: 丹尼 博伊尔 (Danny Boyle)
主演: Ewan McGregor / Ewen Bremner / Jonny Lee Miller

上映年度: 1996
语言: 英语
制片国家/地区: 英国
imdb链接: tt0117951

"
398,猜火车,3,无法装B打四星，厕所有点意思，原来一直因为这个桥段不想看这个片，另苏格兰口音有的地方真土啊。。。
399,猜火车,3,没怎么看懂~太现代了吧~
400,猜火车,1,不知所^的青春。
401,猜火车,2,"Trainspotting不是猜火车的意思，而是一句俚语，意思是寻找胳膊上的血管以注射毒品。
片子的英国口音很重
PUNK+迷幻+摇滚
很颓废，结局算积极向上点吧"
402,猜火车,2,不喜欢这种风格！
403,猜火车,1,这装b装的好让人恶心 被吹得天上去了 不过是一群颓废的二逼故事 还不如香港黑社会故事呢 去挖掘其中那不知所云的深意纯属吃饱了撑着 青春过成这样还不如给狗吃了 这样的价值观都被吹捧活该大英帝国没落在这一代人手里
404,猜火车,2,没感觉，无共鸣，进入状态或许能看得很嗨很感触，不过我也就只是在门外观望而已。总感觉里面对致幻剂的表现太表面了，剪辑太炫，丹尼・鲍尔当年该有多狂放，以至于后面的剧情都没理清楚，只知道有几个无良青年在过着颓废的生活，而最后红起来的只有一万一人而已
405,猜火车,2,这种充斥着shit和drug的青年文化，我是不懂有什么好看的。
406,猜火车,1,麻痹，就是这部电影，曾让我恶心到无法言语的就是这部电影，抱歉当年除了恶心真看不到其他了
