,movie,star,comment
233,色，戒,3,我已经没法判断这个故事到底好不好，如果它不是被炒得这么火的话。
234,色，戒,3,关键字里面怎么也要有汤唯才够厚道吧，不错的演员，招谁了？！
235,色，戒,3, Nalin Pan拍过一个片子也叫＜色戒＞，相比而言李安的色戒应该叫＜戒色＞更合适．评价还行，完全是因为里面的色戏，其他的剧情挺阳痿的．
236,色，戒,3,从家父的U盘里找到的..无删节版 慌兮兮得快进看完的 好想要大钻戒呀
237,色，戒,3,"更喜欢原著....虽然是影帝梁朝伟,虽然汤也是个大美女,但总觉得还是着重了 色 ,却还憋着想 戒....."
238,色，戒,3,其实，给到3分只是某人某阵子总跟我说这玩意多么多么唯美多么多么……（我急不得她用的词了），还非要送我碟子。
239,色，戒,3,几段大尺度床戏毫无必要，也让电影变了质，令人一提起色戒就谈虎色变，仿佛这不是一部剧情片，而是一部三级片，大一看张爱玲原著的时候就不是很有感觉，拍出来的效果也差强人意。
240,色，戒,3,不喜欢。参见宁财神论点：http://blog.sina.com.cn/s/blog_591993d001007vl3.html
241,色，戒,3,还不错，谁说汤唯演技不好的。汤唯横空出世后，我像谁，这个问题算是找着答案了
242,色，戒,3,我在雁荡山宾馆CCTV-电影里看到汤唯的时候，她还是个名不见经传的小演员，演一个倔强不服输的女警。转眼间我坐在黑漆漆的电影院里，她已经成为了和梁朝伟SM，和王立宏kiss，穿低胸走红地毯，学大牌那样笑的安女郎了。很莫名的一部片子，不删减说不定还好一点儿。张爱玲看了要吐的吧。
243,色，戒,3,《色，戒》提供了李安版本的“去革命化”⑹拢菏紫龋它是一“革命者o情，h奸有情”的反D故事；其次，在性e的用妫作品⒏锩c男嗤，革命行幽艘阅行ε性的性eA加以展F，同r@也是集w主xZθ诵缘哪的@F――（弱的）男性由於掌控了革命的Z啵可以硬地安排（的）女性的\命。@油葡氯ィ王佳芝放走易先生的行椋反倒成了被任意[训呐性δ唷―同r也是人私情集w主x的反抗。c其f影片表F出“人性的}s”，不如f更表彰了作者於革命Z的不信任、抵制乃至嘲弄。2019年8月5日夜―6日凌晨於海甸u家庭影院。
244,色，戒,3,我不觉得他明白了该怎么表现这两种人物的差别，更不明白那些场惊心动魄的SEX SCENE有必要那么长时间吗，汗
245,色，戒,3,影片制作精良，摄影娴熟老道，沉稳大气，但个别大头贴特写镜头令人眩晕。这点很奇怪，摄影的优劣居然出现在同一部电影中。影片整体风格偏软，这正是李安的标签。故事无趣，剧情拖沓，表演方面整体较差，倒是个别配角出彩。裸露镜头过多，尺度太大，倒成了影片的噱头，成了不折不扣的色情片，令人厌恶。
246,色，戒,3,郁闷就郁闷在没少付电影票钱，却少看n0分钟正戏，4星留给完全版...
247,色，戒,3,"只看到李安的精细，温情还留在断臂山.
bytheway:床戏拍的太好了…：P
"
248,色，戒,3,纠结，或许是我还没看明白，所以这只是我的第一印象。并没有我想象那么震撼，说实话各种语言上的表现的刻画不多，却利用演员精湛的演技给了人不少情感上的猜测。也可能是力宏的歌手形象太过深刻，让我觉得他的演出很别扭。经典之作，但我就觉得缺一个理由抬高到4星
249,色，戒,3,如果没有太多暴露的镜头，或许能更被客观评价。
250,色，戒,3,为梁朝伟的演技给三星。李安明明就是想拍个毛片吧，还强行套个生硬的剧情。。。汤唯这种无相貌无身材无演技的三无女演员搞不懂为什么这么多脑残粉。还不如让苍老师演，活儿还好
251,色，戒,3,2018.9.13又看了一遍。个人还是不太喜欢这样的电影。里面只要王力宏一出现，我就出戏……不晓得当初让他来演这个角色（戏份也不少啊），是出于票房考虑，还是被人硬塞进来的……幸好王过家庭生活去了……
252,色，戒,3,剧情还行，但当年看了很快就忘了...激情戏完全可以不用这么拍，隔着屏幕都能闻到臭味，因为――汤唯实在太丑了...
253,色，戒,3,李安π缘南胂窳μ差了，]人f有多大成份是抄本能的么??我牟徽J槔畎捕女人，如果J槔畎蔡懂女人了，那只是女人在假的意R形B里生存太久了，我J檫@e充M了意R中ε性的gШ臀勖铩Ｎ乙舱J槔畎簿褪略有人文素B，并把素B作槠嬗^的匠人。
254,色，戒,3,画面好看，音乐等辅助工具也都不错。以我的封建标准，后面确实是过于暴露了。汤MM和梁的演技都没的说。但是，其他隐晦的，我看不出来。力宏TX真心花瓶。虽然是卧底片的题材，但是和看风声那种红色很重催人泪下的悲壮感不懂。这里看到的，是虽然作为卧底，但仍为凡人的俗世纠葛。换言之，生活中的革命者
255,色，戒,3,一个女人为何不能好好爱 时代禁锢了 时局禁锢了 自己也禁锢了 所以虐来虐去的~
256,色，戒,3,"再不动手就开学了！假清高点说，即使是未删节版这片看着也不太情色。家山呀北望,泪呀泪满襟,小妹妹想郎直到今,郎呀患难之交恩爱深……"
257,色，戒,3,其实李安是想告诉人们：女人爱钻戒。这才是电影的主旨
258,色，戒,3,演员太烂了，仅仅靠男女主角的表现是不足以表现李安的意图的
259,色，戒,3,那几个国语说不清楚的家伙简直让人忍无可忍！！由学生而特务的转变没有好好交代，很突兀。。。
260,色，戒,3,除了艺术的镜头，真挚但是无奈的爱情，什么都没有，王力宏演戏太屎了
261,色，戒,3,拍得挺考究，炒得挺火，看得挺犯困，删得挺无耻（正宇琼天） 
262,色，戒,3,"好好的帅哥,变成这样...不忍看完,在40%左右CUT了,抖...恐怖"
263,色，戒,3,没什么想说的。汤唯和王力宏，实在是让人喜欢不起来。
264,色，戒,3,多年后重看，还是未删减版，仍然觉得毫无味道，说爱情会玷污那个纯洁的字眼，讲政治、人性恐怕又达不到敲击人心的深度，作为噱头的几场肉搏戏全是痛苦和身不由己，感受到了演员的辛苦，但对观影者来说也不是什么愉快的好经历，除了油画质地的画面以及汤唯的旗袍外，没有什么值得成为经典的东西了
265,色，戒,3,李安拍出了张爱玲，但没拍出李安。 看了未删剪版。。。无语
266,色，戒,3,梁朝伟好变态 把汤唯干翻了（吐槽啊 结局不应该是这样 梁朝伟应该死在汤唯的怀抱才对 好吧 我是在替汤唯惋惜 还有她那几个丧命的同党）
267,色，戒,3,当作历史片看，太肤浅；当作文艺片看，太苍白；当作剧情片看，太简单；当作三级片看，露得太少…… 不错，李安拍得其实是悬疑片！
268,色，戒,3,民国是我国历史上最暴力最色情的朝代，大概可以如此想象。。
269,色，戒,3,李安其实没必要放那么多激情戏在里面啊
270,色，戒,3,    爱情动作  谍战片、
271,色，戒,3,会时不时的回到开始，不会是因为下到99.2%的原因吧；[色.戒.完整未删版].Lust.Caution.2007.BD.MicroHD-mFANs.mkv 1.47G 1326K  1440*816
272,色，戒,3,『禁片』《苦恋》《鸽子树》《蓝风筝》《活着》《冬春的日子》《黄金鱼》《北京杂种》《儿子》《悬恋》《极度寒冷》《爸爸》《东宫西宫》《飞呀飞》《迷岸》《邮差》《小武》《赵先生》《都市天堂》《苏州河》《鬼子来了》《男男女女》《小说》《动词变位》《色戒》。
273,色，戒,3,没觉得多好，王力宏那普通话真高明
274,色，戒,3,看的时候睡着了。我想我是很没有文艺细胞的那种人，无论节奏还是画面都让我昏昏欲睡……
275,色，戒,3,只看过后半集，却没兴趣翻来看个全部。电影里说，男人往往更理性，而女人总会被感情左右...然后发现，我是纯爷们..结论不错
276,色，戒,3,我看着片明显的目的不纯。
277,色，戒,3,民国场景还原的很精致，情爱场面很虐，把主角内心的变化和情绪都带出来了，情节结局都符合那个年代残酷的环境，就是我觉得这故事没多大意思
278,色，戒,3,张奶奶的原稿那么薄~电影其实也很单薄~
279,色，戒,3,王佳芝不是被一个大到夸张的宝石戒指击败的，她是被自己，给打败了。
280,色，戒,3,  初是以床虺醋鞯模好奇的去看，Y果既]有看到所^的床颍ㄒ榭吹氖h版）故事情也很一般……
281,色，戒,3,四年大学上完了，终于把四年前这部电影的未删节部分看了，主要是四年前看过删节部分之后就懈怠了……和原著最大的差异就是男主角，梁朝伟太帅了！是个女人就得沦陷啊！原著男主角又矮又丑的好不好！
282,色，戒,3,这个片的优劣我没法评价，但它是一部可看性很强的电影，因为这是一部非常非常变态的电影。李安毕竟是个大师，内心世界深不可测，
283,色，戒,3,叙事平稳，突转都放入隐而不发，还是很不错的
284,色，戒,3,"#观影手记# 1568 3.5 愉悦的欢爱,晃眼的钻石,恍惚间她以为看到爱。号召刺杀汪伪政府官员时慷慨激昂高喊 饮刀成一快，不负少年头 啊哈哈哈！"
285,色，戒,3,看了解析我才懂得她的爱
286,色，戒,3,"我以为我这辈子都不会看这部电影。看恐怖片我也没这么躲着脸捂着眼啊。如果不是这个噱头电影的故事应该也不错,但是就太平凡了没票房。那颗鸽子蛋钻石着实闪到我眼了。| 刚看了一篇影评，此片不简单啊不简单"
287,色，戒,3,呃，其实蛮无聊的，不知道为什么梁朝伟突然就会那么暴虐，也不是很明白汤唯为什么最后一刻会放弃。钻戒就有那么大魅力？其实我最想说的是男人真TM没用！这部电影是这个意思吧。。。
288,色，戒,3,蛮好的一个故事，仅此而已。
289,色，戒,3,表现的重点确实是床戏
290,色，戒,3,"完全没必要的很多场床戏     
  
        好久以后才知道  也许、大概、可能  我看的是没删减的。。。zqq  dvd"
291,色，戒,3,7.5，一个姑娘提醒了我，这个其实是个类型片，这样看来，其实是个很精细的类型片 
292,色，戒,3,好多隐喻和晦涩。要是王家卫拍这个片子，我估计会看到一半就开始玩手机吧...
293,色，戒,3,我看了月满轩尼诗，又看了晚秋，昨天看了色戒，然后我为什么觉得汤唯演技其实也就一般呢。。。。另外我要是王佳芝，我肯定不会救易先生，易先生他就是个变态好吗，送颗钻戒就沦陷了吗！典型斯德哥尔摩症候群！
294,色，戒,3,尺度很大，但却完全没有为脱而脱，汤唯很放得开很敬业，床戏拍得十分唯美没有任何色情的成分在，整部戏超乎想象的好。唯一不足的地方大概是王力宏的演技，不过大多数时候快进了，也不影响
295,色，戒,3,一部片可能成就一个演员也可能毁了一个演员。。。何必呢。。。
296,色，戒,3,张爱玲的小说我没有看过，但是从电影中我感觉她的小说是很难懂的，尤其是人物的性格，只能用怪异来形容。用常人的眼光很难理解，不幸的是我自己是个常人，所以我无法理解电影。“易先生的身边突然闯入了一个女人，身为特工总管的易先生居然不闻不问？不管怎样，拍的不错，但是说男女主角演的如何出彩，我觉得和我的预期有些远。还有，建议大家看看《黑皮书》，故事有异曲同工之处，但是那种震撼力我在这部片子里没有看出来。另外，让观众发笑的台词很多。
297,色，戒,3,“她最后对他的感情强烈到是什么感情都不相干了，只是有感情”斯德哥尔摩症侯群 and that`s what I`m talking about~
298,色，戒,3,王力宏的大背头让我印象深刻~唔哇~~
299,色，戒,3,有王力宏才看的，不过貌似演技没有《恋爱通告》好
300,色，戒,3,李安，不要让这么符号式的名字变成仅是符号那么空洞。
301,色，戒,3,挺久前看的了。。。现在一些细节都忘了
302,色，戒,3,浓厚的中华旗袍气息，地下党的悲哀，洗脑时女间谍忘记被切断爱情这根线…爱情面前，革命事业不过如此，不堪一击
303,色，戒,3,欺诈的碎片与惊心的情感。“不但要往我的身体里钻，还要像像蛇一样的往我心里面越钻越深。”
304,色，戒,3,比 L'Amant 差了一大截，除了梁朝伟。
305,色，戒,3,3星半。接近两个半小时讲一个特务刺杀以及爱上刺杀对象的故事，略显拖沓，况且没有出彩之处。懵懂的书生一心救国，到头来却是意气用事，似乎是想传达书生误国，最后大学生死了，易先生却还活着，明明在香港就有机会，终究还是年轻。床戏应该是华语电影少有的大胆暴露。
306,色，戒,3,梁朝伟好敬业啊～～连OOXX时都那么严肃～
307,色，戒,3,色易戒，情难守。但无论如何，李安比起张爱玲，是温情的。他至少安排了易先生对王佳芝动情的细节，让王佳芝最后的沦陷可悲得还不那么彻底。
308,色，戒,3,ur在三星c四星之g。看^『意』，演技L情fN，唯和_比，是小菜一碟。梁朝]有外界f得那么不堪，我倒X得他在e面演得不e。∏榈脑，]什么好f，老早⊥噶耍所以]多大@喜了。王力宏的演技呀，真是人汗！
309,色，戒,3,为啥王佳芝喝过东西以后要留口红印？
310,色，戒,3,"汤唯演得再好些,眼神与表情再勾人摄魄些就好了"
311,色，戒,3,李安是很细腻的。但这个片没有给我带来什么东西。
312,色，戒,3,其实汤唯问王力宏，三年前你可以的，为什么不？搁到今天王应该羞社滴回答：因为李云迪。
313,色，戒,3,在电影院看的删减版，如果看的是未删减版，应该可以再加一星。
314,色，戒,3,男人因为女人的肉色，女人因为钻戒房屋这些物质的束缚，谁都在时代里挣扎，却也被这茫茫世界折腾的遍体鳞伤
315,色，戒,3,"豆瓣还有这条目啊?啧啧,好开放什么的."
316,色，戒,3,梁朝伟这个特务真是狠毒，那帮奋青也真够傻的，没有想再看第二遍的感觉
317,色，戒,3,剧本不错，女主的那些小动作挺像那么回事的，但总觉得这大环境不太对头
318,色，戒,3,这部某人也看过~~
319,色，戒,3,一对大学生无聊寂寞空虚的暑期社会实践及其后续~~
320,色，戒,3,必须无删节版 呵呵后。
321,色，戒,3,张爱玲... 类似的确实仅此一部~并不打算再涉及。。。不是我的胃口
322,色，戒,3,哦哦哦！我看了完整班的～：）没感觉。实话。不象A片的装B电影。
323,色，戒,3,画面柔丽细腻（上海极美）、情节张弛有度。汤唯大气淡定天然呆、梁朝伟后半程演技爆发、王力宏虽是败笔但有很大进步、陈冲何赛飞等老戏骨增色。不过汤的上海话、梁王二人的普通话真吓人啊！要是结局在梁逃走、街道封锁时戛然而止就更好了！
324,色，戒,3,冲那啥啥啥去看的    结果给姐儿删了 = = 
325,色，戒,3,我是真为了看无删剪才看的第二遍，而且主要是快进。但是感觉的确不错。PS：汤唯身材不是很喜欢= =
326,色，戒,3,作为一个俗人，我只能表示无法理解祸水的红颜为何满脸悲壮，粗浅的觉得是初夜记下的仇和斯德哥尔摩症。汤唯的表情很特别，但是看了《晚秋》就知道，她真是永远都那个表情……
327,色，戒,3,在电影院看的删节版。。。
328,色，戒,3,我始终不知道这是在搞什么
329,色，戒,3,不喜欢李安不喜欢汤唯不喜欢梁朝伟 冲着床戏去的 凭借我看情色片这么多年的经验 有几段床戏绝壁真的 
330,色，戒,3,其看^好久了，祗是一直忘了俗。
331,色，戒,3,除了为人津津乐道的几场活色生香的情欲戏，全剧还是展示了李安的深厚功力。把几千字的小说拍成这么一部大戏，很多细节的刻画都意味深长，不错了。
332,色，戒,3,其实我不明白色情部分的比重为何要那样多，还有我还疑惑了半天梁朝伟这个年纪还能把腿盘成那样？
333,色，戒,3,汤唯姐姐浑身 上 下 都是戏
334,色，戒,3,两年分了三次终于看完了。情色镜头是华语电影中尺度最大的。又是在战争的背景下的爱情，和出人意料的结局。
335,色，戒,3,一个“色”字加一个“戒”字就已经完胜157分钟的故事。
336,色，戒,3,感觉情有，但色过分，虽然本来就是情色电影。。。张爱玲的小说
337,色，戒,3,说复杂也复杂说简单也简单的一部片子，后来被禁，当初剧本立案时干什么去了，你说那是几个爱国学生还是乌合之众，显然他们的所作所为也并非光明磊落，王佳芝不是个好演员，入戏过深太享受这一切了，一场游戏动情愚蠢，跟影片一样，没有谁对谁错，只看你怎么去想了，汤唯在里面很动人！
338,色，戒,3,多年来第一次进影院看电影，期待已久，却惆怅而出。上海的电影，还是要让上海人拍，比如WKW
339,色，戒,3,真是可笑，如果没有那个鸽子蛋的戒指，光有床戏谁会救你。
340,色，戒,3,以前看过的吧。不知道为何，对李安的片子不怎么感冒。他的片子确实十分的工整、故事清晰，甚至后来一些电影很多画面也很唯美和细节――可就是欠缺了什么。可能是一种力量与火焰97吧。
341,色，戒,3,影片证明国民党的特务不行啊，一时精虫上脑，几年谋划的刺杀任务就这样前功尽弃。自己也搭上了性命，死有余辜。可惜了其他仁人志士。李安三观有问题。
342,色，戒,3,如果没有那段“梁朝伟打真军”做噱头，就只不过是张爱玲其中一部小说的电影翻拍而已。
343,色，戒,3,我看的完整版啊・・・可到底哪个叫回形针啊・・・
344,色，戒,3,觉得王力宏那个角色实在是太......
345,色，戒,3,在苦难人生面前，比起王家卫深深保藏的一脉温暖，李安还是过于残忍，冷且狠。他的大多数电影可以赞叹，可以敬仰，但惟独不可以热爱。德版蓝光。三星半。
346,色，戒,3,谁是谁的猎物，谁是谁的深情，谁毁灭了谁，谁上了谁的当，谁沉沦谁的游戏，谁忘记了自己。。乱世或者盛世，大家都很理智的寂寞，也很理智的放纵，彼此伤痕累累，一起堕落。。不过你是个女人，我是个男人，我们一起演场戏慰藉自我罢了。。
347,色，戒,3,"力宏蹩脚的国语啊
结局真是够汗的。。。无怪乎大家都说在宣扬汉奸文化了"
348,色，戒,3,"汤唯的形象和气质,是这片的美丽风景,美这个词语完全不足以称道"
349,色，戒,3,女人情字大过天。”再不杀人，就要开学了啊！“
350,色，戒,3,“那一段”的时候我竟然在倒垃圾的路上错过。。。
351,色，戒,3,易先生的那种霸气难道只能通过床戏表达么
352,色，戒,3,王佳芝的倒戈可以料想，对于一个非正规的特务能给她爱的只有易先生，尽管是虐恋，但易先生付出了真心。反观另一头，地下党对王只有利用和命令。我们不用站在道德制高点抨击王佳芝，她只是一个人，一个女人
353,色，戒,3,女人的挣扎。。。。。。不管什么时候，女人总是在感情中奉献一切。。。。
354,色，戒,3,当时看的就真的是删节的那部分的
355,色，戒,3,这片子让我对梁朝伟的厌恶到达了极致，看你从哪方面评价，如果你真的认真去投入到影片中，很多细节会有感触，但我绝对影片情节没什么大的意思，床戏倒是让我看了想呕。
356,色，戒,3,看完之后没看懂，也不想深究，更不知道怎么评分才好。。。
357,色，戒,3,刺杀这事儿实在是太扯了，分析主角的爱情那就更扯。故事拍的很细腻，细腻到我想睡觉。质量不错，只是不对胃口，那帮子民国女作家都去死去死去死哈哈哈。
358,色，戒,3,自从梁叔叔演了《色戒》，我就不怎么喜欢他了，直到《赤壁》。
359,色，戒,3,不喜欢这个故事 就谈不上欣赏演技与拍摄了。老李这次栽了 遗憾
360,色，戒,3,不喜欢这个故事 就谈不上欣赏演技与拍摄了。老李这次栽了 遗憾
361,色，戒,3,结局不像小说那样达到一个高潮，完全冲着张爱玲去看的
362,色，戒,3,不专业的三级片，倒是汤唯一脱成名
363,色，戒,3,其实陈冲演得最好，其它人受制于普通话没法发挥，汤唯的身材很赞，但是脸化成那种时代风格的，现在看真是让人沮丧……
364,色，戒,3,也只能看宣传让我们看的部分。情节太狗血了！！
365,色，戒,3,"李安不够狡猾,不该拍张爱玲"
366,色，戒,3,好吧，其实我真的不知道过人之处在哪。
367,色，戒,3,原谅偶给三星，虽然去了电影院，但至今没看过全版～～～
368,色，戒,3,电影院放的是删节版，在线看了完整版，哎哟～～我瞬间瞎了！
369,色，戒,3,看到信封上的2B我不厚道的笑了。。。
370,色，戒,3,对这个题材喜欢不起来  对于有腋毛的汤唯亦然。。。
371,色，戒,3,我只看了剪切版，甚为遗憾，但回头找到完整版时，又索然无味了。
372,色，戒,3,兴致不大。有性无爱- -
373,色，戒,3,2013.09.26 午后 【冲着汤唯女神来看的，剧情倒是沉闷冗杂，每每看到昏昏欲睡的时候，女神总是切合时宜的站出来脱给你看。另外黑葡萄差评！
374,色，戒,3,刚开始感觉挺好的。后面有种脱离原作的感觉了。我喜欢原作。
375,色，戒,3,李安太柔了，实际上张爱玲的小说骨头是很硬的。不过因为这部电影爱上了汤唯。
376,色，戒,3,汤唯这里演技比后来强多了。被封藏三年真不奇怪，性画面也太直接了。梁朝伟整个片子都显得很阴郁，在她身上那个律动真是好看。但是汤唯的腋毛！受不了。结尾怎么就那么结尾了！片子太长了，实在是有些拖沓。
377,色，戒,3,上映前的噱头太大。其实电影并不优秀。个人意见。
378,色，戒,3,文学课上看的。。。当然后来又补看了激情戏。。。。
379,色，戒,3,一个6克拉就把你给收买了？果然姑娘要富养，不然太容易被骗。【哎哟我的point怎么总是那么奇怪】
380,色，戒,3,咦？啥时豆娘给了链接拉
381,色，戒,3,"本来应该四星~~~
可是电影院的那些个WBD把重点全删了~~~~丫的"
382,色，戒,3,干的好逼真（0404）
383,色，戒,3,只看了被删的部分…………
384,色，戒,3,我只能说我期望太高・・・・・・看完真的觉得不咋地
385,色，戒,3,无甚感觉....没感觉到爱情的踪迹 不像张爱玲了
386,色，戒,3,这个条目被屏蔽一阵，现在又恢复了。补看完整版又有了新感觉，一是床戏尺度大不封才怪，是不是假戏真做有待商榷，二是王佳芝为了易先生不被灭口而牺牲了自己团队所有人，是不是代价太大了呢？女人还真是感性动物呀。
387,色，戒,3,好故事 好演员 那么国产片为什么还是有尴尬感呢？因为配角有些不对头的设定啊 这就是不严谨
388,色，戒,3,其实我觉得完全不用太怎么描写性，原著也没有描写
389,色，戒,3,我是为了张才去捧的，不过被改得一塌糊涂
390,色，戒,3,多体味多方向赢得革命的胜利
391,色，戒,3,2012第一部，未删节，和色色。不尽人意。民族危亡的大背景，沉静中的骚动，抑制感情的拍法很有大师风范，其实我们最爱的只是自己。青年时幼稚的冲动带来的阵痛，那场拙劣的、不安的杀人戏，让我蓦的想起《美国往事》。汤梁眉眼里都是戏，汤微翘的嘴角迷人。王是来搞笑的？愚蠢的青春
392,色，戒,3,3G高清无剪辑版，要是汤唯身材能好点说不定加一星。引刀成一快，不负少年头。邝裕明空有激情，却连当年的汪精卫也不如。易先生活了，其他人都死了，才是最真的结局。最真的结局是要被禁的，就算不露点。
393,色，戒,3,你是个孤独的人，但有那么一刻，我相信你爱过我。
394,色，戒,3,哈哈哈哈哈，有这么傻逼的爱国青年么，这情节实在太搞笑了，比剧情类A片还扯
395,色，戒,3,战争年代什么都是残酷的，和平来之不易。透过影片的背后看到的是人性的悲剧。不过张爱玲并没有写国家大义之心，只是我们以为看到应该是这样。
396,色，戒,3,电影没有电影之后的故事精彩，明明在同一张床上演戏，男人后来红的更是发紫，女人却被无情和谐~
397,色，戒,3,等了许久，追了许久。看过了各种影评，介绍，终于看了未删减版。也没觉得啥特殊的，啥深沉的，啥思考的。跟风罢了。很庆幸没去电影院看，没浪费那几美金。
