,movie,star,comment
128,色，戒,5,最好的汤唯需要李安，只能这么说，除了王力宏比较尴尬，其他人都几乎完美，只有绝望中的感情才足够浓烈。床戏的层层递进，梁朝伟向日本人遮眼的一刻，拉车前的风车，这些神来之笔的背后是李安技法的纯熟度到达顶峰，中西合璧的极致，希望不是他最后一部华语片
129,色，戒,4,李安的细节控制仍旧非常完美，梁朝伟不必说了，眼眸间处处偷情，最大的亮点就是汤唯，她诠释的王佳芝令人看不出来这是她的处女作，太美了，被蹂躏都有一种摧残的淡然的美，感情细腻又不能大放大开，此女未来必然大放异彩，李安真实伯乐啊！可是总菊还是封杀了。8.2
130,色，戒,4,看完片子觉得是不错的情爱片，但里面还有些台词不明白作用，然后看了长篇大论的影评才知道里面隐藏啦好多东西，看影评累死我了。
131,色，戒,5,初看只见情欲，再观已是断肠。寻常人由爱生出忧与怖，而色・戒里的二人由相互理解的那种随时会送命的恐惧感而催生了爱。除了酒馆里唱小曲儿，还喜欢这一段：易先生受预警逃跑后，王佳芝走在街头像断了线的风筝。终于喊到人力车，车头扎着小风车的车夫回头问“回家啊？” 她勉力压住快要失落了的魂魄答道“诶~” 这部片里的汤唯是人间瑰宝，梁朝伟也演得好。李安真的很神奇，把一部可以拍很“大”很商业的谍战片拍得残酷、温柔又纯真。
132,色，戒,5,【Great】与我而言，这是一部无论何时都能在我心目中排进华语影史前三的作品。无论是道具、服装、布景、灯光、摄影、还是表演，都配合的天衣无缝。尤其是角色表演，汤唯和梁朝伟的表演都是那么的刻骨铭心。王佳芝稍带醉意的把手伸出车窗去接雨水，初会易先生的一颦一笑，让易先生走时的痛苦与纠结，坐在人力车上那一幅恍然的表情，和最后把玩药丸时所流露出的最后一丝期待。而易先生这个角色也极为出彩，从他平日淡然自若的神态，发现王佳芝身份时的防卫和自信，第三场性爱里被枕头蒙住双眼时的恐惧，和最后在王佳芝床边那盈满泪水的眼眶。梁朝伟做到了用影子都能演戏。还有一个令我印象深刻的点，就是剧中几乎没有多少流泪的片段，所有角色在悲伤时眼泪都是“撑”在眼眶里的，不禁令我再次感叹李安那对于情感的恰当拿捏和对人物本身的残忍。
133,色，戒,4,是钻戒刺眼所以满腔被珍惜的感动冲破了口啊。结尾易太太质问［用词其实不当］易先生那一段倒是让我回味无穷
134,色，戒,4,一部优秀的电影，李安还是那个李安，然而这么多年围绕这部电影的依旧是逃不开的性话题，有点可悲
135,色，戒,5,李安伟大的地方就在于他想讲什么他就把它做到极致，细腻又有灵魂。色，戒，就是讲男人和女人对性和爱的差别，简单概括为男人能把性和爱分开，女人不能把性和爱分开。交锋、博弈，几场大尺度叹为观止。李安也给出了自己的张爱玲，很成功的改编。好导演麾下全是好演员。另外，选王力宏，安叔挺“坏”的。
136,色，戒,4,竟然有人把色戒当av来看，感觉像是在美术馆里对着席勒撸了一发。至今都记得小学的时候排路队，听到男孩子互相吹嘘看过的毛片，其中一个超社会的男生那句绵阳话：“看色戒蛮！”那种故作老司机的自矜。会因为色情污秽的标签膨胀的都是没长大的熊孩子。
137,色，戒,4,这么火的电影，之前竟然没看过
138,色，戒,5,戏假情真，后半部分让人心痛得难以看下去。
139,色，戒,5,完全被俘获了
140,色，戒,5,A＋ / 私影史：最最最最最最好的李安。
141,色，戒,5,308 李安导演的片子真的是太细腻了，有幸看到未删减版，好看到落泪T_T  汤唯太棒了，眼波流转都是戏，一颦一笑都是情，易先生怎么会不沦陷呢？梁朝伟也太棒了，眉眼间尽是柔情，仿佛要把人吸进去，王佳芝不沦陷就怪了！看完片子的我仿佛心里压了一块巨石，好难受啊TAT 好看，真的好看！
142,色，戒,5,“2007.11.3北京CBD万达电影城”  我还行再看一次足版，谁有下载资源啊。。。
143,色，戒,5,如果有足版DVD，一定买。
144,色，戒,4,几年前看《色・戒》，兴奋，却又兴奋莫名。有时似乎还和刘嘉玲等等一样，纠缠于是否打真军等曲别针似的高难度术语之中，沉溺，难以自拔。记得李安在接受《三联生活周刊》采访时说，“我要拍《色・戒》，就因为大家提到抗日就慷慨激昂，只有张爱玲看透了这个东西。从女性的角度，一个女人去色诱汉奸，这个东西对我诱惑太大，我又兴奋了”。 至于李安所说的这个东西，时至今日才有些懂了。王佳芝身处两难，一边是身体性爱，一边是家国大义――对易先生轻轻一声“走吧”，就完成了女性个体对“国家”“民族”“主义”等话语以及对“男人”还有对“爱情”的反弑，她的第一次尽管是献身给国家了，在被国家和历史沉重叙事绑架、裹挟的空隙中，她却能够匆匆为自己爱上一回。正如张爱玲那时痴恋胡兰成一样，尽管还是悲剧，但至少自己是完整了。
145,色，戒,5,这世界脏，唯你送我一抹洁白。
146,色，戒,4,这电影服道化挺考究，光影也美，剪辑什么的更没得挑。几场不可描述戏作为剧情的推进值得推敲，是作为不带有色眼镜的推敲，男女关系说简单也不简单，说不简单也挺简单。作为爱情片看，这戏很妙。其它发散思维就算了吧。
147,色，戒,4,抗日背景下，只见一群自称护国的中国人，利用一群自认爱国的中国人，去刺杀另一群自称保国的中国人。都扭曲了。只有王佳芝和易先生的关系是实实在在的，甚至还能有几分真。王佳芝只是要个归属而已，一路单纯到了最后，其实很不容易。
148,色，戒,4,我似乎懂又似乎不懂，总之是抱着看热闹的心态把这部戏看完了。个人觉得王佳芝就是自己演真爱演的太投入，自己把自己绕进去了。
149,色，戒,5,"难得,国产片居然也可以让人看完后在屏幕前发一会儿呆....."
150,色，戒,5,你存在，所以他活着。从最初毫无感情的性爱与虐待到最后他看着她的脸柔情地说出“我们在一起”，是爱情吗？其实已经不重要了，只记得在车夫问出“回家吗”时她愣了愣发呆的神情，只记得，最后满眼泪水的他。王佳芝与易先生最后那场性爱令人无比压抑和心伤，肉体的侵略，精神的纠缠，谁都没有放过谁。
151,色，戒,5,今天第一次看，是哪些sb说是色情片的……说得好像没看过美剧一样……明明从各方面都堪称完美
152,色，戒,5,重看，耐看
153,色，戒,4,女人就是这么简单 对待感情奢求得永远不多 只要你有钱 长得帅 活好 她就能死心塌地和你在一起
154,色，戒,4,几个孩子假戏真做，几个大人真戏假做。这么有名的片子事隔多年才看，觉得梁朝伟不亏梁朝伟，汤唯已经不是那个汤唯，只感觉王力宏像李治廷，是最大败笔。说起色戒不得不说当年的床戏，很遗憾没有丝毫美感和性欲，只是他在监狱拷问敌人，他俩在床上互相拷问……
155,色，戒,5,比起虐身更虐心的床颍更值得玩味的倒是氖贾两K扇说难凵瘛Ｓ∠笾]有哪部影男女主眼神交流可以如此出神入化，o言s偾а浴Ｗ尤说氖侨帐骄悄嵌颍唱的有模的忧椋只一曲就明了何^蚣偾檎妗Ｒ紫壬m不多，但前一句“穿著”，後一句“戴著”，不意透露了“壑”，哪怕如此UM。
156,色，戒,5,看完后再听起片中旋律泪止不住的流，她的低眉莞尔，他的阴沉老练，从开始的互相测探到彼此沦陷，三场压抑的情欲戏/天涯歌女，难以挣脱情感的漩涡，难逃政治与欲望的湍流。黄包车上的风车转的轻快，仿佛是她的命运怪圈，一旦踏入难以再回头，褶皱的床单也再次淹没在黑暗里
157,色，戒,5,一曲肝肠断，天涯何处觅知音。
158,色，戒,4,#1080p##重看#满屏的隐喻与反讽，处处身不由己，螳螂捕蝉，黄雀在后，热血天真即非法。再看依旧震撼！汤唯这部和郝蕾的《颐和园》是21世纪头十年最触动，制作最完美，细节无一处不用心的最佳女性视角中国电影。王佳芝在电车上侧身淋雨的瞬间恍惚失神，纯洁无辜，就让时光永远停留在那刻吧~
159,色，戒,4,艹(忍不住爆粗口) 这片子太细腻压抑 极尽挑逗之能事 镜头台词都很缜密 情绪像是妩媚体态上的留香 散不尽又抓不着。两主角表现很到(过)火候。没看过原作 不过剧本塑造了如此集情与怨于一身的悲戚女子 确是一大绝。悬疑揭秘movie.douban.com/review/1242635/
160,色，戒,4,第三次看，真的是李安最好的。理解了王佳芝也就能理解林奕含说“遭受的苦难比种族灭绝还要巨大”，他们的言行是精神被痛苦吞噬后对自身最后的怜悯，是分离崩析的内心对外在世界的最后抵抗，而非出于对他人的恶意。
161,色，戒,4,"汤唯的每个眼神都是精彩的戏码，那眼神或许有一瞬间的爱意，但转瞬又被满满的恨冲到支离破碎！爱国就是个大骗局，沉迷，它绝不是一个褒义词，忤逆不过情感傻女人，只能是牺牲品。李安是最会用镜头讲故事的人，一贯的风格和震撼人心的力量。
PS：王力宏果然是最大败笔！！"
162,色，戒,5,如果 我们也像这样博弈
163,色，戒,5,表现得非常好~~镜头和叙事都可圈可点，还有不少细节做得不错。感觉得到每个人所承受的压抑和痛苦。
164,色，戒,5,动了情 竟相信他爱你
165,色，戒,5,"啊，梁朝伟！
啊，汤唯！
至于王力宏，那是什么鬼？"
166,色，戒,5,四星半。在那样动荡不安的年代，人们口中的卖国贼心中恋着你，好似同仇敌忾的同志却指着你做“妓女”，一切都是扭曲变形的。床笫之欢不过是内心的哭喊，奔赴死亡的笑靥才真的源自心底。李安用他熟稔的细腻，让你滞涩住所有语句，闷得无法呼吸。或许再多分无畏的狠辣，会更完美。
167,色，戒,5,终于等到了完整版．从肉体到灵魂的苍凉．李安终究是比张爱玲温情．
168,色，戒,5,"一切都是冷的黑的.并非可以回头的排练,但溃败仍被过往预演,深渊只是张着大口,等待人如同各自虚掷的代价被掀入它浓暗的腹.主至协众多角色,心理状态都是剖开展示的.家山北望不具决定性,时局作为不分对象的阴影降下,故有泪沾襟,哪怕来自鳄鱼之眼.台词与调度效率高得吓人.汤唯那不知无心或有意的生涩偏巧好"
169,色，戒,4,细节太丰富精致了
170,色，戒,5,"李安细腻到惊人，每个演员的每个眼神每句台词都是满满的戏，一定要二刷。
看完之后好长时间都说不出话来，就一直循环张学友唱的主题曲《淹没》。
生在这样的时代，这样的大环境下，真心的情非常可贵。
满分电影。"
171,色，戒,4,像丝袜上一道裂痕，阴凉地在腿肚子上悄悄往上爬。整个电影所呈现的时代境遇与情感诉求便是这样的表达。王从褪下丝袜的那瞬间开始便走向了沦陷的道路，最为激烈的表现情感的三场递进的床戏更让她沦陷得义无反顾。女人终究是情感的动物。被政治附身男人不过是向情感望了一眼便走开了。
172,色，戒,5,两个半小时一点都不觉得长，三场床戏和闺蜜一起看的有点小羞耻，只有这时候两人都看的聚精会神。易先生这个角色满足了对一个老男人苏的所有幻想。
173,色，戒,4,李安将性、爱的张力与人性处于战争时期的紧张连系在一起，去掉原作的冷冽与反讽，加添感情色彩，并大胆刻划性爱心理，以他的敏感重新演绎张爱玲的故事。《色，戒》公映之际，张爱玲的自传式小说《小团圆》尚未出版，现在配合此遗作的阅读，电影更富有一种耐人寻味的神秘感。《小团圆》印证了王佳芝为张的夫子自道，李安彷佛早看穿这点，《色，戒》电影虽多借题发挥之处，细看却似踏足张爱玲心灵殿堂。扭曲、妖异的性爱场面，不啻超渡《小团圆》里喘息低吟的亡灵，电影的焦虑抑郁，亦与《小团圆》的低语呢喃如出一辙。
174,色，戒,4,即使是所谓的“坏人”，也有他的软弱和欲望。
175,色，戒,4,爱意最终在压抑中迸发。王佳芝作为卧底已达到忘我的境界。
176,色，戒,4,汤唯简直太棒了，举手投足一颦一笑全都是戏！
177,色，戒,5,"1st:2007年12月，成都某电影院；
2nd：2008年3月，上海盗版碟补看床戏；
3rd：2009年5月，北京"
178,色，戒,4,李安为什么不能把那一段拍的隐晦一些，梁朝伟毕竟不年轻了，拍成这样大家的关注点自然落在那一段上，不会有很多人理解或是关心导演的用意，也成为梁朝伟的黑点。
179,色，戒,4,故事流畅节奏感不错，这么长也不觉得拖沓。怕就怕卧底患上斯德哥尔摩症，不过这么帅气又有魅力的特务，放谁都逃不过。就是为毛汤唯和梁朝伟老各自在各自的节奏上，不能调一致了么？
180,色，戒,5,"汤唯~~~~~~~~~~李安~~~~~~~~~~~~
#2016年11月韩国无删减高清重映# 《色戒》真的是每次再看，都能有新的惊喜。"
181,色，戒,4,别去考验女人的理性，如果能和一个极具魅力的男子日夜相眠还能让自己的心不失衡，那也不能称之为女人了。
182,色，戒,4,"政治到底使人失望，她的厌恶自懦弱始。自以为是、幼稚游击、强迫牺牲，垃圾。被皮带捆住、被摁下的时候也许已经得到救赎了，即便如此，性爱也是游离的某些沉重。人力车上呼啦啦转的风车、封路时人群的生活，最后还是他汗津津的关切玩具的眼神。六克拉，单纯无意义的沉重。

“王佳芝，你快上来呀！”她冷漠以对。她应该冷漠的，眼里蹿出一把恨的刀子，但扎不出血来。"
183,色，戒,5,把这部电影定义为色情电影的我们，思想是有多么的龌蹉啊
184,色，戒,5,除了王力宏  剧本 演员 导演在这部片里都绝了  这恐怕是我最爱的李安的一部电影了  台词 镜头铺垫精准 不得不膜拜
185,色，戒,4,你并不是羡慕王佳芝与易先生，卡西莫多对埃斯梅拉达的感情。羡慕的是哪怕成年之后，依然有着爱一个人，虽千万人吾往矣，不顾一切的勇气。
186,色，戒,4,最喜欢的镜头是，王佳芝放走易先生之后，来到街上，怎么都拦不到人力车。最后终于拦到了一辆，没走几步，路被封了。周围抗议声、抱怨声吵吵嚷嚷。车夫说着抱歉，佳芝淡淡地答复，车头的风车在风中悠悠地转着。哀艳极了，这才是张爱玲的感觉。
187,色，戒,5,看过，未删减版，为艺术而奉献，不错不错
188,色，戒,5,卧槽 梁朝伟这个高潮演的，每一条皱纹都闪着疲惫的光啊！4
189,色，戒,5,第三遍看，好看到心惊肉跳，每一个细节都完美精致到不得了。李安真的是大师，大师，大师。太厉害了，拍出了张爱玲字里行间的细腻，还更显大气。以及，邝裕民是混蛋。
190,色，戒,5,沉闷又压抑，看完心里闷的难受，好在李安改编，易先生对王佳芝是有感情的，说话时候的眼神，最后在黑影里的泪眼，梁朝伟太适合这个角色，他和汤唯的对手戏真的余韵悠长，一个眼波流转尽是风情，一个眼里都是克制的欲望
191,色，戒,5,李安的镜头是王家卫的诗意和张艺谋的欲望 故事本身极具时代强加于个人的胁迫性 虽说张爱玲的小说都泛着和她本人一样的落魄之意 但李安很好地将焦点从她的黄油钻转移到汤唯本身 17岁到23岁的年龄跨度不算大 但当时的背景却需要汤唯很深厚的积淀和亦魅亦纯的气质 / 色易守 情难防
192,色，戒,4,前后看了四五遍，最后才看出味道。王佳芝给易先生唱歌的时候，我也哭了。男或女，一旦动了真心，便是凡夫俗子了。
193,色，戒,5,你们都来让我崩溃吧！
194,色，戒,5,李安将时代抽丝剥茧，用理性的东方情结解剖了爱情，以强大的叙事能力和准确的人物刻画完成了一次创作释放。每个镜头都精雕细琢，尤其三场床戏让影片高深莫测。王佳芝褪去脂粉和旗袍，一颦一笑，痴怨妖娆。情欲把她的心囚死，她遂攥紧了背叛全世界的固执。爱之花会在毒液中吐蕊，亦会在凋零时沉醉。
195,色，戒,5,完美的电影。
196,色，戒,5,本来并不觉得十分不错，尤其王力宏非常出戏。但汤唯把那种疼演的太好了，李安的营造也独到。【2014.05.31】
197,色，戒,5,暧昧的情绪油然而生，看得人都不免耳红心跳。结尾还有虐心的感觉。梁朝伟的眼神真是能杀死人了。汤姐其实蛮不错，就是胸小了一点，PP平了一点，腿粗了一点，但是不是贬义，因为这样她才真了一点，这个才是真真实实的美。不得不说，要是我也动心了。其实或者我们都忽略了易太太的感受。PS：钻戒太美了。
198,色，戒,5,“藏”，如冰山一样，线索都在水面之下。 男女情色混着紧张的谍战，政治隐喻和讽刺之下是对人性的挖掘。混乱的年代不乏扭曲与荒唐，学生以爱国为名逼迫同伴献身，同志以组织之名把学生当工具利用，学生的热血与幼稚被现实狠狠打击。王佳芝引诱易先生，可到底谁是猎物？导演没张爱玲狠心，总归是爱的。
199,色，戒,4,导演的问题，最后背锅的确是一个女生，真的很不公
200,色，戒,3,从头笑到尾 抱歉。。。王力宏的出演简直是本片最大的灾难。。。
201,色，戒,3,其实她一开始便知道是死路一条
202,色，戒,3,即便有那些情色镜头，这还是一部干巴又平淡的电影。
203,色，戒,3,冲着李安看的，慕名来看却感觉过誉了，有些失望。梁朝伟中规中矩，完全get不到汤唯的长相和气质，演技也不过如此。不过大众都是这样吧，夸的人的多了自然也就信了，跟着夸就对了。
204,色，戒,3,重看《色戒》，越发觉得易先生活脱脱一个霸道总裁啊……王佳芝说“快走”的时候我还是崩溃了，怎么就就心甘情愿地如此狗血……细节细腻，整体虚浮，像是淹没在对平行宇宙的观测里。
205,色，戒,3,本来幻想的结局是用一颗药丸解决两人，后来想起来，爱一个人，断不会让他死。只是我还是接受不了张爱玲这般冷酷，李安倒是无功无过。
206,色，戒,3,额，没看懂，后来看了爱情公寓才懂了些，可能我是俗人一个。
207,色，戒,3,很漂亮的汤唯，还可以啊！作为艺术片看挺好的，不要在意细节！
208,色，戒,3,李安力图揭露出被“国家大义”掩盖下的“人”。
209,色，戒,3,1，到子蛋就背叛了革命，王佳芝同WGM了全世界女同W的；2，王力宏你笑鐾酢…3，唯念^到_到底哪汉每戳耍4，梁朝ゲ焕⑹怯暗垩萸巴老特斩嫉眯手的。
210,色，戒,3,李安在这部片子里有点失去控制了， 尤其在王佳芝的身上。易先生和梁朝伟的表演倒是相得益彰。 可惜，这片子只能是一部关于王佳芝的片子，成败都在她身上。
211,色，戒,3,两个空虚的躯体纠结在一起勉强取暖的故事，还是可以看的。演技派的戏骨很出彩，要说这片完全靠脱出名真的是完全不公平。但是吧，从找GF的角度来看啊，麦太太这样的女人还是太精致到易碎品的程度了，哦我忘了，那些拍桌上的太太们本来就是凭各种作来生存的，大家三观立场不同这类片子还是没法不看睡着的
212,色，戒,3,王佳芝在演麦太太，汤唯又要演王佳芝又要演王佳芝演的麦太太，挺难的，她做得很棒。很好的电影，但不喜欢就是不喜欢。 顺便说一句Movie Movie竟然是会打马赛克的，不会续约这个频道了！
213,色，戒,3,李安密针细缕近乎完美的《色，戒》恰恰触犯了“爱情”的大忌：嗦。所幸他在张爱玲的小资世界里并没看见顾影自怜的小团圆，反是大时代对于个体人性的压迫和扭曲。然而问题是他的保守主义占据了整部电影，非要将恍惚中的那一句“快走”合理化才肯让言多必失的鸽子蛋从她无法拒绝的指尖上溜走。最终因太多悬而未决的线头毁掉了华丽的袍子。
214,色，戒,3,先入为主了很多美誉，真的看时，难免有心理落差。
215,色，戒,3,最后，也不知道他到底有没有爱上她；她，却因此送命。值得吗？不知道。或许当事人觉得值得吧。
216,色，戒,3,..安导拍的剧情h片，张爱玲写的剧本..回形针gj..
217,色，戒,3,画面很美，色泽浓郁，宛如油画，但是剧情太拖沓，很温吞，又太过于刻意的去反复表现性爱画面，感觉与其说这是一部剧情片，倒不如说这是一部虐恋艺术片。梁朝伟老是演这种沉默寡言、阴郁的角色。铺垫了两个小时的王佳芝叛变，也在豆瓣被剧透到了，唯一意外的是，王佳芝没有在被捕前吃下毒药。
218,色，戒,3,"尊敬 张爱玲 的著作..
3星的确是..有点毁她的心血..
不过事实如此..
觉得似乎想拿细腻做卖点..
但 张爱玲 的细腻却从未感受到..
或许男人..
是感受不到的.."
219,色，戒,3,其实冲着李导演和梁影帝的大名，这部电影已经足以引起人们的注意了；但事实上，这部电影真正被人热议的原因，是占了标题二分之一的“色”。虽然不足电影市场1/4，在舆论效果上却十足的抹杀了另外3/4的情节。不过通过这部电影，最让我开眼的还是媒体的恶趣味。
220,色，戒,3,"记得是高一看的，那晚看的大陆的删减版，回家邪恶的看了完整版。爱情在战火纷飞的年代，被太多因素所覆盖，性更像是爱反抗的爆发。 
"
221,色，戒,3,记得不清楚了 但是汤唯好美 好有味道
222,色，戒,3,"未来的“三国” 
是人性还是奴性？不得而知。
正像陈文茜说的那样，若干年后，对于“汉奸”的争论可能会有一个更加客观和全面的评价。
延安的中共边区政府，重庆的南京国民政府，南京的所谓的合作政府，三者错综复杂，纵横捭阖在中华苦难深重的日子，应该是很有看头的。
"
223,色，戒,3,并没有发觉汤唯在此片中的任何美感~~时隔多年，想到色戒印象最深刻的是当年被炒的沸沸扬扬的被删减的情色镜头~剩下的只有一个因此而名声大噪却被封杀多年的女星。
224,色，戒,3,的确是很不错的汤唯。很好奇用那么多床戏表现易的脆弱心理真的很必要么？倒不是因为你临时倒戈毁了任务俺不接受，这样的人生我欣赏不来而已。王真心别扭→_→
225,色，戒,3,这部电影看得我心惊胆战...= =我日 完全没充分理解电影的最终思想，除了情爱还是情爱？！最后很想感叹为毛我要看这部和小电影一样的文艺电影啊= =！
226,色，戒,4,认真看，汤唯的精致五官，令她或者成了色戒的不二女主！试试，换谁来，都不会这么传神！PS:李安的床戏堪称巅峰之技！当然，也是梁朝伟汤唯的珠联璧合造就的！(若说不是真刀真枪，我是不信的！)
227,色，戒,3,记得是高一看的，那晚看的大陆的删减版，回家邪恶的看了完整版。爱情在战火纷飞的年代，被太多因素所覆盖，性更像是爱反抗的爆发。
228,色，戒,3,打牌时看到那些女人的眼睛就不舒服，勾心斗角。。。怎么说，这年头这部电影的尺度确实够大的，梁朝伟确实演了个原来从没碰过角色
229,色，戒,3,当年色戒被吵得沸沸扬扬的时候，爹妈如防豺狼虎豹一样的避免让我接触到一点儿，以致今天看这部片子心里说不出的别扭，明知道李安不会为了情色而色情，却总不免把种种风言风语套上这部电影，试想如果当初不曾耳闻这些，我大概可以像看佩德罗的电影一样只单纯的欣赏，中国性教育和艺术欣赏的悲哀大抵如此
230,色，戒,3,汤唯她不是很漂亮，但是感觉她身上总是有一种故事感，让你不感小觑，特别她皱眉凝思的时候这种气场就特别明显
231,色，戒,3,“你可以形容一个人如何不具备相信别人的能力，但更绝的是让他在高潮时都不敢闭上眼睛。如果说断背山是一段发生在天堂里的爱情，那色戒就是来自地狱的爱情。”――豆瓣
232,色，戒,3,王力宏在这里纯属搞笑，连我一向喜欢的梁朝伟也成了2号，虽然不喜欢随大流，但是还是不得不叹，汤唯的演技真的不错。许多的面部表情，值得细细体味。
