,movie,star,comment
398,色，戒,3,1、学生的热血意味着幼稚；2、男人与女人的战争中，男人的胜利通常是惯例，前提是他们都拥有符合性别特征的性格；3、从细节看出人的性格是恒久不变的真理，现在多了一个“体位”，男人采用的体位表达出潜意识；4、类似王力宏这样封面标准的偶像出演电影的唯一出路只能是自毁形象。
399,色，戒,3,额……只看了精华部分
400,色，戒,2,汤唯因为这部影片被冷藏多年，可梁朝伟却没有任何影响，影片本身并没有什么，即使有错，也不该是汤唯一个人的责任吧？她是演员，她负责按导演的要求表演，她按编剧给出的剧本表演，怎么出了事就是她不好了？
401,色，戒,2,很黄很暴力.妈的去电影院看脖子以上的床戏.
402,色，戒,2,真的看得我好困，完全没有李安以前给我的感动，对感情的描写还不及一首歌来的动人
403,色，戒,1,少给我拿些暴露镜头和一般人不想着手的话题就想显示什么高度和水品。也许就是我不懂得欣赏，也许就是李安让我大失所望。抽象派画家还知道拿些完全看不懂的乱涂乱画来愚弄人，这部片子~好吧，我不想多说。
404,色，戒,2,"话说，我喜欢李安同学，所以也就对这个，失望了。
除去那几场激情戏，这部片子到底还能剩下多少东西呢？"
405,色，戒,2,这部片子的好坏，其实关键取决于你看的是什么版本。我看的是未剪辑版，看完觉得剪辑是很必要的，还有原来喜欢的梁朝伟实在太猥琐了。
406,色，戒,2,前半程是“我知道你去年夏天干了什么”的样板戏版；后半程是“午夜守门人”的粗糙阉割杂糅版；汤唯很敢，tony也一如既往地敢，可被大家津津乐道的做爱场景远不如short bus来得精彩趣致，SM的肉体精神高度怎比“午夜守门人”？！李安的焦虑从一开始滴汗到最后，都快溢出胶片了！
407,色，戒,1,不知所云，美化汉奸，特别是王佳芝，波不大且无脑！这种人死就死了。
408,色，戒,2,私以为李安拍起中国题材总显得有些拿腔作调，继《卧虎藏龙》中润发紫琼怪音怪调地唱念做打之后，此次王力宏又以他奇诡的咬字方式令人啼笑皆非。依鄙人粗见，此片不知哪来‘情怀’之说，更像是一群热血的姑娘小伙被鬼迷了心窍，虽然戏演脱了还得继续拧巴，况且此种电视剧腔的对白着实令我反感。
409,色，戒,1,这个故事的内核就是“驯服”啊，所以我推荐石井隆当导演比较合适
410,色，戒,2,作为一个在了解郑苹如背景后看这部电影的人我的看法必然是非常主观的，撇开艺术与技术，单纯从电影取材的角度上来说，真的是对郑苹如女士的扭曲，几段性爱一段小曲一颗钻戒，就让一个女人沦陷了，或许女人就是这么简单的生物，但是最后还是让人失望，王佳芝与邝裕民最后一眼的暧昧相视，莫名其妙的可笑
411,色，戒,2,好好一个故事被那些色情镜头喧宾夺主了。
412,色，戒,2,汤唯有个屁演技 没有大导演调教更不会演戏 居然有我喜欢的何塞飞 重点完全不是床戏而是为生存为寻找自己究竟算什么而绝望 因为太渴望因此选择放手尽管从开始王就知道她走的是死路 四平八稳的李安
413,色，戒,2,题材的争议问题正源自原作者一个爱上汉奸的女人张爱铃，看完这片我跟朋友说，无论是服装角色剪辑等等都不错就是题材问题，我不喜欢。对方惊愕问道那你是不喜欢张爱铃，我说，对，从来没喜欢过她虽然跟她爱汉奸没关系。这题材作为小说本不是问题，但是搬上大荧幕，是想被人们批判还是颂扬？豆瓣真没气结
414,色，戒,1,多年后回想起这片，再看了遍，感觉这片真实水平在7分多点。1.导演想表达人性，但不幸让女主沦为为了自己认为的那虚无缥缈的自私爱情，出卖那么人的生命的自私女人；2.戒呢，表现在哪里？恐怕剩下的也只有脱戏的噱头了吧；3.看着几个学生杀狗仔，女主表现得这么洁身自好自命清高？没必要丑化学生吧。
415,色，戒,2,剧情很一般，情色场面拍的有点让我觉得恶心没有美感
416,色，戒,2,故事情节到表演都挺烂的，卖点的情色镜头不如不拍，露了还是让人幻灭
417,色，戒,2,大u作小∏椋值不值得呢。
418,色，戒,2,"回形针,哪呢哪呢,天!我看的是删减版,md"
419,色，戒,1,only the sex scenes
420,色，戒,2,其实完全没感觉，不知道他想干啥……也不知道怎么选的演员，中国导演是不是都这样？文艺一把过后定要疯狂一把……然后不知所云……可怜的汤唯，封杀到现在还在继续……
421,色，戒,2,只能冠名另类爱情片 应该是确实无法自拔的
422,色，戒,2,从光影画面片子无疑是做到了美，只是价值混乱，我个人完全无法理解故事的逻辑合理性和对女性的丑化（有类似情结的《午夜守门人》反而不觉得......）。作为新人的汤唯表现尚可。
423,色，戒,2,有谁冲着剧情去得请举手~！
424,色，戒,1,时隔十多年，经过2019HK和2020疫情才看清很多事。才明白导演的家国意识淡薄。当年看的确被洗脑了，漂亮的旗袍，和所谓的爱情。看完还同情汤唯，讨厌王力宏那个角色。现在才发现导演是如何美化一个施虐狂汉奸，如何美化一个背叛了信仰的小三，如何丑化爱国青年。‘’我不关心大国的崛起，我只关心小情小爱‘’很龙应台，很张爱玲，很国民党，很台湾。2007那几年内地也是公知盛行，精美精日，否定自己，否定前面的三十年。还好，我们扛过来了。喜欢张爱玲的许子东在微博上阴阳怪气，喜欢讲公民常识的梁文道为废青辩解，质疑是否只能国家组织抗疫。哈哈，幸好掌握国家命运的不是这些文人，艺人
425,色，戒,1,既然要把背景放到抗战，那么就要讲点政治正确吧？这么扭曲的故事，如何对得起那些牺牲的战士，无辜的平民呢？被倭寇屠戮了的他们的人性谁来长篇5星点评呢？李安这种人要是占了主流，侵入了意识，下一次民族危亡时刻，谁站出来为大家牺牲呢？怕不是都要被嘲笑成电影那几个弱智的爱国学生？华夏的悲哀！
426,色，戒,1,实在是受不了国产电影了，十分钟也坚持不下来，头十分钟还得是快进的。
427,色，戒,2,有人批评左派看问题是意识形态挂帅，可看这种片子，能不这样吗！
428,色，戒,2,学校放的那天难的教室坐满了，竟然还有人站着！！！
429,色，戒,2,这戏真TM打结～靠
430,色，戒,2,到现在只记得王力宏那句再不杀人就要开学了。。。 
431,色，戒,1,昨天说起李安想起这部色戒来，我最恶心的电影，没有之一，从此埋葬掉因为父亲三部曲对李安的好感。简单说就是一个缺爱的女人被操舒服了就背叛自己和组织，三观混乱不堪。
432,色，戒,1,当剧情的进展无法自圆其说时，蹩脚的导演就用“天降神兵”的方式来解释，王佳芝那神一般的演技就是此片不合逻辑的“神兵”。我们都是知道这个女人最终不是被钻石给给打动的，但用钻石来表示也太俗了吧。性爱镜头完全没有美感，简直就是机器人在互相强暴。
433,色，戒,2,一直没看。汤唯果然不是一般的有野心。
434,色，戒,2,我看这个觉得梁朝伟好猥琐..
435,色，戒,2,易先生太单薄，汤唯太复杂，王力宏太傻，唯一一个设定得好的竟然是易太太……这个类型的电影李安不行
436,色，戒,2,罗曼蒂克消亡史在成人那部分很明显的抄了这部片，然后导演真的一点过度解读的机会都不给人易先生这个人设摆在那里一点儿用都没有，王佳芝缺乏心理描写，整部片子叙事散淡也就国内伪文青看看装13用吧。为了颗鸽子蛋就抛弃组织我也真的内心一波草泥马，然后一伙同学组织把她坑了，她反吃一口同归于尽没毛病！！还有这个0演技王力宏我还能再减一颗星。
437,色，戒,2,虽然说我不太喜欢，却看了好几次，就为了去找梁朝伟的蛋蛋。
438,色，戒,2,SM情节再多点就好了。
439,色，戒,1,按个爪印，没负分和零分这不科学！张爱玲活着也得给气死。再次印证了那句话---女人是水星来的，男人是火星来的，两股道儿上的生物，谁也理解不了谁。据说80年代初有人想拍，找小受演老易，被婉拒，万幸，否则前半辈子形象尽毁。
440,色，戒,2,"算是我偏见好了 看了不知所以然 也确实如料想的会让人失望
力宏完全就是个搞笑的角色 从出场就笑声不断 不过在这么大银幕看到他还是满好玩的
算我没看懂好了 对片子不评论了"
441,色，戒,2,张爱玲的小说总是拍不出原著的味道来
442,色，戒,2,非常无感 因为我实在是太低俗了！
443,色，戒,1,这不是一部烂片，但是我极度反感这里的三观，我的民族感情在这里和在南京南京那里一样感到极度的不适。
444,色，戒,1,"在韩国看的未删节版，欣赏不了。。
关键时刻女特务是被一颗钻戒搞定的，梁朝伟逃命的速度和动作都很卡通。。。"
445,色，戒,1,全国人民都来了。但是难看就是难看
446,色，戒,1,没意思，很差劲！！ 文艺 
447,色，戒,2,床戏……各种床戏～
448,色，戒,2,如果没有床戏，这部电影会是李安最烂的电影。
449,色，戒,2,没啥意思，就是梁朝伟脱光嘛~
450,色，戒,2,不负盛名阿。
451,色，戒,2,价值观再怎么多元话 扭曲成这样也真膈应
452,色，戒,2,这破片儿真的是李安拍的吗？人物的行动，完全没理性可言，叙事平面，就围着这几个人转，没什么生活质感，没情节，没情怀，你说这就是一般的大陆民国电视剧我都信，除了色情，毫无亮点
453,色，戒,1,这片吧，就说明一个道理，男人拿鸡巴就能和女人换大脑，居然还有一众老娘们感动的稀里哗啦。最脑残的一个评论是“为这个女人不值，成为一个时代的牺牲品”，这话真就跟黄讽刺的：小》大，这种逻辑一致。
454,色，戒,2,故事很好，表现很好，什么都很好，为了救一个汉奸搭上一大群朋友的故事，哪怕这个人是爱人，哪怕这是女人的本性，哪怕立场问题，哪怕成王败寇，但是基本的是非还是要有的。
455,色，戒,2,褒扬什么，贬低什么。李安一点概念都没有，女主角被性快感所征服，看的人实在是不舒服。
456,色，戒,1,拍的很认真，但我非常讨厌。不仅仅是对女性狭隘的揣摩对历史偏狭的解读，而是他试图虚无化的东西恰恰是真正推动社会进步的精神。严重扭曲了张爱玲原著的女权视角，代之以男性意淫，龌龊不仅仅无法理解崇高，甚至还要用自己的恶意去揣摩消解崇高
457,色，戒,1,真心不爱看，汤唯身材太差了。
458,色，戒,2,好长。。。。。。。。。。。。。。。。。。。。。。
459,色，戒,1,简直就是部色情片~！
460,色，戒,1,着一颗星给的是画面，情节决不给分！
461,色，戒,1,不得不说太色了..我是在教室里看的，简直觉得要疯了
462,色，戒,2,即使前面没有海上花和花样年华，室中戏和男女戏都不好看，陈冲还有点感觉，其他人演得都不那么舒服
463,色，戒,2,"就是不太喜欢 没办法
"
464,色，戒,2,快进着看就足够了
465,色，戒,2,中关村 美嘉
466,色，戒,2,没看明白~
467,色，戒,2,不知道我是不是对李安有偏见。总之真没看出好来。。。
468,色，戒,1,我把它加入列表就是为了打一星！
469,色，戒,2,汤唯是很美的，表现性的尺度是够大的，除此之外没有了
470,色，戒,2,不喜欢汤唯
471,色，戒,1,我看的是未删减版 烂人
472,色，戒,1,看了无数影评说李安想表达什么，不过真的看过，即便顺着影评人的思维，不抱任何政治偏见，我仍然不能确认李安真的想表达什么。除了色诱，幼稚行事和无休无止毫无美感地做爱，张想imply的东西在我看来一样没好好表达。李最失败的一部片子。
473,色，戒,1,"引用网友的话,中国站起来了,李安还跪着"
474,色，戒,2,汤唯的裸体减分
475,色，戒,2,当年看时正是义愤填膺的年纪。。。
476,色，戒,2,很多禁忌话题，“对伦理道德的模糊认识”，李安在这方面确实像个羞涩的处男，他始终没有足够的勇气去单刀直入，《断背山》和《色戒》表现得非常明显，当他想不通或者不敢往下想的时候，就会用温情的场面去掩盖问题。
477,色，戒,2,没感觉...
478,色，戒,1,寝室看的未删节版。
479,色，戒,2,被时光网和谐了，特此添加到豆瓣，一晃竟然4年过去了
480,色，戒,2,看不出和爱国有什么联系
481,色，戒,1,幼稚的不喜欢小梁演坏蛋，幼稚得觉得坏蛋该被收拾了
482,色，戒,2,我真不觉得这电影咋样，还行吧。对女主的心理描写太少了。对她的成长描写也太少了。告诉你，男人不可信
483,色，戒,1,好好一个故事，被床戏喧宾夺主。
484,色，戒,2,就是个色情片 
485,色，戒,2,看了《色戒被删除的片段》，觉得不好。另外汤唯声音太难听了。
486,色，戒,2,价值观有问题 女人果然只能坏事。。。。。。本来就很SB的主意，毁在一个更SB的女人手上。。。。。。。这150多分钟真是有意思啊。。。。。。。。。。。。
487,色，戒,2,开始不喜欢了，不说他掩盖真相，只说他对不起一些灵魂
488,色，戒,1,没看过原著，也没觉得哪儿劲爆了，就是梁朝伟的屁股在屏幕上乱晃
489,色，戒,2,此类片极难评分，给低了别人说你就冲着看毛片去的结果不过瘾故意低分吧，可高分他妈这片也配？！
490,色，戒,2,争相模仿的一些镜头。。
491,色，戒,2,对这部片子不愿思考太多，太伤脑细胞。实在佩服网上某些达人。
492,色，戒,2,故事情节一塌糊涂，要不是因为有XX场面估计没人去看了。
493,色，戒,1,没意思。无脑青年用爱国情怀怂恿无知少女引蛇出洞，却没想少女被一个有性虐倾向的人弄出了快感也弄出了精神病，最终还是没能逃出女人们最大的弱点：硕大的钻石。在美色与钻石面前，她居然相信她和蛇已然相爱。错觉而已咯，蛇终究是蛇，里面的人死得不冤。这电影纯粹是革命青年的高级黑。
494,色，戒,2,炒作过了头的电影
495,色，戒,2,据说扭曲历史真相
496,色，戒,2,没有想象中的惊艳，看完感觉很闷
497,色，戒,2,汤唯的演技还是可以的，可由于内容太过……可惜了
498,色，戒,2,You are needed
499,色，戒,2,"从什么时候开始，李安和张艺谋一样让我“望而却步”“闻风丧胆”了

2星是为了梁朝伟……始终觉得他比刘德华帅多了"
500,色，戒,1,除了床戏，我什么都不想看，结果广电还把床戏删了。。。
501,色，戒,2,不喜欢这个故事，大概是剪了太多的原因，觉得很干涩，内容很粗糙。但是喜欢汤唯在里面的感觉，有时青春的刺眼，有时高贵的迷人
502,色，戒,2,我没内涵
503,色，戒,1,比想象的剧情差好多...l
504,色，戒,2,没啥好看，就是黄的特点，去掉黄更没得看
505,色，戒,2,被最后王佳芝气得个半死 鸽子蛋之前没看出半点她爱上易先生来
506,色，戒,1,我就不知道该说什么了，反正看了这部电影后梁朝伟在我心目中的形象就彻底毁了
507,色，戒,2,汤唯怎么看都是鸡并且是那种其实是鸡但是又想看起来是贞洁烈妇的那种鸡，两分分别给陈冲和梁朝伟
508,色，戒,1,就是个色情电影
509,色，戒,2,除了情欲没有别的内容
510,色，戒,2,不连贯，不激情，王力宏特傻了，汤唯手臂特粗了，梁朝伟眼睛都要斗鸡了
511,色，戒,2,"我承认我色女一枚，专门下了未删节版本的来看。。。
结果挺失望，此片就是典型的商业片~~噱头只有“性”！！！真的要看还不如去看某国某片呢~各种口味，任君选择~~打着纪念张爱玲的幌子，选了《色戒》来拍，真是过分。。张有那么多优秀作品，独独挑这部小说拍，目的很明确，就是为了票房呗。。。"
512,色，戒,2,一帮十三点拍了一部下作片
513,色，戒,2,乱七八糟
514,色，戒,2,“只你一个眼神，我便丢盔弃甲溃不成军。我终于跳入你眼睛的深渊里，义无返顾。”
515,色，戒,2,惭愧的败笔，不过是让大家欣赏一下梁朝伟的鸡巴
516,色，戒,1,电影是不是要有社会责任，既然是给大众看的不是为满足编剧作者导演自身欲望的片子，就必须考虑到他带给大众的影响。没人规定要按照大家有点看得生厌的为了抗战付出身体，反过来还有人叫好，多半是出于此。本片除了性欲与变态的爱恋我看不到其他，如果非有人说本片表达了什么人性，我只能说“TMD“
517,色，戒,2,梁朝伟啊！阴影啊！
518,色，戒,1,李安是变态？我可欣赏不了，我不爽是因为我错过了经典版本，我啥也没看到我，真是亏。
519,色，戒,2,看见梁朝伟在电影里那棺材脸。。我这个想扇人啊
520,色，戒,2,汤唯做人不错，演技真的不咋样。瞪着眼睛就是欲望了？没感觉。
521,色，戒,2,完全没有感觉。。。
522,色，戒,2,体会是，爱她就得干她，肉体上的表达远胜过千言万语
523,色，戒,2,终于看了一遍完整版，易先生之所以可以做个成功的汉奸，可能就是因为他有为了自己可以杀了心爱情妇的勇气，梁朝伟的屁股真丑，汤唯的皮肤真差，王力宏这个角色真是弱爆了，可恨啊！但是十年前的镜头化妆技术真的那么不成吗，这个星是给汤唯的勇气
524,色，戒,2,冲着被删镜头去的
525,色，戒,1,玷污爱情之作~
526,色，戒,2,只有SEX
527,色，戒,2,一群傻逼学生想出的傻逼办法
528,色，戒,2,除了新奇的姿势外，我找不到夸它的理由
529,色，戒,2,他爱不爱她，我是不知道了。如若他们自己知道，便好，至少不会如花事般枉费。
530,色，戒,2,做作。里面的人物关系都是分离的，演员间相互也没磁场。
531,色，戒,2,我承认，电影比较准确的还原了原作。而我既喜欢张爱玲的小说，又喜欢李安的电影。但不得不说，这个故事，张爱玲讲，那是深刻；李安讲，那是荒诞。
532,色，戒,2,我低俗，我无知。这一个破故事 讲的这么亘长
533,色，戒,1,"2008-1-11
不知道说什么了，如果这是艺术，那好吧"
534,色，戒,2,就一三级带个艺术片帽子 我不得不带眼睛看它
535,色，戒,2,精彩部分很精彩
536,色，戒,2,画面精致，内容不堪一击，床戏是为了拍而拍的吧  （1、如果当初是邝裕民 2、果然钻戒是真爱啊
537,色，戒,2,太过裸露的镜头和叙事我十分受不了。
538,色，戒,2,汤唯一脱成名，王力宏像个傻小子。
539,色，戒,2,可能是太文艺了？....一介草民看不懂，不知道想表达什么....
540,色，戒,2,。。。除了结尾比较不错之外，实在找不到其他圈点的地方的，拍XXOO戏为什么连腋毛都不刮干净呢。。。另外，我想起以前在网上看到的一句话：中国毁就毁在大学生手里。哈哈，有点意思。
541,色，戒,2,安女郎也不一定就会红・・・・・
542,色，戒,1,笑点：“现在这种时局气氛，谁还有心情看这种布尔乔哑的东西？！”；“我们要敲锣打鼓，把他们叫醒！！”；汤小姐他们做作的话剧：“提防”读成“TI防”；“我们有枪，干吗不先杀俩容易的，再不杀可就要开学了~~”。。。。
543,色，戒,2,经典台词：“再不杀就要开学了。”
544,色，戒,1,我不喜g∏榻不起推敲的肉片
545,色，戒,2,有点儿血腥，不是很喜欢，觉得汤唯和王力宏的表演没太有真实感，梁朝伟呢~ 哪部戏都一样啦
546,色，戒,1,只有无耻的中国人才能拍出这样的电影来!
547,色，戒,1,天涯有篇号称真正看懂了的影评。我们可能真的都没完全看明白！
548,色，戒,2,不如直接叫《色》吧...
549,色，戒,2,我爱汤唯
550,色，戒,2,一部失败的色情片
551,色，戒,1,不如看AV
552,色，戒,1,其实就是一个阉割版AV。
553,色，戒,2,这电影除了汤唯和情色还有亮点么？
554,色，戒,2,这两星是给床戏的
555,色，戒,2,不是说什么色情不色情的关系，而是这堆人的戏真的不咋D~特别是王力宏。汤唯被炒的沸沸扬扬，现在复仇了，很多人支持，貌似是这样，但我不得不说，她的戏真的一般。唉~
556,色，戒,2,靠噱头的电影
557,色，戒,2,我承认我把汤老师当苍老师看了
558,色，戒,1,我快进看的，真的很没意思
559,色，戒,2,我是冲着张爱玲去的，可是那句“再不杀人就要开学了”实在是把我雷的够呛。不知道编剧有没有被张小姐的在天之灵骚扰过。。。。。。。。
560,色，戒,2,不痛不痒！无聊！知道为什么宣传时只在大肆宣传情欲戏了。
561,色，戒,1,呵呵，昨天看了一部讲脱衣舞女郎和有钱潘糠⑸感情感情的美国人独立电影，也比这做出来的戏强。用逼真的床戏侮辱了爱情还侮辱了革命烈士，这他妈的才是艺术家啊！
562,色，戒,1,不喜欢这部电影。完全理解不了想表达什么，爱情最大？先有性后有爱？
563,色，戒,2,张爱玲应该改名叫作张爱情，李安则肯定是伤过谁的心。这种天平座脚本改变的让天平座导演的爱情，真是让人受不了。还好，没有把那句什么辜鸿铭的话套进去。唉，总之，扭曲的爱情，让人不舒服。为了印象深刻，就要这样么？
564,色，戒,2,因为这部电影，不喜欢梁朝伟了～
565,色，戒,2,我能说我现在才看过色戒么，还特么完整版的，我要是广电总局，早就封杀了汤、王、梁、李了好么？爱情动作看到想吐，我是一个人么？就不能自作聪明自我感觉良好的去看这部片，有更多的方式表现主题导演你一定要这样么?
566,色，戒,1,终于看完了无删节版的，片名其实完全可以浓缩为一个字以节省油墨，如果让我弄个导演剪辑版，本片基本片长为6分钟，分别由上半部14～16分钟，下半部33～36分钟剪辑合成。除了著名的回形针体位外，本片基本不会让人留下深刻印象
567,色，戒,2,如果打三星的话就太对不起王家卫拍的花样年华了。。。
568,色，戒,2,只记得王力宏在里面特213。
569,色，戒,2,色啊色
570,色，戒,2,当年为了看裸露镜头，结果非常失望。整部片并不好看。
571,色，戒,2,汤唯很美；灯姨太倒人胃口；不知何时已经不觉得伟仔帅了
572,色，戒,2,垃圾的剧情
573,色，戒,2,这片子是给华人看的？还是又一部面对西方的普及中国文化之男女性爱篇？
574,色，戒,2,我所看过最差的李安
575,色，戒,2,没达到安哥的平均水平啊
576,色，戒,2,又臭又长。
577,色，戒,2,老婆，一星给电影，一星给汤唯，原先不喜欢她的，现在觉得她终于也是用时间证明了自己。
578,色，戒,1,王力宏一出场我就看不下去了。小时候是黎明，中学是王力宏，一看到他俩我就起鸡皮疙瘩，感觉特别做作，不真实。曾经有个印象很好的相亲妹子，约我去看王力宏演唱会，看完。。。。。。。
579,色，戒,2,红果果的糟蹋了。。。成为寝室性爱教育片
580,色，戒,1,"浮于形，糟于理！
假戏情真的“情”太牵强了，触觉不到真，一切仅仅是为了演而演！shit！"
581,色，戒,2,喜欢张爱玲，唯独在这样的时代背景下让我有种“哀其不幸，怒其不争”之感。中国人到底在那个时代经历了什么，承受了多少不能承受之重才有了今天来之不易的生活。在那样的时代背景下，还真就体现了资产阶级和知识分子的软弱性，这就是为什么后来需要工农武装。从另一个侧面，更体现了毛和周的伟大！
582,色，戒,2,小女人成不了大气！
583,色，戒,2,点播台放的…，有点危害青少年…
584,色，戒,1,"精神产品的质量和社会效果,会共同影响整个民族的文化气质。你能从《色戒》上感受华夏的文化气质，感受社会效果？最多不过是个精美的鼻烟壶。一个爱上渣男的烂故事，一个替汉奸胡兰成之类洗白的电影，吹得神叨叨的，中国就各种满足洋人猎奇心态的容易得奖。啥时不一脸媚骨地靠洋人的褒贬来为电影贴金，才会有中国电影真正的地位。"
585,色，戒,1,这是一部怎样无趣到底的A片啊!!!
586,色，戒,2,= =非常讨厌 王力宏
587,色，戒,2,估计好多人来看，是带着异样的心情，
588,色，戒,2,已经看过快走那一段了怎么破 我觉得拍的一般 这么能作的大学生...不科学 最大的BUG：易不派人监视麦的房
