,movie,star,comment
229,驴得水,3,不要跟《夏洛》比，两种类型。喜剧性不强，基本算剧情片，但荒诞的黑色味道比较浓。因为源自舞台剧，剧本比较扎实，表演也很不错，特别是演张一曼的（据说没有舞台版好）。但电影的质感很有问题，服装令人出戏，角色背景模糊，民国环境非常可疑，这些都是戏剧改编中出的问题。本来能拍得更为厚实、有劲
230,驴得水,3,友情提示：这不是喜剧。最后要不是投奔了延安，估计就过不了审了。“我可以容忍知识分子的脾气，但也是有限度的。”超浓重的话剧腔，无论是演员的表演，台词的节奏，还是推动观众情绪的方式。所以它的好全都是原作的好，跟电影没啥关系。衷心希望开心麻花团队的下部作品能是原创的电影作品。
231,驴得水,3,没那么好，也没那么差，一个有趣的小故事，薛蛮子大战王全安。
232,驴得水,3,老觉得在看话剧，看了半截都入不了戏
233,驴得水,3,故事文本辛辣，电影语言粗暴，大有提升空间
234,驴得水,3,一曼凭什么会疯？如果她代表的是美和自由，那美和自由凭什么如此脆弱？如果那真是她的信念，就会具备极大的韧性，如荷叶承雨珠，雨珠终将滑落，而叶面不染。后来我明白了，美与自由只是她的追求，远未成为信念。她到此处的目的就是逃避，逃避为想要的自由招来的污名。而逃避者终将垮掉。
235,驴得水,3,前半段的女教师异常精彩，群戏对话一句多余都没有，句句都出人意料地好看，完全不走套路。后半段泄了。
236,驴得水,3,3.5吧，故事真的挺不错的，但是整个电影给人的感觉就是“简陋”，道具像从剧场舞台上直接搬过去的，演员也像在演话剧，总之就是不太像电影。不过长得像冯巩的女主真的越看越美啊……我的审美可能没得救了？
237,驴得水,3,无论是特定年代封闭场景的设置，还是演员说话接话的方式，乃至于情景剧式的镜头调度，都给人非常强烈的舞台感。前半段是逗乐喜剧，摸准观众笑点依旧是开心麻花的本事，后半段展现了小团体内部价值观的激烈冲突，风格也走向讽刺荒诞。说实话，看完心里五味杂陈，不知如何评价。
238,驴得水,3,荤段子飚的有点猛，基本上是照搬话剧的台词，也间接体现了导演的不自信吧，电影语言技巧不够，只好拿原作来支撑了，另外这评分8.3有点可怕啊。
239,驴得水,3,勉强及格吧，喜剧的份额不多，前面把架子搭起来以后后面就开始砸了，挺标准的悲剧拍法了。这片子是以民国为背景用身份喜剧桥段表达了个自由其实是性自由在现实中折毁的主题，虽然女主在后面被遗忘了，但演员表还是这么排的啊。这种姑娘我是喜欢的，来找我的都是这种姑娘，我应该保护她们，以前没做好
240,驴得水,3,"故事是个好故事，但好故事≠好剧本。电影意识稀薄，作为电影质量不如《夏洛特烦恼》。
导演说剧本最初是为电影准备的，但从镜头运用、场面调度、服化道再到表演，甚至剧本本身都是满满的话剧味。所有灾厄压在同一个人身上，开头为表现众人简单美好，每场戏每个人全都笑眯眯的，直接观感就是：“怎么连NG条都剪进正片里来了？”"
241,驴得水,3,成也剧本，败也剧本。对于人性丑恶展现的淋漓尽致，极其压抑，因为太真实，太残忍了，不忍心看下去。可是话剧和电影真的不一样，电影镜头语言倒还好，可是剧本细节还是没有好好打磨，整体太刻意了，人物性格虽然完整并且很典型，但转折做的太僵硬不自然，没有过渡。另外年代感的缺失也是片子的问题。
242,驴得水,3,5分。看似一波三折的故事，其实缺乏有力的内在推动，分明好几条路可走，偏偏要选最悬的一条然后把自己逼上绝路，这就是它剧作结构的基本思路。矛盾靠嘴说，有人从这些大吼中得到自嗨，跟电影本身无关。非逼你哭，不哭就戳，很反感。直男癌视角，任死得令人尴尬。但扔烂片儿堆里算不得最烂，给个鼓励分
243,驴得水,3,如何将一个话剧班底创作的故事搬到大银幕上，而不让习惯了电影节奏和电影表达方式的观众不产生割裂感和距离感，这是开心麻花目前所急需要解决的问题。故事是个好故事，剧本创意不错，演员演技也是好的，就是观影时明明坐在影院里却时不时被拉到春晚现场，你们考虑过这种瞬间出戏的纠结感吗？
244,驴得水,3,不觉得三观有什么问题，所有不舒服的都是在讽刺，这么简答的用意get不了吗？当然讽刺的方式真的很残酷、很刺痛、很丑陋，每个人都变得不像人了，这种狠劲儿真少见，也很大胆。争议大是肯定的，我也不认同这种讽刺方式，已经离开了讽刺喜剧的范畴，成为人身攻击互相检举式的电影了。
245,驴得水,3,第一次看见这样的女主角，放荡的不给自己找任何借口，但这样的人不该轻易被摧毁。就像这部黑色喜剧，最后失控到成了悲剧，总有点不能坚持到底的脆弱和矛盾。
246,驴得水,3,68/100 “开心麻花”出品，但《驴》不是一部以喜剧为目的的电影。从头到尾都像在做一场话剧直播，舞台剧的台词为了在缺乏特写的情况下抓住观众，通常写的比较富有情感和戏剧性，但现代电影整体趋势是追求不露痕迹的写实，舞台剧本改不好会伤害到电影所表达的主题。虽有讽刺，但整体还是隔靴搔痒
247,驴得水,3,铜匠演的真好，憨的时候像学校被霸凌的孩子，怒的时候像老家村口死了爹娘的流浪恶汉
248,驴得水,3,国内不如多拍拍这种喜剧片，多好呀，总比用烂片来充屏幕的好。剧场出来的演员，演技真是秒杀一众小鲜肉。
249,驴得水,3,简单粗暴的荒腔走板。告解体制化溃疡与人性窟窿的寓言有足量令观众津津乐道的社会观照。可到底是小品化还是话剧化？人物形象只靠对白，影像语言的功能扁平得就像那场婚礼戏中的国父像
250,驴得水,3,感受很纠结，在说不上喜欢和不那么喜欢之间挣扎，从讽刺喜剧到人间悲剧的表达失态，为了荒诞而荒诞，为了批判而批判，让人难受。优点除了中国历史微观的演绎，就是女主角一个人撑起全片，这个身体主义的情怀担当，成为让人感动又难能可贵的银幕印象 。 是一部生猛而尖锐的电影，荒诞有余，魔幻不足。
251,驴得水,3,就是个悲剧版的《新龙门客栈》呀，一曼=金镶玉，铜匠=鞑子，专员=大档头，etc.
252,驴得水,3,前半和话剧简直一模一样，后半加进去的一些改编不是很喜欢。话剧舞台上很自然的一些夸大表现放到电影显得有点刻意…整体还是更喜欢话剧。当年那首让人着迷的《我要你》，现在终于被更多人听到了。
253,驴得水,3,讲讲道理 以电影形式呈现 能打8.4分？？？当然我承认剧本确实出色 表演也有力度。这部电影告诉我们一个道理 把话剧拍电影又便宜又赚钱 还能赚更多的人气
254,驴得水,3,好堵，这个本子为了给人添堵不遗余力，戏好看但戏的痕迹太重！同是两个小时，话剧在狭窄的空间里尽可能多的放大剧情放大人性，反倒是电影少了空间的束缚语言更为自在，但话剧的本子碰上电影的表现手法，这些激烈的冲突反而变成了叙事上的负担，话剧演员到电影演员从身体到表情的的过渡稍不注意就会过火
255,驴得水,3,看了个舞台剧。前半段挺喜欢，后半段开始制造冲突矛盾，刻意地拙劣地提供可供解读和嘲讽的人性与时代黑暗，最适合没读过多少书又有点思考的人。以及，看到用大嗓门和激动表情来突出冲突真是头疼。当代国产戏剧怎么还这套。主创觉得纯粹喜剧太低级了所以想给你来点深刻达到笑中带泪的效果拉鸡巴倒吧
256,驴得水,3,好看，很久没看过这么走心的电影了
257,驴得水,3,感觉还是在看话剧。
258,驴得水,3,作为舞台剧，本子的功底很强，还有一定的空间感。作为电影，各方面简单粗暴，表演夸张全靠吼，外加强制营销和圈钱动机，开心麻花吃相难看了点，但无碍这是一部荒诞、黑色、癫狂的魔幻现实主义正点作品。
259,驴得水,3,无疑是个好剧本，但剧作上的缺陷放置大银幕被无限放大，包括人物性格起承转合等等。这也体现在创作态度上，导演没花心思（或者说没能力）进行电影化的改编，舞台式的表演台词都太尴尬了。
260,驴得水,3,佳佳去投奔她大哥了，我们又能投奔谁呢？
261,驴得水,3,最后竟然是去延安…
262,驴得水,3,非常好的讽刺性黑色暴力舞台剧拍成了电影显得有点尴尬。应该是中国内地影史最讽刺的一部，从开头国民党旗到最后跳球乱飞，每一幕都是嘲讽政府和劣根性的中国人，美国佬一句不可思议的中国实在是画龙点睛。看的特别不舒服，很多地方都觉得拍的很别扭。最大的讽刺就是套用了国民党的棋子通过了审核吧。
263,驴得水,3,感觉铜匠很像《血色将至》里的保罗・达诺
264,驴得水,3,并非话剧改编的典范，叙事目的性高过对人物细节的描摹，殊不知后者才是讽刺意味的关键。
265,驴得水,3,很好的话剧，很差的电影，换个导演就好了。一曼仿佛是另一个王佳芝，经过时代洗礼的大部分我们都跟铁男一样。
266,驴得水,3,不喜欢。能看出用了心思，但就像袁袁说的，强行搞笑和强行拷问逼你反思人的“劣根性”，都让人不适。试图喜欢张一曼，失败了。
267,驴得水,3,舞台剧改编而来的电影，舞台感还是很强。相对单一封闭的空间、调度、表演和剪辑，整体视听语言差不多就是情景剧的水平。剧本提供了很好的内容，但没有利用好电影的形式，算是白瞎了摄像机这颗眼睛。那些讽刺于我无甚痛痒，但表现了女性自由，我愿意多给半星。★★★☆
268,驴得水,3,剧本有严重缺陷，人物性格突转生硬。（豆瓣评分8.8，好友评分6.6，事实证明还是好友评分靠谱一点
269,驴得水,3,跟荃看的第二部电影，好想法，但不是好电影，太闹了… 而且里面的人都有点太MDZZ了，对小个子裴与铜匠的人物刻画丰满。
270,驴得水,3,可见知识分子真是最没骨气的一群人。
271,驴得水,3,"通过牺牲别人抵达的信仰不叫信仰，是私欲。
痛过龌龊谎言实现的正义不叫正义，是罪恶。"
272,驴得水,3,和很多没看过话剧的朋友一样，会觉得这是一个非常结构工整、人物丰满、意蕴深远的牛逼话剧，但确实丢到银幕上，就像是舞台实景化，始终缺乏电影感。
273,驴得水,3,电影元素呢?叙事呢?故事性呢?
274,驴得水,3,并不非常喜欢，因为好多段是黑色的部分只有黑色，幽默的部分只有幽默。人是复杂的，而不是一个契机之下说翻脸就爹妈都不认的。光拍出丑的部分是可以要多丑有多丑的，我可以想出更多的方法伤害一个人。但拍出人复杂的部分就不容易了。将丑恶夸张地拍出来只让人生理不适，但不会让人共情。
275,驴得水,3,本片的最大贡献难道不是发掘出适合扮演毛岸英烈士的特型演员阿如那吗？
276,驴得水,3,很好地解决了戏剧票价偏高和一旦坐在后排就完全看不清演员表情的问题。一个猜测，戏剧电影可能会在未来几年频频在中国银幕刷脸，怎么拍没想清楚，想好怎么演就行。Incredible China！
277,驴得水,3,这片足以说明有着话剧的功底去拍电影不会差到哪里去！结尾的处理有点差强人意，剧中布景真的是几乎没有，话剧舞台搬到了户外的感觉！至少我没见识过从头至尾一个学生影子都见不到的学校！
278,驴得水,3,论如何在一点电影思维都没有的情况下拍一部电影。
279,驴得水,3,这不是一部电影，很廉价。但是故事很好看，请那些电影导演、编剧好好学习。
280,驴得水,3,荒诞的故事，真实的案例。最悲惨的受害者永远是女人。
281,驴得水,3,演得有点过，但比《夏洛特烦恼》是要好的
282,驴得水,3,后半段实在太刻意了。穿貂的男人果然都是狗。
283,驴得水,3,把话剧舞台放到旷野了，几乎不算是电影。是违背布列松的，也把演员相对于模特的劣势充分地表现出来了。不过没关系，制作者并不在意也无需在意这一点。
284,驴得水,3,故事性很强，话剧舞台风很重
285,驴得水,3,真实，才可怕。人物强行转变，批判力度锐减。以及，塑造女权的路径，就是造出一个荡妇？
286,驴得水,3,兔子不吃窝边草，约炮不找身边人
287,驴得水,3,这就属于各种方面都不怎么太好，但观感很好滴片子，赢了。
288,驴得水,3,我就想约个炮，你们怎么就当真了呢？
289,驴得水,3,1、跟《夏洛特烦恼》一样，很像小品，电影化程度不够，台词表演来凑；2、女主演的尤其好，一个内心炽烈的奇女子；3、剧本很完整没有拉分，可喜可贺。
290,驴得水,3,想对用逼良为娼来粉饰太平的乌托邦，认真的由衷的说，操。很欣赏电影在审查制度下，努力把讽刺的力度最大化，但原谅我实在恶心裴魁山骂张一曼的戏，恶心这种对女性先捧后踩的把戏，即使是为了讽刺，也让人十分反胃。
291,驴得水,3,似电影 非电影
292,驴得水,3,表演的太露了，还是像话剧。
293,驴得水,3,诚意十足，水平有限。
294,驴得水,3,加长版小品的感觉，充其量算是加长版话剧吧。故事还是不错的，荒诞得挺到位，但是一到高潮还是hold不住，闹得脑仁疼。至于为什么要拍成电影，因为小品话剧不赚钱，电影赚钱呗。
295,驴得水,3,剧本勉强可以看下去，但作为电影实在糙得过头了，每个桥段都让人替导演和演员尴尬得不行。。就不能有点耐心请几个正儿八经学过电影的人来帮忙好好打磨一下嘛。
296,驴得水,3,故事不流常有做作之嫌
297,驴得水,3,一是铜匠败坏的程度和速度，太过。二是看似一曼被摆在最让观众怜惜的位置，实则仍是百分百的男性立场，因为两个极品渣男之所以成渣渣，罪在女人放荡。
298,驴得水,3,有趣并不是构成一部好电影的完全理由。
299,驴得水,3,无论是剧本还是视听语言上都不能算作是电影，只不过话剧锤炼出来的故事相对扎实，掩盖了这些对于电影来说可算致命的缺点。总体还是在大银幕看话剧的观感，全片连个高潮都没。优点是，赵一曼这个女性角色很进步啊！
300,驴得水,3,人物转变没有逻辑，在剧场是可以用其他取代，电影就不行了。
301,驴得水,3,越看越泄气，太自作聪明了，人物扁平，喜剧元素与批判性完全割裂。搞笑是为了卖钱，悲剧色彩是为了赚口碑，太鸡贼了。
302,驴得水,3,只能说国产电影好片的确太少了，所以出个还像样的就被捧上天啊。这部够讽刺够荒诞。但也很可以很生硬。只想说，一曼这个讨巧的角色如果换成男性，只会过街老鼠人人喊打吧？所以在这个要求两性平等的时代，这算不算是另一种性别歧视？
303,驴得水,3,感觉看话剧应该会更有气氛，作为电影来说还是有点哪里尴尬得慌，难进入状态。
304,驴得水,3,跟十二公民的问题一样，表演太用力，舞台痕迹太重。除了远景就全是中近景，场面调度基本负分，熄灯式的强切比比皆是。感觉回到了梅里埃式的舞台实录，对话剧剧本的原番不动从一定意义上就是对电影形式的不尊重。
305,驴得水,3,经历剧场洗礼，剧本很扎实，但毋宁称之为小品。既想要后半段正气凛然，又丢不开前半段假装喜剧，洒狗血表演很容易煽动观众情绪，在舞台上能让戏剧冲突传到最后一排座椅，在大银幕上就只能甩人一脸。上帝之手拗剧情，人物纯属设定，所谓针砭时弊也是赶时髦的媚雅，至少迟到二十年。三星。
306,驴得水,3,演员表演话剧范儿太足。反而不是特别好的电影感。如果去看话剧应该特别棒！总体来说是部很好的讽刺喜剧。
307,驴得水,3,我的情郎 你在何方
308,驴得水,3,故事蛮有特色，前喜后悲，然而这片让不懂电影语言的人来指导，实在可惜。
309,驴得水,3,没救得了驴，没能教好人，孙佳的离去带着股子幻灭与心碎的决绝，舞台剧《驴得水》的影版，依旧辛辣尖锐犀利，直指体制的弊端，拷问人性的弱点，小格局里浓缩百态，旧时代里针砭时弊，虽有起承转合、表演过猛的小瑕疵，但瑕不掩瑜，令人悚然的不是荒诞和死亡，而是造成这样荒诞和死亡的原因……
310,驴得水,3,太不电影，但故事够好。官府就是打劫的，知识分子无论忍辱负重的天真刚强的虚伪势利的愤怒叛逆的自由直率的底色都是一样的怯懦，莫名其妙的优越感和大事不拘小节的自欺欺人，群众感情是纯朴，一朝得势比官府还狠。这戏码演了多少年了，这死结谁知道怎么破？
311,驴得水,3,真的很不错 三星半
312,驴得水,3,故事太刻意，下半部特e崩摹４蠹矣X得好，我想是因樵诖笪幕上偶然看到了〉镊攘Ρ徽痼@了吧。
313,驴得水,3,许多人以为张一曼足以代表女性性解放，是女权标兵。可是一旦她被人强奸（铜匠和众人的侮辱可谓精神强奸、大兵是差点儿肉体强奸），就将此恐惧内化，在精神上被摧毁，这算什么女权？她跟那个小知识男青年没有任何区别。
314,驴得水,3,话剧改编成电影的代表，《十二公民》，《费城故事》，《欲望号街车》，部部经典。可是这部，总感觉缺了点儿什么，论话剧，没有激昂的台词陈述，论电影，又没有场景调度的亮点，平庸之作……
315,驴得水,3,阳光照不进窗里
316,驴得水,3,这是不好看但又做作的电影，故作深刻又对片中人物毫无同理心，像是一个人性实验室，把预想好的结果，一步步引向失控的局面
317,驴得水,3,讲出，事情就这么过去了，就会越来越糟，已经很可以了
318,驴得水,3,简单粗暴，喜欢不来。角色和符号指涉越简单，越露出现实对作品的消解。作品对电影和现实的双重消解。人物是概念，真正可惜了作为摆设的外景。不仅是大嗓门，还是东北话大嗓门（狠）。语言的构造在于，试图使用流行语贴近生活（现实），大嗓门则告诉你这是做戏（概念），最后交代一句去延安才是真相。
319,驴得水,3,看了，觉得蛮不错的
320,驴得水,3,有点不知所谓。心太大，手没跟上的电影
321,驴得水,3,唔...算是对开心麻花的成见有所改观？但客观来说，用一部优秀的话剧剧本套在电影里是非常笨拙的，矛盾设置也显得生硬刻意。好在舞台剧的表演经验加持了演员的表演技巧，使得整体观感还算流畅投入。仗义每多屠狗辈，负心多是读书人。这片子倒黑的彻底，连屠狗辈也不仗义了。
322,驴得水,3,还有得学，一曼不错。
323,驴得水,3,扎实的三星，没看过舞台剧，也理解过于舞台剧的表现。但不应该双重标准，国外也有很多舞台剧式的过分戏剧化的高分电影。故事剧情完整，情节推进节奏非常好，不拖沓。黑色幽默中的夸张人物塑造我倒觉得没有什么问题，这个又双重标准了。表述讽刺得过于直白反而无法引人深思，只剩感慨。总体很好！
324,驴得水,3,幸好1942年没改成1992年，不然这片就黄了。演一曼的演员会红
325,驴得水,3,结尾处理的不好，假高潮。全片有极大的人物变化和几处大反转，骂知识分子，揭人性，可以再过分一些。人，说是接受了教育，比其它动物高明，有底线，其实恰恰相反，世间大恶。
326,驴得水,3,话剧感超重的片，也正因有了心理准备，对后段看似突兀的反转倒觉得可以接受。看完之后有种吃东西不小心把包装也一起咽下的不舒服感，可能是用力过猛，亦可能话题太敏感。但不可否认的是本片给足了大家讨论的话题和空间，单从这点就该鼓励。
327,驴得水,3,1、话剧味太浓，腔调明显，格局有限。2、喜剧效果不错，脑洞有一点，但也就如此而已。3、借古讽今？呵呵。
328,驴得水,3,中华土味魔幻现实主义
329,驴得水,3,讲了一个好故事，但是作为电影不够丰满。并没有所谓针砭时弊，所有的讽刺都是流于表面。
330,驴得水,3,铜匠和裴的转变令人悚然。无知而良善的人拥有了知识，反而变得暴戾狡诈；温和的知识分子一旦撕破脸面，无耻更甚于暴徒。去美国，并不是去美国，而是想逃到那世外桃源，逃去那永无乡。
331,驴得水,3,犯了错当然要承担后果，目的不是借口，把犯错的人扭曲成弱者就更无聊了，用这种方式警惕和质问权力其实是一种创作上的投机，这种级别的荒诞讽刺还非要说有力度有深度，那我只能劝你还是多看几部经典吧
332,驴得水,3,好戏，但格局太小，喜剧，但不值得同情。
333,驴得水,3,音乐加分。
334,驴得水,3,三星半吧。这个片挺可以说一说的。
335,驴得水,3,三星最多，你拍电影为讽刺谁，最后还投奔啥延安＃这是最大的黑色幽默吧？
336,驴得水,3,利用了认知的漏洞，能懂的就懂了然后死命的刻画不讲道理也不铺垫，刻意发力看的不舒服。
337,驴得水,3,故事有意思，但电影真尴尬。“去延安”是最好的神来之笔。
338,驴得水,3,剧场痕迹明显，带着看喜剧的希望去看的小伙伴失望了，而我在人潮汹涌里感受到人物的孤独11.12
339,驴得水,3,比《釜山行》更看透人性。有点太沉重，失控。
340,驴得水,3,行 超乎预期。买了张12.15的戏票，看完再补充。
341,驴得水,3,为了讽刺为了主题为了往人性上带就把故事往拧巴往揪心上编，再精彩也不是好剧本
342,驴得水,3,话剧感十足，剧本也很好，但不适合公映，大屏幕上公映的体验跟小剧场完全不一样，很多地方需要调整，不然就很尴尬。海报太有欺骗性了，引导观众预期是《夏洛特烦恼》那种爆米花喜剧片（营销策略？），如果冲着喜剧进影院，看完会有上当的感觉吧。
343,驴得水,3,情节真的有硬伤，黑色幽默也不够含蓄。
344,驴得水,3,果真，是借古讽今的电影。同名话剧当年挺火但没看过。前半段拍得好，民国小知识分子的意气奋发真有点动人。最喜欢的一幕戏大概是女教师一曼一边剥蒜，一边迎着风唱歌。嗯，到结尾这首歌又回来了。这一段拍得很自然。比后面的用力过猛都好其实。
345,驴得水,3,毫无电影感！太多刻意的舞台剧式情节 很生硬！最后孙佳不去延安找哥哥的话估计这个本子过不到审吧！
346,驴得水,3,为什么都要歇斯底里的喊啊。另外这哪里是喜剧了......
347,驴得水,3,开心麻花第二部，简直和夏洛特烦恼完全不同风格。舞台剧化
348,驴得水,3,这片子太污了，一会就开车，几个人一起看的，好尴尬的。
349,驴得水,3,本以为一曼那么放荡是有隐情，结果啥都没有，莫名其妙就完了，笑点也很干，当成故事片又舞台感很强，奇怪的观后感。给三星吧，以为又是一部爆笑的《夏洛特烦恼》呢
350,驴得水,3,前半段不错，但后半段有种崩坏了的感觉，校长也不可爱了，还给一曼公众道德审判，导演的视角不好。“我要睡服你”真棒！
351,驴得水,3,我有个小学同学叫：于得水～
352,驴得水,3,为了凸显人性之恶而不停地制造戏剧冲突……一切道理都用太直白的方式呈现……造作
353,驴得水,3,3星半。戏是真的演得好，这才叫演员。尽管因其话剧味偏浓而牺牲了电影这种媒介自身的优势。立意什么的也蛮好。但还是行为动机略牵强，也解释得过去，但不充分。即便如此，相比那些瞎J8乱拍的所谓大投资大阵容的国产片，此片还是很有态度
354,驴得水,3,三星半鼓励。剧本的优秀和演员的表演弥补了一部分观感的不适，不过实在难以称之为电影，类似舞台剧的形式完全破坏了影片该有的结构，有些地方糙的实在不像话
355,驴得水,3,喜欢上了这个长的并不好看但是却很吸引人的一曼，那首歌唱的真好。
356,驴得水,3,投观众所好的讽刺，有些做作，一曼纯粹是被自己睡过的，爱上自己的两个男人报复而死，自己也是作
