,movie,star,comment
112,驴得水,5,《驴得水》：剧本非常扎实，真正触及到了喜剧的本源，不仅笑点密集，而且揭示了人性的贪婪、懦弱和丑陋，也把现实中贪污腐败吃空饷的现象用讽刺和嘲笑予以否定，是借古讽今的高明之作。它的煽情不刻意，但却引人深思。班底都是新人，但话剧演员的舞台基本功到位，表演也一点都不成问题。★★★★☆
113,驴得水,5,剧本扎实，表演惊艳，这个故事告诉我们，一个蒙古大夫没那么容易被睡服，但是喜欢穿貂的男人一般都很怂。
114,驴得水,4,话剧式电影，中国政治版狗镇，影射尺度略大，审片员也太不走心了。incredible China。
115,驴得水,4,一个人的理想算不了什么，它就是一朵花，一根草，一个彩色球，但是一些人甚至一群人的理想很容易成为背叛或戕害理想的同谋。反而，控制一群人比控制一个人要容易得多。悲剧，从驴被人替代身份开始，善良最先被利用，自由最先被戕害，侥幸活下去的最后都成了老油子。
116,驴得水,5,在寒冷的冬日，窝在被子里，喝杯热巧克力，看一部好片，真是绝美的享受～
117,驴得水,4,很工整的一部黑色幽默荒诞喜剧，污段子运用的恰到好处，暗讽味道浓厚，可以说这是一部很丰富的电影，话剧味道依然很浓略让人感到不太舒服
118,驴得水,4,看到一曼跪下说我已经改造成功了，铁男说他们有枪，佳佳说过去了就过去了，以后只会更糟，我确定广电里中出了好几个叛徒。。。打底分的影评人啊，这片就是讽刺你们这些软弱的小资产阶级只能当当键盘侠。也根本不懂现在国内能公映这种水平的电影是多么难能可贵。
119,驴得水,4,1.百科说：有恃无恐，以其本末倒置的逆反的荣辱观与公平正义的荣辱观相对抗，就是真正的“婊子”。嗯，当今最大的婊子就是……2.贡献了一个难得一见的女性角色，不好么？3.剧作是真的好，如果你觉得浮夸闹腾，更说明了作者的能耐，这是当下讲诉这种题材的一种必要功力，迎合了大众也迎合了大佬
120,驴得水,5,周铁男发现自己没死然后扑通一下子跪下，让我感到绝望。
121,驴得水,4,犹犹豫豫地还是给个四星吧，其实应该是三星半的，半星鼓励。前半程是绝佳的讽刺喜剧，无论是尺度还是力度都是近几年国产片少有，但是从外国人来了开始全程崩坏，人物性格转变突兀，太浓重的话剧感令观众摸不到头脑，可以体会导演力图极度讽刺的良苦用心，可惜还是功力欠缺火候，没有收住。
122,驴得水,4,“如果过去就这么过去，未来只会越来越糟”。啊喜欢民国。
123,驴得水,4,啊 两处泪点 看得好难受 出了影院还很揪心
124,驴得水,4,微型中华人民共和国史，完美诠释了反右，大跃进，文革，改开的实质，以及苟延残喘的人们。
125,驴得水,4,喜剧的忧伤
126,驴得水,5,情节衔接有诸多生硬之处，但挡不住讥刺世人世相太准，看了痛快解恨
127,驴得水,4,今年最好的喜剧片不假，人人都在扮演牲口，最有意思的地方就在于这个“演”字，逢场作戏，人们却在自然反应和同伴的暗示下搬出了自己最天性的表演――谎言。任素汐的表演真是这三年来见到最直觉的，说她是中国的安藤樱我觉得一点都不过分，但是剧本的败笔还是在于凭什么疯女人一定得死？为啥一定得死呢
128,驴得水,5,怎么会那么好看！！！
129,驴得水,4,我没觉得话剧形式影响审美，我更看重主题和所指。喜剧只是壳，实则是悲剧。笑过之后，更令人觉得无奈。这电影内涵的很，处处在讽刺。“过去的如果就让它过去了，未来只会越来越糟！”也只能在民国了。。8.3
130,驴得水,5,热闹，幽默，辛辣，残酷！脱离不了话剧的影子，但对于好作品，好剧本，好演技，这都无关紧要。
131,驴得水,5,我能想到的悲剧就是剪去自由者的长发，剜去不羁者的膝盖，带走痴情者的爱情，泯灭天真者的稚嫩，扭曲逐梦者的理想。
132,驴得水,4,要不是昨晚浓妆艳抹，早都在电影院痛哭流涕了。
133,驴得水,5,2016年度最佳。最后的枪响再次让我想起易卜生的《野鸭》。理想主义和困局人性的抉择，对教育，权力和利益的讽刺如针入耳。真的很意外在2016年看到这样优秀的华语故事， 讽刺喜剧的巅峰，这片子会在中国电影史留下痕迹，我不潘只会随风入土。麻花主创团队赛高！
134,驴得水,4,这个电影，太不像电影了。
135,驴得水,4,太魔幻了，除了孙佳，我没有看到一点真情，每个人都把别人当工具。这件事之后，每个人都被文化阉割，男人们似乎觉得档中物还在，就可以重整旗鼓；偏偏是无法生理阉割的女人，再也回不去了。
136,驴得水,5,前有“夏洛一梦笑成麻花”准备做2333党，却从一曼落发回忆杀开始忍泪直到最后一枪，好一部乡村魔幻荒诞幽默！造梦者步步行骗竹篮打水，淳朴者丧失灵魂，怒血脾性被驯为牲口，宽者终究冷漠善柔，反抗者若蚍蜉撼树，而山间那向往自由的曼丽野花迎风而{。得承认电影化程度不够，但这剧本我真不舍得扣星啊
137,驴得水,5,张一曼扇自己巴掌实实地震撼到我了
138,驴得水,4,这根本就是个披着荒诞外皮的悲剧，看哭了，非常喜欢，不过确实是话剧味浓重，情节起成转合非常刻意。尽管如此，还是非常喜欢。
139,驴得水,4,张一曼演的真好，还有，谁说她不漂亮！
140,驴得水,5,应该六星。中国社会：一个大型的驴得水小学
141,驴得水,4,这部电影诠释了什么叫做“故事张力”。一曼与老裴唱歌聊天、与铜匠告别那两场戏，简直太美好太浪漫，但也正因为如此，后半段同僚对她的排挤与伤害才显得触目惊心。故事中的男性都有着矛盾虚伪的一面，能把自己的真性情一以贯之的恰是两名柔弱女子。一曼被戕害了，好在还有佳佳变成一颗火种奔向远方。
142,驴得水,4,我差点儿都想给满分了。已经背离了初衷的时候不懂得悬崖勒马，迟早有一天会被心中的恶魔吞噬。
143,驴得水,5,这部悲剧到极致的电影值得注意的当然不仅是女权，而是利用一次次强烈的戏剧冲突一次次被打破的人性底线，让人看到的无非是脆弱的人如何被权力碾碎成行尸走肉。
144,驴得水,5,该死的是你们啊 为毛是一曼【年度最佳】
145,驴得水,5,我喜欢死里面张一曼了啊啊啊啊啊啊 简直就是我的理想
146,驴得水,4,荒诞剧，戏剧冲突集中，这本子写得赞，但看过并不开心，反而沉重。为了能上映，看得出改天朝为民国的削足适履。作为话剧真的不错，作为电影的弱点也很明显，但值得推荐。
147,驴得水,5,中国电影少见的亢奋，说是像《鬼子来了》，其实更像《三毛从军记》，片中最令观众感到痛苦的时刻，也是用一以贯之的癫狂表现出来，无论喜怒哀乐都是用吼的，说好了是喜剧，咱们就痛痛快快来一场喜剧，你别管里面我加了多少悲伤和痛苦――在单个类型里讲尽一切，非常喜欢这种彻底。由层层审批驱动的世界，利益是基础动因，权力是必备工具，领导一句话成为底下人的命，“说你行，你就行”让社会由此变成一出大型角色扮演。权力被无止境切碎后下发寻租，让长期受压抑的“平凡的大多数”反而爆发出最凶恶的施虐倾向，社会的兽性被激活后，伸出利爪的是与你我一样的普通人，影片最尖锐的地方是没有对无辜者泛爱，与中国农村题材电影最常见的基调迥然不同。角色们口口声声要帮助的学生在片中完全缺席，讲成人世界里的恶，不拿孩子打圆场，敬佩主创的立场鲜明。
148,驴得水,4,看似喜剧，其实是黑色幽默的悲剧，以喜衬悲，随着剧情推进越来越沉重。笑点伴着泪点，引导着观众去思考人性，追问自我。令人惊喜的是女性角色特别出彩，区别于以往的同类影片。
149,驴得水,5,剧本厉害，演员成精，一步一陷回首已满是绝望，可比鬼子来了一样令人背后发凉的中国式讽刺佳作
150,驴得水,4,情景喜剧。引古喻今。啪啪啪打脸。多说一句：善与恶的对立，一个促进良性循环，一个导致恶性循环。
151,驴得水,5,看到一曼那段，我有种穿越到羊脂球的感觉
152,驴得水,5,这几年看到的最棒的中国大陆的现实主义作品！强烈推荐！感同身受到甚至颤栗，又纯情感动到流泪。
153,驴得水,4,有成功的话剧打底，剧本成了七成，不过这同时也是种桎梏，毕竟这两种艺术形式还是有不同。荒诞感够多，也够强，笑着笑着哭，不至于，难受倒是有点，最后的戏份有些仓促，华语电影这样不错了。
154,驴得水,4,“我要美丽的衣裳，为你对镜贴花黄。这夜色太紧张，时间太漫长。我的情郎，我在他乡，望着月亮……”与其给婊子立牌坊不如活得坦荡荡。俩泪点一个给驴一个给枪。@朝阳金逸
155,驴得水,5,异常沉重。女性总是被侮辱，被指使，被利用，被损害，被作贱。铜匠这个角色彻底反映了人性深处的恶被搅起来后会放大到什么程度。让人想起文革。“过去的要是就过去了，以后只会更糟。”
156,驴得水,4,原来只要换个年代背景，我们就能产出好电影！
157,驴得水,4,嬉笑怒骂间用荒诞的喜剧色彩所酝酿的悲情，使《驴得水》既能逗人捧腹，更在针砭时弊的同时拷问已人性的盲点，固然电影在形式上有着过重的话剧痕迹，但总体来说，这是一部剧本夯实，耐人寻味恳切的黑色喜剧。
158,驴得水,4,喜剧效果一般，剧场感太强，电影感太弱，人物的代表性很直接，变脸太快太夸张。前半段还真以为是换个时代背景来深刻讽刺，到后半段的夸张荒诞变成了主题先行了，格局反而小了，结局俗不可耐。美国人演技太差，铜匠的方言是蒙古语吧？不过还是为中国荧幕能有这样的毒草加一星。
159,驴得水,4,incredible china。借古讽今，用心良苦，故事设定在民国时代，电影才能过审吧。舞台剧感极明显，全片只有一个取景地，山西大河堡。
160,驴得水,4,当暴力开始露出锋芒来时，理想就顷刻融化了
161,驴得水,5,扯掉小知识分子身上最后一块遮羞布，漏出整个社会的真相
162,驴得水,4,剧本不错，然而超致郁，属于我不会看第二遍的片子。
163,驴得水,4,当一部电影，你越看越不想让它演完，就说明这是一部好电影，看得很爽。故事本身与如何讲故事才是一部好电影的关键。
164,驴得水,4,作为戏剧来说，是完美的。
165,驴得水,5,一个谎就需要若干个谎话来圆。理想，现实，金钱，爱情，自由，亲情，权利等等各种矛盾冲突，每个人的选择也暴露了其人性的弱点。不忘初心，方的始终，初心难得，始终难守。唉
166,驴得水,4,四声枪响，杀死了浪漫，梦想，务实以及骨子里的倔强。
167,驴得水,4,分类是喜剧，但却只有前半段才能算得上喜剧，后半段用一个字来概括就是：脏。不得不承认角色们塑造得都很成功，整部电影只有一曼这一个角色不让我感到讨厌。其实像话剧的表演没什么好喷的，我宁愿看这种所谓没有“电影感”的故事也不想看到面瘫演员和傻逼导演来电影院圈钱。
168,驴得水,5,我和你们一样喜欢张一曼，但我暗地里同情着泪流满面的裴魁山。横的周铁男和怂的周铁男都是周铁男，挪用经费修眼镜的校长啊，不正是朝闺女下跪的校长？他们看起来纷纷崩塌，但其实从来也没有一个瞬间有一丁点儿像是所谓知识分子，从来也没有一个学生证明他们是为了他们。那又怎样，无所谓，有什么所谓，别管我，谢谢啊。
169,驴得水,4,用前朝的事打本朝的脸。配乐和笑点导致了风格不统一，一曼和铜匠上床的戏转的太硬。虽然笑点不俗但为什么非要拍成喜剧。这种故事片就应该找这些专业演员来演。
170,驴得水,5,把美好的东西撕碎给你看，人性有太多不完美到让人憎恶的东西了。冲胆大未必真勇敢，有识不代表有德，贪、愚、弱、私可能是我们每个人。以为的变好可能是变得更坏。女主唱歌时很美，《我要你》很好听。国产加一星。虽然总体还是不够浑然天成。
171,驴得水,5,能在北京的电影院里听到中华民国国歌，光凭这点就该打五星。电影本身也是今年国产片少有的佳作。
172,驴得水,4,移民还是革命，这是一个问题。
173,驴得水,5,国产片居然也能出讽刺片，一步错步步错，一个谎言需要用无数谎言去圆。好喜欢任素汐唱的我要你
174,驴得水,5,幸好有个民国，不然借古讽今都没有抓手。
175,驴得水,5,蛮好看哎起伏很流畅、很多镜头很美，也不炫技，喜欢张一曼
176,驴得水,4,非常韩式悲喜剧的模式啊
177,驴得水,5,这部电影已经给我造成了严重的精神污染，我现在很希望自己能忘记曾经看过这片子…不光是剧情本身，想想那么多做电影的竟然比不过一个做舞台剧的，也真是可悲。
178,驴得水,5,不要再讨论话剧和电影哪个更好，我珍惜为一曼流的眼泪。讽刺的很多，我只牢牢记住了那一旦掌权后的嘴脸。20170103
179,驴得水,4,前半段挺好看的，后半段（从铜匠穿上皮草到婚礼的枪声）太乱来了；演孙佳的演员太烦了，场场嘶吼；有了故事和演技，其他要素是绝不能放弃的
180,驴得水,4,作为话剧看过6遍的粉，一直都身体力行的向所有可能的人推荐这个几年不遇的好故事。电影版在电影性上的确是偷懒了，美术/视听语言/调度方式完全没有电影化，的确属于偏科严重的典型，但这个故事还是值得更多人看到。送一星。
181,驴得水,4,以乐写悲的剧，女主演的很好啊~
182,驴得水,4,一荒诞，就深刻了。开枪的急转直下看到对知识分子的批判
183,驴得水,5,开心麻花出品必属精品
184,驴得水,5,太牛逼了！！
185,驴得水,4,里面的那首歌可真好听啊……
186,驴得水,5,处处充满张力，戏剧，牛逼。
187,驴得水,4,让人看了会难过的喜剧…非常巧妙的故事，环环相扣的因果…结局比之前的部分差一些，最后感觉周铁男的转变有点突兀…开心麻花团队的编剧真的很厉害
188,驴得水,5,看得憋屈得不行…心理闷闷的，可是随着一声枪响感觉解脱了，镜头感非常好，各种拿捏很到位，难得的佳作！！人性总有意外。
189,驴得水,4,虽然话剧感重，人物转折生硬，但让人唏嘘后能联想到很多现实中得弱势群体，这比某些电影大张旗鼓的煽情要有意义得多。而且演员演技有了，有些段子也很有趣，画面也讲究。非要把话剧和电影一刀切开的人也是矫情。
190,驴得水,5,看完心情不太好。
191,驴得水,4,话剧感重引起部分不适所以四星吧
192,驴得水,5,牛逼啊，本子不错，虽然故事是发生在民国时期的黑色幽默，但无不反应当代社会现象，一边看一边在想，这电影怎么过审的，段子也很多，笑料也很足，看哭了好几次，画面也不错，没有一个浪费的镜头。我觉得超赞，没看过话剧，但电影这样我觉得很棒了。
193,驴得水,5,哭死了，近几年看过最好的国产片，中国版《狗镇》。一曼这个人物代表了生为女性在社会中的地位，被爱，被骂，被围攻，被欺辱，被忽略，被结束。当枪声响起，还记得她当初在田野中快活高歌吗？她说：我真的就是想活得自在点儿。
194,驴得水,4,故事仍然是那个充满戏剧冲突的好故事，但没有改变舞台剧的调性。这不是一个那么依赖调度的戏（比如糊涂戏班），转向大银幕其实本可以实现得更好，人物的重新塑造、情节点的设置，特别是叙事手法等等，都有调整的余地。我还是几年前剧场初见后的那句话，它已经超越了太多同类，不过，本可以更好的。
195,驴得水,4,没有想到结局是这样……一曼疯的理由未免牵强，如果我是编剧，会安排晚餐时她在铁男面前被特派员秘书和武官轮J的情节，这样更虐。金钱，扼杀了人性的善，放大了人性的恶，扭曲了人性的真……动听的主题曲《我要你》误导我以为最后是铜匠和一曼的happy ending ……
196,驴得水,4,黑色幽默，节奏感强，剧情也婉转有趣
197,驴得水,4,很多人在电影院放声笑，个别人在电影院偷偷哭，因为怕邻座问起，为什么流眼泪，时无言作答。
198,驴得水,4,我看见幼稚而虚妄的纯情被现实的不纯粹压垮，露出细嫩皮肤下的污血。我看见痴愚而空洞的淳朴被原先不可接触的美与丑扭曲，颜料落在画板上绘出龇牙咧嘴的凶鬼。我看见执拗而暴躁的正义感被更纯粹的暴躁折断，把折断的脊椎捡起来拼凑出狗的四足。我看见无私的善者为了无私本身，将自己和身边人的血肉出卖
199,驴得水,5,WCNMLGB
200,驴得水,3,不能把开心麻花出的所有电影都粗暴地归到「喜剧」里……这种营销思路就会导致我今天观影时遇到的蜜汁尴尬……有一帮观众从开头驴棚着火就开始笑，然后一直笑到结尾枪声……我……真特么……跪了……
201,驴得水,3,三颗星全给任素汐，她是中国最优秀的话剧女演员，有魂。她的巴掌都像是打在我的脸上。但是，建议导演改一下职务叫摄像吧，因为您只发挥了这个功能。
202,驴得水,3,【C-】比夏洛特烦恼还要话剧化。完全没有填充人物之外的任何银幕内世界信息，所有的镜头都聚焦在演员身上，像在看情景喜剧，简陋的视听语言让几个本该令人触动的情节效果大减。《驴得水》用自己充分向那些“故事至上”的电影观众表达了一个真理：好剧本≠好电影
203,驴得水,3,不是烂片，但看完后，却比烂片还让人不舒服。不仅仅是极端环境下的极端罪恶，也不仅仅是那些已经摆在面子上的“讽刺”，而是所有的男人对一个女人的伤害，所有的愚昧对人性的强奸。我相信，看完后产生心理和生理双重不适的观众，不仅仅是我一个。
204,驴得水,3,两星半，无法否认其剧本的完整和工整。但目前电影所展示出的形式，还是只适合舞台剧的呈现，这归结为做久了舞台剧的导演依然不适合拍电影，视听语言的羸弱导致剧本的很多优点难以完整呈现，人物性格不完整，剪辑也很平庸，荒诞里带着一股剧作者的愤青，演员只是剧作者的吐槽工具，只有女性完成的不错
205,驴得水,3,走进影院去看话剧，却不走进影院去看电影。拿的出手的是剧本中对多重主题的深度挖掘和解读空间，一出官僚与知识分子现形记，借民国讽今教育和潜规则，讴歌女性自由。然而不可能只要立意好，就是好作品。
206,驴得水,3,讲个笑话，你可别哭。有部话剧，长得不错，以为自己是电影。
207,驴得水,3,借古讽今，话剧底子确实好。但改电影问题就来了，原版人马受戏剧空间和舞台表演太多束缚，再怎么靠电影技巧修饰都是依葫画瓢，导演技巧为零，成了个《开心麻花剧院现场》…不可否认，演员表演熟练，但那是一种话剧表演的熟练，感情不饱满。话剧看演员，电影看导演，道理就在于此。
208,驴得水,3,讲个笑话，你可别哭。确实有笑有泪。镜头感差，全靠剧本死撑，挑几处刺：1冲突太密集，张弛度欠奉，滚雪球滚到后面都飞了。2人物崩坏。人出于自尊和自私显露阴暗面很正常，但裴魁山和铜匠两人由爱转恨太生硬，伤害一个真正喜欢过的人怎么能这么毫不犹豫？3喜剧的忧伤，忧伤并不是来源于绝望。
209,驴得水,3,话剧人转电影人最大的难度不是对影像感的参透，而是话剧戏剧与电影戏剧的置换节奏，当我们说一部电影“话剧腔”或者“表演靠吼”的时候，其实是说你没有为他们留白。嚼戏上瘾，就会对角色转变前后的突兀产生无视感。《驴得水》是好戏，海啸般的信息量，猛戳国人劣根性，吊，可看到最后我不再相信。
210,驴得水,3,话剧式表演直接搬到荧幕上真的好可怕，看完感觉像被喷了一脸擦不掉的口水
211,驴得水,3,居然从头到尾一个学生都没出现过啊……
212,驴得水,3,假设张一曼是个男人，他睡完一个女人，而且知道女人爱上他之后，还对她说：“在我心里，你就是个牲口”，你们还会觉得张一曼纯真可爱吗？她后来的遭遇，确实令人发指，但她当初对待铜匠和裴魁山的感情，能这么赤裸裸的践踏，让我觉得她也没那么无辜了。
213,驴得水,3,剧作的基本架构还是挺好的，但处理手法过于粗糙生硬，演员用力过猛，舞台剧痕迹太重，看着闹心。编导野心不断膨胀，各种隐喻、暗讽无的放矢、乱飞一气，只管放不管收，终至癫狂错乱、不知所云……总之，整部影片给人一种更年期妇女内分泌失调的感觉。
214,驴得水,3,黑色，现在看或许有点魔幻，但放在一定背景下看则就是现实主义了。这片其实不算喜剧，表达的主题与内涵无非是“我们不应该因为美好的愿望去做错误的决定”，在这背后又可能引发的多米诺骨牌效应让你觉得悔恨。然后，对这片最大的尊重，或许是，请你不要笑得那么大声，毕竟这背后需要你有深层次的思考。
215,驴得水,3,本质上和强行让人乐的段子电影没有区别，这是强行让人反思“劣根性”的人性电影。
216,驴得水,3,评分虚高。一曼这个角色前期塑造得挺好，后来变疯了就俗了；铁男经了一枪后性情大变，本也可以理解，可惜转变缺少过程；铜匠作为男主，符号严重不出彩；结尾有强行悲剧的意味。整个电影就是一个小品，人物塑造流于表面，感情弱，引不起共鸣，也没多好笑。带着高期望去看的，所以失落感特别明显。
217,驴得水,3,很有意思，但毛病也多。估计原版话剧应该比电影水准高很多。
218,驴得水,3,人生就像这伫立荒野远离尘嚣的门，走进来彬彬有礼，走出去步步生风，门里门外世间百态一览无余。有人忍辱断发万念俱灰疯了，有人牺牲底线保全学校怔了，有人身披貂绒万事利己痴了，有人挨了枪子信仰崩溃傻了。弃如敝屣的除了雨神像，还有道德观。成也剧作败也剧作，电影语法的匮乏使得话剧腔调占上风。
219,驴得水,3,3.0。1.驴得水，夹紧了别闹！2.电影感欠佳，但解读空间挺大，剧作上着实费了不少心思；台词很污很野，红白喜事连番闹剧有点趣味。3.结尾似乎有删改，整体可以更好。
220,驴得水,3,体制下劣根性的集中展现，头尾背景设置投机过审。这种电影假象的深度能骗到很多人，而影迷一眼即能识破。[C]
221,驴得水,3,中国教育，求真作假；审丑为美，感同身受。
222,驴得水,3,“舞台真实”和“大荧幕真实”真的完全不是一回事。。许多精彩部分照搬进电影却成了生硬和尴尬 作者没有放胆进行电影化的变形 可惜了那么好的文本
223,驴得水,3,任素汐演得很讨喜，然而张一曼这个角色本身，真是一言难尽......这个角色身上一旦被人放上女权和自由的标签，整个就变味了。ps：本片最大的笑点来自于身边一位阿姨，一直在迷之笑点地大笑，结尾枪声响起还笑，简直让我出戏。
224,驴得水,3,如果一部优秀的话剧，拍成电影并不能让它增添精彩度，那何必要拍呢？
225,驴得水,3,看完心理不适，后半段表演用力过猛很出戏，喜欢前半段
226,驴得水,3,很大的期望去看，分比奇异博士还高！结果。。就中间部分好看。，整部戏都一副用力过猛努力制造矛盾和冲突的感觉。
227,驴得水,3,话剧虽好，可终究不是电影，这样照搬到银幕上，未免太不高级。角色转变突兀，戏剧冲突硬编，演员表演全在拼谁嗓门大……其实有点失望。
228,驴得水,3,怎么说呢，批判现实、刻画人性，不需要把自己变身成为一个受迫害妄想狂，也许话剧可以，但电影并不那么适合。是真正用心对待的故事，但处处都有点用力过猛。一曼很好，歌儿很好，“这夜色太紧张，时间太漫长，我的情郎”
