,movie,star,comment
357,驴得水,3,就算你剧本设定再精巧，人物演技再高潮，每个人物都有着更深层更直指人心的隐喻，你也需要老老实实的说一个故事，展现出合理的人物。话剧是有黑场来让观众缓冲和脑补，也有着大面积的对话来叙事，电影需要的代入感强大许多，它需要大量的细节和充沛的镜头语言来表达来抓住观众的代入感的。
358,驴得水,3,既没找到哭点也没找到笑点，可能我还是不太适合这种端上台面的戏剧，正反面角色转变太快。女主挺耐看的，点个赞。
359,驴得水,3,进来彬彬有礼出去步步生L  去了延安 去你的吧
360,驴得水,3,"有点心疼那些活在自己的骗局里的人们. 导演好像是故意留下了几处舞台剧的痕迹, 看的出戏, 有点生硬."
361,驴得水,3,狗血洒得太猛了。
362,驴得水,3,呵呵呵，讽刺就得是神剧吗
363,驴得水,3,一场闹剧把人的下限暴露的无疑，对于剧中一群“知识分子”学校的墙上硕大的“学做人”3字显得格外的讽刺。
364,驴得水,3,明明是瓦蓝瓦蓝的晴天，可一眼望去怎么成了剧场里黑色的棚顶。
365,驴得水,3,不太是个电影。
366,驴得水,3,就是感觉话剧味道太浓了。然后校长女儿咋咋呼呼的，狂躁式的表演让人很出戏。最后老外那段，感觉真玩儿脱了。
367,驴得水,3,荒诞讽刺的官场现形记。
368,驴得水,3,话剧《夏洛特烦恼》脑仁儿疼，电影把调子提亮了，很巧妙，《驴得水》的话剧看完身体不适，本以为电影版会些微无害一些，但没想到脑仁儿更疼，个人觉得在呈现上周申要认真过徐昂，或者电影观更近，票房相对理性，商品属性确实更刁钻一些，极端偏执且满怀憎恨，爱过进而虚无，希望海外能有所斩获
369,驴得水,3,看似讽刺但其实太过工整对仗。话剧感好浓。
370,驴得水,3,感觉看了一场舞台剧，几乎没有电影痕迹，冲突矛盾都以台词动作在推进，没发挥电影这个媒体的特长，若说喜剧，癫狂荒谬力度又不够，若说讽刺，又太刻板平面，戏剧转折都是突然性的，没有铺垫。应该可以做得更好。
371,驴得水,3,或许是在天朝拍电影习惯了什么都不能说，因此突然有个可以说的本子过审，难免一下子就说了太多，每个角色都糅合了两三种典型形象，而且讽刺摆得太实在，功力真的就弱了（可能这也是过审需要？）。最魔幻的是，片子很多台词，在2016年或许还只是不错，到了2017，突然就有点跟现实太接轨了，这盛世啊！
372,驴得水,3,人物个性鲜明，对小知识分子的嘲讽下了狠手，不错的话剧，很好的演员，但不能算一部好电影。
373,驴得水,3,话剧改编电影 整体还可以吧 有些用力过猛 剪头之后的剧情有些飘 不过不失
374,驴得水,3,一直在用荤疯闹吹一颗气球，中段突然改用气筒打了，最后炸了。任素汐格外耀眼，演活了一个内心丰富的“碧池”
375,驴得水,3,看的闷得慌。人物性格转变太突兀，收尾的节奏也怪怪的。难得的是一个很特别的女主角。
376,驴得水,3,看完特别不舒服，但不错
377,驴得水,3,独幕舞台剧，每个人心里都有一道迈不过去的坎，看完后很压抑。自从姜文《一步之遥》之后，好好的讽刺喜剧都不能好好讲故事了，怎么歇斯底里怎么来，怎么荒诞不经怎么来。你说它过了，它说我这是架空背景的黑色幽默，你不懂。建议学习学习罗马尼亚的电影《无声婚礼》
378,驴得水,3,一头驴引发的连环大骗局，其中笑料百出，污点不断
379,驴得水,3,一个错误只能导致另一个错误。
380,驴得水,3,情节发展略唐突，有些话出来得不够自然，像是刻意等鼓掌。黑色和幽默都还差点儿。
381,驴得水,3,「木？@根本是“orz 任素汐真的太耀眼，以至於]有一曼出F的R^我完全]d致看了，整故事看起碇虚g深^弱。感XY尾有c稀里W啦的……豆瓣推]的常用撕居然有是「内涵」。忍不住笑了。咱v道理之前最好先把故事v溜了吧。
382,驴得水,3,话剧到电影还是有一道鸿沟要跨，仅靠煽动表演远远不够，还需要故事完整、情节连贯。喜剧桥段和主线故事严重脱节，影片包含的喜剧性和意图表达的批判讽刺性没有很好地融合。后半部喜剧包袱减少之后，故事就走低，人物转变、吵嚷嬉闹说来就来。任素汐的女性知识分子被体制逐渐扼杀的过程拍得最为完整
383,驴得水,3,以为是出喜剧  原来是场闹剧
384,驴得水,3,整部电影最缺一个“女儿给爸爸的巴掌”，事实上整个中国都缺一个女儿给爸爸的巴掌，抽死丫的。
385,驴得水,3,前半段 天塌下碜婊子砜 後半段 天塌下礞蛔砜 Y尾 你不是放 你是渭/   女T有意思 人富起
386,驴得水,3,脸谱化较重，当可怜和可恨都变成了可笑，讽刺就失去了力度，搬起石头也只能砸中自己的脚。
387,驴得水,3,这样一部电影，居然都8.4的评分，可见国产电影粗制滥造到何种地步。这是一部少儿不宜的成人电影，前半段刻意制造笑点的人物对白，看的人厌恶，靠台词段子支撑的电影，走不长。
388,驴得水,3,"1、说是喜剧，却毫无笑点‘；说是悲剧，又毫无泪点；说是欢喜交加，可毫无感动。
2、浓缩一下，是一部出色的微电影，为何又要强行拉长？
3、口碑太好、失望太多、亮点太少，不是说演员不好，只能说编剧不够“老”，想表达的意思观众都懂，强行把塑造的人物性格颠倒，并不是明智之选。"
389,驴得水,3,《驴得水》电影感实在太差了，找不到搬上银幕的意义…机灵劲儿过头的密集讽刺看到最后有些反感，所有矛盾巧合误会更适合舞台剧的形式，舞台灯灭灯亮的过渡节奏感会好些…对教育的讽刺对官员的讽刺人性的讽刺男权父权的讽刺对时代的讽刺对权力的讽刺对知识分子的讽刺，心理的阉割个体独立性的阉割…观众
390,驴得水,3,虽然从头看到尾，但是一直不能集中注意力，经常走神。这片子一般啊。
391,驴得水,3,荡妇羞辱。
392,驴得水,3,剧情不错，但话剧的表演痕迹有点重！
393,驴得水,3,就是荒诞～
394,驴得水,3,★★★话剧式的改编也许某些方面更加变得癫狂，忽视基本的逻辑，说是中国的库斯图里卡有些过了，但也是佳作。
395,驴得水,3,新世纪电影界“反思文革”第一部？
396,驴得水,3,话剧的形式感太重 没有电影的质感 唯一的亮点大概就是任素汐的表演了吧
397,驴得水,3,喜欢一曼 电影拍的其实真不咋样
398,驴得水,3,电影看上去很奇怪，突然理解了话剧的不可被代替之处。给人一种只是用实景代替幕布的错觉，激烈的冲突被电影形式覆盖，毫无看话剧时的惊喜感，就像演员在电影屏幕上看上去并不舒适被无限放大的五官特征，甚至失去了本身的韵味。事实证明并不是一个好的剧本就一定是好的电影。还是去看话剧吧！
399,驴得水,3,《驴得水》是电影和舞台剧没结合好的残次品。
400,驴得水,2,即便评分再高也完全喜欢不来。我们还是太热衷主题与意义了，以至于忽视了传递主题的方式与合理性。影片为了所谓的人性深度，而刻意设计剧情和人物转折，忽视基本的人物行为轨迹，都非常让人不舒服。喜欢有深度的电影，但希望能以更巧妙的方式讲出来，而不该是现在这样。以及形式上，这不就是舞台搬演么
401,驴得水,2,后半段太糟糕了。编导像发动起来的传送带，疯狂号召观众扔石头。但最致命的是完全放大了舞台剧改编电影的缺陷，情节推动靠走，人物性格全部靠吼。我绝不是拥护电影形式的圣徒，但也确实看不下“让语言飞”的偷懒与背离。至于讽刺，荒诞和反动之类的解读，难道大家都是当了太久外宾非得要恍然大悟嘛
402,驴得水,1,映后主创见面特别惊讶，被拍成这样还需要导演？！完全照搬舞台剧台词，连人物站位都是舞台式，没有任何电影语言，镜头蠢到还有淡入淡出和虚化背景这样的衔接，很明显的分幕，且大大弱化了表演。全片没有同期声，配音简直灾难。（据说上映版本是同期声）。是好的剧本和演员，但还是去看话剧吧。
403,驴得水,1,如果话剧改编电影可以这样的话，人艺之类的以后岂不是可以赚一笔了，用电影的标准看，这片子一颗星都嫌多，说它成功，只会带坏了未来话剧改编电影的风气，当一场话剧的标准看，这玩意儿倒是可圈可点。
404,驴得水,2,作为话剧5星，作为电影勉强3星。电影感欠佳是一个方面，最早看话剧剧本的时候，就觉得一曼这个角色写得也太简单粗暴了，使用性太强，一言一行皆在让观众发笑或是落泪，转折跟逻辑都不够通顺。电影则更放大了这种不适感。但女演员确实挺棒的。扣一星给这赤裸裸的圈钱动机和国内这该死的电影工业。
405,驴得水,2,"很低级的喜剧，讽刺性流于表面，很多段子都是春晚小品级，台词特别水。话剧那种腔调的表演方式一成不变地照搬进电影，演员就会显得用力过猛，一个个都在扯着嗓门喊，搞得我看完脑子都是嗡的。
倒是驴得水的侧颜挺像陈羽凡的。"
406,驴得水,2,开头好多的黄段子看得就不舒服，趁着有电话要接就直接出了电影院不回头了
407,驴得水,1,《驴得水》这样的烂片，我一分都不会给。它连称之为艺术都不配。创作者显然忘记了艺术需要提纯和过滤这一基本常识，转身沾沾自喜地搞了一场人性丑恶实验和展览，还自以为高明。它真的能引起人们什么沉重的反思吗？不，它只是让人恶心罢了。出发点错了，怎么做都是错的。
408,驴得水,1,脏
409,驴得水,2,反应一个深刻主题就能成为一个深刻电影吗？那么电影与其他艺术形式又有什么分别？
410,驴得水,1,万达CBD店2016.10.29.2:45pm 建议看到四五十分钟时离场（即第一次欺骗完成时），后面就是最媚俗的意识形态导致的闹剧了。
411,驴得水,2,无限同意@小猪大侠 的说法，舞台剧照搬上银幕，如果依然不能解决人物发展的合理性，看上去跟小品荟萃也就没什么区别，作为喜剧的电影，片中人到最后靠cos马景涛来维持实在太让人遗憾了，这种浮躁，其实是创造出这部电影的人自身心态的反映，有一说一，布景道具还挺像样的。
412,驴得水,2,即使我这个外行也能看出来这个剧本编的太糟糕了吧，完全就是瞎JB编，无脑愤青一样的转折和对白，无视叙事逻辑和人物动机的合理性，而且难得的让你对任何一个人物都觉得讨厌。简直比烂片还可怕，浪费时间！
413,驴得水,2,该片质量在两星到三星之间。确实讽刺了官僚体系，但缺少一种强有力的反抗力度。只展现阴暗，而无反抗阴暗之能力与意志的作品，还算不上好作品。对应的好例子，则是《老炮儿》，有阴暗暴虐，更有强有力的反抗意志。
414,驴得水,2,自知对这种片缺乏鉴赏力，特地请我妈一起去看点映，看完她说不是很好看（集中吐槽一曼老师这个角色写的太过矫情，其他都还好），嗯，我听她的。
415,驴得水,1,生理不适，很久没这种观影体验了。
416,驴得水,2,戏剧冲突做得很足，但情感张力完全没出来，我还是坚持之前认定的，开心麻花这个团队尚不具备拍出好电影的能力，道理很简单，倘若以为解决了剧本问题等同于解决了电影问题，那就没有艺术形式的区分。
417,驴得水,1,电影，请先像电影。
418,驴得水,1,因为几乎是话剧形式，所以视听不去说了，不过在话剧基础上，它也像下乘的春晚小品。剧作方面，依旧和《夏》有一样毛病，起手想要缝制孔雀裘，但不是孤勇的巧手晴雯，第一幕后，开始针脚大乱，磕磕巴巴干脆弃了底子。还有这不是讽刺，是美国电影里，小朋友晚会，丑小孩彼得，只能扮演一棵大树那么直白。
419,驴得水,2,今年出现的教科书式反例，题材气质类似前南东欧荒诞情节剧，可诗意，可浪漫，可蒙太奇飞奔神驰，然却以舞台班底囫囵吞枣，不赞成生吞，总得去皮削骨，遗憾于没有二度加工。棉花胡同北剧场大戏实况和西土城4号标放毕作，不是一个概念。
420,驴得水,1,什么傻逼破玩意儿！！用话剧的方式拍电影人物内心全靠巨大嗓门，突兀的手持和旋转镜头似乎看到导演跳出来大喊“我有场面调度啊！”关键是所有角色没一个让人喜欢的，ok你们都是罪人，还最后转嫁给延安老大哥，轻松收获“人性真实”的褒奖，也他妈太偷懒太坏了吧
421,驴得水,2,这根本不能算是电影吧，就是一个大型话剧搬到银幕上再演一遍呗。。。缺乏电影那种错落有致的艺术感，基本上大家就是靠喊来喊去来表达情绪。。。而且这个话题是不是过于陈旧了，从服化道到剧情推进没有任何新意，在我看来这片子和中央六套那些毛驴县令之类的并没有什么区别。。
422,驴得水,2,最大的浅薄，就是故作深刻
423,驴得水,2,站在某种维度讲，这片子根本算不上电影，镜头感为零，留白为零，所以我不想站在电影的角度去表达观感。总之故事还是有深层次内核的，讽刺意味很强，但是根本逃不出话剧的模式束缚，剧本衔接极不流畅，演员表演痕迹极重，总蹦出“WTF”等莫名其妙的感受。在影院大银幕上看了场舞台剧，这个逼装的可以
424,驴得水,2,今年看到的最糟糕的国产片。完全没有电影感，即便是舞台剧拍摄法，技术也业余，还不如学生毕业作品。人物之突兀，性格之极端，感情转折之生硬，让人看的浑身不舒服。所谓隐喻也是强作深刻，扯着嗓子喊大道理那种，越到后面越崩坏，姜文的好没学到，《一步之遥》的毛病倒是都全抄了。
425,驴得水,2,四不像，各个方面都像那死了的得水驴一样，有头没尾
426,驴得水,2,一出很棒的话剧，然而却不是一部合格的电影。表演方式、走位全是舞台剧的那套，几乎全片的景别都在中景以上，一曼被剪头时的特写镜头更是蜜汁尴尬，比学生作业还要幼稚的镜头语言暴露无遗。人物推动情节走向，转折便特别生硬。电影毕竟还是有自己语言的艺术，并非话剧。
427,驴得水,1,让你刷分
428,驴得水,2,除了部分影射性的政治表述之外（但也和寒战2一样保留骑墙空间），表演极为装腔作势，人物情感同样空洞无趣，更何况还有在审美上极为疲惫不堪的置景与美术。年度最被高估的中学语文考试中心思想代表作。
429,驴得水,2,莫名其妙，演到一半变得毫无逻辑
430,驴得水,1,全部看完吐了
431,驴得水,2,这不算电影，只是把话剧搬在了荧幕上。演员比起《夏洛特烦恼》都用力太过猛，完全不像在演电影而是仍然在演话剧。毫不喜剧，太过强调荒诞，缺乏电影的基本逻辑和结构。不明白为何评分这么高。
432,驴得水,1,如果这片子能高分，那以后每部话剧那个摄像机录下来，也能当电影上映。还有演员表演，说话全都是马景涛式的在吼，没有一个人在正常的说话。电影的起承转合全靠人物走动或者换道具，完全没有电影镜头感。还有所谓的深度，完全是在自我意淫。and全片都在拿“性”当笑点，这种直男癌片子也是够了。
433,驴得水,2,话剧尤其是喜剧改编电影，可不是简单加两场戏那么简单，所有的笑点都要重做。这是个喜剧但并不好笑，所有的笑点依赖女老师的放荡，太致命了。
434,驴得水,1,可能反感《驴得水》原因之一是片中人物没有基本的尊严和体面，这与社会地位无关。人在作践别人时，也在作践自己。在烂泥中生活，不见得是中国人的常态，也不必用外国人来啧啧称奇：不可思议的中国。女性因性观念开放就要被骂作“臭婊子”“公共厕所”而发疯；铜匠学了文化倒变得阴暗丑陋，真是有趣逻辑。也是奇怪，这么多”民国粉“宣扬”民国范“，为何选中的是钱钟书写的那种浅薄犬儒、贪图享乐、爱慕虚荣、自私自利软骨病患者，而不去看真正知识分子的风骨。谈”知识分子的脾气”也是可笑，愣头青在枪口下磕头如捣蒜，还振振有词说打入敌人内部才能实现自己的理想…感觉说整部电影“沐猴而冠”都抬举了。
435,驴得水,1,不管你要表达什么讽刺什么，别忘了这是上院线的电影，不是话剧。请先拍好电影，对得起电影这两个字！退票！
436,驴得水,2,太刻意了，要是这种片也能一片喝彩，陈佩斯是不存在过么？
437,驴得水,2,梦里不知身是客，一晌贪欢；流水落花春去也，天上人间。他人即地狱，我想去隐居～
438,驴得水,1,脏。闹。差。
439,驴得水,2,5分。不是一部好电影，也不是一出好喜剧。讽刺的意义是让人心痛，批判的目的是让人反思，一部好的电影、喜剧不该止步于残酷，且是一种人为堆砌痕迹严重的丑陋。期望能有一种怅然若失、如鲠在喉，但没有。无论让人开心，还是让人沉思，似乎不够到位。看似讥讽了所有人，但最后什么都没留下，这是遗憾。
440,驴得水,2,知识分子视角的对知识分子的讽刺，内核中二浅薄，外在乖戾粗暴，体裁设定没有做好，要么你就做好电影叙事，要么就干脆把话剧录下来放大银幕上也不尴尬，不过我倒是觉得如果能真的反倒就直接把话剧舞台搬到荧幕上，就像录播戏曲一样，对我们这种五线小县城看不起话剧的小镇青年来说也是种艺术熏陶
441,驴得水,1,为什么婊子从良都得死，婊子都是灵魂导师，婊子也是生活的学生呀
442,驴得水,1,中国观众真是太可怜了，在一个畸形的言论环境下只能为了这样一个制作粗糙、剧情胡编、政治历史指涉处处反映出编导历史政治认知中种种结构性缺陷且归根结底根本没你们想要的那种批判性的片子（把锅几乎全甩给理想主义尤其令人愤怒）而叫好与过分解读，真是悲哀啊。
443,驴得水,2,幽默不是强行被黑色的  脸谱化的人物特征  生硬的故事衔接  和戏剧化的台词感都是喜欢不起来开心麻花的原因   本身在话剧这个行业里他们的剧本都谈不上优秀  只能说中国的电影市场太弱  这都算神作/年度最佳的话  表演工作坊随便拍一部是不是都可以得金棕榈了？
444,驴得水,2,先花半部时间立起一个美好的幻象，再花半部时间把它通通砸烂，基本架构算是合格。但人物完全沦为符号，剧情转折又过分突兀，主题基本靠吼，调度基本靠抖，话剧就老老实实放在舞台上演好了。
445,驴得水,2,想了想，还是给两星吧，能让我在看片的同时去干各种闲杂事的一定不是好电影，更何况本片镜头僵硬到都算不得电影。另外，导演讽刺隐喻影射的历史政治太多了，多到让人觉得苍白。后半段疯狂密集的各种剧情反转也是同样的效果，苍白。
446,驴得水,2,无论这个话剧多成功，它作为电影是不及格的！
447,驴得水,2,7/1@Cathay 就，还是话剧的语言。
448,驴得水,2,妈的这电影看的真憋屈 为什么评分这么高啊我的天 这表达方式太他妈憋屈了 我真以为我是去看喜剧片的
449,驴得水,1,从3星的印象（太过于话剧模板，电影感缺失，但好在没像《夏洛特烦恼》那般引起我的嫌弃）改2星的不满（为了促成故事的发展，情节转折生硬刻意缺乏现实逻辑）到最后给1星（高豆瓣评分→高失望）。P.S.：片子结束时听到不少同场的观众表示「不好看、没看懂、甚至难看」，不禁让我怀疑此片口碑的真实性？
450,驴得水,1,如果这也是电影……
451,驴得水,2,刚开始的时候有点《不成问题的问题》的味道。看下去发现差太远了。文本不及还是其次，这个由舞台剧改编成的电影完全抛弃了影视的特点和优势，在服化道乃至表演方式上全是舞台剧的样子，偏偏又配了个实景，极其别扭令人出戏。矛盾发展完全靠拱台词输出基本靠吼也叫人十分烦躁。
452,驴得水,2,电影感不是维护什么，电影感的意思是表达准确，为这部戏叹气的原因完全来自于有可能它是个好东西而创作者却因为表达词汇的贫瘠与懒惰亲手使它毁于一旦
453,驴得水,2,调成黑白加快点节奏或许会更好，总的来说像个加长版的小品，使劲吹吧您
454,驴得水,2,开演五分钟已经知道后面什么剧情，谁要变坏，谁要变怂，特派员也是大尾巴狼，要讽刺的东西既不深刻，表达形式还毫无新意，全程尴尬，看到后面，想伸出手挨个儿拍演员肩膀【可以了，兄弟，意思到了，差不多得了，算了算了】
455,驴得水,2,糟糕的剧本和低劣的制作，完全辜负了这个好故事以及一群好演员。毫无电影感，不配进影院！
456,驴得水,2,看完了感觉像吞了一只苍蝇，这不是说电影是烂片，制作还是挺用心的，而是说太过刻意，批判和讽刺的方式让人很不舒服，跟看完《岁月神偷》的感觉差不多，好电影，烂榜样。
457,驴得水,1,这根本不是电影，在电影院看了场话剧也是醉了。退一步讲，作为话剧，剧作也是失败的，后半部分简直不像话
458,驴得水,2,糟得就剩下意义了。
459,驴得水,2,我不喜欢这个片，一点也不。性的解放不等于性解放，性的解放更不等于性别平等或者女权主义。这个片子，完全就是站在男性立场对于性的误导，让人们以为这就叫做解放，这就叫做自由，这就叫做女权。两性平等，不来源于人们允许一个女性自由的享受性爱，而来源于人们打破这层枷锁去认可一切都应该别包容。
460,驴得水,1,开心麻花的电影永远都很会讨好观众，它拍的是老百姓眼中的知识分子。“读书人”脱下裤子博人一笑，当然笑的开心，但是电影需要的是更深层次的思考，这部电影只有现象没有本质，这是它最大的问题
461,驴得水,1,我知道大便很肮脏，不用你一口一口吃给我看来向我证明！！真的不用！！不用！！
462,驴得水,1,瞎
463,驴得水,2,至于么一个个儿解读得这么起劲，在别人作品的基础上显摆你自个儿的文采（福柯）？不会拍就是不会拍咯，全给中景镜头，跟看傻子国产连续剧一样
464,驴得水,2,剧本有点为了癫狂而癫狂，为了愤青的目的而把所有人物都设计得自暴自弃、破罐破摔，看得很不舒服。其实故事中的困境很有现实意义，但像《一次别离》那样自然克制却深入骨髓的困境设置，才是我认为更高级的表达。电影呈现成这样可能也是因为话剧照搬，在视听语言上没有建树。电影化远不如夏洛特烦恼啊。
465,驴得水,2,好话剧不等于好电影，声嘶力竭的表演在舞台上够用，可镜头里需要的只是一个眼神，片中所有表演都太着急，内心转折基本为零，每一步都在剁开肉体强行告诉你这就是劣根性，完全把一个很深刻的故事变成手舞足蹈的肤浅闹剧，一星给故事原本的荒谬，一星给强加字幕的荒谬，一句顶一万句，七十多年，荒谬依旧
466,驴得水,2,特别做作 看着特别不舒服 而且哪里好笑了？
467,驴得水,2,毫无电影感…
468,驴得水,1,连舞台剧走位都赖得改，那我的星当然也懒得多给。而且剧本基本上处于完全脱线失控的状态啊。就是一群人情绪大爆发的总和，有嘛意思呢。
469,驴得水,2,剧本人物什么都不说。一上来看到这种灯光和镜头就先没了兴致。越到后面越来越像MV/婚庆的拍法。
470,驴得水,1,一刷3星二刷1星
471,驴得水,1,犯二小品想说有说不出口，现世道的年轻人都这样要将犯二进行到底。脑残剧
472,驴得水,2,好戏，烂片。真的非常吵，现在特别想看《有话好好说》或者《沉默的羔羊》。
473,驴得水,2,《厨子戏子痞子》看了二十分钟，给1星；《被嫌弃的松子的一生》看了三十分钟打算给2星，结果看完了给了1星；《驴得水》看了三分钟打算给1星，结果看完了给了2星。这世道多变啊。又比如《马男》，不看都给1星，并且一定会看，到了荒岛只给我一部动漫能看，我就带《马男》。好，就这样吧。
474,驴得水,2,乱七八糟，不值八分。
