,movie,star,comment
0,驴得水,5,这样的剧本，这样的电影，任凭你们怎么说风凉话，都休想模仿出来，国产片的普通货色离它差距太大。
1,驴得水,4,幸好有个民国，不然借古讽今都没有抓手
2,驴得水,5,1.库斯图里卡的癫狂、荒诞+法哈蒂的困境、冲突，而这...其实在中国这片土地上随处可见；2.追求自由的人，死了；3.愤怒的人，成了听话的牲口；4.宽容的人，成了小人；5.淳朴的人，成了恶棍；6.正面向上的人，总在行骗；7.就让我们忘掉过去吧，才能继续作为“人”活下去。
3,驴得水,4,过去的如果就让它过去了，未来只会越来越糟！
4,驴得水,5,用喜剧的方式谈悲剧，用讽刺的手法讲人性，为这个故事就值得5星
5,驴得水,5,锋芒毕露，前所未见的作品，不要当作喜剧片看，剧本是真的厉害！为中国电影骄傲，我们又多了两位优秀的年轻的导演/编剧。
6,驴得水,5,对人性的描写太精彩了，中国的好编剧是不是都去写话剧了。女一出色。有人嫌话剧感太重，我倒觉得没有问题，起码是好看的，总比电影感十足的烂片好看。
7,驴得水,5,普通观众全嗨了，说这才是国产佳作;电影专业人员全崩溃了，说这是舞台剧不算是电影。讲真，我觉得当一个作品只剩下它的形式能被人吐槽的时候，已经足以证明其成功。不管它是啥，哪怕我是去电影院看话剧了，我还是觉得，甚好，没错过这个乌龙甚好。
8,驴得水,4,悲叹的是被压迫的是女性，欣慰的是觉醒的也是女性
9,驴得水,4,这个笑话还真把我看哭了，惊喜之作，比夏洛特烦恼的故事高明，但电影感较弱
10,驴得水,4,国民政府太腐败了，气的我想冲上去把特派员打一顿，回家之后一定要看两集《新闻联播》来平复心情。看到片尾字幕得知佳佳去了延安的消息，我垂死病中惊坐起，我又重新看到了希望。感谢祖国，感谢党！
11,驴得水,5,作为一部荒诞喜剧片，本片的笑料绝对是够的。虽然有一些看起来比较“污”的段子，但是贱而不淫，丝毫不让人觉得低级。相反，整部影片倒给人一种干干净净的清爽感，几段感情戏都拍的让人心动。因为话剧改编的缘故，故事的幕间分隔有些明显，但演员的表演削弱了话剧感，也算自然。【任素汐的歌声真心棒！
12,驴得水,4,他妈的谁跟我说这是喜剧的，简直悲得一！塌！糊！涂！借古讽今，民国背锅，最后三分钟才跳出话剧回到电影。华语片应有这样的尝试～
13,驴得水,5,有胆量给当代中国历史尤其是49年以后中国群众史写整体寓言的中国电影仅此一部。这剧作是达里奥・福的水准。它不是关于某个阶层的讽刺，而是虚妄理想主义和阴暗龌龊个人私欲交织乱炖而成的一锅屎汤，整个中国都溺毙在里面。像不像电影已经不重要，就是野茶馆说的评书我也会给五星。
14,驴得水,4,非常正点的黑色幽默和荒诞的乡村魔幻现实主义，整部电影的调子很撒，段子很荤，路子很野，故事上有莫泊桑的味道，讽刺加隐喻，上次让人感受到这些的观影体验还是当年的《杀生》。总体上是一部很值得一看的喜剧，新导演技法的生疏和信息处理的失衡可以被原谅。PS：主题曲真的是太有味道了。
15,驴得水,5,看之前没想到开心麻花的第二部就已经如此生猛。看完后心情久久无法平复，这是尽头。我不懂为什么我们可以允许烂片烂题材烂明星烂导演的存在，却要对话剧取材的电影如此苛刻。喷没有电影语言的请认真看下几个空镜，别犯“干大事就不拘小节”的毛病。最可怕的是后排的孩子在看到惩罚的时候脱口而出坐牢。
16,驴得水,5,说不像电影的，谁规定了电影应该怎样怎样吗。
17,驴得水,5,如果懂得中国人的不讲原则聪慧利己，看透历史的反复吊诡悲喜交加。电影经过女性自由的转折，以后则全在解构悲悼历史。它厉害的是道出了曹雪芹所指女性审美在文化中的缺乏，“驴”得“水”，（男性的贪恶屈服对照女性的自由烂漫），“水”最后却又被压榨废弃，暴戮的未来便可预见。不喜剧，倒实悲。
18,驴得水,4,山河破碎的学校，委曲求全的校长，道默岸然的男人，随性不羁的女人，看似一腔热血却在威权之下瞬间崩塌的年轻人，以及一个有了点知识就背信弃义的铜匠……影片的隐喻和讽刺的力度还不够吗？看上去只有小女孩一个人是个明白人，但，她投奔了延安……
19,驴得水,4,比夏洛特好看太多
20,驴得水,5,“过去的如果就让它过去了，未来只会越来越糟！”一句话说得我鸡皮疙瘩都起来了。有些话，因为太过真实，让人胆战心惊。
21,驴得水,4,还以为《夏洛特烦恼》老一套都市轻喜剧，结果深度过头了，一个多小时都有些不适应。好在最后剪不断理还乱、一个谎言十来圆的“人生镜花缘”，不再开口的张一曼，让这个有些轻狂、癫狂和痴狂的悲剧故事，有了温度和忧伤。“我要美丽的衣裳，为你对镜贴花黄”
22,驴得水,4,典型的一步错步步错的“U-turn”类型。舞台剧改编，蒙太奇不明显，但随之而来的优点就是很工整，戏剧冲突不断，用一个谎言去圆另外一个谎言，矛盾冲突叠加，前面阴差阳错的笑料不断，后30分钟大爆发，讽刺味道浓厚，很像当年的《阿满》喜剧，最后有些过火，女教师是亮点，个人最喜欢满嘴跑火车的校长
23,驴得水,4,全靠最后一句去延安找大哥才过审……
24,驴得水,5,没去影院贡献一张实打实的票房，我真是遗憾又羞愧。
25,驴得水,4,因为《夏洛特烦恼》本来有点抗拒开心麻花的电影，看了后感觉比前者好太多了。话剧舞台风还是很明显的，又荒诞又心疼。演员真是个顶个的，好喜欢任素汐。
26,驴得水,5,难得看到这么好看的荒诞喜剧，虽然作为电影还有一些不足，但是已经很不错了。期待中国也能拍出像《被嫌弃的松子的一生》这样的电影。
27,驴得水,5,开心麻花的第二部电影，相比《夏洛特烦恼》的无厘头搞笑，本片走的是黑色幽默的路子，所以显得格调更高，商业之中带有一点文艺的气质。影片前半部让人笑声不断，后半部让人心酸落泪。真的如同广告语所说，这是一个让人流泪的笑话。而采用话剧原班人马，不使用大牌明星这一点也相当值得尊敬。五星推荐！
28,驴得水,5,所以你们这些文人啊，屎到淋头了全得下跪，什么气节？都抵不过钱谦益一句：“水太凉”。
29,驴得水,4,基于原版话剧本身就很扎实工整的剧本，和强烈的戏剧张力，大电影加入了更多荤段子做包袱和笑点，让这出荒诞讽刺的黑色喜剧更显丰富。舞台剧演员的台词功底让人赞叹，女教师这条故事线被诠释的最完整，片中学做人三个大字道破主旨。个人感觉比夏洛好笑且值得深思，美中不足的是话剧痕迹较重电影感不足。
30,驴得水,5,前半段抖包袱全是为了后半段的严肃沉重做铺垫，最核心的估计就是小女孩片尾的那句“过去的就这么过去了，以后还会更糟糕（大意）”，社会性比夏洛特烦恼要强
31,驴得水,4,无功无过的话剧搬电影，包括一直不太喜欢的结尾闹剧。但其实也足够让我期待这部电影能让更多人关注话剧与剧场了。另希望任素汐与《我要你》快快借着这股东风火了吧！真的等太久了。
32,驴得水,4,看电影的过程，如果你觉得佳佳和铁男幼稚得讨厌，那你已经被这个社会像驴一样驯服
33,驴得水,5,影片话剧改编，虽说话剧的风格更重一些，但是剧情设计相当巧妙。最初救火的几人不同态度暗示了几人最后的结局。我要你一首歌，听的人心痒痒。
34,驴得水,4,很好看，很发人深省的电影，里面的歌也很好听。黑色幽默的暗讽电影。就是话剧演员演电影还是有一点舞台痕迹，偏于浮夸，虽然有克制，但还是有一点。
35,驴得水,5,喜欢。但是，好像不是喜剧片。04
36,驴得水,4,灾难般的视听语言，无法当做电影来评价。三星给文本，一星给女主。难得在当下的创作里看到张一曼这样一个闪着光的女性形象，演员也很棒，于是摧毁更加动魄惊心。这片子能过审本身已经足够荒诞，果然是魔幻现实主义大国。
37,驴得水,4,强忍着不适看完，票房证明，它更适合当成中文系或者电影鉴赏课上的教学片，去看人性，去看现实的荒诞，去看黑色幽默的叙述方式。
38,驴得水,5,Incredible China.
39,驴得水,5,用钱染掉信仰，用枪染掉骨气，用权染掉自由，用伪染掉真爱。在这黑色的染缸，无论加进什么东西去，都变成漆黑。五千年浊世。我说句题外话，谁对我不是潘金莲的评价高于这个片子，这个人以后所有对意识形态领域的批评，都可以忽略不计了。
40,驴得水,4,比预想的好看一些。明明是喜剧，但看完后感觉有点抑郁。
41,驴得水,4,今天终于有机会看了一下，总而言之，希望明天会更好吧
42,驴得水,5,年度国产最佳
43,驴得水,4,借古讽今，颇为有种的一次尝试；剧本写的特别硬，却也相当瘸，目的性太强其实很影响合理性和结构性，但依然欣喜于这种电影的存在；整体感观如同看着隔壁脑血栓的吴老二满当院追老母鸡跑丢鞋，可笑更可怜。
44,驴得水,5,一开始觉得荒诞可笑，结局那声枪响泪奔，不懂得为什么哭，就是想哭，这部电影确实值得观看
45,驴得水,4,开心麻花出品，必属精品，前面的画面一副岁月静好的样子，却不知前面有多欢乐，后面就有多难受，特别是女教师疯了之后，剧情快进，最终人散人亡，都很悲哀，人性总是不可测，利益冲突最后导致一拍两散，何其讽刺
46,驴得水,4,打一星骂话剧腔的真是恶心。
47,驴得水,5,看似所有人都无法解决的死局，为什么铜匠的老婆一己之力便解决了？
48,驴得水,4,2016年以一部<驴得水>收梢，甚好。话剧转电影的形式，还有爆裂的内核，人性的黑暗翻转，让我想起拉斯.冯.提尔的《狗镇》。真希望结局时，张一曼也能像妮可一样，捡起枪，站起来大杀四方。
49,驴得水,5,都怪这夜色，撩人的疯狂。都怪这吉他，弹得太凄凉。
50,驴得水,4,人们说悲剧，就是把一切美好毁灭。
51,驴得水,4,以后再随便看讨论区就剁手，太多污眼睛的言论。形式感很强，鼓励一下国产电影加一星。张一曼，倒是最值得回味的角色。
52,驴得水,4,前半部污污污，各种飙车段子。后半部分惨惨惨，理想主义的破灭。情节蛮精彩，一波多折，各种反转层出不穷，有点借古讽今的意思。众生皆苦，无人不惨。电影还是收了些，话剧更直接。
53,驴得水,5,打两颗星的能不能不装逼，你们是没看过小时代没看过从你的世界路过吗，这电影鼓励鼓励十分都能打啊
54,驴得水,4,一曼的凋零，铁男的委顿，两个中国电影里少有的鲜活立体的人物形象。
55,驴得水,5,三处迷之感动：1.张一曼拒绝魁山的那段表演。2.锁匠离去前的歌声。3.无数彩球从山上落下。
56,驴得水,5,值得推荐
57,驴得水,5,太好看了，剧本过硬，表演到位，节奏控制不错，今年的佳作
58,驴得水,4,此片辛辣讽刺，女主角形象演技真的不错91，值得一看，其犀利风格合我口味
59,驴得水,5,很喜欢张一曼，虽然是悲剧，但活的自由从来都是难能可贵的
60,驴得水,5,一种很经典的爬坡式戏剧矛盾，像连环的鞭炮一样，每当一个角色让步一点ta的原则，就会爆出来一个更大的矛盾，然后烫手山芋滚到下一个人手里，再引爆，最后炸到尸横遍野。强化了警示作用，不要让步原则。可细想，如果没有最开始的让步原则，大家连水都没有。好啦，死路一条。
61,驴得水,4,可能是华语电影的年度神片，剧本精心打磨，以喜剧的方式讲述一个悲剧的故事，处处充满辛辣讽刺，有野心，有胆识。电影感上还需要再打磨一下，但总体瑕不掩瑜。
62,驴得水,4,看完真的压抑…开头有多温馨后来就有多残酷…每个人都变了…  尤其看了嘉年华 小女孩被剪掉头发的时候 我悲哀的发现 如果说驴得水是时代的悲剧 那么这个时代 也是当下 只是方式不同
63,驴得水,4,讲的是个羊脂球的故事。意外伤感。戏里的男人都是渣渣，一曼太惊艳我了。
64,驴得水,4,中国近代史的微缩与丑陋的民族夹缝生存哲学的嘲讽――权力分配资源，以恐吓各阶级重塑秩序、混淆黑白、制造遗忘，并“保全大局”为名行“牺牲他人”私欲；软骨头的知识分子抱以扫除腐朽的热忱，又易在权、利夹缝中媚上偷生，蔑视农民。后者天真地同国家机器一齐“翻天”后又难逃食物链底层命运
65,驴得水,5,年度华语电影最大惊喜，也是目前最佳。一幕魔幻现实的大戏：严丝合缝的精巧剧本，荒诞不经的黑色讽刺，非常闪亮的女性角色，成熟老练的包袱设计。野路子加荤段子，生猛带劲，俨然莫泊桑的套路。大赞女主任素汐，越看越耐看。缺憾么，话剧感明显#讲个笑话，你可别哭#
66,驴得水,5,泪流满面。最后去了延安，真尼玛细思恐极。
67,驴得水,5,好的观众和好的演员一样，你得进得去更要出得来。拿“让我看得不太舒服”的论调去否定一部影片这样的态度真不可取。也许单纯只看情节、抠细节和梗和解读其中的讽刺、隐喻就已经足够劲道尽兴，但于我个人而言，更有趣的在于你去发现、去感知、去记录这部电影所有的，结构的编排节奏点的转化和能量的爆发
68,驴得水,5,能把蒜皮当雪花的姑娘你真好。
69,驴得水,5,不要妥协，妥协只会招来更大更多的妥协。人从为自己开脱，接受从前不接受之事的那一刻，精神上就已经死了。文艺作品中的女性形象，往往比男性更立体更可亲，大概是女人不参与政治，因此得以保存「感情用事」的气性与清醒――然而最后大多也正是败在了「感情」。
70,驴得水,5,真是了不起。
71,驴得水,5,太好看了，心疼张一曼。每个人都走上了毁灭之路，有些人能若无其事继续下去，有些人无法欺骗自己选择离开，有些人则以死亡为嫁衣。所谓梦想，大抵就是在荒芜的人生中滚过的华丽跳跳球，有斑斓五色，却难以把握，终究是个玩意儿，留着照耀卑微的自尊。结尾黑白相片有一张出自“白夜照相馆”，有意思。
72,驴得水,5,人之恶，中国人之恶，中国男人之恶。这都多少年了，很久没看过这么有胆识的国产电影了。年度十佳。
73,驴得水,4,本来想轻松一下看这部电影的，期望它荒诞又喜剧；但猝不及防的假笑和残酷，电影迅速滑入人性的黑暗、幽深与举刀互杀中，就像一场混沌失控的噩梦：人与人之间的爱与恨善变，权力与金钱一贯所向披靡，碾压一切。看到倒抽冷气，内心拔凉。怎么评价这部电影呢？它跟我想象得不一样，但它绝对没让我失望。
74,驴得水,5,非常棒的讽刺喜剧，虽然青天白日满地红飘扬了好几次，但谁都知道它想说的是谁。前三十年和后三十年的丑恶都露出来了。大家吐槽的戏剧感我倒觉得不是问题，可能是话痨电影看多了吧。技术是糙了点，但立意和力度都值得五星。女主真的特别好
75,驴得水,5,勇敢的人离开了，善良的人死了，柏拉图说只有对你有利的才是真实，在晴空下唱《我要》的那十分钟美极了，最后张一曼朝自己开的那一枪实在清脆又令人内心畅快，人和牲口的区别是人敢于勇敢去爱，可圈可点地一部国产电影，而且导演的名字是一位对我而言有意义的故人，以上是观影感受。
76,驴得水,4,中国式的黑色幽默：为了撑住一个起初看上去不大的假象，引发了笑料和残酷的真相。节奏是挺流畅，只是看着太像一个拉长了的小品。此外，无论台词还是人物形象，看着充满了时代错置，当然话说回来，这原本就是个脱离了时空的寓言
77,驴得水,5,看到最后真的好难过……话剧有电影无法做到的癫狂，电影也有话剧无法企及的抒情。事情是荒诞的，世界是荒诞的，人性最荒诞。#一曼老师最美！#
78,驴得水,5,仗义每多屠狗辈，负心总是读书人
79,驴得水,4,话剧走上银幕的佳作，很难得的讽喻喜剧。包袱，段子，反转，讽刺，对故事节奏的把控恰到好处，满屏荒诞，乐中带悲。
80,驴得水,4,3.8吧。擅自Remix一下，“睿智”的佳佳说出了“如果过去的就这么过去了，以后只会越来越糟”，失望至极去投奔她的大哥，去了延.安。接上周铁男这时说“你太幼稚了”。有些人觉得这片不够巧妙不够藏，以此贬低这片。你们以为你们崇拜的《让子弹飞》是有多巧妙有多藏怎么的，盲目崇拜。
81,驴得水,5,冲突的核心就是当所有人都有冠冕堂皇的理由时，所有人都不可逆转的崩坏了。张一曼成为了整个荒唐故事的牺牲品，其他人又可以若无其事的从头来过。
82,驴得水,4,姜文之后最好的在喜剧元素背后添加政治隐喻的电影。情节黑色到底，连看上去像为了过审的去延安字幕配上1942的背景都显得极为讽刺。不过无论是豆瓣为主的夸张一曼女权主义还是支护为主夸铜匠老婆的劳动人民无畏和有原则，都显得对电影主题避重就轻――前者可以说是没文化不知道萧红，后者就不要脸了。
83,驴得水,4,看片需心中默念社会主义核心价值观。背景设在大民国居然就狡猾地通过了审查。一出无需捏他任何西方电影梗也能非常好看且后知后觉的剧本。屎尿屁到黑色幽默再到完全笑不出的荒诞讽刺。任素汐一百分。
84,驴得水,4,可以看出来剧本确实不错，黑色幽默，隐喻，讽刺。。。。然而导演处理得不好，效果大打折扣，很多人物之外的信息都没有恰当的通过拍摄展现出来，都过于话剧化。
85,驴得水,4,瑕不掩瑜，特别唏嘘。作为女性，中间一段惨到看不下去。像批斗、剃头这些行为早在文革历史中就熟知，可是用影像的方式编排出来还是冲击力很大。非要在意一部电影的表现形式吗，但我不是影评人，我不用在意这点。我甚至也不想在意镜头啊摄影啊这些，心里很多很多感慨，就只能说，唏嘘。
86,驴得水,4,不错，其实不是喜剧片，类似姜文鬼子来了，影射国民性和专制体制对人性的摧残和义和团般的所谓群众运动，这点自孙中山畜类统治的广东，所谓的国民运动批斗士绅到文革，一脉相承
87,驴得水,5,无法把它当作荒诞因为现实的地方太多。
88,驴得水,4,以为是喜剧，结果是悲剧。中间有好几段非常感慨。感觉每个人物都是自己，还蛮值得琢磨的。准备二刷走起。
89,驴得水,5,真是看到沉默。我们总说过去就让它过去吧。这部电影里说，如果过去就让它过去了，以后只会越来越糟。
90,驴得水,5,我站在窗口，鸟儿飞离了枝头，这世界了无意义。风轻抚过田野，是人碎烂的声音。
91,驴得水,5,讲过去的事，打得是现在的脸
92,驴得水,4,开心麻花的成功说明中国观众可以不需要好电影，但确实需要好故事。后半部分人物转变确实太硬了，哪怕说小知识分子本来就这样，但他们也会用不那么难看的姿态去妥协和投降。只能说还是刻意做出来的寓言，不过这个寓言的双重对照结构（老师们骗特派员、特派员骗老外）还是让这个故事充满趣味。
93,驴得水,5,前三分一的欢声笑语，后三分二的集体沉默…电影厅里大家应该都感受到了…
94,驴得水,4,3.6星。1.整体完成度不高，镜头和演员略用力的表演像话剧不像电影。2.笑点以尺度不小的黄段子为首，后半段走讽刺荒诞路线，渐入佳境。3.片子看完你可能很难受，因为你在里面看到自己曾经纯洁如今现实虚伪的一面。4.如果夏洛特烦恼让你记住了一剪梅尹正，这部会让你记住一个满嘴大碴子味的帅哥叫刘帅良
95,驴得水,5,我总感觉这是一部黑周立波的电影。
96,驴得水,4,最近才看这部电影，讽刺意味十足，全程压抑。结局昏暗，时代的悲哀。
97,驴得水,4,「如果过去的就这么过去，未来只会越变越糟。」话剧直接搬到电影上还是显得夸张，不够电影化。不过到不至于所谓的观感难受，本身电影元素里也不只是有春光明媚。但影厅里一大群当喜剧在看，哈哈嘿嘿从头到尾就让我觉得很尴尬了。★★★★
98,驴得水,5,主创野心勃勃，最后的成品也是国产剧中的秀作。借民国讽喻本朝“中国特色”之劣迹种种，虽然后半部影射文革有点脱线，但“过去的就让它过去，未来只会越来越糟”仍能与主线接轨，剧终“某某投奔了延安”则实现了金蝉脱壳的华丽转身。当然，黑色幽默的表象之下是鞭辟入里的反思和谴责。
99,驴得水,5,笑点是夏洛特的一半，深度却要比夏洛特高不少。各种对现在社会和政府官员的讽刺！题材受限，票房也应该未必有夏洛特好。后半部分看的真让人心里难受。虽然人物性格和电影感方面有欠缺，但是在中国这个群魔乱舞的电影市场，实在是一股清流了。今年目前国产电影最佳吧！推荐大家等电影大规模上映去看看！
100,驴得水,4,不像电影，像是电影院的话剧，但是，剧本和主题真好。看完不知道从何说起，假如这部是韩国的片，又会刷爆朋友圈吧……
101,驴得水,4,终究是一场话剧，乡村女教师的戏五星好评，可惜后面她的故事线被拆散了。前半段有劲，有点儿《钦差大臣》的意思，从第二幕结束开始乱了阵脚，铜匠的变化生硬。女主演艳光四射！！！！！
102,驴得水,4,不能说完全没打动我，但也确实没有太打动我。从一曼身上看到了羊脂球的影子。但我希望中国电影在刻画女性自觉的时候，不要总照着羊脂球的形象去塑造，除了“被侮辱与被损害”，还是该有些别的。PS：怀疑佳佳去了延安，只能被逼嫁老干部，还真不如去美国。以佳佳的智商，一定能在美国把铜匠卖个好价钱的
103,驴得水,4,居然能过审查，其中的众多影射官僚主义、拜金文化、封建迷信、文革批斗、贞节牌坊啥的太多了，魔幻现实主义像是三流的库斯图里卡，确实像是几个小品串起来的东西，没啥电影感，深度和反思也不可能比得上《鬼子来了》，但能有这样的故事还是能让观众在笑过之余能记得某些东西也算不错了吧
104,驴得水,4,没看过话剧，故事是好故事，放到小说里不会觉得违和。但是电影里对人物后期的设置有强行扭曲之嫌，有些跳脱。让人觉得，诶呀，孬也好，恶也好，狂也好，疯也好，都那么有艺术性
105,驴得水,4,一个谎言引发的无数谎言，推倒了人性的多米诺骨牌
106,驴得水,5,农民翻身把孽造，文人相轻群自保，深明大义投我党，枉费我美一片心！朋友说讽刺当下，我说这他妈还要讽刺吗就是当下啊……还有那些跟这谈电影语言和逻辑的，你麻痹你们才是外宾啊，这逼国家什么时候用过语言和逻辑行事过？不批上个喜剧外套和那两段投奔延安这片子能过审？
107,驴得水,5,_^H棚著火的蚨斡捌看完思O恐：周F男打^有勇o\，一曼跳MH棚救火，裴魁山一航o一曼埋土，最後校L一令下主持大局，H棚o]了，O佳垂死救火，s遭到人阻r。@隹s影心服口服！！！
108,驴得水,4,意外地不难看且有点意思
109,驴得水,5,奴才做了主人 是绝不肯废去‘老爷’这个称呼的
110,驴得水,5,佳佳象征了共产党。这样一看：又是民国、又是美国人的……妥妥的政治隐喻。铜匠的意识觉醒起源是性、吃的是驴得水“死”的是吕得水……种种太多了！很有意思~~~话剧不话剧不管，至少今年的群像演技最佳是这部没跑了！
111,驴得水,5,导演讲了一个小故事，却深刻的反应了现实，没有用喜剧作为结尾，更能引人深思。校长代表了理想，校长女儿代表了希望，一曼代表了自由，铁男代表了人性，老裴代表了现实，特派员代表了权利。为了理想坚持，为了自由而结束，在现实和权利面前扭曲了的人性，还好最后我们还有理想和希望。
