,movie,star,comment
404,触不可及,1,扯淡，哪有那么好看，豆瓣怎么了？都9.1分了！大家都怎么了？多久没看琼瑶小说了？这不过就是个普通的煽情片子，不至于吧？公平来说也就6分
405,触不可及,2,这部片子让我直面自己骨子里是个俗人的现实；作为一名俗人，看罢最大的感触是：有钱真好。原声很舒服，平淡的叙事挺治愈。
406,触不可及,1,剧情弱智。。感动不起来。。能有这么多故事的前提是瘸腿的大叔有钱、很有钱。。没钱呢？还有故事吗？
407,触不可及,1,政治正确加反智主义，给弱智看的电影
408,触不可及,2,结构安排非常业余
409,触不可及,2,天上掉馅饼的事感动不了我
410,触不可及,2,这尼玛也有9.0，这尼玛也能进九强？！
411,触不可及,1,我想这应该是部超现实的作品，无法看懂其中想要表达的涵义，就好像在看另类版的“2001太空漫游”[偷笑]
412,触不可及,2,2.5
413,触不可及,1,以后再也不看这种感人的法国电影了。
414,触不可及,2,就算是不可|的幻X，也得做得有f服力些，管它已颉嘎明」了。
415,触不可及,2,"对法语片完全没感觉. 依我看, 此片完败于Driving Miss Daisy和Scent of a Woman"
416,触不可及,2,配乐很棒，至于故事嘛。。
417,触不可及,2,哪有大家说的那么好 难看又闷！
418,触不可及,2,不值这个分数，也就6顶多，也没觉得感人，如果黑男免费照顾他n年，而富翁也不是富翁，那这个才是感动。一切建立在金钱关系上的炫富故事，如果让我感动，那我感动拜金主义？说坐私人飞机去跳伞，几十万买一幅画，还很像郭敬明的故事。
419,触不可及,1,如此平庸虚浮的影片，如此俗套的fantasy，却得到如此高分好评，真是不可思议，只能打个一分来平衡一下了。
420,触不可及,1,尼玛
421,触不可及,2,话说不是飞姐提醒都忘了标记这玩意了。我来个中肯的评价吧。真是感动的一逼啊！！
422,触不可及,2,反正我是没多大感触。跳伞这项极限运动很帅啊。配乐也很赞。
423,触不可及,2,为此感动……法国人真的疯了……
424,触不可及,2,看的法配版。
425,触不可及,2,被骗了
426,触不可及,2,男主神似达斯丁霍夫曼！
427,触不可及,1,烂的像坨屎
428,触不可及,2,对无生命力的主旋律木有好感木有看下去的欲望，虽然还是半死不活一个个镜头看完了。
429,触不可及,2,很好，但是想一下松堂医院我更是半点都喜欢不起来。
430,触不可及,2,分这么高，以为和其他的“两个不同的人相遇，彼此的生活被改变”这类的片子有什么区别呢，原来没什么不同。豆瓣这分太不可信了。
431,触不可及,2,我能说这片是加了戳不中笑点的笑料的蚊香识女人么。。。。。。。
432,触不可及,2,最讨厌拿弱者做笑料的电影，还加上一个自以为是的失败者
433,触不可及,2,瞎鸡巴
434,触不可及,2,我敢说要是把装13的配乐换了会欢乐十倍。
435,触不可及,2,土
436,触不可及,1,看不下去
437,触不可及,1,除了配乐之外，烂的无与伦比
438,触不可及,1,解构片，不属于我这类暗黑系
439,触不可及,2,温情片 不适合我
440,触不可及,2,那副画卖了一万欧并不等于它的价值真的如此，只是因为它被富豪标榜过；Driss的故事看起来很美好也是同理。所以我不喜欢这个片子。
441,触不可及,2,感动个鸟毛啊。。。
442,触不可及,2,我对不起大家，我实在觉得这电影不怎么样。不是我的菜。
443,触不可及,2,很不幸地，我的生活里就有过这样一个残疾人。可是他没钱，他拖垮了整个家，他的老婆对他不离不弃，可最后他也没能在所谓的高科技的帮助下活到70岁。什么样的残废的老男人才能培养出一个忠犬攻？五星童话
444,触不可及,2,不温不火
445,触不可及,1,好高雅的电影
446,触不可及,1,无趣
447,触不可及,2,观影指南：上豆瓣看剧情简介，使用快放功能播放电影
448,触不可及,1,原来是有音乐的原因啊？在大巴上看的，基本没放大声音，也没插耳机，就看字幕。。感觉没什么
449,触不可及,1,俗套无聊，毫无亮点，不知道触到了广大法国人民和豆友哪根脆弱的神经，获得了如此高的票房与口碑
450,触不可及,2,老实说，真是被这九分忽悠的，电影还算不错，但没觉得有什么太出彩的地方
451,触不可及,2,"反正我是没感到
"
452,触不可及,2,虚高减一星
453,触不可及,2,说句实话……我真没觉得怎么着……配乐不错是真的……
454,触不可及,2,豆瓣250 拍得很认真 但无奈前人已有n部相关类型更好20140122
455,触不可及,2,我猜这片子应该不错，可是我鄙视我以貌取人，虽然我努力克制自己，但是那主演黑鬼实在让我看了心里不舒服。果断删
456,触不可及,1,为毛会感动
457,触不可及,1,意大利人Ludovico Einaudi的一曲<Divenire>如同一条清新的航线，略过整块好似电影一般的荒芜。用钢琴压住浓厚的俗气，就像为黑人选择舞蹈表达其原始野性，这些手法单调到让你只想快进，能有个脱俗的结尾是对片子的最后期待，没想到。。依然是重复的播放<Divenire>，试问换成<I Giorni>应该更贴切些吧？
458,触不可及,2,期望过高了
459,触不可及,2,可能好多人觉得好，可确实不是我的菜
460,触不可及,1,这片子能得9.0分，严重怀疑！7万多人的评价，天啊！不敢想象
461,触不可及,2,竟然有9分 我能说脏话吧：不是我不够文艺范 只是我太不会装逼 太不会感动！
462,触不可及,2,完全没觉得感人，反而觉得有些地方有点造作。。。额，不用给这么高的分儿吧，即使在这个GAY片LA片泛滥的年代
463,触不可及,1,充满了法左的偏见：黑人总是率性而真诚的璞玉，白人总是伪善的小人，这种stereotype让人特别反胃。
464,触不可及,2,不懂何处感人。优雅白人富翁+低智商黑人穷小子，贫贱逗乐。Driss在家苦着脸对谁都大吼大叫，遇一不仅身瘫还毫无幽默感的陌生人一下子欢天喜地各种卖萌耍乖，顺带还要给人抠屎灌肠，这也能叫友情 ？而那些在画展、剧院、高级餐厅、私人飞机上的逗笑不过是“刘姥姥进大观园”，逗贾母一笑，各取所需而已
465,触不可及,2,什么鬼电影。垃圾。
466,触不可及,2,我爱黑人兄弟。
467,触不可及,1,狗是人类最好的朋友
468,触不可及,2,很正常，真正的尊重，朋友的关系，朋友的帮助，不仅是生活上的
469,触不可及,1,故事有爱，段子搞笑，四星整
470,触不可及,2,66987  关爱残障人士
471,触不可及,1,看着无压力
472,触不可及,2,感觉就像《天水围的日与夜》一样，全片毫无高潮，也许我这种俗人不会看平淡的片子。
473,触不可及,2,挺平庸俗套的。同样题材的远不如《再见索罗》。
474,触不可及,2,这破片子有啥好看的？看这种都能看哭的，估计给你个土豆盯着你也要瀑布泪吧。#对不起【然而
475,触不可及,1,这样的影片你们居然这么多打满分！！！真是搞不懂，故事情节很一般，很感人吗？原来豆瓣里的人喜欢的都是这种电影，难怪啊！
476,触不可及,2,请问好在哪！？群众的天使心我服气了
477,触不可及,2,"我看这部剧就是佣人主子版本的""穷美傻各种不靠谱被高富帅各种包容终于休得真爱""的恶心剧情吧！"
478,触不可及,2,如此套路，居然是个真实故事改编。。。可以说就是个要做粗活累活版的遇见你之前了
479,触不可及,1,呵呵
480,触不可及,2,就 ... @印2.5
481,触不可及,2,不带感 ，或许法国人喜欢这样的温情吧
482,触不可及,2,这么CCTV6风格的片子竟然在豆瓣评到9.0……没处感动了是吧，骗我！
483,触不可及,2,搞不懂法国人。。。
484,触不可及,2,并非所谓的拍档片，仅是一个具有非凡技能的草根草根超级英雄闯进上流世界然后拯救失去希望的人们。导演镜头语言干枯，表演还算自然，法式幽默实在难以理解。对于话痨艺术当道的法兰西来说，这么一个好莱坞式的故事实在算得上新鲜。
485,触不可及,2,浪费老子时间，豆瓣这群脑残的品位真不敢苟同
486,触不可及,2,"我冷血,"
487,触不可及,2,真的是看着没有任何感觉的片子 因为我看到一半就真看不下去 这么高的分数是什么意思？？
488,触不可及,2,推荐http://movie.douban.com/subject/1938174/
489,触不可及,1,"看了四十分钟就看不下去了，没有任何值得称道的地方。
"
490,触不可及,2,真诚嘛，我觉得假~假死了
491,触不可及,2,什么呀你们就给5星！
492,触不可及,1,本来是两个白人的故事被改成一黑一白还扯到那么多移民问题和人权问题是不是太欲盖弥彰了
493,触不可及,2,和棒子的穷家碧玉遇到豪门高帅富式的爱情故事没有本质的区别。
494,触不可及,2,跟人性相关的题材就比较容易获奖吧，很难进入，没有高潮，说是纪录片还差不多…
495,触不可及,1,评分太高，怎么能值九分，   豆瓣的水平严重滑坡。。。
496,触不可及,1,尼玛豆瓣的托天天方肘子卡脖子！
497,触不可及,2,虽然电影不错，能够让人自然的从内心感到快乐温情，但是实在想不出为什么分数这么高，所以减掉一颗星
498,触不可及,2,意思还是有一点的，就是表现形式难免让人感觉用力过度，煽情得有些滥情了。
499,触不可及,2,音乐不错，没感动。
500,触不可及,1,有点假还有 有钱什么都行
501,触不可及,1,本来给2、3星算了，看那么多人给5星还是给1星平衡下真相吧。
502,触不可及,2,其实，我不太明白这个片子分数为什么这么高。
503,触不可及,1,为啥我看了40分钟就看不下去了。太他妈无聊了好吗！
504,触不可及,1,"本来觉得还可以，但very CD和豆瓣上一边倒的夸张好评让我觉得难受。
"
505,触不可及,2,这种鸡汤片要是国产肯定评分不会这么高，最近刚好特烦种族歧视题材。
506,触不可及,2,毫无缘由的煽情。
507,触不可及,2,梦境和现实的影子交织，故事没有很感人，人物塑造脸谱化，不真实，男主像达斯丁.霍夫曼.
508,触不可及,2,意淫
509,触不可及,2,马马虎虎，太阳光了点
510,触不可及,2,不是我的菜
511,触不可及,2,不好看，不感动。豆瓣排名前位的短评非常准确！
512,触不可及,1,美化，了世界，偏离了世界。
513,触不可及,1,鸡巴哦
514,触不可及,1,有些部分小有趣，但表现出的感情像塑料一样。
515,触不可及,2,就内容而言，“真、善、美”一应俱全；就电影艺术来说，这片子别说红酒，就连矿泉水都配不上。
516,触不可及,2,不明白好在哪里
517,触不可及,2,别人怎么做富翁都一脸不爽。。。。。看不出什么感动，男主角光环罢了
518,触不可及,1,啥矫揉造作的片儿啊这是！情节假表演浮夸！残障人士是不需要同情，但和任何人一样，也不需要粗鲁和无知的蠢货来陪伴！黑人那角色完全就是黑有色人种的好吗？！自带主角光环做什么都一副老子天下第一有理的欠扁相！要是有人假装天真拿开水烫老子的腿，我管他是什么人，马上赶出家门，永不录用，tnnd！
519,触不可及,1,有钱闲的蛋痛，捐我俩撒
520,触不可及,1,闷死 怎么也想不明白瘫痪老头一开始怎么会让一个毫无责任心的人照顾自己 还那么愉悦
521,触不可及,2,无差法会
522,触不可及,1,矫情。
523,触不可及,2,如果有一方去世了我可能会给4星
524,触不可及,2,"呀！K啦，槭颤N那N多人喜g的影只有我不喜g，是否我bp力有}啊，是我]那N高的文化修B去^p@高深的影。呀我明白了，可能我是一冷酷o情的人，感受不到影中的感樱又或者我]有那N高的文化水嗜ニ伎歼@些P於A，友情，平等的}。好了好了，看完了立即h除，以免看到@部影在硬碟上的r候引起自卑--插(赡兄黠w玩弄警察_始,角色反差(赡兄鞯姆N族Ac身份),反S(黑男主的高r售出-λg的S刺）。"
525,触不可及,2,看来大家对这么高的评分都是枪手整的这件事达成共识了…根本没有那么好笑那么感人…很平淡的故事…
526,触不可及,2,栗子
527,触不可及,1,从头至尾我都游离于剧情之外
528,触不可及,1,真心不知道这个片子的点在哪里，就是讲了个故事而已，真心看不上法国人拍的片子，破大点事情，能说两个小时~~~
529,触不可及,2,霸道总裁爱上我，我是男的。
530,触不可及,1,过几年再来看看评分吧。
531,触不可及,2,这个电影早就想看，可是看完觉得不过如此。不知道为什么，老头子那个演员演得很好...
532,触不可及,2,就那样吧，落入俗套，故事平庸，也许记录片更好吧
533,触不可及,2,攀上牛仔院墙的法兰西人不慎跌落，他说，我瘫了，我金多，我高潮。
534,触不可及,2,这浮夸的演技完全无法让我支撑过前20分钟。。
535,触不可及,2,太老套了 不觉得黑人主角演的怎么样，不自然
536,触不可及,2,大家品味都好高呢 反正我是看不懂
537,触不可及,2,可能是文化隔阂，我更喜欢美版。亚裔按摩女郎这一安排很多余。090109
538,触不可及,1,不是不喜欢这类片子，可这一部真真的没劲儿。
539,触不可及,2,再怎么努力也无法继续 10分钟弃
540,触不可及,2,和我娘一起在飞机上看的！……下载的是德语版本的 怪里怪气的 奇怪的很！不好看 不懂好看的理由……
541,触不可及,2,看不下去一类
542,触不可及,2,没感觉多么好看，很一般般吧
543,触不可及,2,法式温情片，白人和黑人的融合，没什么亮点，个人不太喜欢这种风格。也不明白为什么豆瓣分数会这么高，因为文艺片因为外国片就这么追捧吗？我不喜欢只能给低分了
544,触不可及,1,原本3星，因为剧情单一，过于喜剧。豆瓣总分过高，才给一星以求平衡。
545,触不可及,2,"真的看不下去
"
546,触不可及,2,挚友难寻 且行且珍惜
547,触不可及,2,完全无法被感动，可能是我的理解问题。真的有这么多人真的喜欢这部电影？？？
548,触不可及,2,原版应该很感人，这个故事应该是没有抓住关键点。讲得很白开水，就像我外公在复述一部电视剧。
549,触不可及,2,爽
550,触不可及,2,cheesy as fuck.
551,触不可及,2,矫情
552,触不可及,2,我已经看不了文艺片了。。。
553,触不可及,2,"这种程度的亲情的片子比比皆是,加上比河东狮吼稍好点的,莫名其妙的幽默,被高分骗了,6分的东西."
554,触不可及,1,说实话真的看不下去，太虚荣太做作，演技很浮夸…
555,触不可及,2,c'est bon. et c'est vrai ?
556,触不可及,2,忘得差不多了。
557,触不可及,2,起一个还要猜测其含义的片名不如干脆叫intouching。难以被感动。无趣。
558,触不可及,1,此片给个四星是没问题的，但由于水军作恶，所以我只能给一星为评分制度的平衡出一份绵力。
559,触不可及,2,没觉得有9分那么好啊。。
560,触不可及,2,中规中矩的治愈片，末尾的钢琴曲倒是很好听。
561,触不可及,2,没有看到感动，没有看到温情，更没有笑出一下下………
562,触不可及,1,毫无亮点可言，也不知道怎么拿到这么高分的。既然第一位能够忍受那么多，第二个为何就什么都不能容忍，真是没有原则。
563,触不可及,2,Boring. OST还可以。
564,触不可及,2,不喜欢
565,触不可及,2,牛B吹的有点大。
566,触不可及,1,分数离奇的高了，拉一下分数。。一个资产阶级白人富翁跟一个无产阶级黑人贫民的友谊故事，，，超出正常人的想象，在中国，估计不太合时宜。。。
567,触不可及,2,"boss说""我请他的原因就是因为他不怜悯我"",  那护工何止不同情你啊简直就是不尊重你还拿开水烫你呢。请个护工都要上升到同情心的高度,这boss放到现实中就是一傲娇的抖M啊呵呵呵。"
568,触不可及,2,两位人物相互改变，共同进步。剧情流水账，人物个性也不突出。黑人对于菲利普有好多冒犯的话一度让菲利普生气，一点都不人道。
569,触不可及,1,我真不知道点在哪里。。演技也完全没有加分。
570,触不可及,2,我已经无法忍受法语的电影了。。。完了。。。
571,触不可及,2,别的不说，但是看到黑人在不小心烫到病人然后惊诧地继续倒水试验…我就忍不下去了。没法看了。
572,触不可及,2,最恨励志片最恨励志片最恨tmd励志片
573,触不可及,2,这不就是（互补+钱不是问题）的格局设计么！！！这个设置可以说已经用得烂大街了，为什么你们还打9.1，欺骗我纯洁的感情！！！黑暗中的舞者才8.3，自闭历程才8.8，朗读者才8.4 !! 你们要闹哪样！！
574,触不可及,2,不戳我
575,触不可及,2,多出来的一星给配乐，人设欠揍，剧情，动机，硬伤，法国电影大概也就死了吧
576,触不可及,1,演员，剧情都很好！虽然略显沉闷。原来打算2星，但是无奈我和主角的性格是完全相反的，相性相冲的……生活如此美好，戏中的法国和现实的法国一样迷人。
577,触不可及,2,没啥好看的
578,触不可及,2,苏菲玛索《枕边的男人》 
579,触不可及,2,两星给配乐，哪让人感动了，豆瓣都是泪点超低的人吗~
580,触不可及,2,就是这部，让我意思到，豆瓣说的好电影，不一定都适合自己
581,触不可及,1,白左电影。音乐很好。
582,触不可及,2,还行吧，勉强及格，完全不知道高分怎么来的。只要涉及到平权和歧视就是高分？好莱坞的zzzq感觉越来越全球化了。。。
583,触不可及,2,豆瓣9.1分什么鬼
584,触不可及,2,1都什么时代了，还演这种灰姑娘、穷小子步入豪门的故事；还喜剧，哪里有笑点？  2都懒得解释为何看上他了，连这点诚意都没有 3结尾倒使我想起了我姥爷（使我没给一颗星），如果他最后不能动的时候，我背着他、抬着他下楼或去江边看看多好啊；但那时我图省事，就没多做什么。
585,触不可及,1,好在哪里？
586,触不可及,2,故事真的是太一般了，完全无法理解为何能得这么高分
587,触不可及,2,剧情老套
588,触不可及,2,top23？就这？
589,触不可及,2,配乐比电影好 刚看完时感觉不错 现回想起来有什么值得给高分和感动
590,触不可及,2,没觉得哪儿好啊
591,触不可及,2,黑人无论开多么过分的玩笑，白人都欣然接受，我没有看到纯真的友情，只看到了刻意的迎合
592,触不可及,2,不喜欢。只觉得钢琴曲好听。导演那种想抹平肤色、种族，财富、教育之间的不平等的法式意淫简直让我作呕。
593,触不可及,2,完全看不下去！
594,触不可及,2,没有评价的那么好，还可以吧。。。9.1的评分也太高了
595,触不可及,1,"看5分钟就知道两个小时要放些什么的烂片。还有OST扒BABEL的?
"
596,触不可及,1,好看个鸟。基佬电影。
597,触不可及,2,无法理解
598,触不可及,2,两星最多了，平淡无比的叙事，全程无笑点，更别提什么感动，豆瓣评分9.2？呵呵
599,触不可及,2,太高雅了，欣赏不来，应该让英国人来拍，最好拍成个基片。
