,movie,star,comment
181,触不可及,5,绝对是今年看的最棒的电影。人的一生会不会遇到真正能让你开心的人呢。也许有一个，也许没有。
182,触不可及,4,20120525
183,触不可及,4,两个男人心灵相触的小清新
184,触不可及,4,男人之间的动人友情，虽然太理想化了
185,触不可及,5,心里暖暖的。。
186,触不可及,5,真正的情是不需要煽的！P.S.原声又火了啊
187,触不可及,5,这是一部无甚惊喜的叙事和感动的电影。关于社会的贫富差距、青少年犯罪、种族歧视这些虽没有明说却在暗中映射，以此来烘托角色。富豪有钱却残疾不快乐，黑人贫穷却有一颗善良乐观的心。超越种族和阶级的友情，感人至深的温情，细腻动人的剧情，以及极赞的电影配乐，不禁让人想再次回味！.
188,触不可及,4,轻松幽默有点治愈，不联系现实来看可以当是个温情治愈片，要是说是黑人移民给白人富豪当护工，就有些……当然，里面的那俩还是很可爱的，像是用没什么大不了的态度说一些沉重的现实，片子背景音乐很不错，非常值得一看。
189,触不可及,5,绝对相信这是个真实的故事。。
190,触不可及,4,人生际遇妙不可言
191,触不可及,5,精神!文艺！
192,触不可及,4,内心总有一部分触不可及
193,触不可及,4,温馨有余，但有欢笑无泪水，没有触碰到我的内心深处吧。但仍不可否认片子的成功，让我暂时又对法国电影有了兴趣。
194,触不可及,5,不让别人知道这次收藏
195,触不可及,5,"very nice touching, an funny, movie about two unlikely men who have more in common than they know themselves. Wonderful music."
196,触不可及,5,大自然的味道
197,触不可及,5,触不可及的永远都藏在内心最深的地方・・・・・・
198,触不可及,5,法式治愈系，太棒了~！
199,触不可及,4,what a wonderful fairy tale
200,触不可及,3,轻松诙谐，很有趣的搭档故事。但叙事浮于表面，人物塑造脸谱化，故事缺乏真实感（尽管是据真事改编）。弗朗索瓦・克鲁塞和奥玛・赛的表演动人，但受剧本限制人物缺乏层次。过分中正的温情。3.5星。
201,触不可及,3,又被神话了的电影。
202,触不可及,3,以调和阶级矛盾为旨的片子必以强调阶级差异为乐。
203,触不可及,3,还是有钱人爽
204,触不可及,3,宣扬阶级调和的励志片，从立意到手法都很平庸，不明白怎么那么受欢迎。
205,触不可及,3,没有想象中那么牛B啊。
206,触不可及,3,对于过于完美的想象，我总是心怀恐惧。
207,触不可及,3,只有在这种极端的对比之下，我们才能看清：财富并非万能，健康无比重要。一具病体，连灵魂都不得安宁。
208,触不可及,3,这种题材放给美国人拍肯定会完全不一样吧，当代的法国人拍东西还是太GING太温情脉脉，贱不起来也残酷不起来。关系进展太刻意了，黑人的前史结合的不好，观影过程挺愉快的，但看完了有种无法回味的尴尬感。
209,触不可及,3,钢琴缓缓流淌的温馨，流行歌曲跳跃的欢快。人生中总是在不可知的位置遇见那个影响自己一生的挚友。
210,触不可及,3,叙事白开水，配乐犯规向。无刺可挑，但也不亮，启蒙时期错过即无感系列。★★★☆
211,触不可及,3,这才是阶级嘛。阶级不是一个贬义词，只是一个描述。
212,触不可及,3,由此可见法国人民的文艺其实还是假文艺，骨子里还是喜欢看好莱坞这种温情加点幽默的故事。这片子给我的感觉是音乐真的很棒，演员表演也没说的，但故事其实也就是好莱坞最主流的那一套。所以说人人都爱好莱坞。
213,触不可及,3,观影体验愉快，但作为一个调和阶级差别的故事，仅有偶然意义，而无标本价值。
214,触不可及,3,没有想象中的那么好，也没有看完后的那么糟糕，两个陌生男人阴差阳错相识然后是一段悲欢杂糅却不暧昧的友情故事，有时候人与人的相交就这样。（这位瘫痪的病人和霍夫曼有点神似）
215,触不可及,3,有些桥段真是笑死，看完一想起那个因为2万3千欧元自杀的建筑师就觉得这又是一部现代童话而已了
216,触不可及,3,挺有意思的法国轻喜剧. Fran04ois Cluzet和Dustin Hoffman完全就是一个模子里面出来的啊.
217,触不可及,3,一个柔弱的白人老头和一个爽朗的黑人汉子之间的故事。非常温暖，但能让人笑出声来的地方只有一两处，不能算喜剧。
218,触不可及,3,有点意思
219,触不可及,3,"配乐是我一直最爱的Una Mattica, by Ludovico."
220,触不可及,3,法国的片子艺术感太强了，有点接受不能，不过友情还是诠释得很棒
221,触不可及,3,我觉得就是一个平铺直叙的故事....没啥高潮....
222,触不可及,3,麻麻，除了感动也没啥感觉了，低于期待值。
223,触不可及,3,照常的法式温情片，它居然由真人真事改编。让人感怀的是，世界上最和你契合的那个人完全不是自己可以想象的，也许一辈子也遇不上
224,触不可及,3,mark:paragliding
225,触不可及,3,黑人小伙子不错 这片子也抵挡不了我的睡意
226,触不可及,3,音乐比电影好多了。浮光掠影似的叙事，模式化的笑点，不知道是不是喜剧电影的通病呢？故事不错，但电影可以更好的。
227,触不可及,3,配乐不错
228,触不可及,3,挺可爱的一个片，甜而不腻。但片里每个人物都过于童话了，片头醒目的真人真事提示，反而露了怯
229,触不可及,3,温情
230,触不可及,3,很好的睡前电影，节奏利落，虽然双主角阶级有差异但喜剧部分主要还是来自于性格差异，黑人的立场并没有什么阶级性。配乐也很好听，起码下半夜看片的我不困了
231,触不可及,3,以厍榈墓适旅栊疵篮玫那选
232,触不可及,3,Fly~~~
233,触不可及,3,也就原声配乐赞了一点，其他的还好吧。不知道为什么这么高分。
234,触不可及,3,原声真的很棒~~~
235,触不可及,3,残疾的人生来点幽默也不错 开心是一天 不开心也是一天 为什么不开心点呢
236,触不可及,3,尼玛都要领救助金了还买魔声耳机。
237,触不可及,3,乐观人生
238,触不可及,3,……可能不是我的菜吧。o(s□t)o
239,触不可及,3,无限矫情滥情伪情畸情基情小烂片
240,触不可及,3,三星半
241,触不可及,3,怎么老让我想到闻香识女人和潜水钟与蝴蝶，不过显然更喜欢后两个
242,触不可及,3,关键问题是戏剧冲突感不强 另外辅线全都不突出 剧情推进有点跳 感觉白开水 其他也还凑合 耳朵很敏感的哈哈 3.5星
243,触不可及,3,每次没得夸的时候就只能说，配乐还不错哟，尤其中间跳伞那段muse的feeling good
244,触不可及,3,我相信是根据真实故事改编的，但还是觉得很多情节太造作了。演员表演还不错。后又补：这电影属于越琢磨越没味道的，所以决定把7分改成6分。
245,触不可及,3,配乐太赞！
246,触不可及,3,对9.0的评分感到莫名其妙！
247,触不可及,3,演员和配乐是华章，可惜故事却让我感动无力，好吧，我真是心肠越来越凉了~
248,触不可及,3,完全没get到点....所以就是说白富老是个抖m吗 =_=
249,触不可及,3,感人在哪儿啊啊啊啊啊。。
250,触不可及,3,私人护理和主人公有巨大的差别，主人公有着优越的物质条件，私人护理却生活窘迫，人和人是有差别的，电影一直看下来，找不到平衡点，或者并不需要平衡点。可能是我看不懂吧
251,触不可及,3,电影时间太短了，很多深层次的东西不够挖掘。
252,触不可及,3,迷恋跳伞的富翁因事故造成脖子以下瘫痪，于是聘请了一位黑人护理，两人日久生情，相濡以沫。。。。人物设定的很有趣，从开头就很搞笑，很温情，两男人的性格都好有趣，配乐也很好，推荐一看。
253,触不可及,3,最打动我的是，即使对于一个瘫痪了的人，他们也给予了他享有隐私和个人空间的权利。这比在言语中回避到一些让人不舒服的词汇重要得多。 （然后我终于明白了一个挺有趣的疑问，嗯~）
254,触不可及,3,"“还能比12km/h更快么？” 
　　“不能。” 
　　“那好吧”"
255,触不可及,3,!!严重骗分
256,触不可及,3,故事如此简单，像一则温馨动人的小品。
257,触不可及,3,因为他没有同情心
258,触不可及,3,挺有意思的。法国人对高位截瘫的热爱可以和韩国人对白血病的热爱相媲美。
259,触不可及,3,也许是我期望太高，也许是风格不对我口味，电影感觉Just so so
260,触不可及,3,类似《生命的舞动》，同是残障人士的励志故事，不同的是它从照顾者为切入，阶层，贫富；故事一般，生气仍不足，“同情心”其实是一种很怪的情感，可能会是爱心，也可能会是侮辱；“真正的残疾不是我坐在轮椅上，而是从失去她开始”；菲利普愿意找的是朋友，不是穿着白大褂天天喂药，为他担心受怕的看护
261,触不可及,3,爱情不过是生活的屁，基友才是人生的high
262,触不可及,3,温情幽默的阶级互相改造个例
263,触不可及,3,有人曾经挑战过自己足够了，我想，我再没有耐心和一个嘲笑我喜好和生活方式的人在一起那么久的时间了。看片的过程中，一直替菲利普烦得慌。///另，特别理解给《老男孩》、《三个白痴》、《不可触及》这种片子五星的人。
264,触不可及,3,我承认被打动，可论情感雕琢不及《刺猬的优雅》亦《与玛格丽特的午后》那么法式精致，论题材又在苏菲的《枕边的男人》之后。实在无力给予更多褒奖。
265,触不可及,3,白水
266,触不可及,3,谁能告诉我泪点在哪么 我泪点这么低的人都没有泪到 ps:Philippe是怎么生孩子的？
267,触不可及,3,白人高富帅中年跟黑人潘壳嗄辍（诶还是觉得有浓浓的基情、）啥呀、这评分、扯淡吧就、
268,触不可及,3,猫和老鼠
269,触不可及,3,故事类似修女也疯狂，一个与环境格格不入的人，由于她（他）气场强大，乃至感染了周围的人，一个是喜剧片，一个是温情片。
270,触不可及,3,他们在对方的世界中大口呼吸 因他们各自受困于自己世界中的药物副作用
271,触不可及,3,千金易得 知己难求 PS. 三星半 
272,触不可及,3,说到底，还是因为是好人
273,触不可及,3,演员 很卖力 给一星   幽默很冷 给一星   装逼很彻底 给一星 
274,触不可及,3,所以 我从不会在别人难过的时候说安慰的话 一方面能让我陪的朋友我都当他们每一个都是坚强的个体 另一方面那话我也不太好意思说的出口。愿意说 我总会让你说出来的 否则 就让你跟着我一起称兄道弟一起HIGH！
275,触不可及,3,够温情，却也并没传说中的那么好。
276,触不可及,3,电影其实很普通啦，但是音乐，尤其是结尾那个，绝对是治愈心灵的。
277,触不可及,3,完全没有被感动。。
278,触不可及,3,不值那么高分
279,触不可及,3,9.1分的电影，一个二个都嚎“温情”“感动”，我却没被感动。感动毛啊感动，而且拍的一点都不基
280,触不可及,3,无感，感觉那黑人的性格也不是很讨喜。
281,触不可及,3,笑点不同。。。
282,触不可及,3,"一部有关友谊的治愈系温情作品,如同童话般"
283,触不可及,3,真实故事改编什么的最爱看了，不过这类就是有一个人永远深得另一个人要领的温情片在现实里很幻灭的。
284,触不可及,3,配乐好
285,触不可及,3,居然没有搅基
286,触不可及,3,两个人的差别弄的太夸张了些，开心果到哪儿都乐观积极
287,触不可及,3,风靡一年后才和jojo去看这部电影，没有传说中这么神秘嘛
288,触不可及,3,活者不能太压抑
289,触不可及,3,因为不是一个人看
290,触不可及,3,原声不错，剧情略微平淡
291,触不可及,3,讨厌的电影。
292,触不可及,3,这部电影再次验证了一个事实：黑人的脑子里装的全是shit。这电影让我评奖的话，能得个最佳配乐。结尾揭露真相――看护工根本就不是黑人。这电影一样的剧情如果在国内拍，估计也就是个赔钱的货。
293,触不可及,3,这片区人种面相还蛮像非洲人的。。。带形容词的人都不是人。
294,触不可及,3,堆做的温情，一部片子就只剩结尾了。
295,触不可及,3,温情之余略显平淡，可能是没太用心看进去的问题，不过这种格调的，是枝裕和的片子可能会更到位一些。
296,触不可及,3,可能我的泪点和你们不一样
297,触不可及,3,是一煲老火汤，可惜料子不够靓。
298,触不可及,3,搞笑，但是高潮不够，被评分骗了。。。
299,触不可及,3,……无感，似《遗愿清单》。法式宋思明大叔挺帅，女儿的头发挺好看。
300,触不可及,3,低级腐是对男性世界的认知障碍 高级腐就一乐子
301,触不可及,3,其实是俩宿友在看 我穿插着跑去看了几个片段 貌似还不错啦 
302,触不可及,3,这片看了真觉得就一般，9.0的评分实在是有点高的离谱了！这是为啥呢？
303,触不可及,3,果然。。。对于这一类片子一向无感
304,触不可及,3,with her
305,触不可及,3,我肿么就木有看出有那么好呢？一个老套的故事，一段几乎不可能的友情，如果不是说友谊，而是乌鸦变凤凰的爱情，就不会有这么高了吧？
306,触不可及,3,大家的评价好高啊 虽然故事不错 可这事儿要不是发生在一个超级阔佬儿身上就没故事了吧
307,触不可及,3,并不出彩的故事，格调不错，颇具风情
308,触不可及,3,原声比较棒！
309,触不可及,3,把原型改为黑人，政治正确得太刻意
310,触不可及,3,很有爱的一段真人真事
311,触不可及,3,很老式的感
312,触不可及,3,想知道那么多人是如何被深深感动的。
313,触不可及,3,不知道这片何以这么高分，我觉得蛮一般的，呃，菲利普真的很有贵族风范。
314,触不可及,3,为什么我觉得并不好笑呢？Driss的粗鲁太过了一点，虽然是为了讽刺上流社会的虚假吧，但很多地方违背了做人基本道理，如果没有导演在旁，我很难想象菲利普们会那么宽容。
315,触不可及,3,听着不像是法语 有时还有英语 黑人讲话部分特别像配音 不知道是不资源问题 影片太表面了 没什么新意
316,触不可及,3,轮椅小老头太可爱了。理想世界里人与人相处应该敞开心扉吧，没有隔阂，虚荣和不安筑起的墙，都被真诚融化。
317,触不可及,3,电影还算不错 但是还是感觉被豆瓣的评分欺骗了 
318,触不可及,3,电影本身节奏演员啥的都没问题，就是有一种“现实才不是这么一根筋”的感觉
319,触不可及,3,好像《遗愿清单》、《我最好的朋友》。生日会结束后猜古典音乐那段真是太棒了！
320,触不可及,3,对不起，没被感动到........
321,触不可及,3,忘记是谁推荐的这个片子，看完之后，觉得并不如“枕边人”好看，太流于表面，其实，真正的高位截瘫的人，内心必定是很封闭的，情感的流露也必定是很隐忍内敛的。苏菲的那种骄傲隐忍下的依赖和脆弱，这部电影的男主完全比不上。
322,触不可及,3,很好，看这电影 表情一会傻笑，一会凝重
323,触不可及,3,中规中矩的一部电影，可能是题材比较讨喜，和这部电影题材些许类似的电影有《闻香识女人》，显然和那部相比这部还算比较耐看。
324,触不可及,3,Not bad。。 但是这个评分难道不是刷出来的吗？
325,触不可及,3,泪点到底在哪里？
326,触不可及,3,feeling good
327,触不可及,3,肉体痛苦消失后，就是无尽的精神痛苦
328,触不可及,3,寸步难移的躯壳里是有多么野性的灵魂啊
329,触不可及,3,对这种互助型题材的电影已然脱敏，感觉貌似又看了一版《遗愿清单》
330,触不可及,3,没有想象的那么牛逼。
331,触不可及,3,没看进去，但原声依旧抓人
332,触不可及,3,可以吧，]那N好看啊。。。
333,触不可及,3,“豆瓣评分失灵”法则：温馨、感动、友情、幽默、触及伤痛――即使故事凑活也能到很高的分数
334,触不可及,3,菲利普长得太像达斯汀霍夫曼了。。。。音乐很好。。
335,触不可及,3,非常套路化，属于看了开头15分钟就知道怎么拍下去的片子。中规中矩的老好人片
336,触不可及,3,你相信男人之间有纯友谊吗？我不信，尤其是在掏屁股的时候
337,触不可及,3,有些像《闻香识女人》。一样的感动。钢琴配乐异常的动人。
338,触不可及,3,我说这是一部老港片有人信吗？我说这是《表错七日情》搅基版有人信吗？
339,触不可及,3,应该把残疾人拉屎拉尿也一并记录了。
340,触不可及,3,"交口和高评分闪瞎我狗眼/平庸平庸平庸,情节剧套路,尽在范式中/透出以颠覆高雅、规则、传统自得、来取悦观众的意思/两人生活和心性的交往和对冲没有碰撞出足够精彩的火花/表演不错"
341,触不可及,3,有人说这种还是不刻意的煽情。。。那你告诉我什么是刻意的
342,触不可及,3,没想到去年还有评价这么高的新片，IMDb上也进入了TOP250。不过这种片子就是你被感动到了就会打高分，没什么感觉也打不出低分，难怪分会这么高。影片改编自真实故事，导演是看了相关的纪录片才萌发拍成剧情片的想法。
343,触不可及,3,感觉没那么好啊~
344,触不可及,3,法兰西电影要是都这样法兰西电影狗还怎么汪汪汪啊？
345,触不可及,3,为什么豆瓣老是自动删除我看过的电影！
346,触不可及,3,略枯燥。。。
347,触不可及,3,音乐~赞！
348,触不可及,3,"护工是如何被大家接受的这一点没有交代,他想凶谁就凶谁,向让谁听话就让谁听话,他想打断别人就打断别人,他不是直肠子,是不尊重别人."
349,触不可及,3,居然整整两个月才看完。。。音乐不错~
350,触不可及,3,过誉
351,触不可及,3,应该比３Ｄ版的泰坦尼克有意思吧～　那个老男人长的像打死听伙夫慢啊
352,触不可及,3,轻松诙谐，很有趣的搭档故事。但叙事浮于表面，人物塑造脸谱化，故事缺乏真实感（尽管是据真事改编）。弗朗索瓦・克鲁塞和奥玛・赛的表演动人，但受剧本限制人物缺乏层次。过分中正的温情。3.5星。【我是来同意艾小柯的，句句点中心坎儿~~~
353,触不可及,3,在这部片里黑人白人平等相处、贫富阶级没有对立、失业问题轻松解决，这是一部政治太正确的电影，再加上点法国人所喜欢的戏剧性与艺术感，造就了这部去年法国最高票房的电影。和《一次别离》的差距就表现在太过温情而牺牲了生活的真实性。
354,触不可及,3,不温不火，主要弘扬出跨阶层跨肤色的友谊。黑人的个性过于讨喜化，片子没有高潮。如果是真实改编应该会有冲突的场景出现。配乐很棒。
355,触不可及,3,类似的题材也看过 音乐不错
356,触不可及,3,典型的法国电影~
357,触不可及,3,豆瓣的高分电影是怎么了，还是我怎么了，ost做的还真不错
358,触不可及,3,老与少，富与贫，俯与仰，轻与重，尊重与同情，激情与平淡，理解与误会，滥俗的情节与生动的细节，各种矛盾纠结，在流畅的叙述和如水的配乐交融之下，开出温情之花。
359,触不可及,3,就挺一般的电影，豆娘的品味有时候真是难以捉摸。黑哥们长得有点像加内特
360,触不可及,3,3.5
361,触不可及,3,跟《遗愿清单》一样，残废的富人遇到好心的穷人，然后就火化了……还有条件玩刺激~经历不一样的人生
362,触不可及,3,黑天使的出现给他的生活带来了新动力.
363,触不可及,3,法国电影的节奏，不是太慢就是太快
364,触不可及,3,不理解
365,触不可及,3,弗朗索瓦・克鲁塞演技不错
366,触不可及,3,纯亲情剧，演技很好。
367,触不可及,3,好笑，感动，配乐好听，然后好像就没别的什么东西了
368,触不可及,3,人与人交流总是会相互影响对方的，但这部电影不足以影响我使我给它打五星。。。
369,触不可及,3,没有触到我的点……
370,触不可及,3,是不错，但不至于说成是神片吧。烂番茄也才有77%的新鲜度，觉得还是烂番茄比较靠谱。
371,触不可及,3,偶滴神，看的时候我还在想达斯汀霍夫曼的法语怎么这么好啊，看完发现压根不是一个人演的。。。OST应该更值得收藏一些
372,触不可及,3,这部电影水分太大。分是被人五毛五毛的刷起来的
373,触不可及,3,什么法兰西黑白互补灵魂共鸣高雅上档阶级感化与社会反思，毫不做作的剧情推进和轻松感十足的法式幽默顶可让人称之为是一锅美味十足的心灵鸡汤
374,触不可及,3,挺普通一个故事 高分在真是故事改编吧
375,触不可及,3,大俗套，不但故事情节是大俗套，每一步都能猜到要往怎样的情节发展，种族，阶层，两人彼此的家庭问题等等等等，甚至音乐都是大俗套，用了很多古典，可是每支都是最最最最通俗易见的，9.0的评分完全在意料之中，人们就爱大俗片
376,触不可及,3,镜头蛮好看的，但是我对文化冲突无感。
377,触不可及,3,音乐真棒。其他真心一般。
378,触不可及,3,为啥分这个高？不至于啊
379,触不可及,3,连法国也开始双男主角了，这个世界肿么了。
380,触不可及,3,原型不是黑人啊
381,触不可及,3,笑点真多，法国人就是Mean，越刻薄越讨人喜欢
382,触不可及,3,"overrated,现实里不太真实的部分才会被搬上大银幕，而最真实的是那些不可触及的细节、灰色角落。Ludovico Einaudi的配乐嗲。"
383,触不可及,3,"中规中矩，为毛这个高分？！豆瓣的评分有时就是不靠谱，一群装B的文艺青年！！
"
384,触不可及,3,如果快D四倍放映，可以上四星。
385,触不可及,3,两个极端的碰撞，故事不错，电影一般。
386,触不可及,3,因为没下阿黛尔字幕，又想听法语，大年三十就看了这部不温不火的煽情片，教条式节奏，没达到真正不按常理出牌的刺激感，不过真人真事就打个欣慰分把。
387,触不可及,3,笑得挺欢，音乐故事都不错
388,触不可及,3,三星半吧
389,触不可及,3,剧情一般，没新意。女儿的角色刻画不够
390,触不可及,3,mo甚新意，但充M了不刻意，嘏人心的感人力量。片尾Una mattina的琴曲 「Ludovico Einaudi」是最厝岬陌帷
391,触不可及,3,同情只会让人更加不幸。个人观感只是中等水平的法式温情小品，黑人小伙逗逼疯，残疾富翁老来乐。
392,触不可及,3,这是没有包容和尊重的世界，无论在哪里.歧视一直都存在，种族，肤色，贫穷，人们用鄙视的目光行为去压制他人，认为贫民窟的人没有同情心，人人都唯利是图却要装出高雅尊贵的样子，即使感动也在掩饰，所以无药可救。配乐真棒，比故事出彩。
393,触不可及,3,稀碎稀碎的大无伴减一颗星 
394,触不可及,3,触不可及指的是一种人生的状态：一种不敢面对现实，不能认清自我，不能享受去生活的态度。片里的黑人跟家人无法交流， 跟社会充满隔阂；而瘫痪老人拥有着钱与孤独-----最终，他们从彼此身上得到了生活新的光芒。
395,触不可及,3,也是童话一种，小王子和狐狸，互相征服，互相惦记，各自生活。
396,触不可及,3,分数怎么这么高？如果我是菲利普，断然不喜欢德希斯，纯粹就一2货啊，没素质没教养。影片大部分时间都是关于二逼青年欢乐多。剧情发展完全符合我的猜想，包括最后德希斯为菲利普安排的约会。但非要说的话，这种不经意间建立的友情我还真喜欢。最后一个问题，菲利普脖子以下都没感觉，是怎样育有2女的？
397,触不可及,3,音乐很棒，风景超美，剧情soso
398,触不可及,3,无惊喜， 细节好。
399,触不可及,3,黑小伙长得像巴神
400,触不可及,2,整部看完，改成6.0分，全给配乐，肖邦维尔瓦第巴赫……但这故事的确不算感人。我确认自己不是铁石心肠，但这片里描述的友情，其实很普通。
401,触不可及,2,这样的故事如何来建立价值认同？残障人本身得是个富可敌国的大富豪，出手阔绰黑人才肯勉强戴上手套给他掏屁股。护工得语出惊人似乎做真实自己就可以得到钱罐子青睐。富豪连脑门上都刻着人傻钱多，如果这样的设定都能让一大波人悟出人性，拜托以后看到霸道总裁爱上灰姑娘的时候别忙吐槽，尝个鲜乃常情。
402,触不可及,2,法国《失恋33天》，全是聒噪无趣的对白和装模作样的悲喜交加。
403,触不可及,1,片子不错，但太造作。对比法国在卢旺达大屠杀中的卑鄙角色，这个片子令人作呕。
