,movie,star,comment
364,千钧一发,3,人是分三六九等的，现在也是，只不过没有明文规定罢了。我不想说啥努力就一定会成功这种屁话了，但是不努力一定是失败的。一不小心被剧透了男二自杀，不然我应该预料不到的…说不出来哪里悲伤，但就是看完觉得难受，还有就是看了问题里千钧一发的译名的解释，一开始不理解现在觉得很赞、
365,千钧一发,3,影像质感很棒，借科幻外壳输出梦想内核，竟没料想到是部催人热泪的励志片，命运里的悲伤基因。
366,千钧一发,3,Consider God's handiwork; who can straighten what He hath made rooked?
367,千钧一发,3,"Consider God's handiwork:who can straighten what He hath made crooked?
ECCLESIASTES 7:13
I not only think that we will tamper with Mother Nature,I think Mother wants us to.  WILLARD CAYLIN"
368,千钧一发,3,片子不错，可惜不是我的茶。
369,千钧一发,3,探讨生命哲理的经典之作，演员阵容倒是够强劲。十二根手指的钢琴家那处是本片的精髓，以及文森特那句「我从不为回程保留体力」。凶手应该垃圾工吧，要不干嘛那么拼命收拾
370,千钧一发,3,没有字幕的电影还是比较痛苦的......
371,千钧一发,3,乌玛 我的女神 :D
372,千钧一发,3,故事挺好，基本没尿点，但是总觉得怪怪的
373,千钧一发,3,第一次觉得乌玛・瑟曼这么有味道！   
374,千钧一发,3,不喜欢这种比较闷的科幻片，科幻对社会可以有深刻反思，但是前提得好看。
375,千钧一发,3,明星大腕一堆・・・对于科技的超前反思，做的虽然不是很深刻很哲理，但是还是做到了。兄弟游泳的镜头和最后的一段对白，让自己默默流下几滴便宜的泪。以前感觉自己不属于这里，但是离开的那一刻，还是舍不得，冲到太空，或许并不是离开，而是回家。
376,千钧一发,3,因今年基因编辑婴儿事件而看。97年的影片。基因技术是把钥匙，但人类打开的门将会通向何方？我从不为游回去保存体力。背水一战，破釜沉舟，底层的逆袭只能如此。
377,千钧一发,3,摄影牛逼，每个镜头都很美，Ethan很帅，情节很腐。但是我很讨厌这电影叙事节奏。
378,千钧一发,3,片子冷酷得一如霍克的脸。
379,千钧一发,3,原来每个人都在默默地帮着Vincent。PS吐槽一下坑爹的未来体检...
380,千钧一发,3,原来每个人都在默默地帮着Vincent。PS吐槽一下坑爹的未来体检...
381,千钧一发,3,20191110le。这片高分的莫名其妙。无论在九十年代还是如今，充其量就是个及格线上的商品而已。
382,千钧一发,3,uma theman
383,千钧一发,3,并没有那么好看嘛。伊桑霍克长得好精致。
384,千钧一发,3,今天看了before sunrise 想起来Ethan Hawke第一次给我留下深刻印象的这部电影
385,千钧一发,3,检测放水 警察是你弟弟 还有个好基友天天给你提供头皮屑 真的要谢谢社会主义对我们invalid这么好
386,千钧一发,3,有点儿沉闷...男主角之间很有爱
387,千钧一发,3,呃概念很好，拍得不是特别好，尤其中后段，其实如果现在要翻拍老电影这种类型最合适，理念好，有创意，不是太烂，但又不是特别优秀经典，以现在的条件会拍得更好，这样的翻拍才有意义。最大的感触是那个时期科幻电影特别多(当然其实好莱坞一直都多，现在加上超英电影更多)，只是觉得那个时期更有想象力，对未来世界更有期待，不管是好的坏的，对科技充满幻想，这是不同片子的统一气质，不像现在，总是更多的冷冰冰的技术陈述或者是强调外星异族的入侵。说那时候的片子立意太高的人是真的不知道现在的电影比起以前差多了。
388,千钧一发,3,我只留力气游到对岸
389,千钧一发,3,老片竟然早看过。从剧情线索来说，警察压强不够，但是原始创意过于强大，可以允许这种呼之即来挥之即去的情节处理漏洞。乌玛瑟曼美得让人想哭。
390,千钧一发,3,反基因决定论，兄弟间的竞争和羁绊，摆一个科幻设想，整体较平，特别是结局，一般
391,千钧一发,3,看了一点儿。用黄色蓝色滤镜表现氛围。《毒品网络》也是这样处理吧。评分竟这样高。
392,千钧一发,3,科幻励志片，比较平淡。
393,千钧一发,3,先天不足猫咪一样温顺蓝眼睛的伊桑霍克却有着天大的梦想~
394,千钧一发,3,没有给我太大的震撼，也许人生而平等的信念早已铭刻在心。每个人在生活面前都是卑微的，每个人都需要努力去找到自己的人生定位。杨利伟大概不懂怎么拍电影吧~~
395,千钧一发,3,1，译名太惊悚了，其实是个慢吞吞的软科幻片...其实更像概念片，三个人都好嫩；2，很恶心的片子，一直在验血验尿没个停；最后还有存一大柜子血尿的剧情安排，那人还不被抽干了？！这是BUG吧！！3，科技发展到可以基因筛选，竟然还让男二坐手摇轮椅真的好吗
396,千钧一发,3,看过，记得皮毛线索
397,千钧一发,3,感觉很俗b
398,千钧一发,3,just so so!这扯的片名谁给译的？
399,千钧一发,3,个人觉得一般
400,千钧一发,1,推崇个人奋斗呗，片子不是那么好看。主线是升空，但奋斗没描写多少，而是加入了太多的躲避。副线就是追查，没多大劲。还支出一根爱情线，更是无趣。最后办案人员是主角他哥，狗血淋头，强调了一下个人奋斗。讨厌，特别讨厌。
401,千钧一发,2,尽管格局已经这么小了，依然漏洞百出。科幻外衣包裹下的无聊案情。
402,千钧一发,2,尼玛闹半天是部励志片！！！！以为是科幻呢，尼玛能把科幻这个坑爹标签删去吗？生平最讨厌的就是励志片！！！！伊桑霍克和裘德洛一点也不像！！！！
403,千钧一发,2,除了场景构造有点先进，其他真是老套
404,千钧一发,2,打牌成了花瓶。故事主线毫无特色，悬疑没有理性色彩。倒是让我第一次见到了才子戈尔维达尔
405,千钧一发,2,首先什么样的近视眼才能连旁边的车也看不清？作为一个还没到这种程度的超高度近视，我觉得要是能直接基因剔除高度近视眼的人也没啥不好的其实……所以都这样了为什么还要作死乱穿马路啊我真的不懂，要不是有主角光环一不小心就撞死了呃，或者和男二一样撞成瘫痪……第二次和弟弟比赛游泳的时候我还以为弟弟要狗血地淹死了，正准备为这种安排破口大骂，结果弟弟没死）2019/5/20补充，最近因为美帝佐治亚、阿拉巴马、密苏里等州通过心跳法案的新闻，突然想起来这电影也是pro-life的，电影里还有台词是“上帝的礼物”“上帝的孩子”啥的，大概我也是属于pro-choice吧，所以一开始就很不喜欢这部电影
406,千钧一发,1,安德鲁尼科尔一股子江郎才尽的味道，把这个概念原原本本照着样子在《时间规划局》里腾抄了一遍；再说这部打着励志大旗的电影，活脱脱一个潘柯坑严肴ヌ空旅游的故事，每每出现问题都需要用做作的巧合去弥补，屡次出现的逻辑硬伤以及所做事情的不明就里令我哑然失笑，这让我不禁要问：“朋友，你这又是
407,千钧一发,2,真特么扯淡！公司死了个职员居然调查到大街上去了？要不要把地球上所有人都检测一遍？
408,千钧一发,2,让我想起了冒名顶替录取通知书的“罗彩霞”事件，人类社会任何阶段都要把人分成三六九等现学历、种族、肤色、宗教、姓氏……。都能把人划分等级。其实我们一直都活在影片中的社会里，影片里的等级划分无时无刻都发生在身边。这根本不是科幻片。
409,千钧一发,2,整个电影都傻乎乎的。意识形态陈旧。人物塑造不令人信服
410,千钧一发,2,完全看不出这片子好在哪里。剧情连基本自洽的逻辑都没有，角色也单薄可怜，结尾更是莫名其妙。可惜了复古太空风和演员们的颜值。
411,千钧一发,2,这么个唠比片子还8.5分？？？除了乌玛瑟曼能看，剧情简直狗血的一塌糊涂。。。。男主角一路开挂无人能挡有意思嘛！！！
412,千钧一发,2,极力想表达未来感，结果怎么都是小成本道具。
413,千钧一发,1,美国基督狗真他妈惨无人道，因为人家是基因改良违反圣意，就安排把人烧死？他妈有本事别吃GM食品啊！烧完了异教徒烧“女巫”，然后连黑人也烧，是准备一路烧下去烧出个和上帝合体的未来吗？都是因为霍克瑟曼两人有一腿我以为电影里能挖出撸料才去看的啊唉！还挂个弱智侦探故事当幌子拿出来骗人好意思吗
414,千钧一发,2,没看出来这电影哪里拍的好……居然有人当励志片来看……
415,千钧一发,2,努力可以克服基因？好吧，其实我一直很支持人类tamper with the nature以及人工优胜劣汰的
416,千钧一发,2,善良的软妹纸..落难的英雄..得势的小人物..血浓于水的兄弟..披着科幻外衣的狗血警匪片.从未如此讨厌大团圆结局.ps谁把片名译成变种异煞的?!太坑了简直!pps乌玛瑟曼居然有这么琼瑶的时候!那蹙眉的眼波啊~~~
417,千钧一发,2,真是一部满满豆瓣250气息的电影，也就概念有那么一点意思。你能想象一部片子的高潮段落是。。。验尿吗？
418,千钧一发,2,整个侦探事件和主题显得格格不入，把有些十分真实的瞬间都搞得不伦不类
419,千钧一发,1,【凡是学校要学习的电影一律一星】这个原则不能破。但其实超好看啊超好看啊朱德简直是君生我未生我生君已老......颜的峰值！！！
420,千钧一发,2,叙事沉闷 只看了30分钟
421,千钧一发,2,尽是片儿汤话。也经不起时间考验，82银翼没这感觉。ps，哪只手握JJ是件很随机的事
422,千钧一发,2,架势摆得很大，探讨未来的基因歧视，影射现实。但几幕戏转折都用得太廉价，且对外太空迷人之处毫无展示，梦想变成了说教。细节槽点太多，比如穿着西服挂着块奖牌坐火箭升空，好像在头等舱里一样，决心拍软科幻但也不能这么不像样。评分纯属虚高。
423,千钧一发,2,Ethan很好看，Jude不很好看，电影很不好看。
424,千钧一发,2,     虽然故事创意还行！不过导演功力太差！导致全片非常的晦涩！完全看不出导演想表现出什么！是男主角自强不息？不择手段？还是裘.德洛假借伊森.霍克完成梦想的哪种无私的执着！去TMD导演！还有翻译过来的片名《千钧一发》已经够牛头不对马嘴了，港版翻译《变种异煞》更是将坑爹发挥到了极致！
425,千钧一发,2,寓意很深，观赏性却不佳。
426,千钧一发,2,啊！可能是我不喜g伊桑霍克吧！
427,千钧一发,1,痛恨俗套。好假。让我想起时间规划局，假到不行。12月20日，在豆瓣翻了十几页终于找到你啦，开心。我就是想再加一句评论，剧情让我回想起时间规划局，好恶心的电影啊。
428,千钧一发,2,很多反乌托邦电影的问题在于不合逻辑，比如这个基因决定论，如果基因技术只能用概率来表明一个人的潜能，那怎么可能会被当作一种百分百概率的测试手段呢
429,千钧一发,2,坑爹的科幻片。。。故事有够单调的。
430,千钧一发,2,这电影的意义就是成就了伊桑霍克和乌玛瑟曼的婚姻吧 
431,千钧一发,1,20180530 01:02 GTL 什么乱七八糟，要是就为表达如何成就理想用得着这么费劲吗？这西装革履的查尿啊查血啊，有意思吗
432,千钧一发,2,在那个时代通过这些方式逃过科学检查，也太低级了点。不是天天洗澡就不会留下皮屑、头屑的。而且对于科幻片来说，道具（电脑、检查窗口、检查仪器、汽车……）也着实有点low，毕竟也是97年拍的电影，还不如1968年拍的《太空漫游2001》
433,千钧一发,2,？？？剧情跳跃磨磨唧唧莫名其妙，主题是keep your dream and the world will make the way for you的电影。最后为啥非要自焚呢。。。男二牺牲也太大了吧。乌玛瑟曼这里真的好看，当年咋还离婚了呢
434,千钧一发,1,非常沉闷，不知道好看在哪里，不看影评的话完全不知道在讲什么。
435,千钧一发,2,私以为如果是以科幻为重点应该在冒充优等人的细节上做多些文章，如果重点不在科幻，应该在优劣人等的区别以及男主身份转换前后的变化上做文章，感觉电影还是不够深刻。
436,千钧一发,2,太无语了，被误导了！
437,千钧一发,2,全剧的高潮就在最后尿检的时候，医生说细节也很重要
438,千钧一发,2,很好的题材，导演不给力；2012-12-23；
439,千钧一发,2,非常虚弱的科幻设定，人物都无力。
440,千钧一发,1,逻辑不通，粗糙简陋，不值一看。分值源于鲜肉，但缺乏自畹乃枷耄他们就成了木偶。没人能代替上帝创造人类。血统论需要去打破，而不是隐藏信仰去同流。
441,千钧一发,2,这是尼玛狗屁科幻片啊！王家卫拍的文艺范儿及励志狗血片.......逻辑性牵强
442,千钧一发,2,完全由演员颜值撑起来的电影，年轻时的伊桑霍克和裘德洛简直嫩出水。科技如此发达的未来竟然连虹膜识别、声纹检测都没有，身份验证技术还停留在DNA检测阶段，只有傻子才想不到利用样本造假吧，比起这些用生物个体特征识别不是更安全吗？只能说这样的伪科幻没有一丁点儿指导意义和观赏价值
443,千钧一发,2,这鸟片，这分怎么刷上去的？纯粹的文艺片！
444,千钧一发,2,我反正对于这部片很失望。难以看完。我从骨子里讨厌励志片。
445,千钧一发,2,4分 严重过誉 能从艺术指导和故事前提上看出来导演的用心 年轻时的裘德洛/伊桑霍克和乌玛瑟曼也真的很养眼 但是基本上影片的一切元素（剪辑/配乐/表演）都显出好莱坞式的老派教条 而且有很多处剧情上欠缺逻辑之处 最无厘头的地方无非是未来社会大家都可以用基因预测未来了到哪里还是连监控录像都没有 裘德洛的死也不过是导演的一厢情愿罢了
446,千钧一发,2,我怎么感觉这个电影看着一般，是我的眼光变异了？！
447,千钧一发,1,〔长片〕 ― 〔72〕 〔2019 Δ 273〕 〔1小时 46分钟〕
448,千钧一发,2,基因的故事，我没什么感觉，也许是太深奥了
449,千钧一发,1,且不论剧情存在大Bug，两个男演员年轻时候再帅又怎样，搞基了又怎样？我对这种鸡汤电影的厌恶感觉是不会改变的。
450,千钧一发,2,Hawke和他前妻Thurman，很一般。
451,千钧一发,1,披着科幻外衣的励志片，却没有励志片的激情。实在是太无聊了。
452,千钧一发,1,科幻片？我笑了，着实找不到哪里科幻了，无非就是讲了一个人通过种种手段和技术改变自己悲催的命运，就是连最后的故事都没有表述清楚，到底那个督查？是怎么死的？？一飞上天就结束了。我真后悔选择看这部电影
453,千钧一发,2,角色行为不统一，这种混乱的不统一没有很好地塑造人物，反而让人物失去颜色。无关情节和冲突太多，让The Valid接收Invalid的情节一次就好，女朋友哥哥医生来回走一个套路就很不合适了。。。各种问题吧，算不上是好片、
454,千钧一发,2,100多分钟的电影到底表达了个啥，亲情爱情基情？自由平等信念？还是科技不能凌驾于伦理之上？科幻的部分（勉强算吧）不去深究了，基本的情节都难以自圆其说
455,千钧一发,2,没什么看头 很阴郁的感觉
456,千钧一发,2,伊桑・霍克和乌玛・瑟曼换成马达和格温？如果真是这样的话，还有有点违和的，浪漫主义的理想也不就只有安东尼明格拉拍才能好看，好莱坞强大的工业就是能确保一个小概念，分分钟变成好观感的大电影......
457,千钧一发,1,不敢直接说这电影是垃圾，我就想问了，定位成科幻，惊悚，全篇的科幻元素在哪？就是可以基因定制？别和我扯什么这是二十年前的电影，终结者也是几十年前的电影。惊悚又在哪？就是因为死了个人？不能说漏洞百出，但是电影里的漏洞对得起这么高的评价吗？男主也就是个自私自利的人，只想着完成自己的梦想，你他妈一个人正常跑步都会心率过高快死的人，你不是浪费国家资源是什么。
458,千钧一发,2,缺乏想象力。
459,千钧一发,2,强行说教！强行说教！如果想办法把剧情弄完整点，悬念埋深点，然后男主角情到深处来抒发几句未尝不可――偏偏男主角像个小霸王学习机一样随时随地开启说教模式，弄得好像自己姿势水平很高，天啊好烦。
460,千钧一发,1,人蛮帅的。
461,千钧一发,2,完全冲着琼德洛给了两星。
462,千钧一发,2,哪里好看了这片。。。
463,千钧一发,2,I never saved anything for the swim back
464,千钧一发,2,伊桑电影里面比较不行的了吧 或者是我不喜欢大荧幕上出现求得落的脸
465,千钧一发,2,《爱在黎明破晓前》八字眉男主配《低俗小说》丑陋女主杀伤力巨大，给我恶心了一跟头。题材还行，布景中规中矩，节奏缓慢。
466,千钧一发,2,"good topic, bad movie. any story that is based on false imagination and assumption is a bad one."
467,千钧一发,2,这是一部反基因工程励志片，没有惊悚、没有悬疑，剧情节奏很慢略显拖沓，导演对科技的发展也是非常的局限没有远瞻性，本来3星的片子结局还要扣一星。
468,千钧一发,2,平铺直叙得让我不知说什么好
469,千钧一发,1,要不是男主我才不看这种无聊片
470,千钧一发,1,即使有裘德洛，乌玛瑟曼，伊桑霍克，也无法改变，这是一坨狗屎的事实。又拖又拉，吞吞吐吐，表达模糊，矫揉造作，建筑傻逼，想象呆滞。不仅立意肤浅，而且连个故事都讲不好...事实证明你豆根本没有辨别片子好烂的能力
471,千钧一发,1,讲述了在不久的未来，通过基因工程加工出生的人才是正常人，而自然分娩的孩子则被视同“病人”。文森特就是这样一个病人，而他的弟弟安东则是正常人。但文森特却非常想参加由遗传精英组成的戛塔卡公司，因为那样才能参加前往迪坦星的太空旅行。
472,千钧一发,2,披着生物科幻的外壳也架不住就是一部普通的商业电影，所有的观影情绪都来自于套路式的情节和反转，最后再谈几句梦想拔高一下，毫无深度
473,千钧一发,2,可能是边做别的事边看的缘故，通篇黑乎乎的感觉，本想着是部科幻大片，没想到是这么个情节，只在最后一科jerome自杀时有点小感动
474,千钧一发,2,既然是科幻片 应该接受各种脑洞 比如全剧人得脸盲症！是一部励志片…但是太过沉闷了…而且完全感受不到这是未来…
475,千钧一发,2,好看个屎
476,千钧一发,2,如果世界的本质是数字排列，诗意和浪漫都会荡然无存。非精英的人类同样有生存与生活的权利，灵魂没有基因，它可以自由地飞往外太空。
477,千钧一发,2,分数真好，都是因为励志就捧臭脚吗？
478,千钧一发,1,两人相貌相差如此巨大，你们都是脸盲吗？《白夜追凶》就比这个好太多太多。
479,千钧一发,1,这是一部讲述只要肯努力就可以改变人生的电影，但我不觉得是经典电影，励志电影很多，但这一部电影没有这种渲染力。不知道为什么评分会这么高
480,千钧一发,2,主角能上火箭不是因为他自己厉害，而是因为他用的基因厉害。剧情太勉强了…
481,千钧一发,2,“他们让你拼命找缺点，然后你的眼里就只有缺点了”。伊桑霍克和裘德洛长得也不像啊
482,千钧一发,1,被豆瓣的高分吸引来看  结果发现整个片子除了设定好 可以说哪儿都不好 无聊到看不下去
483,千钧一发,2,被评论骗了，怎么会有这么高的分？二星吧，被附风雅恶心到了！
484,千钧一发,2,★★☆☆☆ 叙事单一，故事老套，人设简单，爱情无感。女主角在低俗小说里的风情不知道比这里多多少…还有确实不喜欢美国傻boy类型的长相无论多帅，还是裘德洛这种欧洲美少年比较深得我心。不过提出的思考我倒是很受触动，我日常怪罪基因，但是如果可以通过努力改变，我应该拼死努力变成那1%
485,千钧一发,2,"4星的期待，3星的设定，1星的呈现…全剧只对女主有好感，结果惊喜的发现原来是演了低俗小说和杀死比尔的大美人，怪不得。更惊喜的发现原来男主后来演了爱在三部曲…演技还是老了之后才厉害啊，不然我还以为是没长大的todd anderson呢(卧槽，没记错的话就太神奇了…)
所以一定是导演的问题，一共没多长的电影还一个劲慢镜头拖时间，剧情密度太尼玛低了，好几个克制紧张的气氛都太做作了，必须快进…还要搞一堆基腐画面，真棒哦"
486,千钧一发,2,立意还行，但是剧本很牵强，叙述的节奏感也不好
487,千钧一发,2,是我的情商不够用？为什么我就感受不到半点的励志温情什么？果然我就是个伪文青
488,千钧一发,2,"Nice story, weak movie."
489,千钧一发,2,我真不适合看慢节奏的电影
490,千钧一发,2,电影主题还不错 但情节太假了 这种冒充的肯定分分钟被查出来！还有自焚的那个兄弟，实在不理解他的人生观，无回报的帮助一个普通人，这是雷锋思密达？
491,千钧一发,2,高分Boring
492,千钧一发,2,感觉旁白太多了，如今再看来，基因这个梗儿也不是很新鲜了
493,千钧一发,1,原谅我的欣赏水准，我想我可能要再看二十遍才能送上五星。
494,千钧一发,2,剧情弱到可怕
495,千钧一发,2,"""My real resume was in my cell,"" and a lousy story about discrimination follows."
496,千钧一发,2,新奇，就此而已。没有太多感觉
497,千钧一发,2,这片子拍的有啥意义么。臆想出一个discrimination的世界，然后塑造个hero，美化以梦想？
498,千钧一发,2,这真的是太剧作了...
499,千钧一发,1,主角三人的盛世美颜也撑不起这拖沓的节奏，精神内核意义深重，可是竟然放弃深挖下去转而讲了一个三流的故事，这他妈就很尴尬了。
500,千钧一发,1,主角三人的盛世美颜也撑不起这拖沓的节奏，精神内核意义深重，可是竟然放弃深挖下去转而讲了一个三流的故事，这他妈就很尴尬了。
501,千钧一发,2,莫名其妙
502,千钧一发,2,隐喻表现的太直白粗暴了，不喜欢这种科幻片氛围。1997年裘德洛和乌玛瑟曼的脸啊～（R63Q）
503,千钧一发,2,好硬的鸡汤……以为是个科幻片，其实是个文艺励志片……硬伤有点多，穿西装上太空也是醉了
504,千钧一发,1,作为一部科幻片，缺乏叙事的技巧。变得很乏味。和这个中文译名实在相差太大了！
505,千钧一发,2,伊桑霍克拍的没那么帅了，还有这译名是什么鬼
506,千钧一发,2,还行吧 不过真的很闷
507,千钧一发,2,和科幻毛关系没有，是方便豆瓣装逼犯们集中的片子
508,千钧一发,2,仔细想想在细节处理上真是槽点满满，就算是上个世纪的科幻片也不能那么反科学。主题的正确性，社会架构，科幻设计没有一个不是有缺陷的。友邻们，就算被洗脑了热泪盈眶也不能随随便便打五星好么~
509,千钧一发,2,当年天真无知 原来是20年后的转基因婴儿
510,千钧一发,2,属于没看明白的电影
511,千钧一发,2,除了几位主角的颜值之外，平庸至极。
512,千钧一发,1,平庸到尘埃里的剧情。
513,千钧一发,1,D 强行励志
514,千钧一发,2,…期待过高，落差有点大，很多部分是快进看的。很普通的电影，唯基因论的社会，人生来就确定了一生。以此为基础构建的一个借用他人基因的普通故事……
515,千钧一发,2,很感人吗？ 不感人。
516,千钧一发,2,not clear
517,千钧一发,2,都可以设计基因的性状了，为什么还要坐轮椅？
518,千钧一发,2,电影真的是一个很私人化的东西 我不喜欢科幻片 也不懂太空梦 勉强能理解导演想要表达的意象 看完以后非常阴郁
519,千钧一发,2,霍克和弟弟对峙那里最好看。
520,千钧一发,2,整部片子压抑的氛围太不喜欢了。考虑到这是22年前的影片，也是很厉害啦…
521,千钧一发,2,命运发给主角一副烂牌，自己努力打好，那叫励志，命运给了烂牌还告诉你接受现实，非基因优化人生来低等，别试图反抗，一心一意追浪漫梦好了，那就把编剧的屁股踹烂
522,千钧一发,1,我的眼泪不那么容易掉，我很理性。
523,千钧一发,1,昏昏沉沉的电影，我哪有耐心看下去？
524,千钧一发,2,美国梦主旋律，平淡无奇。海报倒是很漂亮。
525,千钧一发,2,没意思
526,千钧一发,2,cheat is cheat.
527,千钧一发,2,剧情逻辑有点瑕疵啊
