,movie,star,comment
104,千钧一发,5,对于这种好片，只有一种相见恨晚的感觉。本片在具有出色创意以及世界观构造的同时兼具了回归到个人层面的表达以及警世的主题。美丽而又无比忧郁，伊森霍克太适合这种角色了！
105,千钧一发,4,"开头有点震撼

古典配乐

Genoism

...possible...

Ethan Jude
Uma Loren

""It's funny.You work so hard.You do everything you can to get away from a place, and when you finally get your chance to leave, you find a reason to stay.
I never save anything for the swim back.
For someone was never meant for this world, I must confess I'm suddenly having a hard time leaving it. Of course, they say every atom in our bodies was once part of a star. Maybe I'm not leaving. Maybe I'm going home.""

Titan是土卫六...
不是说手术会有疤吗...还割骨...这解释..."
106,千钧一发,4,低下的瑕疵人，也有日天的梦想。折翼的试管人，也有参悟的资本。基因成为阶层的标签，而人类似乎都如同父亲认为优秀的子女才配有自己的名字。突破阶层的努力是惊心动魄的，而失去辉煌的惆怅更是彻骨深寒。两人的交集，分享了血液、毛发、尿液、名字以及梦想，互得所需，达至人生的大观。尽力遨游吧。
107,千钧一发,5,4 觉得千钧一发更加符合影片的内容嘛~ 所以当科幻成为一种载体，而不是单纯的利用科幻本身当卖点 那么科幻电影才能更加出彩~
108,千钧一发,5,残酷的完美。逃脱体制化是“我从不为回程留力气”。两人殊途同归的结局……剧情节奏对口。大喷一下译制名，脑子进屎了吧。law出场就秒杀，帅得不像话，觉得像……山田熊猫（诶）乌玛挺漂亮
109,千钧一发,5,I never saved anything for swim back. 【看到最后直接在课上哭了T T I'm wondering now is there anything impossible if u have dreams and keep fighting for them.】They say every atom in our bodies was once part of a star. Maybe I'm not leaving. Maybe I'm going home. 
110,千钧一发,5,“我从来没给自己留过后路。”“他们要你去寻找缺陷，到最后你眼中只看到缺陷。”“我只是借给你身份，你却与我分享了你的梦想。” 我最讨厌“三岁看小八岁看老”之类的断言，因为我相信，“人生而平等”。
111,千钧一发,5,本以为讲的是歧视 后来才知道是励志电影 呃 我还是对励志情节太不敏感了......
112,千钧一发,4,A surprising update of the change-of-identity theme. The most wonderful part is how the director uses different kinds of visual and verbal ripostes to weave such a touching narrative. Those repetitions always ring a clear bell in our hearts.
113,千钧一发,4,为什么我满脑子的重点都在裘德洛被公主抱这点上呢=-=腐女没得救了。。。不过剧情什么的在97年这个时间上看来已经近乎完美，故事本身也很美好很励志，被替换身份的男配没有嫉妒没有反目成仇，这点我很喜欢。
114,千钧一发,4,励志科幻片..故事连贯紧凑且有启发性，演员很到位。
115,千钧一发,4,电影所渲染的基因科学过于极端化，在我看来背景有点站不住脚，不过在讲述一个有志者事竟成的故事上这片属上乘之作，小球球的所有美貌真是的，都献给了腐！
116,千钧一发,5,我最大的疑问是，两年前下这片子的时候只有寥寥几千人看过，为什么突然就暴涨到两万多人看过，而且分数从当年的8.1增到了8.5？！四星半看完了，安东和警察的确有点像XD，裘爷真是一个片子一个样，最后结局很感人，片名是取DNA四个碱基拼成的，也很用心~而且他家螺旋式楼梯也是暗示~神清气爽去睡觉。
117,千钧一发,5,相当励志的作品，讲述了在一个基因决定命运的未来社会里，主人公为了追求升空梦想而竭尽所能地掩盖自己的劣质基因。非常精彩加感动，也表达了对基因决定论的反驳和人性之美的讴歌。
118,千钧一发,5,“我就是统计学上那无关紧要的百分之一。”上世纪末本世纪初的科幻片看起来真是舒服。本片大片的暖黄色调，空旷的大厦，海浪拍打的声音，这样看来，“科幻是原子时代的诗”这句话一点也没错。结尾医生和文生那段短短的对话将整部片子拔高到一个极高的地步，着实画龙点睛。“我只是把身份借给你，你却和我分享了你的梦想”。Ps：伊桑霍克真是从年轻帅到老。
119,千钧一发,5,强力推荐。科幻版肖生科的救赎，但更有科技含量、更需要胆识和智慧。实现理想不向命运低头有很多种，这是最给力的一种。影片把基因歧视演绎得惟妙惟肖，主人公为了克服先天的不足，假他人基因最终实现梦想。生物伦理学不是影片讨论的内容。另外，女主角很眼熟竟然是《杀死比尔》和《低俗小说》的女主角
120,千钧一发,5,好片！！！不过结尾Jerome自焚的桥段让我觉得略显夸张，如果可以在发射场外目送vincente升空来结束我会更喜欢。看来我不适合文艺~~~
121,千钧一发,5,I never save anything for swimming back
122,千钧一发,5,挺精彩挺有深意，风格独特的励志科幻片。这是一个基因决定论下的等级世界，生命是梦想成功前的赌注。有时候成功之路需要一些特别手段和赌注，结局不能预料，但自己必须掌握自己的命运，拼就是有赢的机会，认命就永远无望。两个大帅哥和乌玛瑟曼都很养眼，裘德洛这次很沉稳，终于没有发挥他的泡妞天分~
123,千钧一发,5,天。Random发现的片子竟然震慑到手吃。只要还有梦想。当你为梦想与全世界为敌，却也拥有了全世界。对科学盲从，那还是科学吗。如果有一天，没人认得出你的相貌，你变成一串串数据和DNA链条。数学不好的我，宁愿选择这里，此刻，我还是所见的我，享有未知寿命的神秘感，以及哪怕天寒地冻路远马亡的梦想
124,千钧一发,5,看到裘德洛为了伊桑61霍克选择死亡的时候，果断再加一星，这才是真爱有木有。未来世界的现实反思，当全世界人类可以用基因来决定命运的时候，你会为了梦想坚持不懈吗？顶替身份的剧情构思有点《天才雷普利》
125,千钧一发,4,"着赤裸裸的不是爱是什么!!球你又演哀怨小受,看你心甘情愿的躺在床上,小鸟依人的被男主抱着,我就觉得接下来因该有戏.太让我失望啦!"
126,千钧一发,4,“我只是把身份借给了你，而你却让我分享了你的梦想”。温情、励志、动人心魄的软科幻，没有华丽炫目的精致特效，也没有激动人心的大场面，但就是细腻、平稳、直击心底。双男主相互映衬更是相得益彰，结尾双暴击，都以不同方式实现了自己心中的夙愿。“当你努力去实现梦想时，全世界都会为你让路”。
127,千钧一发,4,居家男友太可怜了不由觉得男主有一点点渣。
128,千钧一发,4,前瞻性地提出了“基因决定论”“基因歧视论”以及它们带来的后果，发人深省！
129,千钧一发,4,89 科幻文艺片，看看友邻们一大片的5星，我怀疑看的是不是一部电影....可能要挑个精神好一点的日子重看一遍。
130,千钧一发,5,"...when I eventually did stand up, I'd be exactly two inches closer to the stars...(...我K於站立起r,我又能接近@些星球整整2英寸...)"
131,千钧一发,4,结局会让人感到很温暖，但总觉得少了点什么。如果编剧将剧情引向反乌托邦的极致，我想电影应该会更完美。
132,千钧一发,5,"最让我感动的有三个地方：1.艾琳后于文森说出了那句“sorry the wind caught it” 2.杰罗姆对文森说“我只是把身份借给你，而你却让我分享了你的梦想” 3.登机前安检人员将“不合格”改为“合格”并叫他文森（貌似安检人员早就知道他是瑕疵人是不是啊？）
PS：乌美"
133,千钧一发,5,当年三个主演都好年轻啊！！！Ethan Hawke和Jude Law好有基情好有火花~
134,千钧一发,4,"2008年4月14日
like always, knowing each stroke to the horizon was one we'd have to make back to the shore.
One man's lost is another man's gain.
You almost sound as if you believe that."
135,千钧一发,5,很赞的故事，被社会排挤的边缘人赌上一切成为“基因窃贼”，只为完成自己的梦想，在实现梦想的途中，收获了支持自己的家人，也将梦想的光芒分享给了他们。只可惜导演技法有些平，很多地方处理得也有些淡，不够极致（如文森特和莫洛一线、与女主一线、弟弟角色也太平）不过，作为处女作已经很NB了。4.5
136,千钧一发,4,很有格调的科幻片，整体氛围透着冷酷和优雅，甚至有些1984的调调
137,千钧一发,5,"trying to be perfect all the time, but love the flaw in the end"
138,千钧一发,5,故事很平淡，但是讲故事的手法很好。乌玛瑟曼还真是希腊女神级别的女性
139,千钧一发,5,All of us should think about the problem of discrimination in any kind of ways seriously.
140,千钧一发,4,"伊桑要升空了，裘德洛最后对他说的那句话：“I just lent you my body, but you lent me your dream”"
141,千钧一发,5,@部片子在於人工Yx的生W和交由上帝的自然Q生的一般人，有著烈的Ρ燃澳^秀的c的|疑，不然不安排哥哥是自然人，而弟弟是生W的情r，物天竦那r，真的因人自以槭堑暮Yx而未淼娜硕际良的?@cа菀泊嬉砂桑 裘德・洛也是例^哪!
142,千钧一发,5,I never saved anything for the swim back……My dream，即使是坠入深渊，即使是与全世界为敌，我也不会放手~~嘻，千钧一发关键在那个“毛“呀……
143,千钧一发,4,"“I never saved anything for the swim back.”
“我从来没给自己留过后路。”文森特。"
144,千钧一发,4,“基因”这个核心词也可以填入“种族”、“血统”、“性别”、“肤色”。有人的地方就有歧视，就有反歧视
145,千钧一发,5,影片基本讲述了人定胜天的真理，文生因为基因不好而早早被社会淘汰，凭借坚韧不拔的意志到达人生的高峰。与之形成鲜明对比的杰隆和安东虽然基因优良，天赋过人。一个倒在了自视甚高的台阶上，一个屈服于社会。文生的成功比丑小鸭变白天鹅的故事还励志。谁能感受他的艰辛？
146,千钧一发,5,因槲也煌昝溃才是特的l。其光芒或S在佳片如潮的97年被掩w了，但放到任何r候砜矗都是一部^妙的大片+茏鳌Michael Nyman的配100分
147,千钧一发,4,大家都那么年轻；导演还是缺那么一丁点拍成经典的野心，不过已经足够好了
148,千钧一发,4,那张一再显示的valid证件照证明了：伊桑・霍克 + 裘德・洛 = 詹姆斯・弗兰科。
149,千钧一发,4,yr 1/thinking through writing/Ethan Hawke+Uma Thurman!!!!!!!!!
150,千钧一发,5,"I only lent you my body , you lent me your dream."
151,千钧一发,4,Jude Law 最适合的角色诶！优秀、冷傲、不合群、压抑着有热度的心，是可以和主角交相辉映的人物。而在冰冷的外壳包装下戏的核心是信仰的坚定燃烧起的热血，所有情绪推到最后一刻，燃了。
152,千钧一发,4,"Uma Thurman, Ethan Hawk, Jude Law 光这三只也够养眼了"
153,千钧一发,4,内涵很深，但是毕竟是10多年前的片了，拍的一般，情节走的也太慢，怪导演太文艺了，不过还是值得一看。
154,千钧一发,5,"剔除科幻的本质，本片主要讨论的是少数群体为了成为精英所需要的付出、牺牲，以及承受的歧视和打击。
单纯的甄选基因，其实是在彻底的物化人类，是对人类精神、生命、文明、自由、心灵、灵魂的全面否定！"
155,千钧一发,5,实在有太多理由要给五分了  有我喜欢的两大帅哥  有很好的创意，虽然弟弟那里感觉稍显刻意，但是整体还是相当好看滴，看了这个片子你会发现，虽然科技进步了但是我们的想象力退步了。
156,千钧一发,4,神级译名太到位。安德鲁.尼科尔的科幻片都包含特定背景，阶层分隔，对立阶层角色的身份交换。这20年前的科幻寓言，随着如今基因技术突飞猛进，人们都忍受不了残缺，都想做到最好，就有了比较和极端追求，看似不可能的病态社会已越发接近，还好影片留下足够多的希望，完美基因并非不可战胜。9/10
157,千钧一发,4,作为一部具有相当反乌托邦气息的科幻片，在绝望的基调和悬疑的铺设上做的相当成功，配乐和化妆也有亮点。唯一的硬伤是此片的年代已近21世纪，而编剧可以预计到基因技术的飞跃而看不到网络技术的革新，让片子中最不可能的互换身份成立了。这就像回到未来里偷放射性燃料的情节一样，说的容易，谁偷的到？
158,千钧一发,5,拍得很好的科幻片，发人深思。基因决定论一旦实施，人类的精神世界就显得毫无意义，科学在进步，精神文明在倒退。
159,千钧一发,4,一种强烈的天才雷普利既视感。主题真的可棒，正是那些无法计算无法测量的东西makes us human.但是这么腐真的可以吗，什么醉酒后扶上床的设定真是无法直视啊亲。导演的水准怎么起伏这么大啊。（要脸盲到什么程度才能把裘德洛和伊桑霍克认成一个人啊啊啊）CCAV你剪得太明显了喂。
160,千钧一发,5,还好如今的现实社会除了相貌，家庭背景，其他人都基本站在同一起跑线，这样对于公平的实现还有希望。
161,千钧一发,5,①没有大场面，只凭借平缓的剧情和对白推动故事发生，况且故事讲得还很好②布景点赞。③主演们的颜值真高，而伊桑霍克和乌玛瑟曼背后的爱情故事也值得关注一下。④“变种异煞”这破名字是谁翻译的。
162,千钧一发,5,很久才能看到一部这样的5星电影，好看又有反思作用。基因技术只要运用的那一天，肯定是会引起新的歧视。一个理智的电影，导演却埋下了很多悬疑的地方，开头介绍自己换过基因，紧接着自己有一个好弟弟，游泳说最后一次跟弟弟比赛，以为会弄死弟弟结果没有，女主检查男主基因旁边窗口的吻，后面两人也有接吻，处处悬疑紧张，替主角捏了一把汗。
163,千钧一发,5,我也不知道为什么就是觉得很好看……虽然看译名觉得像是三流科幻片。Jude Law在这片儿中真年轻帅气！演技也真心好。可惜现在秃顶了。
164,千钧一发,4,为什么我们恐惧科技？因为它太强大 以至于在它的信手拈来面前我们人类千万年来的关于善良 勤劳 勇敢 不懈的无数美德都将变得微不足道！
165,千钧一发,5,蛮感人得，有点人残志坚的感觉！by  the  way，看到床戏的时候才发现小时候在明珠台看过！
166,千钧一发,5,"基因可以先天被选择 但是灵魂的完善和强大需要后天的坚持

Vincent: i never saved anything for the swim back.
要成功, 就不要自持强大, 或畏首畏尾."
167,千钧一发,4,实在看不出来是97年的片子，看来太超前的东西总是不容易被当时接受。
168,千钧一发,4,全片都在表现科技的力量，却处处在反科技，表面上是励志，实质却是反乌托邦。
169,千钧一发,4,感动，人这一生的作为岂能是单单基因能够控制的，凡是有所大成就之人往往又是有缺陷之人，当一出生就把人三六九等之分又是何等的残酷没有人性。
170,千钧一发,4,现实中的我茫然，永远犹豫不决，于是我是如此的羡慕这种人，坚定，目标明确，永远不为回程留力，这样的人即使不是最完美的，却一定是离对岸最近的。
171,千钧一发,4,关于追梦 关于作弊 导演是个牛笔的人啊 导过战争之王 编剧楚门的世界，幸福终点站
172,千钧一发,4,"You wanna know how I did it?This is how I did it,Anton.I never saved anything for the swim back."
173,千钧一发,4,"突然就感动我了,这是今天的佳片有约,一如既往的不待见中文译名变种异煞,听起来像是个怪物的故事,不是超级英雄就是异形。但事实上他是个普通法人,坚强的普通人。最后jeremy的死有些可惜却也是最棒的设计,这是部出色的影片,但是比起深刻我更喜欢温馨所以4星。"
174,千钧一发,4,Ethan Hawke和Uma Thurman在这部片子里很般配的～还可以看到Jude Law大红之前更本色的表演，不像现在这么奶油。
175,千钧一发,4,“生而平等”从来都是弱者争取权利的工具，从未有一天实现过，不平等才是世界的真相，优生学发展到人类可以通过基因决定下一代的体能和智力，这才是真的可以把不平等代代相传，人从降生之日就决定一生升沉荣辱，基因优秀的人永远富贵，卑贱者代代卑贱，命运对后者来说更为残酷，永无出头之日。Jude Law
176,千钧一发,4,"此片对于基因至上的人类生活诠释得相当完整，我看此片时从头纠结到尾，一个不畏先天缺陷（现在的正常人）拼搏实现自己的梦想，一个是先天优秀却没有实现理想的人，对于他们之间的差别不在于身体上的，而在于意志上的区别。
片中女主那句：被风吹掉了，对我来说蛮感人的。"
177,千钧一发,4,"不管科技如何发展进步，人类对于自身命运的抗争永远没有尽头，梦想，只有梦想才是人类前进的唯一选择。ps：I only lent you my body, you lent me your dream."
178,千钧一发,5,用空旷来展现科技的幽闭恐惧，还有在特殊环境中被放大的励志精神。这个本子竟然是原创的。
179,千钧一发,4,you lent me your dream
180,千钧一发,4," EthanHawke 一开始极度讨厌他，后来有改观，现在觉得他是萎缩魅力男！
 没人会想到这样一部感觉冰冷的电影是讲梦想的......"
181,千钧一发,4,一直在努力，从不曾放弃，裘德洛真是适合演这种痞痞的角色，乌玛瑟曼什么都很好，除了太大只
182,千钧一发,4,24k纯硬核科幻，几乎全篇贯彻下来都是在疏导概念，与看之前想象中的《少数派报告》类的样子简直大相径庭！看到中段容易疲惫，幸好有年轻时 Ethan Hawke 雕刻般的面孔强行拉回到故事里。唔！赏心悦目！
183,千钧一发,5,这部科幻片内涵又养眼，值得推荐。还知道了，原来伊桑霍克就是死亡诗社里的那个好学生，原来伊桑霍克是乌玛瑟曼的前夫呀，乌玛瑟曼真的是漂亮。
184,千钧一发,4,The God child beats up the scientific one.(20101016)
185,千钧一发,4,在一个凭基因决定优劣的社会中，一个有梦想的劣等人唯一能做的就是运用智慧，偶认为这是励志片。PS：jude law同学拖着两条残腿爬两层楼实属不易
186,千钧一发,5,我只是把身体借给你，你却让我分享了你的梦想。带着导师、爱人、兄弟、朋友的梦想，飞向土星吧。
187,千钧一发,4,从神学角度，我相信基因决定论。
188,千钧一发,5,非常优秀的科幻电影！小时侯看过一次，丝毫没有察觉这居然是97年的作品 !今天重温依旧无法看出，当时囫囵吞枣也没法理解其中深意，如今看过后不禁唏嘘感叹！影片各个方面都堪称精品！导演对节奏拿捏得非常精准，看似平淡的叙事，表面下却暗流涌动！好剧本、好配乐、好演员、好导演，成就一部好电影
189,千钧一发,4,很不错的一部影片，属励志范围，我都难以想象男主角是怎么熬过来的。伊桑和乌玛走到了一起。
190,千钧一发,4,看了这片子我才发现原来judelaw还有演技，最后他爬进焚化炉的时候，角色升华了
191,千钧一发,4,中国突然有基因编辑婴儿出生了，不经想起了这部电影。只有基因工程加工过的才是正常人，自然分娩的反而是病人。原来科幻电影会变成现实……
192,千钧一发,4,场景的粗陋并不能掩盖其作为一部主题深刻的科幻片的炫目光芒。正是种种的不完美才成全了这个世界的完美。正是种种的偶然和意外才令这个世界变得有趣有活力。冰冷的科技不会拥有拯救一切的力量。
193,千钧一发,4,每个人都有梦想，而且那些梦想看起来是那么的不切实际，但有多少人会像文森特那样为梦想不顾一切，只要你有未达目的誓不罢休的精神，相信一切皆有可能。
194,千钧一发,5,powerful，实在想不到这是16年前的片子。这是用生命在圆梦，理想这个东西太崇高。“从来不为返程留余力。”
195,千钧一发,5,有关天赋、梦想与努力的主题，在这部片子里被更残酷但更淋漓尽致地表现出来。不可否认，人自身的意志品质和人之间的美好感情可以使人超越基因设定的极限。然而将来，随着高科技被无耻地利用，片中的故事很可能发生。人类不能用科技的蓬勃发展所带来的繁荣来掩盖人类良知与道德的沦丧。看过的最好的科幻
196,千钧一发,4,又是以科幻的幌子批判人类的丑陋…但效果如同月球般出奇的好…
197,千钧一发,4,无处不在的反讽非常够味 时不时的点题稍显得做作 暗藏的煽情段落让人身心澎湃。。
198,千钧一发,5,为神马豆瓣不能给半星馁  我想给四星半 那半星加到帅哥身上好了==
199,千钧一发,4,当世界都是黑色的时候，白色就显得如此的刺眼，为了活下去，你不得不将自己染黑。
200,千钧一发,3,UMA太漂亮了
201,千钧一发,3,哥俩好呀 都是爱呀都是爱o(s□t)o 冷，慢，无码是亮点。
202,千钧一发,3,"Uma Thurman在里面有点认不出来~Jude Law啊！Jerome: I got the better end of the deal. I only lent you my body - you lent me your dream. 
"
203,千钧一发,3,豆瓣这么高的分，你就知道它肯定有热血和鸡汤的意思了。前半段老实尴尬，这哪是太空公司不如叫脸盲公司好了，就这么容易混进去？其实在剧本架构上是十足的套路活，好在在类型上做出了混搭的新意，节奏铺垫之下，煽情点的安排也比较合理，这种，才叫做合格的工业化电影。
204,千钧一发,3,【B】本来以为会是个硬科幻故事，原来只是套弄个科幻背景的普通悬疑剧情片……另外有裘德洛的片子果然都会很基
205,千钧一发,3,幸好它不是一部科幻片，但它却成了一部励志片。“梦想”这词儿真是让人心醉神迷，又心驰神往。难怪男主角最后说出如此美丽的一句：They say every atom in our bodies was once part of a star. Maybe I'm not leaving... maybe I'm going home.
206,千钧一发,3,太过想讲一个寓言，以至于不能讲好一个故事。细节破绽百出，转折廉价不合情理，这些都可以为了政治正确而牺牲。这类反乌托邦叙事看多了也有几分审美疲劳，感觉像那种劝善惩恶的古典小说，重在说教多过讲故事本身。
207,千钧一发,3,冗长，导演金手指用得太夸张了
208,千钧一发,3,「我只是把身份借给了你，你却让我分享了你的梦想」，好一碗鸡血浓汤。很励志是吗？醒醒吧各位，精英主义和基因论不是这么颠覆的。先天和后天都有上下限，关键要探讨的人择与天择在实际操作中的孰优孰劣的问题却被刻意忽略了。节奏叙事什么的就更不用说了，冗长得一塌糊涂。
209,千钧一发,3,除了概念，哪儿出众了？给这个片子五星的人是不是给《V字仇杀队》也五星啊？
210,千钧一发,3,只有在这片子里还能觉得这两个帅哥美女有点般配。题材不错，励志是好事，生硬不是好事。幸好没拍成烂俗动作片。
211,千钧一发,3,1.“我只是把身份借给了你，你却让我分享了你的梦想”…出生决定一切并非乌托邦，而是基本现实。不懈努力的人至少比放弃自己的人还要来得有机会，只是并不是每个人都能幸运获得机会而已。2.“我从不为回程保留体力”
212,千钧一发,3,"I only lent you my body, you lent me your dream."
213,千钧一发,3,idea很有创意，但是整部影片太简单冗长，注水不少，想拍出《人工智能》的味道，可惜故事内核不够深刻，只是告诉观众“基因决定不了命运”这个道理，有一定的励志感。几位主演演得中规中矩。
214,千钧一发,3,"阴错阳差，本来是要找有johnny depp的电影的。不过此片也不错，结尾有些遗憾。
“我只是把身体给了你，你却让我分享了你的梦想”。"
215,千钧一发,3,ftp://dy44:piaohua@dy44.piaohua.com:2508/飘花电影piaohua.com特卡BD中英双字1280高清.rmvb  
216,千钧一发,3,外教课，现在想想也算不错的科幻了，当时对外教课的老师无好感，导致对这部电影同样无好感。
217,千钧一发,3,前头不错……但是虎头蛇尾……那个，结尾未免太顺利了，而且JUDE LAW同学干吗自杀= =
218,千钧一发,3,剧情想法很不错，但这个冷冰冰的基调不太喜欢。judelaw老是扮演这种生世显赫却又悲剧的身份~lol~
