,movie,star,comment
219,千钧一发,3,明明是一部关于太空梦的文艺科幻片，不知道被谁翻译了“变种异煞”这么惊悚的片名啊！还不错。15年前的乌玛瑟曼很美
220,千钧一发,3,"事情是这样的:托尼・谢尔博为裘德洛和伊桑拉了个皮条,前者对后者心生真爱,但直男伊桑选择了乌玛瑟曼,于是傲骄受心灰意冷地自焚了. 难忘初现时裘德洛的媚视烟行~~~好忧桑好米粒"
221,千钧一发,3,除了乌玛瑟曼真的就没有什么吸引我了，可能真的不大适合这样的电影。。。顺便吐槽一下翻译，这不是坑爹吗。
222,千钧一发,3,"1.译名很烂；
2.剧情压抑，节奏缓慢；
3.貌似励志，不断与理论上比自己强的人竞争；
4.结局郁闷，两主角都死了；
5.仅仅因为一个人有近视和先天性心脏病，寿命只有30年，就要受到这样的歧视，不断地接受各种各样的基因检查，这些不可信的假设是我不太喜欢本片的根本原因。"
223,千钧一发,3,从视觉效果和编剧立意来看，本片是一部非常出色并且创意新颖的作品，男主作为乌托邦社会中受歧视的那一环通过与男二的身份互换最终达成梦想，也体现出励志与科幻相结合的因素，但基因的作用在被无限夸大的同时，视觉感官的作用被弃用了，显得过渡有一些不自然，有一种强行续命的感觉。
224,千钧一发,3,看到最后觉得这片儿应该叫《我们的归宿是群星大海》，只想把翻译成《变种异煞》的那个人掐死。。。这要是个文儿绝对属于软科幻一类，主要还是探讨科技对人类传统道德的挑战
225,千钧一发,3,这部戏的表演有点怪怪的，可是演员又是顶尖的，看来是导演驾驭不住演员啊。。。前20分钟旁白太多，可以再紧凑点
226,千钧一发,3,赫胥黎《美丽新世界》一直没看完，这电影就基于此，基因决定三六九等，片中两个人互为影武者弥补缺点完成双方的梦想，典型的美式电影。分两次看完中间间隔一个月，有点无感，评分高的吓人。90年代末的伊桑霍克真嫩。
227,千钧一发,3,完全无感，就觉得基因决定论这个创意不错，裘德洛演什么都像同性恋。
228,千钧一发,3,"cctv6变种异煞--
不是惊悚片！是励志片！想起了布拉德皮特的返老还童。片名翻译真太……！"
229,千钧一发,3,反乌托邦框架搭起来了，科幻元素点缀得也不错，尤其在某朝刚出了首个基因编辑婴儿的当下，突然想起来看这片子还真是意外应景――结果，100分钟下来，导演就讲了这么个勇敢追梦的鸡汤故事？这还是豆瓣TOP250？！原谅我真喝不下这么平庸的鸡汤，以及，作为副线的谋杀案处理真是太太太太太草率了啊！！！
230,千钧一发,3,大概是边织围脖边看片的缘故 为嘛我就没看出这片有多经典多经典呢
231,千钧一发,3,乌玛瑟曼！好久没看过她演的电影了。能找到这一部实属巧合。现在的计划生育如果再发展个几十年，不也就是电影中所描绘的那样么？唯基因论。由基因判定一个人的好坏。在孩子未出生之前就把基因搭配好，所以生出来的都是完人。好可怕的未来。
232,千钧一发,3,我小时候看过！这估计是我第一次看裘德洛的片子吧。。。但是当时只觉得觉得色调阴冷情节无趣。。。。。完全没觉得Jude Law 怎么样
233,千钧一发,3,裘德洛可真要帅呆了，故事本身很科幻，但总觉得是个不温不火的励志片。其中人从一生下来就可以预测死亡时间可真够眩的，未来世界是这样吗？？
234,千钧一发,3,节制的安稳的程式化中的悬念营造  此外变种异煞这个名字你玩蛋去！
235,千钧一发,3,在科幻的外壳里面是个引人深思的励志故事，不过评价不至于这么高吧，年轻的伊桑.霍克太像付兰兰了！
236,千钧一发,3,感觉它不傻，因为：1，没搞家庭主题；2，对人类就科技的规划有批判性；3，阈于当时的电影技术，已经在成本内尽量考虑未来学。
237,千钧一发,3,探讨先天不足（伊桑霍克）和后天残疾（裘德洛）应该如何面对生命，给了个令人无语的答卷――前者可以飞天，后者可以去死。“你借给我你的梦想”，结果裘德洛还是无法获得救赎，难道这梦想是有借有还吗。这个结局要说是“励志”的话，那真是把残疾人不当人了。
238,千钧一发,3,披着科幻皮的励志片，依旧是主人公不服输于是全世界都为之动容的老套剧情，表面是科幻其实也没多少科幻实质，就是个身残志坚的故事，太装逼了只能给你三星。
239,千钧一发,3,以为要以和梦想失之交臂来结尾呢，没想象中要好……
240,千钧一发,3,变种异煞 这名字起的太唬人了，其实完全没有这么科幻 焦点落在了人性 先天缺陷就一定是失败吗？毕竟是十多年前的了  有些理想主义
241,千钧一发,3,还是差一点儿，无论是原子星球论还是同一个身份，同一梦想 …… 不屈的煽情我竟然感同身受
242,千钧一发,3,很奇怪他家为什么不安电梯，整部电影没有一个坏蛋，说科幻片不太准确，更像励志片，带点儿基情
243,千钧一发,3,坐不住看@片 是好片 ”竞迷偌hurts 主人公榱粝敫命\反抗 也有科技θ诵缘目 只是我那晚太d^看不M...
244,千钧一发,3,法西斯。专制。真他妈可怕。内警察简直就是盖世太保阿。。。还有E.Hawke能不能不拍这样的片儿了？。。。
245,千钧一发,3,前面都很好，结局不太爽。。。不是应该文森虽然被发现，但还是证明了自己，然后改变基因歧视吗？！裘德洛干吗要自杀？！
246,千钧一发,3,和人种论一样，肤色歧视，地域歧视到基因歧视，人们为了追求完美，到了零容错的程度，所有的都要完美无缺，包括人自己，可是人类的进步是在不断的试错中得来的经验，是不可抹杀的。片子调情太多。
247,千钧一发,3,a.其实逻辑漏洞特别多。世界观设定也不完整。 b.所有人的颜（0404） c.升空是go home TT_TT d.裘裘啊。一辈子演的都是天之骄子。sigh
248,千钧一发,3,宇航总部是Marin县civic center! 昨天刚看过，今天就又去了一趟
249,千钧一发,3,我命由我不由天。11566螺旋状楼梯连接着住宅上下，杰罗姆自从残疾，便居住在下层；21566验尿即面试。门槛只有一道，但很高；31566验尸取证却错过被害者右眼的口水6841566文森特留下用过的纸杯68 6851566艾琳：“心力衰竭的可能性不予接受”却能进入公司、参加训练，具体的身体素质则形象地体现在摆脱追捕时的表现；61566十二指琴师证明文森特不是孤军奋战，而且那首乐曲专供十二指；71566刻意躲避唾液采集却不惹艾琳怀疑686881566细节：安东业余时间在训练游泳；91566文森特左腿有疤能上天？91在不远的未来，可供警方调查的个人资料几乎只有照片6868 
250,千钧一发,3,"Quite disappointed. It had a good potential, but a lot of shorcomings ruined it. The actors playing corresponds with the ""i'm badass even if it's ridiculous"" clichey clic, the music is tasteless, and the ""If i want I can"" ideology is ridiculous. It's food for thought though."
251,千钧一发,3,注：他们三个竟然能演一出励志剧，惊奇……另：这部片子很有意思，正同德说，是后天努力克服先天不足，实际点说，要想成功，大路不通要学会走小路。
252,千钧一发,3,细节设定不行，费了这么大力说了个人人都懂的道理
253,千钧一发,3,为什么分这么高……不符合期待的一部片子。披着科幻外衣的杰克苏+玛丽苏。伊桑霍克和男配的演技满分，画面和配乐满分。但情节走向不合逻辑，没办法给观众真实感。是一个个情节推动着主角在走。所以除了鸡汤励志外很难感受到命运的复杂之处，电影的深意也不足展现。
254,千钧一发,3,学会一个道理，不要以先天因素判断人的优劣，不要因为自己的缺陷而轻言放弃
255,千钧一发,3,在人类已经能登上土星的年代，宇航中心还在用笨重的球面显示器，屏幕还是粗糙的8位色彩，宇航员居然穿着老土的双排扣西装直接进火箭升空……这都是因为这是一部97年的老片。那时的电脑特技只能做到这些。
256,千钧一发,3,是不是就我觉得很压抑...
257,千钧一发,3,算是一部励志片吧，在分级的社会，缺陷人依然怀揣梦想进入精英阵营。这部片子主要是从人文角度演绎，但在大部分科幻片中，男主角这样的人会成为反抗军或救世军的领袖，跟身为精英的女主角谈个恋爱，顺便把精英们苦心经营的社会体系摧毁。这片子没那么大的野心，从小处着手，留出一些空间。
258,千钧一发,3,内容深刻情节单薄，正常基因的人和优化基因的人在社会中的存在价值被极其戏剧性的极端化了，然后用一个很简单的故事去尝试说明一个比较复杂的社会、科学设想，剧本还是有欠斟酌。
259,千钧一发,3,赤裸裸的歧影。什N是瑕疵人？前段rg看^一豆瓣V播，f又F又h的人看再多影x再多的也不有快罚凡是不同意的人就都是又F又h又o法快返娜恕Ｎ矣X得f@N的|西狗А
260,千钧一发,3,对基因工程还是了解不够，那个年代还不知道甲基的后天因素，所以在一出生就定一生是不科学的。假设经过这么多年的努力，心脏完全得以重新构建，那么，此时再检测他的基因，结论也会与开始不一样。如果主角的甲基修饰没有改变他的基因，那么，99%的概率他会死在泰坦，谁来为此负责？
261,千钧一发,3,不是一般讨厌伊桑霍克的嘴脸……
262,千钧一发,3,主题不错另人深思？可又怎奈故事剧情上的平庸，有种想发却发不出力的感觉，不够深刻。PS：明明主角们的颜都相当不错，却搞了一张这么丑的海报
263,千钧一发,3,"""I never saved anything for the swim back."""
264,千钧一发,3,发达的电影工业，止步不前的拍摄技巧
265,千钧一发,3,补标 为什么总有这种不知看过多少遍的片子没有标 总感觉是被删评了回档了
266,千钧一发,3,配色诡异，张力都在身份是否会被揭穿上，副线的爱情、友情、亲情都比较弱
267,千钧一发,3,成就我们的不是基因，而是梦想
268,千钧一发,3,基因&命运VS无力感&抗争 Remarkable：双手十二指弹舒伯特钢琴曲D899 No.3.
269,千钧一发,3,还以为会有外星人，满心期待熬到字幕徐徐升起才明白被耍了。
270,千钧一发,3,未来的人类活得好累，什么都要看基因
271,千钧一发,3,终于找到了，高二时候英文课学习材料，反复看，看到吐血，研究每一句台词，场景。而最近编辑基因的新闻终于让这部科幻片成真了。
272,千钧一发,3,挺有想象力的科幻电影，没有用画面来借力，娓娓道来的道理论证，希区柯克式的侦探进程，最少能唤起思考，而不是盲目追画面和帅哥美女，而且这译名真是不错，实在妥当。
273,千钧一发,3,故事比想象的简单更文青更多情感。爱情，理解，羡慕等等。科幻为励志服务。judelaw美瞎我了，他最深情的演出之一。节奏比较作者派。
274,千钧一发,3,编剧好，设定好，摄影好，导演差（摄影机运动和场面调度不好），剪辑差（节奏不好，转场全用隐黑）
275,千钧一发,3,"基因决定人的一生么~？
"
276,千钧一发,3,哥哥是陶瓷娃娃，被认为身体不堪一击，却最后成了宇航员，弟弟是完美基因塑造出的人，最后也不过一个普通的警察。命运是什么，捉弄人的？自己掌控的？
277,千钧一发,3,完全是被海报和译名给骗了！科技感展现得不足，剧情过于平淡，不知道谁翻译的这么扯的译名。不过梦想的力量真伟大，能改变既定的一生，也能影响他人的一生。看到这么嫩的裘德・洛不得不感叹一句，年轻真好！
278,千钧一发,3,"Maybe I'm not leaving, maybe I'm going home."
279,千钧一发,3,人类真的会在某一天走向“反基因歧视”的未来吗？
280,千钧一发,3,特别尴尬，作为一部文艺片，没有形成自己独特的美学风格和艺术逻辑，作为一部商业片，剧情拖沓，节奏缓慢，浪费了一个好创意
281,千钧一发,3,"""我从不为游回去保存体力。""就这一句台词还不错。其它没有喜欢的地方。没感觉出励志来。"
282,千钧一发,3,97年的，是不是有代沟啊，表现方式有点理解无能啊。。　　2011.12.19
283,千钧一发,3,"if it not for Jude Law, i wouldn't have remembered this movie that much."
284,千钧一发,3,开篇引用的圣经准确概括了本篇主旨：“你应当思想上帝的作为，因为上帝弄弯的，谁能使它变直呢？”（传道书 7:13）【#只有神知道的言叶#
285,千钧一发,3,再一次证明人的想象力不可阻挡
286,千钧一发,3,以为是部科幻片，结果是部伦理片，“我只是把身体给了你，你却让我分享了你的梦想”
287,千钧一发,3,我们身体中的每个原子都曾经是宇宙中某颗星星的一部分...
288,千钧一发,3,17 岁的时候看的，没看懂。可以再看一边
289,千钧一发,3,故事一般。讲了两个概念，一个是基因决定论，一个是自我奋斗。一个勉强的三分电影而已，虽然有大牌也还是三星电影而已
290,千钧一发,3,竟然没有被励志到，是不是没救了@.@男主这身体状况硬要上太空真的大丈夫？？？我始终坚信天赋和努力缺一不可！！ps两个男主都好腻害，你们不基不可能！！
291,千钧一发,3,当伊森遇上裘大秃，基因不良的基佬征服地球踏上宇宙的征程。
292,千钧一发,3,挺反感用大框架来阐释主题的片子，同一导演的《楚门的世界》同样是细节粗糙，不过整个故事的切入点实在难得，也算是向「木兰从军」致敬了…
293,千钧一发,3,不明白这个片子为什么这么火，我怎么就觉得是so so呢？
294,千钧一发,3,无字幕+中文配音影响了我的判断！！！按理应该更好才对啊....
295,千钧一发,3,看这种缓慢的硬科幻就是让人想抓狂
296,千钧一发,3,超多明星可惜剧情有点
297,千钧一发,3,励志得相当内敛阴冷低调
298,千钧一发,3,我觉得这部科幻电影没什么意思！一点也不精彩~~~比较有看点的地方就是乌玛和伊桑两人的“定情电影”！
299,千钧一发,3,也算是明星阵容了。标签竟然有惊悚？跟惊悚有个鸡毛关系
300,千钧一发,3,disappointed
301,千钧一发,3,一部大M周章的钪酒=一根睫毛引l的血案+太空特版阿甘正鳌…
302,千钧一发,3,智商与身体都可以突破极限，基因左右不了灵魂
303,千钧一发,3,硬科幻却讲了相当老套的道理，努力比天赋更重要。然而，有天赋不努力可以成功，很努力没有天赋注定失败。努力就会有好结果，不过是用来安慰才智平凡者的麻醉剂罢了。
304,千钧一发,3,幼稚的故事设定“阶级永不会消失但信念改变一切”的老调子 音乐风格非常银翼杀手 年轻时的ethan简直就是一张小痞子的脸...如果没有uma完全看不下去 uma太美了
305,千钧一发,3,为什么不能把歧视从基因里去除呢，哈哈不可能吧。最后医生那里很感人。被男2火烧自己震撼到了。
306,千钧一发,3,腐片儿，哇啦啦，两个大帅哥，乌玛姐姐就是花瓶。
307,千钧一发,3,基因歧视，未来词汇，没有强大的科幻场景，却有科幻氛围！不过两个人长得不一样也可以互换角色这么顺畅，觉得里面的人都瞎了！
308,千钧一发,3,感觉哪里不太好。思路还没理清，再说吧
309,千钧一发,3,典型90年代科幻片的色彩
310,千钧一发,3,"已看。
幻想是很美好的，现实是很丑恶的。未来是不需要优秀基因人种的，那样成本太高，还不如造机器人算了。"
311,千钧一发,3,这是励志片吧...很沉稳冷感的调子更接近心中对科幻的设定
312,千钧一发,3,很规矩的一个故事，不理解为什么打分这么高。
313,千钧一发,3,竟然没标，故事好90年代啊，胜在卡司吸引，现在的好莱坞应该不会这样拍
314,千钧一发,3,帅哥加美女，剧情基本靠“巧合”推进！
315,千钧一发,3,哎 真是苦了出来猛打酱油的忠心不二的裘德洛和看似有故事实则没故事的乌玛以及以游泳溺水退场的底迪，伊桑啊伊桑你也曾是个小年轻，可曾想到今天老的满脸褶子，真是励志大片有没有
316,千钧一发,3,“基因歧视”…触动全部在最后五分钟，因为自己的儿子也有缺陷、一直在替 Vincent 掩盖的体检医生，以及自杀的 Jerome，大约是觉得存在于世上最后的意义也随着 Vincent 去了太空而消失了吧。
317,千钧一发,3,导演是想说理想大于生命么
318,千钧一发,3,怎么那么像《远大前程》，配乐也向；裘德・洛怎么老被人模仿；中文配音太不给力
319,千钧一发,3,没觉得哪里特别shock啊，只是个基友片啊。。
320,千钧一发,3,中规中矩科幻片，八点五的分数是腐女打出来的吧，汗！
321,千钧一发,3,“从此，我不再是我，你不再是你。”故事讲得很好，可是我不喜欢科幻题材。好基友的故事，恩 。
322,千钧一发,3,那年头他们真年轻...其实是个特别好的创意点，但是反思和探讨的不够深，差那么一哆嗦...
323,千钧一发,4,可以说导演很牛，因为总感觉有很多漏洞，但是导演都非常巧妙的设计的似乎很合理，我一直以为千钧一发是我小时候在电影院开场前看到的一点点片尾，今天看完以后才知道不是，电影把基因的问题拍出了人性的高度，好像太多的电影都是离不开这个话题，就是人性人性人性，可是这些不好的人心也是人类的一部分，这也是基因的一部分，优胜劣汰，你说他是不好吗？在平等面前，自由选择就一定对吗？我也不知道！只是看的时候会被带入那种情绪里！
324,千钧一发,3,乌玛瑟曼好看。裘德洛难看。科幻片就是无聊，狗P励志剧。
325,千钧一发,3,开局那些麻木的表情僵硬的动作就表明是反乌托邦了……影调非常压抑以及不舒服……节奏稍慢了些……本来以为凶手是女主角的……最后自焚那段不错……特别是火光中的银牌闪耀着金色的光芒……但也太惨烈了吧……其实用夕阳照一下就好了啊……
326,千钧一发,3,3.5 节奏有问题，一直被叙事推着走，所以看着累，所以感觉冗长和不够深刻，所以在几个段落里一旦选择了惊险或是励志，科幻就显得无关紧要，甚至消失了。
327,千钧一发,3,“你想知道我是怎么做到的么 我就是拼了老命也决不放弃！” 真让人动容 这是怎样的一种精神啊 即便你能创造出完美的基因 你也无法赋予一个人完美的人格 天生拥有种种缺陷的他完成了升空的梦想 无论在智能还是先天身体条件上都处于绝对优势的他却在自我否定中结束了生命 完美的不完美
328,千钧一发,3,很压抑的片子，好歹最后释放了一点，随后又是心痛
329,千钧一发,3,用科学代替自然决定命运，扼杀梦想。平淡的叙事，暗流涌动。女主角告诉文森特：你是神的孩子。好励志！自然人利用科学的骗局代替了人造人，反抗既定的社会规则。伊桑・霍克很俊~
330,千钧一发,3,不知为何这部电影会被挂以科幻之名 这倒是部有剧情的励志片 再想深一层 科学进步有时还真可怕
331,千钧一发,3,两个破碎的人拼造出一双翅膀 当社会秩序退居到人为控制自然选择的时代 唯有情感和理性具有能够战胜一切的能力 需要被歌颂 值得被托付
332,千钧一发,3,裘德洛出场帅爆了有木有！！这么个帅哥你让人家演个残疾人=  =  伊桑霍克长得也不差啊，看着哪儿像基因缺陷的人？？？结局有点可惜，能长命百岁的人自杀了，活不过30岁的人却上天了，哎，天意弄人
333,千钧一发,3,很冷峻的电影，更多的是科幻外衣探讨理想的意义。到结尾终于有一丝暖意，但裘德洛又他妈死了是作甚！！整个人又不好了！
334,千钧一发,3,在科幻的背景下讲了一个再普通平常不过的故事，几乎无看点。评分怎么就这么高呢。
335,千钧一发,3,伊桑霍克把烟吐进杯子里，和马修抽皮带的性感程度相当。
336,千钧一发,3,一开始以为是科幻片，后来发现是讲梦想的励志片，没想到最后拍着拍着变成了悬疑片。电影最后 裘德洛送了男主角一撮头发，评论里有人问是什么意思。看到一个神回复：「呼应片名，欠君一发。」哈哈哈哈哈哈。
337,千钧一发,3,也许电影不错，但我还是得说内容是二流的。
338,千钧一发,3,整个世界都会为那些有梦想的人让步。只是这种紧绷绷的科幻，还是有点接受不了。
339,千钧一发,3,题材不错，其实可以拍得更好。
340,千钧一发,3,2018年11月26日，基因技术史和人类史的十字路口。好的地方和坏的地方都很明显，好就好在紧张感营造特别强，美术设计也不错，但这种过分的精致也烘托了那种草木皆兵的紧张。而剧情上的确漏洞百出，从兄弟相认开始就完全崩了（其实闪回就是露怯）。爱情线太糟糕。
341,千钧一发,4,【人类的历史就是一部歧视史：财富、地位、年龄、性向、肤色；基因决定人生、不过是把这种歧视从人的出生开始以科学的形式固定下来；电影想讲述的是：我也许没有伟大的基因、但我有一颗造梦的心―我就是那个统计学上渺小到不计、但没人可以抹去的1%】变种异煞！千钧一发！我是从头到尾带着一颗惊悚的心看完了一部科幻励志电影！
342,千钧一发,3,科幻片不在于对高科技的展现（况且这个里面也确实没啥高科技，反倒是全片一直在验血。。。），反倒是突破现有观念，去展现新秩序下的伦理观（比如《月球》），还有诸如此类在视野上的突破，总是能给人更大的震撼。
343,千钧一发,3,两人长得太不像了
344,千钧一发,3,从小处着手的科幻电影，其实最后还是讲一个博弈的东西在里面，以及自我挑战等等等等......
345,千钧一发,3,"If you are still intrested, let me know.
Oh, sorry, the wind got it."
346,千钧一发,3,非常励志，但立意比较平庸，下午看的理发师的情人配乐也是michael nyman，非常煽情
347,千钧一发,3,看的是国语配音版。基因决定论，科技歧视，所描绘的世界对人的基因出身十分残酷。真身的上楼梯挺出彩，和自杀及其方式有点意外，其他情节的一般
348,千钧一发,3,在6套看了前3/4，过了几周在hbo又补上了后面一点儿。要是2个演员长得完全一样就好了。
349,千钧一发,3,ethan 小伙儿真帅！
350,千钧一发,3,其实拍得挺好的，就是对乌玛的戏份期待太多，结果发现还是略显平淡了些
351,千钧一发,3,最励志的科幻片，“灵魂无基因”。
352,千钧一发,3,三人年轻人哪，年少时的容颜一去不回，看这片前怎么也不会把二人归为相似度高一类。结局预料之中，译名剧透啊
353,千钧一发,3,怎么这么高的分？！因为是他俩的定情之作？
354,千钧一发,3,科幻伦理道德电影
355,千钧一发,3,没有重点的片子
356,千钧一发,3,科幻题材显然是另一种形式的现实主义题材//我们歧视过出身年龄肤色性别性向长相财富知识等等下一步开始歧视基因 而优质基因不是成功的根本保证 是否拥有梦想和是否拼劲全力才是人能否突破极限的必要条件//以上是电影传达的信息//我吃不太下这样的鸡汤 虽然确实很励志 创作者在不断劝服观众相信付出十分的努力一定会有十分的回报 但这怎么可能//如果要联系最近发生的事 那么是又一次佐证了科技是把双刃剑//以及很讨厌最顶短评拿腐女说事
357,千钧一发,3,虽然没现在的科幻炫，但情节还算不错
358,千钧一发,3,右撇子不会用左手捏 J8 的细节。。
359,千钧一发,3,3.5……因为不是他杀的……有的时候，为什么不相信那十分之一
360,千钧一发,3,It is possible!
361,千钧一发,3,没觉得太惊悚，CCTV6翻译成什么《变种异煞》搞得我还以为男主会变成妖怪，结果……啥都没有，作为自然人的男主靠冒充男2去了太空，但是根本就没有冲破森严的等级制度，总觉得处理得不够给力，最后男2被他鼓励的去2次自杀了……这种结局……
362,千钧一发,3,这就是说“一个体育不及格生，最后却当上了杨利伟”
363,千钧一发,3,缺陷有时候会转化成最大的优势。
