,movie,star,comment
0,千钧一发,4,是该庆幸这样的电影出现的时候还不是腐女遍地的年代……
1,千钧一发,5,没有触目惊心的科幻大场面，娓娓的说伦理、说基因技术的双刃剑。落了泪的点不是主角，而是最后那个医生，原来他一直都帮助着Vincent，这种梦想一旦被共享，也就推动了第一块多米诺骨牌。有趣的是，片名本身是由DNA的碱基组成的，还有剧组成员名字出来的时候，也是先凸显出G.A.C.T，很有心思的小细节。
2,千钧一发,4,"“我只是把身体给了你，你却让我分享了你的梦想”。（BTW：Original Music by 
Michael Nyman）"
3,千钧一发,5,看了这部《千钧一发》，没想到还真不错，男煮饺儿追求梦想时不给自己留任何后路的精神真鸡巴励志啊……这种励志非心灵鸡汤式励志，而是心灵牛鞭汤式励志……我们曾经都是星尘，莫名其妙地来到了父亲的睾丸里，来人世走一遭后重新变成星尘……反正迟早变星尘，不如追梦尽情活…… 
4,千钧一发,5,为什么只有5星？全宇宙的星辰都属于你。
5,千钧一发,5,人类的历史就是一部歧视史，财富、地位、年龄、性向、肤色...基因决定人生，不过是把这种歧视从人的出生开始以科学的形式固定下来。电影想讲述的是：我也许没有伟大的基因，但我有一颗造梦的心――我就是那个统计学上渺小到不计、但没人可以抹去的1%。
6,千钧一发,5,看名字以为是恐怖片，没想到是这么走心的风格。裘德洛的出场太惊艳了，那双眼睛，那个孤傲的眼神和表情让人难忘。可他最后结束自己生命的方式太残忍了，难以接受。
7,千钧一发,5,当你有梦想 全世界都会帮你
8,千钧一发,4,现在再看，还挺腐的。。。
9,千钧一发,5,古怪的老电影气质，很励志，有点基。世界若是真的如此不公平，那我们就集体作弊去吧。
10,千钧一发,4,问题不在于基因，也不在于决定论，而在于一种万恶的标准和秩序，试图消灭美妙的多样性。
11,千钧一发,4,长伊桑霍克这样的被认为是基因差……
12,千钧一发,4,非常优秀的科幻电影！小时侯看过一次，丝毫没有察觉这居然是97年的作品 !今天重温依旧无法看出，当时囫囵吞枣也没法理解其中深意，如今看过后不禁唏嘘感叹！影片各个方面都堪称精品！导演对节奏拿捏得非常精准，看似平淡的叙事，表面下却暗流涌动！好剧本、好配乐、好演员、好导演，成就一部好电影
13,千钧一发,4,这名字译得太搞了～＝＝
14,千钧一发,4,一个凄美的基情故事
15,千钧一发,4,大唐读完《三体》之后，连呼“太真实了”，从某方面来看，科幻的确是一种现实主义，只不过它叙述的不是过去的现实（历史），而是叙述现在和未来的现实。尤其是生物科学，它所衍生的伦理道德、社会问题直接关乎人类的生物性基础，虽然电影本身的故事和节奏略显平慢，但是主题本身的冲突性就已足够抓人了
16,千钧一发,5,梦想与扼杀梦想的不公平，过去、现在还是未来，这是人类戏剧的永恒主题之一。
17,千钧一发,5,这片子在我的科幻片单里绝对能排到前10。《楚门的世界》编剧的导演作品，比《楚门的世界》无论概念还是执行都好太多了，美术设计和世界观尤其精彩。“我就是那个统计学上无关紧要、但没人可以抹去的1%。”改变生命、分享梦想，泪目。
18,千钧一发,5,科幻版天才雷普利
19,千钧一发,4,"I only lent you my body,you lent me your dream 以及so Jeremo will always be here when you need him 搅基大亮 以及越来越觉得Ethan  Hawke是萌物了…"
20,千钧一发,4,"片名是AGCT碱基的重新排布，每个细节都暗示着一个奉行唯基因论歧视法则的全新乌托邦时代，当然，安德鲁・尼科尔这个善于描绘未来世界的导演终究还是会借男主角之口喊出""我从不为向回游节省体力""这样激荡的句子，在最后还隐藏了一个颇为非典型的最后营救的桥段，你不属于这个世界，因为你拥有群星。"
21,千钧一发,5,"2018年11月26日，人民网的新闻宣称，世界首例免疫艾滋病的基因编辑婴儿在中国诞生。
《千钧一发》里最令人动容的是，Vincent作为未来世界里的""瑕疵人""，绝不回头，绝不留后路的追梦历程，既然是浩瀚宇宙中微如星尘般的存在，又何惧以星尘的模样""归家"" ，在人世间放手一搏尽兴地活是Vincent的选择，也是影片除基因重组，人伦道德等探讨点，传达给观众的更重要的生命意义。
但结合今天的新闻来看，片中对基因技术，人类伦理的平铺直叙，令人背脊发凉，正如《黑镜》里所说“我从没想过自己会活在未来，但我现在TM就在未来。”"
22,千钧一发,4,没有什么能比坚定的知道自己要做什么，并且拼出十二分的努力去完成它，更幸福的事了。哪怕是所有人告诉你，你注定做不到。对文森来说，是上太空。对我而言，是写出最好最真诚的作品来。不要把生命耗费在迷茫和颓废中，行动起来，让它燃烧起来。
23,千钧一发,5,太精彩了，所有细节都很重要，而且正是三个主演的颜值巅峰时期
24,千钧一发,5,DNAp螺旋Y的翘荩分隔著表面的光r和背地e的苦痛。即便他能虺越自我完成最高的指耍但永h只能躲在地下室翘莸谋翅幔患幢闼能坐在上用υL客雅微笑，但拖著p腿爬上翘莸倪^程sD辛常，而即使自之前，那Ky牌同U掉的p腿K]有什N差e。再看是M分影。永h的排名前三。
25,千钧一发,5,出色的科幻作品所展示的并不仅是前沿科技，而是能通过其揭示人类真正的问题。有诗意、有力量、有感动，还有那诱人的西装和最好韶光里英俊的脸庞。
26,千钧一发,5,结尾的升华是如此标准却依然如此动人。向着群星向着梦想远航，克服一切困难和不公义。永无止境的抗争是人之所以为人和人之可以为人的起点和源泉，在任何时代我们都有成为人的机会。
27,千钧一发,5,你知道我是怎么做到的吗？我从不为游回去而保存体力
28,千钧一发,5,BL JQ错综复杂啊JQ遍地开花啊
29,千钧一发,4,我觉得男主和裘秃都没有警察弟弟长的帅。。。这是乌玛瑟曼和伊森霍克定情之作吧，两人挺配的，男的略娘，女的略汉，唉可惜。。。
30,千钧一发,4,「我只是把身体给了你，你却让我分享了你的梦想。」★★★★
31,千钧一发,4,诶哟我艹，我觉得这个可以挖掘JQ啊！蛮腐的其实。
32,千钧一发,4,伊桑霍克的迷人之处在于，当他那英俊的面庞情欲勃发时，你会觉得自己是世界上独一无二的女人，是你给他带来了所有的快乐。
33,千钧一发,5,我的天，男主也太帅了，轮椅男二是偷心里面男主。女主也靓，游泳那段有点腐。总之，努力不一定会成功，尤其是在梦想和人权平等之间存在着妥协。
34,千钧一发,5,值得写的东西太多了
35,千钧一发,4,身份低微的小伙子虽有真才实学，但为了进入垄断行业一般而又只看出身的机关单位成为公务员，不得已搞了张假文凭掩人耳目，战战兢兢地奔向自己的梦想。英雄莫问出处，偏见害死人。
36,千钧一发,5,比基因更强大的，是人性。
37,千钧一发,5,在Gattaca的世界里，基因决定一切，因此人一生下来便被注定了一生，任何工作面试时，只要验下血，没有经过基因选择的自然人便只能沦为清洁工。这部电影中描述的这个世界，我觉得完全有可能成为真实。
38,千钧一发,5,抛开几位著名影星，伊桑・霍克、乌玛・瑟曼、裘德・洛等人的加盟，《千钧一发》看起来就是一部成本低廉的小制作。但正是这部小制作，为我们真实地展现了一个“美丽新世界”：以工具理性为主导的科学技术侵入各个领域，连人体本身也成为它的对象，到处都充斥着坚信数据和概率的决定论信徒。在这样的世界里，个体该选择如何生活？随着近期基因编辑事件的发酵，这似乎也一步步成为我们迫在眉睫的问题。而这部影片真正了不起的地方在于，通过展现主角知其不可而为之的勇气和努力，它再一次赞美了人类的自由意志。
39,千钧一发,5,你的心住在月亮上 决定这一切的不是基因 是梦想
40,千钧一发,4,科幻地文艺，文艺地科幻。基因只是标配，活法是灵魂来选择的。
41,千钧一发,5,没有人能挡住梦想。
42,千钧一发,4,虽然是一部关于未来的科幻片，但是整部电影都沉浸在复古的气氛之中，从帽子到车子。很多人认为这是一部励志电影，讲述未来完美基因人类社会中一个瑕疵人借用身份成为宇航员的故事。但我觉得励志只是一少部分，它更多地放映了对现实社会诸多不公的控诉以及梦想给人的勇气与力量。
43,千钧一发,5,勤能补拙是良训，明朗少男成功记，又名爱在裘裘瘫痪时。裘君你演了那么多被偏爱的都有恃无恐的角色终于也用生命去爱了别人一次，正所谓风水轮流转。。。除了裘君伟大的献身，我也深深地被体检医生感动了。97年的片子，没有特技没有CG没有3D但是他妈的有的是深度有的是思考，这是一部有灵魂的电影，看看
44,千钧一发,5,故事情节，演员演技，画面音效，每一个都很棒！
45,千钧一发,4,从幻想的角度探索古老的话题，好科幻就应该是输出价值观，跟有多少特效，有多少噱头根本无关。
46,千钧一发,4,"最喜欢的两句台词第一句“Vincent：you wanna know how i did it?This is my way,Aton.I never saved anything for swim back.”。。第二句Jerome：I only lent you my body.You lent me your dream..一个完美的缺陷人生，Jude Law真系好迷人"
47,千钧一发,5,看到哭。像我们这种劣等基因的人真的太深有同感了，做梦都想有超模的基因。知道男主是爱在系列的男主后哭的更厉害了，时光杀猪刀也太狠了，此片里他秒杀裘德洛啊TVT。主题深刻得不敢多置一词TVT。另，有此片的同人文么，在线等，挺急的。
48,千钧一发,5,重看，上次标注2011-11-28。七年，当初看的科幻片，如今却在现实中初现端倪。基因人高高在上，却只是冷漠重复的程序；自然人低人一等，却依然心存星辰大海。倘若所有人真都完美无瑕，那也意味着所有人都毫无区别，毫无个性。而在千篇一律之外，最可怕的是弱者恒弱，强者恒强，最终逐级淘汰。
49,千钧一发,4,颜值与演技齐飞，桑叔共裘花一色。（咿……）
50,千钧一发,4,历久弥新的科幻片势必触及人性和伦理，人类对优质基因的执念从未淡却，当基因编辑技术强大到可以自由打造体魄强健、头脑发达、才能过人、精神稳定的人类时，一个自然受孕的“劣等基因”该如何突出重围实现梦想？本片不仅预设了一种近在咫尺的“优生”情境，还举办了一场抢跑的先天基因与后天意志的角力。纵然是个生殖“意外”，当你下定决心时，全世界都会为你让路，“我就是那个统计学上渺小到不计、但没人可以抹去的1%”，这碗鸡汤我先干为敬了。
51,千钧一发,4,在说是个好电影外，提一下，以前还真没看出裘德洛和伊桑霍克配。赞卡司一个。
52,千钧一发,4,作为97年的片子放到现在也不过时。构思题材都很有深度。金童玉女那时候还是那么令人羡慕，唉
53,千钧一发,4,我们并不知道Vincent的梦想如何形成，他践行梦想的时候一点也不快乐。事实上梦想是瘾，是我执。
54,千钧一发,5,这个影片所表述的未来用一个霍金就可以将之辩出好几个地球！只是啊，这貌似不是在讲未来，所有的歧视都都在此列，我们无论是歧视者还是被歧视者都顺应着该与不该的规律，所以歧视者理所当然的歧视着被歧视者，而被歧视者更加的被具象为所受歧视的那一两点，这不就是我们所存在的这个人类的世界么？
55,千钧一发,5,这片C6看的译名太辶 变种异煞 但是里面伊桑霍克和裘德洛的颜都实在又嫩又美，乌玛瑟曼you so lucky 还有没人萌这片里面俩男主嘛嘛嘛嘛
56,千钧一发,5,本有机会成为更深刻的经典，可惜导演终究不够冷酷
57,千钧一发,5,灵超越肉，梦想战胜宿命。即使未来让人心颤，只要你不给自己留后路，就可以拥抱整个星空~
58,千钧一发,5,多么了不起的科幻片。那时的裘德洛真的是上帝之手所造的美貌，令人窒息。几度欲落泪，“我只是借给你我的身体，而你借给我你的梦想”。顶级的基因和一往无前付出一切的努力，又何尝有优劣之分。何等讽刺又真实，天赋成为负担，而热爱，成为无比珍贵的天赋。
59,千钧一发,5,终极挑战
60,千钧一发,5,我很庆幸我在豆瓣记录的第1000部电影是这样一个好片子。剧情、演员、氛围、布景，无一不深爱。特别是复古的色调以及后现代感的场景布局。偏偏在那么一些荒诞的人生里加入了不多不少、恰好的热血，但又无损整个片子的基调与格调。完美！
61,千钧一发,5,在昨天，一科学家宣布抵抗艾滋病的婴儿诞生，突然想到这个电影，被优化基因后的人生就真的那么完美吗？至少现在的我认为，生老病死才是人生，人生不要千篇一律，不需要完美，不要别人为我定制，即使有病痛，即使不完美，那也是我自己的人生，我的人生是我自己的。
62,千钧一发,5,除了要有坚定的梦想，还要付出超人的努力，更重要的是有个好弟弟、好女朋友。当然，也可以讲，当你为了梦想拼尽全力的时候，全世界都会为你让路。
63,千钧一发,4,裘花真是适合演这样花拳绣腿的傲娇贵公子啊。啊。啊。啊。感谢电影为我们记住裘花的脸。真的是太可爱了。太可爱了。太可爱了。别的其实没有什么了，豆瓣高分片果然都是在花样励志。
64,千钧一发,4,立意高于影片制作本身。放在此时此刻看，更是意味深远。
65,千钧一发,5,看电影的时候突然想起了中学时代的好多生物学和少数的物理、化学知识。――脱氧核糖核苷酸是脱氧核糖核酸DNA的组成单位，其碱基有：腺嘌呤（A）、鸟嘌呤（G）、胞嘧啶（C）和胸腺嘧啶（T），对应的四种脱氧核糖核苷酸也可用这四个字母表示。一个DNA片段的单链结构可以表示为比如“-G-A-T-T-A-C-A-”。
66,千钧一发,5,双男主都好帅，当然，伊桑更帅，蓝色狭长的双眸(68 686168ω686168 68)啊啊啊啊啊啊啊，女主也美，后半部分剧情很紧凑，结合弹幕看懂了好几处小细节，B站赛高(296106906107)1277
67,千钧一发,4,11.17 二刷。剥离了梦想和身份，一如精神离开了肉体，留下可笑的虚无和永无尽头。黑天鹅事件-阶级意识形态-缘-又一种一见钟情-解决方案-细节中的真相
68,千钧一发,4,扎实的剧本是科幻片很重要的基础，而科幻片里的真实性则又是重中之重，没有哪个科幻片不是影射现实的，因为现实的恐惧才是科幻片想象啊的素材，这样看来，这个题材严谨度足够，受制于投资，可惜想象力匮乏，很多可以很炫的场景变得潦草，不免有些遗憾。
69,千钧一发,4,在当年这个题材似乎还没有烂大街，在电视上看过很多遍的一个老片，很惊艳，片尾所有的哀伤与绝望都触动心灵，似乎我就是个悲情主义者。
70,千钧一发,5,三个演员都太完美了！场景的仪式感很强，犹如构图严谨的工业制图一般，当人类也可以选择最大限度地趋向于完美的时候，情感就成了理智的囚徒。
71,千钧一发,4,啊好淡定的导演。淡定是因为对他创造的世界了然于胸吧。完整的世界观加永恒的梦想/反抗命运主题，还是处女作呢真了不起！――所以后来拍出《时间规划局》这坨东西如何能原谅！（PS：我蛮喜欢小伊的，嘻嘻）
72,千钧一发,5,"they have got you looking so hard for any flaw,that after a while that's all that you see"
73,千钧一发,4,水和A的motif用到了O致；裘德洛拿著y牌M小房的一刻，非常非常感樱浑m然平r很“粝搿边@拥淖盅郏但@拼M全力追っ舻墓适逻是那N尤耍大概追艉鄱家樱重要的不是f出那字眼，而是真切追さ倪^程
74,千钧一发,5,科幻版堂吉诃德。而且把这种对抗的精神描写的极富想象力。尤其兄弟二人迎着海浪的最后一搏。艾伦阿金和裘德洛那两个角色一样有趣。同样的矛盾拧巴人物性格又值得深挖。不仅剧情设置精妙而且台词功夫一流双关和小幽小默比比皆是。
75,千钧一发,5,义无反顾追逐梦想的文森特，奋不顾身穿过汽车疾驰的街道，人性的光辉在基因淘汰的暗灰色调的未来显得那么温情光明，有些悲情但更多的是震撼和鼓舞，人生如歌，何不尽力而为。20年后的今天，基因检测已不是罕事，很难想象如果有基因歧视，将会剥夺多少人的梦想甚至生存权利，将会失去多少才华横溢的“不完美的人”。看着他昂首阔步走远的身影，忽然在想，用尽全力游向未知未来的文森特，这股子勇敢冒险精神，才是人类最该保留的
76,千钧一发,5,安德鲁・尼科尔不多的导演作品，却是一部不可多得的科幻经典。影片并没有传递很多深奥的科学技术或设想，除去对唯基因主义的批判，这就是一部披着科幻外衣的励志片。不过影片对未来世界的勾画很成功，极具说服力。乌玛・瑟曼真是美爆了，才知道伊桑・霍克是她前夫，不过片中伊桑和裘德・洛更有基情些。
77,千钧一发,5,I got the better end of the deal. I only lent you my body - you lent me your dream.
78,千钧一发,5,（９／１０）这部片让我想起以前一个苏联犹太数学家的经历，直到苏联解体，他都不曾知道苏联会暗中打压犹太人的前途，更没有料到自己的犹太人血统可能会带来麻烦，但他幸运地躲过了一切灾难，因为他周围的苏联官员都是好人，一起淡化他的犹太身份，用一生的时间让他活在了没有歧视的天堂里。《千钧一发》中也有几个这样的好人，安东是因为亲情，女主是因为爱情，医生是因为儿子有同样的经历，而尤金则是因为银牌……尤金努力爬上楼梯为文森洗刷罪名的那个场景让我难忘。
79,千钧一发,4,毫无预兆地在当下看了这部电影，虽然漏洞很多，但更让人毛骨悚然的是在电影之外，有人居然真的扛起了基因优选的大旗，而且还是个中国人！
80,千钧一发,5,"""我只是o你我的身份, 而你s我分享了你的粝."" 全片最感拥木褪沁@句. m然第一主角是伊桑霍克, 但裘德洛的角色恰好是一N完美的互a, 把@N生之永不停歇的j望的更有哟. 另外, 作榭苹闷, 基因工程c人性之g的矛盾的看法也很有深度. 全片⑹碌界R^都^ι铣, 可惜知名度不蚋."
81,千钧一发,4,男主literally美如画 被裘秃爬脱氧核糖核酸双链螺旋楼梯和存了两辈子的尿惊呆=。=点子很好 不过没觉得拍得特好 起码节奏可以更紧凑 剧情可以更紧张 场景也可以更科幻。顺便要是我能生一个完美小孩我肯定选基因啊这有什么好说的！
82,千钧一发,4,“我从不为游回去保存体力”――浪子不回头，只管往前游。黑色未来大幕下，诗意地老调重弹小人物大励志。硬性基因定义人权的科幻设定已然沦为陈词滥调，但每每回首仍然大呼过瘾，只是因为某种老情怀在新一代狂轰滥炸的大片没了影儿了。
83,千钧一发,5,这部电影告诉我们经典科幻，不需要到外太空，不需要有怪兽，只要一个好IDEA，加上好导演，就算没有特效也可以五颗星。裘德洛在里面非常基情。
84,千钧一发,5,挺感动的片子，虽然属于科幻，但人性味很浓，唯一有点生硬的可能就是女主角吧……（我真没有腐的意识相信我）。何为完美，用科学统计出来的无缺陷就代表完美吗，谁又有资格分辨缺陷与完美，社会应该要做到可以包括世界一切万物的存在，正因为世事本来就是不可预测
85,千钧一发,5,"其实这个题材现在看来是一点也不新鲜了,那个时候的幻想现在看来也多少有些不符合实际,但是男主的奋斗啊...还是很让人心酸, 基因改造还没有强大到去除人类的恐惧,这个虽然是不合理,但就因为这没有被改变的人性,才知道人类的脆弱不在肉体这方面...好片> <"
86,千钧一发,5,"Once you make a decision , the universe conspire to make it happen. "" I only lent you my body, you lent me your dream.""喜欢这个故事，喜欢两位男主角，喜欢这梦想的力量。Everything is possible，只要你坚信。"
87,千钧一发,4,''我只是把身体借给了你，你却让我分享了你的梦想。''
88,千钧一发,4,分数是打给女主角的。女主角是我喜欢的类型：冷静，理性，有一定的包容之心，最重要的是她是以相对平等各取所需的方式出现。嗯嗯。
89,千钧一发,4,幕因的角度碇匦缕饰鑫锓NM化以及A地位@系列}是有趣的，可惜Y局太钪玖耍K且影M程其起伏不大。每天上班都血一次，也太可怕了c吧。
90,千钧一发,5,之前看到分数很高有点纳闷，看后意识到它是多么优秀而与众不同。曾看过类似题材的小说，科幻背景之下伦理与人性的主题深刻，未来人有了好基因和坏基因之分，人的地位因此迥异，但基因并不是一切，没有人有资格制造不公和歧视，没有人有资格否认梦想和努力。的确基因并无灵魂。
91,千钧一发,5,http://v.pptv.com/show/UG5a2ECmFlS3Nbk.html
92,千钧一发,5,既具有科幻思考性，又有励志的精神内涵，极佳！没有谁的命运是天生注定的，命运掌握在自己手上
93,千钧一发,5,基因决定命运，两个男主角的命运都充满悲哀，整个电影的基调都很悲伤，但是文森特用尽一切方法与命运抗争的精神很令人敬佩。
94,千钧一发,4,这部处女作如此冷峻犀利，将基因优化的近未来阐释得真实。一个出租身份，一个分享梦想，两人都对先天条件抗争，要把握自己的命运。“你问我是怎么做到的？那是我从不为回程保留体力” “我们身体中每个原子曾是星星的一部分，也许我只是回家而已。”(ps那位验尿医生是看上了男主哪点
95,千钧一发,4,索尼公司在1997年十月公映之前特意组织了一场面对哺乳动物细胞生物学家学会的试映，在影片结尾，出现了爱因斯坦、林肯和美国最著名的女运动员Jackie Joyner-Kersee的照片，并伴随着字幕：如果基因工程和基因实验早成事实，那么这些名人将都不会出生――他们分别患有阅读障碍，马凡氏症候群及哮喘病。
96,千钧一发,5,在很小的时候，无意中在明珠台看的。当时很多东西都看不懂，但当时隐隐约约感觉到的压抑、沉重，直到现在我还记得。
97,千钧一发,4,"隐约觉得自己看过,好佩服这样不顾一切为梦想而努力的人.套了个科幻的外衣,讲得仍然是人与人之间的联系.最后的bug没给出解释.jude百看不厌!"
98,千钧一发,4,披着科幻的外衣探讨人类啊社会啊之类的问题。虽然干的是违法乱纪的事儿，但是充满了希望和梦想。明显的BUG是既然未来的技术已经如此先进，那为啥身份识别的时候两个长相有明显差异的家伙却一直被当做一个人？最后说13年前的裘德・洛和乌玛・瑟曼真是太美好了！
99,千钧一发,5,片子相当精彩，除了片名有点误导人，其他哪哪儿都好！好电影就是能让你在看的过程中没有时间的存在感，所以我不知不觉竟看了两遍！故事励志比阿甘正传强的不止一点点！只要有梦想，没有什么不可能！那句“我从来没给自己留过后路”绝对能被人奉为至理名言！如果不是97年出的，肯定能多拿一项奥斯卡！
100,千钧一发,5,"""...Of course, they say every atom in our bodies was once part of a star. Maybe I'm not leaving. Maybe I'm going home."" 为了台词打五星，现在的裘德洛秃的太厉害以至于让人忘记了他年轻时有多么惊艳，即使坐着轮椅出来，气场也完全把伊桑霍克压下去。老派科幻片里那种阴冷而有秩序感让人着迷"
101,千钧一发,4,嗷，原来Jude Law那么帅。我只记得Ethan Hawke说的那句：因为我从不保留游回去的体力。
102,千钧一发,4,2007-10-02，比较早的一部讨论基因的电影。可能是看的少，想的是《逃出克隆岛》，但是这部显然更具有前瞻性。
103,千钧一发,4,You wanna know how I did it Anton? I never saved anything for the swim back!
