,movie,star,comment
129,天空之城,4,宫崎骏动漫都挺喜欢，天空之城很美，配乐也很好听
130,天空之城,5,随着美妙的音符漂浮在无际的空中。――――听过无数次的原音，今天终于看了原剧。
131,天空之城,5,整个故事一气呵成，以现在的技术看场景和细节也许并不够完美，但那种对天空的向往、对科技的反思、对独裁的反对和自由的唱颂，以及更重要的青春情怀、自然之美的展现使得影片得以位列经典。当然还有更迷人的――那首歌和它的旋律。
132,天空之城,4,那女孩以後成...    ///相较于庞大冷血的大组织你更倾向于选择可以自由打情骂俏的小团体。
133,天空之城,5,天马行空的幻想的确适合动画片，听着久石让的音乐又让人心情舒畅，美好的片子~~~~~~~~~~~
134,天空之城,5,吉卜力作品里的最爱，没有之一！天空，飞翔，梦想，爱，这是永恒的主题啊！
135,天空之城,5,看了才知道，之后的很多片子都或多或少用了它的创意，1986年出的，那是我出生的那一年，不得不佩服宫崎骏了。这次新海诚的新作＜追逐繁星的孩子＞借用这部片子太多了吧，哎，对我很喜欢的新海诚实在不想用抄袭这个字眼啊在！
136,天空之城,5,又一部以坚强独立，善良单纯的女性为主角的宫崎骏电影。关键词还有：梦想，和平，爱……
137,天空之城,5,深刻的寓意、舒服的画风、流畅的剧情、精致的细节、典型的宫崎骏手法，的确不错。
138,天空之城,5,时间不对，已经没了五颗星~~ps：如果是1986年这个年份看到这样的片子，五颗星是完全不可以概括的~~
139,天空之城,4,坚持做不想做但应该做的事，就可以得到你想得到的东西。善良，真诚与和平是这世界最珍贵的。
140,天空之城,5,工业和科技的发展始终离不开养育它们的大地。。。PS：音乐成为不朽的经典
141,天空之城,5,满天星：最美最强的剧情，特效，温情，幽默，激情，动作，爱情，音乐，这电影全揽了。
142,天空之城,5,"多年后重看此片,动人的旋律依旧,希望从此巴鲁和西达在城堡里过着幸福的生活..."
143,天空之城,4,善恶终有报.美好的东西有永恒的生命力..忧郁灵动的主题曲真是完美~~我就是老爷子脑残粉！
144,天空之城,5,已经不知道看过多少遍了。尤其是在心情烦闷的时候，就会翻出来再看一遍。也有这样的想法，找个女友一起看遍所有宫崎骏的动画片。也会每每被里面的场景，音乐，台词和可爱的角色感动~~前途再艰险，有你的陪伴，人生都值得，对吧？
145,天空之城,4,"He create a prefect dream, however, it just a dream"
146,天空之城,4,听到了路飞的声音。不愧为80年代的作品，画工简练啊。看到宝贝就往家里拿，人类的劣根性。。总是和环境有关系。濉
147,天空之城,4,不知道为什么没什么可说的.拉普塔是个神秘的城.是乌托邦吧.不过我相信以后人可以住在这样一个美丽的地方.
148,天空之城,4,重看宫崎骏绝对是一场冒险……没找到中文配音版，于是全情投入念字幕，从头到尾给孩子演了一遍……她很崇拜地看着我说，妈妈听得懂他们讲话啊好厉害，我很虚荣地没告诉她我只是认字而已o(s□t)o早晨用《天空之城》的原声给她当了闹钟，那个美哦，人还没醒呢就开始笑了。
149,天空之城,5,天马行空的想象力和宏大的世界观，画风虽然没有现在绮丽精致但天空之城的美景不得不让人惊叹：郁郁葱葱的密林，青苔丛生的机器人，潺潺流水鸟树花鱼，俨然世外桃源。少男少女们的爱情清新动人，海盗们也都那样可爱，善良与真诚，信念与希望，再加上久石让的配乐，构成一幅波澜壮阔的画卷！
150,天空之城,5,到最后真的看哭了，千万别让任何人破坏这纯净的天空之城，亦或者说是最纯净的心灵。一定要好好守着她。宫崎骏的电影就是这样，爱与希望并存，真善美的世界在简单的画笔中永存。
151,天空之城,5,"又名: 天空之城 / Castle In The Sky

导演: Hayao Miyazaki 

上映年度: 1986
语言: 日语
制片国家/地区: 日本
imdb链接: tt0092067
"
152,天空之城,4,极度后知后觉的补完。果然音乐再经典还是得结合片子来听才最有感觉。剧情挺有年代特色的，跌宕中总觉得少了点儿什么。创意点十分浪漫。天空果然是全人类的向往。
153,天空之城,5,三段式，第一段是复古的欧洲工业时代，古朴刻板的男子风；第二段上天入地的压抑中来到一个清新又华丽的绿色世界，洗脱阴霾，赏心悦目；第三段从天而降，一切都走向毁灭，荡然无存。波澜壮阔，激动人心，久久不能释怀
154,天空之城,5,宫崎骏把它的乌托邦梦完美呈现在世人面前
155,天空之城,5,我想这是到目前最爱的一部宫崎骏。
156,天空之城,4,宫崎骏的动画能让坏人都变得那么可爱
157,天空之城,5,这是宫崎骏所有影片在我心目中最高的。一直幻想能有同样一座天空之城。
158,天空之城,5,跟我同龄的动画片，二十几年依然经典的无与伦比。谁能想到龙卷风之中是郁郁葱葱的树，是各种美好的小动物，是默默守护的机器人...贪欲的罪恶在美好之中被无限放大。
159,天空之城,5,人与自然的和谐，自然与科技的和谐，工业革命与哥特艺术的和谐，道家生生不息与笛卡尔机械唯物主义的和谐，金钱欲望与精神追求的和谐，人类与神灵的和谐。
160,天空之城,5,这片子戳中了我的泪点，每次看都觉得很平静，但是却会掉下眼泪
161,天空之城,5,又把天空之城看了一遍，我只能说太爱宫崎骏了，尽管有些人说他的东西很俗又或者他已经江郎才尽了什么的，最重要的是，每一部他的作品都充满着爱意和寓意，人类不要太贪心，贪婪是一切罪恶的源头
162,天空之城,4,好看，看完后很令人感动
163,天空之城,5,吉卜力工作室严格意义上的开山之作，撒哈拉的热风从此处吹起。天空是宫崎骏经常使用的意向，瑰丽的想象力与纯真的感情的结合。除了一贯的人与自然关系的元素，竞还瞥见一股孤独的暗流。久石让的配乐成世界名曲了。ps.从中可以找到波妞原型。
164,天空之城,5,依旧是宫崎骏的心灵洗涤系列，太震撼了！天空之城，1986年的神作，久仰其名，很多熟悉的东西，比如久石让的钢琴曲<天空之城>、默默守护着Laputa的巨型机器人都在这场精彩的历险式爱情故事里找到了原型。看着宛如世外桃源般的Laputa缓缓升空，有种想要逃离现实的感觉。看到最后真的想哭，却欲哭无泪。
165,天空之城,4,有时候，坚持了你最不想干的事情之后，便可得到你最想要的东西，坚持就是胜利。
166,天空之城,4,这部电影最经典之处在于与其同名的编曲――《天空之城》，我相信这是大多数九零后都必听的音乐了，优美又略带些伤感，曲调中充满了伤感的情愫，但又不是那种不可割舍的，而是未完待续却不可能的盼望，和无尽的回忆，电影的剧情对于现在的我们而言稍微有些幼稚了，但对于整个影片的完整度和水平质量还是没什么影响的，海盗婆婆这个亦正亦邪的老家伙，刚出场的时候竟然让我想起了汤勺婆婆，那个在《千与千寻》中出现的反派角色，但是结尾处那盗亦有道的大情怀也还是真的感动到我了，世界上好多自诩为好人的人其实并没有那么好，反而是总以恶人形象现世的家伙倒总是做些令人感动的事情，世界没有我们想象的那么美好，但也绝没有他实际看上去的那样糟糕，生活中只要有一丝甜就能盖过千般苦，我喜欢这句话，所有的辛苦和付出，只要一点激励就够了。
167,天空之城,5,原来一楼里那个吐云的场景是天空之城开头曲里的片段呐！看到动画片里那些细节到有点繁琐的机器，我就想到了2楼的那些分种类图片收集。
168,天空之城,4,宫崎骏的动漫都是艺术
169,天空之城,5,宫崎骏又一力作。。与久石让音乐的又一完美结合。。是后人模仿而无法企及的佳作。。
170,天空之城,5,奇幻的想象，纯真的感情，深刻的寓意，好听的配乐，一步只有成人才能看懂的动画片
171,天空之城,5,拉比达是一座飘在空中的岛，一个以科学力量支配一切的古老帝国。在古老传说中，拉比达已无人居住，蕴藏着无限财富，帕克是矿区一名小工，与意外自飞行船上落下的拉比达继承人希达偶遇，相识，进而成为好友。希达拥有一飞行石结晶，据说它可以带来幸福，也可能带来祸害，军方与海盗均为了夺取飞行石而一再追杀希达，帕克为了救希达，带着希达逃亡，希达遭军方挟持之际曾念出咒语，令飞行时发出圣光，让机器人复活，并指引出拉比达的方向，帕克为拯救希达而与海盗合作，于救出希达后，为阻止军方慕斯卡的邪恶计划，而和海盗一起追寻拉比达，帕克与希达
172,天空之城,5,音乐是大爱，没想到是86年的片子，画面拍得真细腻~真是，音乐听多少遍都不会腻啊
173,天空之城,4,为什么我会黑化，都是潘康囊庖，不战胜成人政治不比他们更强大，是无法掌握局面和向往所要的世界的。
174,天空之城,5,一部音乐，动漫和剧情都让人难忘的作品！
175,天空之城,5,"我喜欢上久石让就是源于此。
其实论剧情不是很好，自然之题不够《龙猫》塑造得深刻，自然。
Laputa的画面还是如此震撼的美。"
176,天空之城,5,故事现在看来虽略显老套，但整体水准依然相当高，久石让的音乐极其出色。场景设定与机械设定看的很过瘾。哎，这简直就是一个小男孩所有的梦想，五星吧
177,天空之城,4,依然是宫崎骏的作品，那自然没的说了，特别要提的是久石让的配乐，太完美、太好听了。。。和宫崎骏的画面配起来堪称经典。。。
178,天空之城,5,"这部电影寓意深刻,久石让的配乐相辅相成,宫崎骏的完美之作."
179,天空之城,4,三星半//想象力与信念力构建出的世界 宫崎骏做出了他个人的作者性//物哀或许是民族性//久石让和宫崎骏的组合也是非常美妙了
180,天空之城,5,好久没看动画片了，好爱！！海盗妈妈的猥琐又可爱的手下们争相去厨房偷偷摸摸讨好舒达的模样真是太可乐了。一听音乐就想流眼泪，好像无尽暖色调的回忆都被召了回来。舒达跟巴斯在一起的样子也特别暖人心扉。
181,天空之城,4,久石让的音乐太完美了。宫崎骏老先生原来那么早就喜欢什么事情都扯上战争。
182,天空之城,4,看过今敏之后再看宫崎骏觉得情节上面苍白幼稚得很，但天马行空的画面跟久石让的音乐确实迷人~
183,天空之城,5,里面的配乐没得说，堪称经典之最，太完美了
184,天空之城,4,最后天空之城的生命之树倒塌，很壮观，故事很不错，宫崎骏的每部动画里，全部都加了情情爱爱，可不可以有那么一次例外啊
185,天空之城,5,最喜欢的动画片之一，富有浪漫的少年英雄主义。
186,天空之城,5,"宫崎骏最强大的力量就在于，他擅长用最干净的童真来对抗全世界的成人政治。钢琴在狠狠蔓延的高潮之后渐息渐止，并缓缓结束。 
"
187,天空之城,4,对于一个二十多岁的人来说，这太童话了，但去怀疑那些细节，未免太不识趣了些。海盗一家太口耐了，著名的片尾曲还是震撼到了我，在加一星吧
188,天空之城,4,毛利小五郎客串演出我会乱说？ 原来那个熟悉的旋律是久石让给天空之城创作的片尾曲  煽到我了～
189,天空之城,5,"1.宫崎骏的电影其实有很多共同点，女主角，男主角都会有差不多的性格2.原来希达的声优是田中老师
3.配乐绝美了"
190,天空之城,5,Laputa和它的音乐一样美。但谁来纪念孤独死去，纯粹保护公主心，还有孤独活着的，连话都说不了的机器人......
191,天空之城,5,久石让和宫崎骏，两位大师的携手巨作，这些年中，各个版本的天空之城都有细致聆听，最喜欢的还是没有任何改动的电影配乐版，那样的空灵飘渺，仿佛灵魂瞬间得到净化一般。1984年的经典动画巨作，至今读来依旧荡气回肠，真想随着那样宏伟的音乐巨章飞翔寰宇，永远的驻留在laputa之城。
192,天空之城,5,今日起床电影是天空之城，一直没有吧阿宫的这部经典好好看完。他的作品其实长大后看会更适合
193,天空之城,5,【A】美的令人难以置信，这是宫崎骏最美丽，却又无比深刻的一个梦。当一切贪婪、疯狂、丑恶都随着拉普达的科技一起破灭时，唯一留下痕迹的，只有纯洁的生命和美丽的心灵。
194,天空之城,4,宫崎作品里很喜欢的一部，当时买的盗版碟竟然还没结局
195,天空之城,5,"看的第一部宫崎骏的电影,也让我从此成为宫崎骏和久石让的fans…每次看完, 都恍如隔世。生活中的悲伤和快乐仿佛都不存在了, 只沉浸在电影中那个纯净的世界……"
196,天空之城,5,小的时候在安徽台看到，却被迫上床睡觉，只牢牢地记住了巴鲁和希达的名字，然后在未来的某一天翻出来搜索，辗转终于看上了完整版，同时开启了宫崎骏之旅。
197,天空之城,4,‘看吧 人类就像垃圾一样’，很遗憾穆斯卡因为剧情需要作为吉卜力最帅反派不能实现自己的想法，反而成了NICO众的调戏对象w
198,天空之城,5,不管是你烦躁，还是失意，人生高潮或低谷，如果你想享受静谧一刻，就老老实实坐下来，拉上窗帘，让宫崎爷爷给你静静的讲个故事吧
199,天空之城,4,因为没有扎根于土地，而是高高悬于天空，拥有地上没有的科技，所以很容易以为自己是神。可是巴鲁说了，这些年科技一直在进步，总有一天会找到拉普达的――看，永远不存在最高的技术水平，所有的高科技都在等待着被超越――过度仰赖冷冰冰的东西只会造成心灵的缺失，因为太虚幻了
200,天空之城,3,剧情无甚佳，但天空之城的景象忘不掉，尤其是废墟中布满杂草的死掉机器人出现的时候
201,天空之城,3,以前没看过宫崎骏的动画（《阿丽埃蒂》不是宫崎骏导演）我是怀着膜拜大师的态度来看片的，但大失所望。精美的人设和画面、美妙的旋律下是一个充斥着俗套的漏洞百出的故事。也许我被皮克斯的真实系动画惯坏了，但我实在不喜欢这么个能让我边看边猜到下一步剧情的动画。剧情要是正常些都够主角死几百次了
202,天空之城,3,久石让音乐甚是经典。可这片拍的……也太好莱坞太斯皮尔伯格了吧！片头从飞艇坠落，在高架轨道上疯狂追逐，不正是比本片早两年的夺宝奇兵2的华彩桥段吗？而动画片在这方面存在先天缺陷，拍不出真人电影的紧张感以及微表情与小动作的幽默调剂。关键时刻项链宝石魔力四射使希达凌空安渡，算是脱离了真人冒险的逻辑维度而进入到动画该有的超想象自由王国，然后又进入到大段类型感真实化和西方文化倾向的桥段，直至天空之城显身才又见动画想象……如此的品质起伏跌宕自然难堪极评，更别说豆#34的耸人高位。三星半。
203,天空之城,3,天空之城告诉我们：舒塔不仅会和贝塔在一起，还可以跟巴斯在一起。。。这条影评冷么。。。。回到影片。犹豫先看了千与千寻，导致影片质量绝对上乘的前提下，观影的兴趣下降了。于是飘满大街小巷的天空之城到现在才看。
204,天空之城,3,特别感动！那个音乐让人很伤感！
205,天空之城,3,我每次浏览各网站的社会版都很窝心，估计和宫大师看科技版的心情一样。整天絮絮叨叨地担心科学毁灭世界，所有的电影好像都是一个模子里刻出来的。
206,天空之城,3,剧情一般般，就是空中植物巨岛的想法挺不错的，如果先看这个再看阿凡达的话会比较惊叹，只可惜我生得晚了没赶上~唉~话说最后那个石头怎么样了...主题曲经典~
207,天空之城,3,某某说里面的城是从mont saint michel得到的灵感，后遗症是这个地方“全”是日本游客
208,天空之城,3,BT下 影视帝国版 3CD 日语简字 1520 外公家 http://movie.douban.com/review/3225532/
209,天空之城,3,这部片子有点很久以前看过得比较诡异的日本动画片的痕迹，个人不是很喜欢，看它只是因为它是宫崎骏的。
210,天空之城,3,是不是参与制作的人太多了？感觉看不太懂~线索太复杂还是？今天之前看的千寻更好看些吧
211,天空之城,3,一度放在P4里没看，最后在课上看了开头，或许此片会很美妙吧，但不是很吸引我，开场掉落在天空里还是很精彩的，但看完就不必了吧~错过的就让它永远未完成吧~
212,天空之城,3,小时候最喜欢的就是天空，觉得它无限神秘广大，还萌生过当天文学家的念头。可实在是不喜欢只会尖叫的女主。大概我已经过了被这些童话吸引的年龄了吧，所以不能够那么喜欢
213,天空之城,3,我一定是一个不太可爱的人，才觉得这种纯爱环保题材是一个顽固的资本主义艺术家工业化创造出来的，反刍似的纯真与和平，深层的优越感让人不适――坏人那么努力追求自己的梦想凭什么就不能美梦成真呢？！；2011.02.11：很美的境、很美的音乐，很拖沓的剧情。宫崎骏是太得意自己的画跟梦境么？
214,天空之城,3,个别人物造型和《千与千寻》有点儿像。这个配乐非常经典。情节一般，感觉有有点拖沓，没太打动我。
215,天空之城,3,"【Sky Chord】天空城池本来就是一个乌托梦想的symbol,哪怕是废弃的.当飞向他的那一瞬间,已经无在乎生死"
216,天空之城,3,小时候看会很喜欢吧，已经过了那个迷恋宫崎骏的时期了。
217,天空之城,3,三星完全是因为主角过于理想化，似乎不能带着有色眼镜去看待，很多世界难题到这里轻而易举的解决，对于天空之城有人陶醉有人羡慕，是啊，世界级的水准，天堂一样的拉比达帝国，通过大师的手显得完美无缺，像一块温玉。。但就是宫崎骏式老套的英雄救美使我很不耐烦，尤其是当运气好到摔跤都能摔出钱。
218,天空之城,3,还是最喜欢千与千寻，然后实在不喜欢里面那个女猪脚。好吧，你们可以说我是心灵不纯洁。
219,天空之城,3,我……去……面……壁！我喜欢不上！看完了，喜欢那个最可爱的机器人！
220,天空之城,3,除了那句“我要像傻瓜一样保护她”，剧情无感...海盗欧巴桑挺有爱~音乐赞。
221,天空之城,3,动画，动作，奇幻，爱情，家庭，冒险。。。这是个什么神片，看来我真不能相信豆瓣评分
222,天空之城,3,不喜欢，用现在的眼光来看，太老套，冗长，想给2星的，因为不好看，第三星给年代，倒是没想到是这么早年的片子。
223,天空之城,3,还好啦，看在宫崎骏成名作面子上。不过看着总觉的特别幼稚，始终不能跟皮克斯的比。
224,天空之城,3,故事不觉得很有意思。。。剧本不是我喜欢的类型，音乐很赞。。。海盗女船长和大机器人很萌-0- 里面还出现了很多小乖。。。
225,天空之城,3,毛利小五郎和少年侦探团 星矢和雅典娜 机械迷城和钻石迷阵
226,天空之城,3,宫崎骏的动画中总是伴随着许多朦胧的感情，可是小时候看的时候却不能理解。如今长大却没有兴趣再去翻一遍了。
227,天空之城,3,年代太久远的关系吗？剧情实在爱不起来，音乐是神作那倒绝对是事实。
228,天空之城,3,很少看日本的东西 不做评价 没别人介绍的那么好 其实很平常 评分虚高了
229,天空之城,3,音乐还是很好听的，至于情节，一向对动画片不感冒的我，竟然在途中睡倒过两次
230,天空之城,3,那些幽深的峡谷一样的城市~~~不过电影真是讲了一个芝麻大点的事，不懂最后为神马要用毁灭的咒语，我还等着看各种各样的好咒语坏咒语呢。只是想不到是86年的，好像00后。
231,天空之城,3,纯纯的爱，对梦想的一种追寻，音乐实在是太美了
232,天空之城,3,看这种东西两小时跟20分钟没区别，不是夸它精彩，而是说它抓不住重点
233,天空之城,3,貌似除了音乐其他的不是很经典么...
234,天空之城,3,这个故事实在是不怎么出彩，天空之城的景色还是很美丽的.
235,天空之城,3,觉得人物没什么性格 亮点在音乐上了
236,天空之城,3,现在看来节奏有些慢，对比卡梅隆的商业片，何其相似：创造美好的世界，然后摧毁，然后抗争。表达人性，表达人与自然的相处。表达对人类社会的思考
237,天空之城,3,宫片一贯有点脱离现实，不是说设定天马行空，是表现出的情感，总会有那么一丝故弄玄虚在其中
238,天空之城,3,那个异想世界，再也到达不了。
239,天空之城,3,中世纪欧陆建筑，工业时代科技，东方面孔，扎着两条粉红辫子的欧巴桑，科幻思想，童话情节，架空的世界――独特的日式风格引领了一批动漫与电游。对片子不怎么感冒，慕容复般的反派让人蛋疼
240,天空之城,3,不知道为什么 觉得很一般...
241,天空之城,3,剧情不感冒，但是那个废弃的城市太美了。特别是那个生根的机器人
242,天空之城,3,L和音罚然o可挑剔，故事情s一般
243,天空之城,3,宫崎骏的作品多多少少都会暗含人与自然的矛盾和对战争的谴责，即使是美好的结局也还是难掩这股忧伤。★★★
244,天空之城,3,就那些个笨头笨脑粗手粗脚的机器人还算是亮点~~~
245,天空之城,3,2月之前看的 忘了纪录了
246,天空之城,3,音乐和画面结合得很棒啊0 0 但那个男人干么要千方百计地控制天空之城啊。。。
247,天空之城,3,Frankenstein+Peter Pan的合体。虽然画面略显陈旧，宫崎爷爷果然还是擅长以动画来诠释这种我们小时候所有光怪陆离的梦的集合体。那是我们一去不返的童年时光，与天空大地海洋为伴，少年少女的大冒险。
248,天空之城,3,三十多年前能拍出这样的动画真是了不起，可惜当我看到的时候都已经2019了，并没有惊喜，或者被治愈，只是庆幸自己没有成为慕斯卡那样的大人。
249,天空之城,3,拉普达，天空之城，远处闪着光辉的地平线，是因为你在后面
250,天空之城,3,三星半，难得剧本还不错，宫崎骏作品的优点是用很简单的画面说简单的道理，它不一定要反映多少东西，不过他的人物性格塑造真是千篇一律啊。海报也做得没想法
251,天空之城,3,音乐都听了有10年了但电影真的是现在才看 剧情很一般
252,天空之城,3,过年陪我妹看的，不觉得管这个叫成人童话，把成人童话说的太虚伪了么？
253,天空之城,3,看过了宫崎骏最经典的两部片子，发现宫崎骏不适合自己。。。
254,天空之城,3,为什么我觉得好吓人啊，真的好吓人的！（害怕。。。。）
255,天空之城,3,喜欢巴鲁和西达间的不离不弃与视死如归，喜欢面恶心善的欧巴桑和她可爱的儿子们，喜欢生机勃勃的大树和简单淳朴的生活。宫崎骏是反战的吧，知识不可怕，只是知识无法等同于智慧罢了。
256,天空之城,3,相比较宫崎骏的动画，我还是比较接受久石让的配乐。
257,天空之城,3,如果是10分值的话，我打7分，但是8分就太高了
258,天空之城,3,风景和音乐咯。情节不喜欢
259,天空之城,3,有人说阿凡达是学天空之城，我的结论是没有共通之处――除了一个相似的形象――漂浮于空中的城或者山。
260,天空之城,3,小时候总觉得云彩上有一座城
261,天空之城,3,。。。。。。挠痒痒动画 到底想说什么
262,天空之城,3,因为蔡公康永很喜欢宫崎骏，并看到会流泪，很想体会他到底是用什么样的心情在欣赏，为何宫崎骏的动画会让那么多人追捧，是不是有我未曾触及过的体悟？想一探究竟，但看过后，仍然没有找到原因，谁能告诉我?我想知道为什么你会喜欢他？
263,天空之城,3,绝对不能把咒语教给未成年人。自以为是，不负责任。如果当年中国被抢的时候，有个自以为是的小孩儿宁为玉碎不为瓦全的使用中国毁灭术。那我们就不知道在哪个维度里喝着什么风了。这个女的只想活命，不识大体，幼稚的感情也实在让人可笑。好，坏人都死光了，就你们活了，你却没想过自己死保留住那个文明
