,movie,star,comment
443,天空之城,1,除了飞行石带来的魔力以外，那么在悬崖上屋顶上火车道上飞机上树藤上，男主违背太多生活常理和力的定力反正是怎样都不会死怎样都不会掉下去怎样都不会受伤，牛顿哭着从坟墓里醒来。最后大家都是在强光下，反派眼瞎了，两主角完好无损？？然后飞行器也是完好无损的就这样摆在两人的旁边就这样得救了？？
444,天空之城,2,手绘动画看着很有感觉。有他的深度在里面。根要扎在土壤里，和风一起生存，和竹子一起过冬，和鸟儿一起歌颂春天。海盗婆婆很可爱
445,天空之城,1,故事太灰暗了！！！！！！我不喜欢！！看完内心一团团的・・想哭但不是因为被感动。而是因为倍感寂寞！！
446,天空之城,1,剧情还不错。。。不过听到天空之城的音乐就想吐。。。
447,天空之城,1,宫崎骏的作品永远透露着对人类社会的无限敌意，所有的官方形象要么坏要么蠢，而传统意义上的坏人永远温情脉脉，对科技充满了不信任，这样一种划时代的技术体系，对我来说是要倾尽一切去保护的东西，对于宫崎骏来说毁掉就可以了。我不能接受。我认为追求幸福是人类的正当权利，淳朴是一种流于表面且没有意义的美好
448,天空之城,1,1星 片子过于古老，电脑里面保存了很长时间，总是看一会就关掉，实在不能被这简单剧情吸引，没有一点共鸣，人设也没有讨喜的。删了
449,天空之城,2,我觉得不行//热爱自然与生命的多耶鲁王意识到：天空时代的科技进步，必将导致飞行石武器的扩散，最终是人类的自我毁灭。
450,天空之城,1,又是一部无聊的电影，看完都不会让人记得说过什么
451,天空之城,2,配乐经典
452,天空之城,2,完了，宫崎骏的电影看完我都没感觉68
453,天空之城,2,几个成年海盗对小女孩献殷勤 说你好美 恶心。小男孩保护小女孩的stereotype 白眼。配乐经典。
454,天空之城,1,真不行。
455,天空之城,1,"额，好无聊，跟龙猫没得比，不知道那所谓看了""好想哭""是怎么样的心境在看。"
456,天空之城,1,睡着了
457,天空之城,1,看得心脏受不了，太恐怖了，比恐怖片还恐怖
458,天空之城,1,辣鸡，宫崎骏最烂的一部动画，无聊死，就音乐能听，居然分这么高，一星拉低
459,天空之城,1,那时候的人类由于科技医学落后，劳累、疾病，平均年龄才三、四十岁，埋没这种科技是罪人
460,天空之城,2,我不喜欢，除了音乐。
461,天空之城,2,不看不知道这还是86年的电影，迄今都快三十年了~那时的久石让就做出如今依旧历久弥新的音乐，为电影加分不少.
462,天空之城,2,年纪大了才看这部片子，没有太多的共鸣，可能是长大了再没有了小时候的那种对世间万物都怀着好奇心的感觉了，其实这是很可悲的！剧情直白简单，风景倒是很不错
463,天空之城,2,幼儿科幻片……
464,天空之城,2,欣赏无力
465,天空之城,2,真的不怎么样啊 在宫崎骏的作品里 不喜欢这个女主 而且这个爱情线好怪 没看出来他俩到底多大 和海盗的友谊也不知道怎么来的 怎么就变成了好人 大反派反的也是生硬
466,天空之城,2,一星给片尾曲，一星给宏大的人与自然的主题。节奏太慢，睡着了然后又倒回去看完的....
467,天空之城,2,可能是配乐的名气实在太大，导致我抱着太大的期望，虽然故事还可以，但是……
468,天空之城,1,很坑爹有木有，看没到一半就弃了……头一次没看完一部动画电影
469,天空之城,1,对不起大家，我欺骗不了我自己，坚持30分钟放弃并后悔这30分钟纯属浪费的心声。再见了，我知道是非好坏，一个豆瓣9.0的影片不会让人看了开头就没有后头。千与千寻一样评价。
470,天空之城,2,看到那些个打斗场面 我就斯巴达了。
471,天空之城,1,讨厌吉卜力这套
472,天空之城,2,这部电影配不上久石让的配乐
473,天空之城,2,除了音乐，确实没找到感动的地方，好无趣
474,天空之城,1,之前坚持了，但剧情不仅没打动我，而且看着头疼。我一舍友也是认为不好看。
475,天空之城,2,真的是动画片了...
476,天空之城,2,没耐心看完 。。。
477,天空之城,2,抱歉我不懂
478,天空之城,2,没看下去
479,天空之城,2,感觉没什么特别的，，为什么会这么出名
480,天空之城,2,宫老的动画还是很有深度的啊 肤浅的我还是不能体会您老的深度 
481,天空之城,2,只有我觉得很无聊么……日本人好喜欢飞行器啊…… （看于@乐视网）
482,天空之城,1,噗，说实话。别卖弄什么情怀了好么？一部稀松平常的电影硬是被你们吹上天了……不过配乐真好听。
483,天空之城,2,不好意思，实在看不下去。东京六本木看过原画展又如何，十年前第一个手机的铃声又如何。这次因为某个MV概念 生命之树 坠海 想想还是吧，努力了好几天想看完，但是真的看不动。
484,天空之城,2,没什么意思啊~~
485,天空之城,2,冲名气和曲子看的，内容挺一般的..
486,天空之城,2,就这么完了 ？ 怎么感觉和小时候看过的感觉完全不一样。是我变俗了吗。
487,天空之城,2,机器人还蛮可爱的，其他都好无聊。
488,天空之城,2,剧情烂俗，女主傻逼，不能因为是宫崎骏的它就值9.0
489,天空之城,2,看过几十部所谓高水准动漫 实在无法理解这种中二弱智的剧情是为何有如此高的评价的
490,天空之城,1,看到一半我就受不了了。以至于我一直没看到后半段。如果有惊喜，我再坚持看一看！
491,天空之城,2,除了女主和boss其他人都挺好 boss最后智商不见了 女主从头到尾智商掉线
492,天空之城,2,看了两三次都没办法完全看完。 里面的飞行器很丑。 《红猪》&《幽灵公主》好看。
493,天空之城,2,只被那两个机器人打动了，难道是因为年代太久的原因导致我感触不深？
494,天空之城,2,假如我来世上一遭，只为与你相遇一次，只为了一万光年里的一刹那，那就让一切该发生的，都在瞬间发生，让我与你相遇，与你别离，再缓缓老去。天外，月明星稀。真是美好，只是不戳我。
495,天空之城,2,不喜欢
496,天空之城,1,以为是近些年的电影，没想到是八六年的。动画片都很有想象力。
497,天空之城,2,没什么感觉 甚至想不起来我曾经看过
498,天空之城,1,觉得剧情很无聊，节奏很拖沓
499,天空之城,2,我恶心宫崎骏。。。
500,天空之城,2,影片最大的问题是其缺失的节奏感，使得整个电影像是一杯温开水，需要观众自身去调动情绪才能感受到宫崎骏的电影语言。
501,天空之城,2,"怎么会比千与千寻和龙猫差那么多。。
不合我胃口
另外，小孩子真是可以很容易就全心全意爱上一个人，羡慕"
502,天空之城,2,真心觉得很不怎么样啊  要不是配乐 我就直接一星了
503,天空之城,2,我没有任何感觉 ... 真的 ... 两星全给主题曲了
504,天空之城,2,跳着看过了，没什么感觉。
505,天空之城,2,小朋友的思维还是接受不能
506,天空之城,1,另一个王族做错了什么，天空之城到底是什么
507,天空之城,2,除了音乐，一无是处。
508,天空之城,1,老头子的东西除了哈尔以外都不喜欢
509,天空之城,2,我可能真的不适合这种小清新治愈系的风格，包括夏目友人帐也不太喜欢，画面是美的，但是剧情实在太无聊了
510,天空之城,2,音乐是真的好听，但是看千与千寻和哈尔的移动城堡在先，所以就不觉得这部有多好了。
511,天空之城,2,没有加勒比海盗号看
512,天空之城,2,真的没感觉= =宫崎骏作品里罕有的没感觉的一部
513,天空之城,2,宫崎骏的动画片儿都很纯
514,天空之城,2,都是冲着宫崎骏啊 我真的是看不懂
515,天空之城,2,原声。
516,天空之城,2,也是不来电。。。郁闷
517,天空之城,1,不怎么喜欢，日本的动画一如既往的圣母，生活哪里那么多圣母
518,天空之城,1,很少看动漫电影，这几天忙着码字和出版的书，一个电影硬是分了两天来看。光看‘宫崎骏’这个名字就该知道不会让人失望，虽然是很久以前拍的了，但是真的不错。
519,天空之城,2,最后只记得海报上的画面。日本文艺不然超喜欢不然超没劲。
520,天空之城,2,天空和音乐很美，但没被感动到，可能长大了吧。
521,天空之城,2,我不喜欢宫崎骏的动画片 除了千与千寻
522,天空之城,2,"  音乐确实好 

  但是还是给小孩子看吧。"
523,天空之城,2,这么小，真会撩妹呀。不过实在喜欢不起来，宫崎骏的动画片，或者说日本的，都不太有感觉。
524,天空之城,2,两星半，道理我都懂，就是没觉得好看
525,天空之城,2,我没有想到天空之城居然那么难看……
526,天空之城,2,朋友极力推荐 说实话 看过之后 很失望。着眼点太细小 思想范围太狭窄。无可寄托。话外：一直不喜欢日本动漫把人画的都那么丑。
527,天空之城,1,无聊的动画片
528,天空之城,2,这个也是，不知道是存在语言障碍还是什么的，真看不懂动漫
529,天空之城,2,是我看过宫崎骏老师的作品中最差的一部。节奏很拖沓，加上很普通的剧情，感觉很失望
530,天空之城,2,场景跟风之谷有点像啊。巴鲁的言行跟路飞差不多呢。少男少女们打这么高分，实在是因为对爱情太过渴望吧
531,天空之城,2,没看出好在哪里，也许因为2018年看1992年的电影吧
532,天空之城,2,"淡淡的感觉
久石让的音乐真的不错"
533,天空之城,1,男女主凭什么决定别人的家园要不要毁灭，自私又恶心
534,天空之城,2,宫崎骏的电影里总能找到相似的人物模板 这部女主角漂亮了 但是我更愿意循环两个小时久石让的天空之城
535,天空之城,2,人的欲望会引导人做许多的坏事，但是善良的人们往往才是最强大的。
536,天空之城,2,就这部来说，是久石让成就了宫崎骏还是宫崎骏成就了久石让，我觉得是前者，整个剧情看得昏昏欲睡，分了3次看的，一星给机器人，一星给久石让。
537,天空之城,1,男主女主竟然长的一模一样！哈哈哈哈哈。。。。。。。。。
538,天空之城,2,0907#　
539,天空之城,2,表示不喜欢~
540,天空之城,1,放在30年代可能能有2分。
541,天空之城,2,过了那个欣赏得来的年纪了。
542,天空之城,1,宫崎骏最差的电影，配乐一颗星
543,天空之城,1,骗小孩的，而且是那个年代的小孩。
544,天空之城,2,音乐 很不错
545,天空之城,2,故事也太薄了…
546,天空之城,2,"250搞完以后我不看动漫了吧还是……
完全get不到我现在真的童心尽失……"
547,天空之城,2,2.5星。偏向热血系，主题曲经典
548,天空之城,1,宫崎骏的电影看多了感觉每部都差不多。。
549,天空之城,2,这个动画片还是无聊r(s_t)q
550,天空之城,2,并不觉得好看，和宫崎骏的其他动画相比
551,天空之城,2,有点地方看起来有点智障，有的地方看起来有点感动。好纠结。
552,天空之城,2,为什么我对宫老爷子的片子越大越不来电了……
553,天空之城,2,我们的孤独就像天空中漂浮的城市，仿佛是一个秘密，却无从述说。
554,天空之城,1,为啥这么高分，我看着觉得好没意思，剧情老套墨迹，也就音乐好听点，一星给配乐
555,天空之城,2,就冲我分不清风之谷幽灵公主天空之城，这几部我都不会给高分……
556,天空之城,2,真不知道这么暴力奇葩的剧怎么出了这么优美的旋律
557,天空之城,1,"故事一般吧,就是一块石头引发的血案，不够温馨。机器人丑爆了。"
558,天空之城,2,实在是对宫崎骏系列不感冒啊，节奏慢到一直走神，慢节奏的话果然还是更喜欢新海诚岩井俊二那种心理情感类的啊…
559,天空之城,2,这阿凡达前身吧，无聊死了，简直煎熬，秀秀美术和配乐就没了。还是千与千寻好看。
560,天空之城,1,主题曲主题曲主题曲―？？？。你们不是对剧情很苛刻吗？
561,天空之城,2,跟有些人是没有缘分的，比如宫崎骏。
562,天空之城,2,每个孩子都有梦想，都想有一次惊险的冒险。
563,天空之城,2,片尾曲旋律比影片内容更能打动人心。
564,天空之城,1,叙事太磨叽，我没工夫跟你们这帮文艺青年体会岁月静好。
565,天空之城,2,不得不说，对于剧情，我看得几乎睡着。。。
566,天空之城,1,讲飞行员的好像，没意思
567,天空之城,2,我是真不知道哪里有说得这么好了…
568,天空之城,2,"我看的哭了 不过不是感动得哭了 而是看困了
我一直对宫崎骏的童话没有任何感觉 糟了糟了我是不是快完蛋了！
“不管拥有多么厉害的武器 操控多少可怕的机器人 离开了土地就无法生存”这句话可以概括近代以来人类的不停掠夺和造孽"
569,天空之城,2,我不喜欢动画片
570,天空之城,1,把宫崎骏的动漫弃了 
571,天空之城,2,忘记说的是什么了。就是因为喜欢千与千寻和萤火虫之墓开始把宫崎骏的动漫看了个遍。这部没有留下太深刻印象。
572,天空之城,2,一般吧，不过那时候能做出这样的动画来也很不容易了
573,天空之城,2,"最让我感动的是海盗老婆婆，
希达和巴鲁在飞船上面裹着毯子看美丽的星空说话。"
574,天空之城,2,catharsis
575,天空之城,2,哎 好可惜我不再是小孩子了 没有一点触动的感觉...
576,天空之城,1,2013年意外看^
577,天空之城,2,很喜欢宫崎骏的动画，但这部实在欣赏不来。
578,天空之城,2,对女主完全喜欢不起来，倒是海盗奶奶很抢戏。以毁灭来解决问题的结尾也实在不能认同
579,天空之城,2,宫爷的其他作品太吊，这个就被衬托的没太大意思
580,天空之城,1,高分都是给音乐的吧，剧情简直垃圾
581,天空之城,2,没觉得有什么好看的地方 就是歌儿真的好听 
582,天空之城,2,情节缓慢无聊
583,天空之城,2,"为啥大家都喜欢这个
有点古老了"
584,天空之城,2,看了一半，没有想看完的欲望
585,天空之城,2,吹过头了，不过还是很好看的
586,天空之城,1,"    三刷。星数仅代表心情。
    我一直坚信什么故事都一定得有个结尾、无论你和我还是宁斯可和付冬阳――即使它有一个百年孤独那么好的开头，结尾也可能很烂、但总比没有结尾要好。痛恨无疾而终，所以明明知道是即将天亮的最后一梦、也是不到黎明不回头。
    而私影的片源既没有片头的吉卜力龙猫也没有片尾的月光下云之海洋，画面戛然而止的时候你淡淡一句『我先走』、短短三个音节译成拉普达语大概跟『巴鲁斯』一样，待我反应过来的时候就只剩自己一个人在黑暗里发怔、而记忆只剩彻底倾覆的天空之城。好像什么都沾染戏剧性的讽刺太浓，只有终于认命――原来『无疾而终』也是结局的一种。"
587,天空之城,2,除了配乐，一无是处。
588,天空之城,1,呵呵！我都懒得说了
589,天空之城,2,值得学习，不过日片你懂的
590,天空之城,2,过誉的电影，唯一亮点是音乐
591,天空之城,1,这是一部以731部队做实验为原型的动画片
592,天空之城,2,看不下去，不明白好在哪里
593,天空之城,2,没有惊艳也没有感动算不得就好吧
594,天空之城,2,"看的第一部宫崎骏的是买的VCD《魔女宅急便》，觉得还不错。后来租了这张VCD，就再不想看宫崎骏的动画片。直到很多年后看了《千与千寻》……
没看懂，当初看的时候觉得超级无聊，满屏幕的绿色植物，然后就是突然出现的机甲？打来打去不晓得是在干嘛……"
595,天空之城,2,听到有人播它的bgm简直想掐人
596,天空之城,2,同事在放这部片的时候，我不知道是怎么打发了这让我觉得极其无聊的一个半钟的。
597,天空之城,1,好无聊的剧情。。
598,天空之城,1,什么三观…
599,天空之城,1,没字幕
