,movie,star,comment
264,天空之城,3,天空之城的音乐实在太美好了，剧情倒还罢了，宫崎骏加久石让真的是珠联璧合
265,天空之城,3,1986年？我们是有多落后。主题音乐和孤独的机器人。
266,天空之城,3,天空之城，一个可以满足所有孩子幼年时期对天空向往的梦想，以及，那么小就知道爱是怎么一回事的青梅竹马小男女，等我们慢慢长大之后，反倒忘记了什么是真爱，怎么为了一个人去奋不顾身，海盗家族，又是面狠心慈的典型，还有那五个不争气的儿子，哈哈，很可爱的单纯喜欢小美女的WSN心态。总之，我爱宫
267,天空之城,3,wow...i'm surprised i've even watched this many animations from him
268,天空之城,3,宫崎骏大叔的作品不是我的茶啊。
269,天空之城,3,唔，期待太高了吗……喜欢小男孩那句‘你从天空掉下来的时候，我的心跳好快噢，就觉得有什么事情要发生了’ 机器人好撒鼻息TAT
270,天空之城,3,怎么评价都高成这样...闹的我怪不好意思的...扔掉音乐和动画单论剧情，我拒绝高分。
271,天空之城,3,难道我老了么，对宫老师的这部经典作品不是很来电，相比之下风之谷要出色的多。
272,天空之城,3,其实这个 我不是很爱。。。- -！！！为什么何同学这么爱呢。。莫明。。、
273,天空之城,3,就∏碚h，我X得算差的。那空中文明在是太莫名了。  \你太可哿~~  [文明分析：fr_始的建造空u，於是在天上有了好多空u（然後自己l展了科技超越了地面？）（造C器人的材料要哪e恚浚┽u群遇到雷落地上，族群重回地上。 ∏樽钺崮畹缰洌H是放走空u的咒Z]
274,天空之城,3,"过382。
放到现在来看，其实就是俗套的冒险夺宝电影。片中对于拉普达王国面纱的逐渐揭开，以及几方力量对于财富高科技的趋之如骛，都是典型的冒险动作片情节。
其实最有意思的看点，倒是对于普拉达王国的描绘和设定，在充满生态主义描画的同时，还提出了“接地气”这回事，算是新颖了。
人对于地的依附，万物对于人类本身的意义，让我们感受到了宫崎骏的博大和赤诚。"
275,天空之城,3,只能说一般，真是盛名之下其实难副，实在不理解为什么分这么高！
276,天空之城,3,还是环保反战电影，但配乐加分太多了，久石让对整个故事的加成要比宫崎骏大得多。我认为它比《风之谷》要出色，不仅有刀子嘴豆腐心的海盗妈妈和保护小鸟的机器人这样的反差萌角色，在保护家园的情节中也带着点悲天悯人的气息和对自然生命的敬畏。
277,天空之城,3,"印象深刻的只有一句：
如谷之歌  扎根土里与风共存  与种子越冬  与鸟儿歌颂 尽管有可怕的武器 操作很多可怕的机器人 离开了泥土还是活不成。
一下子联想到 古希腊神话里某个拥有神力的巨人，离开了土地却手无缚鸡之力。
与土地共存 与自然共生"
278,天空之城,3,"海盗婆婆和她的儿子们挺搞笑的
第一次唤醒机器人的时候女主智商有点让人捉急
换我 最后就选择生活在天空之城
远离俗世 做个世外""高""人09"
279,天空之城,3,确实年代久远了，画风和颜色都粗糙一些。标准的「因石头相识-寻找城堡-拯救城堡」的历险故事，无论是从故事还是想象力还是映射上都不及《千与千寻》。「真难想象希达有一天也会变成海盗妈妈的模样啊」久石让音乐经典。
280,天空之城,3,原来阿凡达在很大程度上都是抄袭天空之城的啊
281,天空之城,3,失落的帝国，在人们的想象里，永远存在那遥不可及的神秘之地。我们想尽方法到达，最终呈现在我们面前的是被洗劫一空的鬼城。我们只能想象它曾经繁华的样子，曾经鼎盛的文化。而我们永远不会去了解，为何如此一城会倾刻倒塌。我们是不是正重蹈覆辙？我们无法从一片树叶看到整棵大树的参天。
282,天空之城,3,剧情有点粗糙啊，经不起推敲，不过很高兴naputa的终极造型是棵大树！和avatar不谋而合。向植树节出生的孩子致敬！和千与千寻里的黑团鬼影一样，看似可怕的坏人其实相反，像丑丑的机器人和海盗老婆娘。还是千与千寻精彩！是不是每一个女孩最终都变成了海盗老婆娘I'm afraid so
283,天空之城,3,不喜欢女主不喜欢女主不喜欢女主
284,天空之城,3,宫崎骏真不是我的菜
285,天空之城,3,老宫这次真被庵野干掉了。
286,天空之城,3,飞行石的魔力好像没有想象中那么精彩 追到最后怎么样了都忘记了 一直期待更有趣点 却没有得到满足啊
287,天空之城,3,说实话，没有想象的那么好，可能被借鉴太多，可能主题也太多类似了。包括对主题曲过分的熟悉，电影里的配乐并没有交响乐版打动人，可能这就是过分的被透支了吧。还是三分吧。
288,天空之城,3,只喜欢海盗 好可爱
289,天空之城,3,有没有人和我一样不喜欢宫崎骏啊啊啊
290,天空之城,3,宫崎姥爷始终探讨人与自然和谐的问题 所有的动画片连起来看 都能成为一部系列连续剧
291,天空之城,3,早恋是个好东西！
292,天空之城,3,大概在那个时代是真的很吸引人吧，不过现在来看还真是不怎么吸引我啊……幼稚的爱情，简单的二元对立……我想我还是更喜欢千寻。
293,天空之城,3,我觉得这个片子看的时候没什么意思，看完想起来好像还蛮值得回味……
294,天空之城,3,我看了，恩，我不懂...
295,天空之城,3,大概是看太多这种某一领域存在着高科技的东西令贪婪的人类向往，最终正义终于战胜邪恶之类的东西。觉得厌倦了。可是还是想去laputa。幻想飞行石在自己脖子上出现。
296,天空之城,3,总觉得在哈尔的移动城堡里看到不少天空之城的影子……
297,天空之城,3,《天空之城》中战争以冷兵器、火器甚至兼带魔法和充满未来感的高科技武器等各种形态展现在观众面前。宫崎骏对于战争的描绘往往比现实更加残酷，表现出他对战争的反对与排斥、对大自然的热爱与悲悯。
298,天空之城,3,吉卜力的开山之作 还不错吧 故事略显粗糙 但原声比较经典
299,天空之城,3,作为如雷灌耳的宫崎骏成名作，在25年后看起来似乎情节和画面都不算出彩，然而这毕竟是久石让的《伴随着你》的出处啊，一首让我刻骨铭心的曲子。
300,天空之城,3,不知道是不是我看惯了欧美科幻动作之类的电影，我没有被剧情吸引，唯一喜欢的就是久石让的曲子。
301,天空之城,3,宫崎骏画的人很多都相似，我看到波妞的身影了有不有。我看见卡尔城堡里面的巫婆了好不好~~~最后那个树生气来的时候好美~~~
302,天空之城,3,跟宫崎老爷子就是气场不合啊，哎....
303,天空之城,3,就。。。。。主旋律电影吧。。。
304,天空之城,3,m崎E的卡通都不m合小孩看 @部好早 久石的OST非常 我是了音凡Q定看片的 m然@部很典 但真的Uo聊的。
305,天空之城,3,童话的美好就在于它总是给人希望。巴鲁，只是个美好的希望。
306,天空之城,3,还行，觉得人物的动作非常生动可爱。
307,天空之城,3,和幽灵公主如出一辙，风格太凝重阴郁了
308,天空之城,3,我出生那年的片。
309,天空之城,3,宫崎骏加久石让，不喜欢剧情，但情景难忘音乐难忘。
310,天空之城,3,女主很装逼啊！还是绿色的机器人好玩。还有海盗家几个。
311,天空之城,3,失落的天空之城，你的后人没有守护你的土地，没有保护你的文明，他们选择逃避、遗忘你，却终对生命的底色心存不舍，留下点滴想念。被毁灭的天空之城，最灿烂先进的文明，我只能迁怒于宫崎骏的冒险动画主角老是无力的小女孩。#抛弃故土的人不得我心#
312,天空之城,3,只喜欢后面天空之城出场那一小段
313,天空之城,3,有想象力。配乐很棒。
314,天空之城,3,我好像不能欣赏宫崎骏的作品・・但是电影原声带比作品更让我澎湃
315,天空之城,3,剧情比较差劲
316,天空之城,3,剧情平凡无奇 久石让的音乐增色不少 天空之城果然是经典的很好听
317,天空之城,3,都说这部好看，我觉得一般吧
318,天空之城,3,宫崎骏的作品中我比较偏爱的一部，勇敢的小男孩和小女孩的冒险故事。也许是因为更喜欢那首“伴随着你”吧
319,天空之城,3,片尾曲挺好听的...
320,天空之城,3,这部的内涵感觉相对简单一些，可能小孩子对于世界的支配是最不感兴趣的吧，配乐很赞。为什么先人会放弃拉比达呢，为什么拉比达科技会这么发达，为什么那棵树没有被毁灭会飞上天去，很多事情并没有给出解答。也许很多事情就是未解的吧。
321,天空之城,3,啥情节，怎么觉得没什么意义
322,天空之城,3,争强好胜的动漫风，适合冒险，不适合安宁-12/22/15 at IFC Center
323,天空之城,3,最棒的是音乐。
324,天空之城,3,第一次看。确实制作精良，但对剧情无法产生共鸣。也无法理解某些人老挂在嘴边的“以小见大”的细节。
325,天空之城,3,喜欢里面的音乐……
326,天空之城,3,找人指点一下这个片赞在哪里...
327,天空之城,3,吉卜力三部曲之“空”
328,天空之城,3,哪有那么好看额。
329,天空之城,3,其实我真的真的觉得很一般……不知道为什么得分这么高，还能衍生出这么多深邃的影评来……还是喜欢魔女宅即便和豆豆龙那种小清新范儿的~
330,天空之城,3,我是久石让的饭，但不是宫崎骏的饭...我还闲着没事儿一次次去证明这点，唉唉...
331,天空之城,3,只有久石让让我感动了，其他的感觉都是浮云。
332,天空之城,3,小蓝孩一开口就好像在喊：娘子！娘子！你这个疯和尚！快放出我娘子！→_→
333,天空之城,3,配乐The Forgotten Robot Soldier很好听。
334,天空之城,3,可能是看了太多的宫崎骏，已经不再容易被这种固定的模式所打动了。
335,天空之城,3,宫崎骏作品的”漏网之鱼“，看了出品时间才明白――竟然是80年代，好腻害！只是搞不懂为什么每部动画片里的人物都长得一样，配角什么的也就算了，男女主角好歹还分一分呐！因为心中最爱是《哈尔的移动城堡》，所以没法给你高分了，对不起……
336,天空之城,3,觉得园丁机器人很孤单。它的身上有花草，后来飞来了鸟。
337,天空之城,3,虽然配乐已经被无数ppt展示毁了，但初到天空之城的美景还是一样震撼，两个善良机器人的故事平静而动人。两个主角的戏份有点弱。
338,天空之城,3,看前面机器那段真有点不想往下看了....坚持过就好了
339,天空之城,3,想脱亚入欧，还表现得不情不愿。
340,天空之城,3,其中一颗星给配乐
341,天空之城,3,宫崎骏的一些细节更能打动我 但是为什么整体一看我就喜欢不起来呢 
342,天空之城,3,想象力很赞 就是没自圆其说 更没表达清楚拉普家族的盛衰去脉 没说明白消灭这样一座珍宝之城的意义 浪费了一个好题材。
343,天空之城,3,场景很精妙，音乐很经典，海盗很可爱，机器人很温暖，巴鲁和希达很有爱。
344,天空之城,3,难免会把同一个导演的作品比较着来看吧，所以相比而言，比别的差点啊……
345,天空之城,3,“没有子民，天堂将不复存在” 圣诞夜看这部真是别有风味。最妙的是刚刚降落在laputa上见到机器人与花树的段落，正邪对抗的段落就非常令人头昏（好莱坞那一套玩得很6）。看到2001太空漫游对它的影响，也能看到它对很多年后的科幻片的影响。总体比《千与千寻》还是差了一截，当然最最妙的还是音乐。
346,天空之城,3,主角才找到天空之城@大型的密境，但]安排太多的@奇在太可惜，在天空之城榷嗑一些故事更加完美。
347,天空之城,3,赵灵儿带着逍遥哥哥大战慕容复。屋顶上的机器人很有爱。OST很好听。然后就完全找不到点在哪里了……
348,天空之城,3,"可能是我比较喜欢情感类的电影吧，感觉天空之城它的剧情没有什么意思，很多都是动作，干嘛干嘛，没有什么情感上的抒发
"
349,天空之城,3,女孩子真是碍事，笨手笨脚的
350,天空之城,3,除了原声已经没啥印象了
351,天空之城,3,说实话，宫大叔的片子里，这部最不喜欢，前面太压抑了，不知道为什么，反正就是有这感觉
352,天空之城,3,作为一名理科生 表示不能理解宫先生在危急时刻的小童真与小浪漫
353,天空之城,3,去心爱的女孩生长的地方看看貌似是个好主意。
354,天空之城,3,"前面|也太L了吧..最後半小r才M入正}
啥?KO大招缰湔Z就3音?逗我呢!!
海I大[藏的少女心是亮c,最後居然在心疼女主的p子XDD
m然看得出尊重女性崇尚自然反Ρ┝Φ戎黝},但故事真的]有那N好吧?"
355,天空之城,3,只记得一台会飞的机器了。要补课。
356,天空之城,3,也就音乐比较经典一点。。。=。=
357,天空之城,3,不觉得多好看，以前只听过音乐，音乐还是不错的。
358,天空之城,3,音乐很棒！没想到这是1986年的动画片……
359,天空之城,3,同《千寻》~
360,天空之城,3,看过两遍 还是印象不深 不知道怎么评价就这么高。 ps.主题曲经典。 观影日期：04年8月和柳
361,天空之城,3,音乐听了这么多年，终于把电影看了，不如想象中好。
362,天空之城,3,因为年代太久了 所以没有千寻清新 走的当时很流行美国漫画的风格 可是也没有哈尔的移动城堡好玩 只有拉普达画的很好很好啊）
363,天空之城,3,总觉得有bug 军队用炮轰都轰不碎 小男孩用火箭筒就轰碎了...挺生小女孩家族气的 不好好把家谱流传下来 小女孩才不知轻重！！！！
364,天空之城,3,好吧。。。我一直以为是普拉达岛。。。。
365,天空之城,3,"久石让的配乐历久弥新

沿用至今的设定:
神秘玉石，空岛、海盗，爆衫 ，机器人受伤一怒为小女孩

船上有传声筒

 善恶和黑白一样是共存的，如果机器人会产生意识要伤害人类，那么也会有机器人特工队要保护人类。一昧阻止科技发展就像文官斥责武官，是为了集团利益而不是为了国家发展

树如果能够脱离土地生存，肯定不愿意和人待在一起 "
366,天空之城,3,好吧，我看得有点心不在焉。。。
367,天空之城,3,一流的创意，二流的故事，一个一眼都能猜到结局的电影，少男少女的爱情，脑残的反派和面恶心善的中立人物，能不能把逻辑性弄清楚一点，谁家的十几岁的孩子这么能折腾和作？
368,天空之城,3,我真的不喜欢那个小女孩 ==
369,天空之城,3,LAPUDA文明，美丽的天空之城，伴随久石让的音乐～～
370,天空之城,3,拉比达的设定是5星，两小孩以及众人的设定我只能给0星
371,天空之城,3,我哭了！我看到那么多无辜的士兵都死得渣都不剩，家里的亲人还在等着他们……我幼小的心灵蒙上了一层黑黑滴阴影！
372,天空之城,3,是不是因为看的都是宫迷了所以给分都高
373,天空之城,3,加一颗星给天空之城里的robot
374,天空之城,3,宫崎骏爷爷深刻地证明了粉色切开都是黑的不破定律，无数细节都能看出他老人家是个内心阴暗的人……
375,天空之城,3,是不是每个小朋友都幻想过，云彩上面有人住。
376,天空之城,3,整部看完没什么特别的感觉，倒是一些影评让我有些感触，哎，自己果然是一个比较缺乏想象力的人……
377,天空之城,3,为什么完全无感..........觉得那么幼稚。我会像傻瓜一样保护她这种话，感觉是俩小朋友= =
378,天空之城,3,宫崎骏还是那么神奇，想象力 纯洁 是一个美好的梦。不过好像没有那么受感染了 但这无疑还是一部好片。音乐，也许是听了太多，还是久石让的那个STYLE 不过这个音乐也有点旧了。。。
379,天空之城,3,那个年代看了也许很震撼，但是如今看来，除了寄托幻想，最多的也只是那纯洁的爱情了~~
380,天空之城,3,主题有点杂乱了
381,天空之城,3,影响了几代年轻人
382,天空之城,3,追逐天空。
383,天空之城,3,没怎么认真看。。。就不难看就是了，至于内涵么，爱么，没触到我的点。。。
384,天空之城,3,一定是我太不懂欣赏了 我觉得有些柯南的剧场版都比这好看。。。（now 243）
385,天空之城,3,"主题曲加分啊
"
386,天空之城,3,重看，一直认为此人是被严重高估的，看了多少部了依然没有让我改观。
387,天空之城,3,with no surprise at all
388,天空之城,3,宫崎骏画的笑脸最好看～
389,天空之城,3,1986年看的话，绝对给5星。但是看过星海诚的再去看20年前的东西，难免更挑剔一些。
390,天空之城,3,宫崎骏，歌非常棒。
391,天空之城,3,并没有什么fancy idea。另外对小女孩的幻想稍微整整就好了，不要那么没完没了的。
392,天空之城,3,一看到名字叫Laputa就想笑怎么破
393,天空之城,3,真不是我想吐槽啊，实在是看不到一半就睡着了。
394,天空之城,3,看睡着了
395,天空之城,3,拉普达是一棵树，上面好像也没有多少居民，除了地理位置闹中取静，拥有矿产资源飞行石之外，一点也不特别。而且一个岛民也没有怎么会有这么多珠宝，难道他们都死绝了还是移民了？故事也没交代啊，真是莫名其妙。配乐是挺好听的
396,天空之城,3,在86年应该是一部很好的影片把 可是现在我还是喜欢皮克斯更多一点 呵呵 虽然皮克斯的家伙们都很崇拜宫大爷
397,天空之城,3,MY GOD 跟我想象的截然不同 不是我喜欢的FEEL啊 完蛋了 没有兴趣看龙猫了 对宫崎骏失望了 还是千与千寻最拽啊
398,天空之城,3,"It's funny that ""la puta"" means a bitch in Spanish. I wonder if Miyazaki knows about it."
399,天空之城,3,过了年纪还是体会不到呢，我自己？
400,天空之城,1,呀，对了，这部宫崎骏动画我竟然没欣赏的了。。看了前面就知道后面剧情的动画，剧情直接让我大失所望，当然当然当然音乐是很好很好的，，
401,天空之城,2,"宫崎骏将思路埋在细节却也败在细节，本片以“上升”到间谍特工电影的高度，可是阿汤哥拍碟中谍6也没这么拼！
天空城中的巨大的树，这也影响到后来的“Avatar”吧。电影中刚看到那棵树时，心里就在想，要是这里变成了战场，与树为依托的庞大的生态系统必然遭到波及…小时候看的时候：哇！好大一棵树，还会飞！
竟然读出了对侵华战争的映射：满载宝物的天空城（中华）-懦弱的君主（希达）-军队（帝国主义），而穆斯卡是用国家利益与帝国主义交易换取利己利益的权贵的代表。而天空城在大程度毁坏后，得以保全，却逐渐拔高，外界很难再接近或进入，这不也是抗战胜利后渐筑高墙的Rouge Regime吗？
科技果然是人的原罪，不过需要辨清的是：错不在科技。想起我看过的一本关于艾滋病的书里的话：科技负责发现，而人类负责分类"
402,天空之城,2,宫大师的作品里较差的一部 太无聊了！俗气！我没法产生共鸣 以及不喜欢男女主角 我就不喜欢笨人！就不喜欢笨人！
403,天空之城,1,哇咧擦…真心觉得很多恐怖啊…吓哭了好不好…
404,天空之城,2,为何把公主编剧成就一直哇哇叫一点用处都没有＠＠
405,天空之城,2,@是唯一m崎E系列中最不喜g的片子 我也不知道什麽不喜g 就是]有好感
406,天空之城,2,这对飞机恐惧症患者来说 简直是灾难恐怖片
407,天空之城,2,个人对跟虫子有关的电影都不看好，比较喜欢后来的《幽灵公主》
408,天空之城,2,so annoying. Why don't you all go to hell? 
409,天空之城,2,拍本片是因为需要还债，片中的大量设定全部来自于宫崎骏之前的《未来少年柯南》和《可爱的鲁邦》，所以等于是炒冷饭拼凑成一部电影。再来，宫崎骏的原则是不做那种只需打败恶棍世界就会恢复和平的电影，但本片恰恰就出现了纯恶的大反派，这直接导致了影片落入俗套。
410,天空之城,1,男女主角纯真的爱情深深感动每个人。
411,天空之城,1,各种情节上的白痴也值得称得上是最好的宫崎骏吗？开挂男主最受不了，当人类是野人还是猩猩？为爱而开挂这种日式老梗原来那么早就有人在玩了，那人还是宫崎骏。
412,天空之城,2,1986年真的算是个很棒的故事 但是今天看起来剧情拖沓得要死 根本没什么意思。。。。。。。（我看过这部电影 2012-06-29 ）2019年又看了一次，觉得想给一颗星，看样子我的审美从始至终都没有变过……
413,天空之城,2,我记得。躺在床上的深夜。我一直没有看完它。然后删了。09年。
414,天空之城,2,好莱坞冒险动作片，桥段设计一般。人物过于简单，相比还是后期《哈尔》，《千与千寻》更有味道。
415,天空之城,2,  分两次看完，时至今日才看完，且倍速播放。不喜欢宫崎骏的电影，剧情较无聊，龙猫也好，千与千寻也好，这部电影也罢，确实剧情太无聊，观感一般。一星给完成度，一星给久石让。
416,天空之城,1,除了音乐 = = 完全不晓得有什么好看的啊
417,天空之城,2,这种早恋的片子，在大陆应该禁播！
418,天空之城,2,我应该是少数不喜欢这部的人吧，整个剧情都好无聊，比较有意思的大概是启发了钢铁巨人，还有让久石让得以扬名全世界吧
419,天空之城,2,略无聊，镜头切换不自然，剧情也狗血，狗血就算了还不感人
420,天空之城,2,正想着要不要补一下的时候发现两年前自己看过了，一点记忆都没有，果然除了魔女宅急便以外，我就是宫崎骏一生黑
421,天空之城,2,据我观测，爱看动漫的人都比较乐观~ 可惜，谁能告诉我这有什么好看的！！
422,天空之城,2,我是真他妈的受不了宫崎骏啊
423,天空之城,2,够了，累了，我再也不想看宫崎骏的电影了。不欣赏就是不欣赏，非得跟榜单较劲干什么r(s_t)q 说是思维方式差异也行吧，我看不得反生理的动画片，尤其讨厌比小强还小强的角色，砸不坏打不着，想抓住什么就抓得住，搞得好像万分惊险但是总是能反生理机能地脱离险境……
424,天空之城,2,来听歌的。
425,天空之城,2,这部真是难得的不喜欢，可能还是时间太久了，节奏太慢，画风不爱，人物个性模式化，有几个地方的情节交代太仓促，各有所爱吧。
426,天空之城,2,尼玛困死我了
427,天空之城,2,除了音乐 我真的找不到喜爱他的理由 也许理由是他的年纪竟比我还要久  日本人的笑点还是一样的奇怪 呵呵
428,天空之城,2,一定是我的世界太不单纯了，所以对这种美好纯真的东西无感
429,天空之城,1,“我的头比我的拳头还硬”。。。。。。
430,天空之城,2,我就是看不来宫崎骏
431,天空之城,2,只有那音乐
432,天空之城,1,能坚持看完挺不容易的。
433,天空之城,1,如此无聊的一部电影动画电影，配音难听，画面奇怪，日本动画的那种难看的风格，分数太高了，那么多人喜欢么？
434,天空之城,2,get不到感动点
435,天空之城,2,天空之城的音乐太出名了。家里面的八音盒还是它，可是我对宫爷爷的表达还理解不够，他对细节、情感的处理…都说不同年龄看会有不同的感悟，以后再看，希望可以稍微理解一些
436,天空之城,2,早知是战争片，我就不看了。
437,天空之城,2,8.9.。。。。。。。。。。。。。。
438,天空之城,2,最令人伤心的永远是机器人 所有人跟它们比起来 总有这样那样的不好...... 这故事也未免太低幼 太无理了 着实是令人捉急 // （第一部喜欢不起来的吉卜力）
439,天空之城,2,ＡＬＩＴＴＬＲ　ＢＯＲＩＮＧ
440,天空之城,2,总觉得宫崎骏的动画无论是人设还是剧情都太过一厢情愿，让人严重缺乏代入感
441,天空之城,2,本来想说因为名声太盛打个一星，还是只冲电影打二星吧。宫崎骏几部热血青春电影都不喜欢，人物太模式化，情节夸张老套，配音造作，主角一会小孩一会少男少女，无法忍受。主题曲也没觉着多好听。
442,天空之城,2,留下印象的大概只有画面和想象力…              童心退化了吧04 其他无感
