,movie,star,comment
232,美丽人生,3,美影m有不少粗uE造之作，但在H影I上有着o可匹车挠绊力，始K有其道理。若]有W斯卡的光h，若非{粹盒薪腥松窆，也不看在真可鄣男『⒎萆希便再找不到理由相信@右积i陋的意大利影能成槭澜绶Q的佳作。
233,美丽人生,3,战乱中也应有的乐观
234,美丽人生,3,啊……竟然没有被感动。尤其前面男主追他媳妇儿的情节好无聊啊
235,美丽人生,3,感觉铺垫太长了，虽然看到一个伟大的父亲的爱，但是不知道这样的谎言对于孩子算不算是好事。另外，女主角很漂亮。
236,美丽人生,3,对意大利人这套没有太多的感触，可能这玩意儿越想越感动吧。
237,美丽人生,3,小聋瞎的德军，可随意走动的集中营，一个随便就能戳破的谎言却维持至终，男主想要的巧合全都会发生，或许是一种绝境中浪漫主义的表达吧，但这让二战变成了一个虚假的布景，让我看了如鲠在喉。主角非常夸张的表演也不是我喜欢的。
238,美丽人生,3,这个父亲明显就是个骗子，花言巧语的男人最可恶！
239,美丽人生,3,话剧都不会演得这么夸张。打高分的人请真诚到永远好吗？
240,美丽人生,3,可能 因为是喜剧片，感觉还不是很震撼，不过贝尼尼的表演的确很棒哦，如果真的能做到如此心态，人生真的很美好！
241,美丽人生,3,用喜剧的形式讲一个集中营的故事，我对此感到相当不适。贝尼尼表演得也太傻了。
242,美丽人生,3,就是专门骗人哭的，看人哭成一片我就没语言了。
243,美丽人生,3,悲惨的电影多了去了，饱受苦难的民族的故事也多了去了，偏偏犹太人受苦就让大伙都感动了，如果男主角不是犹太人，换成其他民族按着模板拍，这电影可能都没有六分，剧情太平庸很无聊，演技浮夸很出戏，个人而言，这部电影就值六分。
244,美丽人生,3,伟大的父爱，喜剧中乍现悲剧之力量
245,美丽人生,3,集中营里的美丽童话，最后一幕为之动容
246,美丽人生,3,感觉不是那么好。。。有一些说不出来的精巧和刻意，又有很多显而易见的漏洞，让这个童话般的二战反思故事感觉只像一个童话那样别扭。。。（叔本华在这里的反讽效果还蛮奇特的。。。）
247,美丽人生,3,和神片有差距，真没觉得特别出众。
248,美丽人生,3,原谅我说实话：煽情的痕迹太重，我这样想着，就连捧场的眼泪也流不出来
249,美丽人生,3,"我无法相信我中学时代是带着怎么样的豆瓣高分、影史经典的滤镜把他俩进入花房前的故事熬过去的98前半段的喜剧完全对我不起作用。
电影里只呈现了他的乐观，没有呈现他这种乐观主义背后的不安，他好像真的没有敏感性一样……但犹太人也是有历史记忆的啊，排犹又不是一次两次的事情…
所以我一直在纠结剧作设置了这样的聪明人，但到底有没有设置一个锚点是他意识到危险可能来临。
当然后半部是一部很特别的集中营电影，但是和前面的浪漫但对我无效的喜剧连接在一起，对当下的我来说，有点勉强了。"
250,美丽人生,3,我要和你做一辈子的爱，是我听过的最真诚的表白了
251,美丽人生,5,"《你好，公主》
第一次看时，或许是没有看懂或者看得不深，没有觉出电影的好。
后来，经历了多了，才发现这部电影的弥足珍贵，有浪漫的爱情，也有捧腹的喜剧，有感人的亲情，也有残酷的战争，仿佛是苦难人类史的一个集中呈现……"
252,美丽人生,3,绝境中的乐观“假乐观”更让人心疼。看完久不能语。但也的确不喜欢这种叽咋性格的人，的确也应了热评中的“看了辛德勒名单不要看这个”。电影很多场景幸运得显的虚假。
253,美丽人生,3,意大利语，还真是忙叨人
254,美丽人生,3,亮点是贝尼尼的演技和小男孩 这部片子蛮无聊的 而且跨度太大剧情衔接的并不好 荒诞式的幽默恰恰又是我最讨厌的 唯独主旨核心渲染的不错 奥斯卡代表作无非如此 为了伟大的父爱和乐观的态度三颗星
255,美丽人生,3,去年此r王彬的n堂上，曾坐在最後一排看^，可惜睡^去了。今天重看此片，技巧K不突出，故事不e，很多小O上很巧妙（有浊孩子呢；早安公主；p手]影l]魔力），但也正因如，此降低了故事的可信度。事先知道Y局所以y免冷漠相ΑＪ俏Я艘徊亢闷子。
256,美丽人生,3,高中看很喜欢，后来觉得有些媚俗的嫌疑
257,美丽人生,3,在亲情面前，历史变得一文不值。但是我真的很讨厌Guido。。
258,美丽人生,3,主题太严肃，解构的太轻盈，去掉二战的背景光做一部喜剧会比较好。【爸爸没有叔叔可爱，贝尼尼像猴子一样上蹿下跳，叔叔台词寥寥，但是气场杀人！】
259,美丽人生,3,只是觉得还成 预期被人为的拔高了....真没觉得 好到能排在这么靠前的位置.....imdb的排名和分数还是比较靠谱的......这真不是乐观 而是少了根筋....这种法式幽默真的很无聊....看完没有觉得一个地方是好笑的
260,美丽人生,3,手法比较古老，呼应确实特别到位。以为会看哭，结果一直笑到最后。另外作为一个每天洗澡的孩子深觉活不到坦克开来的那一天。。。。
261,美丽人生,3,不怎么曲折的剧情，缓慢的节奏，实在无感、
262,美丽人生,3,一点没感动，反而觉得很夸张…
263,美丽人生,3,用黑色幽默，戏谑嘲弄的手法，表现一个民族的苦难，父亲编织的比赛谎言，都有一一对应的现实，很巧妙的编排设置。刻意抖包袱，表演太过火，温情的光环淡化战争的残酷，甚至法西斯看起来也不是那么十恶不赦。抢了权贵的老婆，还能在当地没羞没躁地过起幸福的生活。这美丽的人生啊，终究只是个美丽的童话。
264,美丽人生,3,一定不是我的错....
265,美丽人生,3,影片要塑造的一定是一个聪慧、机智、勇敢、为家人牺牲的男主人公。可惜，我只是觉得他荒延走板，行经语言古怪难受。更甚还癞蛤蟆吃着天鹅肉，破坏了别人理应美好幸福的人生，徒徒留下一对孤饵寡母。我不是男性，站在纯女性的角度，这真不是一个美丽的故事。唯一的 大爱便是那可爱的小儿子和最后出现的坦克手。我只会喜欢英俊善良的坦克手，虽然一直被身边的人说怪，但实在无法忍受男主的乱七八糟饿~
266,美丽人生,3,可惜傻人有傻福这句话没有在最后体现!
267,美丽人生,3,无感。前面一节有点太过多余和拖沓了。这应该是我第一部无感的公认好片。
268,美丽人生,3,为什么这么高分？
269,美丽人生,3,看的太迟了。。。没意思
270,美丽人生,3,小时候看只觉得好玩，长大再看一遍，才体味父爱的伟大
271,美丽人生,3,我只看到一个油嘴滑舌的男人而已
272,美丽人生,3,一个开头很幽默，中间很悲伤，最后很悲伤很悲伤的故事。一个快乐的男人，一个小人物，一个努力保护自己儿子的伟大父亲，一个努力保护自己妻子的伟大丈夫，还有一个深爱自己丈夫的妻子，在这样的时代里，只能用自己一点微弱的光芒，照亮人生。
273,美丽人生,3,首先男主（原来就是导演）真心不好看。然后电影前后脱节颇为明显，承接不足。但后段不错，主要是对这种题材没什么抵抗力，不过就没到非常感动的程度。
274,美丽人生,3,战争中的传奇，历来是好电影的源泉，但我不大喜欢这种过于浪漫化的呈现手法，让残酷的丑相若隐若现，其批判的锋芒也就显得遮遮掩掩。何况本片前后两部分的风格反差太多，前半部分的男主简直话痨版卓别林。若是铺垫，太过赘余，而后集中营部分的描写过于简单美化，对于不了解历史的人，难免有误导之嫌。
275,美丽人生,3,没有预想的那么好啊。
276,美丽人生,3,善意的谎言，也许这根本不算是谎言！
277,美丽人生,3,又看了一遍，重映版本，可能长大了（15年我也成年了，但我总觉得时间好漫长啊），也没那么容易被这样的角色感动了。他就像一根火炬一把插进雪里，这既是本片的看点，也是观感上的短板。人物如一根柱子直直竖立在那里，岿然不动两个小时，引领不了人的共鸣，也无法让人同情，其他的角色只是配合他表演，所以，哭不出来了，会觉得：他好疯啊。剧作上的各环相扣，像一场游戏，很妙，很妙。可是感人的那部分，激昂的那部分，好像消失了。到底去哪里了呢…在看了一个短片导演的解读后，好像知道怎么解决这个硬伤的方案，在电影中，人物要有弧光，像主角这么特别的人，需要有一个被他感染而改变的人也体现这种弧光
278,美丽人生,3,还好 之所以不太喜欢 因为实现可能性几乎为零 就像我不喜欢穿条纹衫的男孩一样。太小看纳粹的管理了 小孩会没有编号？胡乱广播＂我的公主＂会没事？破衣烂衫的犹太小孩能冒充纳粹小孩？连辛德勒名单都被诟病真实残酷不足 遑论其他呢？即使我知道这是写意的小品 也认可父亲对孩子心灵
279,美丽人生,3,老实说 前半段我实在是看不下去了~ 后来~ 一个开朗以至于二的父亲…
280,美丽人生,3,在一起就是个错误，那个男的我怎么这么烦他呢，油腔滑调的
281,美丽人生,3,海德格尔所谓的诗意的生活，我想就是如此的。
282,美丽人生,3,乐观与向善是可以改变命运的态度，在哪里都是这样吧。意大利人说话时候的身体语言太容易抓走人的注意力了..
283,美丽人生,3,感觉过誉了。也许是我更喜欢写实的以纳粹为背景的电影吧，这种BUG满天飞的电影真心让我看着痛苦。不喜欢话痨。煽情的地方不多，触不到我的泪点。
284,美丽人生,3,故事很好，但太嗦太加长了
285,美丽人生,3,温情，却不是我喜欢的风格，我要的是，看清生活的现实后，仍旧勇猛面对。男主对生活的乐观我很佩服，也很喜欢，或许有意大利式的浪漫主义在里面，与这样的人做朋友，真是幸事。但是，电影的剧情硬伤太多，一个如此聪明的人，做了侍从高级岗，却没弄清楚老婆的情况。一切为浪漫主义铺路，不是我要的乐观
286,美丽人生,3,前半段很喜剧。最后被带走枪决的父亲仍在躲在箱子里的孩子面前表现得快乐乐观，着实让人感动。但整得来说，我还是觉得太假。我不喜欢谎言，即使谎言是美丽的。更不喜欢最后这 happy ending.
287,美丽人生,3,上课时听同学讲了这部电影的故事 当时觉得很震撼 故事本身的魅力打动所有人 加上片子本身的名气 看完之后却很无感 达不到自己的预期 父亲用谎言给孩子编织成的一场梦 爱情与亲情筑起的美丽人生 电影用喜剧的形式使悲剧的色彩不那么浓烈 表现手法过于浪漫主义 真实在童话里失去了价值 ★★☆
288,美丽人生,3,2.5。癫狂式的话唠，不停的给自己心理暗示告诉孩子这个世界不是真的，所谓的正能量被过度的爱诠释到极致，我被这种气场压制到不敢对电影说不喜欢是什么心态，看来爱永远是自私且深刻的话题。
289,美丽人生,3,看来心态很重要，如果没有那么乐观的心态怎么能战胜苦难，迎接新生呢？
290,美丽人生,3,一般，前面的搞笑挺无聊的，小男孩很可爱
291,美丽人生,3,不喜欢男主这种人，笑料也有点无趣（当然这也没办法，老电影了），小朋友在那种环境下能不能那么相信老爸的话还是存疑的。虽然是喜剧还是要讲个合理性问题。除非是周星驰某些喜剧。和男朋友看的第二场电影。
292,美丽人生,3,也许是因为意大利语，我真是太讨厌这语言了，不然这就是个完美的故事啊……
293,美丽人生,3,两次看都是一样的评分，利用卓别林、巴斯特基顿式的小人物大生活的拍摄方式和托纳塔雷式的意大利传统反战电影叙述模式，讲述一个感人而充满趣味的作品，一分为二的做法在同类题材里不算新鲜，不过求爱的前半部分确实有趣，后半部分情绪渲染不够。。。适合女性和孩子观看
294,美丽人生,3,影院看的重制版，也许是因为时代差异，老实说低于预期。后半部分进入集中营后的情节很动人，但前半部分的爱情喜剧片实在尬到我坐立不安。网上查了一下是1997年的片子......还挺近的，那为什么会有一股强烈的早期歌舞片的浮夸风格呢....还是意大利人撩妹就是这个套路？？？再怎么说前半段喜剧风格是为了衬托后半段的悲剧结尾，我依然被男主追求女主时一系列做作的巧合给尬到了。好在后半段情节确实巧妙且感人，拉回平均分。出了影院大门，我问汉子感觉如何？汉子沉默片刻，问：“这女的为什么会同意嫁给这个男的？”――真是同一个家庭，同一个困惑。
295,美丽人生,3,你是侍应，不是下人，服务需要高度艺术。上帝为人服务，但上帝不是下人；愈多愈看不见。黑暗；一提到我我就消失：沉默；妈妈，一千分，我们赢了；我想和你做爱，现在就做，做一生一世；前面的铺垫有点长了；
296,美丽人生,3,小时候看感动到不行，现在看是觉得太天真了。对二战集中营的刻画是悬浮的，男主（或说创作者）不假思索和不计后果的盲目乐观却能为他赢得和保住几乎一切：美人的心，孩子的童真，屡次破戒却能保住性命，甚至在集中营为妻子公放情歌……所有真实的残酷都因主角光环让步，二战被简化成几块喊累喊饿的幕布
297,美丽人生,3,06-03-15：觉得一般，难道说我越来越没人情味了？？
298,美丽人生,3,我心肠硬，看不下去。。。。。。
299,美丽人生,3,起初反感圭多的无厘头式疯狂。偷帽子、不会开车就上路、还冒充审视人去误导小朋友……觉得他的所作所为是胡来。直到与儿子一同被关进集中营，他的无厘头帮上了大忙，编织的谎言让儿子充满希望并生活在快乐之下，对儿子对妻子的爱在囚禁时仍如此乐观，慢慢喜欢并理解这个人物了。
300,美丽人生,3,爱情之上才是亲情。温柔的谎言，才能让你勇敢面对。这世上最动人的情话是谎言，那又怎么样，如果谎言是善良的，如果谎言是美丽的。即使是悲剧，也要用微笑着的脸来看。生活并不完美，并不代表他不美。最深沉的父爱是对孩子心灵的呵护，即使生活在兵荒马乱中，也会为你展现世界的美丽。早上好，我的公主
301,美丽人生,3,像阿甘一样，受到赞誉太多，反而看后会有落差。挺普通的一个电影，关键在于主题。是有原型的么？那这个父亲很伟大，身边的人也真的很配合。逃出生天很幸运，悲惨已可见一斑。“早安，我的公主！”真乐观。
302,美丽人生,3,天然去雕饰，在这个越发怀疑一切的时代中，我们如同片中其他的配角众生看怪物一般端详着这个纯粹、真诚、热情的灵魂。主人公全片都用微笑和小机灵面对世界，却从没人尊重他不羁的心灵以及这个心灵承载的流泪的众生。结局略显仓促，结构略显朴素，艺术略逊一筹，为一凡人却足够伟大
303,美丽人生,3,"2009年6月14日3:30:13
"
304,美丽人生,3,……十分政治不正确的不喜欢这个电影，前半段和后半段都假的要命，除了那个小孩每个角色都很假啊！并没觉得有多感人？？男主好聒噪上蹿下跳强行冷幽默不成，看的闹心死了，全程基本都要靠快进的。。。我还以为这片子是五六十年代拍的，一看都1997年拍的了大吃一惊。。？？？？
305,美丽人生,3,片中有些不喜欢的地方，所以只给三星，但它表达的东西还是很深刻的
306,美丽人生,3,刚开始觉得男主角疯疯颠颠，后来发现这种见风使舵的韦小宝配上娇滴滴的公主也还不错，挺愉快的一搭配，女主的”只要你找到了正确的钥匙，我就会对你唯命是从“的心态多典型的。
307,美丽人生,3,感觉意大利语真尼玛难听
308,美丽人生,3,本来准备给两星。但看到坦克出现的那一段，心里紧了一下。这部电影评分高的原因是它所表达的主题吧。没想到男主角还是得死
309,美丽人生,3,"之前试图看了好几遍,没有看下去.这一次前半段也几乎看不下去.直到瓦多迈着滑稽的步伐给儿子看,走道胡同处被射杀,我才回味整个电影的味道.我是个的的确确的重口味!"
310,美丽人生,3,在战争极端环境下，最考验人性的时刻，父亲用他自己的方式保护着单纯的心灵。废墟上最为美丽的而感人的游戏规则。
311,美丽人生,3,可能被传得太经典了，期望太高不免有落差
312,美丽人生,3,故事本身立意角度都好，但是我总感觉像在棚内拍摄，景不真切。男主的表演过于夸张滑稽，电影本不是喜剧。
313,美丽人生,3,充满了不切实际的幻想
314,美丽人生,3,还行，不过不大喜欢完美的温情结局
315,美丽人生,3,童话外表的悲惨世界。
316,美丽人生,3,3.5/5。电影最后一幕感动了我，父亲的爱让这本是悲剧的遭遇变成了喜剧。
317,美丽人生,3,太主旋律太做作
318,美丽人生,3,意大利语话唠式幽默从一开始就让我无法完全投入这部影片，全片对生活爱情亲情都表现出了十足的意式浪漫，LIFE IS BEAUTIFUL！
319,美丽人生,3,#美丽人生#这么让人恶心的电影竟然把很多人看哭了，集中营这么残酷的事儿竟然搞得跟过家家似的，编剧卖弄的不得了每个细节都搞成铺垫，鸡蛋，钥匙，白马，帽子。。。有事没事就拿父爱说事真无耻
320,美丽人生,3,天Y不行不要b女b大佬……
321,美丽人生,3,我倒觉得他儿子的人生更美丽点…
322,美丽人生,3,过誉。平庸的喜剧和喜剧的平庸。
323,美丽人生,3,住宿条件比我们寝室都好。
324,美丽人生,3,看了个字幕对不上声音的我晕，小男孩好萌，他爸死的乱七八糟的么
325,美丽人生,3,这逼片分还挺高
326,美丽人生,3,虽然我不太喜欢 甚至有些失望，但不得不承认这么高分的电影还是可以让人回味的.第一次从电影中感受集中营的残酷，但又太理想化了 德军有点过于低智商 能任凭父亲来回在集中营里穿梭，而且剧情有点太简单了 一直是父与子的戏 而忽略描写了这个环境 其余犹太人对于这对父子没有反应吗 相互没有互动吗？这点很遗憾，所以能量还是有点小.男主演的不错 女主和小孩没演技 眼睛空洞得像盲人一样.最值得咂么的还是医生和那个被洗脑的机器――眼睛瞪的很吓人的那个德国女军官.
327,美丽人生,3,"看了一个短视频 一男的假翻译德语 有趣 待考。
2019.12 看完，97年的电影放现在的视角会产生各种吐槽。豪门家小姐与落魄逗比男结婚，家族竟然没有任何人插手放任自流，不合理。男主放浪形骸，走一步是一步，全凭运气，竟然还有人欣赏，不合理。集中营里那段翻译、盗用广播还没被抓住更是不敢想象，不合理。毕竟20年前的电影，已经不符合现代的审美和逻辑"
328,美丽人生,3,意大利语的语速怎么那么快。
329,美丽人生,3,也许是意大利语太过欢快以至于刚开始我觉得男主有点蛇精病的感觉，可是他的一句‘早安，公主’现在想想真是全局最美丽的地方。剧中真性情的姑娘终会有绿马王子，还有他们的儿子萌呆萌呆的都要虏获我这个怪阿姨了。可惜历史终究是历史，终有一堆人成群结队死去，故事也不仅仅只是这一个。
330,美丽人生,3,并无什么感触与欢喜，感觉网上对此片一片五星好评不免浅薄。我喜欢与赞赏严肃地展现真实的残酷的历史的文艺作品，悲剧总是很有影响人心的力量。
331,美丽人生,3,首先赞扬父亲的乐观和对家人的爱，这样的人生虽然短暂，但是是一个充实欢乐的一生；当然我也有看不下去的地方，感觉战争的残酷完全就可以被他的插科打诨和一些拙劣的小把戏混过关似的，所以后面剧情看着是那么的不真实，在整个大环境虚构的时候，里面的人物就有一点假，即使表现的很高尚。0322-13:38
332,美丽人生,3,我认为的名不副实电影第一名
333,美丽人生,3,好吧，喜和悲都无法触动我
334,美丽人生,3,最具亲情的黑色幽默。
335,美丽人生,3,1开始看非常爽感慨电影这一形式应当归属于意大利2因为害怕看到集中营的镜头故意把自己代入被骗小孩的视角反而是特别棒的体验3过分煽情不留白乃是另一种谄媚4细节不怕多，细节多是值得赞美的
336,美丽人生,3,二战的题材 都感觉阴沉 男主角的乐观 使整个电影的主体  但着实我对我的胃口 一般的电影 后半部分有些沉重
337,美丽人生,3,小时候看过就记得男孩看到坦克就结束了，今儿电影频道看了竟然没有感觉，兴许是没完整看完的缘故吧
338,美丽人生,3,挺感人 就那么回事
339,美丽人生,3,太老了。情节好
340,美丽人生,3,感觉一般的经典电影 证明了我是冷血动物=。=？
341,美丽人生,3,居然是夫妻档，赞。抛开前一部分的抖机灵，其实挺幼稚的。并且之前的巧妙使得集中营中的苦中作乐更显平淡。
342,美丽人生,3,学意大利语四年都没看，毕业第一年终于看掉了。可能这种风格的电影还是不适合我。看到前面这么开心就知道后面一定会悲剧...果然。不过看到结束我都没有特别感动或者特别难受的地方，也没觉得这部电影有好到豆瓣电影250竟然排第五的份上。说它好看的人，一定没有看过《穿条纹睡衣的男孩》。
343,美丽人生,3,我不喜欢！艹。奥斯卡真他吗让人蛋疼。这届应该归楚门的世界！
344,美丽人生,3,喜剧的太过分了。
345,美丽人生,3,"你是公主你会嫁他吗？不能！
猜谜的德国医生 真讽刺
如果你是犹太人，要被歧视要被抓走，也真没办法，只能发生任何事，都熬过去。
一切有组织有规模的罪恶，多么可怕，无论被战胜与否，都始终是破坏的，希望邪恶消失，不再存在人为苦难的威胁。"
346,美丽人生,3,1.3@寰映合生汇 一度想给2星，没看出这导演有啥才华，倒是挺自恋。“经典”重映这么一本万利肖申克阿甘辛德勒还不赶紧安排上。
347,美丽人生,3,https://movie.douban.com/review/10323257/
348,美丽人生,3,一个美好的童话，但边看边因为影片的现实性（过于夸张荒诞）而出戏。适合作为舞台剧来上演，没法与《辛德勒的名单》相提并论。
349,美丽人生,3,故事很好，人生观也很好，入不了戏。
350,美丽人生,3,I don't like it. It's honestly so not weighted it felt tacky
351,美丽人生,4,“没有人的人生是完美的，但生命的每一刻都是美丽的。”第一遍看是那么得感人，笑着笑着就突然哭了。2020年1月，大荧幕重刷：①字幕翻译类“阉割”；②前半段细节上是完整的，但后半段有部分无用剧情（细节）；③低龄向的理想主义集中营呈现，大概是最为大众的二战背景经典影片。
352,美丽人生,3,相同题材的，我更喜欢辛德勒名单和钢琴师，那个父亲是伟大，但是表演的方式实在欣赏不了，用喜剧的方式演绎悲剧，悲喜交加的感觉并不舒服，前半段的那种幽默get不到点，反倒觉得男主角二了呵的。
353,美丽人生,3,撑过前50分钟就是绝对的好电影。
354,美丽人生,3,好故事但拍得实在有点烂呀
355,美丽人生,3,豆瓣怎么这么多装逼犯？草泥马天天在感悟人生 尼玛喝杯水你都能感悟人生
356,美丽人生,3,看评分这么高，本来抱很大希望，片子是不错的，但我就是对这种类型的不感冒。
357,美丽人生,3,剧情非常感人，但我不喜欢贝尼尼的表演－＝
358,美丽人生,3,故事本身不错，但导演的为什么老把一句台词说明白的事情，非得编十句来叙述。很简单的故事，精简一点会更好。
359,美丽人生,3,带有残酷的战争的童话.....  我没有太多的触动. 是自己要求变得苛刻了? 还是我已经不愿去相信童话了.
360,美丽人生,3,我知道这不现实，结局孩子的笑还是狠狠地感动了我！
361,美丽人生,3,没那么邪乎吧？那些让你哭成傻逼的电影推荐，想哭一鼻子怎么就那么难呢？
