,movie,star,comment
362,美丽人生,3,#UA梅龙镇广场# 3.3分。严重过誉，善意可敬、执行则太轻率。大银幕二刷时更强烈地感觉到，后半段男主那些必然招致惩罚甚至找死的行为，其“浪漫主义”并不在童话/谎言的视角内，严重削弱了对纳粹高度理性的刻画、进而削弱了这个故事本身浪漫主义得胜的动人可能。剧作没能说服我，这座并非在童话/谎言里的残酷的集中营为何只对男主如此“仁慈”甚至软弱。
363,美丽人生,3,也许风格的问题，没传说中的人生美丽
364,美丽人生,3,这是作为一个父亲和丈夫的完美诠释 当然并不是生活中所有的人都是这样的
365,美丽人生,3,浮夸的演技和搞笑风格大大削弱我对电影情节本身的关注，实在是忍不了~
366,美丽人生,3,这部电影评分高的原因在于父亲对儿子的鼓励和爱吧。不过全片的巧合点太多，初看做作，但是到后面的呼应以及寓言方式让我觉得童年读童话故事的感觉极强，一看它是意大利电影就顺理成章了。电影男主角除去他的乐观和对儿子爱之外，他身上的很多地方在现实生活中应该很招人烦吧。
367,美丽人生,3,男主的说话技巧我要好好学习下，我要看看“说话的艺术”这本书去。我觉得男主的说话技巧是不直接反驳你，而是从侧面引导你，直到你认识到自己的错误，这样就不会因为直接指正别人的错误而得罪别人，真是一种好的说话技巧呀，我要好好学一学。
368,美丽人生,3,为什么我觉得这个男的好烦。是我打开方式不对吗
369,美丽人生,3,在艰苦的环境中，才能体现乐观的重要性。电影前半段挺无厘头的，直到一家人进了集中营，剧情有了转折，才变得好看。但这部电影终究是一个童话，没有哪一个漂亮的女教师会突然爱上一个癫狂的乡下人，也没有哪一个孩子能在集中营自由活动而不被发现。我宁可看到血淋淋的现实，也不愿多看编织的童话
370,美丽人生,3,【PS：19.12.26 豆瓣9.5[78.1万] 好友8.9[140]】
371,美丽人生,3,在美国人要发起战争那一天看美国人挽救了和平的电影让我很出戏
372,美丽人生,3,反战的思想不希望被一个浮夸而单一的故事来传递，这回使人忘掉战争中的复杂性，而当人们能认真思考其中的复杂性才是真正避免重蹈覆辙的首要条件。很多人说这是寓言，但寓言往往是用来说明一个简单的主题，而战争的复杂不是一个寓言能说得清的。
373,美丽人生,3,"经典两段式电影（废话人家都TOP250的第五名了当然经典），可是这真的是那年奥斯卡？觉得表现平平。有一些梗让人觉得很甜，大概是下了很大功夫。
是一部没有必要和需求看第二遍的电影。
看了一下打三星的居然只有0.3%
那我也不改"
374,美丽人生,3,我有点点绝得 做作  感觉有点点像大笑姑婆
375,美丽人生,3,才x修n上看的，我是半睡半醒著的B，]撒感X。
376,美丽人生,3,意大利人划船不用桨，全靠浪…这个童话当然没有现实的可能，是否消解、消费了困难呢？我宁愿看一个德国看守骗他或她的儿子，这是个游戏，更能体现阿伦特说的平庸的恶…
377,美丽人生,3,前面部分挺无聊的。。。冗长了点，烫头发的时候看的
378,美丽人生,3,还凑合，小孩子很可爱。社会背景的认识不同，很难有共鸣，没豆瓣说的这么高的分吧？
379,美丽人生,3,没评论说的感动
380,美丽人生,3,世界就是个游乐场，人生就是一场游戏
381,美丽人生,3,话唠电影。
382,美丽人生,3,不知道是因为我没认真看呢，还是怎么着，完全不记得情节了！
383,美丽人生,3,父亲节，伟大的父爱，意大利人都是情种啊=。=
384,美丽人生,3,看时一直在想如果把孩子设定成三岁显然更能让我相信他真地相信这个故事，可三岁的孩子显然又没有足够的自制力能让他听话地在床顶床底藏那么久……
385,美丽人生,3,很温情，男主是个负责而幽默乐观的人。以长大后的男主儿子的口吻讲述了当年父亲的伟大牺牲，在片中再出现视角转换，不是很懂为啥要这么干。。节奏上来说，前半部分主要铺垫一些男主的人物，营造轻松欢快的氛围，后半部分与前半部分的欢快做对比，父亲把集中营当成是一场游戏叙述给儿子，不卖惨我喜欢。
386,美丽人生,3,明天就是颁奖典礼。在历史真相面前不可能有这样的轻松与浪漫。更重要的是我并不喜欢这样话痨癫狂范儿。
387,美丽人生,3,好人不长命，祸患留千年
388,美丽人生,3,前面都行，但我不喜gY尾，^度渲染的悲觯^度了。意大利人做得丫罢娴氖蔷@又大
389,美丽人生,3,同这样一个父亲，丈夫在一起，每一天都像是在冒险，过童话里的生活
390,美丽人生,3,真不懂5分是怎么打出来的 稍带诙谐的 拿着二战那动魄的岁月为幕布的小故事罢了
391,美丽人生,3,难道是我没理解导演的用心？
392,美丽人生,3,也许这几年看过几部不同角度二战大屠杀电影，所以对于把悲剧隐藏在细节不再惊喜。导演没有费笔，有很多细节前后呼应。但是对于后半段理应很感动的地方，我却没有什么带入感… 有一些情节设置或情感让我觉得很不真实。
393,美丽人生,3,终于终于看了这部大名鼎鼎的奥斯卡最佳外语片。不知道为什么，我好像没有如预期的那样被感动到。9.5的豆瓣高分....我可能不太认同电影前半段（二战前）的部分，或者是因为我内心从来就不认同太明显的虚构和幻想。
394,美丽人生,3,故事结构的划分太奇怪了，1/2爱情片，1/2亲情片，又喜剧又战争，哪一个都不是诠释的很尽致，落到结尾又变成了儿子的传记，跟《杀出个黎明》有一拼了。
395,美丽人生,3,犹太哥们儿讲故事能力逆天了。。。
396,美丽人生,3,美丽人生~~画面太老了看不下去了~~
397,美丽人生,3,说实话，看片之前我对此片真的很期待，但是看后失望之情还是淹没了自己，不得不说，看多了关于二战、纳粹集中营的电影，已经习惯了充满人性张力，紧张而较具写实风格的电影，对这种过于理想化的童话式表达已经无法为其所动，建议是看此片要慎重，不要期待过高
398,美丽人生,3,不太喜欢，太嗦了，假装很机智的样子，完全可以看成是一部潘磕嫦记！！！生活可以无厘头，也需要机智，但是要适度。。。is it true？
399,美丽人生,3,父爱伟大，9.5评分过誉了吧
400,美丽人生,2,恶俗、经不起推敲的细节，俗气无比的结构，满嘴跑火车的男主加上智商为0的德军，难怪频繁出现在“最过誉影片”之列。我不会说我分了两次才看完，其中还忍不住关掉一次，换成【八部半】看了半小时。
401,美丽人生,2,看不下去，实在不喜欢男主这种夸张深井冰式的表演，让我想起了邓超。。
402,美丽人生,2,"我不是很能接受严肃题材喜剧化的处理手法，我明白导演以喜剧写悲剧的意图，但我感受不到其中的力量。男主的话痨和只放不收的粗糙表演严重影响了我对故事的共情，后半段的有些所谓浪漫桥段简直是败笔。
给痛苦涂上一层所谓温暖仍不能改变其为痛苦的实质，有时反而会掉入自己编织的迷梦之中，我宁愿清醒而痛苦地走向毁灭也不愿带着不明不白的乐观迎接死亡。
这是我为数不多的无法认同的经典电影，可能以后会有新的感悟吧。"
403,美丽人生,2,父爱是伟大的，但战争不是父子游戏
404,美丽人生,2,2020.01.05 4k修复影院重看 5-2-1 非常惊异甚而愤怒。后半段为了延续前半段的喜剧风格而选择继续用夸张的表演和谎言来对比掩盖或粉饰集中营的残酷，小男孩的存在如恶意炮制的美好幻想割裂着谎言的世界与本该更多凝视的苦难，到最后这种失效的幽默甚至使得那片雾中的骸骨山比周遭显得更像虚妄。死于机枪下的贝尼尼看似悲情却套路十足，结尾美国大兵开着坦克穿过着囚服的人群则更像是导演的献媚心切对受难者的又一次羞辱，令人哗然。
405,美丽人生,2,你有多么坚强才能演这出童话 但我还是不喜欢你舞台剧般的肢体和语言
406,美丽人生,2,我更喜欢《一个快乐的传说》这个名字。讲的是集中营里，犹太人父亲为了保全儿子所做的一切。但是我完全接受不了这种表现形式。讲犹太人，我更喜欢《辛德勒的名单》，讲父爱和牺牲，我更喜欢《完美的世界》。意大利人拍的电影，往往过度注重浪漫，漏洞却跟马蜂窝一样多。前半段有个别笑点，但是总体来说太聒噪了。后半段，从进了集中营开始，完全笑不出来了。哭也哭不出来，因为剧情到处都是漏洞，完全没法代入。同时，男主“胡作非为”那么久都没死，会让我产生一种“原来纳粹也没那么坏啊”的错觉，这部意大利片，算不算对纳粹的一种洗白？
407,美丽人生,1,值得注意的是影片的前半，开场圭多坐在失控的汽车上行着假冒的纳粹礼穿过欢呼的人群，甚至盖过了傀儡国王的风头。他突然出现在本地民众的生活中，宣传着种族优越性，骑着刷上犹太标志的马带走了纳粹的未婚妻。前半的张扬与后半的主旋律存在叙事的断裂。圭多究竟是银屏上的纳粹迫害神话，还是新罗马的余孽？当这个叔本华哲学的信徒大摇大摆的走过广场时，背后的士兵是处决者还是送他躲避美国解放的保护人？镜头呈现的到底是出埃及记还是211基地？
408,美丽人生,2,干嘛扯上纳粹就偏要这番受人怜爱?人物表情总让我想起我朝臭名昭著的样板戏
409,美丽人生,2,故事好压抑！！！！我怎么完全快乐不起来！！！
410,美丽人生,1,这些年看了两遍，这部片子完美的诠释了为什么后来以色列人要称呼死在集中营的犹太人为“小牛”
411,美丽人生,2,为什么在我及其不愉快的观影过程中，脑中总是不断闪现出《地道战》《地雷战》的画面呢？
412,美丽人生,2,一个厚颜无耻猥琐跟踪狂挖墙脚无脑童话故事成功上位。到了集中营玩儿童游戏在德军眼前来去自如直到作死作到嗝屁，然而这部变态高分的电影一直在用两种表达手法反复碰撞把现实与童话想一出是一出地不和谐掺揉，一会无比写实派一会逻辑崩塌你只能当它是儿童剧，根本不感觉有化学反应只有浮夸幼稚和矛盾，这样儿戏的超现实主义风格实在欣赏不来。
413,美丽人生,1,我觉得我会被骂，可我是真心不喜欢。详细说不出为什么，但是看完后我难受，而且并不是那种残酷的好电影带来的震撼心灵的难受。。。。。PS.我真受不了贝尼尼的表演风格和表情语言。。。
414,美丽人生,1,如果说卓别林是一种depersonalization，一种结构主义，这更像是用自恋包装的自恋，除了白日梦之外他并不打算做什么。
415,美丽人生,2,"一边两星一边四星, 两星上太虚。"
416,美丽人生,1,比柳云龙还要自恋的导演，完全感受不到战争的悲惨和绝望，只看到导演镜头下极度自恋夸张且不合时宜的尴尬表演，片名叫《尴尬人生》比较合适。
417,美丽人生,2,除了当他叫他儿子藏起来那一刻 有一丝丝的感人外      没感觉好在哪里！！
418,美丽人生,1,仅有的好感出现在开头的几分钟，后半部分持续不断到结束的跑火车，把男主塑造成了最令人反感的角色之一，以至于在本该煽到顶点的情节处，让人心生解脱之感
419,美丽人生,2,老师推荐了找来看 挺无语的 分了两次才看完 前半段被男主blabla的讲话都快烦死了 小孩长得挺萌 最后美国大兵出来还真是和蔼可亲啊呵呵呵呵 看不了听不懂语言的电影 别扭死了
420,美丽人生,2,太失望了。前面耍小聪明的戏精男主看得很不爽。唯一觉得是男主女主进入花房，小男孩从里面出来的转场很棒。男主可太吵了。以乐景写哀情，乐得有点过分了。不喜欢这种话剧电影。
421,美丽人生,2,对于理性思维的人来说，这是一部在故事上漏洞百出，逻辑上充满硬伤的电影。剩下的只有在这漏洞硬伤下的所谓善良和纯真
422,美丽人生,2,个人不喜欢此类
423,美丽人生,2,格林童话这种残害心灵的东西怎么就把魔爪扩散到成人界了呢？稍有点神奇的主人公，白痴的坏蛋，王子公主般的爱情。还好，最后男猪脚嗝屁了，这大概是全片最激动人心的时刻，那个在眼前唧唧歪歪半天的人总算死了。不过，那个镜头的短暂停留应该能打动些小姑娘们吧。。。
424,美丽人生,2,故事很假很天真。男主角这种人素质很低。整部戏充斥着虚伪做作和无聊。你们说他是为了安慰孩子，那最后他有必要抛弃孩子去找妻子吗？马上就要胜利了，男主角很没有逻辑的犯傻然后被杀。不觉得这个电影有多好。只是里面一点人性的光芒还是有的。也仅此而已。
425,美丽人生,2,里面的罗马街道还是很美的。
426,美丽人生,2,……全篇都以喜剧风格来的，配这么严肃的背景，原谅俺欣赏不来
427,美丽人生,2,"   我有些抗拒贝尼尼的表演方式，他太用力了。但编剧要负很大责任，因为没有足够厚的戏提供给演员。而导演大人也不知道干什么吃的，估计还是没搞懂喜剧是咋回事，所以一遇到这种喜剧温情片就把握不好轻重了。
    剧情上讲，贝尼尼饰演的男主人公和老婆恋爱戏篇幅不算短，但却不够浪漫。别跟我说这不重要。如果集中营给儿子造梦是高潮降临，那么这之前的全部戏份都应该为此做好最充分的铺垫。只可惜编剧的力道不够正点，并且也真的不够深入。
    从喜剧手法上讲，担负搞笑任务的主角人物一定是可轻松使人发笑的（这里包括剧本提供"
428,美丽人生,2,只要牵扯到战争、人性之类的电影多少都会戳泪点或是达到某种共鸣。但是这片看完只觉得是浪费时间！话痨式的表演真是神烦，剧情丝毫没有张力，想通过主角的乐观借以大喜衬托出时代的大悲，又以局势的悲反映人性的善，想法挺好，为什么拍出来是这么一个东西？
429,美丽人生,1,看了半个小时还没进入剧情，打瞌睡都，好吧，我不懂欣赏
430,美丽人生,2,很特别的一部电影。可惜演员实在是演得太烂的，惨不忍睹
431,美丽人生,1,还行吧，疯子演傻子看
432,美丽人生,2,无论如何我都觉得宁愿永远承受沉重和痛苦，也不要这样哄骗自己的心。这片子和少年派一样让我感到不适。
433,美丽人生,2,呵呵原谅我走神多处，总觉得女主角在向着奥黛丽赫本学习，可是不好看也不亲民，还是男主角占人心，小朋友没有完美的世界里的小孩萌，大概是我期望过高。由此看出最多人看的不一定是最好看的，没有差评的也可能是差的。
434,美丽人生,2,看完觉得很失望，失去了战争的残酷也就失去了对比的感动和悲凉。夸张的演技和跳跃的剧情，还有前面一小时的爱情故事（我知道那是烘托），让这个片子变得味同嚼蜡。盛名在外，多年的等待却是这样的结果，片子着实让我失望。
435,美丽人生,1,   豆瓣评分竟比《辛德勒名单》高！完全不理解，对二战的片面刻画太荒诞，竟有人会相信战争里也能有如此美好的事发生，善意的谎言确实体现了父爱无疆，但童话毕竟是童话，只能出现在书里！只有如《辛德勒名单》《钢琴家》哪样面对历史！才能深刻理解战争的残酷！而不是期待战争里《美丽人生》的出现！
436,美丽人生,2,做作，怎么会这么高的分？
437,美丽人生,2,都忘记我看过..太温馨浪漫受不了这种不科学的设定
438,美丽人生,2,"Well, Inglourious Basterds better."
439,美丽人生,2,片子不错吧也许，可是我不喜欢
440,美丽人生,2,]印象。
441,美丽人生,2,前半段值五星，后半段集中营的童话只让我感到编剧的悲哀--集中营是过家家的游戏吗？
442,美丽人生,5,不错的片子，一开始看着感觉为了刻意喜剧而把男主塑造成白莲花的形象，很是反感，不过看到最后，真的是一部好片子，由两星改为五星。
443,美丽人生,1,浮夸浅薄假大空
444,美丽人生,2,如果不是跟很多人一起看 我应该坚持不下来  念台词就跟开机关枪一样停不下来 有点闹心。。
445,美丽人生,2,"无厘头闹剧....真不知道国内外都如此高看这片是为啥...拿犹太人集中营来讲这种无厘头喜剧的父爱是我绝对接受不了的
导演开错了玩笑"
446,美丽人生,2,喜剧啊，看的不多。是悲喜剧。难度很大。
447,美丽人生,2,非常失望，被骗了的感觉
448,美丽人生,2,受不了了，个人非常难以接受这种表演形式和滑稽类型，包括库斯图里卡的电影我也生理上看着就非常不适，看不下去
449,美丽人生,2,"太古老了, 没有看完."
450,美丽人生,2,不知道好看在什么地方，发现蒙上二战色彩的片子都特高分。作为一个活在和平盛世的人，觉得生活有很多非灰色的片子胜过他。
451,美丽人生,1,2.0/10 必须承认其真诚，然而其真诚却是在于它如此真诚和全心全意地陶醉于自身的愚蠢。它不但是暴力的，在这个意义上还是反智的。但是不单单如此，这部片子里还有很特别的东西，它的愚蠢和自恋意外地熔铸出了什么，然而我想不明白了。
452,美丽人生,1,烂成这样的电影，凭什么9.5！？真的气人，害我坚持看完，以为会有什么精彩的地方，结果恶心了我两个小时。
453,美丽人生,2,不喜欢这类型 看前半段我都睡着了..
454,美丽人生,2,为什么这种高分电影我都看不懂呢
455,美丽人生,2,一场游戏一场梦，这种没有明确戏剧冲突的电影，就不要用这么味如嚼蜡的叙事方式了吧。
456,美丽人生,2,怎么可能会这么高分啊怎么可能会这么高分啊怎么可能会这么高分啊怎么可能会这么高分啊怎么可能会这么高分啊怎么可能会这么高分啊怎么可能会这么高分啊！
457,美丽人生,2,"不喜g主角榱鹤佣b的快,m然ゴ蟮失s人性...楹文屈NKs仍那N正面？我^多的正能量"
458,美丽人生,1,无聊的要死
459,美丽人生,2,em我不喜欢这个概念，妈妈明明不用进去，反正进去了也看不到家人啊干嘛要一起进去，爸爸什么都不告诉儿子不觉得更可怕吗。唯一比较好的是最后儿子看到坦克说自己赢了，有点讽刺。然后一直说我们赢了（游戏），其实是战争，这是导演的目的吧。最后吐槽一下为什么没有原音版！这个英语配音和字幕真的是……
460,美丽人生,2,童话电影，演技浮夸，剧情随心所欲，男主实乃集中营之命硬头铁之跳王之王相声演员，，经典
461,美丽人生,2,完全不觉得好笑，打开好几次连开头都看不进去，差点怀疑和豆瓣写的不是同一部电影，快进到一半实在看不下去了，就这样吧，不勉强自己了
462,美丽人生,2,我不喜欢这个题材这样做
463,美丽人生,1,逼电影，谁看谁全家倒霉
464,美丽人生,2,如此浮夸的表演即使是为了渲染结束的悲剧，也无力接受。
465,美丽人生,2,伪文艺片，导演自恋狂，蹩脚货
466,美丽人生,1,超级无感，在我的电影美学里，不接受这样做作的电影。电影不是为了感动和自我感动而故意塑造虚假的人物和情节！影片大段的音乐完全是在自以为是得拖着观众跑，观感非常难受。
467,美丽人生,2,看不下去啊，对这类片子没感觉。。。总感觉像国产抗日神剧一样。本身就是很残酷的东西，如何用轻巧的方式去理解，岂非掩耳盗铃。
468,美丽人生,1,emmmmm……首先说一下看法。电影的小说感十分严重。电影并不该是光靠台词推动的，从头到尾都是旁若无人的喷字机般的男主很让人出戏。百分百前后呼应这一点着实把我看乐了，而且同一个包袱不停地用也很无趣。剧情这块，前期男主简直随心所欲游走于集中营，结尾为了煽情一通无脑操作被剧情杀了，生死攸关时期医生的作用就是你帮我猜个谜？失真感太严重导致煽情戏很可笑。虽不至于一星，但9.5背后的风气值得反思
469,美丽人生,1,男主是导演，女主又是他妻子，这就很好理解了，为什么自认为自己很有幽默感的丑bi男主叽叽喳喳一直说个不停还他妈成了一部电影……傻逼的电影，无数刻意的巧合显得这电影很假---话痨确实让人恶心，整部片子就是看这死话痨的拙劣的表演，两耳充斥着这话痨的喋喋不休的废话。最后被德军突突突的时候，我反而升起了一种现在这个世界终于可以清静的爽快感。
470,美丽人生,2,"豆瓣电影top250的no.5 狂颠的话唠表演立意再深都不够引人入胜 更算不上""好看""的电影"
471,美丽人生,2,烂片都是从剧本开始烂的，女主傻白甜，见到一个嘴巴甜会说笑的男的就跟他走了，也丝毫没有深入了解该男士，即使她的未婚夫有钱，长得帅，个子高，但她依旧喜欢那位秃头哥，男主的表白也真的让人感动“我第一次见到你就要和你一直做爱，做一辈子的爱。”纳粹也都是傻子，女的监狱有会讲英文的叫他来男主监狱那不就完事了？其他槽点也是一大堆，男主一生都是戴着镣铐的舞蹈，但他一直都跳得酣畅淋漓，前提是女主和纳粹都是傻子。
472,美丽人生,1,看开头就不喜欢，有点神经，男猪脚也看不顺眼。
473,美丽人生,2,他们说了，这片给低分的都是一些阴暗的家伙。ps:看的是国配版本
474,美丽人生,2,不喜欢这么话多的男主，别人都很累了想安静的时候就他突出，骑个单车车速那么快在窄道上跑，没有丝毫公德心，能活下来纯靠主角光环。同样的故事背景，感觉《辛德勒的名单》才是让人尊重的好电影。
475,美丽人生,2,各种二战时期犹太人的电影，而这是场最华丽的意淫。
476,美丽人生,1,是否可以认为男主后半段对孩子的谎言不过是他一贯装疯卖傻的延续罢了，在电影《布鲁克林》中，片中女孩都认为约会不能找意大利男孩，看来意大利男人不靠谱真是臭名远扬。作为反思二战的题材，电影似乎想用夸张的手法讽刺纳粹和种族屠杀。但是电影中的夸张手法和现实生活缺乏平衡，让人觉得电影太假。
477,美丽人生,2,反感这种表演方式r(s_t)q
478,美丽人生,2,集中营的戏看得尴尬地要死，4K修复版也没觉得好多少
479,美丽人生,2,绝非拍得不好、更非制作或演员差；而是这犹太机智过人、一老一小玩转SX纳粹的“美好愿望”（纯粹YY）的表象下，内核中那与手撕鬼子高度相似甚至一致的、来自于弱者的YY自慰，以及米帝才是解放一切、终结苦难、光芒万丈的救世主腔调实在是太令人倒胃口了
480,美丽人生,2,自编自导自演，搞得太做作了，贝尼尼不太讨人喜欢，至少其他电影很少有他的份
481,美丽人生,2,差不多50分钟的时候我们的主角小男孩才出来
482,美丽人生,1,又是一部完全看不下去的影片，感觉好低龄化。。男主居然还是奥斯卡影帝。。
483,美丽人生,2,这显然是一部荒诞剧，用荒诞剧的形式来表现残酷的犹太集中营可不可以？可以。然而既然主角荒诞，那么配角也要跟着荒诞，不然就会如此剧一样，故事因为不同角色表现的不对称而丧失了说服力。动人的家庭感情和想表达的人生态度固然积极，然而仅仅因此就给这部电影如此高的评价我是不能理解的。
484,美丽人生,1,男主的设定就是满嘴放屁的性骚扰，在马路上随便壁咚路人甲，分分钟被打死。骑着绿马抢婚，亲戚用唾沫就能淹死，根本不用进集中营。这就是为了衬托纳粹残酷编造的虚幻故事，为了感动而感动。
485,美丽人生,1,除了题目说的正好，本片看似紧贴战争与现实，但内容之夸张离奇，表述之不可思议，人物之无法想像，皆成为影片被世人称道的理由，这使影片成为电影造梦的又一个奇迹，更成为电影与生活之间无可逾越的鸿沟
486,美丽人生,1,一星都嫌多
487,美丽人生,2,不喜欢话痨癫狂式的表演
488,美丽人生,1,过誉过誉了，戏剧式电影，做到了既妖魔化纳粹又美化大屠杀；既美化犹太人又最终让唯一的犹太人死了的奇葩电影
489,美丽人生,1,可以将电影拆成两部，很明显的两部。
490,美丽人生,1,"张国清课上播的
Oh my gosh
我觉得意大利语难听死~"
491,美丽人生,1,看了好多遍，但都没看几分钟。开头太不吸引人
