,movie,star,comment
137,美丽人生,5,生命悲惨残忍黑暗，可笑仍如阳光般灿烂。
138,美丽人生,4,乐观的活着
139,美丽人生,4,如果你是一个热爱生活的人，如果你是一个懂得珍爱的人，如果你是一个好父亲，那么这部影片你一定要看。
140,美丽人生,5,影片告诉所有真正热爱生活的人们，噩梦是暂时的，相信美丽的人生才是永远的。罗贝托・贝尼尼也把父亲这个角色刻画的相当成功。
141,美丽人生,4,不可否认 这是一部带给人勇气的影片 也不难理解为何在国际上获奖无数 即使不放在二战的背景下 男主角也会是最好的情人 最好的爸爸 窃以为集中营的部分虽然感人 却让影片落入俗套 可能跟导演的个人经历有关 看到了太多他成长的影子 表演更是偏舞台剧化 时刻提醒着我这并不是真的 
142,美丽人生,5,感动到。似乎有关二战犹太的片子都能触及灵魂和人生。思考很深痕沉重。
143,美丽人生,5,大学思修老师放的时候哭倒一片，但没boarding school的背景缺乏同理心，哭完第二天就忘了。现在看像被锤击，前面恋爱的阶段真是太美好了，骑着绿马带爱人走的时候还有春风得意马蹄急的豪迈，因为爱跟被爱而骄傲。后面为了保护孩子策划出一个游戏出来，由衷的理解并佩服犹太人的群体观念，换某个民族早被同胞举报一百回了。参加朋友公司年会，带着几个不打麻将的朋友组队进电影院看的，从书店被打翻就开始哭，哭到后面变笑边哭，拍的太好了，男人最温柔的一面展示的特别好，广播给老婆报平安那幕差点哭晕过去了。虽然我是念的寄宿学校，但如果是被迫念寄宿学校的话我会疯掉。
144,美丽人生,4,这么久了还是能想起影片的内容，单纯的小男孩，客观的爸爸，残酷的消失！真实又揪心
145,美丽人生,5,美丽的谎言，伟大的父爱，很幸运我们生长在和平年代！一定要看，强推
146,美丽人生,4,希望人们能记住现在的和平来之不易。
147,美丽人生,5,看了之后觉得生在和平年代的我十分幸运 演员选的很好 小儿子的天真反衬了战争的残酷 父亲的爱和死更添悲剧色彩
148,美丽人生,4,最真挚的爱情，有时候真不需要太多的言语，连执手相看都不需要，只是纵身一跃，跟去天涯海角。
149,美丽人生,4,很温情，很感动，很经典。
150,美丽人生,5,上一次看是应该在初一语文课上，当时也没有哭。如今再看，自第二幕伊始便鼻酸：父亲第一次大摆臂走路，儿子第一次躲入柜中，那命运早已埋下的一个个韵脚，仿似一颗颗炸药。纳粹在种族主义狂热的驱使下将“人”物化，而贝尼尼努力在历史悲愤的控诉间微缩小我的动情，从而找回属于有血有肉的个体的真实的感动。在第一幕与最终幕的悲喜潮涨之间，影片始终以诙谐荒诞的构建延伸，数次的虎口脱险与种种巧合为真相蒙上温柔的面纱，作为观众的我们正如被告知“游戏规则”的孩子，不曾直视惨痛的血流和非人的杀戮，只是躲在仅有一条细缝的柜子里窥探这个世界，去触碰那美丽的悲恸，浪漫的伤痕。然后才知道，原来欢笑下的泪水最疼痛。
151,美丽人生,5,"美丽人生
这只是一场游戏。
游戏是会结束的，风雨过后，我们会见到彩虹。"
152,美丽人生,4,乱世中的父爱，凸显的更加伟大和温暖，偶然间翻来看的电影竟然让我痛哭一次，最善意的谎言正是他最温柔的爱。
153,美丽人生,5,二战纳粹集中营，如何能上演一出喜剧？罗伯托・贝尼尼饰演的犹太父亲圭多，以父爱之名为儿子编造的游戏谎言，使这本被死亡阴云笼罩之地充满了阳光，他害怕儿子受到伤害为爱做出的诸多滑稽，令人在忍禁不俊的欢笑间给每一个观众带来了挚诚的感动，人生都是美丽斑斓的，心若阳光 何处无美丽！
154,美丽人生,5,苦中作乐既是一个男人对妻儿的爱，亦是是对残酷战争的戏谑。剧情全程顺畅，情绪过渡自然，笑点节奏密集，把基度这个小人物的反抗精神用喜剧的手法淋漓尽致的表现出来，而用乐景抒发哀情则更体现了戏剧化所呈现的一种独特的张力。
155,美丽人生,4,历经20年重看本片，除了乐观的人生态度以及伟大的父爱，本次感受最强烈的是逆境中诞生的人性光辉。这是非常难能可贵的时刻，当我们习惯了追求顺境，都不愿意面对负面情绪、挫折与失败、人生困境与磨难，甚至用逃避去拖延，其实这些恰恰是成就新人生的重要转折。包括我们苦苦追寻的爱情，“同甘”容易，“共苦”太难，而经历过逆境的爱情，往往更容易抵达幸福。2001.4.23 红旗剧院/2020.1.3 太平洋影城
156,美丽人生,5,2020.01.03没想到还能在大银幕上看到4K修复版。还记得第一次看的时候，因为集中营的游戏，被父子情感动到不行。但这一次被前半段太过纯粹的浪漫给感动坏了，大雨中的红地毯，OMG，怎么可以这么浪漫。“早安，我的公主”！
157,美丽人生,4,这部电影里，感情能够使人变得这样勇敢，感情能够在泪水里开出光华夺目的花朵，举世无双，耀眼的让人不敢直视。感情，能够让我们，无畏无惧，放下所有。
158,美丽人生,4,我们对世界的认知原来是构筑在语言上的，怪不得二十世纪哲学最重要的核心课题是语言。
159,美丽人生,5,以喜剧形式表二战题材的影片，以幽默的方式表现对种族歧视的蔑视。没有人的人生是完美的，但生命的每一刻都是完美的。
160,美丽人生,4,伟大的感情，我永远对于这种在令人绝望的逆境中能够保持自己不迷失且为了一个目标可以坚定到最后一刻的人抱有敬意！
161,美丽人生,5,原来这种电影被称为喜剧。的确，看起来挺荒诞，全是漏洞，演技也挺差的，不过这个电影表达的情感，人物塑造都挺丰满。我爱那个爸爸，一堆废话的爸爸。还有那个小孩，他一辈子都将生活在爸爸的爱里。
162,美丽人生,4,大银幕重温。从今以后我不在的每个日子，都祝你早安、午安与晚安，我亲爱的的公主。再次感叹：罗伯托・贝尼尼真是一位伟大的喜剧演员！
163,美丽人生,5,基度永远乐观而善良地解释一切恶意。当儿子问他，商店门口为何写着“犹太人与狗不得入内”，他回答说：也许因为他们不喜欢犹太人和狗，就像我不喜欢野蛮人，我们明天就在我们小书店窗户上写“野蛮人与蜘蛛不得入内”，因为你不喜欢蜘蛛。这是我见过的最平和最智慧的解释，他保护儿子的纯真。
164,美丽人生,5,最让人心酸的喜剧，当厄运来临时你将如何面对。这是一种另类的集中营体验，苦中作乐为了孩子也为了希望。
165,美丽人生,5,最美丽的人生装满最鲜艳的谎言。
166,美丽人生,4,最美的谎言
167,美丽人生,5,标签是喜剧，却让人看的不禁潸然泪下。我在观影过程中数次泪目，其中印象最深刻是在三处，一是圭多带小约修亚遛进传达室给他们的公主“千里”传音，在那样堪称生死悠关的时刻，圭多把与约修亚的游戏演绎到了极致，话筒里丝毫听不见悲伤和恐惧，唯有父子二人对妻子、对母亲浓浓的爱意。二是圭多在纳粹军官的宴会上偷偷用留声机给他的公主放那首她最喜欢的歌剧的旋律，所有人都在熟睡的时候，唯有她踩进了那爱的旋律，她知道旋律的彼端，是丈夫无时无刻无处不在的挂念。三是小约修亚最终在妈妈的怀里高兴地欢呼着“我们赢了”，他在母亲面前骄傲地炫耀着自己赢得了圭多一直和儿子演绎的游戏的奖励。那个坦克，算是圭多的死换来的唯一的慰藉吧，让这个包裹在圭多精心罗织的假游戏中的悲剧，有了童话故事般欢乐的结局。很欣慰这样美好的电影能重置上映。
168,美丽人生,5,小孩子身处人间地狱，却活在父爱的神迹中。以喜剧的手法来记录残忍的历史，不厚重也不轻浮，带着“美丽人生”必要的体面与风度，让人笑与哭。剧本极佳。
169,美丽人生,5,没有结婚前的那段热闹嘻哈的剧情，怎么会对这个爸爸印象那么深刻，深到他会在那么严酷的环境里为孩子编织美丽童话都变得再自然不过。如果妈妈没有硬跟去的话也许他们会更顺利地逃出来吧……伟大的爸爸。
170,美丽人生,5,豆瓣评分而来，当时没有发现各种在线看电影的APP，直接从电影天堂里下下来的，超级感动
171,美丽人生,5,最爱的电影之一！
172,美丽人生,4,前半部分是爱情故事 猥琐的男主角唧唧呱呱个不定 很让人厌烦 电影过半 场景转入纳粹集中营 气氛变得沉重 配乐也随之变化 开始了一个亲情故事 男主依旧在唧呱 但却是为了保护儿子的生命以及纯真的童心 让人明白 他是以乐观幽默甚至滑稽的状态来面对悲欢不定的人生 这是个强大的心灵
173,美丽人生,4,从未遇到这样一部前后基调迥异的作品 其实这个世界在任何时候都没有什么不同 过的幸福与否只在于你的生活态度 所以不要觉得未来会更好明天会更糟 how make today beautiful is the most important stuff.
174,美丽人生,5,阿西吧。看完心情秒变沉重。直到片尾，我都无法接受灵巧机智乐观的男主，小孩儿的父亲，被枪毙了。。。我更多的观感放在沉重的父爱上，战争真可恶。愿世界和平。
175,美丽人生,5,导演没有残忍到让我们看后哭得一塌糊涂 我的眼泪是因为孩子真正得到了大坦克吧
176,美丽人生,5,影片以类似于卓别林默片的喜剧情节诉说了所有的爱情烂漫和人生美好，爸爸思维的睿智和自然的乐天足以鼓舞每一个热爱生活的人。他竭尽全力编造谎言保护儿子，为给儿子幼小的心灵种下美好的种子而不是让它饱受欺凌，因此小男孩才会兴奋于突然出现的盟军坦克，才能结出美丽的人生。
177,美丽人生,4,前半部分的浪漫喜剧和后半部分的父子温情都很好，但是两头都想要，结果两边都差一点。
178,美丽人生,5,太难受了010101
179,美丽人生,5,请注意它是71届奥斯卡最佳影片提名，而不是最佳外语片提名
180,美丽人生,5,2020年初复习老上译国语版，沈晓谦的配音让人怀念。影片构思确实精巧，我却没有当年初看时的惊叹了，好些情节、细节的处理其实很有些刻意。
181,美丽人生,4,和乔乔兔的做法一样，把世界上最重的题材，用最轻的方式处理了，后者运用童真，此作是滑稽表演，这部电影很厉害之处在于很多景是非常简陋的，很朴实的营造出一种小人物家庭喜剧的氛围，谁料到越走越开阔，最后将爱情、战争、父爱一网打尽。
182,美丽人生,5,影片前半部分让我怀疑我看这片的价值性（尤其受不了老公主卖萌），可到结尾孩子说出：“we won”我竟有一霎那想哭的冲动。这是一个伟大的父亲所做的牺牲。
183,美丽人生,5,一个父亲为了守护儿子心灵的美好做出了伟大的牺牲，用喜剧的方式去讲述一个悲剧的故事，当父亲最后经过儿子藏的铁箱注视片刻做了个鬼脸，儿子回应，微笑，父亲像小丑般走路，而转过胡同，父亲被枪决，这种张力使得对法西斯的罪行的控诉更为强烈，而举重若轻的态度也彰显了创作者灵魂的高度。内牛满面。
184,美丽人生,5,父爱无限，奎多竟然还是死了，心底悲伤无限。前50分钟，我还以为是喜剧片，没想到竟然是这样感伤的温情片。儿子让我想起“小萝卜头”。二战的电影一直拍的很好，很多不是直接用惨烈的战火体现战争的邪恶，而是从侧面用白色恐怖让人缅怀、思考，人性的善恶显露无遗。奎多、儿子还有绿色的白马都好萌啊。
185,美丽人生,5,很遗憾看的竟是英语配音的版本，听上去有点滑稽。虽然该片在拍摄技巧和技术上存在太多的硬伤，但这并不妨碍它成为影史的经典、奥斯卡的赢家，完全以故事和表演取胜，当罗伯特贝尼尼这个可爱的男人站在奥斯卡领奖台上，用一口蹩脚的意式英语致谢时，你会觉得人生是如此美丽。
186,美丽人生,5,热情乐观幽默风趣机智的小犹太男人耍尽诡计最终得到心爱女人，可惜幸福美景不长，人类历史上最黑暗的长夜来临。虽然结局是残酷的阴阳永隔，妻、子却幸存下来，小男人被杀害，但这样的不完美的  
187,美丽人生,4,用黑色幽默的手法描述了圭多一家在纳粹集中营中的悲欢离合，展示了圭多对美丽人生的憧憬和在残酷环境中特有的乐观。其表现出来的悲与喜，美与丑之间强烈的落差，让影片更能有扣人心弦的力量。
188,美丽人生,5,"【Life may be violent and cruel, but you still get a right to smile back.】感人至深，全片哭满。Roberto Benigni无论是作为演员还是导演都无可挑剔。"
189,美丽人生,5,向孩子撒谎是父母的天职，即便在集中营的生死线上也要确保孩子有一个没有阴影的童年。这是一场游戏，父亲带着疲惫的笑意向孩子撒下弥天大谎。而此后的圆谎终究要花上生命的代价。在这样的时刻，没有人去追究虚假与真实，忙着流泪的我们只晓得动机伟大。整部片子带着喜剧的节奏，但在最后能让你哭，神啊
190,美丽人生,5,“早安！公主！” 
191,美丽人生,5,哭点在广播喊话....
192,美丽人生,4,在那样的黑暗之中，身为父亲，用自己的幽默机智保住了儿子；身为丈夫，用自己的担当和责任安慰着妻子。他永远留给这个世界乐观积极的笑脸，与战争的残酷是那么格格不入，又是那样弥足珍贵
193,美丽人生,5,在残酷的战争面前，更显得父爱如山。
194,美丽人生,4,片子的前半部分让我几度怀疑我是不是走错了地方…（好特别） 65色调大胆但惊喜 和后面布满条纹(条纹睡衣后遗症了)的废墟形成了鲜明对比...  65 65前面的可爱主线就是那一句句 “早安 公主” 65无厘头的喜剧影子 在Maria梗的约会上达到了极致.  65两处处理简约得很 Less is More 651. 时间的过渡转场（“哐当”一下 就长大了） 652. 转角 - 枪声 - 烟雾 - 渐渐走入废墟的人 65有点念念不忘的配角安置：那位老人 x 那个女兵 …  65 65男主的那种性子被一个个情节强化得很鲜明了 只不过前半部分是一直逗人发笑的效果 后半部分每出一次都是一个催泪弹 TT  65 65女主虽然没什么塑造的情节 但是坚定地选择进入集中营就说明了一切 不是吗？ 6565E：他终于迎来了父亲口中的坦克。 65
195,美丽人生,4,前半段哄女人特别浪漫；后半段哄孩子就不太自然，乐观幽默得有点刻意――都被关进生死攸关的集中营了，哪有时间讲那么多俏皮话？台词和情节不如再精简一点。整体还是好看的。
196,美丽人生,4,早安，我的公主
197,美丽人生,5,强烈推荐。终于在大屏幕上映，第一时间去还票款。距离第一次观影已经过去了13年之久。但仍然保留之前留下的观感“强烈推荐”。随着年龄和阅历的增长，对这部电影有了更加深刻的感触。一个热爱生活的人，在任何时候都充满希望和昂扬的斗志。用自己的幽默和智慧，用自己全部的爱，追求自己想要的，呵护自己挚爱的。纳粹再残酷，战争再无情，面对乐观向上的人，只能惨败收场。你可以拿走我的生命，却夺不去我对生活的信仰。这份力量，代代相传。
198,美丽人生,5,高中全班同学一起看的，那时候对结局有点遗憾，今天看到热评的一句话很戳，即使在悲惨的世界，也要大大地笑着。
199,美丽人生,5,这世上最美的情话是谎言
200,美丽人生,3,在真实的历史面前，不可能有这样的轻松与浪漫！
201,美丽人生,3,用我残疾的心去看这样一部电影。已经完全没有知觉了。
202,美丽人生,3,【中国电影资料馆展映】绝对被过誉的电影。前半部还不错。后半部集中营里男主继续各种作死还能安然无恙，就太扯淡了。正好最近在研究《古拉格群岛》。这种事在苏联劳改营不可能发生，在纳粹集中营应该也不可能。浪漫感人但也虚假。胶片放映中途，机器多次故障。看来胶片电影真要看一部少一部了。唉。
203,美丽人生,3,喜剧演员常有，但是罗伯特贝尼尼是唯一最爱的，因为尽管这个世界上有很多值得去喜欢的演员，但是真正能带给我温暖的，让人感觉到生活永远是有希望的，就只有这个矮小的罗罗嗦嗦的老头和她美丽的妻子了，呵呵
204,美丽人生,3,实在是不喜欢。对于这种自以为是的爱以及浮沉乱世之中凭借小聪明和运气存活的方式完全不能认同。讨厌这种自以为可以掌控一切实则肤浅的小丑男，讨厌看似乐观聪明实则无脑的行为方式。完全不觉得美丽，只觉得一切都很虚假和一厢情愿。如果生活已陷入黑暗，就诚实坦然去面对。不哭，不代表一定要假笑。
205,美丽人生,3,用父爱编织的伟大谎言，盖过了集中营的阴影。男主的喜剧才华在前半部分求爱时发挥得淋漓尽致，但到后面就玩脱了，进集中营之后还延续这种表演只会显得轻浮。用夸张戏谑的方式来调侃屠杀犹太人这种沉重的历史事件，归根到底就跟国内抗日神剧一个德性。
206,美丽人生,3,治愈系的东西必定能为最广大观众群体所接受与喜爱，更何况还背负着这么沉重的历史背景。片子想表达出的积极乐观的人生态度值得称道，前半部分继承了意大利喜剧片的光荣传统。只是能戳着我的笑点却没命中泪点，后半部分略显无脑般的盲目浪漫主义有些廉价，贝尼尼只放不收的喜剧表演同样减分。
207,美丽人生,3,这部电影还好 但是我还是比较喜欢喜剧片 这部电影人物看的挺舒服96赞一个9199
208,美丽人生,3,嗯。。像这个片儿和肖申克的救赎就真的被过誉了吧- -而且这片儿的结构非常奇怪，生子前后四舍五入算两个故事了。后半段也真的无聊，同样是拍集中营，辛德勒的名单震撼多了。
209,美丽人生,3,不喜欢，很多画面很经典，但是被老师强迫看很不喜欢。当年班主任小丽推荐的电影，还以为是个默片。不过每次翻这部电影，会想起小丽。
210,美丽人生,3,我在想是不是有许多人对本片有误解。这是关于一个乐观幽默的青年的美丽人生，而他恰巧生活在大战年代。这个青年无心于大世界的抱负，甚至他对是非黑白的伦理道德问题也并不以为意，在他心中最重要的是取悦美人和儿子。但灾难降临，他无从逃脱，于是逆来顺受和儿子做了个游戏，人世残酷，你可以选择态度
211,美丽人生,3,开篇用大段笔墨描写爱情，这部分的用意我在小时候没体会到的。全片和人设有欧洲喜剧的可爱温暖以及“假”，剧情安排有点刻意，近乎理想的童话状态（可能因此才感动了童年的我们）后半部分节奏有点赶，触及历史和人性太过肤浅。电影中的夫妻在现实中也是。看到自行车的三人段还是觉得很感动有代表性
212,美丽人生,3,《美丽人生》之谎言，犹如《沉静如海》之沉默，这未尝不也是一种戴着镣铐跳舞的绝美悲壮姿态；小男孩我见犹怜，但仍觉最后情绪递进仓促没有到位；可能是观前抱着超高期待，也可能是下午的《山椒大夫》花光了我所有的眼泪，这一部竟然成为了我私人观影史迄今为止第一部没有看哭我的二战电影。抱歉三星。
213,美丽人生,3,被男主角密集的台词逼逼得脑壳疼，不管你们喜不喜欢，感不感动，我不喜欢，也不感动，一个假的要死的故事，配上前后脱节的结构，看的人昏昏欲睡。
214,美丽人生,3,这种片子的伟大就在于，即使是一个毫无鉴赏力的人，也会打五星。
215,美丽人生,3,虽然巧妙地选择了亲情爱情战争这样催泪的主题，但还是摆脱不了乏味的剧情，导演不善于刻画战争的无力感。前面比较好看。结局更是败笔，莫名其妙地从“我”出发地总结了全篇。
216,美丽人生,3,受不了这种话唠。罗伯特贝尼尼长的也太磕碜了尤其让我撑不下去。后面的催泪环节还好，但你不能拿着卖萌童真和沉重人生骗高分啊。不真实的离谱了。我感觉这厮是将浪漫喜剧，人性批判，二战历史没打碎就放一起，五粮液做成了八宝粥
217,美丽人生,3,P槽太感人了
218,美丽人生,3,“这是个简单的故事，但不易说，像寓言，有悲有喜，也像寓言，教人不可思议。”明天我便记不起，我终于看了La vita è bella。
219,美丽人生,3,当年电视报导过这样一则新闻，本片在某个电影节（记不准是否是奥斯卡）获奖时，斯皮尔伯格愤而要离席，这举动当然会显得不和谐，他老婆坐他旁边，硬把他拉了回来。在斯导看来，用这样一种喜剧手法表达犹太人在纳粹时期的苦难非常不妥以致于无法接受。一直没完整的看这部电影，最近看了，觉得有些拖沓。
220,美丽人生,3,前半段讲基度挖墙脚的时候并不觉得乐观只是觉得他像个满口谎言的滑稽小丑，虽然他一直爱公主逗她开心直到生命最后一刻。进了集中营，他的乐观他的父爱营造的善意谎言让儿子一点没受到纳粹的侵害还是很震撼。当然，从追公主和骗儿子除了犹太人的聪明还有太多幸运的巧合。噢浪漫主义。
221,美丽人生,3,08年12月 当时脑袋肯定被驴踢了 才给了这部电影三颗星。我豆瓣评分一直是看心情的所有就不改了。至少四星半的电影。我们必须要正视历史以及历史所遗留的一切。每每关于集中营那段日子的电影总是励志的 人们总是要在任何时候都背负着希望而活。爱似乎是能够战胜一切的。但这只是电影而非真实人生
222,美丽人生,3,"意大利的电影总是如此温情脉脉，又残酷到骨髓。一个伟大的父亲为了维护自己儿子那颗童贞的心，在二战那个动乱的年代，义无返顾地做一些惊世骇俗的事情，却都是正确的事情。父亲临死之前做给儿子看的夸张动作，看了令人难过。 
"
223,美丽人生,3,立意非常好，后半部分有几处比如翻译的那段看得我想笑更想哭，确实厉害，不过情节全为立意服务，大多无法推敲，而在后半段这么真实而恐怖的集中营场景里，这样不严谨的情节就显得尤其刺眼。
224,美丽人生,3,"我坚持一个观念:美好过于频繁,便谈不上美好."
225,美丽人生,3,荒诞悲喜剧。我觉得大题材和新角度的融合还能更和谐一些。而且，女主角演的好做作啊！
226,美丽人生,3,3.5/5。一部歌剧电影，巨大的情感能量，浪漫化的故事，前后情绪转换但情节呼应（via奎多的喜剧本能），高光的咏叹调（也就真的用了奥芬巴赫的船歌），甚至是皇族意味的爱称。坦克的出现有着微妙的自反，不是童话战胜现实，而是幸存者的自我陈述。我有被煽到，但我认为，将已被全面研究的二战集中营，放入影片的基调，是很难平息质疑的，男主反复出格惹事从不交代后果（订婚那场突破了我对叙事逻辑的底线），摄影使用大量近景镜头和人造光源，过多的正反打对话，化妆基本不体现惨状，这几点削弱了故事背景的现实性，也就是残酷性，那种非人道灾难与人性光芒的反差，是不能与那几部严肃还原现实的电影相提并论的（可对比索尔之子）。说两个细节：1.老被偷换帽子商人的两个儿子叫贝尼托和阿道夫。2.只有督学吃饭时的一两处画面像是4K。
227,美丽人生,3,情节过于疯癫，我不喜欢。至少在我看过的有关集中营的电影，它算不上出色。
228,美丽人生,3,硝烟战火中，也快乐着的意大利人。“早安！公主！”前半部分太欢乐，急转直下，进入集中营。
229,美丽人生,3,前半部的纯喜剧很合胃口，但后半部就有些荒诞了，就像一部残忍的童话一样。之所以打动那么多人，是因为贝尼尼极力的营造父爱的伟大，我倒是觉得过犹不及有些做作了。
230,美丽人生,3,7/10
231,美丽人生,3,可能是因为在主题为“善意的谎言”的SAT ESSAY中，早就把这个故事的梗概翻来覆去写过好多遍了，真正看电影时，并未有那么多的触动，而且很反感前半段夸张式的表演。
