,movie,star,comment
0,美丽心灵,5,幸运的是爱他的女人存在于真实里。
1,美丽心灵,4,"所以说不要学数学,你就是不信邪"
2,美丽心灵,5,"我觉得你很有魅力, 你对我的主动性说明你对我有同感。尽管如此，传统的信任仍然需要我们在做爱之前进行数多次柏拉图式恋爱。我正在往这方面发展，但事实说来，我真正想做的只是尽快和你XXXX。"
3,美丽心灵,5,“我的追求带我穿越了物理、形而上学、幻觉，又带了回来”，顶尖科学家的世界已经足够神奇，何况他还有着伟大的爱情。这部电影不仅是纳什的精彩传记，更是对爱情的崇高礼赞――爱是无限，爱是信仰，爱是一切逻辑和原由。
4,美丽心灵,4,是的，你必须学会分清哪些是幻觉，哪些是梦，哪些是真实的人生，才可以活下去。
5,美丽心灵,5,李笑来老师推荐的一部电影。纳什是历史上第一个广为人知的“用自己的精神战胜了自己的精神病”的人。看的时候不够专注，这是部需要安静认真去看的影片，另现实中精神病始终是一个没有最终被解密的领域，治疗的药物对人的大脑损伤很严重，加速度痴呆和记忆衰退，包括影响性欲。他的爱人其实才是最伟大的
6,美丽心灵,4,"什么都好，除了《A Beautiful Mind》这个名字。
"
7,美丽心灵,5,每个孤独的孩子其实都有一个别人看不见的好朋友
8,美丽心灵,5,你让我相信还真有感情这回事。
9,美丽心灵,5,看哭了，在约翰坐在餐厅里，大家挨个来给他送钢笔的时候。
10,美丽心灵,5,这才是真真的传奇，再好的编剧也想不出来吧。
11,美丽心灵,4,我发现我的一句话短评竟然造成了严重剧透，所以我做了修改，我的建议是，在先生（女士）您看到我这条短评时，请停止手贱，不要再浏览任何短评，以防剧透，立刻去看电影。您将体验电影剧情的不确定性而感到万分愉悦。
12,美丽心灵,5,有你终生美丽
13,美丽心灵,5,与自己战斗，坚持，勇敢，相信自己。面对一切困境，克服它，朝着自己的理想前进。这是人性的光辉之处，这是人超越一切生物的闪光点。
14,美丽心灵,4,与我想象中的不一样，很震撼人的传记电影，从中我最大的体会是：做伟人也真不容易啊~~
15,美丽心灵,4,前半段觉得好平淡，不知道剧情的话后边还说挺出人意料的，詹妮弗康纳利永远的女神！男主角就是一只萌萌的熊叔吗！估计骚受们肯定喜欢他！
16,美丽心灵,5,用精神治好了自己的精神病
17,美丽心灵,4,刚看到新闻说John Nash出车祸死了。。。
18,美丽心灵,4,和近日的《万物理论》相映成趣，皆是饱受精神或生理折磨的伟大天才，以及爱上天才的坚强女人。两部传记片皆淡化传主的道德瑕疵，同时对各自妻子也倾于美化。现实生活中，两位妻子都曾因不堪忍受心生恨意，两对皆离婚。可纳什比霍金幸运，艾西莉亚即便离异也从未放弃爱他，两人2001年复婚。简却另嫁他人
19,美丽心灵,5,他是情商最低的人，但他也是最真实的人。
20,美丽心灵,5,看三次了。第一次在大学图书馆，第二次在上班以后，第三次是电影频道滚动播放的测试片。每个细节都记得清清楚楚，大概是永远也不会忘记的片子了。
21,美丽心灵,4,所有伟大而美丽的心灵都是孤独的，纳什疯了，是因为他太孤独了。
22,美丽心灵,4,那三只影子好可怜啊，难道幻觉就一定比现实无价值么？这只能由当事人来判定吧？不治好病又如何，我要是他就疯下去，看他之后的萎靡，哪有当年当疯子的意气风发？
23,美丽心灵,4,好的导演，好的演员，好的故事，好的电影。
24,美丽心灵,5,很感动的故事，真的可以当成悬疑来看。伟大的人会有不平凡的经历和痛苦，坚强的意志，并且不忘初心。女主角太美了！
25,美丽心灵,4,数学果然容易让人精神分裂
26,美丽心灵,5,八年前标注了想看，今天在去北京的高铁上看了。我以为的还真不是我以为的，众人给教授钢笔时真的很激动。
27,美丽心灵,4,无欲则刚  
28,美丽心灵,4,纳什疯了
29,美丽心灵,5,纳什均衡！
30,美丽心灵,5,纳什的传记，绝对的传奇。影片看过三四遍，每次都还是会为他的故事感动。导演讲故事的能力太强了，一半的时候都可以当成悬疑片来看。
31,美丽心灵,4,以前觉得自己适合去社科院，只搞研究不教书。后来经过陆谷孙和沛公的洗礼后，才发现读了书就更应该好好生活，而教书比写书重要得多。
32,美丽心灵,5,"除了失败的爱情结尾几乎无可挑剔。
过去一旦无法解决，未来将永远无法成为现在。"
33,美丽心灵,5,"朗・霍华德一鸣惊人之作，绝妙的剧本、出彩的视听语言(主观镜头,旋转镜头,色调,配乐,蒙太奇)和出神入化的表演让本片达到了传记片的新高度。罗素・克劳戏路足够宽广，却与影帝失之交臂，女神詹妮弗康纳利终获奥斯卡认可。虽然与现实有所出入，但这部神作依然震撼人心。（9.0/10）"
34,美丽心灵,4,看来Ron Howard在《达芬奇密码》前就已经着手研究符号学和密码破解了，这部片子可以看成是他对《哈维》的颠覆，片中Russell Crowe也拿哈维当成笑话说，哈哈~ 天才和疯子只有一线之隔啊，而主人公的成功则靠着那则爱情工程式的坚持
35,美丽心灵,4,我要有这么漂亮的老婆，我也有斗志
36,美丽心灵,5,爱是一切理由
37,美丽心灵,5,"这是我看过的最好的一部人物传记类影片.它不但表现了天才智能巅峰的一面,更重要的是它将人物人生低谷与其傲然绝群的天份互相缠绕一起呈现出来.或许编导已经洞悉,这恰恰是天才属性不可割裂的一部分.常常慨叹,人类中越接近造物主秘密的人越是在精神、思想、灵魂乃至肉体上被摧残得越惨烈,无一例外。"
38,美丽心灵,5,在Princeton的dorm里看这个电影别有一番风味…
39,美丽心灵,5,入门电影含羞补看计划。爱永远是庸俗而明智的升华，你以此生死以此悲欢，理智与情感的每一次对决，都毫无悬念。朗霍华德的作品很大众，在没有强烈风格的同时，让人暖心且无从挑刺，我一度陶醉黑暗的开放式结局，这次却在同样以精神分裂为主题的电影里，被最质朴的情感洗成泪人。
40,美丽心灵,4,天才和疯子只有一线之差
41,美丽心灵,5,感觉不到真实的时候，就是把自己与这个世界强行分离了。重新回到现实中来的方法，让人心走进来。
42,美丽心灵,4,不止一次听到那句“天才和疯子只是一线之隔”。尽管精神分裂，但纳什的精神力量十分强大，作为一个科学家并获得诺贝尔奖真是了不起。还好他的妻子一直爱着他陪伴着他。之前学习纳什均衡的时候完全想像不到他会是这样一位数学家，当大家纷纷把钢笔放到他的桌前以示尊敬时，特别感人。
43,美丽心灵,5, 罗素的演技真的太赞了！最爱
44,美丽心灵,4,耐心的看能看出亮点的，心理学的经典影片。传记片也可以拍的这么好看，尤其是最后与小女孩告别的场景，令人心碎。
45,美丽心灵,5,与自己，和解
46,美丽心灵,5,最后还是把我看哭了啊= =虽然片子和我之前的想象完全是大相径庭。天才们似乎总是在与自己的内心抗争，所有的自卑，骄傲，孤高与欲想。
47,美丽心灵,5,这么多年过去了，我最大的发现原来是爱情
48,美丽心灵,5,想一想，从你所经历过的那些人，那些事，以及珍惜的片刻并没有死去，而是更糟糕的，都不是真的――大名鼎鼎的纳什均衡就是出自这个伟大的家伙。除了学术研究，他还要跟自己的幻觉，从争锋相对到视而不见再到平然处之。
49,美丽心灵,5,这是一部对我意义非凡的电影，也是我心中永远的痛。2004.5.22 大学宿舍307VCD 2014.5.16 中国电影资料馆艺术影院 “他们就是我的过去，每个人都会被过去缠绕。”
50,美丽心灵,4,#siff#如果你知我苦衷
51,美丽心灵,4,内心的强大才是真的强大
52,美丽心灵,5,4.5星。罗素・克劳的演技出彩（末尾感觉像是在像《雨人》中达斯汀・霍夫曼的角色致敬）。当然，真实的纳什是个天才，孤独、无情，影片则突出了他孤独的一面，却大体略过了他无情的一面。片中既未提他婚前有私生子，更不提他曾离婚――直至影片上映的2001年才复婚，1994年领诺贝尔奖时，他既未提到爱情的力量，他俩也尚未复婚，猜想也未必坐在台下。作为商业电影，这是可以理解的虚构，它总需要人们对主角产生共情，甚至需要感动人，不过这不应让人忘了，现实中这些在黑暗中挣扎的心灵，要过得辛苦得多，他们的亲友也更不容易。
53,美丽心灵,4,哎。。。所以嘛，我高考数学4分，完全没有男主的困扰。。。。坦白讲本以为是个很无聊的传记片，虽然对于这一数学家的处理进行了非常梦幻的加工，但他还是打动了我。。克劳大叔不错哦。。。
54,美丽心灵,4,。是爱呀
55,美丽心灵,5,感动!
56,美丽心灵,4,大概因了自卑，极端，以及强大的孤独，天才都走得穷途末路。不过结果都善终。殊途同归，也或许有些人只为一人等候。
57,美丽心灵,5,2006年巧丽的推荐！真的非常棒！
58,美丽心灵,5,拉塞尔克劳演的咋那么好
59,美丽心灵,4,For My Eternal Math
60,美丽心灵,4,Russell Crowe主演的两部影片连续两年蝉联桂冠。Jennifer Connelly没有童年时代那样惊艳了
61,美丽心灵,4,感人的人物传记，爱可以创造奇迹！
62,美丽心灵,5,拉塞尔绝对的影帝
63,美丽心灵,4,天才传记，克劳真是个好演员。
64,美丽心灵,4,好像在HBO看过 是我第一次看的关于精神分裂的电影
65,美丽心灵,4,好直白的翻译，但也是最贴切的片名！很好看，推荐！
66,美丽心灵,5,无论从画面还是从剧情来看不愧为奥斯卡最佳影片，罗素克劳演的太好了。
67,美丽心灵,5,Creep.
68,美丽心灵,5,有你终生美丽。
69,美丽心灵,4,不容易啊！
70,美丽心灵,5,164 朗霍华德擅长的工整叙事这次发挥到极致，拉素克劳的演技爆表了，看过的最好的传记片。
71,美丽心灵,5,罗素克劳的演绎实在精彩，让人看了充满活力的说
72,美丽心灵,5,爱是一切逻辑和缘由。感人至深的电影，爱的力量真的很难有上限。
73,美丽心灵,4,很精彩的精神分裂电影！
74,美丽心灵,4,这才是真的传奇，再好的编剧也编辑不出来吧
75,美丽心灵,4,要去看看博弈论了。。。
76,美丽心灵,4,不错
77,美丽心灵,4,果然天才也不是那么好当的。。。
78,美丽心灵,5,"震撼哦震撼，太帅了
哈哈，因为不是刚看完来写的，所以词语好匮乏，总之很不错的，很值得一看"
79,美丽心灵,5,JC美翻了我了，看了故事的原版很忐忑……
80,美丽心灵,5,数学家真不是人干的活
81,美丽心灵,5,感谢当年的辅导员 钱露营
82,美丽心灵,4,爱情很伟大
83,美丽心灵,5,故事好，演得也好。最大的魅力在于它表现的是真人真事
84,美丽心灵,5,"啊啊啊,罗素演技太牛逼了. 演一个神经质的数学家.
这片子也挺感人呀."
85,美丽心灵,4,ron howard
86,美丽心灵,4,爱情，悬疑，人生，理想，啥都占齐了，而且朗霍华德把这些元素处理得相当融洽，不得奥斯卡都说不过去了
87,美丽心灵,4,“或者，说得更准确一些：从七八十年代的某一天起，他有意识地选择将一部分的疯狂运用在数学的灵感上，而将剩余的疯狂用理性囚禁起来。 ” http://movie.douban.com/review/5379437/
88,美丽心灵,4,个人世界太强大
89,美丽心灵,4,为什么我看到纳什老想到李开复？2019.08.17，又看一遍，分数一样。
90,美丽心灵,4,天才的界限，感动
91,美丽心灵,4,挺不错的人物传记，值得一看。
92,美丽心灵,5,"我爱这个调,JAMES HORNOR还是很好"
93,美丽心灵,5,闷
94,美丽心灵,4,传记
95,美丽心灵,5,人格分裂 / Jennifer Connelly最佳女配角
96,美丽心灵,5,太震撼了，什么是不离不弃，什么是坚持不懈
97,美丽心灵,5,好伟大的电影
98,美丽心灵,4,精分果然牛逼！！！
99,美丽心灵,5,十分喜欢 十分喜欢 
100,美丽心灵,4,天才的故事总是那样精彩
101,美丽心灵,5,那个老婆谁不想要
102,美丽心灵,4,没有想象的那么好
103,美丽心灵,4,很感人，电影以艺术的方式将传奇的故事刻画的非常不错，感人至深。
104,美丽心灵,5,与我想象中的不一样，很震撼人的传记电影，从中我最大的体会是：做伟人也真不容易啊~~
105,美丽心灵,4,RC演得真好，JC实在太美
106,美丽心灵,5,"当之无愧的奥斯卡经典之作。一个和幻想症抗争了一辈子的经济学家。
一个挣扎在现实与幻想中的伟大的传奇人物。"
107,美丽心灵,5,温情
108,美丽心灵,5,不要错过它
109,美丽心灵,5,经典之作
110,美丽心灵,4,不意外结局
111,美丽心灵,5,打破幻象
112,美丽心灵,4,钢笔
113,美丽心灵,5,天才
114,美丽心灵,4,纳什均衡
115,美丽心灵,5,真实改编
116,美丽心灵,5,数学家的世界居然还能是这样……因为精神世界不同，他就是精神病吗？
117,美丽心灵,5,难忘的 被震了 心理学呀
118,美丽心灵,5,Best biography!
119,美丽心灵,5,这个暑假让我看了又看的片子
120,美丽心灵,4,1 more missed thing 
121,美丽心灵,5,纳什的故事。
122,美丽心灵,5,无与伦比的好
123,美丽心灵,5,与[自闭历程]同类 对抗精神疾病 追求爱与荣耀 数学博士的朴素爱情方程式
124,美丽心灵,4,嗯 又是孤独患者的故事 其实后半段不会有点跳跃么...交代的不是很清楚啊...一直靠几个细节在撑场 小touch 康奈利真的不是一般美 第一季约会的扮相绝美啊 ..再有就是 罗素年轻时候的扮相和伊万好像...
125,美丽心灵,4,罗恩拍这题材还不错
126,美丽心灵,5,很经典
127,美丽心灵,5,虚幻还是真实
128,美丽心灵,4,数学家都太可怕了。
129,美丽心灵,4,事实证明：不是谁都能得精神分裂
130,美丽心灵,5,不得不感叹精神力量的作用，他妻子太伟大了，这部影片带给我最大的感动不是影片本身，而是一个传奇人物的经历。结尾获奖感言很感动，哭了！
131,美丽心灵,5,2013.3.16结尾的演讲让人泪流不止
132,美丽心灵,5,看了一半，剩下的假期补完。纳什去五角大楼是真的还是假的？
133,美丽心灵,5,有个不离不弃的好妻子是何其幸运！
134,美丽心灵,4,克劳兄真是能驾驭各种角色啊
135,美丽心灵,5,疯子和天才都是一种生命的极致，而一直守护其身边的爱情则是最伟大的因素。
136,美丽心灵,5,片子的精髓在中间部分。
137,美丽心灵,4,不爱看励志片。。。。。。但这个例外
138,美丽心灵,5,Great script.
139,美丽心灵,5,天才跟疯子还真是一线之隔啊！！
140,美丽心灵,4,其实虚幻
141,美丽心灵,5,任何的剧本都比不上传记带来的震撼
142,美丽心灵,4,c幸直到今日才看了《A Beautiful Mind》。在F代物理理偏好多重v史的Yr，l又能否定适д感的精神病患，是因樗身於不同的v史？在模型相P真下，是否Mind = Universe？想起在病房e到的schizophrenia病友。xx，我可以稍微w
143,美丽心灵,5,疯狂而保持自我，约翰纳什不得不让我钦佩
144,美丽心灵,5,"""There are other things besides work."" ""What are they?"" 最让人痛苦的不是天才如何疯魔，而是在天才眼中，我们都只是凡人。"
145,美丽心灵,5,看了两遍，虽然第一遍是在思修课上半梦半醒地看完的。第二遍，很认真地看完了，故事很赞。所以说Nuts都是执着的，执着到疯狂，疯狂到精神分裂，但是能成为Nash一样的，就必须Go back，一切绕回原点。看到桌上排着的一支支钢笔，颁奖典礼后含笑的幻觉中的三人。感觉很幸福。@Home
146,美丽心灵,5,不要告诉我什么拓扑学！爱是一切逻辑和原由！
147,美丽心灵,4,★★★★  租碟年代，有点闷，但非常精彩，是不是有点矛盾？但我是这样认为的。
148,美丽心灵,4,好夸张的幻觉~
149,美丽心灵,5,很深切，一种追求，心灵的震撼……
150,美丽心灵,4,幻觉那一段真把我吓着了
151,美丽心灵,5,数学真好
152,美丽心灵,5,诠释真爱
153,美丽心灵,4,影片的纳什显然比现实中的幸福
154,美丽心灵,5,表演很强，故事也有新意
155,美丽心灵,5,又一部心理学课上看的电影，很感人。他妻子在他领奖的时候穿的是旗袍。
156,美丽心灵,5,当时觉得男主好帅……
157,美丽心灵,5,罗素克劳演的好好啊，为什么没获得最佳男主角
158,美丽心灵,5,妄想型精神分裂症
159,美丽心灵,5,我很喜欢的一部片子。
160,美丽心灵,4,"智商高的人情商都低~~~~~
娶了个好媳妇啊~~~~~
看到在普利斯顿的餐厅里，大家都把自己的钢笔给他和获奖感言的时候感动的哭了~"
161,美丽心灵,5,my favorate
162,美丽心灵,5,罗素克劳太大龄了，演的却真像
163,美丽心灵,5,最后一刻热泪盈眶。。。
164,美丽心灵,5,心理老师给我们看得入门片
165,美丽心灵,4,差点因为糟糕的片名而错过了一部好电影
166,美丽心灵,5,这世上没有一个正常的天才
167,美丽心灵,5,生命的构成，少不了爱情。
168,美丽心灵,5,迷惑观者!
169,美丽心灵,5,因为爱情~~
170,美丽心灵,4,大家都看哭了的片子看起来没感觉应该什么感觉呢
171,美丽心灵,5,"最让我心痛的精神分裂..世界上最美的爱情故事...因为这些都是真实的事情...精神分裂的数学家拿到诺贝尔奖..成就了他的一生却也毁了他

"
172,美丽心灵,4,片尾最好
173,美丽心灵,5,克罗影帝之作
174,美丽心灵,5,震撼 加 感动
175,美丽心灵,4,天才都是疯子~
176,美丽心灵,5,真实事件改编！爱情真是个伟大的东西！
177,美丽心灵,5,演的超好w而且剧情也超棒w
178,美丽心灵,4,"原谅我从那个黄段子开始正视这部电影 - -！

太经典了，男人对女人说，反正我们讨论的是液体之间的交流，不如我们直接进入性交主题。

哈哈哈哈，笑死我噶~~"
179,美丽心灵,5,m然t解故事基本不是真的，但音放涞奶感人了，CY上的致o太嘏，所以猿治逍
180,美丽心灵,4,挺好的
181,美丽心灵,5,很感人的一部影片，互相鼓励，不离不弃的相伴让人动容
182,美丽心灵,4,罗素克劳还蛮乖的 －－2002年第74届奥斯卡最佳影片、最佳导演、最佳女配角
183,美丽心灵,4,A-LEVEL时候看过 觉得是在警示学习数学的友人们...
184,美丽心灵,4,剧中最让我感动的是他的妻子，不仅不离不弃，更能一如既往地支持他，鼓励他！
185,美丽心灵,5,在这世界上，冥冥之中，总有一种东西是值得守候和期待的，那就是人性的光辉和爱，在人性的辉照和爱的感召下，残缺变的完美，腐朽亦会化为神奇。
186,美丽心灵,5,神片！
187,美丽心灵,5,我无法用言语来形容 这是一部多么伟大的电影
188,美丽心灵,5,震撼
189,美丽心灵,4,"Two beautiful hearts! ""You are all my reasons."""
190,美丽心灵,5,爱！只盼望他能多演几部偏文艺的片
191,美丽心灵,4,"I am only here because of you, you are the only reason I am, you are all the reason."
192,美丽心灵,5,有点遗憾的剧情
193,美丽心灵,4,极其传统的佳作，难怪会击败《指环王1》拿下奥斯卡，克劳奉献了堪称伟大的表演！
194,美丽心灵,5,十分成功的传记电影啊！
195,美丽心灵,4,典型的高质素商业片，就是有一点深度但又很容易解读，老少皆宜的励志片
196,美丽心灵,4,原声很棒，剧情很赞
197,美丽心灵,5,感动
198,美丽心灵,4,感动！真的很感动，是真实的故事，这就足够震撼了~
199,美丽心灵,5,"玩命儿推荐,此片大爱"
200,美丽心灵,3,幻想又有什么不好，至少多了三个爱你的人。
201,美丽心灵,3,唯一的BUG就是这样一个骚且妩媚而美艳的女人竟然精通数学。对现当代的人物传记片扔提不起兴趣。
202,美丽心灵,3,这种社恐型天才角色不是一般都会有着非常突出的魅力的吗？这部真的没有感觉到，完全无法对男主角共情，甚至觉得前半部的他相当烦人
203,美丽心灵,3,孤寂心灵最美丽，博弈幻影成三人。钢笔重于诺贝尔，感谢YY感谢妻
204,美丽心灵,3,相比卷福的图灵传，差了一些。对女性人物塑造太差，按说纳什太太既然是如此重要的人，可是片子里一直对这个人物几乎没什么着墨。不明白为什么纳什太太可以一直深爱纳什。纳什的病情到底如何好转，片子也描述的不够。基本上就像流水账一样的电影。
205,美丽心灵,3,嘎嘎
206,美丽心灵,3,被钪玖
207,美丽心灵,3,精神分裂的科学家，爱情很伟大
208,美丽心灵,3,中央六看的 
209,美丽心灵,3,可怕，闷。
210,美丽心灵,3,http://movie.douban.com/review/5379437/
211,美丽心灵,3,你若不离，我定不弃。生死相依。
212,美丽心灵,3,Russell Crowe宅男扮相是全菜
213,美丽心灵,3,那么回事儿
214,美丽心灵,3,激发了看Nash传记的冲动
215,美丽心灵,3,精神分裂真的会如这部电影所演的，彻底混淆现实么？
216,美丽心灵,3,规矩的传记片
217,美丽心灵,3,其实 每个人身边都有各种所谓的傻子疯子狂人。。。
218,美丽心灵,3,2013.2.28 0:06
219,美丽心灵,3,生活中的一切都有可能是自己想象出来的 不光是他 我们也不例外
220,美丽心灵,3,纯励志
221,美丽心灵,3,"你在我的眼里是否只是虚幻?
让我萌生了念心理学的欲望..."
222,美丽心灵,3,没想象中好
223,美丽心灵,3,他本人不怎么样，但有个好老婆
224,美丽心灵,3,"不知道事实的真相是怎样的
"
225,美丽心灵,3,同类片子里算是一般的
226,美丽心灵,3,看得我也不相信了。。。不过女主角把我给迷得。。。啧啧。
227,美丽心灵,3,这个老婆太伟大了！
228,美丽心灵,3,没有太大感觉
229,美丽心灵,3,指星星那一场我也用过
230,美丽心灵,3,对数学家有无与伦比的羡慕嫉妒恨
231,美丽心灵,3,天才永远不会停止思考
232,美丽心灵,3,表演啊镜头啊都蛮好，但是剧情未免太宓陌伞！！！Ｆ涫嫡馐遣迤，对吧？！
233,美丽心灵,3,前一部分出戏得厉害，后面慢慢才好。可就是因为前面的不靠谱，最后的落脚怎么看怎么觉得落得不实
234,美丽心灵,3,细节有点空，撑不起来= =，一看又是真实改编的，必定是被美化了。果然有人在这里爆出真相了。。。哈维的梗太有爱了
235,美丽心灵,3,女主靓爆了啊！！！
236,美丽心灵,3,"小波说,智慧本身就是好的."
237,美丽心灵,3,不喜欢这样的传记片，似是而非。
238,美丽心灵,3,还是第一次看到这样一部电影：在电影的中段就告诉你主角是精神分裂然后用大量篇幅去描写精分的内心的。
239,美丽心灵,3,电影没有现实精彩
240,美丽心灵,3,博弈论
241,美丽心灵,3,"爱是一切逻辑和原由。
"
242,美丽心灵,3,估计很大的卖点在于悬念。到一半时方知那些人都是假。可惜我刚看了［不要回头］，也知道了梗概。于是故事变得平淡。没传说中那么高大――虽然纳什本人还是非常令人震撼尊敬的。他的妻子在片中显得单薄，从身材，到情节设置。就是天上掉下来的。老年部分的化妆非常好，自然。
243,美丽心灵,3,重新标注一下，很多年前看过最近又重新拿来看，感觉片中纳什从正常到疯癫这块交代的有些突兀，之后的部分尚可，整体来看导演的态度还是倾向于平凡的生活并非天才的世界。康纳利美到爆，我其实蛮喜欢那个卷毛查理斯的，一直没看懂他到底在片中是真实还是虚幻的？
244,美丽心灵,3,还行，仅此而已。
245,美丽心灵,3,mind在这里不应该译作心灵吧，这里应该指的是智力，是我的话会译作“天才白痴”，又添油加醋了有没有，r(s_t)q~电影总是美好的，他一直爱她，她也一直没有放弃他，回头再看现实总会有那么点失望。
246,美丽心灵,3,拉塞尔克劳的演技 
247,美丽心灵,3,记得这片当时名噪一时，风头无二
248,美丽心灵,3,传记片。。。
249,美丽心灵,3,人格分裂什么的最喜欢了 
250,美丽心灵,3,励志片，还是一样的套路。
251,美丽心灵,3,我不太喜欢以能看见精神分裂者幻想的角度去演绎，这样降低了主角演技的难度，不过拉塞尔克劳演的还不错，影片总得来说缺少一个抗争的挣扎细节，有点乏力
252,美丽心灵,3,总觉得他的妻子也是他幻想出来的。。。。
253,美丽心灵,3,这片最厉害的地方应该是无比自然而又含蓄到位地将天才疯子一念间的精神世界视觉化，其他部分总的来说一般般……
