,movie,star,comment
254,美丽心灵,3,"纳什传~纳什均衡理论~
虽然和现实略有出入吧
纳什的主页：http://www.math.princeton.edu/jfnj/"
255,美丽心灵,3,不好看
256,美丽心灵,3,很闷
257,美丽心灵,3,不是我心中最好的拍精神分裂的电影。节奏对我来说有点缓慢。
258,美丽心灵,3,导演糟踏了那么好的故事和演员~
259,美丽心灵,3,冲着数学届我唯一的偶像约翰・纳什也该狠狠狠支持此片。
260,美丽心灵,3,"又名: 美丽境界 / 有你终身美丽 / 美丽心灵

导演: 朗・霍华德 Ron Howard
主演: 拉塞尔・克劳 Russell Crowe / 珍妮弗・康纳利 Jennifer Connelly / 朗・霍华德 Ron Howard

上映年度: 2001年12月13日
语言: 英语
官方网站: http://www.abeautifulmind.com
imdb链接: tt0268978
制片国家/地区: 美国
"
261,美丽心灵,3,没事别学数学
262,美丽心灵,3,2005看
263,美丽心灵,3,他其实是个自私的AH
264,美丽心灵,3,太奥斯卡了
265,美丽心灵,3,这演技，本来很有机会连庄影帝的
266,美丽心灵,3,军事等领域产生了深远的影响。但就在小约翰61福布斯-纳什蜚声国际时，他的出众直觉因为精神分裂症受到困扰，然而这并没阻止他向学术上的最高层进军的步伐，在深爱他的妻子艾丽西亚（珍妮弗61康纳利）的鼓励和帮助下，他走得虽然艰缓，却始终没有停步，而最终
267,美丽心灵,3,对它期望不要太高
268,美丽心灵,3,被剧透了
269,美丽心灵,3,Russell Crowe真的演得很传神
270,美丽心灵,3,在P4上放了N久，没事的时候看看。但看了N久，还没看完的电影...只能说我很忙..汗
271,美丽心灵,3,缺少真正骨头里面的强悍
272,美丽心灵,3,心理学教学参考电影...对没有深度的我来说沉闷了点.
273,美丽心灵,3,纳什能够获得最后的成功，克服痛苦，绝对与他个人坚强的意志还有他的妻子的支持分不开。或许上帝让他遭受了非人的痛苦与折磨，而那种情不自禁、难以抵抗的痛苦我明白，有些像是戒掉毒瘾。而正如他自己说的，他只是克制住他们。这需要勇气与毅力。
274,美丽心灵,3,拉塞尔克劳演技加分，不知是不是因为最近没什么心境看电影，再好的菜在我这儿都有点儿乏味
275,美丽心灵,3,美化Nash到了这个程度= =
276,美丽心灵,3,烂故事
277,美丽心灵,3,Nash经典泡妞理论 博弈论。天才都是疯狂的，看到后来才明白此片的经典所在！精神病啊，意想症啊，三重人格分裂啊！而且还会遗传啊！原来之前看的一起都是假的，从那个帅气的浪子室友，悲~
278,美丽心灵,3,除了一些黄色笑话，基本无感。
279,美丽心灵,3,第一次知道啥叫精神分裂
280,美丽心灵,3,演得过了。获奖的大反转也过了。
281,美丽心灵,3,《禁闭岛》跟这个有点像
282,美丽心灵,3,剧情发展有点慢。看过很多传记。感觉这个不算很出色啊。
283,美丽心灵,3,看到天才我就烦躁，什么时候我们也能得到同样的关注啊
284,美丽心灵,3,重温，高智商的人我一贯很崇拜
285,美丽心灵,3,这个让人怜爱的数学家～唉，老博喜欢的片子～
286,美丽心灵,3,装逼的罗素克罗让人失望
287,美丽心灵,3,主要剧情是描写情感与纳什的心路，几乎没怎么描述纳什的理论，有些失望。
288,美丽心灵,3,数学看不懂  传记看的累
289,美丽心灵,3,"""You are the reason I am. You are all my reasons."""
290,美丽心灵,3,只觉得开头搞学术的地方挺有意思，看的我都想搞学术鸟。其它一般般
291,美丽心灵,3,你奶奶的高数
292,美丽心灵,3,传记这么拍就sucks咯！用力过度的表演，虚实难辨的剧情，过于主旋律的价值导向，完美得没有个性，john nash的悲哀几人能懂？繁华背后的疼痛才是要突出表现的，太虚幻境神马的太虚飘
293,美丽心灵,3,可能真实情况太糟糕了，电影又全部美化，不仅不感觉正面力量，反而简直像讽刺
294,美丽心灵,3,苦难救了这个世界。
295,美丽心灵,3,@西方经济学
296,美丽心灵,3,所谓的天才总是不那么的完美~
297,美丽心灵,3,老师推荐去睇，于是睇了
298,美丽心灵,3,对于精神分裂...我有了非常生动形象的认识
299,美丽心灵,3,这是JohnNash的传奇。有生之年可以被拍成一部传世好电影没有白活啊~可惜我这辈子是没希望在普林斯顿见到他的。。。罗素克劳，云图那个警官，声音一出来真的很好听，低沉的声音果然我爱啊！[又是个精神分裂~]
300,美丽心灵,3,爱
301,美丽心灵,3,编剧还挺能编，真实的约翰・纳什内心中没有那三个人。
302,美丽心灵,3,怎么让我想起霍金？没头绪~
303,美丽心灵,3,感觉像被骗了一样。
304,美丽心灵,3,Russell Crowe演技+1星。和洛城机密里判若两人。
305,美丽心灵,3,美化的心灵
306,美丽心灵,3,可以
307,美丽心灵,3,视角转换的问题很严重，立场恍惚。当年拿到小金人大概还是因为其独特的属性。看来我是无论怎样也喜欢不上朗霍德华了，不过此君每每对于主流价值观的趋合都成功在意料之内，甚为钦佩。
308,美丽心灵,3,詹尼弗康纳利就是漂亮啊
309,美丽心灵,3,片名很奇怪，内容算ok。
310,美丽心灵,3,名气大而没达到我期望值的又一个片子..而且好长  - - 
311,美丽心灵,3,消费苦难。消费大家对科学的好奇。不喜欢
312,美丽心灵,3,他不存在，他是主角想像出淼模但蛲馑追走了女主角――Paul Bettany真是人生倮M！
313,美丽心灵,3,精神分裂患者。
314,美丽心灵,3,你会被自己打败，也可以打败自己。
315,美丽心灵,3,所以就这样成就了伟大么。
316,美丽心灵,3,我没哭。
317,美丽心灵,3,mess
318,美丽心灵,3,我不知道为什么这么多人给五星……
319,美丽心灵,3,思修课老师放的片子-.-
320,美丽心灵,3,这是天才带来的心灵鸡汤。★★★☆
321,美丽心灵,3,最后十几分钟这部片子才有点意思，总之难看
322,美丽心灵,3,hbo
323,美丽心灵,3,关于20世纪伟大数学家小约翰61福布斯-纳什的人物传记片。
324,美丽心灵,3,这个分裂拍的不错 音乐不错 still boring
325,美丽心灵,3,很遗憾，先看了《我所认识的约翰纳什》
326,美丽心灵,3,该电影可能对我意义重大，首先女主角的精神令人感动；其次，人物传记很难拍成好电影，因为每个人的一生应该是部电视剧，若要拍成好电影就要抓好题材；最后，我顺便查阅了一下人物原型约翰・纳什――消除了我先前对经济学及心理学的诸多偏见。最后提醒一下，翻译成“美丽心灵”实在太糟。
327,美丽心灵,3,没看完.
328,美丽心灵,3,伟大的爱
329,美丽心灵,3,A two-hour long story of a mad genius mathmatician.....
330,美丽心灵,3,Ron导太太太太太甜窝嫁!!怎么这么会拍惊悚啊么么大!!! 但是立意是不是太奇怪了= =+
331,美丽心灵,3,给女友写过英语影评
332,美丽心灵,3,有点假...
333,美丽心灵,3,受不了精分啊啊啊啊啊啊
334,美丽心灵,3,"片头曲不错，女主角也挺漂亮。画面不错。
"
335,美丽心灵,3,我这种很没耐性的女银居然会喜欢传记片。这是我到现在也想不通的地方。
336,美丽心灵,3,如果你精神分裂，你是选择相信自己，还是相信别人？
337,美丽心灵,3,幻觉都是幻觉，还好博弈论不是幻觉！
338,美丽心灵,3,中间有一段弄得跟紧闭岛似的，原来是爱情＋励志
339,美丽心灵,3,罗素克劳很耐看
340,美丽心灵,3,_素高，硬钪荆完全唔岩我。
341,美丽心灵,3,电影很好，但不做过多评价，有不好回忆
342,美丽心灵,3,他，依然安静的坐在角落。
343,美丽心灵,3,被Jennifer Connelly秒杀了 电影本身并无大爱
344,美丽心灵,3,"The people ,places, the moments most important to you are not gone ,not dead,but worse,they have never been."
345,美丽心灵,3,演技到位，编剧一般。
346,美丽心灵,3,nash--博弈论里的常客，不过没想到他的故事这么神奇。
347,美丽心灵,3,再一次证明奥斯卡的品位跟我不合
348,美丽心灵,3,他的疯狂仅仅源于想让这个世界记住自己。Jenny真美，比十二岁那年更多了份风韵。
349,美丽心灵,3,美丽心灵，照亮猥琐人生 [哈哈] 珍妮弗康纳利很美
350,美丽心灵,3,有点闷
351,美丽心灵,3,孤独、偏执造就奇才。
352,美丽心灵,3,当疯子还是正常人，这是一个问题。
353,美丽心灵,3,有点要挑战雨人的感觉。数学家的太太好漂亮啊。
354,美丽心灵,3,初次看完此片我有些怀疑自己的智商，为何会对那些幻想中的人物信以为真…但重温时发现导演其实根本没想让我们看出来。纳什的妻子很伟大，竟帮他在不依赖药物情况下恢复正常。
355,美丽心灵,3,女主角的日常生活装扮好漂亮，数学实在是太恐怖了，任何人在先天智力上的差距还是很明显的啊……
356,美丽心灵,3,读高二的时候，学校大礼堂播放《角斗士》，罗素・克劳在里面的形象让我久久难忘。《美丽心灵》是英雄的另一种演绎。每对情侣都有他们交流的方式，电影是你我之间的语言。
357,美丽心灵,3,我记得颁奖发言的时候还和幻觉开玩笑来着，怎么没有这情节了
358,美丽心灵,3,2.5星
359,美丽心灵,3,为虾米别人都很喜欢，我却没有印象
360,美丽心灵,3,三星半 虽然真实的情况没那么童话 但是宁愿被电影骗一回
361,美丽心灵,3,我喜欢数学家~~~呼呼呼~~~
362,美丽心灵,3,三星是为泡儿和康纳利，既然已经这么粉饰太平为什么还要借传记片的名号
363,美丽心灵,3,很治愈的传记
364,美丽心灵,3,结尾的演讲很经典
365,美丽心灵,3,还是本人的经历精彩
366,美丽心灵,3,惊讶于康纳利的美丽和魅力，罗斯的演技，扣一星脱离实际美化。
367,美丽心灵,3,剧本一般啊。。。詹妮弗康纳利挺投入。
368,美丽心灵,3,谁美丽？
369,美丽心灵,3,太沉闷了。
370,美丽心灵,3,技术宅有病妻子不抛弃
371,美丽心灵,3,7.9 励志
372,美丽心灵,3,天才在左疯子在右
373,美丽心灵,3,没觉得多好看
374,美丽心灵,3,我对此类片兴趣实在不大……
375,美丽心灵,3,三星半，罗素克劳演的不错，但我真是对这个故事提不起兴趣，整部电影在我看来没有什么亮点，可能天才的故事不适合我吧（这也说不过去啊，《社交网络》明明那么让我那么痴迷）
376,美丽心灵,3,"yy
"
377,美丽心灵,3,博弈论 纳什均衡 精神分裂 男主角演得好
378,美丽心灵,3,看这种电影真是，一点意思也没有，一碗白米饭
379,美丽心灵,3,哦。。。
380,美丽心灵,3,越来越喜欢Jennifer Connelly。
381,美丽心灵,3,挺有意志力！
382,美丽心灵,3,入门电影
383,美丽心灵,3,ccav配音听着闹心
384,美丽心灵,3,Nash Equilibrium真的是非常伟大的理论。。所以在看这部电影之前我把更多的期待放在了和博弈论发现有关的一切设想上。。虽然精神分裂的剧情也很扣人心弦，只是它不是我最想要的那盘菜。。
385,美丽心灵,3,上帝关了你这扇门，却为你开了那扇窗。
386,美丽心灵,3,就是打击我这样平凡的潘康
387,美丽心灵,3,06-01-18：故事悬疑设置的手法老套了些。
388,美丽心灵,3,实在一般
389,美丽心灵,3, 对传记类没爱，看前半部还以为是《禁闭岛》类型的 
390,美丽心灵,3,刹糠郑前後都可以成椴煌型的影。o奈
391,美丽心灵,3,谁可以忍受在两个交错的世界中挣扎？
392,美丽心灵,3,以后我不能看精神疾病的片子 看的我快精神分裂了……………………
393,美丽心灵,3,翻译大误。有这样的老婆真是太幸运了
394,美丽心灵,3,"他演的很娘
年轻时太老"
395,美丽心灵,3,还行吧，我对此不是很感冒。早说最喜欢的角色就是，，，，，Charles了。尼玛多帅
396,美丽心灵,3,"中间那段我真以为他是为政府工作的，是电影太成功还是我的脑子有问题，有点长，有点闷。天才总是寂寞的，那些寂寞的人总是少数，这个世界的90%都是average people,对于我们这些注定平凡的人，还是懂点人情世故的好"
397,美丽心灵,3,是个不错的电影，但要说是传记，就差了点
398,美丽心灵,3,近年最名不符实的奥斯卡最佳影片
399,美丽心灵,3,。。。有点牵强。。。。
400,美丽心灵,1,丑恶的道德投机，这是我看过最光鲜也最无耻的一部人物传记片。当传记片修成此种道路，离建D之路不远了罢。当年奥斯卡的加冕，怎么看都像是36年柏林奥运会的历史讽刺剧。
401,美丽心灵,1,此种电影（包括《心灵捕手》）充斥着对理论工作者（本片中还有对精神疾病患者、家属）的stereotype幻想，是一条源自创作者之无知的“康庄”歧途。他们身体力行将反智风潮传向世界~
402,美丽心灵,2,结尾太仓促。
403,美丽心灵,2,生活在幻想里
404,美丽心灵,2,反正我不喜欢。您将的是什么阿，你说了我也不想听 
405,美丽心灵,2,不感人，没啥意思
406,美丽心灵,2,数学好过头了也会造成困扰啊：）
407,美丽心灵,1,其实你们不知道精神分裂症的家人究竟有多痛苦，电影始终只是电影而已，现实比这残酷的多的多，周围人异样的阳光，内心挣扎的煎熬，生不如死的逼迫，如果你不能多思考，多开阔，多调节，你就是下一个精神分裂病人
408,美丽心灵,2,"07.10.5我需要很大的篇幅来描述我对这部片的感受.那与真实有关.与电影叙述的语言有关,就如同文字叙述的语言,我很久以来难以写字就是因为这些方面的困扰,因为观念的难以确立,因为total置疑.我讨厌腻情的语言,因为发现了它背后所有的错误,它可以被用来虚妄地赞美,也可以用来无耻地诋毁,总之可以被扭曲被利用,是不值得信任和鄙视之物,另外,如果从艺术上来说,它也是哗众取宠,虚假的,无真实情感的,或者幼稚的低级的东西."
409,美丽心灵,2,2011-05-25 周林同志发电影过来的。看得特别纠结。不过男主角克服幻觉的方法的确比较特别。某程度上也有励志的成分的。
410,美丽心灵,1,耐心看了俩小时看完了，没发现什么亮点，没看出纳什多么天才，爱情多么感人，或者多么努力奋斗。前半部分演了半天结果是一个精神病的幻想，这跟国产网剧什么分别？后半部分我以为会有精彩的地方，结果很平淡，平淡的也不知怎么的就得了诺贝尔奖。我想获得高分的原因是――美国出品，题材逼格高
411,美丽心灵,2,没法假装，缓慢前行的滞重感，把我看累了，过半后我放弃了
412,美丽心灵,2,不好看
413,美丽心灵,1,康纳利姐姐舍身相助
414,美丽心灵,2,看了三分之二了 实在看不下去了   就记得纳什无时无刻都在计算...
415,美丽心灵,2,不喜欢就是不喜欢
416,美丽心灵,2,自《国王的演讲》、《美丽心灵》之后，我不会再轻易的看这种励志片。
417,美丽心灵,2,#SIFF2015#之十四：千言万语化成四个字――理解万岁！（但你们这样胡编乱造故事真的好吗？
418,美丽心灵,2,又赶上一个传说很好，其实很次的经典烂片。评分那么高，大家都说好，你要是感觉不好你都得怀疑是不是自己的审美观有问题。但是，说实话，我真没觉得这个电影好。不知道是不是商业片的需要，好好一个传记给拍成了悬疑片。总之，我没看出纳什有多伟大，也没感觉出震撼来。
419,美丽心灵,2,有病得治。
420,美丽心灵,2,澳大利亚有科学家？
421,美丽心灵,2,什么奇葩玩意，这不逗我吗，本来女主倒贴的出场方式，我就很厌恶这个角色了，结果剧情走向给我来这出。。。一个字，guna
422,美丽心灵,2,pathetic! 94年别人来通知他被提名的时候，在餐厅他指着女服务员说他有个一样大的孩子，在哈佛，但影片里就有他的孩子是60年前出生。很假，还假的一点也不感人。
423,美丽心灵,2,是部好传记
424,美丽心灵,2,他的mind biu不beautiful我不知道，我只清楚我的心灵肯定没他最后那么beautiful。人类到底还是群居生物。
425,美丽心灵,1,个人觉得很不好看
426,美丽心灵,1,这电影拍的好恶心
427,美丽心灵,2,作为一部传记电影，过分夸大所谓爱情的力量与歪曲事实只能证明编剧是不合格的。
428,美丽心灵,2,数学真是世界上最枯燥的一门学科，整片下来看得无比烦躁。= =
429,美丽心灵,1,对我来说就是催眠曲，在断断续续看了1个半小时之后，我终于不可救药的在24:00之前睡着了……boring……sleeping……ZZZZZZzzzzz
430,美丽心灵,2,豆瓣TOP50榜，我也有打一星的。但那艺术无关。但这部作品实在太平庸了，把他放到大众作品我也只能打三星。故而打两星。总之，如白水，不好不坏，勉强看完。
431,美丽心灵,1,毫无看点
432,美丽心灵,2,没感动，精神分裂搞得跟智障一样。。现实中男主一点也不美丽。。除了他的数学天赋，倒是他老婆还挺美丽的
433,美丽心灵,1,文艺片不适合我，看了一晚上头疼欲裂。在1小时10分钟时忍不住关掉。
434,美丽心灵,1,我不认为这是个好电影。无论是编剧还是导演。这部2小时10分钟的电影前一半时间很拖沓，既没有挖掘人物本质，又没有放置留住观众注意力的动机。纳什只作为怪人出现（展览科学怪人），后一半变成没有太大悬念的悬念片，不过总比前一半容易忍受一点。天才的传记片难拍，是因为没人能理解自己不曾经历过的感受。所以导演的能力，和观众的承受力都决定了它只能是个装模作样的东西。
435,美丽心灵,2,"女主老年状真心差。
以后完全可以把自我救赎类的电影排除在我的片单之外了，就想恐怖片一样"
436,美丽心灵,2,虽然明白传记片就这样 但是太枯燥 三分之二实在忍不了叉掉了
437,美丽心灵,2,感觉这里的爱情什么的好假
438,美丽心灵,2,叙事手法有意思。
439,美丽心灵,2,这部电影没拍好
440,美丽心灵,2,的确很励志，的确打动人心，但不得不说前半部分真的太冗长，导演一次次的黑场做景别的切换，让一个好故事彻底成为流水账。
441,美丽心灵,2,nash's still not WEIRD enough..社交冷漠是演出来的而不是说出来的。相信看过书后你会对nash有比影像资料更深刻的了解。
442,美丽心灵,2,十几年前看的时候觉得不错，现在在看也就是典型的好莱坞流水线产品。。跟模仿游戏差不多。唉，这种人生真是没法被拍电影，怎么拍都是失败。
443,美丽心灵,1,当装逼的罗素克劳遇上装逼的豆瓣
444,美丽心灵,2,又一部获奖题材……幻想和爱情两条线的写法和拍法都非常平庸无聊……把我快给闷死了…实在太过誉了，看得我一直翻白眼而且生气，这样boring地花这么多钱拍一个这样的电影有意思不？这对真实人物的深厚感情也不够好啊！一看又是朗霍华德导演的………我擦，难怪了！我开始相信奥斯卡只是个名利场了
445,美丽心灵,2,一般 为什么会得奥斯卡？
446,美丽心灵,2,"同样,不明白为什么会被感动...可能还是因为对数学有种隔膜吧...哼!"
447,美丽心灵,2,经济学的诺贝尔奖，哥笑了
448,美丽心灵,1,把数学家送进精神病院的人应该得诺贝尔奖
449,美丽心灵,2,不适合我看。Jennifer倒是一如既往的美。
450,美丽心灵,2,流水账一样的人生，全无重点，除了结尾有点小感动，中间全是莫名其妙。励志？不觉得
451,美丽心灵,2,我怀疑下的版本有问题，好闷
452,美丽心灵,1,我可能有经典过敏症
453,美丽心灵,2,假
454,美丽心灵,2,这片子其实很做！！！！！
455,美丽心灵,2,我真的真的不能理解为什么分这么高 剧情拖沓 毫无新意 没有高潮和亮点
456,美丽心灵,2,深度迎合无知者对传记人物的浪漫构想审美，轻化精神障碍带来的痛苦和麻烦，结尾俗到没边的英雄主义直男编剧歌颂式表白，你看看人《星际穿越》在颂爱这方面是怎么铺垫才来得那么感人，你再看看你，重心都放在搞商业元素穿插各种悬疑套路堆挖陷阱，到了结局跟憋了半天脱裤子一蹲发现是个屁似的。权当詹妮弗康纳利的偶像剧看了。（时隔十年的二刷）
457,美丽心灵,2,A biography built up on unreal flattery of love. I don't see any beautiful mind all that I see is a pathetic mathematic jerk losing the ability to enjoy life and... response to his wife.
458,美丽心灵,2,虽然拍得蛮好看。。可是大量歪曲事实搞成一个全面正能量的故事还伪装成传记片这好吗？
459,美丽心灵,2,比起good will hunting  这片子给我的感觉真的也就两分 
460,美丽心灵,2,人格分裂的幻象，没有阻止伟大的科学家。
461,美丽心灵,2,好不好不是由是不是由真人真事改编来决定的。
462,美丽心灵,2,还是不喜欢人物传记
463,美丽心灵,2,奔着NASH EQUILIBRIUM去看的。原谅我，看到一半看不下去了。噢天啊@就是悲K世界e面的rusell crowe~ Jesus WHAT HAVE r光 DONE TO YOU啊H！
464,美丽心灵,1,de-gayed
465,美丽心灵,2,高级爱情片我这庸俗的人看不懂  但我明白好女人是男人一辈子的财富
466,美丽心灵,2,什么乱七八糟的。传记类型的片子琐碎不完整。
467,美丽心灵,2,夸大与不实到令人厌恶的地步
468,美丽心灵,2,很奇怪，我一点都不喜欢，看的时候甚至还以为自己看的是另一部《美丽心灵》。这部电影里的任何情节都给我一种莫名其妙的感觉，男主成名地莫名其妙，爱情来的莫名其妙，疯地也莫名其妙，自始自终都没有把这个真实的故事拍出真实感。也许是男主的世界本来就不真实，也许是我已经不相信这样的爱情是真实的
469,美丽心灵,2,一般。拖沓。
470,美丽心灵,2,真的很无聊
471,美丽心灵,2,闷得发慌。
472,美丽心灵,2,闷死了
473,美丽心灵,2,能扯
474,美丽心灵,1,2008-2-3
475,美丽心灵,2,科学geek的一生
476,美丽心灵,2,聪明人的烦恼
477,美丽心灵,2,"蛎和热莶辉觞N有共Q,可能形容女主角吧,也是套失望之作><"
478,美丽心灵,2,对本片无感
479,美丽心灵,2,正值斯诺登事件让美国人头疼之时，央六播出了这部电影
480,美丽心灵,1,"很明确地说我不喜欢，哪怕这部电影有了奥斯卡撑腰
能把纳什演成个白痴，我真服了你们了
你们根本不了解纳什！
看看原著吧，笨蛋！"
481,美丽心灵,2,不是电影不好，是我不够内涵……
482,美丽心灵,2,我也就是来看天才的
483,美丽心灵,1,拍得跟电视电影一样...可惜了这么好的故事和表演
484,美丽心灵,2,莫名其妙。个人认为室友的演技比男主的好看。
485,美丽心灵,1,评五星估计都是爱屋及乌。---传统认为“人不为已天诛地灭“，博弈论纳什均衡：双赢可以有。
486,美丽心灵,1,各有各的感觉吧
487,美丽心灵,2,没什么亮点，真的
488,美丽心灵,2,既不美丽，也不心灵
489,美丽心灵,1,这片子太假了。我尊敬纳什，敬佩纳什。但这电影里完全就是另一个人啊！不如去看传记啊！
490,美丽心灵,2,我不适合看这种电影。。。
491,美丽心灵,2,我的老师八卦说纳什自己很讨厌这部片子，觉得拍的不是他。说真的，这部电影我没看明白
492,美丽心灵,2,精神分裂为主角的电影看一两部就够了
493,美丽心灵,1,快乐的小二逼
494,美丽心灵,1,越看越觉得自己才他妈像个精神病。这类题材的电影真让人讨厌。
495,美丽心灵,2,并不觉得好看.....
496,美丽心灵,2,不知为何对美国这类型的电影就是不感冒
497,美丽心灵,2,真心无聊 对我来说
498,美丽心灵,2,不知道怎么说，康纳利很美，后半段很糟糕
499,美丽心灵,2,看睡了两次
500,美丽心灵,1,i don't like this part
501,美丽心灵,2,为什么评分这么高。。我感觉非常一般
502,美丽心灵,2,Russell Crow 就是拍不出好片，鉴定完毕！
503,美丽心灵,2,个人觉得有点闷。
504,美丽心灵,1,找不到双星的理由……
505,美丽心灵,2,电影是电影，生活是生活
506,美丽心灵,2,我喜欢看关于天才的作品，但这部电影却好像不怎么样
507,美丽心灵,1,G故事真的好无聊。女主角的面相总给我一种很刻薄的感觉。
508,美丽心灵,2,又一部弱于生活的烂片
509,美丽心灵,2,不喜欢
510,美丽心灵,2,"1.当你想告别某个坏习惯是，不去理它，让它自生自灭。2.我以为最后他会和老朋友告个别something like that，如果是这样我会多加一星。3没什么感觉的公认好片。
原来你是悲惨世界里的警察啊，加一星吧2014.1.25"
511,美丽心灵,1,SB犹太左派电影
512,美丽心灵,2,不喜欢男主角的长相
513,美丽心灵,2,没看完，不好看，欣赏不了。。意大利片就是矫情
