,movie,star,comment
441,猫鼠游戏,2,这样子来说 就拍得有点无聊了 
442,猫鼠游戏,2,这也叫高智商？傻子太多，骗都骗懒得骗了。唐博士看后一定会毫无压力。
443,猫鼠游戏,2,没有找到高潮，对于这个阵容，他太平庸了。
444,猫鼠游戏,2,老斯减一星。汤叔减一星。纳多叔叔再减一星。
445,猫鼠游戏,2,莱昂纳多演太多人生赢家了，所以拿不到奥斯卡。
446,猫鼠游戏,2,我怎么觉得有点……那手法真能骗到吗我说？每看到各种粗制滥造的骗术就蛋疼
447,猫鼠游戏,1,不好看，郁闷，看一半删了
448,猫鼠游戏,2,冲着莱昂纳多来看的，看后对高评分很失望。鉴证别人的牛逼是没有意义的，重要的在于收获和成长，这点我完全没有感受到。如果将它看作商业片，那观影感觉又比较无聊。很普通的一部电影
449,猫鼠游戏,2,故事很好，拍的很次
450,猫鼠游戏,2,聪明个屁，根本讲不通。
451,猫鼠游戏,2,看了半天觉得很没意思 反正放到现在是不可能完成的事情 男主拍泰坦尼克号的时候这么帅 没帅几年就残了 记得他那种痞痞的样子简直迷死人了 怎么看着里面感觉脸要不要这么肥 没办法 我是颜控 还有下飞机的那段也是笑喷 从马桶那钻下去 不臭么
452,猫鼠游戏,2,完美阵容 却教人失望
453,猫鼠游戏,2,看完很失望，既然是斯皮尔伯格拍的，还是汤姆汉克斯和莱昂纳多共同主演的，那么只给两颗星。
454,猫鼠游戏,2,浪漫的近乎失真的英雄犯罪励志电影，既然是真事改编，好莱坞的魔力非同小可。开头用精致的动画交代梗概。小李子风一般的少年，机长，医生，律师。结尾由坏人变成好人也是蛮拼的，家庭，友谊，信任。打光也比较柔和，看的超朦胧。喜欢的桥段倒是圣诞节那个告诉真地址的自我救赎，老鼠哲学
455,猫鼠游戏,2,我擦这怎么那么高的分……
456,猫鼠游戏,2,一点印象也没有。可见真不好看。乏善可陈。
457,猫鼠游戏,2,很久以前看过的  当一部喜剧剧情片的话我可能会打四星吧 现在只是疑问为什么斯皮尔伯格会拍这么一部任何方面都没有开创性、也没有什么特定意义的商业傻乐电影？
458,猫鼠游戏,2,知乎王大路过去的  真人真事改编 感觉没有真人精彩  情绪没有到位 只是故事比较有趣  插叙的手法并不高明 看着不舒服 r(st)q  真人属于家庭对孩子的影响之重 内涵感觉还可以拔高  警察是阿甘哦~（不知道为什么感觉好像 阿米尔・汗 ）
459,猫鼠游戏,2,比SPY GAME 难看，还没人家音乐好听。
460,猫鼠游戏,2,几乎看不下去 有点扯吧
461,猫鼠游戏,2,也许是我跟大众口味最不相符的一次打分
462,猫鼠游戏,2,==确实节奏太慢，剧情也不紧凑。丢下作业没写来看的，有些失望
463,猫鼠游戏,2,直到我翻出多年以前的空间APP看电影才知道我看过这电影还写过影评。居然一直放在豆瓣想看列表 由此可知综上所述烂片一部。
464,猫鼠游戏,2,"很多人都觉得这部电影讲述的是一段天才的传奇，但我真的只觉得是一场天才孤独的独角戏。影片的前半段讲了不知道讲的个什么鬼，又臭又长，拖尽了影片的节奏，一场“猫捉老鼠”的游戏，至于那么多累赘的情节吗？影片后半段才是精彩亮点，一片金发美妞，加上一个帅气的机长，吸引足了观众的眼球。因此这部片子在前后上有着较大的情绪落差感，让人有点失去胃口。
"
465,猫鼠游戏,1,这部电影本身就是一个骗局，营造了一种有颜值不要脸就能当骗子的幻觉，骗一些傻乎乎的少年只要有颜值不要脸就能成为一个骗子，而实际上按照电影里说的去做一定是立马就会露馅。
466,猫鼠游戏,1,从这片儿的给分来看，我对豆瓣很失望。剧情恶俗无知到极致。并不是谁都认为Lenardo长得很帅好么。
467,猫鼠游戏,2,不觉得有什么好看的
468,猫鼠游戏,2,不知道骗骗骗的有什么好看的，骗子的长处是做什么都镇定自若，稳如泰山
469,猫鼠游戏,2,其实有些没看懂。。
470,猫鼠游戏,2,啥玩意儿啊= =
471,猫鼠游戏,2,仓促而漏洞百出的童话，可惜导演忘了这电影的题材不是童话。再次见证豆瓣哈洋一族的强大。
472,猫鼠游戏,2,这部电影给我的感觉就是，如果不是有张小李子这样的脸，有多少次都不会成功的啊。与其说是犯罪片倒不如说是家庭温情片或者主旋律纪录片？
473,猫鼠游戏,2,这片看着有点尴尬，我也不知道它的类型定位是什么。当年看华尔街之狼本来是想一窥华尔街高管的生活结果竟然是部恶搞片。这个电影里的手法应该不能复制吧，要不然美国的银行业航空业也太水货了。
474,猫鼠游戏,2,让偶联想起CCTV8播过的伪装者~！
475,猫鼠游戏,2,不好看，没想到是斯皮尔伯格的。
476,猫鼠游戏,2,1.斯皮尔伯格的电影现在看最大的问题就是太规整，给不了观众任何惊喜，节奏慢的不行，甚至2倍速观看都一点问题没有；2.小李子一直拿不了影帝也是有原因的，上天给了他完美的外貌，但是离激情迸发的天才演员还是差那么一点；3.有时候努力还是需要遇上自己真心才可以。
477,猫鼠游戏,2,这个剧本拿给昆汀一类的导演应该会拍的很精彩吧，主角在不同城市不同职业的差异、小聪明不正经这些个性的体现，都可以拍的变化多端，逻辑不严谨也可以用幽默和调皮盖过。但斯皮尔伯格一贯的严谨陈述，把故事的多元面都定格在很统一的背景里，难免让人用严肃的眼光去挑剔故事的逻辑性，或者只沉浸在故事本身而忽略电影的魅力。另外导演几部电影都加入了黄段子来调节气氛，好突兀，像是强制加入的元素，反而觉得导演本人还真是很正统啊～（海报一定要设计的这么丑吗）
478,猫鼠游戏,1,挺无聊的~~
479,猫鼠游戏,2,不够紧张
480,猫鼠游戏,2,真失望~
481,猫鼠游戏,2,如果硬要在里头选个最佳演员也只有Christopher Walken 诈骗题材真不是斯皮尔伯格强项
482,猫鼠游戏,2,亮点是什么？
483,猫鼠游戏,2,从前我没得选，现在我想做个好人
484,猫鼠游戏,2,斯皮尔伯格黑。
485,猫鼠游戏,2,＜肖像克的救赎＞的翻版
486,猫鼠游戏,2,未成年天才诈骗犯与敬业闷骚FBI探员之间相爱相杀的故事，剧情向爽剧。17岁的Frank凭借胆识、机敏与变态情商伪装成了泛美航空副驾驶员周游列国，用哈佛医学院假文凭混成当班医师借机撩妹，又自学两周成为律师。香车美人，游刃有余，而警员Carl则一直像Tom追Jerry一样被耍得团团转，一追一逃之间生了感情，成为亦父亦友的好CP。
487,猫鼠游戏,2,一个没原则的骗子
488,猫鼠游戏,2,我会告诉你预告片比正片好看么 正片感觉很拖沓呀
489,猫鼠游戏,2,评分这么高是怎么回事
490,猫鼠游戏,2,犯罪天才，现实生活中有吗？编剧就忽悠吧。
491,猫鼠游戏,2,好多情境觉得很假，可能是时代和地域的原因吧。比如面试医生，难道不会问一些专业问题么？这么容易糊弄过去？假扮飞行员只要一身制服就可以……
492,猫鼠游戏,2,真tm是个天才，在小白眼里。。。老汤值一颗星
493,猫鼠游戏,2,节奏超级慢，浪费了一个小时，考
494,猫鼠游戏,2,天才少年犯的从良，没什么意思。
495,猫鼠游戏,2,超级恨骗子，这个骗子并没有高超的伪造技术，而是靠着光鲜的外表和恭维的说话技巧转移注意力使人忽略对辨识真伪的细节。
496,猫鼠游戏,2,纯靠莱昂纳多的颜撑完了整部剧…肿么能这么无聊
497,猫鼠游戏,2,实在不明白为什么这部电影会这么高分。。。
498,猫鼠游戏,1,看不下去...
499,猫鼠游戏,2,他为什么忽然就爱上那个女的啊，why？？
500,猫鼠游戏,2,又是一个误入歧途的天才被救赎的故事。以诚信度为基础的国家系统，在初次诈骗的预防上可谓最大漏洞。
501,猫鼠游戏,2,外国就是不一样啊，被抓了没后台还各种待遇成了专家
502,猫鼠游戏,2,显得别人都是傻逼吗？
503,猫鼠游戏,2,看不下去。。。即使他很
504,猫鼠游戏,2,"8.9的分数虚高严重，不能追究深度，只有表面浮华。
不像故事像人物传记，最终却只有嘻嘻哈哈，添上去的情感始终苍白。
Ps: 我发现小李子的粉丝真的多，讨论组有人提出质疑。能打个几百字反驳，我看了却也没信服。 另外泰坦尼克号时叫帅，现在何必尬吹。"
505,猫鼠游戏,2,当听力练习挺好的
506,猫鼠游戏,2,"三大高手联手打造,却让人很是失望的一部影片."
507,猫鼠游戏,2,收藏了这么久，拿出来准备提升一下观影体验，没想到原来看过的小说现在这么没意思……
508,猫鼠游戏,2,不是我想象中的那样・・・
509,猫鼠游戏,1,2016电影。豆瓣这评分也给的太高了吧。典型好莱坞电影，夸张剧情，追啊追，逃啊逃，艳遇穿插其中。中间部分勉强可以。开头太嗦没有直接进入紧张剧情。
510,猫鼠游戏,2,10年前看应该会觉得精彩，看了一截没看完，只想说有其父必有其子啊哈哈
511,猫鼠游戏,2,全靠李子的颜撑起一片天 这么高分难道是因为粉丝电影脑残多
512,猫鼠游戏,2,故事可以给10分，但是在短短2个小时里想把这么好的故事讲清楚很难，结果就拍成毫无逻辑。
513,猫鼠游戏,2,没啥创造力。
514,猫鼠游戏,2,剧情一分，渴望家庭的孩子走向了造假支票的道路，太没逻辑了。还有一分给小李子的脸，实在是太帅了
515,猫鼠游戏,2,斯皮尔伯格总觉得观众是傻逼吗？
516,猫鼠游戏,1,天的道德^・・不Γ只是主角h得不合意。
517,猫鼠游戏,2,"总体来说并没有想象中那么出彩,不过真心佩服这个神通广大的骗子.所以说智商好重要"
518,猫鼠游戏,1,什么烂玩意儿。有莱昂纳多也不行，长了张好脸，就是不会演戏。
519,猫鼠游戏,2,我真是闲的去看15年前还是斯皮尔伯格的片
520,猫鼠游戏,2,冲着演员去的，失望
521,猫鼠游戏,2,期望越大失望越大
522,猫鼠游戏,2,有一类片子叫斯皮尔伯格随手拍...
523,猫鼠游戏,2,觉得挺难看的，冗长拖沓，后面快进看完的。。。
524,猫鼠游戏,2,一切都太假，虽说是真实改编。在同类片子里水平不高，尤其是剧作方面。
525,猫鼠游戏,2,"难看
"
526,猫鼠游戏,2,典型商业片~~
527,猫鼠游戏,2,果然对于斯皮尔伯格不太感冒
528,猫鼠游戏,1,我认为真的很不好看
529,猫鼠游戏,2,小李子没有泰坦尼克号里面那么帅 剧情一般吧 看完感觉整体一般
530,猫鼠游戏,2,大失所望
531,猫鼠游戏,2,我的忘了说什么了。减一星。
532,猫鼠游戏,2,营销 = 学习+推销
533,猫鼠游戏,1,开头就看不下去，试了很多次都没办法。
534,猫鼠游戏,1,什么几把玩意？看的我都睡着了！
535,猫鼠游戏,2,不值8分，对手太弱，周围人全是笨蛋。
536,猫鼠游戏,2,差评，太聪明了我嫉妒
537,猫鼠游戏,2,斯皮尔伯格已经不适合21世纪了
538,猫鼠游戏,2,意思不大，这样的人现实中根本施展不开来的
539,猫鼠游戏,2,跟书比就....
540,猫鼠游戏,2,废话多
541,猫鼠游戏,2,看简介就行了
542,猫鼠游戏,2,I studied for two weeks and I passed :)
543,猫鼠游戏,2,一个骗子骗来骗去，没什么意思把。
544,猫鼠游戏,1,有点蠢
545,猫鼠游戏,2,斯皮尔伯格是好莱坞很老套的导演，故事很无力，甚至可以说是惨淡。
546,猫鼠游戏,2,汤姆大叔永远都是站在宇宙中心呼唤爱型的角色
547,猫鼠游戏,1,这也太幼稚了，如果单独看剧情，我还以为是网络神剧。
548,猫鼠游戏,2,说实话，看完后完全没什么感觉，只是没想到这是真实的事情。
549,猫鼠游戏,1,这么有趣的题材拍得云里雾里的 难看至极
550,猫鼠游戏,1,从剧情来看，真没啥意思。
551,猫鼠游戏,2,这部电影除了撸颜之外没啥好说的了，剧情虽然紧凑但总感觉缺了点什么，像一直在等高潮结果发现高潮过了。又短又软，难戳G点
552,猫鼠游戏,2,又臭又长，就是不待见斯皮尔伯格，美国最大的钛金五毛！
553,猫鼠游戏,2,不好的回忆
554,猫鼠游戏,2,拿观众当傻逼...
555,猫鼠游戏,2,斯皮尔伯格的这部作品太让人失望了
556,猫鼠游戏,2,不太习惯这部电影的风格 配乐给人奇怪的感觉 不过这部里面的小李子倒好像没那么让人讨厌
557,猫鼠游戏,2,撒谎脸都不红的么，好孩子不要撒谎，让我来拉低评分
558,猫鼠游戏,2,普普通通，大导庸作，最后十秒其实能为其加分
559,猫鼠游戏,2,恕我不能认同影片的三观，对罪犯的宽恕就是对犯罪的鼓励，这不是什么大国心胸，这不过是小民意淫。
560,猫鼠游戏,2,恕我不能认同影片的三观，对罪犯的宽恕就是对犯罪的鼓励，这不是什么大国心胸，这不过是小民意淫。
561,猫鼠游戏,2,"小李乳臭未干，
大汤老态龙钟"
562,猫鼠游戏,2,根本看不下去 第一次体会到什么叫生理反应的厌恶 我居然会有道德洁癖 震惊
563,猫鼠游戏,2,好无聊啊……
564,猫鼠游戏,2,剧本不错……不过小李演啥都特别用力……
565,猫鼠游戏,2,不得不说，尽管是小李子和汤姆汉克斯也不能表达出原著小说里的万一。你很难想象，现实中真实存在这么一个人，我对此只有一句评价“卧槽牛逼！”
566,猫鼠游戏,2,男主不是骗的最高境界，他妈才是
567,猫鼠游戏,1,浪费时间，演技又太次，汤姆克鲁斯都能完爆之。
568,猫鼠游戏,2,美帝太好骗了吧？
569,猫鼠游戏,2,So boring
570,猫鼠游戏,2,看不了这种片，很是尴尬。
571,猫鼠游戏,2,看得我睡着了
572,猫鼠游戏,2,扯上了天，分明不是主角智商太高，而是有些观众太傻
573,猫鼠游戏,2,结局总是拯救和偏向天才的
574,猫鼠游戏,1,相当一般的片子，一直觉得斯皮尔伯格很一般
575,猫鼠游戏,2,好困...
576,猫鼠游戏,2,没看进去
577,猫鼠游戏,2,这电影真睿智
578,猫鼠游戏,2,眼花缭乱的变戏法。现代人最爱戏法大师了。
579,猫鼠游戏,2,Y智^程]有想像精采
580,猫鼠游戏,1,十足平凡的电影。
581,猫鼠游戏,2,故事不错 拍得没感觉
582,猫鼠游戏,1,这样的人生也就只能那个时代骗骗，现在都是小儿科了
583,猫鼠游戏,2,有点无聊……
584,猫鼠游戏,2,出来那一段  小李子冒充警察的那段戏还能看  其他到底哪里来的悬疑点
585,猫鼠游戏,2,一刷没看懂，希望有一日可二刷。
586,猫鼠游戏,2,无聊，还140分钟，弗兰克真人再厉害，电影也只是让我认为这是小李子在卖肉，还是制服诱惑
587,猫鼠游戏,2,不喜欢有装逼嫌疑的高智商互斗
588,猫鼠游戏,2,可能是看多了？没惊喜_
589,猫鼠游戏,2,不好看啊。。。。
590,猫鼠游戏,2,又被忽悠了，不过里昂那多的制服和雷朋行头可真帅
591,猫鼠游戏,2,这个猫鼠游戏还挺有趣的，敬请观看……
592,猫鼠游戏,2,为啥评分这么高。就是一个天才的随意人生啊。
593,猫鼠游戏,2,晕，打过分啊
594,猫鼠游戏,1,感觉好无聊啊，如果是普通导演拍的，大家都会打一星吧
595,猫鼠游戏,2,看到这部总会让我对小李子的另一部，名为飞行者的传记电影赞不绝口
596,猫鼠游戏,2,号称高智商电影，实在看不出哪里体现了，看在汉克斯表演的份上给两颗星
597,猫鼠游戏,2,现实与荧幕的距离被艺术手法无限扩大。
598,猫鼠游戏,2,没看懂，，，，get不到小李子的帅
599,猫鼠游戏,2,美国真是什么职业都有
