,movie,star,comment
243,猫鼠游戏,3,剪接不怎么高明，表演的话要数Christopher Walken最优。开头怎么回事，No.3连开口的机会都没有，导演是把他忘了吗！
244,猫鼠游戏,3,谁说有大牌演员还有大牌导演就是好片儿
245,猫鼠游戏,3,自由是相对的，那句“没有人追你”亮了~~不过貌似和本片主旨关系不大
246,猫鼠游戏,3,大牌的导演，大牌的演员，有失水准的电影……
247,猫鼠游戏,3,听到了Girl From Ipanema
248,猫鼠游戏,3,3.5Frank本人的故事加分啊~好基友啊好丽友~~
249,猫鼠游戏,3,看过电视版的猫鼠游戏反而觉得这个是小儿科了...- -
250,猫鼠游戏,3,莱昂纳多算是本色演出吧，tom让我想起了汤姆和杰瑞。。。
251,猫鼠游戏,3,第一次看的时候11岁。看着看着睡着了。现在被商法老师作为案例，看如何伪造票据。
252,猫鼠游戏,3,如果不是真人真事，这片也一般了
253,猫鼠游戏,3,传奇的高智商犯罪的故事，但除了片头叙述很乏味，对手戏不出彩，逃脱更是靠lucky而不是smart。成名果然要趁早啊，人生上半场靠欺诈混迹名利场，下半场还可靠反欺诈当FBI坐收专利费...【有两只老鼠掉进了奶油桶里，第一只很快放弃被淹死了，第二只则不停地跑呀跑，直到把奶油搅拌成了黄油，跑了出来。】
254,猫鼠游戏,3,高中毕业典礼学校居然在首次启用的新礼堂给我们放这个…
255,猫鼠游戏,3,可惜2位影帝飚戏没有期待的精彩，好在还了年轻人一个赎罪的机会没有置于死地，好人总有好报因为他毕竟是错在父母离异心理难以承受转而以非正当手段赚大把的钱以弥补内心空虚，当听说巴巴死了看到心爱的麻麻有了另一个标准配置的家庭一切都崩溃了.. 好在有一个好警察..
256,猫鼠游戏,3,莱昂纳多从监狱里出来进FBI上班之后被如山的文件吓得逃走那一段（当然为了电影的需要后来他又回来了），真是揭示了上班比坐牢还难熬这个深刻的道理啊！
257,猫鼠游戏,3,看到结束才回想起来原来这部电影当初我看过...
258,猫鼠游戏,3,烂电影周最后一部 依然在与处于疯癫状态的大怪扯淡中度过。。。其实我好好看应该会给四星的-3-
259,猫鼠游戏,3,他是全球最权威的伪造专家~~~感觉他只是害怕寂寞向往自由以及想让父亲过上好生活。
260,猫鼠游戏,3,到底我喜欢的电影是哪种?
261,猫鼠游戏,3,那时莱昂纳多的演技真不敢恭维
262,猫鼠游戏,3,这不就是讲了一个装逼的熊孩子吗 还不如飞天大盗有意思
263,猫鼠游戏,3,"Cooperation from Spielberg, Tom Hanks and Dicaprio? So disappointed and boring. He is not a genius, he is just childish.His farce sucks."
264,猫鼠游戏,3,真理就是，聪明人不管做错了什么都会被原谅！片头大好
265,猫鼠游戏,3,我觉得这片子拍的差劲极了！一点都不流畅！配乐听都听不出，故事很琐碎！不知道为什么有这么高分！
266,猫鼠游戏,3,相tomhans我愿萌dicaprio..
267,猫鼠游戏,3,那时候的莱昂纳多和汤姆汉克斯真年轻，不过电影本身没啥意思，毕竟是02年的，距现在都过去12年了。
268,猫鼠游戏,3,小李子年轻的时候不是一朵花就可以形容啊 太喜欢那飞行员扮相了 再挽几个空姐 各种阳光清纯 故事看了没任何感觉 中规中矩吧 
269,猫鼠游戏,3,"只要用心,看电视都可以看成个专家"
270,猫鼠游戏,3,只是听了一个聪明小子的传奇故事。还有一些努力藏起来的说教。
271,猫鼠游戏,3,还是由衷的佩服Frank W. Abagnale本人，老汉克演得还是很低调的
272,猫鼠游戏,3,RW{多一娃娃也能_@N多人，全然制服T惑。
273,猫鼠游戏,3,不算难看，就是过于中规中矩缺少灵气，不够狂放，电影过于保守的在铺一个关于自我救赎的故事，让它本该有智慧的地方变得太过简单，莱昂纳多和汤姆・汉克斯之间的化学反应不足，该斗智斗勇的地方都很薄弱，有点遗憾。克里斯托弗・沃肯不错，餐厅和莱昂纳多对话那场戏展现了一个老戏骨该有的实力。
274,猫鼠游戏,3,你追我如果你追到我，我就让你……
275,猫鼠游戏,3,只有一点感悟，生活的孤独。黑格尔“想要成功就别要求自由”。
276,猫鼠游戏,3,Leonardo DiCaprio，Leonardo DiCaprio，Leonardo DiCaprio，Leonardo DiCaprio，Leonardo DiCaprio，Leonardo DiCaprio，Leonardo DiCaprio！！！
277,猫鼠游戏,3,I like the chick.
278,猫鼠游戏,3,蜻蜓点水般的叙事，所以什么炫酷技术或者头脑风暴统统没有，只剩下了莱昂纳多一张年轻英俊的脸
279,猫鼠游戏,3,老美真是不拘一格降人材啊，不过我下载的版本不好，是电视台播放的版本，剪切混乱。
280,猫鼠游戏,3, Men like us are nothing without the women we love. 
281,猫鼠游戏,3,神奇少年父母离异后改姓换名印支票钓美眉前能进ICU见死不救后可登高堂面不改色终被温情蜀黍感化迷途知返精忠报国之弗兰克正传。
282,猫鼠游戏,3,祝 LeonardoDiCaprio的戏越来越好！
283,猫鼠游戏,3,拍的太他妈不紧凑了~~~
284,猫鼠游戏,3,"catch me if you can
智商高了怎样都不会难过的哈哈哈"
285,猫鼠游戏,3,也算是两大巨星吧。还不错。
286,猫鼠游戏,3,开头那段有点闷，不过我想要这样的frank
287,猫鼠游戏,3,The Skywayman居然是真人真事
288,猫鼠游戏,3,100884 --猫捉老鼠--2013.07.24
289,猫鼠游戏,3,"只要你煞有介事,就会有人对你敬若神明。"
290,猫鼠游戏,3,原来white collar是从这来的。分数这么高至于么，我觉得导演想把frank渲染得悲情点但有些力不从心，演员也没有太多发挥空间，hanks和dicaprio感觉也不是很来电，真心不如white collar啊
291,猫鼠游戏,3,当年看的时候主演、导演统统没听说过，青葱岁月，嗯。
292,猫鼠游戏,3,他好像没有过交心的人，他爸爸并不理解他，他爱人呢？是个傻傻的女孩，那是爱吗？也许是，也许是出于保护的物性，她妈妈？他是一个悲剧，其实最纠结的在于这个世界上与他频率接近的只有那个追捕他的人。
293,猫鼠游戏,3,7.0/10 分。剧情我都忘记了。感觉很多细节不靠谱，过于浪漫化了。。。
294,猫鼠游戏,3,过人的智商要用在对的地方~~
295,猫鼠游戏,3,"感觉没有大家说的那么好看,演技是没得说，可剧情就比较平淡了"
296,猫鼠游戏,3,本片最令我击节叫好的还是它居然是由真人真事改编，也许事件中多了些戏剧性，但主角的年龄想必并无出入：一个犯罪天才般的少年，他该庆幸他生在了美国。奇怪，为什么我会觉得斯皮尔伯格将如此传奇人物的故事拍得不温不火，因为他的人生已然足够惊人了吗？我到不了他的内心。不过，本片的片头堪称惊艳。
297,猫鼠游戏,3,拍得太轻了，就是个温情脉脉的游戏，还有开场致敬Hitchcock干啥，没意思。
298,猫鼠游戏,3,我承认自己对春风化雨的情节缺少抵抗力~
299,猫鼠游戏,3,又是受了电影版碟片的影响，一看这种劣质的画面我就昏昏欲睡，导致这片讲啥我都忘记了。当时我有没有看到一半睡着了？
300,猫鼠游戏,3,明明是个死不悔改的骗子，还大打这种亲情牌洗白真是让人浑身不舒服，一日为贼，终身是贼，三观接受不能
301,猫鼠游戏,3,片头帅，男主太嫩了
302,猫鼠游戏,3,"2008年8月
WH"
303,猫鼠游戏,3,汉克斯和斯皮尔伯格都浪费了
304,猫鼠游戏,3,编剧都不敢这么写，但却是真人真事系列
305,猫鼠游戏,3,Jen那个角色多CIA agent啊
306,猫鼠游戏,3,原02年小李已初F像
307,猫鼠游戏,3,到底是为什么，这个男人总抓不到这个男孩?
308,猫鼠游戏,3,原来oppo手机的slogan是这儿来的
309,猫鼠游戏,3,电影版leverage但要早很多
310,猫鼠游戏,3,Frank is just a lonesome kid.
311,猫鼠游戏,3,最经典的绝对是一个妓女给了她400块然后和他做爱，只是为了找开一张1400的假支票~乱世出英雄啊，现在社会是有秩序了，但有才的人就少了啊~不喜欢这个节奏，老是老鼠，猫不知道在干什么~针锋相对的太少了~斯皮尔伯格永远在讲孤独的孩子的故事~讲的那么动人~他究竟有多孤独~整个片子最让人心碎的就是他隔着玻璃问小女孩她的妈妈是谁~而最温情的是最后一句，弗兰克和卡尔到现在为止都是好朋友。
312,猫鼠游戏,3,主人公原型的Frank本身经历是很有意思很吸引人的，只是拍成这样一部叙事温情又波澜不惊的电影，多少有些不够跌宕起伏，同时也并未被打动。获得四十多次奥斯卡提名的大神John Williams这次的配乐并不惊艳，倒是Leonardo表演出色。片头与海报都很漂亮。★★★☆
313,猫鼠游戏,3,Spielberg名大于实。
314,猫鼠游戏,3,"watched it in the fraud class, it's more interesting than i thought. actually not all of tom hanks' movies are boring :p"
315,猫鼠游戏,3,一个孩子从小骗子到大骗子最后转正的完美故事
316,猫鼠游戏,3,老斯的一部电影是否牛逼，在于他融入了多少心力和情感，是在“拍”还是在设计和创造。
317,猫鼠游戏,3,在央视看了段结尾，莱昂纳多好年轻
318,猫鼠游戏,3,活在谎言里很爽，但久了就累了
319,猫鼠游戏,3,看过电视剧版应该不会给这个电影版高分吧，可能是想强调dicaprio的人性面，但各种用破碎家庭来煽情，没劲。一如既往get 不到小李子，但是Christopher Walken也太迷人了！
320,猫鼠游戏,3,“活在谎言里永远比活在现实里容易”；you are what you wear的最好诠释，但我一直觉得这是个悲伤的故事，他有一个不愿他stop的父亲，一个另组家庭的母亲，他在世上是如此孤单。当一个人可以愚弄整个现代社会、政府，自由地来去，如果没有人分享，他的快乐是多么得飘渺。
321,猫鼠游戏,3,你追我跑的故事
322,猫鼠游戏,3,影子有点长，只因月光洒在肩膀，你笑着说，要再抓住我，我低下头，逃脱....
323,猫鼠游戏,3,这个人居然是真是存在的。。。这人生过得太多姿多彩了吧，难得主角明目张胆地骗财骗色也能演得如此魅力
324,猫鼠游戏,3,不是很喜欢 演技派的支撑
325,猫鼠游戏,3,就那样 怎么说呢 没啥惊喜 也没啥失望 
326,猫鼠游戏,3,配不上这样的豪华阵容
327,猫鼠游戏,3,法律面前也许真是人人平等，但貌似这个世界对天才会有格外开恩，可惜的是，这种天才在某些人眼中只是一个拥有特殊能力的工具而已，尤其是那些犯罪的天才
328,猫鼠游戏,3,冲着年轻稚嫩的莱昂纳多看的..原来是White Collar的原型啊..
329,猫鼠游戏,3,节奏太慢了 看着没意思我都走神了
330,猫鼠游戏,3,梦工厂真人故事改编，Frank Abagnale加上Warner.Bros制作的飞行家Howard Hughes，莱昂纳多无疑演得十分到位！赞呐！
331,猫鼠游戏,3,cat ch me if you can
332,猫鼠游戏,3,say.Tom Hanks在小李门缝里飞出来的一张支票其实是・阿甘正传・的羽毛吧.斯皮尔伯格插入各种各样的影史名作桥段其实很好玩哈哈
333,猫鼠游戏,3,传奇故事。不知道这种冒险和游戏的态度算不算美国精神的一个侧面呢。
334,猫鼠游戏,3,用知音体说，是不是每个罪犯内心都是个孩子……
335,猫鼠游戏,3,我无法从影片中看到更多的人文意味与父子之情，我们的体验来自我们的经验，弗兰克的遭遇是他的心路历程，我惊讶于影片为何丝毫未表现出初次行骗的惊惶与怯弱，得出结论就是，从片名就是典型的类型片套路，斯皮尔伯格用支票和黄油为我们揉出一个矫揉造作的角色，不论怎么说，奥斯卡欠莱昂纳多一个影帝
336,猫鼠游戏,3,也只有单亲家庭才能诞生如此集智慧与成熟与一身的男孩...但为什么总觉得最后这个转型却是扼杀了这个犯罪奇才全部生命的精华...
337,猫鼠游戏,3,没想象中的那样斗智斗勇，其实只是一个孩子渴望能挽回自己家庭而误入歧途最后回归正道的故事。片尾才发现这是根据真实故事改编，挺吃惊的，没想到真有人这么能骗。
338,猫鼠游戏,3,中学时，每周五放学后必要在碟片店逗留很久，一张张翻，感兴趣就买下。那时候看电影的热情现在根本没法比了，当时很多电影一出来就去找碟看，现在下了高清的扔在电脑里好久都不会打开。。这也是当时看的电影之一，实在不觉得有多深印象，但逍遥法外的译名我觉得比猫鼠游戏更有神。当年还读了原著，摔。
339,猫鼠游戏,3,造假达到大师级也不错啊
340,猫鼠游戏,3,"不好看,虽然是tom hanks..."
341,猫鼠游戏,3,很厉害的骗子.不过仅限高帅的才能装富阿..还得对美女柜员下手.
342,猫鼠游戏,3,三星半。每次都是靠运气= =
343,猫鼠游戏,3,比起犯罪片来更合适的是“传记片”，因为比起犯罪来，描写更多的其实是人物的状态和心理。
344,猫鼠游戏,3,Steven Spielberg / Tom Hanks / Leonardo DiCaprio
345,猫鼠游戏,3,史匹堡老爷子的创作巅峰是不是已经浪去了？近年已经看不到如此引人的故事片了。
346,猫鼠游戏,3,这是我不太喜欢的一部斯氏电影，尽管有我最喜欢的汉克斯参演
347,猫鼠游戏,3,最耸的是，电视上放，我跟我爸妈说，“这我看过”。接着小L就和女N配接吻了，然后就没有然后了= =
348,猫鼠游戏,3,作为真实改编的故事，斯皮尔伯格用心良苦地淡化处理了那些很容易表现酷炫的高智商犯罪手法，把人们的注意从噱头转向猫鼠游戏中。
349,猫鼠游戏,3,it's a greater compliment to be trusted than to be loved.被别人信任比被别人喜爱更是一种敬意。
350,猫鼠游戏,3,Fanfan @图文 2F
351,猫鼠游戏,3,故事本身很精彩，可惜，有限的时间，表达更多的内容，编排上略显不足。
352,猫鼠游戏,3,亦师亦友，在彼此寂寞的一生里，懂得的人话都不需要多说，惺惺相惜的两人，殊途同归。
353,猫鼠游戏,3,"好久没有看电影什么睡着了。。。
"
354,猫鼠游戏,3,莱昂纳多帅到让我看到他的脸就想起前男友，特别是穿着飞行员制服戴着蛤蟆镜的样子。他们都一个德性――帅气，聪明，内心稚嫩，当意识到自己无所归属便将对家庭的渴望深埋在心底，假装独立地茫然追寻着自由。
355,猫鼠游戏,3,Great story yet sluggish story-telling. Amy Adams was such a cutie back then.
356,猫鼠游戏,3,情节太快 不够令人激动的感觉 这么传奇的人物怎是短短两小时讲的清楚的
357,猫鼠游戏,3,每个人的成长都是疯狂的，有些人还顺便逼疯了全世界。弗兰克本人绝逼比电影里演的更富有传奇性，电影140分钟的流水线叙述太平庸啦！很容易让观众误以为弗兰克每次转换身份的时间都很短，其实不是的，他靠行骗当了6年飞行员、1年医生、9个月律师还有3个月大学教授，被捕时只有21岁！
358,猫鼠游戏,3,整部影片的节奏感哪里不对，似乎镜头的切换和部分地方的配乐不太适应整个故事应有的紧凑，观影中数次高预期后的故事情节相对平淡，叙事方面线索感不强，显得有些镜头就多余了…即便如此斯皮尔伯格的很多镜头拍得还是很赞，莱昂纳多的各种制服西装换来换去还是很养眼…！
359,猫鼠游戏,3,虽然是真人真事儿，但是一切都显得太容易了，缺乏真实感……其实挺喜欢，就是不过瘾。
360,猫鼠游戏,3,看了一半才想起来，那部同类型美剧不就是这部电影的后续故事嘛，真够迟钝的。。。
361,猫鼠游戏,3,。。。。。
362,猫鼠游戏,3,电影讲述了一个FBI史上最小通缉犯的犯罪故事。 其实他做的一切只想父母复合重建曾经幸福美满的家庭。但即使他再聪明绝顶、神通广大也终是徒劳。电影中把男主活在谎言中的孤独和对美满亲情的渴望表现得真实动人。
363,猫鼠游戏,3,看简介的时候我还以为特别高智商，结果高智商的斗争都斗争的特沉默，唉。。。还是在海航飞机看完的结尾
364,猫鼠游戏,3,这是所谓美国的主旋律影片吧：只要有才能 犯了罪也没关系 故事发生的年代真是一个美好的年代啊
365,猫鼠游戏,3,比较佩服现实生活中的真人。电影不喜欢。
366,猫鼠游戏,3,关于骗术的细节，还是不够细。（小裂：细个球！要看细的自己拜师做骗子去）
367,猫鼠游戏,3,拍摄手法是非常成功的商业片，情节很吸引，但我并没有在其中看到什么智力元素，纯粹是靠各种戏剧性的巧合来吸引观众的，关于亲情等等的描写，总体来讲是中庸之作，迪卡普里奥还是那么花瓶。。。可以一看，但不值得记住。
368,猫鼠游戏,3,"打算去看嘞,@人太髌媪造v史啊!!! 片^和配芳有!!! X得^程中假冒得太]什N技g含量我就失去d趣看嘞  型的重要性啊,_始小李子那型.... 岳父岳母一洗碗一擦碗彼此N著跟著台的音[屁股那一幕真剀. 最搞笑是那著志名字的小板板~"
369,猫鼠游戏,3,有一个翻译比较直接：《猫捉老鼠》
370,猫鼠游戏,3,The Flash! 我觉得Amy Adams既能演Louis Lane，也能演Harley Quinn....兜兜转转，其实也只是想要个完整的家，有人在乎....I should have been a pilot! What is your name?
371,猫鼠游戏,3,高智商罪犯，一个伤了心的孩子。
372,猫鼠游戏,3,谈高智商电影是夸大其词，如果说是浪子回头的励志电影更合适。小莱年青时帅得一塌糊涂，这让一众花痴女配角们的表演有了说服力。
373,猫鼠游戏,3,失望。
374,猫鼠游戏,3,与其说这是一部警匪犯罪之类的片，倒不如说是一部教育片。不过这孩子确实有才，比如最经典的是他和妓女交换支票，省了一千美刀，还挣了四百，唉，都不知道到底是谁为谁服务...
375,猫鼠游戏,3,擦最后是不是和原来那妹子结婚...
376,猫鼠游戏,3,在内心深处，他需要的是一个父亲和一种认同。开挂的人生啊
377,猫鼠游戏,3,FBI居然都是吃干饭的-0-
378,猫鼠游戏,3,主角都老了，跑龙套的都成了主角
379,猫鼠游戏,3,以真实人物的传奇经历改变而成的典型好莱坞电影。
380,猫鼠游戏,3,还行，有点意思。但是片头和整个故事没关系，还有剧透的影响能力，是个败笔。
381,猫鼠游戏,3,剧情挺无聊的，没啥特别亮点，不过觉得结局很不错
382,猫鼠游戏,3,为神马要搞暧昧。。
383,猫鼠游戏,3,小李总觉得有那么点儿不是帅而是忧伤的别扭。
384,猫鼠游戏,3,小李好年轻。。不过我是觉得这部电影很无聊
385,猫鼠游戏,3,牛掰闪闪的人生就是这么出现的
386,猫鼠游戏,3,艾米亚当斯带牙套也美到爆。
387,猫鼠游戏,3,这个社会工程学 也是门艺术
388,猫鼠游戏,3,十年而已，好莱坞电影的气味已经变了。这电影现在看有一种非常明显的时代感。smells like an old auntie.
389,猫鼠游戏,3,"这还没看到三分之一我就过来刷豆瓣了好吗。。三分是不是都给多了(￣￣"")"
390,猫鼠游戏,3,一个引人入胜的传奇，硬生生的让斯皮尔伯格拍成中规中矩的童话，超级失望，斯导镜头下的社交心理学基本就是人有多大胆，地有多大产，让《飞天大盗》那些专家情何以堪。两星半全给年轻的小李吧。
391,猫鼠游戏,3,别再美化罪犯了！！！
392,猫鼠游戏,3,三星半，我还是高中的时候，在书城买过这部电影的正版VCD，没错VCD哈哈哈！现在翻出来重看里面的卡司很有看头了，可以看见带牙套花痴的Amy Adams，以及更加花痴的实习医生格蕾做空姐真的哈哈哈哈…  诈骗剧情挺有意思的，20年前的小李演高中生真是得心应手这个角色找不出更合适的人选了！！
393,猫鼠游戏,3,和弱点类似，关于救赎与温暖结尾的方式很阳光，多一分肯定，但难掩叙事的平淡，鸡汤与无聊一锅煮
394,猫鼠游戏,3,纯情男孩和善良大叔不得不说的故事
395,猫鼠游戏,3,   一名失足天才少年在一位有爱的警察大叔敦敦教诲之下重返正途的故事・・・
396,猫鼠游戏,3,根据真人真事改编的，还挺佩服那个人
397,猫鼠游戏,3,WHITE COLLAR原型。Ellen Pompeo，Amy Adams，Jennifer Garner都来客串了~Frank真是个传奇~
398,猫鼠游戏,3,".....
当作发条橙看了好久哦..."
399,猫鼠游戏,3,不知道为什么，没我想象的精彩
400,猫鼠游戏,2,怎么能这么无聊呢。。。
401,猫鼠游戏,2,一部所谓的高智商电影其剧情和诈骗戏居然设计的如此幼齿恶俗，整部片子唯一亮点只有片头。史匹堡，你斩茸鲐浚
402,猫鼠游戏,2,忘记什么时候看的了，反正是好看死了~ 现在看简介才发现里面那个护士是Amy Adams，看来当时确实还不是很出名的啊...
403,猫鼠游戏,2,n年前看过的FBI案例改编成电影结果这么无聊
404,猫鼠游戏,2,很一般，作为 斯皮尔伯格 的片子，太差了简直
405,猫鼠游戏,2,我都快睡了2013.3.19电影频道
406,猫鼠游戏,2,这电影顾头不顾尾，一点说服力都没
407,猫鼠游戏,2,2003/2/8 ua telford
408,猫鼠游戏,2,虽然只是十年前的电影，但感觉没有那种“经典”味道，十年之后看是一种很老旧的感觉。
409,猫鼠游戏,2,其实我心里知道如果这片子不是莱昂纳多演的话我会给个稍微高点的分数的。我就是看他的得色劲不顺眼！唉，赤裸裸的偏见啊。Watched with Don on the plane.
410,猫鼠游戏,2,斯皮尔伯格真是让人反胃，这个是看电影频道看的很逗，演员都不错，但是导演的品位实在低・・・・就是商业片的感觉，垃圾食品吃的时候很欢乐，吃完了很没味儿
411,猫鼠游戏,2,"警匪片？不是，整部电影出动的警车大概不过五辆； 
悬疑片？不是，从片子一开始就知道骗子是谁； 
其实捏，这是一部励志片，澹不信自己看去。 "
412,猫鼠游戏,1,汉克斯应该为自己的演出自卑
413,猫鼠游戏,1,即使阵容超级强大依然无法否认是部大烂片，目前居然有8.2，我觉得豆瓣上的人都疯了~
414,猫鼠游戏,2,看得是枪版 但是总觉得不好看
415,猫鼠游戏,2,从剧情来看 真没啥意思~~
416,猫鼠游戏,2,虽然是斯皮尔伯格的，但是不合口味就是不合口味
417,猫鼠游戏,2,他都好年p，我就喜g看真人真事改。
418,猫鼠游戏,2,6.6分。这类真实事件改编的传记电影最难拍，太容易就拍成这样的流水账。不过，真是行行出状元呐！
419,猫鼠游戏,2,拍的这么没劲的片子，我竟然打着哈欠看完了。。。
420,猫鼠游戏,1,第一次看莱昂纳多这么帅，原来是之前发型不对。
421,猫鼠游戏,1,这种电影就是典型的劳命伤财
422,猫鼠游戏,2,很傻逼好吗
423,猫鼠游戏,2,不是很经典，节奏很慢
424,猫鼠游戏,1,太扯淡，太假。蒙谁呢？
425,猫鼠游戏,2,"对这种剧情片越发没感觉了. 这么嫩的莱昂纳多..,和jack没什么两样啊,.舍友都不敢相信他是那个吹可卡因的莱昂纳多.....2星送给希区柯克的经典配乐和开场动画,"
426,猫鼠游戏,1,该导演的最烂作品
427,猫鼠游戏,2,斯皮尔伯格的烂片，那么多喜欢的真是怪了。
428,猫鼠游戏,2,其实我觉得斯皮尔伯格没有真正有内容的好电影。
429,猫鼠游戏,2,两星半，无感，前面父母感情铺垫不足以至于不理解他这样做的动机，中间骗人有些炫技，没有认认真真的交代支票，后面结局也是醉了你要不说这是真的再减一星，斯皮尔伯格的调度就是典型的学院风啊
430,猫鼠游戏,2,一个半小时就可以讲完的故事讲了快两个半小时…又臭又长！
431,猫鼠游戏,2,没意思，故事情节没意思，没动感情，浪费感情
432,猫鼠游戏,2,今天什么情况，几部高口碑影片都折戟！本片是高智商行骗的类型，但看下来这方面的感觉一点都没有，就是，不够“骚”，如果你看过华尔街之狼你就一定会明白我在说什么，一个高智商的人他怎么可以不骚呢？
433,猫鼠游戏,2,过于精心设计地流畅出无聊的流水账。由真实故事改编得格外假。
434,猫鼠游戏,2,。。。真的很无聊啊。。。
435,猫鼠游戏,2,现在的电视剧会好看点。电影的动画片头还是让我觉得挺好看的，话说你见过17的少年眼角就起了明显皱纹的么
436,猫鼠游戏,2,三个臭皮匠顶个诸葛亮，三个诸葛亮却让人失望
437,猫鼠游戏,1,我想说，我米有看懂...哈哈哈
438,猫鼠游戏,1,"生活中没遇到过这种人，也没有经历过五六十年代美国那种环境，很难想象一个仅通过看电影和与人谈话能把医生飞行员律师这种极其专业的人演的逼真的骗子是种什么状态。只能说被他骗的人太二逼，fbi太二逼。
这货要是连看六部碟中谍是不是都能去爬迪拜塔了"
439,猫鼠游戏,2,败了。。
440,猫鼠游戏,2,经济犯犯罪手法高明，只不过这抓捕过程还能再脑残点？
