,movie,star,comment
114,猫鼠游戏,4,一直想起马特达蒙，觉得两个人风格有点象（仅对此类天才犯罪）。看到110分钟，被剧情左右，明知不可能，还是希望frank永远不被抓住。
115,猫鼠游戏,4,故事原型实在太碉堡了，十几岁就把整个世界玩转在手上，40岁的灵魂穿越到了16岁？21世纪的人穿越到了60年代？与其说是高智商诈骗，不如说骗术其实玩的是情商，人心其实太易被蛊惑了，我们都有自己的专属弱点。顺手推荐英国真人秀《骗术真相:The Real Hustle》。
116,猫鼠游戏,5,好萌。我就喜欢傻兮兮的警长和女王样的骗子。话说，white collar是不是根据这个来的？
117,猫鼠游戏,4,影片由真实案件改编，讲述了主角弗兰克不可思议的犯罪经历和具有传奇色彩的一生。汤姆・汉克斯在片中甘当绿叶，而莱昂纳多・迪卡普里奥却大放异彩。影片在摄影、服装等方面表现出色，匪夷所思的剧情更是会激起观众浓厚的观影兴趣。总的来说，这是一部充满神奇、欢乐、智慧的电影。
118,猫鼠游戏,4,@部片我想起天才雷普利，那一咏^明怎佣纪２涣耸值陌缪葜e人，那部片是灰色的，而神鬼交ht是ZS色的，不同的色{，我都很喜g。_子砭筒蝗菀祝m然活在e言e比^容易，但每耶Q，老鼠只能打o咪V苦，@世上其只有咪懂得老鼠。（我猜妙警\探或S也⒖剂松窆斫讳h吧！）
119,猫鼠游戏,5,迪卡布里奥太帅了吧！如果不是值班 我也很久没在深夜看电视 还是CCTV6 。对于真人真事表示 智商高不解释
120,猫鼠游戏,4,片头动画太有意思了，十分吸引人。全片一气呵成，剧情相当流畅。Frank其实只是个缺爱而不自信的孩子，他的犯罪实际上都笼罩在父亲的阴影之中。莱昂纳多那时候还依然很嫩。另外，片子很适合被新东方推荐。
121,猫鼠游戏,4,大才用来作恶就是毁天灭地，用来造福于民就是功德无量
122,猫鼠游戏,5,Leonardo 有点小性感在里面 有几个镜头很像 Tony！ 配乐也是我喜欢的
123,猫鼠游戏,4,http://kankan.xunlei.com/vod/movie/22/22695.shtml
124,猫鼠游戏,4,"Two little mice fell in a bucket of cream. The first mouse quickly gave up and drowned. The second mouse, wouldn't quit. He struggled so hard that eventually he churned that cream into butter and crawled out. Gentlemen, as of this moment, I am that second mouse."
125,猫鼠游戏,5,看的时候总想到心灵捕手。除了第二次给警察打电话设计的有点突兀以外其他都很棒。我倒是希望他成功，他爸爸被美国税了那么久。我一直以为最后他又跑掉了，结果没想到被招安了。
126,猫鼠游戏,4,背后那一首首诡异的老歌，不曾告诉你，此片在表达什么样的情感与内含。由此我甚至怀疑，这也许不过是一部专门为莱昂里多和汉克斯飙演技而拍的片子，可无论如何，还是不由得跟着这个故事百感交集，也只能赞扬其中那不言而喻的真实与生动了。
127,猫鼠游戏,4,少年列昂那多真的帅气逼人啊，汤姆汉克斯在里面倒是演了一个不那么让人喜欢的角色。总的来说是个有意思的故事，一个有两把刷子的导演，整个电影还是欠缺了点什么，平庸得过了头一样。
128,猫鼠游戏,5,造假高手改邪归正，被政府招安变身打假超人~克里斯托弗一个眼神就让人觉着是那种诡计多端的老油条~！
129,猫鼠游戏,5,有这么天才的人，不论是做诈骗还是反诈骗都游刃有余，当然他还要有一个像长者一样关怀他引导他的捧哏.。。。
130,猫鼠游戏,4,Catch Me If You Can (2002) 【 t782c7aaa4 】
131,猫鼠游戏,5,故事根据真实故事改编，弗兰克阿巴内尔“二十世纪最非凡的骗子”，因为父母离异而离家出走，当过假飞行员，假医院夜管医生，假律师等等，制造了很多假支票骗取数百万美元。电影讲述了父母离异对小孩心灵的创伤，弗兰克就像一个迷途的羔羊一样，失去了人生的方向，一场追逐的猫鼠游戏就这样展开了
132,猫鼠游戏,5,让我想起了高三时用一个晚自习看完原著的感觉。电影改编了不少，但是显然是高手之做，故事叙述方式非常成熟，明星云集且表演精湛，只可惜占了原著约一半的监狱经历没有拍出来。很成功的电影，2个多小时看得很愉快。
133,猫鼠游戏,5,能让巨骗进FBI，这份惜才的胸襟才是一个民族强大的原因。电影中，弗兰克每每在圣诞节前夜和那位探员打电话，而被其猜中他是真的没有人可以联系了，这种重伤和看穿的话语，让弗兰克的内心激起了涟漪，他想到父母的离异，父亲对自己的漠不关心，而母亲则是对自己不闻不问，只有这个探员一直在绞尽脑汁地抓捕他，和他玩玩猫捉老鼠的游戏，原来他是这样的寂寞和孤独，没有人会在这种特别的日子里想到他，这种来自内心的孤独渐渐转化成一种恐慌和绝望。
134,猫鼠游戏,5,Two little mice fell in a bucket of cream . The first mouse quickly gave up and drowend. The second mouse wouldn't quit. He struggled so hard that eventually he churned that cream into butter and crawled out.
135,猫鼠游戏,4,繁复讨巧的叙事，幽默不单调。清瘦的小李子，漂亮的娃娃脸，眉眼中天然的一点点毒辣气息，完美匹配了角色。与其说电影拍得好，倒不如说角色选得巧。
136,猫鼠游戏,4,李奥的发福已经有所迹象，这么精彩的片子我想不通怎会有人嫌它无聊，以及片中李奥和汉克斯的猫鼠关系实在太过暧昧，“你骗我说你没有结婚的”“我是结过但已经离婚了”有爱啊
137,猫鼠游戏,4,"“Carl,why r you so sure?”“You see,Frank,nobody's chasing you.”亦敌亦友，妙趣横生。"
138,猫鼠游戏,4,2008-8-25 23:53:21 8/7.7(99846) 看着挺魔幻的，和史搞飞有一拼
139,猫鼠游戏,5,节前在家温习了遍，还是很好看~一个温情的骗子，一个温情的FBI agent. 很少的技巧，可是这么流畅朴实的剧情让人好像喝到一锅慢慢煲出来的热汤，舒服极了。
140,猫鼠游戏,4,故事很神奇 我到现在也没弄明白小李子究竟怎么鬼使神差当上的副机长？
141,猫鼠游戏,4,我怎么看着是一个迷途少年和FBI大叔之间好基友的故事呢・・・・・时隔六年又看一遍，frank就是个渴望家庭的孤独孩子，他走上犯罪初始道路是因为想把自己父亲失去的夺回来，让父母破镜重圆。他在圣诞夜趴在母亲家门外实在让人难过。        你想选择真实的生活还是谎言呢？所以最后踏实的生活着，难以想象这是真实的故事，索性有个好结局。
142,猫鼠游戏,5,当年的小李子啊正当年啊！两个多小时丝毫不觉得拖沓，人物都很出彩，爸爸的角色大爱！主题音乐也很棒！脑子聪明真是好啊！
143,猫鼠游戏,5,又是根据真实故事改编的，好神奇，真是世界之大，无奇不有，天底下还有这种能人。我觉得雷奥纳多的演技已经很不错了。
144,猫鼠游戏,4,"谐趣横生,又总有一丝孤寂似有似无环绕左右.阿巴戈内尔自然是骗技出众,但至少最大的漏洞在于小李自己...倘若你没有帅到这个份上,显然很多骗术你是施展不出来的......"
145,猫鼠游戏,4,和谐版的《华尔街之狼》的即视感。小李子当初还是挺青涩的，汤姆汉克斯基本算打酱油的华丽丽男配了。艾米亚当斯的牙套还是挺萌的。
146,猫鼠游戏,4,没有做不到，只有想不到。司法考试的朋友啊，学习一下吧！
147,猫鼠游戏,4,属于纯真年代的传奇的人生，天才的迷失：家庭的伤害导致玩世不恭疯狂的去逃避去放肆，生活在谎言里的世界比呆在现实更容易，哄完别人哄自己，孤寂的背后还是需要爱与家庭的归宿。
148,猫鼠游戏,4,另类传记片，因为感觉斯大爷的其他神作水平有差距，就给四星吧
149,猫鼠游戏,4,根据真人真事改编的剧情很有传奇性，演员们都很好，斯皮尔伯格的亲情调调有点让我受不鸟。。。片头做得很好，既有复古的感觉又暗示了后边的剧情。这是一个只可能发生在美国的浪漫故事，要是在中国，莱昂纳多早就在看守所了躲猫猫了。
150,猫鼠游戏,5,本来准备看《发条橙》的，结果硬是给我出现了这本，我说看着看着这么小李子出现了。同名美剧的创意是有这个来的吗？
151,猫鼠游戏,5,一部很怀旧的影片，一部斯皮尔伯格很特别的影片，一部很温馨的影片，一部很有人情味的影片，一部不应该错过的影片！
152,猫鼠游戏,4,家庭启蒙教育真的很重要。剧情还不错，真人真事改编，只是结局有点平淡，以为老鼠逃跑了，结果是和老猫成为了好朋友。
153,猫鼠游戏,5,精品，不露声色中已经动人，貌不惊人，出乎意料。不可错过的好片子。
154,猫鼠游戏,4,"Do whatever you want to earn a life, but excel at it."
155,猫鼠游戏,4,让我想起了《天才瑞普利》。马特达蒙和莱昂纳多饰演的两个骗子前者镇定阴冷后者阳光机灵，两者心机同样缜密的让人震惊。两部电影的结局都带着讽刺意味。
156,猫鼠游戏,4,一直都很喜欢传奇故事，尤其是一个能随心所欲伪造假支票的天才
157,猫鼠游戏,4,看完以后只想说 果然我还是很喜欢小leo的。
158,猫鼠游戏,4,警匪片都能如此温情，三番两次的圣诞歌好煽情。小李子好charming，汤叔的忠厚老实范儿也很讨喜。
159,猫鼠游戏,4,说实在的觉得小李子演这种角色不够戳……虽然就演技来说足够灵足够坏，但大概他就是长得不够聪明（喂。
160,猫鼠游戏,4,很不错哦，虽然中间纠结了一下，不过这是真实故事改编，真实的环境下的确不会那么顺利，那么完美。。不过结局很完美。。。
161,猫鼠游戏,5,我喜欢这样的类型的传记电影，莱昂纳多的演技也是从此片开始愈发的如火纯清。
162,猫鼠游戏,4,很多中译名都有译到电影精髓，你追我赶惺惺相惜最后猫鼠成了一家。
163,猫鼠游戏,5,莱昂纳多演技没话讲。每一分钟都很精彩，造假和实施犯罪的过程令人着迷。片中温情的地方毫不做作，看坏人被宽恕回报社会比看他被惩罚要舒服得多。再来真实事件改编，又为影片增光增彩，同时不禁赞叹男主原型的牛逼。
164,猫鼠游戏,4,原型人物更精彩牛逼。steven的片子不会有啥问题，增加更多戏剧冲突，因为父母离婚受伤离家出走的聪明孩子，渴望被关注渴望交谈。片头很有趣，现在好多电影不做片头始终让人觉得缺点什么。小李的演技点赞！！汉克斯也不错91但他这个角色本身没啥难度。
165,猫鼠游戏,4,也许是小李走形前的最后一次银幕帅形象。其实还是觉得马特戴蒙更适合这类高智商角色
166,猫鼠游戏,4,当年28岁的拉昂纳多演绎16岁的少年 居然可以不让人怀疑 太嫩啊！！有木有！！到底是什么时候开始变大叔的啊！！！！
167,猫鼠游戏,5,哇！一个16岁的孩子，先是装作飞行员混在航空公司，然后当医生，通过司法考试成为律师，甚至最后坐牢被FBI担保出来并为FBI工作！而以上的一切不是虚构的故事！WTF！若以上还不足够吸引人，斯皮尔伯格、迪卡普里奥、汉克斯他们3够了吧！
168,猫鼠游戏,4,恩，他只是个聪明绝顶的孩子。震惊的是这个是真人真事改编。那个关于律师资格证的，猜到他是没有作弊。莱昂纳多年轻的时候真是好看，可惜大叔越长越残了。
169,猫鼠游戏,4,所以原来white collar的原型是来自这部电影么。。。那时候的小李子还是那个让姑娘合不拢腿的小李子啊！BTW所有姑娘演员的卡司都很强大啊~
170,猫鼠游戏,4,斯皮尔伯格作品一直精致而准确，另一种说法就是一切都是照着路数来。故事节奏、摄影、表演，都有着一个老派好莱坞的范儿。这种精气神有足够的电影技法作支撑，所以不新鲜，但也永不会过时。
171,猫鼠游戏,5,一个是好人，一个是坏人，好人并不都是好人，坏人并不都是坏人。最后的解决很喜欢
172,猫鼠游戏,5,人生大赢家啊！骗与被骗在第一眼的时候就注定了，制服是最好的障眼法，哥当年换章其实继承了这一点的精髓。为什么道高一尺魔高一丈？因为坏人那一方的驱动力更强，说白了，欲望有多大成就便有多大。
173,猫鼠游戏,4,鬼佬太纯良了，天朝都不入门。假大空适合混领导。
174,猫鼠游戏,4,第75届奥斯卡金像奖最佳男配角入围 警察与骗子 猫与老鼠的游戏 乐在其中
175,猫鼠游戏,4,小李子真应该多演些这样的片子，别整天皱着个眉头往文艺片堆里扎了~
176,猫鼠游戏,5,这部片子太棒了，一个犯罪的天才和一个执着的警察最后竟然成为朋友。2位绝对的演技派，莱昂纳多扮演的弗兰克从16岁到近30岁扮相非常成功。值得一提的是，弗兰克的父亲演技表情也堪称完美，这是一个能够体贴儿子的好父亲
177,猫鼠游戏,5,高智商的人就是不一样啊。两个星期就可以通过司法考试，实乃神人
178,猫鼠游戏,5,今日再看感觉不同以往，华丽的犯罪手法都是浮云。只有小弗兰克得知父亲死讯奋力逃走，看到母亲组建的新家庭幸福美满时那怅然若失的泪水，你真的能够想起――他不是医生，不是律师更不是飞行员，他什么都不是，只是一个希望父母能围在自己身边孩子。DiCa演的太赞！
179,猫鼠游戏,4,他能骗那么久，说明这个世界还是愿意相信的，还是善良的，嗯。
180,猫鼠游戏,4,他能骗那么久，说明这个世界还是愿意相信的，还是善良的，嗯。
181,猫鼠游戏,4,斯皮尔伯格作品，值得四星推荐；不是欺骗，便是被骗。利用泛美航空那节脱壳太赞了。
182,猫鼠游戏,5,超棒的片子，leo从这部戏迈入演技派。实在不喜欢<猫鼠游戏>这个译名，当年公映时是用直译《如果你能抓到我》这名字，也挺好的。中影瞎折腾吧就！
183,猫鼠游戏,5,WhiteCollar电影版 本想四星的最后十五分钟改主意了 给当年小李的青春 T T 
184,猫鼠游戏,5,I watch it twice. Why does this happen from time to time?
185,猫鼠游戏,5,小李子变装秀，猫抓老鼠的经典犯罪，顺带心事重重多层性格又至情至性的年轻而强大的心理素质，汤姆・汉克斯大叔每部电影总有那么一两个镜头闪回阿甘的形象，温憨可爱，嗓音磁性。
186,猫鼠游戏,5,有时候，说谎更容易，说谎更好过呢。一个孤独任性的翘家小朋友，终于在平安夜他惟一可以打给的那个人身上，得到了他要的关注，和宽爱。被需要和被信任，一颗心才会落定。
187,猫鼠游戏,5,20120929京上小火车畔。史上最长黄金周的前一天。
188,猫鼠游戏,5,根据真人真事改编，这个真人真事太离奇太悬乎了好吗！这个罪犯太幸运了好吗！警察都要帮他出来。。。唉，头脑好的人果然够吃香啊！我只想说：能这么活一辈子，值了！！电影我是当作犯罪轻喜剧来看的~斯皮尔伯格、汤姆汉克斯和小李的组合，也没什么理由不看对吧？
189,猫鼠游戏,5,道高一尺，魔高一丈，骗子的生活是最孤独的，因为他无法对其他任何人说真心话，以至于在平安夜都不知道该打电话给谁。猫永远追得上老鼠，没有爱的孩子，即使做坏事情，总是露着一点可怜。
190,猫鼠游戏,4,只想说他是个天才，但是看到他知道他父亲死后所表现的一切时，觉得他也只是个可怜的孩子。还有，喜欢那个警察说的一句话，说谎更容易些。
191,猫鼠游戏,4,基于的真实事件给人以生活化的感觉，但犯罪情节又足以具有传奇色彩，好剧本，好导演，好演员造就好电影，即使措手可及也让他逃之夭夭的戏剧性让观众一直期待猫咪如何捉到老鼠，吊足了胃口，在眼皮底下也能飞走，将故事推到顶点，而捉拿后的引渡，以及为FBI效力的软着陆结局也给大家一个满意的结果。 
192,猫鼠游戏,5,太人才了！！！！这才是人生啊~然后小李子当年还好嫩。
193,猫鼠游戏,4,"这部片给我的印象和rain man一样。不喜欢偶像派，不喜欢leonardo,不喜欢tom curise"
194,猫鼠游戏,4,洋基队会赢的原因，是因为没人能从他们的条纹衣服上移开目光。妙警贼探的原型有木有！！！我爱小李~汤姆汉克斯对于我而言就是一张大众脸！！！
195,猫鼠游戏,5,"后来被抓住的太突兀了，后面的斗智也不够精彩。好在人物弧光很棒，感情做得很足。结局也还意外，只可惜没飞起来。9.但其真实经历却更有动人的力量。“嘿！弗兰克！” 而中招。阿巴内尔是出狱后与妻子认识的，向她坦白了自己的一切。孩子们在很小就知道了老爸那段不光彩的过去，但没一个走上歪道
　　"
196,猫鼠游戏,4,与昨日观影《荒野生存》相同的是，两个少年波澜壮阔的人生都是因为父母家庭，但不同的是，克里斯选择了逃避，而弗兰克是想尽力弥补。金子不管在哪都会发光，正道与黑道，只在一念之间，结尾真是太tm正能量了。
197,猫鼠游戏,5,印象最深的是父母离异时律师要小弗兰克在监护人那一栏写上名字而他却狂奔离去的场景，还有他被捕时站在母亲家的窗外隔着玻璃窗静静看他母亲的眼神，以及最后他对卡尔说“我不是你的孩子”竟让我想流泪，因为他的父亲已不在。他像他父亲，一样的英俊固执机智，对命运不屈从。
198,猫鼠游戏,4,"2011.09.25 @ Home
纵使万贯家财，其实什么都没有"
199,猫鼠游戏,5,虽然故事貌似很轻松的拍摄手法，但――――结婚了就慎重生小孩，不要偷情还被孩子看见，更不要离婚。
200,猫鼠游戏,3,艾米・亚当斯演了一个牙套妹
201,猫鼠游戏,3,真的很好看吗？我认为真的很不好看。
202,猫鼠游戏,3,印象最深：怎样从密封的飞机逃脱；一直期待的父亲偶像破产后赶火车从楼梯掉下来跌死了。骗子大师和执著警探的你追我跑故事。
203,猫鼠游戏,3,Tom Hanks一出现我就知道这片完了，正统的说教剧
204,猫鼠游戏,3,一部经典的展示商业犯罪的电影，记得之后还看了一些以此电影为基础的小说。
205,猫鼠游戏,3,精彩之处在于Frank放弃主动让Carl带走他之后，前面则是天才与勤奋的追捕游戏。斯皮尔伯格其实拍得很中规中矩，没有刻意追求刺激，但Frank的孤独感很动人。
206,猫鼠游戏,3,群星云集的传记+犯罪悬疑片，看来绝不是斯皮尔伯格的长项，题材和风格都不对口，即使伟光正的主旋律传记片也比这好看多了。动画片头和序幕很有创意，之后就一路走低。不过还挺喜欢冒充代课老师和假扮机长在美女簇拥下逃之夭夭这两个段落。（6.5/10）
207,猫鼠游戏,3,英语课上看的
208,猫鼠游戏,3,表演都很好，迪卡普里奥的帅脸在，所以一些低级的桥段也可以蒙混过去了。故事本身是有意思的，造梦艺术的当然选择。另外这才是斯皮尔伯格能做好的题材
209,猫鼠游戏,3,略感拖沓，虽然故事很棒，不过这样的事情对于中国观众而言就是个kidding。
210,猫鼠游戏,3,对于斯皮尔伯格来说讲好一个故事没有任何问题，关键就在于故事讲完了观众有没有共鸣，至少对于我来说比较有限。说白了就是前面情绪渲染不足，但最后让你一口干了这碗心灵鸡汤。。当然对小李和阿甘我从来都无感。我前面铺垫这么多，其实就是想说：我是来刷肯爷的。。。( 03° 0805 03°)
211,猫鼠游戏,3,汤姆・汉克斯的演技精湛中透着过人的自信与老练，其他的留给观众深刻印象的估计除了艾米的牙套和酥胸之外就只有老斯比教科书油墨味还浓厚的匠气了。
212,猫鼠游戏,3,李安立度真的很帅啊。其实Frank想要爱而已，he just wants to be chased.
213,猫鼠游戏,3,莱昂纳多有哪一部片是真正的好看的，或许除了那一部被誉为爱情神片的《泰坦尼克号》，真的没有了。
214,猫鼠游戏,3,6/7/14 重看。类似传记片老马拍一定更胜一筹。只是流于故事本身。单纯的based on true story. 不生产故事。只做好莱坞的搬运工。
215,猫鼠游戏,3,这么离谱的一个故事真没想到是根据真实事件改编的，一个人换多重假身份骗取巨额钞票，最后居然还进入FBI破获假钞、诈骗案件。。。。。片中小李子真帅啊，各种制服诱惑【其实我不爱他泰坦尼克时期，反而偏爱后来发胖期，片中微胖，简直国宝级别！
216,猫鼠游戏,3,除了开头冒充老师以外，其他都是胡说八道，还是天朝好啊。
217,猫鼠游戏,3,印象最深的是自学两周就通过律师考试 想想现在为司法考试奋斗的孩纸们 小李的抬头纹是标志 汉克斯的某些镜头有阿甘的影子 两个人的共同之处是都演过傻子
218,猫鼠游戏,3,斯皮尔伯格越来越平庸，再看他的欧洲版吕克・贝松，做老板和做导演不可得兼啊。
219,猫鼠游戏,3,19064#以这时长来讲，真的有点无聊，可能因为我本身不喜欢看传记。直到后半剧情感受到小李子在徒然想重回当初那个和谐家庭，而父母已经独自选择自己道路，“尽管脑子是聪明的，但实际心智只是当初离家那个17岁小孩，欠教（揍）”。另外，ChristopherWalken真是好看，片头也是！
220,猫鼠游戏,3,"


嗦了 前面真的不错 印象最深的还是Christopher Walken扮演的父亲沉着又动人
"
221,猫鼠游戏,3,又是一个讲人生大赢家的故事，见过的最温情的警匪剧，我对真实事件更感兴趣，PS小李长发太像Emile Hirsch
222,猫鼠游戏,3,Sometimes it's easier living the lie. 音”容^好看啦
223,猫鼠游戏,3,这电影看笑了我几回，不过因为电影从刚开始就一直叙事然后用各种插叙搞的我有点糊涂，总体上来说还算是不错的，有几处笑点戳到我了。。。结尾各种拙作啊，写了一大堆文字就是为了介绍弗兰克的后来生活，是在说少年不要想着犯罪多做点对社会有益的事对么。。。果然基情力量无限大。。。
224,猫鼠游戏,3,一些细节挺有意思，不过总体来说没觉得弗兰克和卡尔之间的斗智斗勇多么吸引人，叙事手法像记流水账，整体感不强，镜头切换太生硬，配乐也很少，莱昂纳多还是短发比较帅。
225,猫鼠游戏,3,还是用爱感化的故事 国语配音杀伤力太大了
226,猫鼠游戏,3,原以为是老式美国大片，没想到更多的是关于家庭关于救赎。Grey的龙套客串眼前一亮。
227,猫鼠游戏,3,a bit contrived at times
228,猫鼠游戏,3,Leonardo 站在圣诞窗外的一刻，脆弱得令人心碎。
229,猫鼠游戏,3,看的片子多了 斯皮尔伯格果然是基础型啊 小李子在这部里介于小伙子跟大叔中间形态
230,猫鼠游戏,3,"一星给标准化教材式的电影语言，一星给演员的表演，一星给对传记和犯罪片的掌控能力，其它的都就算了。个人讨厌这部片子，不随主角的欢乐和高兴，不随主角的失败而难过，要错就错在我是看了""White Collar""之后看的本片，全片只感觉到了一股自恋的气息。"
231,猫鼠游戏,3,Cheryl 有一双流泪的眼睛；一件，一件，又一件粉色的衬衣……；门内门外，哥哥妹妹
232,猫鼠游戏,3,对比淡出鸟的人生，这样何其精彩啊。高智商+犯罪=完美
233,猫鼠游戏,3,本来可给四星，但是汤姆汉克斯一出，三星
234,猫鼠游戏,3,让汤姆汉克斯和莱昂纳多演不共戴天的对手，我们观众该向着谁？斯皮尔伯格也有发昏招的时候
235,猫鼠游戏,3,特地去google了一下此人，真是万年一遇，很是传奇，但大导拍的太平凡，过于工整了。
236,猫鼠游戏,3,"Frank and Carl remain close friends to this day! 
"
237,猫鼠游戏,3,传记性质的电影 但是感觉有点拖沓 这个故事应该可以在更短的时间内讲完 总的来说 这位天才的罪犯终究也只是一个孩子 在欺骗的同时感受到无尽的孤独 他做的很多事情 无非就只是想让离婚的父母回到以前那种和谐幸福的生活 
238,猫鼠游戏,3,没有想象中的那么好看，类似双主角的剧情线注定了它无法将片子的节奏带动起来，显得沉闷而又拖沓。让人多少有些失望。
239,猫鼠游戏,3,我发现越早的电影评分越容易高啊，可能这类电影情节对我来说真的没什么新意所以往往不喜欢。 
240,猫鼠游戏,3,不知道为什么，浮肿的汉克斯演什么角色都泛着讨厌的气息。满喜欢两个父亲的，这算本周的童年毁一生片么==
241,猫鼠游戏,3,一部斯皮尔伯格的非主流电影，一般般！
242,猫鼠游戏,3,还好，拍的我觉得还好吧，剧本不错
