,movie,star,comment
0,猫鼠游戏,5,能让巨骗进FBI，这份惜才的胸襟才是一个民族强大的原因。
1,猫鼠游戏,5,事实证明，聪明的头脑永远可以赚钱。
2,猫鼠游戏,4,他离家出走，说谎，制造不同的身份开始光鲜亮丽的生活。他是智商超群的罪犯，但是他只是个孤独的孩子。在平安夜的时候打电话给抓他的警探，在平安夜被捕的时候拥抱着他说圣诞快乐，在听到父亲的死讯以后失声痛哭，看到妈妈的新家庭以后对来抓他的警察说你们带我走吧。他终究只是个孩子。
3,猫鼠游戏,4,他也只是一个伤心的孩子
4,猫鼠游戏,5,我只想说，02年小李还是尖脸呢。
5,猫鼠游戏,4,这是我看过的来奥纳多最可爱的角色
6,猫鼠游戏,4,很难想象是根据真人真事改编的，很牛，不过在中国估计出不了这种人吧...除非，中国也有个FBI？很好莱坞的片子~~
7,猫鼠游戏,4,片头的复古范儿真棒，整体上的手法和配乐的选择也都很有五六十年代好莱坞电影――尤其是希区柯克――的感觉，局部特写的大量运用对氛围的渲染起到了非常大的作用；至于片子本身，还是那句话：论讲故事，斯皮尔伯格永远是最好的之一。
8,猫鼠游戏,5,简直就是《华尔街之狼》的前传。PS：K两礼拜书就能从小白考到各种执照，跪服....这样的天才，为非作歹必为大盗，秉公执法必为大侠，无论怎样人生都是闪亮亮的，再次跪服......PS：结尾说的是--人生难得好基友，何必天涯胜旅。
9,猫鼠游戏,5,这结局还真是没想到！绝不浪费一个人才！疏忽+牛B this is all
10,猫鼠游戏,4,（8/10）卡尔警官是虚构人物，但伪造犯弗兰克却真人真事，因其出色的鉴伪技术为FBI戴罪立功。必须一提的是现实中弗兰克的父母婚姻问题主要责任在父亲一方，但影片却把责任推给母亲。他的确有律师执照，但花了八周而不是两周。维基百科说弗兰克本尊在片中演一法国警察，但我没认出来。
11,猫鼠游戏,4,最佳弹幕：“阿甘被盖茨比骗很正常~”包含了好多小李日后的角色呢：精神分裂、投机家、飞行员、犯罪专家……发现小李总是在饰演那种受过世界伤害、骨子里反叛不羁、手段游刃有余、内心单纯天真的人生赢家呢，但对中产阶级又有各种点到即止的嘲讽，政治正确也需做得八面玲珑~
12,猫鼠游戏,5,诚实的人最自信，所以――我会尽量让自己不那么害怕。精彩绝伦的猫鼠游戏，现实比电影还牛叉闪闪，斯皮尔伯格真是拍传记片的天才！
13,猫鼠游戏,4,穿机长制服的小李子帅爆了，很能理解那些被小李子骗的富家小姐们
14,猫鼠游戏,5,非常好看，里面有很多有意思的经典桥段，看到小李子装同行骗过汤姆非常刺激，李子的美貌在这部电影中还是表现的挺淋漓尽致的，尤其是穿机长服时，简直帅爆
15,猫鼠游戏,4,“how did u do this frank?”片头十分有意思，悬念里蕴含温馨，两人亦敌亦友，是一种值得去享受的矛盾关系。虽然是根据真实故事改编，但看下来还是能发现不少容易推敲的漏洞，亦或者在那个纯真的年代，其实并不需要多么复杂也能得到想要得到的。★★★★ 
16,猫鼠游戏,5,那个单纯的可怜的女孩呢？她怎么办呢？
17,猫鼠游戏,5,小李美哭。其实这是个很温暖的故事。一个骗子，一个FBI，一个任性的孩子，一个善良的人。
18,猫鼠游戏,5,为什么我看的很难过呢。。
19,猫鼠游戏,4,骗子的生活是孤独的，因为你不可能对其他任何人说真心话
20,猫鼠游戏,4,那时的小李子还没用毁容向奥斯卡评委表忠心。真人改编的电影，骗术之高明令人叹为观止。
21,猫鼠游戏,4,"Two little mice fell in a bucket of cream . 
The first mouse quickly gave up and drowend.  
The second mouse wouldn't quit. 
He struggled so hard that eventually he churned that cream 
into butter and crawled out. 
Gentlemen , as of thi"
22,猫鼠游戏,4,被家庭抛弃的儿子成了空中大盗，被家庭抛弃的父亲逮到了空中大盗，于是两人成了并肩作战的好基友，共度余生所有的平安夜。故事线埋得很深，不愧是编剧课上的经典教材。
23,猫鼠游戏,5,非常棒的电影！即使长达140分钟，但依旧足够生动和吸引人看完。小李功不可没。以年近30的年龄出演不到20的少年犯，演技足以撑起整部电影。真人真事改编，牛逼的人物啊！电影虽然没有什么大场面，不过复古范儿很棒，非常难得和不易。作为一部犯罪片，传记片，却又足够温馨，足够有趣。强烈推荐！
24,猫鼠游戏,5,其实是描述了一个孤独的人，他的透彻的孤独。
25,猫鼠游戏,4,没有想象中的烧脑，果然斯皮尔伯格叔叔就是擅长说故事。从一开始小李子和汉克斯的相互追逐到最后的惺惺相惜，似乎暗合了阿比盖尔父亲的那句话，“第二只老鼠”。居然是由真人真事改编的，太吊了吧。ps.此时小李子颜值还是个少年，还不是李叔真的太好了。
26,猫鼠游戏,5,还不错，故事好，演得好。
27,猫鼠游戏,4,年轻的小李子，像太阳一样，世界总对美人那么苛刻，唉
28,猫鼠游戏,5,真人真事改编，不得不佩服美国人的包容。
29,猫鼠游戏,4,故事一般，没有杀人没有色情没有暴力……只是一个人用自己的小聪明想在这个世界上不劳而获的故事。但讲得很好。斯皮尔伯格永远会讲故事。后面的情节看得蛮感动……弗兰克你要记得，每个人终其一生都要伴随着的孤独，不是钱或者亲密关系可以解决的事情。
30,猫鼠游戏,4,骗术多新手法多奇案件多曲折，这些表面上的卖点被斯皮尔伯格刻意弱化。电影只想为你介绍一个孤独的渴望家庭在骗术中寻求责任感最终发现自己一直在自欺欺人的天才。
31,猫鼠游戏,4,讲道理，如果弗兰克颜值低的话早被捕了，帅哥叫搭讪，丑比叫骚扰
32,猫鼠游戏,5,"观看全称惊呼“怎么可能”“太扯了”，然而这就是真实的故事。。。
还是喜欢汤姆汉克斯在这里的表演"
33,猫鼠游戏,4,【B+】其实想给A-但是想了想还是B，我觉得其实演到小李子在窗前被抓就可以结束了。好剧本+斯老娴熟的叙事技巧+好演员，以及依然有着斯老惯用的造作和讨巧（非贬义），电影做的面面俱到，很精彩
34,猫鼠游戏,4,he is just a lonesome kid。“终于给看了”系列之一。我只能说小李子的才华真的真的真的全都用在了二三十岁正当年了。制服还挺诱惑的！结尾赞~~~俩小客串挺惊喜
35,猫鼠游戏,4,很励志啊，坏事做成专家了，即使坐牢也会被放出来，还能挣钱。
36,猫鼠游戏,4,重看。我发现斯皮尔伯格无论拍什么类型什么题材的电影，他总能展现出一种童心未泯的想象力和表现力，人物和调度动画化是他的绝活，有一种流水作业的刻板感但又人见人爱，也无人能及，那张从门缝下飘出来的美金就是整部电影的缩影，Catch me if you can.
37,猫鼠游戏,4,虽然是个根据真人真事改编的作品，但斯皮尔伯格却消减了不少真实感，让人感觉像是看一部童话，温馨、纯真、浪漫，人物也是一根筋式的善良，也符合斯皮尔伯格一贯的风格，骗子和警探的几次斗智斗勇还是很有火花的，父子关系是本片的重点，导演聪明地将构建了两组父子关系来圆满这个故事
38,猫鼠游戏,5,帅啊！小李子！
39,猫鼠游戏,4,千回百转，一波三折，警匪片的最高境界。
40,猫鼠游戏,4,小李子全盛时期的佳作，之后似乎就启动了用力过猛大爆炸模式，飞行家、无间道、血钻、谎言、禁闭、胡佛、姜戈、盖茨比、华尔街，一路直到猎人上位。。。
41,猫鼠游戏,5,高智商犯罪与FBL之间的斗智斗勇，如猫和老鼠，既是对手又惺惺相惜，真是酷毙了
42,猫鼠游戏,4,一部强大的励志片，即使你身无分文，只要你敢于创新，就能研究出制造假造的技术，只要你肯努力，两个礼拜通过律师证的考试是没有问题的，只要你肯改过自新，你会交到新朋友也获得新生活。好好向弗兰克看齐吧。
43,猫鼠游戏,5,大爱高智商犯罪！尤其是未成年高智商犯罪！！！好基友一生一起走~~哇卡卡卡
44,猫鼠游戏,4,"一句话点评：苦海无涯，回头是岸，何况还有老衲苦苦的等待！
又是真人真事改编，这种电影最重要的是要有好的事件，然后是好的演员，一般而言都会口碑票房双丰收；两个演员的表演都不露声色，这样反而展现的更充分，电影的张力也恰到好处；猫爱上老鼠，多少有点恋子情节，这就属于个人瞎扯环节！"
45,猫鼠游戏,4,想起我爸说他们单位以前有一个人，什么也不会，唯一会的事就是画钱，连画画都不会，但画出来的钱和真的一样，现在不知道人在哪儿在干什么。片中无论罪犯还是追捕他的探员，从地球的任何一个地方飞往另外的任何一个地方，眼从来不眨一下，电影就帮观众免了全球旅行的票，观众在故事里随着冒险家一起尽情地颠覆社会基本制度，最后表现收网时免不了立场站在绝对正义一方，但看起来并不说教，比后来这一类型的电影和剧都顺畅得多，最喜欢片尾坐办公室那段，竟让我觉得这也是一对李慕白和玉娇龙的组合。夸张点说，Leo年轻时的脸，是这25年来，上天送给人类最杰出的自然奇迹，片中有些段落就算再平庸，有他在场，效果也是无与伦比的。我认为汤姆汉克斯“演员本人消失，只让角色现身”的能力是好莱坞第一，你对他再熟悉，在观看时也不会刻意发觉这是汤姆汉克斯
46,猫鼠游戏,4,小李子的经典之作，看了很多遍，学英语的时候还特意找了无中文字幕版的
47,猫鼠游戏,5,论讲故事，斯皮尔伯格永远是最好的导演之一
48,猫鼠游戏,4,中间拖沓了，但结尾完全弥补了。frank是真正的聪明，年少气盛，以为拿回失去的一切就可以换回失去的家，但最后，父亲去世，母亲再嫁，剩下的只有他，想停下来，却没法停下来的自己。感谢frank曾经遇到卡尔。只有卡尔知道，他是个孩子，始终都是。
49,猫鼠游戏,5,高智商金融犯罪。片头有种旧好莱坞的、比利・怀尔德或希区柯克式黑色悬疑的感觉。整部电影并不是靠紧凑的剪辑营造气氛，亮点是故事本身，两人之间的智力交锋火花四溅。小李子当年很厉害，年纪轻轻跟老牌影帝汤姆・汉克斯飚戏毫不怯场。众多龙套中，发现实习医生格蕾。黑客变红客，结局永远无法预料。
50,猫鼠游戏,5,为什么可以有人每部戏都这么好看！！！！！！！啊啊啊啊啊
51,猫鼠游戏,5,神之高速运转大脑，迷之惊天反应能力，高智商让Frank的生命延长三倍都不止！
52,猫鼠游戏,4,感想如下:1.莱昂纳多太帅了，尤其穿机场制服；2.汤姆汉克斯一脸慈祥老父亲，看到三分之二才认出来；3.天才是天生的，比如0基础2星期过司考；4.结局惊呆，充分贯彻了“不浪费一个人才”。
53,猫鼠游戏,4,一个胡闹的小男孩，最终找到爸爸的故事。卡尔就是弗兰克的精神“爸爸”。
54,猫鼠游戏,4,啊斯皮尔伯格真的很会拍爽文！小李和角色相得益彰，他真的是我心中的少年格林德沃，狡黠的金发飞贼，如白色大鸟一样跳出窗外，只留下一个得意的背影。
55,猫鼠游戏,5,从导演，演员，到故事，到改编，无一不精彩
56,猫鼠游戏,5,这篇基本上集合了90年代美国电影界的最强阵容，读初中时，同桌就跟我力荐过，高中时，卖盘的大哥也跟我推荐过原声，今天终于翻回放翻出此片，好片是要慢慢品的，看到最后引人入胜！
57,猫鼠游戏,5,小李子帅哭我，但是居然走剧情流，相当不错了
58,猫鼠游戏,4,想到几位做假画天才最后成为鉴赏家的，啊，专业病……
59,猫鼠游戏,4,对于极端聪明的人来说，见缝插针的为所欲为就是规则本身！而能利用到这种聪明人的政府才是真正最可怕的存在！【电影只是一再的证明了这世界始终是看脸的谢谢】
60,猫鼠游戏,4,非常棒的一部电影，莱昂纳多的经典之作。
61,猫鼠游戏,5,表白小李子，真帅啊。一人千面，论演员的可塑性
62,猫鼠游戏,4,追的紧，反而抓不住；放手让他撒欢儿跑，才是能收回他心的不二法门。（当然是我跑题了～
63,猫鼠游戏,4,挺不错的电影，一般双商高的都会引起犯罪，同样钱是导火索。
64,猫鼠游戏,4,超有爱的片~（PS：终于收了Leo从帅气到发福过渡期的样子哈哈，演骗子他比MattDamon 可爱多了）
65,猫鼠游戏,5,【A】与其说是一个骗术大师与FBI警探较量的故事，倒不如说更像是两个内心孤独的人的互相治愈。有时候，现实比你想的要超凡的多。
66,猫鼠游戏,4,White Collar剧场版么...和大多数这题材的影片相比 风格上还是独树一帜的 没有华丽的剪辑 快节奏的叙事 选择了一种看似不太搭的走内路线 但是却张力十足 人物很饱满 可能 斯皮尔伯格就是想把任何题材都拍成史诗吧...
67,猫鼠游戏,4,骗子大师和执著警探你追我赶的故事。
68,猫鼠游戏,5,"鼓舞人心啊! 我也要""did that all before my 19th birthday""!!!!!"
69,猫鼠游戏,5,一个警察，一个骗子，一个天罗地网，一个瞒天过海，剧情的节奏一直非常的快和紧凑，但剧情并不复杂。我不能说弗兰克只是一个孩子，他需要父亲的温暖，但是事实上确实是的，只是因为他太牛逼了我们才忘记了这点，而最后他和卡尔那种亦敌亦友的关系成了他的精神支柱。
70,猫鼠游戏,5,有些根据真人真事改编的影片故事情节往往特别的精彩。本片就是这样。一个不到19岁的人能做到这种程度，已经不是一般的天才了。这样的人生才精彩啊，能看到这样的影片，确实很过瘾。
71,猫鼠游戏,5,Rr一次又一次的 凵纤的C敏睿智 oFrank是Leonardo。但是 Leonardo不g很多年後的Frank。他不g整日醉金迷 好像一定要]霍M《泰坦尼√》的2500f美元片~才痛快的少年了。他很多了。一少年 在他18q的r候甚N都有了 以至于他不知道在往后的r光Y去得到甚N。
72,猫鼠游戏,5,"he is just a kid...
Two little mice fell in a bucket of cream . The first mouse quickly gave up and drowend. The second mouse wouldn't quit. He struggled so hard that eventually he churned that cream into butter and crawled out.
knock knock..."
73,猫鼠游戏,4,所^高智商犯罪不如f高情商犯罪吧 小李一直以硌蚨继用力 o是JACK是Frank是w茨比又有什麽本|的^e呢？少年感不通用 更何r已中年
74,猫鼠游戏,5,受父亲偷税影响，父母离异，天才少年走向歧途，展开了猫鼠游戏。直到没人追他，老鼠变成了猫。
75,猫鼠游戏,4,"真挺传奇的，而且如此遗世独立的天才最后还被招安了。Tom Hanks在片中的角色塑造得真好，很有意思：一丝不苟、严肃""恶劣""之下略带喜感、滑稽。片中很多镜头都在戏谑抓聪明贼的笨警察，很有趣。另外，影视作品真是好东西啊，能教你多少各行各业的知识啊，行骗必备！"
76,猫鼠游戏,4,"4.5星. 斯皮伯格拍警匪片也有一手, 然@”颈旧砗苡幸馑, 演T也找的十分合m, 年p的R昂{多英饨器, 影片前追昼就成功的刻了一天才少年的形象, h克斯的愚gc而不涡蜗笠踩捣旁carl身上, 不^L^^Ρ蝗R昂{多w^去了. 小李子獾漠年啊, 突然我想起F在的根u. "
77,猫鼠游戏,4,大多数时间，小健步的节奏，不疾不徐，饶有趣味。小李自如地游走戏耍，角色所要求的外在神韵对于那会的他来说没有任何难度。而在收尾阶段，几度起伏的温情戏让影片有了一定意义的升格。物尽其用，在正确的地方发光发热，非常治愈，富有人情味儿。弗兰克行骗过程中的内心描写比较单薄，算是小小不足。
78,猫鼠游戏,4,巧合重重构建，突转也做得蛮有意思的，只是周遭的人未免也太单纯之上太低了吧，这点做得过分了。。。美剧中的法律题材和医院题材果然历史悠久并且深入人心啊。。。有且仅有的钱飘起来的特技真是败笔=。=不过话说回来，好在心理拿捏得很细腻，其实说到底，这是一个讲人的寂寞的故事吧。。。
79,猫鼠游戏,4,电影总是喜欢讲些天才的故事来刺激我们这些平凡人 而且外国的天才电影往往是INSPIRED BY A TRUE STORY 刺激的效用放大一千倍~~
80,猫鼠游戏,4,"2020.02.04；
为了把失去的都找回来，
找回曾经的家庭；


2012.5.22支票"
81,猫鼠游戏,4,"「Two little mice fell in a bucket of cream. The first mouse quickly gave up and drowned. The second mouse, wouldn't quit. He struggled so hard that eventually he churned that cream into butter and crawled out.」「You didn't call just to apologize, did you? You have no one else to call!」「Sometimes it's easier living the lie. I'm going to let you fly tonight. I'm not even going to try to stop you. That's 'cause I know you'll be back on Monday. → Yeah? How do you know I'll come back? → Look. Nobody's chasing you.」"
82,猫鼠游戏,5,看完受益匪浅，会有很多不同的感受。
83,猫鼠游戏,5,感谢YYeTs人人影视字幕组buleliongb的双语制作！牛逼的电影不解释
84,猫鼠游戏,4,看到结尾字幕才知道原来这是一档子真事儿，本来还心说什么时候好莱坞的犯罪片拍的这么脚踏实地的了。
85,猫鼠游戏,4,虽然一开始看过简介知道是真实事件改变看完之后还是感慨一下尼玛居然是真事儿。人才啊都是人才！其实给四星的原因单纯只是因为这是个好电影，我心目中好电影的标准就是你看到它的时长就没看的欲望但是看完之后一点也不觉得冗长。PS小李子真帅。而FRANK在当时也不过是一个对家庭倍感迷茫的孩子吧。
86,猫鼠游戏,4,"一被父母离异所残害的有天赋小孩。
dicaprio居然02年还可以看得那么年轻，3,4年后就一下中年了。。额。。现在发现into the wild男主角有像年轻时候的他。"
87,猫鼠游戏,5,一个惊人的天才，一个执著的警探，本来对立的两个人却是内心中的朋友。喜欢原版片名：catch me if you can.
88,猫鼠游戏,4,一部口味很纯正的娱乐电影――帅哥风流倜傥、剧情张驰有度、整部影片洋溢着六十年代年代那种怀旧的黄金色。真佩服斯皮尔伯格对于商业精神的把握！
89,猫鼠游戏,4,在我记得名字的为数不多的外国人里，先是汤姆汉克斯又看到斯皮尔伯格，这电影怎么能不好看呢~哼哼，很幽默~
90,猫鼠游戏,4,传奇人生。不过骗了银行和政府还能在联邦调查局工作，这种事也只能在美国发生吧，天朝是没有……
91,猫鼠游戏,5,"原来他是一个因为家庭破裂受伤的孩子，个人的机智和幸运成就了他的罪恶；他是一名尽职尽责，忠于职守的警察，却总是迟来一步。结尾还是很赞的，竟然是真实事迹改编。just like tom and jerry, they are friends at last. 李奥纳多真是硕果累累，演过的电影真是佳作连连。"
92,猫鼠游戏,4,"如果留心，总会找到蛛丝马迹。
要做的就是永不放弃。
纵然我很爱电影智商很高的Frank，但生活中我更加钦佩那些知道自己要干什么且坚持到底的人。要知道在现在这种到处都是诱惑的生活中，要坚持做点什么真的不是那么容易。"
93,猫鼠游戏,4,"是精彩的内容,而且他展示的聪明,胆识是很棒的~戏剧的人生~"
94,猫鼠游戏,4,成长于拥有强大人格魅力的父亲的影响下，加上天生聪颖，机缘巧合就触成了这现实版的猫鼠游戏，正是由于各有所需，也就有了其一直持续的道理，我真俗…
95,猫鼠游戏,5,"那个时候的迪卡普里奥多年轻,多帅啊,汉克斯还是天然呆,片子很出彩啊,好看的,这么有趣的骗子,真有意思..犯罪天才啊,片子中还是有温情的,弗兰克在被捉前还是想去看母亲,他心里就不想父母分离..导演是斯皮尔伯格."
96,猫鼠游戏,5,一部很有意思的电影，这部电影让我无限赞叹主角弗兰克的高智商各种高端的伪造。这也是莱昂纳多最具有特色的一个角色之一。与此对比的是汤姆汉克斯的勤奋吧，总之真的很精彩~
97,猫鼠游戏,4,"和平共处的猫和老鼠――很有意思的结尾，也看出来美利坚物为我用的实用主义，很多有趣的场景和对话让人印象深刻。最后再深深怀念一下还未变胖的莱昂纳多和鼎盛时期的汉克斯。
"
98,猫鼠游戏,4,漏洞早就有了，真正能钻还敢钻的人有几个？当然你先得是个天才，而天才一般衣食无忧，根本不至于去犯罪，像莱昂纳多这种的一出来，简直就是个BUG。
99,猫鼠游戏,4,按照片尾来说的话这是真实故事，还是挺惊讶的，不过想想也是，聪明的人总会把握“商机”，就看走没走错路了。年轻小李的风流倜傥对于角色的诠释再合适不过了。片子太长，看到后面真是有心无力。艾米亚当斯的牙套造型还是蛮乖的。
100,猫鼠游戏,5,我现在越来越喜欢这种根据真人改编的电影了。电影从头到尾都很精彩。史蒂文・斯皮尔伯格执导，莱昂纳多・迪卡普里奥和汤姆・汉克斯两大巨星联袂出演，再加上一个这么好的故事，想不好看都难。电影不仅让我们大开眼界，而且发人深省，同时又趣味横生。一个英俊的骗子，一个诚实的**，一段令人拍案叫绝的
101,猫鼠游戏,5,有些人天赋异禀，他们注定不会平凡。佛兰克做了一般人不敢做之事，他可以拿着一张父亲给的一叠25美元的支票。他肆虐了整个欧洲，终于被一个工作狂和偏执狂卡尔抓捕。而因为卡尔的过去，将他们的关系变得更神秘起来，也许卡尔真的把佛兰克当做儿子和朋友一样去看待了，所以最后的结局才会变得不一般
102,猫鼠游戏,4,喜欢这个组合。。Tom Hanks+Leo DiCaprio+Steven Spielberg。。哈哈巧妙。。
103,猫鼠游戏,4,"实在是匪夷所思，太有才了。

时隔十年之后，再次看到这部影片，感觉还是不可思议。好像那个时候的记忆，已经基本消失了，所以又相当于重新看了一遍，十几岁的孩子，真的是天才。那时候的汤姆汉克斯应该是人到中年了，而莱昂纳多・迪卡普里奥，帅气青涩、英气逼人。"
104,猫鼠游戏,5,好看，情节流畅，小李子好帅，结局真的不错，我喜欢的喜剧式结局，看完后我还去百度了一下，发现是真实事件改编的，很牛
105,猫鼠游戏,4,当Frank对着父母的时候，他始终都是一个期望拥有完整家庭幸福的孩子，眼神一直都那么单纯地让人心疼……他和Carl之间慢慢已不再是逃与抓的关系……Carl最后跟自己打了个赌，希望把Frank从谎言中拉回现实，幸好Jr回头了，于是他们俩得救了，美国n多银行和公司也得救了……
106,猫鼠游戏,4,每个天才少年犯都缺一个好父亲嘛 =u= 最后想开溜那场戏弗兰克明显是吃卡尔女儿的醋了 -- 汤姆・汉克斯连绿叶也当得贼好贼好的 >3<
107,猫鼠游戏,5,传奇的人生 现实生活中竟也的的确确存在着如此多的莫名漏洞 影片的开头很有风格
108,猫鼠游戏,5,这是我目前看过的最励志最励志的一部电影了好么 而且最后还有一句弗兰克和卡尔现在还是挚友 卧槽警匪这种相爱相杀的简直萌裂了 居然还是真人故事啊啊啊啊啊世界上真的存在这种西皮啊救命QAQ 我觉得我快要爱上斯皮尔伯格了 如今发现他拍的电影萌点都超级多啊啊啊ORZ
109,猫鼠游戏,4,两大明星主演令人印象深刻，骗子和FBI警官斗智斗勇亮点十足，真事改编的故事十分有趣，结局也很有意思，片头令人眼前一亮，就是漏洞也不少，本片少年成为骗子最终走入正途所体现的社会问题发人深思★★★★☆
110,猫鼠游戏,5,妈的，Frank真。人生赢家，Carl也斯德哥尔摩的可以。可惜现在这个时代大概走互联网这条道才可以追上男主的脚步了。#等等我在想什么# 以及我AA妹子怎么能这么可爱_(:з)∠)_嫩出水72
111,猫鼠游戏,4,小李真的很好看啊！演技棒！也会挑剧本！可为什么拍了这么多还是得不到小金人！心疼！！
112,猫鼠游戏,4,其实我不是才看的- -我只是不知道为什么之前勾了想看。。。= =
113,猫鼠游戏,5,真人物故事改 p_犯中髌姘愕拇嬖 其他更多的是好玩心太重  以至於e^了好多很好的C 一直在改中徘徊不定 唯一不的是欺_ 欺_e人c自己。此g 一亦骋嘤训娜 的_是淼谜好 也做得蚝谩
