,movie,star,comment
129,情书,5,重看才知道之前真的是深深误会了导演！拍得真好，简直是初恋电影类翘楚！对话场面用镜非常活泼，喜剧角色脱线调节奏，交织的感情线非常清晰，剧本又聪明。放学后自行车棚的夜晚对谈、骑车时的恶作剧、运动会、用皮鞋溜冰……诱起中学回忆。三年二班、寻找XXX、《来不及》的梗。（2006-01-13评四星）
130,情书,4,你好吗，我还好。承德和秦皇岛。哦，还有说一下的是那本书没看错的话好像是《追忆似水年华》最后一卷――寻回逝去的时光。
131,情书,4,还记得自己中学时代的暗恋，那种情窦初开的感觉还真是，单纯美好也印象深刻，我总在想，我会不会有一天只记得有这么个人，而不记得他长什么样子了呢？他就像是我的年少时期的荷尔蒙代名词啊。雪天的美好，是真的很美好……
132,情书,5,你好吗？我很好。
133,情书,4,没觉得多么好看，可能是后来的电影看的多了，觉得剧情不那么吸引了，柏原崇的镜头好少，中学时代在雪地里一身黑衣的阿树太漂亮了，美极了。比较喜欢岩井俊二的燕尾蝶，这个还好啦，如果四星不是推荐的话会给四星的，觉得没什么好推荐的。纯纯的爱情电影。还是四星吧，想想觉得很美好呢
134,情书,5,暗恋的极致
135,情书,4,一开始是冲着柏原崇的颜去看的，看了半小时，柏原崇还是没见到，剧情也没看懂，差点就放弃。看到后来发现这剧情发展和想象中不一样-_-||，原来这是个暗恋向电影。这电影十几年了还能让现在的我感动，是部好电影。
136,情书,5,这两天媒体都在做情书二十周年的专题，谣传岩井俊二是王菲的粉丝，想想当年也传cowboy bebop参考王菲的形象绘制了faye。不知道媒体到底是什么操行，总喜欢把王菲往女神级别推。
137,情书,5,"所有的憧憬和悸动都在微风吹动那个窗帘时，阳光照着那个少年时。
他嘴边浮现那抹若隐若无的微笑时偷偷开始，
在得知他的死讯之后埋藏在心里的牵挂轰然爆发。
在下着大雪的高山上就此别过。
再见了，那个少年！"
138,情书,5,情书，好像已经被越来越多的人不屑，而我始终认为这是一部绝好的写给青春的电影，干净，害羞，又蠢蠢欲动，以及一辈子的遗憾。青春与两个藤井树之间的爱情一样，永远再找不回来。小时候只被那种纯情迷的神魂颠倒，直到青春过去了，每次再看到树翻过那张书卡的背面，都一次又一次的流泪。追忆似水年华。
139,情书,4,很唯美很经典的爱情故事，情感流露很细腻。没有开口的告白，如果当初勇敢一些，遗憾会不会少一些。
140,情书,5,",]想到..一看..它就成槲易钕g的top5之一!``写这高贵情书
用自言自语作我的天书
自己都不爱怎么相爱
怎么可给爱人好处.....美.美好到Oc..拇凵涎揖俊二."
141,情书,5,漫天盖地的冰雪里，两颗炽热的心。一边看一边沉寂，其他的事情全都忘记，多么深得同感又耐人寻味的故事才能做到这一点。冰天雪地的凄凉，还有回忆的悠长。越是美好的越是最初的越是要变成回忆。追忆似水年华，想起来就心酸得要命。但这样的故事，空有一份记忆就足够幸福。
142,情书,4,7.7；for love is strong as death
143,情书,5,是第几次看岩井俊二的情书了？极为大胆的镜头和剪辑，不用空镜交代出空镜的气氛，对话的张力完全靠导演(把摄影留给摄影)，对“事件”的组织和放大能力(大处和小处的铺张都恰到好处)，各种形式所有可能性的反差(过去现在老人小孩飘雪樱花新人旧人…)
144,情书,5,回忆总是最美好却又最伤人，因为你知道那是回不去的时光。
145,情书,5,日本电影常如一首凄美之诗，在笃信樱花刹那芳华便为最美的国度，爱情面前生与死的渲染又怎会有作态弄人？那本寄往天国的的《情书》，道尽了年少时那纯粹不夹杂一丝杂质的初爱之美，当爱成为追忆，怎知这不会是一种最美的形态，道一句“你好么？”“我很好” 。
146,情书,5,劭赡]法相互得到的。既然@右脖３至鄣募性，比起生活中充斥著事的邸⑺^的邸㈤L久陪伴的郏我更同@。
147,情书,4,在窗户边站着看书的柏原崇那一幕超经典超少女梦吧，两个叫藤井树的少女和少年，一场无疾而终的暗恋
148,情书,5,有些东西就是会刻骨铭心一辈子，就像初恋、死亡。一生错过的事情太多了，会无奈，会遗憾。再遇到暗恋的人或者那个暗恋你的人，轻轻的说：你好吗？我很好。这是就是对过去最好的告别。再遇到他，我希望可以跟他讲他以前的小事，相信没人比我更了解他了。而这个世上是否也有那么一个人在等我呢？
149,情书,4,鬼使神差又刷了一遍，看得不专心，但在老师告诉藤井树真相那个瞬间有点想泪…藏在图书卡里的爱恋什么的，大概已经和那个时代一起消失了吧。（20160918）
150,情书,5,8年前，脑中没有文艺片的概念，还是看过了。当时到底是被什么触动了呢？还记得吗？现在的我，已经在思考完全不一样的问题了呢。我也长大啦！
151,情书,5,这部片子对于我这个怂逼简直是一记重击，万万没想到我会这么待见岩井俊二早期的青春片。它好在哪里呢？好在我看它的时候还年轻吧，还对自己对一切有那么多的憧憬，好在我还有很多更多的生命力。或许我更眷恋失去之痛。
152,情书,5,#CFA#岩井俊二会撩啊，藤井树在窗户边看书，窗帘飘飘，柔光曼妙，特写一出来，底下就是一阵一阵的骚动。包围的延展性叙事以足够的巧妙构成最真切的戏剧性时刻，以时间的复现占据心理高地，因为很少人能够抵御时间的后验性。流畅性见诸于文字语言角色的接力，从仰望飞机所施加的蒙太奇效应也迷人。
153,情书,5,"也许每人都有似曾相似的故事，逝去了才追悔莫及。无论如何都会流下热泪的电影，五星又怎么够！暗恋的极致，古典的爱情，死亡隔绝了爱与恨。翻过来的卡片，肖像，是初恋回忆情怀的唯美，细腻的完美情书。
"
154,情书,5,当我们突然失去挚爱的人时，伤痛总是会持续很久很久，甚至执着地想要将他生前的一点一滴都要拥有，似乎那个人就是属于自己的，因为别人都已经开始谈笑了，所以真正在乎他的就只有自己。但其实不是的。他有着你所不知道的故事，和别人。而你也有独属于你们俩的回忆。不要因为害怕再次失去而停步不前啊。
155,情书,5,若预期的岩井俊二是忧伤，文艺，清新，浪漫，那《情书》当之无愧为最高作。导演把许多近乎类型片的点子悄无声息融进漫长而略显慵懒的画面，双生人，跨越空间的来信，对亡者的追忆，擦肩而过的恋心。我不太喜欢冬天，那种寒冷与寂寞，但故事里两处雪景下的小城真让人向往。铃木兰兰演的神经女很有趣啊。
156,情书,5,"20070824 9/7.0(2019)
2008-10-31 23:45:43 9/7.0(2196) just need a way out"
157,情书,4,应该早几年把它看掉的，或许感触会更深，现在看有点晚了，总感觉心态不那么对了，大概是我老了。在你来我往的书信中追忆似水年华，暗恋的情愫留存在一张张泛黄的借书卡里。所有的情绪点到为止，没有大开大阖。故事设置还是比较巧妙的，用男主角的死隔绝了所有的爱与恨，也牵扯出两个女生的遗憾与释怀。
158,情书,5,在《情书》中，作为一种有意识的结构与表达，戏剧化的情节设置，带出了自我寓言的层面。影片的迷人之处在于，其全部情节和场景都结构在偶像剧式的日常生活的场景当中，几乎不曾借重神秘色彩，也不曾外在地借助某种哲学表达，却准确地结构出一部现代人的自我寓言。寄往“天国”的“情书”，是为了想像死者的生，也是为了印证死者的死；就“哀悼的工作”而言，那在死者身后延续着的不能自已的爱，同时是一种强烈的修复自我、把握住生命的自恋冲动。――摘自戴锦华的《电影批评》。
159,情书,5,【中国电影资料馆展映】时隔7年重温大银幕，高清的画面一扫过去电脑看的低画质阴霾，得以全身心投入这个优美温暖的故事，并为之深深感动。一对藤井树，温暖暗恋情。电影蕴含丰富的情感，但也有所克制，不至于过分煽情。岩井俊二的电影真是有击中人心的力量啊。后半段始终泪目。不枉排队一个多小时购票
160,情书,5,对日本片，一概的感觉就是入戏难，不过，一旦入了戏，后面也就很顺然了。也许是文化和语言上的差异吧，看了一半，我才多少抓住主线，想想都汗颜。结局我喜欢，淡淡的晕染开来，令人回味。
161,情书,5,一封封来往的信件，树就这样重新被人们记起。一个人的去世对在世的人意味着什么？也许是像老师一样还清晰记得他的班号，像博子一样延绵不断的思念，像树一样得到迟来的爱的告白。所有都会埋藏在心里，回忆的幸福会浮在脸上。他们不会被遗忘，因为他们是我们生命的一部分。
162,情书,4,在小樽一重仉影，一ふ遗z地，感X很不一印Ｐ￠罪L雪U大的，可以w到d著l高的渑苋メt院是多N的危U和xo反。
163,情书,4,很细腻唯美  经典佳作
164,情书,4,剧情的点很击人心的柔软部分两人的线架构巧妙，结尾很动人。不过演员在各个场景中表现的参差不齐，中山美穗的演技时好时坏，配角的表演也是，唯独非常一贯的好的是酒井美纪！画面依然是一贯的注重mis en scene，很漂亮。对音乐的控制相较于后期作品则并不太高明。
165,情书,5,那样的渡边博子。那样的藤井树。那样记忆里美好的青春。forever top 1.
166,情书,5,看完电影抑制不住哭了十几分钟，可能这部电影就是能勾起每个人心底的那抹涟漪吧。亲爱的，请允许这样叫你一声，希望你过得幸福。
167,情书,5,写情书是件很浪漫的事。戏里的中山美穗还真有点像陈老师。少女树的同伴大井早奈很抽风啊。酒井美纪饰演藤井树少女时代，获第19回日本电影学会新人赏。
168,情书,5,一直以为看过这部电影，因为在我上小学的时候我在为数不多的DVD中频繁看到这张，却从来没有欲望去看，可能太热衷于史泰龙和施瓦辛格了吧，汗，当时你说你最喜欢这部电影我也只是记得自己也看过这个在熟悉不过的电影海报，这么久了，你好么？我却怎么也说不出我很好
169,情书,4,第十四届上海国际电影节 天山1厅 13：30 with花 http://movie.douban.com/review/5002545/
170,情书,4,有人说日本电影最大的特点就是让人看不下去。我也真的试过好多次，也都真的看不进去。等终于看进去了才发现，这是一部非常非常非常闷骚的片子，闷骚闷骚着，我就跟着“你好吗―？”“我很好―”哭了。岩井俊二，你要有多闷骚才拍得出这么闷骚的电影啊
171,情书,5,清纯之恋。很喜欢的镜头。下雪夜，灯光那么迷离，忽明忽暗。雪花的倩影在灯光下簌簌的，抬头仰望天空，时间仿佛回到从前，那段永恒的记忆。寻找藤井树，寻找那份藏在流年的记忆。
172,情书,4,挺美好的，表演自然（包括怪咖女，能想起以前某些朋友也是这样），故事编排很大胆。岩井真是个太会把控节奏的导演，同样小清新同样校园同样是爱情，但讲得有条不紊，沉得住气，也能吸引人一直看下去，用成熟的心态看待青春。岩井总是有自己残酷的一面:“如果真是那样（因为我像她而爱我）就不可原谅”
173,情书,5,回想我青涩的少年时期把收到的第一封情书撕得只字不留，随手扔进垃圾桶里，就觉得自己是个变态。。。。现在被这部养眼的片感动死了，嗯。。长大了。。。里面的每个角色都很有感情很feel，柏原崇好帅啊啊啊啊~
174,情书,5,在公交车上看完，抬头一看，正好走到了五象广场，突然就想起2009年去青秀山，第一次坐车路过五象广场，那次归途，在路上也是看完了此片的原著。四年过去了，一切却如同昨天。
175,情书,5,2010.2.16 晚。看第二遍。心里堵得难受。太多回忆交织在一起。Memory is a good thing if you don't need to deal with the past...............
176,情书,4,如果当年看过就来评分 我一定会毫不犹豫给满分 当时脑海里只有两个字：唯美   但是现在来看  也不是那般震撼  不过还是值得我给四颗星  因为 它当年真的美到窒息
177,情书,5,在听到那首歌时，终于忍不住哭了。再一次看，依旧哭的稀里哗啦的。看到对着远山问好的时候，不知道有没有人能够体会对于不在这个世界的人那种思念。少年时懵懂的爱情就这样无声无息的埋藏在记忆中，却在死亡之后才得知。回忆与情感一同袭来的时候，那种措手无策。结尾很好，再多就变得累赘了。
178,情书,4,日剧就是这样总会把初恋、暗恋描写的那么透彻干净~让人想起那些不经意的岁月~~~~~~~~忽然觉着其实并不悲伤~~至少爱情来过~
179,情书,4,冲着柏原崇的美貌去的，疑惑过影片最初暗沉的基调，但最后依然被柏原崇吸引，日本这类型的温情暗恋，真的很令人感动
180,情书,5,先看过人鱼，再看的情书（书），然后才对电影感兴趣。昨天终于把这部电影看了，打破我一贯觉得电影不如小说的观点，这种细腻和美好也只有岩井能制造出来吧。不过因为对情节早有预知，看的时候反而感觉不那么强烈了，不过最后树翻转那张书卡的时候，还是忍不住狠狠感动了一把。如果对爱情仍有信念的人们，真的很推荐看看。
181,情书,5,青春那青涩朦胧的恋情，少年时代的柏原崇什么的美好了！！
182,情书,5,看完泪流满面的片子，本来是不大看文艺片的。觉得这样的摄制规模又能产生如此大的情感冲击确实能知道为什么是这些片子让很多人走进了电影的不归路…
183,情书,5,一个名叫情书的电影，信件却在两位女性之间传递，这不是讲述同性恋的故事，而是一段过往的纯净的恋情。很简单的场景，很简单的人物，甚至是很简单的故事，却像女主人翁的纯洁舒爽的特质，呈现了一段纯真而又永恒的爱情。喜爱片中所有的雪景，喜爱雪夜后的朝阳，喜爱藤井树的帅气，喜爱藤井树的美丽。
184,情书,5,永远的经典。
185,情书,4,1995年，小学一年级，我在小树林里和姑娘表白，结果被残忍地拒绝了。以后就只是暗恋了。
186,情书,5,"当博子和女藤井树擦身而过的那一瞬间，即便此前从未相识，我相信她们内心也一定会涌出“仿佛被命运之绳捆绑了一秒”的心电感应，然后互相回头张望的一瞬，大抵会觉得感动，又被释怀，于是博子决定就此珍藏这段感情，向着雪山用力大喊 “你好吗 我很好”
"
187,情书,5,"潘YY出来的关于女生的剧本。― 2012 - 07 - 06 三星  （2017 - 02 -18 注）
从头哭到尾。― 2017 - 02 - 18 五星
（这五年里，我失去了多少，又获得了多少呢？）"
188,情书,5,原本茫茫人海中的陌生人，却通过一封因同名而写错地址的信联系在一起，从此开始了一段对“藤井树”的回忆。时光流逝，岁月久远，但心中的那一点一滴的情愫挥之不去。博子对丈夫的思念之情，让我感动；两个“藤井树”之间尽然还在学生时代拥有那么一段羞涩的爱情故事。整个故事，通过一封发往天国的情书联系在一起，让我享受到了一幕纯真的爱情。生命如同一棵大树上面的树叶，在树上发芽、变绿、接受阳光的洗礼，当她他到迟暮之年，变成了枯黄的叶子，慢慢地脱离枝干，向地上飘去，飘着，飘着，回忆，回忆。这一生拥有过的，未曾拥有的，都成了记忆，
189,情书,5,"小学就知道的片子，这么多年了，依然很感动。
那些没有开口的告白，最终还是让你听见了。

都忘了该不该恨藤井树了，只是觉得很可惜，今天看了《蓝色大门》也很不错的。

岩井拍的让人淡淡的疼。"
190,情书,4,好温柔的故事，喜欢一个人就会忍不住想了解他的一切，那些拐弯抹角的心意、说不出口的告白、雪一样单纯的暗恋。不过现在再让我看这样的故事，总希望多一些事在人为的努力。
191,情书,4,日本的电影剧本好像都很简短，日本导演专长在于把简单的故事发挥得淋漓尽致。告诉你的不多但一击即中.
192,情书,4,"寄错时空的情书。I drew a picture fou u,don't know if u'll see it.Once u do I don't think u understand the poetry"
193,情书,4,初中也暗恋过一个男生，隔壁班的，他喜欢打篮球，每次都趴在窗台上偷偷看他，后来上了不同高中，不同大学，现在没联系了。。。。。。疼痛――――――成长
194,情书,4,用光，节奏，布景，一个故事，以及故事里的故事。20120630改四星。简单剧情，剧情外的价值。
195,情书,5,藤井，你还好吗。我很好，你呢。我把最美好的年华写成一封给你的信，多希望你能看到。时间深处的心意，只有经过时间的荡涤，才能如此隽永深长。
196,情书,5,那种初恋的感觉没有那部电影曾经超越过
197,情书,5,VCD时代就喜欢的一部电影，原声音乐也听过无数遍，今晚在大银幕上重温一遍，又勾起了哥对逝去时光的追忆，追忆行为本身是伤感的，追忆的内容却是美好的。
198,情书,4,√ 有太多值得探讨的细节，比如细雪勾勒出整部片子的气质，以及浓厚的东方底蕴。奇妙的人物构思，躲在背面的肖像，细腻的情感・・・只有生活让我们重拾旧忆。暗恋的极致不是一直思索什么时候该告白，而是不经意像占满你的回忆。
199,情书,5,与小说相比，电影给人的感觉更为强烈。小说更为详细，笔触淡然却含有浓厚的情意，电影通过镜头的剪切，适当的表达点到即止，剩下的空白留给画面与音乐进行填充，同时也留给观众进行回味。一直认为暗恋是最纯洁的爱情，而此片经过叙述者角度的切换，对暗恋的情感进行更巧妙的编排。
200,情书,3,无聊！找了半天真相才发现自己是个替身……傻比青年啊……
201,情书,3,2000年，本人看得第一部文艺片，当时不知道啥是文艺片，表面上洋洋得意，认为自己算个文艺青年了，内心里无比的可惜那一块钱，因为本来是租《唐伯虎点秋香》去的。被人租走了才不得以看《情书》
202,情书,3,生命只是一连串孤立的片刻，靠着回忆和幻想，许多意义浮现了，然后消失，消失之后又浮现。 ――普鲁斯特
203,情书,3,没有很感冒。。
204,情书,3,因为光良的《童话》而看这部电影，远没有MV里那么夸张的感动。期望太高了
205,情书,3,她的z憾K於放下，另一她的z憾s才正要展_。重看lF自己e了Y尾，中的藤井湔驹谛Px完了那卡，立刻嚎啕大哭不能自己，重看slF她不在玄P也]有嚎啕，而是HH掩嘴含I。@N明@的情，怎N就e了呢？是，那曾嚎啕大哭的，其是我自己？
206,情书,3,被文青们奉为圭臬的经典，洋溢着冬日阳光的怀旧与温暖。日后再也没有那样的少年，图书馆的窗帘后是他谡谡挺立的温柔轮廓；那样的少女心事如诗，美好地被画在借书卡的背面。多少人的青春岁月被如风般抚摸，这样怅然而叹息。暗藏于心的少时情事，未曾绽放业已盛开。这样的纯爱含苞娇羞，连时光都曾惊艳。
207,情书,3,“秋场先生”长得好丑
208,情书,3,说实话我欣赏不来。柏原崇是很好看啊
209,情书,3,愚钝，没怎么懂
210,情书,3,柏原崇这样子就是为少女心而生的
211,情书,3,太凄美了 一开场就有如此纯洁唯美的画面 喜欢这样的雪 暗恋是会悄悄开出一朵花的
212,情书,3,太纯了。像是从记忆中取出的东西。
213,情书,3,人生有很多种如果，然而只有一条向前的路，选中这条就会错过那条，没有谁的一世是完全无憾的吧。
214,情书,3,配乐很好。感动我们的更多是自己逝去的青春吧。每个人自己经历过的暗恋不比电影精彩吗？
215,情书,3,事实证明我的泪点永永远远不在爱情片上，然而看这种爱情片如果不掉几滴眼泪，至少在我心里它是索然无趣的。
216,情书,3,看完忘了，说不出来啥评价
217,情书,3,人生能得几回纯啊……
218,情书,3,"影片的风格很清新，景色也好，故事的拍摄手法很好玩，通过男孩女友抽丝剥茧地询问，女孩慢慢讲述着自己的回忆，并在回忆中回味那段少年时光，最终发现了一段后知后觉却已被错过的爱。

一个是拥有时不自知，知晓时不再拥有；另一个是曾经拥有，但却另有隐情，到底哪个女孩幸福会多一些？"
219,情书,3,日本爱情电影至今还是这么慢慢地淡淡地叙事风格。关于初恋这个话题，总是难以名状的忧伤……我欣赏这故事的结尾，却为故事里的博子难过。
220,情书,3,其实不太理解为什么一说起盐井俊二，这部作品就必须作为代表作来说起呢？个人不太喜欢这部电影，如果说喜欢那淡淡的感觉，还不如《四月物语》。
221,情书,3,借书卡浪漫！玩儿暗恋的嫩仔柏原崇出镜is少……（颓）【tag：中山美穗，酒井美纪
222,情书,3,"画面一直是白茫茫的，剧情不知道该怎么形容。
男树与女树同名同姓，男树暗恋女树，表白了女树但女树却不知道。转学后，男树遇到了长得像女树的博子，男树与博子相爱了。结果男树出意外死了，男树的好朋友秋叶喜欢了博子。而博子对男树念念不忘，就与女树写信回忆男树。最后，博子发现自己是女树的替代品，并且走出阴影。女树发现自己原来和男树是相爱的。
看来我不适合看文艺片"
223,情书,3,"看情书的时候是一张双碟的版本，看完第一张碟，还不知所云，回头看了看影片简介，才恍然大悟男藤井与女藤井的关系。
不过，当女主角在雪地里情不自禁的呼喊时，我却莫名其妙的哭了。。。或许是对女主角失去爱情的那种感同身受吧"
224,情书,3,白窗帘下的藤井树、停车场中的查看试卷、三面书架下的藤井树、书卡的背面……挺多场景真是拍得特别细腻，那种青葱的爱恋感好棒。对阿树的爱很美，可是这对博子很不公平呀。
225,情书,3,这样的剧情还是没能打动我，以前看过类似于这样的日本小说，不知谁抄袭谁的题材。
226,情书,3,飘雪的小樽 绵长而细腻的无疾而终 日韩片子还是硬汉类和历史类的更对我口味 爱情片 还是要看Hollywood
227,情书,3,前半段比较无聊，女一号的男性友人真是长得又丑又聒噪。后半段女二号学生时代和男藤井树（女一号的已故未婚夫）的回忆比较有意思，很轻松欢快的中学生之间的淡淡的没有捅破的爱慕。原以为女一号和女二号之间也会发生点什么奇妙的化学反应，结果果然还是我想多了。总体三颗半星吧。
228,情书,3,喜欢那 下雪的场景……心 生生的疼     PS：女猪脚  实在不敢恭维  演技 长相 各种  不是我的菜
229,情书,3,死亡不能自拔，感冒屡教不改；爱情不见黄河不死心，恋人书中自有颜如玉。一见钟情是假，难忘昔日是真。日本的借书卡是媒人的红线，如此浪漫。
230,情书,3,#观影手记# 1193 他与她共用一个名，她与她共用一张脸，她们同爱过一个人。完全体会不了日式情感。
231,情书,3,构思精巧，却讲了一个很滥俗的故事，套上死亡的光环装文艺，日本人就爱玩这种小把戏，难成大器。我不喜欢爱情片，爱情说穿了很没劲，男人总喜欢同一类型的女人，历届女友长得像亲姐妹，这是他们很生物的表现，说明大部分男人，包括这电影里的纯情男神，只在乎什么外表能刺激荷尔蒙，根本不在乎内心
232,情书,3,真是被文青们捧得不行了……唯一喜欢的是结局那相隔多年的告白，果然那样的场景只属于青涩的初恋……
233,情书,3,虽说是岩井俊二代表作 却不是我最喜欢的他的作品甚至都不是很喜欢 ... 沟通问题？？
234,情书,3,故事刻画得很美 画面也很美 特别是柏原崇的颜 一击即中
235,情书,3,并没有预期的感动，平淡的，甚至是拖沓的贴近生活的漫长。只匆匆看到了几眼柏原崇，像是打酱油的。--记于2010年夏。
