,movie,star,comment
382,情书,3,众人力捧的一部电影。看了一通宵电影的其中一部，回忆起来觉得并没有记忆很深的地方，女主角我不是很喜欢，剧情比较迟钝，因为男一并非丰川悦司，所以悦司的声音听上去很撮。
383,情书,3,"我理解不了，如此深厚情感。
多年以后，再来领教。"
384,情书,3,初恋情结，当有一天，你遇到和你初恋情人长得一模一样的人，你会怎么做呢？
385,情书,3,觉得很一般，不知道为什么评价还那么高，什么纯情，没有看出来！
386,情书,3,电影故事比较一般，关于青春的情感过于单薄。但导演对于光影和角度的把控十分娴熟而且独具一格，布光很柔和感觉很舒服。关于家庭的描写也令人动容，雪景拍摄十分美丽令人印象深刻。
387,情书,3,日式的拍片美学，这部电影是“陈绮贞”的电影处女作品，还有对于青春期的那点小骚情，藤井树（树）真是作~看得我这个白羊座真的很着急。
388,情书,3,当年前男友力荐的一部电影，其实个人觉得一般，总的来说就是学到了一句日语“ciniqiwa 午安”= =以上。
389,情书,3,没有看完，实在无法忍受。。
390,情书,3,电影片头肆掠的风声粗犷却不凄凉，一身黑衣的博子和纯白的雪交映，异常唯美。
391,情书,3,有些爱，是用一生去延续的。
392,情书,3,配音要了我命。回头找原声的再看吧
393,情书,3,拍的挺矫情，没看出什么感觉。风景还好。
394,情书,3,"""那些没有开口的告白，最终还是让你听见了。""所以博子就傻逼了呗？岩井俊二好喜欢玩跨日本转学然后在两地爱上两个不同的女人，两个女人都死心塌地的故事啊。是有多自信……"
395,情书,3,还以为是君的名字解忧杂货店这类二次元的故事，其实不过是同名同姓的初中同班男女同学的初恋故事，男生循着初恋女生的模样找的女友，和初恋女生通信…8.9
396,情书,3,没被感动，也没哭，实在找不到哭点在哪里...是我老了还是本来就没什么感情= =
397,情书,3,最经典的爱情电影之一吧，其实最喜欢的还是岩井俊二的音乐
398,情书,3,没看懂- -。
399,情书,3,两个名字相同的人，两个长得相像的人
400,情书,2,"不喜欢这部电影,看得我要睡着了"
401,情书,1,"做作,太做作了,毫不留情的打个很差."
402,情书,2,一星给少年的美颜，一星给画面
403,情书,2,刚开始想法还可以，后来叙事变得拖沓且含糊不清。长发男角色写的就烂，演的更烂，时时刻刻对着屏幕大吼：“我在演戏啊！”，看得我很是尴尬。剧情拖沓不清是这样的：树的爸爸的死被提及多次，后来和树的病也相互照应，可以说是占了很大比例。但是有了什么作用呢？我唯一看见的作用就是男树最后一次来还书，还有在医院幻想起男主。可以说是极其小的作用了，跟投入完全不成正比，所以让人不知所云。还有渡边的故事线，一个接受过去，一个找回过去，我懂，挺好的创意。但是两个故事没合起来；各讲各的，唯一的联系就是对象都是男树。还有长发男子，他的出现只是推动一下剧情发展，尴尬地旁观着故事的发展，时不时魅力地微笑和甩他乌黑的头发（和故事本身完全无关的东西）。其实很多角色都是这样，无所谓地望着故事发展，自己不改变分毫，还占了大量镜头。
404,情书,2,怒打两星。导演成功引导了观众情绪，正太柏原崇很能让姑娘心旌荡漾。但是 画了姑娘穿三点又画姑娘半身像怎么就是暗恋了？替身痴守前任，结果发现真相，这故事还能更中二一点吗？看病那段太做作，好几个角色没有存在感。触动我的只有中山美穗在雪地里的呼喊【我觉得她是在抒发胸中的怨气
405,情书,2,完了，我们看的好像是日本的这部？…我对不起韩国的情书……
406,情书,2,怎么我就不感动也不想哭呢 青涩的爱情但折磨人了 女澍真傻 男澍太含蓄 所以她都那么大了才知道原来男澍暗恋他 话说我不喜欢含蓄的男人 男澍是个奇怪的人 
407,情书,2,角度清奇，但其实并没有比《七月与安生》高明。如果女一女二用两个不同的女演员来演，也许这部电影还会显得更高明一些。所以这部电影现在看起来连《七月与安生》都不如。看到最后就成了无病呻吟的小清新，不足以让我忽略影片中所有不合理的巧合，以及学妹们轻而易举就找到了学姐的家。
408,情书,2,第一次看时我还是懵懂的中学生，柏原崇的硬粉，这片让偶浮想连翩。现在再看，除了做作没什么好说的了~
409,情书,2,没有感觉那么好  是不是  没经历过啊  哎 
410,情书,2,为什么都说浪漫，就我觉得男藤井树很渣，喜欢女藤井树就去追啊，居然找了长得一样的当替身，女藤井树又不是死了，那少时有多唯美，长大后就有多渣，大学时看就不喜欢这种剧情。
411,情书,1,第一幕就让我觉得格外矫情，好不容易坚持到最后！
412,情书,2,一个核心问题：感冒了为什么要扛到嗝屁也不吃药不看病，你忒么喝点热水洗个澡总可以吧？矫情得要死，感觉整部片子的逼格都被这个脑残的设定给毁了！本来想打一星的，另外一星给这个除此以外的所有设定。
413,情书,2,情书这部电影，单看剧本脉络觉得多好啊，清纯美好的感情只有年纪大一些后才知道有多珍贵。但是拍得…受不了。太淡了。岩井俊二的电影都有“能否坚持看下去”的问题，但燕尾蝶有自己的影子和神秘魅力在吸引着，莉莉周有种不明觉厉的气质。而情书则就影像上什么都没有，美女刚好也不是自己喜欢的那个类型
414,情书,2,这是我看过的最傻逼的电影！！！一星给窗边看书的少年~一星给萌系御姐~~
415,情书,2,宿舍同学在旁边看的时候跟着听了几段，实在不合我胃口。虽然鼎鼎强烈推荐，还是给三颗星吧。嘛，也许文艺什么的不适合我q(s^t)r
416,情书,2,真心。。。看不懂。。。都犯困了。大概太文艺不适合我
417,情书,2,我是真的对日剧不感冒啊......我老联想-。-
418,情书,1,什么？奇巧的构思？完全就是做作。。假得一塌糊涂，还塑造了那么傻逼的女主角，还一造造俩。简直是我看过至今最烂的大烂片了。。
419,情书,1,极其拖沓，不好看，后半段我是快进着看完的，即使快进了也对剧情的理解毫无妨碍。说好听的是文艺，说难听了不就是做作么。一星打给我们那逝去的青春和曾经的情怀。
420,情书,2,前面的赘述实在太平淡太冗长，结尾又不够冲击性。某女站在树出事的山脚下边喊边哭我能觉得太做作了么= =因为整篇我没有看到任何爱情的成分，既不够炽烈，又没有青春期爱情那种懵懂的甜蜜，女主感情的爆发太突然了缺少过渡，有种刻意而为的感觉。即使最后看到那幅借书卡后面的素描画，感动也耗尽了
421,情书,2,一直以为是一人演两个角色。。
422,情书,2,Let-go love & Retrieved love.
423,情书,1,豆瓣和迅雷的评价都很高，可看了一半实在看不下去了。本身就不喜欢日本电影。
424,情书,1,一直都不明白岩井俊二的片子感动在哪儿，都是中二病思春男女的日常破事，但是一堆人捧，还一堆人感动到哭。文艺不懂得适可而止，那就是矫情。
425,情书,1,女主角真倒霉，是作为别人的影子来被喜欢上的，这么高分，疯了吧，装b
426,情书,1,怪我自己吧。真的没看进去
427,情书,2,越来越看不下去这种日式的爱情了――无论你拍的多么细腻。总会觉得有那么一些些的套路化――我就是觉得博子很可怜――也许人家没爱上她，只是她和人家的初恋很像罢了。
428,情书,2,就音乐部分还可以，其他还是岩导的yy作风。
429,情书,2,是因为太久以前的电影么 我提不起精神和耐心看 也不知道这所谓的是什么。恋空的印记太深 让我无法审视情书。
430,情书,2,"淡淡的爱情・有点无聊
"
431,情书,1,本记得好像没看过，特意去找片子，找了好久好久才找到资源，下下来一快进，原来看过了，只是什么都没记住，跟四月物语一样。
432,情书,2,剧情是不是有点太拖沓了 可能在当时的人们看起来不错？两个人在一起的描写也太少了点吧
433,情书,2,为毛那么多人说清纯我还是觉得做啊！！！
434,情书,2,冬日的微风与阳光，部分户外镜头尚可。然而牵强的剧情，夸张做作的表演，矫情的所谓纯爱系。只能说岩井俊二确实不是我的菜~~~看来哥是文艺不足，土鳖有余了~~~
435,情书,1,文青必看电影之入门篇。日本片，没兴趣
436,情书,2,太他妈装逼，看日本电影得防着点这类题材的
437,情书,2,"无聊的片子，无聊的小说。
画面很美，腹中羞涩，可以，这个风格很新海诚。
虽然这么吐槽，冲画面和中山美穗的颜值还是加一星。"
438,情书,2,"就是两个人长得愣像，哪有这么复杂
"
439,情书,2,不喜欢诶...
440,情书,2,原来这就是传说中的文艺范，领教了。
441,情书,2,被同学逼迫着看的，果然对日本电影还是不感冒，同学时隔多年还激动着说里面的情节有多感人，是他一直幻想的情节，可是我竟然看得想睡觉…………
442,情书,1,可怕，这片子豆瓣59/250，不能理解。少女藤井表现还行。一直文艺小清新的路子又烦又腻，画面和语言都是这样，无兴趣。女藤井开始讲故事后我以为正片要开始了，结果真的开始要死不活了。看过18岁的柏原崇后，姑娘的眼里还能容得下其他人吗？误青春哦。
443,情书,1,除了说日本人太闲之外我还能说什么呢- -
444,情书,1,喜欢这片子的都是特别怀念自己学生时代恋爱的人吧 我觉得没多大意思
445,情书,2,Nani? What the fuck is dis? 今天要得罪你们一下，日本孟京辉啊，小清新喜欢这个脑子还能好么。
446,情书,2,我真的很讨厌俩女主角那样懦弱的女人 看得我想打她俩。情节有点太恶心了 什么跟什么阿
447,情书,1,"岩井俊二真的不对我胃口。
故事简单却讲得冗长而枯燥，唯一出彩的就只有少年时的藤井树们。
崇的少年，实在美得无与伦比。"
448,情书,2,节奏太慢 
449,情书,2,太失望了！不能和《四月物语》比！这种奇情一不小心就落入俗套了，点点滴滴的小做作，很失望！
450,情书,2,就因为有丰川悦司
451,情书,2,感觉没有大家说的那么好。。
452,情书,2,很经典吗？记得初中时候去电影院看的，印象不好，节奏缓慢，也不觉得感人，难道我的审美观真的和别人不同~
453,情书,2,闷蛋考虑看看，反正我真的看不下去啊，进入太慢了。
454,情书,1,可是藤原树你究竟爱着谁？
455,情书,2,这个分镜是感冒药吃多了画的吗…
456,情书,1,"中文名应该叫《感冒会死人》，拖沓、繁冗，要不是强迫症犯了，也不会用150%的速度看完最后60分钟・・・・・・・・・・・・1分，差评・・・・・・・・・・・・・
博子妹子很长情，不过是替代品~~~~~~~"
457,情书,2,墨迹墨迹墨迹墨迹墨迹墨迹。。。。。
458,情书,2,最烦腻歪小清新，大姐们你们到底要干什么?男藤井帅到苏啊> <
459,情书,1,当年这片流行时就知道不是我的菜，所以压根儿没看过。并且岩井的片子一部也没看过。如今既然旧事重提，还是挡不住好奇心看了下，后悔的我呀，这片儿矫情的，这俩小时耽误的04
460,情书,2,镜头感是很干净的。有对细节和光线的讲究。岩井俊二的电影语言讲述爱。可以超越时间，死亡的洁净情感。暗恋这东西，说不清道不明，喜欢一个人就是毫无缘由地喜欢。这部电影也是一样，如果触动到了记忆中的某根弦，必然产生共鸣。可惜我没有
461,情书,2,蛋疼的小清新会喜欢 情节慢的我快看不下去了ps柏原崇帅的一塌糊涂
462,情书,2,太拖沓了，以至于后面的人物肖像亮出来都无法让人感动了。
463,情书,2,"还是岩井俊二,唯美唯美....真的不是快餐电影..... 我这种选手.....不说了...."
464,情书,2,心里毫无波动，甚至有些想笑
465,情书,2,看了小说再看这个，美感差好多。
466,情书,2,就是o法喜g
467,情书,1,已经有新男友了，还给故去的前男友写信，不理解
468,情书,1,1:05看完就解手。此情可待成追忆。觉得被这片子里的做作结结实实地整到了。对岩井的既定印象和好感扑空
469,情书,1,老娘前前后后看了3遍都没看完睡着了！操，装逼的都给我去死
470,情书,2,呃...这是什么奇怪的设定..但又是熟悉的设定，联想起挪威森林和蜂蜜四叶草...日本的调调么...
471,情书,2,受不了的小清新
472,情书,2,我已经是老年人了，我们老年人万一要是说起爱情，那些言语和观点，实在不合适拿来和这部电影放在一起了。
473,情书,2,又不是我的菜。。。
474,情书,2,影评写的都很美，电影很闷
475,情书,2,我只能f我不喜g白_水一拥碾影。。。@N垡菜坪踝人不明白。。。
476,情书,1,浪漫个屁 小感冒不治疗拖到高烧 大雪封山了救护车进不来才知道要死了着急的日本人 活该去死吧
477,情书,2,这片子适合女人看吧~没太大感觉~也许是没浪漫过~
478,情书,2,看不下去，节奏太慢
479,情书,1,曾经有个人说很好看-try to但还是看不进去...
480,情书,2,太做作，太矫情！人物行动完全扁平化。导演：这个时候要把那盆花儿砸碎。藤井树走过去把花儿盆打碎。完全是导演一个人自说自话，盐井俊二真是颗少女心。花招子大王编织了一部唬人的绣花儿枕头。
481,情书,2,节奏实在太慢，无数次想快进，实在不该指望剧情，但我还是哭了，突然很想你。你说[当你不能再拥有的时候，唯一可以做的，就是令自己不要忘记]，今晚没有看到星星，你还好吗？miss you much
482,情书,2,不  爱   看 
483,情书,2,或者是我没看懂，或者是今天太疲倦，没有引起共鸣的东西，看得烦躁。
484,情书,2,通篇没看出任何伟大的爱情，
485,情书,2,这tm是啥...小女人or感情细腻gay男看的电影吗...
486,情书,1,哈哈哈哈哈哈哈 死了吧死了吧 一星一星
487,情书,1,为什么我觉得好无聊 不明白为什么评分这么高
488,情书,2,一直没啥感觉的公认好片，包括岩井俊二其他片。
489,情书,2,日本风始终喜欢不起来呀
490,情书,2,岩井俊二最受众面片子竟是这部，可惜可叹
491,情书,2,我终究只是个2B青年 看不懂啊看不懂
492,情书,2,看之前很困，看的时候非常困，看完之后精神来了，鼓掌鼓掌，终于完了！
493,情书,2,看得我直犯迷糊
494,情书,2,现在回想起来忽然觉得岩井俊二的片子都作的不行
495,情书,2,"慢悠悠的,看了一个多小时关了不对胃口...文艺片对我来说果然还是too hard...女主好可爱!"
496,情书,2,不是对日本人的偏见，好好看完这部电影，真的没有被感动，名字玩笑，就开到这吧。
497,情书,2,睡着了
498,情书,2,"F在看岩井就是想睡得不得了。
如果他是字的便是村上春浒?"
499,情书,2,少女在雪中滑行
500,情书,2,朦胧而美丽的爱，像雪山上透过晨雾看到的朝阳
501,情书,2,日本的为什么都有点变态的感觉呢，特别是那个恋空！要有正确的爱情观！！不知道大家为什么这么推崇这部电影！
502,情书,2,理解不能 。。。
503,情书,2,"标记很久了，终于趁出差打卡了。也就那回事吧，如果暗恋真的合适，就不会错过，男藤井树送给女藤井树那本书，什么也不说就告别，是几个意思。
不过那种淡淡的忧伤，感觉挺喜欢的，就是追忆似水年华的那种感觉，得不到的最美。
2019-04-11，感觉这跟北京遇上西雅图之不二情书毛病类似，两个女孩见个面聊聊不就行了，非得整一封又一封信，营造从前慢的氛围。降一星。"
504,情书,2,"果然日本这个国度和它缓慢温暖的叙事风格不是很适合我。
太慢了，看了一个小时，弃。"
505,情书,2,看了半个小时发觉不能再看了，容易把自己搞疯掉。
506,情书,2,矫情逼，前面扯屁蛋看了那么多女主的不讨喜脸和不会讲普通话的男二的危险变态脸，女主和欧姆尼那段台词简直要吐，男主特么迟迟不上线等死爹了，这么作的片子我可全是为了这张脸好么！骚年你生的这么美这个世界对你来说太危险了！隔壁班的大井真可爱23333
507,情书,2,"为毛我一点都不觉得感人..
恶心死了
假猩猩的
发个烧都拖拖拉拉地烦死了..."
508,情书,2,人物心理比较变态
509,情书,1,"搞不懂的统统给1分,以后再看一遍"
510,情书,2,不知道是不是个人欣赏还有心理期待颇高，总觉得是个坑人电影，假，女树的情商也太差了吧，迟钝笨拙，当你反应过来喜欢的时候人家已经转学了，要命。当大井出现就跟神经病一样打酱油吗？娱乐我们所。渡边才可怜，是个替身。导演在女树病了她妈爷那段真可以当恐怖片，我还以为要互相厮杀得真的是
511,情书,2,闷透了
512,情书,2,看一部电影睡着了两回 可能我最近得了嗜睡症 反正一下午都荒废了 女主真美 男主真帅 除此无他 可能我没暗恋过 不知道为什么可以像其他评论一样看完哭到泪流满面 不过不要试图刨根问底现任的前任是定理 这老公死了还好 要是活着 你说这婚离不离 离了亏不亏 不离这以后日子怎么过
513,情书,2,小时候没看懂，现在看懂了也没感觉。以后再看。
514,情书,2,好不容易看完必须来吐槽一下，女主真的是越看越不经看，和年轻藤井树的颜值差太远……这种日式纯爱片看来还不是我的菜
515,情书,2,电影给人一种很纯粹简单的感觉，可能这就是傻傻的初恋。情节只能说是一种小巧合，小趣味与小感动，对于我来说还是过于寡淡了。
516,情书,2,电影前半段太拖沓...最后三分之一才给我一种看电影的感觉...女主太矫情咯！
517,情书,2,说真的没觉得有什么。
518,情书,2,忍无可忍的拖沓
519,情书,1,一个破事前面一个小时都是在讲两个无关紧要的女人，让人无感，日本人叙事手法有病，浪费我的时间。
520,情书,2,可别矫情了，看将近一小时发现原来两个人是一个人演的，半天都没代入感，激动的心，颤抖的手，犹抱琵琶半遮面的，我真是服了，话说两女爱一男，也是醉了，之前学生时代喜欢她，她竟然无察觉，还说对男主有点印象，不是什么好印象，仅仅是名字一样而已，后来写信写上瘾了，到最后也没爬雪山呐喊，而是围着大树转圈圈，也收到了情书，这两个傻女人，真傻！，傻到极致！
521,情书,1,到底哪好看了。。。日本电影的慢节奏实在接受不了
522,情书,2,不明白为什么那么多人喜欢。
523,情书,2,对于这种日系暗恋故事，我脑海里只浮现出做作。
524,情书,2,抱歉 日本电影欣赏不鸟 说个话把人听得累的撒
525,情书,2,各种莫名其妙神经兮兮矫揉造作矫情得不得了，尤其是渡边博子真的是让人想给她一记左勾拳
526,情书,2,看了小说再看的电影。。。我睡了。。。。
527,情书,2,我很好，你好吗？
528,情书,2,我想对于女孩应该会有更多感动吧
529,情书,2,我愣是看不懂
530,情书,2,电影没有书好看
531,情书,2,岩井俊二也拍烂片阿。。。
532,情书,2,双向暗恋 也许很多人在青春的时候都有这层懵懂想要捅破却缺乏勇气的爱恋 这不虐心 这种感觉是少年独有的 是青春的味道 一个安静的 真实的 有代入感的故事 并没有传说中那么神乎其神
533,情书,1,是我欣赏不来的调调，太软太腻味。恰好还没人给过一星，那我来吧，嘿嘿
534,情书,2,为啥看的只有90多分钟？其他说什么好呢？
535,情书,2,不知道在讲什么东西..日本片子果然就是没那个耐心
536,情书,1,对这个替身梗真是膈应无比，凭什么让博子做你们爱情的垫脚石啊，无论多少人说这电影如何如何经典也get不到，你的白月光既没有死那么多年也没有搬家喜欢就去告白啊干嘛拉无辜的博子当替身，没觉得感动只看出了没出场男主的渣和怂
537,情书,1,藤井树就是个渣男，很好的故事，很坏的爱情，没有结局的爱情有什么意义呢？现实中的秋叶这样的好男人又有多少呢
538,情书,2,说实话，其实我没有看懂。
539,情书,2,无趣啊！！！真的看不下去啊！！！试了不止一遍
540,情书,2,当年少年我是多么一厢情愿相信这是真的，
541,情书,2,猥琐眼睛大叔好败笔啊。还是日本电影那种造作有点受不了，有点该怎么着不怎么着的感觉。给那小正太加一分吧。
542,情书,2,当时没看懂
543,情书,2,本来准备大哭一场，结果完全不对胃口。开头的雪很美，后来就完全没感觉了。另外，恶心死了日本女人一副娇羞的表情动作，还一边喊着秋叶先生。整部电影好像就看到了男尊女悲。
544,情书,2,boring~~~
545,情书,2,-“你为什么喜欢我？”-“因为你长得像我初恋。”碰上这样的回答不应该刨出来鞭尸么……居然大喊什么“你好吗我很好”，果然世上有多少人就有多少种爱情
546,情书,2,不是文艺青年实在欣赏无能
547,情书,2,为什么这么多喜欢
548,情书,1,不知道哪来那么多好评 隔了一个月才看完 虽然没被感动 但是我居然在这种电影上浪费了一个小时  一颗星给爷爷背着孙女去医院 难道你们还停留在悲催苦逼的中考作文时吗
549,情书,1,是不是我智商低，你们怎么忍住前17分钟的？
550,情书,2,我着实不喜欢这种感觉・・・==看了一会和室友实在受不了就关了没看
551,情书,2,美少年演的一点都不好啊 眼睛里没有情
552,情书,1,博子真惨，放不下未婚夫不说，好不容易有个同名同姓的带来未婚夫的一些记忆结果未婚夫暗恋人家那么多年，自己不过只是长得像暗恋对象而已。片名改成悲催的未婚妻也挺好的。不过柏原崇真帅。
553,情书,2,可能由于期待的太高故事看完后 让我失望了
554,情书,2,看完完全记不得什么鸟情节，难看
555,情书,2,看得我捉急死了。为了同名同姓的男女藤井树的中学给个两星
556,情书,2,的确不喜欢这种慢悠悠的爱情片
557,情书,1,抱歉，这不是我的初恋。
558,情书,2,我最喜欢老爷子和拍立得 其他的都很讨厌 特别是发型一样前15分钟我异常蒙逼 还有喊山的时候演技尴尬炸了 男女主都很丑 差评 感慨自己初中时还好不怂 也感谢我林哥整天搞事情
559,情书,2,是在看不懂。看了一般就受不了了。
560,情书,2,三个人一致给出的差评。节奏真的是非常的怪异啊，男二号可以去演日式变态杀手好吗。片子里浓浓的日式对白更让人反胃，感觉有一段时间不会再爱日本片了。
561,情书,2,我是没看出来符合这么高豆瓣分的元素（也许和年代自己历练也有关？），还有如果男主真因为两位女主长得像而在一起也是有点渣（果然我单身是有原因的……）多一颗星是给叙事的手法和唯美的画风。
562,情书,1,博子只是替代品，她F任男友K永康也是替代品。女涫呆^Z，通常呆^Z都是公的，怎NC情，怎N煽情，怎N造作就怎N戆桑а菽汶S意，我感拥每煲把@示器砸了。
563,情书,1,"看不懂，觉得没意思，说实话，觉得挺傻逼的，两个双胞胎一样的人存在这么巧合，很无聊。
要是藤井树女和渡边博子是两个演员演的，能做到仿佛是同一个人，且两个演员不是双胞胎，我就打5星。
"
564,情书,2,偶感期待死嘎？
565,情书,2,50分钟才进入正片原谅我接受无能
566,情书,1,我至少有二十遍想逼自己看下去，就是看不下去。。。
567,情书,2,很早就看过，没有达到评分高度的深刻印象。今天看毒舌有个影评，来补标记。和一部分人想法一样，博子似乎是男主初恋的替代，不管初恋还是后来的恋爱都没有打动我
568,情书,1,你神经病啊！这部电影每个人给人的感觉就是我TM好闲啊！我TM好蛋疼啊！你们看我装逼可好？一帮矫情逼~真的太作了那个叫秋叶的真是猥琐大叔的典范啊~你拍这个到底想干嘛啊？我去！浪费时间~
569,情书,2,无感，跟原著的感觉有差，其实原著感触也不大。可能是因为我从未好好暗恋过一个人，所以觉得过于矫情。不喜欢这种没有交流的眼神爱情，光是思念和几句话的接触只能浮在表面。这样的爱情只能去幻想甚至骗人，除非你可以确定自己曾爱上一个从未用语言去触碰的人。
