,movie,star,comment
236,情书,3,怀念逝去的未婚夫，最后却发现自己不过是替代品……对那个女孩欲言又止，对一个很像的女孩却可以说出一见钟情，就算拍的这么美，还是觉得这个故事好残酷，博子的内心，是不是完全崩溃啊
237,情书,3,一点没觉得很感人 只是当时的柏原崇美的很梦幻
238,情书,3,终于终于看完了。所以主角是两个女生，崇崇没怎么露脸，不过偶尔一露就摄人心魂。原来九十年代日本中学生的裙子还是那么长的咯。借书卡真是一种，怎么说呢，浪漫、有人情味的东西。
239,情书,3,真心觉得这个电影很一般。但结尾的肖像好浪漫，但是他妻子真心可怜啊，找了半天真相结果发现自己就是个替身啊。可是看过一吻定情之后回头再来看柏原崇觉得他好美型怎么办-。-
240,情书,3,真心觉得这个电影很一般。但结尾的肖像好浪漫，但是他妻子真心可怜啊，找了半天真相结果发现自己就是个替身啊。可是看过一吻定情之后回头再来看柏原崇觉得他好美型怎么办-。-
241,情书,3,大一在团组织活动上看的，就没觉得哪一点打动人了。
242,情书,3,男人都很自私，自私到说可以喜欢同样面貌的人；博子很可怜，因为她那个害羞的未婚夫，说不出口求婚的原因，是因为自己不是他心中那个人；树酱很可怜，人死了，才被迫发现当年的被爱和所爱。博子是解脱了，树酱不知会如何。而我，力求不做自私的人，看来是很难获得爱情呢。
243,情书,3,@何其d。一女的lF男朋友原硎且樽约洪L得像e人喜g自己，第二女的日子^得好好的突然知道以前有男的喜g自己，但已死了，那男的有很圩约旱奈椿槠藓]忘^自己的暗ο螅但他已死了。
244,情书,3,三星半吧。断断续续看完的一出戏。因为是先看书本再看电影，所以对情节已经有一定了解。但对日本文化还是不了解。比如说，为什么家里面有人去世了，反而一点都没有悲伤的感觉存在。说起某一个人死的时候，为什么还要笑到那么夸张……很不理解。只有那段许多年前没有道明的暗恋是我看明白了的。
245,情书,3,这么一部平淡的初恋电影竟然这么高分07.日本人喜欢的女孩子：甜美、温柔、清纯、乖巧、娴静、内敛、简单、苗条、顾家、清汤挂面的直发，傻白甜，习惯性地装傻（和台湾偶像剧有的一比，难以想象日本女人真得像小孩一样单纯），总是抛出疑问句或反问句回答对方难以回答的尴尬问题（我很讨厌这种低效的沟通方式，搞不清对方到底什么想法，拖拖拉拉磨磨唧唧的回答会让我大为光火）。我曾认识一位大龄单身日本女性，真的是行事说话很温柔，会做饭做手工，没见过发火，不像中国女人那么强势，也不像韩国女人那么泼辣，日本女人应该是所有男人的理想妻子吧？你看剧里不管经济条件如何，日本女人总是打扮有致，家里收拾得干干净净，这和平时日本人给人的感觉一致：干净整洁、注意仪表、特别有礼 ，就是太爱道歉了05。爱情标签电影终于看完了！97
246,情书,3,太年轻，不知道爱情的颜色，因此错过。但我不太感冒这个
247,情书,3,岩井俊二的爱情片我不敢恭维，或许是日本的爱情都是这么含蓄。
248,情书,3,期待了110分钟，就等最后的爆发，刚开始爆发就上字幕了 -_-b 我果然还是西方人么 日本社会也真是奇怪，明明人人都这么含蓄，性就这么开放
249,情书,3,说实话，我并不是一个拥有岩井俊二情结的人，尤其随着年少时光和暗恋记忆离我越来越远，重看这部电影似乎也找不回当年的情绪。但中山美穗依旧是美的，那种谨慎而细腻的美，再后来就愈发难寻了。所以当她在雪地奔跑，向心中那个藤井树大喊，你好吗，我很好的时候，还是感动不已
250,情书,3,关于这个人的故事，每个人都只占有一点点。过去的暗恋也好，后来的婚礼也罢，故事的结局和答案都只在一个人心里。而你永远不可能知道他心里到底留下了什么。
251,情书,3,连着几周都看了日本的电影。这部的节奏好慢好慢啊。。。果然到了学生戏份时我就来神了，不管小说还是影视作品，校园恋爱都是我的菜啊。。。哈哈~这部感触不很大，男的女的都那么漂亮，怎么能没有对方在暗恋这你的自觉呢女树树？情商捉急啊。。。
252,情书,3,"__お元 ですか。

__私は 元荬扦埂"
253,情书,3,重看证明，当年小升初那会儿去某个大姐姐家一呆就是一下午并不是因为这片子有多好看多打动我。
254,情书,3,我也不知道为什么我就是喜欢不了~
255,情书,3,不知道为什么这么受追捧  感觉没有四月物语好
256,情书,3,入门级文青的G点，岩井大神是撩拨的那么用心且到位。
257,情书,3,不是我的斯代尔，看的木有感觉~~~~
258,情书,3,有点无聊，分两次看完，我在想这么一个不会表达爱情的内向男生，后来却找了个代替品而不是去找初恋情人，就这么一个青春期的单恋故事，真的很感动么？为毛能得这么高分？
259,情书,3,6/10。看不出这类伪清新能造成动人效果，岩井俊二一如即往把一切打造的光鲜亮丽，然后情感滑到了惺惺作态里，滥用柔光滥用手持，煽情也不见克制。大概是我没经历过如此MV般非富波折的恋爱缘故，怎么都不自然，硬是没觉得感动，还好这次不太无聊。女主角原先是歌手，怪不得几段表演挺作的。
260,情书,3,中山美穗和柏原崇比起来有点大，其实这种片和很多韩国爱情电影很像
261,情书,3,"闲篇太多，非常可惜。在一个无疾而终的初恋故事里面，一边要让女主角 A “重现时光”，一边要让女主角 B 从丈夫的死中 move on, 甚至在快结尾处时还要照顾到亲戚朋友们的伤痛疗愈，这一切的堆叠让剧本显得笨拙而功利。柏原崇的好处完全没有体会到（在我眼里几乎就是一个日版吴世勋），但酒井美纪的光芒甚至能将中山美穗衬托得苍白无比。"
262,情书,3,说实话我不太感动于这个故事，没什么感触。但是，1：藤井树这个名字真的很不错。2：无论是书还是电影，在爷爷说“不是走，是跑”的时候都非常感动，大概是哭了的吧。嗯。
263,情书,3,"我们暗恋的人也许还能遇见，暗恋我们的人也许也还能遇见，而我们却只能擦肩而过，道一声：
-你好吗？
-我很好。
这是最无奈的事。"
264,情书,3,除了柏原崇的养眼，满篇的矫情真让我受不住。
265,情书,3,一个叫渡边博子的女人跟一个叫藤井树的男人结分，然后男藤井树死了，渡边博子找到了一个女藤井树，女藤井树和渡边博子是一个人演的，她们都男藤井树喜欢过。
266,情书,3,还是很温情的，温情得好像不是真实的生活
267,情书,3,咋说呢，这种被奉为神作的东西在我眼里就是...矫情！理解不上去啊也...真是俗人！
268,情书,3,启蒙电影吧，如今就剩摄影还能回味了
269,情书,3,它来的时候，你并不知道，它走的时候，你也并不明了...一切都藏在岁月的尘埃里，任由时光老去。
270,情书,3,马马虎虎的怀念旧爱作品。想当年柏原崇还是很帅的。
271,情书,3,这个故事告诉我们如果别人送给你一本书，起码要记得翻开看看・・・・如果有一个纸片・・・・・也要翻过来看看・・・・・・・・・・・・
272,情书,3,那个男孩在午后的阳光里，在白色窗帘飞扬的掩映中，静静读书的样子，不由得让人怀恋童年的时光。
273,情书,3,"お元荬扦工`？
あたしわ元荬签`す。
--喂，你好吗？
我很好！
@J Lei （XW喜欢里面的暗恋。）"
274,情书,3,为了经典的藤井树窗边读书侧影看了全篇 有点小感动 暗恋总是以错过结束呐 一声叹息
275,情书,3,第一遍两颗星，第二遍三颗星。有两个人怀念你。
276,情书,3,现实与回忆两线穿插的剧情通过情书这一媒介作为传导体。文艺至极进展缓慢，有种憋在心里久久无法释怀的感觉。于是我一直在等待着那个情感的爆发点，最终等到的却是一瞬的心颤，无奈失望而终。实在提不起太大的兴致来看这部爱情影片，只因情感酝酿了太久了啊。
277,情书,3,其实我没怎么看懂，只是记得“わたしは元荬扦埂￥元荬扦工。”很有感觉的感觉。
278,情书,3,女树小时候和长大后的性格MS不大同啊。。而且博子算什么呢？替代品？调子倒是不错。一贯的岩井俊二风格。
279,情书,3,"为什么 我真的对这个故事 无感呢？ 柏原崇也无感  我可是青春纯爱控啊!
"
280,情书,3,虽然看哭了――是为博子哭的，但是看日剧是需要很大的耐性的。再者，真心觉得除了慢慢渗透你的那种细节影响着你的情绪，这部片真的觉得一般了
281,情书,3,每每发现所谓的经典却是我以为一般的时候，这种对自己的怀疑。。。还是要说，这个电影似乎是残忍的，我不喜欢。看过，就看过了。
282,情书,3,其实我向 来恶意的排斥日本的一切事务。。。 不过，看了岩井俊二的电影，会觉得，日本人民好善良，他的电影给人的感觉是那么的美好（但并不是说，我觉得这部电影好看哈）。。。
283,情书,3,不懂为什么会被奉为经典，难道是因为海报里女主很像得了白血病却又没有得？
284,情书,3,美好而又哀伤 没有谁比岩井更擅长描绘青春了
285,情书,3,岩井俊二是我很喜欢的导演，先看的《燕尾蝶》很有感觉，再看《情书》反而不大喜欢。由于二位女主角的高相似太让人费解，巧合也太多，感觉太不现实。可能由于过分的预测二女为一人，电影想表达青春的萌动，暗恋的感觉却又不令我感动，又或者是对它期待过大，所以很失望，感觉少了深度和美感。
286,情书,3,如果当初我勇敢，结局是不是不一样。
287,情书,3,岩井俊二最失望的就是这部了，期望值太高，看得昏昏欲睡。
288,情书,3,就记得小时候为了看柏原崇。。。。
289,情书,3,没太多感触啊。不过环境挺美的。所以最后的照片揭示了藤井树其实喜欢的是同名的女生，而喜欢上后来的渡边多少也是因为长得像同名女生的缘故吧？渡边在他死后仍然不能释怀。真的不知道感情的世界是否应该讲公平。
290,情书,3,如果最后两个人女同了我就打五星
291,情书,3,"实话是断断续续的看过一些，介绍看过很多
不知道咋说~~每次开头下就很难再继续下去了
雪景很漂亮"
292,情书,3,一个月看了三四次次才勉强看到尾。。。。“你好吗？我很好”――到底有神马感动有神马意境啊！世界这么乱你装纯给谁看啊！！！！
293,情书,3,貌似是还在读小学时候看的吧？什么都不懂耶~摊手
294,情书,3,少年的藤井树男女都很俊俏，女藤井的父母也很好看，爷爷很可爱。情节可能在九十年代很震撼人吧，现在看不是多特别。导演的叙事手法的确很赞。
295,情书,3,三周年祭日上又一次悲痛到不能自已。正因为无法抑制住对已逝恋人的思念
296,情书,3,蛮经典的，就是感觉一般性吧！爷爷那段很感人~
297,情书,3,男人幼稚地付出，女人浪漫地回忆。然而并没有在一起。爷爷才是最好的选择，不然奶奶也不会嫁给他吧。
298,情书,3,看太久了，当时感觉没有多大共鸣，画面和氛围还是不错的
299,情书,3,一个白痴女，一个变态男，而且这还是一个与“女主”无关的爱情故事，除了最后借书签背面那意料之中的伏笔，完全没有出彩的地方
300,情书,3,猜不到岩井俊二的动机 也不敢妄加揣测 但我情愿 他是为了测量自己而写了这部戏
301,情书,3,感人吗？唯美吗？我都没看出来这是爱情片。。。
302,情书,3,从小到大，喜欢过很多女孩，现在想想，她们其实都是同一类人
303,情书,3,一人分析两角。男主角出场太少了
304,情书,3,莫名其妙的无病呻吟的纯爱片我不懂。这个时候你们就不觉得藤井树是渣男了？因为长得帅咯？所以长得没那么帅的男二就看起来很猥琐咯？我不明白暗恋和珍惜眼前人，跟他爸死于肺炎他爷爷背她去看病有啥联系？我也不明白到底是男二感动了她，还是因为发现你只是替代品而选择遗忘？所以这就是追忆似水年华？
305,情书,3,看完了。回忆的部分比较好看
306,情书,3,有些有趣的情节，不过节奏太慢，岩井俊二可能不太适合我
307,情书,3,没有让人感受到的爱恋，就等于不存在；find someone like you 是种无耻的欺骗。。。
308,情书,3,很奇怪，传说中的经典看起来没那么神
309,情书,3,可能是因为没在对的年纪看对的电影吧，只觉得做作。可《假如爱有天意》却是看了又看每次都觉得好。喜欢这部电影的人可能都被白窗帘边的美少年打动，对没有说出口的爱难以释怀并感同身受，可是如果从博子小姐的角度想一想呢？喜欢她，是因为她和年少时的暗恋长得很像；准备了婚戒，求婚却两个小时都说不出口；生命的最后一刻唱的歌，女友也不知是什么梗……永失我爱的现女友与男主年少暗恋的现在貌似还单身的“女友”写“情书”，浪漫的故事架构里，我只看到残忍。
310,情书,3,"小时候曾为这个故事深深地感动过.当然只是小时候,而且当时小屁孩一个,还误会了影片的意思.长大再看一遍,感动早就消失.所以......"
311,情书,3,“本片以清新感人的故事和明快唯美的影象在日本国内引起了轰动，影响波及到整个东南亚甚至欧美，被众多影评人视为日本新电影运动中最重要的作品之一。”反正我看了内心是毫无波动的，也没有想哭想笑。
312,情书,3,没哭，为什么两个人长得那么像呢，没看明白。
313,情书,3,岩井俊二真是不嫌累的慌，就讲这么个稿儿，费了那么大的周折。拖沓嗦得很呐。
314,情书,3,我怀疑我没有初恋。
315,情书,3,也许已经过了那个心境。柏原崇很帅。你好吗？我很好。仅此而已。
316,情书,3,终于看了这部豆瓣鼎鼎大名的电影了，可实话是，电影除了使用了一种讨巧的叙事外，似乎只有少女藤井树和青年藤井树一贯的个性确实让人有太多好感。
317,情书,3,看完《情书》我终于确定了，是我有问题。20万人都说好，那我为什么完全get不到感动的点，只能从个人经历上找原因了。最接受无能的还是那个问题，情感点太散了，以致于我无法集中于一段关系深入感受。还有没人觉得这有点可怕吗？你发现你念念不忘的已故前男友只是把你当成了初恋替身，那之前所有的爱与付出算什么呢？已经没人能给出答案了。岩井俊二我大概这辈子只能喜欢一部《燕尾蝶》了。
318,情书,3,存在电脑里有半年了，听说适合阴天，既不快乐也不悲伤时，于是在高考结束这天翻出来看....没有看燕尾蝶和花与爱丽丝时候的那种悸动，很遗憾珍藏了这么久的东西就这样错过了，不知道是状态依然不好，还是自己再也无法感动了。岩井俊二的片子怎么那么少啊.....
319,情书,3,我始终不知道爱情是什么，尽管我看过几百部爱情电影，听过许许多多爱情故事，但今天我突然发现，真正的爱情，是不会说话的。
320,情书,3,虽然非常有名，但我完全没有感觉！
321,情书,3,我看了五遍，每次都昏昏欲睡……
322,情书,3,不是冲着传说中的柏原崇去看的。小说太爱了所以电影其实失望了。
323,情书,3,很久以前看过《关于莉莉周的一切》书和电影，现在想来当时被吹得有些过分。包括这部《情书》一样是通过介质进行交流，自我抄袭很无聊。故事也乏善可陈，谈个恋爱也比比歪歪扯了一堆，而且部分情节太失真了，学生在学校都不念书的都给你找学校图书室里你们的爱情故事。因为你长得象是初恋所以和你在一起，这几把玩意感动你个老母。吃饱了撑的。
324,情书,3,"可遇与可求之间
只在太过年少的时候看来
才仿佛隔着沧海桑田
――《情书》  "
325,情书,3,"我不是小清新,,,,,,,,,"
326,情书,3,初中看过书，无感，也没有看电影的冲动，最近是冲“日本最后一个美少年”去看的。。。
327,情书,3,很典型的日本式，脱离生活的美好，带来未免稍显幼稚与YY的感人。
328,情书,3,第二次在大屏幕上看中文配音，最后一幕落泪，散场遇到初恋，濉
329,情书,3,绕了一大圈发现自己是个替身，真可怜可气。“你身上有她的影子”
330,情书,3,我同学西巴的最爱，所以我就把自己那套精装HL的D9+CD赠给丫了
331,情书,3,断断续续几天才看完，中途多次睡着，我把这归结于女主的长相是我不喜欢的类型。相比四月物语看完时的意犹未尽和心中的柔软，我真的没法爱上情书
332,情书,3,那年冬天宁静的雪。相比于丝毫不俗气的基耶斯洛夫斯基，这个做的还是有点吃力。
333,情书,3,隐而不发的爱恋总是会让人感动的罢！同名同像为两段没有结果的单恋画了个圆圈。电影以后来才出现的女藤原树在回忆中止后发现一位少年未曾说出口的爱意做结，双层叙事结构更为这段爱情添加了一层超时空的唯美滤镜。p.s.未看电影时觉得“你好吗？我很好”含蕴丰富意境悠长，看完却无法在电影中收获此感。
334,情书,3,暗恋是太痛的压抑，加上小清新的调调，都是我所没经历过的，也是我不喜欢的
335,情书,3,评分再度虚高，日本这种类型的爱情电影让我觉得太做作了。女主角小时候超级好看，一直被别人说做女神的中山美穗好多镜头都让我觉得超级像我妈妈年轻的时候，而且我敢说我妈妈年轻的时候比她要美很多，男二实在是太像AV的猥琐大叔了。逝去的爱情就是逝去了，时间就是残忍的一个东西，不会等着你觉悟。
336,情书,3,其实电影没什么波澜 看上去更像是两位平凡的少女对共同的初恋的追忆吧 那个年代和那时候的心境 就像是烟波浩渺的流水 过了就再也找不回来了 遗憾或许就是最美好的回忆 暗恋的年纪 那种最朴素的情感在多年以后终会发酵成一生的羁绊
337,情书,3,我没觉得这片很好看…这么说是不是破坏了大家心中的神圣呢
338,情书,3,我觉得我晚了10年看这部电影，也许再年轻10岁会给5星。
339,情书,3,基本人人叫好的电影，个人觉得还好吧……
340,情书,3,基本人人叫好的电影，个人觉得还好吧……
341,情书,3,3.5 点到即止才是真。没有什么是必定完美的，或许这才是最好呢？博子小姐温柔似水，真的是外柔内刚的典范。幸好有秋叶在。…幸好又是一个美好的开始。
342,情书,3,柏原崇把纸袋套在骑车的女主头上的那一刻我怒吼道：“我靠这么干人家妹子很容易翻山沟里的好么！小zei你以为你是柏原崇就没人会揍你吗？！”这么一看我果真是个霓虹纯爱电影绝缘体了@_>A。
343,情书,3,因为柏原崇死了很伤心，所以吸取教训，找个苏永康做替代，如果他也不幸死了的话，自己就用不着再伤心了
344,情书,3,大学时被奉为经典的东西，岩井俊二诶！如今已完全忘记情节，现在要传给读大学的表妹启蒙，顺便再看，被做作的细节酸到，一颗星给叙述，两颗心给花瓶柏原崇。。。
345,情书,3,我还真是不适合这种纯情的片子，为柏原崇加个星
346,情书,3,]想到不e。
347,情书,3,7月4日的凌晨，在小樽看完了这部电影。之前无数次因为缓慢的开头而合上了电脑，直保留到我旅行到此片的拍摄地。一场冬日的浪漫回忆，电影中对感情的使用小心翼翼，点到为止，一切在平静中层层展开，这样的叙事方式有着让我静心的魔力。在最后卡片翻过来的时候，真的感觉圆满了：当你知道你喜欢的人也喜欢着你，这就够了，不是吗。藤井树，这个被两个女主同时叨念的名字，已经在两年前永远地留在了雪难里。“你好吗 我很好”渡边对着雪山喊出这些话时忍不住地落泪，那些憋在心底的思念以及往天国寄信的感情在一瞬间被宣泄了出来。而那份迟到了10年的暗恋心情，终得以穿过时光，轻轻地落在女主的窗前。很喜欢这个故事，岩井俊二还在片中聚焦了死亡后对周边人的变化。秋叶先生的吻那段很棒。片中的剪辑和镜头很值得学习，那时候竟就用到希区柯克变焦了
348,情书,3,装小资必备片儿。妹妹的礼物
349,情书,3,没有想象中好看，感觉挺无聊的，差点睡着。。。
350,情书,3,= = 只记住了那个帅气的男生 和那句 你好吗 
351,情书,3,被豆瓣简介和下面那句“暗恋的极致”剧透得体无完肤，日本的女人好奇怪
352,情书,3,看多年前的电影，那种年代陈旧的美丽无法向当时那样认同。不过最后那段树说着：因为太害羞，所以一直没有寄出这封信。微小的幸福感滋生~
353,情书,3,那个渡边同学被当做替代品没人觉得是件很惨的事吗？！而且有很多细节假的很又不合逻辑~~小日本的扭捏作态表现得淋漓尽致~~
354,情书,3,很早就听过这部电影，一直下了都没看完，觉得前面很枯燥乏味，完全是想要知道到底怎么回事才看完的。老实说没有特别感动啦~是日式一贯的小清新纯爱风格~给人细细回味的感觉.虽然柏原崇的戏份不多，还是给我留下了非常深的印象！太帅了！
355,情书,3,"中山美穗有点儿像何美钿,"
356,情书,3,为了小樽，于是看了这部电影。不过原谅我把文艺片想成悬疑片或者穿越片，可是导演干嘛把两个不相干的角色让一个演员演呢？而且替代品这件事实在是太f心了
357,情书,3,一切都是徒劳，闷骚的极致，没啥感觉的公认好片。
358,情书,3,得闲重温了一遍，还是更喜欢《四月物语》呐。
359,情书,3,世上还有另一个我。
360,情书,3,真的没反应过来，书签背后的肖像就是最好的情书。
361,情书,3,"就是不喜欢这个傻故事
虽然喜欢那种寒假 幽闭的小山村的感觉"
362,情书,3,众人力捧的一部电影。看了一通宵电影的其中一部，回忆起来觉得并没有记忆很深的地方，女主角我不是很喜欢，剧情比较迟钝，因为男一并非丰川悦司，所以悦司的声音听上去很撮。
363,情书,3,"我理解不了，如此深厚情感。
多年以后，再来领教。"
364,情书,3,初恋情结，当有一天，你遇到和你初恋情人长得一模一样的人，你会怎么做呢？
365,情书,3,觉得很一般，不知道为什么评价还那么高，什么纯情，没有看出来！
366,情书,3,电影故事比较一般，关于青春的情感过于单薄。但导演对于光影和角度的把控十分娴熟而且独具一格，布光很柔和感觉很舒服。关于家庭的描写也令人动容，雪景拍摄十分美丽令人印象深刻。
367,情书,3,日式的拍片美学，这部电影是“陈绮贞”的电影处女作品，还有对于青春期的那点小骚情，藤井树（树）真是作~看得我这个白羊座真的很着急。
368,情书,3,当年前男友力荐的一部电影，其实个人觉得一般，总的来说就是学到了一句日语“ciniqiwa 午安”= =以上。
369,情书,3,没有看完，实在无法忍受。。
370,情书,3,电影片头肆掠的风声粗犷却不凄凉，一身黑衣的博子和纯白的雪交映，异常唯美。
371,情书,3,有些爱，是用一生去延续的。
372,情书,3,配音要了我命。回头找原声的再看吧
373,情书,3,拍的挺矫情，没看出什么感觉。风景还好。
374,情书,3,"""那些没有开口的告白，最终还是让你听见了。""所以博子就傻逼了呗？岩井俊二好喜欢玩跨日本转学然后在两地爱上两个不同的女人，两个女人都死心塌地的故事啊。是有多自信……"
375,情书,3,还以为是君的名字解忧杂货店这类二次元的故事，其实不过是同名同姓的初中同班男女同学的初恋故事，男生循着初恋女生的模样找的女友，和初恋女生通信…8.9
376,情书,3,没被感动，也没哭，实在找不到哭点在哪里...是我老了还是本来就没什么感情= =
377,情书,3,最经典的爱情电影之一吧，其实最喜欢的还是岩井俊二的音乐
378,情书,3,没看懂- -。
379,情书,3,两个名字相同的人，两个长得相像的人
380,情书,3,真的没反应过来，书签背后的肖像就是最好的情书。
381,情书,3,"就是不喜欢这个傻故事
虽然喜欢那种寒假 幽闭的小山村的感觉"
