,movie,star,comment
130,七宗罪,4,一开始的节奏太有爆发力了 喜欢第一个故事的CULT  反而到了后期有些虎头蛇尾 MORGAN的演技真是太好了！
131,七宗罪,5,没有电锯惊魂好啊～～～但是宗教意义上已成为悬念的永恒高度了～剪拍很流水般值得多遍观看
132,七宗罪,5,Seven deadly sins:gluttony greed sloth lust pride envy wrath （按被杀顺序排列）结局彻底震撼到我了 Pitt Freeman Spacey 阵容强悍 雨中布景的气氛烘托 最后车上凯文跟布拉德那段神学对话 不能再点赞了 结尾处摩根引用海明威的一句话 他只同意其后半句This world is worth fighting for 点睛之笔
133,七宗罪,4,"。。。。。。。。""The world is a fine place，and worth fighting for。I agree with the second part."" "
134,七宗罪,5,承接沉默的羔羊风格的悬疑惊悚片，故事性更强；喜欢上MorganFreeman
135,七宗罪,4,天主教的七宗罪，第一次了解到是在大学英语的阅读课本里，最喜欢的是头宗罪“骄傲”，是因为网络小说里那个永远光辉灿烂的路西法。皮特在这部电影里很年轻很英俊，但是最后出现那个盒子的时候，我没来由地想起《越狱》里的sarah，不过让人伤心的是，sarah的死是假，而他的悲痛是真，多么残酷
136,七宗罪,5,“We see a deadly sin on every street corner in every home and we tolerate it. We tolerate it because it’s common it’s...it’s trivial. We tol
137,七宗罪,4,"「暴食」、「贪婪」、「懒惰」、「嫉妒」、「骄傲」、[淫欲]、「愤怒」…""the world is a fine place,and worth fighting for.I agree with the second part.""~~气氛营造得相当好，弥漫着压抑与无可奈何……"
138,七宗罪,5,当杀人犯说还有两具尸体时我就猜到结局了。只是没想到那一个箱子的桥段！！！  布拉德皮特还真的是帅！！！！！
139,七宗罪,5,重温经典，步步惊心。太多太多细节，恐怕大卫芬奇就好比一个独孤求败的魔术师，制作了一场127分钟的盛宴之后，站在一边冷眼旁观观众的目瞪口呆。奈何世人尚无法完全猜透他布的局，但是他也不会去解释。你想它是什么样，它就是什么样了。
140,七宗罪,5,其实还是不是很明白  但是剧情方面无可挑剔
141,七宗罪,4,"意外结局 片尾景色很美 
曾看到一人画的结尾很美（画图猜电影），苦寻2小时，无果"
142,七宗罪,4,连绵的细雨、阴暗的街道，末世感的犯罪场景和压抑氛围，这便是我对它的大致印象。这部电影让人有罪恶感啊。
143,七宗罪,5,“暴食”、“贪婪”、“懒惰”、“嫉妒”、“骄傲”、“淫欲”、“愤怒”
144,七宗罪,5,这是我第一次接触主题泛着那么浓郁宗教色彩的电影，就想是在融化一颗巧克力一样。不由自主的跟着导演想知道下一步，然后一气呵成的看完后感叹了下剧情真的么什么可以挑剔的，至少导演很完整的告诉了我七宗罪是哪七种，皮特很好的诠释了一个年轻鲁莽的干探，他没有秀他的肌肉但我觉得性感依旧。。
145,七宗罪,4,力图说明的东西太多，两个多小时显然不够用，如果人性真如想象中完美，想必这个世界便没有善，但反之，如果人性没有想象中完美，我们的生活的世界中，也就没有恶，怎奈，我们都是凡人，都有原罪，都有七宗罪
146,七宗罪,5,最近看了一部港剧《警探》，快三十年后后黄日华和苗侨伟再搭档，结尾涉嫌套用本片桥段。
147,七宗罪,5,"乙善是我的最!!!所以,,@部影我很深刻,,主角Me曼+皮特配角史派西..,特e是史派西..演得太入蛄,精彩"
148,七宗罪,4,第一次觉得布拉德皮特帅，可后来凯文史派西出场了，老天~居然有点被他那套理论蛊惑了。。。
149,七宗罪,5,事物都是有两面性的，特别是神秘的宗教。很佩服编剧的精妙构思，只是很难过结尾处皮特可怜的妻子，她似乎是七个死去的人里最无辜不幸的一个。
150,七宗罪,4,很久以前我就被剧透了，被剧透了很多次，以至于我迟迟不肯看这部电影。初中时候的男生大抵是因为难为情没有剧透妓女那段。于是那么一个小桥段我还是微微的shock中，蛋疼。大卫芬奇，我从不怀疑。
151,七宗罪,5,没有比七宗罪更完美的杀人手法了
152,七宗罪,5,最初看的大卫芬奇的电影。。怎么说呢，开始以为会被吓到。看之前就看过很多评论说气氛是多么多么的压抑。。总是湿湿的 因为总是下雨，里面很多因素也和七有关。看完发现大卫芬奇不是盖的啊~喜欢镜头的运用吧，感觉很华丽。但不是那种很张扬的。。
153,七宗罪,5,@就是一部o理智逼看的影，]有有明@的伏P，理智逼一步步的分析下去，最後得Y局就是o理性的人的答案，最後lA了，是罪犯。好Y局。你⒁院畏N世界^抑或宗教信仰砻@日益冷漠冰冷的世界？
154,七宗罪,4,芬奇就是个标准的处女男，龟毛到你可以想象出他的头装在那个凶手身上却毫无违和感。情节猎奇，Bug略多，MV导演的毛病看个片头就能全挑出来，个人比较倾向阴谋论。Pitt年轻时长的不讨厌，还是不能掩盖他贱男本质。
155,七宗罪,5,每个人都有自己内心深处的光明和阴暗，而结尾的凯文史派西只是把大家伙内心的那点焦虑和恐惧直截了当的给我们说出来了而已，所以我们很不爽，而且很害怕。
156,七宗罪,5,"2000，顾路阳光苑，VCD，补登豆瓣。
2005，伊犁路134弄，DVD。
2011，九亭，DVD。"
157,七宗罪,4,时过境迁，看到开头，猜得到结尾。不过史派西的演技真不错。通篇下来，感觉手法比较老旧。可能是年代的关系。结局比较自然，没有硬掰个不像人的英雄出来。
158,七宗罪,4,最漂亮的是剧作结构，用宗教概念带串联起“罪”。如希区柯克所说，真正的悬念是与观众的心理互动，炸弹爆炸只是惊奇，观众等待爆炸才是悬念。最后两罪我不甚满意，如果是皮特因嫉妒弗里曼而杀死他，警察互搏，则更具批判性。
159,七宗罪,5,"抛弃血腥暴力的镜头，仅用镜头的剪切、语言的描述让人体验了一回惊悚之旅。剧情精彩之余也不缺深刻的内容。“love costs ：it takes effort and work。”
人类的七种罪行，何人来偿还・・・

"
160,七宗罪,4,中间有一部分的时候节奏略显拖沓，以至于让我对他失去了耐心。但是坚持着看完以后就会发现他所追求的完整性。层层递进的铺垫使得最后的结局非常完美。
161,七宗罪,5,结局让人很伤感！
162,七宗罪,4,扣人心弦的剧情和布局精巧的犯罪。没想通的是最后的高压线的设置。那个盒子里面是不是人头？with 6
163,七宗罪,4,"大卫・芬奇多么擅长这样的犯罪，人性题材，这部就是经典代表之作。弗里曼是里面演得最好的，有藏有露。最后以里面台词作结“the world is a fine place,worth fighting for it,i believe the second part”"
164,七宗罪,5,美国人最喜欢In God We Trust，所以容易被宗教信仰所困扰，电影的出发点就是在这里，而我们经过美妙的十年洗礼，只相信rmb了，所以还得要懂宗教的人来指点啊
165,七宗罪,5,"Ernest Hemingway once wrote 'The world is a fine place, and worth fighting for.' I agree with the second part."
166,七宗罪,5,虽然我猜到了快递来的是人头，但是没料到米尔斯还是犯下了愤怒之罪，让疯狂又聪明的传教徒称心如意了~天才和疯子总在一线之间~他跪在地上露出淡定的笑容说着：来啊，杀我吧，因为我犯下了嫉妒之罪。那时我就知道这个疯子已经赢了……
167,七宗罪,5,"Ernest Hemingway once wrote,""The world is a fine place and worth fighting for."" I agree with the second part"
168,七宗罪,5,David Fincher 我拜帽砀掠胁藕貌缓! 好影的定xξ叶言很 b要不要逼得我拼命的看何rY束就可以了 一整部127分的影下 毫oUP。
169,七宗罪,5,"傲慢，嫉妒，暴怒，懒惰，贪婪，饕餮，以及淫欲。
“这个世界如此美好,值得人们为它奋斗。”
我只同意后半句。

"
170,七宗罪,5,G弦上的咏叹调，到这个的时候...内心不能平静。david抱着她。说着i love you ..very much。。就很不详，觉得这个女人到最后一定会死...即使这样..还是被结局震撼了...永远都不要低估一个高智商犯罪者..他不是疯子。。人为自己付出了所有的代价。自作孽。
171,七宗罪,5,BDRip 宽屏版720P : http://www.verycd.com/topics/2767745/
172,七宗罪,5,印象最深的是一直到最后才露面的Kevin Spacey。
173,七宗罪,5,看完之后害怕了好久，一直怀疑有个这样的邻居
174,七宗罪,5,这是个美好的世界，值得我们为之奋斗，我同意后半句。个人同意翠西没死，这样愤怒罪的价值才更突显。
175,七宗罪,5,"""The world is a fine place and worth fighting for and i agree with the second part."""
176,七宗罪,5,挺文艺的一点也不惊悚 对这种题材很感兴趣外加摩的强大气场 5星 前半段节奏太慢容易让人放弃 紧张起来又让你的眼睛离不开屏幕了 虽然想到了结局不会太好 但是…… 为什么啊 为什么是她啊!!!!!!!
177,七宗罪,4,整部电影的结构非常独特，没有落入一般连环杀人案的俗套之中，尤其结尾的悬念感到达顶峰，无愧是悬疑片中的经典。
178,七宗罪,4,"整部电影的感觉就是很阴郁,没有一点阳光."
179,七宗罪,5,"long ls the way, and hard, that of hell leaders up to light.
the world is a fine place, and worth fighting for."
180,七宗罪,5,"long ls the way, and hard, that of hell leaders up to light.
the world is a fine place, and worth fighting for."
181,七宗罪,4,海明威说，这个世界很美好，值得我们去奋斗。我同意下半句
182,七宗罪,5,暴食、贪婪、懒惰、嫉妒、骄傲、淫欲、愤怒，这七宗罪配上《G弦上的咏叹调》。麻木、冷淡的这种状态，早已被人们所接受。刺激，警示，惊醒又能持续多久呢？
183,七宗罪,5,“‘The world is a fine place and worth fighting for’I agree with the second part.”
184,七宗罪,5,虽然大致知道结局，但是心脏依旧跳动的异常猛烈。伟大的作品，不论是电影本身，还是电影中史派西的『work』。
185,七宗罪,5,"Ernest Hemingway once wrote:""the world is a fine place and worth fighting for,"" I agree with the second part."
186,七宗罪,5,猜到布拉德皮特会是那个犯愤怒罪的，猜到盒子里的是皮特妻子的人头，但是猜不到凶手的整体计划。结局太棒了，足够出人意料。
187,七宗罪,5,真不好意思，到现在才看，话说真难得大卫芬奇能拍这么一部不那么晦涩的电影。
188,七宗罪,5,唔，拿出来回味了。。。除了重口的案件挺带感以外，片子最后的高潮给的太好了！皮特同学的内眼神！情绪带的太冲了！豆瓣上有个家伙大卫芬奇所有的片儿都打的两星一下。。。您老人家是脑子给屎糊住了吧。。。
189,七宗罪,4,虽然电影将人性阐述的那样丑恶，但其实其中差距却并不大，完全取决于如何看待。说教味太重，张力不足，个人不算喜欢。提而不疑，问题展现过于单调，摩根角色如果在加点纠葛会很好
190,七宗罪,5,「暴食」、「贪婪」、「懒惰」、「嫉妒」、「骄傲」、[淫欲]、「愤怒」，这是天主教教义所指的人性七宗罪。
191,七宗罪,4,看到结尾时，我设想的是直接给他老婆剖腹，把婴儿装在盒子里......最后知道是个人头之后就觉得没有冲击力了。
192,七宗罪,5,一个欲出世一个欲入世，一老一新警官遭遇一个极端的天才厌世者对这个“人间地狱”的“拯救”。由于警官闯入他家改变其的作案计划，七宗罪并不完全“sin to the sinner”（Miller妻是无辜的）。“作者”带着极大的热情和创意行凶，包括处死自己，来警示后人。有点反乌托邦意思（现实的极端化）11/23/14
193,七宗罪,5,用罪恶来教化人们，这事也就芬奇干得出来。Kevin Spacey 这个大坏蛋太有范了。
194,七宗罪,4,布拉德活下去了~凯文你的第七罪要如何圆满？
195,七宗罪,5,最爱影片第3位，各种场景各种隐喻，各种宗教各种人性，你非要去了解每个场景中蕴藏了导演什么样的意图才会完全的爱上这部电影！
196,七宗罪,4,很不错的电影，剧情节奏演员都是一流的，挺喜欢的。
197,七宗罪,5,总觉得有点漏洞但是又不知道漏洞在哪里……
198,七宗罪,5,The world is a fine place and worth fighting for。
199,七宗罪,5,"fincher 经典中的经典 当然这里面还是有spacey
"
200,七宗罪,3,没觉得有多经典。一来因为没有读圣经信基督的文化背景，二来就像那篇最热门的影评说的，它展示了一些很糟糕的东西，却没有给出解答。这没有什么意义。
201,七宗罪,3,因为看的年代晚了 所以惊喜全无～
202,七宗罪,3,整个片子营造一种阴暗的氛围，好像在衬托主题和基调。可是事实上，除了几幕血腥恶心场景外，实在没什么可圈可点的地方了。而且片子中还有好多地方模糊暧昧，模棱两可。人物刻画也不够深刻。最后的结局部分，谁证明那个纸盒里面一定是小警察老婆的人头？而且，即使是，老头如果真想阻止小警察开枪的话，
203,七宗罪,3,g弦上的咏叹调，爱上这部电影，完全是因为它选了我最喜欢的一首古典乐，现在回忆这个故事，不得不说大卫还是太嫩了，黑暗的表现太刻意了。除了这首配乐，其他的都很一般
204,七宗罪,3,他挖了很多坑，但没有全部填上，这是此剧硬伤。
205,七宗罪,3,没觉得有多经典。一来因为没有读圣经信基督的文化背景，二来就像那篇最热门的影评说的，它展示了一些很糟糕的东西，却没有给出解答。这没有什么意义。
206,七宗罪,3,对于故作神秘但是还猜得出结尾的电影实在只能说还行
207,七宗罪,3,胜在结尾 火候未如现今
208,七宗罪,3,一直不怎么觉得好看
209,七宗罪,3,可能对于有着同样宗教信仰或者对于欧洲宗教理解比较深的人来说，这部片子很有感触。这电影给我最大的印象就是最后10分钟的编排，比较深刻，很好的将剧情和主题结合，也比较出彩。其实原罪这种东西是信仰问题，不能当做哲学来讨论，这片子被吹捧过高了。
210,七宗罪,3,牵强 
211,七宗罪,3,也没有想象中的那么好看呢
212,七宗罪,3,觉得渲染有些过度，导致电影有些神棍的意味。
213,七宗罪,3,大卫芬奇果然不是我的菜，三星全送给CHD的压片人员，片子的质量真是无可挑剔，辛苦了~~
214,七宗罪,3,烧脑，悬疑，破案，剧情环环相扣，超级好看！
215,七宗罪,3,不X得特好啊。Y局也普普。Brad Pitt在@影真是念^可憎到尾。y怪是最後的“怒”。= = John Doe好多了。用Blabel他也不^一label。他的想法挺好的。我都同。只是多管f事了些。我喜g一面：他在路上看到一b死去的狗。Johnf:I din't do that.
216,七宗罪,3,高中时看某杂志的一篇文章就把结局剧透光了，以至于现在来看毫无惊喜
217,七宗罪,3,"In terms of making my heartbeat uneven, Se7ve made it."
218,七宗罪,3,很早以前看过，当时基本当作恐怖片看的，除了里面匪夷所思的杀人方式外，其它都没记住。后来又看过一遍之后，才觉得这部电影的内涵挺丰富的，一个年轻自负的警官最终还是败给了一个富有智谋的偏执宗教分子。小布那时还真年轻，不过我更喜欢摩根・弗里曼的表演。
219,七宗罪,3,演员表演精湛，剧本立意深刻，影片制作考究，但我始终觉得一定有在不破坏影片刻意营造出的仪式感的前提下，能够让节奏变得更加顿挫的方法
220,七宗罪,3,本来想调剂一下在单位坐着的心情，结果发现者电影看完后连我的食欲都调节没了。。。与其说是一部高智商犯罪片，不如说是一部疯狂的宗教信仰片。。。
221,七宗罪,3,结局有猜到，不过还是被Kevin的演技惊呆了。看了几部D.F的作品，发现他确实有在进步，这部SEVEN前半段节奏实在太缓慢，而且完全可以将内涵再往深挖，搏击俱乐部最后有点过，而这个则欠些火候
222,七宗罪,3,看前半部就猜出来布拉德皮特会因为愤怒接受惩罚，因为他实在表露得太外在了。关于宗教的玄虚并不能解释这个很不美好的世界，整部片子太压抑，而结尾想扬起来就太难了。不建议心理承受能力低下的人观看。
223,七宗罪,3,早个15年看，我也会被震到吧。结果全盘都在预计范围内。除了最后老者活下来――我错估了，美国电影是不需要强制性的大团圆结局以示和谐的。这也是人家的片子越来越好的原因。
224,七宗罪,3,直到今日才算看过一遍。。一直来的各种剧透和对剧情走势的猜测下全片可以说是鲜有惊喜。。黑暗的设定有点做作但仍然阴森绝望 配乐很棒 自由人老爷子还是一如既往地做着最抢戏的配角 皮特真的真的真的帅掉渣了嘤嘤嘤
225,七宗罪,3,看此片，猜到凶手是楼梯间的拍照者，猜到凶手会杀MILLS妻，故此毫无悬念。
226,七宗罪,3,从那妻子出场第一幕我就猜结局如何，结果果然如何。或许年代关系，现在看来，各种的低于期望值，包括布拉德皮特的最后演技突破，也没点到我心理那根线。。所以整部片子我真的毫无感觉= =
227,七宗罪,3,无论什么教，教义是教人生，从而更好的死；而非以死得生。七宗罪之外，“杀”更甚之。
228,七宗罪,3,"鉴于是16年前的惊悚片，权衡众多，不应太过苛刻。惊悚这个类型势必要考虑到年代的。
所以三星，基本将故事讲圆，只是以今天的眼光来看逊色不少。
<闪灵>也这感觉嘛~不要偏坦了~"
229,七宗罪,3,剧本挺好的 两个主角演得也不错 不过铺垫太多了 后半段都猜到了 没有悬念的后半段很煎熬
230,七宗罪,3,对于教义上的东西我很反感，虽然它带来了对人性的思考，但漠视依然不能被改变，说白了这只是一个教徒的反思，影片节奏缓慢，故弄玄虚又达不到惊喜
231,七宗罪,3,难道是因为之前评论看太多了？也或许是criminal minds看太多，以至于觉得剧情有些拖沓~~~
232,七宗罪,3,很久以前看的，遗憾的是我竟然把剧情忘了。。唯一能想起来的是暴食是七宗罪之一
233,七宗罪,3,不是很明白缘何这部片子被捧到这样的高度，不过赞一下凯文斯派西，这家伙演这种不动声色的反派这是绝了...
234,七宗罪,3,……悬疑不悬疑惊悚不惊悚哲学部哲学也不够宗教……
235,七宗罪,3,John Doe……人家压根叫“无名氏”，到最后也不知道这疯子叫啥，一帮警察都被耍了
236,七宗罪,3,"太老了~~上高中那会看得呢,那会看见个人头就觉得恐怖得不得了,现在开膛破肚都不过瘾。。。"
237,七宗罪,3,我也觉得犯罪心理和宗教扯得很牵强，并没有太出彩的地方，最后的戛然而止也没有太大的震撼。演员演得还是不错的。
238,七宗罪,3,感觉很一般，一个半小时的剧情完全是一开头就能想到的，只有结局意外地让我茫然，百度了才明白咋回事情。但是皮特的媳妇是无辜而死的――这是不是个纰漏呢？
239,七宗罪,3,20070822―20070823 8/8.5(185126) #34
240,七宗罪,3,一般。因为即便已经被剧透了，我一点也没觉得遗憾。
241,七宗罪,3,感觉一般，我认为电影的评分纯属个人行为，每个人对影片的感受都是不一样的，原谅我的无知和肤浅
242,七宗罪,3,7.2/10   这个立意不能说不好，但是形式大于内容，感染力流于表面
243,七宗罪,3,像一集拉长了的criminal minds，只是他是完整结束了的。十五年前的片子，导致我有太多prewatching信息，加上criminal minds的培养，我一边吃酱油面一边看，到最后还差点睡着。。记者，老婆这些，连怀孕我都猜到了。所以只能给三颗星。另，皮特当时太嫩。
244,七宗罪,3,不理解七宗罪口碑为什么这么好，只是牵扯到一点点宗教思想和人类本性的典型美国悬疑片，就哲学角度来讲深度基本为零。整部片看下来不温不火，对看电影的人来说基本没有悬念。。。豆瓣让我对它的期待太高了
245,七宗罪,3,最近看的电影感觉都是一个主题，【You can't play GOD。】我不能托付其中的深意。
246,七宗罪,3,整个世界知识触手可得，你们却在通宵打牌.神曲炼狱，失乐园，坎特伯雷故事集，牧师的故事，天主教词典，威尼斯商人，天主教史，杀人犯和疯子，现代凶杀案调查，冷血，人性的束缚，萨德侯爵.活的干尸，阅读监视，是摄影师，也没指纹，两千本子，被神选中，享受折磨，都选容忍，得学刘邦.john doe.
247,七宗罪,3,出乎我的意料，影片就如片中的凶手般故弄玄虚。
248,七宗罪,3,弗里曼的豁达睿智、布拉德・皮特的血气方刚，这两个的性格与他们所扮演的角色契合度很高。
249,七宗罪,3,无神论者表示没看懂  而且越来越欣赏不来大卫芬奇了。。求别毁gone girl
250,七宗罪,3,David Ficher always screws good plot
251,七宗罪,3,宗教，宗教杀手，很邪，什么都做的出来～～片子其实更多时候看的还是比较沉闷。。。
252,七宗罪,3,那个犯人很帅，但你不能逃避每个人都有或多或少的这样的缺点
253,七宗罪,3,结局完全被猜中。。。估计是模仿它的电影太多？
254,七宗罪,3,有点看不懂，不过看完了立刻看看自己有没有犯这7个罪，结局有意思
255,七宗罪,3,"也许是因为听过地评价太好了吧
看完后实在是有点失望"
256,七宗罪,3,下了那么多天雨啊，累不累啊。结尾很亮，真相有多吓人。硬把“嫉妒”往自己身上套的人你伤不起啊。
257,七宗罪,3,没什么内涵，画面又恶心，亮点在于布拉德皮特这个大帅哥以及全片的最后10MIN
258,七宗罪,3,看到凶手来自首的时候我就已经猜到结局大概会是怎么样了，有人说这是高智商人看的电影，我倒觉得还是笨一点看着会比较有意外感
259,七宗罪,3,说凶手是沙摩塞的童鞋你们真的想多了 不过看多了各种反转这样结局一点也没震撼啊
260,七宗罪,3,"William Somerset: Ernest Hemingway once wrote, 'The world is a fine place and worth fighting for.' I agree with the second part."
261,七宗罪,3,not so good when compared to Fite Club
262,七宗罪,3,加长版 criminal mind，15年前的经典影片，对于看惯了犯罪片儿的我来说木有惊艳之处……
263,七宗罪,3,「暴食」、「贪婪」、「懒惰」、「嫉妒」、「骄傲」、[淫欲]、「愤怒」
264,七宗罪,3,自从《沉默的羔羊》推出而叫好叫座之后，从哲学角度探讨变态狂人犯罪心理成为一些新派推理谋杀片的创作重点，布拉德・皮特 与摩根・弗里曼主演的本片用一种控诉式的姿态来质疑现在这个犯了天主教“七大罪”的美国社会，令人看完影片之后感到心情十分沉重。首先出现的是一个大胖子在脏乱的家中因 “暴
265,七宗罪,3,严重过誉，别的不说，和搏击俱乐部比起来，差的不是一两个档次。
266,七宗罪,3,开始以为皮特是真凶，后来以为摩根是，直到看见面瘫大叔凯文史派西……
267,七宗罪,3,或许是年代的原因吧，结局给我感觉其实并不给力~
268,七宗罪,3,2010年跟某唐一起看的，只觉得电影如果仅仅沦为说教或者哲理的工具就可悲了，必须有很强的故事性串联才好看
269,七宗罪,3,宗教类，各种死。我想我都有很多罪啊，。。。
270,七宗罪,3,可怜的老警官，追真凶那会儿还在被我怀疑是凶手。因为不是，所以就没啥悬念了唉。凶手比小警官耐看
271,七宗罪,3,"我就说很早嘛~~
没啥感觉的说。。
除了Morgan Freeman~~
Brad Pitt那时候真嫩啊~~（09-05-13 13:48)"
272,七宗罪,3,结局有点让人绝望，没有人赢了，都输了，其实我不喜欢这样的结局。所以只给三星。
273,七宗罪,3,可能心思不在这上面，所以没看出什么感觉...
274,七宗罪,3,"可能隔的年代太久远了, 现在看来只感觉到大失所望."
275,七宗罪,3,愤怒的那个实话说太扯了，为了凑齐7个，节奏有些不对劲……
276,七宗罪,3,提前猜到了结尾。。。芬奇的片总是与我不和，这部总算没有睡着
277,七宗罪,3,看着看着就已经猜到了，罪犯和结局，还是觉得不够经典吧
278,七宗罪,3,以为能很恐怖，结果差点儿看睡着...灰暗，潮湿，抑郁，绝望。
279,七宗罪,3,可能是我文化水平太低?我怎么觉得是一部打着宗教旗号的恶心悉悉的烂片?看在老戏骨黑人主角和布拉德彼特的面子上给个三星吧.
