,movie,star,comment
280,七宗罪,3,上星期看的，皮特不错，黑人也喜欢。就是有些镜头恶心了点r(s_t)q总体无感，皮特好嫩啊~~~
281,七宗罪,3,我太^期待了。比起砀喜gfight club一些。
282,七宗罪,3,很无趣的一个片子 就是莫名其妙的一个变态杀人狂而已……
283,七宗罪,3,这是一部自大的电影，在讲述布道的同时也在向观众布道。可惜的是，电影没有搞清楚世间善恶的关系，在极力讲述恶及其惩罚的同时，忽略了善的奖赏。有道是：因果循环，报应不爽。影片的结尾没有将主题升华，而选择了让恶惩罚了善，让恶自我实现。不得不说，这是小聪明，不是大智慧。
284,七宗罪,3,“暴食”、“贪婪”、“懒惰”、“嫉妒”、“骄傲”、“淫欲”、“愤怒”。导演把观众想象成白痴，然后用特文艺的方式告诉大家别去做。我就想知道，导演宣扬后现代反核心主义是出于怎样的目的？我想把它理解为恐怖主义。整部电影都是在一个相对消极一面展开，用时髦的话说，负能量太多。让人太过压抑。
285,七宗罪,3,一段无聊的杀人游戏，如果没有史派西
286,七宗罪,3,"最后约翰杜在车上说他杀死前五个人和他们犯得罪的时候，我就猜到了结局，猜到了最后两个人是谁。
"
287,七宗罪,3,不得不说我对大卫芬奇真的是比较无感。此片，生硬，唐突，情景设置过于主观化，完全是为了铺垫而铺垫的感觉。ps，布莱德皮特似乎每部片子不是吃就是喝……
288,七宗罪,3,还是不错的，但是没有感觉像是传说中的那样经典
289,七宗罪,3,过得去，特地没看剧透，但悬疑感还是不够，结局也一早猜到……
290,七宗罪,3,因为看的年代晚了 所以惊喜全无～ +10086
291,七宗罪,3,沉闷的过程，结局还是不够张力.完全可以猜到
292,七宗罪,3,我总觉得这部片子并没有想象中的那么好，在剧情上太过牵强，没有太多惊喜，也谈不上经典！不知道为什么豆瓣上的分数那么高，也许因为几个非常出色演员坐镇罢了？尤其是老戏骨摩根大叔。
293,七宗罪,3,感觉一般，远远赶不上我之前听过的盛名。开始的剧情毫无新意，后来的结局我很快就猜到。没意思~演员演得还行，给个中等评价吧！
294,七宗罪,3,除了用的题材和逻辑上 我是真心没有看到用这个拍法诠释七宗罪的亮点 不过暴食真心让人有点恶
295,七宗罪,3,皮特帅炸！辣个凶手脑子有包啊！自己嫉妒别人连带着死了6个02人家脸好看管你毛事啊！帮烦人到官司这也是没有办法的事啊！总有人要做这个的。讨厌妓女和同性恋不代表你可以杀他们！最后只能靠杀一个无辜的人来达成所谓的有两具尸体的目标还真是失败啊！要不是最后一句，直接两星完事！
296,七宗罪,3,95年的片，比F_尼早2年，r看到的，得把我那w幼小心Ko震成啥喊。∮绊力久不衰，即使v16年，後仍在拇似汲取B分，比如我看止不住想到的《p瞳》......但的感想――借用此l目u中的一句――就是“因为看的年代晚了 所以惊喜全无～”
297,七宗罪,3,"事实上觉得前面一般, 只是最后的GWYNETH的头, 把我彻底吓呆了.."
298,七宗罪,3,摩根弗里曼很有感觉，里面的音乐也不错，额……是叫D弦的咏叹调是吧~还有雨的渲染不错~
299,七宗罪,3,3个小时啊・・・・・・・・
300,七宗罪,3,上星期看的，皮特不错，黑人也喜欢。就是有些镜头恶心了点r(s_t)q总体无感，皮特好嫩啊~~~
301,七宗罪,3,我太^期待了。比起砀喜gfight club一些。
302,七宗罪,3,很无趣的一个片子 就是莫名其妙的一个变态杀人狂而已……
303,七宗罪,3,这是一部自大的电影，在讲述布道的同时也在向观众布道。可惜的是，电影没有搞清楚世间善恶的关系，在极力讲述恶及其惩罚的同时，忽略了善的奖赏。有道是：因果循环，报应不爽。影片的结尾没有将主题升华，而选择了让恶惩罚了善，让恶自我实现。不得不说，这是小聪明，不是大智慧。
304,七宗罪,3,“暴食”、“贪婪”、“懒惰”、“嫉妒”、“骄傲”、“淫欲”、“愤怒”。导演把观众想象成白痴，然后用特文艺的方式告诉大家别去做。我就想知道，导演宣扬后现代反核心主义是出于怎样的目的？我想把它理解为恐怖主义。整部电影都是在一个相对消极一面展开，用时髦的话说，负能量太多。让人太过压抑。
305,七宗罪,3,一段无聊的杀人游戏，如果没有史派西
306,七宗罪,3,"最后约翰杜在车上说他杀死前五个人和他们犯得罪的时候，我就猜到了结局，猜到了最后两个人是谁。
"
307,七宗罪,3,不得不说我对大卫芬奇真的是比较无感。此片，生硬，唐突，情景设置过于主观化，完全是为了铺垫而铺垫的感觉。ps，布莱德皮特似乎每部片子不是吃就是喝……
308,七宗罪,3,还是不错的，但是没有感觉像是传说中的那样经典
309,七宗罪,3,过得去，特地没看剧透，但悬疑感还是不够，结局也一早猜到……
310,七宗罪,3,因为看的年代晚了 所以惊喜全无～ +10086
311,七宗罪,3,沉闷的过程，结局还是不够张力.完全可以猜到
312,七宗罪,3,我总觉得这部片子并没有想象中的那么好，在剧情上太过牵强，没有太多惊喜，也谈不上经典！不知道为什么豆瓣上的分数那么高，也许因为几个非常出色演员坐镇罢了？尤其是老戏骨摩根大叔。
313,七宗罪,3,感觉一般，远远赶不上我之前听过的盛名。开始的剧情毫无新意，后来的结局我很快就猜到。没意思~演员演得还行，给个中等评价吧！
314,七宗罪,3,除了用的题材和逻辑上 我是真心没有看到用这个拍法诠释七宗罪的亮点 不过暴食真心让人有点恶
315,七宗罪,3,皮特帅炸！辣个凶手脑子有包啊！自己嫉妒别人连带着死了6个02人家脸好看管你毛事啊！帮烦人到官司这也是没有办法的事啊！总有人要做这个的。讨厌妓女和同性恋不代表你可以杀他们！最后只能靠杀一个无辜的人来达成所谓的有两具尸体的目标还真是失败啊！要不是最后一句，直接两星完事！
316,七宗罪,3,95年的片，比F_尼早2年，r看到的，得把我那w幼小心Ko震成啥喊。∮绊力久不衰，即使v16年，後仍在拇似汲取B分，比如我看止不住想到的《p瞳》......但的感想――借用此l目u中的一句――就是“因为看的年代晚了 所以惊喜全无～”
317,七宗罪,3,"事实上觉得前面一般, 只是最后的GWYNETH的头, 把我彻底吓呆了.."
318,七宗罪,3,3个小时啊・・・・・・・・
319,七宗罪,3,摩根弗里曼很有感觉，里面的音乐也不错，额……是叫D弦的咏叹调是吧~还有雨的渲染不错~
320,七宗罪,3,呀 前面一直很紧张以为会是个猜不到的结局...这也太...不...幽默了.....
321,七宗罪,3,像永夜，瓢泼大雨无情地往你身上砸，冰冷无情。电影里唯一天晴的时候，是悬念即将揭开之际，最后却用Mills的数声枪响结束了你隐隐的期望――人只是人，不是神，然后再度回归黑暗。电影它只负责挑起你对这个世界的怀疑和最深的绝望，不负责解答，徒留你在原地追问，为什么？这又有什么意义呢？
322,七宗罪,3,【70/100】连续几部片子都对大卫芬奇爱不起来，除结局外皆白水，沉湎于人性剖析却忽视了悬疑电影最重要的氛围架构。
323,七宗罪,3,这是部绝望的片子，它向人们展示了世界的罪恶和冷漠，但是没有告诉人们怎样避免这种境况的恶化。对了，阴暗的背景，咏叹调的配乐，这些应该是文艺青年的最爱吧
324,七宗罪,3,这个结局，完全没有惊到我呢，之前隐隐约约还是猜到一些，我喜欢看电影因为电影可以帮我宣泄情感，可是这个片子看过之后心里却堵得难受，这个片子真的是悬疑吗，完全没有恍然大悟豁然开朗的感觉，它好像一个纪录片，只是记录了一个疯子的犯罪过程，繁长而平淡。。。不过演员表现很赞，还有中间我YY了
325,七宗罪,3,男人都力捧的好片。其实也就那样。还是有些牵强的。逻辑缜密的电影也多了去了。
326,七宗罪,3,结局让人想不到，前半段略显拖沓。
327,七宗罪,3,严重不喜欢这种被割裂的电影，而且文化差异，让我们对这七宗罪不甚了了
328,七宗罪,3,按照七宗罪杀人的方式有些死板……影片拍得中规中矩，只能靠中间的枪战来调解下气氛。Somerset的很多话都是亮点。其实觉得这个罪犯的某些想法还蛮正常的我一定是坏掉了吧……|||
329,七宗罪,3,"He that is without sin among you, let him first cast a stone at her[...]And Jesus said unto her, Neither do I condemn thee: go and sin no more.Why in such movies (or novels) those crazy ppl always forget Jesus/God is love and not those bullshits. So-so movie."
330,七宗罪,3,道具值得称赞，剧情平平
331,七宗罪,3,"Ernest Hemingway once wrote ""The world is a fine place and worth fighting for.”"
332,七宗罪,3,妇男芬奇憨厚的如一头可爱小熊的外表下隐藏的一颗心又活络了
333,七宗罪,3,Y局太^精彩，^程略@沉L
334,七宗罪,3,1、充分体现了西方人多么迷信7这个数字，从犯罪的7天到7宗罪 2、从Brad第一次暴怒就猜到他肯定是代表groth，只是最后envy没想到是这么处理，也许讨了某些人巧，我却觉得差强人意。另Brad演的暴怒更加让我失望，这是第一次觉得他演技不够。。3、我就想知道关于FBI追踪阅读习惯的是真事么？
335,七宗罪,3,性格有时候很重要。当罪犯到来时，其实大概也可以猜到结尾了。不过很奇怪，为什么雨老是一直在下。
336,七宗罪,3,虽然是犯人，在“罪”面前却表现得这样从容。
337,七宗罪,3,不论我们有多么贤明，我们始终逃脱不了人之本性。我们面对一个并不完美的世界，只有fighting for。世界是不完美的，但我们不能失去理想和信念。
338,七宗罪,3,这是一部悬疑、惊悚、原罪的爱情片呐。。。
339,七宗罪,3,还是给三星把 可能近几年悬疑片看太多了 感觉很一般 如果早几年看到这部应该很惊艳
340,七宗罪,3,还是给三星把 可能近几年悬疑片看太多了 感觉很一般 如果早几年看到这部应该很惊艳
341,七宗罪,3,相比沉默的羔羊，它显得稚嫩了
342,七宗罪,3,以为很好看。下来看了几分钟，发现是看过的。 却怎么也想不起来剧情。SO。 打个三星不为过。
343,七宗罪,3,不血腥不暴力不恶心。。。。。失望了！
344,七宗罪,3,不太能理解这个主线，上帝说有七宗罪，可也有七美德，宽容是七美德之一，若七美德的宽容不能适用于七宗罪，那么它只是个摆设吗？上帝真是神逻辑。PS.愤怒那宗罪好牵强，你怎么知道那是愤怒不是绝望
345,七宗罪,3,没有想象中的精彩，雷声大雨点小，多处的埋笔都有猜到结局，感觉逻辑上多处不符合常规。杜约翰的扮演者的演技相当的赞。远离麻烦的最佳方式就是低调。七宗罪中最该克服的是愤怒。未遂5次，终于看完了~
346,七宗罪,3,再一次证明，经典的不一定每个人都欣赏。
347,七宗罪,3,并不认同大卫芬奇，原罪是信仰问题。并不是每个人相信人类都或多或少会犯七宗罪的某一条或几条。只是一个偏激变态极端的杀人狂，宗教狂去杀人而已，有什么好经典的。价值观念上的不同导致对电影的无好感。
348,七宗罪,3,事先被剧透的我表示一点不惊悚～说明这片还不够惊悚
349,七宗罪,3,"平铺直叙案件过程,陈列各种古怪死法,所谓意外结局也很好猜.一个变态杀人的故事扣上宗教的帽子,就成了名不副实的经典."
350,七宗罪,3,看惯了芬奇青壮时期的作品 这部早期的重口片显得过于拖曳 剪辑也不够凌厉 最可惜的是太过文艺且宗教卖弄有余情节不足 所以片长一般但是看完很累 虽然最后三大影帝长达二十分钟的彪戏非常精彩 但在芬奇的作品里这部算我看得比较闷的 最后花痴那时候皮特好帅啊………………
351,七宗罪,3,就剧情我觉得一般，最后的结局很出彩，可能是我没体会到其中的内涵
352,七宗罪,3,过于绝望，接受不了
353,七宗罪,3,其实真的一般，看着故事觉得就是一个神经病发癫，然后，挂了无关紧要的人，其实，我觉得逻辑性应该更强点，死的人，观众都无感，真的，死了也没什么感觉，或者只是感觉：哇，死了，其实这个电影不够精彩，因为这只是一个查犯人的纪录片=。=
354,七宗罪,3,算是宗教题材的影片吧，人性七原罪，本身就是错误，又有什么资格度化世人呢？一切都是错！错！错！
355,七宗罪,3,为什么我始终觉得很一般，有空以后再看一遍
356,七宗罪,3,一般，即使是95年的片子也算不上是经典，仅靠环境来营造气氛，没有心理上的紧张感。且剧情一般，演员也过于中规中距。结尾明明无力到不行，却又强行加上点励志。显然是被拔高了。
357,七宗罪,3,就是一部动作侦破片，为什么这么高分，演员除了杀手外，其他都演得一般
358,七宗罪,3,我也在算，不止死了七个人啊……结局猜到了。原来芬奇早期是这种调子。新线出品，和派拉蒙做派还是很不同的哈。
359,七宗罪,3,电影很拖 那种悬疑紧张的气氛不足 节奏太慢了 里面人的死法的确很恐怖 但我不明白最后那位老探长的话 
360,七宗罪,3,真心觉得有牵强。
361,七宗罪,3,好久以前听过这电影的解说，当时觉得是神作，但被剧透了，就一直没看，现在差不多都忘光了，才看的原片。片子也就那么回事儿。故事本身还挺有意思，但前期影片节奏太慢，没惊悚起来。最后高潮又太快，精彩几秒钟一下子就结束了。两位警探的人设不细致，人物背景没交代，性格特点表现的太表面。
362,七宗罪,3,觉得还好。。kevin spacey邪气不是一般的重啊
363,七宗罪,3,不是我喜欢的类型，但也还可以
364,七宗罪,3,我有罪，但谁也没资格审判我！世界冷漠而不美好，这个精神病就可以自以为是正义化身光明使者自我陶醉发泄兽欲了？没有宗教知识背景实在无法理解，结局很巧妙，演员很出彩，也就这样。
365,七宗罪,3,“暴食”、“贪婪”、“懒惰”、“嫉妒”、“骄傲”、“淫欲”、“愤怒”
366,七宗罪,3,当时完全还没有觉得PITT爸爸帅的说~情节都不太记得~只记得那个贪吃的的恶心和最后PITT老爹自己把自己带进了圈套里~甭了自己~
367,七宗罪,3,为了什么去看？却觉得不是想象中那样
368,七宗罪,3,这电影何德何能评了这么高的分
369,七宗罪,3,电视是光影和声音组合物，看电视不需要动脑子，人们不费任何力气就能理解电视上的通俗语言和画面，从小就看惯图像偏向视觉体验的人的表现是狂噪、冲动、易怒、油腔滑调、满嘴脏话.
370,七宗罪,3,七宗罪啊！宗教狂热分子
371,七宗罪,3,"即使是皮特 我也并不是很爱
"
372,七宗罪,3,也许是近段这些片子看多了。没有太多的震撼。但还是一部好片子。
373,七宗罪,3,总觉的噱头高于片子的内容
374,七宗罪,3,我个人认为满一般的。。。为什么大家觉得那么经典呢 很费解 太一般了。。。
375,七宗罪,3,很久了……将就 不如肖申克救赎 差远了
376,七宗罪,3,前些天一边准备考试一边看了不让加的激荡1978-2008
377,七宗罪,3,他把手皮用硝酸烧掉来作案...太...执着了...
378,七宗罪,3,“暴食”、“贪婪”、“懒惰”、“嫉妒”、“骄傲”、“淫欲”、“愤怒”
379,七宗罪,3,"没啥意思 为啥这么推崇
"
380,七宗罪,3,"fuck yeah,god damn,it's unfair.David Fincher,u pessimist.and u made a definitely unfair question in the movie,u madguy!!brad.my poor fellow."
381,七宗罪,3,暴食，贪婪，懒惰，嫉妒，骄傲，淫欲，愤怒。如果这些都是罪，那么谁是纯洁的？
382,七宗罪,3,生无完人，罪责不究。
383,七宗罪,3,懒惰设计难度最大 嫉妒和暴怒的死法让人感觉johndoe和奥创可能想到一块了 七宗罪根植于人性 只有毁灭自己才能把这些烂疤彻底去掉 somerset理客中上帝视角 两个警察前期查案的最大突破竟然来自作弊系统 难怪johndoe说佩服了 毕竟如此缜密还这么快被查到 所以tracey可以算是某种意义上作弊的反噬
384,七宗罪,3,提前猜到了剧情  情何以堪
385,七宗罪,3,无功无过，G点在哪里。
386,七宗罪,3,基督教用撒旦的七个恶魔形象来代表七种罪恶：傲慢，嫉妒，暴怒，懒惰，贪婪，暴食，以及淫欲。看完了完全抑郁了..怎么说呢 太压抑和扭曲了
387,七宗罪,3,补档 很经典但很无感 为自己的三俗审美自卑着T T
388,七宗罪,3,凶手自首是道分水岭，从无聊至极到精彩绝伦。构思很巧妙，意义没看到
389,七宗罪,3,穿帮镜头多的不可思议 滥制的电影 这片子唯一能看的就是摩根弗里曼的演技了 布拉德皮特 除了会说f 啊u啊 c啊 k...
390,七宗罪,3,不知道看的是不是乐hp版，感X∏橛泻芏嚆接不上的地方，尼做中人真不容易，就B看影都不得安生。所^的片制度到底是哪X弄出淼模{神R有的人可以代表所有人把影剪得y七八糟？去死去死！！！
391,七宗罪,3,"即使不被定人类所创造的“罪”，一切还是继续，太阳照常升起，过错不可更改。而“罪”的诞生则是人类为自己的“人性”所创造的解脱。无论是犯罪者，还是审判者。
我已经犯了/判了罪了，我得到救赎了。虚妄！"
392,七宗罪,3,饕餮，贪婪，好色，懒惰，嫉妒...
393,七宗罪,3,从妻子占了镜头一部分，刻意拍写皮特的愤怒。只能说，这是摆明了的结局。
394,七宗罪,3,个别镜头很血腥。重温此片后，我还专程揣着此片跑去找系里老师探讨美国宗教和社会问题，，，
395,七宗罪,3,嗷~ 皮特啊冲动是魔鬼啊！
396,七宗罪,3,又是以神之名，替天行道，想到了七杀碑：天生万物以养人，人无一善以报天，杀杀杀杀杀杀杀。最后的结局不错，但整个故事看着感觉很别扭，不流畅，主题也并不是很独特，只是借用了天主教教义的人性七宗罪。类似的主题，《死亡笔记》比这个精彩多了。
397,七宗罪,3,如果不是十二年前就被剧透了 可能我会打4颗星
398,七宗罪,3,终于会天晴，终于会再阴雨
399,七宗罪,3,不知道是不是因为对宗教没啥研究和认识，反正觉得此片沉闷至极，从头至尾无高潮，难看！
400,七宗罪,1,事实证明不能相信经典
401,七宗罪,2,2。7星。结局的小巧妙无法改变整体的不巧妙。
402,七宗罪,2,很久以前看的，相当无聊，今天才发现相当不喜欢大卫分歧
403,七宗罪,1,贴什么大标签~~~故弄玄虚
404,七宗罪,2,张力不足，其实剧情不值一提好么，真的可以得到八分以上的评价么？不要说你看不懂你没弄明白导演的用心，放你妹的狗屁！不足就是不足，不要因为导演是谁就不去正视，自己心甘情愿化身跪舔潘浚然后借此把导演上升到一个女神级别我等潘坎还如此，若只看剧情，和十二星座有毛区别――我没看过十二星座
405,七宗罪,1,None of ur business!!!! fucking shit.
406,七宗罪,2,感觉导演是想传达“凡是不珍惜生命的人都该死”的意思...后来又有了《电锯惊魂》和《数码宝贝》“七魔王”嘛~可是使“教义”成为反社会煽动力未免肤浅了。也感觉不到什么悬疑，看到一半就能猜到结局...
407,七宗罪,1,我发现布拉德皮特还真爱演这些烂片
408,七宗罪,2,如果somerset才是大boss此片水平会几何级提高
409,七宗罪,1,从没有这样的电影，让我看三次才完成，每次都是看到睡着。不论多烂的电影，只要开始看了，我就一定会坚持看完。但这部实在是无法一气呵成。两个警察，年老的丑，年轻的俗。
410,七宗罪,2,拖拖拉拉的，专心看真心难，大部分时候边看边刷网页。还这么长。这么高分让人大失所望
411,七宗罪,2,"The world is a fine place,and worth fighting for.I agree with the second part."
412,七宗罪,1,女主角你就杯具吧。。。。从一露面就杯具。没人比你更惨了。编剧啊。拿出点水平。
413,七宗罪,2,当初看这片感觉皮特太卖弄皮相了，从此之后一直不待见他
414,七宗罪,2,虎头蛇尾有木有！前两个杀得很别致，花了很多心思；而后就开始应付，罪名也牵强；结尾根本就是江郎才尽钓鱼执法。
415,七宗罪,1,美国就能拍出这样让人恶心 毫无意义故弄玄虚的片子   剧情很牛 只能证明 变这个故事的是个变态
416,七宗罪,2,相较于现在那么炫的破案技术和成像技术来说，这个貌似侦探片的电影简直土得可以――然而太多的影评以及它自身不伦不类的表达，都在说它的主题是宗教，以及罪孽之类。拜托！我真的不理解这种变态心理来揭示宗教人伦的意义在何处。――说到底，还是中西文化的迥异，西方的宗教情结怎么可以直接植入东方人心？看了不觉得好或是不明白也大可不必奇怪或自检，想想一如硬生生将西方价值观标上“普世”标签的荒谬即可
417,七宗罪,1,大卫・芬奇的电影总是给我一种加料流水线作品的感觉，没有明星只剩下平庸
418,七宗罪,2,很早就听过这部电影的故事了，可看后却觉得无聊至极压抑深沉的气氛无法理解的台词对话和不明方向的故事走向，都无法认同它的经典性 。另外感觉这个结局真的好弱智啊
419,七宗罪,1,是好评电影，但是不喜欢。
420,七宗罪,2,最大的败笔就是说皮特犯了愤怒 这真的无稽之谈 这是正义这是爱的体现 如果这都不开枪 那这世界还有意思么 搞笑 所以这是烂片 和盲从这电影的傻逼不同 我很高兴我能认识到这一点 非常认真的这么说 如果爱妻给割头还能保持冷静 那才是真正犯了第七罪：冷血 我很高兴自己能站这高度看这片
421,七宗罪,2,"杀几个人都设计得这么有爱,空得不得了"
422,七宗罪,2,没想到这部影片和我一样年份。看完前五宗罪然后去百度了一下结局，以为米尔的妻子翠茜会死的很惨，可是结局让我失望，因为凶手都有耐心等待一年才让犯了懒惰罪那个人死掉，说明一定布置好了，怎么可能把最后的嫉妒罪和愤怒罪定在自己和米尔身上，何况米尔还是后来到这个镇上的，总觉得结局倒是故弄玄虚
423,七宗罪,1,首先根本就没有什么七宗罪，七个贬义词而已；其次，布拉德・皮特演技太烂。
424,七宗罪,2,前面大片血腥的描绘，中间穿插的小温馨家庭画面，都是为了最后的悬疑揭开。不过话说这类题材的，香港八九十年代多的是，还能刻画更加痛苦，更加变态，难道这部里有皮特就会更好看？再说皮特的性格也不够突出，再冲动点都可以，总体说来挺一般的。还没汉尼拔好看呢。
425,七宗罪,2,好吧 这型电影不是我的菜 虽然有我爱的brad pitt~
426,七宗罪,2,太牵强，太假，太矛盾，太不可信，太无共鸣。看片头就怀疑是部故作高深的片子。果然
427,七宗罪,2,真得很一般很一般，开头十分钟就猜到男主是七宗罪之一，所谓最后的结局也在预料之中，这里布拉德皮特演技拖后腿，整部电影拖沓至极，最后，导演可以开下灯吗，看的真心累。
428,七宗罪,2,这么高分的电影着实让我失望了，前半段我几乎快要睡着了，最后俩罪在他们身上也是预料之中，木有意思
429,七宗罪,1,太尼玛难看了，姐被逼看了3次，恩是没看出哪里经典了。8点多分是怎么打出来的
430,七宗罪,2,说实话，这片子真没劲，我当时看着就睡着了，要知道我可是看电影轻易不会睡着的人，不管多没劲的片子……
431,七宗罪,2,剧情的紧凑性就各人来说还不够，似乎没什么联系。最后一宗罪更是看得我莫名其妙，或许是个人没有宗教信仰的关系。
432,七宗罪,2,不是一点牵强。只剩指摘之处。
433,七宗罪,1,就我个人来讲，这是个无聊透顶的片子，想表现人性的丑恶却表现得一点力度也没有。
434,七宗罪,2,是我不喜欢的黑暗题材，但是2个小时却不是很难熬。不过皮特在这部戏里帅的无与伦比了
435,七宗罪,2,故弄玄虚，令人提不起劲
436,七宗罪,2,为了那段配乐  那段老少对白给两颗星。刚开始还以为自己看错了，原来真的是凯文・史帕西演的那个变态；而其中的情节我居然全部猜中，包括杀手的身份就是那个记者，最后送的包裹是米尔斯妻子的头颅。。。
