,movie,star,comment
0,七宗罪,5,里面的布拉德皮特帅的掉渣……
1,七宗罪,4,决定永远不暴食
2,七宗罪,5,多年以后再看，还是功力和锐气并重的作品
3,七宗罪,4,故事看多后的后遗症就是一般最后半小时就知道结局了。。。
4,七宗罪,4,阴沉而绝望。基督教用撒旦的七个恶魔形象来代表七种罪恶：傲慢，嫉妒，暴怒，懒惰，贪婪，暴食，以及淫欲。一个变态的宗教杀手，平时连一只鸡也不杀，但他找到了依据来实施对人的毛骨悚然的谋杀。有什么能比一个人做魔鬼的行径更为恐怖的吗？台词：“这是个美好的世界，值得我们为之奋斗。我同意后半句
5,七宗罪,5,为什么拍出来十几年我才看到呢？
6,七宗罪,5,印象最深的是那个胖子
7,七宗罪,5,结局真的很惊人。惨绝人寰……
8,七宗罪,4,结局让我喜欢这部电影
9,七宗罪,5,"色调太深沉，纽约的雨一直下，混乱的街区，血腥的现场。
有些画面好恶心，分2天看完的，特别喜欢老警察，演技台词都是一流的。
还有万万没想到的结局。
"
10,七宗罪,5,从它开始喜欢上摩根弗里曼
11,七宗罪,4,这才是高智商电影行吗，剧中人物比其他悬疑片人物智商高多了……整部片子气氛很好，解密的话可能不够刺激，不过刺激的话就不是芬奇了，芬奇的电影一直就是这么冷冰冰的没有生气。
12,七宗罪,5,那么，学会克制，远离se7en sins
13,七宗罪,5,片中的笔墨已经不是着重在于约翰・杜是如何预谋并成功实施杀死5人最后造成七宗罪的悬疑，大卫・芬奇把整部电影提高到对整个社会的沉思和批判，甚至是绝望。片中人所在的城市人与人之间的冷淡、功利、自私、纵欲、贪婪、堕落、淫荡、高傲等人性的弱点与罪恶，在片中一显无疑。三个主演真心一级棒！8.7
14,七宗罪,4,大学时导演课就拉片看这个，彻底被分析灯光机位之类的理论伤透了，突然发现我还这电影的盗版蓝光DVD，我定会梦游买的，准备再伤一次！★★★★
15,七宗罪,4,七宗罪：「暴食」、「贪婪」、「懒惰」、「嫉妒」、「骄傲」、[淫欲]、「愤怒」。弗里曼和史派西 神演技。就是通过查图书馆借阅记录来找到犯人有点二。犯人那么有钱，就不能买书么？结尾探讨箱子里的内容其实无意义。不过个人还是倾向是头颅。
16,七宗罪,5,震撼+意外结局。
17,七宗罪,5,这世界是个好地方，值得我们为它奋斗。（后半句我同意）
18,七宗罪,4,入门电影
19,七宗罪,4,胖子是原罪，我要减肥啦！
20,七宗罪,5,9/10。重温，实至名归，抛开那些故弄玄虚的宗教元素和直挑感官的血腥残虐，性格悬殊的临时搭当追查变态连环杀手的套路也早己不新鲜，但杀手身后背负的道义信条令人不寒而栗。剪辑流畅、布光强烈、铺垫扎实、气氛隐忧，最后布局揭晓等一干芬奇式解密精致耐看且合情合理，无论手法还是立意都经得起回味。
21,七宗罪,4,警察抓小偷 老鼠玩死猫
22,七宗罪,4,人最大的敌人，是自己。
23,七宗罪,4,探案的经典，但是不知道是因为之前是在被剧透的太严重了，还是看了一水的犯罪心理神探夏洛克基本演绎法行尸走肉然后眼睛被惯坏了，口味愈发刁钻了，看的直犯困，但为了凑齐七宗罪好召唤神龙还是勉强忍下了……
24,七宗罪,4,影片中的片段 发生的事 生活中真的可能都发生 他只不过没有电影里那么刺激 人性永远不可能是纯白的
25,七宗罪,4,「暴食」、「贪婪」、「懒惰」、「嫉妒」、「骄傲」、[淫欲]、「愤怒」，这是天主教教义所指的人性七宗罪。【可恶的结局
26,七宗罪,5,虽然有点害怕，但是很喜欢这种烧脑的电影。
27,七宗罪,5,好看好看好看。老头儿和皮特都无可挑剔。画面和故事也不错。但是我其实很想给4.5星。私以为最后杀Tracy关于嫉妒一罪略显牵强（虽然前面几宗也有一些John故意制造罪刑的嫌疑）。不过他终于还是成为自己心目中完美的martyr。虽然开始会某种程度上认同John的做法，但后面会越来越发现，其实他只是想做上帝
28,七宗罪,5,我一直认为，JOHN.DOE是最完美的银幕角色
29,七宗罪,5,一遍修复蓝光，虽然画质非常好，但感觉跟康第描述的不太一样，当然那些复杂的胶片留银工艺确实无法用数字手段完全复原，但为什么色调也略不同呢，那些被描述为orange的地方，就并没有橘，只是有点昏黄而已。康第说一些发行拷贝上做了bleach-bypass，他最推崇法国版拷贝，不知道还有没有机会放映这版本
30,七宗罪,4,有人想当上帝。宗教色彩太浓，气氛压抑。
31,七宗罪,5,因为喜欢布莱德.彼特，又特别钟情于恐怖片而看了这部电影，在当时看完可以说是挺震撼的，故事情节很紧凑，恐怖气氛也营造得相当好，最后杀男主妻子，逼男主枪杀自己可以说是全剧的高潮了，给我感觉就是宗教的力量有时候也很邪恶，让坏人有了做坏事的借口。
32,七宗罪,4,"不错，给四颗星的原因是结局我已经猜到了。大爱皮特和史派西！Hemingway once wrote, ""The world's a fine place and worth fighting for."" I agree with the second part."
33,七宗罪,5,【A－】此片绝对是一大堆悬疑电影中教科书般的存在：阴暗的纽约充斥着雨水，混合着罪恶的气息，配以宗教与人性的思考，却被大卫・芬奇用以他特有的冰冷克制的手段给巧妙的包装了起来，造就这一神片的诞生。纵使你知道结局的走向，也还是会被它给触动到，这大概就是经典的力量吧。
34,七宗罪,4,当费劲周折的铺垫即将筑成一座高境界之塔时，芬奇却抛出了令人费解的结局。作为一个普通人，说我看不懂他表达什么，似乎又像在反讽自己是傻瓜。若通篇下来就是在呈现社会的晦暗，抑或是关于疯与不疯好与不好的概念见解，何苦要那么多故弄玄虚的台词。
35,七宗罪,4,摩根弗里曼饰演的的老威廉，经验丰富，睿智理性，学识广博，理解宗教，熟读莎翁，作息规律，爱喝红酒。最可怕的，还很风趣幽默！第一次应邀赴宴，就把女主人崔西逗得忍俊不禁。幽默就幽默呗，为毛用“可怕”来形容？因为稍早闲聊中，崔西回顾小夫妻的情感史时曾说，丈夫是她初恋，他是她见过的最有幽默感的人。面对这样的评价，看过影片的观众都该与老威廉第一反应似的，“真的？”相反，老威廉首次见面便从生活烦恼之中提炼出让女主人十分受用的应景笑话。两相对照，高下立判。这种发生于两位搭档间的性格对比贯穿影片始终涉及方方面面。或专业素质，或生活态度，或修养品味，优势毫无例外的站在老头的一边。甚至枪战追凶这一全片最利于展示拳怕少壮年轻是宝的桥段，芬奇也不愿让步，仍将奋勇当先穷追不舍突然衰变为经验缺乏而被凶手偷袭得手用枪指头！
36,七宗罪,5,暴食、贪婪、懒惰、嫉妒、骄傲、淫欲、愤怒这天主教义七罪，在大卫・芬奇的《七宗罪》里觉非是灌输宗教思想的宣讲，电影借以一名疯狂变态者对触犯教义人的惩戒，警探层层侦破抽丝剥茧之下，其不仅是揭露着世间阴暗，更是对本我的深思。
37,七宗罪,4,真的不该在一个不对的时间观看这样一部质量不错的电影。唉！―― 继昨儿回味《玛丽和马克思》对影片大为改观后，今天《七宗罪》上映20周年纪念日特地重温也导致我对其好感度极大增加，由此说明观影的时间、环境和精神状态等挺重要的！-15.09.22 ―― 米尔斯愤怒开枪前有个一闪而过的翠茜脸部特写镜头！
38,七宗罪,5,人生最崇拜的一句话：这个世界值得我们为之奋斗。。。
39,七宗罪,4,重看，有时想想有信仰的人是幸福，他们有所怕。
40,七宗罪,4,“傲慢、嫉妒、暴怒、懒惰、贪婪、暴食与色欲七宗罪我们都有，只不过，傲慢变成了尊严、嫉妒变成了讽刺、暴怒变成了性格、懒惰变成了悠闲、贪婪变成了进取、暴食变成了美食，而色欲，自然是人人喜爱的性感。罪从来都是非罪。七罪在身，我们反而觉得七罪傍身。”影片不足在于过多悬疑而没有深入探讨罪。
41,七宗罪,5,震撼！功力和锐气并重的作品。
42,七宗罪,5,给之后所有此类电影制订了工业标准和审美方向，再加上芬奇后来也一直照着自己在这里发明的工作方法继续延伸，现在看，片中内容全都见怪不怪了。重刷的新感受：低照明让那几场罪案现场戏，比后来任何“罪案现场类影片”都惊悚；摩根弗里曼在图书馆查资料那场戏的传统气质，只因为少了那么一点点务实精神，芬奇后来再拍片就把它弃用了；霍华德・肖的配乐是片中最强大的环节；米尔斯探员是布拉德皮特生涯至今接过的难度最大的角色，不怪他演得让人总觉得离“精准诠释”还差一点，而是这个角色写得太概念化了，不仅是凶手实现计划的工具，也是编导实现电影的工具。重刷最赞叹的地方是，无论声画剪辑这些实现层面多么顶尖，它们在片中终归都是为了服务于情节，一部故事经典到让人完全忽视技术之精湛的技术流电影。主张用文学对抗黑暗，芬奇的雄心勃勃不服不行
43,七宗罪,4,若上帝没法救赎你，那就去叩响地狱的大门吧。
44,七宗罪,5,somerset才是幕后大BOSS吧
45,七宗罪,5,"一部继承了经典黑色电影氛围的电影,一部让布拉德・皮特,凯文・史派西和摩根・弗里曼三代戏骨同台竞技的电影,一部大卫・芬奇写给绝望的现代史诗,还有什么比这样一部电影更酷呢?"
46,七宗罪,5,无论看多少遍都不觉得腻，Morgan、Brad、Kevin三个人的演技都在本片中发挥到了极致。配图评论：http://blog.sina.com.cn/s/blog_602f80db0100dvcc.html~type=v5_one&label=rela_prevarticle
47,七宗罪,5,每一宗罪都是一次救赎。
48,七宗罪,4,现在想来，大卫芬奇还是年轻了。如果Somerset最后就什么话也不说，那才是坠吼的。
49,七宗罪,4,"Only in a world this shitty, could you even try to say these were innocent people and keep a straightface. We see a deadly sin on every stre"
50,七宗罪,5,"很少一个电影看两次,超好看.这个几乎没有多余的情节,很紧凑.记得以前在7SINS里头的名字是饕餮,和陌猪一块儿"
51,七宗罪,5,第一次是在学校周围的网吧看到的，情节很吸引人~而且把本人最感兴趣的犯罪和宗教联系到了一起~讨论人性，和《电锯惊魂》感觉上其实可以归到一类上去~
52,七宗罪,4,片尾制作名单是从上往下走的，蛮有趣，格温妮丝，皮特，都是闹不少绯闻的人，现在也各得其所，找到搭对的伴侣，都值得祝福。
53,七宗罪,4,「暴食」、「贪婪」、「懒惰」、「嫉妒」、「骄傲」、[淫欲]、「愤怒」
54,七宗罪,4,并不感冒这样的类型，但不可否认影片本身不错，尤其是Kevin Spacey最后的添彩。
55,七宗罪,5,★★★★★ 我不信宗教，所以对电影内涵不是很感冒。初中时曾租碟看过，那时觉得不错，结局震憾。年前重温，感觉已不一样，虽已知道结局，但电影依然看得非常爽，因为我早已为大卫芬奇的电影风格着谜。
56,七宗罪,4,哎呦喂～吓死宝宝了
57,七宗罪,4,the world is a fine place，and worth fighting for
58,七宗罪,5,"摩根61弗里曼在图书馆查阅书籍时配乐是巴赫的作品《G弦上的咏叹调》

天主教明言七宗罪：「饕餮」、「贪婪」、「懒惰」、「嫉妒」、「骄傲」、「愤怒」。"
59,七宗罪,5,非常精巧的故事，非常迷人，即便已经过去了这么多年，看着仍然会不寒而栗，仍然会为故事的每一步进展而击节！
60,七宗罪,5,那一年我才八岁，小学二年级，他们讨论的绝望与惩戒至今都是个迷，这是个好地方，我却仍希望可以为它奋斗终身，当然，只是希望~~PS：凭95年产，都有五星~~
61,七宗罪,5,"悍客.罗 推荐Se7en的评论：.......FREEDOM
自己仍然很清楚记得第一次看《七宗罪》时的情形。当字幕出现，影片落幕的时候，自己做...
最后一幕，老弗里曼重复着海明威的名言“世界是一个好地方，值得为它而奋斗”。“我同意后半句”，弗里曼又加上了自己的评价。日后，重看此"
62,七宗罪,4,「暴食」、「贪婪」、「懒惰」、「嫉妒」、「骄傲」、[淫欲]、「愤怒」，这是天主教教义所指的人性七宗罪。如果杀戮可以拯救罪恶，上帝便无需创造生命。当凯文・史派西惊艳登场的时候，他如同就是上帝之子。
63,七宗罪,5,观影体验让我想起了看《未来水世界》，只是这个城市永远下雨，但是故事精彩，那个永远在水上，故事却是一滩狗屎。
64,七宗罪,5,悬疑片中的经典里程碑式作品。宗教的由头，人性的弱点。也许现在看来悬疑设置已经不那么新奇，但影片的整体节奏掌控及深沉的思想在今天看来依然是难得的佳作。
65,七宗罪,5,"Earnest Hemingway once wrote, ""The world is a fine place and worth fighting for."" I agreed with the second part."
66,七宗罪,5,与常规电影语言分道扬镳的大卫芬奇用黑色阴郁的色调给我们描述了一个阴雨连天肮脏堕落的世界，在这个反转的世界里，罪犯演用自己超群的智商实施天衣无缝的连环杀局更以残酷手段向世人施以教化，而一身正气的警察却最终沦陷为犯罪迷局中的案例，如此黑色幽默的反讽却有着促人反思的震撼力量。
67,七宗罪,4,看之前看了一些影评、 得承认这些影评误导了我对电影情节发展的分析及想象……  算是灵魂洗礼之旅，我不贪婪、不嫉妒、不傲慢、不愤怒…不过其他方面要么未知要么确实我也有罪。。。  虽然我算不上胖、但还是先从暴食开始警戒自己
68,七宗罪,5,The world is a fine place，and worth fighting for。I agree with the second part
69,七宗罪,5,"是人的都逃不过，西方老祖宗太会总结了。
2019年4月28日，又重新温故了一遍。
三人的演技都逆天了，特别是皮特，最后那段愤怒、悲伤、惊恐的交错，教科书级别了！"
70,七宗罪,5,大卫・芬奇的这部悬疑惊悚片可谓是新黑色电影的典范，演员阵容可谓无比强大，有当红小生布拉德・皮特，影帝摩根・弗里曼，未来的影帝凯文・史派西和未来的影后格温妮丝・帕特洛。七宗罪「暴食」、「贪婪」、「懒惰」、「嫉妒」、「骄傲」、[淫欲]、「愤怒」，这大概每个人都会有几个吧。
71,七宗罪,5,如果正如天主教教义所述，那么世间人人必然都会犯这七种罪，甚至Jonh只需要杀一个人就能满足他的大愿。人性到底原本是善还是恶呢？
72,七宗罪,5,"fabulousDavid Fincher的《七宗罪》碟子摆在家里了好久都没拿出来看，终于看了。本片虽为好莱坞商业片，但深入下来它的内里并，对宗教对于信仰都有很深的诠释。Gluttouy暴食 Greed 贪婪 Sloth懒惰 Lust淫欲 Pride骄傲 Envy嫉妒 Warth 愤怒 这天主教教义所指的人性七宗罪，看过的人也该反思一下吧

"
73,七宗罪,4,除了剧情主角完胜~Morgan Freeman太酷~还有帅到掉渣的BP和史派西大叔~连格温妮丝都那么好看~\(RQ)/~
74,七宗罪,5,最后的嫉妒和愤怒完成时，人类不得不低下头承服于最深处的欲望。“这个世界很美好，我愿意为之奋斗。这句话我只同意前一半。”剪辑特色自不用说，哲理深刻摄人。
75,七宗罪,5,欣赏编剧的才华，Brad的演技其实也就这样，只是欣赏脸罢了，Gwyneth的水准也没得到很好的展现。Any way，是部好作品，再次崇拜编剧！！
76,七宗罪,4,it's more comfortable for you to label me insane 其实中途男主赶记者 老头警告他 都可以猜到他是wrath 啧啧 kevin spacey好帅Q-Q
77,七宗罪,4,超厉害，烧脑刺激，结局神反转，很好！
78,七宗罪,5,贪婪 暴食 懒惰 愤怒 骄傲 淫欲 嫉妒 世界是个好地方 值得为他奋斗2009.4.12
79,七宗罪,4,Pride，Envy，Wrath，Sloth，Greed，Gluttony，Lust。Sloth那段看的我心慌慌啊……由于被剧透了所以觉得一般，1995年的犯罪侦破系统真的很落后。
80,七宗罪,4,"""Ernest Hemingway once wrote:""The world is a fine place and worth fighting for."" I agree the second part."" 当年Spacey还年轻，没有现在演反角这么老练~"
81,七宗罪,5,又是宗教电影，一如既往地不感冒。幸好导演很尽职尽责地给我在开头就抖搂明白了，否则绝对影响我欣赏这难得的比赛。结局也是我最爱的，聪明的罪犯赢得胜利，虽然他布的局有点取巧，但我们可爱的人性成就了那个必然。这样的犯罪堪称艺术。
82,七宗罪,5,扑朔迷离，跌宕起伏。无论那个方面来看，都很棒！最后的结局可能有点惨，可是正因为这样才更加的令人深思！这世界是个好地方，值得为其奋斗！我同意后半句！
83,七宗罪,5,大卫・芬奇是个很喜欢在电影中植入宗教的导演，从异形三就可以看出来，七宗罪更是登峰造极了。另：率性给一部公认好片打一星来凸显自己逼格高这种行为本身就很装逼。
84,七宗罪,5,"鬼才的经典。
原罪的可怕。
「暴食」、「贪婪」、「懒惰」、「嫉妒」、「骄傲」、[淫欲]、「愤怒」"
85,七宗罪,5,大卫・芬奇的经典作品！第一次觉得皮特在演戏，应该就是从这部电影开始的吧。。。
86,七宗罪,5,踩着平稳的步伐逐渐攀升，端倪的点滴释放牵引力十足，KS的一席话惊世骇俗
87,七宗罪,5,记得原来我的班主任说，“我不能改变这个世界对学术学问的看法，那我就做一点力所能及的改变”。也许我们看到了太多不喜欢的东西无力改变，想他一样stay far from there，但是，也有人说，能力越大，责任越大，担起那份责任吧。周围的人也请你们不要离开，他们也需要你们心底的支持
88,七宗罪,5,黑色悬疑经典，再无法被超越！天朝之中不可能拍出这么牛的电影~
89,七宗罪,5,"又名: 火线追缉令 / 七宗罪 / Seven

导演: 大卫・芬奇（David Fincher）
主演: 摩根・弗里曼（Morgan Freeman） / 布拉德・皮特（Brad Pitt） / 格温妮丝・帕特洛（Gwyneth Paltrow）

官方网站: http://www.se7enmovie.com/
上映年度: 1995
语言: 英语
imdb链接: tt0114369
制片国家/地区: 美国"
90,七宗罪,5,Fincher万岁！怎么没有人想到要弄个音频相册，这样，凯文・史派西，还有基弗・萨瑟兰的声音就有处可放了！
91,七宗罪,4,"这世界很美好，值得我们去奋斗，我只同意后半句。海明威这这样说的。
我同意整句。"
92,七宗罪,4,"o(s□t)o  很喜欢结尾、虽然悲催
第一宗罪―― 暴食 那个撑死の胖子、让我在看完片子后 一度产生了厌食の情绪 O NO~"
93,七宗罪,5,人性七宗罪..一直都对人性想要有更深的了解与探索..这电影很好地诠释了暴食.贪婪.懒惰.嫉妒.骄傲.淫欲.愤怒的七种常见的人性.生活中人类常犯的错误.只不过.当你把它放大后你就会踏上不归路了.
94,七宗罪,4,以为会很惊悚，结果一般，不过剧情很好看，皮特很帅(2979517929)
95,七宗罪,4,经典在当初
96,七宗罪,5,都是我耐的人，摩根还是那么稳得范儿，再次看到本杰明的组合，真是岁月不饶人啊，整部片子看的人心里很不是滋味，人性中的污点是否可以任意抹去？不论是肥人、妓女、亦或是奸诈之人，即使他们如此不堪，但是否要由某人来结束罪恶？最后的结局其实拍的很真，如果皮特没有开枪，便没了真实，换做谁都会如
97,七宗罪,4,警察抓小偷，老鼠玩死猫
98,七宗罪,5,全都有罪。
99,七宗罪,4,在那个年代，这些演员，如此的剧情之下，这样一部片子已经算出彩了。尤其是结局的安排，印象深刻。
100,七宗罪,5,「暴食」「贪婪」「懒惰」「淫欲」「骄傲」[嫉妒]「愤怒」
101,七宗罪,5,完美的悬疑惊悚，是对我们身处城市环境最深深的忧虑，莫大的讽刺是对现实依然敏感、关心、忧虑并付诸行动的却是一个连环杀手
102,七宗罪,5,世界本就变化莫测，你我他更如是，也许你身边就有个替天行道者，只不过道为何道？道可谓道？难说！94-95年，真是巅峰巨制争前恐后的时间段！
103,七宗罪,4,看完觉得虽然很好 但如果能把汉尼拔医生和这两个超级干探摆一块的话 或许更有张力 希望能有臆想成真的一天^_^。
104,七宗罪,5,"融合宗教成分后,电影本身更加悬疑和紧张了."
105,七宗罪,5,"we see a deadly sin in every corner of city, in every home."
106,七宗罪,4,"human,what should i say about it*后来我已经想不起来我看完这部片子后你对我说过什么了，我只是记得当时面对你的时候那种孤独。i am not your dish,and maybe neither are you."
107,七宗罪,5,"演员都极其优秀啊，最喜欢的那句Once wrote _The world is a fine place! And worth fighting for.
I agree with the second part!
__________
Me too!"
108,七宗罪,4,"好像是个经典的片子？那影评估计多得是，不用我乱说。
我只是觉得，如果我是Mills，最后得知妻子被杀时的反应处理可能会和布拉德・皮特不一样。"
109,七宗罪,5,牛 d 七宗罪   大卫・芬奇 Se7en(1995) BD国英双语中英双字1024高清 Se7en 1995 Remastered Edition 1080p BluRay DTS-ES x264-SilverTorrentHD
110,七宗罪,5,一直觉得剧情有些牵强――但是居然是真实故事改编，果然精神病人的世界无法琢磨啊～
111,七宗罪,5,"宗教、悬疑、惊悚…这之中的经典 
摩根弗里曼 布拉德皮特 凯文帕西诺"
112,七宗罪,5,Brad P就像梁朝伟一样，就是因为本身没什么性格，所以极好雕塑，演什么都能都完全融入角色，在这个片子里，甚至比Morgan更加出色，Morgan更像刘德华，演什么角色都是他自己~~
113,七宗罪,4,宗教上说的七宗罪，也就是饕餮（Gluttony），淫欲（Lust），贪婪（Greed），愤怒（Wrath），嫉妒(Envy)，懒惰(Sloth)，以及傲慢（Pride）。如果没有最后一宗罪的安排（也就是愤怒之罪），那这部电影只能说是一般了，而有了最后这特别的一宗，就让影片的构思新
114,七宗罪,4,老下雨的城市，压抑混乱的城市，在这生活是情境还是性格决定命运？谁在牵动这条生命线？在最初的时候以为凶手在警察之间呢。
115,七宗罪,4,Kevin spacey的表演让我想起了The usual suspects.
116,七宗罪,5,大卫芬奇和凯文史帕西简直是变态二绝，pitt这部片的F word不知道有没有破他以前的记录。。。。the world is a fine place，and worth fighting for。I agree with the second part。很黑色的片。
117,七宗罪,5,"轮回...There's only 1 thing that I know about,David Fincher at his best."
118,七宗罪,5,罪孽，赎罪，洗罪。沉重的字眼。影片中阴暗灰冷的气氛让人有一种时刻想逃离的感觉，孰知就像寂静岭中灰雾爬延的公园中男主角对镜中自己所说的，我们的罪孽都在我们心里，你到哪都带着它们，每个人不停地赎罪，就是为了有一天能不被镜中的自己吓倒自己。
119,七宗罪,5,"greed 贪婪
gluttony 暴食
sloth 懒惰
lust 淫欲
pride 傲慢
envy 妒忌
wrath 暴怒
You want to be a champion，people don't want a champion.
Apathy is a solution"
120,七宗罪,4,"看完真的很沉重。""the world is a fine place，and worth fighting for。I agree with the second part。"""
121,七宗罪,4,有一部类似的电影 忘了 - - 凶手是看透人性了的，他早已知道结局
122,七宗罪,5,几十年过了，这部片子依然经典，不过作为一个不懂宗教的我来说，看的时候还是有点怪怪的，最后的结尾非常好
123,七宗罪,5,阴暗的宗教色彩电影，结尾稍显仓促，但并不影响它发人深省
124,七宗罪,4,海明威曾说过:这个世界很美好，值得为它奋斗。我只同意后半句。
125,七宗罪,5,初中第一次看 十分震撼 后来又重温了几遍 推荐
126,七宗罪,5,"本片出彩的地方正是DAVID杀死JOHN,帮助他完成了对""七宗罪""的惩罚,这是很具有反讽意味的,一个执法者,竟然帮助了罪犯完成犯罪.七宗罪,我们世人谁不曾犯过？"
127,七宗罪,4,没有吓到我就是了，对我来说比较有新意
128,七宗罪,4,一个把自己算计在内的完美计划殉难者、巧妙的利用了沙摩塞的机智老练和冲动无脑的米尔斯完成了自己的夙愿
129,七宗罪,5,剧本赞，暗系灯光赞，布景细节赞，最后的最佳配角华丽转身变成最佳主角
