,movie,star,comment
437,七宗罪,2,无法理解为什么它是经典，实在没觉得哪儿好
438,七宗罪,2,如果没有kevin spacey，这片就毫无意义，布拉德比特的演技相当烂，虽然现在也是。拿个枪的姿势都知道不是警察了。
439,七宗罪,2,过时可能算5错
440,七宗罪,2,这片儿经典在哪儿啊。。。难道还有什么深意？求伪文艺青年解释。
441,七宗罪,2,推进速度太慢，偶尔惊悚一下又归于无聊。故弄玄虚，凶手怎么可能那么多废话？还那么温和？大失望。
442,七宗罪,1,把自己弄的跟耶稣救世一样，不就是个变态吗，宗教的外衣没有意义，和德州电锯杀人狂的弟弟没有区别，一星给布拉德皮特
443,七宗罪,1,为什么我觉得这么烂。
444,七宗罪,2,一部非常过誉的电影，剧情垃圾，想不通是如何被奉为经典的
445,七宗罪,2,一部比较著名的电影，假如你没看过，你会感到遗憾因为你怀疑你似乎错过了什么；当你看了一部比较著名的电影但是没有发现任何值得让它著名的理由，你也会感到遗憾因为你确定你已经错过了什么。
446,七宗罪,2,就没看出来这片子好在哪儿。。。
447,七宗罪,2,"pitt的演技真烂。。。2颗星给freeman
"
448,七宗罪,1,电影表达的是什么？用偏执狂自制的规则杀人？观众看完一致表示认同，你他妈的确实很偏执，确实很变态。这就是这部电影在许多人口中的厉害之处？为什么主角的妻子要死？而且因为妻子被害了而暴怒叫做罪？这他妈算什么罪？不就是凑？有本事就一本正经圆上你变态的道理。影评一个个令人作呕。
449,七宗罪,2,挺无聊的。
450,七宗罪,2,七宗罪 这罪的定义是否准确 杀人者以这七宗罪的标准来审判别人 可扪心自问这是罪吗  只是人的负面特性罢了 总感觉价值观有问题 另外作为一部悬疑电影 里面好多场景都是不必要的 与主线没有联系
451,七宗罪,2,七宗罪算得上是“罪”吗？与《但丁俱乐部》一样走形而上路线，对于凶手的心路历程以及刻画甚至不如《但丁俱乐部》丰满严谨。感谢陪我看这片的你。
452,七宗罪,2,给这么低分不是因为不好看，而是因为在我满心期待结局会有多刺激精彩多意料之外的时候，你给了我黑屏谢幕。
453,七宗罪,2,如果看到亲人朋友被人杀害而愤怒复仇是罪，看到亲人朋友被杀不愤怒不是更大的罪？投机取巧地玩弄价值游戏 用逻辑游戏和镜头掩盖创作的匮乏，直接将5星送回2星，只当是世纪末末世价值坍塌的一个写照而已
454,七宗罪,2,作为大卫芬奇一生黑，这片子相比还算可以了。
455,七宗罪,1,又素闷片一部，我在五号线上都要睡着了
456,七宗罪,2,剧情一般 结局没什么惊喜.. 又是一部我不喜欢的却广受好评的电影.. 我只看见了Brad Pitt...
457,七宗罪,2,七宗罪。
458,七宗罪,2,“刻意”，配乐很刻意（图书馆里那段G弦上的咏叹调），氛围营造很刻意（下不停的雨、崔西和萨默瑟的对话等）。看热门前二的短评，笑了，你喜欢不等于别人也必须喜欢，不喜欢一部电影给低分有问题？还什么“眼烂”“装逼姿态”，不能苟同。希望电影爱好者们，尊重他人所有由心而发的观后感，无论好坏。
459,七宗罪,2,电影里一直提但丁 但是整个电影跟神曲除了七宗罪以外还有什么关系么？但爷爷说要饿死那个胖子啊 要烧死那个妓女啊 杀手做到了吗 Brad年轻的确挺好看的 可是也只有好看而已
460,七宗罪,2,一个大帅哥和一部垃圾。
461,七宗罪,2,都说是经典，但看完以后觉得非常无聊。
462,七宗罪,1,除了结尾有点惊悚，其他不过尔尔，喜欢玩弄程式化，理论先行，有点像马克思理论指导下的苏俄，中国的狗屁作品
463,七宗罪,1,那胖子死得太恶心了
464,七宗罪,2,。。。。其实我根本没看完过因为我怕
465,七宗罪,2,"罪犯自首时就猜测到了皮特老婆遇害，我还以为是因为堕胎。
道德这东西，在不同时代、不同地区完全不同，大多数道德和清规戒律都是经不起推敲的。不要以道德去要求别人，绝对不能触犯的是法律，只有法律才有权力审判和处罚。
美国电影也翻来覆去就那几个人演吗？
现实中的纽约是不是真的这么破烂、冷漠。"
466,七宗罪,1,"被众人抬得太高的所谓“经典”的影片
   完全复制但丁《神曲》   想把悬疑与艺术完美结合   却弄巧成拙"
467,七宗罪,2,精巧的结局掩饰不了全片的无味
468,七宗罪,2,终于看了，果然不是很好看，看来只能说导演不是我的茶了，那个所谓的意外结局不用想都猜得到啊……
469,七宗罪,2,还好，还好，对此类犯罪电影不是很感冒。
470,七宗罪,2,说实话我是冲着高智商电影榜才看的，觉得名不副实。 但最后结局凶手说他当天早去的大卫家，但自首以后应该被拘才对怎么可能随便一个人就走出警局了？ （从前面交待的看他不可能在自首前去大卫家， 而且从黑人的反应看应该没有撒谎！ 
471,七宗罪,2,毫无惊喜...   一开始刻画威廉的妻子的时候我就觉得，这个角色是不是有点多余，结果最后的时候很自然地猜到妻子肯定是一个死者...确是影片中最无辜的死者...这样的设置是不是很失败~~
472,七宗罪,2,实在太难看了 原本就是冲着这三个演员去看的 几次都看的想睡觉 实在不知道为什么叫经典 可能这部片离今天太远了 又看过太多这类型的悬疑片 所以所谓最后的什么意外结局不觉得惊艳
473,七宗罪,2,在结局没揭晓之前，一切GOOD。但当“冲动”向“嫉妒”开枪的那一刻，我绝望了，烂死了。
474,七宗罪,2,你们把我的期望抬得太高了....所以我很是失望..
475,七宗罪,2,看完没有任何感觉。。。是潜意识里排斥宗教因素和BP的主演。。。？
476,七宗罪,2,fuckin' boring ending
477,七宗罪,2,缓慢而缓慢Zzzzz...
478,七宗罪,2,................
479,七宗罪,2,不是我喜欢的电影类型，来看Kevin大叔演杀人犯。电影看到一片肮脏灰暗的主观的世界，而我窗外还是阳光下的大好日子，我们可以不选择灰暗面的不是么。
480,七宗罪,1,史派西果然适合演变态。。 一星是用来拉平均分的，这片子真的不咋地
481,七宗罪,1,"我终于看完了我这辈子里第二部坏人得逞的电影，走啦，我现在要去上英语课了。88

因为翠西死了所以我要给你差评，变态的大卫芬奇"
482,七宗罪,1,感觉自己好装逼呀妈呀
483,七宗罪,1,本来是两分分，看到那么多脑残打了五分，所以拉减去一分。整部电影逻辑有硬伤，其次才是价值观有问题。逻辑是凶手没有直接杀人，却取了警察妻子的性命，警察的愤怒属于合理愤怒，却被定有罪，真是双标。价值观的话，尼玛我是唯物主义者，居然跟我讲宗教的七宗罪，关键也不是普世的观念，都是一些极端的行为，导演只是用他的价值观强奸观众，感觉特别恶心。
484,七宗罪,2,对，伪文艺的烂片子，很多人捧臭脚的。自己都看不明白还得给个五星！！！
485,七宗罪,2,如果不看大家给他如此好的评价，还能给还行的分数，现在，实在是太失望了。
486,七宗罪,2,动画效果挺好看的
487,七宗罪,1,七宗罪之第X宗：第X个故事很无聊。
488,七宗罪,2,这么烂的题材 居然高分
489,七宗罪,2,就悬疑电影来说，就这样。
490,七宗罪,2,差强人意的剧情，糟糕透顶的怪异气氛，蛮惨的片子。
491,七宗罪,2,this movie should be called guess where kevin spacey is...
492,七宗罪,2,传说很好看 今天看了 很一般 差点睡着
493,七宗罪,2,故作深刻的肤浅
494,七宗罪,2,看到一半实在不能忍了，估计以后也没心情补全了
495,七宗罪,2,编剧很想扯出点花头，但是片子太乏味，无论色调还是音乐还是台词。。。扯淡。
496,七宗罪,2,没传说中的好看
497,七宗罪,2,不喜欢一味的血腥，流于形式的各种死状，牵强附会的宗教外套其实并不合身。缺少对心理的刻画，剧情转折也并不精彩。算不上佳作。
498,七宗罪,2,确实没啥意思吧~~~评价那么高。
499,七宗罪,2,记不清了，是否需要重温一下呢 当时不太喜欢 可能太多年前还参不透吧 
500,七宗罪,2,结局真的很傻!!!
501,七宗罪,2,宗教，变态都是我讨厌的题材，哪里好看了?
502,七宗罪,2,一部阴沉的电影，现在想起来仍是心有余悸。甚至连结尾都看不到阳光。如果大卫只是想要揭露现实的阴暗面，那么可能估计很大程度上，it's not my cup of tea.
503,七宗罪,2,为什么那么多人都说好且奉为经典？我只觉得无聊。结尾也并不多出人意料，整个像是一个冗长的纪录片一样。布拉德皮特长了一张过目就忘的脸，之后看搏击俱乐部我也没认出他来。不过好在现在（也许）是记住了？
504,七宗罪,2,喜欢那个诡异又exciting的片头，人性啊...啧啧
505,七宗罪,2,我不喜欢那么血腥的东西。
506,七宗罪,1,"本来是要给四星的,从各种技术上讲.但是只给最差的,因为它阴暗到毁灭了这个人类世界的精神世界.远比邪教来得彻底地毁灭.宗教不等于信仰,远低于信仰.这七宗罪是某个教派定下的,凭什么以此为准则,去惩罚那些原本就不信教或者信别的教的人?"
507,七宗罪,2,是我不喜欢的恶心。
508,七宗罪,2,约翰的角色不丰富
509,七宗罪,1,这是上帝赐给人类的天赋本能，也是使人类繁荣的条件。就如《蜜蜂的寓言》所描述的，私欲的“恶之花”结出的将是公共利益的善果。
510,七宗罪,1,真TM变态！这种片子… 实在反感！ 呈现恶的想象力的罪恶艺术？！ 非常抵制这种价值观！
511,七宗罪,1,紧张了两个小时各种变态，最后看到的不是罪犯绳之以法的痛快，而是罪犯把警察怀孕的妻子杀死了，把人头寄到警察面前，警察一怒之下把他毙了！我擦，要是我我也会一枪干掉他的好吧，就为了凑齐最后的嫉妒和愤怒，导演你至于么，如果说导演你想表达什么深刻的含义，除了导演自己阴暗的心理我啥都没看出来
512,七宗罪,2,-_-||  啥玩意儿
513,七宗罪,2,故事情节拖沓，流水账的叙述谋杀犯7宗罪的人，没什么亮点的烂片。真不知道伪文青们为什么追捧得这么高分。
514,七宗罪,2,有点造作...
515,七宗罪,2,看不下去的七宗罪
516,七宗罪,2,"我就不觉得这个电影有什么厉害之处,不就是""杀人杀出幽默感""么,还非要给它弄上各种高尚名唐,也是大卫芬奇的电影?比搏击俱乐部差远了"
517,七宗罪,1,“不要夸大恶的深度和美感，不要把它提高到它配不上的位置。”
518,七宗罪,2,我不喜欢。没意思。神叨叨的。
519,七宗罪,2,我看了2遍 第一遍给3星  第二遍给1星 中和下给了2星
520,七宗罪,1,这种说教电影想拍出来总是有很多硬伤，毕竟生活没有道理可言。硬伤之一：皮特的老婆到底犯了什么错，难道她不是无辜的吗？难道那个神经病可以杀无辜的人吗？
521,七宗罪,1,又是一打着深度的幌子的娱乐烂片
522,七宗罪,1,看的国配，观感很差
523,七宗罪,1,我最讨厌故意凑齐线索的片子 
524,七宗罪,2,过于压抑过于沉闷，对人性最大的反问与冲击只在最后又所体会。不过结局还是很出乎意料，发人深省的。
525,七宗罪,2,这尼玛的好看吗  恶心死我了
526,七宗罪,2,看过，既不悬疑也不是吸引人。虽然平庸，但是可观。但绝非经典。如果不进TOP榜，3分则可。
527,七宗罪,2,值3颗星的电影。不过鉴于被捧上天了，豆瓣分数又这么虚高，只想给1颗星，不过又鉴于摩根弗里曼，2颗星。
528,七宗罪,2,心里一直有个疑问：在当今这个时代，在看过了这么多类似的作品之后，该片的剧情和表现都已不新鲜，那我能不能够给这部片子打个低分呢？
529,七宗罪,2,很一般，哪好？
530,七宗罪,2,看完闪灵后看这个无压力！不过结尾有点意思！
531,七宗罪,1,垃圾
532,七宗罪,2,无趣到睡着的电影 一直期待最后的几分钟有个反转 自命不凡的傻缺凶手 我相信他是真有神经病的 愤怒调节障碍的警探 非常顺利的探案 各种说不过去的情节 杀人手法让我想起了电锯惊魂 不过还没有saw一半好看 8.7分？我觉得我受骗了 大卫芬奇的电影让我呕吐 两个小时的人生 让我睡一觉
533,七宗罪,2,看了2次才来评价   可能是个人的观影领悟能力一般  感觉这部电影真没大家说的怎么好   但结尾部分好不错   尤其是  凯文・史派西  出现后的部分是电影的精彩部分  其他时间感觉比较LOW   2分送给  凯文・史派西
534,七宗罪,1,故意整人的电影
535,七宗罪,2,其实就是一部被高估的电影。。剧本渣的一地，全靠主角来撑。还有很多观众为它圆。就是一部个人风格很浓厚的电影，论推理同类影片中它不是最出色的，论剧情其实仔细回想除了惊悚没别的意义，论人设其实漏洞很多。。。后面半个小时都是为了满足导演的扯淡自嗨，只有最后皮特的挣扎是亮点
536,七宗罪,2,看了一会居然睡着了，拖沓缓慢，看不下去
537,七宗罪,2,我觉得不咋地咧。。。。。。
538,七宗罪,2,真的不懂为什么打这么高的分，看了半个小时就猜到结局 了
539,七宗罪,2,视觉效果很好...没有什么了
540,七宗罪,1,很没意思 无犯罪美感，例子也牵强
541,七宗罪,2,当时看的很迷茫
542,七宗罪,2,很一般的电影，不管是悬疑、人性还是内涵方面都不怎么样。反派太开挂，一个人做了这么多案件不露痕迹。故事也根本没有深入，只是展示了几场案件，也没内涵可言，结局也挺老套的。
543,七宗罪,2,“海明威说：‘这个世界是美好的，他值得我们为之奋斗。’我同意后半句。”4.5||17.2.27：什么傻逼玩意儿
544,七宗罪,2,犯人以为自己是谁，可以行使上帝的判决？
545,七宗罪,2,始终不能理解外国电影里面罪犯为什么就这么这么容易逍遥法外，呵呵，凯文史派西，也没有起到传教的作用吧，就是个书读多了  自命不凡的神经病。人性七宗罪，但凡是个正常人都避免不了，居然是天主教教义，从此心里把它想为圣母教。
546,七宗罪,2,P文64史西樯冻Ｑ葸@N前半部故弄玄、後半部伏PM的B片？
547,七宗罪,2,我真不知道那些说喜欢结局的人是怎么想的，难道你的妻子和还没出生的孩子被无辜的杀害还不能愤怒了？这也有罪？呵呵，影片和我的观念格格不入，结尾也给人一种意犹未尽的感觉。不过影片中罪犯传道的方式虽然我不能接受但是确实让我震撼，凭这点多给一分。
548,七宗罪,1,欺世盗名，华而不实。
549,七宗罪,2,听说是经典啊，看完挺失望的，七宗罪说出来后就猜到结尾了，片子太长，应该紧凑些。
550,七宗罪,2,七宗罪本身是一个不错的切入，但三流的侦破技术和那个罪犯的幼稚的作案动机让人汗颜。最后米尔斯妻子的死更是让原本有那么一点点的升华彻底沦为一部疯子杀人再杀人的惊悚闹剧，七宗罪的内涵只剩下死亡惨景的视觉冲击和仿佛在教未成年儿童不要做坏事的肤浅噱头。
551,七宗罪,1,暴食、贪婪、懒惰、嫉妒、骄傲、淫欲、愤怒这天主教义七罪，在大卫・芬奇的《七宗罪》里觉非是灌输宗教思想的宣讲，电影借以一名疯狂变态者对触犯教义人的惩戒，警探层层侦破抽丝剥茧之下，其不仅是揭露着世间阴暗，更是对本我的深思。
552,七宗罪,1,基本没看懂
553,七宗罪,2,又一部被夸大其词的片子。其中的宗教劝诱作用和不如《EVA》和《电锯惊魂》来得有说服力。
554,七宗罪,2,看的不舒服
555,七宗罪,2,绅士变恶棍，烂尾啊~
556,七宗罪,2,见识过一流的罪犯，这个级别的的确看不上眼。只能怪看得晚了。
557,七宗罪,1,艹 垃圾 和SAW就没有可比性 别浪费时间看这破片.
558,七宗罪,2,第一次看的时候是08年高考结束，第二次是17年独自在巴黎，两次都睡着了。不过Brad Pitt那时候真是帅得让人挪不开眼合不拢腿
559,七宗罪,2,如果我说这对于我是部烂片。会不会有人扔臭鸡蛋。。。
560,七宗罪,2,其实不太能理解给此片叫好的人的思路，整部电影一直在尝试渲染一种黑暗肮脏的气氛，简单来说就是故弄玄虚，结尾有惊喜？根本没有好嘛，当意识到最后还剩“嫉妒”和“暴怒”之后很容易就猜到了好嘛！说白了这个电影就是一个疯子杀人狂在那自怨自艾，立意很好，可惜拍的一塌糊涂
561,七宗罪,1,很一般很一般的电影，而且是我最讨厌的反派，自以为是的sb，比狙击电话亭里那个还sb，装你妈逼啊，一星给我老公皮特= =
562,七宗罪,2,太好猜了……
563,七宗罪,2,看了几次才下定决心看完  = =
564,七宗罪,2,看了没留下印象的电影绝对不是高分
565,七宗罪,2,没看出什么内容，普通惊悚片而已，而且内容雷同的遍地开花，可能本人还没到那种境界去看懂。他妈的看不懂就是好片！想必各位也如此
566,七宗罪,2,我没发现好看在哪儿，结尾吗？感觉很突兀
567,七宗罪,2,感觉整部影片都不着调
568,七宗罪,2,从来就没法很好的投入这种欧美的带有浓厚宗教色彩的犯罪电影，因为没有了解过基督的内容也就没法很好理解其中的意义，单从电影来说，皮特跟弗里曼的阵容就已经足矣
569,七宗罪,2,这个连环杀手杀的这些人到底因为什么被杀一点都不清晰，所有的东西都浮于表面，内在一点都不充实，尤其最后威廉对直升飞机说无论发生什么都不要过来太浮夸了，那些过度解读的我也不想说啥。
570,七宗罪,2,闷死了
571,七宗罪,2,杀戮不是罪，只要你有道理
572,七宗罪,2,真的不喜欢，结局意外个屁啊，反正我早就猜到了，不就是鬼扯宗教么，凭毛所有扯宗教的电影分数都那么高啊摔！！
573,七宗罪,1,bad ending. more than 7 people were killed.i don't like it.
574,七宗罪,2,一般吧、、、
575,七宗罪,1,"坚持看完了这部所谓的“经典电影”。

黑人大叔更像男主的感觉，男主感觉很不靠谱。一点都不觉得精彩，看一半就很想弃掉。

整部剧就感觉故弄玄虚，总之有点讨厌的类型，结局也能够猜到。过誉的电影。"
576,七宗罪,2,这是一部事先剧透再看就无聊的一部电影……于是我不小心剧透了……忍耐着看到了结尾，然后为我浪费的时间惋惜……
577,七宗罪,2,哪里好看了？？？？！！！！！边斗地主边看完了、
578,七宗罪,2,大卫芬奇用一个半小时多讲了一个楔子，用几分钟填写了故事。当他杀了妒忌，他便成了愤怒，也完成了七宗罪。点睛之笔“这个世界很美好，值得我们去奋斗。我同意后半句”。
579,七宗罪,2,节奏实在是太慢了 我都睡着好几次了 失望啊~
580,七宗罪,1,我始终认为这是垃圾片
581,七宗罪,2,故事boring，追逐戏拍的太差了，画面欣赏不到，布拉德皮特帅气十足，史派西so creepy
582,七宗罪,2,以悬疑惊悚为噱头，一般的剧情。
583,七宗罪,1,我不知道该片是来“反宗教”的还是来“宣传宗教”的，反正作为一个无信仰人士我看了之后对宗教全无好感，得有多脑残才能把这些正常的人性定义成“罪”，和我们那套“存天理灭人欲”有异曲同工之妙，恶心。
584,七宗罪,1,徒有虚名，一遍看完真不知道亮点在哪里。把七宗罪罗列出来很好玩吗，警察家人被杀很意料之外吗？
585,七宗罪,2,心理层面的探索
586,七宗罪,2,其实最后弗里曼开枪打死史派西就能破解这个僵局了，而编剧们也明白这一点，于是早早让弗里曼把枪扔了――所以七宗罪实际上也不成立，于是乎在大卫芬奇创造的“哥谭市”里，这样一番杀人行为也失去了它被讨论的意义，更别提对真实世界有任何反思的价值了。两个主人公占去太多戏份，但实际戏里戏外起到的作用都非常有限，侦破的关键还是FBI大显神通，两人的情感也没有很好的落实。不过大卫芬奇的电影确实体现了好莱坞在1990年之后的短暂进步。
587,七宗罪,2,这么高的评分真不知道怎么来的？wtf?一个精神病借着上帝名义惩罚犯了天主教七原罪的人！贪婪，暴食，懒惰，淫乱，暴怒，骄傲，嫉妒。人人都有，只是程度不同，有的人懂得控制而已。虽然结局wtf但是多半能猜到警察死了。因为暴怒体现的淋漓精致。
588,七宗罪,2,布拉德皮特很帅，其他没什么好看。
589,七宗罪,2,曾有个贱人一路剧透到底，等真正看的时候完全索然无味……请问那些个打四星五星的主儿，剥去讨巧的结局，你们真就重口味到喜欢看活死人？
590,七宗罪,2,当初感觉一般
591,七宗罪,2,七个词汇的牵强堆砌
592,七宗罪,1,好电影最重要是要好看，有哲学有什么了不起，拍什么电影啊，不如去大学教书。
593,七宗罪,1,其实我还以为凶手是这两个警察其中一个，另外胖子和骄傲女做错了什么？
594,七宗罪,2,“这个导演专门拍些伪文艺青年非常崇拜的烂片”――同意。也可以去掉“伪”。
595,七宗罪,1,我实在不懂这片有什么好看的，浪费两个小时，太无聊
596,七宗罪,2,"或许是对西方思想的不了解
看不到有什么意思"
597,七宗罪,2,1.阴暗的结局让人看了很不舒服；2.强烈的宗教寓意令无宗教信仰的人费解；3.摩根・弗里曼反复强调城市中人的冷漠是为什么？4.大城市里的女性遇到危险时高呼“着火了”比“救命啊”更易引人关注，因为利己本就是人的天性吧。
598,七宗罪,2,看网上评价那么高去看的  真的好无聊  两个多小时 看了半个月  睡着n次 剧情缓慢  坑爹的罪犯尽然自己自首了 算什么  简直耍着玩吗 这副片有什么意义？ 无聊 后面两个也猜到了  无高能 该片90%在下雨 看的人难受  最难受不过下雨天
599,七宗罪,1,额，难道我的口味真的刁钻了？？？没觉得很出众，结局也猜出来了。。。没什么惊喜。。整个片子黑压压的。不太喜欢。
