,movie,star,comment
186,盗梦空间,5,脑洞挺大的电影能拍出这样的逻辑性不得不佩服诺兰 很多人说烧脑 不要害怕 只要仔细看都是能看明白的 还不能区分智商…不过看各种大神们的分析真的是折服 有的说得有理 有的完全是脑洞好么…最后结局 我倾向于现实…
187,盗梦空间,4,博尔赫斯的圆形废墟时间交叉+David Lynch妖夜梦魇，概念先行，视觉补充
188,盗梦空间,5,一场无法盗取的梦
189,盗梦空间,5,所谓独一无二
190,盗梦空间,4,你在等一趟火车 它会把你带去远方 你知道自己想去哪里 但不确定火车开向哪里 但是没关系 这是为什么呢 因为我们会在一起 
191,盗梦空间,4,似醒非醒的人生最蛋疼
192,盗梦空间,5,所以最后他回去了么？我觉得陀螺会停下来的TT好吧理想主义者。我很懊恼没有去电影院看IMAX。。。
193,盗梦空间,4,很强悍  可是有点看不懂主题
194,盗梦空间,5,好看死了~
195,盗梦空间,5,"Smart,Clever,Intelligent,Complicated,Funny and Excited.Two Thumbs Up!"
196,盗梦空间,4,我日。容我用一晚上消化一下，但可以肯定的是，我要看第二遍！还有，谁说最后有彩蛋的！！！坐到就剩我一人了也没有彩蛋！
197,盗梦空间,5,电影的制作是非常好的，但是看完电影都开始怀疑自己了，梦想家，哲学家，艺术家……………………
198,盗梦空间,4,诺兰的电影充斥着浓厚的个人风格，模糊不清的现实界限，有意打乱的叙事方法，黑暗阴郁的影像风格，从一开始的《记忆碎片》到现在的《盗梦空间》，这种特质愈发成熟，臻入化境！
199,盗梦空间,5,梦与现实。
200,盗梦空间,3,就那么一个创意，被大家吹得玄而又玄。片中充斥着毫无意义的枪战。看的过程中惟一的惊喜就是CCTV了。
201,盗梦空间,3,一点也没有悬疑 剧情一般 结尾十分老套 
202,盗梦空间,3,今敏大人啊~~您的点子被电影化，感觉好像科教片……
203,盗梦空间,3,没感觉多好看，你们接着炒吧
204,盗梦空间,3,说了一个小时的废话以后，这片子才真正开始，然后紧接着就是一通没头没脑的乱打，有点儿有意思的东西也都被飞来飞去的汽车撞没了。它其实采用了最保守最罗唆的一种正叙方式，生怕大家看不明白。
205,盗梦空间,3,这故事也忒烂了
206,盗梦空间,3,能让人叫好的谜语一定是比较好猜的那种。只有这样受众才会产生对自己智力的陶醉。就是一个基于真实和虚幻的循环结构设定加点动作片元素而已，没有其他任何东西了。一部没有什么意思的娱乐片。
207,盗梦空间,3,这片子我不打分，这片子把观众的潜意识里面的装B形象勾引出来然后展现的淋漓尽致 
208,盗梦空间,3,HK iSquare。再过个10年的样子，应该就和The Shawshank Redemption一样，变成一部经典的鸡肋片。素质不低，但剪辑太碎，节奏也太仓促，结构的扭转还是掩盖不了一个弱剧本。另外实在对那些视诺兰如神明的文青对怀疑者的五毛式口气感到不解....
209,盗梦空间,3,nolan的片一定要有痴情男死老婆么。。我觉得这片真的一般，部分情节拖沓，nolan的片总是看似很高科技，等琢磨清楚了觉得bug也挺多。小李为什么发育成了这样。
210,盗梦空间,3,梦中梦，分不清现实与梦境，如果心有执念那么梦里梦外更难分辨。
211,盗梦空间,3,创意很棒，就知道这是个大套套小套的故事，和诺兰早期那个短片《Doodlebug》一样。抛开创意，其实本质很简单，就是《Doodlebug》的2010升级版，加入了《骗中骗》《穆赫兰道》《禁闭岛》等修改补丁。不过如果是“老婆回到真实世界，小李自始至终还在梦中？”的话我就喜欢这片子了
212,盗梦空间,3,Norlan废了
213,盗梦空间,3,立片基础是sci-fi梦的控制，所以如果要是认真的逻辑探讨你就输了。高射炮打蚊子的剧情设计，故弄玄虚的各条线，强大的CG，神来一笔的配乐，众多让人一见倾心的大配小配。最后40分钟拖沓无比，全片需要全神贯注。btw男主你还要继续减肥，卡在小巷内一段我差点不厚道的笑噎过去
214,盗梦空间,3,看到最后感觉自己都出现幻觉了
215,盗梦空间,3,诺兰变魔术上瘾了哇，用梦包了蹩脚的好莱坞杂碎糊弄观众，又是苦男死女执念的爱情戏 罗嗦的东西太多可以砍掉一个小时 重点放在小萝莉身上就好了 ，最关键的这片子有邪教向现实虚幻鼓励自杀。。。我就做过梦中梦 我在梦里梦见我的梦醒了 
216,盗梦空间,3,看不懂
217,盗梦空间,3,跟莉莉在南京看的，很好懂啊，有什么可分析的
218,盗梦空间,3,讲真看不太懂，没法给高评分
219,盗梦空间,3,豆瓣上评分那么高的片子，分几次看完还看得如此索然无味。。。。。。
220,盗梦空间,3,感觉很神幻，真的挺好的，让人很容易入情
221,盗梦空间,3,对这种玩弄技巧，过于匠心的片子向来不感冒啊。虽然情节编织的够复杂，但那种引发纯粹冲动的悬念感又有多少？况且，偌兰极力在每一层梦空间里营造的大片感觉，在每一层里打打杀杀，不过是看上去增添了惯常的大片气氛。此片未能让我目瞪口呆，就如同《阿凡达》与《哈利波特》，看上去够华丽而已。
222,盗梦空间,3,庄周梦蝶而已，之上只有好莱坞，不如期望。说来Nolan不知道是不是中国哲学的爱好者，他的精湛短片doodlebug虽然只有三分钟，但比这片子的哲理丰富多了。
223,盗梦空间,3,"算是有半部好片 ~ ! 前半部的入 , 分析 , 再入舻榷韫密集得硖理得亦算流 . 但後半部t好像除了要仉影的主旨之N , 要照科幻幼髌迷的囗味 , 因而@得有c力有不棣 ~ !但整w其已是Nolanr最好的荷里活大u作 ~ ! ★★★半 ~ ! "
224,盗梦空间,3,很难懂，得慢慢看。剧情有点拖沓……
225,盗梦空间,3,看得累死我了。
226,盗梦空间,3,平庸之作
227,盗梦空间,3,或许是剧情太好，我记得当年在电影院看睡着了？所以……
228,盗梦空间,3,我觉得很普通啊。不就是开放式结局嘛，新鲜在何处？诺兰的《盗梦空间》和《黑暗骑士》都没让我感到一丝震撼。
229,盗梦空间,3,依旧对诺兰不感冒，没有什么新鲜的，关键是没有观点，爱情重要？梦境重要？真实重要？看不到清晰的观点，结果便不那么重要，于是到底是真是假也失去了意义。
230,盗梦空间,3,不是我的菜
231,盗梦空间,3,不甚喜欢
232,盗梦空间,3,某种原因我只能给三星
233,盗梦空间,3,quite confusing~
234,盗梦空间,3,缺少强大反派，套招用完就完。
235,盗梦空间,3,仁者见仁的电影 可能期望太高 所以看了以后没有那种震撼
236,盗梦空间,3,after all that sick propaganda 
237,盗梦空间,3,我能说我智商不够看这种电影吗？看不懂怪我咯
238,盗梦空间,3,皮皮上已经有了。真没觉得好看。感觉跟Matrix差不多。
239,盗梦空间,3,有意思
240,盗梦空间,3,盗梦，像一根镶着铂金丝的晾衣绳串起的一堆老旧褪色的过季衣服。卖点停留在细薄的概念层级，反复提醒你存在一层层梦的嵌套。等身临其境之后却发现，这些梦境实景远没有预期的神秘奇幻或者视觉震撼，只不过是一些早已见怪不怪的好莱坞现实主义动作俗套的组合，而展示得又远不及勇闯夺命岛那般精彩刺激。
241,盗梦空间,3,可不可以老搞开放性结局啊？让陀螺倒下很难吗？？
242,盗梦空间,3,"大烂片,不过演员和场面真的不错"
243,盗梦空间,3,little idea thats all
244,盗梦空间,3,我是太不淡定了  自己一个人先看了2d版  尽力了给3星半.......之后再看imax会不会再加分就难说了....
245,盗梦空间,3,真的一般般，至少不是我的菜。
246,盗梦空间,3,也就是立体交错的剧情而已，结尾和开头可以连起来做无限循环。。。
247,盗梦空间,3,梦中梦中梦中梦。。。
248,盗梦空间,3,跟不上，有点乱了我
249,盗梦空间,3,3.5吧。这个概念带来的叙述方式还有点意思，进退自如也比较容易自圆其说，但是具体到每个空间的设计都显得没什么想象力啊，尤其是那个雪地攻坚战，很平庸啊。由于精神不好，看的时候小睡过去好多次，可醒来照样能继续接着看，也不影响什么，可见本片并没有传说中那么费脑子啊，信息量并不大
250,盗梦空间,3,想象力瓶i 艟哟伪  五快X的七人午夜 肥leo仍久迷人
251,盗梦空间,3,nolan没有任何新东西
252,盗梦空间,3,越往潜意识深处守卫者越多不对吧
253,盗梦空间,3,看了《致命魔术》后……
254,盗梦空间,3,这尼玛不就是我的梦吗？
255,盗梦空间,3,费脑子的片子。个人觉得这些梦境都太清楚了，我的梦视点不断在转换，有时自己在场，有时不在。这些是无法用摄影机来捕捉的。
256,盗梦空间,3,是怎么成为年度热点电影的？想不通。没觉得难懂，只觉得没意思，情节设置如同游戏，怎么可以拿它跟黑客帝国媲美呢？小李子总是演这么忧郁矛盾情感受挫的男人，真是够了。
257,盗梦空间,3,"没想象中好看,但终算一部好片"
258,盗梦空间,3,看不懂梦境构建的规则和逻辑的话，就只是“魂斗罗梦游记”而已T T
259,盗梦空间,3,大逻辑错了，细节怎么弄也不能变成一个对的故事……是不是我太较真？
260,盗梦空间,3,NOLAN的野心不小，耐心欠缺
261,盗梦空间,3,确实是最近今年来影院播放水平很高的一部电影了。但是也想夸张到可以9.4分吧！不过巨星云集啊！
262,盗梦空间,3,点子是个好点子  如何自然的讲好故事又是另外一回事了 
263,盗梦空间,3,音效不错而已
264,盗梦空间,3,10年前，Jack和Marla在《Fight Club》最后的一片混沌下走向永恒…10年后，Cobb随着未知图腾的指引下从《Inception》走向无限…p.s.Kaylar和Michael推荐的真好，当时就应该在拉萨看完才是，虽然是个盗版碟
265,盗梦空间,3,nolan再这样下去在影史上成就会非常有限的
266,盗梦空间,3,看不懂呀看不懂～
267,盗梦空间,3,时隔七年再刷，深觉无趣。
268,盗梦空间,3,不如禁闭岛。
269,盗梦空间,3,1、电影确实精彩。2、没有想象的难懂，相信你自己。3、总会有一个让你记一辈子的镜头。4、请降低期待值。5、请提前上厕所。6、记得关手机。7、一定要去影院，因为影院也是个造梦机器。8、记得听完结尾音乐。因为它负责让你醒来。9、极可能是近几年你在影院看过最精彩的电影。10、穿越吧少年
270,盗梦空间,3,这么烧脑的电影，果然不适合我，为了表示我还是看懂点，给个三星吧
271,盗梦空间,3,还行吧，看不出特别的好
272,盗梦空间,3,充斥着特效科技的无聊片~不是我的菜，失望。
273,盗梦空间,3,全剧的效果还是可以的，不过故事的内容安排实在牵强。尤其结局更是让人觉得整个故事毫无意义。
274,盗梦空间,3,idea挺棒的
275,盗梦空间,3,抄袭的概念，幸好没失手。
276,盗梦空间,3,有黑客帝国的影子
277,盗梦空间,3,虎头蛇尾，还有断续感，我只能给仨星。
278,盗梦空间,3,比Nolan的其它片子，比如《记忆碎片》和《致命魔术》差不少，构思也老套
279,盗梦空间,3,比《十三度凶间》差远了
280,盗梦空间,3,不特殊，配乐不错
281,盗梦空间,3,你得梦我来盗
282,盗梦空间,3,乱七八糟的剧情，却以各种难以自圆其说的解释挑战观众的智商。
283,盗梦空间,3,我发现我不喜欢科幻片。。。
284,盗梦空间,3,为神马这部片的分就那么高，我真的觉得没太大的噱头
285,盗梦空间,3,比较抽象
286,盗梦空间,3,真心看不懂
287,盗梦空间,3,也许是因为《2001：太空漫游》和《The Matrix》在我心中不可动摇的地位，这部电影没给我多大震撼。三星，给的是动作和特技设计。
288,盗梦空间,3,电影很精彩 没有想象的难懂 总会有一个让你记一辈子的镜头
289,盗梦空间,3,这个剧情累死人  
290,盗梦空间,3,差点没看懂~
291,盗梦空间,3,不知道是因为期待过高还是因为剧透 总觉得没有传说中那么好啊
292,盗梦空间,3,不明白
293,盗梦空间,3,o力
294,盗梦空间,3,"还是得靠评论才明白,小女孩双鱼的果然是做梦高手，莱昂纳多也是水象"
295,盗梦空间,3,我觉得 还是记忆碎片好看些。。。
296,盗梦空间,3,点子不赖，有些画面很赞，但是拍得太赶了，没有仔细推敲怎么讲故事，就用大段大段的独白来交代剧情。
297,盗梦空间,3,中间睡着了。
298,盗梦空间,3,为什么评价这么高。。。。
299,盗梦空间,3,唯一一部在电影院里看不下去的电影，总想动来动去，甚至还想出去逛一圈再回来。幸好当中有点解密，但是结局很抠门！
300,盗梦空间,3,Joseph Gordon-Levitt和所有配角都不饱满啊 最后结尾的时候屏幕黑掉全影院的人都awwww了 最大的意外其实是Marion竟然...没有演活人... 特效很好但是有些太炫而过了梦境的噱头很足但是感觉也有些太过了...还是我对这部电影期望太高了...
301,盗梦空间,3,????
302,盗梦空间,3,个人觉得还不错，但和《穆赫兰道》相比段数相差甚远。首先，这是一部科幻片，借助了梦境的一些元素，比如做梦的时候思维加速，以及弗氏关于梦境的理论――而非纯推理片，比如其实人不能进入另一人的梦境。作为一个一夜n梦的人我可以很负责任地说，《穆赫兰道》的梦完全可能存在而本片的梦，不。
303,盗梦空间,3,梦境是唯一的现实！我想打五星的大部分是因为最后那个陀螺没停吧。。小儿科！
304,盗梦空间,3,我真的没觉得这部片子有多牛X，不明白为什么那么多人推崇。除了特效以外没亮点，很吃力的解释故事的逻辑，以致于让人提前猜到结局，故事也不打动人。毕竟之前我们已经读过了庄子梦蝶，看过了骇客帝国，这一套已经不算噱头了~
305,盗梦空间,3,好吧，看了解析才懂，确实牛B。不过还是觉得这种牛B的电影就该跟个爱好这方面的人去电影院看，可以讨论一下，我还能看的认真细致些。自己在家看又长又看不懂真觉得头疼，以后绝不会自己看这种高科技打斗电影，否则都对不起电影。ps男二好美哦爱死了。讨厌玛丽昂歌迪亚，她绝对是我提不起兴趣的败笔
306,盗梦空间,3,我一点也不觉得这个禁闭岛的翻版能打五星
307,盗梦空间,3,这片子真的有那么好看吗？事实证明我真的不是适合看这种太动脑子的产品。
308,盗梦空间,3,trick film而已。世界观很虚弱，内核很简单，外面包装了那么多trick也掩盖不了其虚弱的本质。小李哥不就是觉得刚放手不在思念亡妻了么，非得整出这么多幺蛾子，况且所谓梦境真是弱爆了，简单无趣，明明有更多的可能去阐释，可惜却选择了最安全最无趣的一种。
309,盗梦空间,3,"这是我所有看过类似题材里最无趣的一部
诺兰是一个骨子里唯物的导演 只会使用左脑的导演 
这是一部高逻辑性高智商结构繁复 缺乏想象力，趣味和风格 留白太少 题材无新意的电影 
诺兰的世界观 价值观 有点无药可救了"
310,盗梦空间,3,包装华丽内敛着卖萌的庸俗商业片。对意识话题本身的挖掘只是虚张声势的哗众取宠，偏偏又无数人买账，就是个装B人的高分道具。无聊
311,盗梦空间,3,看得好费脑啊。。。有bug。。。
312,盗梦空间,3,怎么就不觉得好看呢
313,盗梦空间,3,比想象的差很多。
314,盗梦空间,3,被概念架空了，情感上远不如索拉里斯星震撼
315,盗梦空间,3,能理解票房大卖的原因 不过不对胃口 诸如此类的片子还是越玄越好 不过深刻程度感觉比香草天空还好点
316,盗梦空间,3,如果现代科学对梦能了解更多，不知会对这片子有什么影响？但是梦的真实与现实的虚妄是肯定的。另外结局很灵，也很欠抽！
317,盗梦空间,3,很好的故事，却没能讲的好看，角色和叙事还不够到位――不够酷。
318,盗梦空间,3,高兴的是诺兰没有抄，有些失望的是不够surprise我
319,盗梦空间,3,剥去躯壳无非还是一部好莱坞说教片。
320,盗梦空间,3,好复杂，求真相
321,盗梦空间,3,诺兰的风格，可是我对这类型的片子真的不太感冒
322,盗梦空间,3,这类电影快看麻木了，没感觉了
323,盗梦空间,3,"终于还是和杰一起看的。。虽然他已经看一遍了。。虽然他。。哎。
片子也凑合，我以为多强个东西呢，技术不错，创意不错，可是故事讲的也没那么好，结尾又故弄玄虚的"
324,盗梦空间,3,或许是我的脑子不够复杂没有想到那么多问题 或许之前的期待太高 或许这只是一部男人电影。
325,盗梦空间,3,"intricate, clever, but soulless, shame."
326,盗梦空间,3,有点生硬、雪地枪战和追车没啥看头，不过能把这么复杂的故事讲清楚也不容易了。
327,盗梦空间,3,真不好意思亮星，因为我没看懂
328,盗梦空间,3,胃里翻江倒海
329,盗梦空间,3,为嘛！为嘛这个片子这么高分！
330,盗梦空间,3,为啥我觉得很一般呢。。。
331,盗梦空间,3,"我是被你囚禁的鸟，已经忘了天有多高。如果离开你给我的小小城堡，
不知还有谁能依靠。"
332,盗梦空间,3,还行，挺热闹
333,盗梦空间,3,片子售卖的ideas并不新鲜，没震撼到我。视觉方面由于我看的是枪版，所以……有人说片子“逻辑非常强”，我想说逻辑只有严谨、正确和完整，“强”是神马？不管是神马，反正没在这部片子里看到。最明显的破绽是，要死掉才能返回现实或者上一层面，那么怎么算“死掉”？梦里的投射也能像肉体一样死？
334,盗梦空间,3,还是黑客帝国比较有内涵
335,盗梦空间,3,真有那么好看么？
336,盗梦空间,3,我真的想睡觉。。。
337,盗梦空间,3,高深莫测的片子，亮点是利昂纳多的帅哥助手迳夫~~~要他是我助手~~我一定每天都扑到他~~~
338,盗梦空间,3,没有想象中的那么好，为什么大家都觉得特别好呢？？就是一个普通的商业片而已…………
339,盗梦空间,3,又一次被影评给忽悠了。
340,盗梦空间,3,昨儿早上去看了大名鼎鼎的《盗梦空间》，有人说说到底好看在哪里么？还有，有什么地方是看不懂的？偶咋感觉跟《敢死队》差不多，就是：碰碰碰碰碰，喷彭彭，捧彭彭彭彭，砰砰，朋~~~~~~~~~~~~~~
341,盗梦空间,3,没有想象中的好吧。结构比较新奇而已，商业电影至于那么高分吗？
342,盗梦空间,3,继《阿凡达》的全场鼓掌和《叶问》的全场叫好之后，终于又在《盗梦空间》结束时见识了全场哀号，开放式结局神马的最TM讨厌了！凸=皿=凸
343,盗梦空间,3,没有像玩3那样给我那么大的惊喜
344,盗梦空间,3,催眠大片
345,盗梦空间,3,莫名其妙，y七八糟～
346,盗梦空间,3,不喜欢，形式大于内容，数次分神犯困
347,盗梦空间,3,把套头衫的帽子也带上了。腿也蜷缩在椅子里面。哆哆嗦嗦的看完了电影了。我的精神分裂了
348,盗梦空间,3,太复杂
349,盗梦空间,3,看了开头就看不下去了~无聊的片子不知道为什么那么红 导演被炒的有点太虚了 轮创意和故事等等完全不如入侵脑细胞
350,盗梦空间,3,又是玩弄形式，其实没什么深度
351,盗梦空间,3,"期望值太高=_,=      9/24 奥斯卡 和姜冬瓜"
352,盗梦空间,3,为什么我的标记又消失了。。。
353,盗梦空间,3,"很大片很高深很奇特，但是我不喜欢。
思维意识的刺激大于观感，观感的丰富性大于剧情，剧情的合理与耐受大于感情。
这部影片带给我最大的收获，就是让我明白了纯理性是多么危险、无趣和不幸。虽然我喜欢超现实主义，但是我真不喜欢这部影片，因为它的是非观是混淆模糊的，非常让我反感。"
354,盗梦空间,3,太长了。。。
355,盗梦空间,3,在第2层梦里，柯布伪装成费希尔的保卫建议费希尔进入布朗宁的潜意识，但布朗宁只是费希尔的投射，进入布朗宁的潜意识即是进入费希尔的更深一层潜意识，既第3层梦。但是柯布已经和费希尔说过这是他的梦，费希尔受过训练，怎么会允许别人进入自己深层次潜意识。
356,盗梦空间,3,失望诶
357,盗梦空间,3,```
358,盗梦空间,3,我都不知道该给这片子打什么标签！之前的宣传，炒作太多了，个人觉得还行吧，梦中梦又怎么样呢，活得好辛苦啊！
359,盗梦空间,3,"感觉像点着个能连炸6响的""二踢脚“  都响了；炸挺高，就是烟大点高点，没了"
360,盗梦空间,3,"你把它扯平了看，就是一个普通的枪战片，只不过作者说发生在几层梦境里罢了。
几个地方我都想到了：1保险箱里放的是平凡物品 2结尾陀螺似停非停 3引入新手，以便来个tutorial 4因为突发意外，进入下一层梦境。
但我没想到的是：开头片段也是梦境。"
361,盗梦空间,3,一如诺兰之前的片子，构思很精巧，可总是打动不了我。个人觉得还不如影子写手，甚至不如早前的丹泽尔华盛顿主演的时空线索。
362,盗梦空间,3,又一个不禁琢磨的大热，比阿凡达还不禁，唯独不托宇宙存亡只顾儿子闺女这点颇得我心。第一层后面的，一层一星，够了。
363,盗梦空间,3,我擦，怎么又浮上来了，重新打分
364,盗梦空间,3,8
365,盗梦空间,3,王晶式的导演作品 就是接的不好 
366,盗梦空间,3,也就个五层啊，有啥啦
367,盗梦空间,3,"没有传说中的难懂
甚至属于有点直白的电影。。。"
368,盗梦空间,3,三星半。创意是拿满分的，但深层上就退步了，既比不上《记忆碎片》的解构精彩出的人性刻画，又没有《黑暗骑士》的对立面中的张弛。还有不知是不是看了阉割版，没看到传说中的出彩的最后一秒，我连最后0秒都看完才走出电影院的，啥也没看到，就是字幕完了就黑屏。
369,盗梦空间,3, 不懂欣赏
370,盗梦空间,3,就是玩特效，情节很一般，我对心理方面的电影向来期待很大，对它很失望
371,盗梦空间,3,dis...dis....disappoint 
372,盗梦空间,3,说实话，我真没觉得评分这么高是公正的，想象力和画面没的说，但是情节最多就是个科幻片，甚至还不如记忆碎片那种小成本的片子更吸引人，演员都有点矫揉造作，大家都在自说自话，神神叨叨，卖就卖在了大制作吧，和Avatar一样，多少人说他好是在跟风呢？我不觉得差，但是没有好到这么好吧？？？
373,盗梦空间,3,难道是压了太久没看，导致我对梦境这些完全没兴趣。我认为我基本看明白了，觉得很无聊。山寨蒋雯丽和山寨梅婷亮了。。。
374,盗梦空间,3,无比infer地看了，嗯。莱昂纳多居然残成这样了…自古美人不许人间见白头啊= =构思不错，逻辑比想象中好懂……以及，这是动作片？感觉一点都不悬疑啊……
375,盗梦空间,3,悬疑处理还可以，就是我觉得美剧主角配角都一个样，所以每次都只能看大概03
376,盗梦空间,3,如果一а菀婚_始就以㈥P注引入迷m槟康模那]定不算是一部好片子，即使受到o等说拇蹬
377,盗梦空间,3,典型的Nolan风格 不喜欢
378,盗梦空间,3,就是u造艟撑cI暨@些神秘的|西纹鹆穗影，H上也就一般般
379,盗梦空间,3,没觉得有多好看.....电影看多了感动和意外就越来越少....
380,盗梦空间,3,还不错
381,盗梦空间,3,看得有点晕。
382,盗梦空间,3,相比遗忘的诺兰，没多大新鲜的。恕我没太多苟同地方。
383,盗梦空间,3,花哨包装下的老套桥段。
384,盗梦空间,3,我会再看的！
385,盗梦空间,3,3。看着真累，这世上没有深刻，只有复杂。
386,盗梦空间,3,故事性一般，着墨点太刻意，为小李子打这个三星，不是我喜欢的类型。
387,盗梦空间,3,精彩而空洞，永远在炫技从不走心。
388,盗梦空间,3,梦中梦？这是骗中骗！
389,盗梦空间,3,没仔细深究 。。 
390,盗梦空间,3,有意思也没什么意思。好烦看“剧情分析”神马的！！
391,盗梦空间,3,三星给特技。我觉得这个逻辑挺能理解的。。最后留个悬疑还不错。李奥纳多发福超严重。。。
392,盗梦空间,3,总觉得自己不太习惯在一部电影动太多头脑，于是乎没有看懂。
393,盗梦空间,3,点子很好，其实表达方式上可以拍得更好看吧？
394,盗梦空间,3,272……
395,盗梦空间,3,没有我想象中那么好，跟游戏过关似的，但是核心还是逃不过美国主旋律，一个爱家的好男人云云，挺没劲
396,盗梦空间,3,看过控制的极限，再看这个，简直就是小儿科
397,盗梦空间,3,完全没有想象中的好看……
