,movie,star,comment
0,勇敢的心,5,一句“freedom”煽的我眼泪哗哗的
1,勇敢的心,4,所有的人都会死，但并不是每一个人都活的有意义。
2,勇敢的心,5,有时候男人的一句嘶吼也可以让人流泪
3,勇敢的心,5,那时候的史诗片拍的多好，90年代的大片就应该是这样的。
4,勇敢的心,4,Freedom！自由从未来得这么震撼心灵过~~
5,勇敢的心,5,freedom
6,勇敢的心,5,综合一切娱乐元素的优秀电影。
7,勇敢的心,5,梅尔吉布森自导自演，斩获奥斯卡多项大奖。这部影片从史实角度看完全不及格，但从史诗角度看绝对堪称经典。童年苦情经历、爱情、复仇、战争、背叛、受刑等英雄片的元素齐集，配以高潮迭起的剧情和悠扬的苏格兰风笛，让人即使知道剧情与史实不符，也禁不住流泪。（8.5/10）
8,勇敢的心,4,被曲解的历史，詹姆斯霍纳的巅峰配乐
9,勇敢的心,5,里程碑式的电影
10,勇敢的心,4,生命诚可贵，自由价更高。
11,勇敢的心,5,看了三遍，很好看。Freedom！！时间：2003
12,勇敢的心,5,"其中有一个场景很享受,大约是最后30分钟,华莱士的伙伴重新聚集力量,向其他人宣传华莱士召集士兵做战前准备，而华莱士独自一人登上高山顶峰,那一刻音乐背景画面以及心灵都异常的充实满足。因为这部电影爱上了苏格兰音乐，充满异域风情，风笛太好听了"
13,勇敢的心,5,自由就是这么来的，可奴隶也是这么来的。
14,勇敢的心,4,1：爱尔兰还是苏格兰那边的风景太美了，自然景物美到一种极致，你会感叹造物的神奇；2：苏菲玛索确实很美；3：我个人感觉剧情一般，场面；4：最后的那个“Freedom”，你去天安门喊看看，再来跟我说你震撼到了。8
15,勇敢的心,4,苏格兰史诗影片，为自由而战。每个人都会死，但不是每个人都曾经真正的活过
16,勇敢的心,4,苏格兰的裙子and男主到底爱谁
17,勇敢的心,4,最后一句话。
18,勇敢的心,4,想念苏格兰的风笛，还有古斯特灵桥边的那一旋水洼、一点细雨，远处是华莱士纪念塔，遥不可及。
19,勇敢的心,5,每个人都会死去，但不是每个人都曾经真正活过。
20,勇敢的心,5,90/100 作为史诗电影，《勇敢的心》几乎做到了所有可以做到的事情，剧情、摄影、声音、剪辑、表演、场面调度几近完美，尤其在各方势力的塑造和人物刻画上堪称满分。主题从始至终从未离题，萦绕在主人公周围的爱情、友谊和一切故事都让人那么的心悦诚服，感人至深！
21,勇敢的心,4,虽然剧情有点小拖沓，但总体还是一部激情，悲壮的电影，且结尾处的悲剧也将这部影片推向更深的内涵。
22,勇敢的心,5,我不为结局震撼或感动。电影行至2/3，我冷笑所谓的【一生一世的爱情】最后还不是被苏菲玛索折腰。然而在他死刑前，见到的最后一个影像――眼泪就这样不争气，诺言就是这样顶天立地。
23,勇敢的心,4,【北京电影节展映】一小撮别有用心的苏独份子，有组织有预谋地进行恐怖袭击分裂活动，破坏民族团结祖国统一…咳说正经的。苏格兰民族英雄的故事，激烈的战斗场面，三小时的篇幅，和詹姆斯・霍纳的配乐，确实够史诗范。然而，疆场浴血奋战也好，美人投怀送抱也罢，都不如一句“Freedom！”来得震撼心魄
24,勇敢的心,4,本来是搜这个电视剧的，没想到看到了这个电影，沉重但是很有力量……女主很美
25,勇敢的心,4,跟人感觉一般般，英雄主义太浓了。
26,勇敢的心,4,真是史诗片的配乐、场面，煽情也有一套。
27,勇敢的心,5,官逼民反，民不得不反！！开头山那个清，水那个秀啊！！孩子为什么不好好洗洗脸呢？苏菲・玛索的戏份很少，饰演的角色也不是华莱士的最爱~~~最后为什么没有人去劫法场？眼睁睁看着华莱士被整死~~~
28,勇敢的心,4,觉血腥，苏菲玛索的眼睛惊艳
29,勇敢的心,4,可歌歌不起，可泣泣不来，有时候真是一种无奈的免疫。但创作者真情或假意，倒已能一眼洞察，从视觉系的燃情到触及源头的动容，大概也是观影上的进化。真切佩服梅尔・吉布森的发心。另外，我觉得恰恰不是传言中被美式与神化的个人英雄主义，临终咆哮后战火再燃，是真正象征人壳接力魂魄永载的精神传承。
30,勇敢的心,5,听说了很多年，到最近才看。虽然事隔13年，但确实不愧为冷兵器战争电影中的经典。有3个场景让我印象深刻：最后一次战役中 ，当华莱士知道自己被罗勃背叛后，一个驰骋沙场的大英雄像个孩子一样无助，我哭了；行刑前，华莱士在牢狱中对自己说“我害怕”；在华莱士行刑的过程中，王妃独自哭泣。
31,勇敢的心,5,很经典的电影，每个人都会死的但并非每个人都活得有意义，为自由而战，freedom！！！另苏菲玛索真不愧法兰西玫瑰，太美了
32,勇敢的心,4,Freedom，为自由而战，为自己的梦想而战。成家立业、生儿育女，最卑微的梦想；自由，最崇高的梦想。冷兵器时代的史诗大片，宏大的主题却不失风趣。配乐美到极致。吉布森的眼神用深情射伤了我，苏菲・玛索美呆了！！！
33,勇敢的心,5,多热血啊，多大片阿
34,勇敢的心,4,人生中第一次看的史诗大片，free！
35,勇敢的心,4,苏菲玛索好美呀，影片不错，很燃的打斗场面。
36,勇敢的心,4,跌宕起伏，游刃有余，配乐有如天赋神力，璞素昂扬的九十年代审美。
37,勇敢的心,4,有点沉重，前面有点闷后面好看到飞起，史诗一般
38,勇敢的心,5,(⊙o⊙)哦，我现在才知道很漂亮的女主原来是苏菲玛索，小时候看的了，就记得梅尔吉布森高喊的”freedom“，还有就是爆好听的苏格兰风笛
39,勇敢的心,5,大约10年前我告诉一个盆友，我看了这个电影，讲苏英战争的，其实当时我没看。说谎原因我忘了，总之是装13来着，可能当时我没有一颗勇敢的心。10年后我终于看过了这个电影，觉得我整个人都华莱士了，敢于直面曾经装13的自己需要多大的勇气啊！！
40,勇敢的心,5,雷声、那朵小花，电影课上分析出N多象征意义。|据说剧情和真实历史差距巨大|||| OST六颗星。
41,勇敢的心,5,电影以苏格兰的民族独立战争为引，呈现了一段为自由而战的血泪史诗，自导自演的梅尔・吉布森，用铁血的刚毅与硬汉的柔情，营造了光影间最为男人的英雄传奇，那临刑前“Freedom！”的呐喊高呼，《勇敢的心》震撼了多少人的心？！
42,勇敢的心,5,为自由而迸发的勇敢。男人的豪情和柔情总是能打动女人的心，梅尔吉布森的演技倒倒并不算太出色，对于威廉姆华莱士这个角色来说，他的年龄似乎也偏大了点。他导演的片子倒是功力不俗。这片子的音乐实在是好，风笛和暗沉的苏格兰裙是最能体现那个民族的东西了。
43,勇敢的心,5,"Every man dies,not every man really lives. 我很喜欢这部电影的原声，苏格兰风笛仿佛带着我一路向北..."
44,勇敢的心,5,"配乐大赞啊！感情随着主人公的冲锋陷阵而渐渐充沛，终于在最后处死时决堤。
PS：剧情中的布鲁斯是不是学习了【毛泽东战略思想】。。。等两败俱伤后自己坐收残局~~"
45,勇敢的心,4,自导自演，梅尔功力不凡。场面不错，故事挺俗的，不过好歹符合了当代的普世价值观。由这个电影我倒是想起那些一边标榜XXX一边践踏XXX的人，这种人不仅限于有权有势者，其实每个人身边就有很多。
46,勇敢的心,4,接着延续自己正牌史诗打不到五星的传统~~~好吧，现在所有的“大片”，只剩大船还没看了。。。为什么到现在还没有打算看的意思呢。。。
47,勇敢的心,4,看这片时，我满脑子想的是回民反抗清统治者暴政的被迫自卫反击，看华莱士想到的是白彦虎，杜文秀
48,勇敢的心,4,线索简单，推进层次分明，角色也很有辨识性。萝莉正太成年时还是悲摧了一下。梅尔老好快啊…战争和后面的行刑场面还是看得很虐，总有感同身受的疼痛。片尾那么惆怅又那么励志。断气的前一刻，他在人群中看见她。她是他的自由之钥。是要多么坚定的信仰与爱，才能成就那样的幻觉。第一次看见传说的苏菲。
49,勇敢的心,4,片子是好片子，不过在豆瓣有点评价过高的感觉，长脚王演得非常不错，小华莱士稍微差了点；最后也没想象得有多感人，片子不知道为什么个人总觉得离“史诗片”差了那么一口气；不过和大多史诗大片一样对英国民俗风情的考据真的很用心，从风俗、民乐、长裙、农具、冷兵器到历史人物的个性都很忠实地被还原
50,勇敢的心,5,每个人都会死，但并不是每个人都活过。为自由而战的华莱士，他死的重于泰山。影片中的苏格兰风笛声太好听，非常有韵味。还有，勇敢的心不仅仅指华莱士，反而是从其他人那里最深层次的表达（如布鲁斯受到他的感化领导人民走向自由）
51,勇敢的心,4,都12几几年了，他们怎么还跟野人一样。。我们中国7几几年就大唐盛世了~~ 这居然是看的第一部梅尔吉布森、苏菲玛索的片。。那个罗伯特还蛮帅的啊~~ －－1996年第68届奥斯卡最佳影片、最佳导演等
52,勇敢的心,5,开始觉得他只是为了一个女人才开始民族对抗，但是一切都被他最后一句freedom所震撼了，一个hero，一个一生中拥有量短至死不悔的爱情的男人，一个受到万众爱戴和尊重的伟人，永远留在我们心中。
53,勇敢的心,4,荡气回肠的史诗片，或许看过以后不会再那么清晰的记得剧情，但我想总会记得那句“freedom”，总会记住那双如同凯奇大叔一般深邃的眼以及萦绕在耳边久久不散的苏格兰风笛。★★★★
54,勇敢的心,4,"milktea的top10。勉为其难的看了三个小时。然后发现他就喜欢杀杀杀的调调。我只想说。。。。求求你们。别打了些。ps。苏格兰风笛我喜欢。配乐出名是应该的。赞。还不如让我看三个小时有强迫症的飞行家呢
"
55,勇敢的心,4,梅尔吉布森的巅峰之作。他所演绎的华莱士对Freedom的宣言，在所有电影中，唯有《独立日》中总统的那段为自由而战斗的演讲可以与华莱士的激情相比肩。本片也似乎也看到了亨利的影子，那高亢的、无悔的呐喊，”不自由，毋宁死。“
56,勇敢的心,5,我还小的时候总是喜欢跟着老哥抢电视 难得的意见共同就有这部片子 看过好些遍 印象最为深刻的是最后他被挖心的部分 前段时间无意中看到关于MEL GIBSON的纪录片才知道原来男主就是导演 
57,勇敢的心,4,没有看这部电影，我不会知道威廉・华莱士这个名字（说实话现在我还是记不住）。想起以前关于英雄的一切定义以及奠基于事业之下的无名之士。
58,勇敢的心,5,看到评论中有人指摘片中关于自由的呐喊过于简单幼稚，但这部电影不是为了论述自由，而是为了展现人类在某一信念下展现出的无上勇气，乃至无畏于强权和暴虐，无畏于威吓与酷刑，直至洞穿生命。这就是Bravehart。
59,勇敢的心,5,自由！！！很大的英雄哦～～三国演义+水浒传？？！可惜我们的国家却没有这样的英雄。。。只有小丑。
60,勇敢的心,4,大学时候看的，典型的个人英雄主义电影，还可以。
61,勇敢的心,4,整个片子厚积薄发，看的人热血澎湃！在乱世下，英雄是怎样横空出世，又是怎样壮烈牺牲！华莱士最后那句嘶吼的自由，让我瞬间飙泪！片子差不多三个小时，有机会我还会再看一遍！主要是梅尔吉布森原来就是你，这么牛∫徊科羰景盐艺鸱了，竟然又是导演又是编剧又是演员的！哎，能人辈出！膜拜~
62,勇敢的心,4,★★★★ 租碟年代，改天重温，看看有没有新收获。那时觉得前面比较闷，后面超精彩，郁闷得有点难评分
63,勇敢的心,5,非同凡响，实力五星。细节和结构都非常扎实，给演员表演上的发挥腾出了空间，让梅尔吉布森爽爽地过了一把戏瘾。很喜欢里面危机时分镜头里面的一点小幽默，梅尔吉布森在把握节奏和观众心理方面确实很有一手。简直是一部活生生的领导力手册，再好的领导也会面临陷害。
64,勇敢的心,5,一部宏伟的爱情与自由史诗，最令人我难忘的是那首背景音乐《Wallace Courts Murron》真个跌宕起伏，演绎了乱世中的侠骨柔情。
65,勇敢的心,5,"Don't like the ending. I love FREEDOM, the best Gundam anyway. I'm also pursuing my Scottish courage!!!"
66,勇敢的心,5,"18岁没到的我，愣是看了快进版的，老师把她们结婚后那段给快进了，太做的出了。
但是，它对我影响是深刻的，FREEDOM。"
67,勇敢的心,4,看了几遍，阴差阳错最后高喊freedom就义的那几分钟从没看完过。也许自由抗争的末路总不愿让我得见。PS.电影上映后第20年苏格兰独立公投又失败了。
68,勇敢的心,5,曾经很热血的我在曾经很热血的十几岁年纪，看的爸妈租来的录像带
69,勇敢的心,5,那段激励士气的话，被我一遍遍的引用，不是因为他说的好，只是引起了共鸣
70,勇敢的心,5,可以说是接触的第一部西方电影 甚至 当时还不能理解里面的故事情节 
71,勇敢的心,5,很多人都说苏菲在这里是最美的，我不这么想，我宁愿承认她只是一个被借用的花瓶，光环全在梅尔・吉布森周围
72,勇敢的心,4,"自由啊 自由-------I will die for you。 I really don't care about the result,at least I am trying to do that"
73,勇敢的心,5,虽然不是自己标准的五颗星。但是尊重经典。尊重始祖。原声强大。MelGibson永远是好导演好演员。苏菲玛索真好看。我还是最喜欢演他媳妇儿那女的 
74,勇敢的心,5,"he once attacked successfully Yorkshire, his body died, his followers continue..."
75,勇敢的心,5,当William大吼出Freedom的时候 我真的只想到了 生命诚可贵 爱情价更高 若为自由故 二者接可抛 很难想象所有事情的爆发点是因为一个女人 当躺在自己身边的妻子都要与别人分享 结婚这种事情还要偷偷摸摸的 还有什么理由继续忍受呢
76,勇敢的心,5,"又名: 勇敢的心 / 英雄本色 / 惊世未了缘

导演: 梅尔 吉布森 (Mel Gibson)
主演: 梅尔・吉布森 / 苏菲・玛索

上映年度: 1995
制片国家/地区: 美国
imdb链接: tt0112573"
77,勇敢的心,5,让苏格兰风笛震撼你的心灵...Freedom！！！！！
78,勇敢的心,5,大学时包宿看的，简直是太精彩了，3个小时一点也不觉得长，想当年梅尔吉普森是那么帅
79,勇敢的心,5,以中国人的心态看完了3小时的影片，首先让我想到了古代西周的妲己，然后有点像吴三桂，最后还是觉得像TW的阿扁。看完后很沉重，究竟什么样的才是Freedom？！
80,勇敢的心,5,Happy St. Andrew’s Day！And keep on fighting！
81,勇敢的心,5,终于把这部片子完整的看了一遍。苏菲・玛索在这部片里真是惊艳。另外配乐太赞了，风笛为主的旋律与苏格兰的风景完美契合。
82,勇敢的心,4,。很经典，但我不太喜欢这种类型
83,勇敢的心,4,可能是因为主演和故事内容的原因，感觉很像爱国者，但这部故事性更强，却比爱国者少了那些不可少的温情
84,勇敢的心,4,历史给故事里的每个角色都赋予了厚重感，比亚瑟王这类电影要大气深沉的多，所以虽然很长很长很长，但还是很轻松地看完了
85,勇敢的心,5,上次看还是六年前，不知道自由为何物，单纯的为男人的勇气而感动到热泪盈眶。时过境迁，知道的太多，了解的太多，反而开始质疑单纯的理念，曲解电影的初心。电影还是经典，而我变了。总觉得这是一件悲哀的事情。
86,勇敢的心,5,重温经典。更多的是关注那段真实历史。威廉61华莱士是真实人物，故事虽有改动，但大体遵照历史。片中苏格兰国王罗伯特的形象被牺牲了，尽然活生生地出卖了华莱士两次。其实他才是真正的勇敢的心，带领苏格兰人走向自由。影片中华莱士的各场演讲真是听得让人热血沸腾，最后那声“自由”足以让人起立鼓
87,勇敢的心,4,音乐太好太好太好 尤其是在theater超保真的音质下看的这部片...
88,勇敢的心,4,我的评价是还行吧，都还一般。也许是因为我对那段历史和世界太熟悉了，除了找到一种熟悉感，没有什么特殊的。
89,勇敢的心,4,"知名度高的让我期待很久了。。只是怕欧洲的古代片无法理解
所以我还是避免看这类的。。
可我还是看了
故事还是可以。。英雄史诗般的
也算我看的第一部索菲玛索的片子
结局那残忍死刑现在想来就觉得不舒服
一下子就想起高二时看的《基督受难记》
古代人真的还残忍"
90,勇敢的心,5,"《自由的游戏》史诗大片的典范。所有的人都会死，但并不是每个人都活的很意义，为自由，虽死无憾。一个英雄的价值，最大就在于身后的追随者，影片也确实做到了这点。可能我们作为凡人，永远做不到华莱士坚定追求自由的不屈灵魂，但布鲁斯这个人物就是为我们这些凡人而准备的，屡次背叛，屡次犯错，但最后还是成为了华莱士的追随者，这其中的挣扎和痛苦，背叛时候所流出的泪水，如果经历过会明白异常真实
“只要你有勇气去追寻，你的心永远是自由的”“他们或许会杀死我们，但他们夺不去我们的自由”“我的情绪远超过愤怒”，壮志凌云的台词，“Freedom”一声咆哮，把我眼泪瞬间吼出，加之恰到好处，震撼人心的配乐，热血沸腾的画面，绝对满分的潜质（不知后来权力的游戏借鉴了多少）。只有一点疏忽了，当年盛世神颜的苏菲玛索的戏份实在少得可怜"
91,勇敢的心,4,苏格兰盖尔语 欧洲野蛮人大战其实都很喜感 落后 蛮荒 粗糙感 可是 电影有种好看的感觉 致敬苏格兰英雄
92,勇敢的心,4,高中英语课上老师给放的电影，很多年过去了，我们都记不清电影的情节，但“freedom”却成了我们所有人最熟悉的英文单词。那句自由的呐喊穿越历史长空，振聋发聩，
93,勇敢的心,5,这是我看过的第一部历史电影，我能背诵几乎每一句台词，熟悉每一首配乐。 从爱丁堡带回来的你的雕像和印有苏格兰xx誓言的T恤，也抚平不了对英雄的思念。
94,勇敢的心,5,2003.11.22 dvd 307 “影虫协会”第一部电影，值得纪念！ 2004.12.7 DVD 学校放映室
95,勇敢的心,5,从小就听电影原声，终于从头到尾地看了一遍。90年代的史诗电影。男人，爱情，国家，战争，自由。不过其实我是冲着苏菲玛索看的・
96,勇敢的心,4,freeeeeeeeeeeeeeeeeeeeeeeeeeeeedooooooooooooommmmmmmm
97,勇敢的心,5,"历史总是由处死英雄的人书写的。
一开始玩《帝国》的时候威廉华莱士总是惨败；PS，苏菲・玛索很美"
98,勇敢的心,4,虽然结合历史和逻辑来看颇有硬伤，但确实不失为一部振奋人心的史诗大片。个人英雄主义意味很浓，战争场面宏大而平实，不仅是对人性的探讨还是对自由精神生生不息的追逐，都是一部成功的商业片。PS.苏菲玛索实在是美艳不可方物，端庄又知性，独立又自主。
99,勇敢的心,5,"[大学] Irvin好不容易下好，超大超长啊，看了一遍没几天又重温了一遍
"
100,勇敢的心,5,话说每个男孩成为男人时，应该看的电影。很好，很强大。那Freedom，喊得我眼泪都出来了
101,勇敢的心,4,288 最后和苏菲玛索的爱情简直是败笔
102,勇敢的心,5,如果一个人是自由的，他便是最爱这个国家的。国家不在权势，而在心中。
103,勇敢的心,4,"去年看的...感觉一般,自由,我会做到 你说那句Freedom有震到你"
104,勇敢的心,5,自由的心，还记得那句Freedom吗？喜欢上吉布森由此开始。
105,勇敢的心,5,自由如此打动人心  几百年  几千年来都如此诱人  热血生命都抛洒了只为这一句FREEDOM
106,勇敢的心,5,"自由还是和平，革命或者叛乱？每一个重要的选择有没有完美的标准？
我在世界观不停地在坍塌和重建的过程中，企图找到真理，却只能发现自己的狭隘"
107,勇敢的心,4,很不错的战争片.但实在不是我的菜！
108,勇敢的心,4,“你最喜欢的电影”投票很多人的前三，之前担心中世纪会很不接受，后来才发现好的电影是不分时间段和类型的，那声响彻云天的“Freedom”也是提到这部片时很多人的第一反应，一直没看到某些人所说的“掏肠子”场景，难道我看的删减版？为了自由可以不惜一切，但你在生活中反抗试试？党和ZF枪毙了你！
109,勇敢的心,5,"真正的智慧是用脑子去战斗。
freedom：像战士一样战斗，像苏格兰人一样战斗。"
110,勇敢的心,5,梅尔・吉布森证明了自己，freedom成了经典。
111,勇敢的心,5,"何等的信念，攒足力气的那句""Freeeedoooom!""
All we need one brave heart."
112,勇敢的心,5,终于，在凌晨2.30分的时候看完这部史诗般的电影。Freedom！华莱士一直追寻的东西。心灵的震撼是不可言喻的。
113,勇敢的心,4,什么时候都要有那么一群愚昧的群众，他们总是衬托英雄悲剧色彩的最好的道具
114,勇敢的心,4,Freedom is everyone's right，but……这电影真的太扯了，就算不知道这段历史很多桥段也太戏剧性了，从头到尾一直以为华莱士是为了女人揭竿而起的（汗）……不过苏菲・玛索的法国王妃着实很漂亮，而且爱尔兰风笛的配乐也很好听
115,勇敢的心,5,"一部真正的英雄的史诗,brave heart,real lord.梅尔・吉普森缔造了所有男人期望的传说. 为了自由,为了和平,为了人民,在英雄的剑下,勇敢是会记录下传说的. 但在那样一个时代下,即使是英雄也逃离不了死亡与背叛.当他嘶声力竭出那句Freedom,再没有这样一个传奇!"
116,勇敢的心,5,梅尔吉布森巅峰之作木有之一。。。。把特洛伊，天国王朝，亚瑟等等等等所有其他的所谓史诗片甩下N条街。。
117,勇敢的心,5,这个都不看，别混了。苏菲玛索流泪的时候，我也差点
118,勇敢的心,5,"这部电影让我第一次感受到了真正电影的魅力,对我的意义很重大。到现在还留在我记忆中的,是梅尔61吉布森在一片出奇蔚蓝的天幕下,将长剑插在地上的情景,摄象机沿剑柄的方向直至蓝天……"
119,勇敢的心,4,总是觉得五星好像还差了那么一点点，到底哪里一点点，好像也不大说得出来。这好像是我看到的最漂亮的苏菲玛索~其实Catherine McCormack好像长得不够美，但是给人感觉真是很舒服。
120,勇敢的心,5,"华莱士忍着非人的折磨，用尽了全身的力气最后的生命声嘶力竭的喊出""freedom""。不知触动了多少人的心弦，原本欢呼看热闹的人们突然安静下来，静谧中那句承载着全部生命的freedom在空中人们心中久久盘旋…此刻突然想起那一句台词，哥你要自由的…气氛一下子就活跃了，伟大的四姑娘"
121,勇敢的心,5,我看的第一部很man的电影，当时还是在BT的网站上下了个叫《男人必看的100部电影》的种子，然后看着一百部觉得很揪心，就只下载了几部，这是之一。TAT看战争片是最容易哭的了。苏菲玛索好美。看完这部之后我跑去看吉布森的另一部战争片，发现还是这部好看。
122,勇敢的心,5,Freeeeeeeeeeeeeeeeeeeeeeeeeeeeeeeeeedom！！！！！！！！！！！！！
123,勇敢的心,5,为自由和正义而战！→Freedom! →相较于《血战钢锯岭》枪林弹雨、血肉横飞的战争场面，还是《勇敢的心》里用冷兵器砍杀的画面更让我感动“疼痛”，不过，大量真实残酷血腥的镜头和《角斗士》一样让我在拍案叫绝的同时，也限制了我对影片的喜爱。→每个人都会死去，但不是每个人都曾真正活过。-17.4.22
124,勇敢的心,4,曾经非常非常非常喜欢 因为他死的时候喊的是FREEDOM
125,勇敢的心,5,怕死的我 看的时候还是很触动。人终有一死，选择自己的死亡意义。这种大道理，你我皆知，但是就是要靠别人的故事来启发。感觉和《启示》有想通的地方，比方说都是本身乐于平淡，但是家庭和爱情受到压迫后站起来做个斗士。头一次看苏菲玛索的电影，她真的好漂亮哟。
126,勇敢的心,5,跟爸爸一起租碟看的，3片只借了2片，12点跑出去借第三片，太经典了！
127,勇敢的心,4,革命顶个球，后半句我就不说了，恩恩
