,movie,star,comment
128,勇敢的心,5,老婆，很早很早之前就听说过，只是后来才看的，嗯，老婆，确实不是一般的电影，那苏格兰风笛和裙子，老婆，你在英国会听到看到吗？嗯，老婆，freedom哈，嗯，老婆，我不要freedom好不好，我要光荣革命，把你从英国接回来当女王，好不好哈？嗯，老婆，做我的女王吧呜呜，人家求求你了嘛，抱抱哈！木啊！
129,勇敢的心,5,freedom，freedom，freedom……
130,勇敢的心,4,威廉华莱士临死前那声嘶力竭的一吼相信是绝大部分看过此片的人对影片中印象最深的镜头了。为自由而战的战争史诗！
131,勇敢的心,5,"为自由而战的生活，我们永远也不会懂。
但是我们的一切平和生活，都是那些为自由而战的人换来的。"
132,勇敢的心,5,梅尔吉普森是个才子 最后的那声freedom把我都弄哭了
133,勇敢的心,5,场面挺经典壮观的~~我是在他被背叛的时候留下的眼泪，英雄之所以为英雄，可能也是历史造就的把
134,勇敢的心,4,终于完完整整的看了一遍。发现不那么激动了，它并不像它原声那么辉煌，我就不明白，一个王后怎能如此简单的喜欢上一个农民起义领袖，而对华莱士的塑造仅仅停留在那几句口号和所谓爱情之上，其实不够丰满。当然，勇敢的心的确是华莱士值得人们尊敬的地方，对自己的理想永不放弃。
135,勇敢的心,4,虽然对历史进行了不少的艺术加工，但不失为一部不错的片子
136,勇敢的心,4,"每个人都会死,但不是每个人都能有意义地活~ ps 王妃也太太太美了吧"
137,勇敢的心,5,以前一个朋友跟我说没看过这片的人就等于没看过电影，现在我也想说这句话！经典无须多说，就在华莱士喊出“freedom”时，我身为女人也澎湃了！    打一分的人莫非不是有病??
138,勇敢的心,4,I'll never lose my heart. So I'll never lose you.
139,勇敢的心,5,"这是警察叔叔最爱的电影，我想男人都应该喜欢这样的电影。
如果我也有机会做这样的英雄。。。。
他留在记忆里才是最美好的，就像警察叔叔一样。"
140,勇敢的心,4,"商业就商业..随他去吧..
那结结实实地一吼相信很多人忘不了"
141,勇敢的心,5,如果让Tik来演Mel Gibson的角色，谁又能演Sophie Marceau的那个角色呢？
142,勇敢的心,4,真的好看，正能量满满，经典之作，ost好听，值得收藏。
143,勇敢的心,4,说到爱尔兰、苏格兰等地区大家都是赞不绝口，感觉以前这个世界就是围绕着不列颠展开斗争的
144,勇敢的心,5,好莱坞已经把历史+英雄+壮烈的结局，三者结合的本事掌握得炉火纯青了
145,勇敢的心,4,现在看此片bug当然很多 各种模式甚至逻辑不符 之所以奉为经典不是因为苏菲玛索 或梅尔吉布森 而是因为华莱士为了自由的信仰奋力抗战 愿为自由而死。在我们的国度无所谓自由 不乏自由的信仰 但无人有能力与魄力为此而不惜一死。政治沦为个人野心工具 而不是大多数人利益 无论如何智计百则丑陋不堪
146,勇敢的心,5,又看了一遍，满腔对背叛的仇恨和对自由的向往，凝聚成最后的一声悲吼，freedom~！
147,勇敢的心,5,理想主义者的史诗，他无愧于自己的一生。华莱士之所以失败，是因为还抱有真善美。他有勇士之能，谋士之智，却无老奸巨猾之品行。也正因如此，方显可歌可泣的英雄本色。
148,勇敢的心,5,故事线4分。    特别喜欢在一路进军的高潮时突然给予一次沉重打击的转折，很现实性！     最近在看为什么国产电影走不出去，到主角上行刑的时候意识到，国产电影强调一个主角，没有一条价值贯穿故事，此时必定有劫法场的情节；好莱坞强调一种价值观，所有的内容都在围绕价值观展开，至死都在喊自由！
149,勇敢的心,5,第一次在明珠台看的，年纪还很小不太懂历史，但瞬间被吸引住了。威廉・华莱士高呼自由的一幕真是默泪，结果几百年后苏格兰公投不独立。。。PS：苏菲・玛索好美啊！
150,勇敢的心,5,"Every man dies, not every man really lives.
"
151,勇敢的心,5,影片根据13世纪末发生在苏格兰的真实事件改编而成。故事主人威廉・华莱士，不但确有其人，而且他的英勇事迹更使得他成为苏格兰的民族英雄。对于这种电影，不喜欢的人会往死里骂，我不幸看得很嗨，特别是梅尔・吉布森喊出“Freedom！”的时候，眼角有翔划过。所谓的史诗大片就应该是这样的吧。
152,勇敢的心,5,朋友说，男人都喜欢冷兵器时代，我想这是我喜欢这部片子的最重要原因。
153,勇敢的心,5,经典就是经典！！！虽然我觉得burce老爸也有道理，wallace利用王后对她的爱慕也很经典，wallace一直对m的爱不变也很感人，burce的年轻与对父辈的不理解也有点遗憾。但是，此片最大的感动在于对于自由的追求。那是狂野不羁的心与饱满奔放的勇气的融合！！！我爱我的祖国！！我是自由的！！？他是自由的
154,勇敢的心,5,第一次看这个片子是去海运学院探望同学，然后受邀一起看了这部片子，只记得当年的感觉很震撼、很触动内心，有机会再看。
155,勇敢的心,5,记得高中好像看过，不过大学还是又看了一遍，处刑时候那句Freedom太震撼了
156,勇敢的心,4,毫不夸张的说，是这部片子让我爱上了电影。在一片“mercy”声中我听到了这部电影里最清晰的一个单词：FREEDOM！我确确实实被打动了，心里涌起了自己现实中很少有的强烈感情，惊涛骇浪，风起云涌。苏格兰风笛在我耳边久久萦绕。我第一次明白电影可以让我的世界无限扩大。
157,勇敢的心,5,经典的战争史诗片，塑造了一个追求自由宁死不屈的英雄，战争场面虽不如指环王但很有气势，节奏略拖沓★★★★☆
158,勇敢的心,5,不知道我怎么会被这么刻意煽情的片子所感动，每次在华莱士喊“freedom”的时候都有一种浑身颤抖想哭的冲动。
159,勇敢的心,5,即使多年后，光看这句台词，都会被感动到。 “如果战斗，你们可能会死。如果逃跑，至少还能……多活一会儿。年复一年，直到寿终正寝，你们愿不愿意？用这么多苟活的日子，去换一个机会，就一个机会。回到这里，告诉我们的敌人，他们也许能夺走我们的生命，但他们永远夺不走我们的自由。 ”
160,勇敢的心,4,当时纯粹是为了配乐看的 至今也可能只会因为配乐去看 我不想日子过得苦闷
161,勇敢的心,5,绝对是经典中的经典，又一部让我看了无数遍的电影，梅尔吉布森的形象也是通过本片在我心中树立起来的。并时刻提醒我永远不要忘了，在行刑台上高喊的自由。
162,勇敢的心,4,剧情跌宕起伏，背景音乐太震撼了。
163,勇敢的心,5,剧情，演员，内涵，导演，配乐都一级棒！在感动之余最搞笑的笑点就是短腿爱德华国王把那个纸上谈兵的家伙从窗子上扔出去。。。。。
164,勇敢的心,5,英雄总是要死得感人才更贴合形象，华莱士也是一样，为了自由奋不顾身的姿态在最后受酷刑的时候尤为突出。从小耳濡目染，即使长大之后只想回村子过小日子，也还是抵不过大势所趋，英雄总还是英雄，带来自由和独立。其实每个战争都会牺牲很多人，只看他们为之而牺牲的事情是否值得，死可轻于鸿毛亦可重于泰山。经典果然是经典，任何经典的战争题材影片都是很引人入胜的，就算是不太爱看战争片的人也会被吸引的。苏菲玛索在里面真是美得呀~~~梅尔吉布森的发型有点雷，其他都很好~
165,勇敢的心,5,结局的freedom真是给人极大的震撼，美国的自由思想，给当时处在世界观价值观养成期的我以极大的裨益。
166,勇敢的心,5,史诗般盛大的传奇，撼动人心的男人。在宏大的历史背景之下，故事的真真假假并不重要，当手中紧握的手绢随斧头落下滑落，当华莱士冲着人群中的“美伦”对视微笑，时间便已凝固。
167,勇敢的心,4,看一次湿一次...几个freedom煽得转不过来
168,勇敢的心,5,虽然影片很长，但并不觉得拖沓。悠扬的苏格兰风笛，梅尔吉布森深邃的眼神，还有苏菲玛索倾世的容颜。
169,勇敢的心,5,优秀大片。在梅尔吉布森的硬朗轮廓和坚毅勇气下，华丽丽美男帅哥全部相形见绌~苏菲的含泪的眼睛有着惊为天人的美丽，就是戏份少了点沦为大花瓶。不得不说，结尾煽情得很够分量。这是一部男人的电影。
170,勇敢的心,5,"一个真正的男人，
线条犹如苏格兰绵延的群山，
冷峻而温情，
一个为了所有的人而抛弃了自己的人，
把一生献给了那个不愿做奴隶的民族，
直到生命的最后一刻，
他的爱和信仰，
如同他手中的剑，
从未颤抖。

"
171,勇敢的心,5,最后的呐喊 FREEDOOM 惊世骇俗 振聋发聩
172,勇敢的心,5,那一声Freedom把我的心都叫碎了。。苏菲玛索也很亮眼。话说，这样的男人怎么可能让人不爱嘛
173,勇敢的心,4,真正的史诗片，配乐大气，风景壮美。虽然与史实有不少的出入，但是，影片展现出来的追求自由的精神深深的感染了我。华莱士死亡的结局是影片最好的处理方式，更能表现出剧中的人物性格。当然，处理配角的时候也有照顾不周全的瑕疵存在。
174,勇敢的心,5,还记得帝国时代2里那勇敢的威廉.华莱士么？看过本片会让你对他有更深刻了解。而就向他在影片中所讲的for freedom，自由也成了不变的主题！
175,勇敢的心,5,在苏格兰独立公投之际看还挺应景。感觉这应该是长达三小时的影片中我最爱的一部了，丝毫没有任何乏味感。我真是对于传递自由精神的电影毫无抵抗力，一句嘶声力竭的Freeedooom响彻云霄。本片和史实出入还是挺大的，但这无疑是一部优秀的电影。太爱梅尔61吉布森。罗伯特也不错。华莱士和王妃略狗血。
176,勇敢的心,4,外国人就是喜欢大喊自由，至于是否自由不得而知；不过相对来说国人连喊都不喊，只能说连点血性都没有了。
177,勇敢的心,5,这是一部亏欠很久的片子，最近才看，忽然觉得不管是多年前的《勇敢的心》还是当下的《阿凡达》里面都贯穿着一种价值观，或许这就是美国的一部分，那个用电影为载体向世界各地大张旗鼓又悄无声息的传递信息的普世价值。
178,勇敢的心,4,【9分】观影时间更早，大气磅礴的史诗巨著，此片之前对梅尔吉布森的印象只来自《疯狂麦克斯》和《致命武器》两个系列，感觉他只是位二线的肌肉男。看了此片才知道他不只是个演员。
179,勇敢的心,4,“暴食”、“贪婪”、“懒惰”、“嫉妒”、“骄傲”、“淫欲”、“愤怒”，这是天主教教义所指的人性七宗罪。城市中发生的连坏杀人案，死者恰好都是犯有这些教义的人
180,勇敢的心,4,这片以前是一致的认为好，现在又成了意见不一，不过我觉得，很多人被感动，这和音乐有很大关系，威廉华莱士的悲壮，全靠音乐烘托而出。
181,勇敢的心,4,"场面,场面,还是场面,其他就剩几布森的表演了"
182,勇敢的心,5,小时候不懂，觉得有什么好看的，不就是穿裙子的毛汉子打打杀杀。长大了以后，才知这是一部为自由而战的血泪史，塑造了光影间最为男人的英雄传奇
183,勇敢的心,5,自由万岁，就爱这种不羁放纵爱自由。PS：苏菲玛索真不是一般的美，奥黛丽赫本太甜，玛丽莲梦露太辣 ，而苏菲玛索有淡如茶般的美得那么自然耐看
184,勇敢的心,5,"为了所有的人而抛弃了自己的人就是英雄.
历史的代价是惨重的，人类用血铸造辉煌，用血铺垫和平.
“Fight,and you may die.Run,and you''ll live at least a while. 
　　　 And dying in your beds many years from now. 
　　　 Would you be willing to trade? 

　　　 "
185,勇敢的心,5,有吉布森就够了  忘了  还有那首苏格兰风笛的 For the Love of a Princess
186,勇敢的心,5,是成长，是历史，是对自由的向往。这是被人们所追逐，永不息灭的理想。
187,勇敢的心,5,Freedom!自由是如此的可贵而令人向往，以致让人失去生命也在所不惜！――不过据说历史上真正的英雄其实是那个苏格兰王子，真像如何？待考……
188,勇敢的心,5,惊为天人
189,勇敢的心,5,高中时老师放的，但是对于这段历史不是很了解，看完后对电影配乐倒是印象深刻
190,勇敢的心,4,苏菲和maggie Q长得很相像！
191,勇敢的心,5,"引用一句老话:""生命呈可贵,爱情价更高,若为自由固,两者皆可抛."""
192,勇敢的心,5,老片子，没什么好说的，经典！！！！！！！！
193,勇敢的心,4,@片子好在哪e在]看出怼Ｔ谖铱恚梅吉布森的女人根本不必出F。第一女人的死解了K格m立Щ鹚鳎第二女人的出F只樽英格m王喜爹，@在太荒了。不н@N往v史上屎的。
194,勇敢的心,4,我以为我不会爱上那样潮湿荒蛮充满宗教的地方
195,勇敢的心,5,这部电影无论是在哪个方面都令我很信服，震撼啊。男主角拍得有血有肉，战争场面那是一个惊心动魄，身临其境。更何况在女主角方面也没让我失望，苏菲・玛索那是一个美啊~！
196,勇敢的心,5,this is just the kind of movie that i would say it's perfect yet will never see it again.
197,勇敢的心,4,一直断断续续地看过，昨天在去往alicante的火车上终于完整地看完了
198,勇敢的心,5,"高一的时候报过一堂影视欣赏课。
大都和同学聊天度过了。
唯一记得的就是，某个周六的早上，在诺大的教室里，和密密麻麻的人一起看完了这部勇敢的心。
苏菲玛索演得王妃太美了。"
199,勇敢的心,5,看了烂片的弥补！！ all for Wallace
200,勇敢的心,3,其实觉得一般来着
201,勇敢的心,3,剧情很扯淡，砍人很好看
202,勇敢的心,3,"结局华莱士被砍头的瞬间，我仿佛看到了屏幕上打出了""(此处有眼泪)""的大字，犹如一场精心编排的真人秀；使这片子不落于平庸的其实是几场清晰明了而又荡气回肠的战役，冷兵器的对决看上去永远热兵器更加震撼而血腥。"
203,勇敢的心,3,女人的爱情悲剧之一就是爱上一个真正的英雄。
204,勇敢的心,3,比较一般，可能是在家看所以不震撼
205,勇敢的心,3,说是经典，但我真的欣赏不来，剧情对我来说太枯燥了，场面倒是还不错！
206,勇敢的心,3,"苏菲玛索回去后一个人走着都傻笑的样子，一德说＂这就叫恋爱了呀。"" ，另外的段子：我问""他们都为什么穿的像扑克牌一样？""一德说＂因为扑克牌是照着他们画的。＂"
207,勇敢的心,3,除了片尾的freeeeedom，为自由而战这个主题表现出来的东西真是少之又少。
208,勇敢的心,3,虽说是好评如潮的“大片” 可我确实花了好几天才看完它 中心是为了自由而战 前半部分是为了爱情而战 总之 没有我预想的震撼我 记得很多年前看过《特洛伊》比这个更吸引我 
209,勇敢的心,3,never my fav. types of movies
210,勇敢的心,3,重新看了一遍，还可以。中世纪战场什么的，还是挺有意思的，也没有什么出纰漏的镜头。政治阴谋的部分，所有的对立都压在两个老头子身上，这些戏就略单调了，室内剧味道浓
211,勇敢的心,3,又一部冠冕堂皇的无感佳作，我想说这片子的主题是好的，但总在不经意之处闪耀着“装B”二字！
212,勇敢的心,3,这部片子不如dvd完全手册和网上评论的这么完美。但相信看过这部影片的人都会记得主角在死之前喊出的那声Freedom。
213,勇敢的心,3,"还记得高一那年,在教室只看了前半个小时，它的音乐和画面一下子让我震住了。而后拼命地找碟想看完这部电影.当我终于看完的时候，发现它给我的震撼似乎也永远地停留在了那前30分钟的音乐和画面..."
214,勇敢的心,3,不想看第二遍的电影
215,勇敢的心,3,美国大片啊，让我记住了苏菲玛索的名字。就这个战争场面，唉还是中国人口多的看着舒服。说白了不就是娶了一个老婆然后老婆被敌人杀了才奋起反抗然后又上了敌人的老婆最终解放了苏格兰么。。。外国人几把大很大程度上是因为他们古时候就没有穿内裤的习惯
216,勇敢的心,3,史诗算什么东西？
217,勇敢的心,3,"生命诚可贵,爱情价更高,若为自由顾,二者皆可抛。”的最好诠释~
苏格兰风笛实在太幽怨~
但是怎么说，没有想象中的震撼，总感觉前面的战争描述些许冗长，细节描述又不够，激情（虽然基本不激情）场面没有必要，为了自由这个口号也是…有些程式化~
不管怎么说最后喊出FREEDOM的时候还是挺振奋的~英雄赞歌~"
218,勇敢的心,3,两个喜欢的点：1.小美伦给小威廉姆送花的时候，小威廉姆哭的样子；2.我爱罗伯特布鲁斯！！！！！！！！
219,勇敢的心,3,风笛声是彻底听腻了，有些导演想拍史诗结果拍出来就让人觉得他是神经病，这位就是，这部不是史诗，只能叫恶搞，导演肯定有暴力癖。白刷刷的场面刚在香水中看过，这里又来了
220,勇敢的心,5,少年时代的初看与十多年后的重温感受完全不同，可能在某些「历史的相似点」中有了深刻的「感同身受」，吉布斯在导演生涯的伊始就抓住了「历史的烂漫与残酷」，关于苏格兰战争或者华莱士本人的历史考证完全被「架空」，唯有对「自由」的向往与牺牲是永恒人类情感与价值观上的爆点，也是艺术创作中「史诗」最能够打动人心的地方，甚至于其「煽情与鸡汤」的手法如今看来反而更加真诚、纯粹。
221,勇敢的心,3,"给三星是因为这片子音乐不错,服装不错,外景不错,以及有Sophie Marceau,但是我觉得当年真不该给那么些奖,也不喜欢梅尔吉卜森"
222,勇敢的心,3,#火车上看的电影#大一那年在图书馆看的，当时好激动好激动，怎么有那么好看的电影！现在重新看了一遍，也就一般般。
223,勇敢的心,3,看电影要趁热，先在看来这片除了那句freedom和苏非就没有亮点了
224,勇敢的心,3,这电影不过如此……漫长的电影就为了讲所谓男人对自由的追求与梦想……太空洞了~~~另外，那个鸡巴影评很中肯很到位。
225,勇敢的心,3,Freedom到底价值多少，我已经不想知道了，但是对拿起刀就砍人头的暴徒，却越来越厌恶，不管是为了什么理由。
226,勇敢的心,3,"我就不明白了 怎么莫名的就要freedom了
anyway明天去斯特灵"
227,勇敢的心,3,冗长乏味的外国史 看外国人冷兵器时代的战争是种折磨。
228,勇敢的心,3,真心觉得一般
229,勇敢的心,3,话说这是在那谁那看到的后半段，然后我就完全不想下这片看完整了。。
230,勇敢的心,3,记得当年还小，看的时候，记得了这么几个细节。。。贵族的领地初夜权，爱德华皇太子是个GAY，太子妃喜欢上了华莱士==，我果然是恶趣味啊，专门记得这些。。。
231,勇敢的心,3,邋里邋遢的好莱坞大片，当时还有人嫌弃画面色彩脏，等到了魔幻时代就不说话了吧。
232,勇敢的心,3,据说是最让人荡气回肠的片子，但是我完全没有兴趣看完。要不是苏菲玛索演的那个美丽的法国公主的出现我想我一半都没办法看下去。最后我还是没把片子看完。
233,勇敢的心,3,这片儿不是一般滴一般啊，为毛那么多人给高分……我觉着也就是苏菲演的法国母狼还比较有看头，她老公爱德华二世的下场是被烧红的铁条插PP，这个史实恐怕说明他在和同志们的关系中到底是个受吧！窃笑！
234,勇敢的心,3,一叫华莱士，我条件反射地要想起那个山寨鸡啊啊啊啊啊！
235,勇敢的心,3,看着像是《巴霍巴利王》那种神话传说，原来是对历史人物的意淫之作，以现在的眼光来看一般，如果是小学时候看估计会挺激动的
236,勇敢的心,3,全片平淡如风景片，结尾所谓的高潮用力过猛。BGM真心好。
237,勇敢的心,3,这片的历史其实一塌糊涂，就是看个意思，话说苏格兰军队当年也没像影片中那么寒碜啊。
238,勇敢的心,3,也许只是身不由己的悲哀。此外影片的讲述视角真是奇怪
239,勇敢的心,3,历史上的这条爱德华二世最后可是被那彪悍的皇妃拿根烙铁硬生生把菊花捅爆了，杀猪般的叫声响彻整座城堡。唉，光想想就菊花一紧
240,勇敢的心,3,苏菲・玛索真漂亮啊！电影虽好，但不喜欢杯具~
241,勇敢的心,3,将近三个小时就为了一句freedom。我理解爱国主义 民族主义在那个环境中的重要与先进与伟大，但放到当今社会，这种“主义”其实更多的是产生偏见和膨胀而不是自由，所以没有那么强烈的共鸣，也不假装懂得这种freedom的伟大。最后一幕被我自己的情绪感动了，电影其实很好莱坞 三星吧
242,勇敢的心,3,除了苏格兰风笛和男主死去妻子的长相，没找到任何一处我喜欢的地方，但又无法说它无聊扯淡或愚蠢谬误，尚在纠结中
243,勇敢的心,3,好热血好单纯，想起了初中的英语老师，梅尔迷啊。
244,勇敢的心,3,可能是连着看了好几部史诗片，有点审美疲劳了。
245,勇敢的心,3,曾经把你当做我的最爱，往事不堪回首
246,勇敢的心,3,一声“自繇”的嚎叫俘虏了多少文青的心啊
247,勇敢的心,3,卖糕的我和老师想法完全相反，音乐确实很好听可是觉得煽情的过分了前半部分的音乐和剧情很不搭。不知是反映效果还是怎的感觉像是和《天堂之日》一样早上取景拍摄和晚上，整体色调很暗沉。英雄主义，宗教色彩，苏菲玛索。
248,勇敢的心,3,可能看电影已经看出了惰性，这种片儿已经震撼不到我了，非要看些重口味才行么。
249,勇敢的心,3,他是为耶稣而战？还是为死去的父亲而战？还是为死去的妻子而战？还是为自由而战？还是为苏格兰而战？还是为历史而战？还是因为得罪了士兵破罐子破摔不得不战？如果没有历史作证，这部片看起来更像是在为导演而战。
250,勇敢的心,3,人家能拍出freedom的电影，这是我们国度拼命打压的！苏格兰风笛很美，篇幅过长了。
251,勇敢的心,3,有人掉泪了？能不能告诉我为什么
252,勇敢的心,3,美国人拍史诗片 个人传记 总会有意无意曲解他 成为导演单方面的叙述理解  很难还原客观真实  梅尔吉普森只不过把心目中的英雄强加到华莱士身上罢了
253,勇敢的心,3,某人又得说这是政治幼稚，去他妈的政治幼稚！还有，别跟在后面瞎叫唤什么freedom。你也太抬举这片了。
254,勇敢的心,3,一般般，就是几个场面拍摄的不错，电影语言很棒，但是故事太单薄了，纯粹的个人英雄主义
255,勇敢的心,3,"例行吐槽：几根破木桩完爆重骑兵冲锋，这不科学啊。前面还在跟妹子""i will love you my whole life, you and no other""后头就把太子妃日了。行刑确实很煽情，结尾还来了那么一发就矫情了。苏格兰风笛响了整三个小时。"
256,勇敢的心,3,从高中的时候第十放映室总是喜欢来来回回的不断放这部片。看了很多次，始终没有找到能让我感觉到震撼的地方。梅尔吉布森还是不太适合当导演吧。到现在为止，唯一让我震撼的史诗只有角斗士。这部太拖沓了
257,勇敢的心,3,喊一句freedom 已经成为煽情的重要桥段.......
258,勇敢的心,3,虽然Mel Gibson真的帅得出油，但是全片只有长腿爱德华的演技在线，太可惜了。苏菲玛索那演得什么东西... 回归影片本身，彼时电影语言已经发展了100年，本片使用3小时的长篇无亮点叙事，和众多不实情节以达到的所谓的创造史诗，恕我愚钝，我实在是看不出来这片为何会有这么高的评价。简直没法评论。当然，3星是因为这确实是好看的爆米花，但高喊“自由”谁不会呢。
259,勇敢的心,3,"剧情扯淡，苏菲玛索放进去就是不靠谱，我很不耐烦~ 要是类似的国产片，大家都要叫大烂片了……
"
260,勇敢的心,3,其实王妃苏菲马索和那个苏格兰女子谁更漂亮？
261,勇敢的心,3,风笛好难听…英雄标配就是一个平凡温柔的妻子以显示自己不是贪心的人，要的不多，然后再来一倾国倾城大美人的垂青，完了该干的都干了再表现下对妻子的怀念，多么忠贞不渝啊，当了婊子牌坊还立得高高的呢…回故乡第一天就在婚礼上看到新娘被抢走也丝毫没有反抗意识，还英雄？难道他原本打算隐婚一辈子？
