,movie,star,comment
262,勇敢的心,3,不符合历史，太过分了！！我家的女王哪有这样啊？！！
263,勇敢的心,3,一个鸡巴拯救怨妇的故事，这评论太搞了
264,勇敢的心,3,不是沾上史诗电影的名头就要拍超长篇好咩？3个小时好熬人的哟~剪辑不能更简洁明快些咩？推倒苏菲玛索足么就舍得用一个镜头啊我日？
265,勇敢的心,3,他自始至终是条汉子。一株自由的紫云英。不过有些角斗士的影子。
266,勇敢的心,3,前半段的沉闷是为了后半段的精彩！配乐相当棒~只是华莱士为了妻子而揭竿起义，却在战斗期间和公主发生了情感瓜葛？而最后死之前却依然看到的是妻子的影子？英雄果然不敌美人关啊~
267,勇敢的心,3,配乐很经典，苏菲玛索超级美
268,勇敢的心,3,我觉得一般
269,勇敢的心,3,每次穿短裙的男人们奔跑起来都很揪心，跑得再快就要打马赛克了……音乐很好听的美国快餐片
270,勇敢的心,3,呃 我爸说超棒的电影 我没感觉。。。
271,勇敢的心,3,我又可耻地腐了…………就冲着这片儿的长度活生生也得减一颗星嘛。。。
272,勇敢的心,3,比较假...唯一出彩的是sophie，可惜也没有伊的其他表演出彩
273,勇敢的心,3,这么拖沓的电影可不可以理解为当后期时，导演看母片，“卧槽，老子演的真么特帅，都留着都留着！！！”
274,勇敢的心,3,喜欢里面的爱尔兰长笛，恢宏的气势
275,勇敢的心,3,还行  FREEDOM喊的满响 不过有点过 太让人感觉形式化 
276,勇敢的心,3,先看的爱国者。所以先入为主。
277,勇敢的心,3,苏格兰大气磅礴的历史史诗，其实也就是冲冠一怒为红颜的古老故事，什么西方文明、东方文明都一样，谁也没比谁好那儿去。其实就是很那什么原始未开化，说的那么王者什么，哪儿有压迫哪儿有反抗，反抗也是为了新的压迫。三个小时的冗长，什么勇气都耗没了！
278,勇敢的心,3,梅尔・吉布森那张老脸影响了我的观感
279,勇敢的心,3,"那句""feerdom ""怎么就那么做作  一点没觉得经典"
280,勇敢的心,3,说实话这电影除了OST我真觉得一般。
281,勇敢的心,3,freedom... 被涉世不深的室友严重推荐的电影 太拖沓了 而且有点小儿科 看来是错过了观影的黄金年龄 记得最清楚的是我抓了个彩蛋 有一个收拾战场的悲情场面，有个妞蹲在一个男人尸体旁边偷笑 我跟室友研究了好久 后来觉得这剪辑是在是很nb
282,勇敢的心,3,镜头非常美丽，主题很共产。
283,勇敢的心,3,"Every man dies, not eveyr man really lives."
284,勇敢的心,3,不喜欢战争片……但是苏菲玛索很美很美！！
285,勇敢的心,3,片尾比较让人鸡皮，我多半体会不到为国为民牺牲的感觉了。
286,勇敢的心,3,一个推销美国价值的片子，不知道为什么这么多人喜欢！N多年前的很多剧情都不这个华丽，为什么成为最佳剧情奖呢？这是无语了！
287,勇敢的心,3,"我记得在电影院看这个我睡着了,所以我不知道这个电影讲的具体内容是啥-=-"
288,勇敢的心,3,- - 跟爱国者没差啊。年代问题。苏菲玛索美惨了
289,勇敢的心,3,"""革命顶个球，鸡巴素王道"""
290,勇敢的心,3,2017年4月20日18:36:12，林平之拜师引用的配乐很不错.2017年5月29日15:31:14，三个小时，好长的时间，这部电影又是个人英雄主义，强调追随内心，实话说，这种战争描述可能不符合历史，场面上也跟印象中我国的战争不同，真的就像蛮夷一样。看电影的时候，一直想着的是去年英国公投退欧，苏格兰也要公投
291,勇敢的心,3,梅尔吉布森式教科书，史观是虚伪的，美式主旋律无违和嫁接。
292,勇敢的心,3,梅尔吉布森那金毛儿狮王造型跟这片儿一样主旋律的让人头疼。
293,勇敢的心,3,seems like everyone likes it...i just don't feel the same way...still too hollywood
294,勇敢的心,3,唉，典型的Mel Gibson，典型的美国大片
295,勇敢的心,3,个人英雄主义还是阻挡不了历史潮流
296,勇敢的心,3,帅是真帅，美是真美，难看是真难看，主要就讲一人，本想老实种地，怕看上的女人要被夺走初夜权，所以仓皇娶之睡之，但是老婆被杀，瞬间高举自由大旗，各种不服，毫无半点政治智慧，作死到底，最后他虚头巴脑的freedom也没实现，倒是最后通过他的基因载体点了题，老子的种鸠占鹊巢啦，什么大义凛然从容赴死，反正能延续DNA就赢了啦
297,勇敢的心,3,无爱。苏格兰要独立倒是真的，几百年过去，历史又转回来。
298,勇敢的心,3,自由是什么？机智勇敢跟政治是两回事。。。
299,勇敢的心,3,片风大气但节奏实在太缓 剧情有点晦涩 所谓的为自由战没能充分利用史实 热血太沉不易看见 制作倒是绝对精良
300,勇敢的心,3,音乐大赞 freeeeedoooom大震撼
301,勇敢的心,3,"2010.9.21 家 
终于看了，但真不明家俊同志要我看什么~ "
302,勇敢的心,3,血淋淋的战争场面做得很出色，情节也还行，但离满分还有一点距离。第一，男主在一开始的时候显得太老了，和第一位女主不太般配。第二，电影的主旨和情节都围绕着freedom，但我总觉得太假，高大全，这大概是美式英雄主义的硬伤吧。第三，严重扭曲历史，看了点评才知道真相，很让人误解啊混蛋。
303,勇敢的心,3,个人英雄主义。他连他的战马都不要了。马坠河了……
304,勇敢的心,3,最爱的还是茉朗对吧~另外编剧和男主什么关系！！
305,勇敢的心,3,威廉61华莱士很men！！！
306,勇敢的心,3,这种破片是美国拍的就突然高贵冷艳了起来，最后是突然穿越成后宫甄执了吗尼玛。
307,勇敢的心,3,困觉时最好就别自己看电影了，怪电影不好似的。
308,勇敢的心,3,苏格兰音乐还是不错的
309,勇敢的心,3,梅尔吉布森虚构历史系列……要是你和苏菲的床戏拍的长一点就4星了
310,勇敢的心,3,片子节奏也太特么慢了把！看的我都要睡了。三个小时电影还那么拖沓。吉布森当年对片子节奏控制真是烂。后来拍启示时候好多了。
311,勇敢的心,3,真把美国佬的个人英雄主义发挥到极致了
312,勇敢的心,3,很久之前看完之後lF影很神奇.
313,勇敢的心,3,男人该看的片．我不喜欢战争片儿
314,勇敢的心,3,不太喜欢这种史诗般的电影
315,勇敢的心,3,"作为史诗级电影，场面上显然还不够宏大，剧情也很单薄。
最后一句freedom升华了一下，但是显然民智未开，除了有文化的男主角，几乎没人真正理解自由的意义。
也许是我的眼神越来越犀利了，反正我找到一堆bug，一堆穿帮，硬伤啊。
苏格兰人民还真是落后，那都是几世纪了，难怪我们要称天朝"
316,勇敢的心,3,其实还好。。甚至有点俗。。。可是音乐不错
317,勇敢的心,3,古典主义叙事，调度的舞台感很重，苏格兰风笛的配乐不能再经典，足以瞬间将人拽回那个充满塑胶质感的 DVD、显像管屏幕和厚膜集成电路音响等等浪漫回忆的九十年代。
318,勇敢的心,3,看了，掉了眼泪，可是那并不代表我觉得这部电影拍得好。。。。
319,勇敢的心,3,梅尔吉布森的自我形象放大英雄主义的自恋之作~
320,勇敢的心,3,当年王斐考口语我讲了这个，其实我觉得难看死了好么……还有我英语烂的要死……
321,勇敢的心,3,所谓的淡都是扯出来的。
322,勇敢的心,3,对老布的freedom无感。
323,勇敢的心,3,有的片得分高多半在于政治上非常正确。配乐苏格兰风笛美，
324,勇敢的心,3,一部被过高评价的片子，整天高呼自由的口号。全片显得很冗长，尤其是前半段儿女情长的真心无聊，华莱士造型一副野人相，后半段出现了大场面战斗以及背叛与阴谋稍微精彩一些，但是华莱士的移情别恋真恶心，满口宣扬着与亡妻的情谊却那么快就移情王妃，被处决时又想着亡妻，这算什么？
325,勇敢的心,3,Freedom！
326,勇敢的心,3,必看的片子，但是我觉得剧情一般，需要有足够的历史背景才能深刻体会我觉得
327,勇敢的心,3,很经典的好莱坞大片，英雄、自由、战争、女人，但是看到那些热血沸腾的画面时却没有让我感动。电影塑造了威廉华莱士这样的英雄，却将历史丢弃到最角落，无数人受到这般误导而不自知。虽然电影是一门艺术，然而我认为有时候还是要在一定程度上尊重历史。片中的华莱士若真爱他的妻子，就不会和王妃有染。
328,勇敢的心,3,一开始以为这是一部好片，后来才发现Mel Gibson是一个篡改历史狂。他就是一个美国正统基督教意识形态的布道者。
329,勇敢的心,3,许多男人心中的好片。老美最喜欢拍这种宣扬英雄人性的片子。自己倒是不太喜欢这种男性个人英雄主义片，放在大时代背景里再找个美丽有身份的女性爱上他。套路虽老观众却受用之极。
330,勇敢的心,3,第二次来苏格兰高地游玩的过程中看完的，三个小时好长啊，很文艺，苏格兰的那种天高地广的景色配上风笛音乐真的很适合表达自由精神，挺感人的，不过剧情槽点实在太多了，特别是为了衬托William Wallace的伟大都把Robert the Bruce抹黑成啥样了，虽然他是storyteller，有点无语，还有男主和两个女人相似的感情戏看着很烦
331,勇敢的心,3,一直自由自由的喊~~~这真的是我放了很多年才舍得拿出来看的勇敢的心吗 太失望了 还以为看错了 但看看是1995年的片子 也非常不容易了 谢谢
332,勇敢的心,3,不知道是不是现在看多了一些视觉大片还是对外国的历史不感兴趣，总觉得此片在豆瓣评分有点虚高。是演的好，拍得好，还是剧本好？主观认为一般。而且看时还上网恶补了下英格兰和苏格兰的这段历史。按理革命是段很长的路，愣是让梅导压缩至2个小时以内。作为电影无可厚非，有些东西是应该长话短说。可此片总觉得力度差点 ，主角好像走马灯似的完成导演布置的各项表演工作。差点忘了：导演就是主角！咱就问问导演：演得这么急促，感情戏也是轻描淡写浅尝即止，是不是赶不上放饭的时间了！
333,勇敢的心,3,电影后半段除了那句FREEDOM都是狗屎！原创意淫的狗血偷情全都去死一死阿尔快去死一死你对不起历史对不起英国人民T皿T
334,勇敢的心,3,"多久没看这么长的电影了 画面很美 节奏很慢 冷兵器时代的战争 Courage Passion Freedom！
"
335,勇敢的心,3,梅尔和苏菲金童玉女啊
336,勇敢的心,3,这片很经典哦？应该是吧，大家好像都这么说。这片不是很深刻嘛？对啊，我等凡人领略不出来所以都是快进看的。这片你不是下了高清吗？必须的，2.12G看完赶紧删了，太占地方。这片你给三星？恩，有点高了是吧。
337,勇敢的心,3,依稀记得当时上大学的时候，第一堂多媒体课，英语老师就给我们放的这片子，人家说一句话，老师就按个暂停，再重复一遍，让我们跟着学，我去年买了个表
338,勇敢的心,3,其实很一般的一部片子，因为苏菲玛索梅尔什么的就火了，我就觉得他的民族主义很装B，临死的时候大叫自由~~也没有感动我。反而他和苏菲的恋情让我不爽，你死去的老婆要从地底下爬出来了呀~
339,勇敢的心,3,剧情挺宏大，结局太拖沓了。
340,勇敢的心,3,就是还行，今次而已，勇敢不止行为上，还有心灵的头脑的，不能做莽夫
341,勇敢的心,3,"两个多小时的电影导致我睡过去N次。。。直到苏菲玛索出场终于振作了点，但结局还是挺精彩的，虽然可以猜得到，但某些套路会让你跟着流泪得不亦乐乎。。。
"
342,勇敢的心,3,Mel Gibson自导自演的～鼓掌，还不错。
343,勇敢的心,3,我一直觉得接受不了这电影，精神倒在，但没觉得多了几个大远景就气势磅礴了。跟与狼共舞没法比吧
344,勇敢的心,3,"对这种男人类电影比较没有特别感觉 除了苏菲玛索美的。。实在没话说
"
345,勇敢的心,3,"not that good not that bad, gorgeous sophie"
346,勇敢的心,3,没啥大意思 可是够长的
347,勇敢的心,3,说什么史诗，扯什么自由，把一个故事讲得这么拖沓可不是靠结尾吼一嗓子就能蒙混过去的。 评分：C
348,勇敢的心,3,完全不明白这个片子怎么会这么高评价……
349,勇敢的心,3,不太喜欢血腥的
350,勇敢的心,3,电影太长了终于下决心看完了，从来都对这种洗脑的片子没有好感。口口声声的freedom到底在哪里我一点都看不出来
351,勇敢的心,3,第1600部！每到百部我总会选择看一部重量级的电影，这一次是追逐自由的勇敢的心。史诗，经典，信仰，前人已有太多的赞誉，奥斯卡的最佳电影也是对它最大的肯定了。还是希望中国能有这样史诗级的电影，毕竟民族的才是世界的，才更能打动人心，外国的虽好，毕竟还是差了点共鸣，另外配乐真心经典。
352,勇敢的心,3,不难想象美国人自由战士的狂热信仰，也不难看出自诩新欧洲人对旧欧洲控制的厌恶。君主立宪总是所谓民主联邦诟病的枪靶。而在民主专政制度下幸福生活的人们看来，那都该是资本主义糖衣炮弹作戏。
353,勇敢的心,3,奏O佳，雒莼趾搿Ｗ钺幔向 James Horner 致敬，一如AR士精神永存。
354,勇敢的心,3,佩服美国人的舆论宣传，快死了还不忘大喊，他是党员吗
355,勇敢的心,3,Freedom!
356,勇敢的心,3,就是战争场面还不错，主角之外的人物塑造也不错
357,勇敢的心,3,风笛的配乐听了三年才看这部片，片子感觉并没有超出预期。苏菲玛索真的好美。那个关于自由的呼号，显得好突兀~
358,勇敢的心,3,"从没完整的看过,所以我的评价很片面"
359,勇敢的心,3,我不明白经典的地儿在那儿   或许是我没有看明白   但这背景音乐煽情到我都觉得和这么MAN的片子不搭了   不过其实音乐挺好的
360,勇敢的心,3,"从没完整的看过,所以我的评价很片面"
361,勇敢的心,3,好莱坞拍史诗是没法全部使用正史，要不何来英雄形象，但这最佳音效实属名归，少些儿女情长就怕没人看了么
362,勇敢的心,3,Freedom 太矫情
363,勇敢的心,3,太血腥，战争好残酷。我们今天的自由都是老祖宗抛头颅洒热血换来的。a
364,勇敢的心,3,一个纯爷们儿各种狠，一个美女各种美
365,勇敢的心,3,感X不靠V。不喜g美式英雄主x影片。L景很美，音方典，打硬涣宋叶已。
366,勇敢的心,3,有某有略打打杀杀
367,勇敢的心,3,这部电影究竟好在哪啊？不就是太平天国农民起义么，前2/3基本不用看。扯什么freedom，搞半天你他妈还不就是为了女人么。豆瓣这简介简直坑爹，青年华莱士在哪里啊，尼玛一出来就是个中年大叔啊有木有。谁告诉我苏菲玛索是美女来着，村姑最佳代言人吧。
368,勇敢的心,3, cause dont like any kinds of heroism.for any reason even just describe the history.
369,勇敢的心,3,最好上刑那里拍得很好
370,勇敢的心,3,说不上来什么感觉 开头太拖沓 电影拍得跟电视剧似的.....  被震撼被感动也就是那么一点  一直在等着情感爆发 三个小时我等啊等  等到结束也没等到  失望.......
371,勇敢的心,3,就是因为他妈的片尾freedom才给你3星，太拖沓
372,勇敢的心,3,没有传送中的好，男人戏。
373,勇敢的心,3,我质疑梅尔吉普森的个人观点，他本人总是在他自己的电影中表达自己的私人想法，而这些观点却都那么的狭隘～～～
374,勇敢的心,3,很想说点“浩气长存”之类的话，但实在说不出口。感觉苏格兰起义不成气候，民族缺乏团结心，好不容易有了一个威廉姆华莱士，但也只昙花一现，什么都没有留下。历史的现实使电影失色不少。
375,勇敢的心,3,大学时上课放的
376,勇敢的心,3,"人家说经典，我也只是看了剧情，了解了个故事。

看斯巴达300勇士比较有感觉。"
377,勇敢的心,3,好色如我……uZ一定是：K菲索好漂亮！
378,勇敢的心,3,没明白最后是怎么折磨他的，不就是吊了一下嘛。。为什么他躺在十字架上还一脸痛苦？砍头前做了啥？
379,勇敢的心,3,。。。。现在对这种电影。。越来越没感觉。。。= =
380,勇敢的心,3,四星给最后一小时。   额。   爱情果然只有一次。
381,勇敢的心,3,没有想象中那么震撼，就是苏菲实在是太美了！！！
382,勇敢的心,3,当风景片看了= =女神年轻时候好美
383,勇敢的心,3,曾经有三个男的说过这是他们最喜欢的片子，我看了却没什么感觉
384,勇敢的心,3,貌似没有被该雄心壮志touch到....freedom!!!
385,勇敢的心,3,"It's a men's celebration, women are not in it."
386,勇敢的心,3,好吧，典型的史诗片，磅礴大气，铁汉柔情。但是，有的地方还是太煽情了，总体而言也不太对我胃口。
387,勇敢的心,3,看到热评里有一句评论说这是詹姆斯配乐巅峰，老詹的巅峰难倒不是《燃情岁月》么。抛开电影类型风格等等，只作为一个普通影迷来说，《燃情岁月》可比《勇敢的心》更实在，好看多。
388,勇敢的心,3,花了三天看完了这部被誉为“男人必看的十部电影”...如豆瓣网友说，片名应该叫做《勇敢的“杰宝”》，一切因此而起（初夜权），唤醒了对“自由的渴望”，然后反抗打打杀杀，主角光环把同妻太子妃折服，并怀了孩子。最后，这个“粗人”在尔虞我诈之中被俘，经典被斩首（此处赞暴君，太子根本无所谓）
389,勇敢的心,3,"自由
freedom"
390,勇敢的心,3,还成，配不上这分数。
391,勇敢的心,3,大片而已。“Freedom...”呵呵，想来这个喊声有些平板了。
392,勇敢的心,3,贵族们追求的就是利益最大化，哪管你什么激情与梦想～
393,勇敢的心,3,无感，就记得小时候两个小盆友采花的镜头很美，当然，这是不好的行为哈，小盆友们。
394,勇敢的心,3,太过教科书化的美式英雄主义...并没有被感动到，反而有点尴尬
395,勇敢的心,3,苏格兰 自由 独立
396,勇敢的心,3,谁能告诉我好在哪里= =。除了最后有点激情。
397,勇敢的心,3,相比许多史诗级剧作，战争场面不值一提，重在崇拜英雄主义。
398,勇敢的心,3,伟光正&配乐一流&高举“自由”的思想正确
399,勇敢的心,3,free！！~~~~~
400,勇敢的心,2,拖沓，剧情硬伤，一点没被感动到。还谈什么震撼，有的人真是太容易被震撼了。
401,勇敢的心,2,导得一般
402,勇敢的心,1,十年前就被这freedom雷翻了。。。本来想看在苏菲玛索这尊女神的面子上给个两星，可是你看看Mel Gibson，拍什么不好非要拍史诗，当了演员不够还要当导演，死了死了还要这么吼一下，豆瓣上居然还有这么多五星。。。你非得做得这么高调，我也没办法了。白瞎了音乐、风景和美女。
403,勇敢的心,2,无聊的电影~
404,勇敢的心,2,我认为这是史上最被高估的一部电影，它精彩、经典但远非伟大，Mel Gibson的处女作远没有之后的受难记和启示录留给我们更多，这也从另一个层面说明，奥斯卡的最佳影片奖选出的绝对不是当年最佳，而是’最适合‘，就像中国的某个ZF奖。
405,勇敢的心,2,漫长，无趣。
406,勇敢的心,1,石前发冷言于众，后谋私利于暗。启示录的反面。
407,勇敢的心,1,庸俗的我对这些打扮，这些场景布置没有半点感觉！sorry， freedom！
408,勇敢的心,2,没觉得好看，配乐不错，也很经典，以前经常听到。战争场面太小儿科了，像小孩打架……
409,勇敢的心,2,这部片，有两个让我非常讨厌的地方。当然，少女死去，屠龙的少年还在继续，没有比这个更热血的了。自由死生之约，失败却刻骨铭心。新娘要被英国贵族夺去初夜权之际，在苦苦挣扎的新郎耳边温柔的话语实在是美爆了，女性之美，是温柔的剑。还有小时候萝莉赠花太可爱了(o19ω19o)，还有女王滴下的泪。
410,勇敢的心,2,不够紧凑，情感调度也不够，历史被改的稀巴烂，主角非得用自己么，找不到好点儿的演员了么。
411,勇敢的心,1,每一个领导人都必须是个好的布道者――激励民心、创造理念、令人信服，百姓们只是想要安心生活吃喝不愁，但是英雄会告诉你这样还不够，你要为了“自由”而献出生命，反正人总归是要一死的。在起义的过程中，塑造关于英雄的神话更是必不可少。现如今，科技大佬亿万富翁政治领袖也在运作着同一套模式。马云说，996算什么，我每天工作不少于12个小时，阿里的员工难道只追求吃饱喝足买房就够了么，不是，阿里人是要“改变世界”的。没错，集体的力量足以改变，但这过程中牺牲的无数个体和小家的利益也没人关心。英雄，只要一个就够了，被碾死的蝼蚁却需要千千万。“自由主义”的确鼓舞人心了上千年。
412,勇敢的心,2,以后再没资格说“老子没看过勇敢的心”了。
413,勇敢的心,1,垃圾片。与教父没有任何区别。自由的意识是你看了这部电影就会有的？ 呵呵
414,勇敢的心,2,如果在10年前，我将打5星
415,勇敢的心,2,没什么意思，和角斗士比，差很多
416,勇敢的心,2,对于一个从小生长在没有Freedom的国家里，由于自己的麻木，看得很不感动。但是不感动不代表不理解别人对自由的追求。看不起自己不渴望也不准别人渴望的某些人。。。
417,勇敢的心,2,电影本身可以给3颗星的，但看了真实历史之后，就只剩2颗了……
418,勇敢的心,2,为毛评价这么高...我硬是看不下去，快进了都看不下去...也许以后会重新看
419,勇敢的心,1,你妹 被迫看了3遍  LZ恨死这个电影了
420,勇敢的心,2,欣赏无力。关键是所有的煽情点都能提前预知……
421,勇敢的心,2,不是那么的喜欢，总觉得前半部分的节奏显得特别奇怪。但描绘人对自由的向往，但是这一点就够打动人心了。
422,勇敢的心,2,无论战争题材还是个人传记都是很难驾驭的，但《勇敢的心》成功了。如果没有篡改历史，将是完美的电影。
423,勇敢的心,2,这部电影造神和意淫的功夫比d还过分，比抗日神剧还过分。抗日神剧和这部电影比起来，简直是小脚女人，太谨慎了。还拿那么多大奖？全凭政治正确。
424,勇敢的心,2,Why the fuck did I watch this movie for #3
425,勇敢的心,1,歪曲历史+好莱坞商业片的老套模式
426,勇敢的心,2,很多人真的很容易被感动
427,勇敢的心,2,"反正我觉得没意思
"
428,勇敢的心,2,被摄影的优秀戏剧！
429,勇敢的心,1,所谓自由，所谓正义；所谓忠贞，所谓荣耀；所谓勇敢，所谓英雄；所谓史诗，所谓大片。
430,勇敢的心,2,不想看起来像那些尖酸的影评人，但我的真实感觉就是观影三小时好漫长。可能看了一部假的史诗片，剧情拖沓，情戏进展得莫名其妙，唯一的亮点就是配乐。
431,勇敢的心,2,梅尔吉布森确实会拍战争大场面，故意这么血腥暴力却不知道颈动脉破裂血应该喷溅。很抗拒这种利用镜头和配乐煽动感情灌输理念的做法，何况还是一个美国人拍苏格兰人反抗英格兰人，不知当代英国人看了作何感想。有几处确实有点感动，然而感动得太扁平太廉价，不喜欢。#BJIFF2017 4.13@中国电影资料馆
432,勇敢的心,2,请问你在死前还有什么要说的吗？答：FREE！
433,勇敢的心,2,剧情硬伤太多，太多牵强的部分，让我无法投入。那一段千里迢迢极不合理的一夜情更是败点。也就是苏格兰风笛好听
434,勇敢的心,2,个人英雄主义的意淫片
435,勇敢的心,2,一点没被感动到。还谈什么震撼，有的人真是太容易被震撼了。
436,勇敢的心,1,"这么多血腥场面...那些马多无辜...马在长枪下死去,马被驱跳下深海,....3星都给配乐........."
437,勇敢的心,2,太一般了吧。。。怎么评价这么高
438,勇敢的心,1,风评很好的样子，撑着看了近3个小时真是满无趣的。。满破的。。烂片
439,勇敢的心,1,垃圾
440,勇敢的心,2,除了电影里美丽的风景和好听的风笛 我什么都不记得了
441,勇敢的心,2,不愧是最糟糕的奥斯卡金像奖，主角铭记的到底是自由还是爱情。
442,勇敢的心,2,what a shame
443,勇敢的心,2,音乐一星，还因为william保留那朵儿时的小紫花，我有些许感动，加一星。这部片真的真的很一般。拍摄手法像教科书上的例子，像政治书上的论断。
444,勇敢的心,2,虽然我喜欢这样的题材，但是Mel Gibson太不讨喜了。
