,movie,star,comment
445,勇敢的心,2,除了最后那句经典台词确实震到了之外整部片子简直荒诞，对历史的篡改到了令人发指的地步，对爱德华二世的误读，Wallace带有风月色彩的反抗意图，“法兰西母狼”竟然怀上了苏格兰人的种，最受不鸟好莱坞这种恶心巴拉的YY了泥马，然后我想说的是“勇敢的心”史料可考其实指的是Bruce呵呵。
446,勇敢的心,2,嗨 不喜欢那
447,勇敢的心,2,这样的电影竟然有人用“史诗”“巨著”“经典”来形容？！儿女情长硬是被升华成追求自由，真是服了男主角的悟性
448,勇敢的心,2,所谓自由的红色经典啊。
449,勇敢的心,2,风景不错，音乐不错，剧情很弱。
450,勇敢的心,2,名气太大反而失望 脑子都用到哪里了这个所谓的领导者 一腔热血就能打江山了吗
451,勇敢的心,2,结尾那句话让我恶心好久，太水
452,勇敢的心,1,我个人最讨厌的一部人们口中的“经典电影”，讨厌多余的爱情，还有最后男主角被大卸八块，一声freedom叫死了国王，荒唐！狗屁的史诗巨片。
453,勇敢的心,2,实在是觉得很一般……是群体的无意识让它有了这么高的评价？
454,勇敢的心,2,配乐很美，女人很美。冗长。
455,勇敢的心,2,太长 我记得我当时是分了好几次才看得完。可能是看惯了中国的拳脚功夫 一旦去欣赏欧美的动作大片 就感觉它们简单粗暴 反正我觉得还好。
456,勇敢的心,1,再也不逼自己看什么经典了 浪费时间
457,勇敢的心,1,这男的说白了就是没谋只勇，害自己爱的人白白牺牲的一角色啊
458,勇敢的心,2,"我真的是很~不喜欢这电影= =除了随意篡改历史、米利坚式英雄主义之外的一切都是傻逼、根本难以掩盖的沙文主义、玛丽苏到不行的所谓爱情和模式化的人物之外,穿裙子的梅尔吉布森和修女一样的苏菲玛索不要太丑哦.马脸梅尔叔叔也就不说啥了.苏菲玛索真是活生生让糟践了.要不是老师逼着写作业我死都不会再"
459,勇敢的心,2,一星给freedom，一星给配乐
460,勇敢的心,2,是部不错的史诗片 但是作为我对于它的理解 还是十分肤浅 或许不适合这类的风格
461,勇敢的心,1,"这绝不是我要的经典。。。不是我要说它烂
像吞了臭虫 一样无法继续"
462,勇敢的心,1,sorry，我没看到让我震动的，有一次跟大众观点不同的观影经历让我很高兴 而且期望太高失望也就越大
463,勇敢的心,1,我对华莱士先生的爱情观理解不能，仅此而已，坐等被喷
464,勇敢的心,2,说实话，从来没喜欢过这部影片，因为做作和矫情～～
465,勇敢的心,2,不快进简直要睡着，还不如去玩刺客信条。镜头在人脸上莫名其妙的来回切，浪费了多少胶片，还好意思三个小时的长度。人长得又搓又没演技，化妆又脏兮兮没法看。导演除了开场坐飞机拍了个俯瞰山河，之后全部镜头都是一人身高的拍DV的水平，断手断脚暴番茄酱假得连我都知道怎么拍的，这可是九五年的史诗大
466,勇敢的心,1,我果然善於和人[扭。一N好R]居高R下式的人文P眩一口史上最糟糕的K格m口音，@部影毫o疑是我一直以砩钌罘锤Gibson的根源。
467,勇敢的心,2,这是一部评价很高但我看不上的电影，只能这么说。要场面没场面，要振奋没振奋，男主角还很挫，像个野人。
468,勇敢的心,2,怎么说呢，在我心中，真正具有打动人心的力量的，永远是事实――不虚美，不隐恶。 然后最近真是有做关于各种freedom or right的探讨研究（总觉得这样说有点装），而这部电影表现出来的，在我心里，不太及格。
469,勇敢的心,2,究竟哪里好看啊，明明是烂片啊。梅尔吉布森这个种族主义者倒是在此片里一副人人生来平等的装逼样，操着一口流氓兮兮的美国口音还想混进裙子大军里。
470,勇敢的心,2,把一部史诗片当成了爱情片看，得出的结论这是个渣男
471,勇敢的心,1,可能是我对于这种电影实在厌烦，从头到尾高喊“Freedom”。而历史真是如此吗，没有吃饱穿暖的人类会去高喊Freedom，将此作为概念而号召他人吗？为迎合观众而强奸历史。
472,勇敢的心,2,一向对这种电影没感觉
473,勇敢的心,2,最后男主和苏菲那段算啥？！算啥啊？！！
474,勇敢的心,2,一般般的剧情还要这么长，露阳具露后庭真的是……还是苏菲玛索好看
475,勇敢的心,2,冲你3个小时那么长再多扣你一星
476,勇敢的心,1,这电影一直费力的把一个杀人狂塞进民族英雄的范畴里
477,勇敢的心,2,电影还算可以  风笛真好听 感觉出现的不够多啊  但还是想不到有何必要把它拍成长达三个小时的电影  对这种主题电影真心无感了
478,勇敢的心,1,一直对这种史诗巨著无感，主角都死了还看个鸡8
479,勇敢的心,2,三个小时太拖沓，而且很讨厌这样空洞地喊freedom，就像曼德拉漫漫自由路。但是苏菲玛索好美。PS港台的翻译片名什么shit
480,勇敢的心,2,大烂片我草 还没辛亥革命的口号响亮
481,勇敢的心,2,美国就那么博爱？
482,勇敢的心,2,很难真正喜欢。没有触动我心的东西，即便是“自由”一词的高喊，也无法撼动我对此片的定义：不知道自由为何物的人才会凭借厮杀来求取自由。哈姆雷特式的犹豫一定是不义的孬种。
483,勇敢的心,2,哎 打两心显得老子真没文化    ps.和黑暗中的舞者一样 有一部被神化了的电影 
484,勇敢的心,2,煽情段落过猛过冗破坏了叙事节奏的流畅性和整体性，叙事单元被拆分，整体观感比较断裂。但是战争场面拍得真不错。
485,勇敢的心,2,"勇敢的心
"
486,勇敢的心,1,烦屎了，去死吧破电影！！！！！！！！！！！！！！！！！！！！！！！！！！！！！！！！！！！！！
487,勇敢的心,2,FREE你妹DOM啊。昨晚看的我秒睡了。。。。。。
488,勇敢的心,2,这他妈都能拿最佳影片。。。
489,勇敢的心,2,女主角：你个老不死的，我告诉你你等着断子绝孙吧，我肚子里的孩子是男主的。。。。。。。。。。。。。。。。。。。。
490,勇敢的心,1,        说起来真是可笑，英国直到十八世纪才废除初夜权，什么为自由为理想！不过是杀了狗皇帝，自己当大王罢了。
491,勇敢的心,2,最后那个freedom我觉得有点傻。
492,勇敢的心,1,只有两个字来形容我看这部电影的感受啊 呵呵 谁特么叫你这么长还那么烂 导演我都怀疑你是不是大男子主义严重啊
493,勇敢的心,2,如果不是边打毛线我想我是不会看得下去的……英雄会死，这个可以猜到，男主不帅也就算了，还很长，英雄主义太强。
494,勇敢的心,2,Gibson的一贯风格 比起史诗的剧情 我更中意它的OST
495,勇敢的心,2,教科书一样乏味
496,勇敢的心,1,真不知道有什么好看的，各种的土？很想peta去泼红油，ALF去烧片场！！
497,勇敢的心,2,砍杀，大砍杀，泡妹，再砍杀
498,勇敢的心,2,"名头如此之大，史实错误之多，令人发指。灯塔国的宣传目的明显的太过分。13,4世纪的人，满口的“自由”。还让华莱士在肚子被切开的情况下喊话，不要假的太过分。唯有苏格兰风格的音乐有点味道，让我想起了在北风苔原练级的日子。"
499,勇敢的心,1,挖槽，绝壁不是好电影，老子写的影评被老师说的一无是处，尼玛我只能怪罪到电影了！！！！！
500,勇敢的心,1,好莱坞的历史题材影片一部比一部欠扁
501,勇敢的心,2,cliche！
502,勇敢的心,2,在我看来电影只有好看和不好看。
503,勇敢的心,1,真不好意思，实在看不下去这种渣画质，下载了又删除了
504,勇敢的心,2,男人看的片子 我看不懂 只知道看美女 那美女貌似是法国的女神
505,勇敢的心,2,前半段的情节还是相当紧凑的，节奏也很好，属于那种明明是个鸡汤故事你还是会认真看下去，后半段就开始各种疲软拖沓煽情。行刑那段看得我真尴尬。
506,勇敢的心,2,一切都凝聚在一声“Freedom”中。
507,勇敢的心,2,完全是歪曲事实的胡说八道，居然会被捧得这么高，佩服犹太人的炒作能力！
508,勇敢的心,2,真的各方面都很一般
509,勇敢的心,2,"我喜欢看到梅尔看到自己心爱的人死在面前那刻的表演,只是为对方盖去眼睛没有哭天抢地.至于后面那段大喊freedom什么的,我只能说,唉``是不是有家暴倾向的人都有点大男子英雄主义啊?"
510,勇敢的心,2,这种漏洞百出的战争片看起来真是闷= =   狗血剧情
511,勇敢的心,2,这么好的华莱士题材本可以拍成史诗，结果却是个歌剧，电影中处处不难看出导演没钱啊，但也不能拍成这样傻逼啊。。。
512,勇敢的心,1,我怎么就那么讨厌梅尔吉布森
513,勇敢的心,2,sh*t
514,勇敢的心,2,同样讲了一个关于自由的故事，疯人院给我了一个太精彩的故事，人性，本如此简单，但心却如此复杂，自由难测，不委屈就好
515,勇敢的心,2,其实两星不至于，我就是平衡一个得分，谁让这里这么多为片尾一句freedom无脑五星的中二病。但这片确实无聊的很，浓烈的好莱坞商业感跟古装史诗片本身气质是犯冲的。
516,勇敢的心,2,Mel Gibson这个意淫帝....闹了半天自由尼玛倒说说神马是自由啊！? 要不是看在有十分女神的面子上给你一分
517,勇敢的心,2,看金毛兽闹革命真的不养眼。。。
518,勇敢的心,1,赵本山导演的农民起义~
519,勇敢的心,2,没有戳中我的地方。赤裸揭示的战争太血腥了以及篡改了历史很不喜欢。
520,勇敢的心,1,神马不尊重历史的破片，看这么长就是在浪费时间，我更宁愿去玩Atari上的ET。。这部电影侮辱了我的光驱，这部电影的每一份拷贝都应该被烧掉！！！！！！！！！！！！
521,勇敢的心,2,好憎个男主角
522,勇敢的心,1,"胡编乱造，简直侮辱人的智商！
   除了煽情，我就没见到什么经典的东西，全片充满了美式主旋律，梅尔吉普森啊，我看了你的几部片子，你真的可以和唐国强比肩了，真的！"
523,勇敢的心,2,美国人拍英国人打苏格兰人的故事。  全片打着自由的旗号，干着睡别人老婆，攻打别人城池的事。 剧情走向基本不出预料，打斗场面相比现在也逊色不少。 又被高分给骗了。
524,勇敢的心,2,what the hell....
525,勇敢的心,2,很多人喜欢，我就是觉得俗，一身鸡皮疙瘩
526,勇敢的心,2,一颗星给投资，毕竟花了不少钱，另一颗星给吉布森
527,勇敢的心,2,还好。真实历史完全不一样……。“威廉61华莱士童年时，其父、苏格兰民族英雄马索61华莱士在与英军的斗争中牺牲，他开始接受父亲好友的指导，学习苏格兰文化和武术。青年华莱士（梅尔61吉布森）学成回到故乡，向美丽的少女梅伦求婚，不想梅伦被英军抢去且遭杀害。在广大村民“英雄之后”的呼声中，华莱士率众揭竿起义，并与苏格兰贵族罗伯结成联盟，但不久他发现，苏格兰贵族考虑的只是自身的利益。 ”
528,勇敢的心,2,K菲索――呆板的花瓶，男主――他跟史泰是同一人幔
529,勇敢的心,1,你杀的人，也有亲人。必须1星。1星给玛索吧。
530,勇敢的心,2,狗血的战争场面...一群傻子和一群白痴的战斗...高期望后的失望...
531,勇敢的心,2,受不了吉布森的这个造型。
532,勇敢的心,1,大部分美国电影都是中情局控制下的好莱坞生产的精神鸦片。详情见这本书《好莱坞内部的中情局》http://book.douban.com/subject/26370014
533,勇敢的心,2,没觉得好看，可能是我不了解那段历史吧
534,勇敢的心,2,很勇敢，但是一点点都体会不到震撼，震撼人心不是用嘶吼的 ，差评。
535,勇敢的心,2,梅大自己砸钱导演的电影，台词就一句，FREEDOM
536,勇敢的心,1,穿裙子的男人你伤不起
537,勇敢的心,1,"强行自由？永远只爱一个？三番两次相信贵族？弱小拥有和平？
女主和王妃挺好看的，那个贵族的父亲长的像鬼一样，不愧是跪久了的贵族。这一切和中国有些东西多么地像？"
538,勇敢的心,2,实在是不喜欢这种题材，还有这个男的跟美女搞，搞了又想到自己老婆
539,勇敢的心,2,这破片哪里有史诗的影子？破破烂烂的布景，破破烂烂的衣服，整个几百人的战斗场面忽悠观众。我们在那一千多年前就有几十万人的对决了。这个为了自己女人复仇的故事我可没兴趣。看的时候睡着了n次，断断续续看了4次才看完。10年前就有这个盘，一直不想看，英明啊！P.S.为了女神我多给一星。
540,勇敢的心,2,"我不是不承认它是经典
我只是想说我不喜欢经典而已．．
立志的片子比比皆是"
541,勇敢的心,1,看了一半看不下去了，太残忍了，对反映西方早期战争与决斗的影片总有点接受不了：简直是野蛮人……
542,勇敢的心,2,既然是史诗片，那就应该尊重历史
543,勇敢的心,2,剧情真的很一般，战争场面像村口热血青年的械斗，战争理由明明为了女人复仇，哪点看出是为自由而战？片子表达的所谓的感动和热血真的很牵强。
544,勇敢的心,2,= = 又被忽悠了
545,勇敢的心,2,一点也不好，挖掘的太肤浅了吧，还和历史有出入
546,勇敢的心,2,挺不喜欢这部电影的............
547,勇敢的心,2,没看懂，睡着了，看过两次，都睡着了。。。
548,勇敢的心,2,好长啊  配乐 台词樯橹似的要让你高潮  可就是无感啊
549,勇敢的心,2,95年能拍这样的史诗片，恢弘壮丽，宛如破势长歌，烈酒入热肠。主角华莱士的英勇无畏，天生适合领导，奈何敌方虽然蠢（至少在电影里透着浓浓的蠢劲）但势力强大，再加之友军墙头草，华莱士只能英勇就义。传记片不能纠结剧情，因为事实本如此，但，拍得不好看这锅历史不背。
550,勇敢的心,2,好难看
551,勇敢的心,2,恋爱恋得莫名其妙
552,勇敢的心,2,"看了其中的片段,不耐烦所以不看了.也许很多人是冲名气去看的吧。"
553,勇敢的心,2,一心想要树立正面形象，尴尬的是，并没有成功。贪心、纵欲、野蛮、愚蠢是主角的四大特点。所有历史架空名作里最烂的
554,勇敢的心,2,不知道支持苏格兰独立运动的苏格兰民族党是否会将此部影片定义为爱“国”题材教育电影。
555,勇敢的心,2,直男癌电影
556,勇敢的心,1,男主槔掀统穑喊著freedom召娟友打各N群架，把撤嚼掀潘了留下统鹬子，喊著freedom拿便。o聊死了。。。。
557,勇敢的心,2,诸如此类的史诗片都不是我的菜。。配乐很棒~！
558,勇敢的心,2,讨厌战争片！再也不看这种“史诗”性质的片子了，等我老了再看
559,勇敢的心,2,我真觉得不好看啊。挺俗的。
560,勇敢的心,2,典型的英雄主义……
561,勇敢的心,2,具他妈矫情……
562,勇敢的心,2,怎么就没觉得这部片好捏？
563,勇敢的心,2,观感完全是基于现在的眼光。历史上wallace也是领地主而不是平民，所以影片改编了一个最基本的史实来博取观众的同情心。改变事实没有关系，历史电影不一定要完全忠于历史，但这部片子更像好莱坞用苏格兰历史的幌子来激起美国民众对自己国家独立战争的记忆，以及煽动”从英国佬这斗争获取自由”而引起的爱国情绪。mel gibson有很多这种性质的电影，煽动民族主义情绪是很危险的事。此外，女性就是能做得很少、一直仰慕男主角，很纯洁很单纯这样的既定模式，不过那个年代主流电影的性别歧视比现在还要重更多，不提也罢
564,勇敢的心,1,打一星不是因为电影不好，恰恰相反，电影规模宏大，很精彩。华莱士作为一个领导者，不要爱情，不要权利，一心想着解放苏格兰，放在三年前或许可以让我热血沸腾。话说回来，大家都是成年人了，情怀这东西，陶冶一下情操也就行了，实际上上不了台面，这种毒鸡汤确实容易误导我等年轻人。
565,勇敢的心,1,我是第二次看这个电影了，第一次看是在2年前，那时我没有看下去，今天看是在2年后，我还是没能看下去，忍了又忍，太jb无聊了
566,勇敢的心,2,还好苏菲玛索长得美，不然这就是史诗级的大！烂！片！
567,勇敢的心,2,现在不打着自由的名号都不敢搞革命了
568,勇敢的心,2,两个女主都貌若天仙啊，可是我真不喜欢史诗型的电影，裹脚布一样。
569,勇敢的心,2,一部单纯的无脑爽片而已，充满了以大男子主义出发对史实的魔改，魔改的结果就是观感更像是属于男孩的YY，而不是属于男人的史诗。
570,勇敢的心,1,2015.04.12 有人和我说没看过《勇敢的心》的人生是不完整的。看毕，我呸。
571,勇敢的心,2,过分的大男子主义，看完真的很失望。
572,勇敢的心,1,对于自由的勇敢追求，苏格兰风笛的背景音乐，忧伤而又充满了力量
573,勇敢的心,2,苏菲玛索完全打酱油！
574,勇敢的心,2,狗血，无聊，我记得以前在杂志上还看到某位著名教授说“为什么其他国家能拍出这样的杰作，而我们的鸦片战争却拍不出来？”难怪当今抗战神剧这么多，这部被过誉的烂片的功劳不言而喻。我还发现一个豆瓣以及IMDB的有趣现象，评分高的电影评分只会越来越高，而低的基本越来越低，为什么呢？从众心理，一部电影你看懂后发觉就是无聊还不好意思给差评？
575,勇敢的心,2,"大场面,大片而已."
576,勇敢的心,2,这片就和听oasis的歌一样，充满口号……
577,勇敢的心,2,血腥残暴，革命势必流血牺牲，这终究不过是男人间的为权而战。
578,勇敢的心,1,吐的了
579,勇敢的心,2,刚到美国看这个片子的时候，还被这个片子感动了一下，尤其是Wallas高喊着“freedom”而死去的一刹那，让我唏嘘不已。但经过十多年对美国的民主和自由的体验，对西方做表面文章的说教慢慢产生了免疫，在回头看这个电影，对这个电影所反映的历史真实性产生了怀疑，尤其是和一下苏格兰的人聊
580,勇敢的心,2,刚到美国看这个片子的时候，还被这个片子感动了一下，尤其是Wallas高喊着“freedom”而死去的一刹那，让我唏嘘不已。但经过十多年对美国的民主和自由的体验，对西方做表面文章的说教慢慢产生了免疫，在回头看这个电影，对这个电影所反映的历史真实性产生了怀疑，尤其是和一下苏格兰的人聊
581,勇敢的心,2,看前充满期待，看完我满头问号。和历史相去甚远不说了，神经质一般的个人英雄主义也不说了，弱智如帝国时代2AI般的战斗也不说了，最关键的是，男主不是深爱女主嘛，为什么和敌人的儿媳妇又搞到一起？说好的真爱呢？作为男主真的可以为所欲为啊，真是一部意淫大作。。。为音乐和场景加一星吧，浪费我3个小时。。。
582,勇敢的心,2,原谅我只看到了个人英雄主义和大男子
583,勇敢的心,2,有点假。
584,勇敢的心,1,拉片课的噩梦。
585,勇敢的心,1,拍出了勇气气势，没拍出真实感，拍出了荒诞感，不知道编剧脑子里想啥，直男癌都有病吧，去你妈的男人的浪漫，我都不知道这个有什么浪漫的
586,勇敢的心,2,前面还可以，尤其是男女主的那段，后面好扯淡，看的不知道怎么会这样，感觉人设好假，华莱士就一定要臣服国王，搞什么名堂，还有男主和王妃搞什么飞机
587,勇敢的心,1,什么狗屁烂片
588,勇敢的心,1,详见影评革命顶个球，鸡巴素王道
589,勇敢的心,2,很一般的题材   除了最后30分钟还可以看看...
590,勇敢的心,2,对这种裹脚布式的“经典电影”“史诗故事”毫无感觉啊啊啊啊啊啊~~~
591,勇敢的心,1,大型直男导演意淫秀，从主角演技、叙事、镜头运用、情感处理统统烂穿地心！电影情感处理异常差，男主死了老婆还全程面瘫，要不是男主就是导演恐怕这种演员在剧组待不过三天；各种剪切混乱（我很怀疑导演还抢了剪辑师和编剧的工作），人物往往没有任何铺垫就出场，很多人死了我都不知道他之前是谁；王妃见了一面就深深爱上，千里送消息叛国；苏格兰美到溢出屏幕的风景被处理成城乡结合部，战争场面可不可以换个镜头换个角度拍啊，平拍真的很像街头斗殴啊。上一秒被锤到破相下一秒清清爽爽还刮了胡须可还行。是不是因为战争片少所以这电影才会被吹上天的。
592,勇敢的心,2,仿佛一提到自由就很崇高一样，我感觉还是中国的三国、楚汉更加有意思，至于本片，时间过长，节奏缓慢，男主角和苏菲玛索的感情太突兀了。
593,勇敢的心,2,梅尔・吉布森一辈子都在拍散发雄性荷尔蒙的故事，这是其中一部。只是，有血有汗不见得是英雄的故事。领主睡你老婆，你岁太子的老婆，这算是哪门子阿Q精神？ALL IN ALL只有剑还很牛的确够大，想起了斯。
594,勇敢的心,2,full of cliche
595,勇敢的心,2,没什么感觉啊 剧情很一般 没耐心看到底 电视上点播豆瓣高分里的 看到一半我还怀疑是不是系统出错把它放到这个高分文档里的 一颗星给苏菲玛索 一颗星给放到现在来看也不过时的场景画面
596,勇敢的心,2,3个小时的片，值得看的也就开头的1/3而已。
597,勇敢的心,2,我给了较差？！哈哈，我讨厌这片子
598,勇敢的心,2,不知道为什么这部电影评分那么高，也许投资确实很大，但不代表就是好看的电影，口口声声说自由，这世界上哪有真正的自由，就算有也只属于那些身家过亿的人罢了，小老百姓经常劳动生活，哪有时间说什么自由，真是太幼稚了，如果每个人都说自己要自由，谁TM还要上班，公司都TM要倒闭了，真是傻
599,勇敢的心,2,不合史实。性倾向歧视。
