,movie,star,comment
398,忠犬八公的故事,3,故事其实是感人的故事，可是拍出来真是找不到共鸣点。大狗真的好啊恩。
399,忠犬八公的故事,3,翻拍的一般
400,忠犬八公的故事,1,作为一条狗，也就这点出息。但人要去崇尚，就太没追求了。
401,忠犬八公的故事,2,补。一个感人的故事 拍出来却看的我毫无触动
402,忠犬八公的故事,2,翻拍！
403,忠犬八公的故事,1,@b狗很油....
404,忠犬八公的故事,2,坐在新竹威秀8d第三排看片，像是在看|很的IMAX，小八的大^我有NSr被吃掉的感X。M日本味的好R]片，清新恬淡感，有感人之，但影本身]什N有趣的^c和角度。
405,忠犬八公的故事,2,故事很好，电影不怎样。
406,忠犬八公的故事,1,"我和这些人看的是同一个片儿吗？
这片想说啥？日本是美国的一条狗吗？"
407,忠犬八公的故事,2,多出来的一星给真人真事。敢不把剧本编这么烂吗。
408,忠犬八公的故事,2,我更欣赏那个家庭中的温情。
409,忠犬八公的故事,2,美国人掌握不到日本人变态的细腻，整个电影拖沓且没感动点，不知道怎么拍出来的
410,忠犬八公的故事,2,动物温情片之中看过的最不感动的。对比之前的Maryley & Me也有差距。
411,忠犬八公的故事,2,眼泪赚来的评分是最不靠谱的。你只能说这故事很感人，不能说这电影很棒。
412,忠犬八公的故事,2,可能先入为主的原因，当时觉得没日版感人
413,忠犬八公的故事,2,一看开头就知道结局的漫长等待
414,忠犬八公的故事,2,忽悠啊，这种狗有啥特别啊，相对于那些帮助人，救过人命的狗狗！
415,忠犬八公的故事,2,没找到泪点 但李察吉尔很有型
416,忠犬八公的故事,2,不是我没爱心，可是我真的看到一直快进。。。。。
417,忠犬八公的故事,1,他居然能拍出这样的...让我如何与《狗脸的岁月》《不一样的天空》比拟呀...
418,忠犬八公的故事,2,完全没有感触的说```
419,忠犬八公的故事,2,感人，但我还是喜欢节奏快的。
420,忠犬八公的故事,2,不明白高分在哪里，，看了前十分钟，差不多闷到要睡着。。
421,忠犬八公的故事,2,Richard Gere还是很有魅力的 片子本身也不错煽情但不矫情 在狗狗的众多片子里算是独树一帜的
422,忠犬八公的故事,2,]看完啦其。我X得拍法有c日式...
423,忠犬八公的故事,1,剧情不俗套到了小学程度吗？为什么都觉得被感动了呢？
424,忠犬八公的故事,2,煽情煽到死= =。分数太高了，决定给个两星平衡一下。本来是三星的。超讨厌达赖的信徒李察基尔（他是男主没错，偶讨厌的是他长相）。跨种族人兽生死恋，嗯，88走好不送
425,忠犬八公的故事,2,不温不火
426,忠犬八公的故事,2,画面一般，故事情节无语无趣。
427,忠犬八公的故事,2,Y一句就是 美人B日本狗。。。好吧 可是看日本人不是很爽 就o四星吧。。。 @N影看不哭我。。。
428,忠犬八公的故事,2,烂片
429,忠犬八公的故事,2,"愈发发现我的泪点奇怪.都不哭的我哭,都哭的我不哭."
430,忠犬八公的故事,2,我就是不喜欢看慢节奏的温情片啊，看的我果断关电脑睡觉
431,忠犬八公的故事,2,做作又无聊。你以为是日本片啊！
432,忠犬八公的故事,2,剧情薄弱。一星给狗狗。
433,忠犬八公的故事,2,没劲
434,忠犬八公的故事,2,"2.5; An uncomplicated, unapologetic tear-jerker."
435,忠犬八公的故事,2,谁能告诉我 哭过之后还有什么感觉，纯粹就是哭，这种电影的价值也只能是让观众哭了，不怎么样，有多少人已经不知道为人而哭而为狗哭了
436,忠犬八公的故事,2,这么一部烂片，豆瓣上这么多人捧臭脚，可见豆友素质之低
437,忠犬八公的故事,1,镜头动不动就拍阳光，刺眼
438,忠犬八公的故事,2,so flat
439,忠犬八公的故事,2,2星给配乐……
440,忠犬八公的故事,2,先不论以人心揣测狗心是否立得住脚，这个片子本身很差劲啊，9.1是个神奇的分数。
441,忠犬八公的故事,1,小学时期看的一模一样的套路
442,忠犬八公的故事,1,看不下去。狗对你好，只是恰好对你好，因为你养了他，本质上跟你毛关系没有。你要是不养他，别人养了他，他也照样对别人好。有必要吗
443,忠犬八公的故事,2,说实在的，没有很感人。
444,忠犬八公的故事,2,是我泪点太高吗？准备好大哭，结果一点想哭的欲望都没有。为什么这个片子的分高成这样啊？
445,忠犬八公的故事,2,暮擅鳌Shall We Dance 到忠犬八公，Richard Gere o疑是c日本接|最l繁的W美男演T；Lasse Hallstr02m 一的心`u式拍法，依f]亮c，甚至X得有些做作。已美疲凇
446,忠犬八公的故事,2,不到位的感觉
447,忠犬八公的故事,2,这种电影肿么在豆瓣上这么高分啊。。。太奇异了。。。只是一个很普通的人狗故事。
448,忠犬八公的故事,1,看过2次，都看不下去，第二遍是快进看完的。对我没有吸引力。
449,忠犬八公的故事,2,两分献给表演杰出的狗演员
450,忠犬八公的故事,1,我不喜g用游昶狈浚f心
451,忠犬八公的故事,2,即使大家都说感人，看完之后我各种无感。不过某些地方还算细腻。
452,忠犬八公的故事,2,感人在哪里
453,忠犬八公的故事,2,sucks
454,忠犬八公的故事,2,根据真实故事改编的电影。当初的故事挺让我感动，但电影只有这一点故事是不够的，太干瘪了。
455,忠犬八公的故事,2,我觉得一定是太多人喜欢狗狗，评价才这么高
456,忠犬八公的故事,2,这部电影会更难看，如果不是因为这条狗的出色表演。
457,忠犬八公的故事,2,Don't know the reason... I can only say the story and act is good...
458,忠犬八公的故事,1,好惦记那只拍了小八的头的猫啊 还有这个教授有种干净的好看感啊 一比他女婿逊死了 对了 配乐难听啊 自以为温情地
459,忠犬八公的故事,2,把观众弄哭也不算好电影的标准吧。把
460,忠犬八公的故事,2,真的不喜欢，这是一部日本人在标榜自己国家的狗也聪明绝顶吗
461,忠犬八公的故事,2,不是电影不好。只是，牲畜勿近。8好意思啦
462,忠犬八公的故事,2,其实对于没看哭这一点我很无奈 0.0
463,忠犬八公的故事,1,such troll
464,忠犬八公的故事,2,不知道为什么，对于这部影片没感觉..剧情就这样
465,忠犬八公的故事,2,我对理查有偏见。而且我一直以为这电影叫“忠公八犬”
466,忠犬八公的故事,1,"看完电影其实能给五星
但是一想那些给五星的人的可恶，就气的牙痒痒
真是可笑了，平时吃其他动物吃的面不改色，哦，看一只宠物狗演的假角色可是入戏的不行，说白了，这片不就是个人类打着爱的旗号对家养宠物的意淫么？种族歧视？别的动物的命不是命？无语至极"
467,忠犬八公的故事,2,无情节无细节，一句话可以讲完的剧情愣是拍了了一个多小时
468,忠犬八公的故事,1,可以竞争2009年年度wtf电影。
469,忠犬八公的故事,2,老套美式  总有情感丰富女感动的泪流八股 
470,忠犬八公的故事,1,我老婆看了这破电影之后现在哭的停不下来了怎么办
471,忠犬八公的故事,2,太简单一事了吧，一句话概括全部剧情，完全不够丰满到拍成电影，家庭和车站众人完全可以开拓更多剧情，然而却完全成为多余的部分，完全没被感动到，狗等了死去的主人十年，就这么简单一事拍这么长，有什么好感动的
472,忠犬八公的故事,2,以前看的   全程冷漠脸  被强力煽情恶心到了
473,忠犬八公的故事,2,没哭。说实话不喜欢RICHARD
474,忠犬八公的故事,1,被特么高分给骗了，花我两小时看只狗的故事！真是shit!
475,忠犬八公的故事,2,我并不感动，所以我认为这电影没什么意义
476,忠犬八公的故事,2,无动于衷地看完了……
477,忠犬八公的故事,1,感动如若如此廉价，电影也便毫无诚意。
478,忠犬八公的故事,2,不明白这群女人哭什么，泪点在哪?
479,忠犬八公的故事,2,主线剧情太单一
480,忠犬八公的故事,2,我发现我对活物真的没什么爱心。。。。师姐哭得一塌糊涂。。。
481,忠犬八公的故事,1,用人类的思维来理解狗的行为，自作多情
482,忠犬八公的故事,2,"翻拍的故事，美国版忠犬八公。
没看过前篇，无法比较。感觉比较平淡的一出电影，当然也不乏感人的镜头，赚眼泪的。只是故事本身就这么平淡，导演也算尽力了吧。
同样以狗为主题的电影，似乎小Q或那出《柴犬物语》要更精彩一些。"
483,忠犬八公的故事,2,无聊至极
484,忠犬八公的故事,2,虽然音乐很好听，Hachi也让人疼爱到不行，但这个狗血的俗套故事让我很愤怒。
485,忠犬八公的故事,2,不知道为什么没有非常感动 可能期望太高了
486,忠犬八公的故事,2,狗很萌 男主很帅 剧情九分三十秒拍成了九十三分钟
487,忠犬八公的故事,2,狗的主观镜头不错，但是总体来说还是很反动的一部电影，难怪有“忠犬八公是帝国主义阴谋”的宏论
488,忠犬八公的故事,2,狗能捡球没有用？你能告诉我，在我死了之后，等我10年有个蛋用？
489,忠犬八公的故事,2,有关动物的电影我还真是看不下去。。。
490,忠犬八公的故事,2,毫无感觉也许与我从不养狗有关
491,忠犬八公的故事,2,故意的催泪
492,忠犬八公的故事,1,"真TM2，浪费我1个多小时。。
不对，好像这片子俩小时？"
493,忠犬八公的故事,2,不喜欢这个题材。虽然边上的朋友看的很感动。但是我却一点也不感动，只是觉得电影很乏味，甚至觉得它很卖弄，很滥情。
494,忠犬八公的故事,2,"典型的美国片，凡事都有个大欢喜的结局，一切在该死的表面下看起来那么美好。八公故事的真实背景很复杂：十九世纪三十年代；过去照顾八公的教授暴病离世；教授女儿自私冷漠，逐八公出家门致其成流浪狗。八公在车站一等九年,到底是为了乞食求生还是等待主人?"
495,忠犬八公的故事,2,忠诚的意愿
496,忠犬八公的故事,2,这是个很俗套的故事移植，我只能说，对狗的化妆还不错。
497,忠犬八公的故事,2,不是吧  为什么我看着无感。。。。
498,忠犬八公的故事,2,no feeling...
499,忠犬八公的故事,2,作为一部好电影还是差了点，这样的温情情节实在是太普通了。
500,忠犬八公的故事,2,可能一开始就知道结果了，没感觉。
501,忠犬八公的故事,2,哪感人了，无聊
502,忠犬八公的故事,2,我想给这部片子打高分的人大多爱的是狗，是动物，而不是这片子本身吧。
503,忠犬八公的故事,1,给一星原因：基尔老儿反华
504,忠犬八公的故事,2,没日版的好
505,忠犬八公的故事,2,有时候感动也可以廉价到如此地步
506,忠犬八公的故事,2,星星都给两只狗狗。
507,忠犬八公的故事,2,有点不太相信豆瓣电影排行了，怎么全是这种稀拉拉的催泪片，评分还居然这么高……
508,忠犬八公的故事,2,美国人是拍不出小清新的
509,忠犬八公的故事,2,不好看，不明白会有高分
510,忠犬八公的故事,2,剧情已经被掏空了，还在不停煽煽煽……
511,忠犬八公的故事,1,故事单薄得要命 然后又拼了命的煽情音乐从头充斥到尾 本想脆弱时候好好哭一场 可压根感动不起来 作为一部电影它真的是又臭又长
512,忠犬八公的故事,2,在乱乱哄哄的春节断续地看完了，这么平淡的故事和这么显而易见的结尾为什么会有这么多人看哭呢？不理解
513,忠犬八公的故事,2,狗狗心理学家研究发现狗狗所表现出来的忠诚，护住是因为把自己的主人当成是对自己有用的工具，而表现的一种占有和不许外来潜在威胁侵犯它的工具，很显然，这个hachi这方面倾向比一般狗更高一筹
514,忠犬八公的故事,2,103  为了煽情而煽情，有些刻意的假了，9.2分太高了，三星差不多
515,忠犬八公的故事,2,能别给狗喝酸奶么，能别给狗吃爆米花么，你懂养狗么～
516,忠犬八公的故事,1,三星
517,忠犬八公的故事,2,小眼睛老男人。小眼睛日本人看着很丑。一直以为会出现狗救人之类的奇迹。一直没有，平淡冗长温馨。太抒情乏味太不像老美的片子了。二星，一星给狗一星给房子。
518,忠犬八公的故事,1,这种白描的手法还是很容易打动人的，尤其是眼瞎的大众。当然影片水准蛮高，很喜欢现实主义的大师。
519,忠犬八公的故事,2,美国专毁电影
520,忠犬八公的故事,2,看过太多这种片了.怎么分那么高?.难道是因为他是第一部么..反正看名字就知道整个故事了.
521,忠犬八公的故事,2,叙事手法实在拖沓乏善可陈。好好一个感人的故事看到将近睡着。其实情节又很简单。
522,忠犬八公的故事,2,倒是很感人，不过可惜，人类的“专属”情节，很低级。认为一个生物对自己忠贞不渝的武士家臣情感才感动？不需要这种感情，我希望八公一早就开始自己新的生活！
523,忠犬八公的故事,2,我越来越难被打动了...难道...
524,忠犬八公的故事,2,高一的时候班主任放的，不知道为什么觉得非常一般，记不清剧情也从没被感动到
525,忠犬八公的故事,2,主题本身是十分美好的，拍摄者却把整个故事拍成一部刻意卖弄温情，压迫泪腺分泌物的恶俗趣味片。为迎合大众心理预期，消费大众情感需求，弱化了一切真实境况，舍弃了真实生活场景，美化一切可以美化的叙事。PS：好莱坞电影工业体系下的流水线罐头，请不要涉及这类严肃文学片。
526,忠犬八公的故事,2,@拥墓适轮灰到就想哭了，影抓住了@先天荩可是其他的就，就都]有了。很好奇日本的版本。
527,忠犬八公的故事,1,sorry这个故事看过太多版本太多遍
528,忠犬八公的故事,2,再降颗星平衡一下 被过誉太多了
529,忠犬八公的故事,2,除了煽情，还剩什么？
530,忠犬八公的故事,1,如果你没看过这部片，那么我有机会为你有限的生命节省一两小时时间，因为本片可以浓缩成一句话并且不会遗漏什么东西：一条疑似认知障碍的狗傻逼呵呵的在车站等他屎了的主人十年
531,忠犬八公的故事,2,非常平庸的电影 感觉狗狗的演技不错啊。。
532,忠犬八公的故事,1,人的自我感
533,忠犬八公的故事,2,只能说，老外真心太不会煽情了。。。
534,忠犬八公的故事,1,烂片。
535,忠犬八公的故事,2,虚高，往下拉一点。
536,忠犬八公的故事,2,一般般吧
537,忠犬八公的故事,1,这部翻拍剧别说是超越原版了，一半也够不到。看完之后就觉得，导演很刻意的营造原版那种比凄凉更深层的悲伤气氛，结果只让我觉得是美国人生活在日本。还有理查・基尔整部片子除了肉麻的叫Hachi、Hachi的别的话都不会说了。真要说优点，那就是这条狗演的不错，一星是给它的。
538,忠犬八公的故事,2,不咋滴啊
539,忠犬八公的故事,1,宠物片都这么白瓷？？？
540,忠犬八公的故事,2,WHAT THE?!! 这电影评分这么高?! 当时在电影院看都快睡着了好吗! 
541,忠犬八公的故事,2,…我觉得读那片报道是很感人，电影拖。。
542,忠犬八公的故事,1,交个女朋友，还是养条狗。喜欢她像是狗本性难移，她做出选择不再回来，你只能自我感动的完成剩下的仪式。
543,忠犬八公的故事,2,这事情值得歌颂是因为，这有着一个“它为了我居然能做出这样惊天动地的事情，我很感动”的自私逻辑。如果这是两个普通人的友情，那么留下来等的人一定会被冠上“留恋往事，不向前看”的帽子。故事混淆了一个概念，永远记住你爱的人不等于你什么也不做浪费自己的人生去只等他。
544,忠犬八公的故事,2,故事是好的，可是这么长的片子其实在我看来都抵不过片尾的字幕和真实照片，或者说90分钟的影像并没有增加任何更多的感人之处。对于一个对这个故事有所耳闻的而言，这个片子实在看起来太寡味了。
545,忠犬八公的故事,2,无聊，我能说这狗有强迫症么？
546,忠犬八公的故事,2,直接给我后面一分钟我也可以哭出来啊，郁闷了。。。
547,忠犬八公的故事,2,狗是好狗。
548,忠犬八公的故事,1,从没看完过，天生厌狗，看不下去
549,忠犬八公的故事,2,"鬼子教授家的狗...还是鬼子自己拍这类的片子比较煽情
虽然我还是哭了..."
550,忠犬八公的故事,2,完全没有被感动过。
551,忠犬八公的故事,2,比自己预期的差
552,忠犬八公的故事,2,一般啦，不感人，情节也普通，没有打动我的地方。 
553,忠犬八公的故事,2,哎 两星给狗狗吧……作得不行
554,忠犬八公的故事,2,无语。。当秋田犬出现在米国中产阶级家庭・・怎么看怎么不搭调
555,忠犬八公的故事,2,俗
556,忠犬八公的故事,2,记得当时整个教室都哭得稀里哗啦的，就我一个人直矗矗坐在那里。我满心的问号- 难道狗狗就不冷吗？plus治愈吗？狗狗都冻死了治愈吗？怎么就想着用他人（狗）的付出去衡量爱了？（无碟）
557,忠犬八公的故事,2,没看完
558,忠犬八公的故事,2,好无聊 可能是没养过狗吧
559,忠犬八公的故事,1,一半不好看，一半没爱心。
560,忠犬八公的故事,2,至少没有让我流泪，说明还未戳中我的内心。也许是我对过于液化的画面不甚感冒。
561,忠犬八公的故事,2,天合联盟
562,忠犬八公的故事,2,有意思的是主角的政治观念与电影的人与动物的逻辑非常契合。
563,忠犬八公的故事,2,2.5   这片是霍尔斯道姆拍的……？
564,忠犬八公的故事,2,美国人毁了一个好故事
565,忠犬八公的故事,2,美国佬拍这种电影就是没日本人厉害。。。
566,忠犬八公的故事,2,讨厌这男
567,忠犬八公的故事,1,面无表情陪某姐姐从头看到尾。人家已哭成泪人。。。
568,忠犬八公的故事,2,醉
569,忠犬八公的故事,2,动物和人的感情故事。但是不理解为什么这个高的分数，虚高！！电影实在没有特别值得称道的地方，无解。唯一感觉好的就是小狗的主观视角做的很好。
570,忠犬八公的故事,2,说实话，我看的之后哭的很惨  但我觉得是这个事情本身感人，和影片无关。
571,忠犬八公的故事,2,平白占了TOP250 的一个名额
572,忠犬八公的故事,2,等
573,忠犬八公的故事,2,两星都给狗狗。
574,忠犬八公的故事,2,我还记得多年以前看《狗脸的岁月》的那种美好的感觉啊，然而好像从那以后这个导演就不会拍电影了。这部电影的每一部分都拍得很草率，电影的主要目的好像就是为了催泪。然而小八与parker之间的情感就表现在故事上了，而不是电影拍出来的。然而爱才应是电影的精髓啊！
575,忠犬八公的故事,2,不喜欢 逐渐。。。。
576,忠犬八公的故事,1,这种傻逼的温情脉脉故事果然从来都入不了老衲的法眼。
577,忠犬八公的故事,2,故事挺好 电影情节不咋地
578,忠犬八公的故事,1,看了辣眼睛的傻逼电影，垃圾！
579,忠犬八公的故事,2,故事性弱了些，平平淡淡，白开水一样的剧情。煽情很成功，在大氛围了很可能被其强行感动。可我从始至终就没有入戏，感动也是飘在空中。也许是对这种题材并不感冒。
580,忠犬八公的故事,1,感觉一般般。
581,忠犬八公的故事,1,我不喜欢狗。呵呵
582,忠犬八公的故事,2,拍像翻书一般的平淡，看故事的时候觉得很感人，看电影反而没感觉了。
583,忠犬八公的故事,1,假如一切只是忠诚
584,忠犬八公的故事,1,无趣
585,忠犬八公的故事,2,过煽
586,忠犬八公的故事,2,一向对此类故事无爱啊......
587,忠犬八公的故事,2,为狗打分。其他的，就，太口水帐了。
588,忠犬八公的故事,1,表明态度。
589,忠犬八公的故事,2,我觉得这事是这样的，看完你要是不哭，那是你心理有问题，哭完要是没尴尬，是逻辑有问题（萧伯纳对词句有贡献）
590,忠犬八公的故事,2,你瓣口味高级
591,忠犬八公的故事,2,太缓慢 不带感 也没怎么被感动。
592,忠犬八公的故事,2,闷~介于大家都说好，勉强给2分
593,忠犬八公的故事,2,十年的等待
594,忠犬八公的故事,2,被很多人推荐说每看一遍哭一遍，只能说完全没有打动到我。
595,忠犬八公的故事,1,老人与狗的故事。也许十年后再看会觉得好看。
596,忠犬八公的故事,2,当然，狗演的不错。但其他的，没啥出色啊。
597,忠犬八公的故事,1,狗奴们自我意淫的最好典范。狗奴们哪天被狗咬死了都不知道为什么，不过它们应该会很开心吧，毕竟狗这畜牲是狗奴们的爹
598,忠犬八公的故事,2,如果不是因为狗狗。不就是一星烂片么。剧情还能再烂再狗血么！！
599,忠犬八公的故事,1,看动物电影从来无感
