,movie,star,comment
160,忠犬八公的故事,4,对于人来说，那可能只是九年，但是对于狗狗来说，那是它的一生。只看影评就看哭了的我，看电影看到不能自已。
161,忠犬八公的故事,5,什么治愈，致郁还差不多。留了一升的眼泪。
162,忠犬八公的故事,5,生命可贵的、同样也是执着的。秋田犬八公就用一生很好的诠释了这句话。从它被大学教授帕克决定收养时，就注定一生对主人帕克付出忠诚，永远不会改变。电影后半段，我被许多故事情节感动的潸然泪下。从八公的故事中，不难看出，狗对主人忠诚是可贵的，对主人永远不变的忠诚尤为可贵。看一次哭一次
163,忠犬八公的故事,5,"昨天半夜痛哭流涕的看完,一早眼睛都是[的年前最後一天又看一遍,哭了,痛哭流涕的感X,,,,很久不曾被@淤|愕碾影所感.很久不曾因游锱c人的感情而哭泣,很久找不到如此渭的美好"
164,忠犬八公的故事,5,可爱，感动！狗狗是人类最忠诚的朋友。
165,忠犬八公的故事,5,翻出来重温，由于知道剧情，所以火车站相遇那一幕我就哭了QAQ
166,忠犬八公的故事,5,感人额
167,忠犬八公的故事,5,其实狗只是一种动物，只能做出其智力范围内允许的事情。但是人们都相信狗通人性，狗具有和人类一样高贵的品质。这是人对于这种精神的美好向往和寄托。我也选择相信狗的忠诚，狗用它的生命证明着它的选择：一生只为你绽放一次。
168,忠犬八公的故事,4,都说狗比人忠诚，在这多变的世界，让你更懂忠诚的意义
169,忠犬八公的故事,5,在人的世界里，狗是配角；在狗的世界里，人是主角
170,忠犬八公的故事,4,万万没想到，这片子在豆瓣高居13位，我能说什么呢？只能说大众看的电影无论从数量还是质量来说都太有限，任何评选最佳的榜单前130名都不会出现这部片子，可见豆瓣的定位并不是专业影评，而是大众影评。我也不是贬低，只是就事论事。
171,忠犬八公的故事,4,最难过这个事情是真的。八公在如此恶劣的生存条件下竟然还活到十一二岁。想起曾经大白对我也是这么一心一意 T T
172,忠犬八公的故事,5,看完这部电影，被八公感动得稀里哗啦的，八公是最忠实的宠物。
173,忠犬八公的故事,5,他不会再回来了，你不要在等了0101
174,忠犬八公的故事,5,"看了两次，哭死我了~~（>_<)~~ 永远不要忘记你所爱的人。这是八公教给我的。那是一个被爱注册的名字。看到八公一直在等待，我想到一句话 愿我如星君如月，夜夜流光相皎洁。ps,八公的很多个眼神，看得我很痛心。pss.一只狗的感情居然能如此忠诚，为什么，那么多人类却难以做到?"
175,忠犬八公的故事,5,不敢看泪目
176,忠犬八公的故事,4,狗狗催泪片，狗子太萌了。宠物，是亲人、也是朋友。最好的陪伴。
177,忠犬八公的故事,4,慢节奏的清新电影，看着看着却被戳中心窝，看完很久都很难走出来，不敢重刷的一部啊
178,忠犬八公的故事,5,它是一条狗，一条被主人捡回家悉心照顾的狗，最后，他是一个重要的成员。狗的忠诚，在这样一个势力物化的时代简直难能可贵，当初自己收养了两条流浪狗，现在他他们是我的朋友和家人，他们的陪伴与忠诚是生活中纯澈的甜蜜。看了这部电影深有感触。
179,忠犬八公的故事,5,狗对人的感情真的很真实，忠诚。而朋友却不一定能做到
180,忠犬八公的故事,4,故事本身很平，只是动物和人类的感情完全超越了故事本身。
181,忠犬八公的故事,4,犬类的忠诚
182,忠犬八公的故事,5,等待的滋味，真的是，没有经历过不会懂！
183,忠犬八公的故事,4,爱狗，一切的狗，一切的关于狗的故事。
184,忠犬八公的故事,5,好感人
185,忠犬八公的故事,5,狗狗什么的最可爱
186,忠犬八公的故事,5,一部赚眼泪的电影。很感人。
187,忠犬八公的故事,5,我哭了
188,忠犬八公的故事,5,温情中的感动
189,忠犬八公的故事,5,他那么一个平凡之人，因为一只曾被他爱过的狗所等待，就此真正得到了永生。和八公一样，我多么希望，后头变成奇幻情节，门一推开――还是那一个慈祥的老头。可现实总是残酷，奇迹不来，才懂珍惜。
190,忠犬八公的故事,5,。。。
191,忠犬八公的故事,4,与日本版各有千秋。
192,忠犬八公的故事,4,我也想有个它接送我，那样的路程会很温馨很轻松吧！
193,忠犬八公的故事,4,看不得宠物电影，一看就泪奔
194,忠犬八公的故事,5,最感人的宠物电影，曾让很多人都哭的稀里哗啦。本片触及到你我心里最柔软的地方，养过宠物的人都懂，每次回忆起来都能充满了温暖的力量。有只狗，始终在某个地方等你。这种感觉，想想也是很幸福的吧！对于狗狗来说，此生最美好的回忆，永远不能忘记爱的主人，与君相依，生死不变。
195,忠犬八公的故事,5,动物永远比地球人可爱
196,忠犬八公的故事,5,不是一个特别喜欢小动物的人 但是感动是不分物种的 很感动78永远都不能忘记 你爱的人
197,忠犬八公的故事,4,太感动了，被八公的忠诚而动容。此片没有缠绵的感情纠葛，没有华丽的特效。但那份安静的等待让人心里非常温暖。最后八公慢慢闭上眼睛的那一刻，心里好难受。
198,忠犬八公的故事,5,在火车上看的关于等待于车站的故事 也是一种缘分吧 但是太不适合在公共场合看了
199,忠犬八公的故事,5,十年，三千多天，他有多孤独。
200,忠犬八公的故事,3,感动你们的是电影，还是故事本身？
201,忠犬八公的故事,3,散乱不堪，俗不可耐。如果没有那只秋田犬的表演，根本是浪费时间；即使有了它的表演，也还是浪费时间。
202,忠犬八公的故事,3,太勉强了，从头到尾没有入戏，这个故事的日本味道太浓厚了，所以里面的西洋面孔看着违和感十足，而且音乐几乎没断过这一点真的挺烦啊
203,忠犬八公的故事,3,是不是应该集结动物们来看一下？
204,忠犬八公的故事,3,一种类型片叫不哭死不让出电影院
205,忠犬八公的故事,3,很温情的电影，看后很感动，很有创意！打个3分吧！
206,忠犬八公的故事,3,其实，只是一条狗而已，这里9.1的分真让我吃惊
207,忠犬八公的故事,3,真心没觉得有传说的那么神，可能我并不太喜欢小动物吧。
208,忠犬八公的故事,3,确实感人，不过也就是感人而已
209,忠犬八公的故事,3,感动的不行不行的，真的很棒，情感方面就容易收获人心，棒
210,忠犬八公的故事,3,喜欢狗的忠和对人的感情，就算主人去世了狗狗还一直在老地方等待着他的主人，善待每一个小动物吧。
211,忠犬八公的故事,3,x
212,忠犬八公的故事,3,一部完美的日本宣髌
213,忠犬八公的故事,3,话说，最近想重看点经典电影，图方便就从豆瓣250以此看，结果才刷了半页十几部，胸口就像堵了两大块奶油蛋糕，这口味也太傻白甜了吧……我还是去刷imdb吧……教父我来了！
214,忠犬八公的故事,3,还是日版好些。
215,忠犬八公的故事,3,感动死 等我毕业了 有自己的房子了 我要领养好多小狗 
216,忠犬八公的故事,3,"当人类已将感情淡忘时,宠物狗仍记得九年"
217,忠犬八公的故事,3,该着意表现的等待的辛苦与漫长却只用它身后枯荣开落的树的动画一笔带过
218,忠犬八公的故事,3,跟日版差得远……
219,忠犬八公的故事,3,小狗狗演得好棒
220,忠犬八公的故事,3,没哭
221,忠犬八公的故事,3,狗狗很好
222,忠犬八公的故事,3,我是真的一点儿宠物情结都没有、忠诚啥的、怎么说呢、我觉得我朋友也很忠诚啊我不需要用动物来慰藉受伤的小心灵呢、而且这片快拖沓死了好吗被日本人带坏了=口= 
223,忠犬八公的故事,3,我妹说 李察吉尔像布什。。。。。片头还不错。。。。
224,忠犬八公的故事,3,剧情实在单薄
225,忠犬八公的故事,3,傻傻的狗
226,忠犬八公的故事,3,狗比人忠诚
227,忠犬八公的故事,3,我觉得还好吧，我觉得煽情煽的有点做作了，所以我不但没有哭，而且还给了三颗星。
228,忠犬八公的故事,3,为啥我反而觉得是前半部分挺好看的，到后边感人的地方反而显得有点无趣了
229,忠犬八公的故事,3,一般，普普通通的翻拍
230,忠犬八公的故事,3,太级式煽情
231,忠犬八公的故事,3,狗狗的故事本身足够感人了， 电影拍得很一般
232,忠犬八公的故事,3,狗狗好可爱，那无辜委屈的眼神哪~不过宠物电影都是一个套路。
233,忠犬八公的故事,3,大小提琴和钢琴的伴音一搓一顿的不落着地的煽情，模糊事件地点，格局小镇，一切都在Lasse Hallstr02m的惯有掌控之中。但内容主题如小学教科书般单薄，工业流水线上的合格组装品，齐头整脸但始终缺了神采。
234,忠犬八公的故事,3,好像只要是女人看这类片子必然哭得稀里哗啦
235,忠犬八公的故事,3,有些故事离开了它真实的发生地点，就有点水土不服。况且是如此日本味的故事……
236,忠犬八公的故事,3,看了Red Dog后决定降星到三星半。
237,忠犬八公的故事,3,一般
238,忠犬八公的故事,3,虽然被骗去了不少眼泪，但片子总体仍旧平平。
239,忠犬八公的故事,3,我错了，我不应该把日版和美版放在一起看的- -... 改动的地方真少.... 感动不起来了。不过应该可以轻易在美帝引起秋田犬热潮，没问题吧。
240,忠犬八公的故事,3,看狗..............
241,忠犬八公的故事,3,我只承认这部电影的感人程度，除此之外........
242,忠犬八公的故事,3,没有拟人化的狗狗形象，没有乱糟糟的黑人兄弟配音，这部以动物与人之间感情为主题的电影，不以喜剧为出发点，而是以一往情深击中观众泪点。我相信很多人一直不敢再养宠物，是怕辜负了那份信任与等待。
243,忠犬八公的故事,3,美版的只知道煽情
244,忠犬八公的故事,3,费我多少面巾纸
245,忠犬八公的故事,3,"“永不养狗不是因为不喜欢，而是因为太喜欢”
"
246,忠犬八公的故事,3,20100222 jtl
247,忠犬八公的故事,3,三星半，非常感人，但拍的太单薄了
248,忠犬八公的故事,3,感不动
249,忠犬八公的故事,3,我以后都不看狗电影了，每次都把眼睛弄肿
250,忠犬八公的故事,3,片子一般 八公很乖 赚人眼泪的力作!
251,忠犬八公的故事,3,最佳演技奖给那条狗。除此之外，再无吸引眼球之处。
252,忠犬八公的故事,3,这份感动被拍的廉价了，但我依然哭了，是为真实的八公。至于这个导演，他拍片的水平如此参差不齐，着实让我对他感到非常非常纠结。。。
253,忠犬八公的故事,3,没有传说中那么好看，但秋田犬小时候的可爱程度真叫人唏嘘阿！八公最伟大的地方不仅仅是他在车站等八年死去的主人，而是，他含蓄的情感和孤傲的性格。
254,忠犬八公的故事,3,换成美国没有那个味道了。。。。
255,忠犬八公的故事,3,感人是感人的
256,忠犬八公的故事,3,感人的戏码感人不够~- -要是万一这不是根据真实故事改编的，我怕被感动的人群立刻少了一半- -。。。。那么电影的价值体现在何处？
257,忠犬八公的故事,3,"翻拍日本得八公,依fX得日本那更些吧...m然都很感人 "
258,忠犬八公的故事,3,没有预期的感人
259,忠犬八公的故事,3,栩栩如生嘛
260,忠犬八公的故事,3,特定的人群才有更多感触吧
261,忠犬八公的故事,3,看片过程中没哭，倒是片尾那个八公像一出来就飚泪了。这种跨国界的翻拍果然还是有违和感，李大叔每次喊hachi的时候我都怕他咬到舌头
262,忠犬八公的故事,3,Hachi......
263,忠犬八公的故事,3,就是看完之后我想养一条秋田犬
264,忠犬八公的故事,3,秋田犬真卡哇伊。
265,忠犬八公的故事,3,日本狗比日本人好。典型的美式煽情片，而且力道不够，感觉太突兀和拖沓，所以并没有被感动什么，真实故事倒是挺感人的。自认为，人类驯养宠物本身就是对动物的一种残忍，在这样一个物竞天择的星球，驯养让动物失去自然求生的本能，不靠劳动就能活着，这是人类的自私和残忍。可我也喜欢宠物，矛盾。。。
266,忠犬八公的故事,3,。
267,忠犬八公的故事,3,为什么你要那么忠心耿耿为什么啊TT
268,忠犬八公的故事,3,可以换个美式一点的名字...
269,忠犬八公的故事,3,平凡的不平凡
270,忠犬八公的故事,3,很不错的影片，人与狗的羁绊。忠诚，执着在八公的身上体现得淋漓尽致，它对主人的爱是如此的深沉。。。一部让人感到汗颜的影片。。。
271,忠犬八公的故事,3,这种题材会戳中百分之九十的人的泪点，hachi的故事被诉说过太多次，美版只是把重心放在了温情上，这种剧本制片方和导演必须抢着拍，拍一个火一个。我被小八打动，和电影无关。
272,忠犬八公的故事,3,6。好犬
273,忠犬八公的故事,3,只能说还可以，毕竟小动物的题材更能打动人心
274,忠犬八公的故事,3,。。。怎么会这样 这么多人看哭了我一点泪点没有 我明明泪点很低啊。。。
275,忠犬八公的故事,3,唉 我已经冷血到这种程度了么
276,忠犬八公的故事,3,忍到最后还是飙泪了。。。。。。
277,忠犬八公的故事,3,等待并不漫长。
278,忠犬八公的故事,3,一只狗的一生
279,忠犬八公的故事,3,看得好难受
280,忠犬八公的故事,3,影片改编自发生在日本的真实故事，1987年曾被搬上银幕，由仲代达矢主演，大获成功。看过1987年的日本原版《忠犬八公物语》，比较起来，本片在细节、情感上比原版差了许多，原版更细腻感人些。PS：理察・基尔好像经常演日本片改编电影，但美国人的感情比较东方人来说粗糙许多。
281,忠犬八公的故事,3,翻拍的也挺不错
282,忠犬八公的故事,3,咋么我一点感动都没有，，，故事很好，结构有问题，不够煽情，，最出色是小八的表演！
283,忠犬八公的故事,3,人狗情未了- -
284,忠犬八公的故事,3,可能是我看之前期望值太高了，看完后觉得没有我想得那么感人！唯一掉了眼泪的地方是狗狗最后作梦的时候！
285,忠犬八公的故事,3,看来我的哭点还是蛮高的
286,忠犬八公的故事,3,感觉一般啊，难道我比较冷血？
287,忠犬八公的故事,3,如果是日本人拍，肯定会细腻好多
288,忠犬八公的故事,3,纯被秋田犬感动
289,忠犬八公的故事,3,还好吧，哪有那么感人，狗确实还不错啊，但拍得不行，配乐一团糟――――到北京看的第一部 619
290,忠犬八公的故事,3,打三星是不是会被骂没人性。。。
291,忠犬八公的故事,3,飙泪大作
292,忠犬八公的故事,3,这狗真是神了！
293,忠犬八公的故事,3,hachi~最后眼泪止不住~
294,忠犬八公的故事,3,唔，小狗狗好乖的。
295,忠犬八公的故事,3,片子平平，但狠赚了我不少眼泪。。。
296,忠犬八公的故事,3,故事被讲得比较无聊 最后的漫长等待小感动了下 我是不是太冷血？
297,忠犬八公的故事,3,回不来的就不要等了。
298,忠犬八公的故事,3,这破片儿都能进豆瓣250？呀，真250呀！
299,忠犬八公的故事,3,哎....病态的人类 大家给五星都是冲着狗演员的吧？
300,忠犬八公的故事,3,"电影题材太讨巧．
不哭不行
可比起同题材的电影来说还是一般吧。。"
301,忠犬八公的故事,3,时间在等待者眼里走得那么慢，在等待的狗眼里甚至还要漫长8倍。狗的眼睛看上去总是很忧郁
302,忠犬八公的故事,3,小狗狗好可爱。澹原来已经看过一遍了。
303,忠犬八公的故事,3,它就那么一直等着
304,忠犬八公的故事,3,也许我需要再仔细看一次才能真正感受到那些让那么多人狂流眼泪的内容
305,忠犬八公的故事,3,可爱的小八……
306,忠犬八公的故事,3,救命啊・完全没被感动什么的・硬生生把日本的故事搬到了美国这也太牵强了
307,忠犬八公的故事,3,没有期待那么感动
308,忠犬八公的故事,3,很多人会因为狗的出现而忘记了这是对一部电影的评判
309,忠犬八公的故事,3,不看煽情的电影
310,忠犬八公的故事,3,不能承受之重。
311,忠犬八公的故事,3,故事角度来说，很一般。我家也养狗，我觉得狗给你带来的快乐比所谓的忠诚更重要。
312,忠犬八公的故事,3,实在没看出哭点……简直莫名其妙。
313,忠犬八公的故事,3,美国人缺少日本的一种气息，那就是干净，一个国家的故事还是得自己国家去拍。
314,忠犬八公的故事,3,"大家都说看哭了,难道我麻木了?挺感动,想看看日本版,估计会更好."
315,忠犬八公的故事,3,哭死了。。はち的10年――小狗一生的等待！！3星全给forest
316,忠犬八公的故事,3,说实话，真的不如日本人拍的细腻
317,忠犬八公的故事,3,"其实和我期望值落差不小，也觉得很多地方不算满意,但不可否认从男主死后便开始一直内牛满面."
318,忠犬八公的故事,3,理查・基尔虽然是个反华分子也抵挡不了我喜欢他。因为人人爱Pretty Woman。半夜要哭死了。爸爸大半生的时间都养狗做伴，难过的是或许我陪伴他的时间还没有他的狗陪他的多。我也想养一条狗了，当然，它进入我生命的方式对我十分重要。我等待它光临。
319,忠犬八公的故事,3,真不是我冷血。。
320,忠犬八公的故事,3,木有日本的秋田八公好。恩，不能算烂片，但绝对不是大和的八公啊。
321,忠犬八公的故事,3,真是漫长的一生啊，八公。
322,忠犬八公的故事,3,远不如日本原版的啊，但还是看得我哭的一塌糊涂
323,忠犬八公的故事,3,磨磨唧唧的  其实完全可以拍成一个10分钟短片  冗长
324,忠犬八公的故事,3,老头很帅，狗的眼睛很伤感
325,忠犬八公的故事,3,很少有人能不为这部电影落泪，因为这个故事足够经典。因此，跟这个真实的故事本身相比，电影仅仅变成了一种载体。
326,忠犬八公的故事,3,故事挺弱的，有1/3是在抒情，人和狗的故事也不够分量，来回就那么一两件，不得不佩服好莱坞的编剧导演们对于节奏的把握，就是这两件事愣是能让人不无聊的看完，还能小感动一把
327,忠犬八公的故事,3,简单白烂的剧情，廉价的煽情手段，还有亲日派李察吉尔....但是没办法，狗狗始终是我的泪点，最后还是被煽哭了...
328,忠犬八公的故事,3,一开始的配乐就让我又不想的预感，然后就真印证了，催泪片不是我的菜，早知道就不看了。
329,忠犬八公的故事,3,真实事件改编 
330,忠犬八公的故事,3,自大人类拍的又一部自以为是的电影~但还是被感动了！
331,忠犬八公的故事,3,没他们说的那么好看~
332,忠犬八公的故事,3,无比好的故事，无比无比平庸的导演
333,忠犬八公的故事,3,比起一般来稍好一点，没有评论那么感人。
334,忠犬八公的故事,3,狗比人演得好
335,忠犬八公的故事,3,感觉像吃了啥串味的东西一样。。喜欢老版
336,忠犬八公的故事,3,就整部片子就只有狗狗好看。
337,忠犬八公的故事,3,泪点：是在主人去世，每天等它的主人吗？真心没有被戳到
338,忠犬八公的故事,3,我等你，十年，九年，我等你。
339,忠犬八公的故事,3,看来我是老了，忘记感动是什么- -
340,忠犬八公的故事,3,低于期望值
341,忠犬八公的故事,3,人不如狗。
342,忠犬八公的故事,3,能不能让时间就停在那年的5点钟。hachi
343,忠犬八公的故事,3,"我怀疑电影中10年之后8公的狼狈样是被打出来的,正如教授所说的,艺术场景不能简单进行复制,尽管电影催人泪下,但...
看来不要随便与忠狗发生爱情,否则辜负了她的以身相许.
只能白头偕老.
八公的忠催人泪下的同时让人畏惧
开来还是和狗保持点距离
"
344,忠犬八公的故事,3,Hachi loves him.
345,忠犬八公的故事,3,狗狗的眼神真是太美了，
346,忠犬八公的故事,3,一边看一边对照我家那只潘抗罚咋就这么猥琐这么笨哪，一天到晚心里只有吃！
347,忠犬八公的故事,3,亮点不多
348,忠犬八公的故事,3,你们这些人渣!怎么能这么欺负小八!!!!!!!
349,忠犬八公的故事,3,是一定要翻出多少年前的往事，在狗身上，才找得到“忠诚”了吗？
350,忠犬八公的故事,3,比原版差远了，看在八公的面子上多给一星。
351,忠犬八公的故事,3,这种为了流泪而流泪的电影不喜欢，可是流泪时必须的
352,忠犬八公的故事,3,很好的狗，很一般的电影。
353,忠犬八公的故事,3,HACHI ended its life in waiting. Never forget the one we loved.
354,忠犬八公的故事,3,这故事发展的实在是太convenient了。。。
355,忠犬八公的故事,3,虽然哭了好几次但是不得不说这电影拍的太没意思了……好想养狗啊！
356,忠犬八公的故事,3,这种本应催泪煽情的片子 美国佬拍的就是不如小日本 不过狗狗还是超可爱的！淘宝了一下秋田犬竟然要8000-12000啊！
357,忠犬八公的故事,3,忠诚，这方面我们真不能和狗狗比
358,忠犬八公的故事,3,一生该为什么而执著？可以拷问一下自己。
359,忠犬八公的故事,3,我承认嘛，是很煽情。
360,忠犬八公的故事,3,看的眼泪哗哗的
361,忠犬八公的故事,3,我真觉得一般啊...
362,忠犬八公的故事,3,不知道为什么中间一段我睡着了。
363,忠犬八公的故事,3,typical movie of mankind craving unconditional loyalty and love from others...
364,忠犬八公的故事,3,稍嫌单薄，后半部分好一点。
365,忠犬八公的故事,3,"就是一个初中生能讲的简单故事，却能让人看得眼泪汪汪的，看来人们都希望有个忠诚的“狗”在身边……害我都在想，如果将来有机会去日本涩谷【Shibuya】车站的时候，一定要去看看这个Hachiko的雕像。
"
366,忠犬八公的故事,3,试图客串一次东西方大融合，只是这次嫁接生涩而拙劣。主人美国籍八公狗日本籍的身份，很难不让人产生联想。不知道这算是何种蒙太奇。原本挺感人的故事，结果却阴差阳错的令人作呕。
367,忠犬八公的故事,3,前边太无聊，最后比较感人，看到最后屏幕出现真实的八公时候哭的不行。动物太好了，太可怜了，太有感情了
368,忠犬八公的故事,3,看过之后，谁又不想养一只狗呢
369,忠犬八公的故事,3,哭还是哭了，可是觉得一般
370,忠犬八公的故事,3,小动物都很催泪 没有《我与狗狗的十个约定》感人 八公那寂寞的小眼神儿 真让人心疼
371,忠犬八公的故事,3,只是故事吸引人而已
372,忠犬八公的故事,3,"一点想流泪的感觉都没。。最近要补催泪弹
"
373,忠犬八公的故事,3,审美疲劳
374,忠犬八公的故事,3,变成老狗的时候开始飙泪，，但是煽情不足，，，是个好本子
375,忠犬八公的故事,3,"太感人了
别的没啥"
376,忠犬八公的故事,3,狗不错，电影太一般
377,忠犬八公的故事,3,不知道为什么没看出感觉来。八公很可爱
378,忠犬八公的故事,3,可能是被周围的人 夸得太好了吧，或者是我自己不那么喜欢小动物吧，没有像朋友说的一直哭啊，只是最后哭了一小下，八公的灵魂终于和主人的灵魂相遇了。
379,忠犬八公的故事,3,无感
380,忠犬八公的故事,3,感觉是个很感人的电影。不过中途一直在玩手指头，没仔细看……
381,忠犬八公的故事,3,狗狗很专业
382,忠犬八公的故事,3,就这么信心十足 赤手空拳 的煽情的。 很难免疫 。
383,忠犬八公的故事,3,喜欢这狗狗单纯
384,忠犬八公的故事,3,这只狗太传说了
385,忠犬八公的故事,3,或许期待太高，因此略微有些失望，没有想象的那么那么动人。
386,忠犬八公的故事,3,はち not a dog person 所以 到底有什么好看的啊
387,忠犬八公的故事,3,不知道为什么，眼泪是被煽情的剧情逼出来了，心底却没有触动
388,忠犬八公的故事,3,豆人都感伤
389,忠犬八公的故事,3,太煽情，太温情。
390,忠犬八公的故事,3,为什么其实我觉得还好？
391,忠犬八公的故事,3,老年哈奇增是戏精啊~~
392,忠犬八公的故事,3,Great Hachi!Great Dog!
393,忠犬八公的故事,3,有点做作，分数虚高。日本故事移植到美国，还是图样。
394,忠犬八公的故事,3,我不喜欢可以去煽情的片子！
395,忠犬八公的故事,3,Nothing new in the story! Nothing...
396,忠犬八公的故事,3,还行吧，狗狗的戏份太少
397,忠犬八公的故事,3,老人和狗。。。。
