,movie,star,comment
483,天使爱美丽,1,看到海报的时候就莫名其妙的讨厌这部电影，画面太压抑，但是看到这么高的评分又想试试，事实证明我错了，不明白这样一部三观不正的电影怎么就变成天使、纯粹了…可笑至极，一个正常的人会闯进别人家搞破坏吗？那个人也没有罪大恶极吧，胆子小点的人能被吓死，找谁说理去？
484,天使爱美丽,2,电影没问题，也可以说是挺好。但是为什么都说浪漫？我怎么会觉得很蠢很无聊？完全不如两小无猜浪漫，很平淡好么，而且有一点也很重要塔图没有玛丽昂歌迪亚漂亮。她在这里面表情居然显得很诡异，还不如在漫长婚约里的好。
485,天使爱美丽,2,女主其实就是神经质啊，虽然我们很多人本来就挺疯的。电影十分无聊，两个小时内不停地在催眠我，以致我到最后都没明白这帮人是来干什么的。或许待有缘再重看吧。
486,天使爱美丽,2,不是我喜欢的类型 看封面我一直以为是惊悚片 所以女主的这个表情 不太喜欢
487,天使爱美丽,2,我真的好不喜欢 完全无法看下去啊........不过画面拍得挺精致的 配色也很好
488,天使爱美丽,2,不喜欢这个眼睛长这样的女孩
489,天使爱美丽,2,就前面20分钟是好的后面都在扯淡
490,天使爱美丽,2,我很少有电影看不完的情况，虽然女主很美，，，，可能本人真的无法体会发过人的情调吧。。。。看一半实在坚持不下去了，太无聊了
491,天使爱美丽,2,看了一半..快要睡着了..感觉超级无聊
492,天使爱美丽,1,很天使，很美丽，很法国，很双鱼。所以我只能给1分。
493,天使爱美丽,1,很多人很喜欢，可我却花了两个月的时间才看完。还是因为无聊才看的。感觉电影里的每一个人刚开始都觉得他们是神经病，后来才觉得他们是正常人。
494,天使爱美丽,2,又美又无聊的电影。。。哎，跟傻缺小白脸的感觉一样。。也不忍心伤害
495,天使爱美丽,2,太诡异 尝试看两次都没能入戏 热内的片子太荒诞了 每个人可以理解为是特立独行 但我看着蛮慎人的 
496,天使爱美丽,1,目前为止top 250里最不喜欢的片子 只对开头自白还有点印象 旁白一想起简直不要太糟糕 整个作到不行…男友应该要破口大骂的那种 说不定哪天不开心整的比咖啡店那个控制变态狂还要可怕 唯一的解释就是艾米莉有抑郁症或者精神病之类的疾病吧…
497,天使爱美丽,2,= =对我这种变态来说 这真的就只是一个活在自己世界里的少女自high日记~ 充分论证了心理学上给予比拿走让人快乐的论点。也就是女主好看0 0换个丑女试试？呵呵不是我的菜。
498,天使爱美丽,2,一个矫（二声）情的女人的矫情故事
499,天使爱美丽,2,我承认我没有认真看这部片子．所以没怎么看懂．先放下，有机会再看．不代表不好看．
500,天使爱美丽,2,这种弱智电影怎么这么多人喜欢？我很诧异。色彩还不错，不过又有什么意义呢？完全靠念白推动，根本就不是用眼睛的电影，有声小说吧。若说奇幻，根本没什么惊人的设计，都是小孩子的头脑泡泡；要说现实故事，完全没逻辑没深度。也就01年体现的工业质感还行
501,天使爱美丽,1,不觉得这种装逼的超现实片子有什么好看
502,天使爱美丽,2,根本看不懂。。擦。
503,天使爱美丽,2,看得我都不想看法国电影了。
504,天使爱美丽,2,或许是经典，只是在我这里没有波澜……
505,天使爱美丽,2,什么跟什么啊！前面还可以当喜剧看，后面简直越来越不知道在干什么啊！女人到底在想什么啊！这片子到底要讲什么啊！名字取得差，封面也难看，影片里比封面好看的镜头多去了，干嘛偏偏挑这张！被豆瓣的高评分坑了多少次了。
506,天使爱美丽,2,看这种片太需要耐心了，个人对法国电影一向感冒――皆大欢喜的浪漫结尾。
507,天使爱美丽,2,没意识，没文化，没看懂
508,天使爱美丽,2,最讨厌这种自恋的以上帝的角度拍电影的导演。本来就不太接受法语，结果旁白还叨逼叨个没完。
509,天使爱美丽,2,不是我的菜
510,天使爱美丽,1,"曾经因为我喜欢的电影在豆瓣都是高分的,所以我希望所有高分电影我都喜欢.但事实并不如此,就如此片,无聊,冗长.主角的性格怪到极点.可能我没有这个水平去欣赏这部电影吧."
511,天使爱美丽,2,从这部电影开始发现，我是真的对法国电影无感。我只能说配乐挺美的。
512,天使爱美丽,2,我没有看完，找不到喜欢的理由，现在的节奏太快，没时间去做这些事，我还在为自己的物质奋斗，怎么有空闲去享受精神。
513,天使爱美丽,2,看到一半是在是没欲望继续看了
514,天使爱美丽,2,影片讲诉了资本主义法兰西帝国的女雷锋艾米丽同志的故事，表达了爱美丽同志把有限的生命投入到无限的为人民服务当中去的伟大革命主义精神。该电影本质上与大中华帝国弘扬雷锋精神主旋律无区别，仅因做好事的女主角清新可人而广受豆瓣逼友青睐。据共青团中・央统计，打五星者都是官评学习雷锋先进个人。
515,天使爱美丽,1,不喜欢让皮埃尔热内的风格 也不喜欢奥黛丽塔图
516,天使爱美丽,2,我还没到看这个的年级。得抓住幸福
517,天使爱美丽,2,这电影，完全不对我口味！没等看完，删了了事！
518,天使爱美丽,2,努力看到一半，还有一半不知道要扔到何时。
519,天使爱美丽,1,我很艰难地看完的，乱七八糟，除了她很漂亮，没有其他看点
520,天使爱美丽,1,喜g面色彩 仅此
521,天使爱美丽,2,太矫情了..........................
522,天使爱美丽,1,法国电影一定有一些镜头很浪，节奏一定要拉的很慢。欣赏不能，好困。
523,天使爱美丽,1,so boring！
524,天使爱美丽,1,作b 人长得晦气 心也坏 这种坏心丑陋的作女就该一刀一刀剐死 ；下贱的处女座养出来的顶级坏心的贱孩子 鸡巴喂不饱的歇斯底里症
525,天使爱美丽,1,他妈的我欣赏不来
526,天使爱美丽,2,泼了一屏幕的色彩让人焦虑
527,天使爱美丽,1,不喜欢女主角
528,天使爱美丽,2,这片子对于我来说大概太先锋了。奥黛丽・塔图在《达芬奇密码》中给我的印象就不匝地，这部片子我一看海报上她满脸的粉我就快要失控了。
529,天使爱美丽,2,没有你，良辰美景能与谁说？没有你 我读不出这部片的温馨
530,天使爱美丽,2,是剧情混乱还是我脑子混乱？
531,天使爱美丽,1,很怪异风格的一部电影，直到看完都给我快要神经失常的感觉…… 女主特写像赫本，眼睛很漂亮，但我真心无法喜欢这个风格这个类型，海报真难看。唯一喜欢的一个点是――“没有你，良辰美景更与何人说？”
532,天使爱美丽,2,"当年戛纳的评委没有错
这部电影在我眼中透露与充斥着
虚伪，无聊与花哨的徒有其表
总之一个字作
"
533,天使爱美丽,2,忘得差不多了。隐隐蛋疼的感觉。
534,天使爱美丽,2,我是在接受不了这脑残的剧情
535,天使爱美丽,2,我只能说，法国人的浪漫和幽默，我真心不懂。看不下去啊！
536,天使爱美丽,1,为什么我觉得难看得都不能看下去。
537,天使爱美丽,1,消化不了法式浪漫
538,天使爱美丽,2,我只能说我装不了文艺青年……
539,天使爱美丽,2,对小清新接受无能。。。
540,天使爱美丽,1,没看出好在哪！
541,天使爱美丽,2,"第二遍看,客观地说：形式,得瑟,小气,空洞,作。"
542,天使爱美丽,1,哪里好看了？说这个电影好看的都是装比伪文艺。
543,天使爱美丽,2,终于分了好多好多次把这部电影看完了，我能说我不喜欢吗？我能说对于热爱培养文艺细菌的人法国的屎都是香的吗？ 我能说剧情异常空洞吗？ 唯一喜欢的一是配乐，一是里面的人的稀奇古怪的癖好。 真心不推荐。
544,天使爱美丽,1,法式浪漫和幽默，我是真的不懂
545,天使爱美丽,2,"很奇怪，很善良，很敏感
但是我已经丢失了心中的Emilie。
但我相信自己，因为我开始学会爱了。"
546,天使爱美丽,2,法国电影，看来，真的不适合我
547,天使爱美丽,1,支撑我看完的唯一原因是很稀饭Audrey Tautou那张脸
548,天使爱美丽,1,小美好？ 生活情趣？ 
549,天使爱美丽,2,喜欢的理由总是可以又臭又长。不喜欢的理由一句话就好。
550,天使爱美丽,2,出乎意料地不喜欢，因为开头拍小女孩那段蒙太奇非常非常抓人，还以为会是很好看的片子，没想到从头到尾都是给微电影准备的手法，放在两小时里就显得轻了，让人坐不住
551,天使爱美丽,1,原谅老娘痛恨文艺片
552,天使爱美丽,1,我实在不想看法国片了再
553,天使爱美丽,1,喜欢就说，人没有那么多青春搞无意义的浪漫。这种文艺我欣赏不来
554,天使爱美丽,2,小矮人去了莫斯科。。。。。
555,天使爱美丽,2,没看懂。
556,天使爱美丽,2,不知道为神马我看的如此费劲，，好不容易断断续续看完了，觉得很轻松，终于可以删了。。#沽名钓誉片中的战斗机#
557,天使爱美丽,2,看不懂~
558,天使爱美丽,2,看到四十分钟实在看不下去了     文艺也好 小清新也好      还真的没怎么看懂。无聊到爆 。
559,天使爱美丽,2,对法国片木有感觉
560,天使爱美丽,2,过誉的片子
561,天使爱美丽,2,一个女孩做好事与谈恋爱的故事，好不容易耐着性子看完了，不知道这部电影哪里出彩了……
562,天使爱美丽,2,好@N影
563,天使爱美丽,2,比较温馨 但真的没有想象的那么好 不合我的口味 失望。。
564,天使爱美丽,2,极为适合高中以下人群观看，还得是女生。
565,天使爱美丽,1,译名太烂以致不想看
566,天使爱美丽,2,不知所云，原谅我的白痴
567,天使爱美丽,2,我就是看不懂奇幻影……
568,天使爱美丽,2,老师说很好，但是我看睡着了。。。睡眼朦胧的时候依稀感觉镜头还是蛮好的。。。
569,天使爱美丽,2,很无聊。为什么这么高分？
570,天使爱美丽,2,原来我真的不喜欢法国电影。看不下去啊。
571,天使爱美丽,1,不喜欢！！
572,天使爱美丽,2,几次试图看完它，但都没有耐心，但我看完了5个小时的《一九零零》
573,天使爱美丽,1,这也算法国片？跟裹脚布一样逼叨叨，终于在将近90分钟果断放弃了
574,天使爱美丽,2,女强盗无法理解女文青的世界
575,天使爱美丽,1,这部片子对我来说如此无聊以至于暂停了十多次、花了整整一个下午才看完
576,天使爱美丽,2,不知所以然……
577,天使爱美丽,1,白日梦+胆小鬼爱情 我就无感。。。
578,天使爱美丽,2,1，我不喜欢公主病女孩；2、电影风格对我是个折磨；3、沉迷该片会制造一大批剩女
579,天使爱美丽,1,真心理解不了法国电影，。。。。
580,天使爱美丽,2,像文艺片，只是看过之后没有任何感觉~
581,天使爱美丽,2,一直听说不错，而且是经典之作，就想留着晚点再看，结果看了大失所望。片子开头不错，后面好无聊，看的都睡着了，太清新文艺浪漫的电影不对我的口。
582,天使爱美丽,1,哪里好看了！！不懂。。。没看完就看不下去了
583,天使爱美丽,2,冗长繁琐，看得人昏昏欲睡。鸡毛蒜皮，无聊乏味。
584,天使爱美丽,2,画面很美，没看下去。
585,天使爱美丽,2,额。。没看出来好在哪里。
586,天使爱美丽,2,"因为评分高才看的，看到一半关了。
水平低，欣赏不来。

话说回来，男主也挺作的。
一个人作，叫矫情造作；两人一起作，就是浪漫了――他俩在一起挺好的。"
587,天使爱美丽,2,边缘人物生活中的点点滴滴。。。感受着平淡的幸福，很温馨。。。艾美丽，爱美丽！
588,天使爱美丽,2,真是受不了法国片  我跟豆娘的主旋律严重不符  人就爱整些似懂非懂的电影 搞那么复杂干嘛 好吧我肤浅我恶俗~哈哈
589,天使爱美丽,2,这就是爱情啊？！折腾、偏执、无聊、神经病
590,天使爱美丽,2,点五星的啥心态。。。这不就是个诡异海报白痴女莫名其妙荒废光阴的故事嘛
591,天使爱美丽,1,难道只有我觉得超级难看超级无聊么
592,天使爱美丽,2,当年满怀欣喜，看了五分钟，无法忍受，关，删。可能真的是审美不对口。
593,天使爱美丽,2,多年后重看，依然感觉无聊透顶，唯一感觉就是女主比较漂亮和那个记录前女友的变态比较好玩。全片充满了欧洲文艺片的神神叨叨，不知所谓，也许这就是小资口中的浪漫吧，一部片子有一个怪胎还不错，全片都是怪胎的话就有点反胃了。250中排名这么靠前，可见小资文青在豆瓣中室多么大的群体，在下不敢苟同，告辞告辞。
594,天使爱美丽,2,无比诡异。。
595,天使爱美丽,2,"飞机上看的。
没有很喜欢捏。"
596,天使爱美丽,2,只觉得无趣……这种小清新实在不适合我……
597,天使爱美丽,2,除了色彩几乎一无是处。。。。
598,天使爱美丽,2,一部极具法国浪漫主义文艺情怀的爱情片，讲述了一个乐于助人的神经质姑娘和一个同样神经质的在成人保健工作的男孩之间扭扭捏捏的爱情故事~对于我这种比较现实、理性、俗不可耐的人是很难欣赏如此高雅的艺术作品，每一分都是度日如年，尤其是刚看完精英部队2，简直味同嚼蜡，犹如煎熬，暴殄天物了~哈哈
599,天使爱美丽,2,我是一个容易感动的人，但实在没有打动我，居然很多人给五星。大概很多自以为或喜欢小资感觉的人觉得文艺呗！一般再难看的电影我都会勉强看完，这部实在耐不下心。不知道是电影太作还是我最近浮躁。打两星，一星给浪漫法国色彩，一星给细腻的心理刻画。
