,movie,star,comment
295,天使爱美丽,3,第三次看，才静静的看完这部电影，其实这并不是部乏味的电影，相反正好适合而已会发白日梦的时候看，正好这天我俩的频道对上了。原来这个世界上还有另一个和我一样喜欢白日梦和爱瞎忙的人…爱美丽却因此找到了她的爱
296,天使爱美丽,3,非常典型的法国轻喜剧，气场上有点类似《芳芳》，法国人的东西一直这个样子，很有想象力，也有趣，但是就是有一种挥之不去的矫情，就是法国的那种奇怪怪的感觉，说不上来。不算喜欢。
297,天使爱美丽,3,我发觉我的口味偏冷门 看不完...  画面很炫到是真的
298,天使爱美丽,3,真抱歉这绝不是能打动我的题材，不过看看还是不错的，我怎么以前听说这是个鬼片呢，有个恐怖的结局，难道是我幻听了，热内有些手段已经让我反感了，尤其是用在这里面，塔图挺漂亮，但就是一直喜欢不起来，卡索薇姿当年的颜真不错啊，喜欢这样的傻小子，他的导演作品不成功但却有趣！
299,天使爱美丽,3,法国有些电影的调调真的欣赏不来，觉得有些乏味~欣赏水平有限没办法= =
300,天使爱美丽,3,"配乐和色彩喜欢到不行 至于剧情 
喜欢看的人就从头至尾都会喜欢
不爱看的人就彻头彻尾地不想看
但是有机会一定回去那个咖啡馆 坐下来 诡诞地奇想一番"
301,天使爱美丽,3,狐狸有点不好意思说不很喜欢这样的片子，但这是真的，说我庸俗也是真的不很喜欢
302,天使爱美丽,3,我不知道怎么说，看过就算是路过吧
303,天使爱美丽,3,电影的画面安静而饱含张力，动与静在这里籍着色彩的牵线搭桥完美的结合了。
304,天使爱美丽,3,色调音乐是我喜欢的，但是对我来说，过于小清新过于治愈系，我还是偏好重口味，哇卡卡卡~
305,天使爱美丽,3,总体感觉还好，镜头感觉拿腔拿调。女追男的故事没有拍得恶俗，但有点做作。
306,天使爱美丽,3,法语听的我头昏脑胀的
307,天使爱美丽,3,看了一半就实在看不下去了，现在已经对这种文艺范儿不敢兴趣了。
308,天使爱美丽,3,要不说豆瓣是小文艺们的聚集地呢，看完了觉得太文艺了，节奏太慢了，不太适合我这种情感粗糙的人。但是真心挺喜欢爱美丽的
309,天使爱美丽,3,"这个女人，就这种电影还好...这个还有那个漫长婚期
别的地方不知道为什么很难有好感"
310,天使爱美丽,3,可能是看美国的看多了，法国的这种形式有点不太适应，不过影片拍得确实很有特色，很有美感，期待下一次看！
311,天使爱美丽,3,蛮慢的，不像别的同类型的美国人拍的那么闹
312,天使爱美丽,3,看不进去怎么办 ？？？？？？？？？？？？？？？？？？？？？？？？？？？？？？？？？？？？？？？？？？？？？？？？？？？？？？？？？？？？？？？？？？？？？？？？？？？？？？？？？还是我没静下心来？？？？？？？？？？？？？？？？？？？？？？？？？？？？？？？？？？？？？？？？？？？
313,天使爱美丽,3,我除了听不懂...其他都还比较喜欢....具体喜欢什么~?不知道...可能就是因为这个片子也是happi endin吧
314,天使爱美丽,3,突兀的{和。不完美下L成的完美，完美的wN（v有些小耗r刻，只是平添{皮可郏，完美的脆弱（玻璃），恰好的人人郏惹人z惜。tG，Sc琥珀底色。具w的rg／地c，sO模糊的再F，氐CGI化。黛妃。[客^c？色情商店也很o邪…最後的裸露？（L大，也意味故事Y束了）
315,天使爱美丽,3,天使在身边。。。不过我真的觉得有点无聊。
316,天使爱美丽,3,这片...我看了一半看不下去了...
317,天使爱美丽,3,没有闻香识女人好看的好电影。
318,天使爱美丽,3,完全不同于好莱坞的镜头叙事方法，影片每一个场景音乐动态的小结构都很有特点。刚开始还眼前一亮，但是恕我静不下心，如此文艺慢调的电影实在是越看越无聊。用豆瓣给的“类型”标签来说：喜剧没看到，奇幻全没有，爱情够蛋疼。。
319,天使爱美丽,3,也不知道该打几星 片子太负盛名 这下爱情故事终于算不走寻常路了吧 我又嫌太矫情 这下终于有些莫名其妙的场景有些闲散的镜头了吧 我又看不懂了 我能理解片子不算早了 但我还是想说 美图秀秀的某些滤镜一定是拿您做参考了
320,天使爱美丽,3,我这种人真是看不了这种琐碎正能量的东西，一部电影看了十几次，每次看一点儿就强忍住快进的冲动关闭它。。。
321,天使爱美丽,3,艺术片？！艺术的角度！看电影是为了放松，这部电影我没有放松下来，导演的角度很独特！
322,天使爱美丽,3,如此高分的电影，我却觉得无聊到不能再无聊。片名改成脑残爱美丽会更贴切，你看她做的事儿，不是脑残是什么？不过法国电影好多都是这种基调，表现手法也都大同小异。
323,天使爱美丽,3,麻痹男主太可爱甜哭惹！！！Amelie苏成一滩水完全写实啊槽！！！
324,天使爱美丽,3,1、怎么可能会有一个帅哥喜欢女怪人，不过帅哥自己也挺怪的；2、虽然她很怪 但是我还挺喜欢她的咯；3、法国地铁真的是十几年不变啊，这几天走了两天都无语了= =
325,天使爱美丽,3,1.31:57出F的中上海造象牌[w不是ccav6反}播该片的主要右虬桑2.37:00_始出F的插曲怎N和野鹋诺牟迩同一？3.借b蚨芜^多，o非多抹了臃奶油T了…
326,天使爱美丽,3,典型的法式浪漫电影，爱美丽应该代表了大多数青涩的女孩吧
327,天使爱美丽,3,很多人欣赏，很多人喜欢，可是我能表示下我看不懂么。
328,天使爱美丽,3,"难道是我太无知,我没感觉有多好看呐.....
女主好像刘若英"
329,天使爱美丽,3,女孩子应该很爱看吧 我是在连连不断的瞌睡中看完的 只觉得电影的配乐和画面比较好看而已...
330,天使爱美丽,3,是不是因为这是法语片，让我感觉没什么经典呢
331,天使爱美丽,3,电影从年少放到不年少，终于看了，也许是老了。。。有些招数，用来把M好像不错
332,天使爱美丽,3,没有你，现在的感情只是过去感情的硬茧。
333,天使爱美丽,3,实在不喜欢，可能偶不是和这类放过电影吧。
334,天使爱美丽,3,艾米莉这样的女孩子好可爱～
335,天使爱美丽,3,只有我觉得完全不好看么感觉是一堆杂乱无章的片段拼凑而成= =
336,天使爱美丽,3,…………八百年前看的……除了色彩鲜艳 真的什么都没记得= =
337,天使爱美丽,3,虽然细节很有趣 但是也没觉得特别好看
338,天使爱美丽,3,"恕我愚笨,没看出那么多好来"
339,天使爱美丽,3,法国人的确是很浪漫，但这个电影我看了数次也没看完。
340,天使爱美丽,3,我那可爱的妈妈的最爱，我自己不太感冒哈哈哈哈
341,天使爱美丽,3,【6.6】巨不喜欢的电影，故事有趣，不过剪辑简直比BVS还要散，几条角色线乱如麻，观看时我基本上保持了每切一个镜头就莫名其妙这个镜头和上一幕到底有啥联系？？？的状态，几乎全片到底都游离在状态之外，观感特别差。不得不提色调实在是太沉闷了，看的喘不过气。
342,天使爱美丽,3,其我X得好 并]有很好看啊？
343,天使爱美丽,3,说实话看了觉得并不如想象中的好
344,天使爱美丽,3,……独白跟爱美丽好= =|||色调好美=w=中间有点无聊……
345,天使爱美丽,3,老实说，我不喜欢法国片……
346,天使爱美丽,3,喜欢影片的色调，喜欢最后出现在像集里的维修员
347,天使爱美丽,3,看完只记得爱美丽扶着盲人过马路告诉他自己看到了什么然后又立刻离开那个镜头…
348,天使爱美丽,3,不要被海报迷惑了 女主在本片中看着}人！全程关注着她迷醉的口红色号
349,天使爱美丽,3,话说，原来我只喜欢热内对画面色彩的处理。
350,天使爱美丽,3,感觉是马未都所说的病态美。没看懂。
351,天使爱美丽,3,关注别人有时能够给别人也为自己带来幸福
352,天使爱美丽,3,浪漫童话。艾米丽真是会想啊。
353,天使爱美丽,3,觉得没有传闻中的好，法国片都有点奇怪的感觉。
354,天使爱美丽,3,高评价电影对我来说平庸了点 众口难调 不过拍摄手法很好哇
355,天使爱美丽,3,原谅我不懂法国人的西式幽默，也完全不能理解影片中为什么艾米莉就那么稀里糊涂的坠入了爱河~小矮人被空姐带去世界各地旅行是有什么深刻的含义麽...我凹凸了，我都看不懂...我看不懂啊！对了，还有一句最深的感受就是，谁说法语是世界上最美的语言，听的我心里直痒痒！世界上哪里有比方言更美的语言！
356,天使爱美丽,3,色彩和背景音乐很好，但是这故事讲的是什么？
357,天使爱美丽,3,并不觉得有多么的好看
358,天使爱美丽,3,每个人都有自己的那点小嗜好，国内的教育有太多的“我们要向某X君看齐”，不是所有的事情都是金钱导向的，就像一道证明题，找不到正确答案，只有适合的，喜欢的，那正确与否，还重要么？ 女主小清新，俺的菜。。
359,天使爱美丽,3,额。现在想起来还蛮好看的
360,天使爱美丽,3,高明的R^Z言，行流水的∏椋艾米莉的鬼R性格，F都市童。
361,天使爱美丽,3,幼稚没有什么不好的，反正都是做梦
362,天使爱美丽,3,看了很多次但是都没有看完。看来真的不是我的菜
363,天使爱美丽,3,我实在看不出哪里好看。。可能我悟性太低了。  只是喜欢里面几个小段落。帮助老爷爷过马路那个拍摄手法我很喜欢，仿佛老爷爷能看到以前的一切那样。还有就是第一次跟那个男人见面地面上那个箭头，一直到了最上面，然后再从最上面用望远镜看下来。 怎么安排很美妙。
364,天使爱美丽,3,法国却是比美国有文化，美国也只能从高科技取胜，单纯的视觉效果做文章，但凡需要心理积淀的片子都迎难而退，相比法国就强的不是一心半点。
365,天使爱美丽,3,貌似很多人喜欢。。。我不是特别~~~
366,天使爱美丽,3,现在又觉得不是那么好的片子了
367,天使爱美丽,3,自闭天然呆的爱情故事。。。。
368,天使爱美丽,3,"浓郁的翠绿交织着暖暖的橙红，这样两种色彩无疑绘制了一张有点复古色彩的午后的溪涧之图。真地非常美的色彩。
片中每个人都有着奇怪的小屁好，就像现实中的孩子，琢磨不透的小屁好。我们也曾有过，只是遗忘。
女主角有着诡异的微笑，果然非凡间人。与片子的基调配合地绝妙"
369,天使爱美丽,3,法国文艺片的色彩向来很漂亮.... 不过老实说，很多时候剧情都太瞌睡了...
370,天使爱美丽,3,很可爱很迷人很美丽的爱美丽，所以是给爱美丽的女孩子看的。
371,天使爱美丽,3,隔了很久才看 法国的电影画面都很迷人很复古 超级喜欢里面的那个环游世界的小矮人 里面的温暖的台词和镜头都很治愈 没有你 良辰美景更与何人说
372,天使爱美丽,3,介乎很有意思与相当无聊之间的一部片子。法国人融到骨子里的浪漫气息，小清新和真文艺应该会喜欢。爱美丽是个真正随心而活的人，这种人或许也可称之为奇葩。
373,天使爱美丽,3,画面手法什么的都很喜欢，就是讨厌这个故事和这个女主角。
374,天使爱美丽,3,众多华丽电影手法堆砌的一个普普通通的故事
375,天使爱美丽,3,第十放映室的解说更有趣些
376,天使爱美丽,3,蜻蜓一分钟扇多少下翅膀？14600次左右。
377,天使爱美丽,3,随兴而活的人生赢家，Amelie一定也是个双鱼座！
378,天使爱美丽,3,讲了一个傻娘们的事，完全不知道哪里好看
379,天使爱美丽,3,2018年12月28日22:07:14，一个月前在开封的时候看过一部分，以前一直以为是个时尚片，却原来是个交流沟通相关的心理片，很不错的设定
380,天使爱美丽,3,色彩不错，但是不喜欢情节，感觉女主角有点神经质
381,天使爱美丽,3,"感觉没有预想的那么好，但是爱美丽还是很幸运的~~
"
382,天使爱美丽,3,怎么说呢，反正第一次是没看完就放弃了……
383,天使爱美丽,3,画面华丽 只是小清新的风格和法国强烈的情调主意  我实在无法融入 
384,天使爱美丽,3,影响女人一生的10部电影：孤独
385,天使爱美丽,3,说实话我看不太懂，也许我没太认真，下次找机会再看一次
386,天使爱美丽,3,朋友推荐的，没啥感觉，法国人的浪漫奇幻为什么我很不理解，(⊙o⊙)？？？
387,天使爱美丽,3,我真的不明白那么多5星是怎么打出来的。。。断断续续总算看完了。。。不给差评我已经很给面子了。。。Audrey Tautou对我来说真的是丑的没边了。。。
388,天使爱美丽,3,竟孤独常有，爱情不常有；孤独是永在的，爱情是偶然的；孤独是宿命的，爱情是奇迹的。
389,天使爱美丽,3,太单纯了，不适合我这个老头
390,天使爱美丽,3,不知道是否是感冒的缘故，未能专心看后面那部分...不过我真的不喜欢这种片，没有吸引我的能力了...
391,天使爱美丽,3,这玩意儿看不懂啊
392,天使爱美丽,3,不 喜 欢 女主角！
393,天使爱美丽,3,以前就看了四十分钟，后来就没接着看了，知道看完《丹尼海格》，才突然想来重温法语的美妙……
394,天使爱美丽,3,只是因为音乐不错。。实在无聊
395,天使爱美丽,3,真心Ψㄌm西影不感冒。。。
396,天使爱美丽,3,都说这部电影描述的是一种平淡中的幸福，但我感觉这部电影平淡的太过乏味了，虽然有些细节很有意思，女主角也很讨巧，但是此时此刻，我此时的心境，我这能给它三星，看着这部电影好评如潮，评分超高，我就果断做一次非主流吧。。。
397,天使爱美丽,3,原来就是这么个简单的故事而已……啊……
398,天使爱美丽,3,这部电影就是要告诉我们爱情要勇往直前吗？！
399,天使爱美丽,3,太过想象，太过扯淡。。。女主嘴唇很不好看。。为嘛海报给我有种吸血鬼的感觉
400,天使爱美丽,2,我觉得超级无聊
401,天使爱美丽,1,"也许女生很喜欢,但我怎么也喜欢不起来...漫长的婚约比这个好看多了."
402,天使爱美丽,2,从这部开始不喜欢法国电影的。。
403,天使爱美丽,2,女人太矫情没意思
404,天使爱美丽,2,因为专业原因看的法国电影，一直都有人推荐这部电影，估计被吹得太高了，看过之后觉得很一般，好吧，我想说的是非常一般。
405,天使爱美丽,2,悲哀是：@女人碛幸蛔f般想像皆成真的剖澜纾她的想像力s是如此俗套、平凡且乏。
406,天使爱美丽,2,我承认我EQ，IQ都很低，想不通那么多五星怎么打出来的。2年前看第一遍看完了一点印象没，今天再看，57分钟的时候忍不了了。神马时候我才能到境界。。。！！！
407,天使爱美丽,2,这就是无法欣赏的所谓的大家公认的好片
408,天使爱美丽,2,蛮傻的电影居然这么红。。不好意思再打低分了。。像法国人的雷锋故事。。法国女郎世界闻名Audrey Tautou有这么出挑吗？？
409,天使爱美丽,2,深度yy 所以可以预见地在豆瓣获得高分 真按这种法子生活 是会害死人的 两分给片头 
410,天使爱美丽,2,五彩_的童糖果。大s是七八年前看的 看完之後一^F水又莫名其妙。^度浪漫而]有重c永h是法影的通病。
411,天使爱美丽,2,法国人就喜欢这种捉迷藏式的爱情，一天中除了爱和助人为乐什么都不用想，让我这生活在水深火热中的人深深地感受到水之深火之热
412,天使爱美丽,2,= =怎N有@N高的分...我分了好状谓K於看完了它...o聊到家了啊 而且Y面的人笑起矶我一跳- -
413,天使爱美丽,2,继续完全get不到法国电影，amelie作死了，只记得男主角好性感！啊！
414,天使爱美丽,2,直到最后十分钟才整明白它到底要表达什么，法国包装下其实是典型好莱坞爱情片内核。要说这片子不好可能一部分着迷于该片梦幻气息的人要起来革命。美术很好，音乐很好，但不是我的菜，总结完毕。
415,天使爱美丽,2,一颗星给浪漫的画面和色彩，一颗星给好听的背景音乐。不明白这么乱七八糟的剧情为毛要拍两个多小时，为毛得奖。是我口味重了么？欣赏不了小清新？好无聊的片子
416,天使爱美丽,2,"CONTROL+A+""重庆森林""+CONTROL+C+CONTROL+V=LAME!"
417,天使爱美丽,2,在我心中，美好的女人不应该是这样的。在我脑海里，歌舞片是和好电影不沾边。This is it.
418,天使爱美丽,2,太文艺了，我俗人接受不鸟，尽管是很早以前看的不记得情节了
419,天使爱美丽,2,很无聊的人生，老百姓自己哄自己的人生
420,天使爱美丽,1,神烦这种只有美图画没有真情意的绣花枕头电影。
421,天使爱美丽,2,看的老子真他妈的蛋疼   拖沓的剧情让我受不了   剩半个小时的时候坚持不下去了   想给一星的  可想想音乐和画面都很不错   就下不了手了   真尼玛不明白这高分怎么来的   人众无知效应还是是因为这玩意儿不对我丫口
422,天使爱美丽,1,不喜欢看，不喜欢女主的相貌。看的国配版本，给女主配音的声优太恶心了，虽然声音挺好听的，但声音相貌明显不搭。在中国如果有一个爱米莉，对于她这种行为，别人肯定会觉得她是在多管闲事、吃饱了撑的吧。。。
423,天使爱美丽,1,不知道在干什么，欧洲文艺片再一次挫伤我
424,天使爱美丽,2,"这已经不是小清新了，这是作。为啥豆瓣星评那么高。。。r(￣￣"")q"
425,天使爱美丽,2,各种小清新癖好之滥觞，实在恶心到我了
426,天使爱美丽,2,-- 要多不困才能坚持看完。。。
427,天使爱美丽,1,烂极。是我接受不了这浪漫。开头其实很吸引我，越往后越难以接受这循序渐进的平庸。我不懂如此戏弄别人的妹子真的是天使？教育街坊一定要这样low吗…然后追汉搞得这样复杂矫情？开头的铺垫也完全没有优秀的呼应…最后，我最不懂的是这分数。
428,天使爱美丽,2,"我印象中只看过两部法国片""天使爱美丽"" 和 ""两小无猜""，都看不下去。
于是我得出一个结论，法国片真鸡巴烂！"
429,天使爱美丽,2,她的梦不是我的梦，无法体会
430,天使爱美丽,2,故事没有冲突，画面再漂亮又有什么用？
431,天使爱美丽,2,怎么找了个如此哥特的女的来演，整个电影和Emilie的笑一样SB，配乐倒是不错。不知道怎么这么高分，在我眼里就是个SB文艺片。
432,天使爱美丽,2,女文青就爱看这个？我去。。。
433,天使爱美丽,2,不看影评，几乎看不懂要说明什么
434,天使爱美丽,1,惭愧，我境界不高，睡着了。
435,天使爱美丽,1,我就没懂 为什么都说这个电影好看 难道是因为演员？我勒个去 一文艺片 不是我的菜
436,天使爱美丽,1,第二次尝试，依然没有看完这部号称经典的电影，实在是不知所云，电影里面的确有大量的细节，但是粗糙如我，实在品不出这些细节的来由，目的和趣味，对不起，这次重看也只坚持了一半，放弃了，以后应该也不会再看了
437,天使爱美丽,1,看了半个小时  实在看不下去了  少有的让我结尾都不想知道的电影
438,天使爱美丽,2,"
啊啊啊啊，我不喜欢法国片，不知道为什么有人喜欢，额额额额额额，"
439,天使爱美丽,1,一个旁白在罗里吧嗦的说着难听的法语~
440,天使爱美丽,1,"对这种风格无感，看了一下没看了。各种卖弄镜头，半天放不出个屁来！记得以前好像看过，不知道当时有没有看完
"
441,天使爱美丽,1,再次受不了法国的文艺
442,天使爱美丽,2,稍稍长点年纪再看感觉截然不同。矫揉造作，耍小聪明，配上太过饱和的色调感觉更不舒服。
443,天使爱美丽,2,这等程度，也太矫情了吧
444,天使爱美丽,2,大概是我审美观出问题了吧，大家都给了5星
445,天使爱美丽,2,我不知道，其实我不喜欢，拐弯抹角
446,天使爱美丽,2,我看了很久，而且终究看完了，然后还是没看懂。。为什么评分怎么高？能总结为一句话么，好人有好报，是这意思吗，这种片太不对胃口了，噢，对，可爱的骨头好像也是这种风格。。。对了，看海报我一直以为是强尼戴普演的，汗。。。
447,天使爱美丽,2,全片用快进4倍的速度看完了，发现没错过什么，没漏掉什么...多给一颗星为了那绚丽的色彩运用。
448,天使爱美丽,2,经典的片子吗？好吧，我看睡着了
449,天使爱美丽,1,噗！这是看完后第一个反应！这部居然是法国经典爱情电影而且是高分而且是豆瓣top250啊！！！无力欣赏，觉得非常无聊的一部电影，完全能把人看睡着。
450,天使爱美丽,1,"WHAT THE SHIT, BORING"
451,天使爱美丽,2,真的很无聊...没有高潮
452,天使爱美丽,2,处处流露着精致 不过不喜欢
453,天使爱美丽,2,我想说为啥我觉得这个女孩神经病呢，原谅我不能理解，但是那种法式的浪漫与电影艺术还是很赞的。
454,天使爱美丽,2,让我好好想想，讲了什么呢。
455,天使爱美丽,2,法国第一次的喜剧片我不喜欢
456,天使爱美丽,2,看不懂，莫名其妙
457,天使爱美丽,2,拼图照片的设置有点意思，其他真的一无是处。沉溺琐碎与虚无的日常，处处透露乏味与无聊，缺乏人物的成长变化，缺乏故事的曲线转折。花费十分的注意力却得到一分寡淡的趣味。道貌岸然，装逼扯淡，故作高深，金玉其外，败絮其中，虚伪做作，迂腐愚昧，学雷锋学上瘾了，可能自以为很小资很精致很有品。天使爱美丽？文艺片？呵呵呵。
458,天使爱美丽,2,无聊。我只看到一个童年史有裂痕，性生活史空白表征个体引致妄想狂的频繁发作，沉浸于中无法自拔的案例。
459,天使爱美丽,2,头一次这么讨厌文艺调调，看来偶是无法接受法国人的电影了- -
460,天使爱美丽,2,真的搞不懂女人都在想些什么
461,天使爱美丽,2,感觉不怎么样~
462,天使爱美丽,2,太让人失望了_分了好多天看今天才看完。除了塔图很美以外还有别的吗
463,天使爱美丽,1,给人印象很深刻，比《阿甘正传》好一些。
464,天使爱美丽,2,我承认我看不懂法国文艺片，思维太跳跃了，不理解
465,天使爱美丽,2,不是我的菜。我嗬mm看了状危是看不完
466,天使爱美丽,2,我本人很不喜欢这种分开来完全知道在讲什么，合起来完全不知道在讲什么的，文艺的感觉
467,天使爱美丽,2,没有那么深的感触。。。感觉很无聊，耐着性质看完，也没体会到任何所谓的情感。只是觉得这个丫头为什么那么。。。。一点都不可爱
468,天使爱美丽,2,人生就是简简单单，一股济世情怀突然涌起。要是这部电影能像这句话一样爽朗多好呀，可惜。不过电影的价值，不就是用来发现世界上还有这样的人这样的脑内世界么，从这个角度说我尊重这部电影，只是它戳不中我的点罢了。“此后他一生喝罗宋汤戴毛帽，不过这样的男人爱美丽认为不要也罢”，这里笑了。
469,天使爱美丽,1,要静下来才看得下去
470,天使爱美丽,1,看不下去的名片之一，可能因为海报上的奥黛丽塔图不合眼缘吧。
471,天使爱美丽,2,好乱。。。文艺女青年的各种小心思  法国片真是
472,天使爱美丽,1,完全读不懂法国式的幽默。。。
473,天使爱美丽,2,"看了几分钟就看不下去了。
除了色彩很。。。不知道怎么描述。诡异的悲观的色彩。我不知道为什么叫做喜剧。"
474,天使爱美丽,2,看过很多次都没有看下去，这个经典把我砸到了，我就是不喜欢不喜欢~~~也不认为奥黛丽・塔图是个美女，她长的那么奇怪，没发现么？
475,天使爱美丽,2,要不是女主长得还可以，颜色的处理还不错，真的很难看下去！
476,天使爱美丽,2,真的看不下去
477,天使爱美丽,2,这部文化上完全不正确的影片却取得了如此好的票房成绩，真是讽刺。
478,天使爱美丽,2,看到一半就放弃了。。说实话，没发现特别好看的地方=。=恕我品味接受无能，觉得好无聊。。。
479,天使爱美丽,1,"[2013.12.28]第一,海报就够惊悚的,我以前以为是恐怖片;第二,电影前十分钟好压抑;接着,看了一半下来完全不知所云,还有法语真是难听的要死"
480,天使爱美丽,2,看不下去啊 太散了有点。。
481,天使爱美丽,2,"除了电影画面色调很美,真心觉得片子很一般啊.... （这么高分数哪来的？疑惑中？？？）"
482,天使爱美丽,2,很喜g勖利的小怪癖。
