,movie,star,comment
152,天使爱美丽,5,"爱幻想的艾米丽喜欢观察身边的人，他们开心的和不开心的人生，他们藏在心底的童年，还有他们散发着荷尔蒙的爱情味道，都逃不过她的眼睛。
她一个人用自己的心和行动来温暖身边的人，谱写出一群人的奇幻故事。又甜又暖，帮助电影中人，也治愈着看电影的我们。"
153,天使爱美丽,5,乐观的人生让人突然觉得世界的美好
154,天使爱美丽,5,太好了 每一秒都是那么好 那种感觉 实在是享受啊！ 这项让他一直演下去。有笑有欣慰，有感动，天马行空想象独特，我爱死他了，真是只有五星。
155,天使爱美丽,4,Similar to Chungking Express and The Shoe Fairy!
156,天使爱美丽,5,世界上最迷人的眼睛你是其中之一，大大的眼睛洁白的眼球。长而翘的睫毛，翘的我魂都没了。爱美丽，你是天使，却勾起了我无尽的后悔。幼稚的年龄傻了吧唧考虑太多，听尽别人谗言，舌头底下压死人，去你妈，以后再别不在乎别人的看法。后悔当初，我应得。
157,天使爱美丽,4,电影用非常独特的拍摄手法，把一个精灵古怪的女孩子活灵活现的展现在人们眼前。除此之外，电影中每一个配角的个性也都十分鲜明，令人印象深刻。
158,天使爱美丽,5,不停地给植物打洞的退休检票员，不断重复画雷诺阿的玻璃人，傻傻的蔬菜售货员，沉浸在逝去的爱情故事里的婆婆，你是他们中的谁？
159,天使爱美丽,5,喜欢打水漂的爱美丽，收集快照和脚印的连诺，珍藏着丈夫情书的房东，画着同一幅画的玻璃人，只有一只手的傻子，神经兮兮的烟摊售货员，拿着袖珍录音机的男人。。。。。。其实，谁不是怪胎呢？只是大家都在互相支撑着组成自己的生活。看完这部电影，我又想起了你，可能看不见我这句话的你。
160,天使爱美丽,4,经典好片儿，4+；女主角挺漂亮的，戴上眼罩嘴角非常像《海扁王》里的小侠女；老外的感情有这么含蓄吗？特别是法国这种地方，表示怀疑。
161,天使爱美丽,4,在中央6套看的，当时还很小，初二，看到艾米丽与男友亲热的画面，我还捂脸了。OST很赞呐
162,天使爱美丽,5,"yann tiersen,音乐与画面的完美结合,我不能忘记法国这特有的情怀"
163,天使爱美丽,5,画面太美了！童话式的色彩充盈着屏幕，浪漫的手笔~~爱美丽的小小魔法，或者是可爱的小伎俩，让周围充满爱~所以，天使爱美丽自然可以拥有自己的幸福~快速照相亭边的浪漫相遇，这是怎样一场邂逅！爱幻想，爱做梦，爱天使，爱自己，爱生活~~
164,天使爱美丽,5,"没有你，良辰美景对谁说?人生就是失意,不断排练,却不上演.有的时候,活在自己的世界里也一种幸福。是不是?周游各地的小矮人?"
165,天使爱美丽,4,一个爱情的精灵，怯懦，害羞，感觉像是小松鼠，可是爱情的的小天使还是射中了她喜爱的男人，2个人骑着单车飞梭于城市的街道中，也许最平淡的也能够使最甜蜜的。
166,天使爱美丽,5,美丽的童话
167,天使爱美丽,4,以前一直就认为法国电影文艺，今日事领略到了。其实感觉着电影都带有科幻性质了。希望自己身边也有个艾米莉。
168,天使爱美丽,5,第一次没看懂，还想有空找来再看一下。看过第二遍很多感触，不过怎么都好喜欢艾米莉，喜欢助人的乐观的有想法的天使。她折腾老板的那些小伎俩就好像我们生活中扎得我们不得安生的小毛刺一样，无伤大雅，但是难受得要死，太绝妙了。
169,天使爱美丽,4,温暖人心的故事，法国式的浪漫……
170,天使爱美丽,5,告诉你怎么坚强乐观的活着的一部电影，与其每天自怨自艾不如坚强乐观的活着，每个人缺点，你要做的就是好好活着，总会找到生活的亮点的
171,天使爱美丽,4,"抱着灵动的心，闪耀的眼睛去感受去看待这个世界（没有想到，爱乱想的人这么多）
推荐是因为摄影不错"
172,天使爱美丽,4,色彩调度运用的很棒。
173,天使爱美丽,5,太喜欢全片色调了，以后拍法国浪漫就全都是这个色调。我发现我还是喜欢看女性电影..这个片子只有女孩才会产生共鸣吧~男生肯定觉得很无聊..最后艾米丽躺在床上抱着她爱的男人的那种感觉....
174,天使爱美丽,5,手风琴小调真是浪漫。这部影片色彩好漂亮。艾米丽真是个漂亮善良又古灵精怪的好姑娘。原来她还是“整蛊专家”，有木有，玩过这个游戏的都知道。法国的街景还是那样怡人。每个人都有自己的麻烦和苦恼，如果能相互帮助，相信会“结善缘得善果”。
175,天使爱美丽,4,三星半/影像虽然有特色的但是走得并不如韦斯・安德森那样远吧，熟悉的配乐响起还是会脑子嗡嗡响。然而单论故事，虽然有时被浪漫情结打动，但是总有甜腻的不适感，甚至感觉和现在灵魂有香气的公众号热文如出一辙。某种程度上证明了造梦的局限和过度传统性别话语对美感的破坏。
176,天使爱美丽,4,8错~ 我看懂了起码。嘻嘻~ 怪癖和诡异没关系，谁没一点病？找到一样可以治愈你的东西~ 就幸福了~ lovely girl~
177,天使爱美丽,5,这几年看过的最有意思的爱情电影了。真实，一点不做作。
178,天使爱美丽,5,emily emily what a card u r and u fix
179,天使爱美丽,5,突然感觉好久没看过好电影了。。。要是也能做个这样的女孩，就好了。。。（那天看了《天使爱美丽》，看完已经很晚了，可我情不自禁又点了播放，而且如果不是看到一半电脑死掉了大概会再看一遍。这几天我一直想着要再看一遍这件事，想起来就觉得无比美妙。这真是一部神奇的电影，做一个那样的女孩子，多么好。。。20080121）
180,天使爱美丽,5,生活可以很美。
181,天使爱美丽,5,Quintessential Audrey Tautou. Quintessentail French Romantic Comedy. 10 out of 10
182,天使爱美丽,4,非常好，让我觉得生活是一件特别神奇有趣的事。色彩很好看，整个拍摄、叙事手法我也很喜欢。以前以为是无聊文艺片，现在发现文艺但不无聊。女主角不知道为什么让我想起了王菲，而且又机灵又可爱，真是太喜欢了。要是有个女的那么对我我就嫁了
183,天使爱美丽,5,女孩子，不管她是否看起来神经兮兮，是否工作普通，甚至不敢与男孩说话，都不能阻挡她爱幻想和追求真爱的勇气。这恰是我所喜欢的女孩子。
184,天使爱美丽,5,"进别人的房子

随意支配本应属于别人的东西

其实有些小小的变态~~~~~~~"
185,天使爱美丽,5,没事拖出来看一遍，以致于看得太多遍了。为了防止不再多看下去，我把她删了
186,天使爱美丽,5,一部充满活力，如精灵一般古灵精怪的电影。我们从艾美丽的生活态度中看到了阳光一般温暖的希望，其实生活本就如此，无论你是平庸，是出众，都需要一些快乐正面的能量来填充，保持跳跃的想象力不是什么坏事，它既是生活的动力，有时候还会带给你的惊喜和奇迹――这就是生活的真谛。
187,天使爱美丽,5,墼聿皇且釉~?介系法立文小清新? 艹，AZ市鲞B小清新都慢半拍；我自己都不缘寐了装倌...抽。皮埃斯：T太系一^渡口。
188,天使爱美丽,5,看了心情会很好，全心全力关怀他人 总比自怨自艾来得好。我想我的世界也这么美丽就好了~女主真是个简单可爱的美丽天使
189,天使爱美丽,4,纯净暖和的色调，欢畅明快的旋律，花样迭出的摄影，眼花缭乱的剪辑，童话般天马行空的想像力，王家卫式絮叨先锋旁白，法式浪漫的极致。
190,天使爱美丽,5,很久之前看的了，当时确实没怎么看懂，只觉得是个爱幻想的姑娘；几年后重温，真的收货不少～认真对待生活，去感受生活，会发现异样的精彩，是过去的自己不曾找到过的；即使生活不会每天处处惊奇，但是只要有一颗渴求，有向往的心，平淡的生活依旧美好
191,天使爱美丽,4,"艾米莉・普兰――父：医生/母：教师；
奥黛丽・塔图――父：牙医/母：教师。"
192,天使爱美丽,5,上帝作证，艾米莉是个快乐的好姑娘。
193,天使爱美丽,5,很特别的一部电影，用很有特色的方法叙述了一个平常女孩的平常生活
194,天使爱美丽,4,看了几个欧洲的片子都是色彩浓厚，加了什么滤镜，感觉想正片负冲效果。故事细节很温馨，很舒服，但是整体情节而言有点缺乏吸引力，这也是我最初看完跟没看一样的原因。
195,天使爱美丽,5,kodak的气息浓浓呐，百度了下，果然是250D和320T
196,天使爱美丽,4,印象最深的是当发现相簿里出现的神秘男人不是鬼而是修理工时，整个人一下欣慰了，有些看起来神秘不可捉摸的怪事，认清时有些许哑然失笑的温暖
197,天使爱美丽,4,我对本片的剪辑和摄影师的技术是由衷的钦佩的，可电影里那种女性面对爱情的各种YY和疯狂并没有俘虏我的心。好吧..我承认我大男子主义.....-_-
198,天使爱美丽,5,"漂亮的颜色的细节,独特的叙事,还有美丽的奥黛丽61塔图,原声音乐碟也不错!"
199,天使爱美丽,4,我不知道是冥冥之中有天意还是怎么的，昨天的书中一直在讲这部剧，然后晚上到家，正好开演开头，于是饿着肚子，一直到片子结束，期间还幻想了一下想什么来什么，这是要中奖啊，结果肚子饿过火了，不好玩，片子感觉一般吧，或许是饥饿的原因不能让我沉浸其中，又或者是心里想别的事情，让我不能专心的欣
200,天使爱美丽,3,配乐大好，剪辑大好.别的不够好. 至少不对胃口 到现在只对片子最开始的部分 也即艾米莉的自述印象深刻了 尝试做爱如何，但是感觉不太好. 那个微笑的表情
201,天使爱美丽,3,看名字就不怎么想看的一部片子，果然片子色彩那么美，女主角长得也不错，性格很萝莉，但就是不喜欢。她整水果摊老板的手段太刻薄了
202,天使爱美丽,3,剧情没有想象中的那么好，但是画面跟配乐都超一流
203,天使爱美丽,3,不感冒，甚至都没看完。。。哪儿好啊！？！？！？
204,天使爱美丽,3,"莫非是我有毛病？欣赏不来这部法语片？
剧情真的很一般，没啥特色，我坚强地看完了，人物都很神经质……
不懂为什么分数那么高，只能这电影不合我的口味。
有一个亮点，就是片子的打光唯美又温暖，风景也很漂亮，爱死了"
205,天使爱美丽,3,嗯……其实不是很打动我，热内其他的电影我更喜欢
206,天使爱美丽,3,"心思灵动的女孩，自娱自乐又助人为乐，用善意慰藉周遭的忧郁，用微笑延伸生活的色彩，自己也终获好运的眷顾，遇见希望的人和事。梦一样的故事，少了尘世喧嚣的侵扰，贯穿不可撼动的希望，精致镜头，鲜艳画面，天使般纯粹的喜怒哀乐，感染每个心怀小世界的人。 
"
207,天使爱美丽,3,影片全程都是满满正能量，虽然女主角发生的事情并不好，果然努力生活比颓然度日会好很多！
208,天使爱美丽,3,"爱情从来都是叫人捉摸不定的奇妙之事，有时候，你觉得自己有了足够的条件去爱，却未必能得到所爱之人同样的爱；有时候，你觉得自己过于谨慎，似乎拉大了彼此的距离，却能收获足够令自己幸福的爱。
"
209,天使爱美丽,3,欣赏无能，被迫看了好多遍都没法喜欢。
210,天使爱美丽,3,女主的想法天马行空，看起来还有些许浪漫，但是我get不到。
211,天使爱美丽,3,个人不喜欢 有种诡异的感觉
212,天使爱美丽,3,想象力是标签，却不出彩；真善美是本质，而不深刻。太热情的热内，如何把致郁拍出治愈，应是个文章课题。
213,天使爱美丽,3,很多人大力推崇的片子。但是这个片子，我就是看不下去，我就是强迫自己 看完了之后再想这到底想告诉我们什么。
214,天使爱美丽,3,说实话，看这部电影只是为了回忆巴黎，地铁站，蒙马特高地，圣心大教堂，街边的小餐馆，还有巴黎的味道和一点一滴的美好。
215,天使爱美丽,3,类似《机遇之歌》《罗拉快跑》那般讲述命运无常却又充满定数的《天使艾米莉》是一部广为人知备受推崇的电影。这部概念先行的作品正如影片中生锈的铁盒抑或是遗落的皮包，里面塞满了作者年近半百的私人记忆。可惜拥有天使面容的艾米莉根本不是天使，她是一个深受童年阴影（魔鬼）操控的（圣诞老人）孩子。精雕细琢的本片浪费了许多时间着墨于明暗不对等的 “爱情”，却忽视了她与原生家庭（父女）的关系。这也是为什么她迟迟无法接受这段上天注定的缘分，而只能活在虚无缥缈的幻想里。我们看到导演于十年后的《斯派维》里做了减法，反而取得了优异的成绩。热内将亲情揉进爱情永动机展现了他天真和浪漫的一面，然而那些颇具感官体验的视觉呈现更像是一场华而不实的炫技表演。
216,天使爱美丽,3,巴黎朋友热心地指给我：这就是爱美丽的那家咖啡屋，我都懒得走过去看看。于是我发现，我确实对此片不感冒，基本上，这是个儿童片。
217,天使爱美丽,3,小时候那段让我印象深刻，感觉有些神经质。不过后面越看越觉得这只是个铺垫，抛开一切，就觉得这样才是活着。
218,天使爱美丽,3,在电脑里不知道压了多少年从来没有想要看过，好不容易刷一次大银幕，开篇20分钟果断boring得睡着了。命中注定和热内气场不和，无奈摊手。
219,天使爱美丽,3,我感觉有点无聊
220,天使爱美丽,3,文艺风格虽然不是我的喜好，但这样一个爱美丽，仍然让人喜欢。她善良，调皮，古灵精怪，不敢爱，却又想要爱。她用她的方式过着平凡的人生，生活就应该去冒险。恭喜你爱美丽。
221,天使爱美丽,3,说实在的 一个对生活细节很在意的人不会给这个片子评5星。3星给的是摄影师和色彩师
222,天使爱美丽,3,我也幻想能坐在你的后座上，紧紧抱着。然后看遍城市里的每一个角落。
223,天使爱美丽,3,Amelie搀扶看不见的老人一边快速行走一边讲诉她看到的一切 Amelie撮合爱情失意的咖啡店同事和变态男最后在咖啡店厕所大战 Amelie最后把自己喜欢的男生拉进房间然后他们互相亲吻 我喜欢这三段 其他无感 PS：是不是觉得这部经典好看的大多数是女生？
224,天使爱美丽,3,很典型的一部法国影片。有一种魔力吸引你。一个天使Amelie心里有自己的一个美丽世界。95
225,天使爱美丽,3,应该说，这个艾米莉是奇特的人，有点阿暴的那种。
226,天使爱美丽,3,如同一个现代版的魔幻童话，法国人将他们浪漫至死发挥到了极致，一张照片能4人对话、咖啡厅厕所内做爱的剧烈震动、爱美丽和连诺的浪漫游戏。。。这不太像一部电影反而像是导演的个人臆想，不可否认本片的音乐色彩等等都美妙至极，但是抱歉，我真不习惯这种电影。
227,天使爱美丽,3,没有想象中的那么牛两个月前看的。如果是高中的时候，或许我会爱上的吧
228,天使爱美丽,3,不是我喜欢的类型，起了好多次头，终于耐着性子把这部片子看完。这个女孩确实很个性，不惜大费周折的做着每一件事儿。不过她的眼睛很漂亮。
229,天使爱美丽,3,黄绿色和红色的主色调搭配非常考究。她虽然生活很惨。但却始终以豁达乐观的态度待己待人。她虽没有做过什么惊天动地的救世，却一点一滴的尽己所能积德行善，这何尝不是一种境界。但如果爱美丽真正存在的话，又能有多少人不去嘲笑陷害她？善人总是没有善报，这个世界怎么竟如此荒唐？我们需要更多爱美丽
230,天使爱美丽,3,电影的色调处理成了和lomo相片一样的风格，这种色彩风格表到该电影的主题挺合适的，觉得法国人都挺疯的。
231,天使爱美丽,3,片中一些关于爱情段落的设计还是蛮有创意的。
232,天使爱美丽,3,我老觉得女主角长得很像巧克力工厂的男主角。很喜欢老人过街的那一段，好像整个世界一下生动起来，非常可爱。呵呵，她父亲也很可爱：）女主角的眼睛真是漂亮~。。但有些地方让我觉得很生硬。
233,天使爱美丽,3,似乎讲了些什么，但愣是没看出来，不过不可否认，真的很浪漫，画面很精美!
234,天使爱美丽,3,3.5失望....是忍着看完的，本以为结局有亮点，可惜没有。我感动点这么低的竟然没被触动到，情节有点混乱，层次不分明，基本无高潮...不过画面和细节真的很不错，而且超爱的那段配乐总算找到源头啦~~
235,天使爱美丽,3,只是一颗糖，不似韦斯・安德森的糖霜药丸。
236,天使爱美丽,3,真的不明白她美在哪里？那种情景的美感不是我所能体会到的
237,天使爱美丽,3,坚持看完了这部电影，只能说是为了看奥黛丽・塔图，当然还有看法国人的小资情调，让我觉得惊叹的法国人嗜好，其他我都不想看，就欣赏了法国的风景，法国的人文，法国的音乐，法国的美女，法国的情怀
238,天使爱美丽,3,终于又看完了。除了音乐和色调，其他的欣赏不了。唯一有感的是男人指着蝙蝠女郎问爱美丽这是你吗，她说不是。觉得这片子90分钟就够了，有点长。
239,天使爱美丽,3,这个电影原声。唉。被央视某台用烂俗了。
240,天使爱美丽,3,"很有名，但我好像有点欣赏不来~
再一次证明 我哪出问题了~"
241,天使爱美丽,3,文艺---“懂得成语的人不会坏到哪里去”，好文艺啊~
242,天使爱美丽,3,"大概不太喜欢怪诞风格的电影吧。
喜欢，又不是那么喜欢，不过，看一看，到是挺有意思的 。故事有意思，不落俗套，猜不到接下去会发生什么。"
243,天使爱美丽,3,故事挺好的，奥黛丽小姐演绎得很到位。可我实在是欣赏不了法国人的浪漫啊~~~那碎碎念的旁白令我十分头疼。。。
244,天使爱美丽,3,"只是觉得这个女孩有一种特殊的气质 没太感觉出来主题
"
245,天使爱美丽,3,好早看的，总的来说我还是不喜欢怪里怪气的法国的电影，好话唠，这部算还行的
246,天使爱美丽,3,或许你是很好很好的，只是我不喜欢而已。
247,天使爱美丽,3,法国文艺片。 多情的色彩，精灵般的女孩~ 就是这样
248,天使爱美丽,3,"多看点儿好动画就觉得这没什么了。
本来想给四星 一看五星那么多 就给了三个"
249,天使爱美丽,3,"我分3天才看完
其实有点而无聊- -"
250,天使爱美丽,3,开头结尾挺有格调，中间部分令人觉得女主角人设实在是太闲的蛋疼。 此片还可改名为：爱美丽教你如何艺术的搞对象。
251,天使爱美丽,3,三w星是oS富蚀_的R^\雍兔垒美J的tG色彩搭配的。不明白什麽@N文的片子得@N高的分？法Z著就[心~
252,天使爱美丽,3,其实很一般，只是女主角的头型很有意思。
253,天使爱美丽,3,"不太懂。
法国女人要么极靓，要么极丑。"
254,天使爱美丽,3,配乐和剪辑都挺好的，就是剧情没有想象中的那么好。
255,天使爱美丽,3,"Sans toi, les émotions d'auujourd'hui ne seraient que la peau morte des émotions d'autrefois.  

"
256,天使爱美丽,3,三年后坚持看完整部电影，还是感觉神经质和做作，过多的互动镜头显得电影不自然。奥黛丽・塔图怎么像精神病院跑出来的，笑起来有些恐怖。
257,天使爱美丽,3,其实并没有打动我，也说不上喜欢，浮于表面，表面功夫做得很足，貌似也有个很大的主题和中心思想，但是大而无当，无法深入人心。觉得应该只值2个星，第3个星给非常非常文艺和小清新的画面以及非常非常文艺和小清新的拍摄手法以及非常非常文艺和小清新的台词以及一看就知道很适合拿来装逼的那股范儿
258,天使爱美丽,3,当时看觉得开头很有意思后面一般，但后来看到无数人填写喜欢的电影仅仅是这部我就生理性厌恶了
259,天使爱美丽,3,19 May 2012。噱^在哪e啊噱^在哪e 噱^在小朋友的心Y面？拈_^到Y尾的喜g程度和吸引程度呈fpB 後碇尼Z的矍橛很 c部oP地便感慨一下 我在太郯人精。
260,天使爱美丽,3,断断续续看完的，总提不起精神，三星半
261,天使爱美丽,3,1、前后共5次才看完，太磨叽了；2、在法国，make love 比表白更容易；3、性情相近的人才能互相吸引；4、女主角真不漂亮
262,天使爱美丽,3,为什么此片会是五星电影，可能我确实没有爱美莉的生活情趣
263,天使爱美丽,3,看完我一点感觉也木有，而且有点看不懂
264,天使爱美丽,3,没有想象的好，不过前半部分很出彩，后面有点不尽如人意。
265,天使爱美丽,3,"一场暗恋罢了。情事。
DD颜色太光影。DD我不太喜欢这片子。"
266,天使爱美丽,3,还行吧 就知道豆瓣的人会喜欢故弄玄虚的这种片 肯定觉得这电影有自己的神经病的影子。。。。。现在的人都以自己有神经病为荣 其实也只敢yy
267,天使爱美丽,3,2008.9.7 没那么好看啊
268,天使爱美丽,3,我不能说观看过程中没常展起欢颜，很多地方也着实是可爱的，但这套路玩七八十分钟就刚好了，足玩上两小时，也别说不累人。
269,天使爱美丽,3,色彩跟画面真的好 但故事情节不是我的菜
270,天使爱美丽,3,有时候每个人都有不正常的行为...
271,天使爱美丽,3,还行吧  电影课上讲色彩
272,天使爱美丽,3,这电影很好，但我很讨厌它
273,天使爱美丽,3,有些讨巧的谄媚，本科时期曾让我反感，但如今变宽容了，便觉得其实还是富有创新的浪漫电影。
274,天使爱美丽,3,女性视角的电影 很多情节都是有意识的拉拢女性观众 浪漫的法国人和精神病朋友果然只有一线之隔 电影前半段每个人那点私密的小癖好让人看得乐趣横生 电影的色调很不错 小清新最爱 3星不是说这部电影不那么好 只不过不是我的菜
275,天使爱美丽,3,有关这部电影的褒扬与影片是在太多了，我只想说，色彩、细节、音乐都无懈可击，但最征服我内心的是那份平淡中满满溢出的幸福与满足。
276,天使爱美丽,3,没传说种那么好看，电影颜色很漂亮，女主角也很漂亮就是，还有那个手风琴曲子很好听，被第十放印室当做片尾曲了。
277,天使爱美丽,3,目前不动amelie的美丽心灵
278,天使爱美丽,3,法国片饱满的颜色是一个特点，很早以前看的，却不理解为什么那么多人推崇。
279,天使爱美丽,3,虽然我知道这部片子是N多人的至爱。。。但是很遗憾，实在和法国片缺乏化学反应，虽然女主角长相甜美灵气，但是还是不知此片所云。。。
280,天使爱美丽,3,法国先锋，法国人都艺术
281,天使爱美丽,3,法国电影要不就是让人昏昏欲睡的实验性，要不就是看的脑袋疼的神经质。本片靠近后者多一些，不过看起来还算不错.....这小妞有点像某个人啊
282,天使爱美丽,3,我一个姐妹最爱的电影。却不算和我胃口。这种带点迷幻色彩的小清新电影。抱歉。我还是更爱情节跌宕的好莱坞。
283,天使爱美丽,3,画面精致，塔图在这里漂亮，我几次错认为是赫本，仅此。
284,天使爱美丽,3,可事实抱着太大的期望去看的，看完感觉很平淡，不过正是因为有这种人，世间才多了那么多幸福，很喜欢爱美丽的笑容，感觉能融化一切
285,天使爱美丽,3,盛名之下，难免期望过高。。。 不过绝对治愈系。。
286,天使爱美丽,3,我真不是文青，大胆说我没看明白！！BTW音乐很好，海报很诡异！
287,天使爱美丽,3,电影很拖，但是确很温馨
288,天使爱美丽,3,不知道为什么这么多人觉得好看，不觉得女主角的笑很假吗？
289,天使爱美丽,3,2001的话，应该说是部很不错的电影，但是不是我的菜。
290,天使爱美丽,3,不懂得宿舍的姑娘们为啥那么喜欢
291,天使爱美丽,3,不仔细品位还是看不懂。我就看不懂...
292,天使爱美丽,3,感觉过誉了。音乐，场景，色调，都挺好的，开头更是喜欢。就是整个故事不是很喜欢。
293,天使爱美丽,3,还不错，只是太文艺太法国太weak了！
294,天使爱美丽,3,本片讲述了一个乐于助人，不顾个人利益的好青年的故事。还有，电影的画面还是很不错的。
