,movie,star,comment
0,天使爱美丽,5,艾米丽扶着那个盲老头走过马路和天桥和无数商店，飞快地告诉他自己看到了什么，然后又像天使一样离开。
1,天使爱美丽,5,左上唇，右脸颊，左眼，右后脖颈。
2,天使爱美丽,5,有没有人觉得和重庆深林里的王菲有点相似？
3,天使爱美丽,5,看了心情会很好
4,天使爱美丽,5,浪漫到极至。
5,天使爱美丽,5,全心全力关怀他人 总比自怨自艾来得好
6,天使爱美丽,5,他I硭要的酵母淘獾亩阍陂T背後，撩雍子，一D身，Y果是那只可恶的黑，於是，她哭了。
7,天使爱美丽,5,Amélie请来到我的生活中，我们需要你
8,天使爱美丽,4,洋溢着法国人的性格风情
9,天使爱美丽,5,小聪明，小技俩，小阴谋，小可爱，电影是这么拍的。
10,天使爱美丽,4,浓重的法国情调，舒缓，镜头语言动听。女主角漂亮。唯一的不足就是……这样的爱情会不会太作了？爱情就是门口经过的大巴，现在不上，以后都不能再上了……
11,天使爱美丽,5,颜色！Tautou！细节！XX！四星。再想想，就五星了。
12,天使爱美丽,4,浪漫到骨子里，忧郁，神经质，跳跃，文艺是很典型的法国电影啊！喜欢的人为它如痴如醉，不喜欢的人看的昏昏欲睡，两种极端。我只能说非常好，非常适合一遍一遍地欣赏。艾米丽是天使，拥抱世人，容纳那些不美好。
13,天使爱美丽,5,我太爱她了
14,天使爱美丽,4,爱美丽自己有些不幸的童年，但依然有一颗乐观豁达的心。整个画面唯美浪漫，让人代入感很强，仿佛自己就置身于明媚的巴黎。
15,天使爱美丽,5,一个和我一样在寻找的天使　奔跑无止境却没有方向的天使
16,天使爱美丽,5,启蒙片
17,天使爱美丽,4,没有你，良辰美景奈何？法国式的温馨神秘，爱死了的爱情
18,天使爱美丽,5,视觉语言确实很厉害。简单，但是一点都不幼稚，非常成熟。而且其实也不简单，大广角，视觉特效，声音特效。背后的故事自然空无一物，但是制作非常好很有意思，视听上有意思。真人动画片
19,天使爱美丽,4,奥黛丽61塔图很完美的演绎了“艾美丽”这一角色，表演十分的到位，在古灵精怪的同时又很富有柔情与少女的情怀，十分的完美。
20,天使爱美丽,4,人生确实奇妙，小时候总嫌时间过得慢，一眨眼你已50岁了。童年回忆，只能靠旧盒子里的东西勾起。我现在已经30岁了，回想时间，过时觉得慢，现在却觉过得挺快的！爸妈都已头发发白，爷爷离我们远去了！
21,天使爱美丽,5,美丽的精灵 玩味的一笑
22,天使爱美丽,5,有谁不曾为暗恋而痛苦？我们总以为那份痴情是世界上最重的，有一天暮然回首，我们才发现，它一直很轻很轻。我们以为爱很深很深，岁月让我们知道，它其实很浅很浅。最浅和最重的爱，必须和时日一起成长。
23,天使爱美丽,4,讲给宅女听的现代童话，极致光影美，讨喜伪浪漫。让-皮埃尔・热内以随性诠释感性，就像摆脱了强迫症的韦斯・安德森，大师耍稚气。如果说好看、动听、可回味的电影并不一定需要好故事，那么本片就是明证，法式风情渗透在它每一个镜头的每一个角落里，帧帧如画，迷人而另类。
24,天使爱美丽,5,看了这个电影高兴，啊，世界真的很美好。
25,天使爱美丽,4,喜欢奥黛丽塔图，有一种纯真的狡黠
26,天使爱美丽,5,还要多说？
27,天使爱美丽,4,我喜欢那个古灵精怪爱搞恶作剧的爱美丽，她虽然童年不幸福却依然豁达开朗，乐观向上，这个影片就是讲述了一个现代版的灰姑娘的故事，构图精美颜色丰富，真的挺好看的。
28,天使爱美丽,5,天使爱美丽中，周围的人都是受伤者，都有自己的那份痛。爱美丽像一个天使一样，用无伤大雅的恶作剧，用奇特的想法，用她神经质的微笑去感染所有的人。
29,天使爱美丽,5,电影版的《心灵鸡汤》，仿佛温馨可爱的浪漫童话，不经意间就能打动你的心~~
30,天使爱美丽,5,很多人都想做这样的人，可当这个选择真的放在面前，我们通常只能放弃。
31,天使爱美丽,4,看了不下五次了
32,天使爱美丽,5,浪漫又清新 看到女主感觉看到了自己 在心灵深处保持纯真会让你变得更幸运更快乐 五星推荐
33,天使爱美丽,5,你永远也不晓得自己有多喜欢一个人，除非你看见他和别的人在一起。
34,天使爱美丽,4,古灵精怪，浪漫温和，赏心悦目
35,天使爱美丽,4,全片洋溢着浓郁的法国情调，画面唯美浪漫，情感细腻。
36,天使爱美丽,5,整片洋溢着法国人的浪漫，喜欢艾米丽
37,天使爱美丽,4,导演在整部片子如同艺术家精心涂抹的油画，色彩不繁杂，营造出法式的炫彩浪漫和节奏。
38,天使爱美丽,4,各种方面都挺特别的。女主的大眼睛好美。法国人真有意思呀…
39,天使爱美丽,5,超级喜欢！！Amilie打水漂的运镜美到害得我反复倒回去看了好多遍手机卡掉…色调、情节、人物塑造、配乐棒到无可挑剔，整部电影一气呵成毫无冗余，Amilie脑洞如此之大我竟无可反驳。太喜欢了，还是双语字幕1080p，舍不得删掉。我要一句一句把法语台词背下来，法国版重庆森林王菲桥段。
40,天使爱美丽,4,太喜欢女主，法国的浪漫苏到骨子里但也绝对不腻，天使爱美丽，实在太美丽
41,天使爱美丽,5,男孩子顺着地上的蓝色箭头去寻找谜一般的女孩，圣心堂前面的白鸽受惊四散飞起，真是无与伦比的浪漫。
42,天使爱美丽,4,最喜欢奥黛丽61塔图的笑容，满满的温暖向上的感觉。
43,天使爱美丽,4,如果注定孤独，那么我愿意去爱全世界。 一部很另类的喜剧，又有一些玄幻色彩，生活中每个人都可以成为艾米莉，化作天使帮助他人，这也是这部影片触动我的地方，细腻又温情。
44,天使爱美丽,4,剧情太妙。如果没有你，那些良辰美景要说给谁听。
45,天使爱美丽,4,对生活永远的热爱，善于发现生活的美，电影给人带来的视觉享受。
46,天使爱美丽,4,你永远也不晓得自己有多喜欢一个人，除非你看见他和别的人在一起。
47,天使爱美丽,4,玩的花
48,天使爱美丽,4,治愈系电影高推荐代表作。强烈推荐。你看了绝对不后悔
49,天使爱美丽,4,乐观，积极向上。喜欢女主这样的人
50,天使爱美丽,5,本片在轻松愉悦的氛围下引人入胜，其发自真实生活但又被赋予了浪漫诗意的情节，使整部影片富有感染力。
51,天使爱美丽,5,啊啊啊啊啊啊啊啊啊啊啊啊啊啊啊啊
52,天使爱美丽,4,艾米丽非常奇怪又善良，演员的眼睛好大
53,天使爱美丽,4,拍的挺有意思的，就是太旧了有点看不下去。女主好看的～
54,天使爱美丽,5,还有比她更浪漫的吗？
55,天使爱美丽,5,悬疑与魔幻结合，充满了诗意的细节，爱美丽真可爱。
56,天使爱美丽,4,天使…是不求回报的付出，愿这个世界多一些天使…
57,天使爱美丽,5,古灵精怪的爱美丽，充满浪漫主义气息，感染力很强。
58,天使爱美丽,4,女主过得很有趣，内心世界丰富很可爱，跟男主的爱情也算是梦幻了。
59,天使爱美丽,5,比想像的更美，浪漫的矍榕c生活，文不在任何地方，就在@一c一滴ι活真真切切的喜gcP选？吹教夂茫L景好，e人好，那就整人也好。
60,天使爱美丽,4,电影画面优美，配乐令人陶醉，视觉与听觉的享受，让人喜爱难忘的还有里边的人物。
61,天使爱美丽,5,这手法，这叙述，这剪辑，这表现力，这原声……太牛逼了！
62,天使爱美丽,5,内向人的爱情，充满幻想和浪漫，但只有走出自己的社交恐惧才能建立真情
63,天使爱美丽,5,超有意思的电影，可以看很多遍，古灵精怪的艾米丽，超级讨人喜欢
64,天使爱美丽,4,倘若人生遇到一个这么可爱的女孩，即使是再平庸，这辈子也算是没白活。
65,天使爱美丽,4,多么可爱的电影哇，一点点小幻想，一点点生活情趣，喜欢电影里那种饱和的色彩，女主角时而海瑟薇时而赫本时而刘若英，配乐很好听，只不过我一听就会穿越到第十放映室= =
66,天使爱美丽,4,朋友推荐我看的，电影名字很独特，是一部好作品。
67,天使爱美丽,4,唯美意境，故事情节细腻，很喜欢
68,天使爱美丽,4,作为一部带有悬疑与愿幻色彩的喜剧，本片在轻松愉悦的氛围下引人入胜，其发自真实生活但又浪漫的细节使整部影片更生动。
69,天使爱美丽,5,我觉得我看到的比片子要表达的少多了。丰富而美好的片子让我觉得自己很贫瘠。
70,天使爱美丽,4,爱美丽纯洁，明媚的笑容使人倍觉温暖，剧情也暖暖的，看了感觉心情也变好了。
71,天使爱美丽,4,因为电影高于现实么？电影中就叫高大上圣洁天使，生活中就叫傻白甜短路傻子……（笑哭）
72,天使爱美丽,4,文艺治愈系的，发现自己的美
73,天使爱美丽,4,你永远也不晓得自己有多喜欢一个人，除非你看见他和别的人在一起。
74,天使爱美丽,5,"终于抽时间看了这部电影，平淡而又细腻的艾米丽其实就是我们自己，配乐的钢琴bgm为故事增色不少！我们常常因为自己生活平庸烦恼而又敏感，我想这也是感同身受的原因。
《天使爱美丽》是很难在浪漫横溢的诸多法国电影中脱颖而出，成为矫矫不群的另类经典的。其实这部电影的着力点并不在爱情，片中探讨的是一个比爱情更为重大的主题，那就是孤独，毕竟孤独常有，爱情不常有；孤独是永在的，爱情是偶然的；孤独是宿命的，爱情是奇迹的。"
75,天使爱美丽,5,希望有朝一日成为男版爱美丽
76,天使爱美丽,5,画面的色彩丰富，充满法式情调，艾米丽的心灵是真正活在童话里的天使所有的
77,天使爱美丽,5,法语咕噜咕噜的美好，第一眼就被吸引住了。
78,天使爱美丽,4,好的配乐能够帮助观众融入更好进电影，这部片子很成功。配乐浪漫温和，令人陶醉其中。这部带着悬疑的喜剧，确实吸引人，情节很细腻，小细节处理不错。
79,天使爱美丽,5,无论是情节、表演还是色调，整部电影都是浓浓的童话色彩。爱美丽是别人的天使，但是在以为自己输掉了爱情的那一刻，天使也会流泪。她给别人的生活带来了温暖，然而世界再美好，没有你，良辰美景，又与何人说？
80,天使爱美丽,5,看了之后整个人心情变好了
81,天使爱美丽,5,挺喜欢的一部电影，这样的女孩子太美好了，影片的一些小细节也很不错的。
82,天使爱美丽,5,“如果注定孤独，那么我愿意去爱全世界。”
83,天使爱美丽,5,国语配音版本非常出色！
84,天使爱美丽,5,非常温暖的一部法国爱情片！对平凡的人、甚至是边缘人群的描写、对各种细节的精彩刻画，加上少而得当的奇幻与悬疑色彩，勾勒出了一位平凡的天使爱美丽！很励志！音乐和色彩、剪辑都很出色。法国人的浪漫和细腻！！
85,天使爱美丽,5,最喜g最喜g的一部影
86,天使爱美丽,5,她就是天使啊!虽然童年的成长经历不完美，但是她最终成长为一个完美的女孩!
87,天使爱美丽,4,缘分像环法单车赛 你一味等待 缘分就会擦肩而过  要把握良机采取行动.
88,天使爱美丽,5,热闹的人群中寂寞的脸，然后学着享受寂寞，然后豁达乐观
89,天使爱美丽,5,天使爱美丽，让我忘掉了烦忧。
90,天使爱美丽,4,"那些非同寻常、甚至带有卡通色彩的人物形象和超常规的摄影角度 一直是导演的风格

"
91,天使爱美丽,4,喜欢女主人公的性格  积极向上  充满正能量  生活就是要阳光一些
92,天使爱美丽,4,断断续续的看完。平凡。美好。
93,天使爱美丽,5,看完之后绝对会让人幸福感爆棚，太可爱了！这才是正点的治愈系。喜欢Yann Tiersen的音乐也是从这部电影开始的，总之各种赞
94,天使爱美丽,5,好看的喜剧比好看的悲剧难拍一百倍一百倍
95,天使爱美丽,5,再看一遍发现这是个Database电影！
96,天使爱美丽,5,"好早之前因为这个海报误以为是恐怖片(?)没点开，怎么会有这么可爱的片子！开头和结尾的鸡零狗碎也太萌了。缘分像环法单车赛，一味等待，缘分就擦身而过。7815
每一次与照片有关的相遇，我们都互相致意；不曾相认，但彼此都能听懂对方的言语。有喜欢助人也喜欢恶作剧的天使，也有在路边就能捡到但需要壮着胆子进鬼屋才能捕获的恋人。不忘日行一善，也别忘了勇敢追爱。想要活成Amelie这样的女孩子 76(7961516179)75 "
97,天使爱美丽,5,不好用言语形容的一部影片，只能说太美了。
98,天使爱美丽,4,天使在她的心里入住，从此人生变美丽了
99,天使爱美丽,4,这是一部关于在看穿人生之注定寂寞后如何耐心的劝服自己学会自娱自乐的电影。你不必是正义的，你不必是美丽的，你甚至不必是年轻且面容姣好的，你不需要任何所谓意义，你需要的只是活着，并且看到每一个人都有怪癖，每一个人都偏执，每一个人都害怕不被爱。这就是美，以及意义。
100,天使爱美丽,5,艾米丽是巴黎一餐厅的年轻女招待。艾米丽的童年并不是一个愉快的回忆，小时候因为心脏病没有上过小学，没有朋友玩耍；甚至亲眼看见自己母亲死在身边。但她总是微笑着面对生活，帮助一些弱势人们。
101,天使爱美丽,4,现代童话故事，充斥着法式浪漫风情，还行，但不算经典影片吧。
102,天使爱美丽,5,相当喜欢的电影，可以说是最喜欢，我喜欢那种慵懒的氛围，喜欢那种鲜艳的色调~喜欢手风琴的声音~~~
103,天使爱美丽,5,据说是最双鱼的片
104,天使爱美丽,5,良辰美景，世间的一切，与不凡的想象，都令你微笑且孤独着。而待你遇见爱的瞬间，请不要试探，好好把握住美妙的那一刻。拥有爱与发现美的眼睛，能让你领悟生命与生活中真正简单又纯粹的本质。
105,天使爱美丽,4,镜头和剪辑真的已经算得上无人能及，但是这么多年以后看我依然无法接受这个无理取闹的故事
106,天使爱美丽,4,你永远也不晓得自己多喜欢一个人，除非你看见他和别的人在一起。
107,天使爱美丽,5,看了《天使爱美丽》都会感到每个毛孔都在洋溢着幸福，不管现实的生活有多少压力有多么艰辛，艾米丽总在提醒每一个女生要保护好心中那个纯真调皮的异想少女。
108,天使爱美丽,4,"一部富有浪漫色彩、清新可爱的佳作。一个现代灰姑娘的童话。爱美丽徜徉在

极大的自我满足中的幸福感觉溢于言表，在她那不寻常的大眼睛中闪烁着天使的

光芒，让你希望分享她的快乐与神奇。导演以敏锐的洞察力捕捉到了一些富有意

味、优美的时刻，并发掘出童话般的神奇和理想化的人性。那些发自真实生活但

又被赋予了浪漫诗意的细节使整部影片细致动人，具有强烈的感染力。"
109,天使爱美丽,5,重看更惊喜。充满正能量，心情大好，每一个怪人都十分讨人喜欢。论古灵精怪，艾米丽认第一，没人敢认第二；论奇思妙想，让-皮埃尔・热内认第一，韦斯・安德森敢认第二。
110,天使爱美丽,5,重看了一遍，我也不知道为什么十年前的标记只给了三星，当时是在学校的南湖会堂看的，可能是翻译不行吧，要不然就是我太困了。
111,天使爱美丽,4,女主的颜真的吃不下，但不妨碍电影的好看程度
112,天使爱美丽,5,吃草莓要套在手指上、吃布丁要敲碎上面的脆皮……这个艾美丽到底在想些什么？
113,天使爱美丽,4,电影里法国人的爱情总是荒诞又浪漫，不知道现实是否也这样，总之我做不到有情饮水饱。
114,天使爱美丽,4,“如果注定孤独，那么我愿意去爱全世界”浪漫唯美的法国文艺片
115,天使爱美丽,4,女主角太可爱了。影片一开始的快节奏剪辑非常有趣。
116,天使爱美丽,4,这类电影并不对我胃口
117,天使爱美丽,5,天真的小孩得到爱的时候，全世界都欢喜。―― via wyx
118,天使爱美丽,5,Amelie大概是很多人童年幻想的集合吧 
119,天使爱美丽,5,一部富有浪漫色彩清新可爱的佳作。一个现代灰姑娘的童话。爱美丽徜徉在 极大的自我满足中的幸福感觉溢于言表，在她那不寻常的大眼睛中闪烁着天使的 光芒，让你希望分享她的快乐与神奇。导演以敏锐的洞察力捕捉到了一些富有意 味、优美的时刻，并发掘出童话般的神奇和理想化的人性。那些发自真实生活
120,天使爱美丽,4,法国真是一个浪漫的国家，电影的配乐很棒，画面很美。如果说爱自己是终身浪漫，那么我愿意终身爱自己。如果说注定孤独，那么我愿意去爱全世界，
121,天使爱美丽,5,挺美好的。拍摄居然是Lomo风，有种童话与梦幻的感觉。也许爱美丽和连诺都不是神经质，只是一颗美好和未泯的童心。
122,天使爱美丽,5,"i am the person who choose to stay in dream..

From David, alone at Bingka home"
123,天使爱美丽,5,永远的最爱
124,天使爱美丽,4,一个女孩子，得到了一个盒子，有了乐于助人的想法，认识了一个男孩，暗恋的故事，设计让男孩爱上自己~！小清新的代表作，精彩的是爱美丽的那些内心独白
125,天使爱美丽,5,精致的孤独者的探秘游戏。
126,天使爱美丽,4,"人生有时候就是三个字, ""请给予"". 莽撞可以过一辈子, 乐观可以, 猜谜可以, 一个人可以, 没有了意义就绝对不可能. 可怜这歪曲的文青之恋啊!"
127,天使爱美丽,5,经典经典，看你千遍也不厌倦
128,天使爱美丽,5,在神秘浪漫的气息里，感悟暗恋突如其来的美好！我付出最美的年华，用尽所有的运气，只为遇到你，此生无憾！！！
129,天使爱美丽,5,Un film fran04ais très charmant
130,天使爱美丽,5,以前一直不喜欢法国电影 但是 这部我很喜欢 尽管我看的时候 已经是2012年 这个已经是11年前的电影了  这部之后的那些自称小清新小文艺的片子跟这部比真的差很多 我觉得 /  我好喜欢 男主角的鼻子 
131,天使爱美丽,4,全心全意关怀他人，总比自怨自艾来的好。很有感触的一部电影。
132,天使爱美丽,5,happy engineering课重看。意为告诉我们happy brings lucky. 因为来了一个电影学院的prof让我们还观察用色和镜头的使用。才发现这部电影的精妙之处。绝大多数是黄色基调，大量的使用对比强烈的绿色和红色。配乐也刚刚好。这种爱情也刚刚好。做一个有趣的人吧
133,天使爱美丽,4,法语电影的节奏太快、法语也是世界上语速最快的语言，加上片中还会有大量的旁白，对于看字母的人来说是一种锻炼，此片便是此种的代表。对于此片你不能以正常的思维来理解，因为这是天使的生活。
134,天使爱美丽,5,这部电影是深刻的，描述了Amélie的内心斗争，但并不沉重。Amelie是一个非常天真而富有想象力的年轻女孩。
135,天使爱美丽,4,把故事讲得古怪和讲得有趣真的是要一个奇妙的搭配和精到的表达才可以。不意外的觉得有点“搞”，也不意外的觉得真的很好看。因为要去巴黎了才决心昨晚从头到尾看了一遍，然后发现法国人自己不惜的歌颂巴黎，人家歌颂生活
136,天使爱美丽,4,这部精灵古怪、充满了奇异想象力的电影。在这柔和的色调中，每一秒、每一帧，都如同凝固的艺术品，令人陶醉。
137,天使爱美丽,4,叉叉。我记得当初为了你买的盗版= =！我记得你很喜欢看，但我始终不知道哪里好看。。。。。。。。。
138,天使爱美丽,5,2016重看，每次都有新发现，很容易跟着就看进去。节奏明快，故事丰富而紧凑。人物都很有特点，并不是纯粹的好人或坏人，很多人个性有缺陷，但不妨碍成为一个完整的人物。色彩真美，现在看依然非常鲜明。恐怕很多人都希望“拍一部我自己的天使爱美丽”。080821加：我的青春片~后来再看依旧觉得很有意思
139,天使爱美丽,5,有一部电影，让你开心得笑，笑到满腮都是欢喜的泪水。最近看完了导演剪辑版，明白了让皮埃尔热内在很多镜头和剧情里安排的那些精彩的小心思，如果大鱼老爸爱德华是为黑夜破晓的太阳，那么爱美丽就是点着萤火虫灯在无垠的黑夜里，在我们失落放弃恐惧的时候，用星星点点的光明抚慰我们的心
140,天使爱美丽,5,每人需要一艾米莉@拥娜耍 ！太棒了，直^感受就是很可酆苁娣。浪漫直就是法а莸哪檬趾貌耍人是真的很圻@N型！艾米莉直也太美太可劾玻 ！@部影^κ俏业挠笆纷壑一了。各N巧妙的面造cO定。切R，拉伸，渡，微^哟萎面的展露和各N巧妙的音穿插於面之g。O富特色的R^|感c氛感O的OST也很吸引人！性主址种С龅母鞣N次生故事都O的很明很完美。v的故事很危但是看起碛^感真的是很害，似<3 idiots>的奏c流幼呦颍整w碚f水平可能高c。艾米莉椭了所有身的人~出Dy的一步，樗砹诵律。自己s是懦弱得不敢追求矍椋不敢~出步伐。好，完美的Y局，人人都各成其好，包括艾米莉。看得我缀跞程都在微笑，真的好y得。
141,天使爱美丽,5,全心全意Pe人 比自怨自艾的好
142,天使爱美丽,4,"又名: 天使爱美丽 / 艾梅丽

导演: 让-皮埃尔・儒内（Jean-Pierre Jeunet）
主演: 奥黛丽・塔图（Audrey Tautou） / 马修・卡索维茨（Mathieu Kassovitz）

上映年度: 2001
官方网站: http://www.amelie-lefilm.com/
语言: 法语
imdb链接: tt0211915
制片国家/地区: 法国 /　德国
"
143,天使爱美丽,5,有谁不曾为那暗恋而痛苦？我们总以为那份痴情很重，很重，是世上最重的重量。有一天，暮然回首，我们才发现，它一直都是很轻，很轻的。我们以为爱的很深，很深，来日岁月，会让你知道，它不过很浅，很浅。最深和最重的爱，必须和时日一起成长。 
144,天使爱美丽,4,【中国电影资料馆展映】精致的画面、流畅的摄影、明快的剪辑，在资料馆的大银幕上效果非常棒。之前总看网上各种影评说艾米莉如何天使，如何乐于助人。或许是我想得太好，实际电影表现得差强人意。影片截止艾米莉首次助人节奏很流畅，随后开始拖沓、矫情、略做作。收尾也仓促。比较失望。三星半
145,天使爱美丽,5,刚刚经历一模的失意，心情有些郁闷…朋友说你应该看一部励志一点的电影――《天使爱美丽》是一个童话~阳光明媚，色彩鲜艳，简单快乐。我想，我现在可以带着笑容去睡觉了~晚安。
146,天使爱美丽,5,"Sans toi, les emotions d`aujourd`hui ne seraient que la peau morte des emotions d`autrefois."
147,天使爱美丽,5,繁乱错综看似毫无意义的数字，地铁站人们快速成像后又快速丢弃的照片，什么能开启心灵之门，什么便能让on aime les uns les autres. 世界如此美好一分一秒都值得珍惜。
148,天使爱美丽,4,爱美丽是一个有心的策划者 1如果没有你，我的良辰美景将向何人诉说！ 2 你永远也不晓得自己有多喜欢一个人，除非你看见他和别的人在一起。 
149,天使爱美丽,5,"又看了一次[天使爱美丽]. 依然好喜欢里面节奏很快却又非常细腻的旁白.好喜欢细节里都是浪漫的画面. 我想每个人都有自娱自乐的小情绪, 不管是喜欢在咖啡桌下捏泡泡约瑟, 还是紧张的时候喜欢把手指插在绿豆罐子里的爱美丽. "
150,天使爱美丽,4,带有几米的调调，小细节的法国片，给人平淡温暖至极的幸福感。经历了晦涩孤寂的童年，仍长成了用孩子般的小诡计默默帮助他人的天使。而面对爱情，Emilie却也如凡人般胆小，庆幸老人的一席话“你不是脆弱的玻璃人，幸福全靠自己去争取”，是天使就该被爱找到。
151,天使爱美丽,5,这是一部有着几米的风景的电影，比如那空旷的地下铁，繁华的游乐园；这是一部有着希区柯克的桥段的电影，比如玻璃人后窗的摄像机与望远镜，这是一部有着王家卫的风情，你可以看着快餐店帮工王菲潜入梁朝伟的房间，不动声色地改变着他的生活，同样，咖啡馆女佣艾米丽配了一把蔬菜店老板的钥匙，神出鬼没地戏弄着他的每一根神经。 
